name,postcode,lat,lon
Damascus Drum Cafe,TD9 0AD,55.42104300000000,-2.78873400000000
Heart of Hawick Cafe,TD9 0AE,55.42086400000000,-2.78855700000000
Hawick Coffee Shop,TD9 8AA,55.42959700000000,-2.77896500000000
Teviotdale Leisure Centre Cafe,TD9 8AG,55.42887100000000,-2.78143200000000
Burnfoot Community Hub,TD9 8EJ,55.43636500000000,-2.76722900000000
Horse and Hound Country Inn,TD9 8JN,55.40066909790040,-2.65553092956543
Mansfield House Hotel Limited,TD9 8LB,55.43123245239260,-2.76055908203125
Costa Coffee,TD9 9EE,55.42302140000000,-2.78585340000000
Adam's Kitchen Kamila Raczynska,TD9 9EH,55.42197700000000,-2.78733000000000
Santa Marina Bar and Restaurant,TD9 9RE,55.42531204223630,-2.78600692749023
