name,id,postcode,lat,lon
bearded dragon and wall lizard,190132,TN22 2HW,50.998918870963700,0.087308336760287
Grosbeak and swift,1545982,BN26 5XN,50.807470000000000,0.147420000000000
Armadillo and Diving bird,183719,TN33 0JG,50.924795550370200,0.480268461574409
tokay and diamond snake,1545562,BN27 1PG,50.878403120000000,0.269068304000000
Fox and Magpie,1755096,BN27 1EL,50.875459919441000,0.266451862697352
Diving bird and cobra,179303,TN40 2DA,50.852272853371000,0.474187000000000
copperhead and moloch,192721,TN19 7PA,51.010572443023300,0.442243769810915
Quetzal and gecko,1544939,BN27 4AH,50.888848540000000,0.192665238000000
Mole and Old World vulture,1545013,BN27 4JJ,50.916730170000000,0.304196597000000
Scimitar babbler and Kangaroo,189826,TN22 5JQ,50.962750000000000,0.106265000000000
diamond python and leathery turtle,1545412,BN27 2PG,50.862969030000000,0.265860266000000
Gila monster and Vulture,1545149,BN27 3HS,50.855424220000000,0.256059809000000
water snake and Fish eagle,180614,TN39 4DY,50.849584270078000,0.460420278075237
Songlark and blind snake,1548899,BN22 0UF,50.807924480000000,0.269653998000000
gecko and carpet snake,190888,TN21 9DR,50.960487755939200,0.310889737172127
frilled lizard and Chicken,183802,TN33 0JW,50.924141817974900,0.481827479411468
Rabbit and Mamo,1547554,BN23 7PJ,50.800581280000000,0.310626104000000
blue tongue and Vulture,190135,TN22 2NA,50.997646092694100,0.078999309546499
Tree warbler and Condor,192601,TN19 7LA,50.984926815642800,0.353524032583569
Dolphin and Kestrel,180048,TN39 5DS,50.858298910454400,0.460879050315884
Piping shrike and brown snake,1545910,BN27 1BN,50.863537240000000,0.262533932000000
Towhee and black snake,1547586,BN23 7QZ,50.800556680000000,0.315947018000000
frill-necked lizard and Herring gull,1547135,BN24 6BA,50.809311960000000,0.344233000000000
saltwater crocodile and sand viper,1539373,BN8 6DP,50.926250150000000,0.165863315000000
Perching duck and diamondback,191620,TN2 9NR,50.967863000000000,0.086443000000000
leathery turtle and Bunting,190607,TN22 1AU,50.972223796836700,0.096979517458983
Fox and Thicketbird,179133,TN40 1NF,50.840942683522900,0.482409371218324
chameleon and snapping turtle,1538955,BN8 6NY,50.846224460000000,0.087389275000000
Nukupuʻu and Hawaiian honeycreeper,180781,TN39 3LP,50.840796665970000,0.468523434843431
Rat and Francolin,190603,TN22 1AP,50.971438840174000,0.096118008142431
American sparrow and Schneider python,180741,TN39 3HD,50.843806781253500,0.457587626488857
Grouse and Prion,1547125,BN24 6AN,50.812621860000000,0.353922027000000
turtle and blue tongue,191152,TN21 0JX,50.905049885270800,0.220067836361739
diamond python and Bronzewing pigeon,180228,TN39 4JQ,50.847394967320800,0.451198462309819
smooth snake and goanna,191031,TN21 0DD,50.945361183712100,0.250061919547847
Perching duck and sand viper,1547545,BN23 7NY,50.803146010000000,0.309191404000000
Viscacha and Grackle,192575,TN19 7HN,50.995338000000000,0.378179000000000
Thicketbird and goanna,190760,TN21 8TD,50.977866012866100,0.285183097576794
loggerhead and blue racer,1545978,BN26 5XE,50.810892400000000,0.149549729000000
Fish eagle and cycling lizard,180738,TN39 3GJ,50.840191637466000,0.453718627338836
death adder and gavial,1546101,BN26 6HA,50.823492010000000,0.251140629000000
habu and massasauga,190162,TN22 3BF,50.976147030081100,0.108851771928849
Mockingbird and death adder,179424,TN40 1BW,50.838161678764400,0.474875618696189
Chipmunk and Magpie,190515,TN22 2EG,50.994438480177900,0.091924129065364
diamondback turtle and amethystine python,1548786,BN22 0LU,50.805385260000000,0.254968185000000
diamond python and monitor,191292,TN21 0TE,50.965563995697200,0.207028921506174
leguaan and giant tortoise,1546290,BN26 5LH,50.812880540000000,0.243134872000000
sidewinder and Recurvebill,190158,TN22 3BA,51.003464000000000,0.089223000000000
dugite and Asiatic leopard,1550075,BN20 9NN,50.806626980000000,0.249350358000000
lizard and frilled lizard,1546300,BN26 5LY,50.815711340000000,0.241382345000000
Badger and Viscacha,191204,TN21 0QN,50.964345827230200,0.207241780420934
Hawaiian honeycreeper and Old World quail,1545480,BN27 2RD,50.864732120000000,0.272781609000000
kabaragoya and Tit-tyrant,1547215,BN24 6NX,50.818993550000000,0.369718331000000
lizard and Tahr,1545017,BN27 4JQ,50.907779270000000,0.301563865000000
Booted eagles and cycling lizard,180418,TN39 4TN,50.837303051822600,0.424108485444176
blindworm and New World blackbird,180253,TN39 4LW,50.852098117832400,0.450379456282045
swift and Moluccan boobook,191522,TN21 0BQ,50.968218432329600,0.250311839141687
Pheasant and Scimitar babbler,191297,TN21 0TN,50.971655888566000,0.195409528200525
Marsh harrier and Parakeet,1544680,BN27 4TJ,50.886305290000000,0.339833343000000
Grackle and milk snake,1544625,BN27 4PR,50.896623170000000,0.302663396000000
Snipe and king cobra,190709,TN22 1JE,50.980190227622200,0.101583959096533
bearded dragon and blue tongue,190285,TN22 3PU,50.974992019808000,0.088044355873726
Ibex and amethystine python,1545397,BN27 2NP,50.861450610000000,0.268557741000000
Jay and Cuscus,191514,TN21 0BE,50.944802596261400,0.236539096902443
copperhead and Petrel,190419,TN22 1UN,50.977761463989100,0.104223000000000
ringhals and swift,191166,TN21 0LX,50.967020385416200,0.234017000636682
Kākāriki and Viscacha,1547443,BN24 5FB,50.817350800000000,0.294899657000000
Philippine hawk-owl and Old World vulture,190398,TN22 1TH,50.976501758012900,0.101146750647312
snapping turtle and chameleon,1548891,BN22 0TW,50.802526760000000,0.265201000000000
Rat and cayman,191317,TN21 0UT,50.970590787029600,0.238717931114637
copperhead and massasauga,179175,TN40 1QS,50.843301061579500,0.473428743894554
Piping shrike and milk snake,190999,TN21 8EF,50.965184893261700,0.256973083133244
Hawk and River dolphin,179312,TN40 2DN,50.853936648738500,0.479149340421577
Pratincole and Thicketbird,191092,TN21 8LE,50.969948008862900,0.252033484909598
Tahr and chameleon,190402,TN22 1TP,50.977111305685600,0.101758342467905
pit viper and Darwin's finches,179417,TN40 1BL,50.838310644848500,0.476332324324607
constrictor and bandy-bandy,1544646,BN27 4RD,50.908141670000000,0.346148955000000
Ice seal and River dolphin,190946,TN21 8AF,50.964599737698800,0.255605951196849
Duck and sidewinder,1548281,BN22 9QY,50.801390060000000,0.273595067000000
cayman and horned viper,1547667,BN23 8BF,50.810160560000000,0.299671671000000
Skunk and puff adder,1544745,BN27 4UY,50.894261720000000,0.357866089000000
bull snake and Komodo dragon,1545077,BN27 3EW,50.865046500000000,0.245396500000000
milk snake and Pitohui,179272,TN40 2AL,50.849072727536000,0.470580056439824
racer and Elephant,1538930,BN8 6LF,50.849188920000000,0.082549277000000
Francolin and Polecat,1547155,BN24 6EJ,50.812360000000000,0.351794000000000
Kestrel and asp,1547398,BN24 5DP,50.817465640000000,0.307768173000000
Asiatic leopard and jew lizard,191251,TN20 6DY,51.015827234966000,0.252373802466385
king cobra and Logrunners,1755108,BN27 1FP,50.865845000000000,0.260926000000000
Grouse and Quetzal,183149,TN33 9EF,50.883153309604100,0.427213133757030
tuatara and Piping shrike,191075,TN21 8HU,50.970835487683600,0.249384281956519
diamond python and Badger,191176,TN21 0NL,50.950537000000000,0.220313000000000
Schneider python and cobra de capello,1545656,BN26 6NA,50.822710750000000,0.260843527000000
dukite and krait,1546083,BN26 6EA,50.822194710000000,0.249388572000000
rat snake and Guillemot,1762999,TN21 8FJ,50.965250342051500,0.258286505763554
Tit-tyrant and bull snake,192566,TN19 7EZ,50.998361906446800,0.389921427301817
Macaw and black snake,1547271,BN24 6SH,50.820596070000000,0.365653503000000
caiman and Old World quail,183825,TN32 5EX,50.986704019216200,0.448186440053606
Hawk and Tit-tyrant,179469,TN40 1EL,50.840818000000000,0.481593000000000
Kestrel and mountain devil,1538933,BN8 6LJ,50.847424140000000,0.122091675000000
terrapin and Fulmarine petrel,191401,TN20 6RN,51.011572965985100,0.282961981521612
Treepie and Triller,1547181,BN24 6JB,50.809858760000000,0.347324268000000
blind snake and Maya,1550080,BN20 9NU,50.813618480000000,0.247783985000000
diamondback terrapin and Partridge,1546015,BN26 6BG,50.822024090000000,0.243771876000000
Cloud rat and Black cockatoo,191238,TN20 6BY,51.019750829556200,0.259237239424857
Partridge and Chicken,180041,TN39 5DH,50.860425131893100,0.458575175513940
asp and Ground sloth,190490,TN22 2BG,50.971136895227300,0.087871443644985
Cloud rat and frilled lizard,180641,TN39 3BE,50.835204851539000,0.429851416403167
Pitohui and Parrotbill,1547918,BN23 7JT,50.801061140000000,0.307740320000000
snapping turtle and Jay,1545322,BN27 3SJ,50.881776000000000,0.173226000000000
Mamo and monitor,1539038,BN8 6QS,50.928245000000000,0.187260000000000
Philippine hawk-owl and Duck,191379,TN20 6PH,51.021593000000000,0.262179000000000
Hawk and New World blackbird,190538,TN21 9NB,50.945588000000000,0.344176000000000
hognose snake and agamid,1547177,BN24 6HT,50.810652670000000,0.349436612000000
Mole and king cobra,183783,TN32 5EA,50.986070845204000,0.462046097416360
wall lizard and Quetzal,1547460,BN24 5HR,50.819641940000000,0.318211720000000
diamondback terrapin and brown snake,1763047,TN22 9EE,50.967907423168400,0.086473190623301
Pitohui and black snake,1545669,BN27 1TN,50.870344000000000,0.259367052000000
krait and swift,190026,TN22 2HJ,50.996976229710600,0.085297162847040
indigo snake and whip snake,180709,TN39 4HQ,50.848881609292000,0.456632564820247
Dolphin and Stint,177667,TN6 3RW,51.020807206836500,0.215825926775568
frilled lizard and garter snake,191363,TN20 6ND,51.020586501415900,0.240598101317005
caiman and Warbler,1763041,TN22 5GW,50.959450972450600,0.111627237359400
Ground sloth and Grosbeak,180720,TN39 4JE,50.846351981082000,0.446469832881431
carpet snake and Vole,1539300,BN8 6AL,50.877135700000000,0.129695904000000
moloch and bushmaster,189538,TN22 5TB,50.959187548933300,0.099738973944591
thorn lizard and Tattler,1548157,BN22 9DL,50.800006450000000,0.283646871000000
Grackle and python,1547446,BN24 5FF,50.817175540000000,0.296949679000000
Snipe and moloch,1546198,BN26 5DN,50.816602520000000,0.242745344000000
Parrotlet and garter snake,183227,TN33 9HU,50.869872000000000,0.414114000000000
boa constrictor and snapping turtle,183838,TN32 5HP,50.972645551172300,0.371535316330384
Chicken and Parakeet,190583,TN21 9QY,50.948530139191100,0.319750189271164
amethystine python and Philippine hawk-owl,183796,TN32 5EU,50.982325000000000,0.444750000000000
puff adder and Ibex,190421,TN22 1UQ,50.975597820460900,0.109881040853798
diamondback turtle and Old World warbler,191005,TN21 8EP,50.963261945193900,0.257477000000000
viper and Towhee,190096,TN22 4PY,50.982313000000000,0.165622000000000
moloch and Lemming,190032,TN22 4HE,50.988155466549500,0.136939658204290
copperhead and leguaan,191011,TN21 8EW,50.963695990829600,0.257424000000000
Snipe and Vole,1545900,BN27 1AU,50.865196220000000,0.257213747000000
Meadowlark and Old World quail,1762453,TN19 7BY,51.007789719297700,0.428212345069528
Jerboa and Lemming,189784,TN22 5GB,50.959004000000000,0.109015000000000
habu and death adder,1755111,BN27 3FW,50.877001981017400,0.241564347073276
Booted eagles and cerastes,190746,TN21 8SG,50.977609593399400,0.283119046634454
iguana and fer-de-lance,1544933,BN27 3YT,50.862674250000000,0.257404574000000
Petrel and Parrotbill,2661825,TN22 9GJ,50.967859000000000,0.086469000000000
Parrotbill and massasauga,1546202,BN26 5DS,50.815953860000000,0.244204938000000
Flameback and gaboon viper,180674,TN39 3EA,50.834736635748800,0.441075845075610
adder and Partridge,180429,TN39 3RT,50.842049163959100,0.446642457949770
Guillemot and flying lizard,180430,TN39 3RU,50.846537561489000,0.445769214577681
Quetzal and Duck,183261,TN33 9LR,50.911863000000000,0.432434000000000
bull snake and carpet snake,1547481,BN24 5LB,50.819699700000000,0.338745148000000
giant tortoise and Egret,179257,TN40 1WF,50.840420174591100,0.474243000000000
rattlesnake and Old World vulture,190894,TN21 9EB,50.929869509551700,0.258208885603612
Kākāriki and rattlesnake,190046,TN22 4JD,50.998401673010900,0.177701867089045
Gull and Bunting,1545153,BN27 3HX,50.858248330000000,0.256522947000000
Snipe and thorn lizard,190782,TN21 8UL,50.979364591237100,0.305487157920617
agamid and Partridge,189796,TN22 5HJ,50.959590000000000,0.180186000000000
Dorcopsis and horned viper,183307,TN33 9QJ,50.943387714928400,0.429891000000000
swift and Gull,190755,TN21 8SU,50.977141531900900,0.283138823235092
milk snake and Elephant,180464,TN39 3TN,50.843969238829500,0.439995172903732
Kestrel and anole,2649787,BN24 9HR,50.812555000000000,0.322560000000000
python and fer-de-lance,2649797,BN27 2FP,50.856989000000000,0.270757000000000
Ice seal and Kite,1548755,BN22 0HR,50.801457760000000,0.256680874000000
Tahr and lizard,1545691,BN27 1UQ,50.867860340000000,0.253391325000000
agama and diamondback,1762756,TN21 1BY,50.971303108461600,0.251301311163602
Myna and coral snake,190058,TN22 4JX,50.989965813777500,0.137778049552817
Guillemot and diamondback,191213,TN21 0QZ,50.972691151747400,0.224346392340228
Old World vulture and Ibex,1539306,BN8 6AU,50.869356000000000,0.149324627000000
agamid and Solitaire,189805,TN22 5HX,50.961311620996300,0.158835016206171
Peafowl and leathery turtle,190035,TN22 4HJ,50.995669971065200,0.182875552523110
Stint and terrapin,1545817,BN26 6UA,50.842309590000000,0.144558658000000
coral snake and Stint,180529,TN39 3UL,50.839811949031100,0.437079401279780
Herring gull and dugite,192564,TN19 7EX,50.997072475175600,0.382600673152955
Viscacha and sea snake,1545401,BN27 2NT,50.861448730000000,0.266340773000000
Wallaby and Dorcopsis,1545095,BN27 4NB,50.894263180000000,0.330324000000000
Egret and boa constrictor,1545993,BN26 6AE,50.822926450000000,0.244084920000000
Boto and giant tortoise,1545246,BN27 2DH,50.857803670000000,0.263691549000000
bearded lizard and amphisbaena,190451,TN22 1XB,50.977354187214400,0.111228536576423
Polecat and Nukupuʻu,1546181,BN26 5BL,50.820116130000000,0.253633307000000
Greenbul and frilled lizard,1545357,BN27 2JP,50.863855670000000,0.265590605000000
Vole and bushmaster,1544950,BN27 4BB,50.880566340000000,0.222088273000000
smooth snake and snake,189540,TN22 5TE,50.955787160315600,0.099785036366689
Polecat and sand viper,1544854,BN27 3UG,50.863557390000000,0.244728072000000
Eagle and diamondback terrapin,183790,TN32 5EL,50.985213788038300,0.452210000000000
Meadowlark and bull snake,183319,TN33 9RG,50.896502181785600,0.448656877335470
tortoise and frilled lizard,179161,TN40 1PZ,50.841467618252800,0.476755193716377
Jay and horned viper,190617,TN22 1BL,50.970415472653500,0.096629000000000
Mink and Towhee,1545134,BN27 3GU,50.860070000000000,0.249818000000000
blindworm and Schneider python,1550054,BN20 9LA,50.802248000000000,0.251212000000000
diamondback turtle and Ground sloth,1545961,BN26 5UJ,50.813963340000000,0.154205085000000
Old World vulture and Guillemot,1544956,BN27 4BL,50.883941600000000,0.213434031000000
Solitaire and Herring gull,190961,TN21 8AZ,50.959395443312900,0.251252579645086
Prion and sand lizard,2664638,TN19 7FD,50.997290000000000,0.385946000000000
Moluccan boobook and tree snake,190572,TN21 9QH,50.944014299262600,0.314813229060089
Grackle and Mamo,179224,TN40 1TH,50.844155675148700,0.485691050027957
horned toad and whip snake,190917,TN21 9HP,50.927389090118100,0.257647589237821
puff adder and wall lizard,180250,TN39 4LS,50.850982581683400,0.450392021027038
goanna and Fox,191260,TN20 6EN,51.019589000000000,0.250289000000000
Partridge and asp,1545225,BN27 2BD,50.861049920000000,0.258150329000000
kabaragoya and Armadillo,191507,TN21 0AW,50.965234134721300,0.250694571862556
cayman and deaf adder,180475,TN39 3UA,50.842991387856400,0.445029714220650
tokay and Prion,190166,TN22 3BL,51.021010490974000,0.093134302108465
whip snake and Francolin,190958,TN21 8AW,50.960996064730900,0.250636000000000
boomslang and Mole,1545753,BN26 6QG,50.824441910000000,0.246188114000000
Polecat and White ibis,180054,TN39 5DZ,50.855881772848600,0.470982595205663
leathery turtle and cobra,2638669,BN27 9RH,50.864904000000000,0.259615000000000
boomslang and B,191147,TN21 0JR,50.916235415791500,0.226348041519607
Cuscus and boa constrictor,190168,TN22 3BP,51.019782390872400,0.092408825039777
Fish eagle and Schneider python,180416,TN39 4TJ,50.837510076763200,0.432740920758187
blue tongue and whip snake,1539029,BN8 6QD,50.931247020000000,0.175730410000000
monitor and whip snake,183785,TN32 5ED,50.982690064168300,0.467965419314687
bushmaster and Myna,1545260,BN27 2EA,50.857870740000000,0.260696562000000
Rat and deaf adder,1545741,BN26 6PS,50.825519940000000,0.245785468000000
Thrasher and rattlesnake,1547218,BN24 6PB,50.820140660000000,0.375668752000000
leathery turtle and Pitohui,180453,TN39 3SY,50.839217807883000,0.441676000000000
Bunting and Partridge,1545388,BN27 2NB,50.860215490000000,0.269634618000000
Recurvebill and puff adder,1547422,BN24 5EW,50.815922980000000,0.287461433000000
mamba and puff adder,2661808,TN22 5FS,50.956002000000000,0.095706000000000
cayman and slowworm,189908,TN22 5RG,50.946584728785600,0.141979954361179
Stint and krait,191046,TN21 0ED,50.932915280158600,0.244767000000000
Buzzard and hognose snake,1545594,BN27 1RL,50.876700000000000,0.327752000000000
crocodile and diamondback turtle,1547202,BN24 6LY,50.813946330000000,0.356032923000000
gavial and Mink,189800,TN22 5HQ,50.967668545355600,0.094224884267169
anole and Polecat,1545996,BN26 6AH,50.822207330000000,0.244064636000000
boa and puff adder,1548826,BN22 0QG,50.809109540000000,0.257716808000000
rattlesnake and Mockingbird,1539042,BN8 6QX,50.940674000000000,0.175231000000000
Philippine hawk-owl and Coati,1544658,BN27 4SB,50.882153670000000,0.355747637000000
dukite and loggerhead,1545370,BN27 2LE,50.860891580000000,0.265390068000000
Cloud rat and Treepie,1550063,BN20 9LP,50.804512770000000,0.247517209000000
sidewinder and hoop snake,192600,TN19 7JX,51.006344000000000,0.369476000000000
cayman and sand viper,1547364,BN24 5AL,50.825757090000000,0.301446291000000
grass snake and Bronzewing pigeon,1547243,BN23 8JA,50.812689010000000,0.291846123000000
Tahr and Minke whale,1546281,BN26 5JT,50.815116020000000,0.244278343000000
Jay and Polecat,180700,TN39 4HD,50.849706758402700,0.461009235349731
tortoise and Night heron,180797,TN39 3NH,50.842072120520500,0.451118305948083
mud turtle and Old World quail,190361,TN22 1QJ,50.969734723872300,0.095357596812305
gaboon viper and brown snake,1550099,BN20 9QE,50.812359770000000,0.246360754000000
rattlesnake and Condor,191207,TN21 0QS,50.955071177751100,0.202117557482141
death adder and diamond snake,1545101,BN27 4NJ,50.890366380000000,0.321579733000000
elapid and diamond snake,1547128,BN24 6AR,50.813109670000000,0.355153236000000
king snake and gopher snake,189546,TN22 5TN,50.958098386150500,0.106282955906153
worm lizard and sidewinder,1544636,BN27 4QQ,50.898065490000000,0.323370671000000
carpet snake and sand lizard,1545001,BN27 4HT,50.881514410000000,0.277408389000000
Masked owl and snapping turtle,1539455,BN8 5AH,50.905643550000000,0.095024451000000
bearded lizard and Rabbit,191245,TN20 6DG,51.006727552618700,0.217365000000000
thorn lizard and Tattler,191524,TN21 0BU,50.943708000000000,0.249099000000000
Boto and White ibis,189907,TN22 5RE,50.939344623684400,0.143953141308249
blue racer and taipan,190625,TN21 8PE,50.972130593782700,0.259631690738930
garter snake and python,191312,TN21 0UG,50.982055000000000,0.237047000000000
box turtle and tuatara,1546263,BN26 5HP,50.819561440000000,0.233489000000000
bearded lizard and Buzzard,190853,TN21 0ZL,50.971302190912500,0.251301318810732
Songlark and cobra,180670,TN39 3DW,50.837675964782000,0.457435899066469
amethystine python and diamondback,191025,TN21 0BW,50.971302190912500,0.251301318810732
Ibex and cobra de capello,183872,TN32 5LR,50.950837795079600,0.478365825020733
Duck and elapid,180707,TN39 4HN,50.850825049374800,0.454035193109419
snapping turtle and brown snake,191346,TN20 6JT,50.998651766530800,0.236334299294703
worm lizard and cobra de capello,183787,TN32 5EG,50.983277667694900,0.467398156941586
bull snake and skink,179478,TN40 1EY,50.840553855552700,0.474888579766586
Linsang and White ibis,1545235,BN27 2BU,50.860261140000000,0.259405361000000
Ibex and leguaan,1547516,BN24 5PG,50.816697590000000,0.284191344000000
Polecat and Rat,2577342,BN27 3GP,50.874990292400000,0.241880040000000
Mamo and saltwater crocodile,1539027,BN8 6QA,50.926298490000000,0.165196736000000
Darwin's finches and whip snake,1763019,TN22 3FH,51.001863503017200,0.109191013127497
king snake and Capuchin,1545684,BN27 1UF,50.874423160000000,0.263288594000000
Diving bird and puff adder,1550044,BN20 9JA,50.800971760000000,0.252044944000000
deaf adder and Asiatic leopard,2649804,BN27 4FR,50.878997000000000,0.267064000000000
Night heron and Argus,183233,TN33 9JE,50.886577326678400,0.425613796667990
worm lizard and Mink,183295,TN33 9PT,50.940988440880400,0.452858738405716
king cobra and Maya,1547247,BN24 6RA,50.818607320000000,0.366149293000000
gaboon viper and krait,1755078,BN26 6FQ,50.823262987952600,0.262559849991459
Maya and bull snake,1544927,BN27 3XP,50.866120630000000,0.246130298000000
Solitaire and Coati,189801,TN22 5HR,50.972319377095800,0.172436065035407
Hawk and Ice seal,192230,TN19 7PP,51.013286922415700,0.473097203663581
slowworm and pit viper,1544633,BN27 4QL,50.909991320000000,0.343355000000000
American sparrow and tree snake,178935,TN40 2ET,50.849559049300900,0.482412244062364
wall lizard and cobra,191199,TN21 0QE,50.967444792264100,0.222144439708321
blue racer and sea snake,1545473,BN27 2QA,50.856339910000000,0.260653000000000
swift and Grackle,1545346,BN27 2HZ,50.863356290000000,0.264443700000000
River dolphin and coral snake,1546216,BN26 5ET,50.820692670000000,0.240513426000000
Pheasant and agamid,1545709,BN27 2AG,50.861010230000000,0.262056326000000
Treepie and Puffleg,180748,TN39 3HN,50.837104282632900,0.466197979350024
Snipe and blue tongue,190840,TN21 0XS,50.965563275770200,0.246679857639256
Dorcopsis and Stint,183769,TN32 5DH,50.985571000000000,0.471737000000000
Moluccan boobook and sand viper,180437,TN39 3SD,50.839774884376400,0.444009271533821
terrapin and harlequin snake,2659337,TN19 7XN,51.008236000000000,0.435649000000000
Chicken and caiman,180736,TN39 3GD,50.845388702331100,0.469561421462997
Peafowl and White ibis,189534,TN22 5SX,50.957165000000000,0.106739000000000
jew lizard and Thicketbird,1548321,BN23 5BA,50.800904960000000,0.334116407000000
diamondback terrapin and Dolphin,192481,TN19 7AD,51.007707104717300,0.432584604867015
Vulture and ringhals,1764500,TN40 9GR,50.840438000000000,0.474273000000000
iguana and blindworm,190986,TN21 8DJ,50.967705297815500,0.253135667149726
loggerhead and Wallaby,191200,TN21 0QG,50.965779762726500,0.222207398868715
Eagle and boomslang,190861,TN21 9AU,50.947798972733800,0.279707368926014
Boto and Ibex,190776,TN21 8UD,50.979754000000000,0.286658000000000
Shearwater and Puffleg,183142,TN33 9DS,50.897860000000000,0.450463000000000
gecko and harlequin snake,190410,TN22 1UA,50.975500301939300,0.107312473882072
Tit-tyrant and soft-shelled turtle,1755188,BN27 9TQ,50.864958424255300,0.259788755200303
cobra and blue racer,1544726,BN27 4TR,50.885420390000000,0.341353000000000
Scimitar babbler and perentie,192557,TN19 7EP,50.997645000000000,0.385382107414594
Fish eagle and Shearwater,1545585,BN27 1QQ,50.875381040000000,0.318034464000000
Stilt and diamondback terrapin,2608332,BN27 3YN,50.854535000000000,0.245104000000000
copperhead and indigo snake,1548903,BN22 0UL,50.807842930000000,0.266910515000000
sea snake and garter snake,190588,TN21 9RE,50.950861836407900,0.329915000000000
sand lizard and black snake,192239,TN19 7QA,51.006805484712800,0.475917116300594
perentie and Macaw,192560,TN19 7ES,50.997336362385800,0.385094129574318
frill-necked lizard and Solitaire,180750,TN39 3HQ,50.839532687099500,0.466624334692175
gopher snake and deaf adder,1550210,BN20 9SP,50.807125970000000,0.240715868000000
Zebra and tiger snake,190344,TN22 1NX,50.981242736457000,0.106062308641929
sea snake and frill-necked lizard,1550096,BN20 9QA,50.810029700000000,0.247327786000000
fer-de-lance and constrictor,1546102,BN26 6HB,50.821757090000000,0.252491241000000
cayman and Tattler,1545027,BN27 3BF,50.862370350000000,0.255911950000000
hognose snake and bushmaster,192249,TN19 7QP,51.019414000000000,0.470486000000000
Night heron and hoop snake,180751,TN39 3HR,50.837410771479300,0.469566249980015
Chipmunk and Pheasant,1547385,BN24 5BS,50.837295000000000,0.279146000000000
chameleon and Masked owl,191095,TN21 8LJ,50.971775344949600,0.247748859114689
bull snake and Buzzard,1545657,BN26 6ND,50.823857270000000,0.258300445000000
Wader and harlequin snake,192571,TN19 7HG,50.995810410736400,0.378773478571412
Vole and Cuscus,1547878,BN23 7EN,50.800013000000000,0.316730253000000
milk snake and Black jay,1548885,BN22 0TP,50.803183190000000,0.269268081000000
king cobra and Duck,1539299,BN8 6AJ,50.885188000000000,0.139859129000000
cycling lizard and fer-de-lance,179252,TN40 1UG,50.844701191653800,0.486259883172934
Lemming and bushmaster,180237,TN39 4LA,50.845991223837000,0.443084036688091
tokay and diamond python,1762729,TN2 9QZ,50.967907423168400,0.086473190623301
massasauga and Puffleg,178938,TN40 2EX,50.851313070033700,0.478598160805588
Logrunners and gecko,190198,TN22 3EN,51.016079081826000,0.085255851332139
death adder and amphisbaena,1548844,BN22 0RH,50.809072150000000,0.254535367000000
alligator and brown snake,1545206,BN27 3NR,50.856004680000000,0.247420298000000
Stint and bandy-bandy,1755088,BN26 9AY,50.823416938837900,0.244818344646381
Rabbit and anaconda,1545204,BN27 3NP,50.854642750000000,0.246687013000000
Rat and Kangaroo,191218,TN21 0RG,50.960578000000000,0.196810000000000
Pratincole and racer,180348,TN39 4PX,50.847290446913600,0.430834640429953
Warbler and Dolphin,1545844,BN26 5QX,50.806120000000000,0.167399000000000
Parakeet and chameleon,180033,TN39 5BY,50.858102777549900,0.469309545686404
