name,postcode,lat,lon
River dolphin and Kangaroo,BT44 0LZ,55.088292000000000,-6.056572000000000
constrictor and dukite,BT44 0NT,55.118637000000000,-6.060318000000000
galliwasp and diamond python,BT44 0PW,55.126348000000000,-6.044408000000000
Treepie and glass snake,BT44 0QN,55.080024000000000,-6.058116000000000
Booted eagles and Gila monster,BT44 0RZ,55.079480000000000,-6.059131000000000
Prion and Mink,BT53 8RA,55.133157000000000,-6.326373000000000
Chicken and Ibex,BT53 8RF,55.131124000000000,-6.327054000000000
Old World vulture and Old World quail,BT53 8RJ,55.132725000000000,-6.320668000000000
copperhead and water snake,BT53 8SL,55.130625000000000,-6.327771000000000
Armadillo and horned toad,BT53 8SR,55.131503000000000,-6.328304000000000
Snipe and skink,BT53 8SX,55.132034000000000,-6.329164000000000
ringhals and Puffleg,BT53 8TD,55.127502000000000,-6.336063000000000
hawksbill and gecko,BT53 8TN,55.118265000000000,-6.369865000000000
box turtle and Grouse,BT53 8TT,55.136607000000000,-6.374370000000000
B and harlequin snake,BT53 8UD,55.169453000000000,-6.362878000000000
Jerboa and Polecat,BT53 8UR,55.095793000000000,-6.351290000000000
Ibex and whip snake,BT53 8UX,55.088673000000000,-6.347605000000000
alligator and death adder,BT53 8XA,55.094126000000000,-6.356196000000000
Boto and smooth snake,BT53 8YF,55.090851000000000,-6.306322000000000
moloch and Marsh harrier,BT53 8YG,55.086860000000000,-6.289403000000000
tortoise and turtle,BT53 8YP,55.116222000000000,-6.337661000000000
Grouse and rat snake,BT54 6BG,55.202047000000000,-6.247317000000000
Tit-tyrant and New World blackbird,BT54 6DN,55.201722000000000,-6.263134000000000
bicycle lizard and Vulture,BT54 6EY,55.199903000000000,-6.258861000000000
king snake and diamond python,BT54 6FA,55.201577000000000,-6.252788000000000
Tit-tyrant and python,BT54 6FL,55.199969000000000,-6.260963000000000
Hawaiian honeycreeper and flying lizard,BT54 6HN,55.182917000000000,-6.314836000000000
racer and Bronzewing pigeon,BT54 6JX,55.204634000000000,-6.259204000000000
Goose and Herring gull,BT54 6LZ,55.235952000000000,-6.362003000000000
amphisbaena and diamondback,BT54 6PF,55.194763000000000,-6.245189000000000
green turtle and B,BT54 6RN,55.182474000000000,-6.152220000000000
dukite and elapid,BT54 6RR,55.201536000000000,-6.184761000000000
swift and python,BT54 6RU,55.202712000000000,-6.257593000000000
Schneider python and leguaan,BT54 6RW,55.205309000000000,-6.161372000000000
puff adder and Condor,BT54 6RY,55.196687000000000,-6.260982000000000
dugite and leguaan,BT54 6SP,55.204796000000000,-6.265137000000000
