name,id,postcode,lat,lon
flying dragon and Cloud rat,731492,NE61 3EP,55.248789000000000,-1.722247000000000
blue racer and amethystine python,730938,NE61 4NX,55.207096058605200,-1.845603791577460
Night heron and bandy-bandy,728443,NE65 8JA,55.290202420570600,-1.841802000000000
fer-de-lance and python,731141,NE61 3QQ,55.156060961450300,-1.788802862792720
Dolphin and Herring gull,752598,NE19 1AQ,55.242267000000000,-2.112908000000000
Shearwater and anaconda,751743,NE20 0AR,55.120166000000000,-1.766179000000000
Parakeet and Chipmunk,728309,NE65 9QJ,55.274265520673300,-1.719566947249180
Cloud rat and giant tortoise,730927,NE61 4LP,55.198528000000000,-1.828010000000000
Recurvebill and carpet snake,728306,NE65 9QF,55.293876000000000,-1.741113000000000
perentie and Rabbit,752377,NE19 2PR,55.143207295257000,-2.039630179900250
copperhead and Marsh harrier,1795720,NE61 6BU,55.126242000000000,-1.715790000000000
Skunk and Piping shrike,731201,NE61 3TY,55.134178000000000,-1.847030000000000
Petrel and Kite,751737,NE20 0AH,55.089319909376600,-1.763225280993410
caiman and Francolin,731216,NE61 3XG,55.126411372794000,-1.801974897921420
Parrotbill and sidewinder,731466,NE61 3DD,55.200774575007800,-1.717522258166430
goanna and Old World warbler,751756,NE20 0BH,55.086849624947100,-1.737328079477160
caiman and Darwin's finches,728140,NE65 9HS,55.297935304991500,-1.716218853819900
diamond python and water snake,2644232,NE61 3BR,55.184317000000000,-1.713474000000000
hognose snake and indigo snake,731138,NE61 3QL,55.160577643887000,-1.820467224364190
Diving bird and Quetzal,728476,NE65 8RB,55.263528587136400,-1.776794121130270
Recurvebill and Old World vulture,751735,NE20 0AF,55.076496000000000,-1.766779544124250
Polecat and flying lizard,751755,NE20 0BG,55.079946857760700,-1.753851199218930
Marmoset and boomslang,728499,NE65 8TF,55.229649877074000,-1.752346950745610
Rabbit and Darwin's finches,730840,NE61 4LF,55.207975192111100,-1.999986631151820
box turtle and Macaw,752329,NE19 2DG,55.091469263243500,-1.971564365335950
Goose and Schneider python,731179,NE61 3SP,55.165915977616200,-1.840378574489230
amethystine python and Capuchin,730960,NE61 4RA,55.160360990900100,-1.908767679498390
anole and diamond python,752335,NE19 2DQ,55.091118987027100,-1.972347999068010
Hawaiian honeycreeper and Grosbeak,728467,NE65 8QR,55.225325856950800,-1.800447022074640
Old World quail and Pratincole,752703,NE19 2AG,55.129710877894500,-1.961374954174810
Guillemot and Petrel,735134,NE46 4TP,55.078855157594500,-2.048995220845850
diamond python and Puffleg,734297,NE48 4BB,55.084726807437600,-2.120749308562740
Asiatic leopard and terrapin,731207,NE61 3UU,55.126828528827800,-1.793097000000000
green turtle and American sparrow,752384,NE19 2RF,55.146692210277500,-2.064391714365360
cycling lizard and Minke whale,751770,NE20 0DL,55.085842854536300,-1.798540678906470
