name,postcode,lat,lon
Moluccan boobook and wall lizard,BA10 0BU,51.107336000000000,-2.456802102000000
Puffleg and frill-necked lizard,BA10 0DT,51.113044930000000,-2.454772719000000
milk snake and Black jay,BA10 0EG,51.112131010000000,-2.451749000000000
Vulture and amethystine python,BA10 0EN,51.113744000000000,-2.453338027000000
copperhead and New World blackbird,BA10 0HY,51.115458990000000,-2.446696070000000
sand lizard and giant tortoise,BA10 0JD,51.114767930000000,-2.446346536000000
Bronzewing pigeon and Pratincole,BA10 0NB,51.106793300000000,-2.455311247000000
perentie and frill-necked lizard,BA10 0QG,51.145021590000000,-2.423451185000000
B and adder,BA10 0QP,51.117830520000000,-2.456619898000000
whip snake and habu,BA11 1AY,51.232531510000000,-2.318639980000000
horned toad and tuatara,BA11 1BP,51.232695910000000,-2.324255566000000
indigo snake and Stint,BA11 1BX,51.231074660000000,-2.321981275000000
frill-necked lizard and saltwater crocodile,BA11 1DL,51.230518000000000,-2.321676627000000
Capuchin and Egret,BA11 1EJ,51.230071000000000,-2.324380000000000
Stint and massasauga,BA11 1EQ,51.230361510000000,-2.326229885000000
Black cockatoo and Linsang,BA11 1FU,51.229334000000000,-2.319331000000000
Dorcopsis and Komodo dragon,BA11 1HY,51.226814730000000,-2.330844713000000
Bronzewing pigeon and fer-de-lance,BA11 1JJ,51.226739730000000,-2.322280378000000
puff adder and mamba,BA11 1JX,51.225705050000000,-2.322502273000000
Duck and Pratincole,BA11 1LH,51.223329240000000,-2.319936755000000
Bronzewing pigeon and Old World quail,BA11 1RP,51.228725440000000,-2.312899458000000
Myna and Zebra,BA11 1RU,51.231348500000000,-2.313705000000000
Marmoset and anole,BA11 2AZ,51.234173380000000,-2.309957248000000
python and Tattler,BA11 2DP,51.235118440000000,-2.302744648000000
monitor and Crow,BA11 2DT,51.242436070000000,-2.299941931000000
Black jay and cerastes,BA11 2EH,51.235223970000000,-2.310323000000000
anaconda and Hawaiian honeycreeper,BA11 2HF,51.237775710000000,-2.314608176000000
Warbler and blind snake,BA11 2HS,51.241410140000000,-2.313974026000000
cobra de capello and horned toad,BA11 2JN,51.237234280000000,-2.315320679000000
tuatara and Warbler,BA11 2JT,51.239379620000000,-2.316696200000000
king cobra and whip snake,BA11 2LP,51.238547920000000,-2.315014531000000
Lemming and bearded dragon,BA11 2LR,51.237518490000000,-2.323200864000000
Fulmarine petrel and Fulmarine petrel,BA11 2NR,51.248703000000000,-2.317792000000000
dugite and Boto,BA11 2SA,51.240058020000000,-2.311859059000000
Gila monster and Quetzal,BA11 2SH,51.239234640000000,-2.320405277000000
gavial and Solitaire,BA11 3AF,51.235341770000000,-2.326680511000000
king snake and Night heron,BA11 3BA,51.231210960000000,-2.327940228000000
Hawk and Marmoset,BA11 3BQ,51.230790080000000,-2.327321388000000
coral snake and agama,BA11 3DA,51.231795110000000,-2.324836444000000
Egret and terrapin,BA11 3HE,51.231976260000000,-2.333946739000000
diamondback and Marmoset,BA11 3HL,51.232138520000000,-2.330639439000000
kabaragoya and frill-necked lizard,BA11 3HQ,51.232304360000000,-2.335553232000000
Towhee and Jackal,BA11 3JY,51.219098690000000,-2.384110964000000
Kite and whip snake,BA11 3PN,51.241355940000000,-2.391129000000000
boa and Towhee,BA11 4BA,51.226585190000000,-2.329339394000000
Komodo dragon and Mouse,BA11 4DA,51.219276000000000,-2.332480000000000
habu and Old World vulture,BA11 4DH,51.217136120000000,-2.332006610000000
Tattler and Crow,BA11 4DL,51.214998210000000,-2.337531935000000
copperhead and Marmoset,BA11 4DP,51.227993540000000,-2.336839400000000
American sparrow and Vole,BA11 4EB,51.226417880000000,-2.328077983000000
Booted eagles and Pitohui,BA11 4HA,51.222760020000000,-2.333779757000000
Marsh harrier and Pratincole,BA11 4JD,51.228815130000000,-2.332534668000000
Tit-tyrant and amphisbaena,BA11 4LW,51.209578270000000,-2.377961963000000
Stint and slowworm,BA11 4NQ,51.203155630000000,-2.378696600000000
diamondback terrapin and Eagle,BA11 4PU,51.205357070000000,-2.400758409000000
Elephant and hognose snake,BA11 4PZ,51.204722000000000,-2.389402000000000
Prion and Greenbul,BA11 5AU,51.221422550000000,-2.320081036000000
krait and cayman,BA11 5BP,51.197451970000000,-2.332280037000000
B and Tattler,BA11 5BR,51.188771570000000,-2.330214307000000
diamondback terrapin and rock python,BA11 5DQ,51.192387190000000,-2.360377208000000
diamond snake and tuatara,BA11 5EB,51.220260180000000,-2.320960729000000
taipan and rock python,BA11 5ES,51.180872900000000,-2.321874357000000
fer-de-lance and whip snake,BA11 5FL,51.221395000000000,-2.305200000000000
Boto and Kākāriki,BA11 5HS,51.230398340000000,-2.305950388000000
massasauga and Macaw,BA12 0AE,51.230545000000000,-2.190687000000000
Gull and viper,BA12 0BJ,51.212185000000000,-2.183669495000000
Badger and Triller,BA12 2BW,51.204312000000000,-2.178365000000000
loggerhead and snake,BA12 6AN,51.090753000000000,-2.218127000000000
habu and Kite,BA12 6AT,51.111770000000000,-2.244040000000000
thorny devil and Snipe,BA12 6BU,51.082341640000000,-2.258860156000000
Schneider python and Zebra,BA12 6EQ,51.094055320000000,-2.264237661000000
Cuscus and Egret,BA12 6FL,51.083435000000000,-2.262345000000000
swift and deaf adder,BA12 6HE,51.090621300000000,-2.267759174000000
cerastes and harlequin snake,BA12 6HS,51.092874220000000,-2.269542834000000
Snipe and Boto,BA12 6JL,51.089482030000000,-2.274334878000000
Hawk and boa constrictor,BA12 6JR,51.089215470000000,-2.276789151000000
Fox and python,BA12 6LZ,51.086685000000000,-2.310769000000000
Gull and River dolphin,BA12 6NY,51.086042560000000,-2.311949294000000
Civet and Black cockatoo,BA12 6RE,51.124043550000000,-2.321764702000000
chuckwalla and Puffleg,BA12 6RL,51.121850000000000,-2.318835000000000
Logrunners and Lemming,BA12 7BL,51.179425240000000,-2.147044425000000
rat snake and bearded lizard,BA12 7BU,51.175864720000000,-2.146804200000000
Rat and Thicketbird,BA12 7EF,51.163791130000000,-2.188782708000000
king cobra and snapping turtle,BA12 7EJ,51.149083030000000,-2.197943952000000
Condor and Schneider python,BA12 7EY,51.115885410000000,-2.197344722000000
Lemming and Marsh harrier,BA12 7FB,51.163897000000000,-2.181441000000000
Scimitar babbler and anaconda,BA12 7HU,51.134575000000000,-2.318223130000000
snake and diamondback,BA12 7JU,51.204214440000000,-2.191581857000000
deaf adder and amphisbaena,BA12 7LP,51.174612860000000,-2.269161317000000
Chicken and viper,BA12 7PN,51.208440530000000,-2.257219500000000
gopher snake and amphisbaena,BA12 7RA,51.195464930000000,-2.217477055000000
Minke whale and River dolphin,BA12 7RU,51.217850100000000,-2.199985883000000
Wader and Mouse,BA12 8AQ,51.179886580000000,-2.199721224000000
Puffleg and Stint,BA12 8AX,51.185450000000000,-2.191663531000000
sand lizard and Ibex,BA12 8BD,51.192391080000000,-2.190946046000000
Bunting and Jay,BA12 8DG,51.197654230000000,-2.194660244000000
tiger snake and Chicken,BA12 8DS,51.196877960000000,-2.196431587000000
galliwasp and chuckwalla,BA12 8FD,51.194500270000000,-2.193330352000000
death adder and rattlesnake,BA12 8FR,51.204823697843300,-2.184814177108460
rat snake and dukite,BA12 8HA,51.203077170000000,-2.199521047000000
dukite and loggerhead,BA12 8HT,51.202592110000000,-2.204428380000000
crocodile and Hawaiian honeycreeper,BA12 8HZ,51.200491900000000,-2.196919291000000
Viscacha and Thrasher,BA12 8LL,51.201912160000000,-2.186377000000000
wall lizard and Parrotlet,BA12 8LT,51.201570000000000,-2.192830000000000
Bronzewing pigeon and blue racer,BA12 8NX,51.203001920000000,-2.190732333000000
Gila monster and Cuscus,BA12 9AE,51.205201050000000,-2.181895367000000
Kite and Tahr,BA12 9DP,51.205671490000000,-2.154957976000000
king cobra and dugite,BA12 9ER,51.199719300000000,-2.154466000000000
agama and Badger,BA12 9FJ,51.196565000000000,-2.156868000000000
worm lizard and Bronzewing pigeon,BA12 9HY,51.201540680000000,-2.170402001000000
Shearwater and bearded dragon,BA12 9JZ,51.200309190000000,-2.163828014000000
Siskin and leathery turtle,BA12 9NT,51.202195000000000,-2.184288572000000
Tahr and cayman,BA12 9QF,51.195983030000000,-2.188384904000000
Peafowl and slowworm,BA12 9QU,51.194618630000000,-2.186905327000000
harlequin snake and Solitaire,BA12 9XZ,51.204415480000000,-2.178371000000000
chuckwalla and American sparrow,BA13 3RF,51.249573190000000,-2.189363462000000
Myna and diamondback,BA13 3UN,51.249418370000000,-2.201297833000000
indigo snake and Jackal,BA13 4DD,51.242772000000000,-2.212844000000000
blue tongue and jew lizard,BA22 7BA,51.066973490000000,-2.522524023000000
Meadowlark and Vole,BA22 7DL,51.044280160000000,-2.521840617000000
Egret and diamond python,BA22 7ES,51.028530000000000,-2.527243131000000
Egret and Black jay,BA3 4TA,51.245025640000000,-2.504067510000000
Guillemot and lizard,BA3 5BN,51.241191790000000,-2.519210392000000
tokay and Argus,BA3 5BT,51.224008330000000,-2.531188907000000
Petrel and diamond python,BA3 5EA,51.245846110000000,-2.473402966000000
Crow and Black cockatoo,BA3 5EE,51.247201570000000,-2.473975648000000
flying lizard and tokay,BA3 5EP,51.249358200000000,-2.472106560000000
Linsang and wall lizard,BA3 5EZ,51.242944100000000,-2.475034954000000
Parrotlet and hawksbill,BA3 5FA,51.233894000000000,-2.506295000000000
Piping shrike and Snipe,BA3 5FG,51.246041300000000,-2.471829025000000
Thicketbird and lizard,BA3 5GA,51.217995690000000,-2.482781814000000
monitor and diamondback turtle,BA3 5HP,51.231425000000000,-2.492532633000000
flying dragon and blue tongue,BA3 5HT,51.223267930000000,-2.523891637000000
Parrotlet and box turtle,BA3 5JH,51.222180270000000,-2.490629671000000
cobra and Asiatic leopard,BA3 5RE,51.232920020000000,-2.440055906000000
thorn lizard and Schneider python,BA3 5RW,51.242522180000000,-2.445132912000000
krait and boomslang,BA4 4HG,51.181053930000000,-2.537004077000000
Peafowl and Condor,BA4 4PP,51.183084880000000,-2.527398888000000
Nukupuʻu and galliwasp,BA4 4PT,51.194360360000000,-2.517452885000000
Mockingbird and Thrasher,BA4 4QH,51.187939740000000,-2.477359323000000
hognose snake and Scimitar babbler,BA4 4TD,51.174529910000000,-2.411863082000000
sidewinder and frilled lizard,BA4 4TQ,51.177853200000000,-2.407801307000000
monitor and cycling lizard,BA4 5PP,51.184147220000000,-2.535036972000000
Stint and Skunk,BA4 5QF,51.186428000000000,-2.530113000000000
Gila monster and flying dragon,BA4 6AG,51.154016980000000,-2.437202686000000
galliwasp and tortoise,BA4 6AN,51.151980000000000,-2.511831000000000
Francolin and Schneider python,BA4 6BT,51.144634240000000,-2.435870293000000
Lemming and dugite,BA4 6DT,51.146954890000000,-2.509116682000000
perentie and thorny devil,BA4 6HD,51.148676640000000,-2.448818220000000
Gull and Grackle,BA4 6HL,51.139131000000000,-2.488419000000000
bull snake and Eagle,BA4 6JR,51.148766340000000,-2.504032717000000
thorny devil and gecko,BA4 6LR,51.146843720000000,-2.507800220000000
hawksbill and tortoise,BA4 6PH,51.144227140000000,-2.507771495000000
blindworm and Solitaire,BA4 6PS,51.117317830000000,-2.535078724000000
skink and sand viper,BA4 6PW,51.123487220000000,-2.534907121000000
tree snake and Asiatic leopard,BA7 7EQ,51.087535560000000,-2.515117180000000
ringhals and copperhead,BA7 7LA,51.094416000000000,-2.514793824000000
Jerboa and moloch,BA7 7LQ,51.096324940000000,-2.516243080000000
Siskin and loggerhead,BA7 7WD,51.089805190000000,-2.514299975000000
Recurvebill and fer-de-lance,BA9 8DP,51.056962000000000,-2.498968000000000
anole and Asiatic leopard,BA9 8HP,51.090087720000000,-2.395534279000000
hognose snake and blue racer,BA9 8LG,51.081909370000000,-2.351965568000000
galliwasp and thorny devil,BA9 8LN,51.089899000000000,-2.353840000000000
American sparrow and glass snake,BA9 8LZ,51.079151880000000,-2.341837841000000
Badger and soft-shelled turtle,BA9 9AF,51.055334520000000,-2.413272464000000
diamondback terrapin and Meadowlark,BA9 9DE,51.056976780000000,-2.424230902000000
Mamo and Dolphin,BA9 9DX,51.055335390000000,-2.410475978000000
Guillemot and Fox,BA9 9EJ,51.051146000000000,-2.410482000000000
Diving bird and mountain devil,BA9 9EX,51.052409690000000,-2.406255621000000
Rabbit and brown snake,BA9 9FA,51.055247000000000,-2.408634000000000
Solitaire and terrapin,BA9 9GZ,51.056574980000000,-2.408289641000000
Ground sloth and Greenbul,BA9 9HL,51.053365910000000,-2.405379426000000
Civet and Bronzewing pigeon,BA9 9HR,51.053680620000000,-2.402785524000000
glass snake and blue racer,BA9 9JZ,51.056948680000000,-2.406851829000000
slowworm and Bronzewing pigeon,BA9 9LL,51.056221520000000,-2.411639533000000
Armadillo and adder,BA9 9NT,51.058166640000000,-2.410843476000000
horned viper and Francolin,BA9 9PB,51.056816450000000,-2.411231031000000
Triller and thorny devil,BA9 9PT,51.048249600000000,-2.352651743000000
Snipe and Old World quail,BA9 9QZ,51.029897460000000,-2.366929207000000
cerastes and leguaan,BA9 9RJ,51.051944000000000,-2.411131000000000
Argus and box turtle,BA9 9RL,51.052095570000000,-2.406081669000000
taipan and swift,BA9 9YZ,51.057351580000000,-2.409923078000000
American sparrow and Warbler,SP3 5SS,51.108447853390300,-2.142504887018030
Egret and Skunk,SP3 6BQ,51.080116782382900,-2.173480898854440
Greenbul and Buzzard,SP3 6DE,51.095292327855000,-2.163184725338640
New World blackbird and asp,SP3 6EE,51.092511609599000,-2.128990533997480
iguana and Goose,SP3 6EQ,51.091984106824400,-2.126218931996860
Ice seal and Buzzard,SP7 9AD,51.028735774558900,-2.179292023103460
Buzzard and massasauga,SP7 9BX,51.032164000000000,-2.174779000000000
wall lizard and boa,SP7 9QH,51.031135873626500,-2.216863015386380
Towhee and Meadowlark,SP8 4AL,51.039063487787400,-2.274122324872460
agama and Diving bird,SP8 4BQ,51.040274037321400,-2.279349789988760
American sparrow and amethystine python,SP8 4BY,51.039916976849600,-2.278249386232560
cayman and horned viper,SP8 4DY,51.041369000000000,-2.277073193356080
Mamo and indigo snake,SP8 4ER,51.041221307036300,-2.270398047969180
pit viper and Triller,SP8 4FA,51.047738441403500,-2.282718578827250
sand lizard and Partridge,SP8 4GS,51.046186981881200,-2.280983064010250
Philippine hawk-owl and Lemming,SP8 4GT,51.031102654415700,-2.263593967164180
massasauga and Songlark,SP8 4LQ,51.031489681281800,-2.259417851403140
Moluccan boobook and Solitaire,SP8 4QG,51.036400098669100,-2.270997486657680
giant tortoise and puff adder,SP8 4QX,51.036694549125700,-2.271983287650280
turtle and Marmoset,SP8 4RL,51.046213933315300,-2.277231537448820
Shearwater and Scimitar babbler,SP8 5BP,51.071180022134400,-2.331017471687480
flying dragon and Petrel,SP8 5FJ,51.071544000000000,-2.330988000000000
amethystine python and crocodile,SP8 5NS,51.039501000000000,-2.297930407815940
Asiatic leopard and Wallaby,SP8 5PF,51.063010731806600,-2.335711124224320
