name,postcode,lat,lon
pit viper and White ibis,GU10 1PB,51.220036348202800,-0.760282318053616
Boto and Black cockatoo,GU10 1PH,51.221850913526900,-0.755021142598626
water snake and Jay,GU10 1QX,51.208611266230400,-0.759830332539301
puff adder and python,GU10 2DB,51.176140000000000,-0.760544000000000
Chickadee and Magpie,GU10 2DG,51.165527776716800,-0.753820453217064
lizard and Tattler,GU10 2EH,51.160159591026400,-0.755538161978272
Grouse and pit viper,GU10 2JE,51.136582000000000,-0.779327000000000
kabaragoya and Ice seal,GU10 2JP,51.137587836077100,-0.780230031516282
Skunk and Pheasant,GU10 2JR,51.137008324854500,-0.773827476772317
dugite and harlequin snake,GU10 2PP,51.134839630059900,-0.775399961462693
death adder and Duck,GU10 2QR,51.143274000000000,-0.790773000000000
skink and adder,GU10 3BT,51.168888000000000,-0.772110000000000
Puffleg and water snake,GU10 3BX,51.183275000000000,-0.789326000000000
Siskin and cobra de capello,GU10 3DU,51.165973746650300,-0.793798366973857
Recurvebill and Nukupuʻu,GU10 3HP,51.190502644687700,-0.792700263209290
Gull and diamondback terrapin,GU10 3LX,51.196094776683200,-0.798708228850861
Mouse and Minke whale,GU10 3NE,51.197753921535400,-0.799151705297129
gopher snake and Perching duck,GU10 3NW,51.196978368036300,-0.794563360629289
asp and moloch,GU10 3NY,51.197701203126600,-0.791410093861810
Vulture and pit viper,GU10 3PT,51.193848953037100,-0.785857955379689
goanna and agama,GU10 3RQ,51.198560859757900,-0.784116789050772
Ground sloth and Gila monster,GU10 4AG,51.196018524323200,-0.820120795572006
Kākāriki and box turtle,GU10 4BD,51.185290616886900,-0.816817456787880
Cloud rat and New World blackbird,GU10 4DE,51.184764524260800,-0.829779946805274
worm lizard and Tattler,GU10 4LS,51.168780000000000,-0.839024000000000
Linsang and Maya,GU10 4PF,51.197274284770700,-0.820961656745798
Kite and Snipe,GU10 4PH,51.200267001102100,-0.819897666081051
soft-shelled turtle and Pheasant,GU10 4PL,51.201703334329200,-0.816983943292212
water snake and constrictor,GU10 4PZ,51.198463146294700,-0.817582174923324
gopher snake and king snake,GU10 4RY,51.195081047015800,-0.807736539865844
frilled lizard and bicycle lizard,GU10 5AP,51.234975148561400,-0.843102837614167
deaf adder and Chicken,GU10 5DF,51.188287250354600,-0.887343292717626
Fulmarine petrel and Rabbit,GU10 5EP,51.204206506257100,-0.831634964618211
blindworm and cayman,GU10 5EU,51.197637000000000,-0.843666000000000
Tree warbler and bearded lizard,GU10 5HA,51.196238522579600,-0.848796022279798
River dolphin and Vole,GU10 5JG,51.197421272177800,-0.857539928701901
king cobra and frill-necked lizard,GU10 5JY,51.180905373366200,-0.872370000000000
harlequin snake and sidewinder,GU10 5LE,51.190668222642600,-0.877068452179262
Recurvebill and Songlark,GU10 5LW,51.189729390262200,-0.878565174404441
Tahr and amphisbaena,GU10 5NX,51.231995711478600,-0.859290838701793
krait and ringhals,GU10 5QW,51.242592195098800,-0.864286508447318
puff adder and caiman,GU10 5RH,51.241197000000000,-0.857502000000000
blindworm and gavial,GU10 5RQ,51.239279000000000,-0.859134303524737
skink and green turtle,GU10 5TN,51.237795380690700,-0.830999325283532
cerastes and Badger,GU10 5TP,51.237685401451300,-0.859966660721702
cycling lizard and Chicken,GU10 5ZQ,51.214399000000000,-0.801678146764842
asp and tuatara,GU11 1DY,51.249267125365300,-0.764224956755804
Badger and Capuchin,GU11 1HE,51.244775096684300,-0.762912629240934
sand lizard and Kākāriki,GU11 1HH,51.247853001656000,-0.758904198500270
Tahr and Treepie,GU11 1SZ,51.247563533839600,-0.757894710513292
cycling lizard and Wallaby,GU11 1TG,51.247812833198800,-0.756813399171944
Pitohui and Old World warbler,GU11 1TQ,51.247858371430800,-0.757714833144199
Egret and jew lizard,GU11 1TT,51.249610368584600,-0.760117806077038
Greenbul and snake,GU11 1YA,51.248395000000000,-0.776972000000000
gaboon viper and Coati,GU11 1YU,51.248265951937100,-0.780227588426730
Argus and Cloud rat,GU11 3AH,51.246463141832800,-0.776363865268806
Magpie and Songlark,GU11 3DB,51.239223975099400,-0.760941370746657
Meadowlark and Quetzal,GU11 3DJ,51.247109950379700,-0.766876083584054
jew lizard and Fox,GU11 3FH,51.237467325046800,-0.766603848028106
Bronzewing pigeon and massasauga,GU11 3HX,51.244461829468700,-0.772719000000000
Cloud rat and rat snake,GU11 3JZ,51.248438188426100,-0.773474487587837
puff adder and agama,GU11 3NB,51.240698992315800,-0.768637641139968
taipan and hawksbill,GU11 3NT,51.244906106422000,-0.781405308291628
agama and alligator,GU11 3PE,51.245752000000000,-0.777858000000000
smooth snake and Cuscus,GU11 3PG,51.244866706227000,-0.775045157426454
leguaan and Crow,GU11 3PJ,51.247124921898900,-0.777736093173617
elapid and Thicketbird,GU11 3QD,51.238784044195300,-0.758460613576483
Philippine hawk-owl and Old World vulture,GU11 3QG,51.235657430525000,-0.758716649693539
New World blackbird and boomslang,GU11 3QR,51.237016336540800,-0.764768034776378
kabaragoya and mamba,GU11 3RE,51.234876283144200,-0.757133387347410
taipan and flying dragon,GU11 3RG,51.233732787245000,-0.754457036644825
cobra and tree snake,GU11 3XA,51.244333294765900,-0.777351620602879
bull snake and Stint,GU11 9HF,51.248633000000000,-0.761172872162702
tiger snake and hawksbill,GU12 4HL,51.240043961389700,-0.750103563758921
Schneider python and puff adder,GU12 4NX,51.244975590598200,-0.752992921245422
terrapin and diamondback,GU12 4SH,51.247212826185300,-0.754508477109237
Linsang and Kangaroo,GU26 6BT,51.097846879449700,-0.755183567380044
swift and Booted eagles,GU26 6DE,51.095298000000000,-0.760564000000000
asp and Boto,GU26 6DQ,51.103241803599300,-0.752596262264549
Jackal and chameleon,GU26 6ET,51.107430499800300,-0.758340165604873
Jackal and Cuscus,GU26 6JD,51.126534562942200,-0.783536427597152
Polecat and Grackle,GU26 6JF,51.117333599234000,-0.781649191829532
Stint and racer,GU26 6JJ,51.114361751668200,-0.776927039977862
crocodile and Siskin,GU26 6NR,51.122497466044700,-0.753806000000000
milk snake and Linsang,GU26 6NY,51.126172896687900,-0.756837440989179
Crow and Greenbul,GU26 6QT,51.124609340006600,-0.752721079177913
skink and box turtle,GU26 6SB,51.127167197822700,-0.752252056505474
Chipmunk and agamid,GU27 3QT,51.085177000000000,-0.752597000000000
Asiatic leopard and anole,GU29 0QG,51.027359059882500,-0.767539095279313
constrictor and Shearwater,GU30 7BJ,51.080532972459100,-0.799590292576343
Prion and puff adder,GU30 7BP,51.077167900972400,-0.795037944983322
Jackal and skink,GU30 7DF,51.078730399585200,-0.789601184661431
Siskin and Mink,GU30 7GG,51.071767748895300,-0.803342586811687
swift and Vole,GU30 7NN,51.039594426366900,-0.800035040265012
whip snake and Diving bird,GU30 7PB,51.080090559468200,-0.823299905624552
amethystine python and skink,GU30 7PJ,51.075285500926500,-0.805264574622779
ringhals and diamondback,GU30 7PY,51.082779739656800,-0.802087706423313
pit viper and Songlark,GU30 7QY,51.085372334623300,-0.795353090355716
fer-de-lance and terrapin,GU30 7RW,51.097148270068700,-0.831264407583339
Parrotbill and Prion,GU30 7TR,51.075352940862400,-0.798682268181949
elapid and Thrasher,GU30 7US,51.080818000000000,-0.817353000000000
Kestrel and black snake,GU30 7WP,51.080381000000000,-0.818534000000000
Perching duck and Stilt,GU30 7XB,51.076727865343600,-0.833220630000599
moloch and gavial,GU30 7XR,51.110316741975300,-0.818189843489925
Ground sloth and Old World warbler,GU31 5AP,51.025006303771600,-0.891797830805739
hognose snake and saltwater crocodile,GU32 1BP,51.059723000000000,-0.967911000000000
mountain devil and Meadowlark,GU32 1BZ,51.051771027063100,-0.976164000000000
Tahr and Petrel,GU32 1DQ,51.025862017055200,-0.997523657982697
Siskin and Thrasher,GU32 1EF,51.035015808305900,-0.987029064514517
brown snake and Flameback,GU33 6BD,51.079445284450000,-0.885001827884749
cycling lizard and amphisbaena,GU33 6BT,51.098864353740300,-0.893032483354691
Snipe and rock python,GU33 6JG,51.045319000000000,-0.899159000000000
dugite and Hawk,GU33 6JL,51.049335060177800,-0.901746074234367
sand viper and chuckwalla,GU33 6JU,51.051799000000000,-0.900566494829909
cobra and soft-shelled turtle,GU33 6NH,51.058414694450400,-0.924661738343588
adder and dugite,GU33 6NW,51.062934693220100,-0.935117286277628
rock python and Black jay,GU33 7DS,51.042630257171100,-0.891648488433986
Elephant and Kangaroo,GU33 7EG,51.043029195165400,-0.887259761348998
Rat and hognose snake,GU33 7ER,51.044233024397300,-0.883365137468585
giant tortoise and Greenbul,GU33 7EW,51.043438721851700,-0.884939077916626
Grouse and king cobra,GU33 7HB,51.045455992062100,-0.877729484104644
sidewinder and copperhead,GU33 7LL,51.040164765757600,-0.892434752174743
Ice seal and Eagle,GU33 7LP,51.041021970125900,-0.892742386462596
Meadowlark and Stilt,GU33 7NJ,51.041291214819000,-0.867346049042022
cycling lizard and Mouse,GU33 7NT,51.031264000000000,-0.875562000000000
Bronzewing pigeon and Songlark,GU33 7PA,51.035164831257100,-0.872672539321915
Stilt and diamondback terrapin,GU33 7PS,51.035747085859800,-0.881003000000000
galliwasp and flying lizard,GU33 7QP,51.028289213001600,-0.874921273600945
harlequin snake and Night heron,GU33 7QR,51.028834518211500,-0.882080942746485
gopher snake and tuatara,GU33 7RJ,51.042385000000000,-0.892171538528572
Tahr and green turtle,GU34 1DS,51.150727893374000,-0.969299987486805
Herring gull and Parrotbill,GU34 1FE,51.149938289984500,-0.976666428564353
turtle and Argus,GU34 1FJ,51.145008000000000,-0.981749000000000
fer-de-lance and Tit-tyrant,GU34 1GN,51.150401000000000,-0.989723000000000
milk snake and rattlesnake,GU34 1JX,51.148632947537000,-0.982685723621895
Recurvebill and Vole,GU34 1PN,51.142606972704300,-0.985662883922047
adder and elapid,GU34 1PY,51.145407996262600,-0.989289863726961
Parrotlet and chuckwalla,GU34 1PZ,51.146890589267700,-0.986040792525407
fer-de-lance and cycling lizard,GU34 1QG,51.151581298355600,-0.987739551750869
Dolphin and Mamo,GU34 1QN,51.146716957532200,-0.990919659817029
chuckwalla and Argus,GU34 1QS,51.146760390511100,-0.988659883886415
snake and diamondback,GU34 1ST,51.137905000000000,-0.991812000000000
Recurvebill and anole,GU34 1TY,51.149743640726800,-0.972924834218395
Stilt and soft-shelled turtle,GU34 2DD,51.151129441782400,-0.973037055649271
tiger snake and gecko,GU34 2DU,51.153341118801500,-0.973376000000000
Boto and Solitaire,GU34 2FU,51.163898000000000,-0.970021000000000
pit viper and boomslang,GU34 2FZ,51.155807000000000,-0.963194000000000
lizard and Stilt,GU34 2HR,51.156558806840000,-0.971786895913346
Night heron and grass snake,GU34 2JQ,51.159009316418400,-0.969244201527021
Petrel and rat snake,GU34 2ND,51.156857753715900,-0.966932712899033
blue tongue and rock python,GU34 2NG,51.160090000000000,-0.967261000000000
horned viper and alligator,GU34 2PS,51.147601753439000,-0.972729322608340
saltwater crocodile and Treepie,GU34 2QA,51.151692782028100,-0.961471825128604
River dolphin and boomslang,GU34 2QS,51.157363097919800,-0.956553000000000
Rabbit and viper,GU34 2SJ,51.147062000000000,-0.969467000000000
Marmoset and amphisbaena,GU34 2TA,51.149241656088800,-0.965958954499218
Chipmunk and viper,GU34 2TY,51.143452342815800,-0.977410225633155
diamondback turtle and Lemming,GU34 2UY,51.153748965218400,-0.965186201758589
Mockingbird and death adder,GU34 3AW,51.138187810386100,-0.929713837953065
anole and Wallaby,GU34 3AY,51.134147724396400,-0.930421803010210
Herring gull and Jay,GU34 3BB,51.128983905141100,-0.942045275620195
River dolphin and adder,GU34 3BF,51.141638499515200,-0.956322541049713
Jay and anaconda,GU34 3ED,51.111679350463200,-0.981182876175005
tiger snake and flying lizard,GU34 3EQ,51.112964985692500,-0.986326128523001
Masked owl and horned viper,GU34 3HG,51.134957989302400,-0.987102504797125
rock snake and Fox,GU34 3HN,51.124204807976800,-0.951571186751950
Rat and flying dragon,GU34 3HY,51.101142735716600,-0.943951883888780
sand lizard and Siskin,GU34 3JW,51.096911455808400,-0.942420218969672
Francolin and agama,GU34 3LB,51.096965414996100,-0.940433919873117
cayman and sand lizard,GU34 3NF,51.103997437691100,-0.993363883977661
diamondback terrapin and Pheasant,GU34 3PP,51.065704255307200,-1.018327429559670
Chickadee and blue racer,GU34 3PU,51.059780000000000,-0.992967000000000
monitor and grass snake,GU34 4AU,51.147778967512300,-1.022806707239560
Philippine hawk-owl and Songlark,GU34 4BN,51.162385000000000,-0.980753000000000
Solitaire and sand viper,GU34 4BS,51.167043000000000,-0.973613000000000
coral snake and blue racer,GU34 4DU,51.171503963734900,-1.007186115871520
tiger snake and Mole,GU34 4FD,51.179108050021600,-0.921155840375959
galliwasp and cobra de capello,GU34 4JP,51.177759000000000,-0.923290000000000
fer-de-lance and Warbler,GU34 4LR,51.193937953142500,-0.914827473985534
tuatara and loggerhead,GU34 4PD,51.163097004309500,-0.893984471187052
Thrasher and chuckwalla,GU34 5DJ,51.105849228244600,-1.048058928118500
Black cockatoo and terrapin,GU34 5DP,51.102170581798500,-1.048120000000000
Fox and Diving bird,GU34 5DT,51.113063967559100,-1.037424856132500
boomslang and Kite,GU34 5EB,51.119212636017600,-1.040454730255780
Snipe and snake,GU34 5FR,51.111341513246900,-1.054632000000000
saltwater crocodile and gavial,GU34 5FW,51.113548058287800,-1.040157859638890
Treepie and smooth snake,GU34 5FY,51.114593061096200,-1.039293316024340
Mink and alligator,GU34 5LW,51.129217094345300,-1.064384824987660
Boto and Egret,GU34 5NG,51.128483464143600,-1.093409689446100
tuatara and Buzzard,GU34 5PA,51.135488000000000,-1.047921000000000
whip snake and leguaan,GU34 5PH,51.128393000000000,-1.057871000000000
rock python and sand viper,GU34 5QB,51.116132334841500,-1.078993053791330
iguana and Kestrel,GU34 5RR,51.177365118085200,-1.069333441497070
Civet and Stint,GU34 5SJ,51.178496000000000,-1.035648000000000
cobra and smooth snake,GU34 5TF,51.116373000000000,-1.038727000000000
Boto and constrictor,GU34 9DD,51.147189299777300,-0.977125000000000
Towhee and glass snake,GU34 9DL,51.147189299777300,-0.977125000000000
Argus and Minke whale,GU34 9DY,51.147189299777300,-0.977125000000000
taipan and Hawaiian honeycreeper,GU34 9EF,51.147189299777300,-0.977125000000000
Perching duck and giant tortoise,GU35 0FD,51.108182122040500,-0.865054996413069
Quetzal and Black jay,GU35 0GD,51.122439000000000,-0.863902000000000
diamondback terrapin and smooth snake,GU35 0GP,51.122561000000000,-0.868143000000000
Coati and White ibis,GU35 0GS,51.124216000000000,-0.867231000000000
blind snake and goanna,GU35 0HW,51.116606862243300,-0.861233976423448
Booted eagles and adder,GU35 0HY,51.115054432177600,-0.864343776206395
puff adder and Moluccan boobook,GU35 0LE,51.119873000000000,-0.858021000000000
kabaragoya and giant tortoise,GU35 0NJ,51.121463419638600,-0.861300347155479
Stilt and wall lizard,GU35 0SD,51.117748454579200,-0.847418418848916
Grosbeak and Magpie,GU35 0XR,51.107041751838700,-0.861526142682931
Magpie and smooth snake,GU35 0XY,51.106666246847200,-0.853464826233516
blind snake and tortoise,GU35 0YE,51.116486894866500,-0.841692067120298
diamondback turtle and Duck,GU35 5DN,51.118707053484100,-0.860539515120342
anole and Masked owl,GU35 8EH,51.118667338997200,-0.803703230093208
Jerboa and anole,GU35 8ET,51.116737710401500,-0.799681172478068
snake and horned viper,GU35 8EW,51.117610015437100,-0.802316062046182
Grouse and Tit-tyrant,GU35 8HD,51.114282218444700,-0.802259216844877
crocodile and Badger,GU35 8JT,51.115955713317700,-0.796215386436431
thorny devil and rock python,GU35 8NF,51.114602349444500,-0.824952406182249
Linsang and Nukupuʻu,GU35 8PG,51.120921895744900,-0.829221571017386
Rabbit and leguaan,GU35 8RQ,51.111694943227200,-0.837568000000000
Thrasher and Elephant,GU35 8RU,51.125398000000000,-0.838837563932890
Fox and Tahr,GU35 8SJ,51.126946251285600,-0.797561000000000
Partridge and swift,GU35 8TE,51.137781774654000,-0.839527000000000
garter snake and constrictor,GU35 9AY,51.103028000000000,-0.867601633310434
hoop snake and viper,GU35 9BF,51.112316000000000,-0.899909000000000
Egret and smooth snake,GU35 9DJ,51.098515772077400,-0.880972855041400
Flameback and Moluccan boobook,GU35 9FT,51.135356000000000,-0.881995000000000
water snake and diamondback terrapin,GU35 9JG,51.116685000000000,-0.902211837593592
Jackal and Peafowl,GU35 9QF,51.108455000000000,-0.866140353075237
cycling lizard and gavial,GU9 0AD,51.217801498027500,-0.803899516617641
Night heron and grass snake,GU9 0AF,51.234762759891600,-0.793304333898279
Bronzewing pigeon and Fulmarine petrel,GU9 0AR,51.229729042686800,-0.813988334853533
Coati and monitor,GU9 0BH,51.232756979181000,-0.810200791481083
dukite and coral snake,GU9 0EQ,51.237094863413600,-0.801737694527108
Scimitar babbler and Egret,GU9 0HP,51.233811192518200,-0.798084533480798
Black jay and Flameback,GU9 0HR,51.232322103550100,-0.798438432290292
Kākāriki and krait,GU9 0HW,51.233128453707500,-0.800780783464869
Marmoset and sidewinder,GU9 0JB,51.234576993773700,-0.803608000000000
sea snake and Grouse,GU9 0JD,51.234939881667400,-0.806448932689173
green turtle and carpet snake,GU9 0LF,51.239953227538100,-0.789386521141790
Piping shrike and lizard,GU9 0LL,51.234952444409900,-0.798885588069311
Coati and Gull,GU9 0NA,51.236804551427600,-0.793608929711024
Herring gull and tortoise,GU9 0NP,51.230247789687800,-0.791732253039235
Civet and Ground sloth,GU9 0NQ,51.230096627715800,-0.784947389467354
Kestrel and Chicken,GU9 0QB,51.234582240908300,-0.791907000000000
anaconda and soft-shelled turtle,GU9 0RF,51.234653113138700,-0.788164841289095
Kite and cobra de capello,GU9 1JP,51.214399000000000,-0.801678188176549
monitor and hoop snake,GU9 1NY,51.214397000000000,-0.801680000000000
Bronzewing pigeon and Rat,GU9 1NZ,51.214397000000000,-0.801680000000000
bandy-bandy and habu,GU9 7BX,51.214109965323700,-0.816709025721460
Kangaroo and Moluccan boobook,GU9 7DH,51.212704290063800,-0.810074000000000
Guillemot and mamba,GU9 7DN,51.214244000000000,-0.800555000000000
python and boa constrictor,GU9 7DX,51.212631546302400,-0.805722853560811
Wallaby and Perching duck,GU9 7EA,51.212326095557000,-0.806632717272071
mud turtle and deaf adder,GU9 7JW,51.218544305858200,-0.796534720677641
Schneider python and Tahr,GU9 7LP,51.215505000000000,-0.798952265864820
Darwin's finches and Goose,GU9 7NG,51.215546803937100,-0.797987377061620
Thicketbird and Nukupuʻu,GU9 7RX,51.215663251031600,-0.796953000000000
Flameback and turtle,GU9 8EQ,51.210996010654000,-0.772794302887961
leathery turtle and mamba,GU9 8HN,51.200035857035000,-0.786740198248561
green turtle and Thrasher,GU9 8JL,51.203780251466300,-0.789690773647010
king snake and Darwin's finches,GU9 8JP,51.204878230952200,-0.783707132653545
flying dragon and rat snake,GU9 8NB,51.209654100889200,-0.790739372887092
gopher snake and Vole,GU9 8QE,51.203672935321800,-0.809032066712354
alligator and diamondback turtle,GU9 8QH,51.206539430758900,-0.804420265720525
Stint and Maya,GU9 8QY,51.202348000000000,-0.802410000000000
Piping shrike and Crow,GU9 8RS,51.203187948455600,-0.809974984682072
dukite and Prion,GU9 8SH,51.197152825024000,-0.808083813054616
agama and sidewinder,GU9 8TJ,51.199025942838900,-0.814547781621568
blue racer and adder,GU9 8TL,51.198084311146100,-0.814800944405613
hawksbill and bearded lizard,GU9 8UG,51.202029000000000,-0.816131000000000
Elephant and pit viper,GU9 9BD,51.237509308920500,-0.786972483631549
blue tongue and agama,GU9 9DB,51.235088166629900,-0.781564390538054
bushmaster and blue tongue,GU9 9DG,51.233784478759100,-0.778132518025981
Fulmarine petrel and horned toad,GU9 9DT,51.236131814350700,-0.779889532723814
Polecat and monitor,GU9 9FJ,51.219554519733900,-0.788117371883330
mamba and kabaragoya,GU9 9LG,51.232004644531200,-0.764486844474049
Petrel and rattlesnake,GU9 9NF,51.231088365143600,-0.765428035593382
Condor and saltwater crocodile,GU9 9PP,51.218854462329200,-0.785644258545747
Parakeet and Pratincole,GU9 9QA,51.229438204345600,-0.761590861329065
caiman and anaconda,GU9 9QE,51.218685020163100,-0.788383619795268
giant tortoise and Pitohui,GU9 9RE,51.222593202764500,-0.783712922815258
Partridge and flying lizard,GU9 9RL,51.223325021228500,-0.786643621250540
Marsh harrier and Fulmarine petrel,GU9 9RQ,51.220973999284400,-0.781063508743717
Booted eagles and pit viper,RG22 4BS,51.248293000000000,-1.091773000000000
boomslang and kabaragoya,RG22 4DB,51.237273436028600,-1.122042278746430
blind snake and gaboon viper,RG22 4DG,51.229531056368700,-1.140192202835520
elapid and horned toad,RG22 4DP,51.245392204428400,-1.111171276136740
Goose and Argus,RG22 4FF,51.223857178568100,-1.143892243773030
Cloud rat and skink,RG22 4HD,51.245526657167700,-1.117057033439720
Triller and Chickadee,RG22 4SR,51.225779342980600,-1.143598819783830
Old World quail and diamond snake,RG22 4SS,51.226734764793400,-1.142678868137090
bushmaster and rock snake,RG22 4TW,51.235496044888300,-1.139264000000000
swift and Warbler,RG22 4UJ,51.226807429123300,-1.137879967921650
B and Skunk,RG22 4UL,51.238483709907600,-1.133622240084960
hognose snake and Kite,RG22 4UP,51.238119746993700,-1.134259355579840
Partridge and black snake,RG22 4XA,51.232629644195700,-1.139690461736770
Peafowl and carpet snake,RG22 4XU,51.232813892353500,-1.130549006827870
Vulture and Peafowl,RG22 4YB,51.237273653661000,-1.136581444127400
adder and python,RG22 5FJ,51.246093231259100,-1.137576845236950
hawksbill and flying dragon,RG22 5HT,51.248595639103700,-1.133059772579160
Zebra and Jerboa,RG22 5JD,51.249594000000000,-1.135291000000000
frill-necked lizard and gavial,RG22 5LN,51.247503526317200,-1.137378544676920
bandy-bandy and amethystine python,RG22 5NF,51.242250022725400,-1.133436899163780
chuckwalla and rattlesnake,RG22 5NS,51.240816524537600,-1.139022081814960
Grackle and Snipe,RG22 5PF,51.249400098002800,-1.142171628210090
horned viper and Wallaby,RG22 5PP,51.246974563322300,-1.142488960303540
cycling lizard and Herring gull,RG22 5QQ,51.244354000000000,-1.145490956297420
Masked owl and brown snake,RG22 5RJ,51.241079716311400,-1.138128990044500
chuckwalla and bushmaster,RG23 7FX,51.220458000000000,-1.157372000000000
mud turtle and Black jay,RG25 2DL,51.213179547463300,-1.157979000000000
Pheasant and flying lizard,RG25 2EF,51.171620511714400,-1.131514004513520
Armadillo and cobra,RG25 2FB,51.213046000000000,-1.077159000000000
Logrunners and Grouse,RG25 2FG,51.235860273400000,-1.086202289800000
black snake and Recurvebill,RG25 2HA,51.245850788151500,-1.088941271345390
sand lizard and king snake,RG25 2LE,51.241518886107900,-1.026797000000000
bandy-bandy and milk snake,RG25 2PF,51.202136563381900,-1.039033833008300
carpet snake and thorny devil,RG25 2PT,51.196279506114100,-1.036465062358690
Skunk and king cobra,RG25 2QN,51.200295179094700,-1.094548877275980
Meadowlark and Wader,RG29 1JD,51.226125876168700,-0.914357228975432
Linsang and brown snake,RG29 1PS,51.245507083918500,-0.945177003483312
Mockingbird and Black cockatoo,RG29 1QY,51.241267725245100,-0.955760367810783
boa and Booted eagles,RG29 1RT,51.218129324901800,-0.971848047847342
Fish eagle and Masked owl,RG29 1TD,51.217120347318200,-0.928529296410673
Prion and Marsh harrier,RG29 1UD,51.217074582986100,-0.946270618596490
Viscacha and boa constrictor,SO24 0AB,51.083131101126100,-1.134399351077340
Night heron and Mink,SO24 0AT,51.084233488492800,-1.127854203165600
Grackle and brown snake,SO24 0BD,51.068785366514500,-1.097145187744650
Asiatic leopard and moloch,SO24 0DA,51.091211539689700,-1.058283444263990
diamondback terrapin and Parakeet,SO24 0DP,51.082907594217900,-1.076954518416980
turtle and goanna,SO24 0DR,51.082892442589700,-1.078453863877580
Coati and puff adder,SO24 0EU,51.045406153216800,-1.160009183336300
Mole and blue tongue,SO24 0JY,51.049324025820600,-1.150907817395940
Magpie and Zebra,SO24 0LE,51.044978703677300,-1.145694962408290
chuckwalla and Jerboa,SO24 0LG,51.031487830311000,-1.108066350412560
Cloud rat and tiger snake,SO24 9DS,51.108354061180500,-1.160240268920140
python and Vole,SO24 9JS,51.086214640274400,-1.160184227076950
Egret and Mamo,SO24 9LY,51.088505288220400,-1.158600701938510
Grouse and Wader,SO24 9RP,51.144919595912300,-1.099006256597110
