name,postcode,lat,lon
Buzzard and mud turtle,TR1 1AT,50.267698389870300,-5.031517300953460
python and Old World warbler,TR1 1BT,50.269702874223000,-5.049441400951400
amethystine python and snake,TR1 1BW,50.271599442698300,-5.045277000000000
elapid and chameleon,TR1 1DT,50.265594571274400,-5.053445156186480
Eagle and snapping turtle,TR1 1EL,50.265504874858600,-5.049327437996080
Tattler and Stint,TR1 1EZ,50.265295894378200,-5.049749134469080
Boto and indigo snake,TR1 1FR,50.273435000000000,-5.036112000000000
cayman and Viscacha,TR1 1HE,50.266363043758800,-5.050561171389230
death adder and Bunting,TR1 1HQ,50.265634620774800,-5.047469197737260
Perching duck and bearded lizard,TR1 1HT,50.267022000000000,-5.049158000000000
elapid and blind snake,TR1 1JD,50.266681051337400,-5.046329085417540
Grosbeak and Asiatic leopard,TR1 1LH,50.266207391786300,-5.036938004434810
rat snake and Mouse,TR1 1PG,50.263794511612500,-5.037359791341720
Kangaroo and Thrasher,TR1 1RG,50.273155298249300,-5.041282462315850
mountain devil and Prion,TR1 1SA,50.271543765271100,-5.039270839081870
Mouse and green turtle,TR1 1SS,50.247806724818000,-5.022285609176280
Parakeet and Civet,TR1 1TD,50.270736313647400,-5.023682041054740
swift and Jerboa,TR1 1TH,50.260810988240900,-5.042740833183640
fer-de-lance and Partridge,TR1 1TL,50.262751649511300,-5.038023130744090
green turtle and python,TR1 1XW,50.260846076273000,-5.044833937342590
Rabbit and cayman,TR1 2BL,50.258357265363000,-5.054651846858150
Myna and mud turtle,TR1 2DG,50.258692579089400,-5.059682756499330
Recurvebill and Recurvebill,TR1 2DZ,50.260509000000000,-5.051913000000000
Minke whale and Snipe,TR1 2EH,50.261479573142500,-5.050344000000000
B and moloch,TR1 2EL,50.263191559440400,-5.050751327080770
kabaragoya and gopher snake,TR1 2GT,50.254626000000000,-5.060424000000000
Pitohui and bearded lizard,TR1 2JR,50.260199096657800,-5.059863550358520
Snipe and Petrel,TR1 2LD,50.260749617685500,-5.058088638653330
sand viper and Gull,TR1 2PZ,50.262332064620800,-5.051622557563550
flying dragon and mamba,TR1 2RW,50.263337442158600,-5.052388531046230
Mole and Puffleg,TR1 2TH,50.258553871141600,-5.065623444659890
rattlesnake and chuckwalla,TR1 2TN,50.260964000000000,-5.047023386914920
alligator and Skunk,TR1 3AA,50.265931246205300,-5.056034960548740
Civet and agama,TR1 3DW,50.263833132267400,-5.056798716597960
Shearwater and tuatara,TR1 3EA,50.273084029098200,-5.068632000000000
Marsh harrier and elapid,TR1 3HD,50.264921586101800,-5.093146183255560
Pratincole and Bronzewing pigeon,TR1 3JR,50.262206056263300,-5.087693662329370
Philippine hawk-owl and Flameback,TR1 3LT,50.263879688516300,-5.096460750495360
sand lizard and black snake,TR1 3NF,50.262129615642300,-5.095294685508830
Mole and Peafowl,TR1 3NP,50.262263310085500,-5.071629392728810
Warbler and cobra de capello,TR1 3PQ,50.263164737330400,-5.073259167613390
chuckwalla and diamond python,TR1 3PZ,50.261675015577000,-5.072784323637780
pit viper and Philippine hawk-owl,TR1 3RG,50.262421167516500,-5.076612000000000
Ibex and Tree warbler,TR1 3SN,50.267709874162800,-5.055447165633100
anaconda and Dolphin,TR1 3TS,50.266267708652300,-5.061361477218950
Puffleg and Puffleg,TR1 3TT,50.266173921913800,-5.062871160634060
Pitohui and Mink,TR1 3YE,50.255280340919400,-5.046106437204160
Crow and Old World vulture,TR1 9HS,50.255290063986100,-5.046107927330410
Fish eagle and Meadowlark,TR14 0AD,50.223175870538300,-5.286791937286370
Rabbit and Jay,TR14 0AS,50.224275348287400,-5.287358371017970
elapid and Scimitar babbler,TR14 0BL,50.225356400700800,-5.319545121293360
Solitaire and tree snake,TR14 0DP,50.222897694752300,-5.294216000000000
gaboon viper and Shearwater,TR14 0FP,50.223559000000000,-5.292056000000000
gaboon viper and Badger,TR14 0FQ,50.223917000000000,-5.292445000000000
Francolin and Dolphin,TR14 0JG,50.233976468349800,-5.327339350816960
copperhead and Songlark,TR14 0JH,50.225604750881000,-5.345673226508890
Puffleg and Linsang,TR14 0PX,50.217029613940200,-5.317214054284210
Mamo and turtle,TR14 0PY,50.217517535321800,-5.316092000000000
Diving bird and Mink,TR14 0TW,50.243315030084700,-5.305278584099840
B and whip snake,TR14 7AL,50.209094779157800,-5.292580246808330
Argus and cerastes,TR14 7BB,50.210611000000000,-5.288077963853010
black snake and flying lizard,TR14 7BD,50.210884144631100,-5.290390450783570
kabaragoya and Old World warbler,TR14 7BY,50.207557107126300,-5.291605235026890
boa and giant tortoise,TR14 7DZ,50.210813622318500,-5.303955574162510
Recurvebill and Night heron,TR14 7JD,50.217646771503000,-5.310092361489910
Wader and diamondback turtle,TR14 7JT,50.214277404818500,-5.306157792120850
Asiatic leopard and Polecat,TR14 7NQ,50.214126104232500,-5.315246032424750
Tattler and fer-de-lance,TR14 7NW,50.216329990524800,-5.315567177813610
asp and Greenbul,TR14 7PP,50.214088296727700,-5.312159102562000
ringhals and Tree warbler,TR14 7PT,50.212285208904400,-5.306931208610330
snapping turtle and Schneider python,TR14 8BD,50.214944000000000,-5.297315000000000
blind snake and smooth snake,TR14 8BH,50.215926709810700,-5.296247541870360
Prion and Meadowlark,TR14 8DP,50.215169867542200,-5.292802533114780
viper and carpet snake,TR14 8GQ,50.215760000000000,-5.285062000000000
River dolphin and loggerhead,TR14 8HL,50.213435040924600,-5.295921465262930
Siskin and Night heron,TR14 8HP,50.213979468831800,-5.293856089001710
Stint and Civet,TR14 8HR,50.213243864101500,-5.294099793104390
horned viper and Masked owl,TR14 8HX,50.212890606287000,-5.294818460096480
milk snake and bearded lizard,TR14 8HZ,50.212538455724800,-5.294864277445480
tuatara and Cuscus,TR14 8JD,50.212046058178900,-5.296680829509320
Fox and cobra de capello,TR14 8JH,50.212608292965100,-5.296523345599660
Eagle and gecko,TR14 8JR,50.213054412808800,-5.300301000000000
bushmaster and Myna,TR14 8JS,50.213862427138200,-5.299876393011150
Bronzewing pigeon and fer-de-lance,TR14 8JY,50.213345531225100,-5.300533000000000
Fulmarine petrel and soft-shelled turtle,TR14 8LS,50.219656631494500,-5.301252000000000
White ibis and Jay,TR14 8LW,50.219564398626800,-5.303410923995680
Grosbeak and hognose snake,TR14 8NL,50.223754975279100,-5.282540942938220
Scimitar babbler and Maya,TR14 8QW,50.224016956129600,-5.279319767258230
galliwasp and pit viper,TR14 8RN,50.218184807510100,-5.284822199735960
Logrunners and Ibex,TR14 8RQ,50.219741809636600,-5.284480565153180
Parrotlet and Rat,TR14 9AG,50.208507067849000,-5.281886180945140
brown snake and Kākāriki,TR14 9AT,50.210926261348900,-5.271398195535810
Viscacha and diamondback turtle,TR14 9BP,50.216128000000000,-5.276170000000000
cobra and Grouse,TR14 9DD,50.215909297264600,-5.272384237548400
horned viper and Badger,TR15 1BG,50.237999770903000,-5.236264948091010
Hawaiian honeycreeper and Puffleg,TR15 1FA,50.237212813200000,-5.230045000000000
worm lizard and thorny devil,TR15 1HB,50.241991693091900,-5.229241194273270
Myna and death adder,TR15 1HG,50.239746322103800,-5.226522408597090
Old World warbler and boa constrictor,TR15 1JS,50.234894109040400,-5.226643378391500
Partridge and Prion,TR15 1PZ,50.238079411826400,-5.220462577615700
Bronzewing pigeon and carpet snake,TR15 1RH,50.246355471293800,-5.208451063034190
deaf adder and goanna,TR15 1ST,50.241505000000000,-5.221241000000000
snake and python,TR15 1SY,50.238431531309200,-5.227405000000000
Bronzewing pigeon and Mink,TR15 2AQ,50.233997000000000,-5.225966000000000
flying dragon and Tit-tyrant,TR15 2DJ,50.239058000000000,-5.214076000000000
Guillemot and Snipe,TR15 2HZ,50.229042673819000,-5.221606224619930
sand viper and water snake,TR15 2JR,50.230005349253200,-5.218684039577160
Masked owl and flying dragon,TR15 2JS,50.234587366069200,-5.225094807253880
Stilt and Marmoset,TR15 2LB,50.227796321610600,-5.220161898505510
indigo snake and gaboon viper,TR15 2NS,50.224318256144300,-5.220039632693190
gavial and Grouse,TR15 2RH,50.229193380195800,-5.224926003123090
pit viper and Partridge,TR15 2SP,50.232104139730200,-5.228951273927630
Piping shrike and taipan,TR15 2TU,50.231400000000000,-5.232971000000000
Tit-tyrant and Zebra,TR15 3AA,50.231920161803600,-5.235881018665110
anole and Tree warbler,TR15 3BE,50.229817000000000,-5.262882000000000
brown snake and Quetzal,TR15 3BP,50.225593796006100,-5.240472615776070
Recurvebill and Francolin,TR15 3DN,50.230434717467400,-5.238178515639490
Greenbul and Lemming,TR15 3ED,50.228168672572300,-5.263519716947020
Mamo and diamond python,TR15 3EZ,50.229932000000000,-5.251404000000000
python and diamondback turtle,TR15 3FB,50.224983690881100,-5.271562408407670
boomslang and fer-de-lance,TR15 3JU,50.229377304312900,-5.255398297238390
Ibex and bearded dragon,TR15 3LT,50.233306632607600,-5.261556671555900
monitor and blindworm,TR15 3PT,50.228451000000000,-5.270158000000000
cayman and rat snake,TR15 3SX,50.226008847934100,-5.271259000000000
Pratincole and elapid,TR15 3TT,50.233029302405100,-5.265661086512510
leathery turtle and rock python,TR16 4AE,50.246340873681700,-5.233295132267260
skink and Gull,TR16 4AJ,50.250365092404800,-5.236093145756560
Fish eagle and tortoise,TR16 4AW,50.243953000000000,-5.226694000000000
saltwater crocodile and wall lizard,TR16 4AX,50.244310267537500,-5.224796764077770
anaconda and Tahr,TR16 4BG,50.249665000000000,-5.216670000000000
alligator and iguana,TR16 4BJ,50.257835350397400,-5.215242707989230
Armadillo and constrictor,TR16 4BX,50.253762682388700,-5.234645000000000
puff adder and chuckwalla,TR16 4FH,50.238479000000000,-5.260991000000000
glass snake and copperhead,TR16 4HU,50.264776000000000,-5.248396000000000
agama and Parakeet,TR16 4JF,50.246254853386700,-5.251512788107960
Flameback and Old World quail,TR16 4NQ,50.261103273583200,-5.289656735332140
python and Stilt,TR16 4RS,50.244653692634100,-5.269444288876790
cayman and hognose snake,TR16 4RT,50.244395603870800,-5.270941677807740
tortoise and swift,TR16 5BZ,50.228631000000000,-5.178490000000000
tortoise and amethystine python,TR16 5HB,50.236029453449700,-5.196662869219940
Fox and Marmoset,TR16 5HH,50.230804000000000,-5.201250000000000
chameleon and Badger,TR16 5HS,50.229774081128500,-5.169879356070810
Ground sloth and Lemming,TR16 5HW,50.231142668689200,-5.174443913909170
Maya and tree snake,TR16 5JQ,50.238820960660200,-5.171307452225700
gaboon viper and thorn lizard,TR16 5LJ,50.240344485984800,-5.183022957322720
Armadillo and Marsh harrier,TR16 5LP,50.240486000000000,-5.184463000000000
bearded dragon and Night heron,TR16 5NL,50.239647000000000,-5.191757000000000
anole and Goose,TR16 5NN,50.239174066110900,-5.192230566597260
Jerboa and Shearwater,TR16 5PT,50.240068000000000,-5.173789000000000
blind snake and Partridge,TR16 5QD,50.247522772529300,-5.175813656989710
viper and Philippine hawk-owl,TR16 5QS,50.230155000000000,-5.180030000000000
bull snake and rat snake,TR16 5SZ,50.219890561055100,-5.212373000000000
Capuchin and Fox,TR16 6EF,50.215567000000000,-5.203131000000000
iguana and boa constrictor,TR16 6GG,50.213383825485000,-5.190915096570710
Jerboa and Ice seal,TR16 6HX,50.214833789959100,-5.193436368774560
Buzzard and chameleon,TR16 6JQ,50.214346723561500,-5.192829029278470
thorn lizard and diamond python,TR16 6JR,50.215388000000000,-5.196234153019020
tree snake and Chipmunk,TR16 6LB,50.208056417378800,-5.260211915974960
Boto and puff adder,TR16 6LL,50.200811000000000,-5.240474000000000
bearded dragon and Ground sloth,TR16 6PZ,50.202366000000000,-5.238017217399870
Badger and leguaan,TR16 6RT,50.219116016238300,-5.237271172483420
racer and Macaw,TR16 6SJ,50.214317161650400,-5.249002828051270
deaf adder and gecko,TR16 6ST,50.214649467540000,-5.221266725854430
constrictor and Black jay,TR27 5BP,50.217919767219800,-5.368143236097150
Guillemot and racer,TR3 6DT,50.262051661529000,-5.109322786514130
harlequin snake and Zebra,TR3 6DZ,50.262980056413300,-5.108246580356750
gopher snake and bearded lizard,TR3 6EX,50.234231762234900,-5.066895038900020
Civet and Duck,TR3 6HB,50.230386580616900,-5.069088287858180
Parrotlet and horned toad,TR3 6HH,50.221921458865200,-5.086057124337200
Hawaiian honeycreeper and Minke whale,TR3 6JP,50.224684079133200,-5.083992027734340
Kangaroo and wall lizard,TR3 6LD,50.227195521428000,-5.098457486558500
sidewinder and Treepie,TR3 6LP,50.225637704421900,-5.088049971529660
milk snake and leathery turtle,TR3 6NL,50.206495814350800,-5.070371696095770
Treepie and glass snake,TR3 6NQ,50.208431000000000,-5.073776000000000
Francolin and moloch,TR3 6PQ,50.211569000000000,-5.095811189692420
bull snake and Pheasant,TR3 6PX,50.211244483355200,-5.090750721403570
Scimitar babbler and deaf adder,TR3 6QX,50.223563374990900,-5.059031062245460
Kangaroo and Parrotlet,TR3 6RA,50.213063000000000,-5.058135000000000
Black jay and tokay,TR3 6SE,50.208177634484800,-5.046145834313000
Partridge and Black jay,TR3 6TP,50.263239900997500,-5.117680010030900
Meadowlark and Komodo dragon,TR3 6TS,50.261809532297100,-5.117011186746310
Vulture and leguaan,TR3 6TU,50.261095970528800,-5.117118933645950
Egret and Old World vulture,TR3 6TZ,50.261616414686900,-5.119847283733770
blue tongue and Minke whale,TR3 7JR,50.204389969004600,-5.117345743393580
fer-de-lance and boa,TR3 7LD,50.215344317487700,-5.116405027008810
Gila monster and Chipmunk,TR3 7LN,50.225069309045700,-5.114711645160830
fer-de-lance and Piping shrike,TR3 7NB,50.219341204831400,-5.124334974735150
Rabbit and Thrasher,TR3 7NW,50.216486505987500,-5.109371480023030
Black jay and Petrel,TR3 7RT,50.203274352030700,-5.125345285824560
blindworm and gavial,TR4 8BZ,50.289835728593300,-5.225559110741760
harlequin snake and dugite,TR4 8DN,50.282671951118200,-5.209434368894920
sand viper and Grouse,TR4 8FL,50.256611305298500,-5.159595342527000
agama and elapid,TR4 8GG,50.261716635467300,-5.126154703315780
mud turtle and Crow,TR4 8HA,50.266342000000000,-5.174891000000000
horned viper and gecko,TR4 8HB,50.269672298238400,-5.170817780350260
deaf adder and boa constrictor,TR4 8JQ,50.283776666232800,-5.165915249296840
amethystine python and goanna,TR4 8LN,50.256648000000000,-5.157618000000000
python and box turtle,TR4 8NH,50.258227824591800,-5.156684560378720
Moluccan boobook and terrapin,TR4 8RX,50.216833688584300,-5.145565459381610
horned viper and worm lizard,TR4 8SJ,50.238083000000000,-5.140948000000000
Solitaire and Magpie,TR4 8SQ,50.218350905125700,-5.139033681657430
thorn lizard and skink,TR4 8TU,50.280269496590200,-5.203264047925010
Hawaiian honeycreeper and mamba,TR4 9AT,50.314020242331500,-5.015148368090860
diamondback terrapin and cobra de capello,TR4 9DW,50.292862771180500,-5.088738477026460
blindworm and Fulmarine petrel,TR4 9FA,50.338922000000000,-5.104279000000000
glass snake and hoop snake,TR4 9HE,50.310773039442600,-5.102584675039480
American sparrow and Prion,TR4 9LJ,50.314214199101400,-5.122547090904190
Rabbit and viper,TR4 9LX,50.312831011646100,-5.150117345127410
Gila monster and frilled lizard,TR4 9PT,50.348995667516100,-5.114693420683680
Greenbul and Eagle,TR5 0AL,50.304455000000000,-5.201842000000000
Piping shrike and flying dragon,TR5 0NG,50.306608709935200,-5.214038796340790
Kangaroo and grass snake,TR5 0PG,50.297593995374200,-5.193194000000000
lizard and sea snake,TR5 0PT,50.297283059382900,-5.180926460357120
Mamo and Snipe,TR5 0QY,50.311887454370800,-5.197157991187450
smooth snake and Songlark,TR5 0TH,50.308944022903800,-5.203099050387940
Buzzard and leathery turtle,TR5 0UD,50.310747677067600,-5.199020069324500
Grosbeak and Asiatic leopard,TR5 0XN,50.311359804489700,-5.178691707681650
boomslang and Black jay,TR5 0XP,50.322815595261200,-5.189699925235440
wall lizard and Chicken,TR5 0YP,50.303854475328900,-5.194202985035290
harlequin snake and cobra,TR6 0AD,50.354397707834900,-5.141916816587420
Peafowl and Nukupuʻu,TR6 0BY,50.347385042681400,-5.146753624038890
Thicketbird and Piping shrike,TR6 0DL,50.342067000000000,-5.146528000000000
Kestrel and goanna,TR6 0DS,50.344761413564300,-5.158571289165550
Chicken and taipan,TR6 0DU,50.346016551554000,-5.156742730661760
Diving bird and hawksbill,TR6 0DW,50.345357785965500,-5.142219410449510
Macaw and tuatara,TR6 0EB,50.337942000000000,-5.170544000000000
diamondback turtle and anole,TR6 0EX,50.342775019698300,-5.150890733415920
amethystine python and jew lizard,TR6 0FE,50.342032391900000,-5.153428916300000
dukite and sea snake,TR6 0HB,50.341075078748400,-5.153196000000000
dukite and diamondback turtle,TR6 0JH,50.336854497044300,-5.160210936018580
death adder and Booted eagles,TR6 0JN,50.345248000000000,-5.155054960626570
Perching duck and Armadillo,TR6 0JW,50.345096000000000,-5.155585000000000
frill-necked lizard and mud turtle,TR6 0NJ,50.348323375006300,-5.148643337159300
soft-shelled turtle and diamondback turtle,TR7 1AZ,50.413480073158200,-5.084545452335920
Scimitar babbler and Pheasant,TR7 1GE,50.410728467108400,-5.090631805806800
hoop snake and rock python,TR7 1LU,50.415523005155500,-5.090267416520830
Guillemot and Diving bird,TR7 1LW,50.415701732330800,-5.087604126810410
Komodo dragon and kabaragoya,TR7 1NF,50.414614416147300,-5.087899414903180
Argus and puff adder,TR7 1NY,50.411212860594500,-5.101121871780740
Buzzard and rock snake,TR7 1QA,50.412098632328200,-5.104670980904450
Dolphin and Treepie,TR7 1QG,50.410362093415800,-5.099292578259610
anole and Komodo dragon,TR7 1SJ,50.411161348787700,-5.098331210005450
Schneider python and king cobra,TR7 2BG,50.412551348901800,-5.080557432761510
Philippine hawk-owl and Hawaiian honeycreeper,TR7 2BU,50.410517756975000,-5.084115000000000
Booted eagles and Badger,TR7 2DT,50.409702529009500,-5.081470516023010
garter snake and giant tortoise,TR7 2GZ,50.401384657389000,-5.062296270567900
Kākāriki and diamond snake,TR7 2LL,50.404882126914200,-5.070206995537920
Fox and Warbler,TR7 2NE,50.415776798038000,-5.075951948398640
rock snake and Grosbeak,TR7 2NQ,50.415391000000000,-5.074556754067990
giant tortoise and carpet snake,TR7 2QB,50.413649659260200,-5.069985812228160
Komodo dragon and hawksbill,TR7 2QG,50.414718514202400,-5.071068591984780
tiger snake and python,TR7 2QX,50.414249261289100,-5.069081369093810
python and garter snake,TR7 2RD,50.414060957379900,-5.067013798020010
gecko and wall lizard,TR7 2RF,50.413949817619300,-5.065429879588560
black snake and Wallaby,TR7 2SP,50.410845178074400,-5.058303437937150
frilled lizard and Jackal,TR7 3AN,50.420080000000000,-5.064657000000000
gaboon viper and Dorcopsis,TR7 3BT,50.413072506547800,-5.059122700622510
cerastes and blue racer,TR7 3BY,50.421430820975600,-5.054620892953090
loggerhead and moloch,TR7 3BZ,50.419430000000000,-5.053457034083000
harlequin snake and Siskin,TR7 3DJ,50.418721554512700,-5.058445019991430
milk snake and Partridge,TR7 3JB,50.418824305735500,-5.049398579657520
deaf adder and Philippine hawk-owl,TR7 3JD,50.419901727028700,-5.050847638219960
Coati and Thicketbird,TR7 3LT,50.422116000000000,-5.054214264892550
Fox and Meadowlark,TR8 4FS,50.412002000000000,-5.039658000000000
tortoise and Ibex,TR8 4FY,50.413806000000000,-5.040505000000000
Herring gull and boomslang,TR8 4GH,50.413726000000000,-5.040810000000000
mountain devil and green turtle,TR8 4JU,50.413961509628600,-5.046022000000000
Ice seal and Thicketbird,TR8 4JW,50.420713000000000,-5.030554000000000
agamid and Myna,TR8 4NZ,50.406135371699500,-5.039983179878830
swift and slowworm,TR8 4PS,50.385847000000000,-5.017749000000000
dugite and Civet,TR8 4PU,50.394297775496600,-5.025139204630920
perentie and Dolphin,TR8 4QG,50.404194571274800,-5.030737000000000
hawksbill and carpet snake,TR8 4QN,50.402268410957300,-5.026843373545160
Badger and Goose,TR8 4RB,50.399028000000000,-5.058277000000000
Treepie and iguana,TR8 4RG,50.414323000000000,-5.043791000000000
River dolphin and Parrotbill,TR8 5EN,50.402884817573400,-5.094638267896600
amethystine python and anole,TR8 5FG,50.365263991453300,-5.053908366012870
green turtle and chameleon,TR8 5HG,50.383379750157200,-5.123981725449970
skink and Gila monster,TR8 5JL,50.390346000000000,-5.064427000000000
sidewinder and thorny devil,TR8 5LS,50.369052341054200,-5.045951201528470
Vulture and Scimitar babbler,TR8 5LZ,50.368689349257300,-5.053269625209810
Marmoset and Crow,TR8 5ND,50.365793000000000,-5.057149124959060
Hawaiian honeycreeper and Chipmunk,TR8 5PU,50.376744328378100,-5.126865302923620
Masked owl and Peafowl,TR8 5QA,50.361988000000000,-5.096124000000000
hognose snake and Masked owl,TR8 5QL,50.351683117246700,-5.095593664146080
thorny devil and Piping shrike,TR8 5SD,50.401978817313000,-5.127809233399900
