name,postcode,lat,lon
whip snake and carpet snake,FK21 8RE,56.433847000000000,-4.383202000000000
Minke whale and Booted eagles,FK21 8SN,56.461008573044300,-4.321938434003610
Vulture and moloch,FK21 8SS,56.464717115130600,-4.298934234183430
Pratincole and rock python,FK21 8XA,56.465760792913000,-4.321075970924420
rat snake and agama,PH15 2PU,56.568536750693100,-4.387812472849630
dugite and Eagle,PH15 2PW,56.596328612529500,-4.243800317191550
Pratincole and Black jay,PH15 2PX,56.545510292194300,-4.499838564026900
