name,postcode,lat,lon
hoop snake and Philippine hawk-owl,LL23 7AE,52.909985144343500,-3.599658668324400
agamid and Fish eagle,LL23 7BJ,52.908066000000000,-3.594725000000000
Maya and Diving bird,LL23 7BL,52.909070261936700,-3.595490886360990
Asiatic leopard and indigo snake,LL23 7DP,52.917953247680300,-3.560254362413750
Pratincole and Solitaire,LL23 7HG,52.923294747104200,-3.517828144224860
blind snake and bearded lizard,LL23 7HT,52.921552456611800,-3.512991000000000
Stint and Black cockatoo,LL23 7LY,52.911486000000000,-3.596457000000000
Condor and Vole,LL23 7NR,52.943995642713400,-3.617552281462810
rattlesnake and constrictor,LL23 7PR,52.906245631707600,-3.528771000000000
Guillemot and black snake,LL23 7PT,52.915270372155300,-3.509769050526320
Macaw and python,LL23 7SB,52.921068760107100,-3.629519557520420
skink and tokay,LL23 7SU,52.868893000000000,-3.687210548928930
boa constrictor and Wallaby,LL23 7TF,52.908467966632900,-3.598829488156230
flying dragon and agamid,LL23 7UE,52.851399291825500,-3.680699099552190
Partridge and Marsh harrier,LL23 7UL,52.821440179982500,-3.709224480897660
grass snake and Asiatic leopard,LL40 2BY,52.774002758861900,-3.794654359988150
Tree warbler and Kite,LL40 2HE,52.758331930981000,-3.896889173174480
alligator and Old World warbler,LL40 2HP,52.798593373007900,-3.891414000000000
Magpie and thorny devil,LL40 2LS,52.752915467449300,-3.864261473820210
Rabbit and Meadowlark,LL40 2ND,52.757827000000000,-3.865864000000000
Parrotlet and anaconda,LL40 2PE,52.815124667735500,-3.855526774402240
glass snake and Fulmarine petrel,LL40 2PH,52.836729632104400,-3.880068749480340
