name,postcode,lat,lon
adder and gopher snake,NE48 1BS,55.164725000000000,-2.531758000000000
racer and Polecat,NE48 1BX,55.174843273445600,-2.475118956852150
Macaw and Asiatic leopard,NE48 1DE,55.165478764929400,-2.424274653729450
asp and sidewinder,NE48 1ET,55.256093705591800,-2.540042188052520
Snipe and Minke whale,TD8 6PS,55.370922191667500,-2.513283560624850
habu and saltwater crocodile,TD9 0LX,55.248598000000000,-2.776944000000000
water snake and rat snake,TD9 0LZ,55.274817314306200,-2.768578657487350
habu and Prion,TD9 9TL,55.366994448791800,-2.687392000000000
