name,postcode,lat,lon
Armadillo and coral snake,ML10 6PB,55.665176531196500,-4.048494851360670
Guillemot and Kangaroo,ML11 0BT,55.634918727472300,-3.885864302254500
amphisbaena and cobra,ML11 0BY,55.631563171891600,-3.877887270226340
whip snake and Pitohui,ML11 0BZ,55.631870921877600,-3.878330913525560
Warbler and White ibis,ML11 0DA,55.639652534665500,-3.886600265750580
Shearwater and death adder,ML11 0DB,55.640774343913600,-3.886701874546370
Thrasher and Chickadee,ML11 0DG,55.643598320368700,-3.886567539575640
Lemming and New World blackbird,ML11 0EB,55.637554623461200,-3.888024670447940
Bunting and Ibex,ML11 0EG,55.638379407079100,-3.891655169710050
krait and leguaan,ML11 0HS,55.648368603548400,-3.890770117506320
thorn lizard and Stint,ML11 0JR,55.626263000000000,-3.878364000000000
puff adder and Warbler,ML11 0LB,55.591804974614800,-3.881970301062030
Piping shrike and gopher snake,ML11 0LR,55.593657984882300,-3.887121698990300
leathery turtle and amethystine python,ML11 0PJ,55.553269000000000,-3.846548000000000
anole and River dolphin,ML11 0PN,55.553598078909000,-3.847324997848070
Linsang and Guillemot,ML11 0RF,55.554483945829000,-3.841611378496060
rattlesnake and Perching duck,ML11 0RW,55.553935667213400,-3.861831704143450
thorny devil and anole,ML11 7ER,55.673424304731400,-3.760909933711210
Duck and Darwin's finches,ML11 7WD,55.670328648927000,-3.762331000000000
Kestrel and Diving bird,ML11 8SN,55.664575909018400,-3.668046072621140
flying dragon and Thicketbird,ML11 8SP,55.666194772772300,-3.649929000000000
Prion and Ground sloth,ML11 9BT,55.666534157072300,-3.774448934846680
thorny devil and Pheasant,ML11 9BX,55.664328262753500,-3.772870507158970
rock snake and Shearwater,ML11 9BY,55.665871457945800,-3.776151964123330
deaf adder and Jay,ML11 9FH,55.667522032749600,-3.764524364113170
thorny devil and Piping shrike,ML11 9FL,55.668017943873500,-3.765659700419890
Vulture and Capuchin,ML11 9FP,55.668716685780100,-3.766438497998670
Petrel and boa constrictor,ML11 9GB,55.674437333204900,-3.822626751514700
Goose and Ground sloth,ML11 9JT,55.672693458446600,-3.823865533679240
Magpie and tuatara,ML11 9LJ,55.610873514837000,-3.786588275252480
harlequin snake and caiman,ML11 9ND,55.597005000000000,-3.778085000000000
Mouse and Dorcopsis,ML11 9NX,55.610918844168000,-3.787177790250050
rat snake and Francolin,ML11 9PP,55.608107325900500,-3.787841000000000
Komodo dragon and Egret,ML11 9PT,55.637803312232000,-3.871210934037630
bull snake and water snake,ML11 9RP,55.666545000000000,-3.922302000000000
anaconda and tokay,ML11 9RT,55.671461460944100,-3.924530963731330
gecko and racer,ML11 9RY,55.670976547032100,-3.925652087512790
bicycle lizard and leguaan,ML11 9SB,55.667548000000000,-3.916802000000000
blue racer and Boto,ML11 9SN,55.667771754850100,-3.920263342616260
skink and Francolin,ML11 9TQ,55.651594114819800,-3.787727502541550
milk snake and skink,ML11 9WT,55.669958000000000,-3.793065000000000
whip snake and Elephant,ML11 9YU,55.669095656818500,-3.922379449750520
diamond snake and flying dragon,ML12 6HU,55.572609000000000,-3.686969000000000
Mockingbird and New World blackbird,ML12 6NG,55.620987615729600,-3.699702633415210
swift and rattlesnake,ML12 6RH,55.467792369349300,-3.670165511786510
thorny devil and Gila monster,ML12 6TA,55.468515000000000,-3.737049000000000
Scimitar babbler and boomslang,ML12 6TZ,55.472895061256700,-3.657978000000000
