name,postcode,lat,lon
coral snake and thorny devil,KA10 6AT,55.543458067584400,-4.668185000000000
Tit-tyrant and bicycle lizard,KA10 6BB,55.541744015334000,-4.674916573670280
frill-necked lizard and leathery turtle,KA10 6BT,55.543470000000000,-4.673290000000000
blindworm and Partridge,KA10 6EN,55.540129132340900,-4.657020953412460
Wallaby and Tree warbler,KA10 6JE,55.542053958114300,-4.656136285847890
fer-de-lance and Treepie,KA10 6JR,55.542772106443600,-4.657009093878840
galliwasp and Old World quail,KA10 6LY,55.544277702493900,-4.658046075892880
black snake and River dolphin,KA10 6NY,55.548723580568500,-4.656554652422740
Pratincole and Towhee,KA10 6PH,55.546790276074500,-4.648702988422180
Maya and blindworm,KA10 6PW,55.547180882333000,-4.651836800482360
pit viper and snapping turtle,KA10 6QD,55.550082781042600,-4.651905475223230
Tattler and adder,KA10 6RH,55.555127119150500,-4.654735116072970
Maya and Macaw,KA10 6SY,55.561382000000000,-4.653617217779070
leguaan and Skunk,KA10 7AB,55.548874000000000,-4.645498000000000
amphisbaena and Fish eagle,KA10 7AG,55.544005361951400,-4.632789025032540
soft-shelled turtle and Darwin's finches,KA10 7AH,55.543856883629300,-4.630496218722360
Parakeet and Kite,KA10 7EF,55.553076000000000,-4.641919089243930
Black jay and Vulture,KA10 7EH,55.555255889309900,-4.641296238346930
Solitaire and Piping shrike,KA10 9BA,55.544240000000000,-4.661812000000000
smooth snake and goanna,KA11 1BD,55.626109876304700,-4.642742526547260
Meadowlark and loggerhead,KA11 1ED,55.614683659897300,-4.619786350562340
grass snake and Condor,KA11 1EW,55.615627973187700,-4.624804623108720
cycling lizard and Mink,KA11 1JU,55.619245794493100,-4.634656187838140
Jerboa and blue tongue,KA11 1JX,55.619433246561700,-4.632206773544740
Warbler and sidewinder,KA11 1LW,55.620451131530000,-4.636706736225490
Linsang and diamondback,KA11 1QQ,55.628717913342100,-4.632654760673390
River dolphin and gavial,KA11 1RD,55.629650937577200,-4.634830458792130
tokay and Pitohui,KA11 1RF,55.625637173892300,-4.650066104817850
diamondback turtle and massasauga,KA11 1RN,55.626035128276800,-4.645374662576430
milk snake and Tahr,KA11 1RQ,55.630223405189400,-4.630356647759360
Rat and cobra,KA11 2AX,55.635681599986000,-4.632772455339640
bull snake and Linsang,KA11 2BH,55.632958440725100,-4.639024901646250
gaboon viper and Darwin's finches,KA11 2BS,55.633734658045700,-4.643049529555880
Francolin and anaconda,KA11 2EQ,55.636655532949500,-4.626338480005670
Shearwater and Old World quail,KA11 2FR,55.631327124300000,-4.653326970300000
puff adder and blue tongue,KA11 2GE,55.633549209856400,-4.650331093171790
pit viper and asp,KA11 2GN,55.635289000000000,-4.614897000000000
Pitohui and bicycle lizard,KA11 2GP,55.635283000000000,-4.614754000000000
Tree warbler and rock snake,KA11 2GS,55.635350000000000,-4.614965000000000
Night heron and Komodo dragon,KA11 4DB,55.608365500754100,-4.616379550968730
krait and bearded lizard,KA11 4DT,55.611999000000000,-4.647172000000000
alligator and Jerboa,KA11 4JL,55.607466882552300,-4.620575237862730
carpet snake and bandy-bandy,KA11 5DA,55.596572962641500,-4.639406048112500
amphisbaena and horned viper,KA12 0DA,55.613638184010900,-4.665360131518900
Ibex and Grackle,KA12 0DP,55.611862876065500,-4.660189492588890
turtle and bushmaster,KA12 0EG,55.610365588397900,-4.658769995095620
Elephant and Mole,KA12 0HZ,55.614221437556700,-4.656712349039280
Marmoset and Parrotlet,KA12 0JE,55.613468008486200,-4.658710087764180
Rat and Tree warbler,KA12 0JR,55.615913017445600,-4.648742621104940
diamond python and monitor,KA12 0LJ,55.620319646813200,-4.648642854469430
Moluccan boobook and Moluccan boobook,KA12 0NS,55.620617689590400,-4.651903382299770
fer-de-lance and krait,KA12 0PD,55.618934208051000,-4.652853863967620
moloch and Coati,KA12 0PE,55.616513096428600,-4.654659721953310
frill-necked lizard and Thrasher,KA12 0RA,55.621100601583600,-4.664453096699590
Warbler and Viscacha,KA12 0RP,55.622499000000000,-4.655954000000000
Egret and Solitaire,KA12 2BX,55.615783000000000,-4.668312000000000
diamond snake and Solitaire,KA12 2TD,55.613202753991000,-4.674208324647040
Thicketbird and perentie,KA12 8AG,55.609988581433600,-4.671972647595100
glass snake and Elephant,KA12 8DT,55.611075000000000,-4.669998000000000
Rat and Triller,KA12 8HZ,55.609536696245500,-4.672084820263220
Viscacha and goanna,KA12 8JU,55.599312782284800,-4.674893000000000
Chicken and fer-de-lance,KA12 8LL,55.600560451233800,-4.673569884569580
New World blackbird and Ibex,KA12 8NZ,55.613202753991000,-4.674208324647040
Prion and B,KA12 8PW,55.610615572799400,-4.677017657008350
krait and Francolin,KA12 8QE,55.609066852337300,-4.678373026180780
Crow and milk snake,KA12 8QH,55.607963298368600,-4.681156056046890
Recurvebill and Greenbul,KA12 8RR,55.619862340057900,-4.670960978573190
Linsang and Logrunners,KA12 9AH,55.629446816587900,-4.667545988262710
Quetzal and Grosbeak,KA12 9BQ,55.628724823459500,-4.673078000000000
gaboon viper and Jackal,KA12 9HA,55.628360000000000,-4.665470000000000
Chickadee and whip snake,KA12 9HD,55.628196105649400,-4.665951651097490
mamba and python,KA12 9LZ,55.629856064459200,-4.661123198012940
Night heron and flying dragon,KA12 9NE,55.630662214256400,-4.662909719327160
Herring gull and Egret,KA12 9NJ,55.628129643196000,-4.656176329061920
Ground sloth and agamid,KA12 9PB,55.630819522470100,-4.660632439061110
Perching duck and cayman,KA12 9PE,55.631683972171600,-4.661390169756740
constrictor and grass snake,KA13 6AQ,55.654094647657200,-4.696694813690310
Bunting and Magpie,KA13 6AW,55.653716000000000,-4.699125027365410
Badger and cobra,KA13 6BF,55.651806627994600,-4.699367149786270
Thicketbird and Polecat,KA13 6BX,55.650586835187900,-4.701286164174410
Gull and Macaw,KA13 6DB,55.649147408428800,-4.699708651483670
Masked owl and tree snake,KA13 6EW,55.653684751403800,-4.704695127490920
tree snake and Greenbul,KA13 6FE,55.652071920889200,-4.703645915383850
Marsh harrier and iguana,KA13 6HW,55.646834026965300,-4.700264668402890
flying lizard and frilled lizard,KA13 6JS,55.653709000000000,-4.706446000000000
diamond python and adder,KA13 6LL,55.652157868373500,-4.716433402962850
Hawaiian honeycreeper and glass snake,KA13 6LZ,55.649388450764300,-4.716877389687370
Siskin and tokay,KA13 6QT,55.652678752686700,-4.726580450222040
grass snake and Ground sloth,KA13 6RH,55.656374242822500,-4.718840177272470
cobra de capello and frill-necked lizard,KA13 6RT,55.654945091833800,-4.718025617925740
Buzzard and Chickadee,KA13 6TH,55.647442613416700,-4.712196435003000
diamond snake and Condor,KA13 6TX,55.649166890547500,-4.712268015116620
Marsh harrier and perentie,KA13 6UH,55.658973441145800,-4.711467850568970
Scimitar babbler and grass snake,KA13 7AH,55.657986682893400,-4.698743345943100
Pratincole and New World blackbird,KA13 7AT,55.659979602366700,-4.697226907358230
anole and tuatara,KA13 7BD,55.659323317447000,-4.696005122174100
garter snake and brown snake,KA13 7BL,55.657538991441700,-4.695802898416900
Rat and indigo snake,KA13 7BN,55.658203098052000,-4.694624284529800
cobra de capello and boa,KA13 7EP,55.660140947387100,-4.698064844146150
New World blackbird and python,KA13 7GA,55.654422427602100,-4.705618000000000
Philippine hawk-owl and cycling lizard,KA13 7JY,55.655155811799700,-4.681505174220260
turtle and mountain devil,KA13 7LX,55.654214963465600,-4.692855719451150
Komodo dragon and Recurvebill,KA13 7PL,55.646367000000000,-4.688391000000000
anaconda and Cuscus,KA2 9DJ,55.579260559386500,-4.602859036721990
Nukupuʻu and diamondback terrapin,KA20 3BY,55.642832101718400,-4.752899454720820
Triller and Fox,KA20 3DT,55.640764319206600,-4.764499301698770
Francolin and Myna,KA20 3EE,55.640944476584600,-4.760221000000000
elapid and Fox,KA20 3JN,55.639854956331000,-4.760175956978170
gecko and mountain devil,KA20 4AU,55.643026829244300,-4.768156220931930
Egret and cerastes,KA20 4AW,55.643827046945000,-4.762617144724190
mountain devil and frill-necked lizard,KA20 4BX,55.649759185106900,-4.747440440389770
blindworm and hawksbill,KA20 4DF,55.643358265899700,-4.750282075176750
skink and Grosbeak,KA20 4EZ,55.643651835547000,-4.746408584625400
chuckwalla and rat snake,KA20 4HJ,55.645729413436500,-4.742341907138920
Polecat and Philippine hawk-owl,KA20 4HP,55.647553493825200,-4.741166024685670
Lemming and dukite,KA20 4LA,55.655307689190400,-4.750945498105780
Boto and Asiatic leopard,KA21 5AN,55.640742636594600,-4.795584817621110
B and blind snake,KA21 5BT,55.638353392323600,-4.796685911547580
brown snake and Masked owl,KA21 5HR,55.632492453399600,-4.784446034123530
Prion and leathery turtle,KA21 5JJ,55.634263366017200,-4.784047337579170
caiman and New World blackbird,KA21 5JW,55.635878887886100,-4.782970150044790
Moluccan boobook and copperhead,KA21 5LH,55.636549693616800,-4.784702238225380
Kākāriki and sand viper,KA21 5RA,55.640932000000000,-4.779387000000000
amphisbaena and bearded lizard,KA21 5TB,55.640453444999400,-4.792496831927720
Boto and Snipe,KA21 6AB,55.647276768631400,-4.786147525180980
coral snake and hognose snake,KA21 6AH,55.646132629279400,-4.786654360862910
Pratincole and amethystine python,KA21 6BD,55.645181508079500,-4.788160377502780
Flameback and Magpie,KA21 6BW,55.645337724442200,-4.784054662797060
perentie and thorn lizard,KA21 6BZ,55.646432159192500,-4.793637888695520
Crow and boa constrictor,KA21 6FF,55.651406000000000,-4.778890000000000
sand viper and Ice seal,KA21 6GF,55.652629173190000,-4.786766374043800
Jay and soft-shelled turtle,KA21 6HA,55.648266174966100,-4.785725045662240
Parrotbill and chameleon,KA21 6HJ,55.648122260205700,-4.793631134628190
Buzzard and copperhead,KA21 6LR,55.642654681217700,-4.777506612902120
mountain devil and rattlesnake,KA21 6LT,55.644139798051800,-4.777818425533830
Komodo dragon and Parrotlet,KA21 6LU,55.644876809678400,-4.777425576624010
elapid and indigo snake,KA21 6LW,55.644126000000000,-4.778130695321460
brown snake and sidewinder,KA21 6NQ,55.669478237123300,-4.741936349944150
giant tortoise and Kestrel,KA22 7DB,55.651533161921900,-4.800153746170840
bandy-bandy and massasauga,KA22 7DJ,55.652351082770300,-4.804091276227970
bushmaster and jew lizard,KA22 7EL,55.652908341480500,-4.802127960103520
leathery turtle and snake,KA22 7ER,55.653459592120900,-4.801213456940530
hoop snake and wall lizard,KA22 7HE,55.653799121965900,-4.807199688880010
brown snake and Boto,KA22 7HP,55.655270239389200,-4.809689921407820
cycling lizard and Badger,KA22 7HY,55.656093623670500,-4.806314641177130
wall lizard and bearded lizard,KA22 7JH,55.655772810240900,-4.803048197580600
terrapin and Marmoset,KA22 7JL,55.655224747142800,-4.801069309740700
hognose snake and caiman,KA22 7LQ,55.653946320939500,-4.815399000000000
Wallaby and carpet snake,KA22 8AW,55.645414494681600,-4.802387199406820
Prion and Marsh harrier,KA22 8BD,55.644365651434500,-4.803440774190520
Coati and Fulmarine petrel,KA22 8BZ,55.638513806195600,-4.817945491007300
worm lizard and Parrotbill,KA22 8EH,55.641394379710300,-4.813463844242830
Asiatic leopard and Kangaroo,KA22 8HB,55.640485290304300,-4.813907214514570
Bronzewing pigeon and Tit-tyrant,KA22 8LS,55.649009372906900,-4.813803592851490
horned viper and loggerhead,KA22 8NB,55.648651147990800,-4.812569747578790
bearded lizard and Coati,KA22 8NG,55.650408837982000,-4.815493757462100
mamba and sand viper,KA22 8PW,55.638935781213500,-4.810919489284420
Schneider python and worm lizard,KA7 1DA,55.462894323128100,-4.633437603487950
Masked owl and Prion,KA7 1HB,55.466733981894400,-4.637127153146080
racer and Dorcopsis,KA7 1LE,55.463296000000000,-4.632768000000000
bandy-bandy and Macaw,KA7 1LP,55.463353795904800,-4.631300776051680
Meadowlark and pit viper,KA7 1NP,55.462202767487500,-4.632157484590420
iguana and brown snake,KA7 1TF,55.458443000000000,-4.627251662600780
Vulture and Capuchin,KA7 1TN,55.460045000000000,-4.626746000000000
goanna and Jay,KA7 1TP,55.459956364075500,-4.626709000000000
frill-necked lizard and Mockingbird,KA7 2DF,55.458352323456700,-4.634811541670450
Minke whale and king cobra,KA7 2DJ,55.457153162521700,-4.632470000000000
diamondback and Masked owl,KA7 2DQ,55.456506251666000,-4.635384389240640
Philippine hawk-owl and Diving bird,KA7 2SP,55.450888254752200,-4.631624976329360
snapping turtle and death adder,KA7 2UT,55.456277800727500,-4.636808596348080
Towhee and dukite,KA7 2XG,55.453731715484200,-4.637745829672990
Old World quail and tree snake,KA7 2XW,55.452030352778400,-4.642440423469420
sea snake and Jay,KA7 3DA,55.454279861613900,-4.617251582368670
perentie and Marsh harrier,KA7 3DL,55.452429523730900,-4.619707077926480
Condor and Songlark,KA7 3DT,55.454084962929900,-4.609124468078060
Old World warbler and Darwin's finches,KA7 3EF,55.450306473674800,-4.613904286262880
thorn lizard and Meadowlark,KA7 3HR,55.451055080057700,-4.606204015038680
lizard and flying dragon,KA7 3JY,55.451983863683100,-4.603956114189320
agamid and Chipmunk,KA7 4ZW,55.462653672355800,-4.633662000000000
box turtle and boa,KA7 9EQ,55.462703000000000,-4.633641000000000
dukite and bearded dragon,KA7 9TP,55.461471144969000,-4.638579185321610
anole and cycling lizard,KA7 9TR,55.461471144969000,-4.638579185321610
wall lizard and Booted eagles,KA8 0DG,55.465626740860000,-4.622987566796430
Kite and Chicken,KA8 0EH,55.463049578610000,-4.620348327659730
Bronzewing pigeon and Greenbul,KA8 0EY,55.462281197696800,-4.620550466392190
Petrel and amphisbaena,KA8 0HJ,55.460901818936300,-4.611916183802100
diamondback terrapin and monitor,KA8 0JU,55.469123547454500,-4.604469423010320
Chipmunk and Komodo dragon,KA8 0SB,55.461572020098200,-4.606201982918120
Snipe and diamond snake,KA8 8AE,55.471568803767800,-4.635931014653800
Shearwater and massasauga,KA8 8DN,55.471932185437000,-4.628232975729630
Francolin and hoop snake,KA8 8JH,55.473591509757000,-4.625051855951650
Komodo dragon and frill-necked lizard,KA8 8LU,55.478115793260500,-4.623659318414770
puff adder and Cuscus,KA8 8PG,55.482206645004300,-4.619420206919250
milk snake and Chickadee,KA8 9BY,55.479434870031700,-4.617890895835180
Dorcopsis and Parrotbill,KA8 9EB,55.481197147573700,-4.611138443444830
smooth snake and taipan,KA8 9EF,55.483405415470600,-4.615906621843470
racer and gavial,KA8 9NU,55.471838284700400,-4.605880000000000
gavial and Cuscus,KA8 9PQ,55.471095643018700,-4.610450000000000
Tahr and hognose snake,KA8 9PS,55.475372736295300,-4.608173517327450
brown snake and diamond snake,KA8 9PW,55.469365830995600,-4.612919204721860
gaboon viper and thorny devil,KA8 9QL,55.472975649617100,-4.608458216310360
Coati and Greenbul,KA8 9RH,55.472419478138700,-4.600382634891900
River dolphin and gaboon viper,KA9 1BE,55.505068946416500,-4.610406979831690
giant tortoise and Warbler,KA9 1EN,55.504848818712200,-4.604706742081680
Grouse and blind snake,KA9 1HW,55.500418580949100,-4.609291490215690
thorn lizard and Jerboa,KA9 1JS,55.499429137243800,-4.610587856784440
Greenbul and Marsh harrier,KA9 1LL,55.496408049248400,-4.611892112219400
Chickadee and Black jay,KA9 1LS,55.498158998805700,-4.607764349290000
Logrunners and Partridge,KA9 1NL,55.494322798642600,-4.608822000000000
bandy-bandy and Hawaiian honeycreeper,KA9 1PZ,55.494823849326000,-4.614098888416360
Tattler and diamondback turtle,KA9 1RZ,55.491559000000000,-4.617130772970980
tiger snake and blue racer,KA9 1WH,55.501643397490300,-4.611288725887010
New World blackbird and brown snake,KA9 2BX,55.490320465441600,-4.608623483277730
Moluccan boobook and glass snake,KA9 2DL,55.490867286091900,-4.614169146947440
rat snake and Nukupuʻu,KA9 2DZ,55.487354227492300,-4.606511855199770
Partridge and Asiatic leopard,KA9 2ED,55.487779027816900,-4.605558422541470
wall lizard and horned toad,KA9 2EZ,55.494099297763900,-4.601700983068270
Petrel and Kākāriki,KA9 2HA,55.493466393117500,-4.602720039301660
diamondback and Maya,KA9 2HT,55.486141644240600,-4.603628000000000
anole and swift,KA9 2LQ,55.485539804417900,-4.607294278900930
Mouse and Parrotlet,KA9 2LR,55.484298521526500,-4.606911496221030
