name,postcode,lat,lon
ringhals and Jackal,CH1 1DA,53.189888408003100,-2.887597000000000
asp and Mink,CH1 1PW,53.188754643646100,-2.892930556328510
blue tongue and Old World vulture,CH1 1QS,53.186807437994500,-2.888864355802970
Kestrel and Schneider python,CH1 1RA,53.186072052127500,-2.889836854947420
Bronzewing pigeon and Linsang,CH1 1SB,53.186849000000000,-2.888354304436110
Maya and terrapin,CH1 2HT,53.192865537347400,-2.892551998357930
racer and American sparrow,CH1 2LQ,53.189782137536300,-2.896857000000000
caiman and snapping turtle,CH1 2NF,53.192172347861500,-2.896279457058810
River dolphin and Parakeet,CH1 3AA,53.197725970162900,-2.884630000000000
goanna and Puffleg,CH1 3EQ,53.194452962114900,-2.890639109623460
Black jay and glass snake,CH1 3HB,53.196587941117200,-2.888827222834780
copperhead and Songlark,CH1 3LG,53.192105685212500,-2.885965519305250
alligator and Diving bird,CH1 3LY,53.192550315911500,-2.885405921157500
Hawaiian honeycreeper and Grackle,CH1 4AP,53.204753433288700,-2.895583823035900
python and carpet snake,CH1 4AW,53.202588232996400,-2.897814273098210
Grosbeak and Darwin's finches,CH1 4BB,53.203726553887500,-2.897059554665880
Peafowl and bushmaster,CH1 4BE,53.208776344461700,-2.906837763796010
Pitohui and Bunting,CH1 4DR,53.196183047119700,-2.893683715644060
worm lizard and brown snake,CH1 4DS,53.195093000000000,-2.892972000000000
Mouse and Old World warbler,CH1 4JZ,53.194302039808400,-2.901023000000000
skink and Bronzewing pigeon,CH1 4PS,53.195486907172300,-2.904925619972990
anole and Snipe,CH1 5BG,53.205773574501500,-2.913946032472720
Grouse and Moluccan boobook,CH1 5GB,53.208355086365900,-2.925380542537510
Kākāriki and Jerboa,CH1 5HF,53.211969572600000,-2.929890865505230
Petrel and Condor,CH1 5HX,53.209815754144900,-2.935174830706420
Armadillo and sidewinder,CH1 5LZ,53.199774362824500,-2.923713617785090
massasauga and Asiatic leopard,CH1 5NE,53.198237232806100,-2.929683000000000
diamond python and diamondback terrapin,CH1 5NG,53.199679530568100,-2.932424173060130
Darwin's finches and Marmoset,CH1 5PS,53.202720333977100,-2.928657575561660
Wader and Dorcopsis,CH1 5PY,53.199963100601200,-2.929496170634590
loggerhead and Eagle,CH1 5RP,53.199844000000000,-2.935523629444750
galliwasp and chuckwalla,CH1 5UL,53.208494700230100,-2.909586873797450
whip snake and Quetzal,CH1 5WA,53.209620000000000,-2.914275341374160
green turtle and Lemming,CH1 5XH,53.210182053639600,-2.919295656066340
Chickadee and Booted eagles,CH1 6AH,53.223697958824900,-2.951833834779890
Vole and Herring gull,CH1 6BS,53.202223000000000,-2.948513000000000
horned viper and Grouse,CH1 6BY,53.209382816764400,-2.970203405615910
Fish eagle and horned toad,CH1 6DA,53.221371263540900,-2.953894085713040
Ice seal and snake,CH1 6FA,53.228428000000000,-2.956298000000000
gavial and cobra de capello,CH1 6HF,53.254397108559700,-2.957296938001430
moloch and Gull,CH1 6HZ,53.239590695662300,-2.995475891516720
Viscacha and Cloud rat,CH1 6JP,53.229431425045200,-2.955406541759250
sea snake and Gull,CH1 6LG,53.235875619920000,-2.922453209466830
slowworm and Gila monster,CH1 6LP,53.241063000000000,-2.920137000000000
River dolphin and Masked owl,CH1 6LT,53.246292000000000,-2.932045367673170
hoop snake and tree snake,CH1 6NE,53.219893819191000,-2.924655794750750
blindworm and Goose,CH1 6QL,53.239531000000000,-2.901824000000000
Bunting and iguana,CH1 6QQ,53.186344969148100,-2.944286763679820
Chipmunk and saltwater crocodile,CH1 9AG,53.197786000000000,-2.884632000000000
hognose snake and Dolphin,CH1 9TA,53.191749482411600,-2.892738354508050
Gila monster and Zebra,CH1 9XU,53.197731682562900,-2.884630000000000
copperhead and Logrunners,CH1 9YL,53.197731682562900,-2.884630000000000
Hawaiian honeycreeper and habu,CH1 9ZN,53.197731682562900,-2.884630000000000
Black jay and tiger snake,CH1 9ZU,53.197786000000000,-2.884632000000000
moloch and Peafowl,CH1 9ZZ,53.191749482411600,-2.892738354508050
Dorcopsis and amethystine python,CH2 1AX,53.211182375159600,-2.895358547986500
Parakeet and habu,CH2 1BT,53.210873468702800,-2.889796768691030
python and crocodile,CH2 1DL,53.217375589048900,-2.888194310455160
chuckwalla and Prion,CH2 1DT,53.215000000000000,-2.902971000000000
dukite and Songlark,CH2 1HN,53.220141607649500,-2.877632733463160
Pratincole and Komodo dragon,CH2 1JL,53.220764240267700,-2.878529131623220
Fish eagle and Cloud rat,CH2 1LN,53.224955954299800,-2.875709050134000
anaconda and boa constrictor,CH2 1NN,53.213634136451500,-2.872647823245670
taipan and hawksbill,CH2 1PA,53.208329784845900,-2.877645824167130
Skunk and flying lizard,CH2 1QR,53.212802435550200,-2.879399440083940
frilled lizard and tiger snake,CH2 1RJ,53.217905060886100,-2.879833460731600
perentie and cayman,CH2 1SB,53.211373000000000,-2.874638000000000
Kite and milk snake,CH2 1SN,53.214198598271200,-2.874126856729190
amphisbaena and agamid,CH2 1SP,53.213724932566000,-2.876198726955130
Prion and Solitaire,CH2 1TA,53.211938409544700,-2.877105646445670
tiger snake and rattlesnake,CH2 2AJ,53.204003000000000,-2.892664000000000
boa and dukite,CH2 2BF,53.203055677671300,-2.889425185136870
sidewinder and dukite,CH2 2BJ,53.197462903087700,-2.893231326339980
tiger snake and diamond snake,CH2 2EA,53.199549000000000,-2.888424000000000
Wader and cycling lizard,CH2 2EF,53.202737050874900,-2.881498869089910
Myna and Badger,CH2 2EP,53.204521191318000,-2.883347070957070
Old World warbler and Pitohui,CH2 2FH,53.209090000000000,-2.868498000000000
saltwater crocodile and garter snake,CH2 2HD,53.204039500620000,-2.875536981412990
Philippine hawk-owl and Bunting,CH2 2HR,53.208840427211900,-2.883959992759620
taipan and habu,CH2 2LB,53.205682838023700,-2.875765124875670
Cuscus and Mink,CH2 2PG,53.211251145441100,-2.866609761761590
Meadowlark and bull snake,CH2 2PR,53.210864720374700,-2.867829823399790
diamond python and frilled lizard,CH2 2PX,53.210085578778600,-2.869895412370770
brown snake and tree snake,CH2 2RB,53.200914430706100,-2.893617000000000
Towhee and Badger,CH2 3BB,53.199649410974300,-2.874773837489740
Rabbit and iguana,CH2 3BU,53.198816000000000,-2.878170000000000
diamondback terrapin and Warbler,CH2 3DL,53.197822150515100,-2.870200901042720
galliwasp and Argus,CH2 3HB,53.197396877571500,-2.866884085690190
Night heron and crocodile,CH2 3JR,53.202823981147400,-2.864732991876350
Songlark and diamond python,CH2 3PL,53.199749225589600,-2.881961499545760
gavial and loggerhead,CH2 3PZ,53.203657090377700,-2.866366679417410
alligator and iguana,CH2 3QR,53.201434758364300,-2.878912158458290
diamond snake and hoop snake,CH2 3QW,53.200612000000000,-2.878446000000000
cerastes and cerastes,CH2 3SA,53.207317176029500,-2.862442820096930
sidewinder and Fish eagle,CH2 4AS,53.221176454761900,-2.898277000000000
copperhead and Philippine hawk-owl,CH2 4BZ,53.242291846431000,-2.868900234306290
Hawk and puff adder,CH2 4DT,53.224338258191300,-2.832722816641510
Badger and harlequin snake,CH2 4EJ,53.221832387968300,-2.828555322932410
blue racer and flying lizard,CH2 4HB,53.223326000000000,-2.856474000000000
rock python and Wader,CH2 4HD,53.223506982996900,-2.854904536853490
Chickadee and Bunting,CH2 4HF,53.247008274347900,-2.859374454095070
grass snake and Eagle,CH2 4QD,53.270632473702300,-2.811790062335030
mountain devil and bushmaster,CH2 4QE,53.269912415732500,-2.810606847656600
Gull and blue racer,CH2 4QW,53.224273368213100,-2.826550391033160
Zebra and Eagle,CH2 4RA,53.268838565273300,-2.873546946769390
Black cockatoo and cayman,CH2 4RP,53.273611416680300,-2.809942053190100
Magpie and bull snake,CH3 5DP,53.191354046628200,-2.868408537748310
coral snake and Wallaby,CH3 5NP,53.193794583712100,-2.851603941543980
worm lizard and snake,CH3 5PQ,53.191546431729300,-2.850466775251530
Siskin and Vole,CH3 5QL,53.185117373909200,-2.848199550186690
agamid and deaf adder,CH3 5QP,53.189066580704300,-2.855326639857000
anole and giant tortoise,CH3 5QR,53.187340101200600,-2.850383520725250
Pitohui and frill-necked lizard,CH3 5RE,53.178918732306800,-2.857698291898630
rat snake and anole,CH3 5RR,53.187508391114800,-2.860743165030530
whip snake and Thicketbird,CH3 5SB,53.186643845004900,-2.857223926504970
tortoise and green turtle,CH3 5SQ,53.183341383366800,-2.861437849571750
hognose snake and Vole,CH3 5TF,53.189325360542800,-2.866781095053990
bearded lizard and Ice seal,CH3 5UR,53.190058160694900,-2.868606845694720
Viscacha and Night heron,CH3 5XL,53.181304486478700,-2.863417112097200
Ice seal and crocodile,CH3 5XZ,53.183176890762900,-2.863050693650870
Vole and Wallaby,CH3 6AT,53.175209000000000,-2.830858000000000
goanna and tree snake,CH3 6BB,53.172946389611100,-2.859434267079700
crocodile and Diving bird,CH3 6DF,53.173346288829300,-2.865037618958960
loggerhead and swift,CH3 6EE,53.161983650244900,-2.847578731869680
Pratincole and rattlesnake,CH3 6EZ,53.137826960634400,-2.836400000000000
Meadowlark and Dolphin,CH3 6FG,53.170912310436800,-2.855579175944150
frill-necked lizard and Kākāriki,CH3 6FR,53.172319000000000,-2.852676000000000
Scimitar babbler and Schneider python,CH3 6GU,53.152942000000000,-2.831835000000000
Rabbit and Herring gull,CH3 6NJ,53.082531942315400,-2.870635183297810
agama and leguaan,CH3 6PH,53.073924683287300,-2.863849117573100
Fulmarine petrel and Coati,CH3 6PX,53.085022930415200,-2.876627690451070
Gila monster and rattlesnake,CH3 6QA,53.082667552445800,-2.871757625170970
Logrunners and Marsh harrier,CH3 6QN,53.085942000000000,-2.880097693163780
asp and coral snake,CH3 6QU,53.084881618078600,-2.877505698258730
agama and copperhead,CH3 7AE,53.180217429432800,-2.834608000000000
agamid and box turtle,CH3 7AR,53.184422629161700,-2.834567977531260
sand viper and Pratincole,CH3 7DN,53.192704096340700,-2.836779400043450
Maya and skink,CH3 7DX,53.186646000000000,-2.846675000000000
River dolphin and Thrasher,CH3 7EL,53.204446838607000,-2.823458860286050
Pheasant and horned toad,CH3 7EX,53.207227000000000,-2.842497000000000
Hawaiian honeycreeper and jew lizard,CH3 7LB,53.221703000000000,-2.788128000000000
Stilt and Rat,CH3 7NY,53.173220137888400,-2.814078660679430
chameleon and Stint,CH3 7SS,53.205810565164100,-2.831599899427360
wall lizard and Chickadee,CH3 8AP,53.237232490467500,-2.736572271022670
puff adder and bull snake,CH3 8AT,53.228471009095200,-2.744795629922200
Wader and whip snake,CH3 8AW,53.236648219885500,-2.733896000000000
B and Mouse,CH3 8BB,53.225253720493700,-2.747540823645190
grass snake and Stint,CH3 8DH,53.217940775904300,-2.741123419463120
Pitohui and krait,CH3 8DS,53.190855782346200,-2.762088967015540
hawksbill and soft-shelled turtle,CH3 8EA,53.199716142737300,-2.761676964973340
whip snake and Skunk,CH3 8EN,53.202759000000000,-2.798140000000000
hawksbill and galliwasp,CH3 8EQ,53.196083773892600,-2.777105126513490
Goose and rock snake,CH3 8JD,53.202502429201700,-2.758911853191220
Macaw and Puffleg,CH3 8JU,53.193130000000000,-2.716508000000000
Tree warbler and Ice seal,CH3 8LL,53.195435851748000,-2.764714501971630
python and leathery turtle,CH3 9AT,53.160194782964000,-2.814086368448510
taipan and alligator,CH3 9BQ,53.147899189536300,-2.730706169005170
death adder and Chicken,CH3 9DR,53.128520000000000,-2.807121000000000
Perching duck and Pheasant,CH3 9FA,53.084532848127300,-2.798100832280590
box turtle and Triller,CH3 9HJ,53.114243900185600,-2.777495710074620
Pitohui and Myna,CH3 9HN,53.094867604600900,-2.757284676275250
thorny devil and Linsang,CH3 9JS,53.079446716984900,-2.777465536908430
Greenbul and bushmaster,CH3 9JY,53.081580121156600,-2.750408018824660
wall lizard and ringhals,CH3 9LR,53.092777000000000,-2.817666000000000
bushmaster and Pheasant,CH3 9NL,53.121609509316800,-2.740301617735360
Crow and king snake,CH3 9PZ,53.119479693596600,-2.771344434479330
Skunk and Mockingbird,CH3 9QE,53.121374365527400,-2.768882932855710
monitor and Flameback,CH3 9QQ,53.125501557965400,-2.764518209617430
worm lizard and Thicketbird,CH4 0AH,53.178256969850900,-2.937166408615170
racer and tokay,CH4 0BN,53.177770704615200,-2.945235546336760
Kākāriki and milk snake,CH4 0BP,53.180850815815300,-2.946769711687760
Duck and Herring gull,CH4 0DB,53.171376568686700,-2.947727000000000
Mouse and Myna,CH4 0EZ,53.143670424913300,-3.044671038013510
Hawaiian honeycreeper and thorn lizard,CH4 0FX,53.168918000000000,-2.978251000000000
sand viper and boa,CH4 0GA,53.146137237650900,-3.043220805289870
diamondback terrapin and tuatara,CH4 0GF,53.147888413995300,-3.046492937429110
Skunk and sand viper,CH4 0LU,53.152127000000000,-3.037624000000000
brown snake and snake,CH4 0NE,53.151648096347100,-3.040094547681530
taipan and Cloud rat,CH4 0QB,53.168531625586900,-2.982759776498410
Triller and cayman,CH4 0RB,53.162037257684800,-2.994083447018880
rattlesnake and gopher snake,CH4 0RG,53.165460912016100,-2.988837444253460
Old World vulture and elapid,CH4 0SD,53.158918517504900,-3.013214875976990
Tree warbler and Gila monster,CH4 0SJ,53.162858577020600,-2.983946388531070
Tit-tyrant and Petrel,CH4 0SU,53.164675515612500,-2.984900394681110
sand viper and death adder,CH4 0SY,53.164569598471900,-2.985750571739210
dukite and Parakeet,CH4 7AS,53.185910930000800,-2.878849027082650
Asiatic leopard and Nukupuʻu,CH4 7AZ,53.186777017702100,-2.877205565178290
bearded lizard and B,CH4 7BJ,53.176601931218600,-2.880768339581070
Recurvebill and Grosbeak,CH4 7DH,53.182986512581300,-2.885313626444320
massasauga and Goose,CH4 7EB,53.179753000000000,-2.882331000000000
king snake and Tree warbler,CH4 7ER,53.179470933478500,-2.889041818410710
Mole and Marsh harrier,CH4 7HR,53.181539245949500,-2.888934964240960
Flameback and Bronzewing pigeon,CH4 7LZ,53.167966727386000,-2.916059290634670
Duck and mud turtle,CH4 7NB,53.166490529647900,-2.919812351719890
blindworm and blindworm,CH4 7PE,53.171951043531500,-2.914618216563410
mud turtle and Kangaroo,CH4 7PR,53.168906176592600,-2.911950520205410
sand lizard and cobra,CH4 7PT,53.169040705283400,-2.910816458407640
chuckwalla and bicycle lizard,CH4 7QL,53.168145000000000,-2.899945907304200
terrapin and jew lizard,CH4 7RB,53.173632000000000,-2.901724456192210
Civet and Civet,CH4 8AB,53.180793288051300,-2.904436664548780
Fish eagle and perentie,CH4 8AH,53.181674000000000,-2.909261417909230
cycling lizard and Songlark,CH4 8DF,53.176456700447400,-2.917856096399350
Nukupuʻu and Tree warbler,CH4 8DT,53.171876983723900,-2.917234710981800
Old World warbler and Marsh harrier,CH4 8EN,53.170694746748200,-2.916670930789180
Treepie and gaboon viper,CH4 8HF,53.174504008629800,-2.911096776626360
bushmaster and death adder,CH4 8HZ,53.174132654918500,-2.914978813613070
Towhee and amphisbaena,CH4 8LD,53.179590487017400,-2.913628609455010
wall lizard and bearded dragon,CH4 8NY,53.174742923103900,-2.917445471245520
cobra de capello and Ice seal,CH4 8PH,53.170831926873600,-2.925664840633360
rat snake and kabaragoya,CH4 8QD,53.175850518688500,-2.921852912392710
diamondback turtle and anole,CH4 8RW,53.177953000000000,-2.934811000000000
diamondback turtle and Marmoset,CH4 8SY,53.172584933504700,-2.930265584193560
skink and constrictor,CH4 9AD,53.158561000000000,-2.927884000000000
massasauga and Coati,CH4 9AN,53.134220028528300,-3.016938400009770
Chickadee and Chicken,CH4 9AS,53.144940297230600,-3.004707481415260
adder and Armadillo,CH4 9AW,53.135391000000000,-3.011465000000000
king cobra and kabaragoya,CH4 9BQ,53.151511714592400,-3.004681480452510
hoop snake and dugite,CH4 9BY,53.146937092535400,-3.002436564804620
perentie and Old World warbler,CH4 9BZ,53.144013000000000,-2.993159000000000
snapping turtle and death adder,CH4 9DW,53.124147667566900,-2.932955006534790
bearded lizard and rock snake,CH4 9EZ,53.123966000000000,-2.934535000000000
blind snake and boa,CH4 9QJ,53.161679834460300,-2.901192892519410
diamondback and skink,CH4 9QU,53.160009000000000,-2.902429000000000
Crow and Guillemot,CH5 1AE,53.208501051790900,-3.034896000000000
dukite and Black cockatoo,CH5 1AL,53.208152382406200,-3.039351523732270
Civet and Mouse,CH5 1BE,53.208670351640400,-3.040771558522160
Black cockatoo and gaboon viper,CH5 1DF,53.212202548388300,-3.039808963376660
Piping shrike and sidewinder,CH5 1HQ,53.212846694945800,-3.044272089056430
Buzzard and Duck,CH5 1JW,53.211887915350800,-3.041867823042370
Mole and bearded dragon,CH5 1LF,53.205535395252700,-3.036383561411370
Triller and giant tortoise,CH5 1LW,53.203548006195800,-3.035437305242760
Scimitar babbler and blue tongue,CH5 1TJ,53.201436230253800,-3.035356450689060
Grosbeak and slowworm,CH5 2BE,53.193682867829100,-3.019213559475830
snake and Magpie,CH5 2BY,53.190839094492300,-3.018532446595470
king snake and Hawk,CH5 2DS,53.201990675455100,-3.014799633590890
boomslang and blue racer,CH5 2EF,53.196556006111700,-3.015404727017350
diamondback terrapin and viper,CH5 2ER,53.195413800820500,-3.017578129970790
puff adder and Guillemot,CH5 2LT,53.221516289062200,-2.998725768424760
Herring gull and leathery turtle,CH5 2ND,53.223685144100900,-2.987647183400930
Parrotbill and grass snake,CH5 2PW,53.200934833034900,-2.993591641736340
kabaragoya and deaf adder,CH5 2QU,53.197729497830500,-2.995657743318630
Nukupuʻu and sidewinder,CH5 2SG,53.210342730515200,-2.998720391563190
cobra and Hawk,CH5 2TA,53.210462606740100,-3.017485542684470
Fox and moloch,CH5 3AG,53.196708729932400,-3.042472624864230
hoop snake and Peafowl,CH5 3AW,53.193504982791600,-3.052079239513590
krait and Black jay,CH5 3BN,53.190510309277600,-3.058307042132820
Tree warbler and pit viper,CH5 3FA,53.180144000000000,-3.011859000000000
Condor and Bronzewing pigeon,CH5 3HH,53.193830900659200,-3.028138104407450
Komodo dragon and Meadowlark,CH5 3HX,53.194461817347700,-3.024815250751400
Perching duck and Lemming,CH5 3JH,53.188006133872900,-3.045658804038250
Chipmunk and Cuscus,CH5 3LT,53.185252983503600,-3.026301663367420
blue tongue and Old World warbler,CH5 3NH,53.189211150119900,-3.046631024457540
sea snake and leguaan,CH5 3NX,53.184659000000000,-3.024473892286940
elapid and Polecat,CH5 3PL,53.181548929822100,-2.990255012260540
American sparrow and bandy-bandy,CH5 3PU,53.179789168187600,-2.994314398830680
python and adder,CH5 3PW,53.178480228006300,-2.994972408833890
Vole and king snake,CH5 3QJ,53.185141659088100,-3.033976130951880
Old World warbler and Parrotbill,CH5 3QL,53.185256779121300,-3.033140849427620
diamondback turtle and tortoise,CH5 3RA,53.191172579295900,-3.048474878441890
Bronzewing pigeon and chameleon,CH5 3RB,53.192567070021100,-3.048344264304120
Linsang and viper,CH5 3SG,53.185784329045200,-3.046846869056990
Solitaire and blindworm,CH5 3SJ,53.187043918524100,-3.047745573268530
Armadillo and lizard,CH5 3SP,53.180360627315100,-2.993699153828380
viper and water snake,CH5 3TG,53.183742525522800,-3.056150070165710
black snake and Old World quail,CH5 3XN,53.186319067176800,-3.057545332499450
Egret and Bunting,CH5 4AF,53.220445762805300,-3.062220283799900
Coati and ringhals,CH5 4AH,53.221372000000000,-3.066347000000000
Herring gull and Partridge,CH5 4BT,53.210432902140400,-3.050936702437210
Tahr and Black cockatoo,CH5 4DW,53.219846109647800,-3.058895460664400
habu and Fulmarine petrel,CH5 4FF,53.205997455513500,-3.078183258476020
tortoise and gavial,CH5 4FP,53.205794993789900,-3.078702209849190
Recurvebill and chuckwalla,CH5 4GH,53.204029094709700,-3.078477784684850
tree snake and Maya,CH5 4HJ,53.210806407206600,-3.051395068933490
boa and blindworm,CH5 4HL,53.208831923990700,-3.055105053829690
grass snake and black snake,CH5 4HU,53.209706314981500,-3.055845281103460
puff adder and crocodile,CH5 4JG,53.219925623044900,-3.074114391147190
Moluccan boobook and flying lizard,CH5 4JU,53.205730066687500,-3.066273089869510
Darwin's finches and Myna,CH5 4JX,53.211335665838800,-3.063672000283080
Perching duck and Boto,CH5 4LF,53.208207418711000,-3.063669371308710
River dolphin and cerastes,CH5 4LR,53.209871501666000,-3.062542638316480
anole and moloch,CH5 4NA,53.211026121478900,-3.069129924201280
Triller and harlequin snake,CH5 4NY,53.214057965186800,-3.052702674527040
Argus and Goose,CH5 4PG,53.212587217698400,-3.057383658557780
American sparrow and harlequin snake,CH5 4RD,53.214463779456100,-3.060664570103330
mountain devil and Cuscus,CH5 4RR,53.211921564795700,-3.076504726101410
Jay and Armadillo,CH5 4SJ,53.215065580265300,-3.061727733554700
death adder and massasauga,CH5 4SP,53.216975602405700,-3.062254218523370
brown snake and Ice seal,CH5 4SY,53.214324925659900,-3.063132075602820
Songlark and Grouse,CH5 4TA,53.213986837038600,-3.066762690442790
bicycle lizard and Greenbul,CH5 4TJ,53.214164839125500,-3.067965139549060
Rat and amethystine python,CH5 4TU,53.212511289096700,-3.069915646760390
gopher snake and skink,CH5 4UR,53.222338025275300,-3.066745591885670
krait and American sparrow,CH5 4WN,53.216223056694400,-3.047753780428870
Goose and cobra,CH5 4WP,53.220078060970500,-3.077143640332450
horned toad and Kākāriki,CH5 4XB,53.221835007113900,-3.067706658666330
puff adder and boa,CH5 4XD,53.223329668588800,-3.070439979441710
Mockingbird and sea snake,CH5 4XW,53.215890665218000,-3.066974737337020
python and Boto,CH5 4YF,53.223810999947400,-3.072893512937060
bicycle lizard and mountain devil,CH5 9ES,53.208675000000000,-3.017188000000000
Armadillo and cerastes,CH64 5SG,53.253488146702900,-3.013949846365770
dukite and blindworm,CH64 5SL,53.264549299722600,-2.992052152260150
cobra and anole,CH64 8TJ,53.272756000000000,-3.018919000000000
flying dragon and saltwater crocodile,CH65 4LQ,53.272514000000000,-2.871057000000000
dugite and blue tongue,CH65 5DD,53.273583603997700,-2.889357000000000
garter snake and Schneider python,CH65 6PG,53.267741444158000,-2.906121131767650
krait and diamond snake,CH65 6ST,53.266815153493800,-2.912068960470220
chameleon and king snake,CH65 6TS,53.265500559884000,-2.906463561532880
skink and Parrotlet,CH65 7AH,53.272800269413200,-2.914625678988820
moloch and Grackle,CH65 7AW,53.272666776247000,-2.920291154609180
Fox and cycling lizard,CH65 9DE,53.268415176525300,-2.895474601640090
adder and Pitohui,CH65 9DP,53.269857859479700,-2.888877161863690
thorny devil and rock python,CH65 9EP,53.265999747736900,-2.891525885402210
diamondback terrapin and bicycle lizard,CH65 9HE,53.266983761455700,-2.887348166658500
Towhee and snake,CH65 9JH,53.261579564172700,-2.897310000000000
king cobra and horned viper,CH65 9JR,53.266623026728100,-2.881298000000000
Badger and iguana,CH65 9JS,53.260006835537200,-2.897142809090530
Gila monster and Kestrel,CH65 9JZ,53.260701891410900,-2.897951901627160
bull snake and frilled lizard,CH65 9LJ,53.261537405294200,-2.898014383616770
puff adder and king snake,CH65 9LL,53.262157215154100,-2.898072347696420
tree snake and Stilt,CH66 0NB,53.265954213505800,-2.963237578025500
Bronzewing pigeon and Pratincole,CH66 2BG,53.263465698473600,-2.922132496512830
Triller and lizard,CH66 2BL,53.265451377660900,-2.922250194977090
amethystine python and Dorcopsis,CH66 2EZ,53.268522813617000,-2.942153555301300
Tahr and Linsang,CH66 2JD,53.265822155355000,-2.912617563404160
massasauga and Grouse,CH66 2LJ,53.262902000000000,-2.910149264409800
Shearwater and agama,CH66 2LS,53.272526735925200,-2.937113137001670
Eagle and Bunting,CH66 2LT,53.263926365674100,-2.932247371434310
Civet and slowworm,CH66 2QP,53.273184447123600,-2.926570503714320
indigo snake and Civet,CH66 2RS,53.264433624385100,-2.923667588695200
cobra de capello and thorny devil,CH66 2RW,53.262072801440400,-2.930918126448440
Stilt and Tree warbler,CH66 2SX,53.269084702956500,-2.935868287543290
leathery turtle and Warbler,CH66 2TD,53.261428898265900,-2.925131972680790
alligator and Linsang,CH66 2WG,53.257064120131400,-2.928095744244820
whip snake and blue racer,CH66 2XX,53.259868549677500,-2.920001315895310
leguaan and flying dragon,CH66 2YU,53.259761422016900,-2.918739767307800
galliwasp and Philippine hawk-owl,CH66 3LE,53.274640091980200,-2.927801693516910
turtle and Nukupuʻu,CH66 4LS,53.273080928551600,-2.941085000000000
Meadowlark and mamba,CH66 4QZ,53.272601546452500,-2.928702260562390
Herring gull and hognose snake,CH66 4RP,53.273875078371000,-2.930229472573590
Kākāriki and death adder,CH66 4UG,53.265722775685000,-2.926769000000000
boa constrictor and Condor,CH7 2AF,53.165422876199300,-3.069177573836930
Prion and copperhead,CH7 2AT,53.163342652890400,-3.073583232689910
Skunk and Meadowlark,CH7 2BG,53.164173970428500,-3.077089180705120
giant tortoise and viper,CH7 2EG,53.167067000000000,-3.077386000000000
rat snake and Marmoset,CH7 2EW,53.168359000000000,-3.074681000000000
blue tongue and Jay,CH7 2HD,53.168836902013900,-3.077370532306470
galliwasp and Perching duck,CH7 2HY,53.167814433347200,-3.082072020591620
Capuchin and copperhead,CH7 3AG,53.165038000000000,-3.056020000000000
Chicken and hognose snake,CH7 3AQ,53.166275975919600,-3.065264660696090
amethystine python and leathery turtle,CH7 3BT,53.164466000000000,-3.069707000000000
Kākāriki and Tattler,CH7 3DZ,53.173355371200500,-3.062717143571900
Wallaby and mud turtle,CH7 3ET,53.174820915060900,-3.064698380619680
copperhead and amphisbaena,CH7 3FA,53.171520322508500,-3.051377045745020
Herring gull and Armadillo,CH7 3FG,53.175398000000000,-3.075380000000000
Grosbeak and alligator,CH7 3JQ,53.170410970708800,-3.070288969782220
snake and blue tongue,CH7 3LW,53.180676784746400,-3.070290202063870
taipan and wall lizard,CH7 3NE,53.174289271220100,-3.078823771987960
bearded lizard and Wallaby,CH7 3PP,53.177743417753300,-3.079568815817450
Grosbeak and Jackal,CH7 3PY,53.177351000000000,-3.087295000000000
Buzzard and Wallaby,CH7 3QH,53.176644111188000,-3.074887944161080
Argus and Greenbul,CH7 4HB,53.154997245646000,-3.061919648494480
Hawaiian honeycreeper and Coati,CH70 8AN,53.192479000000000,-2.922165000000000
Songlark and Maya,CH70 8AY,53.192744534230700,-2.922589565664520
Hawaiian honeycreeper and Eagle,CH70 8BJ,53.192744534230700,-2.922589565664520
Philippine hawk-owl and Ibex,CH70 8BQ,53.192744534230700,-2.922589565664520
horned viper and krait,CH99 9NB,53.159265890377100,-2.894681328343930
constrictor and grass snake,CH99 9WB,53.163536835542100,-2.902877127156650
