name,postcode,lat,lon
Fish eagle and brown snake,LN1 1AF,53.245374150652300,-0.554507024416955
Zebra and bearded dragon,LN1 1AL,53.246010424220500,-0.556568782477087
lizard and constrictor,LN1 1BH,53.233190865283900,-0.560835643037134
Fulmarine petrel and Duck,LN1 1DG,53.241463037527000,-0.558909666214893
Lemming and blue racer,LN1 1HA,53.224063806419600,-0.545233448501515
blind snake and Armadillo,LN1 1HU,53.232415248978700,-0.543766752057381
worm lizard and Macaw,LN1 1JE,53.233630335055100,-0.544743000000000
Shearwater and Siskin,LN1 1JP,53.234566967185200,-0.545341957143888
asp and cayman,LN1 1NW,53.231567114348500,-0.543058000000000
diamondback turtle and gecko,LN1 1PH,53.232097455668200,-0.550144973877172
Mouse and American sparrow,LN1 1PL,53.232130358096600,-0.551372403636391
gavial and American sparrow,LN1 1SD,53.234182819930100,-0.557536012161774
Elephant and Lemming,LN1 1UX,53.229546397679400,-0.542201167097751
Fox and habu,LN1 1WY,53.224063806419600,-0.545233448501515
Asiatic leopard and Snipe,LN1 2GG,53.248961000000000,-0.595064000000000
Puffleg and bearded lizard,LN1 2LG,53.271493183886900,-0.746322148527298
Parrotlet and Philippine hawk-owl,LN1 2LU,53.265565000000000,-0.667074000000000
Jay and Stint,LN1 2QX,53.273478257048200,-0.744148000000000
thorny devil and Petrel,LN1 2RG,53.262480558654600,-0.559642519796760
Lemming and cycling lizard,LN1 2RJ,53.274423084886000,-0.574972926964792
tree snake and bull snake,LN1 2WB,53.266345568293400,-0.652655817617040
Mole and cobra de capello,LN1 2WH,53.267529385109600,-0.652408682922983
Mamo and racer,LN1 2ZL,53.250673000000000,-0.600404000000000
turtle and cycling lizard,LN1 3DQ,53.238169187056900,-0.538671587948303
cobra de capello and crocodile,LN1 3JA,53.239959703013000,-0.544679510948064
leguaan and Perching duck,LN1 3JP,53.241350082715200,-0.545906107707129
Egret and Hawaiian honeycreeper,LN1 3JW,53.238735696177700,-0.546773910115216
Old World quail and grass snake,LN1 3LG,53.236895116024800,-0.545487699825419
diamondback turtle and elapid,LN1 3PA,53.251940399638200,-0.545951744904865
Bronzewing pigeon and Cloud rat,LN1 3QN,53.251746420617300,-0.552913250221895
Dolphin and anaconda,LN1 3QU,53.252026158528600,-0.549514000000000
blue racer and Tattler,LN1 3RB,53.252645196397300,-0.548461053552248
Capuchin and carpet snake,LN1 3SU,53.251352214024300,-0.540485734846674
sidewinder and diamondback terrapin,LN1 3TA,53.250870085548100,-0.542225852646567
blue racer and Greenbul,LN1 3TH,53.248636265938000,-0.542601540322586
diamond snake and Chicken,LN1 3TN,53.252834134099100,-0.538906371818605
sand viper and thorn lizard,LN1 3UD,53.244485497875700,-0.547957884828423
Mink and blue tongue,LN1 3UH,53.244239912642300,-0.548460750773311
Fulmarine petrel and agamid,LN1 3XF,53.248381000000000,-0.546721471533491
indigo snake and tiger snake,LN2 1AP,53.228765736158300,-0.539636000000000
Quetzal and puff adder,LN2 1JZ,53.230489720324400,-0.537749535457423
black snake and Towhee,LN2 1PH,53.233632016224900,-0.533027771134006
dukite and Jerboa,LN2 1QH,53.237018022421900,-0.536433235257069
swift and tree snake,LN2 1RX,53.243605878354900,-0.526092753236481
monitor and Prion,LN2 2BB,53.253702085216300,-0.529073480307931
Ground sloth and Masked owl,LN2 2BE,53.253442268607000,-0.527688350379603
Thrasher and Mamo,LN2 2EA,53.247910211981500,-0.533243880409218
fer-de-lance and Rat,LN2 2FD,53.271829000000000,-0.445012000000000
Cuscus and indigo snake,LN2 2FJ,53.269643000000000,-0.487081000000000
gavial and frill-necked lizard,LN2 2FP,53.253771000000000,-0.537167000000000
goanna and Ground sloth,LN2 2JF,53.251919607387100,-0.525956916734332
massasauga and dugite,LN2 2NJ,53.267421795335700,-0.493200348811488
Condor and amethystine python,LN2 2PT,53.264024095983100,-0.499647033821278
rock snake and New World blackbird,LN2 2QP,53.266086590297100,-0.450048894941701
crocodile and Crow,LN2 2RR,53.264937802515200,-0.475999812276233
rock snake and rock snake,LN2 2RY,53.263234857683500,-0.484156698470402
Triller and Vulture,LN2 2SB,53.264125506084700,-0.485624553755933
Fish eagle and Schneider python,LN2 2TL,53.265885000000000,-0.480344155959266
Crow and bearded dragon,LN2 2YH,53.270945640759600,-0.446259118058859
worm lizard and racer,LN2 4AW,53.235196505565300,-0.530861637979083
Thicketbird and death adder,LN2 4BS,53.238261000000000,-0.527026000000000
Booted eagles and Maya,LN2 4DX,53.242377228382800,-0.526329783611617
lizard and Kākāriki,LN2 4FJ,53.241294172306100,-0.506843000000000
Treepie and boomslang,LN2 4FN,53.241683580364200,-0.507426782093333
Darwin's finches and Kestrel,LN2 4FX,53.242851379795100,-0.493778813788272
turtle and Gila monster,LN2 4HE,53.246229857703800,-0.521656302206232
mamba and Vole,LN2 4LB,53.237024788656700,-0.514180000000000
lizard and Siskin,LN2 4ND,53.245652533681800,-0.516430751454787
Francolin and Bunting,LN2 4NS,53.246136121915500,-0.515559756263632
cobra and Scimitar babbler,LN2 4NZ,53.243858000000000,-0.504685000000000
Snipe and Kestrel,LN2 4PW,53.240535529001700,-0.521343035337128
Flameback and anole,LN2 4RY,53.239474897958200,-0.520630348864658
Logrunners and Badger,LN2 4SA,53.249044871054200,-0.501594992424086
skink and horned toad,LN2 4SG,53.247695496551100,-0.504384891764882
boa and leathery turtle,LN2 4UN,53.253936128850400,-0.524733377248725
tokay and blindworm,LN2 4US,53.234810806356000,-0.511366711898410
rock python and Scimitar babbler,LN2 5BQ,53.229870049289500,-0.530489661775322
brown snake and Skunk,LN2 5BT,53.227943546400000,-0.525746872700000
Goose and Badger,LN2 5EW,53.229188349985400,-0.524790173671564
Lemming and goanna,LN2 5LD,53.230203425784800,-0.515316876540473
glass snake and mud turtle,LN2 5LU,53.229879023356300,-0.522188000000000
frilled lizard and Skunk,LN2 5NL,53.231196961987500,-0.517515000000000
mamba and amethystine python,LN2 5QG,53.233787728255600,-0.507911195142459
coral snake and copperhead,LN2 5RW,53.233943000000000,-0.531159000000000
mud turtle and Eagle,LN2 5RZ,53.234538565307900,-0.531453521458694
Cloud rat and Viscacha,LN2 5TA,53.233428645969100,-0.525288664520629
Warbler and Badger,LN3 4AR,53.235084415741500,-0.462106895642442
Ibex and Nukupuʻu,LN3 4AY,53.235639195155400,-0.463300683554570
mountain devil and Old World vulture,LN3 4AZ,53.235916290937600,-0.463875123937322
Kestrel and Komodo dragon,LN3 4DQ,53.252101957975900,-0.444783497599691
caiman and smooth snake,LN3 4GA,53.248510697220300,-0.446517461196403
Stint and Hawk,LN3 4GR,53.242858162801300,-0.473112759318236
massasauga and bushmaster,LN3 4HB,53.236925744794200,-0.432312466953783
thorn lizard and diamondback terrapin,LN3 4LS,53.246463057612500,-0.454280170671600
python and worm lizard,LN3 4PH,53.232967288989400,-0.500496000000000
Buzzard and galliwasp,LN3 4PQ,53.238971000000000,-0.453321926059776
carpet snake and Night heron,LN3 5BD,53.273505519533100,-0.410623593046255
Stint and diamondback terrapin,LN3 5DE,53.273968446107100,-0.406242258174463
leathery turtle and flying dragon,LN4 1BG,53.222250709940300,-0.474582000000000
soft-shelled turtle and Perching duck,LN4 1BL,53.222514309091700,-0.473102478679536
blind snake and tokay,LN4 1DS,53.220017094465800,-0.467649383429696
Crow and Tattler,LN4 1EF,53.220604644431900,-0.516083000000000
Darwin's finches and Darwin's finches,LN4 1EU,53.222350446736000,-0.483503688234549
boomslang and sand lizard,LN4 1FN,53.190207000000000,-0.463772000000000
asp and Myna,LN4 1FQ,53.223555000000000,-0.484510000000000
harlequin snake and dugite,LN4 1FY,53.190342000000000,-0.463737000000000
wall lizard and Asiatic leopard,LN4 1GE,53.213463477989600,-0.455108836170051
Myna and tokay,LN4 1GJ,53.212473975455100,-0.462707074566117
cobra and gavial,LN4 1GQ,53.210223501820400,-0.456213719433166
Night heron and elapid,LN4 1HG,53.222531169078500,-0.482164173962106
gecko and kabaragoya,LN4 1HJ,53.220812105056700,-0.479065000000000
Fox and Songlark,LN4 1HY,53.186651798424700,-0.441139000000000
hawksbill and boa,LN4 1JW,53.210492226682200,-0.451816000000000
Old World warbler and Maya,LN4 1NB,53.193519781852700,-0.471498349005762
Mole and Dolphin,LN4 1NG,53.197839007974400,-0.471120146433161
Minke whale and Old World vulture,LN4 1PQ,53.194927002317300,-0.473978120162498
king snake and king snake,LN4 1QB,53.198541596562600,-0.478251110683257
Partridge and lizard,LN4 1QQ,53.207532000000000,-0.466938071311272
Crow and Perching duck,LN4 1RU,53.218143785804000,-0.463193039532290
Jay and hognose snake,LN4 1SW,53.219822000000000,-0.456617000000000
moloch and Wader,LN4 1TB,53.219935498826900,-0.462709516672628
Armadillo and dukite,LN4 2AL,53.134744983128700,-0.477157868058903
Guillemot and River dolphin,LN4 2AU,53.196772000000000,-0.397341000000000
diamondback and Magpie,LN4 2DH,53.188145556265700,-0.528758507640419
Wader and turtle,LN4 2FF,53.192624000000000,-0.526629000000000
Jackal and skink,LN4 2HD,53.155537071072300,-0.396902518622655
Wader and Dorcopsis,LN4 2HX,53.170279882921000,-0.482647318740392
whip snake and Bunting,LN4 2JT,53.196877453276800,-0.539956469246615
Fish eagle and viper,LN4 2JU,53.197227715570700,-0.538462532302049
terrapin and White ibis,LN4 2NF,53.192149152887700,-0.529744078440973
bearded dragon and Masked owl,LN4 2NS,53.191286063768100,-0.531195564265101
Jackal and boa,LN4 2QZ,53.190806494741900,-0.528757228458288
Prion and chuckwalla,LN4 2RG,53.216017502811800,-0.523984666004735
gecko and Darwin's finches,LN4 2RN,53.213689150628000,-0.524708656156633
moloch and Solitaire,LN4 2SY,53.189485196302400,-0.528772521932239
Bronzewing pigeon and gavial,LN4 2TB,53.198083265162200,-0.526906249395305
Bronzewing pigeon and Eagle,LN4 3BZ,53.111828000000000,-0.409178000000000
glass snake and Coati,LN4 3EB,53.140202000000000,-0.404336000000000
Old World quail and Chipmunk,LN4 3EP,53.142875961972100,-0.407376503396666
hognose snake and frilled lizard,LN4 3HJ,53.138803345394800,-0.393730000000000
dukite and Capuchin,LN4 3JF,53.092595766408100,-0.423630036075782
amphisbaena and Francolin,LN4 3LR,53.093740141996100,-0.380965539702326
Logrunners and Fulmarine petrel,LN4 3PB,53.108006237483600,-0.401107000000000
perentie and gopher snake,LN4 3PG,53.107084175085100,-0.369319887572108
Warbler and milk snake,LN4 3QD,53.059380759357600,-0.397609297143834
Armadillo and Komodo dragon,LN4 3TF,53.131719069039600,-0.340853774240808
blindworm and Egret,LN4 3UQ,53.140857397039200,-0.411727069587912
Jay and anole,LN4 3XD,53.142744094815800,-0.404241596654648
constrictor and bushmaster,LN4 3YY,53.139860000000000,-0.403942000000000
fer-de-lance and flying dragon,LN5 0AL,53.132534223168100,-0.541854540528973
mountain devil and rattlesnake,LN5 0EH,53.109716000000000,-0.527747000000000
Pitohui and mountain devil,LN5 0LQ,53.121697351288300,-0.529817948556069
Grosbeak and Parakeet,LN5 0PF,53.062554611286400,-0.575766511974853
Elephant and copperhead,LN5 0QY,53.066894808491600,-0.625292729734027
Logrunners and Quetzal,LN5 0RS,53.072512759900400,-0.692238466709538
flying lizard and Petrel,LN5 0SU,53.076926675670500,-0.636169305661084
Vole and Partridge,LN5 0SW,53.076333829544400,-0.633902000000000
kabaragoya and amethystine python,LN5 0TL,53.104427820267000,-0.527628458170875
Maya and thorn lizard,LN5 0TW,53.103901241019200,-0.520685497469007
boa constrictor and gaboon viper,LN5 5QT,53.224065750400000,-0.545233469700000
cayman and Guillemot,LN5 5RF,53.224065000000000,-0.545233000000000
Mouse and Komodo dragon,LN5 5RL,53.224087000000000,-0.545234000000000
boomslang and Grackle,LN5 5SF,53.231529978549800,-0.545624597248923
Scimitar babbler and habu,LN5 5TY,53.224087000000000,-0.545234000000000
Kangaroo and Badger,LN5 7BP,53.224446000000000,-0.544037000000000
blue tongue and Grouse,LN5 7DP,53.227361737879900,-0.540911000000000
Mockingbird and cayman,LN5 7EQ,53.226892270360300,-0.539927000000000
Crow and death adder,LN5 7JD,53.227127000000000,-0.531018000000000
Night heron and iguana,LN5 7JN,53.226227000000000,-0.525851000000000
Bronzewing pigeon and Prion,LN5 7LF,53.223862342256900,-0.537482000000000
monitor and amphisbaena,LN5 7NJ,53.221976426989800,-0.539207859678826
Argus and cobra,LN5 7PS,53.224610000000000,-0.542024000000000
crocodile and coral snake,LN5 7QH,53.220899297693000,-0.545220854048137
amphisbaena and Shearwater,LN5 7QL,53.221170221616700,-0.547533324533081
mamba and Snipe,LN5 7TH,53.221684113713000,-0.540296264210109
sand viper and Marmoset,LN5 7WR,53.224063806419600,-0.545233448501515
Tattler and thorn lizard,LN5 7XT,53.219426231300500,-0.537242669719874
Snipe and terrapin,LN5 8AU,53.217854818294000,-0.546941549587624
Masked owl and Vulture,LN5 8BJ,53.217218910498600,-0.548610540529773
Marmoset and Meadowlark,LN5 8DR,53.213416394108000,-0.548619252555209
Piping shrike and indigo snake,LN5 8EQ,53.215972358991600,-0.549596198870139
Macaw and viper,LN5 8HF,53.222412384438200,-0.534444731476406
moloch and puff adder,LN5 8LA,53.218051199064900,-0.543145645050052
Chicken and frilled lizard,LN5 8NA,53.211234754585200,-0.549591475791055
Maya and Meadowlark,LN5 8PG,53.209690000000000,-0.546747203832242
Snipe and racer,LN5 8QW,53.203645070981600,-0.550459000000000
bull snake and Recurvebill,LN5 8RL,53.200626033273000,-0.553213361155525
loggerhead and Stilt,LN5 8SA,53.196345973633100,-0.553132924420580
Booted eagles and gaboon viper,LN5 8SH,53.198173483258800,-0.552607306190812
rock snake and glass snake,LN5 8SN,53.198225960386800,-0.553967842813140
snapping turtle and Fulmarine petrel,LN5 8TG,53.192200412123700,-0.556730162849931
rock python and python,LN5 9AU,53.189454811991300,-0.558648370041807
Kangaroo and sidewinder,LN5 9BY,53.180886847894800,-0.555613532914839
Black cockatoo and soft-shelled turtle,LN5 9DJ,53.185928962481300,-0.557748899517552
Komodo dragon and alligator,LN5 9HU,53.110460686696700,-0.648195776940697
Viscacha and bicycle lizard,LN5 9LZ,53.172235182463000,-0.537636309851368
alligator and snapping turtle,LN6 0BW,53.215871773151500,-0.614432771077553
Skunk and black snake,LN6 0DB,53.213585129787100,-0.580541768586318
python and caiman,LN6 0DF,53.212756376106700,-0.581153201347593
hawksbill and smooth snake,LN6 0DL,53.210337514995500,-0.581098339258848
Viscacha and Mockingbird,LN6 0FS,53.210855875044400,-0.604441759826656
alligator and Booted eagles,LN6 0LD,53.218687959958900,-0.597731939347745
chameleon and rat snake,LN6 0LT,53.217148444012100,-0.613672686347684
rat snake and Goose,LN6 0LY,53.220061736701400,-0.600652697427977
diamondback terrapin and diamondback turtle,LN6 0NZ,53.209886995198500,-0.608456417048048
chameleon and Bunting,LN6 0RL,53.210896003685900,-0.592565509031129
gopher snake and constrictor,LN6 0RT,53.215635691276200,-0.591227033585048
Philippine hawk-owl and Coati,LN6 0XY,53.223716300749700,-0.599529967765089
Skunk and leathery turtle,LN6 3DF,53.201943079038900,-0.588067904331836
Chipmunk and Vulture,LN6 3LL,53.208631033253000,-0.594885816727483
fer-de-lance and Fish eagle,LN6 3NX,53.206529200957900,-0.608056106112215
Parrotlet and Solitaire,LN6 3PJ,53.210937494076300,-0.598374345513646
Stint and Skunk,LN6 3PT,53.209935632357000,-0.597268987243829
Polecat and boomslang,LN6 3PY,53.210943747203700,-0.601968075679057
king cobra and Eagle,LN6 3QZ,53.200662000000000,-0.615971000000000
Linsang and River dolphin,LN6 3YS,53.214575295026800,-0.595829502219508
hognose snake and boomslang,LN6 4AE,53.231165000000000,-0.625370000000000
Marmoset and Towhee,LN6 4RJ,53.230319947864200,-0.622355994164887
fer-de-lance and puff adder,LN6 5AX,53.230939252077700,-0.614515682123397
Maya and crocodile,LN6 5RB,53.234032292213600,-0.622326715862129
Bronzewing pigeon and indigo snake,LN6 5TR,53.236527093780600,-0.619624483989947
cobra de capello and Songlark,LN6 5TS,53.238102553128000,-0.618375000000000
loggerhead and Nukupuʻu,LN6 7AA,53.222974053789800,-0.549494461814864
Solitaire and caiman,LN6 7AL,53.221060973375300,-0.553333641007145
Cuscus and Logrunners,LN6 7DB,53.225924051606400,-0.551087522568591
blindworm and Skunk,LN6 7DD,53.217723000000000,-0.550031000000000
coral snake and caiman,LN6 7DW,53.228766269100000,-0.556235024600000
Mamo and tiger snake,LN6 7EJ,53.220202002579700,-0.551445394973218
American sparrow and Towhee,LN6 7EL,53.229515887900000,-0.558007562600000
Elephant and Prion,LN6 7FN,53.227569450044300,-0.554073044589354
Gila monster and adder,LN6 7GG,53.230216716953700,-0.551466959636440
hoop snake and Chickadee,LN6 7HQ,53.200888512850900,-0.582533256840342
skink and constrictor,LN6 7LH,53.201459977463800,-0.573920785660118
diamond snake and bandy-bandy,LN6 7NF,53.207697792081700,-0.572336120448342
massasauga and harlequin snake,LN6 7RW,53.208568222924800,-0.568458883254193
indigo snake and Tit-tyrant,LN6 7SY,53.212280302785800,-0.561686136560974
Parakeet and Triller,LN6 7TD,53.213457153739400,-0.562365553406877
Wallaby and Parrotbill,LN6 7TH,53.215925544377000,-0.555363752412964
Chipmunk and sidewinder,LN6 7TT,53.217060764886800,-0.553348602404787
soft-shelled turtle and Old World warbler,LN6 7UB,53.218584367939500,-0.556161000000000
Ice seal and harlequin snake,LN6 7UW,53.215174653574100,-0.558535000000000
Herring gull and Gull,LN6 7XN,53.218434085793100,-0.550964000000000
Schneider python and tree snake,LN6 8AH,53.199088457348700,-0.566438000000000
Ibex and Pheasant,LN6 8AS,53.196696749304200,-0.569661000000000
White ibis and Philippine hawk-owl,LN6 8EA,53.188988843512800,-0.581997746720754
Parrotlet and massasauga,LN6 8HA,53.188071725461000,-0.578211470070643
mountain devil and worm lizard,LN6 8HR,53.194708706544600,-0.577677544883295
jew lizard and Piping shrike,LN6 8JD,53.192628728994800,-0.575890302694982
Warbler and milk snake,LN6 8NW,53.184526922523500,-0.589313421016842
puff adder and Badger,LN6 8PG,53.185796539079400,-0.584183323048827
tiger snake and puff adder,LN6 8PQ,53.186378125276000,-0.585466226756429
diamondback and Pitohui,LN6 8RP,53.201921360120800,-0.556717000000000
Puffleg and gopher snake,LN6 8SF,53.198408283000000,-0.574905414100000
sand viper and death adder,LN6 8SJ,53.199242856831100,-0.586270333038641
slowworm and grass snake,LN6 8UD,53.189037301885200,-0.573255343811161
pit viper and tokay,LN6 9BG,53.178900492168600,-0.644147000000000
Wader and box turtle,LN6 9BL,53.181494751826200,-0.639482000000000
Thicketbird and diamondback,LN6 9BN,53.180707000000000,-0.641888000000000
Ibex and Duck,LN6 9BY,53.197941000000000,-0.627032000000000
blue racer and Rabbit,LN6 9DP,53.202931936196200,-0.672536689711146
terrapin and Maya,LN6 9DY,53.185489729231800,-0.668286303804730
Viscacha and black snake,LN6 9EF,53.194252080930600,-0.728129247608096
Meadowlark and grass snake,LN6 9EJ,53.196002304935300,-0.689711058969621
cayman and cycling lizard,LN6 9EL,53.198909779991300,-0.704159000000000
Hawk and tree snake,LN6 9EW,53.194491434666100,-0.726131317418545
green turtle and snapping turtle,LN6 9FL,53.147735047326500,-0.666822863246781
Gila monster and Masked owl,LN6 9NT,53.178600384986400,-0.621365037156971
boomslang and brown snake,LN6 9NY,53.179046887411600,-0.619555092596387
crocodile and Civet,LN6 9PR,53.181154076439500,-0.592085000000000
amethystine python and horned toad,LN6 9PU,53.157744598953000,-0.657584002486895
Thicketbird and Armadillo,LN6 9RX,53.187891479088300,-0.599425261708491
River dolphin and Francolin,LN6 9UD,53.148485654731300,-0.668025752269550
krait and leguaan,LN6 9UL,53.176864000000000,-0.617211875215078
Old World quail and Old World warbler,LN6 9YB,53.179240000000000,-0.588365000000000
Boto and Nukupuʻu,LN6 9YE,53.180061000000000,-0.614374000000000
Dolphin and milk snake,NG23 7BA,53.239106000000000,-0.744691000000000
Fox and Moluccan boobook,NG23 7BZ,53.253473629691000,-0.727197956598612
Komodo dragon and cycling lizard,NG23 7JR,53.172471429286400,-0.742958000000000
Partridge and king snake,NG23 7JW,53.167582389341100,-0.728334463310019
Maya and Civet,NG24 2SB,53.061862751152400,-0.717410000000000
python and mountain devil,NG34 8RL,53.052811190318900,-0.468768445193252
