name,postcode,lat,lon
puff adder and hawksbill,CW10 9JP,53.219287000000000,-2.493688000000000
Armadillo and flying lizard,CW10 9LJ,53.203408870803200,-2.426944346278230
anaconda and Buzzard,CW12 2LE,53.201784393100600,-2.299380726492220
Kangaroo and Partridge,CW4 7AQ,53.201509000000000,-2.357226004278060
Ice seal and Chipmunk,CW4 7BW,53.200643822836200,-2.351617880373470
tuatara and Grackle,CW4 7JX,53.200218609413200,-2.370311693709640
flying dragon and Towhee,CW4 8BQ,53.214138000000000,-2.329326000000000
bushmaster and tuatara,CW4 8EY,53.215735140619900,-2.358001174498360
Tattler and perentie,CW4 8GH,53.217448000000000,-2.371058000000000
dukite and Bronzewing pigeon,CW4 8JT,53.226112967274300,-2.350388661806560
Mole and Mole,CW4 8NF,53.229147000000000,-2.357842000000000
turtle and Warbler,CW6 0SU,53.212211691879900,-2.671918439133970
agamid and Philippine hawk-owl,CW7 2QE,53.207261411163600,-2.580808559908530
python and Chickadee,CW7 2UJ,53.200276803826100,-2.530759377913010
Logrunners and smooth snake,CW7 3AT,53.203408343688600,-2.507293594712530
Partridge and Cuscus,CW7 3BB,53.205021773190400,-2.504334000000000
perentie and bicycle lizard,CW7 3BZ,53.200808560717000,-2.507756894967180
Shearwater and krait,CW8 1BY,53.254902760147000,-2.524615636946970
Jay and Thrasher,CW8 1DQ,53.251664534712200,-2.523212000000000
Vulture and Gila monster,CW8 1GU,53.246570724487900,-2.538570617347660
Skunk and Fox,CW8 1HG,53.256136808779300,-2.524031166427700
Hawaiian honeycreeper and Capuchin,CW8 1HS,53.246921000000000,-2.552121000000000
mud turtle and Darwin's finches,CW8 1LD,53.248278000000000,-2.526917000000000
Cuscus and Tattler,CW8 1LX,53.243429868663600,-2.545319365994440
flying lizard and Tahr,CW8 1NB,53.243684322213000,-2.542745167895220
Peafowl and sea snake,CW8 1PA,53.244230624630800,-2.539230544399130
elapid and bicycle lizard,CW8 1QG,53.246725303453000,-2.544117432544150
Thicketbird and Francolin,CW8 1RP,53.242622999966700,-2.548770573315390
Mamo and Eagle,CW8 1ST,53.243639780500500,-2.554373019258310
rattlesnake and Philippine hawk-owl,CW8 2BA,53.223409729929800,-2.543746830338700
Black jay and Pheasant,CW8 2ET,53.212142496649700,-2.621753940474930
Greenbul and River dolphin,CW8 2EU,53.225168232034400,-2.628473379974110
Stilt and White ibis,CW8 2FE,53.240631879037500,-2.553644866856810
Gull and loggerhead,CW8 2HF,53.240259000000000,-2.567693000000000
Booted eagles and pit viper,CW8 2LB,53.238556999076800,-2.596170693953720
Mamo and Hawaiian honeycreeper,CW8 2LS,53.241125228071200,-2.598484001474260
taipan and Stint,CW8 2LW,53.243196374280800,-2.597855000000000
Mink and jew lizard,CW8 2PY,53.238882778879600,-2.601104776740530
taipan and Ice seal,CW8 2QT,53.234298419702400,-2.602883295857050
Flameback and agamid,CW8 2RZ,53.278302907587400,-2.629972760685450
Ice seal and tokay,CW8 2SA,53.266755865031500,-2.630972425650670
deaf adder and soft-shelled turtle,CW8 2SJ,53.241950068839200,-2.593520654464400
Rat and Komodo dragon,CW8 2SU,53.249474000000000,-2.586386000000000
box turtle and mamba,CW8 2UA,53.245702645330800,-2.613983305503580
Marmoset and Thicketbird,CW8 2UL,53.242065679158100,-2.620239733747920
Crow and thorn lizard,CW8 2WN,53.230953282625700,-2.629202299596760
racer and Black jay,CW8 2YH,53.240119913187800,-2.594604130791490
massasauga and garter snake,CW8 3BW,53.259287182980700,-2.566328017736680
thorn lizard and bearded lizard,CW8 3BZ,53.255870450606400,-2.564634038173440
hawksbill and Triller,CW8 3DB,53.256017954213800,-2.563856532261920
water snake and iguana,CW8 3DE,53.257181052187300,-2.568788494954070
American sparrow and alligator,CW8 3DS,53.258079000000000,-2.578469000000000
Black cockatoo and Kite,CW8 3EA,53.256826876053000,-2.571421980693500
diamondback terrapin and Tattler,CW8 3EG,53.256541950546700,-2.568974877580880
mamba and thorny devil,CW8 3EH,53.254448679770700,-2.566848647895540
giant tortoise and frilled lizard,CW8 3HG,53.264414160639300,-2.586095737298680
Quetzal and brown snake,CW8 3HP,53.261472407215400,-2.586580195808490
frill-necked lizard and Stint,CW8 3JD,53.258374710966100,-2.569179093858310
Diving bird and Philippine hawk-owl,CW8 3JL,53.261595189613900,-2.574288952926490
Moluccan boobook and skink,CW8 3JY,53.262207529600500,-2.568435453149380
Boto and bushmaster,CW8 3LS,53.263175550125500,-2.569017988388850
blind snake and rock snake,CW8 3PA,53.265072076889800,-2.574665394017650
whip snake and frilled lizard,CW8 3PH,53.266836042492900,-2.583475072179590
Viscacha and milk snake,CW8 3PJ,53.267841229315600,-2.572678410800600
swift and goanna,CW8 3QR,53.277159589740300,-2.614809125000140
cycling lizard and Peafowl,CW8 3QX,53.271208000000000,-2.606432000000000
Old World warbler and White ibis,CW8 3WY,53.261263983420700,-2.508697898216530
bicycle lizard and Capuchin,CW8 4AA,53.254709227165600,-2.527730964111670
Towhee and Minke whale,CW8 4AN,53.255078000000000,-2.527930000000000
Argus and cayman,CW8 4AQ,53.252644000000000,-2.528963000000000
Goose and Old World vulture,CW8 4BL,53.262344573885300,-2.528904397573650
Shearwater and monitor,CW8 4BZ,53.255229631738800,-2.529970749194840
sand viper and Hawaiian honeycreeper,CW8 4DA,53.261491421091400,-2.522612513786470
wall lizard and brown snake,CW8 4DB,53.262726000000000,-2.526300000000000
Siskin and B,CW8 4DE,53.263366639283600,-2.527477787129270
anole and tuatara,CW8 4ET,53.270006478744200,-2.546092480496340
Warbler and king cobra,CW8 4FE,53.260691000000000,-2.532600000000000
cobra and agama,CW8 4GE,53.268746000000000,-2.544727000000000
milk snake and Capuchin,CW8 4GX,53.267730857849000,-2.536512619237100
Songlark and Zebra,CW8 4HX,53.274520917154300,-2.557306970099010
mud turtle and harlequin snake,CW8 4JA,53.276079199639500,-2.558541958485150
fer-de-lance and Thicketbird,CW8 4JN,53.269910000000000,-2.543693533821660
Marsh harrier and Black jay,CW8 4LE,53.271275267438400,-2.543829457525760
Asiatic leopard and brown snake,CW8 4LS,53.272465773682900,-2.540980500581830
rat snake and Parrotlet,CW8 4NL,53.275088256461000,-2.545422469520570
Crow and rock snake,CW8 4NT,53.267185000000000,-2.535605000000000
Jerboa and crocodile,CW8 4QA,53.276362611271700,-2.557421000000000
Armadillo and Bunting,CW8 4QY,53.288359988892600,-2.593473888869170
alligator and fer-de-lance,CW8 4SU,53.263539923281300,-2.538124567673570
Chipmunk and Schneider python,CW8 4XU,53.262156942883600,-2.530671082013470
fer-de-lance and Eagle,CW8 4ZL,53.265899000000000,-2.541691000000000
anole and Vole,CW9 5AP,53.261764286634400,-2.513606019503330
kabaragoya and rat snake,CW9 5BN,53.260456052550100,-2.514729648525180
Hawk and snake,CW9 5DY,53.262361209542900,-2.508411000000000
Diving bird and Duck,CW9 5EA,53.262485211768600,-2.506883418692250
python and hognose snake,CW9 5EP,53.261374039607700,-2.510288276596270
bull snake and agamid,CW9 5JJ,53.257886000000000,-2.514804000000000
lizard and milk snake,CW9 5LU,53.262443691783600,-2.499686953284370
Kākāriki and Mink,CW9 5ND,53.263307251151800,-2.495229435407410
Quetzal and blind snake,CW9 5PN,53.255386053329700,-2.502152814312590
Eagle and Coati,CW9 5RT,53.263252405252800,-2.508256757993850
Philippine hawk-owl and Pheasant,CW9 6BB,53.292811613774800,-2.532086255412040
Minke whale and wall lizard,CW9 6EN,53.281357106089700,-2.470766117735890
Tattler and python,CW9 6EQ,53.283917873490500,-2.466459535324080
Condor and snapping turtle,CW9 6HN,53.300885772971900,-2.519628000000000
Recurvebill and Coati,CW9 6HX,53.300817633068500,-2.526693957992300
rock snake and chuckwalla,CW9 6LS,53.299424472987700,-2.477581889056410
Thicketbird and cerastes,CW9 6NR,53.323150290358000,-2.511205517956790
Black jay and Partridge,CW9 6PX,53.282284186624900,-2.472726121449110
Towhee and amethystine python,CW9 6RG,53.274074000000000,-2.493764000000000
Triller and Puffleg,CW9 7AH,53.258793117909900,-2.497800571562460
Duck and Francolin,CW9 7DH,53.255856047651100,-2.477470942873460
bearded dragon and Bunting,CW9 7EP,53.253905240851900,-2.484209073413410
Pitohui and terrapin,CW9 7EQ,53.253436648525400,-2.477818699797200
New World blackbird and Vole,CW9 7JW,53.250469821263500,-2.484619886313630
Tattler and king snake,CW9 7LZ,53.265758811786800,-2.487086718418460
Herring gull and puff adder,CW9 7PL,53.269301765827200,-2.468819337494050
elapid and gopher snake,CW9 7RB,53.247650000000000,-2.486416000000000
Jackal and horned viper,CW9 7TL,53.245622779429000,-2.478450919134780
Ice seal and Tattler,CW9 7UJ,53.250599702528200,-2.474684670673500
blue racer and jew lizard,CW9 7YF,53.271982124592500,-2.455773406313520
cobra and Parakeet,CW9 7YL,53.272641000000000,-2.456335000000000
taipan and Ice seal,CW9 7ZR,53.265043000000000,-2.477603000000000
bearded lizard and boa constrictor,CW9 8AR,53.251866405134900,-2.511778785052300
Mamo and hawksbill,CW9 8AX,53.255422211764400,-2.512660639514530
bicycle lizard and horned viper,CW9 8BF,53.244607411669600,-2.505713273855180
Maya and frilled lizard,CW9 8BH,53.245678501545700,-2.508408047838780
Chickadee and Rabbit,CW9 8DJ,53.244086217934000,-2.506590942215190
perentie and boomslang,CW9 8GA,53.236383000000000,-2.508266000000000
Thicketbird and Marsh harrier,CW9 8GF,53.238651622813600,-2.518273649001360
Kite and Hawaiian honeycreeper,CW9 8GN,53.242318752546700,-2.522468705366850
krait and Ice seal,CW9 8HB,53.237230000000000,-2.522871000000000
amethystine python and leathery turtle,CW9 8HS,53.236177722307600,-2.512490494497210
elapid and Old World vulture,CW9 8HT,53.236612994644000,-2.513694303421800
flying dragon and habu,CW9 8HX,53.236520451009200,-2.518457649722770
deaf adder and Schneider python,CW9 8JA,53.235584613712200,-2.512603000000000
agama and adder,CW9 8JN,53.232940470831800,-2.514863804514950
Kite and Capuchin,CW9 8LS,53.230867678024200,-2.509835408931250
cycling lizard and kabaragoya,CW9 8PG,53.223944283108000,-2.520672223950990
Buzzard and snapping turtle,CW9 8QB,53.221534380619100,-2.510488350927830
Condor and loggerhead,CW9 8QF,53.220325942832400,-2.511402543057650
Chickadee and chuckwalla,CW9 8RX,53.248044633687300,-2.520425378738400
Quetzal and smooth snake,CW9 8TG,53.247807463393100,-2.521216784422190
gopher snake and Parrotbill,CW9 8TX,53.248990249298600,-2.520017225114720
lizard and Black jay,CW9 8UY,53.246308590021400,-2.518635958094450
Thrasher and Ibex,CW9 8WH,53.238820350571100,-2.520807877358940
diamondback turtle and grass snake,CW9 8WP,53.241530707369200,-2.523837660277480
Logrunners and Philippine hawk-owl,CW9 8WU,53.244726532228900,-2.520699794816190
Black jay and Goose,CW9 9JJ,53.261269082669300,-2.508698269876530
copperhead and Stilt,CW9 9LE,53.261269082669300,-2.508698269876530
gopher snake and diamondback turtle,CW9 9RU,53.261328000000000,-2.508699000000000
Linsang and glass snake,CW9 9TW,53.261344000000000,-2.508697000000000
Parakeet and krait,M22 0SR,53.373951714018100,-2.262695488669340
Grosbeak and Puffleg,M22 1ED,53.373630282600000,-2.275770327800000
Mouse and agama,M22 1GX,53.375776701016400,-2.278414401601480
hawksbill and Bunting,M22 1HA,53.372987000000000,-2.268461000000000
loggerhead and Chipmunk,M22 1NH,53.372438025651200,-2.264324445579470
anaconda and sidewinder,M22 1RL,53.378820455534800,-2.279862344583520
Goose and gecko,M22 1RZ,53.374272528473400,-2.279727288169590
terrapin and Condor,M22 1TH,53.375351211624400,-2.271933212770940
leathery turtle and Puffleg,M22 1TQ,53.376494290555200,-2.271264082789880
Rabbit and Towhee,M22 1UX,53.378088816486000,-2.273649293757960
diamondback terrapin and Thicketbird,M22 1UZ,53.378792494146100,-2.276434789913080
Cuscus and agamid,M22 4BS,53.403264933849800,-2.266125036671230
smooth snake and Mole,M22 8EW,53.391524077967200,-2.262863923540790
Schneider python and anole,M22 8FU,53.391878257493600,-2.265287054302570
Gull and leguaan,M22 9GG,53.385236207189300,-2.269064510218820
worm lizard and Snipe,M22 9GS,53.381764575804800,-2.265960761926540
galliwasp and asp,M22 9GT,53.383415000000000,-2.268016000000000
Mole and Egret,M22 9NS,53.385256483930900,-2.264013011793740
Dolphin and death adder,M22 9RD,53.383638151199300,-2.272181504508390
elapid and White ibis,M22 9RQ,53.382130037290100,-2.275238712499760
Skunk and Kākāriki,M22 9RT,53.384902982947300,-2.273302130497000
Diving bird and Tattler,M22 9WD,53.385977920674200,-2.262950004690020
Jerboa and Chicken,M22 9WF,53.387283538630100,-2.265980156280730
Chickadee and krait,M23 0AH,53.409422167880100,-2.292955311552040
Hawk and Herring gull,M23 0AW,53.410343269631900,-2.294872165034370
Rat and deaf adder,M23 0DA,53.410745318294300,-2.273242258095570
death adder and Kestrel,M23 0DW,53.413666077719800,-2.273471620519620
mountain devil and Gull,M23 0FU,53.414322271444300,-2.281193844511900
asp and Eagle,M23 0GT,53.411231038549600,-2.295720761514660
Fulmarine petrel and tuatara,M23 0HA,53.415311027709600,-2.284976719342550
blind snake and asp,M23 0HH,53.413510992555900,-2.289673626859690
galliwasp and blind snake,M23 0JH,53.412794000000000,-2.289097000000000
Condor and crocodile,M23 0NA,53.413240737479600,-2.286196514665840
Petrel and Zebra,M23 0PJ,53.408931517739800,-2.287732031178570
Bunting and cayman,M23 0PR,53.408580524508300,-2.284164509304190
Scimitar babbler and boa,M23 0QH,53.403507263606500,-2.293125217671620
Egret and garter snake,M23 1AH,53.399013047576600,-2.274189707294990
New World blackbird and mountain devil,M23 1AJ,53.399346242324700,-2.273921138900510
hoop snake and grass snake,M23 1DS,53.399418260431000,-2.289111596869540
rock python and puff adder,M23 1DT,53.399970165946600,-2.291326191311010
Perching duck and king cobra,M23 1EX,53.391427049650600,-2.285523751686720
Fish eagle and boa,M23 1FG,53.391246127844500,-2.286003714893670
Vulture and Kestrel,M23 1JZ,53.392855276104300,-2.282149929112520
Grosbeak and chuckwalla,M23 1LQ,53.393354692933000,-2.276153288233600
Masked owl and milk snake,M23 2GF,53.390351665733200,-2.284163272485940
python and Cloud rat,M23 2PU,53.385894378660900,-2.287471297498770
brown snake and Warbler,M23 2RU,53.383807166213100,-2.284495508085630
mud turtle and Fulmarine petrel,M23 2RY,53.386175588830300,-2.286405713259850
Chicken and viper,M23 2SB,53.387180055159300,-2.287344648787020
blue tongue and viper,M23 2SG,53.384466000000000,-2.283658814230320
Grosbeak and Ibex,M23 2SN,53.382607996729300,-2.282262523355600
White ibis and River dolphin,M23 2SY,53.384844537239300,-2.286712496036280
box turtle and massasauga,M23 2XN,53.380961645532600,-2.282867982704790
sidewinder and kabaragoya,M23 9BP,53.401593801872000,-2.296315654182160
gavial and Diving bird,M23 9BS,53.405477796970600,-2.292296436943500
anole and Scimitar babbler,M23 9DG,53.405032092495200,-2.301634203377720
water snake and flying lizard,M23 9EJ,53.406997357179000,-2.306431562034340
fer-de-lance and Partridge,M23 9FD,53.404473000401100,-2.305871917534230
Petrel and racer,M23 9FG,53.404419994717200,-2.305510544101160
Minke whale and garter snake,M23 9FN,53.405044000000000,-2.304567000000000
blindworm and agama,M23 9FY,53.397739000000000,-2.303343102538360
Chipmunk and Skunk,M23 9HH,53.405604452193800,-2.316409000000000
Mouse and rock snake,M23 9HW,53.406899631094400,-2.309469393228520
American sparrow and krait,M23 9LE,53.391324731263000,-2.297958458477160
gecko and Grouse,M23 9NR,53.392290000000000,-2.289620000000000
soft-shelled turtle and leathery turtle,M23 9PA,53.405005296308400,-2.315472267178740
Old World warbler and coral snake,M23 9PX,53.399681654394700,-2.302513754152320
Old World vulture and Stint,M23 9QH,53.407557953558100,-2.301606958458850
black snake and leguaan,M23 9WH,53.397829808143100,-2.302590843893030
carpet snake and thorny devil,M23 9WL,53.391180765839200,-2.298017599036560
Triller and gopher snake,M31 4DG,53.418390696273500,-2.422580913578120
bearded dragon and deaf adder,M31 4DY,53.415758437090600,-2.419635989848980
thorn lizard and caiman,M31 4DZ,53.415863861434500,-2.420329119689660
Piping shrike and Parrotbill,M31 4EZ,53.417327515505400,-2.428332978967720
Grosbeak and Jerboa,M31 4GS,53.413533701782900,-2.435952563691000
hognose snake and Komodo dragon,M31 4HB,53.415898728671600,-2.438128269382180
Stilt and Badger,M31 4HY,53.414280839768400,-2.438111631668770
Grackle and snake,M31 4JU,53.415599960582400,-2.438711966756690
garter snake and Prion,M31 4LW,53.416191150691200,-2.436822310345910
Civet and krait,M31 4NB,53.416768000000000,-2.431622000000000
Dorcopsis and Thicketbird,M31 4PW,53.418438095018300,-2.439328004422570
Fox and Egret,M31 4WN,53.415672313783300,-2.431190008957180
Mole and asp,M33 2DL,53.423390860430000,-2.313983272283610
Night heron and cobra de capello,M33 2FQ,53.423165514719100,-2.303809170143570
gopher snake and agamid,M33 2GH,53.420319107785400,-2.295467882817040
Parrotlet and Treepie,M33 2HW,53.421454499752500,-2.297943531319880
turtle and Mockingbird,M33 2JS,53.419719170566200,-2.290874456633920
bull snake and Thrasher,M33 2LF,53.419766163542200,-2.290032157866170
Kite and Marsh harrier,M33 2RE,53.416179529881600,-2.290113051116300
Maya and Duck,M33 2RH,53.415634083706100,-2.288935800529800
Songlark and indigo snake,M33 2SJ,53.417299262892900,-2.295341610093540
Perching duck and Condor,M33 2SX,53.417898158540000,-2.300280892328840
python and diamondback terrapin,M33 2UN,53.414884842569800,-2.301132261535760
Gull and Black cockatoo,M33 2ZP,53.422474713608200,-2.292488340418560
Parrotlet and wall lizard,M33 3AX,53.419049804086000,-2.320586790365010
Meadowlark and Minke whale,M33 3AZ,53.420018526503700,-2.321346426799090
sidewinder and Darwin's finches,M33 3BW,53.421405939136400,-2.316797542435310
Fish eagle and cayman,M33 3EG,53.421821644712400,-2.312542187763700
hawksbill and copperhead,M33 3EH,53.418682964182800,-2.309735568164460
gaboon viper and kabaragoya,M33 3HQ,53.419367607748100,-2.305662906087120
Shearwater and Badger,M33 3NY,53.409683000000000,-2.314318000000000
Wader and Wader,M33 3SG,53.415338352113300,-2.326907943344100
garter snake and rock python,M33 3UR,53.421887709963700,-2.310902000000000
Gull and perentie,M33 4DN,53.411419327840200,-2.333406900882050
Partridge and Hawaiian honeycreeper,M33 4FH,53.410541770020900,-2.341764244444850
Partridge and sand viper,M33 4FQ,53.409673492470500,-2.337334566858960
caiman and saltwater crocodile,M33 4GA,53.416711362336300,-2.346808926307830
alligator and Kestrel,M33 4HE,53.410878826482900,-2.346445528827050
bicycle lizard and black snake,M33 4HQ,53.410930502927400,-2.350297133043180
Marmoset and diamondback turtle,M33 4LL,53.411720618152600,-2.353643390515250
Tree warbler and terrapin,M33 4NY,53.411271374750100,-2.359597010851520
boa and turtle,M33 4PS,53.413322000000000,-2.344299000000000
frill-necked lizard and garter snake,M33 4QZ,53.416483648657600,-2.353953755126280
Wallaby and harlequin snake,M33 4TR,53.416868727414500,-2.348329831644320
tokay and asp,M33 4UX,53.417537483204000,-2.350170915073630
lizard and Nukupuʻu,M33 4WB,53.415267479921200,-2.348768094180610
Old World vulture and White ibis,M33 4WT,53.413187463302800,-2.356092774011240
Polecat and Buzzard,M33 4YJ,53.417624581916800,-2.351119532339120
asp and New World blackbird,M33 5BP,53.419448372436500,-2.338991886865470
Darwin's finches and ringhals,M33 5EF,53.423310262502300,-2.346366079620320
bearded lizard and Grackle,M33 5FG,53.423512881428900,-2.347782251702920
turtle and Petrel,M33 5FL,53.423915102854500,-2.351622845858770
Nukupuʻu and milk snake,M33 5RX,53.423359622152400,-2.360060231082380
Zebra and Guillemot,M33 6RS,53.421407350556900,-2.332792912372720
king cobra and Chickadee,M33 7LB,53.421142453802700,-2.327825238719990
bandy-bandy and sea snake,M33 7SH,53.420010099205500,-2.324461067514740
Vulture and frill-necked lizard,M33 7TZ,53.420565000000000,-2.329175000000000
Ice seal and bushmaster,M33 7UQ,53.423193335033400,-2.323988737739420
caiman and Rabbit,M33 7YA,53.423073401014900,-2.321805870700010
jew lizard and Mamo,M33 7ZA,53.424721231558600,-2.320719780690510
lizard and grass snake,M44 5ED,53.420431738083800,-2.447082771071940
Partridge and Parrotbill,M44 5GJ,53.424487787600000,-2.433205765700000
death adder and alligator,M44 5UG,53.418921091445000,-2.447232428345250
cobra de capello and Stilt,M44 5XF,53.424495000000000,-2.437524000000000
rattlesnake and Old World quail,M90 2BN,53.361932000000000,-2.271845680348060
Fox and Grackle,M90 3DN,53.366155487500000,-2.274144084100000
diamondback and tokay,M90 3RA,53.365033262745000,-2.275413933962260
diamondback and dugite,M90 4AL,53.367036155365700,-2.279950348736220
Parrotlet and Gila monster,M90 4PY,53.363487000000000,-2.268206000000000
Darwin's finches and Dorcopsis,M90 5YF,53.358493000000000,-2.285784000000000
Parakeet and iguana,SK11 9BW,53.247995000000000,-2.300183000000000
Mink and Skunk,SK11 9DW,53.243084657015200,-2.296987000000000
tiger snake and Pratincole,SK11 9DX,53.228985128480000,-2.291975822934650
blind snake and fer-de-lance,SK9 7WE,53.292335701988600,-2.289317578068000
coral snake and Mamo,WA1 1EP,53.387599697722800,-2.594583180369750
Diving bird and River dolphin,WA1 1RX,53.379690911018400,-2.596126568260540
taipan and Flameback,WA1 1YA,53.389633159145700,-2.607242000000000
flying dragon and galliwasp,WA1 2AE,53.391745285361800,-2.592853000000000
Boto and Songlark,WA1 2EE,53.389417636096100,-2.581541000000000
Wader and deaf adder,WA1 2EG,53.391703468887700,-2.578956746730800
Peafowl and indigo snake,WA1 2ET,53.389991922810300,-2.581564890172290
massasauga and tokay,WA1 2FZ,53.389844108815800,-2.579758829420660
Polecat and leguaan,WA1 2LG,53.389127809862300,-2.592770072863850
gopher snake and wall lizard,WA1 2LH,53.389167000000000,-2.592380000000000
Hawaiian honeycreeper and amphisbaena,WA1 2NS,53.389488042162000,-2.589000974102270
Tit-tyrant and Towhee,WA1 2QA,53.391379033895900,-2.590139824362560
amphisbaena and king snake,WA1 3DD,53.400251345835900,-2.567807818643460
indigo snake and bicycle lizard,WA1 3DL,53.402999152386900,-2.566490727057640
Parakeet and rock snake,WA1 3EA,53.398635981171200,-2.557724892874420
diamond snake and leathery turtle,WA1 3EN,53.398587849795300,-2.554550937563370
carpet snake and rat snake,WA1 3FW,53.393913563150900,-2.582881550476840
Parrotbill and Kite,WA1 3GJ,53.395054277238200,-2.581212861495560
Boto and Fish eagle,WA1 3LA,53.402330320782000,-2.565368820885960
sand lizard and Black jay,WA1 3LS,53.397500561581600,-2.560251644306450
Grouse and Hawk,WA1 3PR,53.399022020076400,-2.574875108395970
rattlesnake and Stint,WA1 3PX,53.398135239852700,-2.576096375162730
Mouse and Cuscus,WA1 3RF,53.396413809610200,-2.569561357421060
Treepie and Gull,WA1 3RQ,53.396268178317500,-2.568055547112620
Mamo and soft-shelled turtle,WA1 3RS,53.397529250871000,-2.573140523801420
Elephant and fer-de-lance,WA1 3RY,53.398405365220400,-2.570385050631950
Quetzal and worm lizard,WA1 3SB,53.397708245129000,-2.571428465687930
Nukupuʻu and Kite,WA1 3TZ,53.397924685987000,-2.552181153969210
crocodile and racer,WA1 3UD,53.397561614389700,-2.549048320585460
Ground sloth and Mink,WA1 4BA,53.395072000000000,-2.535467000000000
Tahr and flying lizard,WA1 4BU,53.396972634264300,-2.534242479901740
Warbler and python,WA1 4DS,53.400758000000000,-2.526018000000000
Fox and Mouse,WA1 4EL,53.400441547714000,-2.528345113650080
rat snake and hoop snake,WA1 4HF,53.399488053459000,-2.526468367169800
Cuscus and alligator,WA1 4HU,53.404626148484200,-2.556930855630550
carpet snake and Herring gull,WA1 4LN,53.401899246250200,-2.542035095751810
Perching duck and Quetzal,WA1 4NX,53.399549890243600,-2.536801459533930
dukite and garter snake,WA1 4PR,53.399159964882200,-2.515139470603160
moloch and Tattler,WA1 4PY,53.398446348713300,-2.511777066575650
glass snake and copperhead,WA1 4QE,53.398496789752800,-2.518831149363330
smooth snake and Francolin,WA1 4RR,53.405886000000000,-2.533331000000000
saltwater crocodile and Marsh harrier,WA1 4SF,53.405827838089700,-2.545860597283070
viper and White ibis,WA1 9AE,53.389633159145700,-2.607242000000000
perentie and hawksbill,WA1 9FY,53.389638395848800,-2.607242000000000
elapid and Wader,WA1 9HG,53.389647000000000,-2.607241000000000
Asiatic leopard and Nukupuʻu,WA1 9HL,53.389647000000000,-2.607241000000000
horned toad and gopher snake,WA1 9UH,53.389634000000000,-2.606686000000000
hawksbill and Maya,WA1 9WH,53.389634000000000,-2.606686000000000
Chicken and Thicketbird,WA13 0AA,53.381315925115100,-2.478813910744410
indigo snake and Siskin,WA13 0AJ,53.378776461212900,-2.477733139385190
death adder and flying dragon,WA13 0AQ,53.380610791555200,-2.477573284514310
Warbler and taipan,WA13 0BQ,53.377840137357400,-2.468928000000000
leathery turtle and swift,WA13 0BZ,53.375993505969500,-2.467766196390440
Goose and Flameback,WA13 0EQ,53.379852561471200,-2.495979986370620
cobra de capello and sidewinder,WA13 0ER,53.380469777940200,-2.492364201912960
gavial and Wader,WA13 0JL,53.381385201423300,-2.472711151872680
tuatara and amethystine python,WA13 0RD,53.375203753489000,-2.460512520588450
Triller and Partridge,WA13 0RU,53.368595963878100,-2.444210086259890
Philippine hawk-owl and mamba,WA13 0SA,53.380951846292500,-2.442745227314640
grass snake and Shearwater,WA13 0TE,53.359964000000000,-2.499309000000000
Pitohui and Pheasant,WA13 9BD,53.384929107149200,-2.494310035800150
Elephant and Vole,WA13 9DZ,53.384981000000000,-2.477442000000000
Coati and Petrel,WA13 9JX,53.378881000000000,-2.426669000000000
agama and Jackal,WA13 9LW,53.383244168217200,-2.490937926604690
Petrel and Stint,WA13 9PJ,53.382802428851600,-2.473569000000000
milk snake and grass snake,WA13 9PS,53.385295678488700,-2.470333901261610
milk snake and Jerboa,WA13 9PY,53.388604000000000,-2.468295000000000
Pitohui and Kangaroo,WA13 9QB,53.387839370904900,-2.465776092354990
frilled lizard and python,WA13 9TJ,53.399338885731600,-2.438890509057990
milk snake and slowworm,WA13 9TS,53.407380789146700,-2.434776474150820
hawksbill and Mouse,WA13 9TY,53.410774000000000,-2.421422000000000
Condor and garter snake,WA13 9WB,53.384560179771500,-2.469934895036330
Chipmunk and Puffleg,WA14 1DW,53.385457000000000,-2.350554000000000
Armadillo and racer,WA14 1EU,53.390017000000000,-2.349087000000000
