name,postcode,lat,lon
Tree warbler and Fish eagle,WA5 3DA,53.392550049323900,-2.651854400461830
bushmaster and python,WA5 3DR,53.393051051541400,-2.648989880432450
Vulture and Darwin's finches,WA5 3NF,53.394749838269500,-2.667152000000000
Asiatic leopard and Argus,WA5 3QW,53.402933878613100,-2.643229187043790
asp and Gila monster,WA5 3QZ,53.404250976394900,-2.644016178857160
Armadillo and grass snake,WA5 3TA,53.402022000000000,-2.660542000000000
Quetzal and Puffleg,WA5 3TQ,53.393799436810800,-2.642896238486470
Fox and Schneider python,WA5 3UU,53.402476364148000,-2.667618638176460
Kestrel and Peafowl,WA5 4DA,53.419092146075700,-2.643864328066540
snake and bull snake,WA5 7TR,53.416144000000000,-2.616858000000000
Bronzewing pigeon and slowworm,WA5 7YJ,53.413261608749700,-2.631499755228680
adder and Black jay,WA5 7ZD,53.413030000000000,-2.629646000000000
frill-necked lizard and grass snake,WA5 8AD,53.396973414195300,-2.642523000000000
Old World warbler and Gull,WA5 8GG,53.399670477777100,-2.631539065779920
anaconda and bushmaster,WA5 8GJ,53.397505082621800,-2.631957000000000
Recurvebill and Parakeet,WA5 8HA,53.398415000000000,-2.644545000000000
Night heron and Pheasant,WA5 8HQ,53.397762900209400,-2.643001115803870
cayman and Grosbeak,WA5 8SB,53.394269795729600,-2.633940679768240
Gila monster and milk snake,WA5 8WX,53.398457766055000,-2.627986827359540
leguaan and chameleon,WA5 8XT,53.404682370882300,-2.637329151287040
frilled lizard and anaconda,WA5 9PH,53.402808763012900,-2.621026773823220
Tree warbler and slowworm,WA5 9SD,53.411776125686900,-2.611228301742390
elapid and black snake,WA6 6LQ,53.246436139101100,-2.661679632869720
Ground sloth and amphisbaena,WA6 6NH,53.246214622929100,-2.669154259403830
hoop snake and cycling lizard,WA6 6NW,53.241505406338100,-2.667372549264150
tuatara and slowworm,WA6 8HF,53.268668813995000,-2.669190064857880
tuatara and king snake,WA6 8HN,53.277739480789900,-2.664217785445830
diamondback and Fulmarine petrel,WA6 8JH,53.244555000000000,-2.660662000000000
diamond python and glass snake,WA6 8ND,53.248842000000000,-2.659182154297120
Ice seal and gecko,WA6 8NJ,53.254503221098000,-2.647864437135150
Prion and Parrotlet,WA7 1TG,53.351979000000000,-2.669158000000000
Fulmarine petrel and Solitaire,WA7 1US,53.348446000000000,-2.663965000000000
Herring gull and Macaw,WA7 1XQ,53.343151355238400,-2.667457260693620
Ground sloth and Old World vulture,WA7 3AP,53.321183898319500,-2.652612404093130
garter snake and Egret,WA7 3BB,53.313535107391200,-2.665494023713850
Cuscus and Black cockatoo,WA7 3BX,53.303531321222000,-2.658870774823240
Lemming and snake,WA7 3DE,53.298942169080100,-2.661365885529220
Grouse and brown snake,WA7 3LE,53.327129371617800,-2.658453679356880
puff adder and snapping turtle,WA7 6HJ,53.326660914138400,-2.658641648857920
iguana and Ibex,WA7 6HU,53.325930210736000,-2.663975367472670
Badger and python,WA7 6HY,53.325025089432300,-2.663480872846090
blind snake and Hawk,WA7 6LA,53.341463709658000,-2.673453693008410
Perching duck and dugite,WA7 6NH,53.337150705077200,-2.666762814557130
Greenbul and Kestrel,WA7 6NT,53.334709815594200,-2.666033947168170
cayman and puff adder,WA7 6PA,53.329523275939700,-2.674031333217740
soft-shelled turtle and cayman,WA7 6RH,53.326588793508200,-2.669976268058520
Rat and snake,WA7 6RQ,53.330138986542100,-2.661998641600250
Cuscus and Parakeet,WA7 6SG,53.327629804923600,-2.670277860476740
