name,postcode,lat,lon
mud turtle and Armadillo,WA14 1GS,53.395147723889700,-2.343701034467250
Grosbeak and Maya,WA14 1LU,53.398477774100900,-2.345337090985410
Cuscus and Vulture,WA14 1PB,53.399163155015000,-2.347658732681660
Darwin's finches and ringhals,WA14 1RH,53.387651144540600,-2.350106000000000
gavial and tokay,WA14 1RZ,53.386718702982700,-2.352158020713870
New World blackbird and Stint,WA14 1SB,53.386236563433400,-2.351537000000000
Elephant and Scimitar babbler,WA14 1SE,53.386624700605100,-2.350503381316640
Old World quail and diamondback,WA14 1ST,53.399213854220100,-2.342560737657390
box turtle and Cloud rat,WA14 2BH,53.385930000000000,-2.357699000000000
tree snake and Meadowlark,WA14 2BJ,53.386476902394600,-2.357899420029170
Kangaroo and goanna,WA14 2DW,53.383706253547200,-2.352584167484000
snake and Condor,WA14 2JH,53.378394632597900,-2.352359873779720
New World blackbird and fer-de-lance,WA14 2LQ,53.375802144601500,-2.359643676018680
bearded dragon and Elephant,WA14 2LY,53.380631904829000,-2.352663983576890
gaboon viper and deaf adder,WA14 2NB,53.382408094284100,-2.353866327870500
amphisbaena and monitor,WA14 2NS,53.379609668628500,-2.357871860936340
boomslang and blindworm,WA14 2PF,53.378655362553400,-2.358374953069500
Elephant and Flameback,WA14 2PW,53.378545780470800,-2.361921649847760
Pheasant and Snipe,WA14 2QE,53.385814000000000,-2.338498000000000
galliwasp and Triller,WA14 2QP,53.384435364551400,-2.355266309665130
viper and Songlark,WA14 2RW,53.376743379112900,-2.351459367287060
terrapin and Condor,WA14 2SJ,53.378983833133800,-2.365653410122060
Zebra and black snake,WA14 2SX,53.383978000000000,-2.349144000000000
boomslang and hognose snake,WA14 2TQ,53.378929542510000,-2.362826850815800
elapid and Perching duck,WA14 2UB,53.376553947477500,-2.363678476792640
coral snake and flying dragon,WA14 2UF,53.378506570325700,-2.350977830587210
Black jay and Cuscus,WA14 2XL,53.385798000000000,-2.338499000000000
hawksbill and Wallaby,WA14 3AH,53.373878554349900,-2.365564560955400
Scimitar babbler and Parrotlet,WA14 3HY,53.371387858138500,-2.344711980587100
bearded lizard and flying lizard,WA14 3LS,53.375506849436000,-2.373830649164050
Mole and adder,WA14 3PL,53.373779281352500,-2.368614922596940
diamond snake and Scimitar babbler,WA14 3RG,53.360387336352000,-2.419932928773200
sidewinder and diamondback turtle,WA14 3UY,53.385798000000000,-2.338499000000000
blindworm and Chipmunk,WA14 4EL,53.394580129197500,-2.356403502216810
Mole and Fulmarine petrel,WA14 4GY,53.397349668746600,-2.353027866982630
Masked owl and mountain devil,WA14 4HE,53.395050217215700,-2.355505146952440
Pitohui and skink,WA14 4JR,53.392355595620100,-2.375406894449910
Rat and Tit-tyrant,WA14 4LH,53.393138817658000,-2.372150669680260
Partridge and Grosbeak,WA14 4PL,53.395923845945500,-2.351888178966610
hawksbill and gopher snake,WA14 4QJ,53.386961978249600,-2.366879531364520
Old World quail and chameleon,WA14 4SB,53.384246017634300,-2.392730187563090
Schneider python and Darwin's finches,WA14 4SD,53.386167006946600,-2.390778295790650
Meadowlark and Ibex,WA14 4XE,53.394252473653800,-2.369558848908730
loggerhead and Pheasant,WA14 4YU,53.394312000000000,-2.361588000000000
Darwin's finches and mud turtle,WA14 5AS,53.404895727483700,-2.342185248437960
chameleon and adder,WA14 5BD,53.406348346335200,-2.343415321160640
Condor and hawksbill,WA14 5FY,53.398482000000000,-2.362331000000000
Masked owl and Recurvebill,WA14 5HR,53.401026665079500,-2.361811718862250
Grackle and Logrunners,WA14 5HT,53.400771643553800,-2.365855343921450
Kite and water snake,WA14 5JT,53.402958489265800,-2.365001745504610
thorn lizard and frilled lizard,WA14 5LN,53.403978276083700,-2.366604851547200
Condor and Mink,WA14 5PP,53.396007333011400,-2.374657053162560
skink and Old World vulture,WA14 5QG,53.404458618268500,-2.344152162111580
Logrunners and Grouse,WA14 5QQ,53.396475000000000,-2.365502000000000
Buzzard and Thicketbird,WA14 5RZ,53.400100169070500,-2.367910043211360
cycling lizard and River dolphin,WA14 5SW,53.397529000667900,-2.404161868581140
Capuchin and Wallaby,WA14 5UA,53.398958552978600,-2.367930268265510
Hawk and black snake,WA14 5XH,53.406483844020300,-2.355465150679130
chuckwalla and asp,WA14 5YJ,53.408743222920200,-2.364675000000000
alligator and swift,WA15 0DQ,53.368363154878200,-2.323872822082750
hognose snake and moloch,WA15 0LA,53.369204230291400,-2.341372934523870
Shearwater and Wallaby,WA15 0LL,53.369752952751000,-2.334884722597200
krait and diamond python,WA15 0QW,53.354100250561500,-2.339284048071170
hawksbill and Old World vulture,WA15 0RN,53.365006320032700,-2.304957788363910
Hawaiian honeycreeper and Recurvebill,WA15 5FS,53.385798000000000,-2.338499000000000
Magpie and Magpie,WA15 5QU,53.385814000000000,-2.338498000000000
Gila monster and diamond snake,WA15 6AL,53.408135107717200,-2.331395565105990
sand lizard and Vole,WA15 6AN,53.408863985652900,-2.327851098259540
whip snake and carpet snake,WA15 6DL,53.400315708987100,-2.321288084464660
Ice seal and soft-shelled turtle,WA15 6DQ,53.403371918715300,-2.319686980312370
Bronzewing pigeon and copperhead,WA15 6DW,53.400646050085900,-2.322117777506500
Songlark and Egret,WA15 6DX,53.403189026684200,-2.318768000000000
leguaan and Cuscus,WA15 6EA,53.401964662847600,-2.323120418322660
carpet snake and puff adder,WA15 6ES,53.403418460567400,-2.323823000000000
chuckwalla and Jerboa,WA15 6EX,53.405505418211300,-2.326697124082580
bandy-bandy and Armadillo,WA15 6HJ,53.404276351046700,-2.325830345250210
constrictor and sand lizard,WA15 6HL,53.405396000000000,-2.327508000000000
Perching duck and River dolphin,WA15 6HS,53.403885155137400,-2.327542049975620
River dolphin and harlequin snake,WA15 6NE,53.394134748026800,-2.326730276004640
Puffleg and Polecat,WA15 6NU,53.396142371915200,-2.325572664672380
agamid and Ibex,WA15 6TH,53.402294022092400,-2.337276151085650
anole and Prion,WA15 7AD,53.386140451552300,-2.314626034320280
adder and black snake,WA15 7BG,53.395005070132400,-2.313924520985550
terrapin and cycling lizard,WA15 7BX,53.392214531245900,-2.315467826681790
White ibis and thorny devil,WA15 7DB,53.394228125671800,-2.311993963080000
Old World vulture and Ibex,WA15 7DS,53.394349367756900,-2.310310614240620
frilled lizard and Tree warbler,WA15 7GH,53.391577369771800,-2.304696729817500
Kangaroo and White ibis,WA15 7JJ,53.391215448017700,-2.309114937892320
Kestrel and Goose,WA15 7JU,53.391487008006800,-2.308380103111480
Greenbul and loggerhead,WA15 7PH,53.389619356412100,-2.317899517374600
adder and Warbler,WA15 7QW,53.391737873518900,-2.341673634506940
Recurvebill and mountain devil,WA15 7SF,53.392521776084300,-2.328191557963950
rock snake and rock python,WA15 7UP,53.397463364415000,-2.319040822106120
jew lizard and flying lizard,WA15 7UZ,53.397138837319700,-2.316015592200900
diamondback terrapin and Triller,WA15 7XB,53.395962388461400,-2.315615871680800
Tattler and swift,WA15 8AF,53.383686647864700,-2.337610060694750
Tahr and Triller,WA15 8DT,53.379705888582200,-2.324214504176920
Kākāriki and Recurvebill,WA15 8EA,53.377526754091300,-2.325641002805950
agama and Partridge,WA15 8HX,53.385772188739400,-2.340708708945160
python and Siskin,WA15 8JA,53.394069851516800,-2.343436702545590
Hawk and Bunting,WA15 8JE,53.380939827572000,-2.329861299098790
Argus and Philippine hawk-owl,WA15 8NG,53.375351133139200,-2.315748938600540
gavial and Tit-tyrant,WA15 8NN,53.374945393488900,-2.319593868871400
garter snake and Herring gull,WA15 8PL,53.381711654746100,-2.310203615139280
Badger and cerastes,WA15 8PT,53.380408869053700,-2.313426215171380
Old World warbler and copperhead,WA15 8QB,53.377548916610300,-2.317418717814140
chameleon and Old World quail,WA15 8QY,53.380854441759500,-2.337888302555530
Gila monster and Parrotbill,WA15 8QZ,53.380500566175800,-2.339058069602670
Solitaire and thorn lizard,WA15 8RB,53.375703000000000,-2.325687000000000
Tahr and B,WA15 8RE,53.373860919693500,-2.321765182571390
Buzzard and Thrasher,WA15 8RQ,53.373643000000000,-2.322846000000000
skink and Greenbul,WA15 8RU,53.379901838370800,-2.337475000000000
gopher snake and blue racer,WA15 8RW,53.379193501053600,-2.320903461751800
constrictor and green turtle,WA15 8RY,53.380193715649400,-2.336319652043630
bearded dragon and sand lizard,WA15 8SA,53.380604339782000,-2.337330100467790
Vole and Cloud rat,WA15 8TH,53.365841018350600,-2.305444642841220
Marmoset and Black jay,WA15 8WB,53.379535748683400,-2.333894000000000
Kestrel and Grosbeak,WA15 8WD,53.385811907182900,-2.336470000000000
goanna and puff adder,WA15 9HL,53.380643492602000,-2.342516797472400
coral snake and diamond python,WA15 9LH,53.371444088251100,-2.334432073953630
Logrunners and king snake,WA15 9NP,53.372008151073100,-2.341560699104340
Stilt and thorny devil,WA15 9NT,53.374147568596400,-2.344644095035010
frilled lizard and cobra de capello,WA16 0BG,53.301688929838200,-2.383163743060340
Perching duck and Pratincole,WA16 0DN,53.299973097805500,-2.377206520780520
Vole and diamond snake,WA16 0GN,53.301646137766800,-2.373995141254520
Herring gull and Thicketbird,WA16 0LN,53.304888134894600,-2.438190934098690
bearded dragon and Ibex,WA16 0NF,53.309213280494300,-2.388483928755400
horned viper and worm lizard,WA16 0PX,53.330142301626500,-2.411632523831450
Maya and Piping shrike,WA16 0QJ,53.334809000000000,-2.448964000000000
Mockingbird and ringhals,WA16 0QP,53.348043226638700,-2.454962052528300
Black cockatoo and mud turtle,WA16 0ST,53.315562549841500,-2.390252773738340
Civet and harlequin snake,WA16 0UW,53.273753304856400,-2.425126091916190
Shearwater and boa constrictor,WA16 0WB,53.324697241825500,-2.397767786562460
Minke whale and moloch,WA16 1EP,53.312491251600000,-2.359441431800000
hognose snake and Linsang,WA16 6DH,53.303529000000000,-2.372975245744430
Kite and flying dragon,WA16 6JY,53.328246708374100,-2.336841569008390
garter snake and Marmoset,WA16 6LD,53.342353125291100,-2.418193581777530
White ibis and taipan,WA16 6LP,53.349316883690400,-2.450949713311730
Black jay and Bronzewing pigeon,WA16 6ND,53.354041060886300,-2.451976144307610
cobra de capello and asp,WA16 6QP,53.312486399748300,-2.359441102598020
Pitohui and swift,WA16 6QT,53.340867650526200,-2.397858267960980
ringhals and amphisbaena,WA16 6QX,53.340812876857000,-2.403459853968530
hognose snake and boomslang,WA16 6SN,53.350005865089300,-2.370993491148790
massasauga and soft-shelled turtle,WA16 6TP,53.350141607146500,-2.446767191790660
kabaragoya and mud turtle,WA16 6XA,53.352586939496100,-2.451434941414030
Black jay and River dolphin,WA16 7AQ,53.311626423907200,-2.303421235463840
Meadowlark and cycling lizard,WA16 7AU,53.300896000000000,-2.295978000000000
boomslang and Egret,WA16 7BA,53.304601905648200,-2.275594797303260
garter snake and Meadowlark,WA16 7BY,53.313553822740300,-2.287374849629300
rock snake and Pitohui,WA16 7GD,53.315128192742600,-2.328602794656030
Philippine hawk-owl and ringhals,WA16 7HT,53.312538456948200,-2.319037127230330
moloch and bearded dragon,WA16 7QB,53.316026217896500,-2.332152125393080
Logrunners and Triller,WA16 8AQ,53.301154283440000,-2.361521611310230
Vulture and Black jay,WA16 8DB,53.304235571936600,-2.359161674490830
tuatara and habu,WA16 8DW,53.307618305582400,-2.361156046172720
green turtle and mamba,WA16 8EL,53.304059463482100,-2.366813309786460
Shearwater and diamond python,WA16 8ES,53.307103799063600,-2.364813451632750
Cloud rat and Masked owl,WA16 8HP,53.309792870445700,-2.355411295401170
bicycle lizard and anole,WA16 8JJ,53.308444949964700,-2.355280031758490
Myna and Black cockatoo,WA16 8JW,53.307725738476700,-2.358320556709640
Mink and ringhals,WA16 8JY,53.305175449444400,-2.354472534316030
Quetzal and harlequin snake,WA16 8LH,53.298826254121200,-2.361501937525700
anole and taipan,WA16 8NL,53.295784711854400,-2.362601478495050
Chipmunk and alligator,WA16 8RS,53.288169306180300,-2.332430887656760
constrictor and swift,WA16 8SP,53.275641846674400,-2.307934901148110
whip snake and Prion,WA16 8UL,53.258208346698100,-2.306085716099560
whip snake and Siskin,WA16 8WS,53.302670114716900,-2.365540923170340
Nukupuʻu and frilled lizard,WA16 8XW,53.313148473136600,-2.357480451126980
Petrel and Rat,WA16 8XZ,53.312408259981200,-2.358524894784170
Meadowlark and iguana,WA16 9AY,53.292262039431900,-2.371062743945320
Skunk and Black cockatoo,WA16 9DD,53.295396469718900,-2.377631267470650
Ground sloth and diamondback turtle,WA16 9HB,53.266342439667400,-2.339547986393620
Bronzewing pigeon and Gull,WA16 9HF,53.264019776537500,-2.334447260635100
gavial and Peafowl,WA16 9LH,53.235014633069300,-2.384485410696880
Crow and Prion,WA16 9LW,53.237325912552700,-2.384131566335840
adder and swift,WA16 9PH,53.272297551080000,-2.382555825995630
Chipmunk and anole,WA16 9QH,53.255642620957400,-2.398595418514910
habu and Piping shrike,WA16 9QT,53.262606571624200,-2.380070621908330
Siskin and horned viper,WA16 9RR,53.273562404612700,-2.407729473717840
Greenbul and Black cockatoo,WA16 9SQ,53.255922000000000,-2.411833000000000
swift and box turtle,WA2 0AB,53.412203472734200,-2.558880326357410
Badger and leguaan,WA2 0AD,53.412732150804400,-2.559233282513620
worm lizard and Philippine hawk-owl,WA2 0BN,53.412773207176700,-2.548446943225550
Egret and bearded dragon,WA2 0BP,53.417832216339700,-2.556561807186060
Tit-tyrant and Flameback,WA2 0DS,53.413623378183300,-2.566571780617830
Old World quail and Perching duck,WA2 0DU,53.413841430839000,-2.575481231228650
Elephant and mud turtle,WA2 0EN,53.418495563038300,-2.555020685366280
brown snake and Zebra,WA2 0FF,53.412909641952100,-2.574851821903750
Capuchin and gavial,WA2 0GG,53.409978052627500,-2.567606447488300
Skunk and black snake,WA2 0GU,53.411683162378500,-2.566290235020960
adder and Jackal,WA2 0LE,53.415838967750700,-2.569429805626520
whip snake and cobra de capello,WA2 0NW,53.419054572097500,-2.588446668539780
smooth snake and Kākāriki,WA2 0SE,53.419325546521600,-2.562058343039080
deaf adder and River dolphin,WA2 0SH,53.419697000000000,-2.550101000000000
Towhee and pit viper,WA2 0TU,53.409995875552000,-2.563845812580540
Snipe and gecko,WA2 0TX,53.409533604937600,-2.562756577213730
skink and Prion,WA2 0TZ,53.409223040425900,-2.563805501332660
mountain devil and frilled lizard,WA2 0UR,53.422521904774800,-2.562822816719000
saltwater crocodile and Old World vulture,WA2 7AP,53.397051329537400,-2.588233190070310
Nukupuʻu and Mamo,WA2 7AQ,53.397148568839600,-2.590385105134750
Wader and anole,WA2 7DW,53.398955370323400,-2.592184798984920
Partridge and blue racer,WA2 7LD,53.394307916211200,-2.601233272320620
Gull and Parakeet,WA2 7LW,53.393765000000000,-2.600414000000000
milk snake and Fox,WA2 7NW,53.394041832513900,-2.595139176276500
American sparrow and brown snake,WA2 7PA,53.398038150708900,-2.596984000000000
puff adder and Mouse,WA2 7QQ,53.401231947689300,-2.584079000000000
puff adder and Perching duck,WA2 7RQ,53.401005569459800,-2.581053349679560
caiman and Bunting,WA2 7TD,53.392498155387400,-2.591042514074430
sand lizard and Towhee,WA2 7TH,53.404554118559100,-2.574032178698350
rock snake and puff adder,WA2 8AJ,53.402821129473600,-2.586598133266110
lizard and Eagle,WA2 8BH,53.404081109085900,-2.591744596411650
frill-necked lizard and flying lizard,WA2 8HZ,53.405738163538800,-2.594730876313870
Solitaire and whip snake,WA2 8LU,53.407278045980100,-2.583229771233870
Wallaby and tiger snake,WA2 8QB,53.408811705886500,-2.594728000000000
cayman and smooth snake,WA2 8QU,53.420860794009100,-2.608273929304760
snake and cayman,WA2 8RE,53.419076209315700,-2.600710000000000
Warbler and frill-necked lizard,WA2 9BA,53.408314422625600,-2.578986810486200
Magpie and diamondback,WA2 9BJ,53.407310714030600,-2.574640921188330
puff adder and Puffleg,WA2 9BZ,53.410656019237500,-2.583591918142190
king snake and Booted eagles,WA2 9HF,53.415064879802800,-2.586360454031080
racer and Lemming,WA2 9LA,53.418047305402800,-2.593999906004280
Old World warbler and turtle,WA2 9NW,53.413802509225400,-2.585335078126530
Crow and White ibis,WA2 9PF,53.410461541170400,-2.588418272682440
Bunting and Skunk,WA2 9PG,53.412045368161100,-2.588048991928290
Francolin and Solitaire,WA2 9SL,53.418026766349000,-2.596316756948620
king cobra and pit viper,WA3 6AJ,53.420268069830200,-2.532939590050250
Lemming and Jackal,WA3 6DL,53.407632382803500,-2.516777000000000
Egret and dukite,WA3 6EJ,53.416716822342500,-2.482386349924470
elapid and Stilt,WA3 6HZ,53.413225538878000,-2.458230388096840
green turtle and Kestrel,WA3 6JP,53.414074043035000,-2.459638685272930
loggerhead and diamond snake,WA3 6JU,53.414411526731300,-2.456016487282580
Diving bird and dugite,WA3 6LX,53.419158112938500,-2.535919997861440
diamondback turtle and Siskin,WA3 6LZ,53.417933834531500,-2.536325892804150
Dolphin and monitor,WA3 6NQ,53.423349225606300,-2.529336481025710
Ibex and Armadillo,WA3 6PG,53.418616313867700,-2.518158308001640
Tattler and Piping shrike,WA3 6PR,53.417719988768100,-2.527837149207050
Old World warbler and agama,WA3 6QD,53.416534192387000,-2.517410788574280
krait and Grouse,WA3 6QZ,53.417568000000000,-2.513526000000000
slowworm and Bunting,WA3 6RH,53.421332566032100,-2.518175000000000
crocodile and smooth snake,WA4 1AE,53.384003494236000,-2.566223719267250
Moluccan boobook and Jackal,WA4 1BF,53.381666000000000,-2.547776000000000
Vole and Masked owl,WA4 1BY,53.383838787091500,-2.586231832959380
crocodile and tortoise,WA4 1GQ,53.383461000000000,-2.546852000000000
Minke whale and snapping turtle,WA4 1HE,53.382491012661600,-2.578756544657010
blue tongue and agamid,WA4 1HS,53.381435565693300,-2.570203239641330
Moluccan boobook and turtle,WA4 1JH,53.381178000000000,-2.566081000000000
kabaragoya and diamondback turtle,WA4 1LS,53.380347369857800,-2.560838146543160
Argus and Crow,WA4 1NE,53.381081416129200,-2.556112000000000
Grackle and Capuchin,WA4 1PX,53.383208770593200,-2.564017880006280
boomslang and sea snake,WA4 1SA,53.385896408617100,-2.558279982268720
taipan and box turtle,WA4 1SG,53.386765000000000,-2.559175593668880
Old World warbler and soft-shelled turtle,WA4 1SU,53.389194989054500,-2.558338196117590
rock snake and snake,WA4 1TR,53.382229241536100,-2.558231989880530
Mockingbird and Thicketbird,WA4 1TU,53.382276782975000,-2.557676364680860
rat snake and Piping shrike,WA4 2EU,53.379607446832400,-2.529996225484300
bandy-bandy and Old World warbler,WA4 2HE,53.381259692714000,-2.536857000000000
Bronzewing pigeon and giant tortoise,WA4 2HH,53.380352966190500,-2.536153990495440
horned toad and Mouse,WA4 2LY,53.382610684389200,-2.537806017982840
cobra and soft-shelled turtle,WA4 2PQ,53.375592000000000,-2.549487000000000
cobra de capello and thorny devil,WA4 2QE,53.375292028015500,-2.544162172148570
cobra de capello and American sparrow,WA4 2QF,53.374915620522100,-2.543916874256630
boa and Francolin,WA4 2QR,53.378312930880800,-2.540051784532280
cycling lizard and iguana,WA4 2RT,53.378287847818100,-2.570552012278730
Flameback and gopher snake,WA4 2TJ,53.381477756863000,-2.515482159095540
Siskin and Macaw,WA4 2XD,53.373518780323000,-2.573479344534400
blind snake and Tattler,WA4 2XT,53.380972423714700,-2.544264691326200
Moluccan boobook and black snake,WA4 2YJ,53.373878741351600,-2.538672959764430
Puffleg and Meadowlark,WA4 3AQ,53.361144269285700,-2.570984036414090
Black jay and Flameback,WA4 3DJ,53.363342770552100,-2.569886412227170
fer-de-lance and hoop snake,WA4 3DP,53.361620843101700,-2.569067024858720
Siskin and Old World quail,WA4 3EP,53.372079196603300,-2.545007980347310
frilled lizard and Kestrel,WA4 3ER,53.371365000000000,-2.548093265570070
Kangaroo and elapid,WA4 3EY,53.370935965073400,-2.537448468488870
viper and Gull,WA4 3HG,53.370130020495000,-2.567842856085000
blind snake and Polecat,WA4 3HS,53.359228963262500,-2.534265921522720
Old World quail and Masked owl,WA4 3JP,53.374128201020900,-2.520954770574930
Mouse and Old World warbler,WA4 3LG,53.363969398222500,-2.551306047391410
Dolphin and Parakeet,WA4 4AH,53.321401949635400,-2.648892662005020
rattlesnake and Asiatic leopard,WA4 4AN,53.337235612706100,-2.641443887748280
blindworm and water snake,WA4 4DS,53.328334000000000,-2.580801000000000
mamba and Peafowl,WA4 4DX,53.323868000000000,-2.584118000000000
king snake and Zebra,WA4 4EL,53.307565479862000,-2.579603261526150
flying lizard and Grosbeak,WA4 4EN,53.305900685670900,-2.579985891677100
Cuscus and saltwater crocodile,WA4 4JL,53.307661511617600,-2.614286931251950
skink and Skunk,WA4 4JT,53.309711982253800,-2.646404040576130
sand lizard and rattlesnake,WA4 4LN,53.311606686603900,-2.640098902816110
Gila monster and coral snake,WA4 4NB,53.339328158807900,-2.574807556320710
Tattler and cobra,WA4 4PF,53.330364117941300,-2.567764868160600
Tit-tyrant and cycling lizard,WA4 4QU,53.352112404404600,-2.545624475905740
soft-shelled turtle and python,WA4 4QZ,53.352645726372200,-2.539036073669390
anaconda and asp,WA4 4SB,53.345908809902000,-2.545920755426360
milk snake and Hawk,WA4 5AH,53.361833327894400,-2.582774050315280
Parrotlet and Petrel,WA4 5EQ,53.352144803238700,-2.571509000000000
New World blackbird and Flameback,WA4 5HQ,53.358889000000000,-2.563501000000000
agama and krait,WA4 5JG,53.359703693294100,-2.573353869152140
Stint and flying lizard,WA4 5LA,53.360631954726600,-2.585807952165380
box turtle and Lemming,WA4 5LN,53.355413007913700,-2.610210916807160
diamondback terrapin and puff adder,WA4 5LW,53.354826000000000,-2.610909000000000
Guillemot and Logrunners,WA4 5NS,53.350374927576500,-2.546203177873390
taipan and Gila monster,WA4 5PL,53.342205408172900,-2.583888083394680
hognose snake and mud turtle,WA4 5PP,53.345372865516900,-2.575790134118420
Puffleg and rattlesnake,WA4 5PW,53.344549352648300,-2.576935609043930
worm lizard and Coati,WA4 5QG,53.352450281222500,-2.567607753274270
blindworm and Rat,WA4 5SA,53.355574501059200,-2.585152620775210
Maya and Gull,WA4 6BL,53.376719681935800,-2.586239241969420
Bronzewing pigeon and Kestrel,WA4 6DD,53.373901904565500,-2.594377279188230
Tit-tyrant and Partridge,WA4 6DQ,53.376322020824800,-2.588503555568840
copperhead and caiman,WA4 6EZ,53.371755298731900,-2.599427534537020
diamond python and flying dragon,WA4 6FY,53.376258163211700,-2.580581337986430
Parakeet and Black jay,WA4 6GH,53.369186000000000,-2.587953000000000
Bronzewing pigeon and Masked owl,WA4 6HS,53.370612721752800,-2.581466110781120
viper and Minke whale,WA4 6HW,53.371282727762600,-2.582316911307610
giant tortoise and hognose snake,WA4 6LB,53.378578745502400,-2.586565433848840
Pitohui and gecko,WA4 6NW,53.369077552023700,-2.582918046226680
Scimitar babbler and rock snake,WA4 6SA,53.364695098216300,-2.591228542284850
Partridge and Kite,WA4 6SH,53.363375560149000,-2.614006364396810
soft-shelled turtle and Fish eagle,WA4 6TD,53.366931247714400,-2.600637196975680
puff adder and Ground sloth,WA4 6TE,53.365193478648600,-2.603002154523240
horned viper and bicycle lizard,WA4 6XE,53.364528916048000,-2.632401601969040
python and fer-de-lance,WA4 9QN,53.389638395848800,-2.607242000000000
Coati and swift,WA4 9QS,53.389638395848800,-2.607242000000000
chuckwalla and Songlark,WA4 9RF,53.389638395848800,-2.607242000000000
Rat and Asiatic leopard,WA4 9RP,53.389635567500000,-2.607242411700000
White ibis and cayman,WA4 9TZ,53.389647000000000,-2.607241000000000
box turtle and elapid,WA5 0AF,53.397070548297300,-2.609483499785710
Myna and cobra,WA5 0AQ,53.400226883620100,-2.610987509150100
Pitohui and amphisbaena,WA5 0AU,53.401097885744000,-2.609405711172620
Mockingbird and Polecat,WA5 0BA,53.401368275564100,-2.607499435487160
Crow and Myna,WA5 0BJ,53.403355200150700,-2.605647603587720
Parakeet and cobra,WA5 0BW,53.398952478930300,-2.612204000000000
tortoise and puff adder,WA5 0DQ,53.403505169857500,-2.602656529715890
Grackle and box turtle,WA5 0EL,53.407057664827000,-2.605820552489160
Pitohui and Coati,WA5 0EZ,53.408139584475300,-2.603398986937110
tiger snake and Viscacha,WA5 0GF,53.398235471991600,-2.613696138215920
Fulmarine petrel and sea snake,WA5 0HY,53.411059785205900,-2.605396039181760
New World blackbird and flying dragon,WA5 0JH,53.397120000000000,-2.606988000000000
tree snake and anaconda,WA5 0NN,53.399045035546200,-2.606548912449820
Pratincole and Zebra,WA5 1AZ,53.386928347021000,-2.613563513328560
Armadillo and Thicketbird,WA5 1BE,53.385366169116900,-2.618067000000000
Dorcopsis and mountain devil,WA5 1DU,53.392354042728200,-2.624633845678330
box turtle and Cuscus,WA5 1HB,53.386485167996400,-2.624487758716310
Night heron and bearded dragon,WA5 1HN,53.386439980760100,-2.627960235531520
Egret and Minke whale,WA5 1JN,53.387634368179400,-2.636653393692360
Ice seal and Coati,WA5 1NW,53.394398039747900,-2.613550681739030
amethystine python and Parakeet,WA5 1PS,53.393726000000000,-2.613363516096930
caiman and diamond python,WA5 1PX,53.394773527373100,-2.613947076506790
Logrunners and Bunting,WA5 1QD,53.395129625653900,-2.612869447176270
Cuscus and Civet,WA5 1QT,53.384174409666900,-2.631444942604760
Condor and Vulture,WA5 1TR,53.389459964502400,-2.610682893349990
worm lizard and green turtle,WA5 1UD,53.391988873401100,-2.606297000000000
adder and Treepie,WA5 1XR,53.391368551236800,-2.629145539159920
anaconda and Chicken,WA5 2AL,53.390123594308500,-2.658313105577610
Ice seal and diamondback,WA5 2BX,53.387164895360900,-2.648719893090510
Shearwater and Egret,WA5 2EP,53.383607937676400,-2.654829846743140
Jay and mamba,WA5 2JS,53.382222296290400,-2.646840682325610
Prion and caiman,WA5 2NA,53.382312869874700,-2.658222641601970
leathery turtle and Fish eagle,WA5 2NQ,53.381240478883500,-2.658717233104850
chameleon and tuatara,WA5 2PY,53.386272589805800,-2.659005431525410
B and Jay,WA5 2QY,53.386744528818400,-2.663057236684130
Gull and chameleon,WA5 2RN,53.386619155665500,-2.664588891104090
hoop snake and Flameback,WA5 2RQ,53.388076168719500,-2.662822327853900
gaboon viper and Macaw,WA5 2SJ,53.382881637131900,-2.641258034224460
Scimitar babbler and leathery turtle,WA5 2WB,53.379702288185700,-2.668615192060860
New World blackbird and terrapin,WA5 3BS,53.395989571356900,-2.652433331105320
