name,postcode,lat,lon
grass snake and Siskin,FY1 1BN,53.819437000000000,-3.051871000000000
flying dragon and gavial,FY1 1EN,53.817864731508700,-3.053684827063010
cobra de capello and Parakeet,FY1 1LL,53.820063761241800,-3.052416000000000
Parrotbill and viper,FY1 1RT,53.822052033887000,-3.054853302718540
Partridge and king snake,FY1 1SF,53.822941914146900,-3.053827443227270
tiger snake and snake,FY1 2AG,53.830478914976900,-3.053287351656110
fer-de-lance and Jackal,FY1 2DU,53.823702720282300,-3.050094155212230
horned viper and tree snake,FY1 2DW,53.824067372879900,-3.051561706284910
hognose snake and krait,FY1 2DZ,53.824724978173600,-3.051395872244960
whip snake and Francolin,FY1 2HR,53.826288856096700,-3.053455682209010
Parrotbill and water snake,FY1 2JU,53.830896204096000,-3.053875213166920
bearded dragon and box turtle,FY1 2NU,53.829003701730000,-3.051366304787120
Gull and Francolin,FY1 2QN,53.830148138638700,-3.041761868119510
bushmaster and Vole,FY1 2RU,53.833194013158900,-3.043964813972150
king cobra and Moluccan boobook,FY1 3AH,53.820390000000000,-3.048750000000000
blind snake and alligator,FY1 3AS,53.819130765219800,-3.049736767437480
Flameback and harlequin snake,FY1 3DN,53.818474182478200,-3.047730469251210
Civet and blue tongue,FY1 3EG,53.819125678597900,-3.048263192235040
Crow and Bronzewing pigeon,FY1 3HP,53.822971961556100,-3.044336000000000
king cobra and Philippine hawk-owl,FY1 3JH,53.822068276726900,-3.045814915657210
B and puff adder,FY1 3JN,53.822442148829800,-3.045201382339730
kabaragoya and swift,FY1 3LQ,53.819875207726800,-3.044772910429360
Diving bird and hognose snake,FY1 3LU,53.819645795833100,-3.043248165282400
Komodo dragon and worm lizard,FY1 3LZ,53.819258052462800,-3.042357498209760
Thicketbird and Vulture,FY1 3NJ,53.821906218133300,-3.039643258648430
Ground sloth and loggerhead,FY1 3RR,53.824200159558100,-3.040459667732060
Nukupuʻu and Petrel,FY1 3TR,53.826163062462100,-3.042133941240140
Booted eagles and Cloud rat,FY1 4BD,53.812082250614500,-3.044776481320410
Lemming and blue tongue,FY1 4HB,53.816649081484100,-3.042626899381090
massasauga and bicycle lizard,FY1 4HN,53.817697561983100,-3.040921312030960
wall lizard and Prion,FY1 4HQ,53.816963109704500,-3.038548750233720
Mouse and chameleon,FY1 4HY,53.816299599261400,-3.039398121877950
tree snake and blue tongue,FY1 4JD,53.815189885248700,-3.038839048994650
water snake and Vulture,FY1 4LH,53.817499224819300,-3.049240291715440
galliwasp and tortoise,FY1 4TE,53.816072433034000,-3.054095526869350
Maya and cayman,FY1 5AB,53.810817827733300,-3.054707820236620
bull snake and Komodo dragon,FY1 5AZ,53.809525425427700,-3.034887086694670
elapid and Kestrel,FY1 5BD,53.810985000000000,-3.055177390283310
perentie and Lemming,FY1 5BX,53.809535841830100,-3.054326334194310
galliwasp and Eagle,FY1 5HR,53.808011925341700,-3.043581836016240
Philippine hawk-owl and Linsang,FY1 5LB,53.806903285815600,-3.042901306253970
Jerboa and Armadillo,FY1 5LD,53.806875660498500,-3.045041811019340
caiman and asp,FY1 5LP,53.808712754668000,-3.038435868831050
Triller and whip snake,FY1 5NF,53.805214416601800,-3.036572730159100
giant tortoise and Civet,FY1 5PB,53.809547946981200,-3.043695932361250
pit viper and cobra de capello,FY1 5QS,53.809583341289100,-3.037546189050840
saltwater crocodile and Hawk,FY1 5RE,53.809878985190200,-3.035579204937810
Rat and Skunk,FY1 6EA,53.806207752600600,-3.053120000000000
bearded dragon and Vulture,FY1 6HT,53.802425743106800,-3.050260757199080
moloch and blue tongue,FY1 6JQ,53.802749938546100,-3.046078004601240
Treepie and mountain devil,FY1 6NN,53.801233515578700,-3.038539497909560
cayman and Lemming,FY1 6PL,53.803120996181200,-3.033347543807700
Bunting and Recurvebill,FY1 6QB,53.803987398217900,-3.035023985701230
box turtle and amethystine python,FY1 6RP,53.805852708931100,-3.034477714089150
Myna and wall lizard,FY1 9HX,53.818787249000000,-3.051657718500000
Crow and garter snake,FY1 9JX,53.818796000000000,-3.051669000000000
Elephant and cerastes,FY1 9NQ,53.818796000000000,-3.051669000000000
Hawaiian honeycreeper and Black jay,FY2 0AA,53.858076062766800,-3.038517742785660
Myna and jew lizard,FY2 0AD,53.859073082962800,-3.040671088296230
king snake and viper,FY2 0BY,53.855647989185500,-3.033455690071090
gaboon viper and Ground sloth,FY2 0DJ,53.850799076579200,-3.033944266138510
Chickadee and Asiatic leopard,FY2 0DN,53.852672911588100,-3.031360465564140
swift and giant tortoise,FY2 0GD,53.857258000000000,-3.021433000000000
Shearwater and Rabbit,FY2 0HL,53.852071238901200,-3.040664553519530
Black cockatoo and Old World warbler,FY2 0JQ,53.849153710083200,-3.037126324417730
Jay and Cloud rat,FY2 0JR,53.846044816374600,-3.041153433301200
moloch and goanna,FY2 0LB,53.844068458430500,-3.034796713661240
green turtle and Schneider python,FY2 0NB,53.858831615918000,-3.024867575537140
frill-necked lizard and constrictor,FY2 0ND,53.846646305329100,-3.033963500311690
milk snake and monitor,FY2 0NS,53.844350276197900,-3.032341379733240
Puffleg and harlequin snake,FY2 0NW,53.840135510428200,-3.032252868310410
Gull and deaf adder,FY2 0PJ,53.852915558944600,-3.025072643353010
Fish eagle and Partridge,FY2 0QY,53.844198494734400,-3.028036261053370
gopher snake and puff adder,FY2 0RQ,53.843826602476800,-3.039897648837220
Crow and diamond snake,FY2 0SD,53.835320349639000,-3.031952064102390
sand lizard and American sparrow,FY2 0WA,53.847935744337200,-3.024054102237450
hawksbill and skink,FY2 0WD,53.846439712448700,-3.024519179584410
black snake and whip snake,FY2 0XE,53.839981995406100,-3.034422364166820
gecko and Parrotbill,FY2 9AQ,53.854487787759400,-3.049070962717440
flying dragon and amphisbaena,FY2 9AR,53.854331992730200,-3.044262938912290
bearded lizard and New World blackbird,FY2 9BZ,53.857284677270400,-3.041675775721390
jew lizard and Scimitar babbler,FY2 9EQ,53.849698846512400,-3.044740426352280
puff adder and Mink,FY2 9HJ,53.851766264216700,-3.050903133604390
deaf adder and lizard,FY2 9JS,53.847138000000000,-3.052955302753760
Grosbeak and Gila monster,FY2 9NH,53.850264677020600,-3.046852322173440
bull snake and blue racer,FY2 9PN,53.843133292410800,-3.050352484699060
Maya and horned toad,FY2 9SB,53.836779836019700,-3.052974000000000
taipan and Scimitar babbler,FY2 9SH,53.833913181084300,-3.053206395313020
cayman and iguana,FY2 9SY,53.835055199996900,-3.050074299017660
Vulture and bull snake,FY2 9TA,53.835429369445600,-3.051481702319180
iguana and Perching duck,FY2 9TH,53.838208460272600,-3.048207984142370
hognose snake and diamond snake,FY2 9TU,53.838268672236000,-3.045428416994300
Pratincole and worm lizard,FY2 9UF,53.835223119351200,-3.048346155601620
fer-de-lance and Grosbeak,FY3 0BA,53.823491307219200,-2.998011619273060
Kestrel and jew lizard,FY3 0BJ,53.822146000000000,-2.990247000000000
Komodo dragon and asp,FY3 0BX,53.817639217248300,-2.990505582277750
tokay and Argus,FY3 0EA,53.817125795550100,-2.993895892859250
Civet and Black jay,FY3 7AE,53.828590678596900,-3.036861261520930
Towhee and cobra de capello,FY3 7AH,53.827658552636900,-3.038631040417030
puff adder and indigo snake,FY3 7BY,53.827485645443800,-3.029495655484670
Skunk and Treepie,FY3 7EW,53.828160413861800,-3.027324352174880
smooth snake and Bronzewing pigeon,FY3 7GZ,53.829360374292200,-3.015183449391990
Old World quail and gopher snake,FY3 7HL,53.833359896690600,-3.031022527723000
diamondback and wall lizard,FY3 7HZ,53.831932378744600,-3.033965638109820
chuckwalla and skink,FY3 7JD,53.830357179815800,-3.033182314997810
White ibis and glass snake,FY3 7LT,53.837371536168900,-3.017003313566610
Argus and Mockingbird,FY3 7NA,53.840852703851000,-3.018699000000000
fer-de-lance and White ibis,FY3 7NZ,53.835007081408900,-3.010685305689990
hawksbill and Maya,FY3 7PN,53.831660184138500,-3.018627000000000
king snake and bandy-bandy,FY3 7QA,53.827626887022300,-3.012908121726660
Quetzal and gaboon viper,FY3 7RL,53.827431090053300,-3.015866059413160
flying dragon and fer-de-lance,FY3 7RP,53.829144679424500,-3.016379000000000
Logrunners and White ibis,FY3 7SF,53.828230033689000,-3.008531776871940
Cloud rat and Chicken,FY3 7TP,53.832928151332500,-3.014190898132210
Moluccan boobook and Quetzal,FY3 7TS,53.833527295638300,-3.013491196313000
boa constrictor and soft-shelled turtle,FY3 7TT,53.834796699268200,-3.014312035975880
Thicketbird and Stint,FY3 7UT,53.836202669857400,-3.010668513315630
Perching duck and Bunting,FY3 8AL,53.822855430303900,-3.036384000000000
habu and tiger snake,FY3 8AY,53.824405895813200,-3.039538049760020
wall lizard and garter snake,FY3 8BX,53.818947111282700,-3.035711702467850
Lemming and Solitaire,FY3 8DG,53.821690790885400,-3.034412186924430
Tit-tyrant and wall lizard,FY3 8DH,53.820202260083900,-3.035043898348400
turtle and elapid,FY3 8DP,53.821490392223200,-3.037840420602390
python and Kite,FY3 8DS,53.819781784628600,-3.037934900339350
Jerboa and gecko,FY3 8FS,53.824993481873900,-3.008621132983230
wall lizard and terrapin,FY3 8PT,53.824310341290600,-3.011825424867680
bull snake and mud turtle,FY3 8QD,53.825365191620200,-3.005029469389140
goanna and rock python,FY3 9AA,53.817382008604400,-3.037921150066740
Triller and Old World warbler,FY3 9AR,53.816789837274900,-3.035719250608830
Perching duck and Snipe,FY3 9BB,53.818026588001800,-3.033015597926510
indigo snake and Armadillo,FY3 9BL,53.817324301501100,-3.036279255843910
diamondback turtle and diamondback turtle,FY3 9BP,53.818426878889600,-3.036625455083120
worm lizard and sand lizard,FY3 9EB,53.813701023571300,-3.031177741497070
Bronzewing pigeon and boa,FY3 9HF,53.810768000000000,-3.032655000000000
diamondback and milk snake,FY3 9JG,53.808493316567000,-3.029485701842610
snake and Hawk,FY3 9JR,53.805587166731100,-3.028776700535260
pit viper and Pratincole,FY3 9LF,53.808092182961000,-3.029096216425150
Philippine hawk-owl and rock python,FY3 9LX,53.804561432778900,-3.023649459682410
Capuchin and Petrel,FY3 9PP,53.807539185321300,-3.027548886019680
amethystine python and slowworm,FY3 9PX,53.807704801189700,-3.025001685437470
dukite and diamond python,FY3 9UP,53.805238309296100,-3.009543793492590
Jackal and Peafowl,FY3 9UW,53.805338372116300,-3.011535452191350
Quetzal and cycling lizard,FY3 9ZQ,53.802621246141200,-2.994661175061990
Thicketbird and Night heron,FY4 1DS,53.796403231354300,-3.050292418079300
bandy-bandy and lizard,FY4 1EB,53.792590768559500,-3.049422933237360
giant tortoise and Mamo,FY4 1JD,53.790805917211100,-3.048983691049690
Kākāriki and gopher snake,FY4 1LX,53.785667686823200,-3.052725891873710
Shearwater and tortoise,FY4 1NE,53.787519323850200,-3.056809815104170
turtle and Schneider python,FY4 1NG,53.786327000000000,-3.057554000000000
Minke whale and Marsh harrier,FY4 1PE,53.784404384431000,-3.053286186678910
soft-shelled turtle and Eagle,FY4 1PP,53.781217888838600,-3.048683767354290
Tattler and blue racer,FY4 1PU,53.781945000000000,-3.047928000000000
horned toad and Night heron,FY4 1PZ,53.782597449363400,-3.051267910439880
water snake and slowworm,FY4 1QQ,53.783641277007700,-3.052159120763710
hawksbill and Gila monster,FY4 1SA,53.782794933197800,-3.047190219452370
glass snake and sidewinder,FY4 1TL,53.789421000000000,-3.047777000000000
Logrunners and Marmoset,FY4 2DY,53.787147997681800,-3.044824538965790
terrapin and Nukupuʻu,FY4 2HE,53.790832054793200,-3.044961654720190
mountain devil and anole,FY4 2LU,53.783811303186800,-3.039884842196340
taipan and snake,FY4 2PQ,53.782138298100400,-3.043121655200550
puff adder and blind snake,FY4 2PR,53.781906052034600,-3.033615265189430
Vulture and lizard,FY4 2PU,53.779287205528000,-3.044356044607620
amethystine python and Boto,FY4 2QS,53.778453000000000,-3.042180000000000
mountain devil and Fulmarine petrel,FY4 2RG,53.776558755375700,-3.027246997708740
sea snake and Ground sloth,FY4 2RL,53.774646000000000,-3.028217000000000
Marmoset and gopher snake,FY4 3BN,53.797916153481000,-3.041721746803650
Grouse and mountain devil,FY4 3DW,53.798181153120700,-3.036034841435350
harlequin snake and diamondback,FY4 3EG,53.794515629355600,-3.031663358530690
sea snake and moloch,FY4 3EP,53.794014000000000,-3.036399000000000
Parrotbill and Shearwater,FY4 3EQ,53.793197128670200,-3.036549569859270
snapping turtle and Dorcopsis,FY4 3HZ,53.791590704553400,-3.032092510300370
copperhead and skink,FY4 3JL,53.790838027722200,-3.032863384989020
milk snake and Hawaiian honeycreeper,FY4 3JP,53.790189408634000,-3.036156622660530
Jay and Pitohui,FY4 3LF,53.789350973570300,-3.032280386231790
Jackal and Black cockatoo,FY4 3LG,53.788352318619500,-3.026108352246260
Flameback and Wader,FY4 3LZ,53.787168846318200,-3.026808037223940
racer and Ice seal,FY4 3PB,53.786798281921500,-3.032278415553760
horned viper and Booted eagles,FY4 4AJ,53.795779109423600,-3.030024386560890
Francolin and boa,FY4 4BA,53.797297176483100,-3.030137507870640
Kestrel and Jay,FY4 4BD,53.798918789145900,-3.029706594143400
box turtle and Moluccan boobook,FY4 4PR,53.793691181499700,-3.015581668954260
Tahr and Mole,FY4 4PW,53.793222195357800,-3.011517069974560
Songlark and cayman,FY4 4RP,53.800637588948700,-2.998653006874760
Puffleg and king cobra,FY4 4UN,53.795563968181900,-3.000232774274190
Civet and Gila monster,FY4 4YJ,53.795290402400100,-3.022011738390250
pit viper and king snake,FY4 5BP,53.792299680424600,-3.015381060201640
adder and Stint,FY4 5DG,53.782567015916500,-3.021674000000000
Gila monster and death adder,FY4 5EL,53.779930856673200,-3.009087847578690
king cobra and thorny devil,FY4 5GP,53.785361000000000,-2.988607000000000
brown snake and Rabbit,FY4 5HQ,53.786621209402600,-3.014059984473310
Zebra and glass snake,FY4 5HR,53.789176833034200,-3.011586691919470
Tree warbler and Schneider python,FY4 5HU,53.789811782395400,-3.007700832179840
green turtle and Shearwater,FY4 5JA,53.781263000000000,-3.007951000000000
snake and snapping turtle,FY4 5JL,53.789158365083900,-2.972545152546380
lizard and Fulmarine petrel,FY4 5LB,53.787014367932600,-2.996113280680230
Parakeet and Hawk,FY4 5NS,53.787968161023300,-3.015276429753920
coral snake and Gila monster,FY4 5PA,53.787907282032600,-3.022439381587920
Elephant and Warbler,FY4 5RJ,53.787842862309700,-2.971831672239980
Coati and garter snake,FY5 1NW,53.869490939659000,-3.041659758759000
Logrunners and tuatara,FY5 1PR,53.866687595597800,-3.043612674251980
frill-necked lizard and Asiatic leopard,FY5 1QT,53.861361337856300,-3.048330627991730
diamondback and blue racer,FY5 1RE,53.864104000000000,-3.044121484362770
boomslang and dukite,FY5 3AA,53.861417378021100,-3.037749004962450
blind snake and harlequin snake,FY5 3AJ,53.862129092187100,-3.036519751890350
B and Piping shrike,FY5 3ED,53.871262762698400,-3.038418641312450
Ground sloth and Macaw,FY5 3EN,53.870454252747500,-3.038368190474000
Gull and Booted eagles,FY5 3ER,53.867672639047900,-3.036778501442740
Philippine hawk-owl and pit viper,FY5 3EZ,53.863079482770000,-3.026339970903820
cycling lizard and racer,FY5 3FB,53.871045599713700,-3.021835484495430
Eagle and hoop snake,FY5 3FG,53.870494268662700,-3.024301069352170
Puffleg and Hawaiian honeycreeper,FY5 3NP,53.873930512077800,-3.035503584913350
cobra and loggerhead,FY5 3NY,53.871403167007800,-3.036733909231130
Puffleg and water snake,FY5 3PG,53.871113571334100,-3.033837034949070
viper and racer,FY5 3RE,53.869590863263600,-3.033221551743920
Bronzewing pigeon and death adder,FY5 3RJ,53.866933842599300,-3.030722856398060
Kestrel and Snipe,FY5 3RU,53.869362278618600,-3.029489868339320
Night heron and Parrotlet,FY5 3SD,53.865964115528100,-3.029558476043300
Nukupuʻu and cobra de capello,FY5 3SN,53.867018272228700,-3.028215694048360
krait and gavial,FY5 3TL,53.871708384802500,-3.026323150284920
Fulmarine petrel and dugite,FY5 3TP,53.870145271019900,-3.026224036185200
loggerhead and black snake,FY5 4DQ,53.872856993340100,-2.996692562658820
Songlark and Wader,FY5 4EP,53.873617549077200,-2.992771300932820
amphisbaena and gecko,FY5 4PZ,53.872843942319400,-3.001498478536450
Philippine hawk-owl and Argus,FY5 5DD,53.868754942412100,-3.002495750196410
Zebra and Prion,FY5 5DY,53.870246733701300,-3.010029296200220
Polecat and Duck,FY5 5EE,53.866595834224800,-3.012238000000000
bull snake and agama,FY5 5NH,53.861793536517900,-3.006252311755220
chuckwalla and Gila monster,FY6 6EG,53.843986000000000,-2.973461000000000
bicycle lizard and Boto,FY6 6RE,53.844022000000000,-2.973461000000000
River dolphin and goanna,FY6 6RH,53.844022000000000,-2.973461000000000
Treepie and Recurvebill,FY6 7AS,53.846540182118500,-2.992251922953230
Eagle and Coati,FY6 7BY,53.849074900187100,-2.995748000000000
hawksbill and dukite,FY6 7DR,53.843623917686800,-2.997077013430520
Dorcopsis and massasauga,FY6 7EH,53.843779487189900,-2.988052487428590
Zebra and loggerhead,FY6 7EW,53.844608392047200,-2.983436218446610
harlequin snake and anaconda,FY6 7FB,53.857519349076900,-3.010026760493660
frilled lizard and Jerboa,FY6 7FQ,53.844840158434000,-3.008566291099820
brown snake and Tattler,FY6 7FR,53.844542235132200,-3.009790273867400
racer and chameleon,FY6 7FS,53.843981329538900,-3.009153607840230
python and carpet snake,FY6 7HZ,53.849088696055300,-2.986535000000000
diamondback and carpet snake,FY6 7JN,53.844850907828700,-2.986740175376240
Piping shrike and thorny devil,FY6 7JU,53.855929997225400,-2.980585029790620
garter snake and python,FY6 7LB,53.855665291609500,-2.971137581704760
mountain devil and anole,FY6 7LF,53.849257837907100,-2.951927195094640
Mink and galliwasp,FY6 7NF,53.851701268548000,-3.004991614704970
Jay and leguaan,FY6 7NJ,53.853305009975700,-3.005607743328910
diamondback terrapin and lizard,FY6 7QA,53.852629301054000,-3.006868529675170
loggerhead and wall lizard,FY6 7RD,53.841786648494200,-3.013599522493010
Philippine hawk-owl and Nukupuʻu,FY6 7SP,53.844168549101000,-2.993183770717240
goanna and cayman,FY6 7TR,53.854316108802800,-2.999702873981750
dukite and Masked owl,FY6 7TU,53.853552890192400,-2.998529283152440
Zebra and Fulmarine petrel,FY6 7UQ,53.841341563954400,-3.005609729774650
massasauga and sand lizard,FY6 7YU,53.857562000000000,-2.978580000000000
Mockingbird and Mink,FY6 7ZN,53.849874253170800,-3.014509822843010
sand lizard and mamba,FY6 8AB,53.842787736199200,-2.994944523672530
Dorcopsis and Kestrel,FY6 8BW,53.833651449784500,-2.994363214123460
alligator and copperhead,FY6 8DG,53.831889580266700,-2.990036557387540
puff adder and Nukupuʻu,FY6 8DU,53.841883794972100,-2.973660620178570
perentie and gopher snake,FY6 8ER,53.836650521268800,-2.988203739809630
puff adder and Mink,FY6 8ET,53.835223054279400,-2.986908861995090
copperhead and turtle,FY6 8EU,53.836320772000900,-2.987861655037080
Goose and Logrunners,FY6 8EY,53.834287862825500,-2.990229897447340
Piping shrike and horned viper,FY6 8FE,53.832267730578700,-2.985593385774820
puff adder and boa,FY6 8FY,53.839933000000000,-2.985585000000000
elapid and Wader,FY6 8HX,53.841636720061600,-2.984111271357430
Nukupuʻu and glass snake,FY6 8LF,53.822908000000000,-2.961675000000000
water snake and krait,FY6 8LT,53.843693696775100,-2.945296000000000
Maya and Hawaiian honeycreeper,FY6 8NB,53.852811178424200,-2.928611618358330
Tit-tyrant and Shearwater,FY6 9AB,53.874300842123300,-2.955096934354390
Stint and cycling lizard,FY6 9BZ,53.874256953857400,-2.949300914418560
soft-shelled turtle and Argus,FY6 9DB,53.869955761196900,-2.947637013292790
Dolphin and Songlark,FY8 1BA,53.739829993176500,-2.997695551858160
king cobra and Masked owl,FY8 1BG,53.740289861275500,-2.999677463857220
rattlesnake and Darwin's finches,FY8 1DR,53.742320994705800,-3.012553081832960
mamba and racer,FY8 1DU,53.741754382541900,-3.004048621175590
Schneider python and amphisbaena,FY8 1EN,53.743484139501400,-3.014248965283200
Siskin and gavial,FY8 1EY,53.744304457511700,-3.011842625153490
amphisbaena and rock python,FY8 1JB,53.743424456223900,-3.022329311400030
Schneider python and glass snake,FY8 1JD,53.744120880324800,-3.020769261269830
cycling lizard and blind snake,FY8 1NR,53.747144558760000,-3.026665614930290
Rabbit and bandy-bandy,FY8 1NW,53.745309838527200,-3.025741390837940
crocodile and cerastes,FY8 1PL,53.749518965961100,-3.026496047799830
alligator and Partridge,FY8 1QG,53.750050633342400,-3.030527796547660
Songlark and Grosbeak,FY8 1TT,53.750654837650300,-3.024006284582270
horned viper and Diving bird,FY8 1UE,53.751865406361400,-3.029586444581170
Songlark and iguana,FY8 2FA,53.771444130900000,-3.050761936800000
Peafowl and milk snake,FY8 2FW,53.776256000000000,-3.052502000000000
constrictor and blindworm,FY8 2FX,53.777958000000000,-3.046019000000000
Nukupuʻu and White ibis,FY8 2HE,53.759582718486500,-3.033157868519010
Armadillo and Quetzal,FY8 2JU,53.759947409962000,-3.035684842852040
slowworm and Wallaby,FY8 2QW,53.757203507957300,-3.042184977558450
whip snake and king snake,FY8 2RE,53.761376288998200,-3.041939433186040
Grosbeak and elapid,FY8 2SL,53.777174273682000,-3.047520676081890
Thrasher and Mouse,FY8 2SR,53.776625110579100,-3.051725600447620
Songlark and Herring gull,FY8 2TX,53.756292000000000,-3.032983000000000
Kite and horned viper,FY8 2TY,53.756292000000000,-3.032983000000000
Mouse and king cobra,FY8 3AP,53.764136651158800,-3.024106832557030
slowworm and Badger,FY8 3BG,53.761956153657900,-3.024435000000000
Buzzard and milk snake,FY8 3DA,53.767091157578800,-3.024421496873610
Stilt and Gila monster,FY8 3DS,53.766515509454800,-3.011769918656740
cerastes and Tattler,FY8 3EA,53.768296028303700,-3.015924294220120
Prion and Fulmarine petrel,FY8 3ES,53.762952090740900,-3.013307401240730
water snake and thorn lizard,FY8 3EW,53.761697813317400,-3.016007686962590
Nukupuʻu and agamid,FY8 3FR,53.768200000000000,-3.017834000000000
rat snake and cobra,FY8 3FT,53.756433000000000,-3.018608000000000
goanna and Pheasant,FY8 3HG,53.766010747698600,-3.014063763986160
Chickadee and perentie,FY8 3HL,53.760604847402600,-3.018757225231720
Moluccan boobook and diamondback turtle,FY8 3HP,53.760086266520000,-3.015255841066900
taipan and Old World warbler,FY8 3JL,53.757660756597400,-3.011905880908520
grass snake and cayman,FY8 3LH,53.752708391061900,-3.014001075743570
Polecat and Kite,FY8 3LS,53.748375291395000,-3.003402804416070
diamondback turtle and Triller,FY8 3NL,53.752845139479300,-3.009515173392620
Goose and anaconda,FY8 3NN,53.751922594152700,-3.006990679070020
Philippine hawk-owl and Jackal,FY8 3PA,53.751537448729300,-3.003614674120030
Kestrel and diamondback turtle,FY8 3PS,53.752093520942400,-3.001610865246410
Grouse and asp,FY8 3RF,53.758501040297100,-3.004979033154070
glass snake and Grouse,FY8 3RP,53.762397441327500,-3.010866899888220
terrapin and gopher snake,FY8 3TA,53.754694000000000,-3.011000000000000
rattlesnake and Polecat,FY8 4AY,53.748308846032700,-2.994120514195920
boomslang and Cloud rat,FY8 4BQ,53.750881550475900,-2.993877963274750
thorny devil and Grosbeak,FY8 4ED,53.744716373730000,-2.992686158596240
sea snake and crocodile,FY8 4EH,53.741233312419500,-2.986706029909350
monitor and Hawk,FY8 4HB,53.743691811885300,-2.952619000000000
gecko and mountain devil,FY8 4HY,53.740245509702900,-2.955540932917470
Songlark and Siskin,FY8 4JA,53.740919417400600,-2.953312274153570
Greenbul and Rat,FY8 4LL,53.745878733666200,-2.945996000000000
Francolin and Jerboa,FY8 4NH,53.765175820909500,-2.974948937803560
tiger snake and Duck,FY8 4QY,53.749382365205700,-2.988216378578580
Condor and mud turtle,FY8 4RA,53.742375379039700,-2.981168193032230
sand lizard and monitor,FY8 4RE,53.741355657844900,-2.981659941049350
rat snake and Armadillo,FY8 4RF,53.740900199909600,-2.979102130681460
Minke whale and turtle,FY8 4RW,53.740005738850300,-2.980764264150880
Polecat and carpet snake,FY8 4UB,53.754859172397400,-2.991135680057070
Philippine hawk-owl and tree snake,FY8 5DY,53.738797425410000,-2.951141687613690
indigo snake and anaconda,FY8 5ES,53.736626097155100,-2.960388000000000
Hawaiian honeycreeper and River dolphin,FY8 5FA,53.739598411649800,-2.952145267090480
Cloud rat and bushmaster,FY8 5HT,53.737864449489600,-2.961201000000000
Thicketbird and Puffleg,FY8 5LE,53.736417696693100,-2.965474988770790
king snake and anole,FY8 5LG,53.736706906140000,-2.964162670079980
Rabbit and Komodo dragon,FY8 5NH,53.738450620502400,-2.969736342276970
Chickadee and hawksbill,FY8 5PE,53.738603064551400,-2.978624213186360
loggerhead and Polecat,FY8 5PN,53.738514066387600,-2.980714363040000
mamba and grass snake,FY8 5PS,53.736978204242400,-2.980572474466350
brown snake and loggerhead,FY8 5QL,53.737482768881600,-2.975064000000000
Kākāriki and habu,FY8 5QZ,53.738106292522700,-2.984404116120450
Jerboa and Jerboa,FY8 5RB,53.737939000000000,-2.983139082714280
rat snake and sidewinder,FY8 5TP,53.738283181727100,-2.944565414367320
diamondback turtle and green turtle,FY8 9ST,53.749843476761700,-3.033707407236360
racer and Puffleg,PR0 2AF,53.758809377700000,-2.683907445800000
Elephant and Gull,PR0 2AG,53.758809377700000,-2.683907445800000
Night heron and Dorcopsis,PR0 2AH,53.758809377700000,-2.683907445800000
Grackle and gopher snake,PR1 0BA,53.753154711216100,-2.730405026707460
Petrel and adder,PR1 0LN,53.738940000000000,-2.741402768434050
chuckwalla and mud turtle,PR1 0LS,53.744338000000000,-2.745066000000000
king cobra and indigo snake,PR1 0NL,53.741754583096000,-2.742594507768200
Old World vulture and smooth snake,PR1 0RA,53.747486002578400,-2.735811176571350
tokay and Nukupuʻu,PR1 0RH,53.742207534157000,-2.739115225910940
Crow and diamondback turtle,PR1 0SX,53.745995555344900,-2.732615975020870
hoop snake and Jackal,PR1 0XB,53.734178717510300,-2.730697425499580
smooth snake and bull snake,PR1 0XS,53.741562480029000,-2.734388580197960
Diving bird and viper,PR1 0YJ,53.739854816659900,-2.732903323194410
Chickadee and Vulture,PR1 1DJ,53.760536000000000,-2.697149376135330
rat snake and Schneider python,PR1 1HQ,53.761290000000000,-2.692533000000000
Towhee and Diving bird,PR1 1RU,53.767157000000000,-2.702259250601380
goanna and alligator,PR1 1TJ,53.765894466234400,-2.698161220240540
bicycle lizard and Ice seal,PR1 1WX,53.754250000000000,-2.708372000000000
