name,postcode,lat,lon
Argus and diamondback turtle,PR1 1WY,53.754250000000000,-2.708372000000000
kabaragoya and diamondback turtle,PR1 1YR,53.765356872107300,-2.699411436841850
cobra and Condor,PR1 2AH,53.758315357203900,-2.699750000000000
amphisbaena and Siskin,PR1 2BA,53.760909000000000,-2.700974182200000
Logrunners and Eagle,PR1 2JB,53.754266000000000,-2.708369000000000
Masked owl and wall lizard,PR1 2RU,53.764142923958500,-2.702576935579440
saltwater crocodile and Recurvebill,PR1 3BN,53.757556420340700,-2.697643687433210
lizard and whip snake,PR1 3LB,53.755012144794700,-2.702363827093070
galliwasp and worm lizard,PR1 3LY,53.754063142949500,-2.698647418354090
bull snake and goanna,PR1 3SD,53.757461706948300,-2.695382160442880
Linsang and leathery turtle,PR1 3TJ,53.756000284046800,-2.697845394364640
dugite and Chickadee,PR1 3XX,53.758262901389500,-2.695167883751970
Parakeet and Rat,PR1 4AY,53.756464337189400,-2.682822464091570
Schneider python and Pheasant,PR1 4BE,53.756697050509400,-2.681415689989380
B and fer-de-lance,PR1 4BT,53.757561056635900,-2.682900000000000
worm lizard and diamondback turtle,PR1 4HY,53.758180362154000,-2.686096206661100
goanna and Stint,PR1 4JU,53.756695832172800,-2.684782790051560
iguana and Goose,PR1 4LB,53.756017831787500,-2.687031635101210
Elephant and anaconda,PR1 4LJ,53.754838324386900,-2.690515850762320
Ibex and flying dragon,PR1 5BD,53.763642192136200,-2.690128000000000
Eagle and Chicken,PR1 5DB,53.766478334353100,-2.684198659101530
skink and Goose,PR1 5ED,53.767718000000000,-2.678211000000000
moloch and Polecat,PR1 5HA,53.767005026539500,-2.680095906136910
Chicken and Recurvebill,PR1 5NZ,53.762107796798200,-2.681442642443540
hognose snake and tree snake,PR1 5PQ,53.764164268056800,-2.683341849672010
amethystine python and Grackle,PR1 6AB,53.771479000000000,-2.702441000000000
Prion and leathery turtle,PR1 6AP,53.771743587700000,-2.705587041700000
Zebra and garter snake,PR1 6HQ,53.773864000000000,-2.684759000000000
saltwater crocodile and Gila monster,PR1 6LL,53.769889346279400,-2.691248420295010
Triller and Old World warbler,PR1 6LY,53.769712583471400,-2.693839911459440
Ibex and Darwin's finches,PR1 6QW,53.765893000000000,-2.690786961100000
chuckwalla and Scimitar babbler,PR1 6QY,53.773415000000000,-2.678394000000000
Old World vulture and mud turtle,PR1 6TD,53.770018849245800,-2.689050606378240
rock snake and Treepie,PR1 6TJ,53.768099740817500,-2.688290945694930
Peafowl and Condor,PR1 6TT,53.767975405454800,-2.689275000000000
Tit-tyrant and blindworm,PR1 7BE,53.763141460738500,-2.706276751301220
Coati and tuatara,PR1 7NB,53.768958000000000,-2.712261000000000
Lemming and Meadowlark,PR1 7NU,53.768199324675700,-2.715087000000000
crocodile and Boto,PR1 7PN,53.770163472529900,-2.714997230609300
Lemming and coral snake,PR1 7PY,53.771715256983600,-2.714022215545040
saltwater crocodile and ringhals,PR1 7QT,53.765052305295700,-2.711451543414580
sand lizard and constrictor,PR1 7RB,53.768771712353000,-2.710224866322230
Coati and hawksbill,PR1 7TH,53.769379951242000,-2.707686273460760
tortoise and Petrel,PR1 7XS,53.770993095462700,-2.711521684152800
swift and Chickadee,PR1 7XX,53.772877274961800,-2.712205000000000
Grouse and Kite,PR1 8AY,53.757235757493100,-2.703295818007080
python and puff adder,PR1 8ED,53.752366878268400,-2.714983018456960
Myna and crocodile,PR1 8ES,53.749832412714800,-2.713438655959130
hawksbill and puff adder,PR1 8EX,53.749764507959500,-2.711253782802260
Mouse and rat snake,PR1 8HJ,53.756766000000000,-2.705426000000000
Magpie and massasauga,PR1 8PS,53.757505090537900,-2.715495008071770
indigo snake and Thicketbird,PR1 8RQ,53.760476203395000,-2.707081453507710
loggerhead and Coati,PR1 9ED,53.734958122214400,-2.720736048962470
Jay and Old World warbler,PR1 9EE,53.735524446972000,-2.719108000000000
flying dragon and Fish eagle,PR1 9EJ,53.736290008680000,-2.718969975184940
Tit-tyrant and Black cockatoo,PR1 9EN,53.736031835335300,-2.717055432930700
Marmoset and Buzzard,PR1 9HD,53.739001727724300,-2.719425617183240
glass snake and Night heron,PR1 9JY,53.743804000000000,-2.715835000000000
constrictor and Tree warbler,PR1 9NE,53.736039000000000,-2.708492064779480
Ground sloth and Darwin's finches,PR1 9QL,53.744101494020400,-2.711324899335020
copperhead and Zebra,PR1 9SB,53.732470795675900,-2.699092609175270
kabaragoya and tokay,PR1 9TU,53.731269532086700,-2.710774703844430
Thrasher and B,PR1 9UR,53.733344981064300,-2.709399957369640
adder and Meadowlark,PR1 9ZG,53.736066000000000,-2.694282000000000
worm lizard and Rabbit,PR11 2AW,53.796647095260900,-2.684993424823000
bushmaster and tree snake,PR11 2BD,53.796647095260900,-2.684993424823000
saltwater crocodile and turtle,PR2 0RX,53.754250000000000,-2.708372000000000
box turtle and Egret,PR2 0TX,53.754250000000000,-2.708372000000000
Grackle and Crow,PR2 0XP,53.754266000000000,-2.708369000000000
Tit-tyrant and Bronzewing pigeon,PR2 0ZJ,53.759885706506700,-2.698956449959730
Polecat and Mamo,PR2 1BN,53.764492759643700,-2.726809342787600
rock snake and Fulmarine petrel,PR2 1JD,53.771979819354900,-2.731262955918260
Eagle and Snipe,PR2 1NE,53.766132807664800,-2.750913519226810
Philippine hawk-owl and Tit-tyrant,PR2 1PS,53.763871358276600,-2.754635280901070
River dolphin and horned toad,PR2 1QX,53.763806000000000,-2.772064000000000
Black cockatoo and tree snake,PR2 1RX,53.773878350075900,-2.759837249952840
gavial and tree snake,PR2 1SP,53.771156815482800,-2.746663880662060
Night heron and Tattler,PR2 1TT,53.769801108002900,-2.762130428075600
rock snake and rat snake,PR2 1XA,53.774082602054100,-2.751677572065070
lizard and Duck,PR2 1XD,53.773041477677400,-2.755725373606150
Pratincole and boa constrictor,PR2 1XN,53.765998228330200,-2.769297927962030
Moluccan boobook and dugite,PR2 1XQ,53.765414379818100,-2.772033100506130
Marsh harrier and New World blackbird,PR2 1YA,53.766707000000000,-2.773720659131530
king snake and gaboon viper,PR2 2AS,53.767363621869400,-2.718757582296310
Booted eagles and Komodo dragon,PR2 2BH,53.771176416486100,-2.718458598206100
Greenbul and Minke whale,PR2 2BQ,53.770515340332000,-2.722270706472390
Crow and bicycle lizard,PR2 2DU,53.771039912043800,-2.726194198148130
rock python and amphisbaena,PR2 2DZ,53.771821038200000,-2.724250752000000
Tattler and massasauga,PR2 2EQ,53.774371999496000,-2.723641871913740
water snake and Armadillo,PR2 2HN,53.773500488603600,-2.722094372580580
Vulture and rock python,PR2 2HQ,53.773813218087100,-2.719414047884650
Argus and Francolin,PR2 2LP,53.771620460216900,-2.728404000000000
sand viper and Myna,PR2 2RL,53.764843905419800,-2.722567000000000
mud turtle and Triller,PR2 2RY,53.765927345717400,-2.725908722759970
Partridge and puff adder,PR2 2SS,53.767325000000000,-2.723885000000000
cobra and deaf adder,PR2 2YF,53.759799458858800,-2.730414000000000
Dolphin and Old World warbler,PR2 2YJ,53.759151625676800,-2.733831000000000
Goose and Fulmarine petrel,PR2 3AA,53.773966959079000,-2.713241077685030
diamond snake and Thicketbird,PR2 3FQ,53.789838343669600,-2.724029560130720
Civet and worm lizard,PR2 3GE,53.783099126897400,-2.735523725058780
Old World quail and Scimitar babbler,PR2 3JB,53.781957076070900,-2.716320830255520
diamondback terrapin and Cloud rat,PR2 3LH,53.798192000000000,-2.716112000000000
Rabbit and massasauga,PR2 3QE,53.777397799615100,-2.718200697857490
hawksbill and Parrotlet,PR2 3QS,53.779355544358900,-2.719979309628660
mamba and bull snake,PR2 3RP,53.776329664102000,-2.725420606926790
mountain devil and bearded dragon,PR2 3RS,53.777310542460700,-2.726712201307420
Shearwater and blind snake,PR2 3SR,53.775533087416100,-2.726347656286250
galliwasp and anole,PR2 3TA,53.777212361069400,-2.738364637078140
crocodile and lizard,PR2 3UN,53.779100247625500,-2.739763568684870
Darwin's finches and swift,PR2 3UP,53.778170629338600,-2.738927763807540
Logrunners and Solitaire,PR2 3UU,53.795236897701900,-2.721602500485140
lizard and Thrasher,PR2 3XX,53.777185784866100,-2.744115363180340
cobra and Chicken,PR2 7AJ,53.784773590848100,-2.746723579740360
Francolin and copperhead,PR2 7AT,53.784722214509800,-2.737601066919910
Cloud rat and Mockingbird,PR2 7DB,53.793597663493800,-2.731062203074170
Peafowl and whip snake,PR2 7DJ,53.787996681147000,-2.745870122118480
Prion and Linsang,PR2 8EP,53.779482088398100,-2.697051376742080
bearded dragon and American sparrow,PR2 8EY,53.780659073891600,-2.697131592990930
Quetzal and king cobra,PR2 8FA,53.780265462105100,-2.678003673602800
diamond snake and mud turtle,PR2 8FX,53.788180186119400,-2.699017041168360
Jerboa and B,PR2 8LJ,53.779094166710400,-2.709549394213840
Piping shrike and River dolphin,PR2 8NB,53.777029243798300,-2.709150361400270
Old World warbler and Petrel,PR2 8PE,53.776898405441300,-2.700832522943340
Kite and kabaragoya,PR2 9FJ,53.795452560942500,-2.701931349502420
Argus and Wader,PR2 9LJ,53.795092000000000,-2.691390000000000
cobra de capello and moloch,PR2 9NQ,53.788073428348800,-2.675306407586300
snapping turtle and king cobra,PR2 9PU,53.793932909733100,-2.702042592527600
taipan and Wader,PR2 9QN,53.787861980408500,-2.708817038629090
Solitaire and Jackal,PR2 9SN,53.796260103727100,-2.712829975888260
Chicken and Darwin's finches,PR2 9SW,53.798213255184100,-2.709340837434600
Old World quail and Pheasant,PR2 9TB,53.796990527096700,-2.704826393680960
thorn lizard and loggerhead,PR2 9TF,53.795128218699100,-2.702062561578160
Towhee and Linsang,PR2 9UE,53.794918982298600,-2.716162232958710
Elephant and worm lizard,PR2 9WJ,53.791666582486700,-2.697648121935870
cobra de capello and blind snake,PR2 9WS,53.797506000000000,-2.693752000000000
Grackle and Logrunners,PR2 9XJ,53.790367664737600,-2.713701516743690
Tahr and Cuscus,PR2 9YB,53.789351000000000,-2.717084000000000
Macaw and fer-de-lance,PR2 9ZX,53.754250000000000,-2.708372000000000
Mink and Badger,PR25 1AU,53.685137461389800,-2.712980211692540
fer-de-lance and cobra,PR25 1GQ,53.694942107281200,-2.713251956360460
Maya and Komodo dragon,PR25 1HS,53.690071157424900,-2.714638495482300
alligator and Gila monster,PR25 1JA,53.689488000000000,-2.714624793182260
snapping turtle and Myna,PR25 1JU,53.684572607778600,-2.715756667277960
Darwin's finches and gavial,PR25 1TX,53.690664248482900,-2.720660510651920
harlequin snake and Scimitar babbler,PR25 1UP,53.689701618023700,-2.716313124784070
death adder and leguaan,PR25 2DL,53.694753884864900,-2.707099921266200
swift and Mamo,PR25 2EL,53.689801402644700,-2.693251766161400
water snake and Armadillo,PR25 2FH,53.690022054475400,-2.693951981389830
Herring gull and Black jay,PR25 2LJ,53.693127953100300,-2.697743735529630
bearded dragon and dukite,PR25 2TF,53.695244230316000,-2.695506977351680
Guillemot and Marmoset,PR25 2TX,53.697486250944200,-2.696376977112220
frilled lizard and snapping turtle,PR25 2XL,53.697634533688900,-2.704830882923390
Flameback and king cobra,PR25 2YB,53.695843892884000,-2.691291318738290
Booted eagles and Night heron,PR25 3AD,53.688939653505800,-2.686817036600800
Boto and Dolphin,PR25 3AN,53.687561000000000,-2.692246000000000
python and Grosbeak,PR25 3AQ,53.687396620851500,-2.683157766463820
diamondback turtle and Old World warbler,PR25 3BN,53.683254620507100,-2.692115000000000
lizard and terrapin,PR25 3EH,53.691807209975800,-2.688499000000000
sand lizard and Goose,PR25 3EP,53.689554835426200,-2.687690207138750
Puffleg and Vulture,PR25 3JQ,53.684462811692400,-2.683791619553350
Recurvebill and amphisbaena,PR25 3NA,53.695191722368900,-2.692159044957860
Maya and Duck,PR25 3NH,53.697210778447000,-2.689617392128060
tuatara and mamba,PR25 3SL,53.696789327222800,-2.689443898381920
Badger and tortoise,PR25 3UD,53.703868813537000,-2.694679750229970
black snake and anole,PR25 4QG,53.704594832825600,-2.684102932058020
agamid and Towhee,PR25 4QZ,53.707921852315900,-2.679127233830620
perentie and Magpie,PR25 4XR,53.702176688925800,-2.682579234968360
agama and Chipmunk,PR25 9DU,53.700203391883900,-2.706661154036890
boa constrictor and mountain devil,PR25 9EW,53.700208740300000,-2.706661586000000
B and Pitohui,PR25 9FH,53.700221000000000,-2.706657000000000
chuckwalla and amethystine python,PR25 9SA,53.690359434151700,-2.703906724136270
smooth snake and Egret,PR25 9SL,53.690359434151700,-2.703906724136270
ringhals and rock python,PR25 9ZZ,53.700204000000000,-2.706661000000000
tuatara and chameleon,PR26 6PN,53.711905000000000,-2.708601484358570
Gila monster and bicycle lizard,PR26 6PR,53.719971061223200,-2.700127846529170
Nukupuʻu and Puffleg,PR26 6RR,53.707614819585800,-2.708845722045880
Fulmarine petrel and diamondback,PR26 6TW,53.706955923341700,-2.697063613625330
Ice seal and cerastes,PR26 7AP,53.690946488467000,-2.743592759829720
Piping shrike and Hawaiian honeycreeper,PR26 7RZ,53.693802953216600,-2.724833474679520
bearded lizard and Night heron,PR26 7SE,53.689066000000000,-2.725085000000000
rattlesnake and Magpie,PR26 7SG,53.686795301031900,-2.728740880250000
Puffleg and tree snake,PR26 7SR,53.693878378362500,-2.728696658652950
ringhals and Dorcopsis,PR26 7SS,53.691465404826100,-2.736711475500000
Mole and Cuscus,PR26 9AP,53.677338038657700,-2.791282311035470
bearded dragon and cerastes,PR26 9BE,53.673115000000000,-2.792505000000000
lizard and brown snake,PR26 9HW,53.668923419272600,-2.775020137811610
turtle and Recurvebill,PR26 9RT,53.662914916519800,-2.781205438800370
skink and Boto,PR26 9RU,53.661965319300400,-2.782095868336140
Quetzal and Tahr,PR26 9SE,53.666028039242300,-2.777963665986260
diamondback and amethystine python,PR3 0GL,53.861489770785600,-2.731621000000000
agamid and garter snake,PR3 0QY,53.853375882629800,-2.741620547224320
iguana and turtle,PR3 0TP,53.865186384215300,-2.821618143415140
Herring gull and giant tortoise,PR3 0TT,53.847389145695000,-2.801798140275170
mamba and bearded dragon,PR3 0TX,53.852265642221100,-2.809097059868750
thorny devil and Dolphin,PR3 0TY,53.869742675119900,-2.823030581497450
habu and monitor,PR3 0TZ,53.865197664299000,-2.818653082686910
Jerboa and bicycle lizard,PR3 0UB,53.863056621694700,-2.825484290384700
slowworm and Fox,PR3 0UX,53.853948122033300,-2.865515650630800
cycling lizard and brown snake,PR3 0XP,53.855402860297000,-2.875610118132040
king cobra and puff adder,PR3 0ZF,53.855851423906000,-2.868306723655200
Hawaiian honeycreeper and diamond python,PR3 0ZN,53.848137287007200,-2.882236000000000
Linsang and moloch,PR3 2JN,53.818629564508100,-2.702516231299200
Stilt and leathery turtle,PR3 5AE,53.830867621424300,-2.739034801358980
Elephant and Eagle,PR3 5EB,53.814720000000000,-2.706671000000000
Masked owl and Pitohui,PR4 0DB,53.768765863831000,-2.812982259190500
diamondback and Black jay,PR4 0DE,53.783189227433400,-2.758563719127190
bull snake and Grackle,PR4 0HN,53.813185638179500,-2.800977909737640
horned viper and Pitohui,PR4 0LA,53.792215848188400,-2.746719182143340
Asiatic leopard and Coati,PR4 0PB,53.785939163322600,-2.755790264816390
amethystine python and terrapin,PR4 0RJ,53.772651270471400,-2.792482662523820
racer and saltwater crocodile,PR4 0RT,53.788561216922700,-2.781413663149790
skink and bull snake,PR4 0YB,53.766638440626800,-2.815430000000000
king snake and Flameback,PR4 0ZJ,53.784594045233700,-2.796821000000000
perentie and Duck,PR4 0ZT,53.769134000000000,-2.815520000000000
White ibis and Gull,PR4 1BN,53.753838906505500,-2.895820715432490
lizard and Ice seal,PR4 1BS,53.751394844346700,-2.898119356533610
galliwasp and Puffleg,PR4 1DU,53.747300204935100,-2.901170960560630
turtle and Cloud rat,PR4 1EE,53.754361215222500,-2.866348001078160
python and Warbler,PR4 1EP,53.755088401100000,-2.896560527300000
moloch and Flameback,PR4 1FJ,53.754811000000000,-2.900100000000000
flying lizard and Ice seal,PR4 1HB,53.749005354071700,-2.859944450325620
Egret and boa,PR4 1JE,53.768956278700300,-2.867862311422290
Mink and Puffleg,PR4 1JT,53.769394742707400,-2.868950000000000
loggerhead and Argus,PR4 1PB,53.753881105572700,-2.861879200810550
Prion and galliwasp,PR4 1PD,53.753613279828300,-2.862661000000000
skink and tokay,PR4 1RS,53.752204570462800,-2.876161374713990
mamba and Minke whale,PR4 1SB,53.750594169219800,-2.870198255910810
Crow and skink,PR4 1SP,53.749906680600600,-2.876962783545850
agama and Rabbit,PR4 1SW,53.740470011713800,-2.906998454800580
Prion and rock python,PR4 1TB,53.743257349294400,-2.904496015618360
racer and thorny devil,PR4 1UH,53.744045909922100,-2.870851378240660
Moluccan boobook and diamond python,PR4 1XJ,53.752668000000000,-2.885362000000000
Piping shrike and boomslang,PR4 1ZB,53.753259708849600,-2.876911315660870
blue racer and sidewinder,PR4 2BS,53.781475491095000,-2.884055867657150
perentie and agamid,PR4 2DX,53.784034066240700,-2.890544838665360
Quetzal and Darwin's finches,PR4 2EJ,53.773433962500000,-2.909802000000000
blue tongue and bearded lizard,PR4 2ET,53.784663000000000,-2.903486000000000
Magpie and Jackal,PR4 2EY,53.785442000000000,-2.902728000000000
massasauga and rock snake,PR4 2HE,53.783789584789200,-2.877381031577540
Logrunners and Cuscus,PR4 2RT,53.783337205773100,-2.870390161843100
Black cockatoo and wall lizard,PR4 2TT,53.779422787810200,-2.879626956740710
Philippine hawk-owl and Maya,PR4 2TY,53.780565166379300,-2.875826497117750
Polecat and python,PR4 2UG,53.785363000000000,-2.896413000000000
brown snake and Wallaby,PR4 2UU,53.777511487100000,-2.872576532800000
dukite and Kangaroo,PR4 2WL,53.772478708743500,-2.915123407558940
flying dragon and Cuscus,PR4 2ZJ,53.780457798992300,-2.862120355514020
Parrotbill and grass snake,PR4 3AG,53.787763565199100,-2.878450585518070
leathery turtle and anaconda,PR4 3DB,53.791139590133400,-2.886262865492180
viper and Pratincole,PR4 3DX,53.790290557384300,-2.886821785930150
Cuscus and Kākāriki,PR4 3ES,53.789441000000000,-2.883996000000000
Ice seal and Black jay,PR4 3HB,53.792660262884600,-2.884822433161350
blue racer and Parrotlet,PR4 3HD,53.798356172273700,-2.887614482196860
snake and crocodile,PR4 3HF,53.791900187706600,-2.879402308566050
garter snake and Argus,PR4 3HR,53.813750360690200,-2.891615319843010
snapping turtle and blind snake,PR4 3JE,53.789958755750400,-2.880621581192460
taipan and Mole,PR4 3JJ,53.814980000000000,-2.928716000000000
Kestrel and rat snake,PR4 3JQ,53.820877425530300,-2.937657576102610
Shearwater and racer,PR4 3JY,53.788921653433800,-2.878641757101920
horned viper and Goose,PR4 3LP,53.787561291820400,-2.879068679082330
pit viper and tiger snake,PR4 3RR,53.769422038295300,-2.841624401007420
massasauga and Rabbit,PR4 3SB,53.780982134660700,-2.852904007196020
chameleon and Philippine hawk-owl,PR4 3UG,53.827614026130600,-2.850250527709240
Polecat and viper,PR4 3UT,53.800819994303300,-2.834919685276730
flying lizard and Marmoset,PR4 3UX,53.786922883846600,-2.837542000000000
Marmoset and soft-shelled turtle,PR4 3ZJ,53.839970000000000,-2.859619000000000
Philippine hawk-owl and Coati,PR4 4AF,53.727016079281400,-2.745123499555070
deaf adder and flying lizard,PR4 4AZ,53.731571626447900,-2.729303117861560
Chipmunk and moloch,PR4 4HA,53.702409104082300,-2.801719951779760
glass snake and Petrel,PR4 4HE,53.704726235736800,-2.797961704063720
Shearwater and Old World vulture,PR4 4JR,53.724495112236100,-2.731226632786800
Skunk and Prion,PR4 4JS,53.723122094316200,-2.732339442004600
Gila monster and cerastes,PR4 4QA,53.703176596901300,-2.798508004654360
tree snake and Petrel,PR4 4RB,53.705360464502100,-2.795852867664320
gaboon viper and Grackle,PR4 4XN,53.717636846983600,-2.745836542911110
Prion and bicycle lizard,PR4 4XQ,53.717341620104500,-2.739815536445120
Shearwater and kabaragoya,PR4 4ZA,53.726102230541000,-2.746092493400400
terrapin and Rat,PR4 4ZH,53.725494509213100,-2.746975937470160
skink and green turtle,PR4 5BP,53.729907631334700,-2.789056033375880
New World blackbird and puff adder,PR4 5DG,53.724090847800000,-2.767972143800000
frilled lizard and Nukupuʻu,PR4 5FD,53.725918412683900,-2.776431961325260
Parakeet and mud turtle,PR4 5FJ,53.730945092131000,-2.771916572756670
Herring gull and Diving bird,PR4 5HB,53.731550606738700,-2.775702000000000
swift and Thrasher,PR4 5HE,53.734191141473600,-2.773113003296920
Herring gull and tortoise,PR4 5HJ,53.735827287186800,-2.774461939030270
agama and cycling lizard,PR4 5HQ,53.723072554100700,-2.788291509631760
Guillemot and Rat,PR4 5LD,53.741216404377300,-2.779215706324820
jew lizard and Hawaiian honeycreeper,PR4 5PB,53.727158223407400,-2.782047622265340
Vole and giant tortoise,PR4 5QS,53.713996663414900,-2.789303610333660
sidewinder and cerastes,PR4 5SJ,53.731032241653100,-2.763929876495190
bandy-bandy and skink,PR4 5TJ,53.731984380296800,-2.758368858394120
Lemming and Bronzewing pigeon,PR4 5XB,53.719951954287200,-2.792627819302790
Hawk and thorn lizard,PR4 5XP,53.719823632206000,-2.799762963834950
green turtle and Viscacha,PR4 5YB,53.718015000000000,-2.792154110176980
leathery turtle and tortoise,PR4 5ZJ,53.725217307136100,-2.794422000000000
Old World quail and Kite,PR4 5ZN,53.724433000000000,-2.796092000000000
Flameback and perentie,PR4 6BP,53.682280405696100,-2.832557380954890
deaf adder and gavial,PR4 6BX,53.687591656484000,-2.837840927293700
chameleon and loggerhead,PR4 6DB,53.686108253387200,-2.835313042429130
whip snake and Marsh harrier,PR4 6EU,53.681489000000000,-2.826304000000000
dukite and Eagle,PR4 6JX,53.661285000000000,-2.883868000000000
puff adder and Pitohui,PR4 6RL,53.695754723878000,-2.838896655481040
Wallaby and Tattler,PR4 6UB,53.681534047186600,-2.830014219124930
whip snake and Meadowlark,PR4 6UG,53.697760129944100,-2.838754790370730
tuatara and hawksbill,PR4 6UH,53.681124847397300,-2.831989536163360
massasauga and water snake,PR4 6UX,53.671991367251700,-2.852607661188810
amphisbaena and rock snake,PR4 6UY,53.677464605421800,-2.836141130497820
Peafowl and diamond snake,PR4 6XH,53.692442000000000,-2.879781000000000
Puffleg and cobra,PR4 6XL,53.694959000000000,-2.883408000000000
hoop snake and diamondback turtle,PR4 9AY,53.777511487100000,-2.872576532800000
Hawaiian honeycreeper and boa constrictor,PR4 9BX,53.777522000000000,-2.872573000000000
Mole and horned viper,PR5 4AH,53.752238883384500,-2.678249727944680
Quetzal and snake,PR5 4NR,53.736243450388700,-2.685511368978660
green turtle and Scimitar babbler,PR5 4PE,53.736014599657800,-2.686235312395080
diamondback turtle and coral snake,PR5 4QT,53.740499883541200,-2.675134478584640
carpet snake and Dolphin,PR5 5AU,53.729179565207000,-2.686927296641870
Pratincole and terrapin,PR5 5BJ,53.726801722133900,-2.686221639782290
Thrasher and sea snake,PR5 5HL,53.720356573086500,-2.689450584120640
frill-necked lizard and gecko,PR5 5LA,53.724215427858700,-2.693801000000000
Tattler and carpet snake,PR5 5LT,53.722560787678100,-2.685955553998960
Tahr and viper,PR5 5NE,53.722896780571000,-2.696266456972100
Coati and death adder,PR5 5QY,53.725518838593800,-2.688928821503340
blue racer and Booted eagles,PR5 5RA,53.724672536468800,-2.690733664995570
Coati and Cloud rat,PR5 5SZ,53.727587635062700,-2.693342950096970
lizard and Wader,PR5 5TL,53.730449223809800,-2.692768583145630
Parrotbill and White ibis,PR5 5XH,53.726464453849700,-2.680744713074000
milk snake and Linsang,PR5 5XN,53.726359478461000,-2.683395366674120
Solitaire and Lemming,PR5 5XR,53.716416609731700,-2.682143129892200
Chipmunk and Mockingbird,PR5 5YD,53.723139749662300,-2.678993621087290
Old World warbler and Viscacha,PR7 5JS,53.653730000000000,-2.677966145223500
tree snake and Pheasant,PR7 6AJ,53.668947806050800,-2.679256903472400
B and bandy-bandy,PR7 6DY,53.660975455745100,-2.676313000000000
Solitaire and perentie,PR7 6EG,53.663110638180400,-2.711594000000000
goanna and taipan,PR7 6EH,53.658117391862300,-2.685468320550520
Masked owl and black snake,PR7 6HP,53.664573769654300,-2.680261057838050
blue racer and agamid,PR7 6HR,53.664757668541900,-2.676359405264590
Herring gull and Parrotlet,PR7 6JE,53.671800000000000,-2.675726208190580
Goose and Snipe,PR7 6LY,53.659048543157000,-2.731636495936550
Night heron and adder,PR7 7HA,53.681009825300000,-2.675651000000000
death adder and horned toad,PR9 0DG,53.652303750207000,-3.003676526848900
Pratincole and alligator,PR9 0EL,53.652360334243900,-3.003360139034220
Ice seal and sidewinder,PR9 0JX,53.658125745229400,-2.991043328021980
flying dragon and agama,PR9 0LZ,53.653371640786300,-2.998512150552640
Tattler and Jerboa,PR9 0QB,53.650021500662600,-3.001428565983960
anaconda and soft-shelled turtle,PR9 0QQ,53.651500112884200,-2.998740252661410
New World blackbird and anole,PR9 7ER,53.651008238605900,-2.973341166374690
copperhead and Tree warbler,PR9 7HR,53.652874150022000,-2.977106198016300
cobra de capello and Bronzewing pigeon,PR9 7JG,53.654368715750100,-2.974598796499320
Petrel and Songlark,PR9 7LP,53.660299781316800,-2.968122580843010
slowworm and bearded dragon,PR9 7NU,53.659702098183700,-2.971997980661020
Macaw and agama,PR9 7PS,53.658420299633500,-2.968230821991090
Flameback and moloch,PR9 7PT,53.655840393330700,-2.967142756246560
Komodo dragon and Logrunners,PR9 7WA,53.660387182302600,-2.962858326292600
Linsang and Dolphin,PR9 8AS,53.675933893523000,-2.929166510138470
loggerhead and Warbler,PR9 8AY,53.677000218810300,-2.930749284241060
Cuscus and alligator,PR9 8BH,53.679777999237500,-2.921408712832880
skink and Bunting,PR9 8DS,53.665558000000000,-2.899168000000000
Vulture and cayman,PR9 8DZ,53.696491542293000,-2.887559445799450
Minke whale and Jackal,PR9 8FE,53.665117000000000,-2.897963000000000
chuckwalla and iguana,PR9 8JN,53.678071819689300,-2.949954322162760
Fox and Prion,PR9 8JW,53.677399497606200,-2.947456393890470
terrapin and Siskin,PR9 8JY,53.667489425139500,-2.950321631776200
American sparrow and Philippine hawk-owl,PR9 8NP,53.669131681993100,-2.961907400490210
Tahr and king snake,PR9 8NR,53.670726008910300,-2.960369517323680
python and Wallaby,PR9 8QP,53.666429539366800,-2.959242607263360
Piping shrike and bushmaster,PR9 8QR,53.669293748009700,-2.954010044942150
Mink and snapping turtle,PR9 8RN,53.678353901000000,-2.916805929400000
Argus and Hawaiian honeycreeper,PR9 8SB,53.680493000000000,-2.925268000000000
