name,postcode,lat,lon
Asiatic leopard and Zebra,PA72 6JP,56.535626000000000,-5.979995000000000
Logrunners and Viscacha,PA74 6NH,56.532947752296100,-6.229751304176330
rock snake and tortoise,PA75 6NQ,56.622872854900000,-6.070684208900000
Fox and dugite,PA75 6PH,56.623474000000000,-6.072317248076670
smooth snake and bicycle lizard,PA75 6PQ,56.624149000000000,-6.073150867579010
American sparrow and Viscacha,PA75 6QR,56.582427918669500,-6.199611846348490
mountain devil and Masked owl,PA75 6RF,56.618579728672100,-6.074624308989050
