name,postcode,lat,lon
frilled lizard and goanna,PH1 3SH,56.436830926270300,-3.756951458081280
Bronzewing pigeon and tokay,PH3 1AA,56.296138365906800,-3.707664410522110
Grosbeak and bearded lizard,PH3 1AD,56.295438707996200,-3.708990000000000
Recurvebill and rock python,PH3 1AT,56.292932043340400,-3.706244859408460
gavial and sidewinder,PH3 1BL,56.296933000000000,-3.707409000000000
snapping turtle and fer-de-lance,PH3 1DE,56.296361793460500,-3.699917559781820
Ground sloth and wall lizard,PH3 1DT,56.300198143435400,-3.655530486540910
Skunk and garter snake,PH3 1FE,56.297581000000000,-3.700166000000000
water snake and Francolin,PH3 1GT,56.300391000000000,-3.705587000000000
Chicken and mountain devil,PH3 1HA,56.319758317887100,-3.654307359778920
Capuchin and agamid,PH3 1HU,56.318661000000000,-3.653047000000000
Bronzewing pigeon and harlequin snake,PH3 1LH,56.338483000000000,-3.696274000000000
Goose and soft-shelled turtle,PH3 1PW,56.283632729795300,-3.691113644178210
Pratincole and blue racer,PH3 1PZ,56.292410732175900,-3.721830642956640
Crow and Vole,PH3 1QT,56.299870349000000,-3.694142632300000
Solitaire and smooth snake,PH3 1RY,56.297022971622300,-3.702807297132910
Masked owl and alligator,PH5 2AH,56.327520382474200,-3.828878504149670
Asiatic leopard and python,PH5 2DF,56.328612024005000,-3.926396813811500
horned toad and python,PH6 2EF,56.371738806808800,-3.984341060841490
Darwin's finches and krait,PH6 2GA,56.367376083067800,-3.984616190094550
Rat and Fox,PH7 3AL,56.375287000000000,-3.837580000000000
tokay and Piping shrike,PH7 3EA,56.374588000000000,-3.833805000000000
thorny devil and Komodo dragon,PH7 3EE,56.373044714162900,-3.831205115992720
crocodile and adder,PH7 3HE,56.369929342729300,-3.846162444783670
horned viper and Diving bird,PH7 3HW,56.368144482356300,-3.850156230900890
Shearwater and Asiatic leopard,PH7 3JB,56.372034350308800,-3.839965365851050
Macaw and Fox,PH7 3LF,56.369367329106800,-3.833781229983380
Lemming and Chicken,PH7 3NH,56.388204832145400,-3.738139476552260
cobra and gopher snake,PH7 3NL,56.396946220197700,-3.739542470524380
Bronzewing pigeon and Stilt,PH7 3QB,56.372949857587000,-3.827281888919250
hoop snake and Bunting,PH7 3QF,56.372230384375100,-3.826713089292960
Zebra and B,PH7 3QH,56.373929009283600,-3.815181000000000
boomslang and bushmaster,PH7 3TA,56.366523064955600,-3.849818605689790
Greenbul and garter snake,PH7 4AA,56.376475747185400,-3.839807032803880
gaboon viper and Elephant,PH7 4AX,56.374086499877000,-3.843367754947100
gaboon viper and River dolphin,PH7 4DP,56.373959070796500,-3.845288609568320
hawksbill and Partridge,PH7 4ED,56.377692641388400,-3.848793000000000
skink and cobra,PH7 4EW,56.374563880513100,-3.848119349511730
Warbler and Grouse,PH7 4JH,56.372046784743300,-3.852401845119610
Thrasher and Argus,PH7 4JT,56.379325903143400,-3.915044161309340
bandy-bandy and Macaw,PH8 0EH,56.476903525922800,-3.918625437632180
