name,id,postcode,lat,lon
diamond python and Partridge,1001675,IV20 1YW,57.833293000000000,-3.829645000000000
green turtle and goanna,998656,IV36 2UA,57.648473779468100,-3.520992965975740
worm lizard and Magpie,998659,IV36 2UE,57.632015612602200,-3.557888218943330
Elephant and Badger,998714,IV36 3UA,57.643627000000000,-3.542855000000000
leathery turtle and turtle,1001622,IV20 1YA,57.833732221970600,-3.827881859535790
Vulture and Scimitar babbler,1001605,IV20 1XE,57.765658825031100,-3.895823027007650
