name,postcode,lat,lon
blue tongue and Macaw,CA11 0XT,54.698914953129800,-2.961897438131410
rattlesnake and wall lizard,CA12 4AG,54.597939136605000,-3.129022299830930
Dolphin and water snake,CA12 4AJ,54.609699000000000,-3.096185000000000
cobra and gaboon viper,CA12 4AT,54.595672760847200,-3.122427887897630
Treepie and Partridge,CA12 4DX,54.599575053573800,-3.131884832477730
cobra and rat snake,CA12 4EQ,54.598824090561100,-3.133380955831560
Mole and goanna,CA12 4GE,54.602835255520000,-3.126340327368550
whip snake and Marmoset,CA12 4HA,54.602276981443500,-3.128383814505900
Rat and Recurvebill,CA12 4LL,54.604862795637900,-3.113128725959730
Armadillo and Tahr,CA12 4LS,54.602297000000000,-3.116657013528620
Fox and tuatara,CA12 4LW,54.604092074229300,-3.112890957216660
Darwin's finches and carpet snake,CA12 4ND,54.601975060324000,-3.134504000000000
flying dragon and Darwin's finches,CA12 4QE,54.643970000000000,-3.190362000000000
Condor and Darwin's finches,CA12 4QT,54.679773327541600,-3.195922835779870
Skunk and Armadillo,CA12 4RD,54.682112143628100,-3.228936953791750
skink and bearded dragon,CA12 4RZ,54.619305709612900,-3.055911939288660
Kangaroo and Philippine hawk-owl,CA12 4SY,54.631538081395500,-3.024440474203800
blind snake and Linsang,CA12 4TD,54.598111334151300,-3.116272469117910
pit viper and frilled lizard,CA12 5AZ,54.599911257814500,-3.135330627443250
soft-shelled turtle and sand lizard,CA12 5ED,54.601722400770200,-3.140566926235090
elapid and Solitaire,CA12 5EQ,54.600878414217900,-3.142385444385500
Parrotbill and worm lizard,CA12 5HF,54.600669770567600,-3.134949260523400
Darwin's finches and Mole,CA12 5PE,54.605942781574600,-3.143812284151890
Ground sloth and Bronzewing pigeon,CA12 5PN,54.607384923738200,-3.138604185463890
bicycle lizard and leathery turtle,CA12 5QF,54.606494095774100,-3.146335845473100
copperhead and Tit-tyrant,CA12 5RB,54.601974119244100,-3.159475523429260
Marmoset and Towhee,CA12 5ST,54.600994273827100,-3.189278000000000
amethystine python and iguana,CA12 5TP,54.604708000000000,-3.207967000000000
anole and box turtle,CA12 5UG,54.559586000000000,-3.161829000000000
agama and blind snake,CA13 0NG,54.693607000000000,-3.355457000000000
blue tongue and boa constrictor,CA13 0RR,54.591605254248000,-3.317523000000000
Komodo dragon and bicycle lizard,CA13 0RT,54.583323429892500,-3.321819637194820
Komodo dragon and constrictor,CA13 9AY,54.661231796936100,-3.352331929149620
Greenbul and rock snake,CA13 9DH,54.657019170319100,-3.358532184417170
Nukupuʻu and bandy-bandy,CA13 9DX,54.657421000000000,-3.354043739061320
Cloud rat and Warbler,CA13 9HD,54.666156566461700,-3.355581113470280
racer and diamond snake,CA13 9NF,54.663941907527300,-3.361523037530900
hoop snake and sand lizard,CA13 9NQ,54.664206872384500,-3.360338057955180
Warbler and Darwin's finches,CA13 9PA,54.661031191771000,-3.359813331750980
Quetzal and sand viper,CA13 9RB,54.662252990070600,-3.362257228813110
Songlark and sidewinder,CA13 9SY,54.708109702505100,-3.244173152643620
B and asp,CA13 9UQ,54.619152000000000,-3.300757000000000
snake and Rat,CA13 9YD,54.669949000000000,-3.245320535726010
Francolin and adder,CA7 1AF,54.764550657730000,-3.209426085710440
Asiatic leopard and puff adder,CA7 1EW,54.740739423860400,-3.146971403673780
mud turtle and thorn lizard,CA7 1HH,54.703801000000000,-3.176222000000000
Tahr and wall lizard,CA7 1HW,54.745729501555400,-3.240464299168900
frilled lizard and Snipe,CA7 1JD,54.745459770225400,-3.245147267144650
water snake and Stint,CA7 1JS,54.762989000000000,-3.242188000000000
Chickadee and Recurvebill,CA7 1LD,54.748715209319900,-3.261467307149060
Cloud rat and frill-necked lizard,CA7 1LQ,54.762901001832200,-3.234368000000000
Gull and Black jay,CA7 2AQ,54.736368000000000,-3.275186000000000
Egret and Peafowl,CA7 2BA,54.757362496977000,-3.334369861950860
B and Booted eagles,CA7 2DU,54.727849211154400,-3.360140204142530
gaboon viper and water snake,CA7 2EX,54.739377465181900,-3.322190774254030
cayman and box turtle,CA7 2HY,54.738963550153700,-3.271835233187100
fer-de-lance and rat snake,CA7 2JR,54.747132428231900,-3.348404279135920
Black jay and Skunk,CA7 3AA,54.764082012368100,-3.328094192008840
brown snake and Pheasant,CA7 3BE,54.765368367921800,-3.322229968556270
Minke whale and water snake,CA7 3BX,54.764262508449800,-3.328846150429840
alligator and king snake,CA7 3DA,54.766894000000000,-3.315907000000000
soft-shelled turtle and green turtle,CA7 3EL,54.766804000000000,-3.326676000000000
fer-de-lance and green turtle,CA7 3HN,54.765007236824500,-3.333051604391810
dugite and Rabbit,CA7 3QQ,54.765049538595600,-3.278202147456020
tree snake and caiman,CA7 3RF,54.760710970964700,-3.277132923290630
taipan and Myna,CA7 8DU,54.749904914236200,-3.053016000298840
Elephant and python,CA7 8ER,54.750411986469800,-3.056711386377470
Egret and turtle,CA7 8HQ,54.746923535864400,-3.075278658545270
Goose and Mamo,CA7 8JY,54.725853264121000,-3.020716313437060
