name,postcode,lat,lon
indigo snake and Philippine hawk-owl,BT81 7DU,54.706586000000000,-7.696495000000000
turtle and Marsh harrier,BT81 7EH,54.673341000000000,-7.677042000000000
Linsang and krait,BT81 7EJ,54.675387000000000,-7.689024000000000
Pratincole and Old World warbler,BT81 7XG,54.695761000000000,-7.700049000000000
boa constrictor and death adder,BT81 7XZ,54.676528000000000,-7.707913000000000
Stilt and Rat,BT93 0LG,54.553325000000000,-7.672475000000000
Philippine hawk-owl and mountain devil,BT93 1FD,54.562470000000000,-7.738547000000000
king snake and Coati,BT93 1FS,54.566642000000000,-7.690749000000000
Treepie and Fish eagle,BT93 1JX,54.585394000000000,-7.688937000000000
Rabbit and fer-de-lance,BT93 8BG,54.551523000000000,-7.831619000000000
king snake and king snake,BT93 8BJ,54.558471000000000,-7.821946000000000
