name,id,postcode,lat,lon
Stint and Grouse,415108,SA15 3EZ,51.685524068334300,-4.145293836881330
Capuchin and saltwater crocodile,407470,SA4 6AB,51.660392000000000,-4.068080000000000
Stint and Chickadee,415533,SA14 8UP,51.691498877177500,-4.093776880955540
Dorcopsis and River dolphin,414725,SA15 3LW,51.690716444274200,-4.155407262414500
Prion and tiger snake,408004,SA4 3YY,51.642637619498600,-4.112597688803990
Eagle and soft-shelled turtle,414922,SA15 4EF,51.684872882966900,-4.172880778056850
Tattler and Fish eagle,410931,SA3 2BP,51.576825874678300,-4.088168696939080
turtle and Shearwater,407830,SA4 3JH,51.634589117593500,-4.098425000000000
thorny devil and bearded lizard,407509,SA4 6PW,51.665824000000000,-4.058306000000000
Fulmarine petrel and Elephant,407426,SA4 4XG,51.670988793123700,-4.051901713278600
rock snake and Mink,411625,SA2 7LQ,51.599399185162200,-4.105650000000000
Scimitar babbler and blue tongue,415152,SA15 1PZ,51.685456651488500,-4.143569042825210
Bronzewing pigeon and python,415027,SA15 2TR,51.678112011840600,-4.166467246187430
perentie and fer-de-lance,414240,SA16 0PL,51.688979970552700,-4.248010131275420
cobra and Parakeet,415035,SA15 2UD,51.677296502646500,-4.164851655905800
galliwasp and sand viper,415826,SA14 8NU,51.692442698497500,-4.128807544056820
flying dragon and worm lizard,415282,SA15 2BS,51.668652234749700,-4.151553000000000
fer-de-lance and wall lizard,410968,SA3 2HH,51.575936000000000,-4.129736000000000
saltwater crocodile and Coati,415598,SA14 9BL,51.682437309691700,-4.124473000000000
Solitaire and elapid,407864,SA4 3NY,51.629541613327700,-4.066791428168680
Pheasant and Flameback,415619,SA15 1NH,51.681472612873600,-4.150960997411440
cayman and Parrotlet,415712,SA14 9NT,51.678321053959900,-4.109557507274380
perentie and king snake,414826,SA15 3RP,51.689514109079900,-4.154771382106380
Francolin and Partridge,414914,SA15 4DR,51.685879240241300,-4.190347843886520
Marsh harrier and Stilt,414299,SA16 0UA,51.687173211783700,-4.275639000000000
indigo snake and Marsh harrier,407935,SA4 3SX,51.634626461704900,-4.122991286705680
blind snake and Duck,415181,SA15 1SU,51.681415371834500,-4.157511385396030
Ground sloth and Triller,415126,SA15 1NS,51.681313446909100,-4.152776163819660
tokay and Grackle,410944,SA3 2DF,51.572447000000000,-4.092268000000000
smooth snake and Tit-tyrant,415882,SA14 8RR,51.687826563371000,-4.148223998683250
Duck and B,411024,SA3 3EW,51.580278964534600,-4.051477901801540
amethystine python and Old World warbler,415924,SA14 8TT,51.697169865713400,-4.082331768924560
diamondback and amphisbaena,407952,SA4 3TY,51.623294888861200,-4.147745176335610
Crow and Minke whale,407600,SA4 6TX,51.662019077111400,-4.071595205106450
Condor and snapping turtle,411016,SA3 3EJ,51.583395851397400,-4.052195716034510
Marsh harrier and Flameback,411068,SA3 3JU,51.584667033519400,-4.057146484389850
Stilt and blue tongue,415147,SA15 1PT,51.675598403533300,-4.149597743245130
cycling lizard and amethystine python,411188,SA3 1AE,51.586336727036400,-4.186580172364000
Vulture and dugite,415240,SA15 1UH,51.680550410654800,-4.162489868003430
Parrotlet and harlequin snake,415881,SA14 8RQ,51.684400394927700,-4.130455501930380
giant tortoise and terrapin,414600,SA16 0HF,51.682371089710200,-4.257809209264350
Kestrel and Fish eagle,416085,SA14 8BB,51.697887230626900,-4.145386690237600
Tree warbler and boa,415160,SA15 1RF,51.674463600639200,-4.151540000000000
massasauga and Greenbul,407836,SA4 3JS,51.635549940852800,-4.105172607370070
deaf adder and slowworm,411010,SA3 3DS,51.568271970790800,-4.057114000000000
bushmaster and amphisbaena,414926,SA15 2NR,51.673328653139600,-4.166426919644950
Ibex and Stint,415825,SA14 8NS,51.690674000000000,-4.127205000000000
Moluccan boobook and mud turtle,407912,SA4 3RY,51.635077096848200,-4.127405497379100
Prion and Chipmunk,415537,SA14 8UT,51.692968206392600,-4.128235000000000
Goose and copperhead,415542,SA14 8UZ,51.693803393526100,-4.079471338449800
Duck and wall lizard,414497,SA16 0BT,51.690746162201700,-4.253451279088750
flying lizard and sand lizard,415896,SA14 8SH,51.688564834944900,-4.137335424039430
Moluccan boobook and Asiatic leopard,407614,SA4 6UR,51.661061022485400,-4.071869599184690
leathery turtle and bicycle lizard,415410,SA15 2LP,51.675123205157900,-4.166642765544650
leathery turtle and Dorcopsis,414144,SA16 0LQ,51.688478330813200,-4.273594516243000
Masked owl and krait,414290,SA16 0TN,51.684929731119300,-4.271087402876360
lizard and Stilt,414318,SA16 0XZ,51.680652029706500,-4.166733187109540
carpet snake and snapping turtle,415378,SA15 1AA,51.680609242376500,-4.163201494763830
Coati and tiger snake,414604,SA16 0HL,51.683388756746000,-4.260536229433060
Argus and Black jay,410943,SA3 2DE,51.567420460292600,-4.091518000000000
Elephant and Minke whale,415682,SA14 9HT,51.677010551765400,-4.113922724054990
Piping shrike and gaboon viper,2382678,SA15 2EN,51.664559000000000,-4.148974000000000
Eagle and worm lizard,407950,SA4 3TW,51.631033105627200,-4.122288800734660
anole and Partridge,414528,SA15 4NN,51.698796017419600,-4.172259972477630
puff adder and grass snake,407490,SA4 6JE,51.660606695242200,-4.063968609800340
snake and Tree warbler,415534,SA14 8UQ,51.690955000000000,-4.091046000000000
indigo snake and Chickadee,414964,SA15 2SA,51.676351857061600,-4.162434425824180
Gull and cobra,407607,SA4 6UF,51.661308664276600,-4.064448760775560
rat snake and thorny devil,407904,SA4 3RJ,51.642197020810000,-4.118083958174940
Pitohui and boa,414897,SA15 4BH,51.687371733236300,-4.199983260508710
Hawk and thorny devil,415136,SA15 1PE,51.678062261761100,-4.152549588715750
Masked owl and constrictor,410948,SA3 2DP,51.577609648871900,-4.087078872146160
Mink and Linsang,415394,SA15 1AY,51.674308197468800,-4.159140554277200
fer-de-lance and kabaragoya,414848,SA15 3TB,51.695163492432800,-4.147790145588400
dugite and River dolphin,407613,SA4 6UQ,51.665570170976800,-4.068590335843140
blue racer and Ibex,415430,SA15 1BP,51.674304102037800,-4.154615000000000
B and Nukupuʻu,414491,SA16 0BL,51.685375727207500,-4.249321662144800
Cloud rat and cycling lizard,1808185,SA15 9AY,51.680660066600000,-4.166734205000000
diamondback terrapin and Peafowl,412113,SA2 7JS,51.598737597879400,-4.058851004025120
snake and Mamo,407960,SA4 3UN,51.621342238923200,-4.103127852983500
asp and Pitohui,415597,SA14 9BJ,51.669679000000000,-4.096574000000000
racer and Masked owl,411283,SA3 1JL,51.610348000000000,-4.282484000000000
tokay and blue racer,411065,SA3 3JR,51.586070050467900,-4.050973756966420
elapid and Rabbit,415280,SA15 2BQ,51.667887554143700,-4.145891921757430
death adder and Badger,415829,SA14 8NY,51.693069232132000,-4.130457556832370
Philippine hawk-owl and kabaragoya,416100,SA14 8BX,51.699702344960800,-4.114227977075090
Meadowlark and Partridge,414610,SA16 0HU,51.682679471706900,-4.270728816675280
smooth snake and rattlesnake,411209,SA3 1BS,51.601274000000000,-4.214446000000000
skink and soft-shelled turtle,415646,SA14 9DX,51.679704909570900,-4.121092890925570
Komodo dragon and lizard,415006,SA15 4LA,51.693786202728500,-4.153758884795070
Mole and Goose,407535,SA4 6QN,51.660228394391600,-4.055290441990050
dugite and Black cockatoo,407505,SA4 6PP,51.665539388540800,-4.053954656940770
River dolphin and puff adder,414866,SA15 3YA,51.680879318093500,-4.163185439715880
Myna and Minke whale,415921,SA14 8TQ,51.691873756624200,-4.084837749257200
Tattler and Zebra,415903,SA14 8SS,51.685472138656500,-4.140748655802260
cerastes and blindworm,407999,SA4 3YR,51.642495371095100,-4.109006603352620
iguana and Parakeet,407878,SA4 3PS,51.625854035147400,-4.066826055130640
Francolin and Macaw,415257,SA15 2AD,51.672341892261800,-4.155546932900110
moloch and Ibex,415384,SA15 1AL,51.679359293906600,-4.163199763857180
Snipe and harlequin snake,415637,SA14 9DL,51.679964580035000,-4.123144661958880
Chipmunk and krait,414148,SA16 0LW,51.684346660393900,-4.249993994307450
viper and Siskin,415232,SA15 1TT,51.678528431007400,-4.161438805566220
Fish eagle and Piping shrike,415290,SA15 2DD,51.667383874444700,-4.147863800549350
Quetzal and diamondback turtle,414473,SA16 0AN,51.684667976003800,-4.255276016434430
Guillemot and agama,407923,SA4 3SQ,51.636573000000000,-4.131213434360300
agamid and rat snake,414151,SA16 0NE,51.683536760804500,-4.243443723660170
constrictor and Tahr,415808,SA14 8NL,51.687037624817300,-4.124864601251910
sand lizard and adder,415678,SA14 9HL,51.677135039083700,-4.121350000000000
Dorcopsis and Gila monster,415688,SA14 9LD,51.676243839792800,-4.115550399282650
Kangaroo and Egret,411252,SA3 1ED,51.603341000000000,-4.150731000000000
grass snake and Rabbit,414979,SA15 2TG,51.678779561121900,-4.167815452006610
rat snake and Darwin's finches,415811,SA14 9PP,51.677777151822600,-4.097251659072990
Peafowl and Maya,414989,SA15 4EU,51.691209719589200,-4.166716640538250
Fox and mamba,415599,SA14 9BN,51.681547345217800,-4.123638241128100
Dorcopsis and Songlark,415680,SA14 9HR,51.678033685432100,-4.116530665287590
