name,postcode,lat,lon
Piping shrike and mountain devil,BS16 1EG,51.484608000000000,-2.537367000000000
Skunk and cycling lizard,BS16 1JG,51.490059399148700,-2.532605659656340
Marmoset and mountain devil,BS16 1NX,51.500518460984400,-2.515886000000000
Parrotlet and Tree warbler,BS16 1PB,51.501350203561600,-2.515074694955220
dugite and Grouse,BS16 1RE,51.508563415179400,-2.518700679017890
elapid and saltwater crocodile,BS16 1RN,51.510659473726100,-2.520496880881820
Black jay and leathery turtle,BS16 1SB,51.509872036803100,-2.513513753816210
Mockingbird and hoop snake,BS16 1SS,51.511267000000000,-2.501151000000000
taipan and Warbler,BS16 2BD,51.493294103959300,-2.514177532242820
Francolin and python,BS16 2DW,51.480622162994900,-2.535692514461480
Nukupuʻu and Capuchin,BS16 2HE,51.488044121603300,-2.520858513718440
Thrasher and New World blackbird,BS16 2LJ,51.483163000000000,-2.526840194283760
fer-de-lance and asp,BS16 2NB,51.485015532098200,-2.524539595232920
Songlark and mud turtle,BS16 2PF,51.487028075803900,-2.518830623307200
Booted eagles and Macaw,BS16 2RG,51.484885817702500,-2.517308540702200
amethystine python and hawksbill,BS16 2SG,51.494026007778200,-2.510065799299180
flying dragon and Masked owl,BS16 3RX,51.477472574226800,-2.528326409780280
diamond snake and mud turtle,BS16 3TH,51.480787645979000,-2.524951875908580
bearded lizard and Logrunners,BS16 3TW,51.479341172013100,-2.524690465429950
Quetzal and Kākāriki,BS16 3TX,51.480094342306700,-2.529163117977900
Coati and skink,BS16 3XH,51.480226000000000,-2.522051000000000
Chicken and elapid,BS16 4AA,51.480735629357900,-2.518456780057300
anaconda and Grosbeak,BS16 4AH,51.479437322882600,-2.517218068472630
ringhals and gecko,BS16 4FD,51.475232000000000,-2.504184000000000
habu and Myna,BS16 4JH,51.476959325503800,-2.516383682025750
horned viper and Jackal,BS16 4NL,51.479078739451100,-2.510820547075780
Jerboa and Siskin,BS16 4NN,51.478450052630100,-2.512714253653430
Argus and bushmaster,BS16 4PR,51.475336000000000,-2.511615228982010
Argus and Gila monster,BS16 4QE,51.477851134777700,-2.505695074411550
krait and Minke whale,BS16 4QG,51.480229435480700,-2.506729393660310
Parrotlet and diamond snake,BS16 4RB,51.475790442722400,-2.508148844349090
Wallaby and Jackal,BS16 4SZ,51.476044343696300,-2.503486477550670
Kite and boa constrictor,BS16 4TA,51.476337027953200,-2.504425625098410
death adder and thorn lizard,BS16 4TF,51.479353215355500,-2.505582096407530
Macaw and gavial,BS16 5BA,51.483743103620900,-2.521543947919830
Asiatic leopard and Skunk,BS16 5EL,51.480973536257700,-2.513433777744070
box turtle and grass snake,BS16 5NG,51.479443369996400,-2.503437523156000
Chickadee and sand lizard,BS16 5NQ,51.479793715545100,-2.503513381956940
Prion and Mole,BS16 5PX,51.485084382295600,-2.494210654548770
indigo snake and cayman,BS16 5PZ,51.485458355735300,-2.492947350550260
anole and wall lizard,BS16 5RD,51.486895878371600,-2.501690560366560
Parrotbill and mud turtle,BS16 5RP,51.487546295537300,-2.496757695357990
garter snake and gaboon viper,BS16 5SG,51.485100231359800,-2.505256839267340
Pheasant and Night heron,BS16 5TD,51.484101065302000,-2.507593198438770
Marsh harrier and Warbler,BS16 5YF,51.478460769209800,-2.526956000000000
tuatara and River dolphin,BS16 6AJ,51.490416558446300,-2.494167512475010
Meadowlark and Fulmarine petrel,BS16 6AN,51.489462568539800,-2.496389000000000
Chickadee and New World blackbird,BS16 6BS,51.490434746302400,-2.502420000000000
brown snake and Jackal,BS16 6BX,51.492634978312300,-2.503208386665200
Rabbit and anaconda,BS16 6DN,51.492195662078500,-2.505004024847140
garter snake and smooth snake,BS16 6DY,51.494391233393400,-2.504624971510990
sidewinder and lizard,BS16 6EY,51.493019266908000,-2.507922754044580
New World blackbird and Duck,BS16 6HE,51.496768417285700,-2.505918897829900
terrapin and turtle,BS16 6LR,51.500694423991400,-2.506682714458320
constrictor and Thrasher,BS16 6NR,51.498322146061100,-2.497940917492640
cobra de capello and python,BS16 6PG,51.499332000000000,-2.499796000000000
Grackle and Asiatic leopard,BS16 6PJ,51.501172988753800,-2.502034676263660
Recurvebill and gavial,BS16 6PP,51.500859831493900,-2.499567713735630
frilled lizard and bearded lizard,BS16 6RH,51.495955803317100,-2.491922639846890
Viscacha and python,BS16 6SW,51.503532666605900,-2.492638185385760
galliwasp and Argus,BS16 6TX,51.497215712845500,-2.487355293940440
goanna and leathery turtle,BS16 6UH,51.495885553843700,-2.489372202492210
mountain devil and Diving bird,BS16 7AP,51.495664413923800,-2.477586622549400
racer and flying dragon,BS16 7BR,51.491338007267500,-2.480148430897410
sea snake and anaconda,BS16 7EH,51.488880696270200,-2.482974352292580
cobra and terrapin,BS16 7ES,51.486972573163400,-2.472411799775340
saltwater crocodile and Viscacha,BS16 7FQ,51.505403069639800,-2.481780344038350
Ground sloth and Condor,BS16 7GA,51.494200337525700,-2.481604557702600
Buzzard and Kangaroo,BS16 7HS,51.495909000000000,-2.472504000000000
Rat and Viscacha,BS16 7JR,51.486994732610400,-2.475985000000000
boa constrictor and turtle,BS16 7LD,51.495063000000000,-2.470464000000000
Shearwater and bull snake,BS16 9AU,51.488343858419500,-2.484509754994800
turtle and Peafowl,BS16 9BN,51.493126774968100,-2.488982544282080
Egret and Ground sloth,BS16 9DQ,51.487843194285400,-2.490308628945800
Moluccan boobook and Komodo dragon,BS16 9ER,51.484684075389700,-2.482382738415570
Mockingbird and Myna,BS16 9ES,51.484045346740800,-2.482462402972200
massasauga and Armadillo,BS16 9JP,51.481979422352500,-2.488460038782590
Parrotbill and frilled lizard,BS16 9NQ,51.481955244460600,-2.470185442501100
Triller and whip snake,BS16 9NW,51.491159460072000,-2.450374572087410
pit viper and Partridge,BS16 9PP,51.487436491215600,-2.438643209627800
constrictor and tokay,BS16 9PQ,51.480079704410300,-2.448594973481380
diamondback turtle and Tree warbler,BS16 9PU,51.489846591909100,-2.433711702389510
cobra and bearded lizard,BS16 9PW,51.488513706227400,-2.436709197550970
Petrel and snapping turtle,BS16 9UB,51.484146000000000,-2.426644000000000
loggerhead and gavial,BS32 0LW,51.529575763404600,-2.534897643793900
agama and mud turtle,BS32 8AY,51.525011650848400,-2.536083758808680
constrictor and Schneider python,BS34 8RT,51.514632194865600,-2.533022000000000
Jackal and leathery turtle,BS34 8SA,51.514855042371900,-2.531165000000000
Hawk and Gull,BS35 1AR,51.620973000000000,-2.527696000000000
Francolin and Songlark,BS35 1EP,51.613274155599800,-2.523591102918280
monitor and king cobra,BS35 1JD,51.617651826624200,-2.523843711704570
Night heron and Magpie,BS35 1SD,51.617916462569200,-2.518921494450440
Shearwater and Capuchin,BS35 1UB,51.615262215240100,-2.511135454149260
Black cockatoo and Old World vulture,BS35 1UE,51.614215491350800,-2.509924970557040
green turtle and amethystine python,BS35 2AG,51.609023000000000,-2.525477000000000
snapping turtle and Marsh harrier,BS35 2AP,51.606628074253900,-2.525926094012530
flying lizard and Triller,BS35 2BP,51.605047024284500,-2.521575964551860
Perching duck and Asiatic leopard,BS35 2DF,51.603631669980600,-2.518354268542260
Dolphin and jew lizard,BS35 2FR,51.602156000000000,-2.515031000000000
Parakeet and king cobra,BS35 2HP,51.607875810433100,-2.512164370719950
Wallaby and monitor,BS35 2HZ,51.606652113414800,-2.518346000000000
Boto and Civet,BS35 2LY,51.610150076172000,-2.512291064258140
Snipe and turtle,BS35 2NY,51.608613314208900,-2.524331692587920
snapping turtle and Booted eagles,BS35 2XF,51.602844974854200,-2.511169218742830
Fox and Jay,BS35 2XZ,51.603388967754200,-2.522394419019830
Chickadee and ringhals,BS35 2YG,51.608329625524000,-2.509122524702890
Darwin's finches and Mink,BS35 3LX,51.590530713720700,-2.530532486038750
whip snake and Stilt,BS35 3ND,51.591400638302200,-2.533011041986720
goanna and Perching duck,BS35 3SH,51.574834261178600,-2.527968696103200
White ibis and whip snake,BS35 3TG,51.577828899944900,-2.494855685514250
tree snake and Argus,BS35 9BE,51.603388967754200,-2.522394419019830
Jay and black snake,BS35 9DG,51.603382000000000,-2.522409000000000
galliwasp and American sparrow,BS35 9SP,51.610962582608000,-2.527781380841560
Parrotbill and Recurvebill,BS35 9TD,51.610962582608000,-2.527781380841560
Fox and New World blackbird,BS36 1AA,51.512361131633000,-2.497186199962550
coral snake and whip snake,BS36 1AB,51.512165731544600,-2.494489380660690
New World blackbird and gavial,BS36 1AP,51.515570737485600,-2.486556883703510
Mockingbird and loggerhead,BS36 1BQ,51.521627632750400,-2.508543786837180
water snake and diamond snake,BS36 1BS,51.512923817079100,-2.506472597195920
Eagle and loggerhead,BS36 1DJ,51.512746710170000,-2.497551000000000
Macaw and frilled lizard,BS36 1DX,51.520490479829000,-2.503270462927770
carpet snake and deaf adder,BS36 1HT,51.518344215975200,-2.500537327043630
boa constrictor and Viscacha,BS36 1JG,51.525910000000000,-2.506227000000000
Kākāriki and blue racer,BS36 1JL,51.524538428542600,-2.507033926822730
American sparrow and Kangaroo,BS36 1JN,51.523668000000000,-2.509029254885780
Lemming and Jackal,BS36 1JP,51.521604017826100,-2.509840702509840
glass snake and bearded lizard,BS36 1LH,51.523229881679200,-2.499769341609350
puff adder and Logrunners,BS36 1PQ,51.529329288949200,-2.501133554589830
Wader and garter snake,BS36 1QH,51.530563440835800,-2.492093913445930
Jackal and bandy-bandy,BS36 1RD,51.528591132952800,-2.503431894487290
thorn lizard and Gila monster,BS36 2AG,51.535139860763900,-2.483507286321260
frill-necked lizard and Tit-tyrant,BS36 2AS,51.528569143877500,-2.465216730568510
rat snake and monitor,BS36 2BQ,51.533366389159200,-2.481844972017010
Grouse and Treepie,BS36 2BT,51.535478051020400,-2.486698000000000
Parakeet and Solitaire,BS36 2DS,51.533413831003200,-2.481239966983140
blue racer and diamondback,BS36 2EN,51.531851804196000,-2.480632418587770
Scimitar babbler and cobra,BS36 2EY,51.527037694282900,-2.483709713535190
Magpie and gaboon viper,BS36 2HW,51.531191330619900,-2.475017592735230
Hawaiian honeycreeper and grass snake,BS36 2JH,51.528470460583600,-2.476358710695240
Chipmunk and crocodile,BS36 2JW,51.527456299181000,-2.478106743066080
leathery turtle and Black cockatoo,BS36 2JX,51.533004665052900,-2.474288000000000
chuckwalla and Herring gull,BS36 2NW,51.531583187722000,-2.453253169406870
bandy-bandy and loggerhead,BS36 2NX,51.528300757931300,-2.478029000000000
Prion and Macaw,BS36 2QB,51.526444008768500,-2.468265371847830
taipan and horned viper,BS36 2RB,51.527519000000000,-2.469445211292530
Greenbul and glass snake,BS36 2RN,51.525879790452000,-2.476634365104130
Herring gull and Tattler,BS36 2SA,51.525401266163100,-2.472679853402820
tokay and Vulture,BS36 2SE,51.526851016630700,-2.474381397509140
sand lizard and tuatara,BS36 2SS,51.525472784010200,-2.470547277705390
Parrotbill and Pheasant,BS36 2SX,51.522702534942400,-2.472997819414390
Shearwater and moloch,BS36 2TE,51.521936262294900,-2.471260294346940
Greenbul and frilled lizard,BS36 2TY,51.520421948009400,-2.463173541324250
box turtle and lizard,BS36 2XG,51.511278789253100,-2.469651642286760
Elephant and tiger snake,BS36 9AW,51.530398000000000,-2.501679000000000
agamid and Francolin,BS37 0DD,51.539470000000000,-2.414053000000000
Maya and Flameback,BS37 0DE,51.539470000000000,-2.414053000000000
horned viper and Skunk,BS37 4AU,51.539743708844600,-2.413020000000000
tiger snake and smooth snake,BS37 4FS,51.531297000000000,-2.426857089200000
Armadillo and Jerboa,BS37 4PE,51.531824156891800,-2.412327716533110
thorn lizard and goanna,BS37 5JQ,51.539996812883100,-2.446848295854560
Petrel and Quetzal,BS37 5JZ,51.538870517382000,-2.437941032513620
viper and Prion,BS37 5PJ,51.543273018903300,-2.416641857758570
Bronzewing pigeon and boomslang,BS37 5SB,51.548684880182500,-2.411831237187240
pit viper and Minke whale,BS37 5TR,51.547215312412100,-2.418033474985570
Kangaroo and bearded dragon,BS37 5TX,51.544969098501200,-2.412489851576110
Grosbeak and Songlark,BS37 6BN,51.540135000000000,-2.398791000000000
diamond python and grass snake,BS37 6DN,51.534788458908400,-2.389503232797570
Hawk and Recurvebill,BS37 6DQ,51.536371437141000,-2.389358158330230
rock python and bandy-bandy,BS37 6EF,51.537097608915500,-2.392694902382150
Snipe and krait,BS37 6EQ,51.536152663870000,-2.392946282905720
Darwin's finches and Boto,BS37 6FL,51.541270000000000,-2.398353339500000
massasauga and perentie,BS37 6FP,51.540287000000000,-2.398935000000000
amethystine python and Piping shrike,BS37 6GA,51.543091822554500,-2.395154936144560
Kite and black snake,BS37 6HT,51.532418655969800,-2.399026692265950
Boto and blindworm,BS37 6HX,51.532797000000000,-2.399375117694860
Meadowlark and Pratincole,BS37 6JP,51.531740385823400,-2.400174058437510
Quetzal and Kite,BS37 6JX,51.538547861254400,-2.402526321693760
Gila monster and Rabbit,BS37 6NJ,51.535857461870000,-2.384350881817940
Stilt and Chickadee,BS37 6NP,51.538019000000000,-2.383735744685580
Jerboa and Mockingbird,BS37 6RL,51.538100723479900,-2.342311767222900
king cobra and rat snake,BS37 6SN,51.525187000000000,-2.352244000000000
Pheasant and Flameback,BS37 6WA,51.539471000000000,-2.414055000000000
Herring gull and Flameback,BS37 6XN,51.528650372631500,-2.409704278459610
water snake and Kestrel,BS37 6YA,51.539471000000000,-2.414055000000000
agama and Schneider python,BS37 7AW,51.543839076274300,-2.406509716082780
sand viper and worm lizard,BS37 7AX,51.541200357681600,-2.407726245209710
Marsh harrier and fer-de-lance,BS37 7AY,51.542257000000000,-2.401432036176180
agamid and bearded lizard,BS37 7BU,51.561861549134200,-2.405458727562300
bearded lizard and Partridge,BS37 7EF,51.559429000000000,-2.420005000000000
slowworm and anaconda,BS37 7LR,51.565388861902900,-2.442047880889070
alligator and cobra de capello,BS37 7LY,51.567877749091900,-2.444885432160860
Bronzewing pigeon and Night heron,BS37 7PS,51.544306329644700,-2.434186301416630
slowworm and Logrunners,BS37 7RQ,51.551407976627900,-2.404457114220150
Gull and crocodile,BS37 7SH,51.545595150928400,-2.405717819163930
Old World warbler and copperhead,BS37 7UG,51.549234550209100,-2.403731161951160
bearded lizard and Old World vulture,BS37 8QJ,51.518075436694700,-2.434931116583870
diamond snake and adder,BS37 8SN,51.525857964704100,-2.428720623272530
adder and Cuscus,BS37 8TF,51.528349232221400,-2.421103985269030
tiger snake and monitor,BS37 8UF,51.528786402514500,-2.414491387047070
Pratincole and Bunting,BS37 8YA,51.524239900154200,-2.421166953726570
Stilt and carpet snake,BS37 8YQ,51.524842742837400,-2.426030064068420
Linsang and Fox,BS37 9UL,51.549005663098200,-2.460940096534300
Kangaroo and Marmoset,BS37 9UZ,51.549762000000000,-2.460907014453590
giant tortoise and blue tongue,BS37 9XQ,51.563211258220900,-2.449586092104410
Grosbeak and Scimitar babbler,GL11 4DX,51.691013629071600,-2.358235431188900
horned toad and Mink,GL11 4EY,51.687546378937100,-2.362996180509170
Herring gull and saltwater crocodile,GL11 4GE,51.681467000000000,-2.349077000000000
Francolin and Old World vulture,GL11 4JZ,51.679121782200200,-2.354106347800550
New World blackbird and loggerhead,GL11 4LN,51.680911957666400,-2.359717717624240
horned viper and blindworm,GL11 4NT,51.677280607138900,-2.344358784934030
pit viper and Tahr,GL11 4NZ,51.676010000000000,-2.342816000000000
Dorcopsis and soft-shelled turtle,GL11 4PR,51.678587083547400,-2.346480272147340
blue racer and Booted eagles,GL11 5AG,51.680058849129900,-2.312228016572230
indigo snake and Triller,GL11 5BJ,51.690187704393400,-2.307017485583070
River dolphin and Elephant,GL11 5BL,51.689609000000000,-2.298334000000000
tokay and Shearwater,GL11 5GD,51.678243244589100,-2.337973578521530
Scimitar babbler and pit viper,GL11 5GJ,51.678763000000000,-2.339163000000000
Petrel and sea snake,GL11 5GL,51.678941040869600,-2.339324000000000
rat snake and Philippine hawk-owl,GL11 5JP,51.698723426874600,-2.362680528603830
Minke whale and Argus,GL11 5NX,51.699885094010300,-2.362096568369820
cycling lizard and worm lizard,GL11 5NY,51.699393362035100,-2.358258237022740
bicycle lizard and dukite,GL11 5PD,51.692607301609300,-2.351549669789850
Black cockatoo and Guillemot,GL11 5PL,51.697045729889000,-2.355505000000000
kabaragoya and cayman,GL11 5RJ,51.694730179323100,-2.363053689432660
Recurvebill and Fox,GL11 5RT,51.695112578183100,-2.364416751260670
slowworm and blindworm,GL11 6AX,51.669113292458900,-2.375313000000000
mud turtle and Scimitar babbler,GL11 6AZ,51.667612902305300,-2.388256228013430
Maya and Diving bird,GL11 6BD,51.681452000000000,-2.398817000000000
chuckwalla and Philippine hawk-owl,GL11 6HB,51.694455852976600,-2.373121134896760
Snipe and Shearwater,GL11 6HT,51.695437940511000,-2.380884167976520
goanna and king snake,GL11 6LX,51.697325419911400,-2.369845865290220
box turtle and Jerboa,GL11 6PD,51.692291780255600,-2.366520758110470
cycling lizard and White ibis,GL12 7AN,51.637767130226200,-2.358335638115470
Magpie and carpet snake,GL12 7AX,51.640214000000000,-2.361388193005900
whip snake and Rabbit,GL12 7DT,51.640849372874400,-2.361842594097170
Dolphin and Jackal,GL12 7DX,51.643013319618100,-2.362799178000110
blue tongue and agama,GL12 7EL,51.663135000000000,-2.317950000000000
agamid and Solitaire,GL12 7EZ,51.636743753745000,-2.351854190809110
bearded dragon and Wader,GL12 7JP,51.635649568743000,-2.347915548569170
Tattler and dukite,GL12 7NA,51.643095767600500,-2.344388601088430
Maya and Prion,GL12 7NX,51.636328174282300,-2.348195569967240
blue tongue and lizard,GL12 7PG,51.647013261047300,-2.385724318698530
Chickadee and monitor,GL12 7PU,51.668938000000000,-2.312282000000000
thorn lizard and Parakeet,GL12 7PY,51.648494584372400,-2.303859334436820
Ground sloth and Argus,GL12 7PZ,51.638386779368400,-2.311334623536810
Herring gull and Myna,GL12 7QE,51.638501000000000,-2.332562000000000
Schneider python and Viscacha,GL12 7QS,51.621920601333800,-2.338435798925790
Mole and gecko,GL12 8AE,51.618131902562000,-2.437360712026550
Perching duck and Mouse,GL12 8AF,51.616442989507200,-2.437186000000000
leathery turtle and Chipmunk,GL12 8AJ,51.612842742465800,-2.435547930791850
Greenbul and fer-de-lance,GL12 8AN,51.606616918021300,-2.443762422045520
Goose and blue racer,GL12 8AP,51.612018200187000,-2.439655914019010
cerastes and saltwater crocodile,GL12 8AU,51.602778664453500,-2.441097131762750
Goose and Jackal,GL12 8PL,51.594687358318900,-2.400741770133460
box turtle and Chickadee,GL12 8QS,51.591242000000000,-2.478386000000000
Meadowlark and snake,GL12 8QW,51.604244119881300,-2.482263134226840
horned toad and blue tongue,GL12 8RA,51.627607664827500,-2.366981000000000
soft-shelled turtle and cerastes,GL12 8RN,51.626555075540100,-2.367030568939540
Marmoset and Minke whale,GL12 8TU,51.627159307894600,-2.402140362293400
Ibex and smooth snake,GL12 8UB,51.629088775183400,-2.396812306051910
Quetzal and tokay,GL13 9AU,51.696341120111200,-2.460092317830870
water snake and Civet,GL13 9BH,51.690414043233200,-2.458267261910530
sand lizard and Prion,GL13 9BN,51.690264526267000,-2.457412223119030
asp and horned toad,GL13 9EN,51.690042605933700,-2.444968791612560
Recurvebill and Jay,GL13 9EW,51.691490142310100,-2.437807380935100
blue tongue and diamondback,GL13 9JP,51.660626000000000,-2.451533000000000
Civet and puff adder,GL13 9QS,51.680147680282700,-2.473711671652240
glass snake and Rabbit,GL13 9QT,51.674104925204100,-2.480503315549880
Philippine hawk-owl and Parakeet,GL6 0DG,51.694040244525300,-2.221192178056750
Coati and Snipe,GL6 0DQ,51.693826825440800,-2.224938000000000
rock python and Tit-tyrant,GL6 0DT,51.697180905913200,-2.229136356088290
Mockingbird and Herring gull,GL6 0EU,51.699705354254300,-2.234734351290660
krait and elapid,GL6 0HT,51.692486106453600,-2.215643654483980
blind snake and Rat,GL6 0JP,51.691358599810700,-2.222394306451300
cobra and agama,GL6 0LE,51.691964416918100,-2.220588899155890
Puffleg and blue tongue,GL6 0LG,51.691351632709300,-2.221323725896650
Maya and Goose,GL6 0LN,51.693360000000000,-2.217452000000000
Gila monster and cayman,GL6 0NE,51.698592026138400,-2.229389466731160
Wallaby and River dolphin,GL6 0PR,51.681084766337900,-2.234652413417420
puff adder and Parrotbill,GL6 0SB,51.693333155866000,-2.233457146726530
bushmaster and taipan,GL6 0SD,51.693665135007800,-2.233560000000000
brown snake and grass snake,GL6 9HA,51.699586000000000,-2.197663000000000
Nukupuʻu and krait,GL6 9LU,51.691419101234600,-2.193316212021280
bearded dragon and Badger,GL8 0AN,51.636710208879000,-2.158766044276940
mamba and blue racer,GL8 0AX,51.636710208879000,-2.158766044276940
Recurvebill and box turtle,GL8 8BT,51.641830752369800,-2.165055459450540
puff adder and Treepie,GL8 8ES,51.637307116252200,-2.158797000000000
anole and Parrotlet,GL8 8FH,51.644513000000000,-2.151981000000000
Tit-tyrant and Mockingbird,GL8 8JE,51.638717061939900,-2.160535713433010
constrictor and New World blackbird,GL8 8JH,51.639678269439900,-2.161160479440150
Snipe and leathery turtle,GL8 8JL,51.639731500491400,-2.161680882831680
Polecat and bicycle lizard,GL8 8JN,51.640125834861000,-2.162607121070400
Darwin's finches and boomslang,GL8 8JP,51.641869165707000,-2.163307018489840
Kangaroo and massasauga,GL8 8NB,51.679877463677200,-2.174146673440050
dugite and diamond python,GL8 8NS,51.680527000000000,-2.167351000000000
Hawaiian honeycreeper and Mole,GL8 8PG,51.639469676640600,-2.162460267334520
amphisbaena and frill-necked lizard,GL8 8UJ,51.620985648140800,-2.256875323023710
Logrunners and bull snake,GL8 8XD,51.626752428255700,-2.151724524290250
Bronzewing pigeon and Pratincole,GL8 8XS,51.661416552254500,-2.198045994938470
Diving bird and Parrotbill,GL9 1AB,51.555777000000000,-2.286076000000000
Macaw and Kākāriki,GL9 1AN,51.576139593629600,-2.311413853652230
pit viper and caiman,GL9 1AS,51.579477961547200,-2.317165922862880
glass snake and Logrunners,GL9 1BA,51.581025852363800,-2.316657161970000
Ice seal and hawksbill,GL9 1BH,51.579001238099600,-2.320539495310070
galliwasp and Wader,GL9 1BW,51.582763000000000,-2.351062000000000
thorn lizard and puff adder,GL9 1DP,51.586255524136300,-2.263462949020960
Boto and Siskin,GL9 1HA,51.533777151065000,-2.322830955999840
deaf adder and agamid,GL9 1HH,51.526622777277700,-2.275961699752610
king snake and Old World vulture,GL9 1HQ,51.527264984551000,-2.274336713945830
tortoise and Fish eagle,GL9 1JQ,51.505553206157700,-2.332385496969070
Cloud rat and anaconda,SN14 6AS,51.523295000000000,-2.185900000000000
Songlark and Kite,SN14 6EA,51.538137000000000,-2.149800000000000
Buzzard and Mole,SN14 6EE,51.518929426012700,-2.135958792017330
Greenbul and Quetzal,SN14 6EH,51.534957306057800,-2.153610026907280
bandy-bandy and Warbler,SN14 6EQ,51.540651476016700,-2.151610569541370
deaf adder and Rat,SN14 6HT,51.489617447716100,-2.127805802944360
water snake and soft-shelled turtle,SN14 6JU,51.497006300096000,-2.177697389592800
rat snake and Marsh harrier,SN14 6NN,51.543509331282200,-2.234361515304330
boa constrictor and cerastes,SN14 6RF,51.498402796331300,-2.142783498682210
monitor and death adder,SN14 6RS,51.475074046192300,-2.131551829047770
Maya and Bunting,SN14 7BE,51.486668000000000,-2.194536000000000
tokay and caiman,SN14 7EQ,51.490506052810000,-2.194307753278490
black snake and garter snake,SN14 7EU,51.475293668823400,-2.209246150877250
galliwasp and dugite,SN14 7HH,51.496934890926500,-2.224528444390790
soft-shelled turtle and flying dragon,SN14 7HL,51.493474169080200,-2.228659810322490
tortoise and tuatara,SN14 7HR,51.493768665400000,-2.232176000000000
Old World warbler and Jackal,SN14 7LR,51.513164000000000,-2.264280000000000
River dolphin and amphisbaena,SN14 7LX,51.515321583626100,-2.271656498397920
Recurvebill and giant tortoise,SN14 7NF,51.512518143839800,-2.233207979351130
hognose snake and hoop snake,SN14 7NY,51.505724039533200,-2.261398508460380
Hawaiian honeycreeper and Cuscus,SN14 7PQ,51.487957000000000,-2.257898000000000
leathery turtle and Dorcopsis,SN14 7QZ,51.493717984758100,-2.218693325692870
Nukupuʻu and Darwin's finches,SN15 5PX,51.488884293288500,-2.132167754792600
death adder and grass snake,SN16 0JU,51.556709000000000,-2.166881000000000
thorn lizard and asp,SN16 0LG,51.573836717202900,-2.210997520411080
Triller and taipan,SN16 0LR,51.572936834238500,-2.211411796343170
Mink and Vulture,SN16 0NB,51.570240900695600,-2.210591287182060
jew lizard and Asiatic leopard,SN16 0NS,51.574801412565000,-2.214508436671020
Wallaby and Snipe,SN16 0PF,51.588986095429200,-2.173235477606110
tokay and Masked owl,SN16 0PW,51.572476556327700,-2.180141860274150
