name,postcode,lat,lon
harlequin snake and boa,BS15 4XJ,51.475737036454900,-2.495419858108850
kabaragoya and milk snake,BS16 0EN,51.478504000000000,-2.526957000000000
sand viper and amethystine python,BS16 1NT,51.499439242781200,-2.518193674637270
hawksbill and Schneider python,BS16 1NZ,51.501524828758900,-2.514212258574980
krait and Badger,BS16 1PS,51.501762389816400,-2.519473430815750
horned toad and Bronzewing pigeon,BS16 1SD,51.511015103604000,-2.513252826127040
python and snapping turtle,BS16 1SJ,51.511746594229100,-2.510638000000000
turtle and coral snake,BS16 2GS,51.483745000000000,-2.534981000000000
B and Komodo dragon,BS16 2HY,51.483357465035000,-2.531332258115940
viper and Mockingbird,BS16 2JL,51.485815545290100,-2.528595690591280
caiman and glass snake,BS16 2JU,51.483273000000000,-2.535926000000000
Gila monster and Argus,BS16 2PA,51.485902322657900,-2.517204834131360
coral snake and loggerhead,BS16 2PT,51.489328398091100,-2.519173609877360
Fulmarine petrel and slowworm,BS16 2QA,51.488161791906200,-2.522703382511760
blindworm and Jerboa,BS16 2UE,51.488271176732000,-2.516281078436390
indigo snake and Mockingbird,BS16 3AT,51.477820357912200,-2.534910912276370
Pratincole and tortoise,BS16 3RZ,51.476168938969600,-2.526295512130450
milk snake and Booted eagles,BS16 3TE,51.481242251187800,-2.527837173808090
Jay and perentie,BS16 3XG,51.478904022330100,-2.521906316015470
Solitaire and Meadowlark,BS16 3XL,51.480741874762800,-2.523122522058430
horned toad and habu,BS16 4BJ,51.478417700889300,-2.518027300669480
turtle and adder,BS16 4BQ,51.478376433032900,-2.517191663500090
ringhals and American sparrow,BS16 4EE,51.476765122365400,-2.519635654309380
Bunting and Marsh harrier,BS16 4NS,51.478041720252800,-2.509441017368540
Stint and bearded dragon,BS16 4NU,51.476128107851200,-2.509074118882310
Night heron and black snake,BS16 4NW,51.478667028708000,-2.510081000000000
Vole and Fox,BS16 4SP,51.476274064667100,-2.502337103678340
fer-de-lance and mountain devil,BS16 5AG,51.481647381328700,-2.515601423544890
Tahr and Ground sloth,BS16 5AN,51.482485456629600,-2.519254273279440
Black cockatoo and Ibex,BS16 5AS,51.482486665670500,-2.522466000000000
American sparrow and sand viper,BS16 5HA,51.481624458014100,-2.514679533255720
pit viper and Ice seal,BS16 5HR,51.481409200454900,-2.510443383878000
Civet and whip snake,BS16 5JW,51.482177398339200,-2.507471026580620
gavial and rat snake,BS16 5PA,51.480005638944800,-2.500218121756380
Eagle and python,BS16 5RD,51.486895878371600,-2.501690560366560
jew lizard and mountain devil,BS16 5TF,51.485055746385600,-2.507229362614000
python and Mink,BS16 5TR,51.485990167680300,-2.505309885539320
Eagle and deaf adder,BS16 5UR,51.486292369624800,-2.514386463948310
Boto and boa,BS16 6BZ,51.492691705501000,-2.502560832657530
Polecat and Armadillo,BS16 6DU,51.495177299843400,-2.505829250710510
Bunting and Chicken,BS16 6LE,51.500633336622300,-2.502071963227260
anaconda and Parakeet,BS16 6PL,51.500371915555000,-2.500124225806580
Piping shrike and goanna,BS16 6PP,51.500859831493900,-2.499567713735630
goanna and bushmaster,BS16 6PZ,51.501916359098300,-2.500616567157780
perentie and Lemming,BS16 6RF,51.495247979927200,-2.491324420966210
Peafowl and Ibex,BS16 6SD,51.497655018779800,-2.496233790845200
leguaan and jew lizard,BS16 6SJ,51.503326894164500,-2.496655608858040
water snake and tree snake,BS16 6TG,51.499273167902300,-2.489581000000000
Armadillo and Boto,BS16 6UP,51.494770952673100,-2.489288237772190
saltwater crocodile and snake,BS16 6XA,51.492307853478000,-2.493438971419890
Marsh harrier and Skunk,BS16 6XG,51.501266428728800,-2.490582396642270
Songlark and hawksbill,BS16 7DP,51.492099422151400,-2.480847815321290
python and Tattler,BS16 7DY,51.485106142602900,-2.478124328191310
hawksbill and Ice seal,BS16 7GZ,51.495115000000000,-2.471344000000000
crocodile and Gila monster,BS16 7HL,51.489219407009000,-2.474897923115490
Condor and tuatara,BS16 7JE,51.486425891942400,-2.474191993729250
bearded dragon and Schneider python,BS16 7LW,51.493821000000000,-2.466245000000000
Elephant and Old World vulture,BS16 7QZ,51.490476168019300,-2.470950090211460
boa constrictor and Viscacha,BS16 9AJ,51.495136977523800,-2.484711759967930
milk snake and B,BS16 9AR,51.485151000000000,-2.434214000000000
milk snake and Fulmarine petrel,BS16 9BE,51.491053106771100,-2.486007640375620
tiger snake and American sparrow,BS16 9BH,51.492690628744200,-2.490072577205820
lizard and lizard,BS16 9BN,51.493126774968100,-2.488982544282080
viper and Treepie,BS16 9DA,51.485910283481700,-2.485924132108540
dugite and rat snake,BS16 9DH,51.489117345958700,-2.490941625287680
asp and Night heron,BS16 9DY,51.490584643311600,-2.492685790050210
Skunk and Stilt,BS16 9HL,51.484225916543200,-2.490946675304570
Piping shrike and king snake,BS16 9HS,51.484360517384300,-2.486699725122310
Philippine hawk-owl and Macaw,BS16 9QA,51.487055840037400,-2.437040914173000
Fox and gaboon viper,BS16 9SU,51.481271674093200,-2.432895894059470
tokay and Peafowl,BS16 9SX,51.481722352401000,-2.432597753295390
Parrotbill and Petrel,BS16 9SZ,51.482408076239500,-2.431956213491850
mamba and indigo snake,BS16 9TD,51.483905284744700,-2.430703064091850
Vole and galliwasp,BS34 8SD,51.515086144128100,-2.529900127959350
Kestrel and Macaw,BS35 1AN,51.619952000000000,-2.520751000000000
Shearwater and Treepie,BS35 1AS,51.622210000000000,-2.526685000000000
Tree warbler and Parrotlet,BS35 1EN,51.611649785696000,-2.526922857816430
giant tortoise and hognose snake,BS35 1JG,51.613360728173900,-2.520299289687420
milk snake and cerastes,BS35 1LD,51.628885047127900,-2.519118929000800
Mink and brown snake,BS35 1LF,51.629454968477700,-2.512190754856820
tokay and sidewinder,BS35 1LU,51.618331821079000,-2.512383227568240
Treepie and smooth snake,BS35 1SN,51.618243638096100,-2.522189503418030
taipan and Flameback,BS35 1SQ,51.618718288220700,-2.520591686554840
Old World vulture and thorny devil,BS35 1TD,51.616290836990900,-2.514425592360470
krait and terrapin,BS35 1TQ,51.614388619549400,-2.513523086424180
green turtle and boa,BS35 1UA,51.612698982177400,-2.511294394494400
snake and Zebra,BS35 2AT,51.606576198767700,-2.525463414415390
Old World warbler and Quetzal,BS35 2DT,51.603793040492200,-2.512320559305440
Siskin and bushmaster,BS35 2HB,51.604352642368600,-2.507691850322760
Macaw and Chicken,BS35 2HY,51.605674311898700,-2.507706598669990
Snipe and boomslang,BS35 2LN,51.608903454393400,-2.515670596999210
saltwater crocodile and Komodo dragon,BS35 2XG,51.602338460614800,-2.511856583528640
sand lizard and anaconda,BS35 2YE,51.608829437382100,-2.505821197453020
diamondback turtle and Marmoset,BS35 3LY,51.590685777828900,-2.530043504555440
bearded dragon and Macaw,BS35 3PB,51.589641365864000,-2.534318429454920
gaboon viper and gaboon viper,BS35 3QH,51.580604088899200,-2.534515452161560
Philippine hawk-owl and amphisbaena,BS35 3QY,51.586778421723500,-2.531167144948520
Petrel and hoop snake,BS35 3RB,51.587659764081900,-2.537052067294370
Macaw and Siskin,BS35 3RE,51.586233836315600,-2.535968000000000
Triller and bushmaster,BS35 3TX,51.602410709614600,-2.497144396412860
thorny devil and kabaragoya,BS35 3TY,51.606679920377100,-2.499660290273350
giant tortoise and boa,BS35 9SB,51.610962582608000,-2.527781380841560
mud turtle and whip snake,BS35 9SD,51.610962582608000,-2.527781380841560
River dolphin and snake,BS36 1BQ,51.521627632750400,-2.508543786837180
black snake and chameleon,BS36 1HY,51.517651224542500,-2.504753000000000
Old World quail and taipan,BS36 1LT,51.521125372318700,-2.509489756280070
Dolphin and boa,BS36 1LY,51.525803156988300,-2.503574105368890
Songlark and whip snake,BS36 1NX,51.526734863584200,-2.502272649611160
Coati and Cuscus,BS36 1PX,51.527375810757200,-2.495331716470350
death adder and Mamo,BS36 1RG,51.530532305568300,-2.501564831319700
Greenbul and puff adder,BS36 1WY,51.530450830932500,-2.501693678530270
Komodo dragon and Rabbit,BS36 2DW,51.531858461302100,-2.489887769109320
massasauga and krait,BS36 2EG,51.532348635604200,-2.477869690027070
Logrunners and frilled lizard,BS36 2FP,51.526005038868600,-2.482488257464770
wall lizard and Crow,BS36 2JN,51.529473000000000,-2.479872000000000
Schneider python and cayman,BS36 2NU,51.536919269601000,-2.452297000000000
carpet snake and sidewinder,BS36 2PQ,51.529230104556300,-2.468582279039350
gecko and Recurvebill,BS36 2UH,51.512499867332100,-2.465586117549150
Marsh harrier and mountain devil,BS36 2XG,51.511278789253100,-2.469651642286760
skink and viper,BS37 0AW,51.539471000000000,-2.414055000000000
Snipe and Black cockatoo,BS37 4AT,51.540579075036500,-2.413113413219720
Gila monster and Polecat,BS37 4BA,51.538731306730900,-2.414394335226670
boa and Siskin,BS37 4DH,51.537806031196400,-2.414155236346810
Old World warbler and massasauga,BS37 4DJ,51.537405445787400,-2.413012572763760
perentie and Black jay,BS37 4HY,51.533179389809100,-2.413031970200940
flying lizard and Diving bird,BS37 4JD,51.531309557482500,-2.415465778735210
elapid and frill-necked lizard,BS37 4LP,51.532042226817100,-2.419292785729160
Capuchin and Zebra,BS37 4LQ,51.530312254502500,-2.425288275579350
Songlark and terrapin,BS37 4LX,51.530313217512400,-2.422534865053600
Perching duck and tree snake,BS37 4XT,51.538959465176500,-2.405716450709400
krait and worm lizard,BS37 5BN,51.545020062414200,-2.425901334849010
Minke whale and Peafowl,BS37 5EB,51.547306506495700,-2.427653237142060
Dorcopsis and Tit-tyrant,BS37 5EU,51.544905000000000,-2.420668543014580
Old World vulture and glass snake,BS37 5HD,51.548212180387900,-2.425426000000000
Minke whale and tuatara,BS37 5JN,51.541949000000000,-2.439759000000000
gavial and Viscacha,BS37 5ND,51.546427873009600,-2.431870319697700
Perching duck and Old World quail,BS37 5PS,51.542962574409600,-2.415442177305350
Night heron and Old World warbler,BS37 5SB,51.548684880182500,-2.411831237187240
taipan and flying lizard,BS37 5XB,51.550621106099900,-2.418583909124810
tuatara and Gull,BS37 5XQ,51.543163834332400,-2.419524833363480
turtle and Old World vulture,BS37 5XT,51.545269029954300,-2.429133860740310
Dolphin and blue racer,BS37 5YS,51.536398090226200,-2.440281799206420
Towhee and Wallaby,BS37 6AR,51.537979181465400,-2.397907471177010
python and Crow,BS37 6BJ,51.538388000000000,-2.394293501681470
perentie and asp,BS37 6DH,51.536096280005200,-2.390985000364510
Hawaiian honeycreeper and Tit-tyrant,BS37 6DJ,51.535356627650300,-2.388989059452490
Grouse and tiger snake,BS37 6DX,51.533638746480200,-2.391843359690210
indigo snake and krait,BS37 6EZ,51.536504821971200,-2.397836935681010
perentie and deaf adder,BS37 6HJ,51.537328348112500,-2.404173629040320
grass snake and Polecat,BS37 6HX,51.532797000000000,-2.399375117694860
green turtle and bearded lizard,BS37 6LF,51.537847112839200,-2.386314105184180
box turtle and moloch,BS37 6LL,51.533556371390900,-2.381535000000000
Dolphin and glass snake,BS37 6NB,51.532684376791600,-2.352593345039490
thorn lizard and chuckwalla,BS37 6NF,51.533702000000000,-2.355481909709060
boa constrictor and Bunting,BS37 6NG,51.530193508621600,-2.358599870105290
hoop snake and Francolin,BS37 6NT,51.540834279591900,-2.385704972657980
hawksbill and horned toad,BS37 6PD,51.561232936710400,-2.352338201511600
blind snake and Magpie,BS37 6QX,51.554839476353000,-2.324494626613380
Stilt and diamondback terrapin,BS37 6XS,51.532089934601000,-2.408322369814610
iguana and American sparrow,BS37 7AE,51.541564259728300,-2.406503853959160
Thrasher and mud turtle,BS37 7AG,51.542835360288700,-2.405549062940560
Civet and Dorcopsis,BS37 7AR,51.543761487040400,-2.408138490070150
Dolphin and monitor,BS37 7BN,51.550250393880500,-2.408975382725230
Dolphin and bearded lizard,BS37 7LQ,51.552690616417600,-2.435463264529240
tokay and Kākāriki,BS37 7PT,51.549399757251100,-2.435460670514250
Tree warbler and brown snake,BS37 7PZ,51.564047000000000,-2.433408000000000
python and Quetzal,BS37 7QH,51.570417000000000,-2.444362000000000
gopher snake and hognose snake,BS37 7RX,51.549109723246500,-2.408619026736010
Minke whale and mamba,BS37 8RS,51.509977000000000,-2.444059709405000
Asiatic leopard and snake,BS37 8TQ,51.529008277857400,-2.420360468477150
Songlark and slowworm,BS37 8YA,51.524239900154200,-2.421166953726570
horned viper and milk snake,BS37 9TD,51.545457205277200,-2.469210493524410
blindworm and Condor,BS37 9XS,51.551261331480800,-2.442574292989210
Lemming and snake,GL11 4AA,51.681545859887900,-2.355282370686150
Duck and leguaan,GL11 4AX,51.674281187329600,-2.349209525760760
python and goanna,GL11 4AY,51.674138147972100,-2.348933658394880
Treepie and amphisbaena,GL11 4BD,51.675011480755100,-2.348535447769980
kabaragoya and deaf adder,GL11 4FF,51.684612000000000,-2.350473000000000
Mockingbird and alligator,GL11 4JA,51.681633934084600,-2.352910999833460
Old World quail and Parrotlet,GL11 4JJ,51.681662440985700,-2.357062618964390
king snake and Grackle,GL11 4PD,51.678072835377000,-2.344017694761690
Stilt and python,GL11 5AA,51.680891000000000,-2.346339000000000
Thicketbird and Booted eagles,GL11 5AG,51.680058849129900,-2.312228016572230
boa constrictor and ringhals,GL11 5DB,51.688242000000000,-2.350402000000000
Gull and rattlesnake,GL11 5HB,51.683266869702700,-2.348049234112870
gavial and chuckwalla,GL11 5HL,51.699930703657600,-2.343937563523800
Ice seal and mamba,GL11 5PB,51.693350000000000,-2.353031000000000
galliwasp and Tree warbler,GL11 5PE,51.691301308838700,-2.349601000000000
perentie and boomslang,GL11 5TH,51.685193975703700,-2.301472550505040
flying lizard and crocodile,GL11 5UX,51.698380504347800,-2.368856102530120
agama and Kite,GL11 6AU,51.675119356854000,-2.380395430268460
Parrotlet and Pheasant,GL11 6LD,51.694933315380700,-2.378449299525140
lizard and Egret,GL11 6PG,51.694335712751700,-2.371311666329400
skink and Hawaiian honeycreeper,GL12 7DE,51.638184450041200,-2.354148441400020
deaf adder and Parakeet,GL12 7DF,51.638589048607300,-2.354151595237890
Fish eagle and Songlark,GL12 7DN,51.639579267305900,-2.356731485839700
Meadowlark and Grouse,GL12 7JA,51.639158774568900,-2.343983049042580
garter snake and Prion,GL12 7JB,51.638400978480400,-2.344844312876150
Argus and tokay,GL12 7JE,51.639244185401600,-2.345515426660520
Fox and Cloud rat,GL12 7JX,51.632587555340400,-2.343499858766450
Coati and diamond snake,GL12 7NU,51.640456406371400,-2.346059321353560
Moluccan boobook and viper,GL12 7NY,51.637346000000000,-2.343995000000000
Argus and tortoise,GL12 7QZ,51.602632475609000,-2.351258203694500
Guillemot and fer-de-lance,GL12 7RP,51.606559783557800,-2.336574260181180
thorn lizard and Condor,GL12 7SD,51.631140229252900,-2.346465148296860
Parrotbill and Tit-tyrant,GL12 8AP,51.612018200187000,-2.439655914019010
milk snake and Capuchin,GL12 8AU,51.602778664453500,-2.441097131762750
slowworm and rat snake,GL12 8AZ,51.599966000000000,-2.440897000000000
bushmaster and kabaragoya,GL12 8BN,51.616104944727800,-2.402201764346760
box turtle and terrapin,GL12 8DY,51.611160023321600,-2.490568072180940
Fish eagle and diamondback turtle,GL12 8ET,51.635158359541000,-2.403078086695640
anole and anaconda,GL12 8HA,51.648216343925900,-2.422778001868920
bicycle lizard and Dolphin,GL12 8HG,51.633024061118000,-2.431825807384110
Bronzewing pigeon and garter snake,GL12 8HT,51.623126490967400,-2.440991169475070
ringhals and Linsang,GL12 8JT,51.625396893372900,-2.363597538886850
Masked owl and Thicketbird,GL12 8LR,51.591222319241000,-2.396438479714230
Macaw and sand viper,GL12 8LS,51.624641262118200,-2.399647876776840
diamondback turtle and Ibex,GL12 8PG,51.592401022927500,-2.398845030510160
Minke whale and Wallaby,GL12 8PH,51.591797018216500,-2.396660014372460
River dolphin and Jay,GL12 8PJ,51.592342152556100,-2.397646374341630
leguaan and swift,GL12 8QR,51.593329106083300,-2.468823257072890
sand viper and Linsang,GL12 8RQ,51.622484533964500,-2.369092225328960
Hawk and fer-de-lance,GL12 8RZ,51.624004179449600,-2.366186581274740
cobra and taipan,GL12 8TP,51.627427277150500,-2.407863570742240
Bunting and snapping turtle,GL12 8TZ,51.625435169268200,-2.404118647562590
Ground sloth and bicycle lizard,GL13 9BL,51.692373547153300,-2.458417266950030
water snake and Boto,GL13 9FA,51.670479924469600,-2.433744093429940
Vole and wall lizard,GL13 9JW,51.661726000000000,-2.446238000000000
snake and Duck,GL13 9LJ,51.665764895614600,-2.477349773127690
Stint and horned viper,GL13 9LL,51.655521279561000,-2.480176563793380
harlequin snake and Old World warbler,GL6 0BL,51.695791000000000,-2.218116340918440
rock python and chameleon,GL6 0DY,51.697600766843800,-2.230527487338920
Old World warbler and anole,GL6 0DZ,51.694014034097800,-2.220786954777400
Black jay and Komodo dragon,GL6 0HJ,51.693649219347200,-2.218745249541760
Siskin and green turtle,GL6 0HU,51.692530023746500,-2.216208084908930
Night heron and Guillemot,GL6 0JD,51.691459000000000,-2.217635000000000
diamond python and Goose,GL6 0NY,51.697293326870900,-2.222308000000000
Badger and tokay,GL6 0PW,51.681106550834000,-2.232743333514450
tuatara and Asiatic leopard,GL6 0QA,51.684101228439700,-2.262483000000000
leathery turtle and Gull,GL6 0QN,51.690434048772500,-2.221579643479780
Crow and bushmaster,GL8 8BZ,51.636705429827900,-2.158765767999760
Stint and flying dragon,GL8 8DF,51.638460000000000,-2.165534000000000
python and Nukupuʻu,GL8 8DQ,51.638757433676000,-2.157284585999730
Schneider python and Cloud rat,GL8 8HQ,51.643365442244700,-2.153904440363040
soft-shelled turtle and Chipmunk,GL8 8HW,51.643101000000000,-2.157415000000000
monitor and Minke whale,GL8 8JQ,51.639336026534000,-2.161578322264800
horned viper and Bronzewing pigeon,GL8 8LG,51.641637816706100,-2.161557614383770
diamondback and adder,GL8 8PF,51.673231973026100,-2.148741991973690
Parrotbill and Elephant,GL8 8PS,51.596339332200200,-2.148230384424680
sea snake and blind snake,GL8 8QG,51.605274758823000,-2.197512000000000
thorny devil and galliwasp,GL8 8RJ,51.626378038741600,-2.134330103325450
Badger and Condor,GL8 8SN,51.686295999383400,-2.141624593097890
Pratincole and Dorcopsis,GL8 8WA,51.646147000000000,-2.154473000000000
chameleon and frill-necked lizard,GL8 8XN,51.644995058779100,-2.171743825660190
hoop snake and brown snake,GL8 8XU,51.657764466334500,-2.209349213773820
soft-shelled turtle and Darwin's finches,GL8 8YB,51.665753000000000,-2.277125000000000
sand lizard and tiger snake,GL9 1DJ,51.544033628922600,-2.285786247836160
cayman and thorn lizard,GL9 1EZ,51.528178462866200,-2.318568000000000
bandy-bandy and New World blackbird,GL9 1HW,51.525251738385900,-2.277798416477920
terrapin and bearded dragon,SN14 6AD,51.515113643443400,-2.195551039006540
Grouse and Kākāriki,SN14 6AE,51.517201853494500,-2.183065137286730
mamba and death adder,SN14 6AQ,51.513203888291200,-2.202935354825760
Maya and rattlesnake,SN14 6AS,51.523295000000000,-2.185900000000000
Francolin and Quetzal,SN14 6BH,51.500175595547500,-2.125818522473080
Zebra and Pitohui,SN14 6DP,51.537091000000000,-2.152853000000000
Boto and Mole,SN14 6DS,51.536459583298500,-2.153067220802160
Crow and diamondback turtle,SN14 6DX,51.536550717974800,-2.152130376393460
bandy-bandy and Vole,SN14 6FB,51.555240900600000,-2.242297440000000
Old World vulture and gecko,SN14 6JL,51.499118149670600,-2.145998250856490
Kestrel and Piping shrike,SN14 6JR,51.501540663840900,-2.150097494365520
copperhead and bearded dragon,SN14 6JS,51.496000099842000,-2.158304465492150
Wader and krait,SN14 6PA,51.555418000000000,-2.241750000000000
brown snake and taipan,SN14 6PX,51.533627634383300,-2.205693380808000
viper and Francolin,SN14 7BP,51.488968900525600,-2.194070767242960
cycling lizard and Herring gull,SN14 7NT,51.505617272686500,-2.264899031261680
alligator and Siskin,SN14 7PH,51.484331223841000,-2.192898955030310
thorn lizard and rock python,SN14 7PQ,51.487957000000000,-2.257898000000000
elapid and Hawk,SN14 8HD,51.486901364661400,-2.386300802876020
Old World warbler and Boto,SN14 8HF,51.490248017437800,-2.385451000000000
Herring gull and puff adder,SN16 0JW,51.562846567756000,-2.148381000000000
flying lizard and Vulture,SN16 0NJ,51.575590000000000,-2.216877861195860
Buzzard and chameleon,SN16 0NX,51.579092000000000,-2.199044000000000
Argus and bearded dragon,SN16 0PN,51.579068634177000,-2.173241004849310
racer and sea snake,SN16 0PU,51.567043969861900,-2.203232975737580
