name,postcode,lat,lon
Philippine hawk-owl and Parakeet,GL6 0DG,51.694040244525300,-2.221192178056750
Coati and Snipe,GL6 0DQ,51.693826825440800,-2.224938000000000
rock python and Tit-tyrant,GL6 0DT,51.697180905913200,-2.229136356088290
Mockingbird and Herring gull,GL6 0EU,51.699705354254300,-2.234734351290660
krait and elapid,GL6 0HT,51.692486106453600,-2.215643654483980
blind snake and Rat,GL6 0JP,51.691358599810700,-2.222394306451300
cobra and agama,GL6 0LE,51.691964416918100,-2.220588899155890
Puffleg and blue tongue,GL6 0LG,51.691351632709300,-2.221323725896650
Maya and Goose,GL6 0LN,51.693360000000000,-2.217452000000000
Gila monster and cayman,GL6 0NE,51.698592026138400,-2.229389466731160
Wallaby and River dolphin,GL6 0PR,51.681084766337900,-2.234652413417420
puff adder and Parrotbill,GL6 0SB,51.693333155866000,-2.233457146726530
bushmaster and taipan,GL6 0SD,51.693665135007800,-2.233560000000000
brown snake and grass snake,GL6 9HA,51.699586000000000,-2.197663000000000
Nukupuʻu and krait,GL6 9LU,51.691419101234600,-2.193316212021280
Philippine hawk-owl and hawksbill,GL7 5DW,51.668833000000000,-1.916525000000000
Peafowl and sand lizard,GL7 5FP,51.670612892014300,-1.898991051749060
Meadowlark and box turtle,GL7 5QF,51.670341000000000,-1.885558000000000
asp and chameleon,GL7 5QL,51.663907177317700,-1.890851566247060
puff adder and Darwin's finches,GL7 5TJ,51.673566000000000,-1.902397000000000
Rat and Macaw,GL7 5TL,51.670692000000000,-1.905614000000000
Dorcopsis and Treepie,GL7 5UL,51.667795247518000,-1.931834410753750
constrictor and python,GL7 5WB,51.669466000000000,-1.927769000000000
Rat and goanna,GL7 5WE,51.668975303050600,-1.928145653303080
Myna and Kite,GL7 5WL,51.669720976228500,-1.927175662527320
Skunk and Bunting,GL7 5WS,51.669971000000000,-1.929185000000000
mountain devil and dukite,GL7 5XL,51.666151000000000,-1.932039000000000
thorn lizard and cycling lizard,GL7 6AR,51.675896484529400,-2.018362268898580
giant tortoise and Quetzal,GL7 6BL,51.654891157913100,-1.971735614141740
Coati and Cloud rat,GL7 6BP,51.684898134080700,-2.000516000000000
blue racer and rattlesnake,GL7 6BT,51.675593000000000,-2.002599000000000
Greenbul and pit viper,GL7 6DP,51.655340989132900,-1.972891765001100
ringhals and Gila monster,GL7 6DR,51.654254000000000,-1.973239000000000
Old World quail and Skunk,GL7 6FD,51.669567000000000,-2.068839000000000
Kākāriki and Rabbit,GL7 6FW,51.644480000000000,-1.971005000000000
carpet snake and Chicken,GL7 6GB,51.670007000000000,-1.904357000000000
swift and bushmaster,GL7 6NB,51.661232000000000,-2.035958000000000
Rat and Tree warbler,GL7 6ND,51.661229000000000,-2.035965000000000
diamond snake and smooth snake,GL7 6NY,51.697951000000000,-2.027848000000000
hoop snake and Logrunners,GL7 6PB,51.691928876891700,-2.065386608068190
Gila monster and Darwin's finches,GL7 6PQ,51.673693000000000,-2.084594000000000
bearded dragon and Badger,GL8 0AN,51.636710208879000,-2.158766044276940
mamba and blue racer,GL8 0AX,51.636710208879000,-2.158766044276940
Recurvebill and box turtle,GL8 8BT,51.641830752369800,-2.165055459450540
puff adder and Treepie,GL8 8ES,51.637307116252200,-2.158797000000000
anole and Parrotlet,GL8 8FH,51.644513000000000,-2.151981000000000
Tit-tyrant and Mockingbird,GL8 8JE,51.638717061939900,-2.160535713433010
constrictor and New World blackbird,GL8 8JH,51.639678269439900,-2.161160479440150
Snipe and leathery turtle,GL8 8JL,51.639731500491400,-2.161680882831680
Polecat and bicycle lizard,GL8 8JN,51.640125834861000,-2.162607121070400
Darwin's finches and boomslang,GL8 8JP,51.641869165707000,-2.163307018489840
Kangaroo and massasauga,GL8 8NB,51.679877463677200,-2.174146673440050
dugite and diamond python,GL8 8NS,51.680527000000000,-2.167351000000000
Hawaiian honeycreeper and Mole,GL8 8PG,51.639469676640600,-2.162460267334520
Jay and flying dragon,GL8 8RT,51.635544193023600,-2.113492784819790
amphisbaena and frill-necked lizard,GL8 8UJ,51.620985648140800,-2.256875323023710
Logrunners and bull snake,GL8 8XD,51.626752428255700,-2.151724524290250
Bronzewing pigeon and Pratincole,GL8 8XS,51.661416552254500,-2.198045994938470
rat snake and giant tortoise,SN11 8TB,51.479872913705800,-1.966385381388070
Cloud rat and anaconda,SN14 6AS,51.523295000000000,-2.185900000000000
Songlark and Kite,SN14 6EA,51.538137000000000,-2.149800000000000
Buzzard and Mole,SN14 6EE,51.518929426012700,-2.135958792017330
Greenbul and Quetzal,SN14 6EH,51.534957306057800,-2.153610026907280
bandy-bandy and Warbler,SN14 6EQ,51.540651476016700,-2.151610569541370
deaf adder and Rat,SN14 6HT,51.489617447716100,-2.127805802944360
water snake and soft-shelled turtle,SN14 6JU,51.497006300096000,-2.177697389592800
rat snake and Marsh harrier,SN14 6NN,51.543509331282200,-2.234361515304330
boa constrictor and cerastes,SN14 6RF,51.498402796331300,-2.142783498682210
monitor and death adder,SN14 6RS,51.475074046192300,-2.131551829047770
Maya and Bunting,SN14 7BE,51.486668000000000,-2.194536000000000
tokay and caiman,SN14 7EQ,51.490506052810000,-2.194307753278490
black snake and garter snake,SN14 7EU,51.475293668823400,-2.209246150877250
galliwasp and dugite,SN14 7HH,51.496934890926500,-2.224528444390790
soft-shelled turtle and flying dragon,SN14 7HL,51.493474169080200,-2.228659810322490
tortoise and tuatara,SN14 7HR,51.493768665400000,-2.232176000000000
Recurvebill and giant tortoise,SN14 7NF,51.512518143839800,-2.233207979351130
hognose snake and hoop snake,SN14 7NY,51.505724039533200,-2.261398508460380
Hawaiian honeycreeper and Cuscus,SN14 7PQ,51.487957000000000,-2.257898000000000
leathery turtle and Dorcopsis,SN14 7QZ,51.493717984758100,-2.218693325692870
terrapin and Cloud rat,SN15 4BJ,51.507236746634300,-2.050438639331780
Ibex and Flameback,SN15 4DA,51.517935387673700,-2.026901615216440
boa constrictor and moloch,SN15 4DZ,51.502945116122400,-1.966627870955780
Mink and Wader,SN15 4EA,51.501362692056900,-1.966888336063560
box turtle and B,SN15 4EX,51.513829302596000,-1.993956731872590
Jerboa and Capuchin,SN15 4EZ,51.514854426147000,-1.996550553364430
bearded dragon and Herring gull,SN15 4GY,51.537773498132400,-2.004724000000000
Hawk and cerastes,SN15 4HY,51.536721411009400,-2.006425000000000
Flameback and Warbler,SN15 4JF,51.540048422672800,-1.998019512603030
Dolphin and tokay,SN15 4LN,51.479133815928400,-2.088393571805300
Badger and amethystine python,SN15 4RE,51.505265737335400,-2.084770280785400
Myna and tiger snake,SN15 4RL,51.507556239443900,-2.075005553807250
python and thorn lizard,SN15 4RP,51.506303123740800,-2.079988707379550
puff adder and Elephant,SN15 4TB,51.505541392663400,-1.959422038180460
Mouse and Grouse,SN15 4TJ,51.512831333339900,-2.003525231982970
blindworm and kabaragoya,SN15 5AW,51.566353000000000,-1.965052437433620
hognose snake and habu,SN15 5AX,51.557535449517600,-1.982685798165640
Piping shrike and Civet,SN15 5DX,51.563767885215000,-1.954249237047220
Scimitar babbler and Siskin,SN15 5HP,51.544101255384400,-2.051345000000000
Condor and Thicketbird,SN15 5LU,51.482386498653000,-2.121031660938840
Nukupuʻu and Darwin's finches,SN15 5PX,51.488884293288500,-2.132167754792600
Myna and puff adder,SN16 0DN,51.587966801180500,-2.108697319848070
diamondback turtle and Snipe,SN16 0FJ,51.549948727900000,-2.096492304800000
bull snake and Fox,SN16 0FQ,51.597357000000000,-2.107921000000000
Kangaroo and Condor,SN16 0HE,51.553457112581500,-2.109610039994750
death adder and grass snake,SN16 0JU,51.556709000000000,-2.166881000000000
thorn lizard and asp,SN16 0LG,51.573836717202900,-2.210997520411080
Triller and taipan,SN16 0LR,51.572936834238500,-2.211411796343170
Mink and Vulture,SN16 0NB,51.570240900695600,-2.210591287182060
jew lizard and Asiatic leopard,SN16 0NS,51.574801412565000,-2.214508436671020
Wallaby and Snipe,SN16 0PF,51.588986095429200,-2.173235477606110
tokay and Masked owl,SN16 0PW,51.572476556327700,-2.180141860274150
bandy-bandy and Hawaiian honeycreeper,SN16 9BQ,51.583607098673600,-2.097227421379730
tiger snake and asp,SN16 9DL,51.599433305302900,-2.052894571004030
Egret and chuckwalla,SN16 9EJ,51.634256875229700,-2.069464524133190
Marsh harrier and Maya,SN16 9ER,51.633583823185800,-2.067252881485290
Egret and Boto,SN16 9GE,51.594631000000000,-2.099253000000000
boa and Buzzard,SN16 9JR,51.591237723419000,-2.100794764587050
Shearwater and gecko,SN16 9JU,51.594086236011000,-2.102793240386830
Herring gull and Crow,SN16 9QQ,51.615381504210800,-1.964090882137180
amphisbaena and Ibex,SN16 9QS,51.617090030729700,-1.964696158015180
Flameback and Mole,SN16 9RW,51.596638455138100,-1.980375725148680
alligator and Civet,SN16 9SQ,51.660727174916400,-2.051968723615820
Mouse and deaf adder,SN16 9XS,51.593390828173400,-2.095819231892020
rat snake and taipan,SN16 9XZ,51.593886020718300,-2.094997433832160
Wader and Ibex,SN4 4DY,51.532349949000000,-1.900248239400000
Pitohui and Bunting,SN4 4EY,51.532349949000000,-1.900248239400000
bull snake and goanna,SN4 4FE,51.532349949000000,-1.900248239400000
boa constrictor and Marmoset,SN4 4FJ,51.532349949000000,-1.900248239400000
Eagle and sidewinder,SN4 4FW,51.532349949000000,-1.900248239400000
Shearwater and Gull,SN4 4HU,51.532349949000000,-1.900248239400000
caiman and blindworm,SN4 4JH,51.532349949000000,-1.900248239400000
turtle and Thrasher,SN4 4LG,51.532349949000000,-1.900248239400000
Viscacha and flying dragon,SN4 4ND,51.532320000000000,-1.900240000000000
Meadowlark and diamondback turtle,SN4 4PY,51.532320000000000,-1.900240000000000
Egret and dugite,SN4 7BJ,51.542293342100300,-1.904177280193070
fer-de-lance and agamid,SN4 7DU,51.538669541467700,-1.903853246745520
loggerhead and Philippine hawk-owl,SN4 7EG,51.536374076892800,-1.900657353845070
Coati and Shearwater,SN4 7FN,51.536085594040100,-1.899764092173080
sand viper and Rat,SN4 7FX,51.534810423900000,-1.896580920300000
coral snake and thorny devil,SN4 7GH,51.537858000000000,-1.898944000000000
horned toad and Partridge,SN4 7HF,51.546820854447400,-1.899206992860610
Francolin and flying dragon,SN4 7PZ,51.500705865144500,-1.901642315227280
lizard and agamid,SN4 7QS,51.522465531790100,-1.902071210201140
Booted eagles and Mouse,SN4 8AE,51.542578379507700,-1.900932273276230
Vulture and pit viper,SN4 8BL,51.538094636612900,-1.894021253843140
grass snake and leguaan,SN4 8DA,51.540847214875900,-1.895370267565040
Guillemot and Fish eagle,SN4 8FG,51.538672035700000,-1.891381578500000
goanna and Rabbit,SN4 8HA,51.545420686302800,-1.891884464928560
Fox and racer,SN4 8JR,51.548936287846900,-1.891847309598110
galliwasp and Mouse,SN4 8LD,51.547473991434400,-1.895499318561620
Piping shrike and cerastes,SN4 8LL,51.545312863835200,-1.882583519542210
diamondback turtle and jew lizard,SN4 8SZ,51.541205630995400,-1.893985207747700
terrapin and Kestrel,SN5 4BH,51.584060786875900,-1.877793267312280
giant tortoise and Chipmunk,SN5 4HA,51.592917842733400,-1.869959928580300
soft-shelled turtle and Hawk,SN5 4HT,51.603081461875200,-1.865021780028430
Jay and tokay,SN5 4JH,51.614744000000000,-1.864583300314960
blue racer and perentie,SN5 4JL,51.613396161210600,-1.851487948198620
mamba and thorny devil,SN6 6AD,51.640889659271300,-1.857279776321210
Black cockatoo and horned toad,SN6 6DE,51.643474781538000,-1.853731036688730
adder and sand lizard,SN6 6DJ,51.657229761078500,-1.867550107794010
Mink and puff adder,SN6 6DQ,51.649001000000000,-1.857109402141690
Quetzal and bull snake,SN6 6EN,51.642691956362400,-1.860655741713270
mountain devil and Philippine hawk-owl,SN6 6EQ,51.643683081962300,-1.862430262672610
Vole and viper,SN6 6HL,51.634861458178800,-1.869262308218630
Egret and Scimitar babbler,SN6 6NY,51.648125866027300,-1.938020801450930
