name,postcode,lat,lon
Triller and diamondback terrapin,SL6 3XE,51.503830615780100,-0.762207795769583
Perching duck and Darwin's finches,SL6 3XP,51.505254159747400,-0.757371176501615
Shearwater and milk snake,SL6 4LH,51.518702371506100,-0.759266000000000
flying dragon and death adder,SL6 5DG,51.525535936225200,-0.750953000000000
copperhead and Diving bird,SL6 5DH,51.525719704119600,-0.753974465785530
Thicketbird and tuatara,SL6 5DT,51.528643000000000,-0.757452235474205
thorn lizard and Gila monster,SL6 5DW,51.530849110632800,-0.754353451132541
horned toad and Kestrel,SL6 5HW,51.530306177263900,-0.750648813589058
anaconda and gaboon viper,SL6 5JA,51.522945627047800,-0.757783437398292
Mouse and blue racer,SL6 5PB,51.534011535902100,-0.819319425041358
frilled lizard and perentie,SL6 6NY,51.530041330063000,-0.763847065348390
Badger and bull snake,SL6 6PB,51.531392155549300,-0.769173537467046
Grouse and monitor,SL6 6QX,51.525390094835300,-0.791231585566948
Jay and Schneider python,SL6 6TG,51.529432173800000,-0.812575898700000
boa constrictor and Moluccan boobook,SL6 9UP,51.556321518644900,-0.760999995816163
thorny devil and gavial,SL7 1AG,51.572331520755300,-0.775138889777916
Chickadee and Petrel,SL7 1BH,51.572606712188100,-0.772216666327803
Songlark and rock snake,SL7 1EY,51.573659211580700,-0.760283411331788
Old World quail and smooth snake,SL7 1FQ,51.581135049656600,-0.758925412738958
thorn lizard and Buzzard,SL7 1JJ,51.579663871680600,-0.760105618545428
Rat and Peafowl,SL7 1LG,51.575018690293900,-0.763002679319922
Fulmarine petrel and skink,SL7 1LP,51.570833037142500,-0.771138958989555
Partridge and leathery turtle,SL7 1PB,51.572589794100800,-0.766315316785958
Rat and Bunting,SL7 1PH,51.573648000000000,-0.767614000000000
bearded lizard and Old World quail,SL7 1QJ,51.569454923683800,-0.764062687742725
Old World quail and Peafowl,SL7 1RA,51.580530009409800,-0.757830600031008
cerastes and Grouse,SL7 1SB,51.551932000000000,-0.787442000000000
Puffleg and Wallaby,SL7 1TH,51.574480275167200,-0.761401082738665
Egret and boa,SL7 1TR,51.583242037285400,-0.761754664530251
dugite and Mink,SL7 1XA,51.570834221000000,-0.775554286984827
chameleon and water snake,SL7 2AA,51.568706927741900,-0.773331709144822
cerastes and Old World quail,SL7 2EX,51.559250182032200,-0.829052471874899
Solitaire and Boto,SL7 2FX,51.570857000000000,-0.779878000000000
Night heron and Triller,SL7 2HA,51.551513447040600,-0.839534756367002
Zebra and massasauga,SL7 2JH,51.575136376963200,-0.799451266114763
gopher snake and Kite,SL7 2LD,51.570057615608600,-0.789975313742229
puff adder and gopher snake,SL7 2LR,51.570059000000000,-0.777826000000000
Grouse and Wallaby,SL7 2NN,51.572317580866800,-0.780709145950352
Crow and Grouse,SL7 2PY,51.574877287186400,-0.780424207288532
king cobra and Guillemot,SL7 2QR,51.574122574345300,-0.810271824028772
diamondback and cerastes,SL7 2QX,51.589048939802600,-0.814717744633947
horned viper and fer-de-lance,SL7 2SD,51.558135979591500,-0.820151882858178
Buzzard and brown snake,SL7 3BA,51.577849872780600,-0.778338676293672
Night heron and Gila monster,SL7 3DU,51.612541055106500,-0.799345856384019
Pitohui and indigo snake,SL7 3EH,51.579977793181200,-0.774586989800179
chameleon and Egret,SL7 3LY,51.586879846991900,-0.773376495704636
frilled lizard and rat snake,SL7 3NB,51.586839315266900,-0.778112053514056
Triller and Mink,SL7 3PX,51.593465238152700,-0.786682780897395
dukite and soft-shelled turtle,SL7 3QN,51.598771282887500,-0.780693964465887
New World blackbird and terrapin,SL7 3RB,51.584528478781300,-0.755859643589983
ringhals and bicycle lizard,SL7 3XD,51.578329000000000,-0.778408854639832
