name,postcode,lat,lon
death adder and Grouse,HP11 1PH,51.618015157349700,-0.758526455328820
slowworm and Recurvebill,HP11 1PW,51.618469695929900,-0.755813000000000
flying dragon and bicycle lizard,HP11 1TA,51.617753054277800,-0.765221258841249
Dolphin and loggerhead,HP11 1TP,51.614247725526600,-0.772220147231727
snapping turtle and diamondback terrapin,HP11 1TS,51.614308078677900,-0.770254261670296
boa constrictor and Fish eagle,HP11 2AR,51.628719264194400,-0.750418136826576
Armadillo and flying lizard,HP11 2BP,51.630544816794000,-0.752130669495078
saltwater crocodile and Mole,HP11 2ET,51.632025131943900,-0.758116000000000
caiman and Stint,HP11 2HQ,51.628590000000000,-0.751645583813651
agamid and ringhals,HP11 2JU,51.627602000000000,-0.756840725386496
Triller and diamond python,HP11 2LQ,51.633482339562300,-0.760358346421455
wall lizard and Pratincole,HP11 2LX,51.633277218397600,-0.764785363775977
Gull and River dolphin,HP11 2QB,51.630594369996300,-0.759353440534804
kabaragoya and hoop snake,HP11 2RS,51.632491000000000,-0.761715000000000
lizard and Condor,HP11 2RW,51.633056798884900,-0.762638444353182
python and taipan,HP11 2RX,51.632811000000000,-0.761359000000000
galliwasp and Crow,HP11 2TQ,51.618408238566300,-0.767673468117300
Armadillo and diamond snake,HP11 2XL,51.629128457519900,-0.751809000000000
Philippine hawk-owl and giant tortoise,HP12 3AF,51.636371051571600,-0.769990057186659
krait and adder,HP12 3AQ,51.637546149581200,-0.770579640600049
crocodile and Chipmunk,HP12 3DT,51.632300917382000,-0.770287970591193
Triller and glass snake,HP12 3HW,51.625598268228600,-0.776811243396327
pit viper and ringhals,HP12 3HX,51.627794165772100,-0.771825649956184
Peafowl and Tattler,HP12 3NU,51.624426406003900,-0.767929396500440
thorn lizard and puff adder,HP12 3NW,51.616623423794600,-0.768963969844956
Hawk and cycling lizard,HP12 3PS,51.621599000000000,-0.768295000000000
Chipmunk and sidewinder,HP12 3SL,51.620024145895300,-0.781207890734944
Rat and goanna,HP12 3UE,51.623027452029200,-0.781214111498137
Warbler and Jay,HP12 3UL,51.623799555148200,-0.777639693255410
Thicketbird and soft-shelled turtle,HP12 3UT,51.629396589061000,-0.779107000000000
king cobra and amethystine python,HP12 4AP,51.657535000000000,-0.783426000000000
bandy-bandy and soft-shelled turtle,HP12 4BA,51.637440000000000,-0.779253000000000
bull snake and deaf adder,HP12 4BN,51.638027954690000,-0.787517161965574
thorny devil and Mink,HP12 4DQ,51.634044613529000,-0.792752871363954
Hawaiian honeycreeper and Parakeet,HP12 4EN,51.621243004915300,-0.791258027233401
rock python and flying lizard,HP12 4LF,51.627420149089400,-0.785141641915201
giant tortoise and loggerhead,HP12 4NB,51.628059168159700,-0.790426777103142
loggerhead and horned viper,HP12 4NL,51.626226555025000,-0.792339146841928
Moluccan boobook and Scimitar babbler,HP12 4RY,51.620396109374400,-0.788478199688822
Komodo dragon and Mockingbird,HP12 4SE,51.616285517157300,-0.782449000000000
agamid and Mockingbird,HP12 4SJ,51.618740295894400,-0.788348952959691
Linsang and python,HP12 4UE,51.616310853107800,-0.787315919497220
chuckwalla and rock python,HP12 4UF,51.615299286541800,-0.789494936264258
gavial and puff adder,HP12 9AF,51.622143700000000,-0.770490300000006
American sparrow and brown snake,HP12 9EG,51.622144880849400,-0.770490370046850
Komodo dragon and Kangaroo,HP12 9FD,51.622164000000000,-0.770369000000000
harlequin snake and Grouse,HP12 9FW,51.622164000000000,-0.770369000000000
wall lizard and Marmoset,HP13 5DN,51.633380382340900,-0.752428544503037
chameleon and Armadillo,HP13 5DY,51.632638055581300,-0.752230000000000
agamid and cobra,HP13 5EN,51.641981609715900,-0.758002191394414
Condor and Stilt,HP13 5EP,51.642714046759100,-0.760944864648254
loggerhead and tokay,HP13 5FT,51.637940335463400,-0.755077953256368
Old World quail and Mouse,HP13 5HB,51.648016865342200,-0.779619144427671
Zebra and python,HP13 5HZ,51.643384124620200,-0.779425557794378
Wader and leguaan,HP13 5JH,51.641303895674800,-0.780854309682234
Jackal and Herring gull,HP13 5LD,51.638862351352000,-0.772624978376466
Jackal and Civet,HP13 5TZ,51.647112180529100,-0.777359782343946
garter snake and smooth snake,HP13 5UF,51.646574214214700,-0.778371530502632
garter snake and diamond python,HP13 5UL,51.644125422380400,-0.778943173952360
bearded dragon and habu,HP13 6RZ,51.630375568567600,-0.750589355871804
Prion and brown snake,HP14 3AY,51.636375731978200,-0.822197958197122
swift and Tattler,HP14 3BP,51.638649843832500,-0.832167000000000
anole and Shearwater,HP14 3BZ,51.639397262633200,-0.830327846327253
Moluccan boobook and diamondback turtle,HP14 3FY,51.659173484218200,-0.897523000000000
Linsang and Dorcopsis,HP14 3LD,51.624081137227800,-0.831805121718321
agama and Parrotlet,HP14 3LQ,51.624135288017200,-0.829116753264852
racer and Buzzard,HP14 3PJ,51.626891000000000,-0.868930578694150
Macaw and Skunk,HP14 3RE,51.658208423308600,-0.893497486489512
Mockingbird and Mockingbird,HP14 3SW,51.650460186435600,-0.889002887137250
Herring gull and Thicketbird,HP14 3TB,51.661774965355000,-0.905512000000000
Guillemot and Argus,HP14 3TQ,51.663974358744200,-0.899487553129272
Old World warbler and Black jay,HP14 3XS,51.651603360209600,-0.911220836615219
hognose snake and Vulture,HP14 3XU,51.634299000000000,-0.918416178405041
diamondback and massasauga,HP14 3YB,51.617036000000000,-0.889588000000000
Rat and Scimitar babbler,HP14 4AR,51.679776733471200,-0.857535720140165
tortoise and Asiatic leopard,HP14 4BX,51.650861517783700,-0.836653053222877
Scimitar babbler and frilled lizard,HP14 4DW,51.663727729190900,-0.864561000000000
Booted eagles and giant tortoise,HP14 4EZ,51.657781662714000,-0.803196271948483
Darwin's finches and anaconda,HP14 4HJ,51.622142368825800,-0.770490331512096
anole and lizard,HP14 4NZ,51.661240463628600,-0.755321539714961
black snake and sand viper,HP14 4QN,51.662931863897600,-0.771642264674307
loggerhead and diamondback terrapin,HP14 4QR,51.663092039833000,-0.765478577624245
Grosbeak and Ibex,HP14 4RA,51.662863000000000,-0.776097000000000
elapid and Bronzewing pigeon,HP14 4TT,51.673710422434400,-0.790469436690089
Ice seal and tortoise,HP14 4UF,51.674804811625700,-0.791091090697140
Quetzal and Thicketbird,HP14 4UL,51.677008859510100,-0.790323725884952
king cobra and Buzzard,HP14 4XE,51.680800615052700,-0.792681614351541
Bronzewing pigeon and taipan,HP14 4ZN,51.622142368825800,-0.770490331512096
Parrotlet and gopher snake,HP27 0PA,51.695979466141500,-0.825050000000000
Puffleg and Myna,HP27 0QS,51.695415418703200,-0.811536373065595
Gila monster and Jackal,HP27 0QY,51.694672092167600,-0.811830743855527
Vulture and Pitohui,HP27 0SN,51.690051138451200,-0.785520261805064
agama and Duck,HP27 0SW,51.689610536556100,-0.784649563884016
Ibex and viper,HP27 9NS,51.684010775241000,-0.829120859277252
Egret and Booted eagles,HP27 9NW,51.689616524578900,-0.830422948312017
copperhead and rattlesnake,OX10 0BP,51.600927291639100,-1.122918184537550
Thicketbird and Warbler,OX10 0BX,51.601036574948000,-1.125515007061970
Dolphin and blue racer,OX10 0DQ,51.597870317670500,-1.126557551600890
Old World vulture and Gull,OX10 0FU,51.606815000000000,-1.139088000000000
Polecat and jew lizard,OX10 0HD,51.598104000000000,-1.122814000000000
Maya and constrictor,OX10 0JX,51.602893020683100,-1.134575969300960
Pheasant and carpet snake,OX10 0QP,51.616420308919300,-1.161154517797000
Argus and Schneider python,OX10 0RG,51.611872481350000,-1.151546000000000
sand viper and Nukupuʻu,OX10 0SH,51.605829288209800,-1.161291892582220
chameleon and leguaan,OX10 1AS,51.596122246247300,-1.137000093506250
Viscacha and blue tongue,OX10 6EH,51.609851809321700,-1.078931341867240
terrapin and copperhead,OX10 6FD,51.624259000000000,-1.111339000000000
Old World quail and Francolin,OX10 6HE,51.621824232168100,-1.079397000000000
Tit-tyrant and Dolphin,OX10 6LE,51.624401838515300,-1.107095310724520
milk snake and Grackle,OX10 6LW,51.621932857273300,-1.101683497912490
chuckwalla and Peafowl,OX10 6LX,51.621365000000000,-1.113164000000000
taipan and bearded lizard,OX10 6QE,51.591508000000000,-1.039417000000000
Black jay and frilled lizard,OX10 6RR,51.619823252696500,-1.104484034840570
bicycle lizard and Scimitar babbler,OX10 6RY,51.619017764582200,-1.112083093037280
leathery turtle and mud turtle,OX10 6SZ,51.621460840792300,-1.106994125493350
Vulture and Ice seal,OX10 7AX,51.663860432923700,-1.140167313602450
blind snake and Shearwater,OX10 7DD,51.638931362750800,-1.137069450485750
Mole and Myna,OX10 7DH,51.642831680229900,-1.139249906044870
Francolin and Asiatic leopard,OX10 7DR,51.637857765735500,-1.135355801377950
sand viper and Towhee,OX10 7DT,51.637146306396500,-1.136424172967950
Crow and Armadillo,OX10 7HE,51.639359438753400,-1.139041065607920
Kite and cobra,OX10 7PH,51.650865000000000,-1.158163000000000
Tree warbler and terrapin,OX10 8AQ,51.607593807760800,-1.133114764954930
frilled lizard and elapid,OX10 8DH,51.595293703343000,-1.102050181836680
Snipe and Komodo dragon,OX10 8ET,51.598624850955200,-1.113260374862370
Meadowlark and Tahr,OX10 8HA,51.598213915910800,-1.113614878262930
skink and sidewinder,OX10 8HY,51.606921169301900,-1.132131188296000
hawksbill and viper,OX10 8JG,51.607031969388700,-1.128879990395280
Egret and grass snake,OX10 8JQ,51.607783937112900,-1.128432383905570
pit viper and cobra,OX10 8JT,51.607552425972200,-1.127527061229610
habu and Greenbul,OX10 8LR,51.622311000000000,-1.135189000000000
Fulmarine petrel and Magpie,OX10 9AB,51.597129463805400,-1.125965000000000
Guillemot and Polecat,OX10 9AU,51.596694095419000,-1.126782227756730
sand lizard and tokay,OX10 9AW,51.597589821238700,-1.131168457624340
Recurvebill and Parakeet,OX10 9BB,51.596632155882200,-1.129338779297550
green turtle and monitor,OX10 9DR,51.596291434688700,-1.125837106955890
wall lizard and Peafowl,OX10 9EQ,51.589785946389500,-1.130061456434880
hognose snake and Fox,OX10 9EZ,51.599679000000000,-1.138810000000000
boomslang and puff adder,OX10 9GE,51.569705000000000,-1.139246000000000
bearded lizard and iguana,OX10 9GS,51.569688000000000,-1.138285236600000
tree snake and jew lizard,OX10 9GY,51.567951000000000,-1.141674000000000
swift and Minke whale,OX10 9GZ,51.568231193542900,-1.141757000000000
ringhals and tuatara,OX10 9JT,51.543204453676400,-1.156473423144800
Kite and turtle,OX10 9NW,51.573634498131700,-1.151826821443860
Partridge and constrictor,OX10 9QL,51.568800131399600,-1.144818061343800
Jerboa and horned toad,OX10 9QN,51.569836057162700,-1.146313630593770
Vulture and Quetzal,OX10 9QW,51.570088766077100,-1.148920485604990
tree snake and Shearwater,OX39 4BB,51.695851356065900,-0.898729127479432
asp and amphisbaena,OX39 4BQ,51.690466329876000,-0.895951894664535
coral snake and Mockingbird,OX39 4HX,51.698268071514600,-0.915918272567166
sea snake and Thicketbird,OX39 4QQ,51.698591501276400,-0.906186887569130
Perching duck and Parakeet,OX39 4RS,51.690228000000000,-0.930317000000000
bicycle lizard and pit viper,OX39 4RU,51.690016461225500,-0.931913309380468
Tahr and thorny devil,OX44 7AG,51.683879143472500,-1.128476777445040
thorn lizard and Moluccan boobook,OX44 7BB,51.677401000000000,-1.129608000000000
cerastes and Eagle,OX44 7RE,51.668917097846500,-1.078934425656300
Moluccan boobook and Vole,OX44 7RL,51.665167953450700,-1.073255788715720
Vole and Logrunners,OX44 7SW,51.668966918544400,-1.086467133747430
cerastes and Mole,OX44 7XZ,51.671852191847600,-1.058050000000000
rattlesnake and Goose,OX44 7YE,51.667246828908100,-1.075772725263800
Maya and grass snake,OX49 5BU,51.645644663267100,-1.003934000000000
Jay and blue racer,OX49 5DF,51.640754762661300,-0.978765751745183
mountain devil and swift,OX49 5ER,51.633561750288900,-0.998635620932962
python and cobra de capello,OX49 5EY,51.624632395376200,-0.991986000000000
Treepie and hognose snake,OX49 5HP,51.618110129883200,-0.951801403726562
Pratincole and Argus,OX49 5JL,51.644786054062900,-1.009574652826610
terrapin and Argus,OX49 5LE,51.634274650320300,-1.031101592628690
elapid and perentie,OX49 5LF,51.634437891889800,-1.033453330662670
smooth snake and copperhead,OX49 5PD,51.639039000000000,-1.050610000000000
python and tiger snake,OX49 5RZ,51.682057096052200,-0.960783504608600
bearded lizard and milk snake,OX49 5SD,51.670989000000000,-0.944537000000000
massasauga and diamond snake,OX49 5TJ,51.675781544576900,-0.959827975583776
Siskin and Fulmarine petrel,OX49 5TW,51.672037240765200,-0.967549245752676
Maya and Boto,OX9 7DW,51.690676000000000,-0.976146000000000
python and Viscacha,OX9 7HA,51.688966779956500,-1.031800837452630
Armadillo and Piping shrike,RG10 0HB,51.480873475477600,-0.841357035429480
puff adder and Wader,RG10 0HP,51.478236662990800,-0.803523100640965
Tattler and Gila monster,RG10 0JY,51.485629931250600,-0.809710000000000
flying lizard and iguana,RG10 0JZ,51.485000153170100,-0.808977352186880
Warbler and anaconda,RG10 0LH,51.487356107129700,-0.825032773888424
galliwasp and glass snake,RG10 8AW,51.502391000000000,-0.846804000000000
ringhals and Thicketbird,RG10 8BH,51.501831545252000,-0.856731460043982
blindworm and brown snake,RG10 8DF,51.518033619100000,-0.848975652400000
Flameback and Jackal,RG10 8HH,51.499624930357200,-0.884375423363311
Piping shrike and whip snake,RG10 8JH,51.502614724861700,-0.867949805011267
mud turtle and leguaan,RG10 8JJ,51.504568518266300,-0.863564522338721
dugite and Gila monster,RG10 8NE,51.523546547400600,-0.849341070684293
Thicketbird and sand viper,RG10 8QG,51.519891598129600,-0.838868373867687
blue racer and Civet,RG10 8QY,51.519676000000000,-0.824408563056917
Gull and Parrotbill,RG10 8QZ,51.520120548433000,-0.821249650717238
Black cockatoo and fer-de-lance,RG10 9AJ,51.477600376595600,-0.869922638308472
chameleon and Ibex,RG10 9AR,51.485050870277400,-0.862091005792072
gavial and mountain devil,RG10 9BA,51.484285894956100,-0.867597141751620
American sparrow and Tahr,RG10 9BP,51.485629088953400,-0.863300807693943
horned viper and diamondback terrapin,RG10 9GA,51.477651582524300,-0.871349000000000
fer-de-lance and thorn lizard,RG10 9JR,51.480352359961800,-0.857902140661548
leathery turtle and Peafowl,RG10 9LA,51.477935056033400,-0.859906484753134
ringhals and gaboon viper,RG10 9LB,51.478890399049100,-0.861985089453999
Rabbit and Wader,RG10 9NA,51.475521429841600,-0.863220838894739
diamondback and agama,RG10 9RU,51.483745000000000,-0.873904000000000
frill-necked lizard and Marsh harrier,RG10 9SR,51.494601688792600,-0.843846878880974
Badger and Masked owl,RG10 9TW,51.477180944465700,-0.867456272073579
jew lizard and Dorcopsis,RG10 9UD,51.479647519684200,-0.853858835155720
Pheasant and Crow,RG10 9UY,51.503479471794400,-0.820641626063412
Mockingbird and thorny devil,RG31 6YE,51.475184000000000,-1.042826000000000
tokay and Capuchin,RG31 6YG,51.477700076506100,-1.052795828820680
Ground sloth and chameleon,RG4 6PQ,51.483281836988500,-0.957285000000000
Vulture and Lemming,RG4 6QS,51.484499516471400,-0.953527700181897
Civet and boa,RG4 6RL,51.483121092872200,-0.948201933396480
Magpie and Bunting,RG4 6RY,51.485109233971300,-0.960412301847942
chameleon and puff adder,RG4 6TS,51.477026425555800,-0.917757609724137
crocodile and Logrunners,RG4 6UA,51.482455783443600,-0.945207391378372
terrapin and glass snake,RG4 7HB,51.476297841970900,-0.988244648873802
Philippine hawk-owl and Francolin,RG4 7HT,51.481634725495300,-0.991928410986822
hawksbill and soft-shelled turtle,RG4 7LD,51.478171274000600,-0.994641000000000
crocodile and Coati,RG4 7NY,51.483159000000000,-0.987157000000000
Black cockatoo and habu,RG4 7PX,51.479350818715600,-0.985253000000000
moloch and Triller,RG4 7UB,51.492094688920700,-1.013376018949400
Argus and king cobra,RG4 7UH,51.498135355707600,-1.008794000000000
puff adder and boa constrictor,RG4 7XJ,51.479310463855000,-0.989330016624090
massasauga and Tattler,RG4 7XQ,51.479618434870000,-0.982310296040724
rock snake and dugite,RG4 8AB,51.479781629914400,-0.963975082529384
Peafowl and Stint,RG4 8LD,51.484463304451900,-0.980042208627054
thorny devil and green turtle,RG4 8PH,51.480391653821400,-0.979196985905528
dukite and rock python,RG4 8QF,51.483574556050100,-0.977109726591563
wall lizard and sand viper,RG4 8QT,51.486786139776000,-0.977282723249940
White ibis and Vole,RG4 8SJ,51.485488639444900,-0.963658552549849
Marsh harrier and glass snake,RG4 8ST,51.488673866367800,-0.969001922794090
Thicketbird and Argus,RG4 8TY,51.481075332961500,-0.961814468825503
Linsang and Schneider python,RG4 8UF,51.490839220591200,-0.956609038181457
Condor and taipan,RG4 8UN,51.492922915587000,-0.958362035715755
Booted eagles and Old World vulture,RG4 8UU,51.491696607355400,-0.960003233832287
Fish eagle and Thrasher,RG4 9AH,51.498004862219200,-0.982102631155991
lizard and River dolphin,RG4 9BH,51.509636741524000,-0.996310824551516
Shearwater and Ice seal,RG4 9BQ,51.517015000000000,-0.984973000000000
fer-de-lance and loggerhead,RG4 9DN,51.518738314443300,-1.003922423599430
Boto and horned viper,RG4 9DQ,51.516091000000000,-0.989317000000000
Philippine hawk-owl and Jackal,RG4 9EB,51.492666722515000,-0.992866310679793
Perching duck and massasauga,RG4 9ER,51.493229963637300,-0.996685502919792
amphisbaena and Puffleg,RG4 9HR,51.511525000000000,-1.022784000000000
Marmoset and Schneider python,RG4 9LR,51.515534101169500,-0.987793716985471
fer-de-lance and Jackal,RG4 9LS,51.517449000000000,-0.985532000000000
hognose snake and rat snake,RG4 9NS,51.503274829008400,-0.961670378886988
diamond python and Recurvebill,RG4 9NY,51.519277000000000,-0.969378000000000
Hawaiian honeycreeper and Old World quail,RG4 9SU,51.519723350011400,-0.979384635020519
racer and Condor,RG4 9TG,51.521989376011400,-0.985618321004196
Vole and krait,RG4 9TH,51.522139000000000,-0.985111000000000
Minke whale and flying dragon,RG8 0BJ,51.528721788921200,-1.133416608414140
crocodile and king cobra,RG8 0DE,51.530267348958600,-1.126006239842960
Dolphin and adder,RG8 0EL,51.522523360832900,-1.132986515213550
gaboon viper and Tree warbler,RG8 0JJ,51.548977035517400,-1.131806070264220
Black cockatoo and Black jay,RG8 0LP,51.529109484049000,-1.117869106895430
saltwater crocodile and Linsang,RG8 0LR,51.527895047606100,-1.105769000000000
Capuchin and Diving bird,RG8 0LT,51.539665961083600,-1.115516643959170
gecko and wall lizard,RG8 0LU,51.540383364430400,-1.116454413523180
adder and Rat,RG8 0QU,51.535420565863200,-1.065454002234280
kabaragoya and Maya,RG8 0RN,51.527523369986000,-1.069666343615830
Nukupuʻu and Pheasant,RG8 0SW,51.529643250221900,-1.067129189234850
thorny devil and dukite,RG8 0TD,51.551993431917700,-1.032316577676530
Darwin's finches and pit viper,RG8 0TP,51.544129640745600,-1.039361954892670
Civet and smooth snake,RG8 0TY,51.553668000000000,-1.034589000000000
mud turtle and sea snake,RG8 0UE,51.528231430808300,-1.037058459624160
Dolphin and New World blackbird,RG8 0UH,51.526729466413900,-1.034826973908010
garter snake and Parrotlet,RG8 0WJ,51.523242302877600,-1.140266276195860
Parakeet and Old World warbler,RG8 7AN,51.484481000000000,-1.088011000000000
chameleon and bull snake,RG8 7AZ,51.482378124253300,-1.088269471506810
leguaan and Philippine hawk-owl,RG8 7BD,51.477600571481800,-1.090440000000000
chuckwalla and skink,RG8 7FZ,51.519920673700000,-1.081236340300000
hognose snake and leathery turtle,RG8 7JS,51.483475842828300,-1.078008220326850
bicycle lizard and Viscacha,RG8 7LY,51.483612221944800,-1.085090961291690
blind snake and agamid,RG8 7PJ,51.506904985906600,-1.075302182540600
Booted eagles and anole,RG8 7RD,51.494805509063300,-1.052066896034800
blind snake and caiman,RG8 7RE,51.501138225957000,-1.060205138903630
American sparrow and lizard,RG8 7RW,51.504041297566400,-1.051111702991790
gecko and kabaragoya,RG8 8AG,51.480596134710600,-1.040711445361810
Kestrel and diamond snake,RG8 8DR,51.480509317634200,-1.057734604977430
Condor and Recurvebill,RG8 8LX,51.481440957403100,-1.140404253955120
Zebra and Vulture,RG8 8NX,51.486430408657900,-1.146431415371320
anole and Rat,RG8 8PG,51.490846547765200,-1.141667792189040
death adder and Rat,RG8 9AX,51.522670380578800,-1.135852045534810
agamid and rock python,RG8 9BB,51.523115441967900,-1.135238243512730
Chipmunk and crocodile,RG8 9BX,51.527287413014000,-1.135216893160710
Old World warbler and diamondback terrapin,RG8 9JE,51.522973504459500,-1.146555737731470
gaboon viper and rock python,RG8 9JQ,51.523392207514500,-1.148493788367680
monitor and Jay,RG8 9JT,51.523396493570700,-1.149084678067090
Mockingbird and sand viper,RG8 9LA,51.527064060057800,-1.150183951916480
Parakeet and wall lizard,RG8 9LB,51.527450865515400,-1.148965878315770
hoop snake and Ibex,RG8 9PG,51.499252219807100,-1.132894991268510
Triller and Old World warbler,RG8 9QN,51.522037986607900,-1.153952913404070
Gila monster and worm lizard,RG8 9SP,51.504590562999000,-1.158310000000000
amethystine python and Zebra,RG8 9TA,51.507249394435800,-1.137037064566070
Badger and Grosbeak,RG9 1AF,51.535481000000000,-0.900978196000000
Diving bird and Cuscus,RG9 1BB,51.535699777317000,-0.900535960650877
rock snake and Francolin,RG9 1BE,51.534008018946200,-0.899437730530724
sea snake and Armadillo,RG9 1DD,51.532299289765700,-0.899406844382398
anaconda and thorn lizard,RG9 1DL,51.531173877748000,-0.900212474187452
cobra and death adder,RG9 1DP,51.530662748533800,-0.899403051943853
Mink and bearded lizard,RG9 1DR,51.529824870619600,-0.898269959297636
turtle and bearded dragon,RG9 1LG,51.528732821759400,-0.912294067579112
cayman and Gila monster,RG9 1NH,51.526709908134000,-0.904586900310197
viper and goanna,RG9 1NP,51.534195000000000,-0.901005000000000
thorn lizard and perentie,RG9 1NU,51.527165089819800,-0.896546644630236
Rabbit and Ibex,RG9 1RT,51.529878098915800,-0.921421042549191
Guillemot and Gila monster,RG9 1SH,51.533060159630300,-0.903843408320450
thorny devil and Duck,RG9 1SZ,51.530852502936900,-0.913007635089094
Darwin's finches and giant tortoise,RG9 1TB,51.530751111217500,-0.914682356519366
harlequin snake and Herring gull,RG9 1TD,51.534430826039200,-0.907155377289775
Flameback and Triller,RG9 1XA,51.534123000000000,-0.910750143377178
slowworm and Goose,RG9 2BW,51.538351415567400,-0.905244720589482
Tattler and deaf adder,RG9 2DF,51.537678000000000,-0.907051635338246
tortoise and Vulture,RG9 2DH,51.540119862396800,-0.905894428072769
whip snake and bearded lizard,RG9 2JD,51.541806792347700,-0.903590049660293
terrapin and gaboon viper,RG9 2QB,51.535930183608300,-0.904019588019346
ringhals and Booted eagles,RG9 3BG,51.558486015619200,-0.866621106863434
krait and king snake,RG9 3GH,51.563772894400000,-0.885086114200000
Old World warbler and anole,RG9 3LP,51.507398404712500,-0.882960842535917
Coati and Zebra,RG9 3LY,51.502686870825300,-0.880151275877324
bull snake and sidewinder,RG9 3NU,51.511556329265500,-0.881461360483506
Bunting and chuckwalla,RG9 4AB,51.512197080079500,-0.899775963063572
king cobra and Moluccan boobook,RG9 4BQ,51.525924000000000,-0.932998000000000
Cuscus and python,RG9 4EA,51.501741271808600,-0.927142228406090
Tahr and bearded dragon,RG9 4LB,51.499687255257800,-0.925735379559377
Petrel and Argus,RG9 4LR,51.497859340553900,-0.930373873010695
Chickadee and amethystine python,RG9 4PL,51.535281557052700,-0.953127965108773
Tree warbler and copperhead,RG9 4PN,51.535230000000000,-0.952303221706696
Chipmunk and Songlark,RG9 4QA,51.529991590056000,-0.957862447762798
Linsang and box turtle,RG9 4QR,51.543227895711800,-0.974244495454909
hoop snake and Jay,RG9 4RB,51.544207553921200,-0.983494934941339
boomslang and Logrunners,RG9 5AX,51.576194035865600,-0.987846000000000
Masked owl and Petrel,RG9 5EN,51.525925396733500,-0.984305617501366
Rabbit and harlequin snake,RG9 5HR,51.525289899136600,-0.987764853155756
diamondback terrapin and galliwasp,RG9 5JH,51.528719706495400,-0.978880801493617
indigo snake and boomslang,RG9 5JJ,51.527883036440500,-0.977013000000000
green turtle and Bunting,RG9 5JL,51.528664975893100,-0.975696152457585
anole and Thrasher,RG9 5LR,51.529624022537100,-0.993002680475357
Herring gull and Lemming,RG9 5NE,51.533086745788700,-0.997309090423529
anaconda and Petrel,RG9 5NS,51.538585007128700,-1.004152590192630
Greenbul and Jackal,RG9 5NW,51.540105229519100,-1.008474046231390
mud turtle and Gull,RG9 5SL,51.581190564111400,-1.033993000000000
Herring gull and viper,RG9 5TR,51.555484146782600,-1.007779160439640
Old World warbler and Ice seal,RG9 5WG,51.538160270696000,-1.019921476599650
amphisbaena and Pitohui,RG9 6EL,51.605411396319400,-0.997854201765446
diamond python and Herring gull,RG9 6HB,51.590814610938400,-0.939134604353807
blue tongue and Goose,RG9 6HR,51.604203000000000,-0.963125000000000
Black jay and Kite,RG9 6HZ,51.574459715686200,-0.914651991319568
Pitohui and water snake,RG9 6JG,51.571452000000000,-0.905272000000000
thorn lizard and tuatara,RG9 6NS,51.607715418823800,-0.859157405819304
flying dragon and Stilt,RG9 6NZ,51.592699000000000,-0.855906000000000
Rabbit and glass snake,RG9 6PH,51.606797331968600,-0.848927597376124
Ice seal and Pratincole,RG9 6RA,51.620899006169300,-0.929044116801554
Black cockatoo and Skunk,RG9 6RB,51.608050329262100,-0.850166721067760
galliwasp and thorny devil,RG9 6RH,51.606377939424900,-0.849255891727642
python and gecko,RG9 6SL,51.588017327095600,-0.869668405039771
Philippine hawk-owl and garter snake,RG9 9BZ,51.535934000000000,-0.904000000000000
chuckwalla and caiman,SL6 3NB,51.499254619037700,-0.758888550634133
Mockingbird and tokay,SL6 3NF,51.501366334230100,-0.761309258124894
crocodile and Puffleg,SL6 3PQ,51.510263323506600,-0.762537852657750
racer and Shearwater,SL6 3PS,51.511551694816300,-0.755974968191300
adder and sand lizard,SL6 3QU,51.512662624005000,-0.790847884807062
grass snake and adder,SL6 3QY,51.510711617834100,-0.790870708100231
Eagle and Towhee,SL6 3RX,51.513377037560500,-0.804404215148593
horned viper and Polecat,SL6 3SB,51.503939000000000,-0.801136000000000
bearded lizard and chuckwalla,SL6 3SG,51.488994415547900,-0.777689933357208
Goose and thorny devil,SL6 3SR,51.480539000000000,-0.782438000000000
