name,id,postcode,lat,lon
dugite and Asiatic leopard,275969,SS9 2AR,51.544491631749000,0.653088734282518
boomslang and swift,1432614,CM2 8UX,51.670372080645500,0.485924047228529
terrapin and blind snake,1428192,CM3 8AW,51.685951237054900,0.558279000000000
Old World vulture and gecko,274847,SS9 5XF,51.566761395878300,0.662538836112360
Civet and Jackal,275577,SS9 3TL,51.553544441326200,0.629292528749769
Crow and Magpie,281720,SS17 7NN,51.529255349682400,0.452793123716155
jew lizard and bushmaster,277998,SS7 1ED,51.555023336586800,0.561239699269465
Civet and habu,275570,SS9 3SU,51.552962412043000,0.631985528066981
elapid and constrictor,279179,SS5 4SF,51.603974863175700,0.641131406994051
Fox and Gull,1751987,SS13 1FL,51.589480414065200,0.514118703344901
Magpie and Towhee,286344,SS0 9AG,51.550027125269800,0.699788908060541
Tattler and indigo snake,275411,SS9 4TP,51.563583318678100,0.638010149394717
turtle and diamondback terrapin,274944,SS99 5YY,51.531164723048200,0.729429421230918
Jay and water snake,286013,SS1 2HJ,51.534335518826500,0.722250211364228
gaboon viper and Tit-tyrant,1438415,CM11 1HG,51.640695014182200,0.441777207954351
White ibis and Dolphin,1437668,CM12 0FL,51.645159216339100,0.431204701239818
B and Kite,280921,SS2 6SB,51.560696990471500,0.700031475985249
Grackle and Myna,279493,SS5 4HD,51.595654170303800,0.667838867319827
Viscacha and Philippine hawk-owl,278114,SS7 1QF,51.554591155002100,0.595219138185301
Goose and viper,279713,SS4 3JP,51.615767784607500,0.689720322390509
caiman and lizard,275196,SS9 5RU,51.568979297685200,0.658728676692363
dukite and bearded dragon,1428988,CM3 4EY,51.693177000000000,0.581523000000000
Eagle and Booted eagles,282960,SS15 5AL,51.570669796829000,0.446738640577279
garter snake and Songlark,275027,SS9 5AH,51.571136148711400,0.648463430400582
perentie and Puffleg,275070,SS9 5EH,51.570508765954500,0.636390739329086
Mouse and Mole,275489,SS9 3LQ,51.547166765197600,0.669582000000000
brown snake and Argus,1427663,CM4 0PH,51.685423564021900,0.356986039390606
Vole and thorny devil,1432611,CM2 8UT,51.669154484906000,0.499221081390991
brown snake and adder,1428000,CM4 0HL,51.679585773423200,0.384225929379510
mountain devil and tree snake,283098,SS15 5HB,51.573735558846400,0.439441748640486
bushmaster and thorn lizard,277530,SS7 2RB,51.554458000000000,0.607373000000000
Perching duck and Egret,281270,SS17 9DB,51.527249302906500,0.469957744366576
glass snake and Komodo dragon,1994266,CM13 1RN,51.630120000000000,0.359275000000000
Eagle and Hawk,276901,SS8 0ND,51.519501891564100,0.561119676822331
carpet snake and Marsh harrier,278332,SS6 8JX,51.583831915547700,0.610888467607385
Vole and Petrel,285288,SS11 8HJ,51.616103000000000,0.530345570699936
blue racer and harlequin snake,285309,SS11 8JP,51.615773010003100,0.537255339142711
diamondback terrapin and Vulture,1427750,CM4 9AP,51.659606497586800,0.369411317804539
Recurvebill and Diving bird,284394,SS13 1JL,51.578779805046800,0.514033161423963
tuatara and Diving bird,1438093,CM11 2YT,51.623786742595000,0.429267102733310
hognose snake and Parrotbill,276656,SS8 7HR,51.513599588808000,0.602487428345463
Chicken and goanna,284278,SS13 3AR,51.564630789009800,0.504060678303818
Towhee and Prion,283956,SS13 3LS,51.570774939064200,0.496807363866795
Flameback and terrapin,283702,SS14 2HH,51.575870278692800,0.470226485983921
Boto and Wallaby,281025,SS2 4DY,51.545167751335200,0.724022045976514
Old World vulture and Marmoset,1437177,CM13 1QU,51.629387831874600,0.356565087593681
rock snake and leathery turtle,281746,SS17 0DN,51.513549559073800,0.423987217907488
Myna and Philippine hawk-owl,279738,SS4 1LP,51.568917089330400,0.739323000000000
Marmoset and sand lizard,281328,SS17 7SX,51.526721721530900,0.441901431092683
caiman and Asiatic leopard,279400,SS5 4BG,51.603353374496600,0.659090506469738
Petrel and blue tongue,1427499,CM4 9PS,51.656514809846600,0.433937976036351
Macaw and whip snake,279243,SS4 3PS,51.618013114469400,0.746919584718935
Rat and Tattler,275884,SS9 1PT,51.545563196597800,0.660968921999844
boa and sand lizard,277624,SS7 4DU,51.572128790593300,0.552575121757802
Warbler and loggerhead,281730,SS17 0BQ,51.517678892388300,0.440394163962655
amphisbaena and gaboon viper,277151,SS7 4HD,51.572144475208500,0.555159364281946
coral snake and Boto,285388,SS11 7AY,51.617160000000000,0.517613000000000
Cuscus and Lemming,284032,SS13 2AF,51.570470000000000,0.509375556477661
wall lizard and lizard,282285,SS16 5QE,51.565892434185700,0.450710066398895
goanna and indigo snake,281571,SS17 8NA,51.524009528174200,0.401216734895870
Chipmunk and crocodile,286289,SS0 8LR,51.541296120575900,0.684628000000000
Goose and Black cockatoo,278231,SS6 9LW,51.598070271730300,0.607170954897702
carpet snake and Fox,1437223,CM13 1UG,51.652671295798000,0.360563090253020
Parrotlet and puff adder,279597,SS4 3BX,51.601881125109200,0.690531252620744
Duck and mud turtle,275103,SS9 5JA,51.567727791569300,0.642074359049740
garter snake and Ibex,1438035,CM11 1LT,51.629870728339400,0.421644588977791
Francolin and saltwater crocodile,275578,SS9 3TN,51.554798861253500,0.628297304113849
water snake and B,280107,SS4 1DQ,51.582789122726700,0.712341621967586
Dolphin and Booted eagles,285308,SS11 8JN,51.613934612640700,0.533266964295146
bushmaster and turtle,279235,SS4 3PF,51.618131288280400,0.745713149121816
Recurvebill and Peafowl,283323,SS15 4EE,51.584903198746600,0.438235521685103
mamba and lizard,286507,SS0 7NQ,51.538479915865100,0.697807247222073
elapid and Lemming,1427558,CM4 9RW,51.656709731979100,0.459106755911866
amethystine python and soft-shelled turtle,2445904,SS15 5FH,51.571103000000000,0.460039000000000
Triller and python,275314,SS9 4ND,51.560219301125100,0.653975491450679
Partridge and cobra,284909,SS12 9BY,51.607125097758300,0.519975515825843
Herring gull and adder,277069,SS7 5SB,51.563634139466500,0.549905931248008
krait and American sparrow,281422,SS2 4DU,51.546949403210700,0.731715882491139
Herring gull and boa,283880,SS14 1NW,51.569864177225800,0.470160563659999
Egret and Thicketbird,285010,SS11 8XY,51.605438730367600,0.545604584659869
python and black snake,1437243,CM12 9PL,51.615005122995000,0.404587448908979
Coati and smooth snake,281074,SS2 4JA,51.547039761941600,0.741717630999738
tuatara and lizard,276388,SS8 9NU,51.532286461275500,0.581404830128863
River dolphin and White ibis,276184,SS9 1BL,51.540372220627400,0.655488350782315
Ice seal and asp,286719,SS0 0PA,51.556386288818200,0.680154592269050
pit viper and Gila monster,1427466,CM4 9LX,51.660331012002600,0.447733000000000
Fulmarine petrel and Recurvebill,1437102,CM13 2SY,51.632083092846900,0.350866709303318
Jerboa and Snipe,285381,SS11 7AJ,51.614236788311100,0.522579680588845
Old World warbler and Kangaroo,458160,RM18 8SN,51.484678000000000,0.418523000000000
viper and Tattler,285519,SS11 7HZ,51.623078480243000,0.527534715876495
Grosbeak and glass snake,274861,SS9 5YB,51.565795355463700,0.655801000000000
Eagle and sea snake,285043,SS11 7LS,51.626800559389900,0.513349969305881
Polecat and Elephant,279286,SS5 5AF,51.605192504120300,0.655717247725129
boomslang and carpet snake,276361,SS8 9JX,51.522899409685700,0.568201512807304
puff adder and Duck,459608,RM16 3AB,51.491720500581400,0.365549141256422
Armadillo and slowworm,286358,SS0 9BH,51.549498361884400,0.697362974594454
Duck and Pratincole,276247,SS8 9BT,51.523792352912900,0.587310973640988
dugite and Bunting,284270,SS13 2RH,51.572750614171200,0.514624050395196
blue tongue and Gull,282568,SS15 6JU,51.574243773523700,0.413129567701049
fer-de-lance and Cloud rat,287007,SS0 0AH,51.558433986666600,0.679885463591800
Kangaroo and Stilt,1752040,SS14 3SN,51.574323839888700,0.487678307729000
Jay and rock snake,278651,SS6 8AQ,51.592016116741100,0.610477139068571
Condor and Bunting,1437381,CM12 9UP,51.593644233111300,0.428712120906176
habu and Thicketbird,1438297,CM11 2HZ,51.624177276260600,0.430819499847804
Linsang and soft-shelled turtle,283001,SS15 6BZ,51.579468904031800,0.421417391828015
cycling lizard and Mockingbird,281443,SS17 8BA,51.524938416793700,0.427735051082412
smooth snake and Parakeet,279948,SS3 9UQ,51.543523000000000,0.712370000000000
Gila monster and Gull,1428156,CM3 7AN,51.639746079298500,0.601886554153197
Prion and glass snake,280441,SS2 6TD,51.562523816362800,0.692549803629905
indigo snake and Duck,1428999,CM3 4HJ,51.675753721574300,0.589355102370195
boa and death adder,278377,SS6 8PN,51.584068333371200,0.618841901781838
bull snake and diamond snake,1428045,CM3 6PH,51.688403000000000,0.655297027153213
Songlark and dukite,1437780,CM12 0NB,51.635435775051700,0.411680194859191
Wallaby and brown snake,274960,SS99 6DT,51.556978956510200,0.706823086379166
Partridge and Hawk,278893,SS6 7JH,51.587000246053400,0.605916142070451
Perching duck and gopher snake,283128,SS14 3HY,51.589832695648300,0.484050091258061
Mouse and perentie,2658817,SS8 0FJ,51.516309000000000,0.581840000000000
boa and B,284709,SS12 9WR,51.614087438386300,0.524088168386507
Chipmunk and Mockingbird,281995,SS17 0RG,51.484581462829000,0.410941389359604
sea snake and Linsang,1432595,CM2 8TW,51.697189208681600,0.455030000000000
Flameback and amphisbaena,286185,SS1 1AA,51.543522177491200,0.712370456304241
Parrotlet and Chickadee,279010,SS5 6AN,51.621429758391400,0.630384478831273
Boto and fer-de-lance,282004,SS17 0RW,51.488349078882700,0.405277214450143
Snipe and perentie,277997,SS7 1EB,51.555342125302000,0.561055636999279
puff adder and Tahr,281243,SS17 9AQ,51.527472230183300,0.458604000000000
indigo snake and Puffleg,1438397,CM11 1EF,51.641757345503400,0.435228802282565
Fox and rock python,276483,SS8 8DZ,51.526002919363200,0.599186741369059
Capuchin and deaf adder,275041,SS9 5BA,51.574678970646500,0.646100328876517
boomslang and deaf adder,1438172,CM11 2BH,51.625561947260600,0.426486629762198
Lemming and Cloud rat,281846,SS17 0GG,51.516822393841000,0.425761014592437
anaconda and diamondback turtle,281464,SS17 8DD,51.530847793982500,0.437666855698130
Parakeet and Fox,283334,SS14 2LG,51.573570380602800,0.462842245837562
snapping turtle and Argus,276844,SS8 0ET,51.517890342009100,0.575977654614118
crocodile and green turtle,1428348,CM3 6ET,51.686765193624800,0.761658270953237
slowworm and bicycle lizard,276197,SS9 1DD,51.542234049319600,0.666183259963937
rock python and sand lizard,1437190,CM13 1RQ,51.628134464514800,0.357179246526255
B and rock python,274672,SS99 9YX,51.531164723048200,0.729429421230918
Bunting and bearded lizard,281027,SS2 4EA,51.545533711199000,0.728010572301571
whip snake and blue racer,279789,SS4 1QH,51.588098516192100,0.704414062993796
Schneider python and Kangaroo,285034,SS11 7JZ,51.621148157679300,0.517761916814683
fer-de-lance and lizard,2581495,SS14 0PR,51.570844000000000,0.459708000000000
box turtle and Nukupuʻu,1437328,CM12 9QU,51.616477127802900,0.424831788725155
tokay and hognose snake,283493,SS14 3DP,51.588697000000000,0.490153000000000
chameleon and king snake,279579,SS4 3AY,51.597087626212300,0.692096210858171
Dorcopsis and Scimitar babbler,458819,RM17 6HH,51.478464000000000,0.351800000000000
Perching duck and habu,1428308,CM3 6DL,51.664147844652700,0.758532186210871
Bunting and Kite,286637,SS0 0DS,51.558734810140500,0.670640209033177
rat snake and Badger,458112,RM18 8RG,51.486094000000000,0.420923454653278
elapid and Fulmarine petrel,279016,SS5 6AU,51.612816000000000,0.623935000000000
iguana and sidewinder,281832,SS17 0EG,51.505838891848800,0.436302706019180
Stint and Rabbit,277604,SS7 4BT,51.570006244380900,0.550926444863557
snake and fer-de-lance,274667,SS99 9YR,51.531164723048200,0.729429421230918
tortoise and Black jay,283782,SS14 1DE,51.569447000000000,0.457114819421165
sand viper and slowworm,1438198,CM11 2DX,51.627492931583300,0.430086460530412
rock python and Asiatic leopard,283246,SS14 3SD,51.585214160566000,0.456095166225763
thorny devil and mamba,281306,SS17 9HH,51.548432287067500,0.469778126763266
Grosbeak and blue racer,280758,SS2 6LW,51.547121105465200,0.709194780831541
Zebra and Songlark,276479,SS8 8DT,51.525932612119900,0.598706952728635
tokay and turtle,1437256,CM12 9QG,51.620736817785000,0.418442058527779
perentie and Bronzewing pigeon,1428223,CM3 8DQ,51.640159000000000,0.540004000000000
Bunting and Macaw,1428090,CM3 6RX,51.665194866811700,0.650635545577323
Grouse and monitor,1428606,CM3 5WN,51.641176288010300,0.606738361719712
Myna and Scimitar babbler,278495,SS6 8YR,51.585438507267600,0.624334439193278
Hawk and smooth snake,2581668,SS11 7GN,51.631834000000000,0.584742000000000
python and Magpie,1427962,CM4 0DL,51.672737432802700,0.381797869112235
Solitaire and Linsang,282832,SS15 5ST,51.578381629286300,0.432242715297916
jew lizard and pit viper,275334,SS9 4NR,51.558295107986900,0.654353981850572
Stilt and elapid,285409,SS11 7DB,51.616124069598900,0.522222085277229
Thrasher and American sparrow,278236,SS6 9ND,51.594219556241200,0.606834849829325
moloch and diamond snake,286601,SS0 8AF,51.541431634612200,0.688722427930601
Maya and sand lizard,279118,SS5 6JR,51.624713986960900,0.610981553512297
anole and taipan,277664,SS7 3DW,51.564909401902600,0.595907842920377
skink and Francolin,275703,SS9 2QS,51.547087252353400,0.625270721831069
Shearwater and indigo snake,279119,SS5 6JT,51.624805429446300,0.607677968074046
Wallaby and Greenbul,284200,SS13 2HZ,51.569439049695900,0.534774907457905
brown snake and soft-shelled turtle,276290,SS8 9FH,51.531146734318500,0.584152094767434
Moluccan boobook and Booted eagles,285970,SS1 2DP,51.537284002752000,0.719599582895410
Polecat and flying dragon,284720,SS13 1AG,51.577166150037800,0.511273853184612
Triller and hognose snake,281828,SS17 0EB,51.511292254597500,0.428767654601041
mamba and death adder,275307,SS9 4LU,51.559205124046800,0.649905343141830
Hawk and Nukupuʻu,275610,SS9 4AN,51.559018412655800,0.665289489425558
king cobra and ringhals,276520,SS8 8HW,51.528044000148500,0.605690356433872
Elephant and hawksbill,1752003,SS14 1FL,51.572333847069700,0.463078420085255
Guillemot and Philippine hawk-owl,285024,SS11 8YR,51.600919779429500,0.547460205575314
garter snake and New World blackbird,279648,SS4 1HA,51.578896362053500,0.707606098601801
cobra de capello and Goose,282428,SS16 4LP,51.562562543049400,0.490109593162820
green turtle and monitor,285479,SS1 3EZ,51.536489251150400,0.758891000000000
harlequin snake and Greenbul,458926,RM16 4QD,51.486682780411200,0.374521763420296
Francolin and Egret,282205,SS17 0AD,51.515775637944000,0.437207797537193
cerastes and krait,1438115,CM12 0AT,51.634832775464700,0.425232869081055
jew lizard and Chipmunk,1438061,CM11 1PJ,51.624155476944200,0.481430000000000
whip snake and Parrotbill,279655,SS4 1HJ,51.574261980834300,0.709668759670539
Nukupuʻu and tiger snake,278138,SS6 9DT,51.595446227721000,0.589609000000000
Pitohui and brown snake,285937,SS1 2AQ,51.531789000000000,0.730880000000000
Thicketbird and Thicketbird,278794,SS6 7BB,51.580807151543700,0.597434000000000
habu and monitor,284359,SS13 1ET,51.584309304596600,0.512418479033367
hoop snake and slowworm,277837,SS7 2EF,51.550255116822300,0.624371250454789
Boto and Warbler,284555,SS12 9HL,51.602742143618900,0.523473203507386
Boto and Tattler,1428127,CM3 5XR,51.643746626643900,0.612884703332830
Stilt and monitor,277416,SS7 5HE,51.553668019219400,0.554931357039055
Magpie and habu,281963,SS17 0PQ,51.517784000000000,0.427216907169793
Stilt and Pitohui,1438382,CM11 1DJ,51.645380840481500,0.434396697826496
sea snake and Greenbul,285797,SS1 2XG,51.537197132415900,0.739943263592912
Scimitar babbler and horned toad,284489,SS13 1QU,51.582494613697900,0.506861780640641
sidewinder and Schneider python,1806554,RM16 3BW,51.511629000000000,0.399918000000000
diamondback turtle and Solitaire,281795,SS17 7RB,51.524722807309800,0.445038263720335
Schneider python and Recurvebill,283635,SS14 2BH,51.574679814780200,0.456681710386948
grass snake and saltwater crocodile,281779,SS17 7QF,51.525551491856600,0.457452614570274
bicycle lizard and American sparrow,1437966,CM11 2TN,51.610313679994500,0.427594258775878
Nukupuʻu and bicycle lizard,283711,SS14 2HZ,51.578936086860900,0.468559639385476
Herring gull and Gull,280878,SS2 5EB,51.550751813312100,0.712425569277848
puff adder and Gull,1438180,CM11 2BX,51.624655233952100,0.422927242256366
Rabbit and dugite,284752,SS12 0JP,51.615617609112500,0.499658403209576
Schneider python and anole,284433,SS12 9EE,51.603965347351500,0.516348821695819
Darwin's finches and Vulture,277617,SS7 4DL,51.569507701232900,0.547795787538227
Badger and tree snake,276799,SS8 7QT,51.517736447146800,0.623077472909857
Jay and mountain devil,277189,SS7 5XX,51.565039635015800,0.561759429428321
Snipe and Shearwater,459172,RM16 3HG,51.511480335793600,0.363229125461594
cerastes and Flameback,275166,SS9 5QD,51.571141760089300,0.657758054268814
Snipe and Schneider python,282379,SS16 5TA,51.564348737507200,0.451420660499925
Schneider python and flying dragon,2647316,SS4 1UU,51.583785000000000,0.694442000000000
boa and elapid,278671,SS6 8BU,51.594887106043100,0.612807745309312
galliwasp and Mamo,284956,SS11 8SB,51.610008077370600,0.555913454331564
crocodile and tokay,284458,SS13 1PF,51.578172298946800,0.501644126132327
Ibex and Scimitar babbler,1427953,CM4 0BZ,51.671711798393100,0.384087000000000
loggerhead and racer,286421,SS0 9JH,51.547453552703900,0.691241291153665
Wader and Shearwater,279514,SS5 4JQ,51.590901404328000,0.655735212360910
Moluccan boobook and Grosbeak,284815,SS12 0PY,51.600530553088800,0.515480146893095
Peafowl and terrapin,275985,SS9 2BW,51.542387665790400,0.651076895263318
saltwater crocodile and Minke whale,274639,SS99 9DN,51.556978956510200,0.706823086379166
Bronzewing pigeon and hoop snake,277444,SS7 3TW,51.571367546772100,0.593836853667393
Kestrel and Ibex,279797,SS4 1QW,51.589102366960000,0.702221380471929
River dolphin and puff adder,279139,SS5 4PW,51.599665089281700,0.651582159497655
puff adder and water snake,1432564,CM2 8RZ,51.699838724644800,0.476742596680368
agamid and agama,276221,SS9 1ER,51.541762308675800,0.667944111483571
Capuchin and monitor,284912,SS12 9DB,51.607599915029700,0.521735021367634
loggerhead and cobra de capello,275349,SS9 4PS,51.562257994049000,0.650919786902016
Macaw and Petrel,286070,SS0 9QB,51.548095168796500,0.686793016304027
Ice seal and snake,282936,SS15 4HT,51.587432328267100,0.447639372114227
indigo snake and cayman,2581143,SS17 0FE,51.511197000000000,0.416469000000000
Egret and frill-necked lizard,276126,SS8 8QB,51.526450457882200,0.609001960544868
caiman and horned viper,279084,SS5 6EL,51.621003754114200,0.612820091880307
Rabbit and boa constrictor,1438364,CM11 1BB,51.631149524564700,0.427218399443871
amphisbaena and Buzzard,286081,SS0 9QR,51.548365487600500,0.684414397529999
sand lizard and cerastes,1428417,CM3 6LR,51.638728000000000,0.676409000000000
snapping turtle and Recurvebill,276928,SS7 5HX,51.555140944428500,0.554609971353391
Puffleg and Ibex,275476,SS9 3JU,51.549534957602200,0.667057442701427
Gull and New World blackbird,276359,SS8 9JU,51.523581765079900,0.567432574061903
copperhead and dugite,1428557,CM3 5SG,51.653594980146000,0.612453645840901
moloch and asp,286034,SS0 9LN,51.545843590781500,0.689285527653868
Kite and Perching duck,286127,SS0 9SG,51.548453558274700,0.680957577415819
White ibis and Linsang,277735,SS7 1SA,51.556968167826900,0.597533046222039
Argus and cayman,1428596,CM3 5UQ,51.650754000000000,0.618521000000000
flying dragon and Rabbit,276341,SS8 7TG,51.518613144258200,0.618860898777924
blindworm and caiman,1437909,CM12 0SU,51.637926220929900,0.411711182287867
snapping turtle and cobra,275142,SS9 5NW,51.567116881573000,0.648027728008303
Warbler and black snake,281525,SS17 7AN,51.521244141968400,0.431113635333982
glass snake and water snake,281127,SS17 8RG,51.522300713460200,0.425691801667938
Marmoset and slowworm,276777,SS8 7PR,51.515071476264200,0.614347808739822
mud turtle and Thicketbird,458120,RM18 8RT,51.482800265404500,0.422744795641823
Rat and Pratincole,276471,SS8 8DE,51.528562454675800,0.592036803295533
jew lizard and Maya,1428496,CM3 5PU,51.649917614572400,0.605938855159101
deaf adder and Bunting,283844,SS14 1JT,51.572118877182000,0.472418759495577
Ground sloth and Pratincole,278009,SS7 1ES,51.555926050578500,0.566844854957479
Songlark and Ground sloth,284638,SS12 0DS,51.614604053327900,0.513427100738457
Viscacha and iguana,283068,SS15 5FQ,51.572646116427200,0.426928540995270
cerastes and habu,277826,SS7 2DJ,51.553862099878000,0.613874414685365
taipan and hognose snake,285550,SS1 3JS,51.536975904570500,0.761259481384178
cobra and Philippine hawk-owl,280905,SS2 5HD,51.548474359248300,0.719892093041377
Badger and gavial,285837,SS1 1HZ,51.536211656984800,0.713478713523507
krait and Kestrel,281239,SS17 9AJ,51.530035359576500,0.457203899505446
Komodo dragon and viper,279659,SS4 1HQ,51.575708001162400,0.706637110113625
Jackal and Wallaby,282167,SS16 6SR,51.561600878104400,0.407366772356165
American sparrow and diamond python,1427858,CM3 8HG,51.650410123423700,0.533739346165655
New World blackbird and diamondback terrapin,276847,SS8 0EX,51.517978556285200,0.571139161074749
Black jay and Wader,459405,RM16 4NA,51.484922606531400,0.370843664348357
Rat and blue tongue,275502,SS9 3NT,51.548591366813200,0.669396792047983
leathery turtle and Kestrel,1437941,CM11 2RZ,51.607835694104700,0.430870632459435
Grouse and tree snake,286410,SS0 9HS,51.544962202686200,0.686851000000000
krait and kabaragoya,1752082,SS15 6LJ,51.582495397252100,0.414501000000000
turtle and snapping turtle,278957,SS5 5LE,51.619277847759900,0.671102856383667
Herring gull and cerastes,278511,SS6 9BB,51.592847971287400,0.592837205555871
dukite and Dolphin,286720,SS0 0PB,51.556918554356500,0.688727101483034
moloch and dugite,285135,SS11 7QG,51.625764729062900,0.545256000000000
mud turtle and anole,275234,SS9 4BY,51.561571963516700,0.662149012367211
diamondback terrapin and tokay,286499,SS0 7ND,51.539064050930400,0.694697789726121
brown snake and agamid,277692,SS7 3HS,51.570205621343200,0.566523733647491
rat snake and Rat,286234,SS0 8DS,51.536984000000000,0.687826000000000
Jerboa and glass snake,280978,SS2 5NZ,51.546854908133300,0.717977969051573
anaconda and Lemming,284157,SS13 2DR,51.567277832416700,0.523225632617476
Rabbit and Fish eagle,284806,SS12 0PN,51.601557717794900,0.510771256917196
Old World vulture and Fulmarine petrel,1752520,SS5 4FP,51.592899087743700,0.672326718933137
mountain devil and worm lizard,281245,SS17 9AS,51.523419626767700,0.463046754008732
Cloud rat and Wader,286477,SS0 7JJ,51.541185941739900,0.697462551075956
Chipmunk and Parakeet,280841,SS2 5AG,51.541505159726000,0.716360999441868
Kestrel and habu,282081,SS16 6LY,51.559099736427000,0.417911164216788
Dolphin and Macaw,281957,SS16 6DY,51.564035693105200,0.403094478924819
Grouse and Fulmarine petrel,276773,SS8 7PL,51.515797432337300,0.613250645067129
gopher snake and wall lizard,282322,SS16 5SN,51.565180264732400,0.438276634450589
Stint and White ibis,277056,SS7 5RL,51.563942781900400,0.555146717110516
diamond python and tokay,276930,SS7 5HZ,51.552481004870700,0.561111271769849
bull snake and Badger,1428536,CM3 4LS,51.697573291861300,0.586823649025180
bicycle lizard and Ice seal,275092,SS9 5HJ,51.572157966327000,0.640238625491291
Dolphin and Gila monster,281551,SS17 8JY,51.535008626177800,0.445156965425597
Argus and blindworm,275102,SS9 5HZ,51.571722629709000,0.642796771623457
Skunk and Badger,1427669,CM4 0PR,51.693617555058300,0.361813000000000
Boto and blue racer,281936,SS16 6BN,51.562392321334900,0.415676258351184
Jackal and giant tortoise,281417,SS2 4DP,51.545265196795700,0.730273519316044
python and Fish eagle,459397,RM16 4LL,51.480642000000000,0.377549000000000
bushmaster and boa constrictor,2658775,SS16 5NH,51.561243000000000,0.451774000000000
Civet and Viscacha,278368,SS6 8PA,51.581647151509900,0.617316849187730
cycling lizard and Thrasher,277339,SS7 3PX,51.571933453583500,0.583679930602394
dukite and hawksbill,277531,SS7 2RD,51.553977586532300,0.608687465978954
Mole and grass snake,1438155,CM11 2AG,51.626690508456300,0.420174765537921
agamid and copperhead,283134,SS14 3JH,51.593335050518000,0.494882588488073
coral snake and bearded dragon,278665,SS6 8BJ,51.596803461165800,0.622448294101625
Wallaby and bicycle lizard,286214,SS1 1DT,51.534389854548300,0.710775000000000
Warbler and Gila monster,275983,SS9 2BS,51.542090153907900,0.651506708323538
chameleon and Mink,278927,SS5 5HH,51.608796888894200,0.665720787510207
Prion and boa constrictor,276993,SS8 0QW,51.518144139820600,0.558636159037760
Black cockatoo and chameleon,282212,SS17 0AQ,51.514490890455700,0.428476601517665
rock snake and ringhals,1437192,CM13 1RS,51.630782871783900,0.359195114555152
tuatara and Black cockatoo,2594880,CM11 2EL,51.623492000000000,0.420278000000000
Ground sloth and bearded dragon,1423027,CM9 6PG,51.695711184151900,0.680667963508369
Gila monster and Booted eagles,276717,SS8 7NX,51.516441843232300,0.608948715234824
caiman and Fox,280014,SS4 1AS,51.582825445364600,0.703041000000000
Polecat and Scimitar babbler,282821,SS16 4EB,51.558956500955700,0.482034952936036
worm lizard and bicycle lizard,282906,SS15 6AQ,51.573551140231800,0.416195819259424
wall lizard and Prion,286028,SS0 9LA,51.543862012823700,0.691375454075249
hawksbill and monitor,274869,SS9 5YR,51.568957868555800,0.674703077289880
Jerboa and Crow,284126,SS13 2AP,51.567887168862100,0.512854803699869
Guillemot and chuckwalla,284323,SS13 3EX,51.566305000000000,0.504052000000000
flying lizard and cycling lizard,1438313,CM11 2JX,51.621631171558700,0.438672922867851
glass snake and Old World quail,277621,SS7 4DR,51.571376999590800,0.551580484932775
Flameback and Capuchin,286789,SS0 0SX,51.551508181719200,0.694048514728951
slowworm and Eagle,286451,SS0 7EW,51.540323394335200,0.694296268615306
Pheasant and bearded dragon,2598155,CM4 0FQ,51.670363000000000,0.382987000000000
agamid and New World blackbird,275149,SS9 5PF,51.564090064515000,0.653421745536639
Warbler and milk snake,281218,SS2 4UN,51.544036589957800,0.743224610740141
