name,id,postcode,lat,lon
dugite and rattlesnake,1302822,DL14 9EU,54.635268398828800,-1.714867781474550
Boto and Fox,1298850,DL3 9SL,54.539702463605300,-1.597667219416590
Kākāriki and Marsh harrier,1304802,DL12 8XB,54.525804868404800,-1.820462526538060
Perching duck and thorny devil,1302515,DL14 9SF,54.620820895936400,-1.757634233546440
soft-shelled turtle and puff adder,1302555,DL14 8PE,54.659249781239600,-1.612872514009680
Thrasher and python,1303262,DL14 6HL,54.653406132932900,-1.676489450800130
bushmaster and Kākāriki,1304625,DL12 8NP,54.542084745802700,-1.915527196998620
boa and Boto,1303122,DL14 7HY,54.663630680540300,-1.668966892906940
Rabbit and blue racer,1298476,DL5 4ET,54.620849830441300,-1.578020243665270
Jerboa and Mole,1305258,DL11 7HE,54.480759457550500,-1.801275007356770
blindworm and Ibex,1302760,DL14 7QX,54.662187000000000,-1.683256000000000
terrapin and Pitohui,1304551,DL12 9NW,54.573755715828500,-1.984885337320940
saltwater crocodile and Fish eagle,1303515,DL14 0TW,54.655242193408600,-1.698484428458050
carpet snake and mountain devil,1302537,DL14 8NF,54.658953648687000,-1.633662000000000
bearded lizard and agamid,1303502,DL14 0TA,54.649957324492000,-1.749510802260690
pit viper and Badger,1301210,DL17 0NG,54.638866350325600,-1.582636806185230
racer and blue tongue,1302551,DL14 8NZ,54.662322967687200,-1.633011954048150
blindworm and agama,1297634,DL5 7NH,54.627308790926200,-1.579874084213190
dukite and leathery turtle,1298695,DL4 2BA,54.631407587474300,-1.632686010464810
green turtle and Egret,1298627,DL3 9HT,54.534653012590100,-1.576931200143260
Boto and Cuscus,1302703,DL14 8YP,54.654520660650500,-1.660594000000000
Diving bird and Grouse,1305265,DL11 7HP,54.477487893922200,-1.812340412179660
blue racer and galliwasp,1302166,DL15 8HU,54.696401303001300,-1.754329639098600
amethystine python and Herring gull,1303229,DL14 6ED,54.652902683889800,-1.669751468289680
tree snake and Moluccan boobook,1298391,DL4 2LU,54.632658000000000,-1.630011258933200
blind snake and blind snake,1303641,DL13 5PR,54.627052140175800,-1.841206421084460
swift and Duck,1303315,DL14 6NQ,54.654810123768800,-1.691063356530370
Quetzal and Quetzal,1302445,DL14 9NG,54.628771401476300,-1.734848299082950
puff adder and diamond python,1302276,DL15 0LA,54.691052395205800,-1.705091647339500
turtle and Kite,1299929,DL2 3NE,54.580907474409300,-1.800247129732060
Solitaire and Asiatic leopard,1302847,DL14 7TH,54.657704417536100,-1.677478373916430
Ibex and puff adder,1303405,DL14 6PG,54.648366696816500,-1.684107508075080
saltwater crocodile and hawksbill,1298812,DL3 9RL,54.536737596531600,-1.589876234730840
Fulmarine petrel and Buzzard,1302491,DL14 9QZ,54.620285961192900,-1.764358490758660
blindworm and agamid,1302869,DL14 8AT,54.682480307206200,-1.645145289417380
Songlark and leguaan,1298908,DL3 9XT,54.527146096054100,-1.594484054582000
grass snake and Parrotlet,1303820,DL14 0DS,54.662615967138500,-1.727016442676110
Snipe and krait,1303192,DL14 6DS,54.655998511380200,-1.671369381776500
Thrasher and Petrel,1297558,DL5 7HU,54.628032484033900,-1.597152792394250
harlequin snake and Fulmarine petrel,1302601,DL14 9UL,54.633640580853800,-1.722082684457930
Polecat and perentie,1298366,DL4 2JN,54.623393683689300,-1.642468881150810
Pitohui and habu,1303362,DL14 0JE,54.648589558584300,-1.762009884708770
gopher snake and Greenbul,1298623,DL4 1LU,54.628737474845300,-1.644389233114360
Chipmunk and monitor,1302904,DL14 8EA,54.646641549807900,-1.633153129356670
hoop snake and tree snake,1303664,DL13 5QW,54.621989452678400,-1.838810134718650
Skunk and snapping turtle,1304563,DL12 9PP,54.569109016672100,-1.981082165670030
rock snake and Vole,1299960,DL2 3PX,54.544080395466400,-1.858315041247540
gavial and blind snake,1300096,DL2 3XG,54.580163665640500,-1.735751000000000
Diving bird and tokay,1303047,DL14 6XE,54.651454438057300,-1.665966129548490
Ground sloth and Philippine hawk-owl,2580132,DL16 7WB,54.697472000000000,-1.585946000000000
Condor and Dorcopsis,1299886,DL3 0QE,54.542879160958400,-1.575254073207280
Mouse and bearded dragon,1298686,DL4 2AQ,54.630357643766400,-1.636165280152670
Meadowlark and leguaan,1297639,DL5 7NQ,54.626567042668400,-1.581074363891000
Towhee and Condor,1300172,DL2 2UQ,54.598524867246500,-1.666863491418490
fer-de-lance and Wader,1304954,DL12 8AN,54.547277098342600,-1.926182979128050
death adder and Ground sloth,1299074,DL3 9DF,54.530882814792900,-1.591263810403910
Snipe and Peafowl,1302528,DL14 8LU,54.661342127388400,-1.632586731312750
Minke whale and Thrasher,1298329,DL4 2EG,54.631564369110400,-1.640011702324620
boomslang and Perching duck,1299989,DL2 3RZ,54.545656000000000,-1.786351592039770
Stilt and king snake,1298869,DL3 9TT,54.539588972202500,-1.598672966808120
grass snake and Solitaire,1304119,DL13 3RE,54.673302393897700,-1.813006059439960
Mink and Nukupuʻu,1301774,DL16 6FB,54.698039799114700,-1.600324000000000
Komodo dragon and Mink,1301722,DL16 6DG,54.698488342889300,-1.602568897824410
sea snake and Stilt,1301593,DL16 7AL,54.686908231844900,-1.620567062764260
Schneider python and Wader,1302439,DL14 9LT,54.629696617329300,-1.730582551259250
box turtle and Old World vulture,1303092,DL14 7DW,54.661856560760500,-1.677585031341450
Schneider python and turtle,1298591,DL4 1HX,54.629242018165100,-1.651014476554360
Meadowlark and Minke whale,1303591,DL13 5LB,54.636463704775800,-1.857684799813590
Herring gull and boomslang,1303225,DL14 6DY,54.651527872932900,-1.673125732667660
fer-de-lance and loggerhead,1302809,DL14 9EB,54.637668370248100,-1.711287618502800
Pitohui and taipan,1302059,DL15 8AZ,54.679325211103500,-1.736504431209180
harlequin snake and indigo snake,1302039,DL15 0XR,54.692968646040400,-1.709685436912740
Armadillo and crocodile,2634731,DL11 7SN,54.495717000000000,-1.690358000000000
Tattler and Tahr,1297553,DL5 7HP,54.627253194732000,-1.595224351500140
Parakeet and Polecat,1303079,DL14 7DD,54.659874364676900,-1.679042348786370
slowworm and Grouse,1299981,DL2 3RP,54.544795626333800,-1.782956076423760
blue tongue and water snake,1298780,DL3 9PR,54.528386764270600,-1.586653234268860
whip snake and coral snake,1302480,DL14 9QL,54.616976000000000,-1.757975000000000
Dorcopsis and Mouse,1298646,DL4 1NL,54.627156897781100,-1.647841573538940
chuckwalla and Crow,1303704,DL14 0AY,54.676357785294700,-1.775835633958350
Mink and amethystine python,1299859,DL2 3JY,54.577480669322600,-1.809654226122920
Vulture and diamondback,1302717,DL14 9AW,54.639167290613200,-1.685263315510850
Songlark and Kite,1305006,DL12 8ES,54.546625936004100,-1.919707075299160
boa constrictor and Shearwater,1299631,DL3 0DF,54.538419203344000,-1.587541069029220
Booted eagles and Grouse,1298970,DL3 8RY,54.518957598814400,-1.578298292529690
Capuchin and Thrasher,1303174,DL14 6BG,54.650618486844100,-1.679208212861570
Komodo dragon and bandy-bandy,1298473,DL5 4EP,54.619419793594700,-1.577694337404210
chameleon and kabaragoya,1299943,DL2 3NX,54.587280767319000,-1.780533000000000
Gila monster and Herring gull,1299432,DL3 0SX,54.544485593411600,-1.579766515027920
smooth snake and caiman,1297871,DL5 6UF,54.611183712407300,-1.579080125214540
River dolphin and Argus,1302951,DL14 6SA,54.651357043905000,-1.669779488470980
Old World warbler and swift,1303078,DL14 7DB,54.660278593970400,-1.678977158704880
cobra and cobra de capello,1303402,DL14 0NH,54.631056566429400,-1.766681831401520
rock python and viper,1304884,DL12 9DB,54.554892000000000,-1.976960485322220
blindworm and Meadowlark,1305077,DL12 8HY,54.545779502799600,-1.917219978775190
Kestrel and hawksbill,1299940,DL2 3NT,54.575375022056600,-1.771655904702600
snake and smooth snake,1301420,DL16 7TT,54.696682180245100,-1.602617570293190
Mamo and Ground sloth,1302541,DL14 8NL,54.661774983237900,-1.627188062229540
chuckwalla and garter snake,1302795,DL14 9DF,54.637816642584200,-1.705678086648080
blind snake and diamond snake,1298134,DL5 4NN,54.622972000560900,-1.575814560846980
Chipmunk and Marsh harrier,1302449,DL14 9NP,54.606569000000000,-1.757573000000000
flying lizard and elapid,1299933,DL2 3NJ,54.580205181185400,-1.799446060598770
death adder and goanna,1303243,DL14 6EW,54.655982780988100,-1.675539001152260
glass snake and Warbler,1303068,DL14 7BA,54.661434153233700,-1.677572871407330
dugite and blind snake,1301694,DL16 6AB,54.699706774839300,-1.601999000000000
anole and diamond python,1302400,DL15 0RJ,54.693413525948200,-1.693268217803610
Towhee and Zebra,1303912,DL13 5BJ,54.614031379111100,-1.799434833128530
king snake and Rabbit,1303400,DL14 0NF,54.633280877007500,-1.764407383881920
White ibis and dugite,1300298,DL2 3DW,54.546570422031100,-1.739585767082320
thorn lizard and Mole,1302843,DL14 7TD,54.657708400690600,-1.675602766465450
caiman and Mockingbird,1304946,DL12 8AB,54.545443560088100,-1.925815286028140
grass snake and Francolin,1302263,DL15 0JJ,54.685655041704800,-1.710327013442190
Songlark and diamond snake,1297550,DL5 7HH,54.620881344467800,-1.597858349600540
king cobra and blind snake,1305500,DL11 7SZ,54.498774994878500,-1.688797090818380
Recurvebill and Guillemot,1768081,DL16 7EP,54.691026875145200,-1.623212667107710
River dolphin and Black cockatoo,1297537,DL5 7ES,54.623216811774200,-1.594830744964710
Piping shrike and anole,1302785,DL14 9BL,54.639020059703700,-1.701672078511720
Grackle and Jackal,1302560,DL14 8PP,54.664717305231700,-1.637284805639830
American sparrow and boa constrictor,1304079,DL13 3NT,54.698135957381800,-1.889106483685930
gopher snake and Egret,1302704,DL14 8YR,54.653623572180700,-1.660694165689560
Guillemot and Parrotlet,1298667,DL4 1QB,54.627396000000000,-1.652441623689590
Bronzewing pigeon and bushmaster,1302942,DL14 6RP,54.648083668169000,-1.678995703357820
whip snake and thorny devil,1298355,DL4 2HR,54.636025096025400,-1.644170770459120
Elephant and bandy-bandy,1302366,DL14 9JX,54.629855965087200,-1.725500775545420
dukite and Grosbeak,1304771,DL12 8SW,54.601121117190600,-1.952508694998240
Linsang and giant tortoise,1302828,DL14 7SF,54.670344062996000,-1.679114919445640
king snake and slowworm,1768137,DL3 0EB,54.540948455569700,-1.590468000000000
Diving bird and Old World vulture,1302509,DL14 9RY,54.623461964605400,-1.761645320099660
Egret and Rat,1298658,DL4 1PJ,54.626867000000000,-1.643535420388790
Philippine hawk-owl and Triller,1303085,DL14 7DL,54.662568841851100,-1.678463036735530
bushmaster and ringhals,1303302,DL14 6LX,54.654466446777000,-1.686710633385510
snapping turtle and Badger,1303273,DL14 6JB,54.651339106952900,-1.676459360254120
diamondback and Rat,1305124,DL12 8NN,54.540874417944900,-1.919795611269580
Francolin and rock python,1304788,DL12 8UJ,54.556478418220000,-1.889180981148000
Black cockatoo and chameleon,1303569,DL13 5HZ,54.628651868327100,-1.815843857686860
Mole and Hawaiian honeycreeper,1304892,DL12 9DN,54.555539326440400,-1.983809632417120
Wallaby and kabaragoya,1303684,DL13 5RZ,54.617579811351300,-1.889510938969180
bearded lizard and Parrotlet,1301368,DL16 7QL,54.699928976022400,-1.614564795573220
Gull and Zebra,1302342,DL14 9HL,54.631017381491500,-1.722487813960460
Fish eagle and B,1301312,DL16 7LW,54.695504000000000,-1.610511000000000
viper and Meadowlark,1304118,DL13 3RD,54.649286454261600,-1.816572078491880
copperhead and Philippine hawk-owl,1297646,DL5 7PA,54.625519421849700,-1.582401000000000
Old World quail and Armadillo,1298756,DL3 9NG,54.530373171596500,-1.576341879843200
taipan and loggerhead,1298823,DL3 9RZ,54.536979757112100,-1.592392955587610
alligator and iguana,1304629,DL12 8NT,54.540912348805000,-1.922855875393130
dukite and Chickadee,1305071,DL12 8HR,54.545475489523500,-1.919508373127970
thorn lizard and Stint,1305507,DL11 7TH,54.496517470391500,-1.684630102564110
Minke whale and sand viper,1302470,DL14 9PW,54.624325609706600,-1.687407000000000
constrictor and Old World quail,1298593,DL4 1HZ,54.629732524416800,-1.649709120380700
Duck and asp,1300087,DL2 3UL,54.584280000000000,-1.679482000000000
grass snake and Rabbit,1300514,DL2 2LW,54.534554868410500,-1.656643739834480
box turtle and alligator,1297542,DL5 7EZ,54.622718633240500,-1.596353454168750
Viscacha and sea snake,1298972,DL3 8SA,54.523199447845700,-1.578300961629460
chuckwalla and rock snake,1305122,DL12 8NJ,54.541584611951700,-1.920149722780300
Quetzal and Grosbeak,1297989,DL5 5NH,54.618579781274400,-1.576479651792980
amethystine python and blue racer,1302107,DL15 8EW,54.692181630240600,-1.743262783774430
Tree warbler and chuckwalla,1297906,DL5 7AF,54.618241544018800,-1.579998411516380
loggerhead and Fulmarine petrel,1302643,DL14 8RU,54.646858503455800,-1.642604054044460
Marmoset and deaf adder,1303109,DL14 7GE,54.659416587947900,-1.656290071626160
Magpie and asp,1298475,DL5 4ES,54.619730753881800,-1.576669026933170
Francolin and Herring gull,1304553,DL12 9PA,54.573029000000000,-1.985133000000000
Hawk and Eagle,1303338,DL14 0EY,54.653724657303200,-1.733539101902610
Jackal and frilled lizard,1304090,DL13 3PS,54.673636779432100,-1.814229549716050
Night heron and Towhee,2640586,DL16 9DL,54.699316000000000,-1.602245000000000
Cloud rat and leathery turtle,1303720,DL14 0DF,54.657994957754700,-1.742610103831080
diamondback turtle and massasauga,1302115,DL15 8HA,54.695832669287900,-1.748732111388620
constrictor and agamid,1304958,DL12 8AS,54.549217779367800,-1.925406518276270
blue tongue and bandy-bandy,1298712,DL4 2DG,54.627391174826200,-1.632908042193940
River dolphin and leathery turtle,1301310,DL16 7LS,54.696202563666500,-1.609898947206980
Fox and puff adder,1305123,DL12 8NL,54.541962018116300,-1.920087161739450
ringhals and garter snake,1302571,DL14 8QH,54.662246003735500,-1.649522675290510
Jerboa and Myna,1302179,DL15 8JP,54.697491629215500,-1.746906000000000
Towhee and Chipmunk,1299453,DL3 0TZ,54.541158161647600,-1.584313974850450
king snake and Bunting,1305708,DL11 7BB,54.513844954600800,-1.725475242063100
puff adder and Hawaiian honeycreeper,1298273,DL5 4ZF,54.636277000000000,-1.582013000000000
Grackle and harlequin snake,1302924,DL14 8HN,54.666012196246500,-1.617087308543660
Darwin's finches and saltwater crocodile,1298564,DL4 1EP,54.633962934716900,-1.652012023870740
Grackle and Francolin,1302691,DL14 8XA,54.643804629063800,-1.637098980726840
Jay and hognose snake,1302932,DL14 6QX,54.644349318430500,-1.687454676748630
crocodile and Towhee,1303152,DL14 6AD,54.655815731412700,-1.678547000000000
asp and rock snake,1302887,DL14 8DB,54.695452387897700,-1.682361318399790
cerastes and Armadillo,1297758,DL5 6NT,54.605190576791200,-1.628896916870210
rock snake and Komodo dragon,1304566,DL12 9PS,54.568174110265000,-1.979551000000000
terrapin and elapid,1302667,DL14 8TE,54.643856746131500,-1.648689057364950
tuatara and tuatara,1297753,DL5 6NL,54.603570000000000,-1.630689664935550
agamid and Herring gull,1303625,DL13 5NJ,54.634179237606100,-1.912765424896710
Mouse and diamond snake,1303332,DL14 0EQ,54.666763480325400,-1.733143765975190
River dolphin and python,1300060,DL2 2QR,54.494386720892500,-1.607529746279300
Parakeet and diamondback turtle,1305492,DL11 7SH,54.502486000000000,-1.745825561340980
saltwater crocodile and Parrotlet,1302763,DL14 7RA,54.660918740059000,-1.683188618336670
tortoise and constrictor,1303219,DL14 7LY,54.658808050454200,-1.670153145539460
rattlesnake and Chickadee,1299222,DL3 8DJ,54.516035381905400,-1.577880414375700
viper and Perching duck,1300377,DL2 2FL,54.545403722521100,-1.590685947278110
constrictor and Masked owl,1303182,DL14 6DB,54.653698986767100,-1.681880813400570
Solitaire and Thrasher,1303595,DL13 5LP,54.622733198530500,-1.858708335517800
Bunting and Thicketbird,1302662,DL14 8SY,54.645534818228400,-1.650952511551110
constrictor and python,1767895,DL14 0HR,54.642464596701400,-1.720085908559530
cobra de capello and sand viper,1306053,DL10 5NQ,54.475990364664700,-1.670806644930790
wall lizard and Ibex,2634742,DL4 2BF,54.627749000000000,-1.628966000000000
Solitaire and Elephant,1302909,DL14 8EH,54.663395858845000,-1.605500279869730
snapping turtle and Grackle,1305524,DL11 7UE,54.536311330638600,-1.763389217070790
Prion and Quetzal,1299875,DL2 3LW,54.580025610980100,-1.810725356627800
Mamo and Old World quail,1302957,DL14 6SJ,54.645257295355700,-1.660825776118300
Tree warbler and Parrotbill,1299439,DL3 0TF,54.546042139451700,-1.582888568172620
diamondback and racer,1305020,DL12 8HB,54.548258661411200,-1.915468105058950
jew lizard and amphisbaena,1297767,DL5 6PF,54.595859425383800,-1.619293000987070
Peafowl and tiger snake,1303090,DL14 7DT,54.662912669356500,-1.679343972267160
Mockingbird and Coati,1303522,DL14 4BB,54.657336006079200,-1.680891395906840
B and lizard,1302064,DL15 8BG,54.692482011098600,-1.749388858927650
monitor and king cobra,1302052,DL15 8AR,54.682932822399900,-1.726306000000000
water snake and Herring gull,1298549,DL4 1DL,54.631443965651000,-1.644892321593630
gopher snake and black snake,1302677,DL14 8UE,54.647855070997300,-1.648422149720580
Peafowl and black snake,1298911,DL3 9YA,54.529895097920400,-1.580997946086820
Parakeet and Flameback,1302490,DL14 9QY,54.620182053637400,-1.761772874695310
Fish eagle and Dorcopsis,1300303,DL2 3EB,54.547649063202400,-1.739687116336470
diamond python and Prion,1298977,DL3 8SJ,54.526452580379200,-1.586070173765470
Petrel and diamondback,1300092,DL2 3XA,54.578520053492100,-1.807700105043150
Old World vulture and Macaw,1303044,DL14 6XA,54.647443857755000,-1.678334381812940
agama and Armadillo,2651686,DL12 8FG,54.545570000000000,-1.925298000000000
Schneider python and horned viper,1303282,DL14 6JX,54.650317402393500,-1.680899843699360
Viscacha and Grosbeak,1298715,DL4 2DL,54.633896195610300,-1.641447331702650
Hawk and blind snake,1304571,DL12 9PY,54.566907074182900,-1.979969613222850
Mamo and Shearwater,1304772,DL12 8SX,54.541444000000000,-1.910026000000000
Tattler and Maya,1298557,DL4 1DX,54.634180128578200,-1.646324719765540
adder and Quetzal,1304594,DL12 9RF,54.524164326830400,-1.945923182173720
Puffleg and Grosbeak,1303412,DL14 6PR,54.644747539270300,-1.681625244231790
