name,id,postcode,lat,lon
Condor and snapping turtle,221242,TA1 2DH,51.021840509167500,-3.080835123516980
Capuchin and saltwater crocodile,219373,TA13 5JZ,50.926571708534600,-2.819079060294720
Thicketbird and box turtle,221294,TA1 2JB,51.011267456065400,-3.084480818590610
Puffleg and constrictor,220642,TA1 4PY,51.011073952149500,-3.111759811244280
dukite and Mink,211756,TA6 6TZ,51.093547315818600,-3.015576049881960
Komodo dragon and sand viper,1759211,TA1 1NU,51.020193171305100,-3.103680000000000
elapid and Thicketbird,218285,TA2 6NT,51.035071709455600,-3.143610000000000
harlequin snake and Francolin,216525,TA21 0BY,51.001087917936400,-3.217696313953810
brown snake and Gila monster,1759613,TA2 6UZ,51.027911113000800,-3.124326788379420
Rat and Warbler,220980,TA1 4HX,51.003689515592200,-3.110029724927000
Dorcopsis and asp,217713,TA20 1EF,50.882972673459200,-2.956473000000000
Herring gull and hawksbill,218366,TA19 9HD,50.948881877275200,-2.926194578180440
Mamo and swift,220793,TA1 5DL,51.008397108568900,-3.123669076647390
Chipmunk and goanna,2613914,TA1 1AY,51.019921000000000,-3.097309000000000
slowworm and sand lizard,217663,TA20 1AR,50.878126683497100,-2.957553974363640
Jay and Buzzard,220449,TA1 5JH,51.006789262329700,-3.138339751762690
Herring gull and Warbler,220246,TA10 0AS,50.990894700445100,-2.860391315932310
blue racer and Mamo,220866,TA1 3TA,51.011747377666800,-3.099516686196080
cayman and asp,217116,TA20 3TD,50.910515954984100,-3.032708992821790
snapping turtle and Argus,218913,TA19 0BB,50.929064984510200,-2.908682804138120
Grosbeak and Fish eagle,1759677,TA21 9BW,50.982471209198500,-3.214689000000000
Komodo dragon and snapping turtle,213807,TA4 3BE,51.064284281923600,-3.186587577867670
Jerboa and Kite,211356,TA7 0NR,51.094570700242300,-2.891217636652880
Philippine hawk-owl and elapid,214783,TA3 5PW,51.021945046188300,-3.034527568111960
Night heron and asp,218382,TA19 9JB,50.958644694018500,-2.890764029623250
Nukupuʻu and carpet snake,213910,TA4 3EQ,51.094439000000000,-3.192657000000000
Black jay and skink,217853,TA2 8AS,51.057588186493200,-3.154838927929910
Duck and amethystine python,218456,TA19 0EN,50.921151178944600,-2.911032554599910
coral snake and Goose,214407,TA3 7LR,50.994482715720900,-3.117405050090920
Pitohui and turtle,220829,TA1 3QB,51.011095758540500,-3.100912490354420
brown snake and grass snake,220818,TA1 5ES,51.013163847711600,-3.135687544808180
grass snake and glass snake,220218,TA10 9RN,51.040816763285600,-2.826042069002290
puff adder and diamondback turtle,221452,TA1 1LD,51.017429258978300,-3.097754967522630
rock snake and tokay,216172,TA21 9EX,50.981488504476400,-3.218978345596500
Tit-tyrant and Cloud rat,217741,TA2 7PJ,51.025758399236400,-3.101359701197860
thorn lizard and Zebra,214031,TA3 7PZ,50.912768000000000,-3.174223000000000
bicycle lizard and Lemming,218020,TA2 7DU,51.026475136910600,-3.104499507887200
cycling lizard and Condor,218604,TA19 0NY,50.910400236304100,-2.889501194384770
Old World vulture and turtle,214646,TA3 5BH,50.958517063770300,-3.052026827191400
coral snake and Thicketbird,213821,TA4 3DA,51.055398451561200,-3.198160362423260
crocodile and frilled lizard,216283,TA21 9ND,50.984715000000000,-3.207928917082110
agamid and krait,220356,TA10 0LR,51.017333318958700,-2.841762840453020
Prion and Scimitar babbler,218555,TA19 0JJ,50.961454952057700,-2.877091075766990
boa constrictor and tree snake,214676,TA3 5DY,51.029606051803600,-3.039660760278270
Fox and Mouse,214400,TA3 7LG,50.992760212171000,-3.116978946124110
Duck and indigo snake,212969,TA5 2EP,51.097648481274500,-3.081659667812310
Stilt and moloch,214815,TA3 5RR,50.976654952323200,-3.037978974200550
Diving bird and brown snake,218057,TA2 7EY,51.030469927204600,-3.095681575099660
Warbler and puff adder,217902,TA2 8EZ,51.033532584702700,-3.090320152423740
Komodo dragon and soft-shelled turtle,214152,TA4 1DA,51.036769295692500,-3.182817976869590
Magpie and Stint,221209,TA1 3LJ,51.014639917995600,-3.100796852785440
Fish eagle and Herring gull,217832,TA2 6RX,51.026678000000000,-3.138651877583470
Cuscus and gaboon viper,213534,TA4 3NS,51.055268095523000,-3.185372536530030
bushmaster and viper,217538,TA2 8JZ,51.041454000000000,-3.092546000000000
wall lizard and tokay,217743,TA2 7PN,51.024257920513600,-3.101224323020530
Black cockatoo and gecko,1196730,EX15 3PH,50.922882000000000,-3.197470000000000
Rabbit and Zebra,221461,TA1 1LW,51.016489111990400,-3.103050387292260
rock python and cobra,220817,TA1 5ER,51.011383692396700,-3.137497182405830
snapping turtle and snake,216251,TA21 9JN,50.981994581584400,-3.181994994109080
Tree warbler and Argus,221322,TA1 2LP,51.024209000000000,-3.066874000000000
alligator and Badger,219203,TA17 8TA,50.915665282305100,-2.866200912122950
Gila monster and python,216267,TA21 9LG,50.965322678942700,-3.176601690377650
chameleon and death adder,219270,TA13 5DF,50.947943294380200,-2.814458192747740
king cobra and Ibex,217537,TA2 8JY,51.044504778362500,-3.090178372095510
Duck and Quetzal,212057,TA6 6NY,51.090347952202000,-3.021545966566400
Duck and Maya,217997,TA2 7BQ,51.035867927992600,-3.100201707266350
Schneider python and bearded dragon,211682,TA7 0DD,51.060817000000000,-3.009266000000000
chuckwalla and horned viper,2586362,TA2 8FH,51.038327000000000,-3.057071000000000
Hawaiian honeycreeper and pit viper,1196886,EX15 3SX,50.929897904572900,-3.209403998704320
dugite and hognose snake,218693,TA19 0SA,50.924969440364300,-2.950946166565990
Schneider python and Civet,214789,TA3 5QD,51.024746902569200,-3.037997814438450
bicycle lizard and Snipe,217585,TA2 8PQ,51.036406764812400,-3.063374529706550
galliwasp and bull snake,1759412,TA1 9LP,51.023455716726900,-3.109703798849010
king cobra and Civet,217211,TA20 4AH,50.887898863931600,-2.926718811466030
Ground sloth and Dorcopsis,217625,TA2 7NJ,51.031826632573900,-3.107250786890340
Vole and cobra de capello,217755,TA2 7QB,51.026129593047000,-3.094268000000000
alligator and Snipe,211389,TA7 0QN,51.084843966571300,-2.878952154918290
sidewinder and massasauga,217809,TA2 7TB,51.030012380499300,-3.102259142053440
Prion and White ibis,217858,TA2 8BD,51.027445271181400,-3.067860840971290
snake and lizard,212053,TA6 6NT,51.089510725968300,-3.017529470721490
bearded dragon and rattlesnake,214203,TA4 1HW,51.001649553464300,-3.184062230480720
blue tongue and mountain devil,220351,TA10 0LJ,51.017713188044300,-2.850152555127170
Schneider python and bandy-bandy,218201,TA2 6HQ,51.024534438683700,-3.106221470790900
puff adder and Solitaire,220976,TA1 4HS,51.002419546723000,-3.110241693847050
turtle and Darwin's finches,220448,TA1 5JG,51.007647761458300,-3.138831143771310
Vole and Mouse,218879,TA18 8RH,50.883679835069500,-2.819975499189470
diamondback and bushmaster,217024,TA21 0BX,51.001223588650700,-3.218483716209470
Black jay and asp,221004,TA1 4LB,51.002424340189100,-3.124778923382650
snapping turtle and Argus,220372,TA10 0NT,51.025821210810700,-2.859184276583640
Asiatic leopard and Thrasher,220898,TA1 4AA,51.015851388077600,-3.104874299105840
bushmaster and elapid,218906,TA19 0AT,50.926766360871000,-2.903601029667230
bearded lizard and Vulture,221447,TA1 1JX,51.017910059800000,-3.098265312317260
giant tortoise and cobra de capello,220811,TA1 5EH,51.016534346051300,-3.138635443035420
sand viper and Chicken,213057,TA5 1DR,51.099174837467100,-3.139636561017960
Pratincole and frilled lizard,214479,TA3 6DB,50.997365371576800,-2.993452523400080
Mink and racer,218667,TA19 0QL,50.927444215639400,-2.840551561885860
blue tongue and Armadillo,214476,TA3 6BY,51.003697890758100,-2.995355105167460
Grackle and amethystine python,218441,TA19 0DS,50.925979009438600,-2.912336303834040
wall lizard and Skunk,219341,TA13 5HF,50.967352977562900,-2.813900502982380
Parakeet and Bunting,218373,TA19 9HN,50.961407000000000,-2.926614000000000
Grackle and Chickadee,221129,TA1 2AD,51.019613419746200,-3.088254156566970
Lemming and Black jay,218222,TA2 6JS,51.026800391627300,-3.109084552133190
Gull and Macaw,213903,TA4 3EF,51.093509606374300,-3.184850882477360
Siskin and Darwin's finches,217925,TA2 6SD,51.028907907391200,-3.151501947608880
Kangaroo and Wallaby,218923,TA19 0BS,50.921695000000000,-2.910631000000000
box turtle and Badger,218163,TA2 6DJ,51.032744250937200,-3.110566000000000
grass snake and Asiatic leopard,218269,TA2 6LX,51.027701836347500,-3.115465951974650
milk snake and Vole,2659159,TA2 8GY,51.031187000000000,-3.059426000000000
tuatara and frill-necked lizard,220869,TA1 3TP,51.013799000000000,-3.102345000000000
Gull and Philippine hawk-owl,1198020,EX14 9NZ,50.877091000000000,-3.124174000000000
rattlesnake and slowworm,220324,TA10 9SA,51.041893492925600,-2.826375030022430
Parakeet and boomslang,218246,TA19 9BZ,50.933310801098400,-2.927948623102580
Petrel and Minke whale,220493,TA1 5NU,51.011191854022700,-3.124805738302290
death adder and flying dragon,221040,TA1 2XE,51.020777335774200,-3.069332979425570
python and alligator,217695,TA20 1DH,50.881195114159500,-2.960602015908510
rock python and Mink,214576,TA3 6LZ,51.020711532284300,-2.975117314190910
garter snake and diamondback terrapin,221403,TA1 2QE,51.006166507845100,-3.078888611199610
thorn lizard and brown snake,221399,TA1 2PZ,51.008121554462800,-3.078492112965550
chameleon and mountain devil,218724,TA19 9AW,50.928433943086900,-2.912341654025600
galliwasp and tree snake,214392,TA3 7JX,50.994365130461900,-3.119354421230780
anaconda and Skunk,214525,TA3 6EW,51.043021000000000,-2.922208000000000
python and garter snake,216989,TA20 3JH,50.928657495577200,-3.027234021763110
Recurvebill and caiman,217760,TA2 7QH,51.027173463979400,-3.092395411334080
Eagle and mountain devil,219843,TA10 9TD,51.041808836742400,-2.816674073015110
Vulture and Condor,214191,TA4 1HF,50.999627748953100,-3.181246003547200
Tattler and bicycle lizard,217985,TA2 7AZ,51.032894000000000,-3.101928000000000
Peafowl and pit viper,217578,TA2 8PE,51.036339803659000,-3.060848547651270
Chickadee and diamond snake,217581,TA2 8PJ,51.034051664570200,-3.065245943790360
B and Polecat,213432,TA4 3HU,51.072996956993800,-3.199028849856580
mamba and loggerhead,214128,TA4 1AP,51.016741000000000,-3.190235000000000
chuckwalla and Magpie,218203,TA2 6HS,51.024903602256000,-3.108069665496790
Parakeet and tuatara,217325,TA20 1EY,50.876445552368400,-2.953099126300050
Black jay and galliwasp,221603,TA1 1UW,51.018619967031700,-3.106893331625150
Moluccan boobook and anole,214704,TA3 5HX,51.012363779806600,-3.045105385457430
Darwin's finches and Bunting,2613942,TA1 9NH,51.023437000000000,-3.109655000000000
frill-necked lizard and Jackal,221346,TA1 1EG,51.021638042318900,-3.111042997220290
Treepie and crocodile,217551,TA2 8LR,51.062846000000000,-3.063381000000000
puff adder and galliwasp,220063,TA10 9DH,51.074132000000000,-2.820084000000000
rock snake and frilled lizard,221120,TA1 3ED,51.005618248893800,-3.087584483531300
Skunk and Hawk,217588,TA2 8PT,51.029824935977000,-3.077042218831390
slowworm and Mamo,212114,TA6 6RX,51.095142087147900,-3.010027334454840
Chickadee and Shearwater,219525,TA12 6BT,50.978473542550200,-2.828410674021960
Rabbit and goanna,221572,TA1 1SR,51.016580779966100,-3.097136158311690
Eagle and bushmaster,217783,TA2 7RP,51.038604403171700,-3.098954324708590
chuckwalla and Masked owl,220366,TA10 0NL,51.038083629075900,-2.854718667343370
cobra and anaconda,214211,TA4 1JF,51.038635171299500,-3.189469386453470
Logrunners and hawksbill,221216,TA1 3LX,51.014373560156300,-3.099479018427440
Vole and gopher snake,216277,TA21 9LU,50.984051607191400,-3.160705988016920
tuatara and Grosbeak,217696,TA20 1DJ,50.881030323154700,-2.955481279328840
lizard and skink,218304,TA2 6QD,51.028471024244300,-3.142878022907220
Old World warbler and diamondback turtle,220626,TA1 4NT,51.002527817997000,-3.127104520924270
harlequin snake and turtle,220882,TA1 3XG,51.002193768480300,-3.080620686692130
Stint and Meadowlark,217826,TA2 6RQ,51.026921000000000,-3.149813000000000
Capuchin and tuatara,217731,TA2 7NX,51.036412059635400,-3.107331577732790
Quetzal and whip snake,214665,TA3 5DH,51.011632000000000,-3.039721218948840
horned viper and leguaan,217374,TA20 1LA,50.881095757455500,-2.970436668708670
Solitaire and Puffleg,211753,TA6 6TW,51.090292827883000,-3.018589003761570
rock python and gavial,2613732,TA2 8FU,51.035850000000000,-3.052915000000000
Hawk and Grosbeak,217778,TA2 7RG,51.037277771067300,-3.095628238444320
iguana and mud turtle,220797,TA1 5DR,51.013805645303200,-3.127919680638020
agamid and Argus,214712,TA3 5JG,51.019688802142600,-3.048549288501830
Kangaroo and Chickadee,217087,TA20 3QY,50.935452124683200,-3.089290000000000
Perching duck and Shearwater,213025,TA5 1AT,51.093412950571900,-3.133854260907800
Jackal and harlequin snake,220791,TA1 5DH,51.008905286305000,-3.122255952843680
amphisbaena and Cloud rat,218476,TA19 9PP,50.932325220685300,-2.928626296732450
boa constrictor and Greenbul,220698,TA1 4TB,51.005868128445100,-3.117322324690290
Fulmarine petrel and blue racer,214655,TA3 5BW,50.985518670405200,-3.048377422610150
Songlark and wall lizard,211669,TA7 0BL,51.073701173589400,-3.004808000000000
Parrotbill and diamondback,221016,TA1 4LS,51.004763813961000,-3.121828175637580
leguaan and indigo snake,220631,TA1 4NZ,51.003552824788400,-3.128982182374650
Warbler and Dolphin,220497,TA1 5NZ,51.008124176409200,-3.124931070620010
Chipmunk and Thicketbird,214076,TA3 7SS,50.965042310627600,-3.132192206819480
cycling lizard and Komodo dragon,211394,TA7 0QT,51.079419536014900,-2.880419639164590
leguaan and bearded lizard,217029,TA20 3LD,50.932177206671600,-3.051076534711770
constrictor and tortoise,211368,TA7 0PF,51.084215130480200,-2.893103005152100
Stilt and skink,212035,TA6 6LU,51.090759000000000,-3.012694345092580
sand lizard and worm lizard,1759620,TA2 8DP,51.033636183183000,-3.057236067652490
Prion and Bronzewing pigeon,220841,TA1 3QW,51.005273758574300,-3.107972364472860
boomslang and Darwin's finches,218355,TA19 9ET,50.953960493424800,-2.921924776802070
Pratincole and horned viper,221149,TA1 2BD,51.019005327272400,-3.083050322945430
anaconda and leathery turtle,1759682,TA21 9EQ,50.980705000000000,-3.214941000000000
king cobra and grass snake,212951,TA5 2DQ,51.097277962597000,-3.048304486469850
Grouse and Chicken,214187,TA4 1GY,51.037732082251500,-3.186424000000000
rattlesnake and terrapin,216934,TA20 3DE,50.875680932147800,-3.003540536207200
Peafowl and agama,214416,TA3 7NG,50.997867111068300,-3.126435789886670
indigo snake and ringhals,214354,TA3 7EP,50.994776000000000,-3.121640335018160
milk snake and carpet snake,218272,TA2 6NA,51.027744805707700,-3.107167760819430
water snake and mud turtle,221072,TA1 3AJ,51.013985920987900,-3.094794013010270
Buzzard and Tattler,220763,TA1 5AW,51.014829466891600,-3.114002274476590
Booted eagles and bull snake,220821,TA1 5EW,51.015637004378500,-3.137515736487660
dugite and Asiatic leopard,214452,TA3 6AQ,50.976020000000000,-2.963270000000000
tokay and Badger,217318,TA20 3AQ,50.893485000000000,-2.950191000000000
Marsh harrier and Shearwater,221369,TA1 2ND,51.019576899596300,-3.067851113724150
boa and grass snake,1196877,EX15 3SL,50.918559707515400,-3.223193000000000
Boto and New World blackbird,1196734,EX15 3PP,50.908639000000000,-3.199124522142290
giant tortoise and frill-necked lizard,214608,TA3 6PY,51.005452824781300,-2.904516525745940
Komodo dragon and Songlark,217931,TA2 6SL,51.043379007204400,-3.124515432954080
thorny devil and Fox,218210,TA2 6JB,51.024969169127800,-3.108741401147370
Crow and Bronzewing pigeon,220359,TA10 0LU,51.002242507785300,-2.841974189131090
blind snake and Capuchin,218176,TA2 6EB,51.035581452929500,-3.110520777777780
Wallaby and indigo snake,211734,TA6 6SX,51.092022480315800,-3.017199062395780
Darwin's finches and jew lizard,2659132,TA1 9PA,51.023437000000000,-3.109655000000000
Songlark and rattlesnake,221583,TA1 1TF,51.016549924740400,-3.093713898153360
Hawk and Linsang,217655,TA20 1AF,50.876275559972800,-2.958482537937450
Condor and Skunk,1196901,EX15 3TU,50.929476229074300,-3.179425011973510
Piping shrike and sea snake,220741,TA1 4YH,51.000324325008900,-3.123402746466160
Towhee and Stilt,218092,TA2 7JT,51.034229176969800,-3.095641895902860
dugite and diamond snake,220446,TA1 5JE,51.007058757095200,-3.136521900295710
Tattler and Francolin,214291,TA3 7AZ,50.966882362888000,-3.111017568635190
Fish eagle and tortoise,216265,TA21 9LE,50.969439788364000,-3.174768000000000
horned viper and Bronzewing pigeon,219191,TA17 8SL,50.910501464231700,-2.822710000000000
Towhee and Kangaroo,221101,TA1 3BZ,51.002700186705000,-3.085164630784680
New World blackbird and Marmoset,1759623,TA2 8FB,51.034141028432600,-3.054109975019700
Diving bird and Goose,213466,TA4 3LU,51.054398679082300,-3.187747372728530
galliwasp and Old World quail,220440,TA1 5HX,51.007551577931700,-3.131146063410560
bull snake and Francolin,221239,TA1 2DE,51.020750784053200,-3.077117044990560
cycling lizard and mamba,214154,TA4 1DE,51.038343846948000,-3.181845395030700
sea snake and Dorcopsis,220389,TA10 0PQ,51.025681295139000,-2.883963805328370
sand lizard and Logrunners,220929,TA1 2RU,51.012391968373200,-3.072746603616640
snake and moloch,214238,TA3 6SN,50.980610000000000,-2.993921000000000
Songlark and adder,217806,TA2 7SY,51.030708283359900,-3.109491587606490
sand lizard and carpet snake,218591,TA19 0NE,50.954155088776400,-2.843866653583810
Egret and swift,1196832,EX15 3QE,50.905992949032000,-3.181663000000000
agamid and tortoise,212064,TA6 6PG,51.074375233197400,-3.037109727057910
king snake and Tree warbler,220908,TA1 4AR,51.014705573901500,-3.107170761625940
box turtle and Nukupuʻu,216351,TA21 8ED,50.972847623156100,-3.218011412956600
Kangaroo and Pitohui,220643,TA1 4PZ,51.011214641120100,-3.111150221199200
carpet snake and Pheasant,220176,TA10 9PA,51.037537293901300,-2.828194437198460
anole and agama,220219,TA10 9RP,51.040440353008300,-2.827133661128640
anaconda and Jay,220938,TA1 2SF,51.006968339612700,-3.073847251811050
brown snake and Grouse,218462,TA19 9NT,50.945248721403900,-2.980184716479400
Black cockatoo and Scimitar babbler,214599,TA3 6PN,50.999825573389100,-2.923788554555030
saltwater crocodile and sand lizard,2592419,TA1 3FN,51.010158000000000,-3.095026000000000
Vulture and Condor,221333,TA1 1DN,51.020554469836700,-3.112457110562220
Thicketbird and Jackal,2632407,TA7 0DW,51.081857000000000,-2.878530000000000
Tree warbler and black snake,217076,TA20 3QJ,50.917374691081700,-3.081656071819680
gopher snake and death adder,217021,TA21 0BT,51.000547020263800,-3.217824666461770
Argus and Flameback,214074,TA3 7SQ,50.958256033958100,-3.123484088878460
Petrel and box turtle,221252,TA1 2DX,51.025030000000000,-3.073452000000000
carpet snake and Parrotlet,214429,TA3 5SN,50.955785249337800,-3.039763389901330
Chicken and Boto,217556,TA2 8NA,51.034700698163300,-3.069011715407300
Badger and diamondback turtle,217929,TA2 6SH,51.026216246777200,-3.153616924330320
tuatara and Stint,1196733,EX15 3PN,50.919991087421300,-3.189841101665510
B and Thrasher,218571,TA19 0LE,50.949182893920200,-2.851207541816650
Black jay and coral snake,218904,TA19 0AR,50.926417699142600,-2.905657425448910
rock python and Petrel,212087,TA6 6QN,51.091823019362600,-3.011168760804540
cobra and Night heron,217737,TA2 7PE,51.033975490348100,-3.109184561753950
Herring gull and Civet,214511,TA3 7NU,50.988938386042000,-3.136549357420380
Flameback and Vulture,214823,TA3 5SD,50.952880000000000,-3.035897000000000
milk snake and horned viper,219830,TA10 9SJ,51.044555165535700,-2.820174000000000
soft-shelled turtle and Rat,217602,TA2 8QP,51.047161000000000,-3.033451397420530
blindworm and Parakeet,221003,TA1 4LA,51.005578285716100,-3.125966957475550
mamba and glass snake,212042,TA6 6NE,51.094370236588400,-3.019178419345150
Minke whale and Boto,220664,TA1 4RH,51.000383169633300,-3.107827337308020
Booted eagles and Mouse,214029,TA3 7PX,50.905237967009200,-3.167178320349420
Quetzal and Parakeet,217528,TA2 8JG,51.060596951057600,-3.121993022680240
Scimitar babbler and racer,220978,TA1 4HU,51.003266838823400,-3.108138328028720
puff adder and Pitohui,220972,TA1 4HN,51.006643881379800,-3.110470846235570
Wallaby and anole,219197,TA17 8ST,50.910821000000000,-2.840167000000000
Tit-tyrant and leguaan,216618,TA21 9AN,50.970637172455100,-3.223864194270850
Stint and frilled lizard,221810,TA1 1AZ,51.020353716812400,-3.113706970623670
loggerhead and Duck,214464,TA3 6BG,51.026582391536600,-2.993406948119680
amethystine python and leathery turtle,214336,TA3 7DG,50.963622740813300,-3.095289835233990
Dorcopsis and Petrel,220338,TA10 0JS,51.020403000000000,-2.853945300400710
Darwin's finches and Asiatic leopard,217870,TA2 8BY,51.029129000000000,-3.065760000000000
saltwater crocodile and grass snake,217348,TA20 1HS,50.877895157654000,-2.945140498964300
bearded dragon and Prion,216940,TA20 3DN,50.896057000000000,-3.021468000000000
leathery turtle and hawksbill,213812,TA4 3BP,51.054970776207100,-3.195138713667690
giant tortoise and massasauga,221079,TA1 3AU,51.014141596946600,-3.092573799568170
hognose snake and Wallaby,221145,TA1 2AY,51.020473565729400,-3.084724162795340
Vulture and Philippine hawk-owl,220568,TA1 9GL,51.023449287837400,-3.109703229798920
rat snake and ringhals,212100,TA6 6RD,51.094951443610600,-3.007109978127630
Towhee and cobra,217796,TA2 7SG,51.026573493508000,-3.104558883983990
Skunk and snake,218137,TA2 6AN,51.029763803401200,-3.126911000000000
