name,id,postcode,lat,lon
diamondback turtle and carpet snake,1098631,GU33 7QN,51.030212823548100,-0.875773126127324
monitor and pit viper,1100650,GU29 9DQ,50.986910802713900,-0.738120847237670
Minke whale and wall lizard,2653071,GU29 9FZ,50.988932000000000,-0.739998000000000
Myna and cobra,1099767,GU31 4JN,51.002381893643700,-0.935420728114581
Recurvebill and Chipmunk,1101628,GU27 2FD,51.084336667786300,-0.719067440123912
green turtle and Kangaroo,515572,PO9 6DU,50.885136354961400,-0.930560027370913
Crow and loggerhead,517889,PO7 7QA,50.884517272932300,-1.020930913168690
Stint and diamondback terrapin,515966,PO9 4EU,50.879398478375800,-0.995295911756100
perentie and kabaragoya,1099633,GU31 5PE,50.997827034305100,-0.898060034452675
Booted eagles and Jerboa,2645575,PO18 0FX,50.912311000000000,-0.754955000000000
puff adder and Pitohui,1099774,GU31 4JX,51.000619070822600,-0.935389806532390
diamond python and tuatara,1100087,GU31 4BJ,51.005391200636200,-0.934083350864143
thorn lizard and Buzzard,517235,PO8 0LQ,50.942053436242700,-0.998800029779342
king snake and lizard,1100033,GU30 7UP,51.074055472965400,-0.800186097669277
gavial and cobra,1099684,GU31 5SG,50.976977596655500,-0.951299911548242
Polecat and Rat,1101422,GU28 0NU,50.946829000000000,-0.701796000000000
Rabbit and Fish eagle,1099050,GU32 9DL,51.003907841284000,-0.938280000000000
indigo snake and massasauga,517573,PO8 0DU,50.927034432112800,-1.003903308901210
sidewinder and sand viper,1101321,GU29 0AR,50.996755000000000,-0.724547394485382
bandy-bandy and tree snake,1101868,GU27 1LN,51.087737501820700,-0.737406992905616
Buzzard and diamond python,517749,PO7 8JS,50.881982764362800,-1.014686703122170
rock snake and green turtle,1099174,GU32 2HJ,51.008872709449400,-0.938992000000000
Logrunners and cobra,1102322,GU27 1EU,51.092345017208800,-0.728585102810312
bicycle lizard and Elephant,517231,PO8 0LJ,50.942622145819000,-0.998004965901949
king snake and Mouse,1098959,GU32 3PD,51.008636993567300,-0.965039736636122
bandy-bandy and elapid,1101151,GU28 9DD,50.997339598859500,-0.676902019783206
mud turtle and Triller,1099692,GU31 5SX,50.983580638431300,-0.958616204269621
Old World warbler and gavial,1100995,GU29 0NG,50.992187078325100,-0.773358224682881
diamondback and hognose snake,1804109,PO8 0YF,50.941301686100000,-0.994688650700000
crocodile and Philippine hawk-owl,1099538,GU31 5ES,50.994748904211600,-0.802730822232478
hawksbill and tree snake,516019,PO9 4LR,50.876842000000000,-0.994896000000000
Stint and gopher snake,517119,PO8 9QX,50.908706000000000,-1.017323000000000
Piping shrike and mud turtle,1100879,GU29 9PR,50.982628184534100,-0.744604970748394
Mole and blue racer,1099950,GU30 7PW,51.080537558635000,-0.812367325251348
Chipmunk and boa constrictor,2580198,GU33 7FA,51.041747000000000,-0.892240000000000
saltwater crocodile and Warbler,517622,PO8 0HX,50.931691510974800,-1.000616263782620
Boto and python,1100858,GU29 0DW,50.952282530465300,-0.719369091986768
snapping turtle and water snake,2626369,GU31 4FS,50.995518000000000,-0.942629000000000
Warbler and glass snake,516980,PO8 9JX,50.914170556811400,-0.998132261875068
Logrunners and copperhead,517363,PO8 0ST,50.942238925442100,-1.013200392616370
Scimitar babbler and cerastes,1099876,GU31 4YZ,51.009886039257700,-0.931956232001124
Myna and cycling lizard,1098972,GU32 3PX,51.001483415044700,-0.942438886028408
Macaw and Black cockatoo,1101599,GU27 3SU,51.081378749456100,-0.731498289800884
wall lizard and milk snake,1099222,GU33 6HA,51.068919348821100,-0.895873448296160
Fulmarine petrel and coral snake,1101191,GU28 9HJ,51.052411000000000,-0.644601000000000
soft-shelled turtle and Condor,1098948,GU32 3NL,50.989993615751500,-0.959769313715740
Towhee and Thicketbird,531988,PO18 9JX,50.948654661900900,-0.847661454455073
Snipe and Quetzal,2641893,GU32 9GL,51.003869000000000,-0.938263000000000
glass snake and lizard,1100176,GU30 7AY,51.077012551553100,-0.799167475159944
green turtle and kabaragoya,1101871,GU27 1LR,51.089936558500500,-0.740360015303362
blue racer and turtle,1100254,GU30 7GD,51.081762172390400,-0.802827809870648
amethystine python and python,1098732,GU33 6HQ,51.064088612246000,-0.910059543852591
blind snake and krait,517265,PO8 0PD,50.939580793363300,-1.009245000000000
Thicketbird and jew lizard,516860,PO8 9DH,50.905033210273400,-1.007515891702040
Meadowlark and Kestrel,1099549,GU31 5HH,51.007185109532700,-0.851956211927908
Mink and chuckwalla,516953,PO8 9HH,50.917280054157100,-1.001052953055850
Tree warbler and Jerboa,515583,PO9 6EH,50.900980956272600,-0.946323803931007
loggerhead and snapping turtle,1098964,GU32 3PJ,51.005934000000000,-0.972469000000000
Badger and copperhead,517517,PO8 8BB,50.890143911425100,-1.009936485828160
Old World warbler and kabaragoya,1098840,GU33 7AG,51.045180844749600,-0.893199597223355
worm lizard and Siskin,1101960,GU27 1RD,51.087247033877600,-0.741960840558158
Treepie and taipan,1099702,GU32 1AH,51.021401150242300,-0.957499000000000
rattlesnake and Fish eagle,515544,PO9 6BE,50.881729436502600,-0.968691953874294
terrapin and tortoise,1100752,GU29 9FE,50.995449379914400,-0.731063509267483
Dorcopsis and puff adder,1101762,GU27 2QR,51.084854589698600,-0.731103403435564
rock snake and habu,1097825,GU34 3RB,51.089432217052800,-0.966836066727432
thorny devil and diamondback terrapin,1099836,GU31 4PW,51.003853390801200,-0.928175309231825
rattlesnake and mamba,1099405,GU32 3JA,51.004344547661900,-0.936658549948636
adder and Mole,2616112,PO8 0WN,50.943024000000000,-0.990066000000000
Mink and iguana,1804110,PO8 0YN,50.939850386400000,-0.993239726700000
sand lizard and Diving bird,1099716,GU32 1BD,51.039506996490600,-0.963881563056718
whip snake and diamondback terrapin,1098729,GU33 6HL,51.077224138485600,-0.912691662670265
crocodile and carpet snake,517531,PO8 0AR,50.917417538660700,-0.987777172046028
cobra de capello and sand viper,1100998,GU29 0NL,50.993756454806700,-0.773801340982419
coral snake and ringhals,515543,PO9 6BD,50.881691723657000,-0.966461012639436
amphisbaena and Solitaire,1101870,GU27 1LQ,51.089014398530400,-0.733245645497430
Gull and thorny devil,1098777,GU33 6NB,51.052165518850100,-0.935535448451573
hognose snake and green turtle,1100076,GU31 4AW,51.008232271623100,-0.930084196045971
gecko and Minke whale,1101129,GU28 9AY,51.000040599492400,-0.661961000000000
Guillemot and frilled lizard,1101627,GU27 2EZ,51.083641436239800,-0.703569000000000
Ibex and rattlesnake,516933,PO8 9ES,50.903248490596400,-1.002803798226170
Tahr and flying dragon,1099920,GU31 5DP,51.031102851190300,-0.834437777043116
Viscacha and boa constrictor,1099344,GU32 1EA,51.035395000000000,-0.968491182929860
Cuscus and New World blackbird,517502,PO8 8AG,50.890806682306800,-1.011742323707300
deaf adder and blue racer,1098545,GU33 7NN,51.038229216249300,-0.865024498854594
goanna and Polecat,1101068,GU29 0PU,51.004850000000000,-0.780265000000000
Mouse and cobra de capello,1101673,GU27 2LP,51.096404971632800,-0.701967979946959
Magpie and boomslang,531938,PO18 9ED,50.889725288300000,-0.878134115024362
racer and Pitohui,1099878,GU31 5AB,51.014613823317100,-0.914141986285785
king cobra and Booted eagles,2662961,GU31 5BQ,50.977131000000000,-0.968088000000000
Hawaiian honeycreeper and Scimitar babbler,517770,PO7 8LT,50.885201754471600,-1.011448617691860
garter snake and Recurvebill,1098173,GU34 3JS,51.096778612777000,-0.941652074498111
Skunk and American sparrow,517856,PO7 7NE,50.877846525017000,-1.022221998617300
smooth snake and monitor,1101955,GU27 1QL,51.085466780690600,-0.765610203680481
Warbler and boa,1101386,GU28 0JZ,50.949244569093900,-0.633025667249737
king cobra and chameleon,1101859,GU27 1JZ,51.089685253114300,-0.732084996956829
hoop snake and Old World vulture,1098224,GU34 3PT,51.062024000000000,-1.003065000000000
Lemming and Tit-tyrant,1101765,GU27 2QU,51.085881453235200,-0.729404000000000
Chickadee and smooth snake,1100788,GU29 9JQ,50.975855835330500,-0.743690771774571
fer-de-lance and viper,1099252,GU32 3BD,51.006396254565300,-0.948741150180996
Minke whale and Recurvebill,1100268,GU30 7HN,51.070265785283600,-0.799813068644027
bushmaster and New World blackbird,1099686,GU31 5SL,50.971248965693000,-0.953380000000000
Grackle and Vole,516969,PO8 9JG,50.911267015723400,-1.007738952436850
American sparrow and Old World warbler,517748,PO7 8JR,50.875300669437700,-1.021038718316930
tiger snake and mamba,1100107,GU31 4DL,51.008751684519100,-0.914250338156532
Towhee and White ibis,1101899,GU27 3EJ,51.046681624308600,-0.722902317007197
Mouse and Skunk,516848,PO8 9BT,50.899772485425600,-1.007513942391130
racer and Hawaiian honeycreeper,1101740,GU27 2PJ,51.084580010151200,-0.720759740978106
iguana and Meadowlark,517534,PO8 0AU,50.909124949351500,-0.951943168379887
bull snake and Eagle,2630315,PO8 8BU,50.899926000000000,-1.015955000000000
cobra de capello and Thicketbird,517345,PO8 0RT,50.948938833346400,-1.009001424729710
bearded lizard and Komodo dragon,517514,PO8 8AY,50.891654597305500,-1.008866543431240
bearded dragon and Diving bird,515540,PO9 6AZ,50.887839538008600,-0.972098000000000
Tahr and caiman,1779079,GU30 7GS,51.078979000000000,-0.805769000000000
Partridge and Greenbul,1101854,GU27 1JT,51.093345377982300,-0.732099156925365
frilled lizard and Fulmarine petrel,532655,PO18 0EX,50.910793098910200,-0.755442527927804
cobra de capello and copperhead,1099562,GU31 5HZ,50.991546617584700,-0.859266924033532
flying dragon and frill-necked lizard,1100077,GU31 4AX,51.008069665273400,-0.931969432030065
Tit-tyrant and bearded lizard,517431,PO7 8RH,50.886772557622400,-1.006866059100930
Night heron and agama,1099782,GU31 4LH,50.997591918937600,-0.945676700696070
chameleon and Partridge,1779032,GU27 9FW,51.085916831646200,-0.730974501261675
Quetzal and anaconda,1098836,GU33 7AB,51.044055080617900,-0.892070968135616
alligator and New World blackbird,1101869,GU27 1LP,51.091611913399900,-0.740614378436915
lizard and Shearwater,1100321,GU30 7NG,51.048992015909800,-0.769789869564284
blind snake and Puffleg,1100947,GU29 0HG,50.951598886244600,-0.750907876385322
leathery turtle and Gull,1100189,GU30 7BQ,51.079922092462900,-0.796151315602337
thorny devil and Parakeet,1100895,GU29 9QP,50.981725138697300,-0.746766204374132
Meadowlark and Shearwater,516825,PO8 9AL,50.897642804811500,-1.013005439878800
Civet and perentie,516877,PO8 9EE,50.912590153669800,-1.014254090546510
Grouse and Condor,516981,PO8 9JY,50.907756706780000,-1.010544386649450
amphisbaena and galliwasp,1099844,GU31 4QJ,51.011697070983200,-0.931358702995754
black snake and Skunk,1099116,GU33 6BE,51.080113712060200,-0.893836838987246
smooth snake and Hawaiian honeycreeper,531985,PO18 9JT,50.930781421756300,-0.856328144955356
Greenbul and Francolin,1100168,GU30 7AP,51.079604024755600,-0.801955571210590
gavial and leathery turtle,1100956,GU29 0HT,50.943082099788700,-0.758438154748682
Komodo dragon and blind snake,1099285,GU32 3DZ,51.006179190051100,-0.938654815679054
Francolin and python,1100222,GU30 7EH,51.060344103415800,-0.809202344946398
blue racer and flying dragon,2635181,GU27 3DR,51.074978000000000,-0.725401000000000
Dorcopsis and gopher snake,1099190,GU32 2JE,51.013448787515300,-0.934112509891450
Snipe and adder,1804126,PO8 9WG,50.903676011600000,-1.011484301100000
Jackal and Diving bird,516768,PO8 9YB,50.913874201254600,-1.015094689104280
Parrotlet and elapid,1097741,GU34 3QS,51.085960000000000,-0.993356000000000
giant tortoise and bicycle lizard,532016,PO18 9NJ,50.907659421204700,-0.823569890060592
Rat and goanna,1098734,GU33 6HS,51.074241570325600,-0.919798678764176
boomslang and Polecat,1101921,GU27 3HQ,51.023948754971300,-0.725423412038183
Piping shrike and Hawaiian honeycreeper,1098163,GU34 3JE,51.098890030288900,-0.948430509260146
Asiatic leopard and kabaragoya,1097829,GU34 3RJ,51.090876000000000,-0.976428000000000
leathery turtle and terrapin,515586,PO9 6EN,50.896560412817800,-0.952751294940780
thorny devil and Skunk,1100902,GU29 9QY,50.982161732766400,-0.748905598592828
Zebra and king snake,1101192,GU28 9HL,51.054227603476600,-0.643962894851729
monitor and snake,532362,PO18 0RB,50.906175000000000,-0.775243181499378
Ice seal and B,1102219,GU27 1DX,51.098621040572300,-0.709632402459291
blindworm and Petrel,1100929,GU29 0EG,50.980512730219100,-0.731086038616044
Rabbit and diamondback terrapin,515974,PO9 4HF,50.877210494648200,-0.998114627773244
Kangaroo and Duck,1092491,GU8 4SX,51.081089745859900,-0.634012259242823
Peafowl and puff adder,1100083,GU31 4BE,51.013539823917700,-0.918571996825930
Badger and Crow,532375,PO18 0RU,50.932370897556400,-0.797900595787378
boa constrictor and worm lizard,1099024,GU33 7LJ,51.035992443240000,-0.883006945012345
frilled lizard and cayman,1098727,GU33 6HG,51.066526360953000,-0.901496350451127
green turtle and giant tortoise,517638,PO7 8BZ,50.875139993570600,-1.019038039713800
monitor and Solitaire,1100753,GU29 9FG,50.985127849779900,-0.743739729507096
goanna and giant tortoise,1098542,GU33 7NH,51.043061018831300,-0.878357925469393
flying dragon and Stilt,1099325,GU32 1DB,51.051917116595400,-0.987545032616482
cobra and blue racer,517507,PO8 8AP,50.892630036072500,-1.008305545505850
sidewinder and puff adder,1099279,GU32 3DS,51.005800157561800,-0.938506680033423
diamondback turtle and Prion,1101880,GU27 1NB,51.088501046236800,-0.733173995500742
Night heron and Parrotlet,532360,PO18 0QZ,50.906434118055300,-0.775243181499378
Marmoset and tree snake,2653082,GU32 9GP,51.003869000000000,-0.938263000000000
taipan and Linsang,517029,PO8 8DL,50.893882488802200,-1.018175230480560
crocodile and Nukupuʻu,2584006,PO8 0WJ,50.943342000000000,-0.990588000000000
diamond snake and terrapin,1098738,GU33 6HX,51.080182511656600,-0.924342861142701
green turtle and asp,1779052,GU29 0EY,51.017149000000000,-0.746810000000000
anole and Masked owl,1101612,GU27 3TN,51.082340817149600,-0.738967291168578
Marmoset and elapid,1804102,PO8 0SY,50.914809475900000,-0.995743067200000
frilled lizard and Marmoset,1099165,GU32 2EX,51.009390136724500,-0.943826000000000
Old World warbler and Buzzard,1099246,GU32 3AW,51.006313901498800,-0.943597605103046
Mole and Ice seal,1099268,GU32 3BZ,51.008150966328000,-0.943883720098108
hognose snake and Grosbeak,517420,PO8 0YP,50.919975508510600,-0.999729069131288
sand lizard and python,1101540,GU27 3PS,51.073215325766900,-0.745838423789344
Rat and Herring gull,1099680,GU31 5SA,50.978601507859500,-0.949881601569713
Rat and Linsang,516975,PO8 9JR,50.909477197044300,-1.007705880565130
gecko and Coati,1101172,GU28 9EH,51.063175370671700,-0.644743290206759
soft-shelled turtle and tree snake,1100074,GU31 4AT,51.010341896280900,-0.927726445789522
New World blackbird and harlequin snake,1101845,GU27 1JG,51.090545793119500,-0.732661199570931
Diving bird and Philippine hawk-owl,517529,PO8 0AN,50.909224766954300,-0.972280546283052
indigo snake and alligator,1099135,GU32 2DB,51.024352000000000,-0.932451000000000
Pheasant and Mouse,2343051,PO7 7PW,50.880894000000000,-1.021988000000000
Towhee and Wallaby,1099514,GU32 2AA,51.008580842872700,-0.936747007916393
Mouse and Kestrel,1099302,GU32 3EX,51.005608768292800,-0.935261364345150
Solitaire and Cloud rat,515960,PO9 4EL,50.877596722672000,-0.994922446076609
saltwater crocodile and box turtle,516940,PO8 9FB,50.908391000000000,-1.001400000000000
tree snake and thorn lizard,1099295,GU32 3EP,51.006536005079200,-0.934384943756132
Dorcopsis and Nukupuʻu,1102204,GU27 1DD,51.088483784674500,-0.725792389577350
racer and tree snake,516954,PO8 9HJ,50.912988892245000,-1.008242882552350
jew lizard and diamondback terrapin,1098654,GU33 7SA,51.043831425171800,-0.895043373861065
cerastes and deaf adder,1099765,GU31 4JJ,51.001888000000000,-0.935332000000000
Maya and blindworm,1099872,GU31 4YA,51.003907841284000,-0.938280000000000
diamondback turtle and Puffleg,1102315,GU27 1EL,51.094212000000000,-0.710069000000000
Bronzewing pigeon and caiman,1099713,GU32 1AZ,51.009048727394500,-0.966855090115587
Tahr and horned toad,1099282,GU32 3DW,51.007691509888200,-0.942796622673765
asp and tortoise,1804097,PO8 0FN,50.911266000000000,-0.996905720500000
box turtle and Siskin,1100944,GU29 0HD,50.954028000000000,-0.750857000000000
pit viper and Stilt,1099793,GU31 4LX,50.995211302902200,-0.940971202889416
Pheasant and Jay,1100846,GU29 0DF,50.961020277508100,-0.727302433996613
blue tongue and Marmoset,517550,PO8 0BQ,50.925209968483300,-0.999816041930377
grass snake and Philippine hawk-owl,1099572,GU31 5JN,50.990811345591000,-0.829476971297864
elapid and massasauga,517152,PO8 8NR,50.898801824513500,-1.017147487399540
king snake and mud turtle,517247,PO8 0NF,50.931502956490200,-1.001701804285470
Francolin and rock python,516976,PO8 9JS,50.909171327341300,-1.008750694468700
Recurvebill and Logrunners,1099882,GU31 5AG,51.024613480841800,-0.895899490128777
Minke whale and copperhead,2662963,GU32 3FT,51.003995000000000,-0.944232000000000
Zebra and gavial,1099166,GU32 2EY,51.009510946094900,-0.942128083798896
agama and Fox,1099567,GU31 5JF,50.987788506307000,-0.860270875221697
rat snake and Night heron,1101324,GU29 0AX,50.985327162055800,-0.715753244588172
copperhead and jew lizard,1101004,GU29 0NT,50.992938772280000,-0.774720591176600
cayman and carpet snake,1101777,GU27 3AD,51.082544630536500,-0.718017608735995
anole and Coati,2636590,PO9 6FA,50.885962000000000,-0.970189000000000
Parrotbill and Rat,1804098,PO8 0FU,50.941795207800000,-0.994564142500000
cayman and mud turtle,515967,PO9 4EX,50.879205370611500,-0.996892069243489
terrapin and bandy-bandy,1100103,GU31 4DF,51.006257706264300,-0.917800588702357
Scimitar babbler and Thicketbird,1102122,GU27 2ET,51.096564662220500,-0.695308467141889
Tree warbler and death adder,1099242,GU32 3AQ,51.005108730442800,-0.942584516372436
Argus and Boto,516998,PO8 9LU,50.913671619746700,-1.003932477929360
Piping shrike and Mouse,1098643,GU33 7RB,51.056424757903000,-0.884085044513527
blind snake and Night heron,1100877,GU29 9PP,50.982995000000000,-0.744324000000000
moloch and Ground sloth,1099255,GU32 3BG,51.005815574887200,-0.949167611288857
Stint and Vole,1100744,GU29 9ET,50.989885925383000,-0.750536010786510
Chickadee and galliwasp,1100195,GU30 7BY,51.077390725547600,-0.789621859827533
bearded lizard and Shearwater,517881,PO7 7PP,50.882398884813800,-1.022467906529310
thorn lizard and Mole,1098192,GU34 3LT,51.096387878522800,-0.939218960900565
Songlark and puff adder,1100318,GU30 7ND,51.037104847227600,-0.789701753548452
king cobra and Zebra,1100869,GU29 9PD,50.985123997370600,-0.737542421405426
Thicketbird and gopher snake,1101737,GU27 2PF,51.089251184064700,-0.716204424031642
Coati and king cobra,1100977,GU29 0LB,50.967769902836600,-0.822095081841654
Zebra and Shearwater,1100646,GU29 9DJ,50.987847155031400,-0.738223691285377
Philippine hawk-owl and American sparrow,516839,PO8 9BE,50.898781579092300,-1.006255176652510
rat snake and Flameback,1101833,GU27 1HN,51.087839517842300,-0.727737686161818
Cloud rat and bull snake,516645,PO8 9SG,50.909965262009600,-1.022929075371380
mountain devil and death adder,1101788,GU27 3AW,51.080719000000000,-0.704791000000000
Chicken and brown snake,1102117,GU27 2EL,51.092340702957600,-0.662755000000000
Polecat and Cloud rat,1099102,GU33 6AN,51.073420755339100,-0.883162521907633
harlequin snake and lizard,516984,PO8 9LB,50.913576864492200,-0.996935000000000
garter snake and monitor,531977,PO18 9JH,50.897534387214600,-0.859915512460288
rock python and turtle,1098564,GU33 7PL,51.043119339509400,-0.861139178623098
Marmoset and American sparrow,517600,PO8 0FL,50.943372030324300,-1.010016488113520
Minke whale and Philippine hawk-owl,517818,PO7 8QD,50.887232000000000,-1.005735494667320
