name,postcode,lat,lon
turtle and moloch,BN27 1JB,50.875970630000000,0.259084812000000
monitor and Peafowl,BN27 1LH,50.875341550000000,0.250681781000000
White ibis and Cuscus,BN27 1NF,50.875482150000000,0.254114368000000
garter snake and Cuscus,BN27 1RQ,50.880603880000000,0.326752628000000
garter snake and caiman,BN27 1UJ,50.876755390000000,0.260359507000000
boa constrictor and cerastes,BN27 1UT,50.877395440000000,0.262298000000000
Buzzard and king cobra,BN27 3AT,50.878198370000000,0.248516482000000
Prion and Jackal,BN27 3BG,50.876354390000000,0.245726817000000
mountain devil and Hawk,BN27 3PS,50.878820000000000,0.221280000000000
moloch and Black jay,BN27 3YG,50.880104721314700,0.222293717474132
Kākāriki and glass snake,BN27 4AU,50.879851020000000,0.224229327000000
Ground sloth and Herring gull,BN27 4DT,50.886645030000000,0.240022514000000
adder and Boto,BN27 4DY,50.897590210000000,0.245653358000000
Gull and bearded dragon,BN27 4FJ,50.881070000000000,0.263127000000000
hoop snake and Francolin,BN27 4FU,50.887029000000000,0.317376000000000
Mamo and Perching duck,BN27 4JU,50.885844680000000,0.315582279000000
Partridge and Duck,BN27 4LF,50.889371060000000,0.325042422000000
Solitaire and Pheasant,BN27 4NS,50.891165470000000,0.319386948000000
harlequin snake and perentie,BN27 4QL,50.909991320000000,0.343355000000000
Badger and Dorcopsis,BN27 4SZ,50.886865710000000,0.337899257000000
elapid and terrapin,BN27 4UD,50.902807000000000,0.352964000000000
cycling lizard and Lemming,BN27 4UG,50.904458550000000,0.347272365000000
tokay and monitor,TN17 2RD,51.087212785215300,0.449806800245000
diamond python and Tattler,TN17 3AP,51.093228439957200,0.538774730527524
Chickadee and Pratincole,TN17 3AR,51.092958638532500,0.537531674382839
gopher snake and Philippine hawk-owl,TN17 3BJ,51.094224657565400,0.536801172069877
bandy-bandy and terrapin,TN17 3BU,51.094130461521700,0.534924991367652
Stilt and chameleon,TN17 3BX,51.090916954433900,0.536705801543697
Buzzard and coral snake,TN17 3DD,51.092167181537800,0.537531183235957
saltwater crocodile and Mamo,TN17 3DN,51.096009494429500,0.534127944740408
Herring gull and Marmoset,TN17 3EW,51.094954056513500,0.527628650920041
garter snake and skink,TN17 3HG,51.095848151854400,0.536893000000000
Eagle and black snake,TN17 3JE,51.097742651615900,0.540464731911991
diamondback terrapin and racer,TN17 3JQ,51.096759169645900,0.538841000000000
Tahr and Kākāriki,TN17 3ND,51.098140227262000,0.530430692136746
Thrasher and Thicketbird,TN17 3NJ,51.099784257371300,0.532177469540648
Shearwater and Moluccan boobook,TN17 3PU,51.083400189825700,0.508692596170776
Polecat and Hawaiian honeycreeper,TN17 4DR,51.068328372050300,0.584932135683611
leathery turtle and monitor,TN17 4DU,51.066265295259600,0.583461117631903
sidewinder and jew lizard,TN17 4HE,51.057045011385600,0.571701934519025
Coati and rock snake,TN17 4PG,51.054614312756400,0.616762164952172
Crow and Magpie,TN18 4BP,51.049051649051800,0.508305303070212
Jerboa and bushmaster,TN18 4DE,51.050266000000000,0.510026000000000
king cobra and boa constrictor,TN18 4DQ,51.050140202915900,0.510804132146905
Rabbit and Chipmunk,TN18 4DS,51.050128561481400,0.511345724782594
Stilt and Mouse,TN18 4EB,51.050768917901800,0.512935718083459
Zebra and Civet,TN18 4HT,51.045506606762000,0.513192000000000
Booted eagles and Magpie,TN18 4HW,51.049158075816000,0.514488000000000
Crow and Jay,TN18 4LH,51.046204398643100,0.510220278552873
cobra and goanna,TN18 4LT,51.042398706425000,0.507346642618463
Grouse and Hawaiian honeycreeper,TN18 4PD,51.041564839830600,0.506216000000000
Schneider python and Snipe,TN18 4QX,51.038647537932300,0.498984230556441
chameleon and River dolphin,TN18 4RJ,51.034463841274600,0.526231932419464
Wallaby and kabaragoya,TN18 4RS,51.036618253414000,0.503867712736596
habu and cobra,TN18 4XD,51.038202536212600,0.483582291149891
cayman and Darwin's finches,TN18 4XN,51.049594498486100,0.472291653378157
frill-necked lizard and gavial,TN18 5DH,51.049807481168300,0.535785315566074
bicycle lizard and puff adder,TN18 5DX,51.036507306480600,0.528226063028565
Myna and Jackal,TN18 5JP,51.025586222310300,0.567093336907980
leguaan and Dorcopsis,TN18 5NY,51.014159239719400,0.568115994204437
Masked owl and Grouse,TN19 7AB,51.006852000000000,0.434821000000000
chuckwalla and rattlesnake,TN19 7DP,50.986260846536300,0.388373532572537
Kangaroo and chameleon,TN19 7DS,50.989342144278400,0.379297697747452
Fulmarine petrel and smooth snake,TN19 7DX,50.996290631316100,0.389173634287465
goanna and Kestrel,TN19 7ES,50.997336362385800,0.385094129574318
Kite and chameleon,TN19 7NA,50.988055039970800,0.334787350140103
terrapin and Ice seal,TN19 7PB,51.014636019207700,0.451767753250752
Thrasher and Crow,TN19 7PE,51.017427031384500,0.459757365666955
slowworm and Peafowl,TN20 6AE,51.020061454376400,0.259451970397020
horned viper and Komodo dragon,TN20 6AT,51.020910903013900,0.255985441632915
Parrotbill and Ground sloth,TN20 6EL,51.019176232395300,0.249399153805399
Vole and Kestrel,TN20 6HS,51.006521000000000,0.219535884929273
perentie and Argus,TN20 6JE,50.999009000000000,0.218227056618677
Magpie and cayman,TN20 6NG,51.017579895026000,0.229459909311391
Lemming and Partridge,TN20 6PH,51.021593000000000,0.262179000000000
Old World warbler and water snake,TN20 6PX,51.037103873781600,0.289965425281284
leathery turtle and Argus,TN20 6RJ,51.019975377315600,0.286982347070740
cerastes and garter snake,TN20 6TT,51.020044767006400,0.263101519591910
brown snake and Philippine hawk-owl,TN20 6UN,51.026432119942800,0.275506144607260
Hawaiian honeycreeper and garter snake,TN21 0BH,50.941653872266800,0.236117506147577
king snake and kabaragoya,TN21 0BT,50.940883835610700,0.248766000000000
Shearwater and sand viper,TN21 0FT,50.933406000000000,0.241628000000000
blindworm and glass snake,TN21 0HE,50.934855000000000,0.251149000000000
Hawk and sidewinder,TN21 0HJ,50.934090153459400,0.247824097278582
Ground sloth and bushmaster,TN21 0JJ,50.925616134428100,0.235277140108840
terrapin and blind snake,TN21 0LA,50.905536275170000,0.228995262398085
habu and thorny devil,TN21 0LZ,50.933369163044500,0.244629683869279
rock snake and tiger snake,TN21 0NS,50.952277850968300,0.225165548272448
flying lizard and puff adder,TN21 0SS,50.972566509216000,0.217659728825569
cobra and pit viper,TN21 0UJ,50.981630657308100,0.219630379825589
Linsang and Parrotlet,TN21 0UY,50.969249777487700,0.238450000000000
grass snake and Vole,TN21 0XP,50.965272184475500,0.246850962882293
hognose snake and diamond snake,TN21 8EB,50.965740874695000,0.258452775411590
snake and Thrasher,TN21 8EZ,50.972161036718200,0.254334204509024
puff adder and Fish eagle,TN21 8HT,50.971552269011700,0.250458753565382
racer and Pitohui,TN21 8NN,50.973212065134500,0.255795345996029
Elephant and constrictor,TN21 8NP,50.974241314936600,0.254192788695752
Old World warbler and Chicken,TN21 8PP,50.972535142984900,0.255919232466123
Coati and gaboon viper,TN21 8QL,50.960288706233700,0.255297450261459
Logrunners and Jackal,TN21 8SB,50.978661688118100,0.283127921831975
diamondback turtle and Grackle,TN21 8SH,50.977124437073000,0.280331503364415
Mamo and Lemming,TN21 8SN,50.975588526602100,0.278845935191870
asp and Civet,TN21 8ST,50.976798902762800,0.282723126924595
Wader and sand viper,TN21 8UL,50.979364591237100,0.305487157920617
cayman and bearded lizard,TN21 9EB,50.929869509551700,0.258208885603612
Minke whale and rattlesnake,TN21 9EJ,50.937005323837500,0.266368954148598
Solitaire and Capuchin,TN21 9EP,50.937897942824300,0.268106213986027
garter snake and king cobra,TN21 9HN,50.924652642899500,0.261485264023717
chameleon and loggerhead,TN21 9JG,50.954709714693900,0.350288079132566
chameleon and puff adder,TN21 9JU,50.956790213198600,0.361286689588148
chuckwalla and Duck,TN21 9NB,50.945588000000000,0.344176000000000
chuckwalla and boa constrictor,TN21 9PA,50.939158000000000,0.340593000000000
soft-shelled turtle and Parrotbill,TN21 9PE,50.959832779868600,0.316710231812755
smooth snake and Asiatic leopard,TN21 9PP,50.950645398048200,0.306044608601209
indigo snake and gopher snake,TN21 9QH,50.944014299262600,0.314813229060089
Vulture and diamondback terrapin,TN21 9QJ,50.943032412989800,0.317611597348789
Pitohui and Kestrel,TN21 9QR,50.938931000000000,0.317237000000000
elapid and Ground sloth,TN3 8BA,51.099310915271000,0.340460336682281
boa constrictor and constrictor,TN3 8LE,51.095301318456100,0.378692283956501
cerastes and grass snake,TN3 9DS,51.096767267879500,0.271088227356457
harlequin snake and copperhead,TN3 9DU,51.097369313182600,0.270189335039627
agama and Partridge,TN3 9EJ,51.084818000000000,0.284382000000000
Songlark and cayman,TN3 9EL,51.083671531451900,0.289580318358065
Darwin's finches and Linsang,TN3 9JD,51.089672000000000,0.217274000000000
puff adder and cycling lizard,TN3 9JG,51.098612016822200,0.221900999585206
Chipmunk and Chickadee,TN31 6BX,50.945339701490600,0.611331053150536
rattlesnake and Mockingbird,TN31 6DS,50.950320193054300,0.599749522269840
Tahr and Jackal,TN31 6DT,50.950756094557500,0.597970000000000
wall lizard and Jerboa,TN31 6HR,50.980133000000000,0.593892000000000
Ice seal and Argus,TN31 6JD,50.970952827103300,0.607012907295990
whip snake and Coati,TN32 5DD,50.984520891847000,0.469002957906539
Tahr and habu,TN32 5DJ,50.984657541489100,0.468069788826090
adder and snapping turtle,TN32 5DQ,50.985650324157600,0.467481247962236
Tahr and Black cockatoo,TN32 5ET,50.988243271005200,0.444690734944230
Maya and Myna,TN32 5FH,50.967227000000000,0.377398000000000
Logrunners and Petrel,TN32 5JG,50.978729020467400,0.473240424024361
chameleon and thorny devil,TN32 5JW,50.955289000000000,0.501187808596166
Stilt and Songlark,TN32 5NB,50.986326000000000,0.498381000000000
bull snake and Guillemot,TN32 5QL,50.973429633979600,0.543245865377152
Fulmarine petrel and Myna,TN32 5RH,50.984257366216900,0.537098043924972
Warbler and leguaan,TN32 5RX,50.962189921842300,0.535254454379454
Vole and Ground sloth,TN32 5TE,50.992712194049800,0.557399000000000
diamondback terrapin and death adder,TN32 5TS,50.977385423525600,0.562652455011409
Recurvebill and Towhee,TN32 5UX,51.010752257111600,0.523474453319475
Treepie and Siskin,TN33 0AH,50.917272000000000,0.484386054711304
rock snake and Nukupuʻu,TN33 0DT,50.915144151697600,0.500954261578337
brown snake and Kite,TN33 0EN,50.917111035700600,0.484242019770230
Capuchin and whip snake,TN33 0FR,50.916323000000000,0.483561000000000
Viscacha and Fox,TN33 0FS,50.936822000000000,0.531213000000000
Vulture and Mamo,TN33 0HB,50.918769944091200,0.474740270908917
lizard and Grackle,TN33 0JA,50.916151279447100,0.470560602048580
garter snake and tokay,TN33 0LA,50.927253266844900,0.476770247715046
anole and thorn lizard,TN33 0LZ,50.921024000000000,0.500274000000000
glass snake and Guillemot,TN33 0QZ,50.931746636898200,0.533512783827278
Grackle and Myna,TN33 0RG,50.928923984023300,0.528050875292005
Hawaiian honeycreeper and carpet snake,TN33 0RH,50.925372705831800,0.533792541247111
Philippine hawk-owl and caiman,TN33 0RQ,50.934465995109600,0.535439807095558
sand lizard and Schneider python,TN33 0RT,50.920022000000000,0.559356000000000
Black cockatoo and king snake,TN33 0SL,50.894299960257200,0.519988701713484
smooth snake and hognose snake,TN33 0SR,50.901568435400500,0.480896895280309
green turtle and Puffleg,TN33 0TJ,50.907463316077700,0.516844641773174
Grosbeak and grass snake,TN33 0TQ,50.905862229915400,0.509332919229240
python and Pheasant,TN33 0TS,50.902680920914800,0.514225505506218
Gull and Old World quail,TN33 0UG,50.911917868985200,0.503768860895098
python and puff adder,TN33 3ET,50.915704000000000,0.485164000000000
goanna and Goose,TN33 9AG,50.888034982145900,0.496373417959012
Mink and Chicken,TN33 9BS,50.888001506325600,0.470478305089376
leguaan and Capuchin,TN33 9JA,50.886444452362000,0.430270624520299
mamba and Bronzewing pigeon,TN33 9JH,50.887250681097200,0.422207799735762
Linsang and Diving bird,TN33 9LJ,50.916385000000000,0.445888000000000
Maya and Old World warbler,TN33 9LR,50.911863000000000,0.432434000000000
Guillemot and Hawaiian honeycreeper,TN33 9ND,50.899768590440900,0.400968719639533
box turtle and Guillemot,TN33 9NJ,50.889387000000000,0.404231000000000
slowworm and Rabbit,TN33 9PA,50.917832258954300,0.384554399755856
White ibis and cayman,TN33 9PX,50.941870095873700,0.448563272722961
whip snake and Coati,TN33 9QJ,50.943387714928400,0.429891000000000
Boto and Pheasant,TN33 9QQ,50.944211210382200,0.432086712958742
Skunk and Buzzard,TN33 9QS,50.921414658956200,0.425447656851728
Cloud rat and Piping shrike,TN34 2FD,50.884346125199900,0.577931315469436
bandy-bandy and Tattler,TN34 2FJ,50.879863000000000,0.589925000000000
Chicken and Black jay,TN34 2FN,50.879283000000000,0.590546000000000
Puffleg and sea snake,TN34 2JS,50.876336541787400,0.583004987763889
hoop snake and grass snake,TN34 2NA,50.875805278506600,0.565504419331364
Armadillo and constrictor,TN35 4JT,50.875685687144600,0.608216224363906
bearded lizard and Songlark,TN35 4LX,50.917172118743500,0.620851604804440
Goose and turtle,TN35 4QJ,50.911040337160800,0.578227000000000
Zebra and Tree warbler,TN35 4QL,50.910145000000000,0.577884525849454
pit viper and bandy-bandy,TN35 4QU,50.909329792747200,0.577206412000566
carpet snake and amphisbaena,TN35 4QY,50.907496000000000,0.578030000000000
Komodo dragon and ringhals,TN35 4QZ,50.908603856765800,0.575459210822305
Stint and Lemming,TN35 4SD,50.908306125721400,0.570606040667859
king cobra and tiger snake,TN35 4SY,50.923433804962800,0.594208558971769
Viscacha and thorn lizard,TN35 5DB,50.876028313517500,0.610993248689132
Old World quail and Zebra,TN37 7HS,50.884106201180200,0.570851616178108
Ibex and Quetzal,TN37 7ND,50.891743146047100,0.557307593020385
crocodile and chuckwalla,TN37 7NF,50.895457965113300,0.567537470239870
Minke whale and Black cockatoo,TN37 7PB,50.887957000000000,0.553261000000000
Logrunners and Tit-tyrant,TN37 7PE,50.882837832476100,0.552014165873549
dugite and saltwater crocodile,TN37 7QZ,50.877414965114800,0.550338837629912
viper and gaboon viper,TN37 7RR,50.877673225529800,0.561541170335009
Logrunners and B,TN37 7SZ,50.880868433237600,0.560209417461650
Old World warbler and Cuscus,TN37 7TN,50.887189275072800,0.538075515994519
Francolin and Snipe,TN37 7TX,50.882425721886300,0.545764273930522
blue tongue and fer-de-lance,TN38 9NJ,50.882825944889000,0.543497022338098
turtle and Snipe,TN38 9NQ,50.881216935355600,0.542215117987150
Rabbit and cayman,TN38 9NY,50.880716000000000,0.535122000000000
Ground sloth and Pratincole,TN38 9QA,50.878471725074200,0.545193301919659
box turtle and Chickadee,TN38 9QH,50.877766041637900,0.543733210553367
dukite and Chicken,TN38 9QN,50.879591864907900,0.543320861946874
goanna and Bunting,TN38 9QP,50.880125299807200,0.543193528695333
frilled lizard and Thicketbird,TN38 9RP,50.880632000000000,0.538984000000000
Maya and Perching duck,TN38 9RT,50.877388264956300,0.531742615529890
kabaragoya and Skunk,TN5 6BA,51.060649914351300,0.341663780915564
snapping turtle and Darwin's finches,TN5 6DA,51.063932675482900,0.331767091104437
Gila monster and Tahr,TN5 6FJ,51.057915000000000,0.345221000000000
Perching duck and tortoise,TN5 6HQ,51.080400748694900,0.381682893139474
gecko and Hawk,TN5 6JH,51.058971000000000,0.307242000000000
Grouse and Fulmarine petrel,TN5 6JR,51.057828989196300,0.299850221035337
leguaan and Badger,TN5 6LT,51.054454640090500,0.344733162293539
Elephant and bearded lizard,TN5 6RW,51.068603593137700,0.329803637825467
constrictor and diamondback turtle,TN5 6UL,51.066897007550000,0.331045388992808
Gila monster and Bunting,TN5 7DB,51.047170076152200,0.418828919636190
Parakeet and perentie,TN5 7DG,51.048793417925100,0.421653043171622
Quetzal and Bronzewing pigeon,TN5 7DP,51.038061345509500,0.395159418282716
agamid and Capuchin,TN5 7EN,51.031810336767300,0.375353661273550
Peafowl and Partridge,TN5 7HB,51.044751008115700,0.417616000000000
racer and python,TN5 7HN,51.056098734010900,0.404995117664684
Old World warbler and boa,TN5 7HR,51.060828714281100,0.411577084188327
Lemming and Parrotbill,TN5 7HS,51.062117000000000,0.409845797931105
gaboon viper and crocodile,TN5 7HU,51.049561351477700,0.398378199731979
Thrasher and blindworm,TN5 7JB,51.041713076244900,0.391196340950439
Boto and amphisbaena,TN5 7NG,51.053105431752300,0.428827393609819
Triller and frilled lizard,TN5 7PH,51.055678539944800,0.446029645434541
rock python and Solitaire,TN6 3LP,51.045045363522900,0.219593326124303
agamid and Francolin,TN6 3LS,51.042868000000000,0.217899456179856
ringhals and rock python,TN6 3NN,51.048827570349900,0.241946640431799
rock python and Flameback,TN6 3PD,51.060459897881500,0.281256137142817
anole and amethystine python,TN6 3PG,51.072922000000000,0.255074000000000
Recurvebill and Vulture,TN6 3QF,51.031148109268100,0.233862113701903
indigo snake and New World blackbird,TN6 3QP,51.044174979617000,0.239753183420975
