name,postcode,lat,lon
rock python and diamond snake,BN27 1FQ,50.876693000000000,0.265758000000000
viper and king cobra,BN27 1GG,50.877313000000000,0.269925000000000
chameleon and Egret,BN27 1LY,50.877232280000000,0.251042983000000
mud turtle and Tattler,BN27 1PJ,50.879535930000000,0.278321265000000
Fish eagle and Moluccan boobook,BN27 1UH,50.876081740000000,0.261705781000000
Logrunners and soft-shelled turtle,BN27 1UP,50.878364410000000,0.261332977000000
Thicketbird and gavial,BN27 3BA,50.878588430000000,0.246943076000000
Fish eagle and Hawk,BN27 3XZ,50.883029170000000,0.174904891000000
B and habu,BN27 4AE,50.898434880000000,0.207508106000000
bearded dragon and turtle,BN27 4AW,50.891125170000000,0.183318000000000
horned viper and Tahr,BN27 4DQ,50.889462650128600,0.270188713926052
Stint and Boto,BN27 4DS,50.885649500000000,0.241282818000000
constrictor and bull snake,BN27 4DZ,50.899306770000000,0.248054178000000
tiger snake and Gull,BN27 4HJ,50.917436000000000,0.265930000000000
smooth snake and diamondback,BN27 4JJ,50.916730170000000,0.304196597000000
Gull and Chipmunk,BN27 4LJ,50.889231780000000,0.321367000000000
death adder and water snake,BN27 4NB,50.894263180000000,0.330324000000000
wall lizard and Vole,BN27 4NY,50.891658460000000,0.317207334000000
krait and New World blackbird,BN27 4PR,50.896623170000000,0.302663396000000
Boto and White ibis,BN27 4QH,50.900541770000000,0.329538634000000
American sparrow and boomslang,BN27 4RA,50.912236530000000,0.341987404000000
Black cockatoo and grass snake,BN27 4SZ,50.886865710000000,0.337899257000000
turtle and pit viper,BN27 4UB,50.905023200000000,0.346475768000000
terrapin and Goose,BN7 1AE,50.879395070000000,0.016171709000000
Old World warbler and deaf adder,BN7 1BY,50.877884340000000,-0.000042000000000
Prion and gavial,BN7 1WA,50.879395070000000,0.016171709000000
Marmoset and Magpie,BN7 2RN,50.878388100000000,0.020833554000000
Thrasher and amethystine python,BN7 2TB,50.881830000000000,-0.001934000000000
thorn lizard and adder,BN7 2TF,50.882716250000000,-0.003858465000000
Siskin and Triller,BN7 2TG,50.882596980000000,-0.002669361000000
Fulmarine petrel and Nukupuʻu,BN7 2UD,50.881873660000000,-0.003496415000000
Chicken and tiger snake,BN7 3AX,50.923482210000000,-0.044146896000000
Flameback and Asiatic leopard,BN7 3AY,50.921001650000000,-0.045318041000000
Linsang and krait,BN7 3DP,50.929334650000000,-0.059640737000000
massasauga and diamond snake,BN7 3QD,50.892588870000000,-0.011100818000000
frill-necked lizard and Thicketbird,BN7 9ED,50.879395070000000,0.016171709000000
Ice seal and Vole,BN7 9NJ,50.879363000000000,0.016227000000000
Mole and python,BN8 4AE,50.938311520000000,-0.023270279000000
Stint and Magpie,BN8 4DZ,50.966868230000000,-0.025020664000000
wall lizard and Pitohui,BN8 4EU,50.972782440000000,-0.024285475000000
wall lizard and Jerboa,BN8 4GD,50.981731000000000,-0.015699000000000
bull snake and viper,BN8 4GE,50.982038120000000,-0.015885743000000
Black cockatoo and massasauga,BN8 4HQ,50.972616420000000,-0.013438484000000
Recurvebill and Triller,BN8 4JR,50.981121760000000,-0.005909336000000
Viscacha and Badger,BN8 4LF,50.975349950000000,0.011806370000000
swift and Coati,BN8 4LX,50.976010000000000,0.019000000000000
Civet and giant tortoise,BN8 4PD,50.972317250000000,0.010350611000000
Greenbul and Black jay,BN8 4PJ,50.971926210000000,-0.002500094000000
Gila monster and crocodile,BN8 4PS,50.917438000000000,-0.011550000000000
bearded dragon and puff adder,BN8 4QD,50.925512220000000,-0.014165112000000
amethystine python and Ground sloth,BN8 4QL,50.946519560000000,-0.042311724000000
Bronzewing pigeon and gavial,BN8 4RH,50.962965570000000,0.005033662000000
cerastes and Treepie,BN8 4SW,50.903773000000000,-0.009202000000000
viper and carpet snake,BN8 5BG,50.923301740000000,0.020317484000000
Fish eagle and Black cockatoo,BN8 5DL,50.924660220000000,0.022368474000000
Logrunners and Masked owl,BN8 5EX,50.892981480000000,0.054498028000000
hawksbill and boa,BN8 5HF,50.891840340000000,0.056481215000000
python and alligator,BN8 5JU,50.895672640000000,0.056422504000000
monitor and snapping turtle,BN8 5JZ,50.895389430000000,0.053608554000000
taipan and Siskin,BN8 5NL,50.899259000000000,0.086518000000000
Piping shrike and Capuchin,BN8 5NR,50.898004710000000,0.072538649000000
Old World warbler and saltwater crocodile,BN8 6BS,50.902207600000000,0.133769754000000
Eagle and king cobra,BN8 6BW,50.898264240000000,0.133504147000000
gecko and chuckwalla,BN8 6EL,50.930525530000000,0.157423348000000
Duck and Old World warbler,BN8 6HF,50.916096830000000,0.199025018000000
Civet and horned viper,RH16 2QP,51.015213445189700,-0.042471128324696
leathery turtle and puff adder,RH17 7AY,51.039204000000000,-0.027704501033313
grass snake and rattlesnake,RH17 7DJ,51.061039162254700,-0.008171544456449
rock python and Minke whale,RH17 7EE,51.035808711164600,-0.030734532888228
Siskin and boomslang,RH17 7LG,51.047035570439100,0.026537000000000
gopher snake and water snake,RH17 7NN,50.996215334165300,-0.027252223905155
flying dragon and Elephant,RH18 5AH,51.096592489600300,0.031889611732128
cayman and lizard,RH18 5EA,51.095872188879400,0.040198789254375
Hawaiian honeycreeper and Macaw,RH18 5LX,51.092698970810000,0.049884554273767
sand lizard and puff adder,RH18 5NT,51.095477857502600,0.046294130429203
alligator and cycling lizard,RH19 4NZ,51.075474264469600,-0.042827020628757
Gull and Dolphin,RH19 4PB,51.079368206105300,-0.042819743371795
boa constrictor and Old World warbler,RH19 4PN,51.075877081130800,-0.050373000000000
caiman and Ice seal,RH19 4PZ,51.076648617016500,-0.046903243662549
tiger snake and terrapin,RH19 4QJ,51.078222918058200,-0.052861639838308
taipan and Linsang,TN19 7BZ,50.986626860375800,0.336083541632235
monitor and Darwin's finches,TN2 9PY,50.967907423168400,0.086473190623301
worm lizard and Vulture,TN2 9PZ,50.967907423168400,0.086473190623301
mud turtle and Armadillo,TN2 9RT,50.967907423168400,0.086473190623301
American sparrow and indigo snake,TN2 9WS,50.967859000000000,0.086469000000000
Greenbul and Tahr,TN20 6BD,51.017459669770600,0.263303575954063
Treepie and mountain devil,TN20 6BG,51.019061002373800,0.258633346019694
sand lizard and Cloud rat,TN20 6DE,51.019130080973900,0.260176668574134
Puffleg and Maya,TN20 6EJ,51.017206398793600,0.250344668555394
Logrunners and Cuscus,TN20 6ER,51.020901466578500,0.250880093928785
Stilt and Thrasher,TN20 6ET,51.024672329310600,0.250749037615742
Grouse and Skunk,TN20 6NH,51.015999230411700,0.227929778009998
hognose snake and Mamo,TN20 6TW,51.021840464312200,0.268821590356985
boa constrictor and bandy-bandy,TN20 6TX,51.021567541536800,0.270833142630948
Hawaiian honeycreeper and Guillemot,TN21 0AW,50.965234134721300,0.250694571862556
Peafowl and Tahr,TN21 0BT,50.940883835610700,0.248766000000000
Petrel and green turtle,TN21 0BY,50.945168987107600,0.247433168268184
Goose and Tree warbler,TN21 0DP,50.965176473753700,0.248085430365366
death adder and Chickadee,TN21 0EQ,50.933230417262800,0.242957789705783
Tattler and Crow,TN21 0FQ,50.970538000000000,0.244170000000000
frill-necked lizard and Jay,TN21 0FW,50.967576000000000,0.224572000000000
Scimitar babbler and Puffleg,TN21 0GH,50.932288000000000,0.240848000000000
moloch and cayman,TN21 0HA,50.937178222690600,0.247190167988899
Prion and Chickadee,TN21 0HJ,50.934090153459400,0.247824097278582
python and Gull,TN21 0NY,50.949192832712100,0.225174808823460
Black cockatoo and Siskin,TN21 0QU,50.953420222618800,0.202865352329587
bushmaster and tuatara,TN21 0TG,50.964873000000000,0.203678000000000
whip snake and mountain devil,TN21 0UG,50.982055000000000,0.237047000000000
Shearwater and bushmaster,TN21 0XU,50.968888632629600,0.247267636578869
deaf adder and bushmaster,TN21 8BY,50.960222231486400,0.252218204062872
Macaw and Viscacha,TN21 8DT,50.966229108267100,0.258319788384305
anole and Polecat,TN21 8EB,50.965740874695000,0.258452775411590
turtle and constrictor,TN21 8HR,50.965112807499400,0.259305337732962
Boto and Chickadee,TN21 8LX,50.973209000000000,0.252775000000000
taipan and bandy-bandy,TN21 8ND,50.972732230977900,0.251299258254365
Minke whale and Logrunners,TN21 8PU,50.980209470492100,0.267389655994171
bearded dragon and asp,TN21 8RJ,50.968136000000000,0.276459000000000
cobra and gecko,TN21 8RY,50.976771414656400,0.278604688353010
Tit-tyrant and puff adder,TN21 8UF,50.978138423368700,0.285509894881672
cobra de capello and Thicketbird,TN21 8UU,50.995197000000000,0.310787026181407
Crow and smooth snake,TN21 8YL,50.962722250253600,0.262464925243349
coral snake and Goose,TN21 9AL,50.959474505047500,0.273628468898281
puff adder and Diving bird,TN21 9DB,50.962253030126300,0.297547523615034
Quetzal and Maya,TN21 9HN,50.924652642899500,0.261485264023717
Eagle and Tit-tyrant,TN21 9QA,50.933054058903500,0.307835729456023
garter snake and Grackle,TN21 9RB,50.953813502068400,0.327232505190525
diamond snake and Logrunners,TN22 1AB,50.970711208512000,0.096071003137787
diamond python and American sparrow,TN22 1BA,50.969686000000000,0.091624000000000
Stilt and New World blackbird,TN22 1DL,50.976719733440600,0.097025362219614
massasauga and king cobra,TN22 1LY,50.978373000000000,0.110648000000000
Badger and Parrotlet,TN22 1NB,50.979103678472400,0.110965984539319
Bronzewing pigeon and Stint,TN22 1QX,50.971662854659000,0.097666453246778
viper and Prion,TN22 1TA,50.975914836339200,0.101276955528982
Grouse and amphisbaena,TN22 1TN,50.977004474285900,0.101197935866741
Parrotbill and Badger,TN22 1UH,50.977232841674700,0.105994827487219
rat snake and fer-de-lance,TN22 3AA,50.988449109169100,0.103424663622983
Viscacha and Old World vulture,TN22 3BP,51.019782390872400,0.092408825039777
River dolphin and Old World warbler,TN22 3NS,51.030513987280500,0.058862842201120
dugite and king cobra,TN22 3NT,51.029391945752300,0.062820654830732
Zebra and Jackal,TN22 3PD,51.030538074899900,0.049308343290628
Treepie and Goose,TN22 3QP,51.002661312811500,0.009809146041898
rat snake and Perching duck,TN22 3QY,50.998718000000000,0.011230749886252
elapid and Stint,TN22 3SR,50.992203000000000,0.033184000000000
tiger snake and Guillemot,TN22 3SU,50.995634271205400,0.035442822612025
sidewinder and Greenbul,TN22 3XU,50.995217571443700,0.060235906529130
blue racer and harlequin snake,TN22 4BY,51.024926000000000,0.112990000000000
Asiatic leopard and Argus,TN22 4DR,50.996749203666600,0.156246668928214
galliwasp and Tit-tyrant,TN22 4EB,51.000573836418100,0.182749404448383
king snake and constrictor,TN22 4ER,50.997439508851700,0.194032514881422
American sparrow and Kite,TN22 4HP,50.996334957904200,0.186270184740047
Civet and pit viper,TN22 4JQ,50.994456286716300,0.143029320629412
Condor and Chicken,TN22 4JW,50.992017924613900,0.145539059525682
lizard and Condor,TN22 4LG,50.988984386359600,0.135381794319957
gavial and leathery turtle,TN22 4LP,50.990993211132100,0.135203250624654
New World blackbird and saltwater crocodile,TN22 4PD,50.987378378984600,0.142047840420488
Solitaire and Ibex,TN22 4PR,50.982214140423700,0.138718436990345
Diving bird and Lemming,TN22 4PT,50.980774311120000,0.144650227155456
Old World vulture and Cuscus,TN22 4PX,50.980265770854700,0.154200639254218
Gull and anaconda,TN22 5AA,50.968473501456700,0.097480027818526
Fox and king snake,TN22 5BS,50.968197540421800,0.102822966570297
Grackle and Hawk,TN22 5DP,50.964503477318700,0.098696902370248
smooth snake and rat snake,TN22 5DY,50.965579690989800,0.101864451595071
sea snake and leguaan,TN22 5EZ,50.940799997735000,0.062669168438029
cobra de capello and Gull,TN22 5FD,50.989396299061500,0.132094745806671
Vulture and diamondback,TN22 5GA,50.959411001167800,0.108862799625994
Siskin and giant tortoise,TN22 5GH,50.959050453802000,0.111594000000000
cobra de capello and blind snake,TN22 5HG,50.966640625740100,0.176667000000000
bearded lizard and Myna,TN22 5HY,50.958649013362800,0.160320736864736
puff adder and harlequin snake,TN22 5JB,50.956963923134700,0.171648573547548
Pratincole and snapping turtle,TN22 5PA,50.963979373543000,0.130617511776079
Polecat and tortoise,TN22 5PL,50.964081000000000,0.133029000000000
Hawk and carpet snake,TN22 5QS,50.931407126884700,0.093691431929859
amphisbaena and blindworm,TN22 5SW,50.957659332932600,0.105195116688711
Solitaire and black snake,TN22 5TN,50.958098386150500,0.106282955906153
Bronzewing pigeon and frilled lizard,TN22 5XG,50.941408374770700,0.061284000000000
Zebra and Gull,TN22 9ED,50.967859000000000,0.086469000000000
constrictor and flying dragon,TN22 9GD,50.967859000000000,0.086469000000000
grass snake and swift,TN22 9GE,50.967859000000000,0.086469000000000
horned viper and Wader,TN3 9DG,51.097699541081100,0.272633647232636
amethystine python and Old World warbler,TN3 9EF,51.095414411237000,0.270821975560535
Mockingbird and horned viper,TN3 9HT,51.076934503945700,0.255397522338161
Fulmarine petrel and giant tortoise,TN3 9JA,51.082882078272100,0.229942662595383
Cuscus and Partridge,TN3 9LB,51.090222085383800,0.199977780454110
grass snake and horned toad,TN3 9LP,51.075840956097600,0.204777615138088
tortoise and agamid,TN3 9PL,51.096626974066500,0.187712000000000
Thrasher and glass snake,TN5 6AJ,51.062740988230100,0.337999000000000
hoop snake and rat snake,TN5 6BH,51.061747782109100,0.340882000000000
Pratincole and rat snake,TN5 6DN,51.061746896142700,0.341676327452874
Partridge and Jerboa,TN5 6DS,51.068524889335100,0.341390405407751
elapid and giant tortoise,TN5 6DU,51.069414295557600,0.338294894409108
wall lizard and milk snake,TN5 6EF,51.073449734218900,0.346507079115863
Booted eagles and swift,TN5 6EL,51.072161143187400,0.339734000000000
rattlesnake and milk snake,TN5 6FL,51.084600000000000,0.348812000000000
tortoise and Eagle,TN5 6HY,51.064205681906400,0.327726000000000
Greenbul and Puffleg,TN5 6JN,51.060239054032400,0.306705898331477
harlequin snake and Booted eagles,TN5 6JW,51.062394000000000,0.310153000000000
Egret and coral snake,TN5 6LS,51.056311594598300,0.344969689930441
agama and Francolin,TN5 6NY,51.050311000000000,0.311743714334236
boa constrictor and Logrunners,TN5 6PP,51.064966915272000,0.309124750896110
habu and moloch,TN5 6RN,51.069355179492400,0.329998407220296
smooth snake and Hawk,TN5 6TE,51.068721447419000,0.334263150985477
harlequin snake and grass snake,TN6 1AL,51.060761301902800,0.160832430241204
Mouse and American sparrow,TN6 1DQ,51.055811791986800,0.157105833075640
krait and Dolphin,TN6 1EL,51.051050732737300,0.164104469069149
Ice seal and Elephant,TN6 1JP,51.049889901977500,0.160921000000000
brown snake and B,TN6 1NH,51.047167143536100,0.159643229011561
Scimitar babbler and bicycle lizard,TN6 1NJ,51.047095307939300,0.160610065963406
Philippine hawk-owl and Komodo dragon,TN6 1NR,51.047413052336800,0.162394014892391
puff adder and Bronzewing pigeon,TN6 1NU,51.046190476884700,0.162850686964657
mountain devil and cycling lizard,TN6 1QR,51.053404980354900,0.150087657670542
Tree warbler and Grackle,TN6 1RP,51.062459274443600,0.159470023395703
blue tongue and Francolin,TN6 1SN,51.064289093008800,0.149978263660025
Argus and Asiatic leopard,TN6 1SR,51.065791379465900,0.159225465147973
crocodile and Wader,TN6 2AX,51.055080057862900,0.173781758748909
Mockingbird and king cobra,TN6 2BQ,51.056901303873700,0.176435730222412
Shearwater and Diving bird,TN6 2BX,51.056983356808500,0.180235507092414
tortoise and Triller,TN6 2EX,51.048855610868100,0.192124186284092
Fox and rock python,TN6 2FE,51.061229096749000,0.170530420318005
New World blackbird and asp,TN6 2GB,51.045274018003800,0.183485000000000
Gila monster and wall lizard,TN6 2JR,51.045646000000000,0.183512000000000
whip snake and Pratincole,TN6 2PT,51.048590274438500,0.176973479185820
Tit-tyrant and Jerboa,TN6 2PX,51.047884329159000,0.167538028481611
leathery turtle and water snake,TN6 2QE,51.060132366946100,0.162744047018227
frilled lizard and ringhals,TN6 2RD,51.059349309901900,0.163749343642582
Hawaiian honeycreeper and constrictor,TN6 2RP,51.058458151675800,0.164763835157623
ringhals and Fish eagle,TN6 3BS,51.043378512851900,0.165116423388169
tuatara and harlequin snake,TN6 3DA,51.041219188691000,0.171594000000000
Asiatic leopard and coral snake,TN6 3DD,51.041092102768200,0.170559096986414
massasauga and boomslang,TN6 3DE,51.041004909088500,0.169927340275316
smooth snake and Skunk,TN6 3DQ,51.040162151654100,0.166877999602302
lizard and Civet,TN6 3DY,51.045897896423200,0.190144086869421
skink and Crow,TN6 3EW,51.044023000000000,0.187511117216573
kabaragoya and dugite,TN6 3HD,51.069494973375900,0.186404728040541
Old World quail and Fulmarine petrel,TN6 3LE,51.046161119682200,0.216721900431038
constrictor and indigo snake,TN6 3PE,51.051934443595500,0.285831274652157
Darwin's finches and king snake,TN6 3PH,51.059951000000000,0.257876838800697
Viscacha and Tattler,TN6 3QL,51.041613720977500,0.249016544112245
iguana and leguaan,TN6 3QS,51.050732075167300,0.233605877621562
Ground sloth and Fulmarine petrel,TN6 3QX,51.052919859681900,0.233953734560958
whip snake and fer-de-lance,TN6 3SU,51.040426032890100,0.134465371349521
Peafowl and Wader,TN7 4AL,51.093951107514300,0.094912660414580
Lemming and Skunk,TN7 4AY,51.093785905489900,0.102174466568796
cycling lizard and whip snake,TN7 4DH,51.097710353604100,0.104923438214463
krait and Parrotbill,TN7 4EN,51.078089202975600,0.092268710323539
