name,postcode,lat,lon
Grouse and Komodo dragon,PO33 1AU,50.715147592708400,-1.143303743881550
Parakeet and bull snake,PO33 1BQ,50.719427304176700,-1.156754094329730
Songlark and bull snake,PO33 1BX,50.718635984732600,-1.149331363972910
Moluccan boobook and boa,PO33 1BZ,50.716889833268100,-1.150354517959180
Cuscus and gecko,PO33 1DA,50.717189112996100,-1.151935604055480
mamba and Tahr,PO33 1EH,50.721156372289100,-1.157091396900150
jew lizard and Chicken,PO33 1FA,50.715162000000000,-1.139269000000000
amphisbaena and copperhead,PO33 1FN,50.722774005177800,-1.150743981464490
flying dragon and Buzzard,PO33 1FY,50.698829000000000,-1.115876000000000
sidewinder and blind snake,PO33 1HA,50.720177615763600,-1.158539719613050
tokay and rat snake,PO33 1NJ,50.724845332370500,-1.142546096613970
Jerboa and Solitaire,PO33 1RA,50.722263866512300,-1.149846532964320
bull snake and Prion,PO33 1TX,50.697369000000000,-1.109491689361080
swift and Grosbeak,PO33 1UY,50.698099070762900,-1.115861856232470
blue racer and Marmoset,PO33 1XE,50.697416965089100,-1.114855214282250
lizard and White ibis,PO33 2TR,50.720328281694600,-1.161979379635670
Elephant and Ground sloth,PO33 2WF,50.717591374077500,-1.157806928799930
Treepie and Triller,PO33 9EQ,50.717594644900000,-1.157807011000000
Old World warbler and mountain devil,PO34 5AQ,50.720254120482400,-1.116592604681920
Kestrel and grass snake,PO34 5AW,50.724446612272200,-1.125482000000000
sidewinder and moloch,PO34 5AZ,50.718356748229100,-1.110692913064540
American sparrow and grass snake,PO34 5DB,50.709732000000000,-1.109312000000000
Ice seal and K훮k훮riki,PO34 5ED,50.712529363234200,-1.116610293613740
Macaw and Moluccan boobook,PO35 5AA,50.691111910500000,-1.090780000000000
Ground sloth and Chickadee,PO35 5AE,50.693104371209700,-1.089678627636980
glass snake and Civet,PO35 5NA,50.690596115423600,-1.090930519118240
Parakeet and Tree warbler,PO35 5NS,50.690646000000000,-1.099438000000000
Egret and galliwasp,PO35 5PN,50.674842079625200,-1.101580204699950
frilled lizard and Greenbul,PO35 5QN,50.681543918354900,-1.083362893364810
Viscacha and bull snake,PO35 5QU,50.683210149072700,-1.080258813750590
Thrasher and saltwater crocodile,PO35 5RA,50.684432721325300,-1.079060027312790
Myna and cobra,PO35 5RL,50.684053000000000,-1.080908000000000
Fulmarine petrel and Bronzewing pigeon,PO35 5TH,50.685768000000000,-1.071545000000000
Dolphin and mud turtle,PO35 5TW,50.684030000000000,-1.075699000000000
amethystine python and Mamo,PO35 5UW,50.685456550723300,-1.089189578666610
Cloud rat and amethystine python,PO35 5XA,50.687326364767000,-1.082216851131930
black snake and tokay,PO35 5XY,50.691556299446300,-1.082629848523140
Goose and gavial,PO36 0AQ,50.677022295503100,-1.142709861833960
tiger snake and fer-de-lance,PO36 0BD,50.682168751955600,-1.133316547463860
adder and mamba,PO36 0DA,50.677618193624300,-1.144255864415810
death adder and Buzzard,PO36 0ER,50.676824512829200,-1.147624551124520
Tahr and Quetzal,PO36 0HU,50.682900838152500,-1.145999940577610
sand viper and Elephant,PO36 8ES,50.654853419033600,-1.154854842367700
gecko and cerastes,PO36 8JA,50.654754035820700,-1.157275650649040
Myna and Stilt,PO36 9AG,50.660190779356900,-1.155480624745600
turtle and K훮k훮riki,PO36 9BW,50.656720371666900,-1.159334221206710
Stint and taipan,PO36 9DR,50.661419059485700,-1.161188682303120
Parrotlet and gopher snake,PO37 6HG,50.653495000000000,-1.157072000000000
