name,id,postcode,lat,lon
Warbler and Moluccan boobook,413858,SA17 5LR,51.788556117758600,-4.234341131061200
blind snake and Gull,409516,SA33 4JR,51.830332000000000,-4.507041000000000
garter snake and dugite,414059,SA17 4PR,51.743803780100400,-4.289699622679400
alligator and Tit-tyrant,409454,SA33 4BY,51.825878624566800,-4.492251866978350
Myna and Towhee,409248,SA33 4TT,51.759024205486100,-4.496928620137010
perentie and fer-de-lance,414240,SA16 0PL,51.688979970552700,-4.248010131275420
Old World vulture and Capuchin,409514,SA33 4JP,51.812898843868500,-4.510135794526790
Warbler and Nukupuʻu,1808194,SA17 4HJ,51.732786001000000,-4.227070473700000
Buzzard and amethystine python,413988,SA17 5YL,51.755404756164800,-4.337625561217990
Jay and green turtle,410085,SA31 3NF,51.848971794959100,-4.322783533525110
Francolin and Partridge,414914,SA15 4DR,51.685879240241300,-4.190347843886520
Marsh harrier and Stilt,414299,SA16 0UA,51.687173211783700,-4.275639000000000
Moluccan boobook and Marsh harrier,409163,SA33 4RZ,51.770732475103000,-4.463308074652650
adder and Viscacha,409421,SA33 5JY,51.772457732198800,-4.390676765822270
blue tongue and Meadowlark,413931,SA17 4HG,51.736338773650100,-4.229924054004710
Lemming and jew lizard,414424,SA17 4EY,51.712082132201800,-4.235302391958240
blue racer and mountain devil,413946,SA17 4LF,51.734003860458300,-4.297415985874300
Snipe and Goose,409603,SA33 4NE,51.817236000000000,-4.462043000000000
Marmoset and Old World vulture,2586641,SA17 4HZ,51.733872000000000,-4.225849000000000
ringhals and bicycle lizard,409511,SA33 4JE,51.779992369427600,-4.582380874163430
Capuchin and puff adder,409266,SA33 5AB,51.825798158126500,-4.341792318409540
Perching duck and leguaan,414562,SA15 4RS,51.712824239055000,-4.226059746868670
Recurvebill and Mink,409499,SA33 4HN,51.796926763883300,-4.558111865569220
bicycle lizard and milk snake,409165,SA33 4SB,51.770343670265800,-4.461692424225640
Prion and krait,413736,SA17 5HL,51.808039481524100,-4.251494447517830
Petrel and Songlark,410303,SA31 2LP,51.832781001714400,-4.289523749464610
diamond snake and mountain devil,409412,SA33 5JN,51.770357151328300,-4.395349068253290
giant tortoise and terrapin,414600,SA16 0HF,51.682371089710200,-4.257809209264350
Scimitar babbler and American sparrow,409729,SA31 3SA,51.846721855106300,-4.347321622336560
chuckwalla and thorny devil,414385,SA17 4AW,51.715576973609500,-4.239253312961700
Duck and wall lizard,414497,SA16 0BT,51.690746162201700,-4.253451279088750
turtle and Francolin,410309,SA31 2LW,51.835915818557300,-4.291555372223310
Condor and Grosbeak,414429,SA15 5UG,51.751090125735400,-4.208802294958450
leathery turtle and Dorcopsis,414144,SA16 0LQ,51.688478330813200,-4.273594516243000
Cloud rat and dukite,2592740,SA15 5UQ,51.744446000000000,-4.212976000000000
Masked owl and krait,414290,SA16 0TN,51.684929731119300,-4.271087402876360
Tree warbler and Duck,409664,SA32 8DU,51.811515434908300,-4.306435285377040
perentie and hognose snake,409281,SA33 5AX,51.815723266442900,-4.344650408606740
Coati and tiger snake,414604,SA16 0HL,51.683388756746000,-4.260536229433060
sea snake and blue tongue,414428,SA15 5UF,51.751207000000000,-4.212213000000000
iguana and puff adder,413923,SA17 5TD,51.769137892439900,-4.367657787021230
Warbler and taipan,409225,SA33 4SN,51.768301116063400,-4.464320702850760
Elephant and Wader,1808184,SA15 5SJ,51.758919508400000,-4.225603383700000
Hawk and Solitaire,413864,SA17 5NA,51.793610429373800,-4.261115440701590
Greenbul and tree snake,414386,SA17 4BE,51.718423413475500,-4.242304070731870
boa constrictor and frilled lizard,409135,SA33 4QD,51.775006620704000,-4.461902814408870
puff adder and Capuchin,413964,SA17 5UD,51.761282527550600,-4.353566142415770
Pitohui and boa,414897,SA15 4BH,51.687371733236300,-4.199983260508710
Black jay and Scimitar babbler,414027,SA17 4LS,51.753963325653200,-4.284272979822900
Grouse and sand viper,408938,SA33 5ND,51.835541000000000,-4.434075177411350
B and Nukupuʻu,414491,SA16 0BL,51.685375727207500,-4.249321662144800
elapid and rat snake,409307,SA33 5DJ,51.840155000000000,-4.371262000000000
perentie and adder,414207,SA17 5DS,51.793713556787400,-4.216047947897100
bearded lizard and perentie,414804,SA15 5PD,51.760520666934900,-4.200321496919290
River dolphin and perentie,414045,SA17 4NT,51.753253458115600,-4.277760445127220
Parakeet and Cuscus,414583,SA16 0EZ,51.703937880027700,-4.290666954542810
Booted eagles and blue tongue,410242,SA31 2EB,51.849258292632300,-4.294454913758320
mud turtle and habu,409484,SA33 4EQ,51.812324799498400,-4.496131931628390
Meadowlark and Partridge,414610,SA16 0HU,51.682679471706900,-4.270728816675280
Zebra and Thrasher,409277,SA33 5AS,51.803563305077000,-4.372072943066580
tiger snake and Kestrel,409391,SA33 5HF,51.787865000000000,-4.410429000000000
boomslang and crocodile,414715,SA15 5HP,51.778575000000000,-4.197634000000000
Tattler and python,414801,SA15 5NY,51.758860064152100,-4.202559275388390
Old World quail and Mamo,409242,SA33 4TJ,51.766488730779100,-4.464120487966900
snake and Ground sloth,414035,SA17 4ND,51.767282424677300,-4.286539924957470
loggerhead and indigo snake,413843,SA17 5JS,51.743224734064400,-4.336909591312890
Chipmunk and krait,414148,SA16 0LW,51.684346660393900,-4.249993994307450
Quetzal and diamondback turtle,414473,SA16 0AN,51.684667976003800,-4.255276016434430
hawksbill and puff adder,409448,SA33 4BR,51.822067490283200,-4.517480797794130
hawksbill and taipan,408997,SA34 0HW,51.822147236272200,-4.599739712427890
agamid and rat snake,414151,SA16 0NE,51.683536760804500,-4.243443723660170
gopher snake and diamondback,413874,SA17 5NS,51.784577000000000,-4.282833000000000
diamondback terrapin and alligator,414167,SA17 5AH,51.754502418186200,-4.290762590748560
king cobra and adder,409429,SA33 4AR,51.827157539063700,-4.519578950299760
amethystine python and puff adder,410308,SA31 2LU,51.833708588905600,-4.289454697111860
tree snake and Bronzewing pigeon,410094,SA31 3NW,51.842647855833700,-4.321978753617560
