name,postcode,lat,lon
Condor and Masked owl,NP15 1BQ,51.702632667988800,-2.904636980633270
fer-de-lance and cerastes,NP15 1BX,51.702757346827900,-2.898937945539570
Black cockatoo and monitor,NP15 1DQ,51.699236067744300,-2.905524229120220
rat snake and Diving bird,NP15 1DS,51.743619443692000,-2.828502720896260
agamid and Lemming,NP15 1JH,51.733250746584500,-2.896111086965600
gecko and rock snake,NP15 1LP,51.681015000000000,-2.865703000000000
sidewinder and turtle,NP15 1NS,51.648805753673900,-2.907496220453160
Boto and Old World warbler,NP15 1PN,51.665454158100500,-2.912629302558100
asp and Scimitar babbler,NP15 1QZ,51.707446000000000,-2.893792000000000
thorn lizard and dugite,NP15 1SL,51.706615000000000,-2.897828000000000
anole and puff adder,NP15 1TE,51.694596466662800,-2.904360951003440
harlequin snake and diamondback,NP15 1TF,51.695216334006400,-2.904431183990620
amphisbaena and Partridge,NP15 1TH,51.685032000000000,-2.915815000000000
Polecat and Eagle,NP15 1TZ,51.709222000000000,-2.894411989400000
agama and python,NP15 2AD,51.761651000000000,-2.856180000000000
Bronzewing pigeon and Booted eagles,NP15 2AF,51.775796000000000,-2.885851000000000
adder and snapping turtle,NP15 2DP,51.765140097570600,-2.853009370065760
fer-de-lance and bandy-bandy,NP15 2EB,51.764432067812400,-2.855169602199690
tiger snake and Mink,NP15 2LG,51.800833082450200,-2.848477000000000
Recurvebill and Lemming,NP15 2LZ,51.806113437566800,-2.909361844737850
Prion and amethystine python,NP15 2NB,51.799899481494400,-2.907048000000000
Grosbeak and kabaragoya,NP16 5BB,51.633850587911200,-2.686348000000000
Stint and goanna,NP16 5BW,51.632945881518900,-2.683039212181180
boomslang and elapid,NP16 5ED,51.639430000000000,-2.675276000000000
Puffleg and Pratincole,NP16 5EG,51.638432499180300,-2.684263234444570
Marsh harrier and glass snake,NP16 5JA,51.642221061027700,-2.677513666450970
krait and Jay,NP16 5JN,51.632045590581900,-2.675469288307630
worm lizard and hognose snake,NP16 5LA,51.635331000000000,-2.675068564696710
Civet and diamond snake,NP16 5LS,51.644515537041100,-2.681883520521400
Rabbit and Kangaroo,NP16 5PJ,51.639226824727200,-2.679087478817890
taipan and Asiatic leopard,NP16 5PN,51.637956586132500,-2.681062606519910
loggerhead and Mamo,NP16 5XQ,51.641792013071000,-2.675369000000000
racer and Triller,NP16 5XY,51.641271055961700,-2.675418543305870
cobra de capello and python,NP16 6AQ,51.639309943964800,-2.751052263239640
Maya and sidewinder,NP16 6EF,51.668171692935900,-2.701744873705450
Duck and Herring gull,NP16 6FD,51.707515000000000,-2.745240000000000
cycling lizard and Buzzard,NP16 6NS,51.706515876356100,-2.760153570271340
boa constrictor and rock python,NP16 6PH,51.686294000000000,-2.733545000000000
diamondback terrapin and Buzzard,NP16 6QD,51.730032427356500,-2.770538957104130
Rat and smooth snake,NP16 6QZ,51.736396010693700,-2.764000213208140
Eagle and Songlark,NP16 6UA,51.640163195944700,-2.755401607110810
terrapin and smooth snake,NP18 1GA,51.631556000000000,-2.977616000000000
Gull and caiman,NP18 1GE,51.629054691121900,-2.971132980792450
Peafowl and Flameback,NP18 1LQ,51.628719837649700,-2.951636349757720
boomslang and Rat,NP18 1PG,51.628406690996000,-2.967940742667070
anole and garter snake,NP25 3DN,51.813253089212400,-2.710771000000000
Parakeet and tortoise,NP25 3DQ,51.826502109178400,-2.717523972945330
milk snake and Dolphin,NP25 3EE,51.811476572800000,-2.716269861585770
Darwin's finches and Chipmunk,NP25 3EG,51.809568419302400,-2.719546719986000
Vole and Badger,NP25 3HE,51.817254240706800,-2.709455996945740
Grosbeak and soft-shelled turtle,NP25 3HR,51.825660211490300,-2.716741000000000
Pratincole and tiger snake,NP25 3JQ,51.806201169651200,-2.696693000000000
Myna and Condor,NP25 3LD,51.805465155723800,-2.699234369207020
Schneider python and Marsh harrier,NP25 3LZ,51.805818854767500,-2.706245124071040
rock snake and Stint,NP25 3NZ,51.814507101046100,-2.713228044608480
kabaragoya and leathery turtle,NP25 4AR,51.782208626731400,-2.700135806278720
chuckwalla and Macaw,NP25 4AU,51.787319000000000,-2.686065000000000
Ice seal and perentie,NP25 4BG,51.774684797394600,-2.805068000000000
Old World quail and Quetzal,NP25 4HX,51.798348641536600,-2.714930649614050
cobra and alligator,NP25 4PF,51.741896008050600,-2.729043568724120
Thicketbird and snake,NP25 4PX,51.734537170432700,-2.723871285721610
Siskin and tortoise,NP25 4PY,51.743241000000000,-2.747039000000000
Black cockatoo and diamondback turtle,NP25 4SB,51.776967482955500,-2.698503754831490
Wader and blue tongue,NP25 4SP,51.778681764663600,-2.697501091595040
puff adder and box turtle,NP25 5AL,51.807484468722300,-2.720688367539120
Marmoset and Argus,NP25 5BU,51.815185670095700,-2.731560732900870
Capuchin and Bronzewing pigeon,NP25 5FN,51.808898000000000,-2.725004000000000
Prion and Magpie,NP25 5HJ,51.817906000000000,-2.791985000000000
Mouse and bicycle lizard,NP25 5HR,51.832435000000000,-2.841308738645270
Mouse and Stilt,NP25 5HT,51.824347805907600,-2.785873821796600
Shearwater and Marmoset,NP25 5NG,51.837004613420300,-2.788967950482750
gaboon viper and White ibis,NP25 5TR,51.804339431208400,-2.724771615274160
Mamo and flying lizard,NP25 5WA,51.809170000000000,-2.739778000000000
glass snake and Komodo dragon,NP26 3BA,51.628920652917800,-2.838012106493950
Grackle and taipan,NP4 0AE,51.748180833253500,-2.993936938549500
bearded dragon and Treepie,NP4 0BX,51.683078726300000,-3.008841355300000
Old World quail and Elephant,NP4 0HA,51.722761526799800,-2.982246197947710
Logrunners and cobra de capello,NP4 0PL,51.688777681072400,-3.008316685975340
mud turtle and Wallaby,NP4 0PQ,51.693085270831300,-3.012420039349700
whip snake and hognose snake,NP4 0QS,51.695547203453400,-3.011577932868740
Fish eagle and Chickadee,NP4 0QY,51.696573320249500,-3.018734038687330
Macaw and glass snake,NP4 0TF,51.706369246749800,-2.963902226436260
Chipmunk and death adder,NP4 0YE,51.729800210283900,-2.971626000687130
Herring gull and cobra de capello,NP4 0YT,51.718072448876300,-3.001947523370140
blue racer and ringhals,NP4 4ZZ,51.701143000000000,-3.040137000000000
wall lizard and Pheasant,NP4 5BW,51.676866038613000,-3.029832910590080
Kākāriki and Thrasher,NP4 5DT,51.680660599162800,-3.022614724347610
deaf adder and Myna,NP4 5EJ,51.675808339792700,-3.021218248199650
coral snake and dukite,NP4 5EQ,51.675715180756700,-3.024687120036310
sea snake and Parakeet,NP4 5HG,51.687165611267100,-3.026262108797900
Duck and Viscacha,NP4 5HY,51.686247753755000,-3.025315541751600
New World blackbird and Petrel,NP4 5JB,51.688725485235900,-3.024735009838610
Minke whale and Crow,NP4 5LE,51.696776893137700,-3.029416792973850
Viscacha and Mamo,NP4 5LN,51.687784000000000,-3.029705000000000
flying lizard and harlequin snake,NP4 5SB,51.694724509504100,-3.036835926639790
White ibis and glass snake,NP4 5SH,51.694490605262000,-3.038885088006390
bearded dragon and giant tortoise,NP4 5SS,51.694931339793700,-3.029678745980620
horned viper and terrapin,NP4 5SX,51.682332130767000,-3.019614852442640
River dolphin and chameleon,NP4 5XB,51.688984431867600,-3.049377494884560
bicycle lizard and New World blackbird,NP4 5XZ,51.679836536915200,-3.039663307056030
puff adder and Warbler,NP4 5YL,51.678197790900000,-3.019088473400000
frilled lizard and Grouse,NP4 6AA,51.699211399378000,-3.042914561367890
tiger snake and tortoise,NP4 6BH,51.701393116628100,-3.054353081862620
adder and tortoise,NP4 6BY,51.704199890865800,-3.043116122915450
glass snake and Fulmarine petrel,NP4 6EW,51.700161267953600,-3.038204657072160
Diving bird and massasauga,NP4 6HL,51.704650000000000,-3.047236000000000
Old World quail and goanna,NP4 6LD,51.698711538333800,-3.045536555586710
Fish eagle and bandy-bandy,NP4 6LH,51.698401863697600,-3.046990848452890
Mamo and Tahr,NP4 6PT,51.711068189415500,-3.059325458211700
gavial and elapid,NP4 6PY,51.711429582667400,-3.060129962043640
green turtle and milk snake,NP4 6QZ,51.711139000000000,-3.063573573475150
bandy-bandy and gaboon viper,NP4 6SQ,51.712283231873000,-3.057197216494730
garter snake and terrapin,NP4 6SU,51.711500049366000,-3.054298662701820
Minke whale and harlequin snake,NP4 6TA,51.716221185776800,-3.059228761454550
Pitohui and Tattler,NP4 6TG,51.724583000000000,-3.057426000000000
Stilt and Chicken,NP4 6TH,51.725724103832500,-3.056352538947780
Gila monster and sand lizard,NP4 6XQ,51.704667602076600,-3.041071912936780
Dorcopsis and bushmaster,NP4 6XU,51.703110466457700,-3.041253229459460
galliwasp and Fish eagle,NP4 7AN,51.726070929065400,-3.062760109301720
deaf adder and worm lizard,NP4 7BA,51.722645109088600,-3.057786406401090
Jerboa and whip snake,NP4 7DG,51.724516746075100,-3.059625368514960
chuckwalla and elapid,NP4 7EU,51.728815578900000,-3.071121572400000
snapping turtle and horned toad,NP4 7HJ,51.728113483191400,-3.065573536693430
Macaw and bearded dragon,NP4 7JT,51.730332954837500,-3.067710839597230
Perching duck and leguaan,NP4 7LS,51.734615808459400,-3.063423989798600
blue tongue and Hawaiian honeycreeper,NP4 7PQ,51.731418846594900,-3.061987800360640
anaconda and Ice seal,NP4 7QD,51.738082946247400,-3.070746559758410
Towhee and agamid,NP4 7QL,51.737336564051900,-3.071742659417480
Parakeet and Tree warbler,NP4 7QT,51.735020395211100,-3.069370837776900
Myna and leathery turtle,NP4 7RG,51.734332345349500,-3.072076000000000
Wallaby and Ibex,NP4 7RU,51.751964408224100,-3.061977205865710
tree snake and massasauga,NP4 7SB,51.742295617651100,-3.067268705730130
cerastes and Flameback,NP4 7SD,51.740934646647600,-3.067627676579630
goanna and frill-necked lizard,NP4 7TH,51.720700436162800,-3.064038402128990
wall lizard and grass snake,NP4 7TY,51.719632121700000,-3.063550479300000
turtle and Polecat,NP4 8AF,51.701097241507400,-3.019631538199130
Herring gull and mud turtle,NP4 8BY,51.707263023730800,-3.034300516127770
elapid and Jerboa,NP4 8DD,51.706362146095300,-3.040604296143550
tokay and asp,NP4 8DE,51.704879364443500,-3.040512379371260
Ibex and pit viper,NP4 8HD,51.715247961562900,-3.049449862178790
blue tongue and dukite,NP4 8JD,51.715027281866800,-3.036837092381830
Songlark and Komodo dragon,NP4 8JL,51.713767144027900,-3.033927839062240
skink and alligator,NP4 8LQ,51.716574909043300,-3.055893202541740
Wallaby and bandy-bandy,NP4 8NS,51.712610540325100,-3.052790229213990
sand lizard and Chicken,NP4 8QE,51.732185000000000,-3.063961000000000
Parrotlet and Moluccan boobook,NP4 8QP,51.728386582756100,-3.056112000000000
Prion and Pitohui,NP4 8QQ,51.732112743917000,-3.061815823074420
Tree warbler and Darwin's finches,NP4 8XR,51.734096000000000,-3.056432000000000
Solitaire and krait,NP4 9AR,51.771580803138800,-3.083959862760790
cobra de capello and Thrasher,NP4 9BB,51.772423979200000,-3.082907971800000
cobra de capello and massasauga,NP4 9BG,51.770455481690700,-3.083135798576110
Linsang and Partridge,NP4 9HA,51.773658832303800,-3.083850231751580
king snake and gaboon viper,NP4 9HW,51.771073725470700,-3.074556318213800
racer and Chicken,NP4 9LW,51.770285384412900,-3.076204244343340
Pheasant and Lemming,NP4 9NA,51.772563784228100,-3.085592183720040
Bronzewing pigeon and flying lizard,NP4 9PA,51.777754212929200,-3.080455077302100
smooth snake and Grouse,NP4 9PB,51.777999059062900,-3.080229005275280
Thicketbird and Boto,NP4 9QS,51.779022312266800,-3.084326667063590
gecko and New World blackbird,NP44 1AG,51.660799712484300,-3.028630002088410
Prion and Skunk,NP44 1BZ,51.654415000000000,-3.022631000000000
Old World warbler and Fish eagle,NP44 1DT,51.659641131087100,-3.025394251448170
krait and Condor,NP44 1EF,51.662290182562900,-3.024760077002430
Meadowlark and Mamo,NP44 1FG,51.674325000000000,-3.023751000000000
New World blackbird and Macaw,NP44 1JR,51.660107655857100,-3.035756285651910
American sparrow and Marsh harrier,NP44 1LZ,51.657263299787200,-3.022767313757080
ringhals and Jerboa,NP44 1NJ,51.659294784620700,-3.023868432263140
turtle and Fox,NP44 1PH,51.659650719746000,-3.024295716766560
giant tortoise and thorny devil,NP44 1QB,51.656225081579400,-3.021182670787350
Old World warbler and Minke whale,NP44 1RF,51.664558410505500,-3.025519746807690
Shearwater and River dolphin,NP44 1RT,51.665126695989200,-3.027368874059670
jew lizard and Viscacha,NP44 1SR,51.665505648886700,-3.039479735888290
Dorcopsis and smooth snake,NP44 1TX,51.661675887200600,-3.018890768178860
cycling lizard and Goose,NP44 2AN,51.655559812594800,-3.002389452368710
Dorcopsis and Siskin,NP44 2EH,51.659201034119400,-3.008729734746830
green turtle and Komodo dragon,NP44 2HL,51.661634820378900,-3.003824746333290
iguana and blindworm,NP44 2LP,51.660995843764100,-3.008090090089940
Darwin's finches and hawksbill,NP44 2LW,51.664672555744000,-3.006089641652930
Grackle and New World blackbird,NP44 2NJ,51.664768961089000,-3.008477490159170
Skunk and Ibex,NP44 2NP,51.663840942776100,-3.009743692796180
New World blackbird and Magpie,NP44 2NT,51.663092011733100,-3.009004123006060
Songlark and gecko,NP44 2PE,51.663394231687900,-3.004167265835700
Siskin and krait,NP44 2QQ,51.665665954989100,-3.013948513021810
Macaw and Piping shrike,NP44 3BH,51.639015481213600,-3.011807631925790
terrapin and Thrasher,NP44 3BN,51.635365000000000,-3.003620000000000
Pratincole and Philippine hawk-owl,NP44 3DQ,51.656405234547700,-3.028357005798030
tiger snake and green turtle,NP44 3DZ,51.636740207656600,-3.014979322678980
Jackal and Pheasant,NP44 3EB,51.636585746190000,-3.016204115613140
thorn lizard and Cloud rat,NP44 3EW,51.654945000000000,-3.025881000000000
Grouse and kabaragoya,NP44 3LQ,51.645603497244100,-3.024571595971850
Greenbul and rattlesnake,NP44 3NG,51.646190405337000,-3.031478897991040
Bronzewing pigeon and pit viper,NP44 3QL,51.649629427923500,-3.018635040809270
American sparrow and Masked owl,NP44 3YS,51.642683000000000,-3.021399000000000
White ibis and puff adder,NP44 4DN,51.643168386966200,-3.041757949119080
Darwin's finches and Asiatic leopard,NP44 4EG,51.643593058013400,-3.046580255100540
tree snake and frilled lizard,NP44 4SL,51.650089829810300,-3.046036106196910
gecko and carpet snake,NP44 4SR,51.649319262546100,-3.046741064234570
Parakeet and boomslang,NP44 5BA,51.655070828886900,-3.034182000000000
frilled lizard and Linsang,NP44 5SL,51.665761136940600,-3.044126992811530
boa and Mouse,NP44 6HA,51.639757405562300,-3.059194314671370
Fish eagle and Stint,NP44 6JQ,51.643187822816200,-3.059678926587360
Maya and krait,NP44 6JZ,51.639737000000000,-3.060552000000000
anaconda and Capuchin,NP44 6UL,51.644615881970600,-3.052861742595150
caiman and rock snake,NP44 6UR,51.645491689515300,-3.053460146577810
grass snake and Quetzal,NP44 6UT,51.642055319700300,-3.054637782984590
perentie and brown snake,NP44 7DJ,51.642359000000000,-3.038921000000000
Quetzal and flying dragon,NP44 7DP,51.640423801042900,-3.040986929727270
Warbler and Dorcopsis,NP44 7HH,51.641393650996100,-3.025806216156550
Thicketbird and Parrotlet,NP44 7LF,51.642212805348600,-3.035940904181490
monitor and Quetzal,NP44 7PG,51.643205571779900,-3.023216849167270
death adder and harlequin snake,NP44 8RN,51.649393425818200,-3.005332092299240
Ice seal and agama,NP44 9DN,51.654418000000000,-3.022638000000000
Chipmunk and Capuchin,NP7 0EZ,51.827105000000000,-3.086300000000000
tuatara and skink,NP7 5AS,51.824001316801300,-3.019546408267030
White ibis and Diving bird,NP7 5BS,51.823870169774900,-3.023257947284160
boomslang and Gila monster,NP7 5DH,51.821786768258200,-3.023994222806090
massasauga and Moluccan boobook,NP7 5DW,51.822190033627300,-3.024148460829160
Petrel and cayman,NP7 5HF,51.819490259674400,-3.015092045248610
puff adder and Mink,NP7 5HS,51.816401373693200,-3.010438288206380
cerastes and Wader,NP7 5NH,51.821860334843900,-3.016552712175310
frilled lizard and alligator,NP7 5PJ,51.823154114937400,-3.015624212485610
tiger snake and amphisbaena,NP7 5SD,51.822397401989500,-3.017870640090960
Francolin and death adder,NP7 5SU,51.828276831723800,-3.013809476679810
mud turtle and habu,NP7 5TD,51.828116656818900,-3.012572433858130
agama and bicycle lizard,NP7 5UB,51.825646024960100,-3.019627082147050
jew lizard and habu,NP7 6AR,51.835191770637800,-3.014777557995820
diamond python and Maya,NP7 6BG,51.830315582303600,-3.014072944304570
soft-shelled turtle and bushmaster,NP7 6BS,51.832997107226500,-3.012783511848920
mud turtle and dugite,NP7 6DA,51.829987597670500,-3.013528641989370
snapping turtle and Francolin,NP7 6PD,51.830622671776800,-3.007636547842000
flying lizard and bandy-bandy,NP7 7AL,51.826504774122400,-3.031472632255610
Treepie and Capuchin,NP7 7AP,51.826503163296800,-3.030630979236540
Thicketbird and Thicketbird,NP7 7BD,51.830010000000000,-3.031756000000000
Stilt and perentie,NP7 7BL,51.831124402863400,-3.030663934574480
horned toad and racer,NP7 7BN,51.832992602437300,-3.029864858714920
python and chuckwalla,NP7 7ES,51.835931560964200,-3.064329330617040
amethystine python and Boto,NP7 7HT,51.840485000000000,-3.017364166752500
Mamo and smooth snake,NP7 7RU,51.825519275627800,-3.030042615990850
boomslang and Stint,NP7 8RL,51.842978911379900,-2.912659483191320
sidewinder and Nukupuʻu,NP7 8TA,51.834879494802300,-2.899508000000000
Jerboa and Greenbul,NP7 8TD,51.833635194863800,-2.876261136703980
whip snake and Asiatic leopard,NP7 8UD,51.845790494920300,-2.898998080972480
chuckwalla and lizard,NP7 9ET,51.766351100557000,-3.043867385162090
Marmoset and pit viper,NP7 9EU,51.766159953049600,-2.996491068027240
mountain devil and chuckwalla,NP7 9FE,51.812206654072800,-3.030480000000000
Chickadee and Pratincole,NP7 9FL,51.812254000000000,-3.029493000000000
Tit-tyrant and Buzzard,NP7 9HA,51.768388000000000,-3.000018000000000
bicycle lizard and Cloud rat,NP7 9JJ,51.812213238174800,-3.011272977708230
Komodo dragon and Hawaiian honeycreeper,NP7 9NN,51.814310000000000,-3.032920000000000
agama and rock python,NP7 9PY,51.818363253168900,-3.067223042628250
frilled lizard and Fulmarine petrel,NP7 9RZ,51.815166000000000,-3.072892000000000
Shearwater and Diving bird,NP7 9SJ,51.814184063399100,-3.010026014478970
River dolphin and Booted eagles,NP7 9SS,51.804495542257900,-3.004298065581730
Masked owl and Logrunners,NP7 9TL,51.817944000000000,-2.969520624008820
boomslang and jew lizard,NP7 9UF,51.799455343652400,-2.927210112968850
grass snake and Francolin,NP7 9UT,51.800623011013600,-2.948769867125540
Pheasant and Moluccan boobook,NP7 9YB,51.813921902073700,-3.032955042351220
