name,postcode,lat,lon
chameleon and Darwin's finches,BS35 1PT,51.633145054604000,-2.564333410594120
Logrunners and Capuchin,GL12 8BS,51.637310000000000,-2.447299000000000
boomslang and Kākāriki,GL12 8DL,51.645544000000000,-2.454765000000000
leathery turtle and Chickadee,GL12 8DN,51.640786961576600,-2.454731881544580
New World blackbird and cobra de capello,GL12 8EQ,51.628870000000000,-2.404826000000000
hawksbill and Zebra,GL12 8JA,51.631733518925000,-2.402830992113480
gecko and Siskin,GL12 8LH,51.626524252264500,-2.411553714651840
Old World vulture and Tit-tyrant,GL13 9AR,51.696146633961400,-2.461537189992680
Chipmunk and Grosbeak,GL13 9BY,51.690800873333000,-2.462799263221690
cerastes and Black jay,GL13 9DL,51.649133827137700,-2.476654654581750
Elephant and Quetzal,GL13 9DZ,51.644907559419500,-2.510934179967550
Dolphin and Argus,GL13 9EX,51.691109364696600,-2.426447239279790
Pratincole and Stilt,GL13 9GA,51.713236491848200,-2.472523535142760
carpet snake and Myna,GL13 9HB,51.698805336599100,-2.403701562305240
tokay and mountain devil,GL13 9HP,51.734391028380500,-2.446331204782030
leathery turtle and Bronzewing pigeon,GL13 9LA,51.652315369119300,-2.458952373831120
frilled lizard and snapping turtle,GL13 9LD,51.657057886259300,-2.460200152512460
wall lizard and Logrunners,GL13 9RN,51.705443217709700,-2.459330881055190
taipan and Old World warbler,GL13 9RS,51.708749643578500,-2.459726000000000
Triller and goanna,GL13 9SQ,51.718231938066400,-2.458505132062680
diamond python and mamba,GL14 1AE,51.801194088168200,-2.451283534285570
Mockingbird and Kangaroo,GL14 1HH,51.807403581132700,-2.463688520970710
Pratincole and frill-necked lizard,GL14 1HQ,51.808504323508300,-2.453488724020670
Magpie and Peafowl,GL14 1JT,51.827016943792600,-2.453471568702790
anaconda and Bronzewing pigeon,GL14 1PQ,51.826088701530000,-2.404810097108580
kabaragoya and chuckwalla,GL14 1PU,51.825290607948500,-2.414524484134560
Rat and Tit-tyrant,GL14 2BU,51.827018407238700,-2.488992926992920
constrictor and Gull,GL14 2DE,51.823388834714400,-2.490477073304730
garter snake and wall lizard,GL14 2DG,51.820715282617800,-2.497658670346010
Mole and Magpie,GL14 2DJ,51.819950852747200,-2.495575586211800
Civet and Tahr,GL14 2DL,51.819585286314000,-2.496978847181290
ringhals and box turtle,GL14 2DN,51.819864197352600,-2.498446000000000
Shearwater and Skunk,GL14 2EB,51.817762471245300,-2.500658167842540
Solitaire and snake,GL14 2GJ,51.821049507570700,-2.509037292409700
krait and Capuchin,GL14 2LB,51.826222569052000,-2.504974446134020
amethystine python and alligator,GL14 2PL,51.824667408357900,-2.498587328146800
horned toad and rattlesnake,GL14 2RQ,51.824410859288800,-2.491184635744480
Fox and sidewinder,GL14 2SH,51.823991449447800,-2.498971615492150
crocodile and Tree warbler,GL14 2ST,51.825690492346600,-2.499528000000000
flying dragon and B,GL14 2TU,51.811230211308700,-2.486805718233620
tree snake and Tattler,GL14 2UF,51.783097287266600,-2.486763637346860
Parakeet and python,GL14 2YE,51.834275751238300,-2.513917314208780
White ibis and thorn lizard,GL14 3BS,51.814910706894500,-2.496796837798060
Mink and thorn lizard,GL14 3EJ,51.805227270544600,-2.505247317155040
Cloud rat and Chicken,GL14 3FA,51.811800000000000,-2.505495000000000
cobra de capello and mud turtle,GL14 3GB,51.813441692233600,-2.498869851102830
alligator and Songlark,GL14 3HB,51.810977450190700,-2.508154000000000
Herring gull and ringhals,GL14 3HJ,51.809543272363800,-2.507398000000000
bandy-bandy and Gila monster,GL14 3JD,51.839004356704500,-2.512011755562900
White ibis and box turtle,GL14 3NL,51.819082000000000,-2.477853705525090
Greenbul and Ibex,GL14 9BR,51.823068000000000,-2.498121000000000
leathery turtle and indigo snake,GL14 9EE,51.823068000000000,-2.498121000000000
rat snake and Komodo dragon,GL14 9FR,51.823068000000000,-2.498121000000000
Shearwater and Armadillo,GL14 9FS,51.823068000000000,-2.498121000000000
New World blackbird and Wallaby,GL14 9FY,51.823068000000000,-2.498121000000000
tuatara and giant tortoise,GL14 9GJ,51.823068000000000,-2.498121000000000
tiger snake and Rat,GL14 9HR,51.823068000000000,-2.498121000000000
saltwater crocodile and Magpie,GL15 4BT,51.762273349619700,-2.491539000000000
Schneider python and bearded dragon,GL15 4DR,51.761075972405700,-2.476297287408860
Petrel and anole,GL15 4ED,51.759117000000000,-2.476364000000000
Ground sloth and soft-shelled turtle,GL15 4EU,51.740265569511500,-2.521886667861280
Tahr and Greenbul,GL15 4JR,51.773246283788100,-2.560674001147440
Tahr and Chipmunk,GL15 4LN,51.745077040287500,-2.496725309203630
gavial and Pheasant,GL15 4PJ,51.753117700919200,-2.556339351880940
thorny devil and constrictor,GL15 4QB,51.754573806930200,-2.542985599547430
Capuchin and rattlesnake,GL15 4QY,51.757099750449800,-2.539205573747620
worm lizard and krait,GL15 4RB,51.756223447019700,-2.538152018501450
python and Duck,GL15 4SX,51.754646000000000,-2.545217000000000
blue racer and Peafowl,GL15 4TY,51.754865478461500,-2.532297507963270
slowworm and New World blackbird,GL15 5AE,51.728946597997200,-2.523696422280260
sidewinder and Lemming,GL15 5AN,51.727128632046400,-2.522068304895420
black snake and blindworm,GL15 5DG,51.724498282248200,-2.533171218115240
Asiatic leopard and diamond python,GL15 5DQ,51.723567962095400,-2.534101290300320
Tree warbler and Thrasher,GL15 5DU,51.723268226381900,-2.538701490048600
puff adder and iguana,GL15 5EW,51.715061000000000,-2.532610086281290
worm lizard and Grackle,GL15 5FF,51.731688539976200,-2.519731693150630
caiman and sea snake,GL15 5HD,51.725744573718800,-2.533938739003520
Flameback and constrictor,GL15 5HZ,51.724639753205500,-2.539600931680540
cobra and Grouse,GL15 5JG,51.729009640056100,-2.539566113638420
green turtle and soft-shelled turtle,GL15 5JW,51.733324999980600,-2.545496552970780
soft-shelled turtle and Linsang,GL15 5LA,51.726493368325400,-2.531399405658700
Tree warbler and Polecat,GL15 5LL,51.731427415144100,-2.529879000860050
Diving bird and Armadillo,GL15 5LR,51.733796673170400,-2.528864124670660
Capuchin and death adder,GL15 5QP,51.722173000000000,-2.522619000000000
blue racer and bearded dragon,GL15 5QR,51.722167712121000,-2.525601382138510
Diving bird and boa,GL15 5RS,51.725142569955400,-2.529877875027050
Kestrel and coral snake,GL15 5SH,51.734939472289900,-2.528660257441340
viper and Ibex,GL15 5SU,51.742483398573700,-2.524577157358850
Duck and rattlesnake,GL15 5TG,51.720860830433100,-2.534272047476920
hognose snake and Philippine hawk-owl,GL15 5TH,51.719727602911300,-2.534345541323590
diamond python and Marmoset,GL15 5TJ,51.719803575425800,-2.535432140371470
Grackle and Mouse,GL15 6AB,51.699249748052500,-2.579712000000000
mud turtle and frill-necked lizard,GL15 6BD,51.706970959073200,-2.577625502350110
bull snake and Prion,GL15 6DN,51.710184000000000,-2.554929000000000
ringhals and garter snake,GL15 6HB,51.746262343180300,-2.579502745132080
Ground sloth and Cuscus,GL15 6JB,51.754263209196500,-2.577939175669820
Hawk and Mamo,GL15 6LL,51.753458120559200,-2.571583666617310
blindworm and mamba,GL15 6NB,51.749286398173100,-2.571545471031580
gopher snake and Kite,GL15 6NY,51.709911492823900,-2.602599806059880
horned viper and Wader,GL15 6NZ,51.705533790321000,-2.602396901607490
tuatara and Buzzard,GL15 6RE,51.749259000000000,-2.566287000000000
Perching duck and python,GL15 6RZ,51.771826000000000,-2.638494976757390
Triller and anaconda,GL15 6SN,51.728017000000000,-2.660292000000000
bandy-bandy and slowworm,GL15 6XN,51.746682000000000,-2.573120000000000
Rabbit and adder,GL16 7EJ,51.802432000000000,-2.551363000000000
Peafowl and milk snake,GL16 7EP,51.816490178000700,-2.590732594694750
White ibis and Maya,GL16 7EY,51.816349622946400,-2.593646661386380
rat snake and constrictor,GL16 7FD,51.795276000000000,-2.597053000000000
anole and lizard,GL16 7FG,51.792143000000000,-2.607714000000000
Puffleg and blind snake,GL16 7GA,51.797417885493800,-2.598270216521330
B and swift,GL16 7HJ,51.792013614943000,-2.601910466971450
Stilt and massasauga,GL16 7LB,51.781212524351500,-2.605681000000000
Masked owl and Pitohui,GL16 7NZ,51.838247000000000,-2.632702000000000
adder and Marsh harrier,GL16 7PT,51.781667823046200,-2.603077351814670
soft-shelled turtle and River dolphin,GL16 7QP,51.807887660494400,-2.611448229872790
indigo snake and Mink,GL16 7RZ,51.793197763221300,-2.602433722881440
Fox and krait,GL16 8AQ,51.793108079643400,-2.617976039462580
gopher snake and rock python,GL16 8BD,51.793264936990100,-2.615498752840980
wall lizard and garter snake,GL16 8BL,51.794873434617900,-2.613954647927400
blue tongue and habu,GL16 8BT,51.795088385243400,-2.612391548577700
frill-necked lizard and Bunting,GL16 8DN,51.794091158032600,-2.619105971964010
skink and Thicketbird,GL16 8FF,51.789055000000000,-2.617053000000000
Asiatic leopard and rattlesnake,GL16 8HQ,51.791518363218100,-2.617649823065070
Elephant and Vole,GL16 8LH,51.767073000000000,-2.609047909900540
Solitaire and Grouse,GL16 8NR,51.790930065695900,-2.640216506111180
Grosbeak and Mamo,GL16 8NS,51.800382495151500,-2.633070482187410
Scimitar babbler and anaconda,GL16 8NW,51.783035644286800,-2.650078190311420
Parrotlet and Stint,GL16 8NZ,51.811932482107600,-2.656673430541770
Old World quail and Diving bird,GL16 8PN,51.786243920196300,-2.611851302326520
Jackal and Parrotlet,GL16 8QH,51.806579980708700,-2.622482478879450
Songlark and Philippine hawk-owl,GL16 8QX,51.810556450320800,-2.622029601584730
Guillemot and copperhead,GL16 8RJ,51.789667068025700,-2.615768723851980
smooth snake and hoop snake,GL16 8RQ,51.790434069540000,-2.615242721660310
Old World vulture and jew lizard,GL16 9SA,51.792044303845400,-2.618512463921110
Fulmarine petrel and dugite,GL16 9SB,51.792044303845400,-2.618512463921110
Capuchin and Egret,GL16 9SX,51.792044303845400,-2.618512463921110
thorny devil and grass snake,GL17 1AS,51.823065604219000,-2.498047618550480
pit viper and Tree warbler,GL17 1DF,51.823065604219000,-2.498047618550480
Diving bird and Ibex,GL17 9JH,51.847857667407400,-2.516772237285210
blindworm and grass snake,GL17 9JW,51.845849000000000,-2.517959334978150
mud turtle and perentie,GL17 9NU,51.849051249498700,-2.582637198566330
mud turtle and sand lizard,GL17 9QJ,51.829601214913900,-2.577655415931790
Grackle and frilled lizard,GL17 9QL,51.835725488833200,-2.581028312218020
Gull and Parrotbill,GL17 9QZ,51.845884046872800,-2.578546000000000
Chipmunk and boa,GL17 9SA,51.841191638825400,-2.582927593794590
Mole and cycling lizard,GL17 9SE,51.839329560524600,-2.579478143792840
Thrasher and Francolin,GL17 9UG,51.841598065853600,-2.556573436355420
Minke whale and bicycle lizard,NP16 5AQ,51.629671064503700,-2.677167697678060
bearded dragon and Triller,NP16 5BJ,51.636723069932400,-2.685985908223950
Minke whale and constrictor,NP16 5DA,51.640587000000000,-2.677450747183840
Badger and puff adder,NP16 5HL,51.643428266684200,-2.670840486816630
Wader and gopher snake,NP16 5HT,51.642125392395400,-2.673827138760070
Warbler and Tattler,NP16 5JG,51.634394479260700,-2.676660106869280
pit viper and Philippine hawk-owl,NP16 5LD,51.634575532151700,-2.674885577842840
Night heron and B,NP16 5NA,51.645585967648500,-2.687969628350980
blue tongue and diamond python,NP16 5NE,51.643088079334000,-2.686139799697850
mamba and Grosbeak,NP16 5NF,51.642655488785800,-2.681682189758260
Parrotbill and tortoise,NP16 5NQ,51.625322585761200,-2.675022704618420
Badger and frill-necked lizard,NP16 5NY,51.626073443400700,-2.669515375003600
Komodo dragon and Parrotbill,NP16 5QY,51.636361388946800,-2.681703382298230
bushmaster and Jerboa,NP16 5SA,51.642183827761300,-2.685475832868600
perentie and carpet snake,NP16 6BE,51.644458580934900,-2.690091473693560
adder and Stilt,NP16 6BQ,51.650566293044300,-2.700287649788880
horned toad and Mamo,NP16 6BX,51.657830453980300,-2.749927305932290
racer and Duck,NP16 6BZ,51.662654000000000,-2.743819000000000
death adder and blindworm,NP16 6JS,51.627910878811300,-2.696774774644190
Herring gull and Prion,NP16 6LA,51.630149000000000,-2.695620776436180
elapid and blue racer,NP16 6NB,51.688107315434600,-2.749472915018370
Chipmunk and Jerboa,NP16 6PB,51.689102000000000,-2.751601000000000
caiman and hoop snake,NP16 6PU,51.681327367280200,-2.762118103861510
Guillemot and Old World warbler,NP16 6QS,51.727156000000000,-2.763714000000000
Macaw and Meadowlark,NP16 6RA,51.629186823622200,-2.799861498846550
Darwin's finches and Maya,NP16 6TS,51.698737276577000,-2.705574654529610
Pratincole and Hawaiian honeycreeper,NP16 6TU,51.699127387896800,-2.701992275944000
Siskin and Hawk,NP16 6UE,51.629844607251500,-2.698191370559030
Ice seal and python,NP16 7AZ,51.638388000000000,-2.657734470348910
racer and Grouse,NP16 7BD,51.637370324239000,-2.657731744092980
Puffleg and caiman,NP16 7BJ,51.653870000000000,-2.665791000000000
Kangaroo and Pratincole,NP16 7BX,51.651166127551000,-2.664984000000000
Mamo and bandy-bandy,NP16 7DS,51.639603749737900,-2.661896929722970
moloch and indigo snake,NP16 7EG,51.645620441915600,-2.666407035252260
Perching duck and milk snake,NP16 7HB,51.632992219670700,-2.654388592002720
jew lizard and puff adder,NP16 7HZ,51.659644604035900,-2.662058874876830
rat snake and whip snake,NP16 7JJ,51.672960070492800,-2.641342000000000
Mole and indigo snake,NP16 7JU,51.647978680071700,-2.661195103168670
Siskin and loggerhead,NP16 7LA,51.646723857752900,-2.674719147681320
water snake and Chipmunk,NP16 7LB,51.646385303188000,-2.675740263985520
milk snake and Grosbeak,NP16 7LT,51.685053000000000,-2.607535000000000
mountain devil and grass snake,NP16 7PX,51.657181000000000,-2.662225000000000
chuckwalla and diamondback terrapin,NP16 7WZ,51.640736819086300,-2.672939493146550
gopher snake and alligator,NP16 9AX,51.640742436000000,-2.672939914600000
saltwater crocodile and diamond snake,NP25 3AX,51.817986328051900,-2.716242548108180
Gila monster and Lemming,NP25 3DG,51.811246982808900,-2.714104910479740
lizard and Triller,NP25 3DQ,51.826502109178400,-2.717523972945330
racer and bandy-bandy,NP25 3EN,51.810552400216000,-2.717430128386590
viper and alligator,NP25 3GB,51.826487687527600,-2.712503168662870
Bronzewing pigeon and swift,NP25 3GE,51.827822133925100,-2.713365856089640
bearded dragon and milk snake,NP25 3HD,51.826586328546900,-2.714028313696830
Grouse and Dolphin,NP25 3JH,51.804785687620700,-2.694031653318840
Lemming and blue tongue,NP25 3JZ,51.807411998571200,-2.701454637919500
tiger snake and Warbler,NP25 3LY,51.808921000000000,-2.706521593287210
Komodo dragon and Asiatic leopard,NP25 3NE,51.806088841444600,-2.703203552435040
Lemming and Wallaby,NP25 3NW,51.821949000000000,-2.716828000000000
indigo snake and Old World vulture,NP25 3NZ,51.814507101046100,-2.713228044608480
Night heron and Rabbit,NP25 3SU,51.843870571256500,-2.684747453409310
Masked owl and diamondback,NP25 4AQ,51.766721108297200,-2.708416885854720
frilled lizard and Fish eagle,NP25 4AR,51.782208626731400,-2.700135806278720
fer-de-lance and Rat,NP25 4JH,51.787658000000000,-2.753993000000000
Bunting and rat snake,NP25 4JS,51.770621000000000,-2.736753000000000
Egret and Herring gull,NP25 4QB,51.742078000000000,-2.711333000000000
mountain devil and Parrotlet,NP25 4QF,51.725571285836900,-2.718269818878680
Shearwater and bicycle lizard,NP25 4RX,51.769997783903100,-2.686555999931750
Night heron and python,NP25 4SE,51.778569125342900,-2.695267133064550
iguana and boomslang,NP25 4TE,51.731349953459000,-2.690227123556780
rattlesnake and Dorcopsis,NP25 4TY,51.763512651185800,-2.705193309975970
Pratincole and carpet snake,NP25 5DW,51.813388613965700,-2.735694885403850
green turtle and death adder,NP25 5FB,51.802882039900000,-2.717033114800000
garter snake and terrapin,NP25 5NH,51.829354761134700,-2.768358782661210
Booted eagles and mamba,NP25 5NX,51.845087000000000,-2.795946000000000
sea snake and Songlark,NP25 5QG,51.848182779718200,-2.771016751996480
tree snake and Macaw,NP25 5QH,51.843009940595000,-2.767342971567930
Goose and Meadowlark,NP25 5SS,51.820197945923400,-2.729436674401090
Viscacha and moloch,NP25 5TQ,51.804009428547600,-2.725796042854830
