name,id,postcode,lat,lon
python and Nukupuʻu,1440052,CM0 7UD,51.690103000000000,0.872980000000000
asp and jew lizard,1440096,CM0 8BE,51.625107572841500,0.819032919689868
hognose snake and chuckwalla,1423433,CM9 4SN,51.744491991624100,0.675515275799556
coral snake and Mockingbird,1440240,CM0 7EP,51.661846989187000,0.829498954704940
diamondback and River dolphin,1413388,CO5 7NJ,51.836723774341000,0.900891352738734
coral snake and glass snake,1412936,CO5 9AU,51.830057263269300,0.692327983612791
Ground sloth and diamondback terrapin,1416600,CO2 0JT,51.845421183634500,0.857540857234456
Myna and Crow,1413259,CO5 8QA,51.776680050820300,0.911143802818861
Thicketbird and chameleon,1423765,CM8 3AH,51.800951598703900,0.650934723473575
Linsang and slowworm,1411989,CO7 0FH,51.806120802528300,1.023520486551760
swift and sidewinder,1423435,CM9 4SQ,51.744054403222000,0.679719710786177
krait and Old World quail,1413541,CO5 0LT,51.817106000000000,0.741016851988634
Masked owl and moloch,1424103,CM8 2RP,51.816406923327600,0.636722181091374
blue tongue and diamond snake,1423451,CM9 4TJ,51.741044797814100,0.694911618922815
rattlesnake and caiman,1423294,CM9 6BZ,51.720801477705100,0.681515189138223
gecko and Capuchin,1413879,CO5 0EJ,51.818953599058000,0.746998044822305
tortoise and flying lizard,1424078,CM8 2QG,51.814555053874800,0.634684229455121
perentie and milk snake,1423552,CM8 3SN,51.845224465797700,0.630551360107598
Triller and Scimitar babbler,1411627,CO7 0LD,51.812537475057600,1.015664815200020
Kite and Tit-tyrant,1413923,CO5 0JE,51.816310000000000,0.761232000000000
diamond snake and tortoise,1424051,CM8 2NW,51.813540585133500,0.634204260606290
tokay and snapping turtle,1439908,CM0 8UD,51.643668252366400,0.816137009384840
Quetzal and skink,1423697,CM9 4BL,51.745601973900500,0.697370605827772
Tit-tyrant and skink,1440140,CM0 7BF,51.663726975681200,0.823137132285625
glass snake and Solitaire,1422195,CO1 9BW,51.816996000000000,0.745399000000000
Badger and wall lizard,1440386,CM0 7NR,51.718424872570900,0.822461104970528
Bronzewing pigeon and agama,2623973,CM0 8FN,51.639481000000000,0.805023000000000
python and mud turtle,1422634,CM9 8TH,51.775687211817900,0.798024644640962
Triller and Wader,1423308,CM9 6DS,51.722517690336000,0.682369758125802
habu and rattlesnake,1423231,CM9 5PB,51.731564047445200,0.675316283224835
Mamo and blind snake,1414020,CO5 0JR,51.810759892735700,0.763141337753401
Fish eagle and box turtle,1424058,CM8 2PF,51.811822736486600,0.644623056698593
bull snake and diamond snake,1428045,CM3 6PH,51.688403000000000,0.655297027153213
Triller and Fish eagle,1413385,CO5 7LZ,51.832742921546300,0.914208295555031
Polecat and agamid,1422988,CM9 8QQ,51.759347262274400,0.836593243112894
Buzzard and Kangaroo,1423404,CM9 6JU,51.721891207916100,0.670791923122272
snake and chameleon,1424039,CM8 2NE,51.814978505205900,0.637857604197563
iguana and Jackal,1423770,CM8 3BU,51.800153890594700,0.648422020701501
Condor and Lemming,1416589,CO2 0JB,51.844613856047100,0.862629841200772
Linsang and flying dragon,1413230,CO5 8NG,51.778948390211100,0.902706369662479
crocodile and green turtle,1428348,CM3 6ET,51.686765193624800,0.761658270953237
cobra and dugite,1413301,CO5 8SE,51.780375742763300,0.945093625594687
Logrunners and Rat,2639747,CO5 0FZ,51.808042000000000,0.756793000000000
Perching duck and habu,1428308,CM3 6DL,51.664147844652700,0.758532186210871
snapping turtle and chuckwalla,1411220,CO7 8JG,51.842747915432400,1.025815845224910
diamondback terrapin and Mole,1424214,CM8 2UY,51.802362114317400,0.645809860292733
Bunting and Macaw,1428090,CM3 6RX,51.665194866811700,0.650635545577323
leguaan and soft-shelled turtle,1424392,CM8 1DL,51.790614377274100,0.631504489947834
Stilt and Stilt,1413855,CO5 0DD,51.815375934566700,0.749232622549661
Kite and massasauga,1440090,CM0 8AS,51.625117000000000,0.817213000000000
soft-shelled turtle and Boto,1423766,CM8 3AL,51.809252497274100,0.646938929618141
diamondback and Marmoset,1413539,CO5 0LR,51.815832320387000,0.740858799101330
Recurvebill and bearded lizard,1440232,CM0 7EB,51.662891416105500,0.833179507819000
Jerboa and terrapin,1440100,CM0 8BQ,51.631318000000000,0.815527776190709
caiman and Cloud rat,1423444,CM9 4TA,51.761426089370300,0.672371723405769
Magpie and Scimitar babbler,1413293,CO5 8RU,51.787274144572600,0.921673009502530
frilled lizard and Mole,1439751,CM0 8NE,51.634250579503800,0.866701495201143
king snake and pit viper,1423234,CM9 5PF,51.731571872520800,0.677735460761107
Perching duck and soft-shelled turtle,1423809,CM9 4PQ,51.741746522989300,0.676019395685646
copperhead and glass snake,1413254,CO5 8PT,51.777942045215100,0.926593899842031
Rabbit and swift,1413454,CO5 7RD,51.799240470609200,0.872605459663809
habu and Dolphin,1413851,CO5 0BW,51.810497109566100,0.743262617949159
flying lizard and habu,1440274,CM0 7HJ,51.713972784085200,0.883180402301827
sand lizard and cerastes,1428417,CM3 6LR,51.638728000000000,0.676409000000000
Myna and Puffleg,1424191,CM8 2TJ,51.806318112767200,0.643566000000000
Condor and Komodo dragon,1422964,CM9 8PG,51.775324655986400,0.689937544292917
Parrotlet and Triller,1412970,CO5 9EA,51.844832767057400,0.716737000000000
Thrasher and Jay,1413118,CO5 9QD,51.844315651743700,0.713666202139990
Marsh harrier and jew lizard,1413432,CO5 7PG,51.832239690534200,0.909835405696694
Jay and Towhee,1423508,CM9 4YZ,51.738833244941600,0.703094775625046
monitor and Treepie,1424056,CM8 2PD,51.815835397675100,0.643349017287758
Vulture and rat snake,1411955,CO7 0DD,51.808874272814800,1.024517380012670
puff adder and Gila monster,2634382,CO1 9RY,51.817005000000000,0.745427000000000
Ibex and tuatara,1423336,CM9 4QZ,51.735356596076200,0.692356923181274
Guillemot and Pheasant,1761840,CM9 9EB,51.734888654449300,0.677557000000000
caiman and bearded lizard,1413712,CO5 7AW,51.833719780613000,0.917610266561186
Ground sloth and bearded dragon,1423027,CM9 6PG,51.695711184151900,0.680667963508369
Chickadee and blue tongue,1413031,CO5 9FB,51.846148274971200,0.720542000000000
brown snake and cerastes,1416578,CO2 0EU,51.825118022259900,0.837314540347688
lizard and Mockingbird,1422854,CM9 8ES,51.793330000000000,0.770850000000000
grass snake and Fish eagle,1428067,CM3 6QS,51.701357111401200,0.637656000000000
Siskin and Kākāriki,1411995,CO7 0GZ,51.807140000000000,1.024503000000000
lizard and indigo snake,1440403,CM0 7PS,51.729586990659700,0.917732305689409
Meadowlark and Pheasant,1413909,CO5 0HL,51.812328810435800,0.754923418337224
sea snake and worm lizard,1412015,CO7 0JF,51.816516604562800,1.022867194259310
rock python and bearded lizard,1422676,CM9 8XQ,51.756962223265700,0.842617259579515
Wader and Solitaire,1423172,CM9 6XH,51.729951340562300,0.668327207722670
Civet and blue racer,1413261,CO5 8QD,51.775538958035500,0.911461772128824
Perching duck and Darwin's finches,1413645,CO5 0SA,51.801114286239400,0.759127887054210
Pitohui and dukite,1440395,CM0 7PE,51.712591421702300,0.830538226495569
Hawaiian honeycreeper and tree snake,1413596,CO5 0QS,51.804320000000000,0.739783000000000
Ice seal and Capuchin,1413423,CO5 9AA,51.837360505723600,0.701314527447226
Logrunners and Marsh harrier,1411753,CO7 0UB,51.815120155876200,1.017361018378980
Kite and harlequin snake,1416229,CO2 0NZ,51.848477363467300,0.785665326317908
River dolphin and diamondback,1428360,CM3 6GN,51.672694464078200,0.663787794242397
blindworm and constrictor,1411709,CO7 0RR,51.821835375708600,1.018187314819480
box turtle and loggerhead,1413092,CO5 9NR,51.841015970075700,0.703870917619107
frilled lizard and cerastes,1422924,CM9 8ND,51.774635242916400,0.738853692035568
leguaan and Philippine hawk-owl,1439841,CM0 8PG,51.642639647456200,0.793320630293100
Towhee and flying lizard,1428358,CM3 6GJ,51.688117492459800,0.754245328521614
Siskin and flying lizard,1424410,CM8 2DW,51.805133753080100,0.639734274233471
copperhead and Snipe,1428087,CM3 6RT,51.663930000000000,0.658480316002782
tuatara and krait,1412741,CO5 9UJ,51.821043919909600,0.786947005833732
Black cockatoo and Black cockatoo,1761419,CM3 6FL,51.650629102459200,0.679003864758083
Old World vulture and Polecat,1428085,CM3 6RR,51.671384000000000,0.660948000000000
Zebra and Solitaire,1440155,CM0 7DA,51.660340509117200,0.836765713852710
viper and deaf adder,1440042,CM0 7TN,51.694496868650400,0.881160312547860
Tattler and whip snake,1423608,CM9 5HE,51.730803928719200,0.683865000000000
puff adder and viper,1423353,CM9 4RW,51.730667212908000,0.708559900189515
snake and Condor,1423092,CM9 6SQ,51.725112050927600,0.661626949245260
Ibex and tortoise,2639653,CM9 4DF,51.748060000000000,0.692561000000000
Wader and Goose,1439739,CM0 8LQ,51.626609338885200,0.822781963384133
Macaw and fer-de-lance,1423811,CM9 4PS,51.741192895662600,0.675450673208379
python and rock snake,1413054,CO5 9JJ,51.837580088027300,0.699585583346826
Piping shrike and Hawaiian honeycreeper,1422952,CM9 8NR,51.772318166826100,0.692411544042788
Vulture and Crow,1422912,CM9 8LP,51.784532675842400,0.756346482774906
Meadowlark and bandy-bandy,1439907,CM0 8UB,51.633189000000000,0.803401640274787
death adder and Argus,1412754,CO5 9XB,51.834271929406400,0.797983763354197
Booted eagles and Parrotbill,1413214,CO5 9SP,51.828558636692000,0.726998000000000
anaconda and moloch,1424505,CM8 1JX,51.795861349327800,0.644950545459694
bushmaster and gopher snake,1440196,CM0 8HJ,51.626735000000000,0.814987000000000
monitor and chameleon,1423891,CM8 3JQ,51.766213793773300,0.653579971088173
New World blackbird and Tattler,1428042,CM3 6PE,51.686471990135600,0.657058517530561
Treepie and Partridge,1424094,CM8 2RB,51.815812344575600,0.635163882499021
Parrotbill and Petrel,1422887,CM9 8JG,51.778774622042000,0.731797155121949
bandy-bandy and tokay,1440202,CM0 8HS,51.628660415429300,0.812273507456881
death adder and kabaragoya,1412732,CO5 9TY,51.836338174496400,0.750829238652227
indigo snake and tree snake,1439927,CM0 7QX,51.733804330789700,0.888658089964953
puff adder and diamond snake,1422923,CM9 8NB,51.767703060972900,0.751611000000000
Greenbul and Eagle,1423162,CM9 6WG,51.752975507893000,0.642414211987513
Partridge and Maya,1440215,CM0 8JJ,51.629573488464500,0.820321493424478
Dolphin and caiman,1413860,CO5 0DJ,51.816635741387700,0.751123193335307
slowworm and giant tortoise,1411633,CO7 0LL,51.815724742249900,1.017633612713650
Kangaroo and Duck,1423031,CM9 6PN,51.703720000000000,0.699379000000000
slowworm and Black cockatoo,1422891,CM9 8JN,51.772738148265100,0.736129379411699
Gila monster and Siskin,1413622,CO5 8FA,51.775276084415800,0.913358581390430
saltwater crocodile and Magpie,1423394,CM9 6JD,51.724582565888400,0.669502495509496
diamondback terrapin and Pratincole,1423949,CM8 2HR,51.804059981641700,0.637089369541255
Jackal and Egret,1761928,CO1 9PT,51.816994441163300,0.745398681127852
blind snake and amphisbaena,1761802,CM8 3FF,51.782448942455500,0.666596516714003
Ice seal and Peafowl,1439935,CM0 7RH,51.692233688970100,0.799992221560583
Old World quail and Badger,1422648,CM9 8UA,51.769520279559100,0.801532000000000
tuatara and death adder,1440168,CM0 8DZ,51.628899523159300,0.817302776935309
Skunk and Chipmunk,1762248,CO5 9FE,51.839838920653400,0.703045382585781
anole and Bronzewing pigeon,1422726,CM9 8BB,51.747871974143500,0.753417715176376
anaconda and Quetzal,1422718,CM9 9SW,51.728842411790100,0.680296787043224
Black jay and Elephant,1423225,CM9 5LJ,51.721197408728900,0.686621113079737
wall lizard and Goose,1440127,CM0 7AL,51.664020199219600,0.823285528068299
Herring gull and chuckwalla,1423111,CM9 6TP,51.726432000000000,0.643472000000000
Old World warbler and B,1422921,CM9 8LZ,51.765703000000000,0.748981000000000
Capuchin and Fulmarine petrel,1422715,CM9 9SS,51.728842411790100,0.680296787043224
adder and Mamo,1422830,CM9 8DF,51.788023966435500,0.711237000000000
Petrel and Snipe,1423408,CM9 6LA,51.723225000000000,0.674302000000000
box turtle and River dolphin,1424451,CM8 1EY,51.799221947198600,0.629046832142554
deaf adder and Fox,1411525,CO7 0JT,51.812879544827200,1.019155657764540
caiman and Rabbit,1424366,CM8 1AZ,51.799140291076700,0.637106793352944
sand viper and Booted eagles,1422727,CM9 8BD,51.748513848163900,0.752891696540134
sea snake and sidewinder,1411697,CO7 0QZ,51.824945976323200,1.017887360505920
Partridge and Egret,1412960,CO5 9DG,51.843672817077000,0.678955229891004
kabaragoya and gecko,1422826,CM9 8BZ,51.785422151520100,0.706866176433372
anaconda and Civet,1413675,CO5 0TS,51.812210388742100,0.743453761398432
Mink and skink,1428059,CM3 6QA,51.673803905424500,0.664040958171433
Songlark and Coati,1423903,CM8 3LG,51.788691000000000,0.656683000000000
Minke whale and anole,1413258,CO5 8PZ,51.780858012578700,0.912036371188433
Pitohui and death adder,1440051,CM0 7UB,51.691282290674900,0.887255000000000
mamba and indigo snake,1424368,CM8 1BD,51.790223504097400,0.630887147403319
Komodo dragon and diamondback terrapin,1424150,CM8 1QJ,51.787931367589400,0.637656329121735
sidewinder and Schneider python,1762250,CO5 9FH,51.831806856231900,0.777160325303887
Marmoset and milk snake,1440204,CM0 8HW,51.626570676576000,0.813907136793105
Jay and Piping shrike,1422849,CM9 8EJ,51.769964571147800,0.781855463565394
Logrunners and Booted eagles,1440138,CM0 7BD,51.665634000000000,0.817557000000000
copperhead and Bronzewing pigeon,1424049,CM8 2NT,51.813271460648000,0.643387544770116
Cuscus and anaconda,1413215,CO5 9SR,51.845960249942300,0.715455000000000
glass snake and Siskin,1413916,CO5 0HU,51.811148080844800,0.758101416554923
rock snake and chuckwalla,1440141,CM0 7BG,51.663583623842300,0.809620716586073
Partridge and Philippine hawk-owl,1411530,CO7 0JZ,51.813684710905000,1.017017000000000
diamondback turtle and rat snake,1423494,CM9 4YB,51.741530495902600,0.696084971001957
cycling lizard and blue racer,1439873,CM0 8RJ,51.633082642576700,0.809948000000000
gaboon viper and pit viper,1412730,CO5 9TW,51.835396865785700,0.752238048846956
galliwasp and Triller,1411675,CO7 0PR,51.818077551127500,1.025119526913940
mamba and Perching duck,1411674,CO7 0PQ,51.816723000000000,1.023984000000000
Night heron and Warbler,1416604,CO2 0JY,51.845530922847800,0.873579000000000
amphisbaena and galliwasp,1423218,CM9 8AS,51.746676018190000,0.758010217891215
Mink and Tattler,1412973,CO5 9EF,51.837853391998600,0.702784000000000
Tattler and Marmoset,1411529,CO7 0JY,51.814274636704700,1.017014285558580
Black cockatoo and Tahr,1423348,CM9 4RQ,51.732828382585800,0.707660813038092
Zebra and dukite,1423858,CM8 3FJ,51.794840177164400,0.697393810883794
mamba and cycling lizard,1423209,CM9 8AF,51.762750431161800,0.784948211987541
python and dugite,1439850,CM0 8PT,51.642133771346100,0.802844348281260
