name,postcode,lat,lon
tortoise and Stilt,EH46 7AD,55.700568607915600,-3.433131412327410
Capuchin and anole,ML11 7DA,55.676097734972500,-3.761857049500750
anaconda and Diving bird,ML11 7DX,55.677392223180400,-3.766829583215310
cerastes and monitor,ML11 7EE,55.678750071726800,-3.763646289279530
rat snake and Kestrel,ML11 7EL,55.675755185656500,-3.766930707179600
Herring gull and Argus,ML11 7JE,55.679816485012600,-3.765730127642020
Philippine hawk-owl and adder,ML11 7LD,55.672632418140500,-3.769954000000000
Goose and Diving bird,ML11 8JQ,55.698438424931400,-3.622356582223980
elapid and leathery turtle,ML11 8JU,55.700382707400500,-3.627545189483580
worm lizard and indigo snake,ML11 8NR,55.701062000000000,-3.694934000000000
adder and hognose snake,ML11 8PB,55.730848182492100,-3.723362000000000
brown snake and Jerboa,ML11 8QA,55.695337347609000,-3.689038117635440
sea snake and Tattler,ML11 9FL,55.668017943873500,-3.765659700419890
Eagle and Polecat,ML12 6DG,55.623080082248700,-3.524288000000000
Coati and Kākāriki,ML12 6DP,55.625554518574800,-3.520952069522230
rattlesnake and Kite,ML12 6EE,55.622491236577700,-3.531696045369150
jew lizard and dukite,ML12 6EU,55.623578535554300,-3.520144980184510
coral snake and amphisbaena,ML12 6HP,55.567343548334100,-3.599755838812600
Parrotlet and horned viper,ML12 6HS,55.555652911312300,-3.643815499835250
Ibex and Ground sloth,ML12 6LL,55.598721162543500,-3.593811241622530
Chipmunk and coral snake,ML12 6QH,55.585667572709700,-3.401540382596820
Solitaire and deaf adder,ML12 6SJ,55.597751034558300,-3.594470234213990
