name,postcode,lat,lon
Scimitar babbler and Puffleg,NE71 6AN,55.586538000000000,-2.002734000000000
amphisbaena and Chicken,NE71 6BP,55.548231534034200,-2.017676309486080
puff adder and terrapin,NE71 6BW,55.547746329947800,-2.017533000000000
Fish eagle and Partridge,NE71 6DL,55.548007051182600,-2.016614326747580
Rat and Moluccan boobook,NE71 6HG,55.566197152780800,-2.101580120216040
Tattler and Eagle,NE71 6LA,55.546138386082200,-2.014378928508540
Fish eagle and Buzzard,NE71 6LW,55.543757307279700,-2.014045251412970
Night heron and rattlesnake,NE71 6ND,55.544584000000000,-2.017215000000000
hognose snake and black snake,NE71 6RH,55.532303114858000,-2.043112353574510
Duck and Pheasant,NE71 6TW,55.548305986616100,-2.168036680841810
Gull and Petrel,NE71 6XR,55.553923573402300,-2.137895539781030
agama and Grosbeak,TD11 3NE,55.749958095287500,-2.194408864954400
Minke whale and mountain devil,TD11 3NQ,55.747773000000000,-2.241120000000000
Ice seal and Coati,TD12 4BF,55.654969861474600,-2.260748052078160
box turtle and Bronzewing pigeon,TD12 4EB,55.655404524584400,-2.254870764103090
Treepie and Boto,TD12 4EQ,55.655738032901600,-2.249993932290170
death adder and Mamo,TD12 4HN,55.691563841157400,-2.218090775621300
Tit-tyrant and bearded lizard,TD12 4LG,55.647654906737200,-2.261207855756580
Warbler and Herring gull,TD12 4QD,55.616975501193900,-2.195749933175810
wall lizard and Treepie,TD12 4QN,55.590328000000000,-2.253084000000000
worm lizard and Pratincole,TD12 4QT,55.567268449840300,-2.212151935142840
Myna and Snipe,TD12 4RS,55.616472605316500,-2.262826121333700
Cloud rat and brown snake,TD12 4SF,55.640744638893800,-2.199363612515700
Mink and Cloud rat,TD12 4UE,55.647424122938400,-2.228284020330420
python and Old World warbler,TD12 4UZ,55.686047521507000,-2.199657938628430
constrictor and Tit-tyrant,TD12 4XH,55.654239783857200,-2.176341369128150
Tahr and Prion,TD15 1XJ,55.738581454709800,-2.164761489325190
massasauga and mountain devil,TD15 2JY,55.725733366591800,-2.135014000000000
Pheasant and Condor,TD15 2RH,55.734119000000000,-1.990324000000000
blindworm and whip snake,TD15 2TJ,55.670027330425500,-2.012215000000000
Tit-tyrant and mamba,TD5 8BU,55.562210825371900,-2.322727335834850
cayman and coral snake,TD5 8BX,55.553853496877100,-2.316191420003800
Stint and Skunk,TD5 8RP,55.543603975973400,-2.289628299806240
