name,postcode,lat,lon
Herring gull and racer,DG8 9LX,54.788383344254600,-4.583383941410800
hoop snake and boomslang,DG8 9LY,54.786143000000000,-4.570828000000000
adder and wall lizard,DG8 9NE,54.816081483885800,-4.568076148211490
mamba and Mole,DG8 9NG,54.820985000000000,-4.542311000000000
Recurvebill and frilled lizard,DG8 9NP,54.816063541011900,-4.485651976905500
Cloud rat and turtle,DG8 9PA,54.818815000000000,-4.486973000000000
alligator and Civet,DG8 9PQ,54.800586900134900,-4.519058296131950
Vole and Tattler,DG8 9PT,54.775977000000000,-4.527185000000000
