name,postcode,lat,lon
Argus and Lemming,PL11 2AB,50.376008581529300,-4.195784862149780
copperhead and viper,PL11 2DA,50.375943205269300,-4.196864839107710
Pitohui and American sparrow,PL11 2DP,50.376106531609300,-4.216689909891210
glass snake and galliwasp,PL11 2ER,50.374265240011000,-4.200458111904980
Greenbul and milk snake,PL11 2PX,50.376489222456500,-4.213599370346830
Night heron and rat snake,PL11 2QT,50.379000004158100,-4.215418253343090
deaf adder and Argus,PL11 2QU,50.378197229775500,-4.214593167458190
Towhee and Dorcopsis,PL11 3AA,50.371195528464000,-4.250860398200850
water snake and Wallaby,PL11 3AX,50.353098235522700,-4.233750000000000
dukite and lizard,PL11 3DS,50.368138796112700,-4.359195955856890
Skunk and Coati,PL11 3ED,50.352951592833000,-4.232832179654050
green turtle and Masked owl,PL11 3HG,50.388573234238600,-4.325783786853740
blue tongue and Kākāriki,PL11 3HW,50.373985461103300,-4.389134329626000
slowworm and grass snake,PL11 3JR,50.363685333073200,-4.370744562716910
worm lizard and Ice seal,PL11 3JS,50.364420238122300,-4.384237000000000
gavial and anaconda,PL11 3JZ,50.361808471443500,-4.369443000000000
Flameback and galliwasp,PL11 3LS,50.365266244501000,-4.366436015804040
Argus and amethystine python,PL12 4AA,50.410415272585700,-4.229185365458180
Condor and python,PL12 4AJ,50.405470812494700,-4.224829674051780
Jackal and rattlesnake,PL12 4BD,50.406003877161900,-4.229400501073820
Ibex and boomslang,PL12 4DE,50.405083408712300,-4.233776396566710
dugite and glass snake,PL12 4ED,50.407855641482600,-4.212978178470100
blind snake and terrapin,PL12 4FW,50.409314943800000,-4.226023826000000
Marsh harrier and goanna,PL12 4HH,50.413219977981600,-4.237227764070320
bearded dragon and Crow,PL12 4HN,50.411494752102100,-4.232459332560360
Goose and Bronzewing pigeon,PL12 4JX,50.412317503705300,-4.236917799526800
asp and monitor,PL12 4LP,50.410079722415700,-4.228859960841320
Greenbul and amphisbaena,PL12 4NP,50.403537446129800,-4.223866571859830
cobra and milk snake,PL12 4PD,50.403939153567200,-4.217904260233580
Francolin and Bunting,PL12 4RJ,50.413015000000000,-4.246522000000000
anole and harlequin snake,PL12 4RR,50.430303141786300,-4.292048364541360
Pheasant and milk snake,PL12 4TE,50.402789536478200,-4.212151060913600
Cloud rat and Magpie,PL12 4XU,50.409979174307000,-4.239242621951640
Fox and water snake,PL12 5BA,50.422080465386200,-4.291679398927540
Nukupuʻu and Ibex,PL12 5BQ,50.398281000000000,-4.319884000000000
boa constrictor and American sparrow,PL12 5BS,50.395347524658900,-4.367160272115750
mud turtle and Fish eagle,PL12 5DS,50.421717031355200,-4.291408435218850
moloch and gecko,PL12 5EF,50.423124973299200,-4.290251535063350
whip snake and anaconda,PL12 5EU,50.421116831148300,-4.289915299853310
Egret and Old World vulture,PL12 5FB,50.416603000000000,-4.328260000000000
Condor and rat snake,PL12 5FD,50.421145849842100,-4.290268661334020
Black jay and dukite,PL12 5LR,50.393128282393600,-4.311612952569680
Ibex and Mink,PL12 5PE,50.395168150202000,-4.327935849858830
Thicketbird and Petrel,PL12 6AL,50.408436453349900,-4.211288151430890
tree snake and chuckwalla,PL12 6AR,50.408309411276800,-4.210874074771740
Mockingbird and cobra,PL12 6EE,50.411480971313400,-4.224731247448120
Flameback and chuckwalla,PL12 6ER,50.410388373983600,-4.222132453390010
Greenbul and chuckwalla,PL12 6JT,50.409125888700500,-4.215233038224020
Fulmarine petrel and Perching duck,PL12 6JW,50.408938831591700,-4.212775314383600
tiger snake and Diving bird,PL12 6PG,50.422536797280300,-4.237300860856820
copperhead and diamondback,PL12 6PN,50.436458113727700,-4.261123781625480
Peafowl and diamond python,PL12 6PU,50.447256396172700,-4.249735847939450
brown snake and glass snake,PL12 6SE,50.454850235582800,-4.306999450330950
Linsang and Elephant,PL12 6SG,50.483383090946600,-4.262912362317730
frill-necked lizard and rat snake,PL12 6SL,50.470232811280000,-4.235493497959510
cobra and Boto,PL12 6SP,50.486516220835500,-4.250698285489250
Zebra and Vole,PL12 6SY,50.486227556693200,-4.233006023433130
Cuscus and diamond snake,PL12 6TG,50.485454038425000,-4.242358471860020
gopher snake and cobra,PL12 6TR,50.489343672208800,-4.259348284535630
Kākāriki and asp,PL12 6WE,50.418255579272000,-4.228863736640680
B and Perching duck,PL12 6XF,50.415719627906800,-4.224141580350430
Bunting and diamond snake,PL12 6XU,50.408554060304500,-4.213615933895900
giant tortoise and Diving bird,PL13 1AH,50.352966000000000,-4.454405956751210
Goose and tokay,PL13 1DN,50.355682000000000,-4.454758000000000
Asiatic leopard and Meadowlark,PL13 1EY,50.360980000000000,-4.448877699544020
mamba and smooth snake,PL13 1FH,50.365250000000000,-4.452587000000000
Thicketbird and green turtle,PL13 1HX,50.357078230711000,-4.453761189684560
Maya and python,PL13 1JP,50.356790444912800,-4.446340000000000
glass snake and boomslang,PL13 1JT,50.357517049596400,-4.446599213739530
Mockingbird and Greenbul,PL13 1JZ,50.358297091941800,-4.445008360737120
sand viper and anole,PL13 1LZ,50.364441801965700,-4.451778705183890
Jay and Dorcopsis,PL13 1NA,50.363642832013900,-4.450851625774000
skink and Ground sloth,PL13 1NP,50.363111432906800,-4.450458639758650
Francolin and Vole,PL13 1QG,50.395720000000000,-4.410363000000000
Armadillo and Fish eagle,PL13 1QS,50.381764702783300,-4.423947308342730
king cobra and viper,PL13 2AE,50.357268000000000,-4.457187000000000
lizard and Dorcopsis,PL13 2LL,50.368162205743100,-4.531244448074120
Black cockatoo and sidewinder,PL14 3AN,50.454757571495300,-4.462420633353560
Tree warbler and mountain devil,PL14 3AR,50.455556477603400,-4.461222302257750
Marsh harrier and tortoise,PL14 3AT,50.455124411217300,-4.462087467776270
Nukupuʻu and Jay,PL14 3AX,50.453804793299500,-4.461539919479490
giant tortoise and bearded lizard,PL14 3BP,50.455052407948900,-4.458688312850440
cayman and Mamo,PL14 3DG,50.453961677432600,-4.458800801869110
blue racer and alligator,PL14 3DJ,50.458073006596100,-4.460465323689530
Nukupuʻu and Minke whale,PL14 3EF,50.456824664389500,-4.459949661540460
anole and wall lizard,PL14 3ET,50.459370015520500,-4.455699739021930
Petrel and mountain devil,PL14 3EY,50.459422999766000,-4.457449663141410
dukite and agamid,PL14 3EZ,50.459113712099100,-4.458039499090620
amphisbaena and Black jay,PL14 3GL,50.457512000000000,-4.461867000000000
Fish eagle and hoop snake,PL14 3JW,50.456011352732600,-4.463528363266900
glass snake and thorn lizard,PL14 3LP,50.469108000000000,-4.425038950548600
Marsh harrier and Schneider python,PL14 3NH,50.460876866256600,-4.425469039798330
Vole and constrictor,PL14 3PQ,50.444105483989900,-4.432189142270170
Jerboa and flying lizard,PL14 3ST,50.442951991161900,-4.411128972491140
carpet snake and Old World warbler,PL14 3SW,50.460086604758600,-4.380128465726450
Dorcopsis and River dolphin,PL14 3UG,50.452724276445300,-4.452227892503550
agama and anaconda,PL14 4AJ,50.453561687209300,-4.465373434943270
Triller and pit viper,PL14 4AT,50.453813765171800,-4.468331042197410
Grosbeak and Diving bird,PL14 4BY,50.448140262956800,-4.469078093124460
Old World quail and anole,PL14 4FL,50.455218000000000,-4.511116000000000
Tit-tyrant and blue racer,PL14 4JP,50.441265032138100,-4.475156876854180
viper and Piping shrike,PL14 4LN,50.452642000000000,-4.487514000000000
amethystine python and Masked owl,PL14 4LY,50.442796025845200,-4.524028241210210
constrictor and bull snake,PL14 4QG,50.393868098095000,-4.515560100376890
Wallaby and Mamo,PL14 5AA,50.515937484766500,-4.422211260475300
Solitaire and lizard,PL14 5BD,50.531542053621000,-4.411862577338750
adder and king cobra,PL14 5BE,50.531349164680000,-4.406843153711220
Goose and Buzzard,PL14 5DQ,50.486654621940500,-4.469423000000000
Ibex and Gull,PL14 5DU,50.488828879289300,-4.468802608367700
Grosbeak and tiger snake,PL14 5EJ,50.490392543703600,-4.461228180614760
amethystine python and Buzzard,PL14 5EL,50.489584559417700,-4.461580951974140
Elephant and Old World warbler,PL14 5EN,50.492388471126600,-4.462544549303630
Treepie and cycling lizard,PL14 5JP,50.499373000000000,-4.452190000000000
terrapin and Kangaroo,PL14 5LG,50.502498120390800,-4.452338229205160
hawksbill and galliwasp,PL14 5LT,50.511311517052000,-4.436559543690350
Fulmarine petrel and Kestrel,PL14 5NE,50.503932041062700,-4.407803620484910
gaboon viper and Songlark,PL14 6DN,50.456294925577200,-4.474548000000000
boa and saltwater crocodile,PL14 6JH,50.457684541710700,-4.513126527927510
hawksbill and Peafowl,PL14 6JJ,50.457863456332400,-4.512755590064940
Meadowlark and snapping turtle,PL14 6LB,50.456132972580400,-4.537771004192790
Moluccan boobook and Tahr,PL14 6LN,50.458551000000000,-4.524608000000000
Parrotbill and Piping shrike,PL14 6NE,50.458355223363400,-4.517882224910270
Argus and ringhals,PL14 6NT,50.479920890133200,-4.555989423408820
hoop snake and Old World warbler,PL14 6RH,50.465000000000000,-4.461777993575630
bearded dragon and indigo snake,PL14 6RU,50.489966603722600,-4.499344629566580
black snake and rock snake,PL14 6SD,50.535415368695800,-4.521491105112750
Elephant and copperhead,PL14 9DF,50.454723720700000,-4.464738000000000
Mamo and Snipe,PL14 9DN,50.454617000000000,-4.464774000000000
amphisbaena and Grouse,PL15 7LU,50.567406876022200,-4.403413215473380
whip snake and Meadowlark,PL15 7NL,50.554880180275100,-4.439173409144970
Siskin and Treepie,PL15 7PG,50.563426098095000,-4.440405616090360
tree snake and frill-necked lizard,PL17 7AR,50.504094000000000,-4.315266000000000
Duck and Fox,PL17 7AW,50.503493792278600,-4.320031849507550
Philippine hawk-owl and kabaragoya,PL17 7AX,50.503710483996500,-4.314119182787600
monitor and diamond python,PL17 7DL,50.502977040171200,-4.314365374468210
Mink and harlequin snake,PL17 7EA,50.503640781653600,-4.305851394200840
asp and Egret,PL17 7HD,50.499786626369800,-4.316042608914570
Partridge and glass snake,PL17 7PF,50.538794475936400,-4.407815069452960
Puffleg and Condor,PL17 7PY,50.501940589982600,-4.304048047355450
thorn lizard and sidewinder,PL17 7QP,50.505518261302400,-4.309144396471090
American sparrow and racer,PL17 7RA,50.497730630822200,-4.319918569243070
Darwin's finches and Vole,PL17 7RD,50.504890000000000,-4.307308000000000
horned toad and loggerhead,PL17 8DL,50.507585258388500,-4.236481987428020
Wader and lizard,PL17 8JP,50.511562306393200,-4.251325368026300
Warbler and Prion,PL17 8LA,50.533261288666700,-4.307564019613120
snapping turtle and Nukupuʻu,PL17 8NS,50.513955000000000,-4.240183000000000
Towhee and green turtle,PL17 8NY,50.546385000000000,-4.316155556541510
mud turtle and cerastes,PL17 8PN,50.523282081046200,-4.320452278812470
king cobra and Crow,PL17 8PX,50.539988000000000,-4.346833000000000
American sparrow and chuckwalla,PL17 8QJ,50.556719000000000,-4.367534788798920
tree snake and Shearwater,PL18 9AG,50.512662555264700,-4.223575601226800
Boto and slowworm,PL18 9AP,50.522274462775900,-4.235935022088340
tiger snake and sand viper,PL18 9BQ,50.515619000000000,-4.220484000000000
agama and flying dragon,PL18 9EL,50.514154645272600,-4.225507727588680
Songlark and Old World vulture,PL18 9ER,50.514304000000000,-4.226700000000000
Stilt and Linsang,PL18 9FF,50.516704000000000,-4.239808000000000
River dolphin and Old World vulture,PL18 9GJ,50.511921408135800,-4.211494810565390
Elephant and Black jay,PL18 9HN,50.516904804473900,-4.242015172530610
Bronzewing pigeon and gaboon viper,PL18 9HT,50.515895118516200,-4.233249463728910
cobra and Booted eagles,PL19 8PG,50.547024253517200,-4.247027000000000
death adder and bushmaster,PL20 7AB,50.479218000000000,-4.188747469199680
White ibis and monitor,PL20 7BZ,50.478490953083800,-4.189551759604520
iguana and Jerboa,PL20 7EZ,50.486455403673600,-4.195516783217320
Gila monster and Francolin,PL22 0PE,50.367965000000000,-4.590876000000000
giant tortoise and mountain devil,PL22 0RJ,50.439234418974600,-4.592697102379410
sidewinder and diamond snake,PL22 0RT,50.412177476616400,-4.586658321810360
anole and tortoise,PL5 1AR,50.399163627278700,-4.192267636073020
tree snake and Argus,PL5 1ES,50.396810000000000,-4.195522000000000
Songlark and Shearwater,PL5 1JP,50.403284689751700,-4.199325468954130
Armadillo and cobra,PL5 1LR,50.406085824864100,-4.197217452763070
galliwasp and indigo snake,PL5 1NZ,50.406320969148300,-4.191429891092560
