name,id,postcode,lat,lon
brown snake and American sparrow,1221212,EH39 4QH,56.056226226799200,-2.723050950162250
king cobra and elapid,1221696,EH35 5LN,55.912218413875100,-2.940673805564480
fer-de-lance and king cobra,1222615,EH32 0AE,55.969896820033400,-2.956717141948850
copperhead and Prion,1226496,EH21 6PF,55.935503350100000,-3.069027646274060
Hawk and python,1221237,EH39 4RF,56.052682652056900,-2.728234866536830
Kangaroo and frilled lizard,1221846,EH32 9QU,55.953331653902000,-2.982815000000000
Stilt and Old World vulture,1221705,EH35 5LY,55.909667655380700,-2.952225825598940
Argus and Greenbul,1219371,EH41 3LJ,55.958815489937800,-2.779662000000000
Prion and massasauga,1221438,EH39 4AA,56.058169000000000,-2.722769510353210
Kite and viper,1226080,EH21 8BH,55.938256876438900,-3.016546250185500
Recurvebill and flying lizard,1222203,EH32 9HN,55.957970820558400,-2.965120041495160
Vulture and milk snake,1226356,EH21 6AY,55.942307936244500,-3.058311894985810
coral snake and Parrotbill,1222242,EH32 0HD,55.970995873723700,-2.955190112241200
water snake and Crow,1225774,EH21 8NT,55.919285137174900,-3.035330824887540
Lemming and loggerhead,1219029,EH41 3RT,55.955826866396100,-2.791999117543630
king snake and mountain devil,1226618,EH21 6QU,55.940899000000000,-3.061267000000000
Logrunners and agamid,1219031,EH41 3RW,55.955363007374400,-2.797050559134630
jew lizard and iguana,1220937,EH39 5FB,56.048553144599900,-2.781970352504530
bull snake and New World blackbird,1226408,EH21 6HH,55.933561706908100,-3.063931953522290
Wallaby and Warbler,1219306,EH41 3HA,55.954684000000000,-2.781073717799020
blind snake and Argus,1222478,EH32 0RY,56.009469803671100,-2.857473056223640
Tree warbler and bandy-bandy,1222314,EH32 9PD,55.957895820200100,-2.979181001049290
blind snake and taipan,1226444,EH21 6JL,55.944863383697800,-3.056844486378600
whip snake and smooth snake,1221981,EH33 1BH,55.946454631783300,-2.955530452963390
indigo snake and loggerhead,1219362,EH41 3JY,55.957242291992600,-2.780110000000000
pit viper and Greenbul,1225439,EH22 2NL,55.913186767201300,-3.036080181311830
gavial and python,1226372,EH21 6DE,55.945517267883000,-3.063347134989630
boa and chuckwalla,1221460,EH39 4BD,56.056810871882400,-2.732086199429600
Macaw and fer-de-lance,1226229,EH21 7AN,55.940966230808500,-3.047084276096730
coral snake and smooth snake,1222058,EH33 1EX,55.944627553114100,-2.896275000000000
Stint and bearded lizard,1220948,EH39 5HQ,56.044785000000000,-2.803485000000000
leathery turtle and jew lizard,1219028,EH41 3RS,55.956087010392500,-2.794615000000000
Siskin and Crow,1221638,EH33 1PS,55.939328602765500,-2.903229174326710
monitor and Tahr,1221888,EH33 2LL,55.923001422515900,-2.964970727767190
boomslang and goanna,1225450,EH22 2PA,55.904450748962100,-2.996067821816420
sand lizard and Parakeet,1221501,EH39 4EF,56.052724277565000,-2.715086000000000
tokay and giant tortoise,1219079,EH41 4AT,55.954561000000000,-2.770625000000000
Parrotlet and Gila monster,1226374,EH21 6DG,55.945076396340400,-3.064455874210910
horned viper and glass snake,2036084,EH21 8RS,55.934373000000000,-3.084832000000000
garter snake and gopher snake,1221904,EH33 2NF,55.931883249335000,-2.948209034779590
Night heron and Civet,1225937,EH21 7PE,55.939702000000000,-3.058353000000000
Triller and smooth snake,1221766,EH33 2BL,55.939422828343600,-2.951579105630580
Tahr and anole,1221439,EH39 4AB,56.058493645082000,-2.722499240926680
Civet and Treepie,1219303,EH41 3EX,55.954892000000000,-2.773803000000000
lizard and frilled lizard,1226507,EH21 6PW,55.942895100813300,-3.054805524556450
Recurvebill and B,1226394,EH21 6EL,55.944656388582900,-3.065228918040910
elapid and Songlark,1218863,EH41 4RS,55.952829394572700,-2.790048190707290
bearded dragon and Snipe,1219110,EH41 4DJ,55.953597000000000,-2.784012745925680
Chipmunk and tree snake,1221143,EH39 4JS,56.059169688753700,-2.715960037527630
sand lizard and Guillemot,1226370,EH21 6DB,55.945417618117900,-3.062399701304150
box turtle and Diving bird,1221284,EH39 5BA,55.990735000000000,-2.797378000000000
Wader and Mockingbird,1772788,EH41 4EU,55.950873998694000,-2.781793688518290
indigo snake and leathery turtle,1222694,EH32 0BQ,55.969010632561600,-2.950478946485210
box turtle and Black cockatoo,1225995,EH21 7SG,55.949057287147500,-3.046582079362400
Tahr and Vole,1226047,EH21 7TT,55.936588780048100,-3.049383403639250
water snake and Parakeet,1222191,EH32 9GE,55.951878000000000,-2.984602000000000
taipan and Songlark,1221801,EH33 2EJ,55.941837800128200,-2.954167949715110
Asiatic leopard and bushmaster,1772287,EH21 8PF,55.910491000000000,-3.015675000000000
Boto and puff adder,1221627,EH33 1PD,55.941253738333300,-2.911455052034260
Perching duck and blue racer,1222241,EH32 0HB,55.971323816985600,-2.953451752906060
Chipmunk and Crow,1222588,EH31 2HB,56.035586660674500,-2.828939623869010
Gila monster and garter snake,2625611,EH39 5FJ,56.049504000000000,-2.725724000000000
cobra and thorny devil,1221708,EH35 5NH,55.906755186489400,-2.933615365753080
Kestrel and diamondback,1221980,EH33 1BG,55.947039591874300,-2.956569654095270
Tahr and crocodile,1225965,EH21 7QT,55.942230454130600,-3.033573473643960
Wader and carpet snake,1219100,EH41 4BX,55.954404301248600,-2.774081149399590
horned viper and grass snake,1226620,EH21 6QX,55.940373326677300,-3.061765277159540
Lemming and Stilt,1222198,EH32 9HF,55.955404801854000,-2.969220299018950
Tit-tyrant and Cloud rat,1221854,EH33 2HT,55.943517113430100,-2.960069249114920
sand viper and Elephant,1225740,EH21 8JX,55.940573223288700,-3.010219020978350
Old World quail and Pheasant,1218731,EH41 4NU,55.951107544192400,-2.792335115722420
Komodo dragon and saltwater crocodile,1221435,EH33 2PU,55.939194449014400,-2.940367119601210
python and Asiatic leopard,1222076,EH33 1HP,55.942581352462600,-2.942642000000000
Old World quail and Recurvebill,1225738,EH21 8JU,55.944116000000000,-3.001153000000000
bearded lizard and Macaw,1222379,EH32 0PE,55.972765769633500,-2.901540813651860
sidewinder and slowworm,1221630,EH33 1PG,55.939875118099200,-2.909549574628110
Shearwater and alligator,1222188,EH32 9GA,55.951649156730100,-2.988423698191990
Tit-tyrant and pit viper,1772719,EH35 5AB,55.910692168088500,-2.950395000000000
Kite and tree snake,1221291,EH39 5BJ,55.988425511923400,-2.744273505124350
Myna and Lemming,1222202,EH32 9HL,55.958080201292600,-2.966067764111030
Old World vulture and Meadowlark,1226382,EH21 6DT,55.943014101930500,-3.072244643337490
thorn lizard and python,1222306,EH32 9NT,55.958083757446300,-2.982661431566950
B and Viscacha,1226371,EH21 6DD,55.945603078885000,-3.061732277255880
Kestrel and sand lizard,1226053,EH21 7UL,55.937622261417100,-3.057767876262370
Wallaby and cayman,1219035,EH41 3SB,55.978771000000000,-2.717871000000000
leathery turtle and anaconda,1226104,EH21 8DQ,55.942277956984900,-3.019245307535020
caiman and Kākāriki,1219267,EH41 3BE,55.958867356171400,-2.792319000000000
New World blackbird and Herring gull,2591908,EH39 5QA,56.048418000000000,-2.731612000000000
Civet and Shearwater,2652192,EH32 9FZ,55.948515000000000,-2.996675000000000
Dorcopsis and Marsh harrier,1222024,EH33 1ER,55.947593000000000,-2.965102000000000
tree snake and Mockingbird,1221539,EH33 2QP,55.936032831856700,-2.954233318138960
Stint and Guillemot,1219313,EH41 3JE,55.955924317491400,-2.778115432411940
Old World warbler and swift,1218943,EH41 3RL,55.955209568355100,-2.799930194902570
thorny devil and Wallaby,1221830,EH32 9PY,55.956149491499100,-2.973915631742250
Pheasant and mountain devil,1219156,EH41 4JB,55.913016897213100,-2.751210779498540
Bunting and diamond snake,1226204,EH21 8EX,55.941635030233500,-3.022014203595320
Lemming and Chicken,1218939,EH41 3RF,55.954062312961300,-2.796719540154100
Jerboa and Shearwater,1222276,EH32 9LE,55.954149733496800,-2.981344578752030
Solitaire and hoop snake,1226206,EH21 8EZ,55.939944303445900,-3.022193804456130
fer-de-lance and deaf adder,1222311,EH32 9NZ,55.957290432406100,-2.980735345452730
frill-necked lizard and grass snake,1225967,EH21 7QW,55.943487458549000,-3.031541535718500
bicycle lizard and B,1222061,EH33 1FD,55.948750893542800,-2.947900742744260
boa and Komodo dragon,1226149,EH21 6SU,55.930841166063600,-3.064737705846930
Flameback and Zebra,1226351,EH21 6AS,55.943701509965900,-3.060303274376960
Old World warbler and Thrasher,1221732,EH33 1QG,55.941498588212200,-2.905056800352300
Jackal and diamondback turtle,1222151,EH32 9DX,55.959803038213800,-2.982272527182130
Partridge and Duck,1222500,EH32 0TJ,55.970864772318400,-2.939517168147740
Triller and Siskin,1221620,EH34 5EX,55.911370482118000,-2.886629373882380
Fox and blindworm,1222193,EH32 9GZ,55.955925648667100,-2.979483606082950
death adder and Polecat,1219283,EH41 3DB,55.957400532415300,-2.783366394931300
Egret and soft-shelled turtle,1220977,EH39 5LJ,55.995791048956000,-2.746114497953250
Marsh harrier and Linsang,1222007,EH33 1DT,55.954557705777200,-2.952254741558660
Badger and Towhee,1226268,EH21 7EE,55.941810100705200,-3.049284462275330
Minke whale and Magpie,1219296,EH41 3EN,55.955561839227000,-2.777179253304980
green turtle and Zebra,1226257,EH21 7DN,55.940604000000000,-3.051669000000000
water snake and amethystine python,1221230,EH39 4QX,56.052172347077400,-2.729445470358090
Snipe and mountain devil,1225927,EH21 7NL,55.939392786295300,-3.034985000000000
bull snake and Mink,1222325,EH32 0JG,55.968468267755900,-2.964772603708320
smooth snake and tuatara,1221844,EH32 9QR,55.958461901580400,-2.972372000368710
Thicketbird and rattlesnake,1221462,EH39 4BF,56.057921103373500,-2.728189101417180
cayman and Prion,1219093,EH41 4BN,55.955926124194900,-2.769242738748990
Herring gull and Asiatic leopard,1222274,EH32 9LB,55.954648284725100,-2.979437000000000
krait and asp,1226443,EH21 6JJ,55.945291144853000,-3.057256435596980
tiger snake and Kite,1221229,EH39 4QW,56.053430827145400,-2.723239473218730
Herring gull and Mouse,1226324,EH21 7LQ,55.945315036752300,-3.040732874199870
milk snake and adder,1225943,EH21 7PR,55.944890727531600,-3.025974780892480
Lemming and Pitohui,1221821,EH33 2HH,55.941470856821300,-2.962067906213950
Greenbul and tortoise,1219288,EH41 3DT,55.954819878404900,-2.779422541685040
Ice seal and sea snake,1220956,EH39 5JF,56.031740597162000,-2.737019321447050
Guillemot and glass snake,1222303,EH32 9NP,55.953774139952600,-2.982247941028040
River dolphin and snapping turtle,1222563,EH31 2DQ,56.039224260368800,-2.827797802751740
adder and Tit-tyrant,1221031,EH39 5PX,56.051935490526000,-2.702130690435380
boa and agamid,1218727,EH41 4NQ,55.952123519586900,-2.760871970090420
Myna and blind snake,1221639,EH33 1PT,55.939610541894000,-2.901538759915070
Rat and Marmoset,1221599,EH34 5DW,55.911960411275900,-2.885810954257190
hognose snake and black snake,1221880,EH33 2LA,55.936643590155500,-2.962348430447070
Rat and perentie,1221529,EH33 2QA,55.935395079177300,-2.946053780120780
tokay and taipan,1221767,EH33 2BN,55.939590495087800,-2.953136119207200
Masked owl and Kestrel,1222613,EH32 0AB,55.970754849867000,-2.956145502204980
Viscacha and bushmaster,1226513,EH21 6QE,55.942468775736500,-3.062591134163980
mud turtle and Macaw,1221146,EH39 4JW,56.060762308948000,-2.718655372494600
Stilt and Chipmunk,1226308,EH21 7JN,55.937976955861500,-3.037190223571160
anole and Old World warbler,2625566,EH21 8SZ,55.934418000000000,-3.086786000000000
B and Perching duck,1222118,EH33 1NH,55.944569031358600,-2.990629003091030
Puffleg and swift,1218828,EH41 4PG,55.906070995309600,-2.721229508606820
Mink and glass snake,1222312,EH32 9PA,55.956679493052000,-2.979598745923030
Fish eagle and Stilt,1221430,EH33 2PP,55.936557225936200,-2.943312722019510
Condor and frilled lizard,1222356,EH32 0LY,55.976188809630200,-2.895419042429910
rock python and loggerhead,1218844,EH41 4QJ,55.903136727910300,-2.747692998811790
Goose and Chicken,1219397,EH41 3NW,55.956407898703300,-2.782625622835040
snake and Meadowlark,2585162,EH22 1SX,55.927330000000000,-3.087192000000000
hoop snake and Fulmarine petrel,2641124,EH21 8ST,55.935015000000000,-3.084274000000000
constrictor and diamond python,1226303,EH21 7JF,55.938498416098100,-3.039285331759640
