name,id,postcode,lat,lon
Eagle and horned toad,403271,SA61 1EG,51.797699826311000,-4.979795913792230
Mink and snake,401640,SA63 4XE,51.843013000000000,-4.846512377907430
grass snake and Siskin,401044,SA67 8AZ,51.746580977251600,-4.851838784422520
Mole and Triller,403047,SA61 1TS,51.800943438536400,-4.963922292077970
amethystine python and Civet,403098,SA61 2BB,51.800747246904100,-4.988352698253460
carpet snake and Tattler,403404,SA61 1PU,51.798744714603500,-4.966940236099480
Snipe and Treepie,408663,SA34 0SD,51.869782171661700,-4.630540200937450
loggerhead and galliwasp,403199,SA61 2LE,51.802436483066600,-4.966413931880160
python and grass snake,399057,SA73 1RZ,51.714911427249600,-4.950934482686800
Badger and moloch,402824,SA62 4AN,51.794559893968800,-4.905152662507920
boa constrictor and Wader,403093,SA61 2AT,51.815307000000000,-4.963987212531520
boa constrictor and green turtle,408700,SA34 0UU,51.865388270412400,-4.681329028718310
smooth snake and Komodo dragon,400061,SA70 8RW,51.703495518965600,-4.774002888810500
snake and agamid,398943,SA73 1LB,51.734971000000000,-4.947983000000000
monitor and kabaragoya,403020,SA62 3EX,51.752245156010600,-5.002377194166010
Minke whale and leguaan,403411,SA61 1QE,51.798801294124300,-4.971249000000000
Minke whale and Old World quail,403095,SA61 2AY,51.800001681192200,-4.989376819359700
rock python and Solitaire,403398,SA61 1PL,51.796979445042100,-4.976851000000000
Ground sloth and Warbler,400926,SA67 8UD,51.795384044439800,-4.706846706459960
Asiatic leopard and massasauga,401029,SA67 8AE,51.768018000000000,-4.793310000000000
Linsang and death adder,401275,SA66 7SR,51.846507557996800,-4.726845412985090
Pheasant and Black cockatoo,401701,SA66 7LF,51.910412784630600,-4.791295687033060
asp and Mouse,402863,SA61 2SF,51.801609060266400,-4.977080000766180
Rabbit and Dolphin,402834,SA61 2QS,51.814064598440100,-4.958602292621010
box turtle and Snipe,2615416,SA61 9DT,51.792569000000000,-4.979156000000000
Pratincole and grass snake,403406,SA61 1PX,51.800540975433000,-4.969886980594080
Quetzal and Booted eagles,401019,SA68 0TA,51.714170363362700,-4.832409675320060
sand viper and diamondback,403297,SA61 1HZ,51.798325870599600,-4.989846117412430
chuckwalla and elapid,401280,SA66 7SY,51.858468432913800,-4.728019264390640
Kākāriki and racer,401603,SA66 7HW,51.841014785802500,-4.776689878379230
Chickadee and thorny devil,402877,SA61 2TE,51.802864455334100,-4.990683391127750
thorn lizard and Badger,401424,SA67 7EE,51.802300259398700,-4.745978156333040
massasauga and Chickadee,402519,SA62 4LA,51.781704934296800,-4.973201969306200
Black cockatoo and leathery turtle,400800,SA69 9JX,51.712742064131900,-4.704570395037410
Prion and flying lizard,402452,SA62 4DJ,51.822603990350700,-4.945185805075850
Vole and pit viper,401205,SA67 8NN,51.734571029509100,-4.650051800941800
chameleon and mud turtle,401973,SA63 4QL,51.862222394255900,-4.890803603383520
Pratincole and slowworm,402461,SA62 4DW,51.825868216420900,-4.944847334753660
king cobra and White ibis,402433,SA62 4BE,51.815232222864500,-4.892929920987290
Condor and ringhals,403237,SA61 1BD,51.800932116759100,-4.967577168521330
sea snake and thorn lizard,400627,SA68 0XU,51.731636905429000,-4.717053926788690
Rabbit and Linsang,402127,SA62 6EA,51.814552447621400,-5.003182597466740
diamondback terrapin and hoop snake,400810,SA69 9LJ,51.713958472373500,-4.705641974926930
Gila monster and Stilt,401422,SA67 7EB,51.798383888500300,-4.738066937190270
Jackal and Ground sloth,402893,SA61 2TZ,51.803679821646600,-4.985500232404730
bandy-bandy and Skunk,403384,SA61 1NT,51.796676610537600,-4.972969032409300
diamondback terrapin and Prion,402701,SA62 3PS,51.755496539242600,-4.993390634781270
Old World warbler and sidewinder,402622,SA62 5DA,51.865327327336500,-4.959744812665770
perentie and racer,401300,SA67 8QL,51.753376669727300,-4.673439215872050
saltwater crocodile and Asiatic leopard,400625,SA68 0XS,51.730647050728500,-4.713967551413030
boa constrictor and Condor,402939,SA61 1SA,51.796980853982500,-4.967694672289270
krait and snapping turtle,401085,SA68 0TR,51.703195434295200,-4.820940087685950
Mouse and Ice seal,401310,SA67 8QZ,51.793008620100100,-4.744499635817160
rattlesnake and Darwin's finches,402703,SA62 3PU,51.754204000000000,-4.991943000000000
Quetzal and Armadillo,399090,SA73 1TS,51.709399700258200,-4.951588873426950
python and Wallaby,401295,SA67 8QE,51.760816093105000,-4.641154524178470
Ice seal and fer-de-lance,403268,SA61 1ED,51.793666332367600,-4.984214655994910
Cloud rat and Marsh harrier,399067,SA73 1SN,51.707300294762500,-4.946370916082160
Linsang and saltwater crocodile,402478,SA62 4ET,51.771688048433400,-4.957437197571380
Francolin and River dolphin,1808374,SA62 3QH,51.759447326500000,-4.992835000000000
diamondback terrapin and bearded lizard,402730,SA61 2PP,51.806510848348000,-4.965695063945530
Argus and amethystine python,401702,SA66 7LG,51.910166999827400,-4.794828474157790
Argus and Eagle,401335,SA66 7TT,51.866461258720300,-4.728503169280470
chuckwalla and agamid,402854,SA61 2RS,51.803729194137300,-4.976465403204820
Shearwater and anaconda,400887,SA69 9PF,51.704974751622600,-4.702485656680340
whip snake and Black jay,403309,SA61 1JS,51.788964000000000,-4.977117000000000
leathery turtle and diamondback turtle,401211,SA67 8NU,51.727048066591700,-4.681153012916680
carpet snake and Coati,400867,SA67 8TW,51.782278102713100,-4.706569166533630
amethystine python and agamid,401397,SA67 7BU,51.799168300868200,-4.740681907706960
Petrel and giant tortoise,401612,SA66 7JH,51.845410371258600,-4.769540747110320
Bunting and blue racer,402690,SA62 3PB,51.763385561333200,-4.996159490635760
bandy-bandy and grass snake,403395,SA61 1PG,51.796763432772100,-4.975933790625800
Fox and Flameback,402311,SA62 5LU,51.898066644571000,-4.971070976449160
Badger and tortoise,403213,SA61 2NF,51.803612000000000,-4.965889985886180
Myna and Skunk,401597,SA66 7HP,51.848850553534200,-4.769723028606670
cerastes and Masked owl,400761,SA69 9EE,51.700562745101500,-4.743037972249100
loggerhead and thorny devil,402027,SA62 5UB,51.922930254167300,-4.988046000000000
pit viper and Maya,401394,SA67 7BQ,51.798333000000000,-4.743010000000000
green turtle and constrictor,400930,SA67 8UH,51.797839143057900,-4.678202142787640
massasauga and Parrotlet,403157,SA61 2EG,51.802283820576300,-4.971031594721390
taipan and Rabbit,400786,SA69 9HT,51.707923835467400,-4.705252701489530
adder and Black cockatoo,403316,SA61 1LD,51.790420875263000,-4.971888000000000
dugite and Myna,401134,SA67 8EU,51.807606275848200,-4.777739595274510
coral snake and Parakeet,401408,SA67 7DJ,51.800317445164200,-4.738068111866000
rat snake and gavial,401258,SA66 7RP,51.910205000000000,-4.696170000000000
king cobra and gopher snake,408540,SA34 0NU,51.770509339925000,-4.640821963246740
Flameback and tuatara,398941,SA73 1JY,51.749052950463000,-4.973011794045960
king snake and Old World vulture,400898,SA69 9PU,51.703985367865800,-4.707174323417720
White ibis and Armadillo,401324,SA67 8RS,51.775666000000000,-4.735052000000000
cycling lizard and Kestrel,401133,SA67 8ET,51.814060460637600,-4.790820000000000
Warbler and sand lizard,401503,SA67 7EX,51.811884453788900,-4.745327787507790
Coati and python,401276,SA66 7SS,51.846695000000000,-4.735467000000000
whip snake and rattlesnake,401210,SA67 8NT,51.728014210591500,-4.680196462089350
bicycle lizard and Piping shrike,401182,SA67 8LG,51.772003217135900,-4.705200206560710
rock snake and Siskin,401174,SA67 8JX,51.732826000000000,-4.699078000000000
bushmaster and milk snake,403158,SA61 2EH,51.802482102638000,-4.973148147890610
carpet snake and gopher snake,402225,SA62 5DE,51.878051699247500,-4.946209641088340
Duck and Old World warbler,2615371,SA62 3AQ,51.750701000000000,-4.999324000000000
puff adder and iguana,1808366,SA61 1TE,51.797676448900000,-4.968655052400000
Nukupuʻu and rock python,401151,SA67 8HT,51.818605282155800,-4.780781856748060
Polecat and Mamo,399092,SA73 1TU,51.708274239326800,-4.950922013252110
worm lizard and Parrotbill,401355,SA66 7XE,51.899456565450600,-4.705585971279920
habu and worm lizard,408541,SA34 0NX,51.778845000000000,-4.635712000000000
iguana and anaconda,408908,SA34 0BE,51.824025484201500,-4.617626113875220
Argus and fer-de-lance,401089,SA68 0TW,51.733366244589000,-4.714608523449540
Linsang and Pitohui,401017,SA68 0SX,51.712423105731800,-4.813812526585610
snake and cycling lizard,400879,SA69 9NT,51.707000107115800,-4.697713706894390
copperhead and iguana,399046,SA73 1RL,51.712720585990900,-4.952934527876600
Boto and Pheasant,402816,SA62 4AA,51.791724000000000,-4.945405000000000
rattlesnake and Jackal,398967,SA73 1NP,51.727573693593500,-4.921128546808300
Duck and Zebra,401306,SA67 8QT,51.794250000000000,-4.743792000000000
Songlark and thorny devil,398974,SA73 1NX,51.708208905501900,-4.922616003182860
boomslang and king cobra,400851,SA67 8TA,51.797786002809100,-4.728588117194320
carpet snake and American sparrow,401510,SA67 7NZ,51.813895146432900,-4.707506712354610
Pheasant and taipan,401005,SA68 0SE,51.727431000000000,-4.740190000000000
Puffleg and leathery turtle,401297,SA67 8QG,51.760296802659700,-4.653819589247840
