name,postcode,lat,lon
Tattler and soft-shelled turtle,GL3 4SJ,51.824648707397900,-2.119133848253360
Bunting and Argus,GL3 4UG,51.844969701818000,-2.117706968827140
Mink and milk snake,GL3 4XG,51.844692000000000,-2.124464000000000
Komodo dragon and Grouse,GL50 1DB,51.901297124884200,-2.074411846043300
cobra and Dorcopsis,GL50 1DD,51.901441345735400,-2.073830716981690
Cuscus and Polecat,GL50 1HZ,51.898516186043700,-2.078650947714990
Lemming and horned toad,GL50 1NW,51.897841393196600,-2.079361884641220
Asiatic leopard and milk snake,GL50 1SR,51.896338021740900,-2.081946000000000
rat snake and leathery turtle,GL50 1UL,51.895692482866600,-2.079678000000000
Prion and bull snake,GL50 2BU,51.888705315838300,-2.081350892215780
anaconda and Greenbul,GL50 2DX,51.892759705040200,-2.082055744146170
dugite and Marmoset,GL50 2GB,51.887847378845400,-2.080637000000000
Armadillo and Peafowl,GL50 2HB,51.886932915303100,-2.083062166054500
Duck and mamba,GL50 2HD,51.887193855612300,-2.082772056382970
amphisbaena and constrictor,GL50 2HP,51.893641000000000,-2.083133000000000
death adder and Songlark,GL50 2HZ,51.894058170996400,-2.089193242156740
monitor and Piping shrike,GL50 2LA,51.887590435920700,-2.093437614814720
Booted eagles and Mole,GL50 2LJ,51.894898000000000,-2.086564909349080
galliwasp and garter snake,GL50 2NR,51.900485000000000,-2.090856000000000
Masked owl and Linsang,GL50 2RP,51.887780323443100,-2.092072208515260
Minke whale and Zebra,GL50 2SD,51.884941709768900,-2.088826451078580
blue tongue and Darwin's finches,GL50 2SP,51.885878603227100,-2.086358341685290
Guillemot and indigo snake,GL50 2SS,51.883851158424400,-2.092267557433240
Linsang and New World blackbird,GL50 2TB,51.890440034669000,-2.082095097913030
Kangaroo and Old World warbler,GL50 2TL,51.892288448658700,-2.087228009026540
krait and Zebra,GL50 2TR,51.892979291373000,-2.089307000000000
Kangaroo and deaf adder,GL50 2TX,51.891073440652300,-2.088882167771800
Towhee and Piping shrike,GL50 2XG,51.892212984830900,-2.079846000000000
cobra and Viscacha,GL50 2XL,51.893632854909400,-2.080560575943750
Macaw and Grouse,GL50 3AX,51.896894572583300,-2.083371246709650
New World blackbird and Shearwater,GL50 3DB,51.900467383342600,-2.078378222452710
Nukupuʻu and frilled lizard,GL50 3DN,51.899216706138600,-2.079785787043570
B and Parakeet,GL50 3EP,51.897364116085000,-2.080480073453900
bicycle lizard and Shearwater,GL50 3HJ,51.902421000000000,-2.076463000000000
soft-shelled turtle and Jay,GL50 3LA,51.902283861784900,-2.077887222073470
White ibis and habu,GL50 3LW,51.902498005123300,-2.080314862863860
Puffleg and krait,GL50 3LZ,51.903612000000000,-2.082728687954830
cobra and Parrotlet,GL50 3PF,51.899097287566300,-2.083433470483030
Old World vulture and death adder,GL50 3PG,51.900818239284800,-2.078059086985700
flying dragon and Gull,GL50 3PL,51.900945000000000,-2.077972000000000
Mouse and Songlark,GL50 3PR,51.900762474237400,-2.080631000000000
tree snake and terrapin,GL50 3QW,51.902515000000000,-2.083120000000000
leguaan and Masked owl,GL50 3RG,51.901016000000000,-2.079963071253150
death adder and Warbler,GL50 3RQ,51.903750395137900,-2.089081678996290
jew lizard and dugite,GL50 4AS,51.904719285772200,-2.079519397927680
Buzzard and Armadillo,GL50 4BL,51.905696870000200,-2.083009668811140
Mole and Fish eagle,GL50 4DB,51.908234562131200,-2.079729136010830
Parrotlet and Parakeet,GL50 4EL,51.910036100621200,-2.081535170884620
diamond python and king snake,GL50 4ES,51.905953465117600,-2.075844062265110
Scimitar babbler and Eagle,GL50 4GJ,51.911716346789300,-2.083021051107010
skink and black snake,GL50 4HJ,51.907327998170000,-2.077474429228990
wall lizard and gecko,GL50 4HL,51.908109309369700,-2.078813122986320
Piping shrike and monitor,GL50 4HQ,51.907912689243000,-2.077039349855470
sidewinder and king snake,GL50 4JJ,51.904336696125200,-2.073355821066750
Jerboa and Maya,GL50 4LF,51.907816229797900,-2.073230683526550
Tit-tyrant and Fish eagle,GL50 4LY,51.906412000000000,-2.076993000000000
goanna and racer,GL50 4NG,51.911754519252000,-2.072742836185650
garter snake and Guillemot,GL50 4NX,51.915304044465400,-2.075670867352920
Eagle and caiman,GL50 4PG,51.919064708635700,-2.085142683500050
Parrotlet and Francolin,GL50 4PY,51.914010643775100,-2.073662405464140
Asiatic leopard and rat snake,GL50 4QG,51.914609787568300,-2.071802714439880
horned viper and Rabbit,GL50 4RG,51.916207233712000,-2.082898260088860
anaconda and monitor,GL50 4RH,51.916664624456200,-2.084498408337190
Macaw and rat snake,GL50 4YQ,51.905652590676500,-2.082050239670910
Herring gull and Skunk,GL50 9AL,51.905654000000000,-2.082050000000000
sand lizard and Egret,GL50 9AN,51.905652590676500,-2.082050239670910
Herring gull and Scimitar babbler,GL50 9BJ,51.905654000000000,-2.082050000000000
Marsh harrier and leathery turtle,GL50 9DP,51.905661000000000,-2.082043000000000
agama and sea snake,GL50 9EB,51.905661000000000,-2.082043000000000
brown snake and chuckwalla,GL50 9EL,51.905661000000000,-2.082043000000000
slowworm and chameleon,GL50 9EN,51.905661000000000,-2.082043000000000
Boto and dukite,GL50 9GF,51.905661000000000,-2.082043000000000
iguana and coral snake,GL50 9UN,51.905657204397900,-2.082050496918800
Armadillo and brown snake,GL50 9XP,51.905657204397900,-2.082050496918800
mud turtle and Bronzewing pigeon,GL51 0BH,51.912841591431800,-2.108696791833910
Cuscus and cobra de capello,GL51 0DD,51.908474480513200,-2.115561977897710
Polecat and hoop snake,GL51 0ES,51.911040770476100,-2.111527208409040
garter snake and glass snake,GL51 0FP,51.897545617357100,-2.120257000000000
Snipe and Songlark,GL51 0FW,51.897987915562900,-2.118804957212360
racer and alligator,GL51 0HX,51.903437236481900,-2.117947272948250
Grackle and mamba,GL51 0HZ,51.903579886584100,-2.119139509132120
thorny devil and Kangaroo,GL51 0JF,51.904468643655600,-2.120246000000000
Pratincole and Hawk,GL51 0JH,51.905123609573700,-2.121774509266960
Linsang and cayman,GL51 0LU,51.910545538126700,-2.121338553449030
flying lizard and Egret,GL51 0LW,51.910240315206800,-2.120887080553330
Night heron and smooth snake,GL51 0ND,51.910425725610600,-2.124143892041120
sand viper and Perching duck,GL51 0RA,51.910038911097800,-2.115536928392930
hawksbill and water snake,GL51 0RB,51.910308492426700,-2.115465000000000
coral snake and diamondback,GL51 0RH,51.908805000000000,-2.118950000000000
Marmoset and Gila monster,GL51 0WW,51.915314874615900,-2.117207910396660
Coati and saltwater crocodile,GL51 0XN,51.902650861923700,-2.122029431387610
puff adder and gavial,GL51 3AY,51.889274069366000,-2.101447301239180
Chickadee and Partridge,GL51 3BR,51.889969145070500,-2.098179506405540
bushmaster and snapping turtle,GL51 3DH,51.881481812258600,-2.098117384046670
Chickadee and agama,GL51 3DP,51.879621151286600,-2.097575817508020
American sparrow and skink,GL51 3DQ,51.881239784436200,-2.097100000000000
Tahr and Mamo,GL51 3HG,51.884607463611500,-2.101843574379010
turtle and diamondback turtle,GL51 3JB,51.886786701431400,-2.117409586451940
Rabbit and Eagle,GL51 3JP,51.886135177368900,-2.112496991335180
Wader and Siskin,GL51 3JR,51.884206132169100,-2.108249799065640
Herring gull and bandy-bandy,GL51 3LY,51.887221775446100,-2.104159707852830
Hawaiian honeycreeper and Nukupuʻu,GL51 3NY,51.890761569092700,-2.107059533355170
rock python and milk snake,GL51 3NZ,51.887296942441700,-2.110451218440080
diamondback turtle and galliwasp,GL51 3PP,51.889073005743100,-2.114756527117330
Quetzal and diamondback,GL51 3QQ,51.883514985994900,-2.116442167479990
caiman and diamond python,GL51 3QY,51.888179538633100,-2.108855094704490
garter snake and Logrunners,GL51 3RZ,51.880705310645300,-2.111844195545490
Guillemot and Marsh harrier,GL51 3YD,51.880264411879000,-2.112206283378790
sidewinder and Grosbeak,GL51 4GA,51.873923003737200,-2.105566909919730
terrapin and slowworm,GL51 4TL,51.861913477106900,-2.121744685588070
Fulmarine petrel and Herring gull,GL51 4TU,51.860617228801400,-2.123236847477360
fer-de-lance and perentie,GL51 4UF,51.859239000000000,-2.116155000000000
bushmaster and garter snake,GL51 6AG,51.894755346214600,-2.114640246288630
agama and cerastes,GL51 6BZ,51.895703076690500,-2.119946974176790
jew lizard and brown snake,GL51 6EE,51.891031223991500,-2.096786865523700
tuatara and gavial,GL51 6ER,51.890309639615200,-2.109644906672200
Tree warbler and rock snake,GL51 6HZ,51.885368203889000,-2.124365000000000
amethystine python and Partridge,GL51 6PA,51.889314430754600,-2.124870230335310
rattlesnake and Snipe,GL51 6PX,51.893209868268300,-2.093260391842660
Macaw and snake,GL51 7AP,51.895132566116900,-2.105471407496340
blindworm and thorny devil,GL51 7DB,51.898318685113900,-2.111568297391890
Maya and Piping shrike,GL51 7DJ,51.898721938643000,-2.112964498352550
leguaan and Boto,GL51 7EE,51.897706165291600,-2.102977772136980
agama and Diving bird,GL51 7EU,51.896854291596600,-2.110387510829760
Dorcopsis and Parakeet,GL51 7JY,51.908096715052600,-2.106199592643330
Darwin's finches and Badger,GL51 7LJ,51.907959846911700,-2.108394252113610
Black jay and Parakeet,GL51 7PH,51.909660259156300,-2.107148185602450
viper and chameleon,GL51 7PQ,51.910246709922800,-2.104881804871880
Francolin and Mole,GL51 7QA,51.904429990276900,-2.114141663429430
jew lizard and carpet snake,GL51 7QQ,51.903467957918600,-2.114153754368540
sidewinder and Philippine hawk-owl,GL51 7TZ,51.898331086593900,-2.117294410980540
turtle and Peafowl,GL51 8BD,51.904054315786700,-2.102280107253450
American sparrow and Boto,GL51 8BJ,51.903552149142100,-2.100752800541500
mountain devil and cycling lizard,GL51 8BL,51.903974455727100,-2.101058983333620
Darwin's finches and adder,GL51 8BP,51.902868683768300,-2.100940218192680
brown snake and Solitaire,GL51 8DB,51.902937365114700,-2.104646718516420
Skunk and dugite,GL51 8DP,51.905401136348800,-2.104332677556110
thorny devil and Kestrel,GL51 8DZ,51.908099283200800,-2.103321400124570
sand lizard and garter snake,GL51 8HF,51.900886000000000,-2.097201021281690
Tattler and copperhead,GL51 8HT,51.905855162421800,-2.099159047232790
asp and Dorcopsis,GL51 8JN,51.905342047455700,-2.088721450246110
python and box turtle,GL51 8LT,51.910824011779800,-2.102746179369270
tiger snake and Polecat,GL51 8NE,51.902993422193100,-2.091347591532260
diamondback and deaf adder,GL51 8NY,51.907377000000000,-2.097796000000000
fer-de-lance and Thrasher,GL51 8PS,51.900478141157700,-2.099743067104840
cobra de capello and Skunk,GL51 9DH,51.910813931816000,-2.093282418119960
moloch and sea snake,GL51 9JJ,51.910918073334300,-2.086435582659930
Komodo dragon and Hawaiian honeycreeper,GL51 9PA,51.915566000000000,-2.098273000000000
Chicken and B,GL51 9QG,51.920256325125200,-2.090699331966840
Old World warbler and Stint,GL51 9QY,51.922356815711900,-2.094949537726630
diamond python and Treepie,GL51 9SQ,51.919706664971400,-2.103071849733030
Greenbul and constrictor,GL51 9TX,51.918162961496300,-2.099927750813990
Partridge and caiman,GL52 2AA,51.904770090968700,-2.070362262146390
wall lizard and alligator,GL52 2ER,51.900618456338700,-2.066707733216620
Solitaire and Vulture,GL52 2HU,51.903719205421800,-2.068601886397580
grass snake and Towhee,GL52 2LT,51.901163364967100,-2.072652996360710
gaboon viper and tokay,GL52 2NH,51.902755968928100,-2.070649796110530
puff adder and bearded lizard,GL52 2QG,51.903660765579300,-2.060433171868280
Old World quail and Greenbul,GL52 3AR,51.913647677012200,-2.044643673853600
Parrotlet and Zebra,GL52 3BW,51.919283412356400,-2.048444227158130
cayman and Mockingbird,GL52 3BY,51.913612833720600,-2.041605169525950
lizard and bearded dragon,GL52 3DN,51.914888000000000,-2.048498286339810
perentie and boomslang,GL52 3DX,51.915748628175900,-2.051697098400990
Badger and Jerboa,GL52 3EA,51.915540567213900,-2.054502837948920
asp and moloch,GL52 3EE,51.914570448786700,-2.052553506523830
Cloud rat and Cuscus,GL52 3JD,51.911462693884200,-2.064412410352680
Rabbit and dugite,GL52 3JN,51.914138358063000,-2.070667724690350
Petrel and Herring gull,GL52 3JT,51.915145057354200,-2.071120008411580
mamba and snapping turtle,GL52 3JY,51.912460192876500,-2.065286109006900
copperhead and Jackal,GL52 3LA,51.915238000000000,-2.068750000000000
Marmoset and Polecat,GL52 3LB,51.915247734080800,-2.064810000000000
sidewinder and Tit-tyrant,GL52 3LT,51.914868930997500,-2.066874000000000
bicycle lizard and Tit-tyrant,GL52 5BG,51.910601846850400,-2.038869383420860
Stint and Night heron,GL52 5DF,51.910593915739200,-2.035540367610890
Black jay and Moluccan boobook,GL52 5DH,51.909964711235700,-2.035031073872170
python and racer,GL52 5EF,51.909480932950700,-2.054102973392250
Cloud rat and amphisbaena,GL52 5EY,51.907729954716100,-2.049027713952220
Linsang and Chipmunk,GL52 5FQ,51.901431000000000,-2.040220000000000
Elephant and Mockingbird,GL52 5FW,51.901692000000000,-2.043062000000000
hoop snake and Peafowl,GL52 5HF,51.911190522864900,-2.051139418345570
Rat and black snake,GL52 5SE,51.909569394178100,-2.034085870293640
chuckwalla and Tit-tyrant,GL52 5YL,51.905652590676500,-2.082050239670910
perentie and diamondback turtle,GL52 6BE,51.898417812574800,-2.062882222123460
mud turtle and flying dragon,GL52 6DG,51.897003888062900,-2.067138342273640
Philippine hawk-owl and iguana,GL52 6DS,51.896888259450000,-2.064914660808810
Elephant and boomslang,GL52 6EN,51.894775881586900,-2.064054213353910
asp and diamond snake,GL52 6EZ,51.894908727964400,-2.067643830822410
fer-de-lance and python,GL52 6FA,51.898101000000000,-2.066798000000000
thorny devil and Macaw,GL52 6JW,51.893251056068100,-2.057047823863870
asp and Kākāriki,GL52 6LP,51.887492428607400,-2.046869706769650
Parakeet and garter snake,GL52 6LS,51.888283769583100,-2.046507285569730
dukite and Kite,GL52 6NX,51.894880876919200,-2.051716621523070
Polecat and diamond snake,GL52 6QQ,51.896033568462300,-2.047314616785770
Skunk and Lemming,GL52 6RA,51.896298172844100,-2.058635747862300
Jay and puff adder,GL52 6RJ,51.893375758071600,-2.059402101923730
horned viper and Coati,GL52 6RQ,51.892395887231000,-2.059139241082410
loggerhead and Darwin's finches,GL52 6SD,51.893939914571400,-2.063718788819490
Egret and cayman,GL52 6SH,51.892836077569200,-2.059851861430560
tokay and black snake,GL52 6SJ,51.893869175502200,-2.061495328950450
Condor and Buzzard,GL52 6TH,51.894174872114000,-2.061481216170510
Parakeet and Kite,GL53 0AH,51.874342435338200,-2.074512443833000
gopher snake and horned toad,GL53 0FE,51.882190000000000,-2.076349000000000
Hawk and Duck,GL53 0JR,51.883504694080800,-2.086789631444040
Eagle and frill-necked lizard,GL53 0JW,51.884204426126300,-2.088868579497530
ringhals and thorny devil,GL53 0LN,51.880072607373800,-2.083441720363530
Jerboa and diamondback,GL53 0NZ,51.874336964549100,-2.082675746221160
tiger snake and hognose snake,GL53 0PZ,51.877644963533900,-2.095378021686030
fer-de-lance and kabaragoya,GL53 7BA,51.886489916899400,-2.073239484526140
Ground sloth and Tahr,GL53 7BD,51.887216645466800,-2.075652586239250
Capuchin and smooth snake,GL53 7EB,51.882875000000000,-2.075660000000000
harlequin snake and Vulture,GL53 7ED,51.889113194822900,-2.069393500559540
Prion and elapid,GL53 7GA,51.890157125425900,-2.068073000000000
Jerboa and diamondback,GL53 7PF,51.885255423224200,-2.077508992252990
Fish eagle and Chickadee,GL53 7QX,51.890835787523000,-2.067782999737070
Towhee and bandy-bandy,GL53 8BN,51.886087861181300,-2.051604773353630
New World blackbird and agamid,GL53 8DF,51.879037836289700,-2.054211516356740
monitor and diamondback turtle,GL53 8DW,51.878289697956400,-2.058161884760580
monitor and copperhead,GL53 8LB,51.879227222998700,-2.052947892821940
mamba and Piping shrike,GL53 8LQ,51.878328732013800,-2.051610371175960
Armadillo and adder,GL53 8PD,51.879203463254800,-2.045292119207090
dukite and worm lizard,GL53 9AT,51.884539000000000,-2.060218707061440
wall lizard and Hawk,GL53 9BW,51.882971713771700,-2.062497371769660
mamba and Marsh harrier,GL53 9EG,51.877572289253200,-2.071089545852020
crocodile and Eagle,GL53 9HS,51.877992919550600,-2.058321293149520
Chicken and moloch,GL53 9PB,51.812428000000000,-2.047357000000000
Myna and cerastes,GL53 9QU,51.849738000000000,-2.083676000000000
saltwater crocodile and elapid,GL54 2BX,51.884116354233800,-1.758284150944690
Vulture and puff adder,GL54 2DN,51.882211000000000,-1.757800000000000
Gila monster and Petrel,GL54 2DX,51.877824445705700,-1.746275288367530
Stint and harlequin snake,GL54 2EA,51.878657294778600,-1.748929025680540
New World blackbird and death adder,GL54 2EB,51.880211089609000,-1.748164955611950
Komodo dragon and Tattler,GL54 2GG,51.895115165062000,-1.755362362737730
moloch and chameleon,GL54 2HL,51.890768854041300,-1.762331654053350
Prion and Komodo dragon,GL54 2HY,51.902886863575000,-1.761497441714680
Shearwater and Coati,GL54 2JB,51.908327222020900,-1.775685308583890
gavial and Logrunners,GL54 2JZ,51.892004416692700,-1.755408298201680
thorny devil and smooth snake,GL54 3BX,51.893415000000000,-1.874298000000000
tiger snake and Bronzewing pigeon,GL54 3DX,51.824935000000000,-1.751957704315320
racer and Fish eagle,GL54 3EW,51.829071847117900,-1.835283302724480
Ibex and Shearwater,GL54 3FR,51.834453000000000,-1.825105000000000
Chicken and Meadowlark,GL54 3HT,51.829079045778800,-1.834006316124620
Capuchin and Thrasher,GL54 3JS,51.799319000000000,-1.885987000000000
snapping turtle and diamondback turtle,GL54 3LG,51.823597000000000,-1.888320000000000
Zebra and Kākāriki,GL54 3PR,51.814305077323000,-1.773569770099280
Meadowlark and Crow,GL54 3PU,51.790301969327600,-1.796757000000000
bicycle lizard and Night heron,GL54 3QR,51.789057234655500,-1.773116000000000
milk snake and deaf adder,GL54 3RL,51.833029246644300,-1.836270229509410
Mamo and boomslang,GL54 4AF,51.808205172700600,-1.925111259828580
soft-shelled turtle and Parrotlet,GL54 4AH,51.802895575440200,-1.917738256405740
Skunk and Grackle,GL54 4AY,51.876170000000000,-1.967923000000000
Cloud rat and blue tongue,GL54 4BU,51.802610000000000,-1.923110000000000
flying dragon and elapid,GL54 4DE,51.835441294812200,-1.929115360831430
Viscacha and Old World quail,GL54 4JD,51.865714509962600,-1.947860320586620
Bunting and Tattler,GL54 4JR,51.876456353391100,-1.966282000000000
gecko and Kangaroo,GL54 4LE,51.872672572121600,-1.971716769503350
Herring gull and Jackal,GL54 4LH,51.868378000000000,-1.978168000000000
Jerboa and hawksbill,GL54 4LW,51.863495097216600,-1.983615964863120
Goose and Duck,GL54 4LY,51.870057340213900,-1.976888968378010
Duck and tree snake,GL54 4NE,51.800714232100200,-1.922875848866460
Booted eagles and jew lizard,GL54 5AR,51.924272703495600,-1.931666238040620
Tattler and amethystine python,GL54 5TB,51.900505635131300,-1.924595084555070
giant tortoise and Capuchin,GL54 5UE,51.919955000000000,-1.857111000000000
bicycle lizard and Dolphin,GL6 7JG,51.755324009181700,-2.081718700404520
mountain devil and Minke whale,GL6 7NU,51.729554620068300,-2.123791529620750
Mole and Black cockatoo,GL7 1DA,51.714963655102900,-1.951492340611990
Partridge and Viscacha,GL7 1DD,51.714136129466800,-1.950668198080130
puff adder and loggerhead,GL7 1DN,51.712159801987300,-1.954983426508530
Ground sloth and dukite,GL7 1DU,51.710970412020200,-1.948703284964780
Goose and moloch,GL7 1DZ,51.713191303752700,-1.948888944823190
Elephant and Triller,GL7 1EP,51.715587509854200,-1.960842236277430
boa and soft-shelled turtle,GL7 1EQ,51.713151870826000,-1.963971000000000
Puffleg and Petrel,GL7 1JH,51.716048292154900,-1.968195000000000
tokay and diamondback terrapin,GL7 1JT,51.711002212294800,-1.961396146192520
boa and saltwater crocodile,GL7 1LU,51.721548199076000,-1.948373000000000
hognose snake and Egret,GL7 1NR,51.707718614813000,-1.956145571914830
cerastes and Schneider python,GL7 1PE,51.704220115567000,-1.953674406171400
blind snake and adder,GL7 1PG,51.703690409142100,-1.955686378804440
Meadowlark and mamba,GL7 1QB,51.706881000000000,-1.980835267446850
Kite and Thrasher,GL7 1SA,51.708317198943900,-1.973555088619090
Stilt and Old World quail,GL7 1SZ,51.713432656580600,-1.971251000000000
amphisbaena and Rabbit,GL7 1TR,51.708308000000000,-1.966579000000000
Grosbeak and Ibex,GL7 1WA,51.704433157839600,-1.974165111980550
wall lizard and flying lizard,GL7 1WR,51.708983000000000,-1.969444000000000
Condor and gopher snake,GL7 1XP,51.709809846531800,-1.974089717062180
Myna and Stilt,GL7 1XS,51.710161213204400,-1.977591940213420
Grouse and Parrotbill,GL7 1YN,51.707796936796500,-1.979792848111620
Coati and asp,GL7 1ZA,51.720227000000000,-1.945962000000000
Thrasher and taipan,GL7 2BH,51.718359768307100,-1.971276646668760
Lemming and king snake,GL7 2DZ,51.725579652882300,-1.971330024695650
sea snake and Macaw,GL7 2EF,51.718090611060300,-1.973766575605010
flying dragon and smooth snake,GL7 2HG,51.726989681668600,-1.965422039111270
Lemming and boa constrictor,GL7 2HQ,51.727754000000000,-1.962627000000000
Vulture and lizard,GL7 2HU,51.727792594074700,-1.976454008092210
Tahr and Siskin,GL7 2JU,51.726893643297700,-1.977279724978290
sand lizard and Songlark,GL7 2LH,51.730544588198400,-1.980507000000000
agama and rock snake,GL7 2NB,51.731112000000000,-1.981129000000000
Piping shrike and harlequin snake,GL7 2PY,51.716784172481200,-1.963259000000000
Shearwater and Parrotlet,GL7 4AN,51.706884729221700,-1.776218705791480
Jackal and gaboon viper,GL7 4DA,51.705861043324600,-1.786599793979750
leguaan and horned toad,GL7 4DJ,51.708565464145600,-1.780667901100310
garter snake and indigo snake,GL7 4JF,51.710697281499700,-1.791049225494450
hawksbill and chameleon,GL7 5AS,51.754142000000000,-1.762020000000000
Rat and worm lizard,GL7 5DH,51.731608999819500,-1.805823575142890
Stint and Thicketbird,GL7 5NG,51.758622400463700,-1.838306611330800
thorn lizard and bandy-bandy,GL7 5NL,51.759351071451800,-1.838593783995320
Chipmunk and Mole,GL7 5RR,51.713311919843000,-1.909925000000000
Rabbit and gecko,GL7 5RY,51.717380405424900,-1.904315338868060
tortoise and Wallaby,GL7 5ST,51.718911000000000,-1.852866000000000
green turtle and saltwater crocodile,GL7 5TD,51.718199700353300,-1.895049366021310
leathery turtle and taipan,GL7 6EU,51.700393683750400,-1.941928892948600
Piping shrike and rat snake,GL7 6JW,51.707677765045000,-2.030314739395670
Piping shrike and Guillemot,GL7 6LA,51.713325861447900,-2.051291125217860
Diving bird and American sparrow,GL7 6LE,51.727302291369700,-2.076499251230860
diamond snake and rattlesnake,GL7 7AG,51.744069000000000,-2.011047000000000
cayman and death adder,GL7 7DF,51.783765654444800,-1.957319009172550
pit viper and Jackal,GL7 7DW,51.772287793833200,-1.969228259929300
death adder and frill-necked lizard,GL7 7EA,51.778434000000000,-1.995793000000000
Minke whale and Perching duck,GL7 7ET,51.805360245582700,-1.989147954948180
anaconda and cayman,GL7 7HA,51.787376400923700,-1.976452342677480
frilled lizard and giant tortoise,GL7 7JH,51.765754706651100,-2.011124953004640
B and Flameback,GL7 7JL,51.770119513019000,-2.035356651532260
agama and viper,GL7 7JS,51.783025000000000,-2.028771000000000
Mouse and Recurvebill,GL7 9HR,51.701774000000000,-1.960064000000000
Treepie and Schneider python,GL7 9HZ,51.701774000000000,-1.960064000000000
Fulmarine petrel and Herring gull,GL7 9SE,51.711929739985500,-1.966099211281940
amethystine python and lizard,GL7 9SQ,51.711929739985500,-1.966099211281940
slowworm and sand lizard,GL7 9SW,51.711929739985500,-1.966099211281940
worm lizard and python,OX18 4TY,51.820192848166000,-1.722529891533030
