name,postcode,lat,lon
Rabbit and Polecat,LL36 0AZ,52.585120000000000,-4.095272000000000
White ibis and green turtle,LL36 6AJ,52.588301000000000,-4.081075000000000
Pheasant and Polecat,LL36 9AB,52.586715461016000,-4.089982001103380
milk snake and brown snake,LL36 9AF,52.586177213754000,-4.089912096607000
Mamo and tree snake,LL36 9AL,52.584930146964200,-4.091284641799560
boomslang and bearded lizard,LL36 9AP,52.587803893284600,-4.096057019701530
thorny devil and Fish eagle,LL36 9DQ,52.587776642051500,-4.081563000000000
Lemming and Boto,LL36 9EY,52.583705359641900,-4.088849733054860
Flameback and gopher snake,LL36 9LA,52.584692913065400,-4.083833439711820
Vole and boa,LL36 9PE,52.606309034108500,-4.052899830808170
Moluccan boobook and cobra,LL38 2EY,52.695589817486100,-4.054571932496900
crocodile and Shearwater,LL38 2SJ,52.688817740491100,-4.052596648457400
Eagle and Chicken,LL42 1DD,52.720224368475400,-4.050827000000000
bull snake and Civet,LL42 1DW,52.721604371829100,-4.053869858664180
Chicken and diamond snake,LL42 1EH,52.720085002300500,-4.051266392637770
Logrunners and Chipmunk,LL42 1HD,52.725724699154400,-4.062534448270840
Fish eagle and Meadowlark,LL42 1LF,52.728537944646700,-4.065840000000000
Piping shrike and Herring gull,LL42 1PE,52.724944563112300,-4.057240423104860
Ground sloth and dugite,LL42 1PF,52.724532844330300,-4.057650494465060
Chicken and Cloud rat,LL42 1PL,52.725324000000000,-4.060294000000000
Diving bird and Coati,LL42 1YN,52.730644894589500,-4.063966440535480
