name,postcode,lat,lon
hoop snake and brown snake,BB10 1BG,53.799550060000000,-2.240238988000000
copperhead and Warbler,BB10 1BT,53.801586520000000,-2.242133348000000
soft-shelled turtle and Scimitar babbler,BB10 1DP,53.802674000000000,-2.236386000000000
blindworm and racer,BB10 1HH,53.808573790000000,-2.235810869000000
diamondback terrapin and Lemming,BB10 1HR,53.807481300000000,-2.238310297000000
harlequin snake and mud turtle,BB10 1HZ,53.808126370000000,-2.239346572000000
Diving bird and king cobra,BB10 1JA,53.808697630000000,-2.241323969000000
anaconda and Myna,BB10 1LD,53.796782980000000,-2.239631083000000
Viscacha and Grackle,BB10 1NF,53.801713620000000,-2.237169000000000
thorny devil and Kākāriki,BB10 1NG,53.801178290000000,-2.239246000000000
grass snake and Nukupuʻu,BB10 1QA,53.804374040000000,-2.241511692000000
habu and Warbler,BB10 1QG,53.805299640000000,-2.241592939000000
hognose snake and Logrunners,BB10 1RN,53.803757000000000,-2.235708000000000
Zebra and constrictor,BB10 1RY,53.805759660000000,-2.236265784000000
Mouse and massasauga,BB10 1SF,53.807138150000000,-2.234572809000000
tortoise and bicycle lizard,BB10 1XB,53.803287200000000,-2.232061159000000
Rat and Lemming,BB10 2BJ,53.813422830000000,-2.224083075000000
diamondback turtle and hoop snake,BB10 2HE,53.811610700000000,-2.201931146000000
Wader and Boto,BB10 2HH,53.812179330000000,-2.205806550000000
Kite and tortoise,BB10 2HY,53.811083270000000,-2.200227715000000
Maya and Fulmarine petrel,BB10 2LE,53.814957620000000,-2.234601330000000
Perching duck and leguaan,BB10 2LL,53.818670000000000,-2.234727806000000
Wallaby and frilled lizard,BB10 2QE,53.811757660000000,-2.225365061000000
Zebra and Wader,BB10 2QN,53.814448000000000,-2.228553752000000
hoop snake and tiger snake,BB10 2RQ,53.814175590000000,-2.220442057000000
rock snake and tokay,BB10 2RW,53.815500360000000,-2.218504935000000
cycling lizard and galliwasp,BB10 2SH,53.816349650000000,-2.230538608000000
Duck and Duck,BB10 2SQ,53.816678780000000,-2.227624212000000
taipan and Kākāriki,BB10 2TS,53.807332000000000,-2.213223000000000
Siskin and Polecat,BB10 2UD,53.814368500000000,-2.218164911000000
cayman and Logrunners,BB10 3AE,53.797081000000000,-2.238919254000000
puff adder and cayman,BB10 3AL,53.799529780000000,-2.236883568000000
worm lizard and Quetzal,BB10 3AS,53.788024000000000,-2.193105000000000
puff adder and Marmoset,BB10 3DN,53.802055320000000,-2.227651198000000
Civet and Vulture,BB10 3EL,53.803710360000000,-2.226992082000000
leathery turtle and Bunting,BB10 3EN,53.802830350000000,-2.226562184000000
diamond python and Ibex,BB10 3EX,53.803877740000000,-2.224016935000000
Booted eagles and gaboon viper,BB10 3HH,53.807572210000000,-2.223793689000000
Duck and Francolin,BB10 3HJ,53.807210790000000,-2.224809166000000
Tree warbler and Buzzard,BB10 3LD,53.794486820000000,-2.223207806000000
blind snake and Schneider python,BB10 3NN,53.787986000000000,-2.188020558000000
deaf adder and Pheasant,BB10 3PE,53.793995080000000,-2.184738150000000
Macaw and diamond python,BB10 3PJ,53.804407000000000,-2.170418160000000
fer-de-lance and Coati,BB10 3PR,53.789884300000000,-2.186845105000000
bull snake and constrictor,BB10 3QF,53.819782180000000,-2.201074289000000
Magpie and hognose snake,BB10 3QL,53.815419180000000,-2.192472100000000
Eagle and swift,BB10 3QX,53.814238920000000,-2.170626812000000
Polecat and Masked owl,BB10 3RD,53.823583170000000,-2.153043219000000
bushmaster and leguaan,BB10 3RQ,53.834880960000000,-2.172883736000000
Grosbeak and Capuchin,BB10 4BQ,53.793212640000000,-2.231565263000000
Armadillo and sand lizard,BB10 4DG,53.788395370000000,-2.226711988000000
Marmoset and habu,BB10 4DU,53.787286370000000,-2.228542534000000
garter snake and Civet,BB10 4EE,53.786311810000000,-2.230555853000000
Warbler and Macaw,BB10 4EW,53.786437360000000,-2.225988071000000
whip snake and jew lizard,BB10 4HL,53.787127290000000,-2.207292624000000
tortoise and constrictor,BB10 4HS,53.785106980000000,-2.205962000000000
snapping turtle and Eagle,BB10 4JB,53.781527990000000,-2.201907913000000
tree snake and Macaw,BB10 4PD,53.785029540000000,-2.219378444000000
Jay and milk snake,BB10 4SN,53.765309550000000,-2.204302709000000
Boto and hawksbill,BB10 4SZ,53.744795050000000,-2.178578226000000
Shearwater and Hawk,BB10 4TA,53.743467060000000,-2.177071535000000
king snake and American sparrow,BB11 1AP,53.791445980000000,-2.243167804000000
Jackal and snake,BB11 1DR,53.788971840000000,-2.244367766000000
Guillemot and Marmoset,BB11 1HT,53.788776610000000,-2.243137172000000
Old World vulture and Songlark,BB11 1JH,53.788435650000000,-2.242846809000000
rock snake and blue racer,BB11 1JZ,53.786217100000000,-2.246522133000000
lizard and rock python,BB11 1PH,53.789313500000000,-2.244309039000000
amphisbaena and Cloud rat,BB11 1PY,53.789735530000000,-2.244508818000000
blind snake and king cobra,BB11 1QW,53.790281430000000,-2.245665603000000
Badger and Coati,BB11 2AU,53.788575000000000,-2.241299000000000
blindworm and Thicketbird,BB11 2HN,53.784352680000000,-2.244037359000000
Jackal and diamond python,BB11 2HX,53.779765280000000,-2.236832827000000
Parrotlet and Fox,BB11 2JF,53.781991300000000,-2.238347803000000
Black jay and Mink,BB11 2PG,53.776341330000000,-2.254142245000000
milk snake and Eagle,BB11 2RN,53.776856760000000,-2.235010706000000
Treepie and Songlark,BB11 2RZ,53.793504000000000,-2.234891000000000
tuatara and Grouse,BB11 3AW,53.784698140000000,-2.237619486000000
goanna and saltwater crocodile,BB11 3BN,53.789176900000000,-2.236431000000000
carpet snake and Ground sloth,BB11 3BT,53.789090130000000,-2.234487000000000
monitor and Stilt,BB11 3BU,53.787696590000000,-2.234858856000000
cobra de capello and bearded dragon,BB11 3NY,53.783213970000000,-2.233862000000000
smooth snake and Goose,BB11 3QF,53.772315100000000,-2.253951002000000
giant tortoise and taipan,BB11 3QS,53.766305060000000,-2.234891031000000
diamond snake and elapid,BB11 4DU,53.781553580000000,-2.262839203000000
Hawk and tiger snake,BB11 4EU,53.778957120000000,-2.262352540000000
Quetzal and Komodo dragon,BB11 4HF,53.774603430000000,-2.255649074000000
lizard and thorny devil,BB11 4JE,53.785081190000000,-2.252480092000000
Condor and Masked owl,BB11 4LN,53.786499400000000,-2.257588314000000
milk snake and Moluccan boobook,BB11 4RA,53.777208190000000,-2.260642097000000
Partridge and horned toad,BB11 4RD,53.777635090000000,-2.258581016000000
tuatara and worm lizard,BB11 4RE,53.776814460000000,-2.255662524000000
alligator and Ice seal,BB11 4RH,53.779691260000000,-2.255361347000000
Peafowl and snapping turtle,BB11 5BD,53.787077390000000,-2.268747000000000
Solitaire and Schneider python,BB11 5EL,53.785573310000000,-2.269982525000000
smooth snake and Gull,BB11 5HG,53.772120140000000,-2.256862941000000
blind snake and sand lizard,BB11 5HJ,53.773832850000000,-2.258724527000000
garter snake and chuckwalla,BB11 5HW,53.774527910000000,-2.261490357000000
Vulture and mamba,BB11 5JF,53.777194560000000,-2.266833135000000
Mink and Ibex,BB11 5JN,53.775844810000000,-2.263471149000000
flying dragon and Snipe,BB11 5JX,53.781722450000000,-2.267757269000000
glass snake and Puffleg,BB11 5LS,53.784798780000000,-2.270675693000000
horned viper and loggerhead,BB11 5NR,53.769582000000000,-2.262870000000000
Chipmunk and Polecat,BB11 5PB,53.749371410000000,-2.269143574000000
Dorcopsis and terrapin,BB11 5QS,53.773834020000000,-2.314576779000000
Solitaire and Asiatic leopard,BB11 5RF,53.780261800000000,-2.317477873000000
whip snake and Boto,BB11 5TD,53.780772000000000,-2.294096000000000
alligator and chameleon,BB11 5TE,53.782144000000000,-2.295138000000000
Siskin and Skunk,BB12 0AD,53.794019610000000,-2.246234000000000
Philippine hawk-owl and Meadowlark,BB12 0AL,53.796563770000000,-2.245793442000000
mamba and flying lizard,BB12 0AP,53.795670720000000,-2.247367037000000
Prion and gaboon viper,BB12 0BA,53.796744510000000,-2.249665749000000
Armadillo and Rabbit,BB12 0BS,53.796645000000000,-2.250455000000000
Night heron and Thicketbird,BB12 0EZ,53.797233710000000,-2.264622485000000
Gull and blue racer,BB12 0HF,53.792215830000000,-2.265790071000000
snapping turtle and Jay,BB12 0JR,53.797237590000000,-2.262861449000000
Marsh harrier and blindworm,BB12 0LY,53.793471380000000,-2.258845487000000
Parrotbill and Bronzewing pigeon,BB12 0TJ,53.793899060000000,-2.256404087000000
Partridge and thorn lizard,BB12 6AT,53.795697420000000,-2.283968583000000
sand lizard and Chipmunk,BB12 6AX,53.796828560000000,-2.284537943000000
Chipmunk and dugite,BB12 6BX,53.795743300000000,-2.279748569000000
Minke whale and leathery turtle,BB12 6BZ,53.795460520000000,-2.277666900000000
python and Rat,BB12 6DL,53.792167450000000,-2.275277093000000
Tit-tyrant and crocodile,BB12 6DS,53.794205710000000,-2.272223998000000
Jerboa and cobra,BB12 6DX,53.791894340000000,-2.272861743000000
Komodo dragon and viper,BB12 6EE,53.793329640000000,-2.270123460000000
boomslang and Logrunners,BB12 6EU,53.787072240000000,-2.282574628000000
Cloud rat and Egret,BB12 6HS,53.788993240000000,-2.283604514000000
Myna and Komodo dragon,BB12 6JP,53.788591370000000,-2.278668809000000
boomslang and Grouse,BB12 6LG,53.796839880000000,-2.291050849000000
Old World warbler and Gila monster,BB12 6NG,53.790529230000000,-2.291492858000000
milk snake and mountain devil,BB12 6PA,53.797061550000000,-2.295956011000000
Armadillo and puff adder,BB12 6PL,53.793525720000000,-2.297388400000000
Gila monster and bull snake,BB12 6RG,53.792583990000000,-2.269966866000000
Goose and worm lizard,BB12 7AY,53.796005820000000,-2.315198240000000
Flameback and Mink,BB12 7BY,53.793315170000000,-2.309546212000000
Thicketbird and bandy-bandy,BB12 7FL,53.784160000000000,-2.310769000000000
Herring gull and Darwin's finches,BB12 7HD,53.796588890000000,-2.308735365000000
Quetzal and Duck,BB12 7HU,53.807034830000000,-2.347443119000000
turtle and Old World vulture,BB12 7HY,53.806546250000000,-2.345449847000000
Chickadee and Black jay,BB12 7LD,53.784069820000000,-2.315169411000000
death adder and tuatara,BB12 7LN,53.784985580000000,-2.321991000000000
ringhals and Polecat,BB12 7QP,53.821413200000000,-2.345162072000000
cycling lizard and perentie,BB12 7RA,53.810570000000000,-2.353166431000000
mud turtle and Masked owl,BB12 7RE,53.809299480000000,-2.363164000000000
Coati and amethystine python,BB12 7RW,53.806725470000000,-2.357887853000000
Tattler and Chicken,BB12 7SA,53.820872000000000,-2.352418000000000
Towhee and Egret,BB12 7SS,53.804258580000000,-2.353235670000000
Nukupuʻu and B,BB12 8AJ,53.797032940000000,-2.273973013000000
Hawk and fer-de-lance,BB12 8HT,53.803568640000000,-2.317122620000000
New World blackbird and Mockingbird,BB12 8JG,53.801977030000000,-2.317399083000000
Badger and horned toad,BB12 8NN,53.803389160000000,-2.313598624000000
harlequin snake and asp,BB12 8RQ,53.796839700000000,-2.305564290000000
blue tongue and Ground sloth,BB12 8RS,53.799230300000000,-2.312611084000000
dugite and White ibis,BB12 8SQ,53.800344130000000,-2.302371057000000
python and box turtle,BB12 8ST,53.797251000000000,-2.299601000000000
Viscacha and Viscacha,BB12 8TH,53.795165560000000,-2.302956190000000
Tahr and Philippine hawk-owl,BB12 8UF,53.799376230000000,-2.278983289000000
Booted eagles and Wader,BB12 9JH,53.846329000000000,-2.267820000000000
Eagle and tree snake,BB12 9PT,53.846048790000000,-2.251388043000000
Capuchin and box turtle,BB18 5BF,53.915328920000000,-2.186415856000000
Tahr and American sparrow,BB18 5EF,53.919858150000000,-2.186710000000000
Piping shrike and Pheasant,BB18 5EN,53.921248380000000,-2.188650102000000
Goose and Diving bird,BB18 5HX,53.919086210000000,-2.191655000000000
cobra de capello and python,BB18 5JB,53.920136000000000,-2.193304000000000
gecko and Coati,BB18 5JT,53.921195830000000,-2.193325000000000
thorny devil and kabaragoya,BB18 5JY,53.922222000000000,-2.192461208000000
chameleon and Logrunners,BB18 5ND,53.916512400000000,-2.188278555000000
Darwin's finches and Boto,BB18 5NJ,53.917822240000000,-2.189791755000000
Recurvebill and thorn lizard,BB18 5NU,53.916430560000000,-2.188887176000000
Bunting and loggerhead,BB18 5QB,53.916368370000000,-2.194063297000000
Grouse and River dolphin,BB18 5RF,53.917499980000000,-2.194586205000000
White ibis and Kākāriki,BB18 5SD,53.907600730000000,-2.217646409000000
Dolphin and pit viper,BB18 5XF,53.913096490000000,-2.225104100000000
harlequin snake and Eagle,BB18 6AE,53.915461000000000,-2.182351536000000
diamond snake and Ibex,BB18 6AR,53.916895870000000,-2.184428383000000
Lemming and Hawaiian honeycreeper,BB18 6BH,53.917478320000000,-2.179665493000000
diamondback terrapin and black snake,BB18 6ER,53.923744130000000,-2.178778793000000
carpet snake and glass snake,BB18 6EY,53.920449740000000,-2.175993530000000
cobra de capello and pit viper,BB18 6FG,53.923028000000000,-2.180880000000000
bicycle lizard and loggerhead,BB18 6HD,53.920568940000000,-2.174380051000000
goanna and skink,BB18 6JE,53.920986000000000,-2.163056000000000
Scimitar babbler and Francolin,BB18 6LL,53.892903000000000,-2.142082000000000
Towhee and dugite,BB18 6NS,53.914676730000000,-2.144501029000000
thorny devil and B,BB18 6PL,53.918441900000000,-2.145092620000000
Old World warbler and Mink,BB18 6RN,53.915725750000000,-2.139054299000000
elapid and Snipe,BB18 6SA,53.914488300000000,-2.136568666000000
bushmaster and Thrasher,BB18 6TG,53.897321880000000,-2.151304254000000
boa constrictor and Civet,BB18 6WE,53.917786000000000,-2.142764000000000
frilled lizard and Capuchin,BB18 6XW,53.912939650000000,-2.146504518000000
Meadowlark and jew lizard,BB4 8BN,53.729033000000000,-2.287777878000000
Prion and Peafowl,BB4 8DN,53.727141680000000,-2.281823681000000
diamond python and Pitohui,BB4 8FD,53.733533600000000,-2.285034619000000
Tattler and Meadowlark,BB4 8QL,53.734733720000000,-2.286831511000000
Buzzard and deaf adder,BB4 8RQ,53.743019330000000,-2.283643312000000
Old World vulture and gecko,BB4 9QT,53.732029440000000,-2.241505671000000
Kangaroo and boa constrictor,BB4 9RB,53.727954390000000,-2.229554068000000
Greenbul and mamba,BB5 0AD,53.753758430000000,-2.369631000000000
rock snake and Marmoset,BB5 0AQ,53.753007000000000,-2.377403915000000
blind snake and Viscacha,BB5 0DR,53.751588510000000,-2.388326000000000
Darwin's finches and leguaan,BB5 0ET,53.748162240000000,-2.388703070000000
skink and diamond snake,BB5 0HH,53.748598850000000,-2.384309523000000
Petrel and frill-necked lizard,BB5 0NH,53.741650440000000,-2.373132656000000
Logrunners and perentie,BB5 0NY,53.740414360000000,-2.365920169000000
Egret and Herring gull,BB5 0QD,53.746761620000000,-2.371221892000000
Argus and blue racer,BB5 0SJ,53.748574530000000,-2.374968242000000
mud turtle and worm lizard,BB5 1AJ,53.755687020000000,-2.362337175000000
River dolphin and Kangaroo,BB5 1AL,53.756179840000000,-2.362841923000000
asp and thorn lizard,BB5 1EA,53.753726000000000,-2.363094000000000
Guillemot and sand viper,BB5 1EB,53.753287180000000,-2.362346839000000
Condor and harlequin snake,BB5 1GJ,53.753700020000000,-2.362547551000000
Zebra and viper,BB5 1HA,53.753442700000000,-2.364410727000000
adder and frill-necked lizard,BB5 1JR,53.752523910000000,-2.365404000000000
Herring gull and amphisbaena,BB5 1NT,53.751620540000000,-2.366563562000000
water snake and Linsang,BB5 1PJ,53.751657850000000,-2.363166891000000
Myna and Old World vulture,BB5 1QS,53.754016810000000,-2.373530473000000
cycling lizard and Pratincole,BB5 1QZ,53.754617000000000,-2.371716000000000
galliwasp and Rabbit,BB5 1RN,53.754084690000000,-2.374820189000000
Ice seal and amethystine python,BB5 1SE,53.753681570000000,-2.385720878000000
Pheasant and Fox,BB5 1SX,53.754269630000000,-2.376035125000000
death adder and thorn lizard,BB5 2BE,53.750168270000000,-2.359378044000000
blue racer and Night heron,BB5 2BN,53.747951630000000,-2.358236991000000
habu and python,BB5 2ED,53.750060000000000,-2.365777000000000
boa constrictor and flying lizard,BB5 2HR,53.748270540000000,-2.362773723000000
rock python and Francolin,BB5 2JS,53.741172000000000,-2.356572000000000
terrapin and coral snake,BB5 2PT,53.737894990000000,-2.348752083000000
Magpie and garter snake,BB5 2SJ,53.725573100000000,-2.332675867000000
Parakeet and Pitohui,BB5 2TN,53.742324160000000,-2.349425576000000
Condor and caiman,BB5 2TQ,53.740864000000000,-2.348079000000000
Pratincole and Mamo,BB5 3AN,53.741267030000000,-2.380725131000000
terrapin and New World blackbird,BB5 3BH,53.741042340000000,-2.391866690000000
viper and River dolphin,BB5 3BU,53.739963280000000,-2.394752390000000
Francolin and Snipe,BB5 3BX,53.740204800000000,-2.395103359000000
lizard and diamondback terrapin,BB5 3DE,53.747351000000000,-2.389757000000000
crocodile and moloch,BB5 3DZ,53.744654280000000,-2.394993499000000
swift and krait,BB5 3EU,53.742146650000000,-2.392240853000000
B and Zebra,BB5 3HX,53.742413000000000,-2.396231000000000
Grosbeak and Nukupuʻu,BB5 3LF,53.742302210000000,-2.399565455000000
Armadillo and Pheasant,BB5 3LX,53.745200030000000,-2.395756763000000
Stint and leathery turtle,BB5 3NB,53.746725670000000,-2.393739214000000
elapid and Ground sloth,BB5 3QF,53.738177760000000,-2.399238264000000
amphisbaena and crocodile,BB5 3TQ,53.739719140000000,-2.378497645000000
death adder and Chipmunk,BB5 4BH,53.758863280000000,-2.372921292000000
Schneider python and Parakeet,BB5 4DH,53.765020740000000,-2.378452252000000
Kākāriki and harlequin snake,BB5 4DT,53.759059900000000,-2.384647771000000
mountain devil and sidewinder,BB5 4DY,53.757200590000000,-2.384266759000000
B and Fox,BB5 4HD,53.753185000000000,-2.389189276000000
amphisbaena and Buzzard,BB5 4RU,53.759002610000000,-2.379930000000000
soft-shelled turtle and pit viper,BB5 4RY,53.758118720000000,-2.378192979000000
Civet and Linsang,BB5 5AX,53.763009700000000,-2.366147061000000
Old World quail and Quetzal,BB5 5BN,53.763232670000000,-2.369637948000000
king cobra and Solitaire,BB5 5DR,53.766267460000000,-2.370665870000000
agamid and Jay,BB5 5EQ,53.766254060000000,-2.374974152000000
Parrotbill and Mouse,BB5 5HY,53.769829230000000,-2.389480000000000
carpet snake and hoop snake,BB5 5NA,53.773899000000000,-2.382205537000000
Kangaroo and Herring gull,BB5 5NR,53.775222300000000,-2.384067292000000
blue racer and perentie,BB5 5PT,53.777620420000000,-2.387382074000000
Magpie and Pheasant,BB5 5QB,53.778388350000000,-2.386159992000000
Parakeet and Quetzal,BB5 5QR,53.773966690000000,-2.394297741000000
Treepie and worm lizard,BB5 5ST,53.779711490000000,-2.391119290000000
cobra de capello and Puffleg,BB5 5SZ,53.778905360000000,-2.390261989000000
adder and Fox,BB5 5TE,53.783573840000000,-2.383551715000000
Siskin and Macaw,BB5 5UB,53.782379000000000,-2.366422000000000
Capuchin and bandy-bandy,BB5 5YQ,53.780408320000000,-2.392415694000000
habu and Parrotbill,BB5 6AR,53.760004610000000,-2.364209713000000
bicycle lizard and Bronzewing pigeon,BB5 6AZ,53.758173760000000,-2.363314147000000
pit viper and Flameback,BB5 6BS,53.760880240000000,-2.365916165000000
Jerboa and Chickadee,BB5 6DZ,53.758488700000000,-2.357219484000000
White ibis and Lemming,BB5 6HD,53.760681080000000,-2.354431948000000
Elephant and Greenbul,BB5 6HN,53.766134400000000,-2.348501000000000
fer-de-lance and Peafowl,BB5 6HP,53.766291250000000,-2.344633623000000
Partridge and swift,BB5 6LX,53.770122320000000,-2.340735527000000
Stilt and indigo snake,BB5 6PU,53.754870640000000,-2.361829655000000
green turtle and Fish eagle,BB5 6RS,53.752543790000000,-2.358488405000000
Fish eagle and ringhals,BB5 6TG,53.753975490000000,-2.357620977000000
flying lizard and Darwin's finches,BB5 6TS,53.767383120000000,-2.355459366000000
Perching duck and Petrel,BB5 6UL,53.755551100000000,-2.350627421000000
green turtle and Hawk,BB5 6UQ,53.757304530000000,-2.350369026000000
whip snake and Ground sloth,BB5 9FA,53.753704813396800,-2.362547880748910
Magpie and Viscacha,BB5 9SX,53.750063651159200,-2.368764318707460
Hawaiian honeycreeper and Cloud rat,BB7 0SE,53.873454570000000,-2.391583356000000
Recurvebill and box turtle,BB7 1DG,53.867762300000000,-2.397932362000000
Gull and Schneider python,BB7 1DT,53.866879120000000,-2.395931881000000
mud turtle and krait,BB7 1ES,53.866722990000000,-2.388707194000000
blind snake and Dolphin,BB7 1JG,53.871078820000000,-2.384154689000000
Polecat and blindworm,BB7 1LE,53.866593880000000,-2.386942017000000
Fish eagle and tokay,BB7 1LG,53.868004350000000,-2.386696000000000
Songlark and Night heron,BB7 1LL,53.865336000000000,-2.381608000000000
whip snake and New World blackbird,BB7 1PT,53.852110000000000,-2.371637000000000
loggerhead and Tit-tyrant,BB7 1PU,53.862917120000000,-2.352163799000000
bicycle lizard and Old World quail,BB7 1PZ,53.851467990000000,-2.369594614000000
glass snake and Mamo,BB7 1QG,53.873992000000000,-2.381368000000000
Peafowl and bearded lizard,BB7 2DL,53.873806680000000,-2.388331851000000
frilled lizard and perentie,BB7 2EU,53.873117400000000,-2.392994649000000
Grackle and tuatara,BB7 2HG,53.874397820000000,-2.391729060000000
Old World warbler and gopher snake,BB7 2HT,53.876046770000000,-2.393204654000000
Minke whale and Skunk,BB7 2JZ,53.870388750000000,-2.397333776000000
Ibex and alligator,BB7 3AL,53.901245000000000,-2.398921000000000
Philippine hawk-owl and dukite,BB7 4AR,53.893114290000000,-2.352889516000000
Grouse and Cloud rat,BB7 4ET,53.934320560000000,-2.262961511000000
snake and Francolin,BB7 4HB,53.935417280000000,-2.262861791000000
horned viper and anaconda,BB7 4HL,53.936067230000000,-2.257412859000000
Logrunners and Grosbeak,BB7 4JU,53.934636990000000,-2.262110545000000
glass snake and Mouse,BB7 4LH,53.920074540000000,-2.308520000000000
Viscacha and Linsang,BB7 4LR,53.944658000000000,-2.282314000000000
White ibis and swift,BB7 4LU,53.948227750000000,-2.324162059000000
horned viper and diamond snake,BB7 4NB,53.907995290000000,-2.341461740000000
saltwater crocodile and brown snake,BB7 4NF,53.935356880000000,-2.257560799000000
Schneider python and smooth snake,BB7 4NH,53.914742000000000,-2.343572000000000
hawksbill and amphisbaena,BB7 4NT,53.944984880000000,-2.336402000000000
Hawk and hawksbill,BB7 4RJ,53.908826570000000,-2.370132000000000
Myna and worm lizard,BB7 4RP,53.905854970000000,-2.366254421000000
king snake and blind snake,BB7 9AZ,53.842069980000000,-2.399375506000000
frilled lizard and Ibex,BB7 9BL,53.835294140000000,-2.388096809000000
krait and kabaragoya,BB7 9DR,53.822238450000000,-2.383935000000000
hawksbill and Mamo,BB7 9DW,53.807420030000000,-2.391589915000000
Moluccan boobook and cycling lizard,BB7 9EL,53.835973490000000,-2.335739044000000
tortoise and Chickadee,BB7 9EY,53.830153590000000,-2.334203506000000
Hawk and Myna,BB8 0DE,53.854415210000000,-2.176612886000000
Tahr and Rat,BB8 0EQ,53.854624370000000,-2.168678173000000
amethystine python and green turtle,BB8 0EZ,53.854859380000000,-2.167736573000000
Snipe and monitor,BB8 0HW,53.855661370000000,-2.166249924000000
ringhals and boa,BB8 0JE,53.856707440000000,-2.163730372000000
sidewinder and Pitohui,BB8 0LS,53.857799470000000,-2.160405089000000
Fulmarine petrel and Chickadee,BB8 0QB,53.857183160000000,-2.150627000000000
Komodo dragon and Francolin,BB8 7HE,53.859143010000000,-2.142758483000000
terrapin and Hawaiian honeycreeper,BB8 7HL,53.861864160000000,-2.128824866000000
harlequin snake and massasauga,BB8 7JQ,53.862725580000000,-2.130135166000000
Triller and Stilt,BB8 7NQ,53.874953380000000,-2.169779143000000
dugite and slowworm,BB8 7NU,53.875008160000000,-2.169293000000000
Lemming and New World blackbird,BB8 8AD,53.853106910000000,-2.180012559000000
loggerhead and anole,BB8 8AU,53.850444310000000,-2.175425685000000
ringhals and cobra de capello,BB8 8DA,53.856298210000000,-2.139054482000000
giant tortoise and Kākāriki,BB8 8DL,53.851425890000000,-2.180202950000000
sidewinder and Pheasant,BB8 8NP,53.850172000000000,-2.158749000000000
Diving bird and Piping shrike,BB8 8NS,53.853171310000000,-2.145869685000000
deaf adder and lizard,BB8 8PE,53.844613510000000,-2.139441249000000
Linsang and harlequin snake,BB8 8RG,53.849548690000000,-2.138728060000000
Chicken and bearded lizard,BB8 8SF,53.843099130000000,-2.135454304000000
Ground sloth and Maya,BB8 9LF,53.861072530000000,-2.165921701000000
Tahr and Treepie,BB8 9QA,53.858424600000000,-2.182087910000000
box turtle and Petrel,BB8 9QF,53.857526160000000,-2.181855953000000
Old World vulture and Goose,BB8 9QX,53.852867720000000,-2.195015565000000
Logrunners and Booted eagles,BB8 9RP,53.861790570000000,-2.172979613000000
Jay and horned viper,BB9 0AR,53.829649240000000,-2.222376963000000
Magpie and garter snake,BB9 0AZ,53.831823930000000,-2.217693536000000
dugite and gavial,BB9 0BN,53.831474150000000,-2.217281485000000
horned viper and smooth snake,BB9 0ED,53.828697680000000,-2.216689000000000
slowworm and Skunk,BB9 0EZ,53.822544420000000,-2.214911052000000
Duck and Hawaiian honeycreeper,BB9 0HG,53.822651510000000,-2.210278430000000
Viscacha and Myna,BB9 0JE,53.829346310000000,-2.205799636000000
Grosbeak and habu,BB9 0JG,53.828998330000000,-2.204309012000000
amphisbaena and Recurvebill,BB9 0NE,53.833546070000000,-2.193573353000000
Pratincole and soft-shelled turtle,BB9 0NP,53.834460960000000,-2.200187398000000
sidewinder and Parakeet,BB9 0NQ,53.831256880000000,-2.213147635000000
amethystine python and Pheasant,BB9 0RJ,53.829235940000000,-2.212392901000000
Grackle and harlequin snake,BB9 0RX,53.827208110000000,-2.210438008000000
viper and diamondback terrapin,BB9 0SJ,53.831542920000000,-2.208940368000000
Hawk and bushmaster,BB9 0TG,53.835425290000000,-2.203960448000000
Minke whale and Old World quail,BB9 0WA,53.832716470000000,-2.195240902000000
gavial and sand lizard,BB9 0XA,53.830140250000000,-2.209252441000000
Mockingbird and Treepie,BB9 4SQ,53.836968960000000,-2.215516844000000
gopher snake and deaf adder,BB9 4ZZ,53.834116000000000,-2.218085000000000
tree snake and Ibex,BB9 5AG,53.823463680000000,-2.232825975000000
Argus and anaconda,BB9 5AW,53.822510880000000,-2.232866259000000
Marmoset and snake,BB9 5BS,53.822028080000000,-2.226848140000000
