name,postcode,lat,lon
Grackle and Solitaire,BB9 5EJ,53.818171900000000,-2.222240179000000
worm lizard and Coati,BB9 5LU,53.821497050000000,-2.231934022000000
Gila monster and water snake,BB9 5NP,53.826474000000000,-2.233573653000000
Asiatic leopard and diamondback terrapin,BB9 5QR,53.819778250000000,-2.246613000000000
Polecat and New World blackbird,BB9 5RW,53.827910870000000,-2.229113273000000
Stint and Pitohui,BB9 5SP,53.832180520000000,-2.233573300000000
New World blackbird and puff adder,BB9 5SW,53.826720000000000,-2.231978000000000
Dorcopsis and hoop snake,BB9 6BD,53.863573480000000,-2.205070660000000
Capuchin and Mockingbird,BB9 6BG,53.863283240000000,-2.206604988000000
Booted eagles and dugite,BB9 6DW,53.841733970000000,-2.224538340000000
Hawaiian honeycreeper and Rabbit,BB9 6JL,53.856292030000000,-2.210979349000000
White ibis and bushmaster,BB9 6JU,53.853248410000000,-2.219172995000000
Shearwater and Puffleg,BB9 6LT,53.867871750000000,-2.214170348000000
Night heron and Chipmunk,BB9 6NG,53.884140950000000,-2.213508158000000
Quetzal and puff adder,BB9 6NH,53.898542200000000,-2.236028563000000
water snake and Philippine hawk-owl,BB9 6NN,53.859837040000000,-2.237771785000000
thorny devil and Argus,BB9 6NS,53.858392920000000,-2.240804324000000
agama and Recurvebill,BB9 6NU,53.856912470000000,-2.244155000000000
lizard and bushmaster,BB9 6PG,53.873043210000000,-2.226957135000000
horned toad and Solitaire,BB9 6RH,53.891253480000000,-2.211733796000000
Stint and Rabbit,BB9 6RL,53.855731100000000,-2.218060982000000
slowworm and sea snake,BB9 7AN,53.833562000000000,-2.221273000000000
Maya and rock python,BB9 7DN,53.832287590000000,-2.224260000000000
bull snake and mamba,BB9 7ET,53.836962760000000,-2.218935891000000
dugite and Wader,BB9 7JX,53.836185180000000,-2.216530922000000
Marsh harrier and bearded lizard,BB9 7LG,53.836968960000000,-2.215516844000000
horned toad and cobra de capello,BB9 7PS,53.838008010000000,-2.217482506000000
water snake and Parakeet,BB9 7QZ,53.840279280000000,-2.208877532000000
Pratincole and habu,BB9 7RT,53.843504000000000,-2.210565000000000
moloch and Solitaire,BB9 7XJ,53.840126980000000,-2.213694237000000
Rat and boa constrictor,BB9 8BU,53.839774100000000,-2.193936446000000
flying dragon and Marsh harrier,BB9 8JP,53.841546230000000,-2.198503913000000
Kite and Egret,BB9 8NN,53.847056670000000,-2.218669427000000
racer and rock snake,BB9 8NT,53.848124080000000,-2.219845392000000
agamid and dukite,BB9 8NY,53.845697870000000,-2.219559082000000
Mole and crocodile,BB9 8QU,53.848014000000000,-2.221851000000000
boa and Marsh harrier,BB9 8SN,53.847320100000000,-2.206982269000000
rock python and caiman,BB9 9AA,53.833740680000000,-2.216411935000000
Marmoset and Peafowl,BB9 9EF,53.835698000000000,-2.215831000000000
diamondback turtle and White ibis,BB9 9EU,53.836567080000000,-2.203768458000000
kabaragoya and Kangaroo,BB9 9LJ,53.835428680000000,-2.185270195000000
Armadillo and bandy-bandy,BB9 9NG,53.836798510000000,-2.194302576000000
thorny devil and frill-necked lizard,BB9 9PJ,53.831206070000000,-2.211384894000000
Linsang and Thrasher,BB9 9PL,53.830990850000000,-2.211110322000000
Grosbeak and thorn lizard,BB9 9QT,53.836201940000000,-2.207048938000000
diamondback turtle and hognose snake,BB9 9TL,53.838901780000000,-2.210223166000000
Stilt and Jerboa,BD20 7BB,53.881706830000000,-2.001226090000000
Dorcopsis and skink,BD20 7BU,53.889157390000000,-1.990621643000000
mamba and death adder,BD20 7NR,53.890550680000000,-1.993299233000000
cobra and Marmoset,BD20 7NW,53.888995810000000,-1.993573000000000
taipan and green turtle,BD20 8AB,53.902144770000000,-1.990330000000000
Ibex and constrictor,BD20 8AP,53.902405540000000,-1.992338575000000
tree snake and Pheasant,BD20 8AT,53.902153930000000,-1.993145254000000
moloch and agamid,BD20 8AU,53.902333680000000,-1.993099567000000
snake and cycling lizard,BD20 8DB,53.897489130000000,-1.991137235000000
mud turtle and harlequin snake,BD20 8DS,53.895987790000000,-2.012609120000000
indigo snake and Parrotlet,BD20 8EW,53.909559000000000,-2.062591000000000
Warbler and agamid,BD20 8HP,53.893878000000000,-2.103304549000000
Jay and Grosbeak,BD20 8HT,53.912129000000000,-2.083523000000000
Maya and leathery turtle,BD20 8LD,53.917459210000000,-2.016026141000000
Booted eagles and Philippine hawk-owl,BD20 8NR,53.918798060000000,-2.018264821000000
Lemming and black snake,BD20 8QZ,53.898567780000000,-2.006583500000000
Piping shrike and Lemming,BD20 8TN,53.900077780000000,-1.993693456000000
diamond snake and perentie,BD20 9ED,53.932991140000000,-1.996826232000000
gavial and rattlesnake,BD20 9EE,53.934186450000000,-1.994998409000000
Magpie and deaf adder,BD20 9HG,53.930581880000000,-1.988008312000000
Elephant and Booted eagles,BD20 9QB,53.931840730000000,-1.998806253000000
terrapin and Peafowl,BD22 0AF,53.887004000000000,-2.038622000000000
saltwater crocodile and Linsang,BD22 0AS,53.885888600000000,-2.039427609000000
Tit-tyrant and blind snake,BD22 0BL,53.883766790000000,-2.041448907000000
cerastes and monitor,BD22 0FD,53.873501000000000,-2.036225000000000
B and Condor,BD22 0LJ,53.894011200000000,-2.065364323000000
sidewinder and Mouse,BD22 0NT,53.889898710000000,-2.034471297000000
taipan and diamondback turtle,BD23 3AT,53.931683630000000,-2.108509830000000
Partridge and king snake,BD23 3BE,53.932354000000000,-2.047331000000000
Snipe and Greenbul,BD23 3BQ,53.940797230000000,-2.031862919000000
Darwin's finches and Quetzal,BD23 3EG,53.943184020000000,-2.044235124000000
monitor and gopher snake,BD23 3HA,53.944343680000000,-2.043566024000000
cobra de capello and Bronzewing pigeon,HX7 6BG,53.742869130285100,-2.015837253313080
gopher snake and Piping shrike,HX7 6DP,53.744233683870600,-2.025223297299320
Ground sloth and Marsh harrier,HX7 6DT,53.742588869788200,-2.025237463882710
Tree warbler and indigo snake,HX7 6HJ,53.740505075709500,-2.017261488708240
Puffleg and loggerhead,HX7 6LZ,53.741716306685300,-2.028436009801250
Flameback and skink,HX7 6PP,53.734268439860800,-2.046697301760180
Triller and Gull,HX7 7AQ,53.757573722990600,-2.014447494056670
Logrunners and Jerboa,HX7 7BL,53.742599874502400,-2.012653171024320
perentie and loggerhead,HX7 7EU,53.752843478648600,-2.028489089879720
fer-de-lance and Maya,HX7 7HL,53.752944171673500,-2.050175869585070
tree snake and Snipe,HX7 7JE,53.744001844346700,-2.066934679093650
monitor and White ibis,HX7 7JH,53.744886485150400,-2.059749002767320
Herring gull and Parrotlet,HX7 7NR,53.750526084926500,-2.021253964467960
Maya and Maya,HX7 7PG,53.761865653800000,-2.074350375075640
Logrunners and Minke whale,HX7 8BT,53.742222699490000,-2.009196194449200
Lemming and Old World quail,HX7 8BX,53.742483278712700,-2.010090797069840
puff adder and box turtle,HX7 8BZ,53.742716842099100,-2.011455420851770
Myna and Fish eagle,HX7 8EN,53.741611250788400,-2.012076732762970
puff adder and Mink,HX7 8EZ,53.744307855699100,-2.010030595890910
Booted eagles and sea snake,HX7 8HR,53.747347000000000,-2.009910000000000
Black cockatoo and loggerhead,HX7 8HX,53.746923635323800,-2.006316211272200
gecko and Chipmunk,HX7 8HY,53.746824780831100,-2.006058419264350
saltwater crocodile and sand viper,HX7 8LJ,53.747687192634200,-2.011790403844710
giant tortoise and tiger snake,HX7 8NL,53.733773971731800,-1.990746244566800
habu and diamond python,HX7 8PD,53.735644000000000,-1.989336000000000
blue racer and moloch,HX7 8PE,53.739921674668900,-1.989244009092170
grass snake and Piping shrike,HX7 8PF,53.740461196470400,-1.992473175508100
Marmoset and Magpie,HX7 8QN,53.761619070574700,-2.005954460174830
python and Logrunners,HX7 8TA,53.754644406323800,-2.005210289175950
krait and elapid,HX7 8TS,53.747408833354000,-1.990758497438320
Stilt and Mockingbird,HX7 9AY,53.740653544753400,-2.014062796551170
Treepie and flying lizard,HX7 9BT,53.740656000000000,-2.014064000000000
Scimitar babbler and Greenbul,OL13 8GE,53.726271287339500,-2.195428817488130
Puffleg and leathery turtle,OL14 7EG,53.732805724760600,-2.144769800945730
jew lizard and alligator,OL14 7ER,53.730119553862800,-2.151020533685440
Gila monster and American sparrow,OL14 8HE,53.726345210425400,-2.118346000000000
Crow and Parrotlet,OL14 8HP,53.727281978022300,-2.116499435182880
leguaan and Puffleg,OL14 8JA,53.727215000000000,-2.121880000000000
brown snake and saltwater crocodile,OL14 8LF,53.732192418196200,-2.138735000000000
New World blackbird and Quetzal,OL14 8LY,53.732569703920200,-2.139160450476950
Wallaby and kabaragoya,OL14 8QA,53.733839897078000,-2.144318600577100
goanna and mamba,OL14 8RF,53.725343625958500,-2.079953901774810
slowworm and carpet snake,OL14 8SA,53.738439434288200,-2.113088964801510
Parrotbill and taipan,OL14 8ST,53.732147000000000,-2.050151000000000
