name,postcode,lat,lon
diamondback turtle and Polecat,BD20 9JD,53.947468940000000,-1.949776000000000
alligator and coral snake,BD20 9JH,53.931731000000000,-1.945729000000000
puff adder and python,BD20 9JY,53.914757930000000,-1.939630557000000
cayman and Puffleg,BD21 1AS,53.856781620000000,-1.916483403000000
flying lizard and Mole,BD21 1DD,53.862351040000000,-1.911911000000000
Black cockatoo and Booted eagles,BD21 1DG,53.861892820000000,-1.912413546000000
flying lizard and Cloud rat,BD21 1DL,53.859841000000000,-1.912527000000000
indigo snake and giant tortoise,BD21 1EP,53.859331050000000,-1.912099596000000
green turtle and Gull,BD21 1HL,53.860196410000000,-1.915625184000000
Tree warbler and constrictor,BD21 1NB,53.855976320000000,-1.921866779000000
Warbler and Partridge,BD21 1RX,53.859843400000000,-1.925478189000000
snapping turtle and Zebra,BD21 1SL,53.864582220000000,-1.915251446000000
krait and Schneider python,BD21 2BN,53.868029750000000,-1.909998038000000
Elephant and kabaragoya,BD21 2BX,53.868042000000000,-1.913541018000000
soft-shelled turtle and harlequin snake,BD21 2EE,53.869442610000000,-1.912397822000000
anole and python,BD21 2HA,53.870074630000000,-1.916441800000000
blindworm and Mink,BD21 2HT,53.870740840000000,-1.918052536000000
Jerboa and massasauga,BD21 2JP,53.866908000000000,-1.911551299000000
cayman and moloch,BD21 2PA,53.866690650000000,-1.923093827000000
horned toad and viper,BD21 2RD,53.869078340000000,-1.918420756000000
gaboon viper and death adder,BD21 2RQ,53.868245440000000,-1.922437000000000
anaconda and Booted eagles,BD21 2SE,53.869977000000000,-1.917476000000000
blindworm and bearded dragon,BD21 2SU,53.872982840000000,-1.911052061000000
habu and Gull,BD21 3AP,53.870518430000000,-1.908730444000000
leathery turtle and Mole,BD21 3BL,53.874229810000000,-1.907946708000000
Civet and Elephant,BD21 3DG,53.868046160000000,-1.908067000000000
bearded dragon and thorn lizard,BD21 3HT,53.871023160000000,-1.899239420000000
Old World quail and Prion,BD21 3HY,53.871017320000000,-1.903071905000000
Cloud rat and Puffleg,BD21 3JW,53.873210870000000,-1.903705625000000
Wallaby and Condor,BD21 3JY,53.873750250000000,-1.903841272000000
ringhals and boa,BD21 4AD,53.874039760000000,-1.895521000000000
Wader and frilled lizard,BD21 4AP,53.874082990000000,-1.893406911000000
Gull and Hawaiian honeycreeper,BD21 4BD,53.871569870000000,-1.897397891000000
Old World vulture and Viscacha,BD21 4BU,53.866196000000000,-1.897061000000000
Eagle and Greenbul,BD21 4FD,53.858360550000000,-1.890421251000000
Cloud rat and anaconda,BD21 4FE,53.869910000000000,-1.893846000000000
Parrotbill and Jackal,BD21 4HD,53.876669590000000,-1.881749282000000
blind snake and Ice seal,BD21 4NW,53.867338500000000,-1.889409398000000
Fish eagle and Cuscus,BD21 4NY,53.870499159659800,-1.891500011748070
Hawk and White ibis,BD21 4PT,53.865377920000000,-1.898203724000000
Egret and puff adder,BD21 4QF,53.862406740000000,-1.902802857000000
blindworm and boomslang,BD21 4RD,53.861679150000000,-1.903336708000000
Parakeet and grass snake,BD21 4SR,53.862059390000000,-1.885941348000000
Black jay and Meadowlark,BD21 4SY,53.863706150000000,-1.888050453000000
Treepie and caiman,BD21 4TU,53.858746990000000,-1.890374632000000
Fish eagle and Grouse,BD21 4WA,53.858136740000000,-1.891167000000000
Snipe and Scimitar babbler,BD21 5DG,53.854126040000000,-1.910696676000000
death adder and Myna,BD21 5DL,53.854798460000000,-1.908475708000000
Philippine hawk-owl and gaboon viper,BD21 5FB,53.851268625474800,-1.918668320902880
jew lizard and carpet snake,BD21 5HF,53.847660580000000,-1.918903062000000
diamondback terrapin and gopher snake,BD21 5PE,53.856548000000000,-1.904488723000000
diamond python and Kestrel,BD21 5PJ,53.858157000000000,-1.903982820000000
adder and diamond python,BD22 0AF,53.887004000000000,-2.038622000000000
Bronzewing pigeon and Rat,BD22 0BA,53.885142340000000,-2.040248422000000
carpet snake and garter snake,BD22 0EQ,53.824506500000000,-1.980700531000000
Flameback and horned viper,BD22 0HD,53.829531860000000,-1.989966093000000
pit viper and frill-necked lizard,BD22 0JJ,53.838198000000000,-2.003808000000000
death adder and rattlesnake,BD22 0JT,53.890456650000000,-2.031961240000000
Mamo and horned toad,BD22 0LU,53.888327710000000,-2.053731545000000
leathery turtle and Darwin's finches,BD22 0NU,53.890591040000000,-2.033528521000000
Black jay and cobra de capello,BD22 0QL,53.855470000000000,-1.975852000000000
Diving bird and elapid,BD22 0QN,53.851156510000000,-1.987574499000000
Thrasher and elapid,BD22 0QW,53.854369250000000,-1.963417000000000
Rat and Flameback,BD22 0RF,53.848643110000000,-1.960564649000000
Cuscus and rat snake,BD22 0RQ,53.850925330000000,-1.958464790000000
loggerhead and indigo snake,BD22 0RR,53.838139840000000,-1.973719249000000
Gila monster and harlequin snake,BD22 0SB,53.865582580000000,-1.953128180000000
dukite and Herring gull,BD22 0TF,53.836743290000000,-1.939256059000000
blindworm and Fulmarine petrel,BD22 6AE,53.861980430000000,-1.922190139000000
bandy-bandy and whip snake,BD22 6BY,53.862407610000000,-1.929928741000000
frilled lizard and Cuscus,BD22 6HB,53.869749130000000,-1.927300784000000
copperhead and harlequin snake,BD22 6JA,53.868233250000000,-1.932580302000000
Jay and Peafowl,BD22 6LD,53.861221790000000,-1.930934222000000
habu and rock python,BD22 6LH,53.860036080000000,-1.932137302000000
swift and sand lizard,BD22 6LR,53.859372060000000,-1.934099687000000
Warbler and Towhee,BD22 6PU,53.870439220000000,-1.940043899000000
coral snake and Linsang,BD22 6QA,53.870772390000000,-1.941305699000000
Thrasher and gopher snake,BD22 6QF,53.869610690000000,-1.936821045000000
Hawk and pit viper,BD22 7BG,53.850387770000000,-1.924856496000000
snake and python,BD22 7DH,53.851348830000000,-1.923836308000000
bicycle lizard and Myna,BD22 7DU,53.854505430000000,-1.926825435000000
Flameback and Thrasher,BD22 7DW,53.851827200000000,-1.927088511000000
Philippine hawk-owl and black snake,BD22 7HS,53.846255010000000,-1.944516485000000
Wader and Mole,BD22 7LA,53.854884580000000,-1.929606809000000
Old World warbler and harlequin snake,BD22 7PJ,53.847761900000000,-1.959364689000000
deaf adder and cayman,BD22 7SY,53.852602820000000,-1.931632428000000
taipan and Goose,BD22 8BS,53.826736370000000,-1.951667284000000
Old World vulture and Black cockatoo,BD22 8DA,53.829550660000000,-1.954429223000000
Dorcopsis and River dolphin,BD22 8EP,53.832706550000000,-1.957540655000000
Jay and Francolin,BD22 8EX,53.832777230000000,-1.954197825000000
cerastes and kabaragoya,BD22 8JB,53.832494870000000,-1.945218327000000
blue tongue and Chipmunk,BD22 8QN,53.827896620000000,-1.953716956000000
swift and adder,BD22 9AA,53.840375270000000,-1.924874360000000
massasauga and leathery turtle,BD22 9AE,53.838597400000000,-1.927704074000000
adder and blue tongue,BD22 9AP,53.838328700000000,-1.929284957000000
Stint and chameleon,BD22 9BH,53.836361460000000,-1.931202912000000
swift and Asiatic leopard,BD22 9DD,53.835982210000000,-1.928179623000000
Guillemot and Komodo dragon,BD22 9DT,53.836346000000000,-1.934774375000000
hoop snake and Chicken,BD22 9ED,53.835123290000000,-1.935094906000000
Chickadee and goanna,BD22 9EN,53.836481820000000,-1.937660887000000
Greenbul and wall lizard,BD22 9ES,53.835673850000000,-1.939500726000000
giant tortoise and slowworm,BD22 9HN,53.808574246013800,-1.947724852145380
Recurvebill and galliwasp,BD22 9HW,53.810161990000000,-1.950076514000000
Polecat and Dolphin,BD22 9NP,53.805483870000000,-1.940424708000000
B and tiger snake,BD22 9QD,53.804826860000000,-1.960028501000000
Warbler and diamondback turtle,BD22 9QJ,53.807989400000000,-1.956411000000000
Solitaire and Peafowl,BD22 9QP,53.809700000000000,-1.960571000000000
diamondback terrapin and perentie,BD22 9QY,53.808318180000000,-1.974891816000000
rat snake and rock snake,BD22 9RL,53.820474080000000,-1.957750414000000
slowworm and mud turtle,BD22 9SF,53.814684240000000,-1.953382111000000
Darwin's finches and milk snake,BD22 9SS,53.815205950000000,-1.934867362000000
green turtle and Old World warbler,BD23 2UR,53.947083000000000,-2.018704000000000
New World blackbird and Grackle,BD23 3DL,53.942744280000000,-2.042421776000000
Kestrel and Prion,BD23 3SY,53.944165320000000,-2.144724989000000
giant tortoise and gopher snake,BD23 3TG,53.926437100000000,-2.132968163000000
Old World vulture and Komodo dragon,BD23 3TR,53.931721120000000,-2.148931102000000
Wallaby and Myna,HX1 1YH,53.726251270942200,-1.860467481013840
python and Chickadee,HX1 4GG,53.729509227231800,-1.886269490677360
tortoise and Recurvebill,HX1 4NP,53.725089000000000,-1.882189532179400
Wader and wall lizard,HX1 4NS,53.725698577121700,-1.881444847682720
Gila monster and Masked owl,HX1 4QS,53.726515000000000,-1.887778000000000
Parakeet and iguana,HX1 4QW,53.725839851250200,-1.888173620037600
Chipmunk and Treepie,HX1 4RF,53.725702083367900,-1.885051903111350
Solitaire and worm lizard,HX1 5PD,53.725821000000000,-1.876701299968250
cobra de capello and green turtle,HX1 5PJ,53.725560326490700,-1.878020050655910
Darwin's finches and worm lizard,HX1 5RA,53.727398000000000,-1.872210300936690
blind snake and anaconda,HX2 0EF,53.730334982301200,-1.889359154623990
Cuscus and Nukupuʻu,HX2 0EL,53.729707026618000,-1.890679473671700
massasauga and death adder,HX2 0EQ,53.730137175562900,-1.889283886080950
leguaan and Tattler,HX2 0HX,53.728254431530400,-1.894442000000000
B and Mole,HX2 0NS,53.726172989817600,-1.910300357173220
Kangaroo and gavial,HX2 0QF,53.728579622793400,-1.896426806876370
thorn lizard and dugite,HX2 0QN,53.730825370632600,-1.894966173850010
Tree warbler and Tree warbler,HX2 0SA,53.732522485965100,-1.903753702627310
gaboon viper and Siskin,HX2 0SB,53.732072950186700,-1.903587988331570
king cobra and Black cockatoo,HX2 0SR,53.736354000000000,-1.905170000000000
Old World vulture and Chickadee,HX2 0SX,53.731935916441500,-1.912440558351830
Dolphin and Wallaby,HX2 0TE,53.732717452989900,-1.890050193696470
king snake and boa,HX2 0TG,53.733280000000000,-1.895096074478320
Argus and Pratincole,HX2 0TJ,53.737338974070400,-1.902378336876870
cobra and Rabbit,HX2 0UG,53.743377498978700,-1.912159091268870
tortoise and Tree warbler,HX2 0UL,53.742331360495400,-1.919788000000000
Armadillo and Hawk,HX2 6HX,53.727261000000000,-1.958252438430300
Goose and death adder,HX2 6QY,53.731440914735600,-1.940832133412900
Siskin and hognose snake,HX2 6RP,53.729410000000000,-1.939137000000000
thorny devil and hognose snake,HX2 6SR,53.740919000000000,-1.931404000000000
boa and moloch,HX2 6TG,53.746073182810400,-1.940280963116070
cayman and mud turtle,HX2 6TH,53.743501619708900,-1.938328677939030
skink and Treepie,HX2 6US,53.737607247889800,-1.965367000000000
dugite and Parakeet,HX2 6UX,53.737501645659000,-1.946796689315040
Duck and Macaw,HX2 7SY,53.739342440643100,-1.926403319588810
box turtle and lizard,HX2 7TG,53.752584284196900,-1.930550745329690
death adder and Eagle,HX2 7UW,53.753979917367000,-1.935007228714140
thorn lizard and black snake,HX2 8BB,53.743181566259700,-1.882684525850640
Ice seal and American sparrow,HX2 8HG,53.748688366769300,-1.889129087092500
sidewinder and White ibis,HX2 8NB,53.747175000000000,-1.894243736200410
New World blackbird and soft-shelled turtle,HX2 8NE,53.744713000000000,-1.895552830975330
saltwater crocodile and Ibex,HX2 8PQ,53.744779129689900,-1.900010936683170
Night heron and Mole,HX2 8QL,53.747098404151400,-1.900445184330640
hognose snake and Marmoset,HX2 8RS,53.749684951226300,-1.909264745174830
rock python and mountain devil,HX2 8SJ,53.752804146464500,-1.909728173182190
Gila monster and Elephant,HX2 8ST,53.750464812149000,-1.918907782681490
frill-necked lizard and Jackal,HX2 8SU,53.751488507695100,-1.917525801594980
puff adder and Fish eagle,HX2 8SY,53.752208056339300,-1.918267494970490
chameleon and Diving bird,HX2 8TY,53.742278273814400,-1.897424207393490
Siskin and anaconda,HX2 8WF,53.757957000000000,-1.904517000000000
soft-shelled turtle and tuatara,HX2 8XA,53.760565446008200,-1.893436010009730
Rabbit and Tattler,HX2 8XD,53.769451074393800,-1.899800760647590
wall lizard and Dorcopsis,HX2 9EZ,53.753210546188800,-1.890436618166740
harlequin snake and Macaw,HX2 9HD,53.751863649881800,-1.891880803678850
gopher snake and Ice seal,HX2 9JB,53.762620926930800,-1.890351506725910
New World blackbird and mountain devil,HX2 9JD,53.762270519678200,-1.890488937455070
galliwasp and Schneider python,HX2 9JL,53.760837068624400,-1.895695413011180
Perching duck and goanna,HX2 9JQ,53.761400084141000,-1.892038392355720
slowworm and chameleon,HX2 9JY,53.756971169468900,-1.894491608073400
River dolphin and Mink,HX2 9LG,53.757226000000000,-1.896645000000000
massasauga and terrapin,HX2 9PF,53.766805220768300,-1.885926005687040
tuatara and Chipmunk,HX2 9PZ,53.759053331557500,-1.881563487606900
asp and frilled lizard,HX2 9QE,53.760329671644400,-1.881605409082320
turtle and Fish eagle,HX2 9QL,53.760080433203300,-1.884093678795070
Thrasher and Kangaroo,HX2 9QR,53.757859413513900,-1.883083570215960
Tattler and tokay,HX2 9RF,53.754851173931300,-1.885943156003510
Jay and Nukupuʻu,HX2 9SH,53.759039941384600,-1.886311026646990
Ibex and swift,HX2 9SZ,53.757728668171300,-1.878139404330630
Cuscus and agama,HX2 9UA,53.770266339249400,-1.877375000000000
River dolphin and flying dragon,HX2 9UX,53.764981104953200,-1.886401204694540
brown snake and death adder,HX3 5DD,53.733420903690600,-1.874162241017110
Greenbul and terrapin,HX3 5EA,53.733333399806400,-1.876148000000000
gecko and saltwater crocodile,HX3 5JE,53.735921426058500,-1.884963449679320
agamid and perentie,HX3 5JR,53.735549801841900,-1.891270721606070
Duck and sidewinder,HX3 5JX,53.736260335506000,-1.891799476010160
diamondback and Pitohui,HX3 5QB,53.737073073566300,-1.877077202232920
Polecat and skink,HX3 5WG,53.727558468106800,-1.863888509482860
indigo snake and Black cockatoo,HX3 6AH,53.726921865579400,-1.850098437870290
Jackal and Philippine hawk-owl,HX3 6BD,53.729870430981500,-1.850482056315060
Zebra and bandy-bandy,HX3 6EG,53.731254071883700,-1.865225634353320
jew lizard and Quetzal,HX3 6JH,53.735843530377500,-1.862194264217820
box turtle and Mamo,HX3 6LP,53.734211456578100,-1.865504210481520
Kite and leathery turtle,HX3 6LZ,53.733531308166800,-1.868159124430250
rat snake and cerastes,HX3 6PB,53.737053562315600,-1.867193055388690
kabaragoya and blue racer,HX3 6PE,53.737487000000000,-1.868041000000000
diamond python and wall lizard,HX3 6QY,53.743519532646400,-1.879074995606440
perentie and Hawaiian honeycreeper,HX3 6RY,53.745682114471400,-1.875611652817340
agama and bearded dragon,HX3 6TL,53.737128650054500,-1.870103510200860
Fulmarine petrel and elapid,HX3 6UL,53.737639168760200,-1.868449495740590
agama and Masked owl,HX7 5AB,53.732623263634300,-1.988002852927990
tokay and Myna,HX7 5AJ,53.732290762033300,-1.988594111299040
box turtle and Marmoset,HX7 5AP,53.731751902745700,-1.994990888839660
Recurvebill and Masked owl,HX7 5BS,53.730044146328500,-1.994384789641080
Goose and perentie,HX7 5BT,53.732245972345900,-1.990640000000000
Pheasant and River dolphin,HX7 5ER,53.726529464144600,-1.989126095452700
flying lizard and bearded dragon,HX7 5EU,53.725738577940900,-1.989868925841140
bandy-bandy and Grackle,HX7 5HF,53.726295080132400,-1.983033466405500
bull snake and Tahr,HX7 5HH,53.727310779340400,-1.983381658880140
monitor and Tahr,HX7 5HS,53.728200609819100,-1.983472253303150
puff adder and Chicken,HX7 5JF,53.727175441973400,-1.979956397291870
mamba and Fish eagle,HX7 5QT,53.735561000000000,-1.974828530821950
garter snake and Goose,HX7 6BX,53.743738762533400,-2.027815736909860
Towhee and boa constrictor,HX7 6DF,53.750855321229400,-2.035220894415710
death adder and cerastes,HX7 6DS,53.742993484140900,-2.024509935308810
tokay and Nukupuʻu,HX7 6NH,53.737391725897100,-2.033541961119760
boomslang and Stint,HX7 6PQ,53.736644852465200,-2.036482336680700
skink and coral snake,HX7 6QA,53.739712000000000,-2.030739000000000
Greenbul and cerastes,HX7 7AF,53.756424000000000,-2.012475000000000
Schneider python and cobra,HX7 7AX,53.778518289394000,-2.041769367215160
Chipmunk and Eagle,HX7 7HF,53.753775281182400,-2.038908652195880
Kite and Eagle,HX7 7NJ,53.749474375264200,-2.021966000000000
water snake and Logrunners,HX7 7NS,53.748988902469500,-2.022496635814540
water snake and horned viper,HX7 7NW,53.750166647296300,-2.020783680346060
Lemming and Egret,HX7 7PJ,53.759024682909600,-2.075558757556110
water snake and indigo snake,HX7 8BG,53.741961883213500,-2.011076171406290
anole and Rat,HX7 8BN,53.742159729986700,-2.009848131173790
Egret and alligator,HX7 8HA,53.744424749500200,-2.009439288387310
saltwater crocodile and rat snake,HX7 8LR,53.746554592416700,-2.012821179352520
agama and boa constrictor,HX7 8NB,53.748451185907000,-2.011684475116780
Condor and bearded lizard,HX7 8NR,53.733212271605000,-1.998992786826420
dugite and fer-de-lance,HX7 8QP,53.761565117201800,-2.006424679950530
taipan and gopher snake,HX7 8SH,53.750006710385200,-1.999659489244000
tokay and Parakeet,HX7 8WF,53.740649309415600,-2.014062555663030
green turtle and ringhals,HX7 8WJ,53.740649309415600,-2.014062555663030
soft-shelled turtle and goanna,LS29 0JF,53.945486293843200,-1.888212984510770
Siskin and snake,LS29 0LL,53.936613000000000,-1.894527000000000
Songlark and ringhals,LS29 0NX,53.942687502855500,-1.884396646456970
Recurvebill and krait,LS29 0QF,53.941762000000000,-1.883257000000000
Parrotbill and blind snake,LS29 0QT,53.942922444661600,-1.876611239270470
Pheasant and copperhead,LS29 0QW,53.940807616856100,-1.873997288509700
sand viper and Darwin's finches,LS29 0RS,53.940781313386600,-1.883579290963890
Thrasher and flying lizard,LS29 0SF,53.943542877829900,-1.876883634835920
Linsang and Nukupuʻu,LS29 0SS,53.942993099939800,-1.884411037848150
anaconda and smooth snake,LS29 0TP,53.941862740882000,-1.896601335090360
Marmoset and gopher snake,LS29 0TX,53.945519000000000,-1.878618000000000
king snake and Towhee,OL14 7DL,53.725725365386000,-2.118207722019920
Black cockatoo and Vulture,OL14 7ES,53.728806000000000,-2.145832000000000
Polecat and Tit-tyrant,OL14 7ET,53.731743940974500,-2.152951420778100
Darwin's finches and moloch,OL14 8AY,53.727797099963600,-2.122684710418640
terrapin and Prion,OL14 8HS,53.726581763785100,-2.115618444239690
Black cockatoo and gopher snake,OL14 8HY,53.727184620364100,-2.114498000000000
sand viper and ringhals,OL14 8JF,53.727377586715700,-2.128458052340170
tokay and viper,OL14 8JQ,53.729596537039900,-2.129480358308100
Argus and Grosbeak,OL14 8JY,53.732258921566400,-2.135854956712680
frilled lizard and Mouse,OL14 8QD,53.732570994077900,-2.152833162295560
