name,postcode,lat,lon
leathery turtle and Moluccan boobook,BB10 1AB,53.796650270000000,-2.243046126000000
Kestrel and Boto,BB10 1AD,53.797117050000000,-2.243337277000000
sidewinder and frilled lizard,BB10 1BH,53.800502960000000,-2.240153344000000
Hawaiian honeycreeper and Dorcopsis,BB10 1DQ,53.798147190000000,-2.240610509000000
Flameback and Old World vulture,BB10 1DZ,53.804810680000000,-2.234362407000000
Komodo dragon and Logrunners,BB10 1EG,53.807418550000000,-2.233663263000000
mamba and leathery turtle,BB10 1HY,53.807469920000000,-2.239509867000000
Thrasher and Mink,BB10 1LZ,53.800757920000000,-2.238499876000000
Tit-tyrant and Coati,BB10 1ND,53.801595000000000,-2.238505000000000
Moluccan boobook and Songlark,BB10 1PY,53.803592400000000,-2.241355357000000
gaboon viper and rock python,BB10 1SJ,53.806063920000000,-2.232349835000000
Siskin and water snake,BB10 1TT,53.809205020000000,-2.225396911000000
boa and Logrunners,BB10 1UR,53.804730780000000,-2.229199316000000
Kestrel and leguaan,BB10 2BA,53.805399000000000,-2.213730000000000
diamond python and Prion,BB10 2BH,53.813236780000000,-2.222639286000000
lizard and Mockingbird,BB10 2ET,53.811930160000000,-2.209450000000000
mountain devil and python,BB10 2FU,53.812288321900000,-2.236864725800000
swift and Condor,BB10 2HE,53.811610700000000,-2.201931146000000
Prion and amphisbaena,BB10 2LB,53.813313050000000,-2.234485825000000
milk snake and Elephant,BB10 2LR,53.811585010000000,-2.201171686000000
crocodile and Petrel,BB10 2PZ,53.811907300000000,-2.227036417000000
Shearwater and indigo snake,BB10 2QS,53.817334700000000,-2.227734092000000
Kākāriki and Old World quail,BB10 3DW,53.800993310000000,-2.228404584000000
giant tortoise and Buzzard,BB10 3EW,53.801420490000000,-2.225901704000000
bandy-bandy and Kangaroo,BB10 3HL,53.805821210000000,-2.227686806000000
Solitaire and crocodile,BB10 3HW,53.803976960000000,-2.228587841000000
Petrel and blue racer,BB10 3JF,53.790836030000000,-2.219241803000000
Darwin's finches and bull snake,BB10 3JN,53.791303440000000,-2.198615447000000
Badger and Wallaby,BB10 3LB,53.795702410000000,-2.226812162000000
cayman and rock snake,BB10 3NA,53.789185740000000,-2.190955404000000
Old World warbler and Mockingbird,BB10 3NQ,53.788378900000000,-2.189646398000000
mountain devil and Ice seal,BB10 3PU,53.789071600000000,-2.189254884000000
boa constrictor and adder,BB10 4AE,53.787987820000000,-2.233008743000000
Solitaire and B,BB10 4BE,53.791494000000000,-2.233224772000000
turtle and Peafowl,BB10 4DS,53.787404540000000,-2.227844990000000
smooth snake and frill-necked lizard,BB10 4HR,53.784798740000000,-2.207675736000000
blue tongue and crocodile,BB10 4LG,53.787750090000000,-2.220910465000000
Boto and thorn lizard,BB10 4LT,53.787835380000000,-2.223384952000000
adder and Hawaiian honeycreeper,BB10 4PF,53.785018770000000,-2.220349724000000
Chipmunk and deaf adder,BB10 4PY,53.791226530000000,-2.221945770000000
constrictor and hognose snake,BB10 4QP,53.789397340000000,-2.224425412000000
horned viper and gopher snake,BB10 4QW,53.788906470000000,-2.227352246000000
Stint and Puffleg,BB10 4RS,53.772916160000000,-2.180199837000000
dugite and Buzzard,BB11 1DW,53.788640620000000,-2.243713166000000
Armadillo and Marsh harrier,BB11 1EL,53.791916000000000,-2.240651000000000
blind snake and Crow,BB11 1HD,53.787992340000000,-2.244270998000000
Petrel and Duck,BB11 1HG,53.788129000000000,-2.243847000000000
Mink and garter snake,BB11 1HW,53.787273160000000,-2.244342706000000
Grosbeak and rattlesnake,BB11 1JG,53.786524000000000,-2.246251000000000
garter snake and loggerhead,BB11 1JH,53.788435650000000,-2.242846809000000
crocodile and Logrunners,BB11 1JY,53.786829990000000,-2.245690951000000
thorny devil and bushmaster,BB11 1NU,53.789369139932700,-2.245493000000000
Stint and Vole,BB11 1PB,53.789843000000000,-2.245253000000000
Stint and Grackle,BB11 1PP,53.789849140000000,-2.246088083000000
soft-shelled turtle and Grosbeak,BB11 1PQ,53.790942690000000,-2.247536521000000
Songlark and Buzzard,BB11 1PW,53.790746430000000,-2.246821942000000
Puffleg and Marmoset,BB11 1QW,53.790281430000000,-2.245665603000000
Tahr and cerastes,BB11 1RN,53.788668120000000,-2.252137368000000
bearded dragon and Partridge,BB11 1RW,53.789698680000000,-2.249305113000000
Minke whale and massasauga,BB11 2EE,53.788520650000000,-2.240813395000000
cerastes and Rabbit,BB11 2GA,53.790929280000000,-2.240887922000000
Egret and blue tongue,BB11 2LW,53.781716560000000,-2.245327179000000
box turtle and Grosbeak,BB11 2PJ,53.778575680000000,-2.251621563000000
Marsh harrier and boomslang,BB11 2QF,53.774678820000000,-2.254010804000000
Rabbit and tree snake,BB11 2RD,53.775451660000000,-2.241026800000000
green turtle and asp,BB11 2RH,53.775158290000000,-2.239416718000000
bull snake and python,BB11 2SB,53.792772180000000,-2.236192713000000
Gull and diamondback terrapin,BB11 2SD,53.792653840000000,-2.236951042000000
Fox and tokay,BB11 2SF,53.791898370000000,-2.237189654000000
hoop snake and Zebra,BB11 3AA,53.788386570000000,-2.236396000000000
Asiatic leopard and flying lizard,BB11 3BP,53.788240750000000,-2.236941325000000
blue racer and Pitohui,BB11 3BX,53.788201600000000,-2.233996517000000
Gull and Old World vulture,BB11 3DP,53.791041900000000,-2.233951624000000
Asiatic leopard and bicycle lizard,BB11 3EF,53.779389250000000,-2.231489072000000
Kangaroo and Civet,BB11 3EQ,53.779947490000000,-2.230976187000000
hognose snake and Logrunners,BB11 3HD,53.777004120000000,-2.233190621000000
Old World quail and Zebra,BB11 3LE,53.782477710000000,-2.237819395000000
Stilt and adder,BB11 3LP,53.783295420000000,-2.237915083000000
Herring gull and asp,BB11 3LY,53.782132000000000,-2.236102000000000
bicycle lizard and bushmaster,BB11 3NQ,53.780695400000000,-2.234622436000000
sea snake and garter snake,BB11 3QQ,53.779469730000000,-2.236300031000000
bearded dragon and Thrasher,BB11 3QU,53.763882000000000,-2.219207000000000
Cloud rat and boomslang,BB11 4HE,53.775240410000000,-2.256199199000000
viper and racer,BB11 4HY,53.785941620000000,-2.249343526000000
leathery turtle and alligator,BB11 4HZ,53.775239140000000,-2.256790962000000
taipan and amethystine python,BB11 4JY,53.784851020000000,-2.255058812000000
Fulmarine petrel and Bronzewing pigeon,BB11 4QT,53.775770590000000,-2.260420748000000
blue tongue and New World blackbird,BB11 4SD,53.787258080000000,-2.251628032000000
Rat and diamondback turtle,BB11 5HJ,53.773832850000000,-2.258724527000000
Herring gull and Pratincole,BB11 9SJ,53.787596100000000,-2.244648146000000
dukite and whip snake,BB11 9SW,53.787596100000000,-2.244648146000000
thorn lizard and Tree warbler,BB11 9TH,53.787600699187000,-2.244648443995920
anaconda and smooth snake,BB12 0AF,53.798345000000000,-2.245515000000000
hawksbill and Pitohui,BB12 0BX,53.799808180000000,-2.245918711000000
Polecat and leathery turtle,BB12 0DQ,53.807171230000000,-2.244989996000000
Parrotbill and loggerhead,BB12 0JT,53.796980990000000,-2.261007705000000
turtle and Grouse,BB12 0TW,53.796224350000000,-2.257617598000000
indigo snake and bearded dragon,BB12 9LG,53.856691120000000,-2.255328668000000
monitor and Thicketbird,BB12 9PS,53.844663840000000,-2.256015342000000
water snake and alligator,BB12 9QF,53.839816480000000,-2.248843178000000
Diving bird and saltwater crocodile,BB18 5AL,53.914727080000000,-2.186200034000000
Francolin and iguana,BB18 5AP,53.914265850000000,-2.188024853000000
Francolin and black snake,BB18 5AR,53.913475530000000,-2.187640706000000
Jerboa and Stint,BB18 5AT,53.913434000000000,-2.185875000000000
Guillemot and blue racer,BB18 5ER,53.920357300000000,-2.189468293000000
jew lizard and hoop snake,BB18 5HS,53.917127030000000,-2.191767846000000
Guillemot and Coati,BB18 5HX,53.919086210000000,-2.191655000000000
death adder and Bunting,BB18 5JR,53.920925140000000,-2.194374000000000
Jerboa and Flameback,BB18 5LN,53.920075750000000,-2.196866881000000
Chicken and Chicken,BB18 5NW,53.917103990000000,-2.189301294000000
Peafowl and Booted eagles,BB18 5PB,53.914604750000000,-2.189701025000000
diamond snake and asp,BB18 5PE,53.913868550000000,-2.189195298000000
Magpie and Fish eagle,BB18 5TD,53.908203450000000,-2.179305973000000
chuckwalla and Civet,BB18 5UH,53.915892350000000,-2.188214864000000
fer-de-lance and boa,BB18 6AJ,53.916805640000000,-2.184656358000000
Piping shrike and Jay,BB18 6AS,53.917228980000000,-2.184064452000000
worm lizard and Grosbeak,BB18 6BA,53.918471920000000,-2.182349448000000
horned toad and sand viper,BB18 6HE,53.920237120000000,-2.173876205000000
Stilt and Nukupuʻu,BB18 6HH,53.923439710000000,-2.178000899000000
bicycle lizard and Fox,BB18 6HW,53.925358330000000,-2.175130985000000
Stilt and carpet snake,BB18 6LF,53.899855560000000,-2.120358599000000
soft-shelled turtle and indigo snake,BB18 6LJ,53.900248150000000,-2.139581120000000
water snake and Bronzewing pigeon,BB18 6PG,53.913631010000000,-2.139564933000000
Stint and Elephant,BB18 6QX,53.917189820000000,-2.139866097000000
Mouse and turtle,BB18 6RU,53.913837630000000,-2.131710154000000
death adder and Fulmarine petrel,BB18 6SQ,53.916068630000000,-2.137898371000000
Jay and Jackal,BB18 6SU,53.905314640000000,-2.149232732000000
Hawaiian honeycreeper and Warbler,BB18 6UF,53.900236070000000,-2.149595073000000
glass snake and snake,BB4 9NJ,53.733079210000000,-2.237934307000000
Chickadee and horned viper,BB4 9QU,53.731570780000000,-2.241639460000000
harlequin snake and tuatara,BB4 9RJ,53.728878440000000,-2.239608137000000
Hawk and Stint,BB7 4DQ,53.936804000000000,-2.255851000000000
rock python and ringhals,BB7 4JL,53.914167070000000,-2.247397689000000
Myna and bull snake,BB8 0AS,53.855440000000000,-2.161569000000000
Darwin's finches and Cloud rat,BB8 0LG,53.857175930000000,-2.169616000000000
flying dragon and Herring gull,BB8 0NB,53.858633020000000,-2.162126304000000
Masked owl and Towhee,BB8 0NG,53.858055340000000,-2.163933288000000
rat snake and Coati,BB8 0PZ,53.857810990000000,-2.151556731000000
bearded dragon and Puffleg,BB8 0QY,53.861800760000000,-2.159143207000000
Old World warbler and king cobra,BB8 7DB,53.861233630000000,-2.152922338000000
monitor and fer-de-lance,BB8 7DH,53.863061980000000,-2.156928021000000
bull snake and Pheasant,BB8 7EN,53.865434500000000,-2.108505173000000
Warbler and iguana,BB8 7HL,53.861864160000000,-2.128824866000000
tiger snake and Maya,BB8 7HU,53.862448040000000,-2.120509466000000
Stilt and Fish eagle,BB8 7QA,53.877509380000000,-2.167325397000000
Grouse and diamond snake,BB8 8BY,53.856686430000000,-2.137550671000000
hoop snake and Jackal,BB8 8EN,53.854754620000000,-2.137042648000000
Herring gull and Linsang,BB8 8HT,53.851577030000000,-2.169000328000000
hognose snake and Goose,BB8 8JB,53.850674320000000,-2.189639451000000
crocodile and Hawk,BB8 8JH,53.849424530000000,-2.189937803000000
pit viper and Asiatic leopard,BB8 8LB,53.849635260000000,-2.193282000000000
sand lizard and Cloud rat,BB8 8LG,53.846196450000000,-2.196398046000000
swift and blind snake,BB8 8NR,53.853447280000000,-2.155418000000000
Thrasher and Pheasant,BB8 8NX,53.844980580000000,-2.140673572000000
indigo snake and Gila monster,BB8 8QB,53.846986550000000,-2.131287011000000
Thrasher and horned toad,BB8 8QD,53.844103720000000,-2.129059000000000
worm lizard and rattlesnake,BB8 8SR,53.839884520000000,-2.132723657000000
gaboon viper and Civet,BB8 9DE,53.856758460000000,-2.172213879000000
boomslang and blindworm,BB8 9EY,53.862558280000000,-2.170367496000000
Nukupuʻu and Goose,BB8 9HY,53.858859090000000,-2.167661370000000
goanna and king cobra,BB8 9LF,53.861072530000000,-2.165921701000000
caiman and Parrotlet,BB8 9QY,53.856802340000000,-2.184984645000000
Chicken and copperhead,BB9 0BZ,53.830610540000000,-2.212703735000000
sea snake and Black cockatoo,BB9 0HN,53.821664870000000,-2.219175039000000
Cloud rat and tortoise,BB9 0JF,53.829212430000000,-2.205252027000000
crocodile and Polecat,BB9 0JT,53.830200990000000,-2.205317640000000
box turtle and Fulmarine petrel,BB9 0NH,53.832703620000000,-2.208216822000000
diamondback and Hawk,BB9 0PP,53.824010810000000,-2.219126532000000
glass snake and anole,BB9 0QY,53.827993340000000,-2.213662791000000
cayman and diamond snake,BB9 0RQ,53.830308360000000,-2.210772629000000
gopher snake and habu,BB9 0RS,53.827016500000000,-2.212062623000000
Night heron and Meadowlark,BB9 0TB,53.833878060000000,-2.204727855000000
Lemming and crocodile,BB9 0TG,53.835425290000000,-2.203960448000000
mamba and Viscacha,BB9 0TH,53.834959390000000,-2.203092056000000
Logrunners and perentie,BB9 0TJ,53.834995340000000,-2.203092230000000
Mouse and Boto,BB9 0XB,53.828478320000000,-2.208773170000000
Meadowlark and indigo snake,BB9 0YH,53.818182130000000,-2.221571913000000
Condor and Cloud rat,BB9 4DA,53.834115140000000,-2.218268000000000
cobra de capello and cobra de capello,BB9 4SB,53.836968960000000,-2.215516844000000
loggerhead and king snake,BB9 4TB,53.836973503019500,-2.215517134948150
copperhead and Mockingbird,BB9 4UQ,53.836973503019500,-2.215517134948150
soft-shelled turtle and amethystine python,BB9 4US,53.836973503019500,-2.215517134948150
amphisbaena and Towhee,BB9 5AD,53.822624550000000,-2.234492297000000
Flameback and anole,BB9 5AE,53.823633910000000,-2.233100359000000
Rabbit and Mink,BB9 5BT,53.822721610000000,-2.226077162000000
chuckwalla and king cobra,BB9 5EP,53.818893380000000,-2.220922526000000
Mamo and Parrotlet,BB9 5GZ,53.824613770000000,-2.233014655000000
puff adder and Towhee,BB9 5HH,53.825746880000000,-2.232686729000000
blue racer and death adder,BB9 5HS,53.823632110000000,-2.234027005000000
Shearwater and bearded dragon,BB9 5PG,53.824500860000000,-2.235596566000000
Perching duck and Shearwater,BB9 6BQ,53.862935640000000,-2.204900278000000
Booted eagles and Kangaroo,BB9 6EG,53.851769790000000,-2.216763461000000
gopher snake and monitor,BB9 6EH,53.851437550000000,-2.216594529000000
Triller and Songlark,BB9 6EP,53.853165180000000,-2.215508933000000
Thicketbird and Dolphin,BB9 6HD,53.854709490000000,-2.216398611000000
diamondback terrapin and alligator,BB9 6HZ,53.854345630000000,-2.213812358000000
krait and Macaw,BB9 6JL,53.856292030000000,-2.210979349000000
Kestrel and Vole,BB9 6NB,53.871282300000000,-2.221776755000000
Buzzard and River dolphin,BB9 6NT,53.858309980000000,-2.241822492000000
cobra and wall lizard,BB9 6RF,53.868022940000000,-2.204803514000000
chuckwalla and mamba,BB9 7AZ,53.835688530000000,-2.222697707000000
New World blackbird and chuckwalla,BB9 7BU,53.833636280000000,-2.224312640000000
Parrotlet and Kākāriki,BB9 7DG,53.830837150000000,-2.226379202000000
snake and Vulture,BB9 7LP,53.837722790000000,-2.216158959000000
deaf adder and Cloud rat,BB9 7QN,53.840044000000000,-2.210335000000000
Towhee and Moluccan boobook,BB9 7RF,53.841439320000000,-2.208533770000000
Piping shrike and iguana,BB9 7RP,53.842236000000000,-2.206076000000000
Black cockatoo and bicycle lizard,BB9 7RQ,53.841853130000000,-2.208323061000000
White ibis and Badger,BB9 7RU,53.843895290000000,-2.212360791000000
loggerhead and Chipmunk,BB9 7TW,53.839413490000000,-2.220559549000000
Kestrel and amethystine python,BB9 7UR,53.836871460000000,-2.214756550000000
goanna and Jackal,BB9 7XQ,53.839742230000000,-2.212719674000000
Thicketbird and Cuscus,BB9 7XX,53.841341530000000,-2.213031739000000
Pitohui and snake,BB9 8AD,53.839089290000000,-2.200452648000000
habu and American sparrow,BB9 8AR,53.839479360000000,-2.198296566000000
crocodile and blind snake,BB9 8BT,53.839611410000000,-2.194497977000000
pit viper and horned viper,BB9 8BZ,53.840760400000000,-2.189807352000000
Darwin's finches and Vulture,BB9 8DN,53.838310110000000,-2.199249000000000
Skunk and boa constrictor,BB9 8EP,53.842805650000000,-2.203206064000000
Jackal and tiger snake,BB9 8JF,53.844243390000000,-2.198030335000000
gavial and gecko,BB9 8JZ,53.844468260000000,-2.192407910000000
mountain devil and habu,BB9 8LD,53.844927800000000,-2.191680479000000
Asiatic leopard and Booted eagles,BB9 8LN,53.842684320000000,-2.205834725000000
Warbler and boa constrictor,BB9 8LX,53.845131140000000,-2.204600436000000
Thicketbird and Mockingbird,BB9 8NE,53.848820990000000,-2.217189013000000
wall lizard and Old World vulture,BB9 8QG,53.850150970000000,-2.217317512000000
amphisbaena and gopher snake,BB9 8RU,53.847237160000000,-2.202923560000000
Duck and Gila monster,BB9 8SZ,53.845242250000000,-2.202685917000000
perentie and Ground sloth,BB9 8TL,53.848272730000000,-2.222095772000000
Night heron and thorn lizard,BB9 9AP,53.834113230000000,-2.214165017000000
blind snake and ringhals,BB9 9DF,53.833940970000000,-2.209924786000000
chameleon and death adder,BB9 9DN,53.834024220000000,-2.208572862000000
thorny devil and Kākāriki,BB9 9EY,53.836493220000000,-2.199589274000000
sand lizard and Dolphin,BB9 9HP,53.839299200000000,-2.203888116000000
Gila monster and Petrel,BB9 9HT,53.837420870000000,-2.203803000000000
Thrasher and mud turtle,BB9 9HW,53.838319810000000,-2.203716192000000
milk snake and moloch,BB9 9NH,53.835250970000000,-2.195298291000000
Thrasher and Lemming,BB9 9PU,53.834510000000000,-2.208970000000000
mountain devil and Pratincole,BB9 9SX,53.836935190000000,-2.214300999000000
snake and Chicken,BB9 9TX,53.838744550000000,-2.207608572000000
Perching duck and Triller,BD13 1JD,53.773374840000000,-1.859856357000000
python and mud turtle,BD13 1LL,53.774092750000000,-1.858898060000000
Thicketbird and Tahr,BD13 1LQ,53.774571060000000,-1.860565527000000
Petrel and Logrunners,BD13 1NS,53.773396560000000,-1.863103288000000
Crow and Logrunners,BD13 2DH,53.762087630000000,-1.861350078000000
Minke whale and thorny devil,BD13 2HW,53.769609460000000,-1.852844446000000
Grouse and Lemming,BD13 2JP,53.769889850000000,-1.854284774000000
Dorcopsis and blindworm,BD13 2JR,53.771232320000000,-1.856995946000000
Tattler and tokay,BD13 2JW,53.769792900000000,-1.855878129000000
leguaan and Grackle,BD13 2LZ,53.762105750000000,-1.853886947000000
boa constrictor and blue racer,BD13 2QF,53.769839960000000,-1.850264463000000
leguaan and Civet,BD13 3JG,53.791027910000000,-1.852891064000000
Crow and kabaragoya,BD13 3JJ,53.791109830000000,-1.853740819000000
soft-shelled turtle and Magpie,BD13 3JY,53.790145820000000,-1.851861975000000
diamond python and Chipmunk,BD13 3ND,53.790363060000000,-1.853105892000000
Snipe and wall lizard,BD13 3NL,53.790958660000000,-1.855077118000000
Puffleg and coral snake,BD13 3NQ,53.791568310000000,-1.853815124000000
Masked owl and hognose snake,BD13 3NT,53.793611830000000,-1.856510109000000
galliwasp and blind snake,BD13 3QB,53.791704390000000,-1.870770000000000
bushmaster and River dolphin,BD13 3QX,53.794442930000000,-1.859892000000000
chuckwalla and rock python,BD13 3QZ,53.794191870000000,-1.860591666000000
puff adder and Hawaiian honeycreeper,BD13 3RR,53.802468580000000,-1.867472717000000
Armadillo and Kangaroo,BD13 4AS,53.802846530000000,-1.895257409000000
Booted eagles and Kākāriki,BD13 4DJ,53.800600830000000,-1.896750898000000
carpet snake and puff adder,BD13 4DP,53.799121180000000,-1.900747440000000
Jay and diamond snake,BD13 4DQ,53.800977370000000,-1.895641627000000
horned toad and flying lizard,BD13 4EP,53.792885000000000,-1.890818496000000
River dolphin and blindworm,BD13 4FD,53.798759000000000,-1.900068000000000
Marmoset and Minke whale,BD13 4HG,53.787288660000000,-1.885718797000000
Macaw and Francolin,BD13 4LD,53.806677890000000,-1.898163388000000
worm lizard and Marmoset,BD13 5AP,53.824891200000000,-1.892164269000000
glass snake and anole,BD13 5AU,53.824917720000000,-1.891662881000000
Grosbeak and gavial,BD13 5DH,53.823406010000000,-1.900036996000000
Diving bird and Treepie,BD13 5DN,53.822847240000000,-1.898230621000000
Elephant and Duck,BD13 5DZ,53.821448600000000,-1.902426514000000
Jay and Greenbul,BD13 5EF,53.826587110000000,-1.899285030000000
whip snake and Thicketbird,BD13 5FG,53.820947000000000,-1.896962000000000
Ibex and carpet snake,BD13 5FH,53.821578000000000,-1.898935000000000
Perching duck and swift,BD13 5GY,53.826734250000000,-1.903554000000000
grass snake and Linsang,BD13 5HE,53.827512400000000,-1.898735888000000
Nukupuʻu and green turtle,BD13 5JF,53.826829830000000,-1.899345218000000
crocodile and Quetzal,BD15 0BE,53.824050990000000,-1.869425000000000
leguaan and caiman,BD15 0HR,53.821028360000000,-1.859287564000000
Thrasher and king snake,BD15 0JF,53.816836210000000,-1.856096786000000
Masked owl and American sparrow,BD15 0LL,53.818234580000000,-1.860542412000000
Old World quail and Partridge,BD15 0LN,53.817274030000000,-1.861548053000000
Crow and Kangaroo,BD15 0LW,53.818101900000000,-1.862395917000000
Duck and Coati,BD15 0ND,53.816447970000000,-1.862264629000000
Egret and bearded lizard,BD15 9AB,53.808343000000000,-1.855564000000000
Chipmunk and rock python,BD16 1HX,53.839516120000000,-1.866839306000000
Stint and Polecat,BD16 1JQ,53.836901350000000,-1.867485811000000
water snake and carpet snake,BD16 1JR,53.840867940000000,-1.870163234000000
monitor and Fulmarine petrel,BD16 1QL,53.842136400000000,-1.871253556000000
rat snake and sand viper,BD16 2DL,53.858460000000000,-1.855924000000000
gecko and green turtle,BD16 2UA,53.862419000000000,-1.851866000000000
Cloud rat and puff adder,BD20 0AL,53.912491860000000,-1.937380765000000
wall lizard and Pheasant,BD20 0DG,53.911776080000000,-1.944141000000000
habu and agama,BD20 0FS,53.906135000000000,-1.937424000000000
Mockingbird and sand lizard,BD20 0FU,53.906135000000000,-1.937424000000000
gavial and Fox,BD20 0LR,53.912873000000000,-1.926876260000000
Chickadee and Recurvebill,BD20 0LS,53.900481530000000,-1.905728092000000
Viscacha and Night heron,BD20 0NW,53.909211020000000,-1.936822435000000
glass snake and cayman,BD20 0QQ,53.910034830000000,-1.931204137000000
horned viper and snapping turtle,BD20 5AH,53.878879410000000,-1.889972251000000
Flameback and Tit-tyrant,BD20 5AZ,53.877617000000000,-1.884317000000000
Diving bird and Armadillo,BD20 5BB,53.878313440000000,-1.880816791000000
snake and mountain devil,BD20 5DD,53.882209440000000,-1.895044431000000
brown snake and rat snake,BD20 5DQ,53.881986880000000,-1.897524575000000
python and Vulture,BD20 5HQ,53.878865830000000,-1.876008526000000
wall lizard and Maya,BD20 5LA,53.873863750000000,-1.871399678000000
Solitaire and cobra,BD20 5NH,53.867000260000000,-1.858282040000000
Minke whale and Treepie,BD20 5PD,53.880531000000000,-1.886058000000000
cycling lizard and Marmoset,BD20 5PJ,53.880879450000000,-1.885418685000000
leathery turtle and Myna,BD20 5PU,53.880892920000000,-1.880779048000000
copperhead and Stilt,BD20 5QH,53.883599000000000,-1.900563000000000
galliwasp and diamond snake,BD20 5RE,53.884468030000000,-1.870119727000000
taipan and cobra,BD20 5RZ,53.871434190000000,-1.853217898000000
hognose snake and mud turtle,BD20 5TH,53.875169840000000,-1.850543138000000
amethystine python and amethystine python,BD20 6AA,53.877081430000000,-1.911241124000000
Egret and Ice seal,BD20 6AT,53.878880120000000,-1.912773644000000
Old World vulture and elapid,BD20 6BB,53.878852510000000,-1.911891460000000
iguana and Argus,BD20 6DX,53.883206290000000,-1.917054630000000
whip snake and glass snake,BD20 6ED,53.880617740000000,-1.916710000000000
chuckwalla and diamondback turtle,BD20 6FG,53.898363000000000,-1.955922368329060
tortoise and glass snake,BD20 6HP,53.881959190000000,-1.920327711000000
terrapin and slowworm,BD20 6JL,53.873456490000000,-1.920009219000000
monitor and elapid,BD20 6LG,53.877233450000000,-1.923181023000000
dugite and Asiatic leopard,BD20 6PN,53.893534590000000,-1.952731891000000
Snipe and Recurvebill,BD20 6PY,53.892842410000000,-1.952413129000000
skink and indigo snake,BD20 6RL,53.896211030000000,-1.948041941000000
Parrotbill and Piping shrike,BD20 6RS,53.896057440000000,-1.946216054000000
Mink and Boto,BD20 6RY,53.898889000000000,-1.944842622000000
tokay and sidewinder,BD20 6SB,53.897101390000000,-1.949364780000000
New World blackbird and Goose,BD20 6SG,53.897748580000000,-1.949638000000000
Kangaroo and tiger snake,BD20 7AJ,53.895825500000000,-1.982752890000000
Greenbul and Rat,BD20 7BP,53.888770870000000,-1.990058785000000
American sparrow and smooth snake,BD20 7LD,53.901021320000000,-1.990832128000000
Pratincole and sand lizard,BD20 7PL,53.892510120000000,-1.995520469000000
boa and constrictor,BD20 7PP,53.892051760000000,-1.996083502000000
Tattler and Minke whale,BD20 7QP,53.893822380000000,-1.996585491000000
Tree warbler and Capuchin,BD20 8AF,53.897869000000000,-1.969714000000000
diamondback terrapin and Lemming,BD20 8AZ,53.897581000000000,-1.967538000000000
chameleon and krait,BD20 8DB,53.897489130000000,-1.991137235000000
Civet and habu,BD20 8DG,53.898109310000000,-1.990894000000000
wall lizard and Fulmarine petrel,BD20 8DU,53.893902510000000,-2.013551903000000
Coati and Masked owl,BD20 8HH,53.905170000000000,-2.086949000000000
Solitaire and lizard,BD20 8HP,53.893878000000000,-2.103304549000000
Eagle and Armadillo,BD20 8JH,53.900769350000000,-2.012123581000000
Duck and whip snake,BD20 8JZ,53.916614480000000,-2.015112326000000
python and Thicketbird,BD20 8LD,53.917459210000000,-2.016026141000000
harlequin snake and chuckwalla,BD20 8LU,53.916705180000000,-2.005992699000000
massasauga and Wallaby,BD20 8NQ,53.919229300000000,-2.019391715000000
Stint and Elephant,BD20 8PR,53.899547650000000,-1.999720086000000
horned toad and habu,BD20 8RD,53.899574500000000,-2.005046589000000
Elephant and Boto,BD20 8SR,53.901632660000000,-1.993525819000000
Fulmarine petrel and harlequin snake,BD20 8UA,53.896236450000000,-1.969985353000000
Thrasher and racer,BD20 9AN,53.911284900000000,-1.985760740000000
Prion and diamondback,BD20 9AU,53.910179470000000,-1.986430896000000
Masked owl and hoop snake,BD20 9BH,53.908696060000000,-1.983250000000000
Kite and bearded dragon,BD20 9BJ,53.911565000000000,-1.988760000000000
python and Marmoset,BD20 9BP,53.915276140000000,-1.993934850000000
deaf adder and Rabbit,BD20 9DS,53.932083320000000,-1.995090029000000
python and massasauga,BD20 9ED,53.932991140000000,-1.996826232000000
Badger and tree snake,BD20 9ES,53.936909770000000,-1.995942494000000
