name,id,postcode,lat,lon
constrictor and Night heron,1261504,DY14 9RE,52.361533645068200,-2.396736722353050
krait and king cobra,1049971,HR7 4QP,52.198927467963500,-2.485238588908600
indigo snake and blue tongue,1262908,DY12 1PZ,52.365900000000000,-2.286042000000000
Ibex and Piping shrike,2637677,WR2 5TY,52.181622000000000,-2.269950000000000
Night heron and anole,41475,WR6 6BQ,52.315426000000000,-2.362569000000000
wall lizard and ringhals,1262318,DY13 8UL,52.339667486966800,-2.281630642600580
Schneider python and blue tongue,1262296,DY13 0RD,52.320479209773900,-2.297573597101520
asp and Kākāriki,41420,WR6 5UG,52.193046744049100,-2.446802053397750
Tahr and Solitaire,1050267,HR7 4FN,52.188251236819600,-2.511614000000000
Egret and turtle,1261875,DY13 9AW,52.340738987838700,-2.272933000000000
asp and sand viper,43580,WR2 6QS,52.214833383370600,-2.279463928657610
dukite and rattlesnake,222036,SY8 3BU,52.337901468990900,-2.654576419092240
hawksbill and Dorcopsis,1262430,DY12 2XZ,52.338591344485400,-2.332450742436950
Ibex and gopher snake,1262639,DY12 2DY,52.373869283581700,-2.312533311959990
flying lizard and bandy-bandy,1261391,DY14 9JS,52.334698763457400,-2.469978666037780
bandy-bandy and Petrel,1262291,DY13 0PA,52.328611029852400,-2.292110844077420
Black cockatoo and Ice seal,1769716,DY14 9AG,52.351724000000000,-2.369958000000000
Black jay and B,43854,WR2 4PT,52.153880101947300,-2.263018407843810
dukite and tuatara,40925,WR6 6YR,52.259401938884000,-2.323858366162700
Polecat and cayman,1050194,HR7 4BA,52.188691000000000,-2.516445000000000
skink and Vole,41322,WR6 6YN,52.253712248137900,-2.306589536429520
ringhals and Capuchin,1050763,HR6 0QU,52.231318340418500,-2.662774000000000
Mole and constrictor,1780890,WR15 8TR,52.305565000000000,-2.598646000000000
goanna and rattlesnake,41647,WR6 5BQ,52.154646000000000,-2.477404000000000
Bronzewing pigeon and flying dragon,41466,WR6 6AZ,52.307934560096000,-2.374505886102930
Macaw and Jackal,1262163,DY13 8QZ,52.351010789453500,-2.293653333450190
anaconda and brown snake,46009,WR13 5ED,52.150091000000000,-2.342239000000000
chuckwalla and moloch,1263371,DY11 7BY,52.369098139661300,-2.271478132394610
Towhee and goanna,44301,WR15 8HB,52.317208060055300,-2.599976397676400
Kangaroo and hognose snake,43551,WR2 6NX,52.240239434580600,-2.294546553215500
horned toad and Warbler,1263420,DY11 7JJ,52.370734965716700,-2.271209109196660
kabaragoya and Towhee,41694,WR6 5HP,52.170756295831800,-2.355177182868840
Kangaroo and Old World warbler,2635302,HR6 0RD,52.242138000000000,-2.640188000000000
Night heron and Black cockatoo,2560222,WR6 6EJ,52.253901000000000,-2.424412000000000
Songlark and gavial,1050263,HR7 4FF,52.185918338670400,-2.516954297793330
mud turtle and Hawaiian honeycreeper,44316,WR15 8HW,52.326182387488900,-2.606627414746590
Schneider python and Fox,222119,SY8 3LW,52.370001686184200,-2.616921686467490
Gila monster and Moluccan boobook,1261492,DY14 9NW,52.358445789877600,-2.423829956297540
grass snake and Nukupuʻu,1261981,DY13 9HN,52.338778523424800,-2.277383280685560
terrapin and Old World warbler,41325,WR6 5LT,52.196144728229800,-2.296873545439430
Recurvebill and skink,1262320,DY13 8UP,52.339471279376000,-2.280968910843070
mamba and green turtle,1262602,DY13 0DP,52.326550969184500,-2.288986555563680
flying lizard and bearded lizard,1261039,DY14 9TE,52.367729962576500,-2.398789676516780
Darwin's finches and Mink,44379,WR15 8ND,52.317342072147500,-2.593024508287400
skink and Old World warbler,41303,WR6 6XP,52.267458287858400,-2.463654563952910
blue tongue and amphisbaena,44276,WR15 8ED,52.310096747316200,-2.596418590417880
Lemming and Mouse,41520,WR6 6HJ,52.249729500796500,-2.437704027503360
Ibex and Macaw,41288,WR6 6UY,52.301004196325400,-2.404143482367510
Greenbul and worm lizard,1262798,DY12 2UN,52.363543612866700,-2.361524374399150
Logrunners and Grackle,1263386,DY11 7EG,52.367913007232000,-2.270795265314590
Night heron and Marmoset,1261947,DY13 9EQ,52.339239769635300,-2.280028091927140
Ground sloth and Tahr,1262723,DY12 2PQ,52.374856997819500,-2.326274659916930
Old World warbler and gopher snake,1262314,DY13 8UE,52.345582153536500,-2.293074192463920
Crow and Badger,1780902,WR2 4ST,52.156770000000000,-2.265857000000000
blue racer and Nukupuʻu,1261930,DY13 9DN,52.347634808764500,-2.273122803563590
dukite and mud turtle,44381,WR15 8NF,52.317025515675300,-2.593401699050480
Jackal and Mink,222044,SY8 3DF,52.342668576464100,-2.585657160842310
gaboon viper and Dolphin,44355,WR15 8JX,52.325256982026400,-2.454413429188300
Thrasher and blind snake,1263397,DY11 7EW,52.366526000000000,-2.272241000000000
cycling lizard and Parrotlet,41347,WR6 5NZ,52.203821247034400,-2.364644916018150
Armadillo and fer-de-lance,1262771,DY12 2SG,52.367562159282100,-2.307598077005300
Mole and Rabbit,1261340,DY14 9DE,52.362460824146700,-2.390372000000000
Rat and Night heron,1261345,DY14 9DL,52.360308555055800,-2.408003342635970
lizard and Asiatic leopard,44309,WR15 8HN,52.333182863547500,-2.603700072921810
Fulmarine petrel and Marsh harrier,1262156,DY13 8QL,52.351926325989200,-2.286935255009030
River dolphin and Argus,1261926,DY13 9DG,52.346258717978800,-2.273378549245190
Fish eagle and Chickadee,44284,WR15 8EP,52.307133267144500,-2.597537431683940
Puffleg and snake,1262578,DY13 0AS,52.334739666758800,-2.289553627743100
adder and Maya,1261726,DY14 0AS,52.351422059230000,-2.523097525339650
grass snake and green turtle,1261515,DY14 9RW,52.348972368925400,-2.402144000000000
anole and slowworm,1261513,DY14 9RT,52.339122209576300,-2.393703262283170
Tahr and diamond python,222028,SY8 3BE,52.372529252005300,-2.571995308887460
mud turtle and horned viper,1261505,DY14 9RF,52.361341000000000,-2.395590000000000
python and monitor,1261928,DY13 9DJ,52.346718874586400,-2.272662079090000
hoop snake and green turtle,1262227,DY13 0HF,52.327605150036500,-2.284327258147730
Asiatic leopard and black snake,1820742,DY13 9QD,52.328619000000000,-2.268629000000000
Marsh harrier and bicycle lizard,1262569,DY13 0AF,52.335755832074800,-2.289442860446280
Tit-tyrant and caiman,1262776,DY12 2TF,52.369582572049500,-2.308508055163850
Cuscus and elapid,43857,WR2 4PX,52.154580566779300,-2.263373336977740
Snipe and Mole,1262642,DY12 2EB,52.373297363149400,-2.321298394002360
Grouse and Treepie,44040,WR15 8RS,52.262783000000000,-2.542083000000000
mountain devil and ringhals,44347,WR15 8JN,52.311637257886500,-2.444827490415580
tokay and Jay,1262062,DY13 8HA,52.341703673841900,-2.279779464423350
blue tongue and Stilt,41387,WR6 5RY,52.221434000000000,-2.413784000000000
Buzzard and pit viper,41486,WR6 6DJ,52.251418944947200,-2.418077154360160
rock snake and glass snake,1050218,HR7 4DG,52.185878501371200,-2.509581876913760
garter snake and cerastes,1261745,DY14 0BW,52.360162524314100,-2.522657463257820
Songlark and Tree warbler,44261,WR15 8DJ,52.302879646770800,-2.592420555338040
turtle and Duck,1262325,DY13 0RZ,52.307329209534800,-2.278022507405450
Quetzal and black snake,1262295,DY13 0RB,52.322464095674000,-2.294769938205240
Towhee and Minke whale,1262796,DY12 2UH,52.364719479834400,-2.353221806552550
Mockingbird and milk snake,41686,WR6 5HB,52.165291015192500,-2.375192385240540
mud turtle and Marmoset,1769705,DY13 9DU,52.337587779369700,-2.277346746421750
bearded lizard and Peafowl,1049963,HR7 4QA,52.252625051777300,-2.487963345945930
chameleon and Stilt,1769507,DY11 7AS,52.367716025619400,-2.272556749177120
Scimitar babbler and Macaw,1262082,DY13 8JW,52.347967897815900,-2.280597098978190
Old World quail and Ice seal,41332,WR6 5NE,52.194943257480000,-2.354302092102320
caiman and crocodile,1049972,HR7 4QQ,52.186147873463800,-2.494884838578860
iguana and galliwasp,1261730,DY14 0AY,52.354901747840000,-2.531052575647740
snapping turtle and Skunk,41163,WR6 6NE,52.266625446052800,-2.268433407087780
Boto and Solitaire,45924,WR13 5DQ,52.164453000000000,-2.321604000000000
Hawaiian honeycreeper and Rat,1049954,HR7 4PP,52.230356997820100,-2.476679339588550
Stilt and B,1262221,DY13 8TY,52.346311730706000,-2.292521192857980
Guillemot and Pheasant,1262589,DY13 0BF,52.331298697963800,-2.292275311514050
brown snake and Greenbul,1261867,DY13 9AL,52.341656246629400,-2.273159320697000
agamid and blindworm,1050009,HR7 4SN,52.176537036020200,-2.613494628965490
Francolin and saltwater crocodile,1261405,DY14 9LL,52.356475184200200,-2.451004232265130
Marmoset and dukite,41473,WR6 6BN,52.307683476653200,-2.363298000000000
Guillemot and Badger,1261277,DY14 9AE,52.369911606814100,-2.397002766849210
Ice seal and turtle,41141,WR6 6JT,52.285084003827200,-2.343778000000000
Stilt and skink,1263025,DY11 7NS,52.373185893068600,-2.272678307018000
slowworm and Old World vulture,1769702,DY13 8DY,52.348725346080200,-2.289131542610220
frilled lizard and Kangaroo,1261377,DY14 9HZ,52.332638000000000,-2.440430000000000
blind snake and Civet,1049953,HR7 4PN,52.216938000000000,-2.476111000000000
blue racer and Old World quail,1262667,DY12 2HS,52.374267644482200,-2.328077056986740
Darwin's finches and amphisbaena,44248,WR15 8BT,52.311811161061300,-2.595180158130560
Recurvebill and diamondback terrapin,41229,WR6 5LR,52.185456687430800,-2.299800766725360
harlequin snake and Vole,1261945,DY13 9EN,52.337084000000000,-2.279633000000000
Cloud rat and goanna,1261975,DY13 9HE,52.339275455637900,-2.276476000000000
Dorcopsis and Solitaire,44034,WR15 8RH,52.296925000000000,-2.580522000000000
fer-de-lance and pit viper,1781603,WR6 6DQ,52.249278334258700,-2.419771097598080
water snake and Towhee,44250,WR15 8BW,52.310675052140100,-2.595839644097880
Old World vulture and bearded lizard,1262412,DY13 8AF,52.344702586863500,-2.273735920709080
monitor and Ice seal,41404,WR6 5TD,52.186828724115100,-2.473580573971610
Zebra and diamondback terrapin,1769692,DY13 0BL,52.331511795841900,-2.295314678845260
Peafowl and bearded dragon,1050780,HR6 0RU,52.210708000000000,-2.651022000000000
Boto and leguaan,1261955,DY13 9FG,52.336314415733800,-2.277720082554750
king cobra and Goose,1262361,DY13 0UR,52.319156077927300,-2.331879513733030
Rat and crocodile,41345,WR6 5NX,52.211789094640700,-2.360963550644140
Chickadee and Night heron,1050196,HR7 4BD,52.188952545114000,-2.513888388542920
Dolphin and Songlark,46005,WR13 5DY,52.154548000000000,-2.313844000000000
habu and horned viper,1262074,DY13 8JL,52.349244938634900,-2.280414343866430
copperhead and Tattler,1262421,DY13 8AS,52.348632000000000,-2.274169364096460
Jay and hognose snake,44369,WR15 8LR,52.321245248893100,-2.528360608429650
mud turtle and Greenbul,45920,WR13 5DH,52.168230000000000,-2.346428000000000
mamba and boa constrictor,1262268,DY13 0LX,52.331114686633600,-2.290337042246940
chameleon and hoop snake,1261894,DY13 9BZ,52.339396000000000,-2.271281000000000
saltwater crocodile and Polecat,1263198,DY12 1BQ,52.373470503394700,-2.303423499773600
Kangaroo and rock python,1262580,DY13 0AU,52.336547191101700,-2.285661505118140
Jay and dukite,1780932,WR2 6RU,52.209200585007600,-2.276531000000000
Triller and Dorcopsis,41717,WR6 5JX,52.180181430396300,-2.338843114697930
Ice seal and flying lizard,1050240,HR7 4EA,52.191360320560700,-2.508050055989810
krait and Old World warbler,1261225,DY14 8RD,52.374641000000000,-2.486047000000000
hoop snake and Viscacha,1263385,DY11 7EF,52.368779811100000,-2.269155611976840
Gull and amphisbaena,41320,WR6 6YJ,52.243845226380900,-2.311779334270050
fer-de-lance and Jay,41298,WR6 6XG,52.312913790786600,-2.407493793778510
