name,postcode,lat,lon
tree snake and deaf adder,MK41 0AS,52.150551265878600,-0.428584547386633
soft-shelled turtle and amethystine python,MK41 0DE,52.154550443075100,-0.429788567954766
Recurvebill and diamondback turtle,MK41 0DH,52.154011290621400,-0.428462713472564
Greenbul and perentie,MK41 0GJ,52.155454988897400,-0.420094146525456
Chipmunk and Capuchin,MK41 0JT,52.161863551888600,-0.424633410381343
agamid and king cobra,MK41 0NW,52.153390342851900,-0.422359861739763
Marsh harrier and Fulmarine petrel,MK41 0PU,52.152393113565600,-0.426458679439235
cycling lizard and bearded dragon,MK41 0PX,52.153399080340800,-0.426379357309626
Grackle and Thicketbird,MK41 0TL,52.153544998159700,-0.418466132661050
Viscacha and Mockingbird,MK41 0TN,52.153595169685200,-0.417514214136817
wall lizard and python,MK41 6AL,52.162610583756000,-0.503411109573410
Piping shrike and Grouse,MK41 6AQ,52.161219415777600,-0.497946070608651
Towhee and Skunk,MK41 6BL,52.184713000000000,-0.490777000000000
diamond snake and Ibex,MK41 6BQ,52.167403720087800,-0.502767776038726
Flameback and flying dragon,MK41 6DB,52.166687142104500,-0.499590000000000
Snipe and terrapin,MK41 6EN,52.150439967020100,-0.483970182396796
Philippine hawk-owl and horned toad,MK41 6ER,52.162574058511300,-0.487856274296975
Guillemot and Philippine hawk-owl,MK41 6GD,52.170103165337300,-0.506479091567799
Ibex and slowworm,MK41 6GF,52.168315493773500,-0.507313927400766
milk snake and indigo snake,MK41 6HA,52.164513998117600,-0.486986362543563
Triller and Perching duck,MK41 6HJ,52.169741373029000,-0.504180820927214
Egret and rattlesnake,MK41 6HP,52.169110310851800,-0.504757638763674
brown snake and glass snake,MK41 7BH,52.159134674881800,-0.461760495988339
Egret and mountain devil,MK41 7DU,52.154287611634500,-0.458945564785592
bearded dragon and Coati,MK41 7EL,52.160163540935900,-0.456549676122475
New World blackbird and Kangaroo,MK41 7EP,52.158910878857500,-0.457016965710671
Darwin's finches and Pitohui,MK41 7FD,52.168814000000000,-0.459248000000000
agamid and viper,MK41 7FX,52.169194000000000,-0.464265000000000
box turtle and bearded lizard,MK41 7HN,52.154582313064900,-0.462926046302298
Kangaroo and Pitohui,MK41 7JE,52.158440552157800,-0.465073713183991
chuckwalla and mamba,MK41 7JN,52.150694483145600,-0.456453272167580
agamid and pit viper,MK41 7QG,52.154149673930400,-0.466990035999275
leguaan and python,MK41 7YG,52.166599888450600,-0.455756731460215
Tattler and Pitohui,MK41 7YW,52.164120951014500,-0.458021062484052
Night heron and terrapin,MK41 7YZ,52.163999534171500,-0.455469000000000
cycling lizard and diamondback turtle,MK41 8AN,52.167941510003900,-0.447682700714918
Mouse and bull snake,MK41 8AS,52.157438229912300,-0.448252785739276
Old World warbler and goanna,MK41 8AT,52.157573700393400,-0.449666097885303
Cuscus and Marsh harrier,MK41 8BN,52.153583851654300,-0.451207985520700
snapping turtle and Guillemot,MK41 8DJ,52.156561825803100,-0.445198765841927
Hawaiian honeycreeper and Komodo dragon,MK41 8HF,52.154431307360900,-0.441823200498145
White ibis and pit viper,MK41 8HP,52.151083957473500,-0.430100545803647
blind snake and indigo snake,MK41 8HU,52.150070555522100,-0.430296971211761
gavial and Boto,MK41 8JE,52.152525839511000,-0.434405742453237
gecko and Maya,MK41 8JY,52.155510449053100,-0.437836000000000
Kestrel and Warbler,MK41 8LE,52.154564941577000,-0.434261116723383
Marsh harrier and box turtle,MK41 8PQ,52.155121000000000,-0.431376000000000
Snipe and K훮k훮riki,MK43 7DU,52.199491523891600,-0.604599254985418
Stint and Guillemot,MK43 7LW,52.188461678548100,-0.605544347707093
Warbler and Gull,MK43 7NH,52.189337715257600,-0.552852524662417
Stilt and horned viper,MK43 7NW,52.188109597013500,-0.554618577202401
Cloud rat and Fulmarine petrel,MK43 7PJ,52.189855171007900,-0.534315117437636
Recurvebill and tree snake,MK43 7QN,52.167303000000000,-0.556594000000000
Bunting and sand lizard,MK43 7RD,52.176774000000000,-0.522639020049294
bearded dragon and Armadillo,MK43 7SE,52.171502633537500,-0.526246733712067
Mink and sidewinder,MK43 8BJ,52.159057136814500,-0.597530000000000
Argus and snake,MK43 8LE,52.152237261198900,-0.533679839820125
bearded lizard and wall lizard,MK44 1AT,52.292031429556100,-0.517895015128403
cycling lizard and sea snake,MK44 1AU,52.293522966608400,-0.518534411587927
Eagle and Thicketbird,MK44 1AW,52.289481234857000,-0.517437627761623
River dolphin and goanna,MK44 1BF,52.252266084909400,-0.484061092076365
sidewinder and Bunting,MK44 1DJ,52.256423542872600,-0.470396250992734
Boto and Triller,MK44 1DP,52.254952639330900,-0.469289440403014
chuckwalla and iguana,MK44 1DS,52.256240641437100,-0.469464866696636
diamond python and python,MK44 1JE,52.227336704520000,-0.550870687856833
Myna and amphisbaena,MK44 1LQ,52.231546423585600,-0.563531523857740
Darwin's finches and gopher snake,MK44 1LZ,52.231943000000000,-0.565715000000000
hoop snake and Shearwater,MK44 1NH,52.221251000000000,-0.514008270463568
whip snake and gecko,MK44 1NX,52.223318183623400,-0.532469000000000
python and diamond python,MK44 1QS,52.233778000000000,-0.508468704328849
giant tortoise and Moluccan boobook,MK44 1QT,52.223962097545800,-0.500251311231622
Philippine hawk-owl and smooth snake,MK44 1SA,52.195142218501400,-0.516349935934423
gaboon viper and Buzzard,MK44 1SB,52.192901914768300,-0.514800559545065
sidewinder and bicycle lizard,MK44 2AQ,52.247485000000000,-0.380172000000000
Fulmarine petrel and cycling lizard,MK44 2BB,52.274599532023200,-0.414204799555776
Wallaby and Lemming,MK44 2BD,52.272598813310700,-0.414525365555645
Quetzal and dukite,MK44 2EL,52.223652000000000,-0.409871000000000
Scimitar babbler and Pheasant,MK44 2ET,52.218729000000000,-0.428946000000000
gavial and Parakeet,MK44 2JN,52.215546626005300,-0.378557576322959
Mamo and iguana,MK44 2JY,52.211267563442200,-0.387144027629612
bandy-bandy and Pratincole,MK44 2PE,52.186160150655700,-0.405387164409881
Stilt and krait,MK44 2QS,52.182872000000000,-0.413535000000000
python and Pitohui,MK44 2SP,52.275146000000000,-0.413936000000000
diamond snake and Polecat,MK44 2YP,52.220022000000000,-0.483124000000000
black snake and Kangaroo,MK44 3DS,52.181736000000000,-0.305067000000000
Wader and Chicken,MK44 3DX,52.178790660101100,-0.318845981458634
snapping turtle and constrictor,MK44 3JS,52.157251736053300,-0.356161004992706
Civet and Ice seal,MK44 3LJ,52.168922824578500,-0.331208608055943
bearded dragon and whip snake,MK44 3LN,52.166397961624000,-0.338336202418959
White ibis and Condor,MK44 3NU,52.151280444747500,-0.315307370862574
Tree warbler and Wader,NN10 0AD,52.291588765527900,-0.596472618926672
Polecat and worm lizard,NN10 0BE,52.296374259249200,-0.589121209482340
River dolphin and cayman,NN10 0BP,52.295591269455100,-0.586799851376172
Capuchin and skink,NN10 0GW,52.298879698700000,-0.585683379000000
Ground sloth and rattlesnake,NN10 0HE,52.289111984612400,-0.594600868309835
Hawk and amethystine python,NN10 0JW,52.287342021169900,-0.590932916197232
cycling lizard and Parrotbill,NN10 0NY,52.287924315050800,-0.592263295891901
Solitaire and skink,NN10 0RQ,52.284309275516700,-0.583933554930928
Guillemot and mamba,NN10 0RZ,52.291158672399100,-0.582292891031322
Old World warbler and Maya,NN10 0SJ,52.267575664950300,-0.570383529317334
garter snake and Coati,NN10 0SS,52.280984000000000,-0.538904000000000
American sparrow and chuckwalla,NN10 0TS,52.281463410678700,-0.593318281306639
bearded lizard and Siskin,NN10 0UJ,52.281014549255000,-0.594886365606018
Jerboa and Cloud rat,NN10 0UT,52.297758000000000,-0.588168000000000
Thicketbird and Rabbit,NN10 0XH,52.288006616110100,-0.599943297525252
anaconda and rock snake,NN10 0XJ,52.277372943701000,-0.597889151022351
adder and Rat,NN10 6BX,52.295449539233400,-0.597538362544024
king cobra and rat snake,NN10 6DJ,52.300370467632100,-0.591736669973803
Cuscus and snake,NN10 6DP,52.301732402317400,-0.594362678675915
Capuchin and indigo snake,NN10 6EQ,52.301157038968900,-0.598150011187417
boa constrictor and dugite,NN10 6FD,52.297682394730500,-0.612033000000000
Jay and Marmoset,NN10 8AB,52.302626928877600,-0.590961102934353
Night heron and Boto,NN10 8BB,52.304705690362800,-0.595327000000000
cobra and boa,NN10 8BJ,52.303393511536500,-0.595688734315834
box turtle and hawksbill,NN10 8DA,52.303524581487000,-0.593103266143649
sand lizard and tortoise,NN10 8DF,52.303635372423000,-0.600917069675364
cycling lizard and snake,NN10 8EH,52.308588765252900,-0.601626349358464
monitor and Condor,NN10 8EN,52.310231533130200,-0.600650450904028
Komodo dragon and Solitaire,NN10 8EY,52.310337630589600,-0.595953074593868
mud turtle and bearded dragon,NN10 8HD,52.305009093231700,-0.593188216567434
Siskin and diamondback,NN10 8HJ,52.304826801873000,-0.592225970015645
copperhead and death adder,NN10 8HW,52.307924217658900,-0.586583195539863
Jerboa and black snake,NN10 8LE,52.315321366221700,-0.590147230457566
Treepie and horned toad,NN10 8NZ,52.312045446022700,-0.594402758907591
tokay and Old World vulture,NN10 9JT,52.284720000000000,-0.594857000000000
massasauga and Mamo,NN10 9NB,52.281033302700500,-0.609383679690826
Grouse and gecko,NN10 9NS,52.288168255323400,-0.609057661466274
Pratincole and hoop snake,NN10 9NZ,52.287314245842700,-0.609832128729040
Parrotlet and Kite,NN10 9RT,52.290558616379100,-0.605903713417334
Macaw and snake,NN10 9SS,52.291844695019000,-0.605174191897509
sand lizard and tortoise,NN14 4BZ,52.364886000000000,-0.551236000000000
B and worm lizard,NN9 5QB,52.327928561764500,-0.609278466396017
diamondback turtle and Greenbul,NN9 5SP,52.327710275146100,-0.607539036562372
boomslang and Fish eagle,NN9 6AU,52.301440337898400,-0.541354505309174
Tattler and Old World vulture,NN9 6AZ,52.333172212286700,-0.563602428071728
Herring gull and Schneider python,NN9 6ER,52.344002440923900,-0.541275419891114
Partridge and Bronzewing pigeon,NN9 6EW,52.342925607263200,-0.543630255063575
Mouse and Songlark,NN9 6FA,52.334129000000000,-0.544241000000000
Quetzal and asp,NN9 6HE,52.345916842742800,-0.544867908505594
cerastes and Petrel,NN9 6LE,52.346761473396100,-0.538997140372327
diamondback terrapin and Capuchin,NN9 6PB,52.344404309900600,-0.528005949466637
rat snake and gaboon viper,NN9 6PN,52.331340000000000,-0.559958834909218
hawksbill and blind snake,NN9 6PX,52.329949890975200,-0.558878599048276
Viscacha and Hawaiian honeycreeper,NN9 6QB,52.331162145057500,-0.562774000000000
River dolphin and flying dragon,NN9 6RJ,52.348364000000000,-0.554554017500000
K훮k훮riki and Greenbul,NN9 6TY,52.343440566800000,-0.532764975700000
hawksbill and mamba,NN9 6UR,52.351601000000000,-0.542728000000000
sidewinder and Kestrel,PE19 1AJ,52.230114288135900,-0.268542269415539
Greenbul and Treepie,PE19 1BQ,52.229400955896300,-0.265275411153303
bandy-bandy and Buzzard,PE19 1BZ,52.230126950794600,-0.265599000000000
River dolphin and Treepie,PE19 1DN,52.231636267733700,-0.263811785224972
rock python and king cobra,PE19 1DW,52.230679000000000,-0.264083000000000
Pratincole and Warbler,PE19 1JS,52.228437275915200,-0.262721268720891
puff adder and loggerhead,PE19 1RB,52.238576420734100,-0.258239182199100
Vole and Tree warbler,PE19 1RJ,52.229704813453000,-0.265761422404940
Chicken and Parakeet,PE19 1RL,52.230571429154400,-0.264160836202265
Triller and Maya,PE19 1SG,52.230177412122000,-0.257557574642940
sidewinder and Songlark,PE19 1ST,52.229557303520800,-0.255328000000000
hoop snake and Crow,PE19 1SU,52.230697912417800,-0.254447484926413
diamond snake and Chicken,PE19 1TN,52.235184615736400,-0.248984743941387
adder and Duck,PE19 1TX,52.231472977719000,-0.251532325333502
habu and diamond snake,PE19 2AW,52.227525290948200,-0.271644626054325
slowworm and Ice seal,PE19 2BZ,52.226394978700000,-0.265582990200000
Prion and kabaragoya,PE19 2DD,52.224199106182300,-0.261891104779901
gaboon viper and Boto,PE19 2GD,52.213904267636400,-0.274778883992221
Cloud rat and Pheasant,PE19 2HX,52.213523393628800,-0.271485569350121
Hawaiian honeycreeper and Maya,PE19 2JU,52.214007136477100,-0.270749545869968
Mockingbird and Rabbit,PE19 2NQ,52.218294000000000,-0.264376000000000
massasauga and Fish eagle,PE19 2PG,52.217204532481200,-0.259499938368798
taipan and Old World quail,PE19 2PY,52.227955358610000,-0.272155044608156
cycling lizard and hoop snake,PE19 2QX,52.216315512188000,-0.263238214359609
dukite and flying dragon,PE19 2RN,52.210897942258200,-0.264137433460503
Rabbit and Triller,PE19 2RW,52.214042236142200,-0.266400796326528
Grouse and snapping turtle,PE19 2SH,52.215611604712600,-0.270409105970335
boa constrictor and Mockingbird,PE19 2TN,52.222524534805100,-0.268471498712173
Marmoset and Ice seal,PE19 2TU,52.221125286338700,-0.265641846958187
ringhals and frilled lizard,PE19 2UG,52.219366360916800,-0.270160756004728
rock snake and Gila monster,PE19 2UT,52.210380661509600,-0.265035785113968
soft-shelled turtle and whip snake,PE19 2UY,52.226184941054700,-0.268534078787265
Hawaiian honeycreeper and anole,PE19 5GJ,52.277256000000000,-0.215599000000000
bearded dragon and rock python,PE19 5JY,52.245640221793000,-0.299943865329143
tokay and kabaragoya,PE19 5LA,52.249608304327800,-0.307028930706411
bearded lizard and amphisbaena,PE19 5TU,52.294588566712500,-0.244017882225413
gaboon viper and Philippine hawk-owl,PE19 6EQ,52.249561078920900,-0.260489805671390
blue racer and Tahr,PE19 6HG,52.250434740700700,-0.254990000000000
taipan and Jerboa,PE19 6LW,52.247200286201400,-0.258926855137873
Quetzal and adder,PE19 6PX,52.245889541921300,-0.262112874797903
Tit-tyrant and Duck,PE19 6PY,52.246538419099100,-0.261604122733914
copperhead and death adder,PE19 6QL,52.249803550197500,-0.262912129977359
king snake and blue racer,PE19 6SW,52.225300417110600,-0.230120156247455
Cuscus and deaf adder,PE19 6UJ,52.193915926537500,-0.205426013442311
White ibis and black snake,PE19 6UQ,52.192356851451300,-0.204011105989703
Coati and Fulmarine petrel,PE19 6XQ,52.210368433062300,-0.207075644204956
Black jay and Masked owl,PE19 7AY,52.222796398645100,-0.281534918754558
frilled lizard and jew lizard,PE19 7NQ,52.226395533198200,-0.285422423082729
sand lizard and cerastes,PE19 7RD,52.229011641327600,-0.277985707718926
diamond python and copperhead,PE19 7RP,52.228880046743700,-0.282529982383276
Duck and hawksbill,PE19 7RX,52.227929328500000,-0.278876906100000
Dorcopsis and frill-necked lizard,PE19 7SB,52.224923927900700,-0.278831999018996
gavial and water snake,PE19 8DE,52.220141108317300,-0.290626158740470
Zebra and snake,PE19 8HW,52.215625236037300,-0.285515165186906
elapid and Eagle,PE19 8JF,52.225910944126300,-0.293552498544825
dukite and jew lizard,PE19 8PA,52.223382096246100,-0.287807810734484
blindworm and Parrotbill,PE19 9EP,52.233225511800000,-0.262329378300000
Towhee and Old World vulture,PE28 0AR,52.333020223827600,-0.301409299710996
bandy-bandy and River dolphin,PE28 0BB,52.310172820470000,-0.304484433806017
Parrotlet and Moluccan boobook,PE28 0DX,52.290791265386400,-0.319828826787550
diamondback and brown snake,PE28 0DY,52.308950494937400,-0.299514372984379
leguaan and Magpie,PE28 0ED,52.303484000000000,-0.397388000000000
Diving bird and Tattler,PE28 0GW,52.289916263541400,-0.312691930318106
Vulture and Stilt,PE28 0JQ,52.323576804283100,-0.405058796735522
Francolin and perentie,PE28 0LU,52.299216591133600,-0.463688000000000
iguana and alligator,PE28 0PH,52.349299000000000,-0.415502477200811
tree snake and Vulture,PE28 0QH,52.368825684068800,-0.422921163158583
Ice seal and giant tortoise,PE28 0RE,52.366959000000000,-0.470339353810462
Logrunners and Shearwater,PE28 0RQ,52.342960151956900,-0.452966619854499
Greenbul and Moluccan boobook,PE28 0RU,52.324683000000000,-0.451653000000000
taipan and Mouse,PE28 0RX,52.367215000000000,-0.471287000000000
sea snake and Grackle,PE28 0SS,52.287565004988400,-0.317414399009143
Stint and Recurvebill,PE28 0SY,52.284098339110100,-0.318322746284497
Fish eagle and Peafowl,PE28 0UB,52.333258317898000,-0.328302000000000
Scimitar babbler and Kangaroo,PE28 4GJ,52.371384000000000,-0.236327000000000
cobra and taipan,PE28 4GL,52.371696000000000,-0.234331000000000
flying lizard and gopher snake,PE28 4GZ,52.314234000000000,-0.223737000000000
Francolin and Stint,PE28 4NJ,52.330219000000000,-0.266969000000000
Stint and Herring gull,PE28 4PR,52.318014000000000,-0.220195960441657
smooth snake and Vole,PE28 4RB,52.323275089973500,-0.229250375008868
bull snake and alligator,PE28 4RZ,52.325392931888500,-0.239804807308199
black snake and Egret,PE28 4SP,52.326723553570300,-0.238592673231757
Duck and Mink,PE28 4TT,52.322126514801100,-0.231805384072088
Diving bird and tree snake,PE28 4UZ,52.316416719981400,-0.219811601156292
Hawaiian honeycreeper and Recurvebill,PE28 5BH,52.355498057584000,-0.310811898896211
Tree warbler and blindworm,PE29 6FH,52.337493377777200,-0.209408000000000
Duck and snapping turtle,PE29 6GN,52.340678395796200,-0.205757786167824
sand lizard and Tattler,PE29 6UW,52.339970250020700,-0.202351481112090
diamond snake and Duck,SG19 2AY,52.170603210888600,-0.287846086222067
Treepie and grass snake,SG19 2HX,52.160682000000000,-0.210009000000000
