name,id,postcode,lat,lon
Eagle and rock snake,1174236,FK6 6DP,56.022420736555300,-3.906689174328500
Capuchin and Fox,1177585,FK15 0AL,56.189122538578200,-3.963706000000000
Mole and Cloud rat,1178538,FK10 3DQ,56.126788501603100,-3.783442860519060
saltwater crocodile and chameleon,1178918,FK10 2UG,56.121985416310800,-3.804165967063890
Darwin's finches and diamond snake,1172899,FK9 4NG,56.163456046211500,-4.008826000000000
brown snake and Dolphin,1174012,FK7 7RZ,56.112283956515400,-3.922422703171800
Kākāriki and flying dragon,1179120,FK10 2DS,56.118711604333100,-3.798816987889080
Macaw and soft-shelled turtle,1774903,FK16 6EG,56.189811300584300,-4.079790705319470
leguaan and crocodile,1172441,FK9 4QQ,56.158133153509200,-3.948770282226090
Polecat and black snake,1178318,FK12 5BZ,56.151641474672500,-3.810192544231210
tiger snake and Goose,1179187,FK1 9SF,56.001840798552500,-3.792339487168360
swift and Siskin,1179600,FK1 4JR,56.004288843657200,-3.828795435487940
Treepie and Badger,1174921,FK5 4AY,56.024949272076000,-3.825712475878030
Boto and boa,1179151,FK1 9AS,56.001995449292600,-3.784777096584330
Pheasant and hognose snake,1179257,FK1 4RJ,55.997497445856800,-3.831665653790330
taipan and tuatara,1178562,FK10 3EU,56.131675163433500,-3.782945015524170
sand lizard and Kākāriki,1174140,FK7 0QF,56.096207266643600,-3.939080715436740
Elephant and bicycle lizard,1174771,FK5 4RX,56.032970000000000,-3.836877000000000
green turtle and turtle,1178449,FK10 3AN,56.142346000000000,-3.776405000000000
Recurvebill and Crow,1174502,FK6 5GY,56.023535654756500,-3.927460243695270
sand viper and Perching duck,1774898,FK16 6DU,56.191905358530000,-4.052359470355970
Polecat and Prion,1146505,G65 0QX,55.995932000000000,-3.998357000000000
sidewinder and Old World quail,1179241,FK1 4QD,56.003232704307300,-3.821223795242910
Booted eagles and Civet,1175015,FK5 4GA,56.028656278679200,-3.833879594655870
Chickadee and bicycle lizard,1178319,FK12 5DA,56.152475233629200,-3.811551952097450
deaf adder and Minke whale,1176672,FK2 7GJ,56.015018130628100,-3.801356252957640
Grackle and Cuscus,1174137,FK7 0QB,56.096829707516100,-3.943501067217580
Piping shrike and Chickadee,1174611,FK6 6AG,56.021673288017400,-3.911433960939400
Old World vulture and Tattler,1178247,FK10 3RY,56.120479796859800,-3.783472596532950
puff adder and Condor,2641422,FK10 3FF,56.124562000000000,-3.788480000000000
Cloud rat and king snake,1179347,FK1 5DR,55.997496196640900,-3.812294792605010
puff adder and Diving bird,1173706,FK7 9PF,56.108548117600300,-3.968456157360300
Marmoset and death adder,1177519,FK15 9PE,56.193635000000000,-4.008549362608930
Petrel and agamid,1172849,FK8 3BA,56.121884245199900,-4.071182827524070
gavial and Mouse,1174589,FK6 5NX,56.010683160241700,-3.916617720956080
caiman and Dolphin,1176506,FK2 8AH,56.031136040369800,-3.781804769310500
diamondback turtle and diamondback terrapin,1176320,FK2 8SF,56.063470000000000,-3.836866000000000
blue racer and Boto,1176349,FK2 7PP,56.017929754558800,-3.787148668150500
whip snake and Elephant,1175196,FK5 3AB,56.019492285022400,-3.837244000000000
Black jay and blue racer,1178199,FK11 7DB,56.150384000000000,-3.858576000000000
hoop snake and hawksbill,1173503,FK8 1RQ,56.131821343797300,-3.952153660751060
cobra and massasauga,1176406,FK2 8UW,56.023834000000000,-3.795813365278670
Bronzewing pigeon and Mink,1173253,FK8 1AT,56.118658692326500,-3.938875170682030
Darwin's finches and Gull,1172909,FK9 4NX,56.154756890938100,-3.949742497610070
thorn lizard and Night heron,1172682,FK9 5EG,56.136610123214100,-3.925310672783210
galliwasp and Dorcopsis,1174785,FK5 4SW,56.040150586382800,-3.869742038906060
tiger snake and lizard,1178725,FK10 2JZ,56.125728948202400,-3.808106032497870
Peafowl and Mockingbird,1172895,FK9 4NB,56.158803000000000,-3.958698257048710
goanna and American sparrow,1177384,FK15 9BG,56.187685736187800,-3.970541370898480
carpet snake and Black jay,1174855,FK5 3HW,56.021269994475700,-3.821720020574390
deaf adder and Chickadee,1173201,FK8 2JZ,56.111470718837700,-3.941086907883810
saltwater crocodile and cobra de capello,1174231,FK6 6DD,56.023275034315800,-3.909152000000000
pit viper and Gull,1173776,FK7 8GB,56.066626507514400,-3.879666523035180
whip snake and Elephant,1178655,FK10 2HJ,56.127565957222200,-3.810911377539620
Magpie and wall lizard,1172373,FK9 5RE,56.138162455400700,-3.936380727991280
Gila monster and water snake,1146259,G65 9PD,55.982194638826700,-4.069493614084730
Zebra and kabaragoya,1173552,FK7 9HA,56.103759878662600,-3.953080325863490
Recurvebill and rock python,1146813,G65 0HJ,55.977975159770100,-4.056349461753170
Goose and Chicken,1174400,FK7 0BY,56.100270911768900,-3.934959922499490
diamond python and hognose snake,1173453,FK7 8QA,56.085957811240300,-3.907095547929680
Pitohui and bearded dragon,1179555,FK1 4BZ,56.005096434277100,-3.811223241389050
jew lizard and habu,1178148,FK10 9ST,56.119328949967400,-3.794679527015510
Thicketbird and Diving bird,1177608,FK15 0BU,56.195702138243200,-3.956365182847980
indigo snake and Herring gull,1173433,FK7 8NZ,56.085989698478300,-3.910263405617040
elapid and Grouse,1174484,FK6 5DW,56.019590000000000,-3.906718917960800
Mouse and White ibis,1178138,FK10 9SF,56.119328949967400,-3.794679527015510
Solitaire and Puffleg,1177174,FK16 6AU,56.185334474774200,-4.068783286332770
Warbler and Nukupuʻu,1173660,FK7 7XJ,56.100339357079500,-3.913852243841500
Chicken and cayman,1175363,FK4 1LX,56.004953068904400,-3.887865073947660
brown snake and constrictor,1774925,FK2 8AD,56.041799000000000,-3.811065000000000
Pheasant and leguaan,1172964,FK8 3HW,56.123555185202600,-4.179808904985860
frilled lizard and amphisbaena,1146530,G65 0SP,55.978778114713200,-4.058315507780270
dugite and frill-necked lizard,1174906,FK5 4AE,56.020128707212500,-3.838673801687690
White ibis and Fish eagle,1178735,FK10 2LT,56.121569025523900,-3.796360380443820
Fulmarine petrel and Logrunners,1173487,FK7 9BT,56.097215308999100,-3.942411165825620
cerastes and caiman,1178815,FK10 2SE,56.134333165748900,-3.842464879288420
Vole and Meadowlark,1173618,FK7 9NN,56.109050459098900,-3.969639736699990
constrictor and Bronzewing pigeon,1173354,FK8 1JQ,56.122804411666000,-3.926052560968320
leguaan and coral snake,1172686,FK9 5ER,56.137990544160400,-3.927262720727080
turtle and dukite,1173227,FK7 9QH,56.072248260461000,-3.951116158498670
frill-necked lizard and Parrotlet,1174859,FK5 3JA,56.021813840203100,-3.817750304612170
snapping turtle and Vulture,2594407,FK6 6FA,56.058794000000000,-3.911256000000000
flying lizard and tiger snake,1174118,FK7 7TE,56.113499050102200,-3.924606399810540
habu and dugite,1172919,FK9 4PN,56.161269812270100,-3.951022693041400
Kite and gecko,2652499,FK5 4FU,56.030546000000000,-3.830977000000000
Elephant and Boto,1172945,FK8 3EQ,56.124262957794100,-4.169728677207610
gaboon viper and kabaragoya,1172676,FK9 5DZ,56.138502000000000,-3.943978000000000
Ice seal and Booted eagles,1174489,FK6 5EB,56.014964241232800,-3.907701354339620
Cloud rat and Quetzal,1179599,FK1 4JQ,56.006009224816100,-3.833367648798770
diamondback terrapin and copperhead,1176636,FK2 7ED,56.007135658556200,-3.779801379821980
mountain devil and puff adder,1174463,FK6 5BP,56.019974574703300,-3.916660930437850
Grosbeak and boa constrictor,1173574,FK7 9JD,56.110353481219300,-3.953237486025770
Asiatic leopard and alligator,1178965,FK10 1QG,56.111728402416200,-3.779658115045100
Tattler and Masked owl,1179989,FK1 1UA,55.994194666410200,-3.780473142802440
Viscacha and puff adder,1172456,FK9 4RJ,56.148527882121100,-3.929802626553420
asp and flying dragon,1174095,FK7 0NB,56.089299142183400,-3.929748121508490
leathery turtle and bull snake,1179000,FK10 1TF,56.115740546636300,-3.813331340818690
hognose snake and Viscacha,1179526,FK1 4AD,56.006913956164600,-3.838992215284850
hawksbill and turtle,1173887,FK7 7HP,56.100815826433100,-3.864514568041690
Bunting and thorn lizard,1173659,FK7 7XH,56.117396696897300,-3.908554573327990
flying dragon and Hawaiian honeycreeper,1178537,FK10 3DP,56.130638661671800,-3.792471010492340
massasauga and Myna,1178767,FK10 2PT,56.134536977378600,-3.837228470120850
bicycle lizard and Cloud rat,1178162,FK10 9TL,56.119328949967400,-3.794679527015510
blind snake and alligator,1177366,FK15 9AH,56.187329143521600,-3.969797909745120
racer and black snake,1774999,FK7 7FG,56.116945216117200,-3.876265556549430
Thicketbird and Myna,1176722,FK2 7LF,56.009803856839800,-3.793494294135380
turtle and Diving bird,1179006,FK10 2AH,56.119148099936300,-3.791663035819380
Piping shrike and Condor,1178866,FK10 1JL,56.115688000000000,-3.791100000000000
Argus and gavial,1176587,FK2 7BL,56.008874000000000,-3.785126000000000
Ground sloth and Kite,1176512,FK2 8AR,56.031444032430000,-3.782878222036140
blindworm and bearded dragon,1173952,FK7 7NG,56.098217000000000,-3.832845000000000
caiman and puff adder,1177603,FK15 0BJ,56.192975000000000,-3.961190000000000
tuatara and box turtle,1175958,FK2 9EL,56.008472011437800,-3.781226228651610
Marsh harrier and gopher snake,1774844,FK10 1RP,56.116287592745300,-3.777359958585520
Linsang and puff adder,1177948,FK12 5JH,56.153207721207400,-3.798319863159260
Grackle and Argus,1176403,FK2 8TE,56.023610278554600,-3.789545289187510
Marsh harrier and mud turtle,1177978,FK12 5LY,56.154007000000000,-3.802709376646550
lizard and Gila monster,1173256,FK8 1AY,56.118451366053400,-3.937912000000000
pit viper and Wallaby,1179240,FK1 4QB,56.002341555992000,-3.820716778295580
gavial and iguana,1775025,FK9 4AB,56.149122595102500,-3.917404647709170
Rabbit and Booted eagles,1174599,FK6 5PN,56.007816638508600,-3.915449180267610
Petrel and hoop snake,1176396,FK2 7SA,56.016558280850900,-3.795572179842830
elapid and king cobra,1173419,FK8 1QP,56.129565000000000,-3.943182479027240
Ice seal and Crow,1174302,FK6 6LN,56.027840969485100,-3.918768004240590
New World blackbird and Mink,1174724,FK5 4QJ,56.028797065686200,-3.817693410904980
Mouse and River dolphin,1172604,FK9 5AP,56.129469276295900,-3.935444880107830
Songlark and chameleon,1176437,FK2 7SU,56.019460296581500,-3.791904355131540
death adder and whip snake,1179954,FK1 1SB,55.999816297045600,-3.778246082346550
tuatara and Ibex,1174320,FK6 6NJ,56.027419318122700,-3.912937646451520
bull snake and cycling lizard,1173711,FK7 9PN,56.112644000000000,-3.969148000000000
galliwasp and Kestrel,1174471,FK6 5DA,56.018671542778300,-3.918970955768440
rock snake and Coati,1174516,FK6 5HR,56.022586406304600,-3.926097147480380
saltwater crocodile and blue tongue,1175006,FK5 4FP,56.034341690007200,-3.829237757543790
milk snake and galliwasp,1176133,FK2 8EB,56.027548316230300,-3.783821947441870
cayman and Cloud rat,1173494,FK8 1QZ,56.119545000000000,-3.932196000000000
whip snake and Ibex,1178679,FK10 2JU,56.123886631525800,-3.808116101526670
worm lizard and Marmoset,1176152,FK2 8FF,56.024914881475600,-3.776383199362540
boa constrictor and cerastes,1175314,FK4 1LF,55.987161848094400,-3.950065554574100
Capuchin and cobra de capello,1173666,FK7 7XX,56.115564585792100,-3.918918993271220
saltwater crocodile and amethystine python,1175982,FK2 9GE,56.009708633046300,-3.775861513689240
Philippine hawk-owl and Mink,1179113,FK10 2DH,56.121628607793900,-3.807672314870660
coral snake and Fish eagle,1173436,FK7 8PE,56.090599059303400,-3.905074575326340
Marmoset and death adder,1177360,FK15 9AA,56.185054334406100,-3.967054730967390
Gila monster and iguana,1177937,FK12 5HQ,56.153153000000000,-3.795403439411720
dugite and Tree warbler,1177407,FK15 9DP,56.182223069626500,-3.972726623399870
Parakeet and Elephant,1177944,FK12 5HZ,56.153787091558800,-3.790602638213880
cerastes and Duck,1179036,FK1 5PG,55.986760467127900,-3.806582330602590
amphisbaena and cayman,1775012,FK8 1RB,56.120555097856800,-3.933162000000000
Fish eagle and black snake,1179859,FK1 1HN,56.004622573469800,-3.784561440256340
Skunk and Capuchin,1174630,FK5 4HL,56.029155175700100,-3.797553312760140
habu and bearded lizard,1173174,FK8 2HJ,56.107875076680300,-3.942867828809500
green turtle and blind snake,1178960,FK10 1QA,56.112335330357800,-3.782436337460620
Fish eagle and Vulture,1175044,FK4 1TQ,55.997411708544200,-3.915049000000000
Linsang and Night heron,1173060,FK8 1XJ,56.126966797551400,-3.927097327691670
anole and Pratincole,1172804,FK9 4HN,56.155486654997500,-3.949184000000000
Lemming and mud turtle,1175217,FK5 3BN,56.022869879466500,-3.813162663632060
Snipe and New World blackbird,1179287,FK1 5AP,56.000655895612300,-3.789157477497390
pit viper and thorn lizard,1179189,FK1 9SH,56.001840798552500,-3.792339487168360
Hawaiian honeycreeper and Kite,1178201,FK11 7DE,56.150114428045400,-3.857371311517310
rock python and giant tortoise,1177946,FK12 5JB,56.153330238796000,-3.788021450463140
Polecat and Diving bird,1174812,FK5 4UF,56.034449850377100,-3.798666230024830
amphisbaena and Thicketbird,1176252,FK2 8LX,56.088137000000000,-3.783584000000000
Perching duck and Eagle,1174840,FK5 3EX,56.015660644212300,-3.827311554975300
Chickadee and carpet snake,2652488,FK12 5FB,56.152119000000000,-3.789294000000000
Crow and turtle,1174976,FK5 4DQ,56.024743850879900,-3.801183418140490
harlequin snake and agama,1172535,FK9 4SA,56.150843860500600,-3.927085211827070
sea snake and caiman,1172667,FK9 5DL,56.136869053165700,-3.939775863157330
American sparrow and bull snake,1172795,FK9 4EU,56.153098483485900,-3.947889000000000
caiman and Goose,1175075,FK4 2AT,55.994148243894500,-3.877000000000000
green turtle and Gila monster,2050942,FK6 6EL,56.022708000000000,-3.901504000000000
Cloud rat and Francolin,1146529,G65 0SL,55.976521684522400,-4.054589415529310
deaf adder and soft-shelled turtle,1175070,FK4 2AN,55.996316342688200,-3.883210605133550
copperhead and Vole,1179365,FK1 5EU,55.994581296908200,-3.804558147583330
tiger snake and tokay,1178259,FK10 3SS,56.119351985441100,-3.781461000000000
Kite and Dolphin,1177486,FK15 9JW,56.188247942258200,-3.979224209308180
rattlesnake and viper,1177993,FK12 5NU,56.153303788346200,-3.815100811727460
gaboon viper and Moluccan boobook,1172931,FK8 3DS,56.127023548599600,-4.171171422284050
Ice seal and tiger snake,1172235,FK9 5LB,56.140670653867100,-3.924242177513910
Jerboa and snapping turtle,1178736,FK10 2LU,56.120667220189300,-3.797814391291950
flying dragon and Chicken,1172930,FK8 3DR,56.124938066025300,-4.175285483376300
mamba and Parrotlet,1775015,FK8 1TS,56.127358546669500,-3.955741373285070
Tattler and perentie,1146438,G65 0JW,55.980370016773100,-4.045288249995220
Mouse and king snake,1178819,FK10 2SJ,56.136096023670400,-3.833907192172220
Old World warbler and constrictor,1178680,FK10 2JX,56.126165940998900,-3.808947076214560
Old World vulture and Prion,1178429,FK10 2UX,56.135975030177900,-3.848913000000000
perentie and Tattler,1172574,FK9 4UE,56.132433767044000,-3.973554970438550
Armadillo and whip snake,1173654,FK7 7XB,56.100132105710200,-3.915626661546630
Philippine hawk-owl and carpet snake,1173040,FK8 1UJ,56.125214000000000,-3.932288044744550
Polecat and Parakeet,2594224,FK10 1EF,56.107978000000000,-3.793790000000000
pit viper and Rabbit,1146271,G65 9PT,55.982895032236900,-4.059335800665790
agamid and Mamo,1179617,FK1 4LW,56.003505690818000,-3.816120546898500
boa and Thrasher,1178753,FK10 2NT,56.125214245579700,-3.830235808637840
water snake and Lemming,2662857,FK8 3XX,56.115675000000000,-3.918918000000000
Mouse and Tattler,1177233,FK16 6JQ,56.191314000000000,-4.062159000000000
anole and Black jay,1174969,FK5 4DF,56.026948982600600,-3.803404408160560
coral snake and turtle,1173634,FK7 7UF,56.119426068175200,-3.908655085038310
constrictor and iguana,1173597,FK7 9LL,56.113115269470600,-3.958174000000000
Macaw and Rat,1174909,FK5 4AH,56.020551354978200,-3.833222535170310
Black cockatoo and Dorcopsis,1176373,FK2 7QT,56.019113606623300,-3.786689946366730
Zebra and blue tongue,1174739,FK5 3DW,56.020458786257600,-3.817012735724380
caiman and Armadillo,1173061,FK8 1XL,56.128927418016300,-3.925843813848130
sand viper and Mouse,1172553,FK9 4TA,56.146555352131300,-3.943274249181700
Capuchin and hoop snake,1179126,FK1 5TA,55.998437376122600,-3.791556514407340
cobra de capello and Francolin,1172780,FK9 4DT,56.155855752555700,-3.942053000000000
Booted eagles and cerastes,1177423,FK15 9EQ,56.183725163324400,-3.977702240379690
pit viper and worm lizard,1175115,FK4 2DY,55.989437790232500,-3.895188900085730
king cobra and blind snake,1174613,FK6 6AJ,56.021338984282400,-3.917338278376520
Scimitar babbler and milk snake,1175110,FK4 2DS,55.990360395364500,-3.892460393998590
Recurvebill and Pheasant,1174772,FK5 4RY,56.013992426180200,-3.871429469653990
diamond snake and Chipmunk,1177177,FK16 6AZ,56.188883789577600,-4.075775347893320
sand viper and Jerboa,1177441,FK15 9EU,56.183805896733500,-3.964187081025160
Cuscus and harlequin snake,1179622,FK1 4NH,56.000358024013900,-3.823590253720620
Thrasher and Nukupuʻu,1179591,FK1 4JD,56.006689504524600,-3.829741000000000
slowworm and Logrunners,1176141,FK2 8ER,56.028204048476300,-3.786323595743630
cobra de capello and American sparrow,1174417,FK7 0DW,56.098112324655500,-3.933356395125360
crocodile and Pheasant,1177347,FK15 0NT,56.197362906812500,-3.955337522126850
viper and dukite,1176661,FK2 7FP,56.013320712652500,-3.806202095466980
Old World warbler and grass snake,1174406,FK7 0DF,56.100129000000000,-3.932589000000000
coral snake and Ground sloth,1175243,FK4 1DH,56.002088972371600,-3.891798916560550
Black jay and Condor,1174453,FK6 5BA,56.016989232876000,-3.912726668018280
Snipe and Night heron,1178917,FK10 2UF,56.129933147811900,-3.830765738679520
adder and Vole,1146511,G65 0RH,55.988603993766100,-4.006347393341960
Moluccan boobook and king cobra,1175226,FK4 1BG,56.003564588573100,-3.878751827203250
Nukupuʻu and turtle,1174397,FK7 0BT,56.099427517707100,-3.933727817587070
Greenbul and Philippine hawk-owl,1176356,FK2 7PX,56.018711808814500,-3.784649830296000
Minke whale and Chipmunk,1174792,FK5 4TF,56.032487253960200,-3.798911970897140
agama and loggerhead,1172897,FK9 4NE,56.146500126078300,-3.959852307975540
Kākāriki and Maya,1172442,FK9 4QR,56.150995514209800,-3.939215896910170
Bunting and Tree warbler,1173205,FK8 2LF,56.116754365372200,-3.937106475600050
elapid and Dorcopsis,1177697,FK15 0HS,56.179735479541200,-3.945982194296170
indigo snake and Shearwater,1146579,G65 9DN,55.981299604783300,-4.055852709718440
Pratincole and jew lizard,1175395,FK4 1PR,56.006333673513200,-3.889841102596900
Jerboa and Wallaby,1172773,FK9 4DJ,56.144080000747900,-3.947527647156290
diamond python and skink,1174794,FK5 4TH,56.033098375543200,-3.798908306115320
garter snake and Egret,1172431,FK9 4QB,56.157904102664700,-3.946198357506620
krait and diamondback,1174916,FK5 4AS,56.024162331224000,-3.836346261093780
Towhee and Gull,1176448,FK2 7TJ,56.018653417948000,-3.778117200337580
Cloud rat and cobra de capello,1179717,FK1 4NP,56.001388225010100,-3.821377565035430
Mockingbird and Tree warbler,1174575,FK6 5NE,56.012352136699800,-3.917935624771910
Fish eagle and sand lizard,1179337,FK1 5DD,55.996097642999800,-3.812068976155740
turtle and Petrel,1179116,FK10 2DN,56.122964913049800,-3.811531676650520
Greenbul and cayman,1172802,FK9 4HH,56.153592830261400,-3.940345026356690
hognose snake and Armadillo,1179206,FK1 9TE,56.001840798552500,-3.792339487168360
anaconda and leguaan,1179238,FK1 4PZ,56.001875803713700,-3.818177023337230
Meadowlark and blue racer,1173191,FK8 2JL,56.109869125342700,-3.943499056443370
Egret and Recurvebill,1178543,FK10 3DW,56.130631767374400,-3.793564858917930
Hawaiian honeycreeper and anaconda,1172905,FK9 4NR,56.154173102743400,-3.947793000000000
Partridge and amethystine python,2641435,FK6 5FA,56.015263000000000,-3.900811000000000
Schneider python and Parakeet,1176335,FK2 7NS,56.014009763923000,-3.788523680070800
amphisbaena and gopher snake,1179587,FK1 4HY,56.004555784110100,-3.827156096197710
constrictor and puff adder,1177690,FK15 0HH,56.198362909478700,-3.951197310080140
Perching duck and cobra,1177971,FK12 5LQ,56.151787918190000,-3.796466469949620
jew lizard and anaconda,1178641,FK10 2ET,56.127981229516900,-3.816288764415750
bushmaster and Moluccan boobook,1774845,FK10 1SG,56.107698000000000,-3.778089000000000
Peafowl and chameleon,1178467,FK10 3BL,56.125612096630600,-3.785254680135320
Vulture and Scimitar babbler,1179899,FK1 1NU,55.999872807560600,-3.783043526201320
perentie and Perching duck,1177989,FK12 5NQ,56.154574448467600,-3.815466657603150
Chicken and Tree warbler,2625906,FK1 9FZ,56.001991000000000,-3.784770000000000
rat snake and galliwasp,1177348,FK15 0NU,56.186419000000000,-3.948400552839120
Meadowlark and worm lizard,1177219,FK16 6HX,56.189797888748800,-4.059273097358680
Vulture and Nukupuʻu,1173610,FK7 9NB,56.108530073335200,-3.976335475918080
tuatara and diamondback,1174526,FK5 4GS,56.022649812891900,-3.831701363948630
Chickadee and water snake,1173020,FK8 3PR,56.174166350498500,-4.153340352211320
taipan and Prion,1146622,G65 9JW,55.977053016350900,-4.064202224982810
American sparrow and diamondback terrapin,1775029,FK9 4EN,56.153771336326300,-3.945687000000000
crocodile and Buzzard,1178430,FK10 2UY,56.136106451307700,-3.848278893338940
Eagle and Partridge,1144449,G68 0LN,55.976144000000000,-3.954640000000000
whip snake and diamond python,1172335,FK9 5NS,56.143641425888200,-3.949694612336680
B and Songlark,1173372,FK8 1LU,56.124601198316100,-3.927236416537440
frilled lizard and diamondback terrapin,1176354,FK2 7PU,56.019769442393900,-3.797213386203890
Partridge and gopher snake,1179106,FK10 2BZ,56.120636399783300,-3.809153995420230
Linsang and python,2038625,FK2 8RR,56.040345000000000,-3.817691000000000
thorny devil and Siskin,2652487,FK12 5FA,56.152318000000000,-3.791670000000000
Snipe and boomslang,1176472,FK2 7UQ,56.019916508356500,-3.780261059174280
Rat and death adder,1774931,FK2 8RH,56.039632977730900,-3.818829569979980
anaconda and Mamo,1176398,FK2 8SP,56.021921709108600,-3.792579979888550
bicycle lizard and harlequin snake,1177612,FK15 0BZ,56.197885898666900,-3.952382041993740
Boto and Black jay,1174779,FK5 4SN,56.044114000000000,-3.864957000000000
milk snake and death adder,1179893,FK1 1NE,56.000276109185800,-3.782180000000000
Polecat and Ice seal,1174677,FK5 4LU,56.031477641637400,-3.804048970662600
Grosbeak and Magpie,1774856,FK10 3LZ,56.124299069527100,-3.782636371656020
Komodo dragon and Rabbit,1176456,FK2 7TU,56.014976714194100,-3.794953327574710
Scimitar babbler and sand viper,1173608,FK7 9LZ,56.111883491996600,-3.967806232832590
diamondback and sea snake,1177452,FK15 9HD,56.183312396020800,-3.967529560390710
Kite and constrictor,1177657,FK15 0ED,56.189864445488200,-3.945898757661250
rock snake and thorn lizard,1179003,FK10 2AD,56.118074740602900,-3.795650589313210
Mink and leathery turtle,1775027,FK9 4AE,56.143324000000000,-3.922347000000000
whip snake and Solitaire,1774819,FK1 2AE,55.988195514802100,-3.786115000000000
tree snake and Macaw,1774820,FK1 2PD,55.987155978099400,-3.781063839082670
mountain devil and mamba,1173461,FK7 9AG,56.104572935986400,-3.941414995811890
box turtle and Triller,1177198,FK16 6DJ,56.190324000000000,-4.050904000000000
Quetzal and Songlark,1173906,FK7 7JS,56.105646860259600,-3.882517219103910
krait and mamba,1178950,FK10 1PP,56.112457046692300,-3.788312301069870
tree snake and Jay,1178820,FK10 2SL,56.135824116618000,-3.831641219949140
king cobra and Puffleg,1176346,FK2 7PF,56.010193685573500,-3.781481927145630
Black cockatoo and agama,2588743,G65 0DP,55.977722000000000,-4.041517000000000
