name,postcode,lat,lon
cayman and Duck,TR11 5QE,50.137155651341700,-5.180572973162330
Rabbit and snake,TR11 5QF,50.128227698028300,-5.195890000000000
gaboon viper and blindworm,TR11 5QR,50.132605333859100,-5.187394657942790
rock python and blind snake,TR11 5QU,50.141472235025100,-5.190784050987110
Francolin and leguaan,TR13 0AL,50.144601063722300,-5.305868520485830
lizard and Triller,TR13 0AN,50.142869388532500,-5.309808646051090
Night heron and Towhee,TR13 0DR,50.164502621751300,-5.203172361365870
viper and frill-necked lizard,TR13 0HH,50.133539446947500,-5.258681088461260
Grouse and worm lizard,TR13 0HS,50.165204000000000,-5.234380000000000
rock python and Minke whale,TR13 0JP,50.155258591268600,-5.232224448855270
gaboon viper and Logrunners,TR13 0LF,50.152709960036100,-5.213864700110770
Wader and adder,TR13 0LH,50.150128384686400,-5.212879452236020
Shearwater and Solitaire,TR13 0LY,50.126916000000000,-5.262755547179600
Fish eagle and Meadowlark,TR14 0AD,50.223175870538300,-5.286791937286370
Rabbit and Jay,TR14 0AS,50.224275348287400,-5.287358371017970
elapid and Scimitar babbler,TR14 0BL,50.225356400700800,-5.319545121293360
diamondback and racer,TR14 0DF,50.174284000000000,-5.306728000000000
Solitaire and tree snake,TR14 0DP,50.222897694752300,-5.294216000000000
gaboon viper and Shearwater,TR14 0FP,50.223559000000000,-5.292056000000000
gaboon viper and Badger,TR14 0FQ,50.223917000000000,-5.292445000000000
Francolin and Dolphin,TR14 0JG,50.233976468349800,-5.327339350816960
copperhead and Songlark,TR14 0JH,50.225604750881000,-5.345673226508890
Night heron and Diving bird,TR14 0JR,50.173730340642600,-5.311564319012890
Nukupuʻu and Magpie,TR14 0JW,50.172093851171700,-5.310274474728450
Ibex and coral snake,TR14 0JZ,50.178597000000000,-5.312251000000000
grass snake and rat snake,TR14 0NE,50.180538494402300,-5.339256478990330
Fish eagle and anaconda,TR14 0NF,50.177918000000000,-5.330626000000000
Puffleg and Linsang,TR14 0PX,50.217029613940200,-5.317214054284210
Mamo and turtle,TR14 0PY,50.217517535321800,-5.316092000000000
Diving bird and Mink,TR14 0TW,50.243315030084700,-5.305278584099840
B and whip snake,TR14 7AL,50.209094779157800,-5.292580246808330
Argus and cerastes,TR14 7BB,50.210611000000000,-5.288077963853010
black snake and flying lizard,TR14 7BD,50.210884144631100,-5.290390450783570
kabaragoya and Old World warbler,TR14 7BY,50.207557107126300,-5.291605235026890
boa and giant tortoise,TR14 7DZ,50.210813622318500,-5.303955574162510
Recurvebill and Night heron,TR14 7JD,50.217646771503000,-5.310092361489910
Wader and diamondback turtle,TR14 7JT,50.214277404818500,-5.306157792120850
Asiatic leopard and Polecat,TR14 7NQ,50.214126104232500,-5.315246032424750
Tattler and fer-de-lance,TR14 7NW,50.216329990524800,-5.315567177813610
asp and Greenbul,TR14 7PP,50.214088296727700,-5.312159102562000
ringhals and Tree warbler,TR14 7PT,50.212285208904400,-5.306931208610330
snapping turtle and Schneider python,TR14 8BD,50.214944000000000,-5.297315000000000
blind snake and smooth snake,TR14 8BH,50.215926709810700,-5.296247541870360
Prion and Meadowlark,TR14 8DP,50.215169867542200,-5.292802533114780
viper and carpet snake,TR14 8GQ,50.215760000000000,-5.285062000000000
River dolphin and loggerhead,TR14 8HL,50.213435040924600,-5.295921465262930
Siskin and Night heron,TR14 8HP,50.213979468831800,-5.293856089001710
Stint and Civet,TR14 8HR,50.213243864101500,-5.294099793104390
horned viper and Masked owl,TR14 8HX,50.212890606287000,-5.294818460096480
milk snake and bearded lizard,TR14 8HZ,50.212538455724800,-5.294864277445480
tuatara and Cuscus,TR14 8JD,50.212046058178900,-5.296680829509320
Fox and cobra de capello,TR14 8JH,50.212608292965100,-5.296523345599660
Eagle and gecko,TR14 8JR,50.213054412808800,-5.300301000000000
bushmaster and Myna,TR14 8JS,50.213862427138200,-5.299876393011150
Bronzewing pigeon and fer-de-lance,TR14 8JY,50.213345531225100,-5.300533000000000
Fulmarine petrel and soft-shelled turtle,TR14 8LS,50.219656631494500,-5.301252000000000
White ibis and Jay,TR14 8LW,50.219564398626800,-5.303410923995680
Grosbeak and hognose snake,TR14 8NL,50.223754975279100,-5.282540942938220
Scimitar babbler and Maya,TR14 8QW,50.224016956129600,-5.279319767258230
galliwasp and pit viper,TR14 8RN,50.218184807510100,-5.284822199735960
Logrunners and Ibex,TR14 8RQ,50.219741809636600,-5.284480565153180
Parrotlet and Rat,TR14 9AG,50.208507067849000,-5.281886180945140
brown snake and Kākāriki,TR14 9AT,50.210926261348900,-5.271398195535810
Viscacha and diamondback turtle,TR14 9BP,50.216128000000000,-5.276170000000000
cobra and Grouse,TR14 9DD,50.215909297264600,-5.272384237548400
Pheasant and diamondback terrapin,TR14 9EW,50.194956000000000,-5.277901000000000
saltwater crocodile and swift,TR14 9HB,50.196436990048700,-5.276376943210340
bushmaster and rock python,TR14 9JH,50.187181931719600,-5.264987000000000
Old World quail and blue tongue,TR14 9JJ,50.188856600115400,-5.271794177046700
horned viper and Badger,TR15 1BG,50.237999770903000,-5.236264948091010
Hawaiian honeycreeper and Puffleg,TR15 1FA,50.237212813200000,-5.230045000000000
worm lizard and thorny devil,TR15 1HB,50.241991693091900,-5.229241194273270
Myna and death adder,TR15 1HG,50.239746322103800,-5.226522408597090
Old World warbler and boa constrictor,TR15 1JS,50.234894109040400,-5.226643378391500
Partridge and Prion,TR15 1PZ,50.238079411826400,-5.220462577615700
Bronzewing pigeon and carpet snake,TR15 1RH,50.246355471293800,-5.208451063034190
deaf adder and goanna,TR15 1ST,50.241505000000000,-5.221241000000000
snake and python,TR15 1SY,50.238431531309200,-5.227405000000000
Bronzewing pigeon and Mink,TR15 2AQ,50.233997000000000,-5.225966000000000
flying dragon and Tit-tyrant,TR15 2DJ,50.239058000000000,-5.214076000000000
Guillemot and Snipe,TR15 2HZ,50.229042673819000,-5.221606224619930
sand viper and water snake,TR15 2JR,50.230005349253200,-5.218684039577160
Masked owl and flying dragon,TR15 2JS,50.234587366069200,-5.225094807253880
Stilt and Marmoset,TR15 2LB,50.227796321610600,-5.220161898505510
indigo snake and gaboon viper,TR15 2NS,50.224318256144300,-5.220039632693190
gavial and Grouse,TR15 2RH,50.229193380195800,-5.224926003123090
pit viper and Partridge,TR15 2SP,50.232104139730200,-5.228951273927630
Piping shrike and taipan,TR15 2TU,50.231400000000000,-5.232971000000000
Tit-tyrant and Zebra,TR15 3AA,50.231920161803600,-5.235881018665110
anole and Tree warbler,TR15 3BE,50.229817000000000,-5.262882000000000
brown snake and Quetzal,TR15 3BP,50.225593796006100,-5.240472615776070
Recurvebill and Francolin,TR15 3DN,50.230434717467400,-5.238178515639490
Greenbul and Lemming,TR15 3ED,50.228168672572300,-5.263519716947020
Mamo and diamond python,TR15 3EZ,50.229932000000000,-5.251404000000000
python and diamondback turtle,TR15 3FB,50.224983690881100,-5.271562408407670
boomslang and fer-de-lance,TR15 3JU,50.229377304312900,-5.255398297238390
Ibex and bearded dragon,TR15 3LT,50.233306632607600,-5.261556671555900
monitor and blindworm,TR15 3PT,50.228451000000000,-5.270158000000000
cayman and rat snake,TR15 3SX,50.226008847934100,-5.271259000000000
Pratincole and elapid,TR15 3TT,50.233029302405100,-5.265661086512510
leathery turtle and rock python,TR16 4AE,50.246340873681700,-5.233295132267260
skink and Gull,TR16 4AJ,50.250365092404800,-5.236093145756560
Fish eagle and tortoise,TR16 4AW,50.243953000000000,-5.226694000000000
saltwater crocodile and wall lizard,TR16 4AX,50.244310267537500,-5.224796764077770
anaconda and Tahr,TR16 4BG,50.249665000000000,-5.216670000000000
alligator and iguana,TR16 4BJ,50.257835350397400,-5.215242707989230
Armadillo and constrictor,TR16 4BX,50.253762682388700,-5.234645000000000
puff adder and chuckwalla,TR16 4FH,50.238479000000000,-5.260991000000000
glass snake and copperhead,TR16 4HU,50.264776000000000,-5.248396000000000
agama and Parakeet,TR16 4JF,50.246254853386700,-5.251512788107960
Flameback and Old World quail,TR16 4NQ,50.261103273583200,-5.289656735332140
python and Stilt,TR16 4RS,50.244653692634100,-5.269444288876790
cayman and hognose snake,TR16 4RT,50.244395603870800,-5.270941677807740
tortoise and swift,TR16 5BZ,50.228631000000000,-5.178490000000000
tortoise and amethystine python,TR16 5HB,50.236029453449700,-5.196662869219940
Fox and Marmoset,TR16 5HH,50.230804000000000,-5.201250000000000
chameleon and Badger,TR16 5HS,50.229774081128500,-5.169879356070810
Ground sloth and Lemming,TR16 5HW,50.231142668689200,-5.174443913909170
Maya and tree snake,TR16 5JQ,50.238820960660200,-5.171307452225700
gaboon viper and thorn lizard,TR16 5LJ,50.240344485984800,-5.183022957322720
Armadillo and Marsh harrier,TR16 5LP,50.240486000000000,-5.184463000000000
bearded dragon and Night heron,TR16 5NL,50.239647000000000,-5.191757000000000
anole and Goose,TR16 5NN,50.239174066110900,-5.192230566597260
Jerboa and Shearwater,TR16 5PT,50.240068000000000,-5.173789000000000
blind snake and Partridge,TR16 5QD,50.247522772529300,-5.175813656989710
viper and Philippine hawk-owl,TR16 5QS,50.230155000000000,-5.180030000000000
bull snake and rat snake,TR16 5SZ,50.219890561055100,-5.212373000000000
Capuchin and Fox,TR16 6EF,50.215567000000000,-5.203131000000000
iguana and boa constrictor,TR16 6GG,50.213383825485000,-5.190915096570710
Jerboa and Ice seal,TR16 6HX,50.214833789959100,-5.193436368774560
Buzzard and chameleon,TR16 6JQ,50.214346723561500,-5.192829029278470
thorn lizard and diamond python,TR16 6JR,50.215388000000000,-5.196234153019020
tree snake and Chipmunk,TR16 6LB,50.208056417378800,-5.260211915974960
Boto and puff adder,TR16 6LL,50.200811000000000,-5.240474000000000
Crow and constrictor,TR16 6ND,50.189783191025200,-5.249704102411870
Solitaire and Perching duck,TR16 6NR,50.181375354223400,-5.218591696878700
Darwin's finches and B,TR16 6PD,50.168513532353700,-5.183608386595610
bearded dragon and Ground sloth,TR16 6PZ,50.202366000000000,-5.238017217399870
Badger and leguaan,TR16 6RT,50.219116016238300,-5.237271172483420
racer and Macaw,TR16 6SJ,50.214317161650400,-5.249002828051270
deaf adder and gecko,TR16 6ST,50.214649467540000,-5.221266725854430
Mouse and Prion,TR17 0AA,50.128745721564000,-5.489351987349640
Philippine hawk-owl and whip snake,TR18 2AT,50.125287911102700,-5.536973978199310
Black cockatoo and Mole,TR18 3BN,50.132125395961600,-5.528703054480160
Dorcopsis and viper,TR18 3BZ,50.132512181586200,-5.528409623136270
Egret and Diving bird,TR18 3EZ,50.127318180198400,-5.549733068216190
Parrotlet and galliwasp,TR18 3JA,50.128465386015500,-5.546641151079950
Minke whale and Masked owl,TR18 3LT,50.126197178651800,-5.528980308263680
anole and puff adder,TR18 3LW,50.125465831636300,-5.528939000000000
Dorcopsis and Tahr,TR18 3NJ,50.128521988754600,-5.528563695090910
Chickadee and Parrotbill,TR18 3NS,50.127181479905100,-5.541256144055450
gopher snake and Puffleg,TR20 8AZ,50.167551000000000,-5.510473000000000
Vulture and Parrotlet,TR20 8BQ,50.152682743315700,-5.516257594607390
pit viper and Zebra,TR20 8BU,50.161015000000000,-5.468148000000000
Mockingbird and glass snake,TR20 8EH,50.146485618779100,-5.484008082384280
Stint and bushmaster,TR20 8HQ,50.141723000000000,-5.495239000000000
Old World warbler and Schneider python,TR20 8JD,50.129065395377400,-5.499941580464940
bearded dragon and Maya,TR20 8JW,50.130378662494100,-5.500247420557370
Diving bird and Viscacha,TR20 8LL,50.179240467494400,-5.527819977717860
Greenbul and Scimitar babbler,TR20 8LW,50.172156496005000,-5.528236224651620
Duck and Solitaire,TR20 8NQ,50.171621436921100,-5.497478025828180
Goose and Stilt,TR20 9BU,50.145525381833600,-5.450520550995420
tuatara and bandy-bandy,TR20 9DD,50.138042008045000,-5.404797430363780
viper and Grouse,TR20 9DT,50.132700000000000,-5.424936000000000
turtle and Skunk,TR20 9HR,50.125607982399500,-5.421644451617520
cycling lizard and whip snake,TR20 9RT,50.133088147002300,-5.386250607150360
Bunting and Philippine hawk-owl,TR26 1BL,50.209622347870700,-5.490319052973780
Guillemot and Ground sloth,TR26 1EG,50.211958667742900,-5.488316687246590
massasauga and tree snake,TR26 1EJ,50.212507105985300,-5.489225936811970
agama and Grosbeak,TR26 1EU,50.208710889407200,-5.493701029712790
hoop snake and smooth snake,TR26 1FJ,50.212214856860700,-5.481283591356130
cobra de capello and Old World vulture,TR26 1HE,50.214051933268200,-5.480323872204760
bull snake and thorny devil,TR26 1HJ,50.213982547225900,-5.480837557868130
slowworm and loggerhead,TR26 1JN,50.212640775861100,-5.482380109974150
habu and puff adder,TR26 1NG,50.215586720090000,-5.480744115651410
flying dragon and king cobra,TR26 2AA,50.207023075100600,-5.476209407389680
Duck and Partridge,TR26 2AD,50.205951000000000,-5.472697000000000
Black jay and gopher snake,TR26 2AL,50.204075850834700,-5.472182428039420
Minke whale and sidewinder,TR26 2BS,50.207684736415800,-5.479047139636970
Hawaiian honeycreeper and anole,TR26 2DG,50.208867000000000,-5.479287000000000
anole and gaboon viper,TR26 2EF,50.207307160279600,-5.476636592026140
Solitaire and leathery turtle,TR26 2FB,50.207241047173100,-5.495009406220400
snapping turtle and snake,TR26 2FH,50.208491280715200,-5.482750629035230
Eagle and dugite,TR26 2FQ,50.203328729160300,-5.490238937310800
Mouse and Polecat,TR26 2GE,50.204803994327100,-5.497117030577170
whip snake and smooth snake,TR26 2GJ,50.208064233353900,-5.480842059873360
Ibex and Thicketbird,TR26 2JF,50.205992067980000,-5.493165866194890
amethystine python and tiger snake,TR26 2NL,50.195628756090200,-5.463734839476420
B and cayman,TR26 2PE,50.196728337072500,-5.465173939466820
Komodo dragon and thorny devil,TR26 2PW,50.198816084306000,-5.475682712739030
Zebra and leathery turtle,TR26 2QQ,50.195143888642300,-5.473033318982640
leathery turtle and Pheasant,TR26 2UH,50.203510847012300,-5.492507963000130
Grouse and hawksbill,TR26 3DP,50.185275583357000,-5.437358078647950
Thicketbird and Jerboa,TR26 3DY,50.187477093295100,-5.437446231958590
Goose and agama,TR26 3HW,50.188441262593900,-5.467025660818780
indigo snake and Linsang,TR26 3HY,50.190557000000000,-5.445893000000000
Parakeet and Old World warbler,TR26 3JS,50.184968274182500,-5.440138265870640
Minke whale and brown snake,TR26 3LA,50.186875000000000,-5.437487000000000
galliwasp and blind snake,TR26 3LF,50.184130342227100,-5.440598000000000
Egret and asp,TR27 4EE,50.193847153629100,-5.405083538217060
Scimitar babbler and Egret,TR27 4EN,50.191310742846500,-5.403837943579380
diamond python and Ground sloth,TR27 4ET,50.184334000000000,-5.425129000000000
worm lizard and tokay,TR27 4FG,50.188090000000000,-5.406995000000000
leguaan and Bunting,TR27 4HD,50.183341094784800,-5.422759870500770
cayman and Triller,TR27 4HR,50.183949054729900,-5.421668479325940
Peafowl and Night heron,TR27 4HU,50.184903700278200,-5.423768403790860
crocodile and Cuscus,TR27 4JN,50.176783060795500,-5.424882374321400
cycling lizard and blind snake,TR27 4LD,50.188744339754500,-5.415860081974360
saltwater crocodile and Rabbit,TR27 4NR,50.187708012318500,-5.411638490692550
Hawk and blue racer,TR27 4RF,50.195567801515700,-5.401015769567620
jew lizard and Magpie,TR27 5AF,50.197486295010500,-5.427234077860400
constrictor and Black jay,TR27 5BP,50.217919767219800,-5.368143236097150
hawksbill and Snipe,TR27 5EP,50.171104000000000,-5.372481000000000
Elephant and flying lizard,TR27 5FA,50.182787349403500,-5.367015073911400
dukite and rock snake,TR27 5FY,50.188502000000000,-5.403059000000000
anaconda and taipan,TR27 5HH,50.175437938297000,-5.360123153069450
Komodo dragon and Asiatic leopard,TR27 6AS,50.143316169696700,-5.358429610864330
Boto and Gull,TR27 6AU,50.147901736369700,-5.367207290693410
Solitaire and giant tortoise,TR27 6AW,50.144553054746900,-5.381195237019950
taipan and frilled lizard,TR27 6AZ,50.146703112954600,-5.368933000000000
Condor and Lemming,TR27 6BB,50.159019000000000,-5.352417000000000
Herring gull and cobra de capello,TR27 6BY,50.163902548646300,-5.426678720567830
hoop snake and thorny devil,TR27 6DZ,50.163814216536000,-5.427232602428940
saltwater crocodile and racer,TR27 6LW,50.172839166719600,-5.464088127082470
moloch and box turtle,TR27 6LY,50.160525000000000,-5.457735000000000
mud turtle and Diving bird,TR27 6NW,50.172369168839400,-5.483090638130300
tree snake and galliwasp,TR3 7AQ,50.187194983697900,-5.178476305896110
American sparrow and Armadillo,TR3 7AR,50.189051093698100,-5.200626367094010
leathery turtle and Solitaire,TR3 7AT,50.193021481273000,-5.201816924934990
elapid and Black jay,TR3 7AW,50.184935000000000,-5.191720000000000
dukite and massasauga,TR3 7BG,50.187126653522200,-5.172096617558110
Bronzewing pigeon and bearded lizard,TR3 7BW,50.188052345601100,-5.177062055485090
thorn lizard and Greenbul,TR3 7DQ,50.187216439963600,-5.172761103926910
harlequin snake and garter snake,TR3 7RD,50.187654349628500,-5.177257000000000
blindworm and gavial,TR4 8BZ,50.289835728593300,-5.225559110741760
harlequin snake and dugite,TR4 8DN,50.282671951118200,-5.209434368894920
sand viper and Grouse,TR4 8FL,50.256611305298500,-5.159595342527000
mud turtle and Crow,TR4 8HA,50.266342000000000,-5.174891000000000
horned viper and gecko,TR4 8HB,50.269672298238400,-5.170817780350260
deaf adder and boa constrictor,TR4 8JQ,50.283776666232800,-5.165915249296840
amethystine python and goanna,TR4 8LN,50.256648000000000,-5.157618000000000
python and box turtle,TR4 8NH,50.258227824591800,-5.156684560378720
thorn lizard and skink,TR4 8TU,50.280269496590200,-5.203264047925010
Rabbit and viper,TR4 9LX,50.312831011646100,-5.150117345127410
Greenbul and Eagle,TR5 0AL,50.304455000000000,-5.201842000000000
Piping shrike and flying dragon,TR5 0NG,50.306608709935200,-5.214038796340790
Kangaroo and grass snake,TR5 0PG,50.297593995374200,-5.193194000000000
lizard and sea snake,TR5 0PT,50.297283059382900,-5.180926460357120
Mamo and Snipe,TR5 0QY,50.311887454370800,-5.197157991187450
smooth snake and Songlark,TR5 0TH,50.308944022903800,-5.203099050387940
Buzzard and leathery turtle,TR5 0UD,50.310747677067600,-5.199020069324500
Grosbeak and Asiatic leopard,TR5 0XN,50.311359804489700,-5.178691707681650
boomslang and Black jay,TR5 0XP,50.322815595261200,-5.189699925235440
wall lizard and Chicken,TR5 0YP,50.303854475328900,-5.194202985035290
Kestrel and goanna,TR6 0DS,50.344761413564300,-5.158571289165550
Chicken and taipan,TR6 0DU,50.346016551554000,-5.156742730661760
Macaw and tuatara,TR6 0EB,50.337942000000000,-5.170544000000000
diamondback turtle and anole,TR6 0EX,50.342775019698300,-5.150890733415920
amethystine python and jew lizard,TR6 0FE,50.342032391900000,-5.153428916300000
dukite and sea snake,TR6 0HB,50.341075078748400,-5.153196000000000
dukite and diamondback turtle,TR6 0JH,50.336854497044300,-5.160210936018580
death adder and Booted eagles,TR6 0JN,50.345248000000000,-5.155054960626570
Perching duck and Armadillo,TR6 0JW,50.345096000000000,-5.155585000000000
