name,id,postcode,lat,lon
Hawaiian honeycreeper and Asiatic leopard,899528,LL14 4DR,53.024016935028400,-3.029655808111410
Parrotlet and boomslang,1442103,CH7 4BP,53.101208973338700,-3.144279000000000
Lemming and Stilt,900337,LL13 9QP,53.058255238658700,-2.964565665819370
deaf adder and frilled lizard,899422,LL15 1YA,53.129065097985300,-3.275902623701610
diamondback and Zebra,1441309,CH7 6XJ,53.167062497573900,-3.113900723471780
Piping shrike and sea snake,900909,LL13 8TA,53.048776331534000,-2.983717254646910
sand lizard and Vulture,1442365,CH7 1QN,53.163771192182500,-3.153678188296700
Bronzewing pigeon and Tahr,901810,LL12 8HU,53.090137701459200,-2.967145161898550
tortoise and frilled lizard,902236,LL11 6EP,53.077932402455200,-3.039361477756250
Parrotlet and ringhals,903623,LL11 1NF,53.048659000000000,-2.994679000000000
saltwater crocodile and king cobra,899133,LL15 1BU,53.112606078588100,-3.305654439183170
snake and Lemming,900422,LL14 2EJ,53.008312140885300,-3.048180077357480
Komodo dragon and Herring gull,903215,LL11 3RD,53.060483576447600,-3.078768023199280
diamond snake and Francolin,900090,LL14 2TN,53.005454992417800,-3.035696691521980
Black cockatoo and Nukupuʻu,903615,LL11 1LR,53.047027294548200,-2.995133838853770
thorn lizard and alligator,900047,LL14 2PW,53.002804355483100,-3.067061638978020
diamondback and death adder,1441585,CH7 5DX,53.174068496389000,-3.188874645518040
Cuscus and perentie,1442364,CH7 1QL,53.163339335291300,-3.145335143790080
Rat and Macaw,900270,LL14 1TA,53.012870321050200,-3.048126595252300
cobra de capello and cycling lizard,902348,LL11 6LW,53.062632893753300,-3.035172858429310
Fulmarine petrel and Schneider python,1442152,CH7 2EX,53.168580384697300,-3.077902645775820
puff adder and Ground sloth,902987,LL11 4FD,53.068674000000000,-3.015335734208580
Tree warbler and box turtle,1441818,CH7 4NT,53.091834541946600,-3.137163174775450
agama and Linsang,1441880,CH7 4SF,53.133378232501300,-3.093642475905410
agamid and brown snake,899998,LL14 4AY,53.032349773098800,-3.026588570014190
boomslang and Vulture,900954,LL13 7DY,53.040664722335400,-2.994897781494060
Parrotlet and diamondback terrapin,901229,LL13 0RT,53.023463712648600,-2.958183368494780
jew lizard and Zebra,1448503,CH5 3TE,53.182474738479800,-3.057196342485330
tree snake and puff adder,902859,LL11 3YT,53.064286546615700,-3.083668367193790
thorny devil and goanna,1448700,CH5 3DJ,53.186478000000000,-3.035490000000000
gaboon viper and amphisbaena,901711,LL12 9NS,53.117527000000000,-3.035819000000000
American sparrow and Pitohui,900287,LL14 1UE,53.004157488911100,-3.087377376665990
dugite and thorn lizard,899380,LL15 1ST,53.127725711597300,-3.282588444915890
Stint and skink,899486,LL14 6EE,52.986989000000000,-3.046234000000000
iguana and leguaan,1455185,CH4 9LR,53.144888328448700,-2.957565460485800
Peafowl and Kākāriki,1448242,CH5 3HD,53.194179395354900,-3.027338156352400
Coati and cerastes,898926,LL15 1YF,53.113281000000000,-3.251306000000000
Moluccan boobook and diamondback,1448757,CH5 1XH,53.197472733145800,-3.043509090351480
wall lizard and bicycle lizard,1448260,CH5 3JA,53.182877028391200,-3.051355157028760
Komodo dragon and Myna,903189,LL11 3NW,53.051295255732400,-3.058875514852960
Darwin's finches and pit viper,1441571,CH7 5DE,53.176585000000000,-3.178141000000000
Towhee and Scimitar babbler,898759,LL16 4HJ,53.176354476327900,-3.336168293059760
Armadillo and kabaragoya,902360,LL11 6NN,53.065663000000000,-3.033126000000000
Parrotlet and Towhee,899098,LL15 2HN,53.057358937694700,-3.244104348301610
blind snake and Songlark,903220,LL11 3RJ,53.049318622074600,-3.068807261098850
rat snake and turtle,1455986,CH4 0BU,53.169610529948000,-2.979463384232710
Wallaby and rock snake,903369,LL11 2NU,53.051570316018500,-2.997953745389460
massasauga and Bunting,1442348,CH7 1PR,53.162129449351200,-3.144016596448360
bearded dragon and Chicken,1442106,CH7 4BS,53.099471000000000,-3.155437000000000
tuatara and massasauga,902519,LL12 0AL,53.118670432651000,-2.991125019444970
Black cockatoo and Kākāriki,1441895,CH7 4SZ,53.130799097429200,-3.089631132508530
White ibis and boa,901645,LL12 9DD,53.102808795382300,-3.032866356249410
Dorcopsis and Ground sloth,902857,LL11 3YR,53.062830591465700,-3.084616720582590
flying dragon and Jay,1789206,LL15 1QG,53.118379943430400,-3.319053886841440
White ibis and Komodo dragon,901902,LL12 8PY,53.087226826537800,-2.974649946604690
Quetzal and Maya,901932,LL12 7AS,53.053187909949400,-2.990486696591770
Parrotlet and anole,1760779,CH7 6GW,53.176504512271800,-3.132324956076400
mud turtle and Partridge,901385,LL12 9UF,53.096127954371100,-3.023700949441610
whip snake and New World blackbird,1441640,CH7 5JG,53.180970341778300,-3.195365363744500
Dolphin and Puffleg,900899,LL13 8SL,53.047373509267100,-2.980507913228370
Maya and Tree warbler,902910,LL11 5FH,53.068783631839600,-3.050334734598650
Recurvebill and deaf adder,1448360,CH5 3LW,53.184720688920800,-3.030688664182540
Black jay and Asiatic leopard,1448025,CH5 3UG,53.183195882821500,-3.061015069765420
galliwasp and Ground sloth,902688,LL11 6AW,53.072452451817000,-3.039975783555590
indigo snake and soft-shelled turtle,1441471,CH7 6EY,53.189045464735500,-3.129706568223110
Mouse and python,900598,LL14 1BT,53.013895113470400,-3.059286115975500
elapid and Schneider python,1442184,CH7 2JF,53.170352401377500,-3.085696389796060
Quetzal and terrapin,1441744,CH7 4EX,53.135485231427000,-3.143966174685890
terrapin and Peafowl,903581,LL11 1BD,53.045979970971200,-2.994602535831590
wall lizard and ringhals,902982,LL11 4EW,53.073368765526800,-3.025549138797450
Eagle and Pratincole,1442019,CH7 3LW,53.180676784746400,-3.070290202063870
Wader and agama,903246,LL11 2BA,53.056037000000000,-3.006800000000000
Guillemot and Lemming,1455706,CH4 0NR,53.165253000000000,-2.993380000000000
Fox and alligator,1441738,CH7 4EQ,53.150390000000000,-3.159824000000000
cobra and Argus,1456024,CH4 0EX,53.145648211288800,-3.033326053118960
Bronzewing pigeon and Piping shrike,902555,LL11 5SF,53.061540000000000,-3.053277000000000
sea snake and Stint,899053,LL15 2BY,53.133980869257400,-3.350204303525860
green turtle and cayman,1442454,CH7 1TR,53.165480574460800,-3.150747305722770
New World blackbird and whip snake,900928,LL13 7BG,53.038092153520200,-2.988619348073580
Boto and chuckwalla,1455790,CH4 0SJ,53.162858577020600,-2.983946388531070
tortoise and cayman,1789157,LL13 7YF,53.039741188445100,-2.986688733440270
anole and rattlesnake,1442621,CH7 1ET,53.165778525927600,-3.141271537922580
Old World warbler and Jay,899185,LL15 2RF,53.039061411912500,-3.353097554656430
Kākāriki and Pratincole,901956,LL12 7DD,53.051514020373100,-2.984212260996130
Old World warbler and Chickadee,903516,LL11 2UR,53.067143863369700,-2.991045734930200
goanna and Booted eagles,1442666,CH7 1GG,53.167319351504600,-3.154880352904970
Argus and whip snake,900621,LL14 1EG,53.014075624236500,-3.054147991044400
Tahr and Thrasher,901356,LL12 9SD,53.115905000000000,-3.023767000000000
taipan and tokay,903098,LL11 4PD,53.072778054957200,-3.012653831126280
Mole and Mink,903102,LL11 4PH,53.069932430540000,-3.007945332712150
tortoise and Guillemot,900237,LL14 1PW,53.010259538487500,-3.040372548764590
thorn lizard and Treepie,900273,LL14 1TE,53.010688347598500,-3.054959712756610
boa constrictor and sidewinder,901920,LL12 8RY,53.081768000000000,-2.996801000000000
pit viper and Bunting,1455206,CH4 9NX,53.141280584389200,-2.953463698483500
Ibex and goanna,900140,LL14 1HL,53.013874045786700,-3.048478851902980
Treepie and snake,1441867,CH7 4RP,53.129422293648800,-3.091748499117730
Chickadee and krait,902475,LL11 6TU,53.052989826784000,-3.025527581856470
Viscacha and python,1442388,CH7 1RR,53.172996385447400,-3.150679162131710
American sparrow and Pheasant,1442668,CH7 1GJ,53.168276027488400,-3.147979817348370
Tattler and puff adder,895556,LL21 9BG,52.984520404623800,-3.304007452816610
Schneider python and Warbler,900759,LL13 8DQ,53.042019501732600,-2.983324735286950
anole and Guillemot,902276,LL12 0RB,53.094170000000000,-3.004674000000000
horned toad and Peafowl,1455810,CH4 0TJ,53.169786711349100,-2.980993292008300
Stilt and Greenbul,902584,LL11 5TT,53.063951148030200,-3.111252950156220
River dolphin and Solitaire,1441666,CH7 5LU,53.140399445039700,-3.199082132533740
tiger snake and Perching duck,899651,LL14 4LD,53.026094000000000,-3.069441000000000
anole and Chicken,1441255,CH7 6TD,53.166537566871700,-3.105599955019830
elapid and Piping shrike,903292,LL11 2HG,53.060227875012000,-3.001078537646980
alligator and Shearwater,899076,LL15 2EG,53.087403701120400,-3.302771031423840
cobra de capello and Mamo,902525,LL11 5PE,53.059141077697700,-3.043848029267960
carpet snake and Black cockatoo,899299,LL15 1NU,53.114086859753900,-3.318115190954030
habu and Ice seal,903107,LL11 4PR,53.070242565715800,-3.010594347705950
king snake and Myna,1455186,CH4 9LS,53.144629608972100,-2.957320488459150
Mamo and Polecat,1442223,CH7 2NE,53.170456574314700,-3.090037456606010
python and Black cockatoo,900967,LL13 7EQ,53.032080809849600,-2.990465124854320
terrapin and kabaragoya,899595,LL14 6RL,52.994213478090700,-3.055630773206170
Mamo and Fulmarine petrel,900516,LL14 1BB,53.011370827842600,-3.061102316683330
Coati and racer,901623,LL12 9BN,53.105334813859300,-3.032867140664490
Mockingbird and elapid,901524,LL13 0JL,53.037712422066600,-2.971429746248730
loggerhead and Skunk,902687,LL11 6AU,53.073170163776000,-3.039112428805980
snapping turtle and Cloud rat,900903,LL13 8SR,53.045869972698200,-2.981875961257290
flying dragon and bushmaster,1442392,CH7 1RW,53.172158043133200,-3.142770000000000
monitor and diamond python,1760757,CH7 3GE,53.168365875368600,-3.067456027772940
Philippine hawk-owl and soft-shelled turtle,1448518,CH5 3TY,53.180097958631800,-3.057601748547110
elapid and sea snake,1442227,CH7 1LQ,53.170390894771000,-3.137429512698560
mamba and tiger snake,901343,LL12 9RJ,53.118773558900600,-3.044246484001380
Treepie and dugite,1448799,CH5 2BJ,53.191142899806300,-3.019796896291320
wall lizard and flying dragon,899254,LL15 1HA,53.114886746946700,-3.305081083720400
Moluccan boobook and boomslang,1441614,CH7 5HH,53.189687613658900,-3.203645139144880
Jay and giant tortoise,1455697,CH4 0ND,53.151901330361800,-3.038889426932960
Parrotbill and horned toad,899567,LL14 6NS,52.988911056285100,-3.039144262852410
tortoise and Parakeet,899088,LL15 2EY,53.079397970322100,-3.272492445042410
Snipe and dukite,900581,LL13 9DX,53.052384139647500,-2.972416204311390
thorn lizard and White ibis,902793,LL11 5AN,53.078674742885000,-3.061174580267740
whip snake and Herring gull,1448606,CH5 3AA,53.195893705001800,-3.040072788098850
Grouse and Mamo,1442232,CH7 1LW,53.171072926856500,-3.136609772205700
Zebra and Chipmunk,902578,LL11 5TL,53.063434278904600,-3.058516657751330
dugite and mud turtle,900791,LL13 8HY,53.044955955346800,-2.992476000000000
cerastes and Logrunners,903170,LL11 3LU,53.051331774318600,-3.057802257425730
Solitaire and amphisbaena,903232,LL11 2AD,53.050314000000000,-3.003216729427200
tortoise and Hawk,902398,LL11 6RR,53.061415214169700,-3.033576823107180
carpet snake and Gull,899189,LL15 2RL,53.027324532862000,-3.330453162271770
Mole and monitor,1448746,CH5 1UP,53.198188984498600,-3.040757092684010
Mockingbird and elapid,1441979,CH7 3HQ,53.171867990973700,-3.083131514044660
Night heron and iguana,899666,LL14 4PJ,53.014881288252300,-3.039216715730820
frilled lizard and flying dragon,903360,LL11 2NH,53.054572464540300,-2.997993289548350
glass snake and bearded lizard,1441424,CH7 6YY,53.187433762588000,-3.133764906495840
frilled lizard and Cuscus,901035,LL13 7NU,53.041953796650300,-2.998760745502220
Gull and Tree warbler,900896,LL13 8SG,53.048366077421100,-2.978964092276960
smooth snake and leguaan,1441957,CH7 3EL,53.174112135547000,-3.059504196173810
Kestrel and cayman,2639495,CH7 4DN,53.095115000000000,-3.200211000000000
perentie and Peafowl,1455066,CH4 9AZ,53.144684928037800,-3.000874050222360
snapping turtle and iguana,902655,LL11 4SQ,53.069370267935000,-3.020110975219130
tree snake and copperhead,902835,LL11 3UF,53.055026024366900,-3.073901999385900
tokay and leathery turtle,902392,LL11 6RF,53.060639118087800,-3.037020139876240
Stint and Skunk,1789164,LL13 8AF,53.038390390351000,-2.983719781024770
Greenbul and Puffleg,900935,LL13 7BW,53.036613000000000,-2.989301000000000
Prion and bushmaster,899910,LL14 3UT,52.981928836734000,-3.064238343883120
Pratincole and Mockingbird,901037,LL13 7NX,53.045539953271600,-3.003109846487260
dukite and Grouse,1441291,CH7 6UY,53.168610054174900,-3.109901742193200
crocodile and Grackle,899445,LL14 6AY,52.994609991289300,-3.036107577321210
White ibis and Stint,900565,LL13 9DB,53.051825245489100,-2.970404493183210
Ice seal and Myna,896005,LL20 8DA,52.992349435818100,-3.209921000000000
Herring gull and turtle,900508,LL14 1AP,53.011916549509100,-3.058373151106180
gopher snake and Black jay,1442510,CH7 2AJ,53.161414120648700,-3.076107692765930
crocodile and Egret,903299,LL11 3SB,53.053147979007700,-3.069827045458920
Badger and tiger snake,900300,LL14 1UY,53.012266382996600,-3.041151186045390
Minke whale and Philippine hawk-owl,1448533,CH5 2PN,53.195604647988900,-3.000353590859130
blue racer and Chipmunk,901804,LL12 8HL,53.089143834637900,-2.973274754744210
Gull and wall lizard,900574,LL13 9DP,53.052444673101200,-2.970507927356510
Mockingbird and Marmoset,900075,LL14 2SR,53.007356395922800,-3.039289274330230
agama and ringhals,900577,LL13 9DS,53.051603115623200,-2.968982218414650
Ground sloth and Mamo,1442314,CH7 3AL,53.165536845826800,-3.064483474331630
Boto and Siskin,1455198,CH4 9NN,53.140162000000000,-2.956294000000000
Bunting and Dolphin,1441623,CH7 6LH,53.181132512940600,-3.102129635166240
tree snake and Boto,903579,LL11 1BA,53.046890000000000,-2.994519000000000
Tattler and galliwasp,899732,LL14 3HY,52.983352980729800,-3.065822471198640
Mouse and tuatara,899089,LL15 2EZ,53.076738348329900,-3.272369217183910
garter snake and Scimitar babbler,1441572,CH7 5DF,53.172045258810500,-3.189836035100860
black snake and Myna,901984,LL12 7EY,53.056238148196500,-2.991228086519370
thorny devil and coral snake,1441856,CH7 4QY,53.095952213694300,-3.210032108235310
Piping shrike and Lemming,903019,LL11 4LY,53.075085701885600,-3.016126260350950
turtle and River dolphin,1789179,LL13 9UN,53.067699551451300,-2.977835908705630
Asiatic leopard and Condor,900173,LL14 1NR,53.011932832977400,-3.044332863479260
Duck and Puffleg,900841,LL13 8NR,53.036843404836300,-2.980925137231010
diamondback turtle and chuckwalla,1448539,CH5 2PU,53.197031959210700,-2.999518612821240
Magpie and adder,895634,LL21 9LH,53.015177733762500,-3.275640213237240
Rat and crocodile,900927,LL13 7BE,53.038436787124200,-2.988254377856790
mud turtle and Jay,899654,LL14 4LG,53.033200112560900,-3.063937000000000
saltwater crocodile and Flameback,900274,LL14 1TG,53.013865779642700,-3.066589272957900
B and B,901177,LL13 0PB,53.039791000000000,-2.960305000000000
agamid and thorn lizard,903015,LL11 4LG,53.072806474726200,-3.016699486149510
cobra and Songlark,1441230,CH7 6RX,53.179144577398900,-3.116742578163870
Shearwater and chuckwalla,1441713,CH7 5QH,53.199539062945100,-3.206406281947630
indigo snake and Eagle,900588,LL13 9EF,53.055202220937800,-2.970778787239840
puff adder and moloch,895981,LL20 8AN,52.979666012519800,-3.193628077346490
bandy-bandy and Eagle,900129,LL14 1ET,53.014986780178800,-3.051755391944190
harlequin snake and copperhead,1455673,CH4 0JQ,53.151818613959100,-3.043209014774620
loggerhead and Herring gull,895968,LL20 7YU,52.997082122887600,-3.212867916388360
White ibis and Dolphin,902399,LL11 6RS,53.062006357940400,-3.034859384921800
Old World vulture and moloch,1448523,CH5 3UE,53.185002309671500,-3.057019078747590
Petrel and Mockingbird,900989,LL13 7HN,53.044998000000000,-2.994971252101240
Condor and soft-shelled turtle,1441860,CH7 4RE,53.130572179023300,-3.086920116004690
viper and Pitohui,900499,LL14 1AA,53.010277000000000,-3.056902000000000
sand lizard and Mamo,901214,LL13 0RL,53.024057707463600,-2.962550036715900
gavial and blind snake,902453,LL11 5NF,53.063128418391200,-3.040198815495560
Piping shrike and grass snake,901341,LL12 9RG,53.123002000000000,-3.032648000000000
gavial and Greenbul,899993,LL14 4AS,53.031853491972500,-3.027844302754420
tiger snake and Old World warbler,1442077,CH7 3QG,53.176706044692600,-3.073004245397370
Shearwater and anole,902027,LL12 0AW,53.119029000000000,-2.979493000000000
kabaragoya and tree snake,901457,LL13 0DE,52.978977000000000,-2.970260000000000
bicycle lizard and grass snake,895645,LL21 9NA,53.015747850359800,-3.291115426222340
tokay and Coati,902260,LL12 0PJ,53.100375438586100,-3.010642000000000
massasauga and cobra de capello,902120,LL12 7UB,53.062660397053300,-2.970051151607070
Vole and Thicketbird,902855,LL11 3YP,53.060874848109600,-3.088119048385200
amethystine python and adder,900162,LL14 1NB,53.009858470931500,-3.045102519630330
Myna and bearded lizard,903386,LL11 2PY,53.061325078321000,-2.991359809540790
Grosbeak and Parakeet,900271,LL14 1TB,53.010086573471600,-3.054900320295180
Macaw and Mockingbird,903274,LL11 2EE,53.056832610855900,-2.998612514571450
bearded lizard and jew lizard,901699,LL12 9LW,53.111684437880900,-3.042819744965420
Jerboa and python,903270,LL11 2DP,53.060306711278400,-3.005586755204800
Night heron and wall lizard,900618,LL14 1ED,53.013699332845700,-3.055018260413660
Ice seal and Snipe,900298,LL14 1UU,53.010335222369100,-3.038913716497810
goanna and Grosbeak,1441195,CH7 6RF,53.180132313337400,-3.115900355995600
chameleon and grass snake,900936,LL13 7BY,53.041273341637000,-2.991988412287020
bearded dragon and B,1441598,CH7 5EP,53.165331000000000,-3.211265000000000
moloch and Old World warbler,900152,LL14 1LD,53.013175000000000,-3.049356000000000
sidewinder and brown snake,899489,LL14 6EH,52.986365990283500,-3.050508684080660
Condor and New World blackbird,901222,LL13 7YE,53.035306706290800,-3.002424870474170
Jerboa and Polecat,900280,LL14 1TS,52.992211562566900,-3.061377420891540
Philippine hawk-owl and adder,901094,LL13 7TE,53.046194259692500,-3.005467002544840
bull snake and smooth snake,899629,LL14 4HE,53.039868000000000,-3.013821000000000
Zebra and sand viper,2654300,LL12 0BX,53.095432000000000,-3.002926000000000
Solitaire and Coati,900500,LL14 1AB,53.009520000000000,-3.057062000000000
python and New World blackbird,900012,LL14 4BU,53.033048860682100,-3.020565642604930
boa constrictor and cobra,901729,LL12 7YN,53.057748553571000,-2.987965240315120
king cobra and amphisbaena,1442396,CH7 1SA,53.170476711238400,-3.152810883202990
Pheasant and deaf adder,902500,LL11 6YF,53.058559048230000,-3.032255059102110
skink and whip snake,1442672,CH7 1GR,53.160688609918800,-3.152668183072900
dukite and tortoise,1442070,CH7 3PW,53.172549944021900,-3.074336758646110
Moluccan boobook and king cobra,903585,LL11 1BT,53.050085000000000,-2.996129000000000
Fulmarine petrel and perentie,1441834,CH7 4PE,53.114029677686600,-3.115308128682510
Pratincole and rock snake,902002,LL12 7LB,53.058339402578300,-2.985009458516260
Viscacha and lizard,1455784,CH4 0SB,53.161523590833400,-2.993444000000000
sidewinder and Zebra,1760229,CH4 0GQ,53.156799846857200,-3.039651198690790
Quetzal and cycling lizard,902660,LL11 4SW,53.069565051763000,-3.026115000000000
flying dragon and Grosbeak,899958,LL14 2LN,53.013443000000000,-3.059737000000000
diamondback terrapin and Gila monster,902574,LL11 5TF,53.063263792016000,-3.049349812207700
bearded lizard and Fox,900521,LL14 1BH,53.012281501436700,-3.060796744183000
Diving bird and blindworm,1441251,CH7 6SY,53.188535295405600,-3.132312289174050
mud turtle and gecko,1441256,CH7 6TE,53.167062436161800,-3.105224516176010
hawksbill and Fox,902776,LL11 4YS,53.064851583220500,-3.021854681402570
leathery turtle and sea snake,901995,LL12 7HR,53.056435482261000,-2.984786977116100
Kangaroo and Chipmunk,1442386,CH7 1RP,53.173007420299300,-3.151397590441020
River dolphin and death adder,899641,LL14 4HX,53.034587858378400,-3.024539012709200
asp and gecko,903411,LL11 2SR,53.062414333558200,-2.991175909425720
Vulture and diamondback,900997,LL13 7JB,53.033398534135500,-2.990912878121250
Puffleg and Minke whale,902062,LL12 7PH,53.065698877705600,-2.977730499189110
Cloud rat and horned viper,1441307,CH7 6XG,53.170883209709900,-3.114837480380690
moloch and mud turtle,1455736,CH4 0PS,53.161964993297200,-2.988727155056540
goanna and Stint,900992,LL13 7HS,53.041962000000000,-2.996837000000000
Myna and Marsh harrier,1442599,CH7 1DF,53.172262934919100,-3.147502794798270
boa and Pitohui,1789146,LL12 9PX,53.120902511082600,-3.042027180991000
gavial and deaf adder,899940,LL14 2HL,53.005560752812600,-3.052316048534430
whip snake and Jackal,1448678,CH5 3BF,53.195622114971400,-3.048493662358130
Flameback and Moluccan boobook,898781,LL16 4LU,53.184609068764500,-3.318226979086640
Grackle and American sparrow,2662293,CH4 0TR,53.152609000000000,-3.037964000000000
gecko and Eagle,902902,LL11 5EX,53.076532248511800,-3.052404224131670
whip snake and copperhead,899918,LL14 3YF,52.976898874793200,-3.068776271914440
rat snake and agama,1789166,LL13 8DX,53.041853332289800,-2.988899712065160
agamid and Lemming,902560,LL11 5SN,53.063544705903500,-3.051132478116460
anole and snake,902916,LL11 5HA,53.097877281212300,-3.049908365108620
Zebra and crocodile,1441946,CH7 3DX,53.172511000000000,-3.056667000000000
Towhee and Kākāriki,900925,LL13 7BB,53.038936879632100,-2.988653591951470
dugite and Solitaire,1441896,CH7 4TA,53.129814000000000,-3.086363000000000
Mink and blind snake,900863,LL13 8QH,53.036412222214100,-2.979796832895110
Booted eagles and puff adder,902496,LL11 6YA,53.053478447533900,-3.019929460079790
Ibex and Perching duck,900698,LL13 9LE,53.044405685719800,-2.966389399443400
Parrotbill and Skunk,1441935,CH7 3BU,53.164077863510600,-3.067797926839080
Parrotbill and Mole,900127,LL14 1ER,53.014762646573100,-3.053717554104840
mountain devil and rock snake,902214,LL12 0NR,53.093917243425600,-2.985284433098200
kabaragoya and Kestrel,1441172,CH7 6QA,53.178675250652000,-3.120770402809590
jew lizard and Dorcopsis,898837,LL15 2UW,53.093240991900000,-3.276113000000000
blue racer and boa,1760214,CH4 0AB,53.154421362542400,-3.026792687570090
gecko and Guillemot,900729,LL13 7YX,53.048809231678400,-3.010883389837360
constrictor and Schneider python,1442313,CH7 3AJ,53.165557274694900,-3.054102862787030
tuatara and Night heron,901558,LL12 8UN,53.084550778637600,-2.972111067564860
Bunting and Armadillo,899895,LL14 3TY,52.983160931503000,-3.074174009063310
gopher snake and bearded dragon,1441947,CH7 3DY,53.173091230834500,-3.051968616242070
Pheasant and Elephant,901324,LL13 7AU,53.039492881326800,-2.988815461513380
python and alligator,899967,LL14 2ND,53.001686251033100,-3.058391091357420
Marsh harrier and puff adder,899869,LL14 3SG,52.977939536436600,-3.084886957757060
Egret and slowworm,900808,LL13 9NX,53.043154327463900,-2.969926292698690
Siskin and hognose snake,903161,LL11 3LH,53.051975004724500,-3.063293292053420
cobra and Mink,903618,LL11 1LY,53.047279575091200,-2.995065064951750
grass snake and gavial,901596,LL12 8ZJ,53.048909000000000,-3.000085000000000
Rat and Night heron,901175,LL13 0NZ,53.037681317384300,-2.978513182637390
Wader and Partridge,902818,LL11 5DJ,53.078795125077200,-3.052683348861020
monitor and Old World warbler,1789127,LL11 5BJ,53.071963592322800,-3.106787852600080
Grosbeak and caiman,900245,LL14 1RH,53.012632000000000,-3.054973977000480
boa and Magpie,2584823,CH7 9XA,53.176475000000000,-3.136738000000000
tuatara and Fox,901041,LL13 7PD,53.041921633199800,-2.996164711590410
Greenbul and bushmaster,895939,LL20 7TX,52.975130307834100,-3.096149824275170
tuatara and python,902256,LL11 6HX,53.058805855754000,-3.031783477438190
terrapin and Siskin,1448257,CH5 3HX,53.194461817347700,-3.024815250751400
Towhee and soft-shelled turtle,900725,LL13 7YP,53.048972000000000,-3.014109000000000
Vole and copperhead,899529,LL14 4DS,53.021746154891000,-3.037518161209130
horned viper and Boto,895950,LL20 7UR,52.975874014708500,-3.102244927670580
carpet snake and Tahr,903389,LL11 2RD,53.059692744022400,-2.996291216305590
Linsang and bearded dragon,901456,LL13 0DD,52.985163000000000,-2.963398000000000
Fox and diamond python,902206,LL12 0NE,53.099268780156800,-2.994666617451770
Macaw and Triller,899645,LL14 4JB,53.039200875881700,-3.010718215768430
Triller and green turtle,902054,LL12 7NT,53.058113763961000,-2.982945207419050
frill-necked lizard and diamond snake,903068,LL11 3DB,53.061449260851400,-3.097027236961490
Condor and smooth snake,1441496,CH7 6HN,53.199689589852500,-3.098878138660250
anaconda and Stilt,900941,LL13 7DG,53.042004769653000,-2.994824234809660
Bunting and Wallaby,1441644,CH7 5JR,53.165571643013100,-3.170913842717180
frill-necked lizard and Triller,899930,LL14 2EU,53.007413952296100,-3.049112143218650
gecko and constrictor,900527,LL13 8YF,53.036811944084700,-2.966100236828480
Komodo dragon and Wader,1455194,CH4 9NG,53.145382000000000,-2.953255000000000
wall lizard and Polecat,1448709,CH5 3DY,53.189912033907800,-3.046663064095450
B and coral snake,900066,LL14 2SD,52.998101000000000,-3.065426000000000
rock snake and Parrotbill,1455644,CH4 0HD,53.144401549311800,-3.046378248790910
Grouse and Coati,1455774,CH4 0RQ,53.165863937532200,-2.987934249188240
Tahr and leathery turtle,1442205,CH7 2LG,53.165567051145600,-3.087011584476410
Parrotbill and blind snake,901005,LL13 7LT,53.045421710114000,-2.997931014676410
Songlark and Mole,900737,LL13 8AE,53.046357172517200,-2.992493009460740
Capuchin and sea snake,1442110,CH7 4BX,53.112615000000000,-3.190958000000000
Moluccan boobook and Partridge,902089,LL12 7SB,53.063985649223400,-2.977273846260680
Moluccan boobook and diamondback turtle,1442494,CH7 1XY,53.156397258402800,-3.131466204480800
massasauga and lizard,901941,LL12 7BD,53.056147668103800,-2.981542695126900
puff adder and skink,1442078,CH7 3QH,53.176644111188000,-3.074887944161080
