name,id,postcode,lat,lon
deaf adder and Tahr,900576,LL13 9DR,53.052053420476400,-2.972184973094750
sea snake and Prion,903518,LL11 2UT,53.067694800527800,-2.993968636087370
Francolin and gopher snake,1441827,CH7 3BB,53.162437987504700,-3.054101198993070
Mouse and python,1455179,CH4 9LH,53.152555000000000,-2.962267000000000
pit viper and sea snake,1789169,LL13 8RF,53.038001920687800,-2.984591000000000
Grouse and Pitohui,1448346,CH5 3LD,53.184545981834300,-3.055765761029870
Fish eagle and goanna,899665,LL14 4ND,53.033666971240400,-3.073893059128790
snapping turtle and Thicketbird,902476,LL11 6TW,53.053799309852300,-3.027709000000000
blue tongue and sidewinder,1442605,CH7 1DQ,53.167066683076200,-3.143803881847200
Logrunners and Thicketbird,1442090,CH7 4AR,53.156011284282100,-3.168634658210000
cycling lizard and rattlesnake,1448354,CH5 3LP,53.179217826621500,-3.054467761788330
Mole and gavial,902654,LL11 4SP,53.072442689845300,-3.028691450828560
tiger snake and mamba,903381,LL11 2PS,53.058853007663100,-2.993511395983610
Badger and River dolphin,899657,LL14 4LN,53.042794000000000,-3.047525000000000
Bunting and Triller,902909,LL11 5FG,53.067439215836400,-3.050898990021430
krait and flying dragon,901658,LL12 9ED,53.109724738198500,-3.022096798691260
rattlesnake and goanna,901233,LL13 0RY,53.021712000000000,-2.954805000000000
flying lizard and snake,902393,LL11 6RG,53.061136036960000,-3.036733633990950
Piping shrike and hognose snake,900980,LL13 7HA,53.039011567280100,-2.992637458798990
Asiatic leopard and goanna,1441612,CH7 5HF,53.188895892646800,-3.181593000000000
Pratincole and Nukupuʻu,1441145,CH7 6NN,53.176474334724000,-3.136737619371230
slowworm and blue tongue,902389,LL11 6RB,53.059850140241300,-3.035747764474970
bushmaster and sea snake,1441875,CH7 4RY,53.127886000000000,-3.089826000000000
Magpie and Black cockatoo,1441685,CH7 5NU,53.195488000000000,-3.241230000000000
Condor and Piping shrike,902289,LL12 0RY,53.096023056368600,-2.988259650909000
Moluccan boobook and king cobra,900906,LL13 8SU,53.047714308811200,-2.982783101270000
Pitohui and saltwater crocodile,900501,LL14 1AD,53.009502000000000,-3.056038505345090
Grouse and horned toad,900792,LL13 8JA,53.035801000000000,-2.967882000000000
turtle and tortoise,1441855,CH7 4QX,53.087944390197000,-3.212495116733240
Quetzal and Scimitar babbler,899416,LL15 1UY,53.129370486894600,-3.275926618437740
viper and Petrel,1442211,CH7 2LQ,53.165912541824600,-3.085599255764010
Parrotbill and caiman,1441274,CH7 6UB,53.169163000000000,-3.111442000000000
pit viper and Parrotbill,902901,LL11 5EW,53.094154112335500,-3.055163929395480
king snake and brown snake,1448487,CH5 3SD,53.186849944741300,-3.049357147728560
Philippine hawk-owl and bandy-bandy,1442188,CH7 2JL,53.166817906262200,-3.080939990157180
Moluccan boobook and Songlark,902620,LL11 5YS,53.073080162403900,-3.100114140786370
rattlesnake and Warbler,902917,LL11 5HB,53.096204913113600,-3.048926778396210
leathery turtle and whip snake,1441625,CH7 5HN,53.193347610394300,-3.190096630509470
