name,postcode,lat,lon
water snake and tiger snake,CH45 8NA,53.422128000000000,-3.088954000000000
Old World warbler and frilled lizard,CH46 0PG,53.398894523009600,-3.110998821174790
Badger and Herring gull,CH46 0QA,53.397379000000000,-3.105861000000000
asp and garter snake,CH46 0QU,53.396661000000000,-3.104835000000000
puff adder and soft-shelled turtle,CH46 1QU,53.407201769063900,-3.100173687592730
sand lizard and asp,CH46 1RS,53.412547781271400,-3.089659846814220
turtle and racer,CH46 2RH,53.419699353280500,-3.091046534064080
diamondback terrapin and black snake,CH46 3RG,53.415528170375000,-3.100870112820740
diamond python and Herring gull,CH46 6BA,53.400108458424800,-3.125349118328470
agamid and Rat,CH46 6EH,53.397144681245600,-3.128880402331740
Puffleg and Logrunners,CH46 6HE,53.394607097746300,-3.128211682351830
Old World vulture and chuckwalla,CH46 6HU,53.400233484210700,-3.132090640920460
Skunk and Perching duck,CH46 6JA,53.398951498861800,-3.130778184522700
mountain devil and frilled lizard,CH46 6JG,53.401644956264100,-3.134910737362990
jew lizard and saltwater crocodile,CH46 7TN,53.402116783563200,-3.113444272908260
Herring gull and swift,CH46 7TQ,53.405133840813800,-3.113793835644030
Wallaby and smooth snake,CH46 7TR,53.401230880885700,-3.113977654707360
snapping turtle and anole,CH46 7TZ,53.405004797285000,-3.114136437912160
garter snake and Piping shrike,CH46 9QH,53.401172553252400,-3.105748715156910
bearded dragon and Parakeet,CH46 9RN,53.399803090706400,-3.097320610457270
brown snake and box turtle,CH46 9SF,53.401204019752500,-3.101372605737420
snapping turtle and Pratincole,CH47 0LG,53.398477916098100,-3.165989507657560
diamond python and Solitaire,CH47 0LH,53.398263231462300,-3.164960914740830
amphisbaena and monitor,CH47 1HE,53.391121521828000,-3.181863515312430
perentie and New World blackbird,CH47 1HN,53.386718000000000,-3.195394000000000
skink and harlequin snake,CH47 2AB,53.390730366497800,-3.178694822040040
White ibis and Cloud rat,CH47 2DL,53.394928996132400,-3.179532731066760
Night heron and Bunting,CH47 2DT,53.395333830787100,-3.177679089419720
Solitaire and racer,CH47 3AF,53.398176797005900,-3.173007000000000
Mockingbird and habu,CH47 3AR,53.397414995785700,-3.176292749081180
bearded dragon and Skunk,CH47 3DG,53.395944595764400,-3.171334360850550
deaf adder and Diving bird,CH47 4AF,53.385302482081600,-3.183987696249790
rock snake and agama,CH47 4BB,53.391631214710900,-3.173937724117130
flying lizard and Vole,CH47 4FF,53.390988000000000,-3.172687000000000
taipan and blue tongue,CH47 5AA,53.395193305375800,-3.174501000000000
Zebra and Schneider python,CH47 5BE,53.401797575326900,-3.167554337418510
tokay and copperhead,CH47 7AU,53.407199000000000,-3.152930000000000
thorn lizard and Dorcopsis,CH47 7BE,53.404329116401000,-3.150310134476330
Chicken and Duck,CH47 7BN,53.402101689008400,-3.152912358969030
Shearwater and Greenbul,CH47 9SF,53.393514996346600,-3.153131372160610
sand lizard and Hawaiian honeycreeper,CH48 0QN,53.370703098714300,-3.184995545290070
sidewinder and Crow,CH48 0RL,53.368652159526100,-3.184232217634140
River dolphin and bandy-bandy,CH48 0RQ,53.369284557991100,-3.182100493187240
frill-necked lizard and Jay,CH48 1LB,53.365652109352300,-3.162973757983570
Greenbul and Jerboa,CH48 1NZ,53.357146148738000,-3.143674701965390
tree snake and Skunk,CH48 1PB,53.360221428102700,-3.144508397967590
New World blackbird and Dorcopsis,CH48 1PR,53.369843372475900,-3.144135112534230
puff adder and box turtle,CH48 2JW,53.357175677864400,-3.165010000000000
hawksbill and Greenbul,CH48 2LD,53.357243439703800,-3.160716000000000
Thicketbird and diamondback,CH48 2LG,53.365594000000000,-3.174453000000000
kabaragoya and Thrasher,CH48 3HS,53.366788638951400,-3.181790915645700
amphisbaena and Badger,CH48 3JG,53.366850034420400,-3.176487382145180
flying dragon and River dolphin,CH48 3LB,53.368072558358900,-3.178309575402020
Guillemot and Chicken,CH48 4DA,53.372198726160000,-3.183744413258260
Egret and Zebra,CH48 5DG,53.374336923581900,-3.187262000000000
Asiatic leopard and Gila monster,CH48 5DS,53.381294430924800,-3.183876472827290
constrictor and Flameback,CH48 5EQ,53.378478000000000,-3.183381858763450
Vole and Old World warbler,CH48 5EY,53.376922969662300,-3.178704262067500
hognose snake and Polecat,CH48 5HF,53.377237652178600,-3.178697921355020
green turtle and Philippine hawk-owl,CH48 5JQ,53.378720170259300,-3.187833943313100
gavial and Vole,CH48 5JU,53.375750550201500,-3.183632481435510
Thrasher and python,CH48 6EX,53.375713093112300,-3.157205017029080
Mole and rock snake,CH48 7EH,53.374195456746500,-3.170211000000000
chuckwalla and Civet,CH48 7EU,53.371515187497200,-3.171941442635420
Mouse and Bronzewing pigeon,CH48 7HG,53.367073244141400,-3.168407900808400
flying lizard and Songlark,CH48 7HQ,53.366794811732300,-3.169302017434580
Cloud rat and tree snake,CH48 8AP,53.369956373692200,-3.164052949990340
Perching duck and caiman,CH48 8BU,53.367690302130800,-3.160444251716900
Tahr and fer-de-lance,CH48 8DD,53.368437949492100,-3.164898285348940
fer-de-lance and Dorcopsis,CH48 9YF,53.375300852305500,-3.153360697206360
Chipmunk and Chipmunk,CH49 0UB,53.383720238005600,-3.098577000000000
leguaan and Philippine hawk-owl,CH49 0UJ,53.383293965550200,-3.099842745329140
diamondback terrapin and Badger,CH49 0WJ,53.379024000000000,-3.100799000000000
Fox and B,CH49 1RF,53.374279798171300,-3.117062001894870
Linsang and Perching duck,CH49 1RH,53.376090926913200,-3.121393572270020
boa constrictor and Pitohui,CH49 1RL,53.373168923823100,-3.118146000000000
Badger and Polecat,CH49 1RW,53.374076361940700,-3.120543971775200
Buzzard and brown snake,CH49 1RX,53.374757464754300,-3.118848242825620
king snake and moloch,CH49 2NB,53.383933006594500,-3.109466516508470
Ice seal and amethystine python,CH49 2PY,53.382989229745200,-3.115245319056810
Masked owl and adder,CH49 2QJ,53.379671897596500,-3.123908060629690
Gull and Old World vulture,CH49 2RG,53.384882484516800,-3.117535062557300
Chipmunk and Siskin,CH49 3NH,53.377942904976700,-3.118495809824140
caiman and thorn lizard,CH49 3NJ,53.377216361968100,-3.124068876014790
slowworm and Chickadee,CH49 3NL,53.375039729714200,-3.127062998828890
diamondback and dukite,CH49 3QB,53.376745055680700,-3.126386482219440
milk snake and saltwater crocodile,CH49 3QW,53.378707189609900,-3.124213379167500
tiger snake and diamond python,CH49 4GN,53.394658835453600,-3.091714169404530
diamondback turtle and box turtle,CH49 4LA,53.387642319092600,-3.113667874091530
Kestrel and Jerboa,CH49 4LF,53.387214454947900,-3.113280802338490
flying lizard and hoop snake,CH49 4LG,53.386793487227500,-3.115044054230870
Argus and Marsh harrier,CH49 4NS,53.389044153708900,-3.102096141410740
Philippine hawk-owl and Fox,CH49 4PQ,53.393796502337300,-3.099481964029420
Mink and snake,CH49 4QD,53.389373929372600,-3.121697640790010
Solitaire and indigo snake,CH49 4RU,53.387505492091600,-3.110987864777420
River dolphin and Thicketbird,CH49 4RY,53.390807367621200,-3.112426000000000
Booted eagles and blue racer,CH49 5LL,53.372553000000000,-3.093020969192720
Kangaroo and Elephant,CH49 5NY,53.370001000000000,-3.090918000000000
rock snake and tiger snake,CH49 6PJ,53.386592567867300,-3.109595827677320
rattlesnake and gaboon viper,CH49 7NA,53.371943868082000,-3.087631000000000
Cuscus and thorny devil,CH49 8JQ,53.377654789446200,-3.090377143692120
Old World quail and elapid,CH49 9AS,53.381874866626500,-3.091883163936420
terrapin and Tattler,CH49 9BX,53.379432496099300,-3.089625805589610
Black jay and Black jay,CH61 3UL,53.353966008486300,-3.117852777494730
jew lizard and box turtle,CH61 3UQ,53.355430955948200,-3.104368739852510
Scimitar babbler and hawksbill,CH61 3UZ,53.356553232389300,-3.096719859860920
cycling lizard and Petrel,CH61 3XD,53.355884295695000,-3.095604000000000
Lemming and gopher snake,CH61 3XE,53.355837000000000,-3.096578456327640
Parakeet and flying lizard,CH61 3XF,53.355979000000000,-3.094782000000000
Myna and box turtle,CH61 3XX,53.353786944620400,-3.103289554679360
Condor and Black jay,CH61 4UL,53.356129533920300,-3.110456948425060
alligator and Old World vulture,CH61 4XJ,53.356559068329000,-3.124894000000000
Cuscus and Vulture,CH61 4YH,53.358875550149000,-3.113849120045220
Eagle and Goose,CH61 7UQ,53.353185553683100,-3.094409824138180
snapping turtle and Rabbit,CH61 7UR,53.357006733528400,-3.092359115239630
Diving bird and worm lizard,CH61 7UU,53.355982104729600,-3.090379652737830
caiman and green turtle,CH61 7XL,53.357074730518100,-3.087734000000000
Kangaroo and bushmaster,CH61 9PP,53.350078496127200,-3.093083312430460
agamid and Chicken,CH61 9PR,53.351439099750300,-3.098601687300340
fer-de-lance and Scimitar babbler,CH61 9PW,53.350427062257600,-3.093302555289790
Vole and copperhead,L37 2EB,53.550123000000000,-3.087788000000000
