name,postcode,lat,lon
bicycle lizard and bearded lizard,HD8 8QG,53.573938750900400,-1.662520388369000
perentie and Skunk,HD8 8RE,53.573601777379700,-1.648493901980840
Fish eagle and indigo snake,HD8 8TS,53.568533597884800,-1.655104206247940
sidewinder and Minke whale,HD8 8UT,53.563106000000000,-1.658410938408670
tree snake and Chipmunk,HD8 8XW,53.569896000000000,-1.699910000000000
Pitohui and diamondback terrapin,HD8 8YF,53.553936157095600,-1.694694561990540
Grosbeak and Puffleg,HD8 8YJ,53.558379000000000,-1.649480000000000
massasauga and bandy-bandy,HD8 8YQ,53.560839439055300,-1.667772585743170
coral snake and Marmoset,HD9 1HE,53.570365586884600,-1.785268000000000
tuatara and Fulmarine petrel,HD9 1HF,53.570410311339600,-1.785041278109140
Bronzewing pigeon and horned toad,HD9 1HS,53.570509939961700,-1.785463579477470
sidewinder and Towhee,HD9 1RW,53.550517518449800,-1.770110000000000
Skunk and Marmoset,HD9 1SS,53.564134276827900,-1.769371196909000
Buzzard and Stint,HD9 1UN,53.570833015546400,-1.761437317350970
bearded lizard and mountain devil,HD9 1XA,53.574533793667200,-1.778919324189390
bull snake and Tit-tyrant,HD9 2AE,53.562379000000000,-1.808000000000000
Hawaiian honeycreeper and copperhead,HD9 2AW,53.543189000000000,-1.777030000000000
Night heron and amethystine python,HD9 2DA,53.554037000000000,-1.786558000000000
Recurvebill and Mamo,HD9 2DS,53.566100393072100,-1.782783000000000
blue racer and Tit-tyrant,HD9 2JF,53.537756815318900,-1.775866687107380
Coati and thorn lizard,HD9 2NT,53.560328331470100,-1.813609774744630
Pratincole and diamond python,HD9 2PY,53.563384071432500,-1.807738465147300
Prion and Meadowlark,HD9 2QQ,53.550802277267100,-1.839536391269840
tree snake and Grosbeak,HD9 2RR,53.557427973933400,-1.778359294017810
copperhead and turtle,HD9 2RZ,53.530980741257900,-1.771723560227970
giant tortoise and Peafowl,HD9 2SF,53.551464978669600,-1.796517628570670
racer and Ground sloth,HD9 2TQ,53.556274807099400,-1.819620334229980
monitor and bearded lizard,HD9 3BD,53.568652091317100,-1.797356316512270
bandy-bandy and boomslang,HD9 3HE,53.571087517711700,-1.802493930264000
bandy-bandy and blue racer,HD9 3JA,53.573197449185700,-1.785465094086590
B and Hawaiian honeycreeper,HD9 3TA,53.570123975270900,-1.806907634563140
wall lizard and skink,HD9 7BU,53.573990769975100,-1.749625320248120
boomslang and sand lizard,HD9 7ER,53.574161072165400,-1.749397792353970
Shearwater and cobra,HD9 7HD,53.565831443168800,-1.754973052632240
Vulture and Grackle,HD9 7HY,53.569270394375100,-1.744655143948770
iguana and Skunk,S33 0AB,53.416469427083100,-1.797658265347610
worm lizard and gaboon viper,S33 0DB,53.350550000900700,-1.690034305489720
Old World quail and snapping turtle,S33 7ZJ,53.364408925145600,-1.846983628540300
chameleon and soft-shelled turtle,S35 7DQ,53.490994691307200,-1.577886122608680
Treepie and Mink,S36 1AL,53.482103375123800,-1.598272119647590
hawksbill and tuatara,S36 1AT,53.475037166231200,-1.600583705248200
mamba and Argus,S36 1JN,53.483398249747800,-1.603820480374730
Argus and Darwin's finches,S36 1LP,53.479809647452500,-1.595114409990840
Magpie and Coati,S36 2AT,53.480575000000000,-1.585193000000000
green turtle and chameleon,S36 2GQ,53.479492583457900,-1.589120378975950
Ice seal and Masked owl,S36 2PX,53.475359328784900,-1.581762629822640
Gila monster and thorn lizard,S36 2QN,53.478864670569900,-1.584289697043430
Ground sloth and Marsh harrier,S36 2RX,53.478195000000000,-1.580003965683920
tokay and Towhee,S36 2SY,53.478595819024400,-1.581941770481430
Recurvebill and Duck,S36 4GR,53.490184000000000,-1.640322230525400
sidewinder and jew lizard,S36 4GW,53.493127521444700,-1.645089562341330
Snipe and Meadowlark,S36 6EQ,53.520939491632600,-1.625023660002660
Tit-tyrant and Recurvebill,S36 6GG,53.523045877100000,-1.613556963400000
Moluccan boobook and Crow,S36 6GS,53.552935861488900,-1.670007982646320
puff adder and Meadowlark,S36 6HG,53.526592109669800,-1.624672079161840
B and Thicketbird,S36 6HH,53.524799000000000,-1.617191000000000
Maya and Polecat,S36 7AB,53.533748713400000,-1.635517000000000
Minke whale and agamid,S36 7BX,53.533885375039500,-1.637522313518760
gopher snake and Philippine hawk-owl,S36 7GA,53.542786287303600,-1.644312467135740
slowworm and Eagle,S36 7HE,53.540941003716800,-1.592720955951660
garter snake and bandy-bandy,S36 7JF,53.538141956908600,-1.621733323212800
harlequin snake and Linsang,S36 8WR,53.500433726060100,-1.601807516758440
bicycle lizard and water snake,S36 8ZU,53.517990691969500,-1.602563008073140
Warbler and cycling lizard,S36 9AS,53.521010000000000,-1.639051000000000
Ibex and tokay,S36 9DA,53.512059281842900,-1.633848102645410
Civet and moloch,S36 9FJ,53.499210084374900,-1.632315569231900
Old World warbler and mountain devil,S36 9LN,53.525127925084700,-1.673799000000000
bearded dragon and lizard,S36 9QR,53.527282092411000,-1.650687421563850
king snake and Fox,S36 9QZ,53.528485365299100,-1.650285310184450
fer-de-lance and dugite,S36 9RE,53.526651694059800,-1.653137000000000
Parrotlet and Rabbit,S36 9UY,53.514060786119400,-1.632895889407620
thorny devil and Pitohui,S6 6HW,53.419756150647600,-1.600153644465600
blue racer and Gila monster,S6 6JN,53.446362000000000,-1.621781000000000
Tahr and Eagle,S75 4AT,53.571016629749400,-1.590227544184710
water snake and carpet snake,S75 4FD,53.564017795400000,-1.577175181100000
Fish eagle and Mockingbird,SK13 0AF,53.446337709204200,-1.986726842563060
glass snake and Mamo,SK13 0AG,53.446310785728400,-1.987118309487110
boa constrictor and Tree warbler,SK13 0LA,53.449438535433800,-1.984994315938070
Fulmarine petrel and smooth snake,SK13 1AY,53.462298329161000,-1.970319707486900
gaboon viper and snake,SK13 1BE,53.466560000000000,-1.971251000000000
diamondback terrapin and Stint,SK13 1BG,53.463664790743200,-1.971207435248310
frill-necked lizard and hoop snake,SK13 1EJ,53.461377405484300,-1.956780114664680
mud turtle and puff adder,SK13 1HS,53.470880000000000,-1.959000000000000
Macaw and snake,SK13 1HX,53.479321186708200,-1.912372000000000
Viscacha and bandy-bandy,SK13 1JX,53.472938710393100,-1.963246617760600
blue racer and Warbler,SK13 1LE,53.472822885017200,-1.966772040875750
White ibis and Kite,SK13 1LJ,53.472222320284200,-1.973476552853060
blue tongue and horned toad,SK13 1NN,53.461803406119500,-1.968136119807600
water snake and bandy-bandy,SK13 1NS,53.461660316856800,-1.971012979070960
Scimitar babbler and Stint,SK13 1PJ,53.461141000000000,-1.977535000000000
rattlesnake and Skunk,SK13 1QE,53.459056104855000,-1.984207832959440
tree snake and ringhals,SK13 1QS,53.463088239199300,-1.966237348735690
pit viper and Jerboa,SK13 2BF,53.461402953100000,-1.967489008400000
diamondback and flying lizard,SK13 2EF,53.457033611248600,-1.983545935400710
wall lizard and Kākāriki,SK13 2NR,53.459397962103500,-1.986677668442850
Diving bird and diamond python,SK13 5HN,53.423505968158400,-1.979902000782930
Puffleg and Greenbul,SK13 6AB,53.432107000000000,-1.948047000000000
Grouse and White ibis,SK13 6DA,53.445572807339100,-1.980253063811270
glass snake and puff adder,SK13 6ES,53.447955003626700,-1.981832925704940
bearded dragon and Cloud rat,SK13 6HU,53.447056470200700,-1.984076702278500
Polecat and Flameback,SK13 6HW,53.447543000000000,-1.985868000000000
blindworm and Chipmunk,SK13 6LH,53.439319443547200,-1.956155058333700
River dolphin and cayman,SK13 6TB,53.445142113743800,-1.985613086742600
Civet and Boto,SK13 6TD,53.445204894341800,-1.984483887460350
Boto and harlequin snake,SK13 6XU,53.438560225306800,-1.972323148837350
Siskin and carpet snake,SK13 7BE,53.451765338022100,-1.948206734565880
pit viper and Black jay,SK13 7DN,53.446462431617200,-1.948905735475120
giant tortoise and deaf adder,SK13 7DT,53.448820952987400,-1.958042514371860
mountain devil and wall lizard,SK13 7DX,53.447914912281000,-1.963554143504660
Magpie and turtle,SK13 7GA,53.445938579127100,-1.967515543707820
Kestrel and blue tongue,SK13 7RD,53.446676576906500,-1.945322095947920
blue tongue and Wader,SK13 7RS,53.450969644930300,-1.938254522711050
Masked owl and Condor,SK13 7SL,53.450826609790000,-1.939790614980450
grass snake and Treepie,SK13 8AJ,53.442745836000000,-1.950009406300000
Flameback and Meadowlark,SK13 8EX,53.443401442381000,-1.959643658675730
adder and worm lizard,SK13 8GR,53.434355000000000,-1.951235000000000
Jerboa and Parrotlet,SK13 8NU,53.437247347221500,-1.944671814612270
deaf adder and grass snake,SK13 8NX,53.435654913503400,-1.941573091232020
viper and flying lizard,SK13 8PT,53.443009075047300,-1.944890188977460
Cuscus and Dorcopsis,SK13 8QJ,53.445027562711000,-1.936923149199030
leathery turtle and Condor,SK13 8QY,53.444509287292300,-1.926505528588640
leathery turtle and Grackle,SK13 8RH,53.442138019685200,-1.929324822275710
Perching duck and krait,SK13 8SU,53.437041562991100,-1.929363352781580
hawksbill and Egret,SK13 8SY,53.436359711734100,-1.931562157304090
massasauga and Grosbeak,SK13 8TS,53.441783291743500,-1.938026913178490
blue racer and Black jay,SK13 8UG,53.440021000000000,-1.935741000000000
Thrasher and Crow,SK13 8UN,53.442329775446100,-1.934608704676270
Peafowl and Vole,SK13 9FL,53.442931000000000,-1.949316000000000
monitor and Civet,SK22 1DJ,53.383764291285800,-1.965412636161750
snake and Coati,SK22 1DN,53.383700576559100,-1.962751667960280
fer-de-lance and Viscacha,SK22 2AD,53.377451717400000,-1.946883723500000
thorny devil and Parakeet,SK22 2HN,53.381050584355600,-1.943857388509110
cayman and hoop snake,SK22 2JZ,53.378264899278900,-1.945544629751710
Old World vulture and bushmaster,SK22 2LD,53.378119133906700,-1.941411002803250
horned toad and Philippine hawk-owl,SK22 2LJ,53.386180304743000,-1.922741694953930
horned viper and Tit-tyrant,SK22 2LL,53.373855000000000,-1.918285000000000
Mouse and boa constrictor,SK22 2PD,53.379866026188100,-1.948158279603490
Hawk and Macaw,SK22 4QJ,53.372468269308400,-1.976439000000000
