name,postcode,lat,lon
crocodile and Mockingbird,FK10 1JT,56.115854696334700,-3.788999000000000
Solitaire and Tahr,FK10 1LW,56.114011660975300,-3.798211623326120
snapping turtle and Peafowl,FK10 1PF,56.113490589658000,-3.800053009521530
green turtle and gaboon viper,FK10 1PY,56.114038784310400,-3.784573834728360
White ibis and blue tongue,FK10 1RG,56.120025000000000,-3.818343000000000
dugite and wall lizard,FK10 1RH,56.113002000000000,-3.781116000000000
tree snake and perentie,FK10 1TA,56.118944000000000,-3.816715000000000
loggerhead and sea snake,FK10 2AS,56.118201337487500,-3.792503722981120
Badger and Ice seal,FK10 2BN,56.123133848689500,-3.789467408294730
mamba and Mink,FK10 2BX,56.119812585140100,-3.805270703655650
rock python and hognose snake,FK10 2DP,56.118966874246500,-3.799182792791690
blue racer and Parrotbill,FK10 2DW,56.117997562026000,-3.797866786703660
dukite and harlequin snake,FK10 2HD,56.129404296455900,-3.812397653502320
tiger snake and Kākāriki,FK10 2HQ,56.131159438675800,-3.815263983253750
Night heron and Partridge,FK10 2JS,56.125213352829500,-3.808950614604790
Siskin and massasauga,FK10 2JZ,56.125728948202400,-3.808106032497870
goanna and hoop snake,FK10 2LA,56.124653191317000,-3.807315486005740
Meadowlark and leathery turtle,FK10 2LS,56.120835323953500,-3.796760515671370
Grouse and Bronzewing pigeon,FK10 2NJ,56.120888313975100,-3.795588659971830
Partridge and River dolphin,FK10 2QR,56.135918930037200,-3.839772733548000
leguaan and Buzzard,FK10 2QY,56.136866918153700,-3.842489542789900
bicycle lizard and Gila monster,FK10 2RR,56.131856851850000,-3.834960473818230
Tattler and Minke whale,FK10 2SG,56.134528000000000,-3.840253000000000
carpet snake and sea snake,FK10 2TE,56.134576469574900,-3.830938182322750
black snake and wall lizard,FK10 2TX,56.136068535836000,-3.824233919627040
Puffleg and Grouse,FK10 2UX,56.135975030177900,-3.848913000000000
Minke whale and puff adder,FK10 3BQ,56.124855107755900,-3.794084256631380
chameleon and Lemming,FK10 3DF,56.128268736458400,-3.791684966241020
Dorcopsis and Buzzard,FK10 3EA,56.126934578570700,-3.782661254769530
Lemming and viper,FK10 3EF,56.132564458219600,-3.794137602593910
Marsh harrier and Snipe,FK10 3FF,56.124562000000000,-3.788480000000000
Darwin's finches and Gull,FK10 3FH,56.123642000000000,-3.788743000000000
jew lizard and River dolphin,FK10 3GB,56.133417134929800,-3.773807000000000
Ibex and cerastes,FK10 3GE,56.133554863371800,-3.772845860405590
water snake and Puffleg,FK10 3GP,56.139368903773800,-3.834192364431460
Minke whale and Capuchin,FK10 3HD,56.130753050868800,-3.777093578867290
Masked owl and Condor,FK10 3HN,56.131655514842200,-3.791134492259570
Hawk and boa constrictor,FK10 3HT,56.136596626865300,-3.772535278284660
caiman and gecko,FK10 3LX,56.123343062493600,-3.779341904695990
Mouse and flying dragon,FK10 3NZ,56.127850403762700,-3.771473156693040
alligator and jew lizard,FK10 3PY,56.117123421684700,-3.728615000000000
rattlesnake and elapid,FK10 3RN,56.118823493525900,-3.785535348239300
agama and smooth snake,FK10 4AH,56.062375478363000,-3.709809836265570
Black cockatoo and Eagle,FK10 4AP,56.056817907539200,-3.690663000000000
bearded dragon and diamond snake,FK10 4DJ,56.106421799029200,-3.740916417191920
blind snake and chameleon,FK10 4DR,56.099717994430700,-3.721706495595540
thorn lizard and Scimitar babbler,FK10 4HA,56.106684977143500,-3.746460015479280
blue tongue and skink,FK10 4HW,56.110129382031000,-3.755139532910900
wall lizard and diamond snake,FK10 4HX,56.109564647191100,-3.750610918092330
death adder and Polecat,FK10 4JQ,56.105743259338400,-3.752672552871570
New World blackbird and puff adder,FK10 4LQ,56.100574196767300,-3.750283157886040
Rat and krait,FK10 4NR,56.066706000000000,-3.717000925935100
kabaragoya and Piping shrike,FK10 4PR,56.066229000000000,-3.697563000000000
hognose snake and Bronzewing pigeon,FK10 4QD,56.074260524880700,-3.720410212142800
rat snake and anole,FK10 4QJ,56.079150203177400,-3.720965618285350
glass snake and green turtle,FK10 4QX,56.070894646377900,-3.720774316520250
mountain devil and Treepie,FK10 4RX,56.071381000000000,-3.714241000000000
Black jay and Songlark,FK10 9TB,56.119328949967400,-3.794679527015510
anole and dugite,FK10 9TH,56.119328949967400,-3.794679527015510
Kite and skink,FK11 7AG,56.150058094736800,-3.853343828837680
anole and Buzzard,FK11 7AQ,56.152271851456900,-3.847734943334310
Komodo dragon and Towhee,FK11 7BH,56.151623468503900,-3.853226010859550
copperhead and Shearwater,FK11 7DG,56.149471572458900,-3.858290120869440
Ibex and monitor,FK11 7HX,56.152183577948200,-3.846426612044040
Lemming and diamondback turtle,FK12 5AS,56.150776378419500,-3.801136312426870
Parrotlet and Fulmarine petrel,FK12 5BG,56.153085571011000,-3.805462618438040
Pratincole and Prion,FK12 5BL,56.152145383292200,-3.807076789279660
gavial and mud turtle,FK12 5BS,56.152297012544800,-3.810223376377890
moloch and Bunting,FK12 5ED,56.152922390234500,-3.799578000000000
Chicken and Bunting,FK12 5EP,56.153240374227200,-3.802861645915980
Songlark and krait,FK12 5JB,56.153330238796000,-3.788021450463140
Old World quail and amphisbaena,FK12 5LS,56.154481470425500,-3.800327570217680
king snake and saltwater crocodile,FK12 5LZ,56.152131874788000,-3.795677538419720
saltwater crocodile and water snake,FK12 5NU,56.153303788346200,-3.815100811727460
Thicketbird and grass snake,FK13 6EG,56.155076136090400,-3.745741208734260
Fox and asp,FK13 6HQ,56.149185000000000,-3.742335000000000
jew lizard and Petrel,FK13 6JR,56.142651356809000,-3.739801884099640
Wallaby and Booted eagles,FK13 6JX,56.144382208915300,-3.740684915741770
Egret and hognose snake,FK13 6LB,56.141657682714400,-3.741446975979430
pit viper and Badger,FK13 6NN,56.152298898030100,-3.741960622452910
gaboon viper and rat snake,FK13 6PB,56.152073065384900,-3.736299472916410
harlequin snake and terrapin,FK13 6QH,56.154093142057600,-3.734506868774390
Puffleg and king cobra,FK13 6QQ,56.155869164490800,-3.728323599030400
diamond snake and soft-shelled turtle,FK14 7AE,56.163634557215200,-3.667395889015420
Old World vulture and Duck,FK14 7AN,56.164816080420700,-3.669733954558430
garter snake and Boto,FK14 7AZ,56.167525486771100,-3.668724158048140
deaf adder and Coati,FK14 7BB,56.167549451070800,-3.669611014818770
blindworm and Dolphin,FK14 7BG,56.167963361602200,-3.666795000000000
B and black snake,FK14 7BP,56.170974876947000,-3.664814800220400
Pratincole and boa,FK14 7DP,56.163710986684500,-3.671715116603740
Minke whale and cobra,FK14 7EN,56.160824888217100,-3.671171042516380
Ice seal and Wallaby,FK14 7HQ,56.163275208044300,-3.685932123578260
constrictor and mamba,FK14 7HR,56.164417925519700,-3.677237460698990
Condor and bandy-bandy,FK15 0HD,56.189141602236800,-3.957529975942500
snapping turtle and rock snake,FK15 0HX,56.194073092729900,-3.954543000000000
mamba and Hawk,FK15 0JH,56.215081000000000,-3.921745000000000
blue tongue and Skunk,FK15 0LA,56.186212508045400,-3.963165928068630
Kite and Old World quail,FK15 0LX,56.247333618366800,-3.881316126746550
Black cockatoo and Parrotbill,FK15 0NB,56.231871399109500,-3.898175716855000
Nukupuʻu and Minke whale,FK15 0PA,56.195493442690300,-3.953082512192140
Recurvebill and slowworm,FK15 5BA,56.180327000000000,-3.965516000000000
gopher snake and indigo snake,FK15 9BF,56.190514155567600,-3.968430102336070
iguana and Lemming,FK15 9EZ,56.182524274201100,-3.966796360855140
Diving bird and Partridge,FK15 9FL,56.185836373596900,-3.981501658526160
Prion and box turtle,FK15 9JB,56.190335416349200,-3.979621812291150
Towhee and Cloud rat,FK15 9JE,56.190102388974700,-3.977337414254460
Civet and anaconda,FK15 9JP,56.187065287009500,-3.979002157026110
Siskin and tokay,FK15 9JW,56.188247942258200,-3.979224209308180
mountain devil and Macaw,FK15 9JY,56.192290199823900,-3.971180000000000
Triller and Fulmarine petrel,FK15 9LP,56.246885201188100,-3.917544218438640
Linsang and Tree warbler,FK15 9NA,56.199429002557200,-3.974045315320810
blind snake and Argus,FK15 9NZ,56.170294000000000,-4.027939023265120
Tahr and amphisbaena,FK15 9RE,56.264990487423200,-3.884330446572780
Marsh harrier and cayman,FK2 8JG,56.065039650290700,-3.770836000000000
green turtle and Hawaiian honeycreeper,FK2 8JH,56.067347000000000,-3.768359000000000
Lemming and Egret,FK7 0BU,56.099843257752000,-3.934150624069690
tortoise and goanna,FK7 0DJ,56.099102162958300,-3.934418937139430
mamba and Stint,FK7 0EU,56.096080250366000,-3.931018000000000
kabaragoya and Crow,FK7 0HQ,56.096266000000000,-3.921576000000000
cobra de capello and wall lizard,FK7 0LR,56.089156097728500,-3.930850064608510
Egret and amethystine python,FK7 0QR,56.099289425407500,-3.928881000000000
chameleon and swift,FK7 1SP,56.112891973661700,-3.936992773810820
Dorcopsis and adder,FK7 1SW,56.112891973661700,-3.936992773810820
rat snake and Fox,FK7 1TD,56.112891973661700,-3.936992773810820
Polecat and Francolin,FK7 7AX,56.084728210956100,-3.872367677943700
Cloud rat and elapid,FK7 7BG,56.083842382133600,-3.871426000000000
New World blackbird and Jay,FK7 7DX,56.085671975475200,-3.868797224485150
Logrunners and Snipe,FK7 7EE,56.107323417203400,-3.878643087952160
Rat and Elephant,FK7 7HQ,56.105920939979100,-3.878092327212910
Masked owl and Thrasher,FK7 7JD,56.104657913517800,-3.876052943070930
Moluccan boobook and python,FK7 7JU,56.104694201339000,-3.881345090584630
anaconda and anaconda,FK7 7JZ,56.105760140329700,-3.931038316203660
Pitohui and Buzzard,FK7 7NF,56.099289029006400,-3.842912511233410
Jerboa and Piping shrike,FK7 7PW,56.109633392937600,-3.932181203623170
Bunting and bearded dragon,FK7 7RE,56.108785835331700,-3.930064133464530
blue racer and crocodile,FK7 7SX,56.112712772249400,-3.921430818755380
Chipmunk and galliwasp,FK7 8AW,56.069423000000000,-3.859399000000000
New World blackbird and Vole,FK7 8BA,56.051153077718600,-3.886653532074360
python and Rat,FK7 8DD,56.065933369052700,-3.874428033742010
crocodile and tree snake,FK7 8DQ,56.064913931083900,-3.872322406686630
constrictor and skink,FK7 8DY,56.064832515514500,-3.877089338540110
ringhals and Gila monster,FK7 8EF,56.064774105311600,-3.876203003887250
Mamo and death adder,FK7 8EH,56.084130859307800,-3.915973275171470
diamond python and Gull,FK7 8EN,56.087271908430700,-3.928360872822530
Tattler and River dolphin,FK7 8ES,56.084625526948300,-3.927489299196660
indigo snake and smooth snake,FK7 8HJ,56.089093641120900,-3.910609985136100
Marsh harrier and glass snake,FK7 8JX,56.092616679264800,-3.907681960459560
box turtle and Coati,FK7 8NU,56.087693188455100,-3.908309000000000
mamba and Herring gull,FK7 8NX,56.087670237712700,-3.913159426055130
kabaragoya and blue tongue,FK7 8PX,56.085098667107200,-3.909190675005710
soft-shelled turtle and Wallaby,FK7 9AA,56.105469978182400,-3.940945583412460
grass snake and habu,FK7 9DU,56.099381204602200,-3.946395108040450
Ibex and rock snake,FK7 9EH,56.100718523837700,-3.944790418296690
Schneider python and rock python,FK7 9EW,56.101443328955200,-3.943846151299830
sidewinder and anaconda,FK7 9JX,56.110681675975700,-3.964270951343380
Hawk and Marmoset,FK7 9NN,56.109050459098900,-3.969639736699990
dukite and mud turtle,FK7 9NS,56.110810127113200,-3.947084756182070
Pitohui and water snake,FK7 9NX,56.107932808406800,-3.965337022298670
Bronzewing pigeon and Mole,FK7 9PP,56.110349000000000,-3.969828848126790
Komodo dragon and Lemming,FK7 9QL,56.068558182031500,-3.952038180652210
Snipe and Hawaiian honeycreeper,FK7 9QR,56.064453000000000,-3.975653000000000
perentie and perentie,FK8 1BS,56.120467016621000,-3.941604427872860
Wader and Polecat,FK8 1EJ,56.123761742978100,-3.947776000000000
terrapin and Grouse,FK8 1HN,56.122952117752900,-3.940153033457640
Skunk and lizard,FK8 1LS,56.124606608153800,-3.925161249114660
Fox and Perching duck,FK8 1LX,56.124896412063300,-3.925594039195700
Scimitar babbler and bearded dragon,FK8 1TD,56.127541306202700,-3.957986595314660
snake and Myna,FK8 1UU,56.122810274513700,-3.935448206951510
Komodo dragon and Marsh harrier,FK8 1XZ,56.136652000000000,-3.959971000000000
Mouse and anole,FK8 2HW,56.109652931897500,-3.939531866595830
Towhee and grass snake,FK8 2JE,56.112438353620300,-3.944127196280950
Booted eagles and Parrotlet,FK8 2LF,56.116754365372200,-3.937106475600050
king snake and Triller,FK8 2NU,56.111134000000000,-3.940677706699860
leathery turtle and puff adder,FK8 2QA,56.117487948034900,-3.938462380654160
Grackle and black snake,FK8 2RH,56.119058520669900,-3.944879431455410
king cobra and leguaan,FK9 4BS,56.150318787899600,-3.945106406482610
Old World quail and constrictor,FK9 4BX,56.148286430841300,-3.945196886957040
saltwater crocodile and Stilt,FK9 4EF,56.153561565401300,-3.933742117408740
Mouse and mountain devil,FK9 4JF,56.153183998286800,-3.953172762676070
flying dragon and Fox,FK9 4NE,56.146500126078300,-3.959852307975540
brown snake and Quetzal,FK9 4PA,56.152529591838200,-3.948518727421350
Pitohui and dugite,FK9 4RQ,56.152378000000000,-3.936436000000000
Chickadee and Maya,FK9 4SJ,56.147343099545100,-3.945181412924400
sand viper and sand viper,FK9 4TN,56.145673992058000,-3.942746831230190
Tit-tyrant and turtle,FK9 4TQ,56.151202607012400,-3.928858051658790
sidewinder and Komodo dragon,FK9 4TS,56.128414377635200,-3.961297320113340
Macaw and bandy-bandy,FK9 5BS,56.134311000000000,-3.936796549676230
Bunting and B,FK9 5EZ,56.134355413171100,-3.929285509815640
bearded dragon and Fox,FK9 5GA,56.138273340681600,-3.946477513383650
Vulture and whip snake,FK9 5HG,56.132930120900400,-3.933655549118650
bicycle lizard and Old World quail,FK9 5HS,56.135774960827200,-3.933155219755970
Petrel and Thrasher,FK9 5ND,56.125730316962300,-3.919940170487060
Wallaby and Wallaby,FK9 5PD,56.139557134678900,-3.932250085415230
fer-de-lance and caiman,FK9 5PN,56.134016633981500,-3.912648000000000
Chicken and water snake,FK9 5PP,56.133976488968200,-3.907396747004480
crocodile and Petrel,FK9 5QJ,56.133635806380000,-3.881567782071360
snapping turtle and bearded lizard,FK9 5QT,56.137547764666300,-3.935464641450840
galliwasp and alligator,PH3 1PN,56.267912869437700,-3.717483959070430
White ibis and Nukupuʻu,PH4 1PX,56.262368810801300,-3.783530394581660
