name,postcode,lat,lon
sand viper and snapping turtle,KW10 6RQ,57.977508432151600,-3.972312703054510
Schneider python and Logrunners,KW10 6RS,57.977323928111200,-3.965081557563270
thorn lizard and anole,KW10 6SF,57.985321640549300,-3.948029823394260
sand lizard and Recurvebill,KW10 6SU,57.973417525294200,-3.983484685650860
Chipmunk and Fox,KW10 6TJ,57.973773789777500,-3.979649032678010
milk snake and python,KW9 6PW,58.006973192859900,-3.857339083934330
box turtle and rock python,KW9 6PX,58.008995213770400,-3.848659556155150
Ibex and giant tortoise,KW9 6QD,58.009420823854200,-3.848427625168560
Eagle and Darwin's finches,KW9 6QX,58.013775075112700,-3.851716144476650
