name,postcode,lat,lon
lizard and galliwasp,SA34 0TN,51.885133031156500,-4.642191006033110
Tree warbler and tortoise,SA34 0XA,51.879054000000000,-4.683523000000000
Logrunners and black snake,SA34 0XY,51.926254000000000,-4.632039000000000
diamondback terrapin and gaboon viper,SA36 0DX,51.957066251475900,-4.614528856304910
Perching duck and Flameback,SA37 0EN,52.021321578471800,-4.601751000000000
Siskin and Masked owl,SA41 3TS,51.979291565390400,-4.766975502854450
goanna and Coati,SA41 3XB,52.017545825611300,-4.795646581040630
bearded dragon and Songlark,SA42 0NL,52.027350000000000,-4.806216000000000
Hawaiian honeycreeper and Dorcopsis,SA42 0NT,52.039030874224900,-4.832512156016830
New World blackbird and coral snake,SA42 0PD,52.045079000000000,-4.765410000000000
Perching duck and Nukupuʻu,SA42 0QL,51.996594864821800,-4.812114721901700
Parrotlet and glass snake,SA42 0RQ,52.018517472784400,-4.837351913897170
cobra de capello and blind snake,SA42 0TW,52.016209000000000,-4.834655000000000
bearded dragon and Stilt,SA43 3EZ,52.072614000000000,-4.669663455742360
box turtle and Jackal,SA43 3NP,52.065208731621400,-4.681222148200730
Mamo and Pratincole,SA43 3PA,52.046947349374400,-4.713266023215470
rock snake and coral snake,SA62 5DB,51.870627953555600,-4.952102217154540
Bunting and bicycle lizard,SA62 5DN,51.923625000000000,-4.878968000000000
Gull and tokay,SA62 5PE,51.850975489358500,-4.965366557055640
Solitaire and terrapin,SA62 5QR,51.869797997107700,-4.947543969734980
Grouse and Black cockatoo,SA62 5QT,51.870430000000000,-4.939594000000000
tokay and grass snake,SA62 5RP,51.940095620069200,-4.891256368431220
Francolin and glass snake,SA62 5RQ,51.928965457700000,-4.983660866200000
leguaan and Black jay,SA62 5SP,51.928074427133800,-5.001698039819800
cobra and wall lizard,SA62 5XY,51.954020311639900,-4.943010422425950
adder and gaboon viper,SA63 4TJ,51.905379195128300,-4.869279688563420
wall lizard and Kestrel,SA63 4TT,51.911609591963200,-4.844563419632990
Mouse and Pratincole,SA63 4UB,51.923771851738300,-4.845551008698560
gavial and Boto,SA64 0BA,52.000982507175400,-4.998679455392140
Parrotbill and Treepie,SA64 0DX,52.010289214571900,-4.991679779766550
Parrotlet and crocodile,SA64 0ER,52.002707043972900,-5.000179130872850
dukite and Mole,SA64 0EX,52.003229559253700,-5.002938000000000
hoop snake and snapping turtle,SA64 0JU,51.995072334820300,-5.002611302288450
cobra and Jackal,SA65 9AA,51.995776149262300,-4.977744551230330
diamond python and puff adder,SA65 9DB,51.995085736051100,-4.981923790455890
Magpie and leguaan,SA65 9DF,51.996923751040000,-4.982148010308020
mud turtle and death adder,SA65 9DL,51.996550138329400,-4.985532484414560
tokay and Gila monster,SA65 9ED,51.998791545388000,-4.977289139260150
carpet snake and Coati,SA65 9LH,51.993153318350500,-4.973345492490380
Siskin and White ibis,SA65 9LN,51.991135867033600,-4.973459395205480
Hawaiian honeycreeper and Vole,SA65 9NX,51.997474711219400,-4.978148752609380
Macaw and sand lizard,SA65 9SD,51.970575088911200,-4.878032189818450
Guillemot and Civet,SA65 9TB,51.980056000000000,-4.932280000000000
Stint and milk snake,SA65 9TT,51.957600000000000,-4.862549192180310
taipan and Coati,SA65 9TY,51.986550784325100,-4.814310854212600
Chipmunk and swift,SA66 7JR,51.915142000000000,-4.740544000000000
lizard and Skunk,SA66 7LQ,51.909285937047400,-4.796329608656490
cayman and Fulmarine petrel,SA66 7LT,51.859188994423600,-4.753814851608030
brown snake and Parakeet,SA66 7RS,51.916187017201800,-4.699582632216570
Capuchin and mud turtle,SA66 7XS,51.909986398839900,-4.769006892982500
