name,id,postcode,lat,lon
blue tongue and Grouse,1415209,CO3 4LS,51.880900747712600,0.859021152785782
Flameback and jew lizard,1005767,IP7 5RR,52.032102292077100,0.947501653584964
leathery turtle and Kangaroo,2650797,CO1 2ZR,51.886942000000000,0.913515000000000
Jerboa and Stint,1415312,CO3 4RY,51.876118699098700,0.869993183053582
Schneider python and rattlesnake,1414726,CO4 0BA,51.897207082889400,0.918656348424047
Condor and American sparrow,1016675,IP2 9PB,52.047285590218400,1.141845007807600
Linsang and agama,1016993,IP2 0QJ,52.048159786748800,1.119792403969610
American sparrow and Wader,1007901,IP4 4AA,52.061726436926100,1.172830142515000
White ibis and mud turtle,2650867,CO2 7WS,51.887788000000000,0.898948000000000
mamba and Boto,1004679,IP9 2JP,52.003269000000000,1.057213000000000
River dolphin and cobra,1414072,CO4 9HT,51.920060005493000,0.926975225884362
bushmaster and Old World quail,1415803,CO2 9QA,51.868310926244200,0.890241646534510
Parrotlet and boomslang,1007870,IP4 2DD,52.061309163660600,1.160923096488520
taipan and cobra de capello,1411129,CO7 8AG,51.852809314288100,0.999957097774971
Philippine hawk-owl and Mamo,1011243,IP3 0DW,52.050669584880400,1.166269375377700
Chickadee and cayman,1410755,CO7 9QJ,51.866476384728600,0.961787736832024
Ibex and cerastes,1420214,CO11 1TR,51.965236059463000,1.065381947706340
Piping shrike and Viscacha,1422084,CO1 2RP,51.890342910246500,0.908574575982739
water snake and blind snake,1761906,CO1 2ZJ,51.883719088185600,0.915645702904487
galliwasp and Marsh harrier,1415978,CO2 8UD,51.863186724968900,0.910206217951671
Herring gull and crocodile,1011200,IP3 0BQ,52.052294949835700,1.164356566234480
thorny devil and Peafowl,2624174,CO16 9FB,51.850538000000000,1.118531000000000
Greenbul and bicycle lizard,1017259,IP2 0AN,52.055896837922300,1.132128000000000
Kangaroo and box turtle,1410952,CO7 8SZ,51.884333000000000,1.058970000000000
hognose snake and Fulmarine petrel,1414188,CO4 5JS,51.924492334222900,0.919074236154688
tokay and perentie,1412192,CO6 4PY,51.992870847129400,0.833301021824767
Marsh harrier and Marsh harrier,1024884,IP1 2BE,52.053522289508900,1.145740405353480
Mouse and Old World quail,1414556,CO4 3EH,51.892535247392800,0.920272179181759
Macaw and Nukupuʻu,1416106,CO2 9AT,51.874739287657800,0.874918125091387
glass snake and gecko,2120808,IP1 9FE,52.052850000000000,1.146700000000000
amphisbaena and puff adder,1005154,IP8 3EX,52.034103054155800,1.077049197563860
turtle and blindworm,1421643,CO10 0PA,52.004026140044300,0.767369857258014
python and bull snake,1416172,CO2 8FA,51.875799066512300,0.926742875110800
cerastes and Snipe,2596484,CO4 6AU,51.918284000000000,0.897162000000000
Fish eagle and Macaw,1414439,CO4 3YY,51.884382659416700,0.935977051472533
rat snake and diamond snake,1004797,IP9 2QB,51.983592615700800,1.156216564475890
gopher snake and snapping turtle,1410447,CO8 5ED,51.971760718438900,0.776053740801695
Chipmunk and Magpie,1016906,IP2 8TE,52.046341159159600,1.157648852430860
Puffleg and garter snake,1414863,CO4 0NX,51.905464434018600,0.927654199205542
black snake and Gull,1416003,CO2 8WS,51.862114399366700,0.899855000000000
soft-shelled turtle and diamondback,1416068,CO2 8AA,51.876850736839500,0.919531296870546
swift and water snake,1422452,CO1 1DA,51.889526000000000,0.896894000000000
Hawk and mountain devil,1415108,CO3 9XE,51.876425788469800,0.854421589421904
Prion and bearded lizard,1414699,CO4 3PW,51.895884352978800,0.933863421737863
Tree warbler and blue racer,1006070,IP7 5JN,52.040986515515900,0.967964613364963
Chicken and blue racer,1411773,CO7 6AE,51.956303694174100,0.999135494475370
Mouse and Partridge,1415410,CO3 3PY,51.887976253790600,0.883957000000000
Vole and rock python,1411821,CO7 6DX,51.946308014325800,0.976259654877021
Treepie and Greenbul,1761950,CO10 0RJ,52.056876408699800,0.781607215499813
jew lizard and Thicketbird,1422405,CO1 2JU,51.884956802203200,0.909621871299140
moloch and cerastes,1411736,CO6 4SP,51.981427808931100,0.926068055429634
Bronzewing pigeon and Mole,1415686,CO3 0YH,51.881424456099300,0.846702177720019
Badger and Linsang,1416249,CO2 7AR,51.887147000000000,0.897468000000000
horned viper and worm lizard,1422610,CO1 1TP,51.890321026996500,0.901450984467567
Logrunners and Gila monster,1413042,CO5 9HL,51.858061270253300,0.776671521009297
Grackle and snake,1411152,CO7 8BQ,51.850396000000000,0.980307000000000
kabaragoya and swift,1420195,CO11 1SR,51.964316997043500,1.062683922984940
rattlesnake and bushmaster,1412188,CO6 4PT,51.997770369671100,0.846053046687380
tree snake and boa,1414175,CO4 5JA,51.926811000000000,0.909769000000000
Marmoset and whip snake,1414196,CO4 5LB,51.913496411061300,0.900037013656494
Stilt and Wader,1005732,IP7 5PU,52.039718428666900,1.011529957496100
Argus and Komodo dragon,1024543,IP1 4HZ,52.068719117379700,1.131675369153910
cobra de capello and Jay,1416799,CO16 9JU,51.858135125701000,1.113012118915370
harlequin snake and galliwasp,1023930,IP1 9LW,52.052638000000000,1.146583000000000
Macaw and gecko,1008007,IP4 2RD,52.059810247214000,1.171512379814780
agama and mountain devil,1411103,CO7 7YF,51.883151258927100,0.990903873002620
Buzzard and lizard,2650890,CO4 6EF,51.918879000000000,0.887587000000000
snake and Marsh harrier,1024561,IP1 4LL,52.071135597176100,1.146628887608800
asp and anole,1422136,CO1 2TQ,51.890414542277700,0.917663648559232
elapid and Kākāriki,1005178,IP8 3JD,52.029456440491500,1.080710532667510
Grackle and sand lizard,1414110,CO4 9RJ,51.911778105709600,0.920065000000000
Parrotbill and Vulture,1420511,CO11 1LE,51.943122124485500,1.084232259226730
cayman and Minke whale,1420387,CO11 1AU,51.945677242954700,1.065619068511440
Mockingbird and Quetzal,1411568,CO7 6SA,51.972459989752600,1.003578690711250
jew lizard and Macaw,1762108,CO2 7FW,51.881337462831600,0.906496100650224
Darwin's finches and Argus,1412314,CO6 3NX,51.920264257451900,0.816943751179318
carpet snake and bearded dragon,1011087,IP3 8ET,52.050743076506400,1.174896099225760
swift and Fulmarine petrel,1016548,IP2 9DL,52.038957946428000,1.138445895571440
Chicken and elapid,1420025,CO11 1LY,51.941302475885300,1.090510302197640
thorny devil and anaconda,1004325,IP9 2RP,51.977555767228800,1.157627022697920
cobra and python,1416157,CO2 8EB,51.867021747807600,0.928889390450804
Meadowlark and blindworm,1416414,CO2 7QY,51.879109631483800,0.903489677691418
death adder and frilled lizard,1416535,CO2 0BD,51.860331880405800,0.905635213408542
Parrotlet and milk snake,1762230,CO4 5YX,51.925530000000000,0.898602000000000
diamond snake and king snake,1411011,CO7 9DS,51.854940120563900,0.960608514756293
Elephant and Zebra,1412137,CO6 3DJ,51.931755000000000,0.851445000000000
Old World vulture and Treepie,1005174,IP8 3HY,52.034851000000000,1.084946000000000
thorn lizard and B,1416361,CO2 7LB,51.874776059358200,0.883333316065081
goanna and Kangaroo,1410878,CO7 8QE,51.854927130168400,1.058426486524300
diamond snake and galliwasp,1415535,CO3 0NZ,51.887563000000000,0.836492268715826
snake and Tattler,1761891,CO1 1LY,51.896201918972100,0.902571390229608
taipan and Crow,1410792,CO7 9SJ,51.866638264454900,0.952849395211884
Komodo dragon and Boto,1416280,CO2 7EE,51.886961141420400,0.903850592650920
constrictor and agama,1414956,CO3 8ZD,51.877554972884300,0.831897836163395
pit viper and Black jay,1412270,CO6 3JQ,51.915022999776400,0.853059871665731
Flameback and Tahr,1419992,CO11 2NZ,51.900815000000000,1.088034000000000
dukite and anaconda,1422508,CO1 1HZ,51.889444564991500,0.896874193755328
viper and bull snake,1414421,CO4 3YQ,51.888768462454100,0.937542087014684
Ice seal and Partridge,1415299,CO3 4RE,51.875848748198300,0.867418656495332
Treepie and Kite,1416056,CO2 7UY,51.880353993548500,0.884722148759379
Goose and cayman,1008204,IP4 1JL,52.054104227327700,1.159947294438150
Kangaroo and python,1016951,IP2 0NG,52.050695614478200,1.125235376966300
bearded lizard and Kākāriki,1016762,IP2 8HJ,52.047318094775600,1.156098628205660
Vole and Buzzard,1017292,IP2 0DU,52.057105575865900,1.114813555437600
loggerhead and Cloud rat,1422566,CO1 1QP,51.891934220812400,0.895842476339225
Moluccan boobook and Fox,1415296,CO3 4RA,51.877848835609300,0.872065093723994
bicycle lizard and hognose snake,1420175,CO11 1RQ,51.959115865229600,1.062096258511210
Tit-tyrant and racer,2120794,IP1 9DW,52.052652000000000,1.146613000000000
Fulmarine petrel and Duck,1411463,CO7 6JJ,51.970192361159400,0.976372249775934
Pheasant and Kestrel,1004348,IP9 2ST,51.972122160276100,1.119572024824530
taipan and Guillemot,1411268,CO7 7BL,51.896105689879000,0.964129476396178
hawksbill and jew lizard,1410669,CO7 9LJ,51.864181654733500,0.961840287780402
Badger and Mockingbird,1024937,IP1 2EQ,52.057486810449300,1.140416508663970
lizard and Vole,1415850,CO2 8PF,51.865284154549300,0.905765671768562
tiger snake and hognose snake,1017099,IP2 8AY,52.049587804435000,1.147914577006000
Capuchin and Parrotlet,1415510,CO3 3SZ,51.888087112793100,0.867863669598624
Minke whale and puff adder,1414200,CO4 5LG,51.914599086463500,0.893607432700423
American sparrow and terrapin,1421195,CO10 5QG,52.035207034484100,0.846535634718765
Polecat and boa constrictor,1004352,IP9 2SY,51.973677000000000,1.121340000000000
tuatara and Treepie,1410943,CO7 8SN,51.889757849506300,1.066475530048270
bull snake and black snake,1006084,IP7 5LE,52.020179799609400,0.972067399061644
Grackle and cayman,1007959,IP4 2LJ,52.057018027829100,1.168323497412080
pit viper and grass snake,1761902,CO1 2FT,51.883466403692000,0.918942839443345
Moluccan boobook and amethystine python,1422366,CO1 2GS,51.878682017502400,0.921117664066642
goanna and American sparrow,1412409,CO6 3SR,51.889519000000000,0.916094000000000
cobra and Francolin,1412124,CO6 4LX,51.964561000000000,0.846335000000000
Civet and smooth snake,1024676,IP1 3EW,52.059880426755100,1.146771066260210
giant tortoise and pit viper,1016731,IP2 8DZ,52.047070624538300,1.154257832035350
Minke whale and Linsang,1414427,CO4 3BE,51.887367778911000,0.929878391243017
elapid and Songlark,1411073,CO7 7UA,51.884033006328800,1.041378706131300
sea snake and Minke whale,1005760,IP7 5RF,52.003448737312600,0.937792594656031
bandy-bandy and gaboon viper,1412249,CO6 3HL,51.912210715144600,0.848867934910623
Songlark and indigo snake,1005766,IP7 5RQ,52.006408938057600,0.924375579183833
leguaan and Ground sloth,1005276,IP8 3PS,52.049423196985400,1.040204686284120
Black jay and cycling lizard,1414355,CO4 3TB,51.888911760934400,0.946911793618372
Mink and sea snake,1414231,CO4 5NN,51.943744985173100,0.932199529394176
Towhee and gavial,1024929,IP1 2EB,52.053681592079400,1.142469101763350
Warbler and rat snake,1007874,IP4 2DJ,52.058649995847500,1.161814932659280
Buzzard and rattlesnake,1411845,CO6 4UH,52.001245510300400,0.849246045963692
Black cockatoo and Treepie,1006051,IP7 5HP,52.043310170703000,0.960330299718034
iguana and king cobra,1415906,CO3 0FZ,51.885558215134900,0.845350287487329
blue tongue and monitor,1016792,IP2 8LH,52.038780484724200,1.151486169766730
chuckwalla and Cuscus,1414465,CO4 5BG,51.907386605571300,0.873048595213004
Towhee and swift,1414865,CO4 0NZ,51.908775064928900,0.930865086744967
Wader and fer-de-lance,1416562,CO2 0DW,51.856256512416800,0.911138568575430
Kākāriki and Marsh harrier,1410970,CO7 9AN,51.861947878395100,0.955897581637676
bull snake and Fish eagle,2639748,CO5 7DH,51.852382000000000,0.951974000000000
tuatara and soft-shelled turtle,1024815,IP1 3ST,52.067232894932900,1.156015124313250
black snake and whip snake,1422289,CO1 2AS,51.881171851309000,0.912835982169218
Ice seal and Marsh harrier,1414094,CO4 9QQ,51.923251641838800,0.923764707274449
giant tortoise and sea snake,1004715,IP9 2NJ,52.001467174719800,1.112520569384410
Scimitar babbler and boa constrictor,1420155,CO11 1QQ,51.958626696613200,1.062921806424420
Vulture and gavial,1412121,CO6 4LS,51.969447000000000,0.847737000000000
Elephant and whip snake,1415867,CO2 8QE,51.870383724917900,0.906850041212597
Tahr and gaboon viper,1415594,CO3 0SA,51.881975937998200,0.842493639667110
Lemming and cobra,1412214,CO6 4RB,51.991293865721900,0.888194312376208
massasauga and leathery turtle,1419978,CO11 2NE,51.930382512808400,1.048514365699950
Rat and turtle,1017117,IP2 8DE,52.050424098963900,1.153633485652500
Cloud rat and cayman,1011048,IP3 8BD,52.051327547617300,1.167048000000000
milk snake and Zebra,1414912,CO4 3AL,51.889768634990300,0.926284609426875
B and Linsang,1415473,CO3 3QW,51.889355671333500,0.877784425513993
giant tortoise and saltwater crocodile,1024320,IP1 9EP,52.052638000000000,1.146583000000000
Mink and rat snake,1420133,CO11 1PE,51.968320930480400,1.083968409334260
king cobra and hawksbill,1017067,IP2 0UB,52.061526953094700,1.126488054730820
Zebra and Pheasant,1411813,CO7 6DN,51.954521106584600,0.981869360340459
Pitohui and Thrasher,1416508,CO2 7RQ,51.879407261739300,0.910731037976540
crocodile and Black jay,1422442,CO1 1BB,51.889788553488100,0.896053304649770
rock python and coral snake,1016911,IP2 9AA,52.050349027503100,1.141301487904920
Pitohui and Badger,2626986,IP9 2FG,51.990961000000000,1.159707000000000
Grouse and leathery turtle,1420096,CO11 2UG,51.931788981298800,1.156811472448580
sand viper and dugite,1008218,IP4 1LN,52.053350810374800,1.162884807669200
king snake and massasauga,1415298,CO3 4RD,51.876273047512600,0.867721742902602
perentie and Fish eagle,1416301,CO2 8JR,51.881883597556600,0.925103742223791
Perching duck and leathery turtle,1024825,IP1 1RJ,52.056090016723200,1.150459000000000
Polecat and grass snake,1420007,CO11 2QB,51.916536132544700,1.034093493251300
slowworm and cayman,1416534,CO2 0BB,51.859475258733200,0.905725241123409
Recurvebill and jew lizard,1411159,CO7 8BZ,51.856553175684000,0.994570783841910
Siskin and harlequin snake,1016774,IP2 8JJ,52.047944530756500,1.155880232121360
python and Logrunners,1414611,CO4 3JB,51.902055136843900,0.941738720714560
Dolphin and grass snake,1024612,IP1 5AF,52.063392000000000,1.120650000000000
bull snake and hognose snake,1410978,CO7 9AX,51.858406501546500,0.958671986808071
Kākāriki and Francolin,1783065,IP1 9TA,52.052638000000000,1.146583000000000
Herring gull and Goose,1005516,IP8 3AQ,52.060549884499400,1.095384663165380
adder and garter snake,1024963,IP1 2HW,52.058386159338400,1.141092428904640
copperhead and Parakeet,1411009,CO7 9DQ,51.854350283487100,0.960816678033715
tokay and gaboon viper,1024600,IP1 4QA,52.063949000000000,1.132579575746100
Macaw and terrapin,1422532,CO1 1LJ,51.888377632626900,0.902447000000000
python and Towhee,1412275,CO6 3JX,51.912423000000000,0.858348000000000
racer and viper,1005962,IP7 5AG,52.042134973058900,0.954841745953342
blindworm and Diving bird,1004721,IP9 2NT,52.002745015143900,1.110452597046090
Tree warbler and jew lizard,1412307,CO6 3NP,51.927600085281900,0.807278707239027
snapping turtle and frilled lizard,1024752,IP1 3PE,52.062613700212400,1.146467200367080
Fulmarine petrel and Meadowlark,1410730,CO7 9PD,51.862957562663600,0.957590762195381
bull snake and death adder,1414708,CO4 3QG,51.889201513690100,0.936407557896134
Condor and green turtle,1011049,IP3 8BE,52.051495263081300,1.171681685178720
White ibis and galliwasp,1414734,CO4 0BS,51.894309993061900,0.923047471104751
pit viper and deaf adder,1004926,IP8 3UD,52.031929482834300,1.122030069953350
boa and Moluccan boobook,1421664,CO10 0QD,52.029762000000000,0.769820000000000
anole and rat snake,1414958,CO3 9AA,51.890439953135100,0.853216947977809
snapping turtle and Capuchin,1422395,CO1 2JF,51.883773802891500,0.918526810322559
goanna and Fulmarine petrel,1417354,CO16 0AB,51.863460000000000,1.150526000000000
Snipe and Komodo dragon,1415893,CO2 9RQ,51.867273000000000,0.893749000000000
moloch and tokay,1415128,CO3 4AU,51.896904272304200,0.866244836950065
Jay and blue tongue,1421045,CO10 5EP,52.056002432430200,0.862373839924517
flying lizard and goanna,1411829,CO6 4SX,51.985811507166100,0.948975105993281
slowworm and habu,1416355,CO2 7JT,51.875860885554200,0.880903538978037
viper and Armadillo,1421668,CO10 0QH,52.034716816331200,0.788469490016630
saltwater crocodile and Prion,1420411,CO11 1DD,51.944147049116300,1.064976200971720
fer-de-lance and tortoise,1417394,CO16 0DL,51.887467000000000,1.100385344076590
whip snake and Chickadee,1024656,IP1 3DB,52.058460849373600,1.156461440223780
Pratincole and Magpie,1005141,IP8 3ED,52.067973743019600,1.044515329487070
tree snake and tortoise,1415564,CO3 0QP,51.879608312677600,0.839612316784637
Piping shrike and Parrotbill,1422293,CO1 2AX,51.878040173463000,0.915452491032725
ringhals and goanna,1016535,IP2 9BU,52.040181204732500,1.141477706140420
Boto and Flameback,1011191,IP3 0BB,52.048242477729000,1.163880424478940
box turtle and box turtle,1411082,CO7 7UN,51.887201611835200,1.047871642343460
Fish eagle and frill-necked lizard,1411295,CO7 7EG,51.881926351319500,0.989558183011819
fer-de-lance and Wader,1414305,CO4 5SH,51.955598912088600,0.920251143434121
Stint and asp,1005125,IP8 3DG,52.061639083649400,1.094321897447270
perentie and Magpie,1005529,IP7 6LH,52.062074763480500,0.951927010880726
bearded dragon and sidewinder,1416400,CO2 7QE,51.873321660952500,0.900050889652658
Chipmunk and Old World warbler,1415582,CO3 0RL,51.883268069054400,0.837401595373542
slowworm and bull snake,1415123,CO3 9XZ,51.881551782572100,0.851840040570809
tuatara and Civet,1005182,IP8 3JH,52.014888073490700,1.067217330318010
Logrunners and boomslang,1416147,CO2 8DP,51.865287844090100,0.927730744463346
soft-shelled turtle and Pitohui,1762027,CO11 1FG,51.968888000000000,1.075737000000000
dugite and Booted eagles,1411193,CO7 8GA,51.853355380817300,1.066627353667250
Skunk and diamondback,1413973,CO4 5XH,51.907289477739800,0.903737374461297
smooth snake and Peafowl,2626927,IP2 9WJ,52.046498000000000,1.126431000000000
slowworm and Crow,1410972,CO7 9AQ,51.861630367828500,0.959580874715249
Old World vulture and agamid,1422396,CO1 2JG,51.883103986538100,0.917974754103272
tuatara and Duck,1417413,CO16 0HD,51.855166000000000,1.164964000000000
Pratincole and puff adder,1411770,CO7 6AA,51.958622400324100,0.993904078897714
Tattler and New World blackbird,1010926,IP3 0NL,52.036028946166000,1.166546530945350
Jerboa and Snipe,1411395,CO7 7PJ,51.912265748503000,0.954185627947774
gavial and python,1414119,CO4 9RW,51.911485952501200,0.921313118297956
Kite and Eagle,1415780,CO2 9NX,51.862334375805600,0.878339270220052
Mockingbird and box turtle,1411732,CO6 4SG,51.980132214338400,0.899928247048520
gavial and habu,1005863,IP7 6DP,52.061588166308600,0.933479000000000
Goose and Bunting,1414589,CO4 3GF,51.892644472883100,0.951560528182649
Jay and leathery turtle,1017070,IP2 0UG,52.059736000000000,1.128960000000000
Cuscus and black snake,1414204,CO4 5LN,51.917029388928900,0.902649961903811
Tattler and Duck,1016374,IP2 9YB,52.033775486798000,1.130412365196240
Treepie and green turtle,1005281,IP8 3PY,52.038291611330600,1.047061467757260
Old World warbler and cobra,1007971,IP4 2NJ,52.058012125852800,1.163797918969830
sidewinder and sand lizard,1008021,IP4 2SA,52.062440837204100,1.164329991556350
sidewinder and mamba,1414975,CO3 9AX,51.887087980158100,0.849400154377329
snapping turtle and puff adder,2634388,CO11 9AR,51.945243000000000,1.062795000000000
puff adder and diamondback terrapin,1419981,CO11 2NH,51.933178832312600,1.073772669829620
amethystine python and tuatara,1415071,CO3 9FF,51.882088637836200,0.855289111602565
agamid and Stint,1004436,IP9 2UF,52.006078492608400,1.053906811865050
Kākāriki and blind snake,1005294,IP8 3QQ,52.031204129625600,1.031400241659870
Songlark and B,1417048,CO16 0LJ,51.858514808302200,1.167480043517760
Eagle and Polecat,1411559,CO7 6RN,51.977224589848200,1.022276772470570
Pitohui and horned toad,1004331,IP9 2RW,51.985626140567800,1.157860010700240
thorny devil and lizard,1007948,IP4 2HX,52.059527239788700,1.164313602039920
viper and Diving bird,1762288,CO7 8FA,51.858363000000000,1.060199000000000
amethystine python and Night heron,1006060,IP7 5HZ,52.040534547334900,0.963413610588946
Moluccan boobook and diamondback turtle,1011034,IP3 8AJ,52.052745924600000,1.166985236541960
snapping turtle and Triller,2639737,CO4 6BW,51.918366000000000,0.900033000000000
boa constrictor and Gull,1411347,CO7 7JQ,51.881952162688800,1.017419004371510
Hawaiian honeycreeper and bandy-bandy,1412059,CO6 4EP,51.929775811747700,0.876991000000000
anaconda and sidewinder,1422170,CO1 2XL,51.887381942742900,0.926420178511613
sand viper and Jay,1024548,IP1 4JJ,52.074641881251200,1.140614037982800
smooth snake and deaf adder,1422565,CO1 1QF,51.890465000000000,0.896126000000000
Magpie and diamondback,2650855,CO16 0FD,51.891859000000000,1.107248000000000
Lemming and grass snake,1413965,CO4 5WP,51.904153110734700,0.902182812131762
diamond python and milk snake,1412229,CO6 3EL,51.904677318621300,0.850222971411024
fer-de-lance and Tree warbler,1762225,CO4 5XU,51.903166684853500,0.874960010396876
Chicken and Perching duck,1415967,CO2 8TJ,51.875325961772700,0.920812846889595
Mockingbird and monitor,1413752,CO4 9TU,51.913928362018000,0.915669179093297
thorn lizard and hoop snake,1784543,IP4 2GG,52.062264147712300,1.168198871952440
New World blackbird and White ibis,1005072,IP8 4JL,52.070482087434100,1.063278925531980
death adder and Hawk,1416214,CO2 8HX,51.874684754144200,0.930729000000000
Ground sloth and Greenbul,1005324,IP8 3SD,52.039182855767700,1.103839036750880
Tree warbler and swift,1004342,IP9 2SJ,51.968887425788600,1.129277970080990
Jackal and chameleon,1016355,IP2 9UQ,52.038314763569300,1.127127501970780
fer-de-lance and Piping shrike,1421070,CO10 5JB,52.022951000000000,0.875394000000000
horned toad and Marsh harrier,1411804,CO7 6BX,51.946287717840000,0.996545794408278
boomslang and Jay,1415074,CO3 9FP,51.882345865946400,0.856177359425535
Boto and Partridge,1416340,CO2 7HW,51.878975444171400,0.883138000000000
whip snake and Parrotbill,1414240,CO4 5NZ,51.945509938494600,0.932110964175803
Wader and tiger snake,1016741,IP2 8EP,52.047392642345400,1.156672773143240
bandy-bandy and Triller,1005845,IP7 6BP,52.050998600862400,0.960371966251017
Condor and galliwasp,1421675,CO10 0QS,52.030658641843000,0.795769453610128
mud turtle and Gull,1414107,CO4 9RF,51.911425630779800,0.926995100428764
Towhee and worm lizard,1414294,CO4 5RT,51.946559000000000,0.921090000000000
anaconda and blindworm,1420078,CO11 2TH,51.938946302633000,1.168404000000000
black snake and Jerboa,1415460,CO3 0LL,51.873340744857800,0.832490159957945
whip snake and blue tongue,1421810,CO10 0XY,52.053309080707000,0.776148613518843
diamond python and Buzzard,1016684,IP2 9PR,52.042427430406000,1.116519655598970
Skunk and blindworm,2650870,CO3 0BH,51.875334000000000,0.836174000000000
Moluccan boobook and Magpie,1421183,CO10 5PR,52.057189407743100,0.845307568655628
Marsh harrier and rattlesnake,1761892,CO1 1QD,51.897036865984600,0.910998678076255
Tattler and Vulture,1414614,CO4 3JF,51.895786613456400,0.941736064493097
monitor and crocodile,1413332,CO5 7ET,51.854816967097600,0.949457000000000
turtle and Egret,1007882,IP4 2DZ,52.058799620592500,1.157579635608140
giant tortoise and Mamo,1421686,CO10 0RG,52.053301845456000,0.771874002603699
thorn lizard and Buzzard,1415488,CO3 3RS,51.891133707777500,0.869060660258559
hognose snake and Viscacha,1008135,IP4 1AQ,52.054203429373800,1.155913114892790
galliwasp and Jerboa,1415698,CO3 0YZ,51.885248487190100,0.845141785289011
blindworm and Fulmarine petrel,1004775,IP9 2NY,51.977034000000000,1.090931000000000
bull snake and Perching duck,1023825,IP1 9FD,52.052638000000000,1.146583000000000
Parakeet and Moluccan boobook,1421926,CO10 0BY,52.066458260690200,0.768457382092750
Fulmarine petrel and Elephant,1415626,CO2 9DB,51.871641733831700,0.868443968477650
python and amphisbaena,1411119,CO7 9FH,51.853761000000000,0.961068000000000
Stilt and Parrotbill,1419996,CO11 2PH,51.904437401581400,1.085331188722810
Old World vulture and Dorcopsis,1421670,CO10 0QL,52.032169017067400,0.791999818149584
Diving bird and Prion,1762132,CO2 7UA,51.877415783510200,0.892788000000000
anole and slowworm,1416144,CO2 8DJ,51.866532385129400,0.927593694443788
harlequin snake and B,1415394,CO3 3NX,51.883691459703300,0.881753238271802
Petrel and cayman,1016827,IP2 8NH,52.033153000000000,1.149710545089680
taipan and boa,1005786,IP7 5SS,52.044308667451700,0.962467424104449
Prion and Night heron,1783089,IP1 9XJ,52.052638000000000,1.146583000000000
Guillemot and elapid,1416385,CO2 7PH,51.876340877029000,0.905258299476745
Kangaroo and Bronzewing pigeon,1411102,CO7 7YE,51.884301260540400,0.989890253101989
Old World quail and Marsh harrier,1024659,IP1 3DJ,52.058812453480700,1.152065291314150
Parakeet and saltwater crocodile,1410486,CO8 5JH,51.974175000000000,0.778970000000000
Mink and Stint,1415415,CO3 3QF,51.887673725027500,0.880729093603002
thorn lizard and New World blackbird,2650888,CO4 6EA,51.917056000000000,0.884561000000000
green turtle and Jackal,1421051,CO10 5EY,52.060185633840200,0.852311634093580
whip snake and mud turtle,1004425,IP9 2TJ,51.970616783180400,1.128845185515460
Darwin's finches and Snipe,1414643,CO4 3JW,51.894635482601700,0.937098000000000
gaboon viper and Wallaby,1415959,CO2 8SY,51.875867249276500,0.913495550111985
hognose snake and Tit-tyrant,1007997,IP4 2QJ,52.059918000000000,1.169208274918700
Pitohui and boa,1414764,CO4 0EN,51.898686665594500,0.921005654032907
puff adder and gecko,2650827,CO11 2FU,51.935866000000000,1.045685000000000
River dolphin and Stilt,1005229,IP8 3JY,52.029834992466300,1.092342984018000
Scimitar babbler and cobra,1414152,CO4 5GX,51.906747970370500,0.896519494079001
Jackal and python,1011276,IP3 0HD,52.037745377068300,1.174280651981800
puff adder and diamond python,1420169,CO11 1RG,51.957381008932600,1.057217740594070
Mole and Old World vulture,1016633,IP2 9JY,52.039353583368500,1.120855947944150
Booted eagles and diamondback turtle,1417380,CO16 0BS,51.881336785147100,1.119571500790280
anole and Meadowlark,1411601,CO7 6TU,51.968237932249500,1.030393581333980
Polecat and asp,1410542,CO8 5LJ,51.980232225832700,0.793544575437926
