name,id,postcode,lat,lon
Greenbul and king cobra,1415839,CO2 8NR,51.866575027267500,0.905540000000000
milk snake and Black jay,1412860,CO6 1DN,51.861569692722800,0.791442111102362
python and deaf adder,2624191,CO4 6AY,51.916996000000000,0.900177000000000
Fish eagle and Gila monster,1016635,IP2 9LA,52.039806275381200,1.119385320024660
Jay and agama,1783088,IP1 9XG,52.052638000000000,1.146583000000000
Scimitar babbler and carpet snake,1415731,CO2 9HY,51.866580986584400,0.874964164205587
indigo snake and Fish eagle,1008143,IP4 1BB,52.055290774996000,1.158966052460170
anaconda and Fish eagle,2586231,CO2 8YX,51.876997000000000,0.931398000000000
Logrunners and Nukupuʻu,1024647,IP1 3BE,52.058787000000000,1.155069000000000
Gull and Old World warbler,1005166,IP8 3HL,52.046475780088200,1.098758099595760
Buzzard and Gila monster,1007989,IP4 2PN,52.060673992608700,1.168159253397470
crocodile and cerastes,1016600,IP2 9JH,52.037982831999000,1.119637464154090
asp and elapid,1412111,CO6 4LD,51.972664213389500,0.865924814559574
Fulmarine petrel and hognose snake,2642342,IP1 5FD,52.066796000000000,1.115970000000000
Parakeet and Darwin's finches,1417390,CO16 0DE,51.891583829371400,1.109277740795350
diamond python and Thrasher,1415990,CO2 8UT,51.860400622881300,0.909764859336443
dugite and Tahr,1413794,CO4 9YL,51.920112927061600,0.914702906551691
Treepie and Treepie,1413781,CO4 9XP,51.918740000000000,0.923311000000000
Armadillo and Goose,1004718,IP9 2NQ,51.993084900751200,1.109623000000000
Tattler and Elephant,1415613,CO3 0UT,51.876622520647200,0.836256462786894
diamondback turtle and constrictor,1023977,IP1 9QL,52.052638000000000,1.146583000000000
Tree warbler and Armadillo,1017068,IP2 0UD,52.059805510210400,1.127055000000000
milk snake and black snake,1420086,CO11 2TT,51.937987065550700,1.171812736390400
Kite and death adder,1422495,CO1 1HE,51.891196000000000,0.898854838819992
Hawaiian honeycreeper and gaboon viper,1005180,IP8 3JF,52.020172000000000,1.072594000000000
Black jay and jew lizard,1783060,IP1 9RU,52.052638000000000,1.146583000000000
Pratincole and Hawaiian honeycreeper,1412131,CO6 3DA,51.918602482459000,0.848603740620363
worm lizard and Towhee,1415742,CO2 9JU,51.867952824874600,0.869028000000000
Badger and Badger,1024470,IP1 4EF,52.066282410365300,1.141106952617700
Gull and diamondback terrapin,1410670,CO7 9LL,51.863626686263100,0.962806148494854
Skunk and gaboon viper,1420453,CO11 1ED,51.946707259875500,1.056796975476030
agama and Marsh harrier,1412311,CO6 3NT,51.924681026988600,0.809380179902289
Eagle and Grosbeak,1422133,CO1 2TL,51.887862689987800,0.927701376687896
moloch and Tree warbler,1415657,CO2 9EY,51.869498987129700,0.870748295600476
elapid and Grackle,1415019,CO3 9EF,51.874280089048900,0.858339426359847
Marsh harrier and Pratincole,1419451,CO12 5BP,51.897203222384300,1.157946692946320
Asiatic leopard and kabaragoya,1017296,IP2 0ED,52.053527569321700,1.137789859693770
dugite and snapping turtle,1421849,CO1 9SR,51.889792095121300,0.898829691206350
deaf adder and kabaragoya,1415837,CO2 8NN,51.868191545016300,0.903846616358587
Stilt and lizard,1017262,IP2 0AR,52.051593155044200,1.143212338519950
Crow and galliwasp,1011294,IP3 0JB,52.037124155547200,1.166288559601430
Night heron and leathery turtle,1421170,CO10 5NY,52.010121000000000,0.856397000000000
mud turtle and Skunk,1415236,CO3 3BZ,51.885599277260000,0.894156117747597
Philippine hawk-owl and snake,1005848,IP7 6BT,52.050141900021700,0.958316870446054
Warbler and Vulture,2120814,IP1 9FR,52.052652000000000,1.146613000000000
Tahr and Chicken,1916238,CO1 1LQ,51.888636000000000,0.901996000000000
Bunting and Tree warbler,1421728,CO10 0RY,52.053341646006700,0.793787078215341
Old World vulture and Marmoset,1017288,IP2 0DP,52.057225879366500,1.122496252527810
Kangaroo and tokay,2588697,CO3 9FJ,51.893607000000000,0.847428000000000
sand lizard and mountain devil,1412395,CO6 3RT,51.893940189314500,0.769624529579421
Viscacha and tree snake,1005623,IP8 3DE,52.061598099988300,1.085257867272680
Rat and Lemming,1006081,IP7 5LA,52.025729725345800,0.966326877510500
rat snake and cerastes,1004808,IP9 2QR,51.983338948337700,1.158296226405280
Tree warbler and Polecat,1422537,CO1 1LS,51.887912716959100,0.900641750873230
terrapin and Treepie,1415190,CO3 4JL,51.885902380837100,0.854528114694108
garter snake and diamond python,1414084,CO4 9PU,51.915751048090600,0.917440000000000
king cobra and agamid,1414772,CO4 0EX,51.907647169290300,0.924510020034541
bull snake and Masked owl,1414066,CO4 9HA,51.914923000000000,0.928895000000000
puff adder and mountain devil,1005142,IP8 3EE,52.055254531749000,1.069195480167290
cycling lizard and Chipmunk,1005867,IP7 6DU,52.061441173071100,0.915262465774322
tortoise and goanna,1011039,IP3 8AR,52.053573617749500,1.171653919654310
moloch and Solitaire,1762154,CO2 9FJ,51.860361465453600,0.897502877473527
Badger and Viscacha,1005885,IP7 6ES,52.045028486300000,0.896833000000000
sand viper and Lemming,1415695,CO3 0YW,51.881178091507700,0.846105329101028
Condor and chameleon,1420423,CO11 1DX,51.945501929751500,1.061299292253260
Skunk and bull snake,1011184,IP3 0AS,52.046542000000000,1.164271000000000
puff adder and moloch,1024302,IP1 9BN,52.052638000000000,1.146583000000000
Grosbeak and Pitohui,1414717,CO4 3QT,51.889433211740000,0.930725005033814
Petrel and Chicken,1005747,IP7 5QQ,52.001893083437900,0.968611160398491
harlequin snake and swift,1411882,CO6 5BG,52.021991523787800,0.910712586184665
gavial and leguaan,1414276,CO4 5QW,51.950871745320700,0.912855707206335
Warbler and perentie,1417384,CO16 0BX,51.894270894312600,1.101526173021600
Crow and Coati,1420048,CO11 2RR,51.910423063009700,1.134807133291240
agamid and turtle,1410744,CO7 9PW,51.865084447292000,0.961347597617031
Black cockatoo and bushmaster,1414584,CO4 3FX,51.891868271952700,0.947366964760707
wall lizard and Prion,1416353,CO2 7JR,51.876244067556600,0.880681027893723
Crow and Elephant,1410736,CO7 9PL,51.864320901273600,0.959525147057770
Mouse and diamondback,1420462,CO11 1EQ,51.945560235126700,1.060095329890800
Greenbul and black snake,1004710,IP9 2ND,51.992884706799400,1.109885269041900
Hawaiian honeycreeper and Dolphin,1414275,CO4 5QU,51.949402000000000,0.918131000000000
bicycle lizard and Scimitar babbler,1005893,IP7 6GB,52.053176365489000,0.956022868776544
mamba and Goose,1414669,CO4 3NE,51.894489527304000,0.936418154717706
Masked owl and Jackal,1412405,CO6 3SH,51.913367398141300,0.859019035945916
Marmoset and Mole,1007925,IP4 2EL,52.059051141746100,1.163287761468210
turtle and cerastes,1420039,CO11 2RD,51.927008839789200,1.102213069936660
Bronzewing pigeon and Grosbeak,1412371,CO6 3QL,51.893186000000000,0.822939000000000
Fish eagle and death adder,1416158,CO2 8ED,51.866130644502400,0.928918633685630
Chickadee and Mink,1415174,CO3 4HL,51.886077332406000,0.857692982435325
king cobra and Triller,1415246,CO3 3DN,51.884195248752700,0.891638865027700
Maya and Parakeet,1410967,CO7 9AH,51.860782551066500,0.960033598850889
blue tongue and Vulture,1415186,CO3 4JE,51.884878639084700,0.857427983544012
Bunting and Cuscus,1411943,CO6 4BP,51.939408535082300,0.861402833013315
rock snake and blue racer,1420151,CO11 1QG,51.968073424597600,1.069012030967340
Marmoset and Booted eagles,1016789,IP2 8LE,52.041869775909700,1.152330788563520
diamond python and horned toad,1422500,CO1 1HN,51.891087660942400,0.899174744543917
blind snake and rock python,1024300,IP1 9BG,52.052638000000000,1.146583000000000
rock snake and habu,1413761,CO4 9UJ,51.906936844959500,0.914358221404377
Ground sloth and Ground sloth,1415182,CO3 4HZ,51.886024259137700,0.859506305205486
frill-necked lizard and habu,1411344,CO7 7JL,51.878718241693000,1.033695797325990
Stint and Viscacha,1006804,IP5 3WY,52.052638000000000,1.146583000000000
Wallaby and amphisbaena,1008187,IP4 1HE,52.057150897480500,1.160702283998370
horned toad and Herring gull,1422093,CO1 2SA,51.893081946090500,0.908737004466814
Rat and Diving bird,1412832,CO6 1AW,51.881954026746500,0.806336368395808
Hawaiian honeycreeper and kabaragoya,1413756,CO4 9TZ,51.921373793280000,0.929475232528218
adder and Dorcopsis,2650908,CO7 8FP,51.854570000000000,0.995238000000000
anaconda and chuckwalla,1024654,IP1 3BY,52.059230917875700,1.155917546675020
Chipmunk and White ibis,1416396,CO2 7PZ,51.879564305575500,0.902923193541945
Marmoset and Minke whale,2662392,CO8 5HX,51.974387000000000,0.778156000000000
Crow and Grackle,1006099,IP7 5LY,52.024467000000000,0.961170000000000
python and cayman,1010957,IP3 0QF,52.042006475956400,1.173022156552650
Guillemot and Cloud rat,1412777,CO6 2AQ,51.919250488709900,0.772549896941623
crocodile and Chipmunk,1005757,IP7 5RB,52.017420105741400,0.949844754969333
B and Boto,2624216,CO6 4UY,51.989254000000000,0.894925000000000
leathery turtle and slowworm,1421866,CO1 9TN,51.889792095121300,0.898829691206350
Old World warbler and Duck,1006095,IP7 5LT,52.004256101097000,0.988250698240104
Rabbit and Recurvebill,2634397,CO16 0DT,51.890282000000000,1.110730000000000
tokay and Fish eagle,1414970,CO3 9AR,51.889437529532800,0.850260000000000
Mockingbird and Darwin's finches,1762140,CO2 8YP,51.882003307795400,0.927509333999037
cerastes and Darwin's finches,1413740,CO4 9TD,51.920428000000000,0.934286000000000
Kangaroo and green turtle,1007644,IP4 2ZR,52.052638000000000,1.146583000000000
Black jay and cobra de capello,1005994,IP7 5DA,52.047384290536000,0.962116676102537
dugite and amphisbaena,1005832,IP7 6AX,52.049485282979400,0.964399982481347
adder and mamba,1420252,CO11 1US,51.947221000000000,1.060616000000000
python and rock snake,2621947,CO6 4RW,52.000777000000000,0.882745000000000
Cloud rat and White ibis,1007929,IP4 2ER,52.059320117283000,1.162314604041070
frilled lizard and death adder,1416789,CO16 9JG,51.857240948872600,1.115869889659190
anole and Komodo dragon,1411070,CO7 7TX,51.893554980333100,1.039042041353880
pit viper and Egret,1414819,CO4 0LU,51.907650022013300,0.927287483981980
Herring gull and Triller,1017089,IP2 8AJ,52.050904878806400,1.145410550510130
box turtle and Peafowl,1004709,IP9 2NB,51.990765701327600,1.108048427314410
Old World vulture and flying lizard,1421755,CO10 0TL,52.059089747147300,0.787653569298548
amethystine python and Grouse,1415002,CO3 9DJ,51.881387516182600,0.855273726391787
cayman and Thicketbird,1412370,CO6 3QJ,51.895165503311100,0.823615036720629
coral snake and Mamo,1011203,IP3 0BU,52.048727599570800,1.164235638429020
snake and Piping shrike,2624187,CO3 8BZ,51.887437000000000,0.822809000000000
Piping shrike and boa,1422423,CO1 2LU,51.884004829647700,0.917190208977044
kabaragoya and milk snake,1415286,CO3 4QJ,51.881042000000000,0.866180000000000
White ibis and tiger snake,1024997,IP1 2LX,52.061750452017000,1.140395000000000
Bunting and Dorcopsis,1024754,IP1 3PG,52.063296590684400,1.144807962647360
Grackle and Logrunners,1412181,CO6 4PJ,51.989368000000000,0.856605000000000
Hawaiian honeycreeper and death adder,1415176,CO3 4HP,51.887741659610500,0.862478583664008
snapping turtle and harlequin snake,1411606,CO7 6UB,51.966371774432700,1.035451011277680
bearded dragon and Thicketbird,1017071,IP2 0UH,52.061695000000000,1.129345000000000
Boto and Warbler,1006089,IP7 5LL,52.008871681698100,0.986051677602917
Thrasher and krait,1422346,CO1 2EU,51.884275388630400,0.906627621569566
Pratincole and puff adder,1416767,CO16 9HE,51.857995942897200,1.115210347712000
Tahr and mud turtle,1024265,IP1 5HS,52.070664974436200,1.118676680314950
perentie and Triller,1006004,IP7 5DR,52.042382394422800,0.953224601097205
Jerboa and Darwin's finches,1416139,CO2 8DB,51.868905048716400,0.927660689120488
blind snake and Old World quail,1421682,CO10 0RA,52.023580726399500,0.792747525108606
indigo snake and Marmoset,1008023,IP4 2SH,52.062313824181200,1.160352044020210
Grosbeak and Macaw,1422095,CO1 2SD,51.893865244813800,0.906519968164949
copperhead and Crow,1762179,CO3 8AH,51.881204230095300,0.830485143213446
Parakeet and Triller,1005263,IP8 3NY,52.063549946436900,1.019320759031910
Komodo dragon and Old World quail,1412067,CO6 4EY,51.924105956842700,0.874873064542930
terrapin and Parakeet,1412420,CO6 4AD,51.946399379577200,0.876037277506854
Chicken and tortoise,1415407,CO3 3PT,51.887871031621900,0.885886823126842
soft-shelled turtle and Herring gull,1421684,CO10 0RD,52.031860943058700,0.793613649631849
dukite and Triller,1415360,CO3 3JH,51.889163000000000,0.890789231499807
Darwin's finches and green turtle,1005621,IP8 3DB,52.062058200738900,1.093431623213890
Chicken and turtle,1016647,IP2 9LS,52.046189808396200,1.127940170026050
habu and Macaw,1005232,IP8 3LB,52.038031118846000,1.092238130156990
bull snake and Songlark,1005999,IP7 5DH,52.045761915140200,0.962257288169399
alligator and Mink,1007991,IP4 2PU,52.057255055751000,1.161847671122890
Black cockatoo and iguana,1011268,IP3 0FF,52.050103919376300,1.167571435290790
agama and coral snake,1004641,IP9 2ES,52.002731607729600,1.045970265771270
Mouse and carpet snake,2121772,IP2 0HZ,52.060744000000000,1.124756000000000
swift and Grouse,1017254,IP2 0AD,52.052244819270100,1.139012878145640
Parrotlet and Marsh harrier,1411245,CO7 7AE,51.880610597035300,0.997434482167586
White ibis and Guillemot,1004777,IP9 2PA,51.977826197095200,1.100103146018460
Kestrel and amphisbaena,1023995,IP1 9SR,52.058237379656500,1.148683575614940
Jerboa and Stint,1417379,CO16 0BP,51.876596318035800,1.111788590919820
Jay and Stilt,1422523,CO1 2LX,51.884004449206100,0.917568043719929
Mamo and smooth snake,1411880,CO6 5BD,52.023452997443500,0.909801624572905
B and fer-de-lance,1415774,CO2 9NQ,51.870411546697800,0.879770545487576
Moluccan boobook and Kākāriki,1415955,CO2 8ST,51.874509893867100,0.915282128408596
Pratincole and Jerboa,1415072,CO3 9FG,51.882400993939200,0.855018267816033
diamond python and diamondback,1415869,CO2 8QG,51.870208166634400,0.909947828486351
Masked owl and Old World vulture,1414345,CO4 3SN,51.889667930348500,0.940057180006975
giant tortoise and puff adder,1412198,CO6 4QF,51.991609429722100,0.900961507479733
Hawaiian honeycreeper and Gila monster,1420274,CO11 2AQ,51.942351037514400,1.066250721965390
water snake and leathery turtle,1007965,IP4 2LX,52.056745970053400,1.164058551432980
Linsang and Wader,1412120,CO6 4LR,51.972108733755000,0.864360400974025
Chipmunk and Coati,1005162,IP8 3HF,52.039402976860200,1.071783975878160
amphisbaena and Mink,1422516,CO1 1JW,51.889782000000000,0.897136426900416
Black jay and Ground sloth,1415194,CO3 4JX,51.879778898214300,0.856334270168272
Magpie and Marsh harrier,1414591,CO4 3GH,51.882165842471500,0.932548179272291
caiman and B,1414330,CO4 3RS,51.890517810257200,0.931231664023696
Crow and Partridge,1016765,IP2 8HW,52.049059597305600,1.158905516369560
worm lizard and Fish eagle,1024873,IP1 2AP,52.056855717439200,1.148892737911390
Chicken and Hawk,2624218,CO6 4YX,51.989254000000000,0.894925000000000
horned toad and cayman,1411343,CO7 7JJ,51.878342615275300,1.035356160300940
Maya and brown snake,1024939,IP1 2ET,52.060852888550500,1.144709143268010
