name,id,postcode,lat,lon
Hawk and New World blackbird,497682,RG18 4BU,51.411641609970000,-1.257994000000000
Night heron and amethystine python,498959,RG14 6AL,51.394345030635200,-1.341551832322070
krait and rat snake,498549,RG14 7QU,51.390107340039400,-1.322167545344830
cycling lizard and Nukupuʻu,497062,RG19 4NU,51.393514000000000,-1.241083000000000
tuatara and black snake,497442,RG18 9JL,51.432178794521400,-1.269600940603390
viper and glass snake,497367,RG18 9HA,51.425034713984700,-1.273195442316150
chuckwalla and Lemming,480859,RG8 9RG,51.513566836510800,-1.188176871669060
Mole and Jackal,495609,RG20 7YY,51.400007757712100,-1.322063000000000
Quetzal and indigo snake,498977,RG14 6BL,51.396429427206000,-1.338057831248600
python and Siskin,481031,RG8 8QS,51.468400792698400,-1.173747000000000
Crow and Skunk,495963,RG20 0HP,51.389092111049200,-1.410495371118030
Buzzard and New World blackbird,499242,RG14 5NL,51.398699672778100,-1.332476509301240
tuatara and dukite,1804988,RG17 9AA,51.397429000000000,-1.476840000000000
grass snake and taipan,498419,RG17 7LZ,51.505794758599700,-1.512384043229540
bushmaster and king snake,497623,RG18 9UG,51.450004000000000,-1.251487000000000
Asiatic leopard and king cobra,497888,RG18 0TT,51.492229397472200,-1.240511068737180
Grackle and Dolphin,498133,RG17 0SL,51.422759665708600,-1.539644255675040
cerastes and American sparrow,498322,RG17 7LE,51.503096000000000,-1.533779000000000
Mink and Goose,499290,RG14 5RJ,51.399743463777000,-1.316993974247410
Stilt and water snake,494850,RG20 9UP,51.350944296100100,-1.388512143366550
Wader and leathery turtle,499698,RG14 2BT,51.404186860415700,-1.308043282485250
gaboon viper and garter snake,499261,RG14 5PL,51.400479842416600,-1.326154318520130
black snake and Mouse,497664,RG18 3TA,51.404397531825600,-1.267240045327480
Black jay and B,498751,RG14 6TD,51.378160745651100,-1.348149030047280
Prion and Skunk,495423,RG20 8TT,51.485343000000000,-1.327425000000000
rock python and Rat,498526,RG14 7PN,51.397266000000000,-1.297726000000000
amphisbaena and cayman,497412,RG19 3YW,51.396180689088700,-1.260342508115080
flying lizard and sidewinder,482239,RG7 4TW,51.377906946666900,-1.197115661932160
thorny devil and Jay,497618,RG18 9UA,51.445198678041700,-1.253867403975880
Chickadee and Egret,495368,RG20 8QR,51.481687751122300,-1.375619931816310
Kite and hawksbill,481897,RG7 6SQ,51.415486773067700,-1.227806000000000
Mockingbird and chuckwalla,498660,RG14 9EA,51.400007757712100,-1.322063000000000
coral snake and swift,499403,RG14 2NX,51.409461506898400,-1.298373624541900
Kākāriki and Schneider python,495594,RG20 7PE,51.515649520668300,-1.256882182596630
Egret and bearded lizard,497066,RG19 4NZ,51.391335971410300,-1.239552060735550
giant tortoise and bushmaster,499873,RG14 1DT,51.404749793344700,-1.324510000000000
Schneider python and habu,497135,RG18 9UX,51.439705726422700,-1.221730000000000
Armadillo and American sparrow,2615984,RG14 1EZ,51.402827000000000,-1.326101000000000
Parrotbill and blue tongue,495357,RG20 8PT,51.430267040692400,-1.410872092285850
frill-necked lizard and elapid,496912,RG19 8XQ,51.382050565461600,-1.314412133456950
bicycle lizard and racer,498370,RG17 0DF,51.407262080527600,-1.518262900207710
viper and Armadillo,498234,RG17 7AW,51.507167012864300,-1.531533000000000
king cobra and Capuchin,498782,RG14 7AU,51.388170989372000,-1.327872780857100
sea snake and Schneider python,497134,RG18 9UW,51.441933000000000,-1.242192492860330
Siskin and puff adder,497838,RG17 9XN,51.398531064020800,-1.445016443327780
harlequin snake and Grouse,498799,RG14 7BW,51.395942194688200,-1.326709668000430
blindworm and pit viper,499532,RG14 1PN,51.410766000000000,-1.332143000000000
Kākāriki and New World blackbird,496852,RG19 8EU,51.373596789548700,-1.255218281146010
rock python and Parrotbill,498450,RG17 0JJ,51.413984724292500,-1.517502083225950
Grackle and Tahr,497952,RG17 7TS,51.487260047688400,-1.559331351327970
turtle and caiman,499616,RG14 1UP,51.411075220088100,-1.340937798943930
Skunk and tree snake,498843,RG14 7EY,51.385021850104700,-1.321279842829020
chameleon and Mamo,495149,RG20 9JN,51.345261432832600,-1.332477527854400
blue racer and Grosbeak,495170,RG20 9LQ,51.326048584037600,-1.344108658400930
Francolin and hawksbill,497955,RG17 7TZ,51.483486000000000,-1.557179000000000
Gull and Fox,497231,RG19 3BF,51.404291834003900,-1.288029886703940
brown snake and Marmoset,481916,RG7 8AA,51.361538736080100,-1.163260947060040
smooth snake and death adder,497584,RG18 9SD,51.462546508727900,-1.274384867415150
elapid and rat snake,497599,RG18 9TA,51.453256304625700,-1.277007480384770
Thicketbird and Condor,497447,RG18 9JS,51.435372780681700,-1.269909673870550
python and bearded dragon,498984,RG14 6BY,51.396735465962900,-1.327057374706340
boa constrictor and Recurvebill,499496,RG14 2ZJ,51.400007757712100,-1.322063000000000
frilled lizard and constrictor,498616,RG17 0RG,51.386355459599000,-1.547367130040870
Wader and Elephant,499295,RG14 5RU,51.400560000000000,-1.311907000000000
Snipe and gopher snake,498999,RG14 6DT,51.391335373190200,-1.342212000000000
Nukupuʻu and Thicketbird,495781,RG20 5RJ,51.326960848151700,-1.243143000000000
ringhals and bull snake,499034,RG14 5AS,51.401352748270200,-1.321815000000000
chuckwalla and amphisbaena,498581,RG14 7TA,51.389311086558100,-1.313585093474950
Myna and Diving bird,498230,RG17 7AR,51.455590066923700,-1.475829898134290
Dolphin and Black jay,498094,RG17 8YN,51.508430410943200,-1.525828270833280
Puffleg and goanna,499542,RG14 1QA,51.407838936573100,-1.331538362124370
worm lizard and horned toad,499114,RG14 6RB,51.381216227752900,-1.351080035352480
Eagle and worm lizard,497214,RG19 8AP,51.361235892910400,-1.241644734038160
Dolphin and Badger,1804995,RG18 9WN,51.460497095000000,-1.265291726800000
anaconda and kabaragoya,481889,RG7 6SD,51.417717352533100,-1.220304750971670
blind snake and garter snake,495698,RG20 4UP,51.350409629780500,-1.283063766821100
chameleon and Ibex,499479,RG14 2SF,51.411133000000000,-1.300951000000000
Hawk and flying lizard,499393,RG14 2NH,51.409685549548700,-1.302769862161220
moloch and Viscacha,482227,RG7 4TD,51.378068756757500,-1.210345900977930
Condor and Macaw,497080,RG19 4PS,51.396198890779900,-1.253284682112650
River dolphin and Perching duck,495379,RG20 8RE,51.468198427438700,-1.376955695237280
Old World quail and Old World warbler,499207,RG14 5LF,51.398545000000000,-1.325551874132740
krait and Old World warbler,498507,RG17 0PW,51.428769617403400,-1.493887000000000
Armadillo and goanna,497039,RG19 4LD,51.400246568742500,-1.224411144350840
cobra and Armadillo,495482,RG20 7BG,51.496733913738200,-1.389906206558060
bandy-bandy and Hawk,497050,RG19 4NA,51.395263987906900,-1.240723078958370
Fox and Pitohui,481900,RG7 6ST,51.416644501309900,-1.228030800596680
Petrel and Kite,499352,RG14 2JD,51.414638665224300,-1.331884998859870
chameleon and flying lizard,499923,RG14 1LF,51.407596288748300,-1.323720637563100
black snake and massasauga,498063,RG17 8UB,51.528821000000000,-1.525043271354850
River dolphin and Black jay,497453,RG18 9LS,51.433179318817900,-1.287005000000000
Schneider python and Kite,497813,RG18 4NF,51.403930795889200,-1.224046944185420
crocodile and Asiatic leopard,498214,RG17 9QB,51.380157613517200,-1.465584570493490
soft-shelled turtle and rock snake,481870,RG7 6QS,51.412416140316300,-1.224967392221480
Prion and Gila monster,495351,RG20 8PJ,51.432053225437300,-1.394249000000000
harlequin snake and habu,495174,RG20 9LY,51.400007757712100,-1.322063000000000
Petrel and Old World warbler,497028,RG19 4GX,51.397611377952800,-1.244982128635710
Kākāriki and Warbler,498558,RG14 7RL,51.383074007450400,-1.337589436989760
Mockingbird and diamond snake,495724,RG20 8BY,51.428460666950200,-1.377970737434940
soft-shelled turtle and galliwasp,499149,RG14 5DP,51.398818222721700,-1.324913762976790
Komodo dragon and puff adder,497565,RG18 3EZ,51.405692846121400,-1.260160358775080
Old World warbler and puff adder,2615990,RG14 9NL,51.400070000000000,-1.322045000000000
brown snake and Dorcopsis,497163,RG18 9XX,51.450451000000000,-1.309575000000000
monitor and Cuscus,497942,RG17 7TA,51.461781275458400,-1.516782603164990
rock snake and Magpie,495228,RG20 8DD,51.440110809733000,-1.391092215040280
Recurvebill and kabaragoya,497343,RG18 9DR,51.450199411317200,-1.291791850086880
Parakeet and boa,495548,RG20 7HR,51.524413167721700,-1.373450464270630
deaf adder and Komodo dragon,498868,RG14 7JB,51.395365356859000,-1.317145389987450
Pitohui and giant tortoise,495919,RG20 6NE,51.515913887937600,-1.246170174783140
amphisbaena and Treepie,498292,RG17 7HB,51.488038652231800,-1.479404387211810
diamond snake and Jay,498356,RG17 0BN,51.410467925114400,-1.515066044472560
Guillemot and chameleon,495188,RG20 9NY,51.344472004458900,-1.375217031786260
Ibex and Booted eagles,498767,RG14 7AA,51.384943458167600,-1.309396824704950
Meadowlark and Polecat,495988,RG20 0JX,51.380828651793400,-1.377438088906390
Viscacha and blind snake,320770,SN8 3JU,51.406901575821100,-1.561598917485590
Civet and Grosbeak,498254,RG17 7DA,51.474860857383400,-1.446841217906990
puff adder and River dolphin,498964,RG14 6AS,51.395027622655200,-1.341298000000000
thorn lizard and Viscacha,499615,RG14 1UN,51.411143406017300,-1.341871416411160
Scimitar babbler and Old World warbler,482203,RG7 4RY,51.364188061594300,-1.179328904202380
grass snake and Parakeet,497861,RG18 0SB,51.485568040440100,-1.240736917973110
Marsh harrier and cobra de capello,498406,RG17 0GW,51.447580263242700,-1.552216120091980
skink and Logrunners,482056,RG7 5SG,51.395325997201600,-1.177923990547180
Triller and Cuscus,495788,RG20 5RT,51.325001287188800,-1.235138291414640
blindworm and soft-shelled turtle,497142,RG18 9WR,51.460613623872200,-1.262900298746960
smooth snake and glass snake,499388,RG14 2NB,51.408416701947000,-1.299582949769940
amethystine python and cobra de capello,498985,RG14 6BZ,51.396027980363600,-1.327556456950600
Zebra and Black jay,495513,RG20 8UR,51.462468058638000,-1.316720561619680
perentie and Piping shrike,497851,RG18 0AB,51.485987417613200,-1.243019876333020
Thicketbird and gopher snake,498273,RG17 7EB,51.482200015821000,-1.464724536255290
Tree warbler and Magpie,498996,RG14 6DP,51.391605374253700,-1.340455731952560
alligator and turtle,2657211,RG14 1GF,51.406064000000000,-1.319914000000000
gecko and River dolphin,495626,RG20 0PA,51.360538536471700,-1.398940919555260
milk snake and Jerboa,320352,SN8 3RA,51.368106300162400,-1.501794954714690
Minke whale and Black cockatoo,499154,RG14 5DY,51.398296186144800,-1.326503000000000
Buzzard and cobra,498147,RG17 0TF,51.432799000000000,-1.540622000000000
Tit-tyrant and crocodile,499872,RG14 1DS,51.402229611885000,-1.322405324652450
Triller and Argus,498491,RG17 0NU,51.414091152794900,-1.523741557246160
Guillemot and saltwater crocodile,2630463,RG14 9NU,51.400070000000000,-1.322045000000000
Cuscus and amethystine python,498287,RG17 7EU,51.487430000000000,-1.473712145781510
hawksbill and Boto,496877,RG19 8LQ,51.349379902086800,-1.256343131707730
Warbler and Marsh harrier,1805060,RG20 9AH,51.345244875800000,-1.333698339000000
Argus and agamid,497587,RG18 9SL,51.450206128190400,-1.275228017688380
rock python and diamondback,498896,RG14 7LS,51.396461174028300,-1.324877000000000
leguaan and Nukupuʻu,499572,RG14 1RX,51.407692910550200,-1.339088595999510
Cloud rat and water snake,495922,RG20 6NJ,51.516707917972100,-1.252224398257240
bearded dragon and dugite,498588,RG14 7TR,51.391777629519100,-1.312527760206310
Masked owl and Stilt,495614,RG20 8AG,51.422065297009100,-1.352630439815140
Diving bird and Linsang,495958,RG20 0HG,51.380928000000000,-1.387552000000000
galliwasp and Kite,499587,RG14 1SX,51.409942433930700,-1.337776530557070
flying dragon and Nukupuʻu,495416,RG20 8TH,51.471356679180600,-1.316011944096810
Komodo dragon and Chipmunk,499704,RG14 2DB,51.405406773595300,-1.316737123143700
smooth snake and American sparrow,498940,RG14 5XB,51.399566912064900,-1.291783175301950
Night heron and Boto,497363,RG18 9EY,51.424179601953500,-1.273050794208870
Quetzal and sand lizard,495066,RG20 9DX,51.359263857426900,-1.329703268435560
lizard and Bunting,495388,RG20 8RS,51.465228000000000,-1.310371052522230
Scimitar babbler and Songlark,491471,RG26 5HD,51.356509668997700,-1.164156785105760
Chickadee and Rat,497218,RG19 8AT,51.361565000000000,-1.229833000000000
Kite and Egret,497877,RG18 0TE,51.482775807625800,-1.234461228554570
Fulmarine petrel and slowworm,495282,RG20 8JT,51.414488276204300,-1.364686754987310
alligator and Recurvebill,499819,RG14 1BN,51.402478318909500,-1.328123185397380
Kestrel and Recurvebill,497072,RG19 4PG,51.395326200409800,-1.254621249489500
Black cockatoo and Pratincole,499710,RG14 2DJ,51.410052851847300,-1.314741236093110
Triller and Asiatic leopard,499039,RG14 6HT,51.388572054993300,-1.336719660068770
adder and bearded dragon,499910,RG14 1JP,51.406348478424700,-1.319411580690530
whip snake and death adder,497758,RG17 9TH,51.399481642517800,-1.457927801181670
chuckwalla and king snake,497095,RG19 4QN,51.398082103020800,-1.249502000000000
Parakeet and alligator,481871,RG7 6QU,51.414158734851600,-1.225109000000000
milk snake and Herring gull,498786,RG14 7BB,51.396563234218900,-1.326815545262260
worm lizard and chuckwalla,482211,RG7 4SN,51.389731894393300,-1.203807251063920
Magpie and Crow,499068,RG14 6NE,51.382558848692500,-1.340312699690490
Mockingbird and deaf adder,498713,RG14 9SS,51.398367431280300,-1.324704779975540
Pitohui and whip snake,1804951,RG14 7GN,51.394660000000000,-1.310113000000000
blind snake and Warbler,498095,RG17 8YP,51.508463521171400,-1.525121889548290
adder and Night heron,499369,RG14 2JZ,51.416468664714800,-1.334288568327660
Fish eagle and black snake,482085,RG7 5UL,51.402500995273600,-1.205238834418130
tree snake and diamond python,498380,RG17 0DW,51.416555732578000,-1.515174227633660
Wader and Asiatic leopard,495461,RG20 7AA,51.539489913804300,-1.316678469456320
Snipe and Tit-tyrant,497341,RG18 9DP,51.447044350331100,-1.290473617680490
Tattler and thorn lizard,495470,RG20 7AQ,51.540134681207000,-1.319321922608800
Minke whale and Siskin,482017,RG7 8LN,51.361557357027000,-1.164481000000000
Tattler and Booted eagles,499336,RG14 2HE,51.409916040805200,-1.313148000000000
Linsang and Armadillo,498118,RG17 9DT,51.373820000000000,-1.489766000000000
goanna and leathery turtle,499469,RG14 2RP,51.410739129571800,-1.294011822207340
snake and anole,499657,RG14 1XB,51.411743976836100,-1.331999068205710
Perching duck and Partridge,496871,RG19 8LG,51.356847000000000,-1.256760320186960
Lemming and chameleon,495784,RG20 5RP,51.326436116309100,-1.241458007960060
Hawaiian honeycreeper and boomslang,499694,RG14 2BL,51.408450650061500,-1.310927000000000
harlequin snake and mud turtle,497282,RG19 3RX,51.402938213175000,-1.268255295646600
Dorcopsis and puff adder,495549,RG20 7HT,51.523554277005900,-1.386074000000000
Vulture and cayman,320776,SN8 3LB,51.411148971973400,-1.572241402670200
Vole and Maya,497975,RG17 8NA,51.508479607179500,-1.509358338499750
bushmaster and Masked owl,480857,RG8 9RE,51.513287338727800,-1.185472632298360
tortoise and lizard,497603,RG18 9TF,51.456519656305500,-1.266765897350850
sea snake and Songlark,498960,RG14 6AN,51.394762609931800,-1.339059261357790
Solitaire and Wallaby,498302,RG17 7HR,51.490599352614300,-1.472936950888660
Kestrel and Chicken,495658,RG20 4HS,51.369009763348100,-1.282414303931820
dukite and soft-shelled turtle,498840,RG14 7EU,51.386064224921100,-1.321163834632360
Kestrel and thorny devil,497494,RG18 9PY,51.420267960480200,-1.262930843548470
hognose snake and Old World quail,497689,RG18 4DD,51.409389477264600,-1.250409995647930
adder and sidewinder,495693,RG20 4UG,51.332839668903100,-1.284557818156310
B and rat snake,498440,RG17 0HW,51.418316582811000,-1.512639008448640
snapping turtle and Komodo dragon,497855,RG18 0RS,51.485589841330100,-1.241327033737870
Shearwater and Stilt,320846,SN8 2HH,51.470054597414100,-1.562909067722500
Solitaire and mud turtle,497979,RG17 8NG,51.507762471650000,-1.536440011234880
Nukupuʻu and rock python,495560,RG20 7JL,51.472237550110800,-1.341093844096920
Recurvebill and bearded dragon,499315,RG14 5TA,51.399329107330300,-1.309194661764250
Komodo dragon and Magpie,498058,RG17 8RB,51.519806899448700,-1.573271465077620
terrapin and Quetzal,499340,RG14 2HL,51.411077745954600,-1.308586334827580
python and milk snake,497083,RG19 4PW,51.401245000000000,-1.256236000000000
flying dragon and Ice seal,499043,RG14 6JD,51.390519058278000,-1.331230174390690
Coati and krait,497913,RG18 0XL,51.466122876496300,-1.206005855689630
White ibis and grass snake,498785,RG14 7AY,51.387013015935800,-1.329786693190510
Chickadee and Grosbeak,495375,RG20 8QZ,51.483961670751100,-1.368719473803810
Goose and galliwasp,320332,SN8 3QA,51.361681545319900,-1.544881298554220
giant tortoise and Grouse,499065,RG14 6NA,51.384891253475700,-1.337750024204150
Pratincole and Piping shrike,497076,RG19 4PN,51.396888989492500,-1.252928473696130
Partridge and Jay,497428,RG18 9HS,51.418567000000000,-1.251195000000000
Dolphin and Fulmarine petrel,497720,RG18 4EU,51.407013660752900,-1.244496671545530
cobra and flying lizard,498305,RG17 7HW,51.489632353405800,-1.475857505879110
adder and smooth snake,499151,RG14 5DS,51.398450381008300,-1.323294000000000
Francolin and Petrel,498117,RG17 9DS,51.372124419022500,-1.486925543486720
rock snake and racer,498200,RG17 9EB,51.382032000000000,-1.496715000000000
agamid and Greenbul,497683,RG18 4BW,51.410971107294000,-1.254496371395490
rattlesnake and glass snake,497918,RG18 0XU,51.457641443120900,-1.197747389038060
saltwater crocodile and Ibex,495598,RG20 7PL,51.514673221230000,-1.260327894270980
Vole and Nukupuʻu,497112,RG19 4RH,51.396155208372800,-1.249260733644130
Old World vulture and brown snake,497733,RG17 9RN,51.433416836040500,-1.452247049229680
Jay and gopher snake,496869,RG19 8LE,51.349286383800600,-1.258613384203910
dukite and Night heron,481888,RG7 6SB,51.421315174444100,-1.215080522045890
Ice seal and cycling lizard,495635,RG20 0PN,51.364620441225400,-1.400625531716630
American sparrow and moloch,495782,RG20 5RL,51.326931547191500,-1.241593358406660
Maya and tiger snake,495029,RG20 9AD,51.328070735676100,-1.298898347637010
death adder and giant tortoise,495930,RG20 0AQ,51.367888000000000,-1.448719000000000
horned toad and hognose snake,499027,RG14 5AD,51.400962000000000,-1.323862000000000
Nukupuʻu and chuckwalla,499106,RG14 6QP,51.381259492130400,-1.344311600334640
Grosbeak and anaconda,499401,RG14 2NU,51.408231346883800,-1.307737842145110
Kākāriki and sand lizard,1805055,RG20 6PD,51.514805253900000,-1.256506966500000
Badger and agama,495679,RG20 4SZ,51.344634371885300,-1.262378338931590
Boto and viper,499181,RG14 5HX,51.400970301424400,-1.328576529770290
garter snake and hoop snake,497548,RG18 3ED,51.406380259404300,-1.269408044660640
Black cockatoo and B,499135,RG14 5BL,51.399700815725900,-1.329860095922100
boa constrictor and Ice seal,491480,RG26 5HQ,51.355250557115400,-1.164122247704320
diamond snake and cobra,499309,RG14 5SR,51.400270546878800,-1.317949253577030
viper and bandy-bandy,495442,RG20 6QH,51.517484685657900,-1.251361377786170
Macaw and Komodo dragon,497309,RG19 3TL,51.401687673091000,-1.285640848762850
