name,id,postcode,lat,lon
Buzzard and Philippine hawk-owl,720570,NG13 8PQ,52.981204197678700,-0.964130796181893
king snake and Guillemot,708419,NG24 4PA,53.059889835442900,-0.820263644011706
boomslang and Skunk,710219,NG23 5DR,52.997892899155500,-0.755452689830547
diamondback and cobra de capello,708830,NG24 2EN,53.080550594971600,-0.796290152354067
krait and dugite,720386,NG13 9HE,52.904071793151100,-0.925529754840399
Ground sloth and Thicketbird,709281,NG24 2AR,53.093590853289100,-0.793268118587625
diamond python and Schneider python,709855,NG23 5HZ,53.011402788914000,-0.733153319128842
perentie and water snake,877738,LN5 0RF,53.073477944970600,-0.692537615843159
Old World quail and Tattler,1796624,NG31 9DA,52.910432000000000,-0.635069000000000
turtle and Duck,2644386,NG31 8XJ,52.921466000000000,-0.666684000000000
Dolphin and New World blackbird,707945,NG25 0HD,53.077590042046700,-0.954892707493070
cayman and Philippine hawk-owl,708320,NG25 0EL,53.079605423553300,-0.954067623848321
mountain devil and cycling lizard,708649,NG24 3TZ,53.057547355217800,-0.849110398386497
Boto and Prion,706157,NG31 9BQ,52.916184164838700,-0.630382188679037
Magpie and Kangaroo,710180,NG23 5AR,53.030746022982300,-0.741369758116096
Partridge and cerastes,709035,NG24 1NT,53.076313882990800,-0.800483547157823
mud turtle and flying lizard,706412,NG31 8LW,52.935116107321200,-0.661028000000000
Jay and Eagle,706378,NG31 8JD,52.923671000000000,-0.655330000000000
rock snake and soft-shelled turtle,720366,NG13 9EZ,52.945769842064500,-0.894568374578612
wall lizard and hoop snake,709327,NG23 7RP,53.114808000000000,-0.773983000000000
horned viper and Dolphin,708468,NG24 4RL,53.060961392316400,-0.828635617680808
sand lizard and boomslang,708407,NG24 4NJ,53.057017627985400,-0.810777774577651
crocodile and perentie,706269,NG31 8DT,52.924621833120100,-0.640216489598431
B and Ground sloth,720428,NG13 8GU,52.919813000000000,-0.940514153176598
Bunting and frilled lizard,706194,NG31 9FE,52.925845809117000,-0.613877236926932
Polecat and loggerhead,720685,NG13 8TG,52.954079800897000,-0.972102464023577
Snipe and Stilt,706716,NG31 7AX,52.903263912213400,-0.645137571384263
harlequin snake and New World blackbird,720325,NG13 9AU,52.950798617434800,-0.900765980116193
Polecat and Jerboa,721106,NG13 0DD,52.942081515232300,-0.799764302114369
Pratincole and rat snake,709012,NG24 2LZ,53.078454399816200,-0.779360111540772
American sparrow and rock snake,708722,NG24 4DZ,53.067087508656300,-0.807336472646442
bearded lizard and glass snake,710101,NG23 5TL,53.091787902425500,-0.902850000000000
anaconda and Old World vulture,720344,NG13 9DB,52.982295000000000,-0.878197239726218
python and Myna,708873,NG24 3HJ,53.052870703655400,-0.786468672730762
Bronzewing pigeon and fer-de-lance,708659,NG24 3US,53.048089442619700,-0.769346000000000
water snake and chameleon,706892,NG31 0TA,52.910858820938800,-0.639487593593744
Cloud rat and Kite,709666,NG23 6EA,53.106697881866000,-0.822015739628932
death adder and Kākāriki,708048,NG25 0PW,53.100396000000000,-0.927570289834102
caiman and Duck,708583,NG24 3RF,53.049377558842800,-0.769336094738180
diamondback terrapin and thorny devil,708061,NG25 0QP,53.056620313875300,-0.975437000000000
hognose snake and Magpie,708281,NG25 0BE,53.078283771408200,-0.964325386719440
Viscacha and Partridge,708752,NG24 3BA,53.061512603672400,-0.785867713666023
Diving bird and Kākāriki,709503,NG24 1LA,53.080799000000000,-0.803001000000000
Night heron and harlequin snake,707984,NG25 0LF,53.074130867499100,-0.958170755216926
rat snake and iguana,709083,NG24 2QQ,53.077635715540700,-0.769694913060022
Diving bird and tortoise,2257273,NG24 2PJ,53.078694000000000,-0.776308000000000
Fulmarine petrel and Old World warbler,706911,NG31 6BA,52.909163415615400,-0.640596505765890
Triller and Old World warbler,719751,NG14 7EU,52.990510000000000,-0.987104000000000
Nukupuʻu and bushmaster,706263,NG31 8DL,52.924774724297400,-0.636299392875429
hoop snake and boa constrictor,708269,NG25 0AQ,53.077838072061800,-0.962694009122987
massasauga and Maya,708580,NG24 3RB,53.058405998950700,-0.779210542436994
Linsang and Elephant,709523,NG24 1NB,53.078393468709300,-0.799888332026203
milk snake and iguana,2617265,NG24 1FU,53.077253000000000,-0.797842000000000
viper and Armadillo,720347,NG13 9DF,52.984761821483800,-0.877473000000000
Mouse and monitor,720355,NG13 9EL,52.948642091028300,-0.892158454064670
gavial and Wader,708759,NG24 3BL,53.058730423397000,-0.783677845019756
Partridge and Jackal,706010,NG31 9UW,52.927823974183700,-0.622412823726952
Grosbeak and snake,706233,NG31 8AW,52.914517476062900,-0.649709100402611
Tit-tyrant and puff adder,710323,NG23 5FP,52.988303622194100,-0.748011497544455
habu and Crow,705664,NG32 1DS,52.910215383271500,-0.720760880251185
constrictor and Wader,721008,NG13 0AE,52.943149059983100,-0.806684530613735
Viscacha and puff adder,705564,NG32 2JS,52.971692834474600,-0.723711839526862
Boto and sand lizard,720410,NG13 9JP,52.912602378154800,-0.906729817666105
Kite and Goose,708950,NG24 2GN,53.073534296123000,-0.773842019875460
anole and cayman,720916,NG13 8GE,52.953604546459500,-0.954713047331013
Asiatic leopard and green turtle,708906,NG24 3LB,53.056343975066300,-0.783267581626639
flying dragon and Egret,705680,NG32 1EN,52.908886116125400,-0.689528143930451
puff adder and elapid,721089,NG13 0BF,52.943238515562300,-0.813825310951671
whip snake and tokay,706119,NG31 9AS,52.912965000000000,-0.632566000000000
green turtle and thorny devil,708626,NG24 2TH,53.082583332563800,-0.772629408667882
Hawaiian honeycreeper and Crow,720595,NG13 8QZ,52.948543056144700,-0.946530120406304
Piping shrike and pit viper,720362,NG13 9EU,52.944559864583900,-0.890134585761131
habu and Hawaiian honeycreeper,705954,NG31 9RW,52.923294881270900,-0.621797946417087
Polecat and bull snake,710024,NG23 5SR,53.081126424976400,-0.901733000000000
black snake and Parrotlet,706640,NG31 6PX,52.911641283309500,-0.646601243138919
Komodo dragon and Macaw,708949,NG24 2GL,53.073729418815000,-0.770970536802212
cobra and dukite,709114,NG24 2ST,53.079262998443800,-0.781068969086603
habu and giant tortoise,721731,NG12 1ED,52.969537653200300,-1.015141765524490
Mamo and snake,710169,NG23 5AA,53.031412102141200,-0.738054769725496
New World blackbird and Chicken,706054,NG31 8QY,52.928762941230400,-0.638360989185684
puff adder and Scimitar babbler,705913,NG31 9QL,52.926679947672000,-0.619890404035039
Mink and Herring gull,709147,NG24 1QU,53.072860970382200,-0.803072206412739
Cuscus and hawksbill,719824,NG14 7PA,53.005149117952900,-0.997312635942447
Egret and Kākāriki,706575,NG31 7SL,52.900612387903100,-0.652297154269796
diamond python and Viscacha,708534,NG24 3NU,53.055164542653600,-0.774333674986426
bearded lizard and Ice seal,706213,NG31 9GW,52.920781555559000,-0.628348088573224
Puffleg and mud turtle,708503,NG24 4TJ,53.066030746074100,-0.838646439311709
coral snake and Ibex,708930,NG24 2FL,53.093510679193100,-0.791567932102854
Meadowlark and hoop snake,705428,NG32 1TD,52.912783749298000,-0.687536702450609
tortoise and Jackal,709070,NG24 2PX,53.082144017235500,-0.751994125945122
Puffleg and monitor,720492,NG13 9PX,52.917405239727300,-0.884731033265172
Linsang and Elephant,708538,NG24 3NZ,53.055321000000000,-0.770174420809727
terrapin and bushmaster,706715,NG31 7AW,52.907334347614100,-0.648906445786902
Greenbul and Coati,706088,NG31 8SS,52.918298293250000,-0.662873481775178
White ibis and Viscacha,709064,NG24 2PQ,53.102198370468400,-0.779284000000000
kabaragoya and flying dragon,705654,NG32 1DE,52.907833377368800,-0.679701229386372
American sparrow and sand lizard,706531,NG31 6JP,52.904497303562300,-0.638706000000000
Night heron and Komodo dragon,720621,NG13 8SH,52.952088060872300,-0.945863499082643
gavial and ringhals,706179,NG31 9DY,52.905442884055600,-0.631315712201391
horned toad and Gull,709039,NG24 1NY,53.075748061752300,-0.798752761463558
Tattler and copperhead,720432,NG13 8GZ,52.948872548800200,-0.941119405493487
gopher snake and Old World quail,710178,NG23 5AP,53.047802588158500,-0.735726298386670
soft-shelled turtle and taipan,720624,NG13 8SN,52.953120809197600,-0.972437780757938
Fulmarine petrel and Chickadee,720387,NG13 9HF,52.903740335541500,-0.926653057371277
green turtle and Cloud rat,721595,NG12 3DU,52.913679067786100,-0.984510027428791
Flameback and blind snake,708964,NG24 2HL,53.086710000000000,-0.795417000000000
Boto and Parrotbill,706634,NG31 6PG,52.912540300982400,-0.646602963614407
tuatara and chuckwalla,705649,NG32 1BY,52.917568584715900,-0.694263436760058
anole and ringhals,706033,NG31 8PR,52.933135409827900,-0.666403712207552
Darwin's finches and gopher snake,710788,NG22 8BW,53.084781287595500,-1.024771486114050
hognose snake and constrictor,709935,NG23 5LU,52.999754725314300,-0.879406730420146
galliwasp and grass snake,708323,NG25 0EQ,53.080088113255100,-0.944591118142562
harlequin snake and Diving bird,1796491,NG24 3UQ,53.056891172600000,-0.768943084200000
sidewinder and amethystine python,720332,NG13 9BE,52.951688458866100,-0.898808434277081
Parakeet and Peafowl,706787,NG31 7DJ,52.910589561537700,-0.656909749964789
smooth snake and Gull,705569,NG32 2JY,52.975268751024100,-0.721849132105668
Lemming and Pratincole,720677,NG13 8SX,52.952675105731600,-0.970796133102147
Goose and bearded dragon,720810,NG13 8DP,52.950332205952900,-0.939476291578336
blind snake and Diving bird,708436,NG24 4PP,53.060102332856600,-0.821750038522245
Philippine hawk-owl and galliwasp,706549,NG31 6LQ,52.912803135085400,-0.644260000000000
sidewinder and Kangaroo,706514,NG31 7QQ,52.905680397594700,-0.656853403398350
diamond python and Civet,708869,NG24 3HE,53.056007000000000,-0.785336000000000
mamba and horned viper,706553,NG31 6LX,52.910573734582800,-0.644554000000000
blindworm and Perching duck,708259,NG25 0AA,53.078581864208000,-0.956257014582525
Armadillo and cerastes,708915,NG24 3LP,53.054169431046700,-0.778972191159398
puff adder and horned viper,708082,NG25 0RR,53.090466000000000,-0.964120000000000
cobra de capello and Boto,720702,NG13 8UD,52.950384360573000,-0.938269409914676
habu and Buzzard,705537,NG32 2HF,52.931523357339900,-0.728479254566225
turtle and Chipmunk,2579451,NG24 9NL,53.074593968200000,-0.814309088600000
Pitohui and anole,706328,NG31 7FN,52.900728392382500,-0.648264481568001
copperhead and Piping shrike,706571,NG31 7SF,52.903655498434900,-0.651846000000000
Kangaroo and gecko,706141,NG31 8AE,52.916433669049900,-0.655375532174647
blue tongue and Masked owl,705838,NG31 9JS,52.914758569731900,-0.628374788370447
crocodile and coral snake,708477,NG24 4RY,53.067885222012900,-0.831567046052523
Tattler and Thrasher,720365,NG13 9EY,52.945436553812100,-0.891600391202487
agama and Parakeet,706463,NG31 7LT,52.913043154027900,-0.667229122081976
Eagle and Thrasher,1796494,NG24 3WB,53.049968921500000,-0.766874000000000
anole and elapid,709385,NG24 1DL,53.088504891063600,-0.816763769189865
Meadowlark and swift,720337,NG13 9BS,52.967739731127700,-0.907111287497592
Thicketbird and Thicketbird,708650,NG24 3UB,53.058104491465700,-0.847230396273115
soft-shelled turtle and mamba,720770,NG13 8AL,52.952321746068300,-0.949921335969236
rock python and Capuchin,709031,NG24 1NN,53.077795760893300,-0.802129243856182
Black jay and cayman,706369,NG31 8HQ,52.925598000000000,-0.657189000000000
jew lizard and black snake,708306,NG25 0DT,53.085740663774900,-0.956621373310100
Kākāriki and chuckwalla,708961,NG24 2HG,53.084907864149400,-0.793361652610677
Macaw and Jerboa,708348,NG24 4HH,53.062714913362800,-0.809665825662224
Logrunners and Pitohui,710711,NG22 8US,53.104977981994000,-0.989062000000000
Coati and puff adder,709177,NG24 1SJ,53.066403067955000,-0.795610035140521
Greenbul and snapping turtle,709181,NG24 1SQ,53.068012000000000,-0.797276270088487
habu and Kākāriki,708371,NG24 4JP,53.065560164362200,-0.813721312143295
Partridge and gavial,720426,NG13 8GS,52.925208674942800,-0.963206573223489
frill-necked lizard and tortoise,720486,NG13 9PP,52.913679000000000,-0.892828000000000
worm lizard and Mamo,709058,NG24 2PD,53.105430000000000,-0.729212000000000
rock python and mountain devil,721528,NG12 2NN,52.946080928649600,-1.004006619896510
racer and Wallaby,708939,NG24 2FY,53.086852754467900,-0.792784668449082
loggerhead and Ice seal,707980,NG25 0LA,53.077047174583200,-0.961683007077311
Civet and Old World warbler,708795,NG24 3EG,53.055660084071700,-0.790254721186501
Solitaire and chuckwalla,706222,NG31 9HN,52.921911692571500,-0.635004000000000
king cobra and Wader,708428,NG24 3NE,53.065420801382700,-0.775117095765015
New World blackbird and sand lizard,705945,NG31 9RH,52.924236910401300,-0.622407680000741
Lemming and gaboon viper,706025,NG31 8PF,52.913810770367200,-0.652393151060485
caiman and Jay,719740,NG14 7EF,53.003880000000000,-0.968640000000000
garter snake and death adder,708566,NG24 3QJ,53.061091631875300,-0.779865825942745
moloch and Komodo dragon,709048,NG24 1PN,53.073609025819200,-0.797021082214041
Skunk and garter snake,710490,NG22 8NR,53.097805243046500,-0.957733433441507
Pitohui and rattlesnake,710022,NG23 5SP,53.067398428483300,-0.890606429915170
alligator and Towhee,2663656,NG24 9PX,53.074613000000000,-0.814305000000000
Piping shrike and cobra de capello,708994,NG24 2JY,53.074664789679600,-0.779750890161505
blind snake and Cloud rat,2258143,NG31 8BF,52.915128000000000,-0.649968000000000
diamond python and Flameback,709468,NG24 1HD,53.080556000000000,-0.807472000000000
Snipe and Mockingbird,708410,NG24 4NQ,53.059355543741400,-0.823501331453635
puff adder and cobra,708736,NG24 3AF,53.060470409874600,-0.785926856636436
skink and rock snake,706989,NG31 6ED,52.909252572484400,-0.639746103823989
sea snake and black snake,708662,NG24 3UW,53.048350480340100,-0.770857149414382
Recurvebill and agamid,708376,NG24 4JU,53.060413678493100,-0.811475137845728
Black jay and Marmoset,721535,NG12 2NW,52.945562075576800,-1.006459229377960
River dolphin and blue racer,706480,NG31 7NR,52.909668000000000,-0.640577093679687
bandy-bandy and slowworm,709206,NG24 1TW,53.073445000000000,-0.809176000000000
fer-de-lance and Mink,707015,NG31 6HT,52.902227987131500,-0.634747443930338
cerastes and Dorcopsis,706152,NG31 9BH,52.915981278111200,-0.628380776169051
alligator and dukite,705655,NG32 1DF,52.909893894559400,-0.687980939544796
thorn lizard and Gull,708741,NG24 3AN,53.064759000000000,-0.793021449748722
tuatara and Guillemot,706806,NG31 7EH,52.911925573895000,-0.656600742126595
elapid and Old World warbler,720589,NG13 8QP,52.947458959969600,-0.940871141426363
Bronzewing pigeon and Grouse,705949,NG31 9RP,52.924484560158400,-0.630611156041352
rock python and Schneider python,705901,NG31 9PW,52.927537430324900,-0.626393988493362
Black cockatoo and Polecat,709931,NG23 5LQ,53.011766518838700,-0.901751572257301
tuatara and bandy-bandy,708138,NG24 4WF,53.071868145395600,-0.817966101181923
sidewinder and Herring gull,705859,NG31 9LT,52.913871233234300,-0.627049471872673
copperhead and smooth snake,706523,NG31 7RE,52.902206245828500,-0.659681664978420
Marsh harrier and krait,709368,NG24 1BG,53.076337071344000,-0.813559501172395
worm lizard and chameleon,708886,NG24 3JA,53.050884697923200,-0.782138312889206
bearded dragon and Komodo dragon,1796612,NG31 8UH,52.932878469200000,-0.666545612200000
elapid and blue tongue,709498,NG24 1JT,53.077015120186600,-0.806748690092966
blindworm and diamond python,707982,NG25 0LD,53.074660000000000,-0.961024000000000
Partridge and Mamo,707003,NG31 6HD,52.908399850132200,-0.636724448356118
snake and Pratincole,706353,NG31 8GU,52.926608474686000,-0.648083314651992
krait and gecko,705883,NG31 9NY,52.917454244086500,-0.621269465647073
mamba and Solitaire,708600,NG24 3SB,53.058347698698700,-0.850999004738206
Hawk and Ground sloth,706273,NG31 8DY,52.929721300520700,-0.642764376208958
swift and Kangaroo,706361,NG31 8HE,52.927069711156900,-0.657842775125617
Triller and hognose snake,706482,NG31 7NU,52.908515000000000,-0.655427000000000
Boto and mountain devil,719790,NG14 7GX,53.036122315968400,-0.970451066459257
Moluccan boobook and viper,2655730,NG31 0JR,52.909690000000000,-0.640635000000000
Fox and Jackal,705536,NG32 2HE,52.917496526838600,-0.757981759464334
box turtle and sand viper,706522,NG31 7RD,52.903929943526800,-0.662661649390369
slowworm and asp,709744,NG23 6FQ,53.074582435966300,-0.814294369995519
cayman and pit viper,705565,NG32 2JT,52.975466823995800,-0.737019203478965
Mole and Flameback,706724,NG31 7BG,52.901439000000000,-0.645016000000000
loggerhead and tree snake,720352,NG13 9EE,52.945541870291200,-0.890362458170858
swift and Kestrel,706071,NG31 8RU,52.913952522183400,-0.669759179751643
Chicken and Boto,706372,NG31 8HT,52.925341459196600,-0.652883059748319
Prion and thorny devil,719769,NG14 7FT,53.034094000000000,-0.920034000000000
Scimitar babbler and slowworm,705641,NG32 1BL,52.917561961337800,-0.689578600401886
boomslang and Quetzal,720729,NG13 0GW,52.927196369228200,-0.759814000000000
Warbler and hoop snake,721559,NG12 3AT,52.925666761648900,-0.981879262759434
diamondback and tokay,708790,NG24 3EA,53.054218546598700,-0.789056730532715
gecko and Vulture,708230,NG24 9HW,53.074582435966300,-0.814294369995519
gopher snake and Mouse,877746,LN5 0RR,53.072551000000000,-0.693969000000000
Elephant and Recurvebill,720103,NG14 7AU,53.009683641889800,-1.008490154731750
black snake and Jackal,706535,NG31 6JT,52.903523891874800,-0.634082236521490
horned toad and gaboon viper,709408,NG24 1EW,53.078774000000000,-0.807143498780895
Solitaire and galliwasp,721594,NG12 3DT,52.915260642489100,-0.983387389578985
Condor and White ibis,705449,NG32 2AU,53.022205040583800,-0.655846310769794
python and Francolin,1796597,NG31 7GJ,52.901756899000000,-0.648186000000000
Tit-tyrant and Francolin,707954,NG25 0HS,53.076720703681000,-0.945001859281921
diamond python and bicycle lizard,706567,NG31 7RW,52.903270748360700,-0.656823841648216
iguana and tortoise,705571,NG32 2LA,52.976893810341900,-0.720818216736468
amphisbaena and puff adder,710312,NG23 5EY,52.990402747710800,-0.751004903081026
Solitaire and Dolphin,706300,NG31 8FH,52.931551055349500,-0.643971771970704
perentie and bandy-bandy,721451,NG12 2HL,52.948186845889100,-1.021609708144080
bull snake and agama,708044,NG25 0PR,53.086663397827600,-0.944399000000000
Chipmunk and Ice seal,706880,NG31 0SJ,52.910858820938800,-0.639487593593744
Hawaiian honeycreeper and Minke whale,1796476,NG24 1GL,53.080603758100000,-0.802215634300000
Linsang and Jackal,706689,NG31 6TF,52.911496502735800,-0.638529000000000
sea snake and amphisbaena,709414,NG24 1FE,53.082217477649200,-0.810590000000000
hawksbill and milk snake,709510,NG24 1LJ,53.078832000000000,-0.804068081530452
Mole and Old World vulture,1796631,NG31 9SA,52.920371000000000,-0.626963000000000
snapping turtle and boa constrictor,708475,NG24 4RW,53.061286867791000,-0.827910515447107
Darwin's finches and amphisbaena,706683,NG31 6SU,52.916361645265200,-0.640356245362451
flying lizard and bushmaster,708593,NG24 3RT,53.050941303257100,-0.827146881433167
Gila monster and snapping turtle,706794,NG31 7DT,52.910762394452600,-0.659477061831093
Prion and chameleon,708700,NG24 4BX,53.069589817943100,-0.803177819578176
saltwater crocodile and Parakeet,706921,NG31 6BS,52.907234359871100,-0.642500730505363
swift and Quetzal,708324,NG25 0ER,53.078355000000000,-0.949769000000000
Petrel and diamond python,2655711,NG23 5GP,52.991347000000000,-0.732692000000000
Argus and Tit-tyrant,710304,NG23 5EP,52.987976247149000,-0.752788073318179
python and Snipe,720457,NG13 8JR,53.006283332840600,-0.944499185987584
Skunk and Songlark,1796602,NG31 7GR,52.911095000000000,-0.652269000000000
Pratincole and Perching duck,706642,NG31 6PZ,52.910858820938800,-0.639665000000000
boa constrictor and Wader,706695,NG31 6TS,52.909794768190500,-0.638526000000000
horned toad and wall lizard,710789,NG22 8BX,53.096088124390400,-1.003921657059260
