name,postcode,lat,lon
New World blackbird and mamba,LN4 3JJ,53.069947726840000,-0.449458361418102
blue racer and Bunting,LN4 3NQ,53.080055000000000,-0.384042953832177
cobra de capello and Meadowlark,LN4 3QU,53.123800310453800,-0.321715402403448
Fulmarine petrel and Francolin,LN4 3ST,53.091704703371800,-0.317185157646866
horned toad and amethystine python,LN4 3YB,53.095300347627200,-0.435105688898204
swift and Polecat,LN4 4BQ,53.098975826950900,-0.294317599592598
king snake and Scimitar babbler,LN4 4DA,53.082547249348400,-0.279080860140572
Pratincole and Masked owl,LN4 4DH,53.051817194995300,-0.284572623501113
Peafowl and Parakeet,LN4 4DR,53.066495000000000,-0.290527000000000
dukite and hawksbill,LN4 4DS,53.056351172490000,-0.322606822732736
puff adder and indigo snake,LN4 4EJ,53.081107769838900,-0.286483951522268
Mink and Wader,LN4 4ER,53.080849573834800,-0.294168293262606
Cloud rat and flying dragon,LN4 4HL,53.079986748463400,-0.276092502267031
Coati and terrapin,LN4 4HR,53.080796687822900,-0.279255192430807
Buzzard and Capuchin,LN4 4JR,53.106811282285000,-0.209571150035442
Asiatic leopard and asp,LN5 0BX,53.095508000000000,-0.507189000000000
Rat and Tree warbler,LN5 0EQ,53.106854722422200,-0.526873333612682
Perching duck and frill-necked lizard,LN5 0ER,53.106281976326700,-0.520558992112445
Shearwater and Mink,LN5 0LN,53.111363326629500,-0.587809000000000
Cuscus and python,LN5 0QH,53.076692000000000,-0.544190000000000
Badger and Perching duck,LN5 0QW,53.062594636408700,-0.578361837347955
brown snake and bandy-bandy,NG31 9FP,52.923800569031700,-0.609643566866073
taipan and Pheasant,NG31 9UF,52.916656516061200,-0.607596816376325
wall lizard and Zebra,NG31 9UL,52.920393459869200,-0.608116536797381
saltwater crocodile and habu,NG32 2NG,52.966830969328800,-0.612328336230579
Polecat and Philippine hawk-owl,NG32 2PL,52.976347994559400,-0.596727899892873
Snipe and amethystine python,NG32 3ET,53.024334082248100,-0.570479000000000
White ibis and Myna,NG32 3LW,52.935093815835700,-0.551832576704692
tuatara and box turtle,NG32 3ND,52.938783939078300,-0.507126844263089
Mockingbird and alligator,NG32 3PF,52.973690727738300,-0.506996469627219
rock snake and Bunting,NG32 3QJ,52.983560121982600,-0.535778084079763
box turtle and moloch,NG32 3RN,53.016174778074500,-0.521005000000000
soft-shelled turtle and bearded dragon,NG32 3RS,52.983676402433000,-0.529175176133442
habu and snake,NG34 0AF,52.970207510500000,-0.386821935600000
Badger and Jackal,NG34 0AN,52.943822765364800,-0.375837847917124
snapping turtle and elapid,NG34 0BF,52.928927418316900,-0.414556418066221
Rabbit and Parrotlet,NG34 0BJ,52.989586156374400,-0.375417691293076
snake and swift,NG34 0BS,52.934300000000000,-0.265565000000000
Elephant and Civet,NG34 0DB,52.977048000000000,-0.344923000000000
leathery turtle and python,NG34 0DF,52.980088000000000,-0.337329000000000
galliwasp and sand lizard,NG34 0DN,52.929541315480000,-0.410710407836668
cobra de capello and bushmaster,NG34 0FB,52.903571078800000,-0.336573028800000
jew lizard and tree snake,NG34 0RG,52.950605584783200,-0.308466803188365
Dorcopsis and Warbler,NG34 4SE,52.999746628185800,-0.405421305470977
diamond snake and dugite,NG34 4SS,52.999746628185800,-0.405421305470977
sea snake and chameleon,NG34 4ST,52.999746628185800,-0.405421305470977
frilled lizard and python,NG34 6AB,52.988646000000000,-0.418637000000000
Pheasant and Greenbul,NG34 7DY,53.001134417696800,-0.405668216799835
Moluccan boobook and Darwin's finches,NG34 7EF,52.999635000000000,-0.405723000000000
horned viper and Jerboa,NG34 7EY,52.996179110861000,-0.406208367326302
Crow and bull snake,NG34 7FL,52.994620730987400,-0.395284353451178
Chicken and Mockingbird,NG34 7GB,52.998446202607800,-0.392966902570816
blue tongue and mud turtle,NG34 7GX,52.992687395240700,-0.409972393063079
Peafowl and Marmoset,NG34 7HJ,52.999978342102700,-0.400584529689984
taipan and lizard,NG34 7JU,52.993735225606000,-0.434056650438921
Ground sloth and Capuchin,NG34 7LB,52.991182911306700,-0.411755926779409
Tahr and anole,NG34 7LN,52.992832640332800,-0.415464969501071
blind snake and black snake,NG34 7QS,52.999352853048700,-0.415643505351195
sea snake and Buzzard,NG34 7QY,52.999729006352400,-0.416210907200553
Rat and Bronzewing pigeon,NG34 7RW,52.995957218544300,-0.409107249469806
Badger and wall lizard,NG34 7SJ,52.996077969373500,-0.410741878569795
Fulmarine petrel and diamond python,NG34 7SP,52.987523167348400,-0.411026114865391
bicycle lizard and saltwater crocodile,NG34 7TH,52.988087874926500,-0.410901104980523
Thrasher and carpet snake,NG34 7XP,52.989076324587200,-0.431856358272610
Grouse and Diving bird,NG34 7YW,52.998615830128100,-0.405567279364975
carpet snake and skink,NG34 8AY,53.007655824233000,-0.421435444863345
Pitohui and rock snake,NG34 8BP,53.009488441469800,-0.423365874720698
gavial and Zebra,NG34 8EG,53.045460319155600,-0.495776055768742
Towhee and Fox,NG34 8FL,53.037690630078900,-0.469513024620800
bushmaster and chameleon,NG34 8GE,52.980997931177000,-0.449963738980767
Recurvebill and rattlesnake,NG34 8GL,53.009747000000000,-0.399538000000000
rock python and Jay,NG34 8GU,52.985327960200000,-0.454411943300000
horned viper and saltwater crocodile,NG34 8GW,52.984682403949900,-0.453302762491241
blindworm and Diving bird,NG34 8HJ,53.036688110661900,-0.492382590197646
dukite and B,NG34 8HQ,52.982449820100000,-0.446724141600000
snake and worm lizard,NG34 8JF,53.025207004764700,-0.420272870115529
tokay and glass snake,NG34 8LT,53.024549000000000,-0.422742000000000
galliwasp and Guillemot,NG34 8QG,52.997633270360700,-0.471779223809702
king snake and tuatara,NG34 8RH,53.056258974496100,-0.455217064136339
Songlark and Parrotlet,NG34 8RL,53.052811190318900,-0.468768445193252
brown snake and flying lizard,NG34 8SJ,53.026763608017600,-0.386218450331759
deaf adder and sidewinder,NG34 8SR,53.010581091151100,-0.386196154439104
coral snake and Asiatic leopard,NG34 8TB,52.943965150322200,-0.454606546730417
Logrunners and boa,NG34 8TE,53.010011194276600,-0.418726152259874
giant tortoise and indigo snake,NG34 8UP,52.989556033530500,-0.421231369378329
asp and Goose,NG34 8YL,53.012542000000000,-0.415946000000000
horned toad and Egret,NG34 9AF,53.045561849653600,-0.392855908533687
Snipe and black snake,NG34 9AY,53.046980475289100,-0.401217000000000
Lemming and Scimitar babbler,NG34 9BY,53.043424135871200,-0.386357032913804
Argus and Prion,NG34 9DH,53.042150036528200,-0.377946924890009
rock snake and Armadillo,NG34 9DN,53.044348817716800,-0.382951186452001
terrapin and cerastes,NG34 9EW,53.046129700325000,-0.394296740342292
elapid and grass snake,NG34 9FD,53.048021698048000,-0.403953315251310
Bunting and mamba,NG34 9FN,53.048059897239500,-0.397432492417688
horned toad and carpet snake,NG34 9FX,53.043956530818700,-0.393810650043039
Chipmunk and jew lizard,NG34 9GG,53.045262963187400,-0.390032679710919
tree snake and coral snake,NG34 9GW,52.984122208923200,-0.307262038268688
Old World warbler and chameleon,NG34 9GY,53.045988238544300,-0.391810714917789
Parrotlet and harlequin snake,NG34 9HJ,53.048945328738700,-0.393594000000000
Armadillo and Dolphin,NG34 9JB,52.969533000000000,-0.289709000000000
Herring gull and Fulmarine petrel,NG34 9LG,52.971116502423400,-0.291776001360030
fer-de-lance and Tattler,NG34 9NE,52.990990000000000,-0.280220000000000
tiger snake and milk snake,NG34 9PP,53.013540000000000,-0.326981000000000
Tattler and Perching duck,NG34 9PQ,53.014621091243000,-0.327877883342694
cobra de capello and puff adder,NG34 9QS,52.979236303762400,-0.310759709978973
bandy-bandy and Dolphin,NG34 9RF,52.981093013281100,-0.299738968870991
Komodo dragon and elapid,NG34 9SN,53.039164914658800,-0.338831008509780
boomslang and goanna,NG34 9SQ,53.035333000000000,-0.356741000000000
Kite and Kangaroo,NG34 9UF,52.982076631102400,-0.305033120669148
Lemming and Moluccan boobook,NG34 9UT,52.984368224384700,-0.305598876765821
Black jay and horned viper,NG34 9UX,52.980788317242000,-0.309894810661267
