name,id,postcode,lat,lon
Magpie and copperhead,1307451,DL1 2JS,54.544660055447100,-1.548354450562300
Coati and Cuscus,1307523,DL1 2RB,54.545731672069900,-1.532358808869240
Boto and Fox,1298850,DL3 9SL,54.539702463605300,-1.597667219416590
Civet and Egret,1299385,DL3 6UL,54.531328237654200,-1.561683000000000
Kākāriki and Marsh harrier,1304802,DL12 8XB,54.525804868404800,-1.820462526538060
Perching duck and thorny devil,1302515,DL14 9SF,54.620820895936400,-1.757634233546440
Chipmunk and New World blackbird,1307609,DL1 2UB,54.534411736801300,-1.512768885344250
Peafowl and White ibis,1307615,DL1 2UJ,54.534060631048400,-1.544932486021550
Rabbit and blue racer,1298476,DL5 4ET,54.620849830441300,-1.578020243665270
perentie and crocodile,1299602,DL3 6BG,54.530231435832500,-1.559299396699900
Booted eagles and Elephant,1297887,DL5 6XQ,54.606684000000000,-1.566757000000000
grass snake and Fox,1306357,DL10 5AZ,54.409968992550900,-1.727540125247300
Jerboa and Mole,1305258,DL11 7HE,54.480759457550500,-1.801275007356770
Civet and Coati,146428,TS21 1HP,54.574672000000000,-1.477885000000000
Darwin's finches and Jerboa,1305852,DL10 6RA,54.448218849426100,-1.650981442683590
cayman and Duck,1298296,DL5 5BB,54.620036121709600,-1.556518092911660
anole and Puffleg,1307682,DL1 1TG,54.526904652592100,-1.546696196359080
jew lizard and Warbler,1307226,DL1 2YL,54.544578710622700,-1.543439770284410
green turtle and Egret,1298627,DL3 9HT,54.534653012590100,-1.576931200143260
Diving bird and Grouse,1305265,DL11 7HP,54.477487893922200,-1.812340412179660
kabaragoya and Guillemot,1307014,DL1 5EE,54.514091054390700,-1.549587442359610
asp and sand viper,1297133,DL6 2EU,54.433373218394000,-1.462509494714810
gaboon viper and Kestrel,2651708,DL2 2JT,54.491724000000000,-1.530314000000000
Jackal and smooth snake,2640595,DL3 6DB,54.531232000000000,-1.554260000000000
Schneider python and Rat,1307138,DL1 2YB,54.544321890941500,-1.542066900798200
cycling lizard and Hawaiian honeycreeper,1300464,DL2 1BP,54.513260222610800,-1.468829482571180
sidewinder and sand lizard,1299468,DL3 7DT,54.526298174477100,-1.559403000000000
horned toad and cobra de capello,1305931,DL10 7AQ,54.405603975031700,-1.732776050552320
Moluccan boobook and puff adder,1307266,DL1 3DG,54.547691841429500,-1.544409862883390
Diving bird and Stilt,1298280,DL5 5AG,54.617196063504000,-1.558918208636830
Mink and rat snake,1299696,DL3 6HQ,54.533947689566600,-1.568068032915740
rock python and Mockingbird,1306394,DL10 5EY,54.418280968993600,-1.747764793644050
Marmoset and flying lizard,1299155,DL3 7TH,54.524784876674200,-1.561644662734660
cerastes and Magpie,1307002,DL1 5DL,54.519734826610500,-1.551997120261370
tortoise and Masked owl,1306383,DL10 5ED,54.425828401200200,-1.685665868464850
Viscacha and Herring gull,1307152,DL1 4GQ,54.526077977468000,-1.505420763754480
Moluccan boobook and Asiatic leopard,1299723,DL3 6LQ,54.528369128505900,-1.558747731359810
turtle and Kite,1299929,DL2 3NE,54.580907474409300,-1.800247129732060
Quetzal and gavial,1306667,DL1 5LX,54.521080325079600,-1.548892618599250
Rat and Fish eagle,1299719,DL3 6LE,54.528969764841000,-1.558339508850910
rat snake and Gila monster,1300419,DL2 2JL,54.484453000366700,-1.537950822840670
saltwater crocodile and hawksbill,1298812,DL3 9RL,54.536737596531600,-1.589876234730840
Fulmarine petrel and Buzzard,1302491,DL14 9QZ,54.620285961192900,-1.764358490758660
Duck and Mamo,1299821,DL3 0PD,54.538922895902100,-1.552250768693950
Songlark and leguaan,1298908,DL3 9XT,54.527146096054100,-1.594484054582000
death adder and Tahr,1306659,DL1 5LJ,54.522384806319000,-1.546854376292310
dugite and Mamo,1306247,DL10 4RQ,54.400743279563800,-1.741649256603440
diamond snake and Treepie,1306837,DL1 4PW,54.519144000000000,-1.515175000000000
Polecat and perentie,1298366,DL4 2JN,54.623393683689300,-1.642468881150810
soft-shelled turtle and Chickadee,1299127,DL3 7RB,54.524687800678000,-1.564627603450420
fer-de-lance and Logrunners,1305961,DL10 7DR,54.406514476738200,-1.718180915253840
Tahr and Guillemot,1307134,DL1 2XN,54.537732736836900,-1.518463237979600
caiman and Ice seal,1300416,DL2 2JG,54.483916098748300,-1.540920374755410
Macaw and Perching duck,1307491,DL1 2PD,54.534858480688500,-1.549204406689610
king snake and Parrotbill,1300367,DL2 2EX,54.486845222278900,-1.529063593306460
hoop snake and tree snake,1303664,DL13 5QW,54.621989452678400,-1.838810134718650
Old World quail and sand lizard,1768281,DL98 1TL,54.527513250706600,-1.559699669343980
massasauga and swift,1299806,DL3 0NJ,54.541319963425000,-1.551590822748690
Masked owl and Songlark,1299737,DL3 0GT,54.539693629072200,-1.561484987855220
Old World quail and skink,1307245,DL1 3AL,54.552794468600300,-1.546285644360370
gavial and blind snake,1300096,DL2 3XG,54.580163665640500,-1.735751000000000
frill-necked lizard and blind snake,1307339,DL1 2FQ,54.542667270252900,-1.534727849907470
Condor and Dorcopsis,1299886,DL3 0QE,54.542879160958400,-1.575254073207280
water snake and copperhead,1307274,DL1 3DS,54.548947737445600,-1.541427663081450
Towhee and Condor,1300172,DL2 2UQ,54.598524867246500,-1.666863491418490
sand lizard and Kite,1299793,DL3 0LS,54.540509669198800,-1.553624470233800
death adder and Ground sloth,1299074,DL3 9DF,54.530882814792900,-1.591263810403910
boomslang and Perching duck,1299989,DL2 3RZ,54.545656000000000,-1.786351592039770
Stilt and king snake,1298869,DL3 9TT,54.539588972202500,-1.598672966808120
alligator and diamondback,1306463,DL10 4AP,54.405866534584500,-1.741940604402160
Komodo dragon and ringhals,1299282,DL3 8HA,54.518478858366700,-1.569945899117970
frilled lizard and Gila monster,1300363,DL2 2ES,54.487968849771800,-1.529127869909440
green turtle and tree snake,1306932,DL1 3RL,54.547616000000000,-1.519831000000000
Armadillo and moloch,1299397,DL3 7AJ,54.525501844898800,-1.561096217114260
diamondback terrapin and Flameback,1299294,DL3 8HW,54.520928000000000,-1.568592000000000
Armadillo and crocodile,2634731,DL11 7SN,54.495717000000000,-1.690358000000000
Badger and Lemming,1306513,DL10 4EY,54.405277420887300,-1.752466086835760
crocodile and Elephant,1307052,DL1 3TS,54.548817682223500,-1.535600926813930
New World blackbird and Perching duck,1298464,DL5 4DS,54.619834045118900,-1.572811869939370
slowworm and Grouse,1299981,DL2 3RP,54.544795626333800,-1.782956076423760
puff adder and Parakeet,1306356,DL10 5AY,54.411493591438500,-1.722183592774030
blue tongue and water snake,1298780,DL3 9PR,54.528386764270600,-1.586653234268860
tree snake and carpet snake,2594410,DL1 9UQ,54.522106000000000,-1.550760000000000
Chicken and Ice seal,1307159,DL1 4HH,54.514118384937400,-1.535422892285250
Kite and death adder,1299253,DL3 6PR,54.535336435659000,-1.559414431390930
rat snake and Moluccan boobook,1299664,DL3 0EZ,54.547454573448200,-1.550657892183290
Towhee and glass snake,1300269,DL2 2AH,54.486638493017600,-1.522181536516400
whip snake and coral snake,1302480,DL14 9QL,54.616976000000000,-1.757975000000000
soft-shelled turtle and Vulture,1768142,DL3 0QJ,54.536958771373000,-1.559768068017170
Mink and amethystine python,1299859,DL2 3JY,54.577480669322600,-1.809654226122920
Grouse and Badger,1307168,DL1 4HU,54.515836472178000,-1.531170942152560
tuatara and adder,1299542,DL3 0XQ,54.556035000000000,-1.552172000000000
boa constrictor and Shearwater,1299631,DL3 0DF,54.538419203344000,-1.587541069029220
Booted eagles and Grouse,1298970,DL3 8RY,54.518957598814400,-1.578298292529690
Komodo dragon and bandy-bandy,1298473,DL5 4EP,54.619419793594700,-1.577694337404210
chameleon and kabaragoya,1299943,DL2 3NX,54.587280767319000,-1.780533000000000
Gila monster and Herring gull,1299432,DL3 0SX,54.544485593411600,-1.579766515027920
Goose and tokay,1307975,DL1 1EG,54.524004226666800,-1.528497274188600
smooth snake and caiman,1297871,DL5 6UF,54.611183712407300,-1.579080125214540
Asiatic leopard and worm lizard,1306196,DL10 6JQ,54.474509510931000,-1.646051297248190
Badger and Zebra,1307208,DL1 4LW,54.512269398491200,-1.531366222879110
Fox and Condor,1306982,DL1 5AS,54.509000298132400,-1.550894401924010
Vole and Vulture,1299348,DL3 6QZ,54.535968138069400,-1.560133994534280
python and horned toad,1306497,DL10 4DY,54.403393904737900,-1.741386142695660
moloch and puff adder,1298302,DL5 5BL,54.619367174253100,-1.557903628216710
Fulmarine petrel and krait,1307418,DL1 3QT,54.549850745844300,-1.517114738159310
Kestrel and hawksbill,1299940,DL2 3NT,54.575375022056600,-1.771655904702600
elapid and cayman,1306271,DL10 4TA,54.409657839421900,-1.754288559645760
Thrasher and Skunk,1307250,DL1 3AS,54.552303275318900,-1.544714099806110
blind snake and diamond snake,1298134,DL5 4NN,54.622972000560900,-1.575814560846980
perentie and Stint,2625084,DL3 0AP,54.539536000000000,-1.566782000000000
Chipmunk and Marsh harrier,1302449,DL14 9NP,54.606569000000000,-1.757573000000000
gaboon viper and elapid,1299512,DL3 7JY,54.526538133093800,-1.556928798413110
carpet snake and tuatara,1951297,DL1 1PQ,54.526799000000000,-1.564250000000000
flying lizard and elapid,1299933,DL2 3NJ,54.580205181185400,-1.799446060598770
milk snake and Hawk,1300446,DL2 1AQ,54.509277721767900,-1.462440754249840
mountain devil and Treepie,1300141,DL2 2SX,54.480778267543800,-1.554984751331850
sand viper and giant tortoise,1296845,DL7 0EU,54.429748413028300,-1.561996261346680
elapid and Philippine hawk-owl,1299717,DL3 6LB,54.528773187111600,-1.558650665706290
tokay and constrictor,1299295,DL3 8HX,54.521538168931100,-1.573544305509670
Towhee and Zebra,1303912,DL13 5BJ,54.614031379111100,-1.799434833128530
Tree warbler and krait,1306846,DL1 4QH,54.512593872267600,-1.531609642502350
White ibis and dugite,1300298,DL2 3DW,54.546570422031100,-1.739585767082320
Kākāriki and Petrel,1299702,DL3 6HX,54.530374000000000,-1.563733000000000
Mouse and Dolphin,1298007,DL5 5PS,54.620257045263500,-1.565404917800150
deaf adder and crocodile,1298310,DL5 5DL,54.616528000000000,-1.562921000000000
king cobra and Francolin,1300487,DL2 1DZ,54.507192843527000,-1.468568386568220
Songlark and diamond snake,1297550,DL5 7HH,54.620881344467800,-1.597858349600540
cerastes and giant tortoise,1299603,DL3 6BH,54.529764808122200,-1.559489845981110
flying dragon and Kestrel,1306064,DL10 5PE,54.467663163576100,-1.696284517304850
king cobra and blind snake,1305500,DL11 7SZ,54.498774994878500,-1.688797090818380
River dolphin and Black cockatoo,1297537,DL5 7ES,54.623216811774200,-1.594830744964710
dugite and Diving bird,1300286,DL2 2BE,54.486287787888700,-1.524408380468540
Quetzal and Zebra,1299038,DL3 7PY,54.528961638555900,-1.563531428899040
sand viper and Moluccan boobook,1307132,DL1 2XJ,54.537783517746800,-1.517674422998370
Kangaroo and harlequin snake,1306575,DL10 4LL,54.400352270566300,-1.727295730953140
saltwater crocodile and tokay,1299653,DL3 0EJ,54.544824752067100,-1.549140984694730
monitor and grass snake,1298041,DL5 5QU,54.621666875819800,-1.562602242890340
Boto and Masked owl,1306955,DL1 4XP,54.522792879968900,-1.502046082705890
Rat and New World blackbird,1298318,DL5 5DX,54.614534164371300,-1.565883936859700
snapping turtle and king cobra,1300538,DL2 1HF,54.515982540001000,-1.448573976503940
Dolphin and Nukupuʻu,1299923,DL3 0SL,54.546913983604400,-1.557604772235490
Parrotbill and elapid,1307452,DL1 2JT,54.543933239790100,-1.548656166467050
boa and perentie,1300351,DL2 2EB,54.488008204960500,-1.532322764439670
Perching duck and Vole,1299303,DL3 8JG,54.520313630901800,-1.567995000000000
king snake and slowworm,1768137,DL3 0EB,54.540948455569700,-1.590468000000000
Diving bird and Old World vulture,1302509,DL14 9RY,54.623461964605400,-1.761645320099660
Gull and alligator,1306529,DL10 4GD,54.404841198543300,-1.750111732491060
horned toad and hognose snake,1307611,DL1 2UE,54.534350391551900,-1.515396787207930
Flameback and Grackle,2640603,DL5 9BF,54.610444000000000,-1.570118000000000
Chicken and Parrotlet,1307775,DL1 2AL,54.539116328809000,-1.529791473918570
Pitohui and Thrasher,1306751,DL1 5YF,54.516484437027600,-1.562613986978950
turtle and Pheasant,1306159,DL10 6EJ,54.404877026215100,-1.599695769752860
Grackle and asp,1297728,DL5 6JZ,54.596959085678400,-1.564259900594460
diamond snake and Schneider python,1306284,DL10 4TT,54.413460158190700,-1.733449206203510
Quetzal and frill-necked lizard,1307311,DL1 3HQ,54.545924195668100,-1.517300207927380
Parakeet and rock python,146560,TS21 1NQ,54.602838000000000,-1.484415501715710
caiman and Myna,1296847,DL7 0EZ,54.429389643021900,-1.559718755178900
Moluccan boobook and Towhee,1299036,DL3 7PT,54.529042000000000,-1.560687000000000
Dolphin and Triller,1299591,DL3 6AR,54.532027014049700,-1.557116000000000
Masked owl and carpet snake,1306472,DL10 4BA,54.407758787653900,-1.740064587500990
Viscacha and ringhals,1307778,DL1 2AQ,54.539735500780700,-1.531870916037870
Boto and flying dragon,1306542,DL10 4HS,54.403618496684200,-1.737179266049240
boa and Armadillo,1306066,DL10 5PG,54.465319536305300,-1.697073248486380
Linsang and Guillemot,1299126,DL3 7RA,54.525137130896700,-1.564622825969270
tortoise and Jerboa,1306299,DL10 4UN,54.405644615863900,-1.743236049167240
amphisbaena and Chickadee,1300613,DL2 1QR,54.486833000000000,-1.498871000000000
Old World quail and Armadillo,1298756,DL3 9NG,54.530373171596500,-1.576341879843200
taipan and loggerhead,1298823,DL3 9RZ,54.536979757112100,-1.592392955587610
Tree warbler and tree snake,1307346,DL1 2GJ,54.544099489164400,-1.545285000000000
Schneider python and Francolin,1307269,DL1 3DL,54.547920947809100,-1.543201505048570
sand lizard and amphisbaena,1306895,DL1 4TD,54.513147158497600,-1.521424443803240
thorn lizard and Stint,1305507,DL11 7TH,54.496517470391500,-1.684630102564110
Minke whale and sand viper,1302470,DL14 9PW,54.624325609706600,-1.687407000000000
viper and Recurvebill,1307623,DL1 2UZ,54.539078850009300,-1.515727189448720
Duck and asp,1300087,DL2 3UL,54.584280000000000,-1.679482000000000
grass snake and Rabbit,1300514,DL2 2LW,54.534554868410500,-1.656643739834480
box turtle and alligator,1297542,DL5 7EZ,54.622718633240500,-1.596353454168750
gaboon viper and turtle,1300247,DL2 1UD,54.503315712555200,-1.473884486409400
amethystine python and Booted eagles,1300352,DL2 2ED,54.489047148275000,-1.533731103489670
Viscacha and sea snake,1298972,DL3 8SA,54.523199447845700,-1.578300961629460
crocodile and Grackle,1305735,DL10 7SP,54.410093728602400,-1.715367714982770
Guillemot and Piping shrike,1306245,DL10 4RN,54.400963159983900,-1.739414348635710
Quetzal and Grosbeak,1297989,DL5 5NH,54.618579781274400,-1.576479651792980
thorn lizard and cycling lizard,1306733,DL1 5TP,54.510631107752600,-1.556900062491720
Marsh harrier and chameleon,1307209,DL1 4LX,54.514311952227300,-1.546171367661380
Tree warbler and chuckwalla,1297906,DL5 7AF,54.618241544018800,-1.579998411516380
Magpie and asp,1298475,DL5 4ES,54.619730753881800,-1.576669026933170
whip snake and Grackle,1306320,DL10 6NT,54.440444737515900,-1.670073903076090
Mockingbird and gecko,2640556,DL1 9ZE,54.522106000000000,-1.550760000000000
Ibex and asp,1306731,DL1 5TL,54.511782050371900,-1.559528777341910
Prion and water snake,1305841,DL10 6QG,54.428969036149800,-1.638890653963480
Diving bird and bull snake,1299232,DL3 6NE,54.533223814805700,-1.556763715611350
Peafowl and slowworm,1296853,DL7 0HH,54.428274414812600,-1.572000225405320
puff adder and Pratincole,1307256,DL1 3BH,54.547810000000000,-1.547117855639460
kabaragoya and Kangaroo,2634715,DL1 1QJ,54.526415000000000,-1.535246000000000
Darwin's finches and rock python,1307176,DL1 4JE,54.521737698994700,-1.532663750355120
Towhee and Chipmunk,1299453,DL3 0TZ,54.541158161647600,-1.584313974850450
leathery turtle and worm lizard,1298054,DL5 5RL,54.622606759747400,-1.561570001811890
king snake and Bunting,1305708,DL11 7BB,54.513844954600800,-1.725475242063100
king snake and Armadillo,1305952,DL10 7DE,54.410267158952600,-1.716506643005180
cerastes and Armadillo,1297758,DL5 6NT,54.605190576791200,-1.628896916870210
Fox and python,1307293,DL1 3ET,54.547420441905800,-1.539187787007550
Kestrel and Condor,1306433,DL1 9SB,54.523575359158900,-1.552835745610090
perentie and Parakeet,1300227,DL2 1SR,54.548165431130700,-1.468778290566920
Flameback and Old World vulture,1297939,DL5 5HF,54.614608912525600,-1.571736209677530
tuatara and tuatara,1297753,DL5 6NL,54.603570000000000,-1.630689664935550
gopher snake and milk snake,1307507,DL1 2QG,54.542875684493800,-1.532839706858140
River dolphin and python,1300060,DL2 2QR,54.494386720892500,-1.607529746279300
Parakeet and diamondback turtle,1305492,DL11 7SH,54.502486000000000,-1.745825561340980
Schneider python and rock snake,1300277,DL2 2AT,54.486794312375000,-1.525236049574080
boomslang and Dorcopsis,1307639,DL1 1QQ,54.529796101874700,-1.548472089266700
rattlesnake and Chickadee,1299222,DL3 8DJ,54.516035381905400,-1.577880414375700
Kite and Mink,2651711,DL5 6AD,54.607789000000000,-1.563860000000000
viper and Perching duck,1300377,DL2 2FL,54.545403722521100,-1.590685947278110
cobra de capello and sand viper,1306053,DL10 5NQ,54.475990364664700,-1.670806644930790
iguana and Jackal,1305926,DL10 7AG,54.405740513197700,-1.733669000000000
rock python and chameleon,1307270,DL1 3DN,54.547244038045000,-1.542436122787830
snapping turtle and Grackle,1305524,DL11 7UE,54.536311330638600,-1.763389217070790
Ground sloth and Minke whale,1300046,DL2 2PX,54.466900971241800,-1.544967880275800
Prion and Quetzal,1299875,DL2 3LW,54.580025610980100,-1.810725356627800
chameleon and Komodo dragon,1300714,DL2 1RZ,54.545083364114600,-1.475063358083460
giant tortoise and kabaragoya,1307084,DL1 4BH,54.518178170552500,-1.539516860053760
Hawk and Schneider python,1306026,DL10 5JZ,54.453936584828400,-1.754116299397490
Tree warbler and Parrotbill,1299439,DL3 0TF,54.546042139451700,-1.582888568172620
Gila monster and crocodile,1299587,DL3 6AL,54.532312601068800,-1.555800033358130
amethystine python and Masked owl,1299760,DL3 0HX,54.549293657693700,-1.549787415999810
pit viper and kabaragoya,1768139,DL3 0PX,54.544583973429600,-1.570862000000000
jew lizard and amphisbaena,1297767,DL5 6PF,54.595859425383800,-1.619293000987070
wall lizard and B,1296873,DL7 0JR,54.438922460157700,-1.551707165071190
horned toad and Maya,1307283,DL1 3EE,54.551372043903200,-1.545621165398360
Goose and agamid,2625017,DL1 9TS,54.522106000000000,-1.550760000000000
Peafowl and black snake,1298911,DL3 9YA,54.529895097920400,-1.580997946086820
Parakeet and Flameback,1302490,DL14 9QY,54.620182053637400,-1.761772874695310
box turtle and American sparrow,1299761,DL3 0HZ,54.546155000000000,-1.548981760545150
Marmoset and Marsh harrier,1300715,DL2 1SA,54.545409556359300,-1.475677499173160
Fish eagle and Dorcopsis,1300303,DL2 3EB,54.547649063202400,-1.739687116336470
rock python and Scimitar babbler,1299143,DL3 7SR,54.523401882220000,-1.564409528478710
Nukupuʻu and Skunk,1306501,DL10 4EE,54.404135232826100,-1.743445730341750
bandy-bandy and Ibex,1300226,DL2 1SQ,54.547059225233000,-1.472703728361580
horned toad and Wallaby,2662616,DL3 8EJ,54.510640000000000,-1.573481000000000
crocodile and Badger,1297956,DL5 5JB,54.613119781725300,-1.569955721327690
diamond python and Prion,1298977,DL3 8SJ,54.526452580379200,-1.586070173765470
Petrel and diamondback,1300092,DL2 3XA,54.578520053492100,-1.807700105043150
River dolphin and tokay,1306515,DL10 4FB,54.411376711329400,-1.746713192522360
bull snake and Parakeet,1306446,DL1 9ST,54.523575359158900,-1.552835745610090
Rat and Diving bird,1307316,DL1 3HW,54.543230500196400,-1.520160672261380
blue racer and Dorcopsis,1306458,DL10 4AE,54.404821037491600,-1.736509000000000
Wader and gopher snake,1306340,DL10 5AD,54.408541699388000,-1.728273682727600
Parakeet and glass snake,1299238,DL3 6NN,54.532918481911300,-1.559285922393970
Pratincole and agamid,1306512,DL10 4EX,54.405063213987500,-1.753191418417160
harlequin snake and rock snake,1298043,DL5 5QX,54.622197065148300,-1.565089996851690
Vole and carpet snake,1307525,DL1 1JW,54.527855000000000,-1.543333000000000
River dolphin and Partridge,1306493,DL10 4DR,54.403489588892000,-1.739906701150970
