name,postcode,lat,lon
diamond python and mamba,GL14 1AE,51.801194088168200,-2.451283534285570
Mockingbird and Kangaroo,GL14 1HH,51.807403581132700,-2.463688520970710
Pratincole and frill-necked lizard,GL14 1HQ,51.808504323508300,-2.453488724020670
Magpie and Peafowl,GL14 1JT,51.827016943792600,-2.453471568702790
anaconda and Bronzewing pigeon,GL14 1PQ,51.826088701530000,-2.404810097108580
kabaragoya and chuckwalla,GL14 1PU,51.825290607948500,-2.414524484134560
Rat and Tit-tyrant,GL14 2BU,51.827018407238700,-2.488992926992920
constrictor and Gull,GL14 2DE,51.823388834714400,-2.490477073304730
garter snake and wall lizard,GL14 2DG,51.820715282617800,-2.497658670346010
Mole and Magpie,GL14 2DJ,51.819950852747200,-2.495575586211800
Civet and Tahr,GL14 2DL,51.819585286314000,-2.496978847181290
ringhals and box turtle,GL14 2DN,51.819864197352600,-2.498446000000000
Shearwater and Skunk,GL14 2EB,51.817762471245300,-2.500658167842540
Solitaire and snake,GL14 2GJ,51.821049507570700,-2.509037292409700
krait and Capuchin,GL14 2LB,51.826222569052000,-2.504974446134020
amethystine python and alligator,GL14 2PL,51.824667408357900,-2.498587328146800
horned toad and rattlesnake,GL14 2RQ,51.824410859288800,-2.491184635744480
Fox and sidewinder,GL14 2SH,51.823991449447800,-2.498971615492150
crocodile and Tree warbler,GL14 2ST,51.825690492346600,-2.499528000000000
flying dragon and B,GL14 2TU,51.811230211308700,-2.486805718233620
tree snake and Tattler,GL14 2UF,51.783097287266600,-2.486763637346860
Parakeet and python,GL14 2YE,51.834275751238300,-2.513917314208780
White ibis and thorn lizard,GL14 3BS,51.814910706894500,-2.496796837798060
Mink and thorn lizard,GL14 3EJ,51.805227270544600,-2.505247317155040
Cloud rat and Chicken,GL14 3FA,51.811800000000000,-2.505495000000000
cobra de capello and mud turtle,GL14 3GB,51.813441692233600,-2.498869851102830
alligator and Songlark,GL14 3HB,51.810977450190700,-2.508154000000000
Herring gull and ringhals,GL14 3HJ,51.809543272363800,-2.507398000000000
bandy-bandy and Gila monster,GL14 3JD,51.839004356704500,-2.512011755562900
White ibis and box turtle,GL14 3NL,51.819082000000000,-2.477853705525090
Greenbul and Ibex,GL14 9BR,51.823068000000000,-2.498121000000000
leathery turtle and indigo snake,GL14 9EE,51.823068000000000,-2.498121000000000
rat snake and Komodo dragon,GL14 9FR,51.823068000000000,-2.498121000000000
Shearwater and Armadillo,GL14 9FS,51.823068000000000,-2.498121000000000
New World blackbird and Wallaby,GL14 9FY,51.823068000000000,-2.498121000000000
tuatara and giant tortoise,GL14 9GJ,51.823068000000000,-2.498121000000000
tiger snake and Rat,GL14 9HR,51.823068000000000,-2.498121000000000
Rabbit and adder,GL16 7EJ,51.802432000000000,-2.551363000000000
Peafowl and milk snake,GL16 7EP,51.816490178000700,-2.590732594694750
White ibis and Maya,GL16 7EY,51.816349622946400,-2.593646661386380
rat snake and constrictor,GL16 7FD,51.795276000000000,-2.597053000000000
anole and lizard,GL16 7FG,51.792143000000000,-2.607714000000000
Puffleg and blind snake,GL16 7GA,51.797417885493800,-2.598270216521330
B and swift,GL16 7HJ,51.792013614943000,-2.601910466971450
Stilt and massasauga,GL16 7LB,51.781212524351500,-2.605681000000000
Masked owl and Pitohui,GL16 7NZ,51.838247000000000,-2.632702000000000
adder and Marsh harrier,GL16 7PT,51.781667823046200,-2.603077351814670
soft-shelled turtle and River dolphin,GL16 7QP,51.807887660494400,-2.611448229872790
indigo snake and Mink,GL16 7RZ,51.793197763221300,-2.602433722881440
Fox and krait,GL16 8AQ,51.793108079643400,-2.617976039462580
gopher snake and rock python,GL16 8BD,51.793264936990100,-2.615498752840980
wall lizard and garter snake,GL16 8BL,51.794873434617900,-2.613954647927400
blue tongue and habu,GL16 8BT,51.795088385243400,-2.612391548577700
frill-necked lizard and Bunting,GL16 8DN,51.794091158032600,-2.619105971964010
skink and Thicketbird,GL16 8FF,51.789055000000000,-2.617053000000000
Asiatic leopard and rattlesnake,GL16 8HQ,51.791518363218100,-2.617649823065070
Solitaire and Grouse,GL16 8NR,51.790930065695900,-2.640216506111180
Grosbeak and Mamo,GL16 8NS,51.800382495151500,-2.633070482187410
Scimitar babbler and anaconda,GL16 8NW,51.783035644286800,-2.650078190311420
Parrotlet and Stint,GL16 8NZ,51.811932482107600,-2.656673430541770
Old World quail and Diving bird,GL16 8PN,51.786243920196300,-2.611851302326520
Jackal and Parrotlet,GL16 8QH,51.806579980708700,-2.622482478879450
Songlark and Philippine hawk-owl,GL16 8QX,51.810556450320800,-2.622029601584730
Guillemot and copperhead,GL16 8RJ,51.789667068025700,-2.615768723851980
smooth snake and hoop snake,GL16 8RQ,51.790434069540000,-2.615242721660310
Old World vulture and jew lizard,GL16 9SA,51.792044303845400,-2.618512463921110
Fulmarine petrel and dugite,GL16 9SB,51.792044303845400,-2.618512463921110
Capuchin and Egret,GL16 9SX,51.792044303845400,-2.618512463921110
Towhee and Gull,GL17 0DD,51.866628000000000,-2.486184000000000
Night heron and green turtle,GL17 0EU,51.853526534421500,-2.488365652291790
bull snake and Pheasant,GL17 0FL,51.865134796734600,-2.489421176050480
Buzzard and Thicketbird,GL17 0GE,51.865134796734600,-2.489421176050480
Kākāriki and bearded dragon,GL17 0GU,51.865129513665300,-2.489420809952180
soft-shelled turtle and goanna,GL17 0HU,51.864637484862800,-2.490983893372800
Coati and loggerhead,GL17 0JB,51.864548733287100,-2.492856320826770
Gila monster and Kestrel,GL17 0JF,51.865134796734600,-2.489421176050480
terrapin and ringhals,GL17 0LJ,51.874882000000000,-2.461550000000000
ringhals and Mouse,GL17 0QL,51.874044562129500,-2.466058977263610
rock python and hoop snake,GL17 0QR,51.868032386286400,-2.456309000000000
Cuscus and blind snake,GL17 0RB,51.879871522424300,-2.452027725050690
king snake and diamondback turtle,GL17 0SZ,51.865636588132300,-2.486391054244200
bull snake and bicycle lizard,GL17 0WP,51.865134796734600,-2.489421176050480
flying lizard and Vole,GL17 0YR,51.865103000000000,-2.489407000000000
Viscacha and python,GL17 0YX,51.865129513665300,-2.489420809952180
thorny devil and grass snake,GL17 1AS,51.823065604219000,-2.498047618550480
pit viper and Tree warbler,GL17 1DF,51.823065604219000,-2.498047618550480
dugite and amethystine python,GL17 9EY,51.855800484260800,-2.505566994999720
Stilt and New World blackbird,GL17 9HR,51.860389281049600,-2.515144300940450
Diving bird and Ibex,GL17 9JH,51.847857667407400,-2.516772237285210
terrapin and boa constrictor,GL17 9JP,51.851077684755400,-2.512381111577250
blindworm and grass snake,GL17 9JW,51.845849000000000,-2.517959334978150
mud turtle and perentie,GL17 9NU,51.849051249498700,-2.582637198566330
mud turtle and sand lizard,GL17 9QJ,51.829601214913900,-2.577655415931790
Grackle and frilled lizard,GL17 9QL,51.835725488833200,-2.581028312218020
Gull and Parrotbill,GL17 9QZ,51.845884046872800,-2.578546000000000
Chipmunk and boa,GL17 9SA,51.841191638825400,-2.582927593794590
Mole and cycling lizard,GL17 9SE,51.839329560524600,-2.579478143792840
Thrasher and Francolin,GL17 9UG,51.841598065853600,-2.556573436355420
Marmoset and snake,GL17 9XH,51.852753000000000,-2.551705446701560
rock python and copperhead,GL18 1EW,51.930245688940200,-2.401937061021940
Songlark and glass snake,GL18 1GH,51.928462836163000,-2.443775649672800
amphisbaena and krait,GL18 1LS,51.959018409920800,-2.417940436841950
Warbler and Mockingbird,GL18 1NR,51.917126000000000,-2.451121404242230
cayman and chameleon,GL18 1NY,51.924525000000000,-2.458162000000000
harlequin snake and Solitaire,GL18 1PG,51.917528380690400,-2.469649870176620
Wader and Francolin,GL18 1PU,51.930475630943700,-2.404178545820250
horned toad and anole,GL18 1RD,51.928359944678100,-2.407606215033190
Prion and wall lizard,GL18 1SY,51.931922000000000,-2.402388000000000
hawksbill and Grouse,GL18 2AU,51.977333000382100,-2.440051122232970
pit viper and wall lizard,GL18 2AX,51.979189438768000,-2.438890006961270
Skunk and sea snake,GL18 2BE,51.968451000000000,-2.451885000000000
massasauga and Puffleg,GL18 2DD,51.988224000000000,-2.434812556285760
copperhead and galliwasp,GL18 2DQ,51.978835346046400,-2.407336478572920
Mink and Piping shrike,GL18 2EF,51.997672169861500,-2.465362000000000
Old World warbler and Tree warbler,GL19 3HJ,51.891281172593100,-2.410292912174340
caiman and green turtle,HR1 4SP,51.964409379523500,-2.599691461241890
Bronzewing pigeon and Fish eagle,HR1 4SR,51.968731768211100,-2.580404063187570
Solitaire and Chickadee,HR1 4SW,51.972287126055600,-2.621880105438220
Diving bird and hawksbill,HR1 4UH,51.965447253003700,-2.623168130866240
mountain devil and Greenbul,HR2 6NH,51.985015090140500,-2.622464165946020
wall lizard and Minke whale,HR2 6NJ,51.985136340463400,-2.619932149602110
amethystine python and Goose,HR2 6PP,51.980921754127400,-2.662462321162060
River dolphin and blue tongue,HR2 6QB,51.977224448478100,-2.670764600483000
Asiatic leopard and Viscacha,HR2 8AY,51.987243339392400,-2.723396568704070
python and blue racer,HR2 8BF,51.976308344710500,-2.786798296394600
pit viper and rock snake,HR2 8DZ,51.888050000000000,-2.757314000000000
Magpie and Thicketbird,HR2 8EU,51.936703175056800,-2.797844000000000
alligator and king cobra,HR2 8HL,51.975582103123200,-2.727780031425350
frill-necked lizard and amethystine python,HR2 8LP,51.906521000000000,-2.700018000000000
chuckwalla and constrictor,HR2 8LX,51.903089030839500,-2.709950358000230
Pitohui and caiman,HR2 8LY,51.897408000000000,-2.711372000000000
tuatara and diamond snake,HR2 8PA,51.928241377700400,-2.731231255672190
Argus and Fulmarine petrel,HR2 8QN,51.889724350532700,-2.731157913941080
hawksbill and cayman,HR2 8QR,51.885934115040000,-2.733406578231090
Mouse and Parrotlet,HR8 2NF,51.994110620036000,-2.498487465175250
Mouse and coral snake,HR8 2PG,51.993592723628900,-2.532576412906790
sand lizard and Rat,HR9 5AG,51.911454356891100,-2.581496761929640
Darwin's finches and sand viper,HR9 5BT,51.908053558510100,-2.589171711517950
water snake and anaconda,HR9 5BY,51.914012728140900,-2.582314899317690
thorn lizard and elapid,HR9 5GT,51.907251754991700,-2.585178604402810
hognose snake and blue racer,HR9 5HA,51.900836840920700,-2.588568561685060
wall lizard and Marmoset,HR9 5HE,51.913958623940100,-2.584160578744320
hawksbill and Elephant,HR9 5JA,51.913804287250700,-2.588069397718190
gopher snake and hoop snake,HR9 5JH,51.912339290130500,-2.580723150834040
mamba and asp,HR9 5JT,51.907305399758800,-2.580512834225810
mud turtle and krait,HR9 5LW,51.912427795638700,-2.575519716018420
snapping turtle and bearded dragon,HR9 5NW,51.910706510026800,-2.578172578165320
Perching duck and monitor,HR9 5PN,51.908517594038000,-2.588072999425750
horned viper and Nukupuʻu,HR9 5PS,51.903816506140100,-2.586034799853480
Cloud rat and Cuscus,HR9 5QJ,51.886566273460600,-2.594310136507870
habu and Kestrel,HR9 5QL,51.908795423190800,-2.588251070853800
skink and Hawaiian honeycreeper,HR9 5US,51.894420907204500,-2.521084820788700
hognose snake and Diving bird,HR9 5XA,51.907273870998200,-2.588667271886330
thorny devil and Warbler,HR9 6ES,51.862182423314700,-2.672798203046120
gaboon viper and alligator,HR9 6FE,51.854117000000000,-2.651990000000000
whip snake and Francolin,HR9 6HZ,51.871420290608800,-2.612832732202360
Kangaroo and dugite,HR9 6JA,51.868910738485200,-2.623299398589640
jew lizard and Philippine hawk-owl,HR9 6PN,51.898241744634000,-2.702650808175840
thorny devil and Pheasant,HR9 6PY,51.917537000000000,-2.603937000000000
goanna and Quetzal,HR9 6QT,51.949124456011100,-2.606791475049490
Chickadee and Parrotbill,HR9 7AR,51.930954000000000,-2.457879000000000
Buzzard and turtle,HR9 7BP,51.923725452139900,-2.574486389442640
Vulture and Ibex,HR9 7DB,51.916438590616600,-2.584323000000000
snapping turtle and horned toad,HR9 7EE,51.916434874379700,-2.581590207875060
soft-shelled turtle and Marsh harrier,HR9 7GH,51.923025521470000,-2.589847982305070
box turtle and Tree warbler,HR9 7GQ,51.923285636342100,-2.590679930659630
rock snake and soft-shelled turtle,HR9 7GR,51.920883119755700,-2.572152989052060
Solitaire and Old World quail,HR9 7HA,51.920928957471200,-2.580048833759090
Meadowlark and Tahr,HR9 7HD,51.921846915367000,-2.583506880193990
tokay and Kestrel,HR9 7JE,51.936855000000000,-2.583251000000000
Myna and water snake,HR9 7JF,51.936578123150100,-2.571683275979000
Peafowl and Stint,HR9 7LQ,51.891891379200100,-2.488273038095840
Civet and Diving bird,HR9 7LY,51.902807956707800,-2.507025029590500
Parakeet and Stilt,HR9 7ND,51.894323883818500,-2.487078726391200
python and giant tortoise,HR9 7NH,51.913984954437900,-2.569622493843590
mountain devil and cobra,HR9 7PR,51.914834083400700,-2.509966503792480
Bunting and Black cockatoo,HR9 7QB,51.918901875041900,-2.584515563286380
Mockingbird and hoop snake,HR9 7RA,51.972690000000000,-2.534758325028820
chuckwalla and gaboon viper,HR9 7RH,51.920754825894600,-2.584350611068590
diamondback turtle and king snake,HR9 7RQ,51.921118732643200,-2.585170000000000
snake and Treepie,HR9 7RU,51.921226994396800,-2.488693197388430
skink and Kākāriki,HR9 7TG,51.896576361699200,-2.609512792941480
frill-necked lizard and Bunting,HR9 7TS,51.938356822723100,-2.539631322622820
Fox and Parrotlet,HR9 7WA,51.911981000000000,-2.571618000000000
gopher snake and sidewinder,HR9 9AX,51.911979289195100,-2.571617855617610
saltwater crocodile and diamond snake,NP25 3AX,51.817986328051900,-2.716242548108180
Gila monster and Lemming,NP25 3DG,51.811246982808900,-2.714104910479740
lizard and Triller,NP25 3DQ,51.826502109178400,-2.717523972945330
racer and bandy-bandy,NP25 3EN,51.810552400216000,-2.717430128386590
viper and alligator,NP25 3GB,51.826487687527600,-2.712503168662870
Bronzewing pigeon and swift,NP25 3GE,51.827822133925100,-2.713365856089640
bearded dragon and milk snake,NP25 3HD,51.826586328546900,-2.714028313696830
Grouse and Dolphin,NP25 3JH,51.804785687620700,-2.694031653318840
Lemming and blue tongue,NP25 3JZ,51.807411998571200,-2.701454637919500
tiger snake and Warbler,NP25 3LY,51.808921000000000,-2.706521593287210
Komodo dragon and Asiatic leopard,NP25 3NE,51.806088841444600,-2.703203552435040
Lemming and Wallaby,NP25 3NW,51.821949000000000,-2.716828000000000
indigo snake and Old World vulture,NP25 3NZ,51.814507101046100,-2.713228044608480
Night heron and Rabbit,NP25 3SU,51.843870571256500,-2.684747453409310
frilled lizard and Fish eagle,NP25 4AR,51.782208626731400,-2.700135806278720
fer-de-lance and Rat,NP25 4JH,51.787658000000000,-2.753993000000000
Night heron and python,NP25 4SE,51.778569125342900,-2.695267133064550
Pratincole and carpet snake,NP25 5DW,51.813388613965700,-2.735694885403850
green turtle and death adder,NP25 5FB,51.802882039900000,-2.717033114800000
garter snake and terrapin,NP25 5NH,51.829354761134700,-2.768358782661210
massasauga and Polecat,NP25 5NW,51.868133729241300,-2.801988639686470
Booted eagles and mamba,NP25 5NX,51.845087000000000,-2.795946000000000
Minke whale and box turtle,NP25 5NY,51.865749317722500,-2.804879871372140
sea snake and Songlark,NP25 5QG,51.848182779718200,-2.771016751996480
tree snake and Macaw,NP25 5QH,51.843009940595000,-2.767342971567930
Grouse and Booted eagles,NP25 5QQ,51.852850520347300,-2.774915007450040
Goose and Meadowlark,NP25 5SS,51.820197945923400,-2.729436674401090
Viscacha and moloch,NP25 5TQ,51.804009428547600,-2.725796042854830
