name,postcode,lat,lon
Parrotbill and Meadowlark,AL10 9FB,51.775560510000000,-0.239059565000000
B and galliwasp,AL3 7BJ,51.801794570000000,-0.399129070000000
Parakeet and Chipmunk,AL3 7BS,51.799187810000000,-0.397872650000000
blue racer and Kākāriki,AL3 7DU,51.792644510000000,-0.404687769000000
skink and sand viper,AL3 7ET,51.803840790000000,-0.404133030000000
sidewinder and tuatara,AL3 7HE,51.798721000000000,-0.403806000000000
boa constrictor and Mamo,AL3 7JS,51.800448200000000,-0.406587803000000
Badger and Cloud rat,AL3 7NB,51.796001000000000,-0.398174000000000
Condor and cobra de capello,AL3 7PN,51.803834230000000,-0.399680498000000
crocodile and rattlesnake,AL3 8AD,51.828496710000000,-0.471177831000000
terrapin and king cobra,AL3 8AS,51.819247000000000,-0.462336000000000
black snake and boomslang,AL3 8BJ,51.824268000000000,-0.459878000000000
Pheasant and Tree warbler,AL3 8ED,51.817404960000000,-0.438633718000000
diamondback and leguaan,AL3 8EF,51.817853320000000,-0.437863775000000
Herring gull and Elephant,AL3 8HS,51.823758980000000,-0.428401000000000
Jackal and Triller,AL3 8HX,51.836219660000000,-0.466098000000000
Parrotbill and Tree warbler,AL3 8NE,51.832529390000000,-0.456368397000000
Dorcopsis and Elephant,AL3 8NQ,51.833561000000000,-0.458852073000000
lizard and River dolphin,AL3 8RE,51.834757960000000,-0.467264746000000
terrapin and green turtle,AL3 8RZ,51.834618870000000,-0.463279000000000
taipan and loggerhead,AL4 8AF,51.811112910000000,-0.296919464000000
diamondback terrapin and thorny devil,AL4 8AJ,51.807737340000000,-0.301021216000000
cobra and diamond python,AL4 8BJ,51.812557060000000,-0.291715003000000
Ice seal and Jay,AL4 8BL,51.812440360000000,-0.291110118000000
blindworm and krait,AL4 8HL,51.818361090000000,-0.308180796000000
Tahr and giant tortoise,AL4 8HX,51.819988010000000,-0.320685042000000
boa constrictor and Recurvebill,AL4 8JJ,51.814621220000000,-0.294538499000000
elapid and Mink,AL4 8JN,51.809940290000000,-0.292945432000000
tiger snake and Armadillo,AL4 8NJ,51.811239840000000,-0.282770661000000
king cobra and indigo snake,AL4 8PD,51.809246690000000,-0.291622575000000
Gull and Pitohui,AL4 8RA,51.816602080000000,-0.296581936000000
Shearwater and tiger snake,AL4 8RP,51.830964230000000,-0.301700175000000
Pitohui and Songlark,AL4 9DW,51.782259680000000,-0.303268744000000
hognose snake and Dolphin,AL4 9ED,51.780771790000000,-0.294278502000000
kabaragoya and Stint,AL4 9HJ,51.776296420000000,-0.270591000000000
giant tortoise and Mockingbird,AL4 9LE,51.775538380000000,-0.311087346000000
Dolphin and Stint,AL5 1AG,51.809342120000000,-0.316946531000000
frill-necked lizard and tortoise,AL5 1AY,51.805432100000000,-0.339182902000000
Guillemot and Myna,AL5 1EW,51.806197630000000,-0.338632587000000
Wader and Fulmarine petrel,AL5 1LP,51.809582990000000,-0.339581559000000
Gila monster and frilled lizard,AL5 1LW,51.808473500000000,-0.340608719000000
Peafowl and Puffleg,AL5 1QL,51.806567830000000,-0.344479034000000
frilled lizard and python,AL5 1RD,51.803710060000000,-0.340130942000000
cycling lizard and sidewinder,AL5 1SQ,51.803684200000000,-0.337027999000000
massasauga and leathery turtle,AL5 2AS,51.796611270000000,-0.351978630000000
lizard and Petrel,AL5 2AY,51.796909470000000,-0.371443889000000
dugite and snake,AL5 2AZ,51.800820160000000,-0.366850501000000
Zebra and Diving bird,AL5 2DE,51.814883250000000,-0.359088278000000
bearded dragon and Kite,AL5 2DU,51.817171000000000,-0.366307239000000
Booted eagles and death adder,AL5 2NG,51.799175640000000,-0.358527368000000
Condor and gopher snake,AL5 2QD,51.819168000000000,-0.360595025000000
Kangaroo and milk snake,AL5 2QE,51.819010380000000,-0.362056000000000
Tree warbler and grass snake,AL5 2QH,51.816406180000000,-0.360614354000000
White ibis and viper,AL5 2QZ,51.817094040000000,-0.364811346000000
White ibis and alligator,AL5 2SU,51.816029200000000,-0.356797895000000
leguaan and turtle,AL5 3AD,51.819859460000000,-0.371646684000000
Masked owl and Philippine hawk-owl,AL5 3AH,51.822018200000000,-0.369102151000000
chameleon and jew lizard,AL5 3AJ,51.821551380000000,-0.370453915000000
Boto and flying lizard,AL5 3AN,51.824696600000000,-0.370964390000000
White ibis and Capuchin,AL5 3AQ,51.821948420000000,-0.373152957000000
green turtle and hawksbill,AL5 3BB,51.823922630000000,-0.366377931000000
Gull and Meadowlark,AL5 3DP,51.820444230000000,-0.371669130000000
Kākāriki and saltwater crocodile,AL5 3EB,51.825170660000000,-0.376635608000000
cycling lizard and rock snake,AL5 3EG,51.825880320000000,-0.380499108000000
Komodo dragon and Mamo,AL5 3HB,51.828316260000000,-0.383705967000000
Badger and frilled lizard,AL5 3LU,51.827894100000000,-0.373954580000000
frilled lizard and cerastes,AL5 3NB,51.830539160000000,-0.382537937000000
hawksbill and Pratincole,AL5 4EL,51.816269940000000,-0.353246000000000
Tattler and rattlesnake,AL5 4FP,51.821504000000000,-0.345837000000000
Stint and king cobra,AL5 4NG,51.829053620000000,-0.346194350000000
grass snake and water snake,AL5 4NQ,51.827943890000000,-0.346568771000000
thorn lizard and Jackal,AL5 4NS,51.825020010000000,-0.350942068000000
New World blackbird and massasauga,AL5 4NZ,51.827791160000000,-0.350420018000000
whip snake and tuatara,AL5 4PL,51.824815130000000,-0.345957783000000
Partridge and Prion,AL5 4UW,51.826201360000000,-0.351827655000000
Coati and Old World warbler,AL5 5AZ,51.825482950000000,-0.338474580000000
brown snake and saltwater crocodile,AL5 5BA,51.826338190000000,-0.339183195000000
carpet snake and Jay,AL5 5BJ,51.827125110000000,-0.334423435000000
Logrunners and Myna,AL5 5BL,51.825519430000000,-0.334061835000000
sand lizard and king cobra,AL5 5BZ,51.821386000000000,-0.335501063000000
Tattler and Bronzewing pigeon,AL5 5FE,51.827017000000000,-0.343889000000000
New World blackbird and Petrel,AL5 5LW,51.814780520000000,-0.350459922000000
Mamo and Ice seal,AL5 5PW,51.817006900000000,-0.343806298000000
Crow and Crow,AL5 5RT,51.816383170000000,-0.337837260000000
Minke whale and bicycle lizard,AL5 5RW,51.816756190000000,-0.338781087000000
Mouse and sand lizard,AL5 5TA,51.810144220000000,-0.348786902000000
Chicken and python,AL5 5TE,51.811033600000000,-0.347448812000000
mamba and galliwasp,AL5 5TT,51.810770980000000,-0.345398503000000
giant tortoise and boa constrictor,AL6 9AU,51.827128850000000,-0.215150646000000
python and Hawk,AL6 9BA,51.810970560000000,-0.233632345000000
Triller and Nukupuʻu,AL6 9FP,51.834487000000000,-0.208764000000000
goanna and Grouse,AL6 9GH,51.819287000000000,-0.222106000000000
Hawaiian honeycreeper and thorny devil,AL6 9HA,51.830412000000000,-0.214629000000000
king snake and rat snake,AL6 9HB,51.831109890000000,-0.219144034000000
deaf adder and taipan,AL6 9JB,51.826403980000000,-0.214787484000000
diamond snake and Chicken,AL6 9JE,51.826013500000000,-0.213351765000000
Triller and sand viper,AL6 9JN,51.824588600000000,-0.217224566000000
blind snake and whip snake,AL6 9JR,51.823864470000000,-0.218689731000000
Towhee and tortoise,AL6 9LA,51.822975160000000,-0.216969029000000
ringhals and bull snake,AL6 9PD,51.829808150000000,-0.219282459000000
Rat and Condor,AL6 9QA,51.828476810000000,-0.219247893000000
Rabbit and Greenbul,AL6 9RB,51.835259590000000,-0.210547370000000
Schneider python and Guillemot,AL6 9RP,51.835085760000000,-0.212716921000000
kabaragoya and Nukupuʻu,AL7 3BU,51.800286480000000,-0.200041000000000
boomslang and indigo snake,AL7 3RB,51.794761390000000,-0.201825877000000
Old World vulture and coral snake,AL7 3TG,51.792364530000000,-0.201500692000000
krait and snapping turtle,AL7 4ET,51.785445080000000,-0.201790410000000
amethystine python and flying lizard,AL7 4FL,51.787497030000000,-0.200142890000000
adder and Quetzal,AL7 4SJ,51.791239910000000,-0.204402014000000
agama and Old World quail,AL8 6AP,51.801888920000000,-0.206084000000000
chameleon and Badger,AL8 6EE,51.799055560000000,-0.208630945000000
leathery turtle and Old World quail,AL8 6EX,51.794813680000000,-0.211148301000000
Warbler and Zebra,AL8 6HF,51.795388730000000,-0.215853110000000
elapid and chameleon,AL8 6HP,51.795207700000000,-0.212814903000000
perentie and bearded lizard,AL8 6ND,51.802459030000000,-0.204797514000000
B and elapid,AL8 6NY,51.800987610000000,-0.206190288000000
tokay and Macaw,AL8 6PA,51.801178540000000,-0.206327746000000
gecko and garter snake,AL8 6RT,51.800088800000000,-0.216856842000000
Maya and Civet,AL8 6UB,51.804039220000000,-0.208766996000000
Zebra and giant tortoise,AL8 6XY,51.792307600000000,-0.215610000000000
Herring gull and Komodo dragon,AL8 6YF,51.793747360000000,-0.219093653000000
mountain devil and agama,AL8 6YT,51.794057750000000,-0.223562325000000
galliwasp and jew lizard,AL8 7NL,51.819868670000000,-0.211360383000000
Dorcopsis and Minke whale,AL8 7NN,51.820514940000000,-0.208331257000000
elapid and cycling lizard,AL8 7PH,51.805541680000000,-0.203514646000000
boa and bushmaster,AL8 7PU,51.810291180000000,-0.200685604000000
elapid and mountain devil,AL8 7SH,51.812685800000000,-0.207930925000000
snake and bearded lizard,AL8 7XA,51.783603000000000,-0.227830000000000
Siskin and adder,HP1 3DE,51.781980885796800,-0.542567846126334
tuatara and puff adder,HP2 6EE,51.777130495482900,-0.452214867265034
soft-shelled turtle and Parrotbill,HP2 6EL,51.776326612795000,-0.450575421949342
sand lizard and cycling lizard,HP2 7HH,51.778554252556800,-0.449035032572165
Coati and Magpie,HP2 7JF,51.778355342237000,-0.445548348769265
Parrotbill and Stilt,HP2 7NA,51.776608093543900,-0.433142413134732
sidewinder and River dolphin,HP2 7ND,51.778922460195200,-0.443557397256750
Egret and loggerhead,HP2 7NR,51.778344797076400,-0.440347000000000
Parrotlet and sand viper,HP2 7PQ,51.779125804781700,-0.438549238063583
Kākāriki and Thicketbird,HP2 7QQ,51.781372351296200,-0.441153600480838
chuckwalla and fer-de-lance,HP2 7RU,51.776833467899500,-0.432511304841280
Linsang and boomslang,HP4 1ND,51.818357000000000,-0.573690000000000
elapid and Prion,HP4 1NW,51.783404000000000,-0.547045000000000
Gila monster and mountain devil,HP4 1PJ,51.807811635886100,-0.557690589367281
jew lizard and Wallaby,HP4 1QJ,51.810623607580200,-0.542906193674507
Booted eagles and Asiatic leopard,HP4 1QU,51.833794000000000,-0.555859000000000
worm lizard and Skunk,HP4 1UH,51.805581664099900,-0.551104222139608
tuatara and green turtle,HP4 3TH,51.776125000000000,-0.601407347701558
box turtle and bull snake,LU1 1BL,51.879280342900000,-0.424473000000000
Tree warbler and Peafowl,LU1 1BQ,51.881819000000000,-0.422184000000000
Wallaby and Quetzal,LU1 1EX,51.885896189554300,-0.428751000000000
Philippine hawk-owl and B,LU1 1LP,51.885361430602800,-0.440595000000000
gaboon viper and Old World vulture,LU1 1QU,51.878048427844300,-0.422703267590816
Partridge and whip snake,LU1 1UG,51.884053116777100,-0.452366522529665
Marmoset and mountain devil,LU1 1WP,51.879975639827700,-0.422926394139066
cerastes and snake,LU1 2EF,51.882551662775100,-0.418564599188022
elapid and Snipe,LU1 2RG,51.879662333589200,-0.421019597363044
alligator and amethystine python,LU1 2WN,51.881596046452200,-0.414370159779479
giant tortoise and Treepie,LU1 3DJ,51.875253000000000,-0.408744278180853
bushmaster and galliwasp,LU1 3DT,51.874169000000000,-0.408214808387872
Wader and Marsh harrier,LU1 3DU,51.874169000000000,-0.408214808387872
Triller and Wader,LU1 3FR,51.875985183800000,-0.408233709500000
death adder and tokay,LU1 3NG,51.868857964061900,-0.410416000000000
Piping shrike and Pheasant,LU1 3QF,51.872646267790500,-0.412811080203775
snapping turtle and turtle,LU1 3QG,51.871805224293100,-0.416457654657307
Armadillo and Buzzard,LU1 3RF,51.869462999852200,-0.414796895028236
Skunk and River dolphin,LU1 3RQ,51.867881796701100,-0.418236739588471
Stilt and Herring gull,LU1 3TY,51.871871841257700,-0.418067698424019
Mockingbird and brown snake,LU1 3UP,51.871944918442400,-0.417484094111489
leathery turtle and Boto,LU1 3UX,51.873254920758100,-0.414605454850745
sea snake and Puffleg,LU1 3XG,51.875012000000000,-0.414099702250380
New World blackbird and Ibex,LU1 4AZ,51.888190464889600,-0.475737000000000
turtle and ringhals,LU1 4DW,51.857514000000000,-0.449836000000000
Night heron and Meadowlark,LU1 4ER,51.860405519141600,-0.460627994393252
Coati and snapping turtle,LU1 4FX,51.880669000000000,-0.465781000000000
Gila monster and copperhead,LU1 4HU,51.860348140968000,-0.454879161771381
Vulture and Skunk,LU1 4JG,51.861607619021900,-0.452875460387121
Stint and cerastes,LU1 4LF,51.837340000000000,-0.393195000000000
Songlark and slowworm,LU1 5BE,51.876713525425300,-0.419045458457630
Thrasher and Mink,LU1 5DP,51.876810032582500,-0.419654000000000
snake and milk snake,LU1 5DS,51.876991000000000,-0.419501000000000
Gull and Marsh harrier,LU1 5FA,51.876671000000000,-0.417158000000000
Mouse and Minke whale,LU1 5FL,51.874633000000000,-0.442986000000000
Fish eagle and rat snake,LU1 5JB,51.875773990886300,-0.426095061907310
Tattler and Gila monster,LU1 5JL,51.874154963626100,-0.427400885483744
moloch and blue tongue,LU1 5JY,51.876304678347200,-0.431495248312562
Partridge and Marsh harrier,LU1 5LD,51.871525553324800,-0.432504022634966
death adder and B,LU1 5LY,51.871392374131100,-0.428586686326894
asp and Hawk,LU1 5NZ,51.870617514251300,-0.431838366527003
Egret and Night heron,LU1 5PG,51.871180747676200,-0.433068000000000
Jackal and Jerboa,LU1 5PJ,51.869984793361000,-0.430916225898949
Logrunners and Piping shrike,LU1 5QA,51.867568918627200,-0.433832587361801
Dolphin and Argus,LU1 5SH,51.878409742494700,-0.441722385416879
leathery turtle and horned toad,LU1 5SS,51.877359475493600,-0.430354436378625
Scimitar babbler and Treepie,LU1 9NE,51.879977550500000,-0.422926408400000
cayman and Masked owl,LU2 0AZ,51.881022343290600,-0.402534725785036
Zebra and constrictor,LU2 0BH,51.881877884069700,-0.405947826607985
racer and Tit-tyrant,LU2 0EX,51.886568645539600,-0.405069880243494
Skunk and tuatara,LU2 0FF,51.879985000000000,-0.422902000000000
whip snake and thorny devil,LU2 0HS,51.882919335423000,-0.413411000000000
Coati and hawksbill,LU2 0JH,51.887834576459400,-0.402278681555450
goanna and Duck,LU2 0LE,51.889131630386800,-0.401782207299283
Pitohui and Prion,LU2 0LQ,51.885575608249300,-0.398159486358968
giant tortoise and diamondback,LU2 0PW,51.891087398957400,-0.396830004948304
tortoise and River dolphin,LU2 0SP,51.882509815117800,-0.389623439953473
swift and Fulmarine petrel,LU2 0TJ,51.891273838005000,-0.395995030888970
Civet and Piping shrike,LU2 7BF,51.906030000000000,-0.421883000000000
River dolphin and Polecat,LU2 7BH,51.911530557833600,-0.421821217510721
Treepie and flying dragon,LU2 7DP,51.899294082370600,-0.417220979533002
bandy-bandy and B,LU2 7EB,51.879977000000000,-0.422926000000000
Egret and sand lizard,LU2 7EZ,51.906727564629800,-0.413020099525199
black snake and hoop snake,LU2 7FA,51.893822402030200,-0.408867796197668
Piping shrike and Magpie,LU2 7GE,51.913678420520100,-0.416250000000000
Viscacha and Thicketbird,LU2 7LD,51.889160000000000,-0.420425000000000
green turtle and leathery turtle,LU2 7NG,51.893296706193000,-0.409889134602994
Skunk and Peafowl,LU2 7NJ,51.894676721912200,-0.410872288307118
boa constrictor and Komodo dragon,LU2 7NQ,51.892706431171300,-0.406799968948171
indigo snake and Parrotbill,LU2 7PQ,51.887472000000000,-0.417920650653537
Myna and Mamo,LU2 7RZ,51.889296194225300,-0.407952308122178
caiman and diamondback,LU2 7SF,51.908235425129600,-0.411627000000000
diamondback and mud turtle,LU2 7US,51.902104500854700,-0.402949853077514
chameleon and Towhee,LU2 7UU,51.898553152503100,-0.399006091472659
gavial and copperhead,LU2 8BJ,51.904640052502400,-0.390402071481317
amphisbaena and Jackal,LU2 8DU,51.901215578006000,-0.380669400271868
Parrotlet and Treepie,LU2 8ED,51.899938193877500,-0.383244436391937
Vole and chameleon,LU2 8HL,51.903656963959400,-0.391936000000000
cayman and goanna,LU2 8JE,51.895168152247100,-0.380959479982042
Old World vulture and Old World quail,LU2 8LY,51.933166568729500,-0.379741000000000
boa constrictor and Wallaby,LU2 8QB,51.897280704390200,-0.367904459401670
Puffleg and boa,LU2 8QT,51.898208247308000,-0.382986776221489
box turtle and Tit-tyrant,LU2 8RB,51.897641433997600,-0.384271614063219
iguana and wall lizard,LU2 8SW,51.888076454311900,-0.361669750262378
anole and amethystine python,LU2 8TX,51.893077405511400,-0.373448456604370
White ibis and Komodo dragon,LU2 8UY,51.894127871834200,-0.365548043476720
skink and blindworm,LU2 9AU,51.901112725683000,-0.394162008909610
Parrotlet and Songlark,LU2 9BW,51.894549700565600,-0.387652516384013
Logrunners and loggerhead,LU2 9EA,51.891809064625300,-0.394362872664536
Mink and anaconda,LU2 9HW,51.886497433930300,-0.382070246238027
Asiatic leopard and Moluccan boobook,LU2 9JG,51.885969745935600,-0.379008709244250
Siskin and flying dragon,LU2 9PL,51.869433000000000,-0.375623000000000
Skunk and Thrasher,LU2 9QG,51.882283525940000,-0.376935000000000
Triller and Tattler,LU2 9SG,51.888813085455300,-0.377845612610816
monitor and indigo snake,LU2 9SZ,51.887855571408600,-0.372968538910189
swift and mamba,LU2 9UE,51.888437816059300,-0.367614488678245
Perching duck and bushmaster,LU3 1AJ,51.889938229145000,-0.428288679321689
Grouse and horned viper,LU3 1AQ,51.890296887309300,-0.428886507266818
Recurvebill and carpet snake,LU3 1BB,51.887064733068400,-0.423869814590509
Mockingbird and box turtle,LU3 1BG,51.888002040717700,-0.428065596553736
tortoise and indigo snake,LU3 1BS,51.884071000000000,-0.419151000000000
fer-de-lance and Cuscus,LU3 1EU,51.892615959606500,-0.421437572968459
Armadillo and garter snake,LU3 1FJ,51.895785083500000,-0.426297115000000
Petrel and Warbler,LU3 1HH,51.892690560557000,-0.425663969953685
Old World warbler and smooth snake,LU3 1JG,51.893095402500800,-0.434442168203566
asp and Shearwater,LU3 1JS,51.891191078960700,-0.431209538557864
snapping turtle and Tattler,LU3 1LU,51.898514907988200,-0.424152281589590
asp and Francolin,LU3 1QD,51.897403905142100,-0.429830421490782
Grosbeak and flying lizard,LU3 1SD,51.900711042500000,-0.421488240700000
bearded lizard and Civet,LU3 1TT,51.903938000000000,-0.437689475315320
agamid and Polecat,LU3 1UU,51.902902572941100,-0.432211571856692
Dorcopsis and asp,LU3 2DA,51.914218917863900,-0.438826000000000
Asiatic leopard and death adder,LU3 2DQ,51.913356701685300,-0.430626202388194
gaboon viper and Recurvebill,LU3 2EF,51.918543000000000,-0.430389000000000
flying dragon and kabaragoya,LU3 2ES,51.910239947972600,-0.435605193263171
kabaragoya and rattlesnake,LU3 2EZ,51.913339648963600,-0.432720461735019
diamondback terrapin and worm lizard,LU3 2HJ,51.910646245609500,-0.430328150042196
Wader and giant tortoise,LU3 2JG,51.906427498923600,-0.443064349001567
Hawk and viper,LU3 2LR,51.905328612315700,-0.441561450862306
Grackle and skink,LU3 2NB,51.904853800556000,-0.437623932650670
Asiatic leopard and brown snake,LU3 2PG,51.903156701228600,-0.444587429335274
Old World quail and sand lizard,LU3 2QF,51.899725000000000,-0.448107000000000
diamondback terrapin and Jackal,LU3 2QW,51.905335454811600,-0.454353533397532
wall lizard and tokay,LU3 2QZ,51.903601000000000,-0.452959000000000
gopher snake and blue racer,LU3 2RE,51.903595129034000,-0.453977183010508
Hawk and Tahr,LU3 2RJ,51.903177904352900,-0.449601627724972
Meadowlark and Crow,LU3 2TS,51.908243252103600,-0.449834265445018
Recurvebill and thorny devil,LU3 3BA,51.921234000000000,-0.471607000000000
Vulture and water snake,LU3 3NA,51.914137300204100,-0.459082015962540
Snipe and Boto,LU3 3NQ,51.916806562347900,-0.459674036476041
Black cockatoo and carpet snake,LU3 3SR,51.916987146291800,-0.454244258923405
tree snake and kabaragoya,LU3 3TL,51.919731000000000,-0.450820000000000
frill-necked lizard and python,LU3 3XG,51.917613118192500,-0.440350938663802
Pheasant and Mink,LU3 4AN,51.920389480930700,-0.440196558355387
boomslang and bearded dragon,LU3 4DL,51.924629710293000,-0.440587669175938
Armadillo and bandy-bandy,LU3 4EB,51.924995019436700,-0.432212727206922
boa and chuckwalla,LU3 4EG,51.922345504035600,-0.430414542067965
Komodo dragon and Gull,LU3 4EP,51.922435835523800,-0.433145339892809
Logrunners and sand viper,LU3 4EQ,51.922613063752200,-0.429576296509503
monitor and leguaan,LU3 4ER,51.921125000000000,-0.434587000000000
diamondback terrapin and puff adder,LU3 4EU,51.923220925549200,-0.432826000000000
Mole and Lemming,LU3 4HF,51.925893502713200,-0.434188409865978
agama and dukite,LU3 9DS,51.879977550500000,-0.422926408400000
Jerboa and Mockingbird,LU4 0DF,51.890844621843600,-0.479482495047143
diamondback turtle and cayman,LU4 0EL,51.898959294826700,-0.474252260186395
amphisbaena and Nukupuʻu,LU4 0FE,51.896310329252000,-0.476609255681013
taipan and Pratincole,LU4 0HE,51.892915957154500,-0.476258995721703
tuatara and puff adder,LU4 0HH,51.892416014827700,-0.481405879627710
diamondback terrapin and taipan,LU4 0JD,51.888833112415900,-0.482471178552209
Buzzard and garter snake,LU4 0NG,51.896615692514400,-0.485638987515235
Shearwater and pit viper,LU4 0NX,51.898372763945600,-0.486510000000000
ringhals and Tree warbler,LU4 0UJ,51.903461814385900,-0.495729375541190
Vole and Ibex,LU4 0UL,51.902757377216500,-0.497598954384960
Diving bird and Thrasher,LU4 0YA,51.905356064233100,-0.483586127827566
rock snake and Pheasant,LU4 0YH,51.902973015137700,-0.482866898375662
Partridge and Francolin,LU4 0YN,51.903223173237200,-0.483439910275099
Skunk and Black jay,LU4 8AG,51.885852230312000,-0.432049289335560
black snake and tokay,LU4 8AL,51.886237117840200,-0.437325028717748
constrictor and Gila monster,LU4 8DY,51.893503000000000,-0.446837312493011
harlequin snake and Hawk,LU4 8FA,51.888864112600000,-0.459103771600000
loggerhead and Darwin's finches,LU4 8FY,51.894198000000000,-0.447691000000000
Puffleg and sea snake,LU4 8LD,51.891274842462900,-0.440216590133345
blue tongue and Myna,LU4 8NU,51.897239322613100,-0.446001000000000
smooth snake and Mouse,LU4 8QX,51.890428398930800,-0.464049158663300
tortoise and blue tongue,LU4 8RP,51.893744223037900,-0.450856434397289
Bunting and Nukupuʻu,LU4 8RQ,51.892675064088300,-0.467402257345740
Ice seal and blind snake,LU4 8RT,51.892318000000000,-0.457184000000000
Capuchin and green turtle,LU4 8SH,51.890956153549700,-0.460398151164620
Magpie and blind snake,LU4 9AE,51.905850399553300,-0.461400779551531
Petrel and Duck,LU4 9AL,51.907697059330200,-0.465102880264024
Cuscus and Duck,LU4 9DX,51.911582805542400,-0.480454122927877
harlequin snake and goanna,LU4 9FA,51.900263702380500,-0.463931787778705
Puffleg and Songlark,LU4 9GQ,51.902943763267200,-0.468113935708078
Mockingbird and bandy-bandy,LU4 9HD,51.911332054090200,-0.475664843556689
Francolin and Jackal,LU4 9HN,51.907620860444000,-0.475150841071409
Eagle and Guillemot,LU4 9LL,51.903397021519100,-0.466325116751292
dugite and moloch,LU4 9LX,51.903873250990400,-0.469753982149709
king snake and puff adder,LU4 9PB,51.905942000000000,-0.475280000000000
snapping turtle and leathery turtle,LU4 9QA,51.897881276961400,-0.459144048137768
soft-shelled turtle and pit viper,LU4 9RB,51.898878453046000,-0.457016948075850
black snake and bicycle lizard,LU4 9SF,51.894560707612000,-0.454141934659567
caiman and Towhee,LU4 9TW,51.896807788645100,-0.463003199938600
Tit-tyrant and Mockingbird,LU4 9XT,51.905056127422900,-0.474292813212354
Grosbeak and leguaan,LU4 9XZ,51.903841151081500,-0.474900889292073
Old World quail and chuckwalla,LU5 4BL,51.885282473453800,-0.509994665135913
rock python and Myna,LU5 4BW,51.884882835351100,-0.511809601982771
New World blackbird and Cuscus,LU5 4BZ,51.881171211487200,-0.511249307322199
water snake and amphisbaena,LU5 4DA,51.882004305159800,-0.510291925594075
rock snake and Dorcopsis,LU5 4EA,51.875418636266600,-0.502200137648541
Komodo dragon and Tit-tyrant,LU5 4EF,51.876227761462000,-0.500778637071292
Guillemot and Myna,LU5 4FD,51.888333602100000,-0.487515875100000
Civet and leathery turtle,LU5 4HA,51.888044676359600,-0.521542685891683
Solitaire and Greenbul,LU5 4HG,51.890860585659300,-0.518805470439236
blind snake and Darwin's finches,LU5 4LE,51.889405894659400,-0.496271359564756
goanna and Condor,LU5 4PS,51.888405067578000,-0.489736663656317
dugite and Fulmarine petrel,LU5 4SQ,51.894068697710500,-0.491755814497719
tree snake and Eagle,LU5 4SS,51.894754912463000,-0.496194542684786
Stint and gavial,LU5 4UL,51.876365749374200,-0.503141996215964
Stilt and Parrotlet,LU5 4UR,51.887647213145500,-0.510701139196264
agama and Goose,LU5 5BF,51.898986000000000,-0.525602000000000
asp and anaconda,LU5 5BS,51.902905519482900,-0.519935604831474
brown snake and goanna,LU5 5DH,51.903941549247000,-0.526544577967186
blindworm and Skunk,LU5 5ER,51.905134859082800,-0.527057920489808
water snake and Herring gull,LU5 5GZ,51.904111658572100,-0.512191765684155
Partridge and Thicketbird,LU5 5LJ,51.904835103664600,-0.513941311761812
Shearwater and Tahr,LU5 5NP,51.916324527455600,-0.503863727277947
Towhee and bushmaster,LU5 5NQ,51.912018926916500,-0.513195334337748
tokay and Egret,LU5 5NS,51.913123073409900,-0.510207422468574
tokay and king cobra,LU5 5TT,51.903643000000000,-0.520551000000000
gopher snake and Fulmarine petrel,LU5 5TZ,51.906139742180000,-0.510453014902413
turtle and Old World vulture,LU5 5UD,51.901179558294800,-0.506445444959734
Dorcopsis and diamondback turtle,LU5 6BH,51.949127260348200,-0.539804088612333
rattlesnake and Eagle,LU5 6DE,51.945891951000700,-0.530539146498149
Grosbeak and Parakeet,LU5 6DJ,51.946293085201200,-0.537480857540360
Scimitar babbler and Wallaby,LU5 6DN,51.947803996128700,-0.530287502839530
frilled lizard and Tree warbler,LU5 6EU,51.942992930906400,-0.533121718265905
crocodile and rat snake,LU5 6GH,51.908774000000000,-0.528993000000000
Nukupuʻu and Tahr,LU5 6HG,51.949979220962200,-0.546891863162816
Stilt and ringhals,LU5 6HQ,51.948867220298600,-0.548020000000000
Masked owl and Old World vulture,LU5 6HZ,51.962829619530800,-0.494063054847249
gopher snake and deaf adder,LU5 6PG,51.963438360279300,-0.493853433306737
Bronzewing pigeon and Mamo,LU5 6QP,51.940177698598600,-0.534493752687258
Jay and sand viper,LU6 1EL,51.894045244709400,-0.539802608240698
