name,postcode,lat,lon
hoop snake and leguaan,LU6 1GG,51.890577000000000,-0.524806000000000
Capuchin and worm lizard,LU6 1PH,51.883891510475300,-0.533113799385531
bull snake and crocodile,LU6 1QD,51.882276218084200,-0.533369782731940
sand viper and Chickadee,LU6 1RF,51.880779684648000,-0.563667115127133
hawksbill and Old World warbler,LU6 1RP,51.896220753181200,-0.555065063922596
tokay and moloch,LU6 1SA,51.886823259988900,-0.523805947996931
Bronzewing pigeon and fer-de-lance,LU6 1SF,51.884645807313000,-0.525838817059747
Chicken and rattlesnake,LU6 1UJ,51.898421884885600,-0.541797277653522
alligator and blindworm,LU6 2BA,51.868630000000000,-0.607526000000000
Fox and Solitaire,LU6 2BE,51.881776522290800,-0.591835980625076
Pheasant and Ground sloth,LU6 2BU,51.892138480223000,-0.577939012322459
Mouse and hognose snake,LU6 2DQ,51.876965405240800,-0.594790054747272
Pheasant and Zebra,LU6 2HQ,51.875522059743700,-0.585392570855226
thorn lizard and Tahr,LU6 2LL,51.851092245580300,-0.533730000000000
Diving bird and Zebra,LU6 2PS,51.882206627023300,-0.538617060388699
Crow and Jerboa,LU6 2RJ,51.863694908674400,-0.582132805692474
bandy-bandy and sand viper,LU6 3AW,51.880232933032200,-0.521697245523747
dugite and Piping shrike,LU6 3FF,51.884740246774500,-0.518323738075222
Wallaby and Mockingbird,LU6 3LY,51.871788425194800,-0.503802376156357
Macaw and Guillemot,LU6 3NP,51.879781598762700,-0.515565000000000
Komodo dragon and Darwin's finches,LU6 3PG,51.875101743790500,-0.519076362881038
milk snake and Recurvebill,LU6 3QF,51.877169653807400,-0.524790378035580
green turtle and Stint,LU6 3RF,51.846658273730400,-0.494052321999497
Hawaiian honeycreeper and Chipmunk,LU6 9UE,51.887761000000000,-0.523968000000000
water snake and Old World quail,LU7 9LZ,51.927956595324700,-0.581389000000000
bicycle lizard and Bronzewing pigeon,LU7 9QJ,51.924737612088700,-0.547416240429259
Boto and Peafowl,LU7 9QR,51.928876710706900,-0.557899858014926
anole and anole,LU7 9SL,51.931746000000000,-0.586782000000000
deaf adder and bearded lizard,MK17 9EB,51.996385002456700,-0.571230096443598
galliwasp and Mouse,MK17 9EE,51.987240751760800,-0.550623108037383
White ibis and Fulmarine petrel,MK17 9EF,51.987161385513600,-0.547829563351413
Perching duck and Kestrel,MK17 9EN,51.980511002587000,-0.532857587215533
crocodile and Grosbeak,MK17 9HP,51.968311307326500,-0.586665362457045
bearded lizard and rock snake,MK45 1ST,51.997583966187700,-0.507667620843167
Towhee and crocodile,MK45 4LW,51.965244950964900,-0.425743151619683
Mockingbird and Booted eagles,MK45 4NS,51.966260520732500,-0.420336226796533
Mouse and Polecat,MK45 4NW,51.964994876868500,-0.419827592389436
Parrotbill and bandy-bandy,MK45 4QG,51.970689043139400,-0.423368690775864
coral snake and Pratincole,MK45 4QH,51.969825328388800,-0.421986912611651
hognose snake and mountain devil,MK45 4SL,51.970947000000000,-0.468683533500119
tokay and Magpie,MK45 5DH,51.984245135084000,-0.505183981221784
Recurvebill and Ground sloth,MK45 5JL,51.982149516433800,-0.498324000000000
Egret and lizard,MK45 5JP,51.981963790751500,-0.496901653494480
Diving bird and tree snake,MK45 5LD,51.981388219664100,-0.494780412583714
Quetzal and worm lizard,SG1 1BG,51.902302226371300,-0.202796697589393
Minke whale and tortoise,SG1 1DG,51.901270324313400,-0.200584824990135
Komodo dragon and Scimitar babbler,SG1 1EL,51.903689129815500,-0.202348852497354
garter snake and krait,SG1 1ER,51.900470209041500,-0.201183684545235
Boto and Badger,SG1 1HN,51.901322000000000,-0.203234115835065
Thicketbird and Cloud rat,SG1 2FY,51.906204087400000,-0.213282416900000
krait and Puffleg,SG1 2JQ,51.916906442945300,-0.224810093113967
Vulture and Marmoset,SG1 2JT,51.920381739373200,-0.220935711785083
galliwasp and hoop snake,SG1 2NF,51.904170198718400,-0.212679829253089
Vulture and Rabbit,SG1 2NH,51.907639285825800,-0.211379079432484
smooth snake and Darwin's finches,SG1 2QJ,51.910638658533700,-0.222396663994728
hoop snake and Booted eagles,SG1 2QL,51.910848392793800,-0.221399736418416
Vulture and Fox,SG1 2RX,51.912674096600300,-0.219044896806287
Macaw and Mockingbird,SG1 2XU,51.899740683530300,-0.217652294105102
Crow and carpet snake,SG1 3AB,51.912048394729400,-0.209808114362820
Night heron and Vulture,SG1 3BZ,51.913905859692400,-0.206012019659300
giant tortoise and milk snake,SG1 3EU,51.915906466382100,-0.213987747984307
Viscacha and Argus,SG1 3HT,51.907372287495600,-0.206096000000000
sand lizard and Kite,SG1 3JD,51.909496557265000,-0.204617581084837
Schneider python and cerastes,SG1 3JH,51.910694000000000,-0.204010412008575
lizard and Wallaby,SG1 3PS,51.913696537461000,-0.201134969726612
Siskin and jew lizard,SG1 3PY,51.912305294737400,-0.205421537252245
blindworm and chameleon,SG1 4AZ,51.918118993166800,-0.207516323451769
Nukupuʻu and indigo snake,SG1 4BX,51.920645569152100,-0.205147115571809
boomslang and tokay,SG1 4BY,51.921342962090300,-0.204886621529005
Petrel and Peafowl,SG1 4BZ,51.919955963053200,-0.202815000000000
Grosbeak and gecko,SG1 4TN,51.922031064440600,-0.211694166925459
Pratincole and caiman,SG1 9NP,51.896091000000000,-0.202978000000000
Petrel and Meadowlark,SG1 9NW,51.896091000000000,-0.202978000000000
Old World vulture and Herring gull,SG1 9NZ,51.896091000000000,-0.202978000000000
Triller and hognose snake,SG1 9PE,51.896091000000000,-0.202978000000000
diamondback and rock python,SG16 6LA,51.997996736665400,-0.318722554141573
Tattler and Towhee,SG4 0AZ,51.960141856732600,-0.265413438021769
Chickadee and diamondback,SG4 0DU,51.948849578954100,-0.250919724100738
glass snake and Chipmunk,SG4 0FS,51.958621004674500,-0.267886000000000
Linsang and Gull,SG4 0NF,51.951941642603300,-0.249635236747363
Dorcopsis and frill-necked lizard,SG4 0NR,51.951833390999500,-0.247970000000000
bearded dragon and Komodo dragon,SG4 0TJ,51.965853000000000,-0.262995000000000
Kākāriki and perentie,SG4 0TZ,51.965774987142800,-0.265705440786717
Duck and Nukupuʻu,SG4 7HY,51.932279000000000,-0.235258000000000
mamba and flying lizard,SG4 7LD,51.933057842042600,-0.209510262676999
dukite and bandy-bandy,SG4 7LG,51.935111000000000,-0.212018000000000
goanna and American sparrow,SG4 7NZ,51.927030228806500,-0.256625843861194
iguana and perentie,SG4 7PB,51.930794281235400,-0.258210859890988
black snake and python,SG4 7PH,51.893661959688500,-0.240942711874177
Mamo and Bronzewing pigeon,SG4 7QD,51.929448031023100,-0.276094951589977
slowworm and chuckwalla,SG4 7SB,51.906889252649100,-0.296584475976769
Bronzewing pigeon and adder,SG4 7TB,51.915257123004900,-0.296965740223521
Prion and Fulmarine petrel,SG4 7TE,51.933856267754800,-0.300989144838056
Parrotlet and blue tongue,SG4 8BJ,51.851491283700000,-0.307098456000000
fer-de-lance and Linsang,SG4 8BU,51.886595817372800,-0.266488034006905
goanna and kabaragoya,SG4 8ES,51.847353399441800,-0.320392000000000
Grosbeak and constrictor,SG4 8HP,51.853302964824000,-0.301280399613093
Herring gull and Thrasher,SG4 8JT,51.899282361531600,-0.314706672464417
crocodile and chameleon,SG4 8PE,51.891653704360600,-0.335933435643417
blind snake and Black cockatoo,SG4 8PN,51.886760396398600,-0.331362551006036
iguana and Bunting,SG4 8TR,51.864094000000000,-0.229229517335010
wall lizard and Old World warbler,SG4 8UQ,51.848153288900700,-0.231681000000000
frilled lizard and bearded dragon,SG4 8UY,51.843691970057800,-0.238405478684809
elapid and Black jay,SG4 8WW,51.848510000000000,-0.244852000000000
Elephant and Tahr,SG4 8XL,51.852555000304500,-0.236404107525479
Eagle and Viscacha,SG4 9AA,51.947929000000000,-0.273808688450855
saltwater crocodile and Grosbeak,SG4 9AN,51.940079066829100,-0.276283919142913
anole and Mouse,SG4 9DJ,51.940898561315600,-0.272905000000000
Egret and Philippine hawk-owl,SG4 9HP,51.944457816300300,-0.268302877043599
Gull and gavial,SG4 9LP,51.944326008084700,-0.266678392896960
Gila monster and Partridge,SG4 9NA,51.944130946515300,-0.261507000000000
green turtle and Shearwater,SG4 9QJ,51.944783217450200,-0.253202192129604
thorn lizard and Tahr,SG4 9QZ,51.950287279022300,-0.262999817583216
pit viper and viper,SG4 9RU,51.947522480678200,-0.268810511765275
ringhals and Chipmunk,SG4 9SE,51.947595052871800,-0.274366084481299
loggerhead and anole,SG4 9SQ,51.951077511352800,-0.271482105592470
bearded lizard and Egret,SG4 9SY,51.951925000000000,-0.265973851739132
Bronzewing pigeon and Asiatic leopard,SG5 1EU,51.953268000000000,-0.276710000000000
Scimitar babbler and Masked owl,SG5 1HD,51.950375000000000,-0.279891000000000
rock snake and Mamo,SG5 1LN,51.952235436504300,-0.276865548300737
bearded lizard and Asiatic leopard,SG5 1PE,51.955740042079000,-0.279176145451343
Stint and Pitohui,SG5 1QU,51.953840456624300,-0.272085000000000
black snake and Quetzal,SG5 1RH,51.953759011164300,-0.268555762368879
Fox and Tit-tyrant,SG5 1TE,51.958686170717500,-0.272819546082638
Rat and boa constrictor,SG5 1XD,51.957052422175800,-0.277917933730519
anaconda and water snake,SG5 1XE,51.957542009472100,-0.277578987470688
Ground sloth and Armadillo,SG5 2BL,51.945827827762800,-0.283876937711638
mountain devil and leguaan,SG5 2DN,51.945856261453300,-0.278434107836069
tuatara and Argus,SG5 2EF,51.947189525129100,-0.285497000000000
gavial and iguana,SG5 2EP,51.946023626212000,-0.309215817436309
Hawaiian honeycreeper and Marmoset,SG5 2HY,51.949255877835800,-0.287733108805807
green turtle and asp,SG5 2JJ,51.954590932931600,-0.286700354809327
gopher snake and Darwin's finches,SG5 2JZ,51.951022839824900,-0.284959172547556
brown snake and Snipe,SG5 2LA,51.951689674727100,-0.285675882462942
habu and snapping turtle,SG5 2LE,51.952300256220700,-0.286234683722637
blue tongue and Rabbit,SG5 2LW,51.952470493910100,-0.288047224470673
Shearwater and saltwater crocodile,SG5 2NZ,51.956132189702600,-0.291284146269900
copperhead and Shearwater,SG5 2PP,51.958135731484000,-0.293653053925093
Darwin's finches and hognose snake,SG5 2PR,51.957623213409400,-0.294895041596972
Dorcopsis and elapid,SG5 2PS,51.957392153653700,-0.295704268742344
Coati and Masked owl,SG5 2QU,51.952886000000000,-0.288090000000000
habu and pit viper,SG5 2QZ,51.958502159443000,-0.295982365542764
Nukupuʻu and Ground sloth,SG5 2TF,51.960735005595700,-0.290599706017658
whip snake and Mouse,SG5 2UL,51.958951000000000,-0.288441000000000
galliwasp and Stint,SG5 3AJ,51.929383513288900,-0.339048000000000
ringhals and Quetzal,SG5 3NA,51.985396000000000,-0.372159000000000
cerastes and Fish eagle,SG5 3NY,51.998364272138000,-0.367217012902855
Zebra and indigo snake,SG5 3RB,51.974375457288400,-0.330715638124633
goanna and Buzzard,SG5 3SH,51.984801422257000,-0.299615337118644
smooth snake and Pitohui,SG5 3ST,51.981700509463700,-0.309066812930808
brown snake and cobra de capello,SG5 3SU,51.981820461409800,-0.310533029951590
dugite and tree snake,SG5 3XJ,51.967845000000000,-0.288466000000000
Boto and python,SG5 3YJ,51.970659052647800,-0.280526353512207
Quetzal and Tattler,SG5 3YR,51.969257000000000,-0.330498000000000
Perching duck and jew lizard,SG5 9EH,51.896109245500000,-0.203001000000000
Cuscus and Minke whale,SG5 9FN,51.896091000000000,-0.202978000000000
cobra de capello and Meadowlark,SG6 1BH,51.982834000000000,-0.224064452087926
Scimitar babbler and Stint,SG6 1BT,51.985341881039600,-0.220561692674541
alligator and rock snake,SG6 1DY,51.988225331712100,-0.212058545282171
Gull and giant tortoise,SG6 1ET,51.984195223747800,-0.218640000000000
Peafowl and tree snake,SG6 1FB,51.983456000000000,-0.209948000000000
pit viper and habu,SG6 1FY,51.980408000000000,-0.213651823315532
Tahr and tree snake,SG6 1HA,51.986481839198100,-0.207977408375347
Masked owl and tuatara,SG6 1NA,51.985024218117900,-0.204962807093953
frilled lizard and Eagle,SG6 1PR,51.979114947014100,-0.220255137511697
agama and Partridge,SG6 1QX,51.976818667710500,-0.215279166332718
gaboon viper and bandy-bandy,SG6 1SN,51.974348353703100,-0.219002640796076
Chickadee and racer,SG6 1UG,51.980927000000000,-0.212204000000000
Dorcopsis and Black jay,SG6 2AG,51.960978199253200,-0.217435000000000
Cuscus and Eagle,SG6 2DF,51.964556320858200,-0.220788232966927
amethystine python and leguaan,SG6 2ER,51.977431000000000,-0.205209044207425
Peafowl and Warbler,SG6 2GA,51.962072000000000,-0.216906979030718
Greenbul and Guillemot,SG6 2HL,51.966856031593800,-0.222429443476886
Siskin and Pheasant,SG6 2HY,51.964929880830200,-0.222898675244954
Parrotlet and Black cockatoo,SG6 2LH,51.974228000000000,-0.213425430940160
gecko and water snake,SG6 2LQ,51.973045776958000,-0.211964033348355
leathery turtle and Cuscus,SG6 2PZ,51.970610000000000,-0.204272000000000
Stilt and tuatara,SG6 2QW,51.969851773967000,-0.204157046538131
diamond snake and python,SG6 2QX,51.970682773742500,-0.200280428963290
bushmaster and sea snake,SG6 2SB,51.968720000000000,-0.205367000000000
terrapin and Francolin,SG6 2SP,51.965670094436900,-0.213582249519257
diamond snake and ringhals,SG6 2TN,51.967913240041300,-0.212080982474502
anole and Vole,SG6 2XB,51.981444000000000,-0.209504000000000
saltwater crocodile and Dorcopsis,SG6 3BJ,51.980396432993100,-0.225329966869887
snake and harlequin snake,SG6 3HH,51.974176018920300,-0.234427877090247
Pratincole and Nukupuʻu,SG6 3HJ,51.975801953032700,-0.233723321444999
Solitaire and Grackle,SG6 3HS,51.977307733477400,-0.225029776084114
Egret and Pheasant,SG6 3JE,51.975336643515300,-0.225500791964461
sea snake and Chickadee,SG6 3JS,51.969544782830300,-0.225423880853965
Zebra and Schneider python,SG6 3LL,51.968404202217800,-0.232689468399028
python and Solitaire,SG6 3LX,51.967091690166100,-0.238709506501270
Night heron and boa constrictor,SG6 3QT,51.975332319124100,-0.240191762144758
rock snake and Old World vulture,SG6 3RE,51.973291425549700,-0.242615739840166
gopher snake and python,SG6 3XY,51.970653450079900,-0.238176780142140
blind snake and Polecat,SG6 4BS,51.981498277389400,-0.246663075901520
Parakeet and Marmoset,SG6 4DF,51.982968222736200,-0.234912208697966
cycling lizard and Elephant,SG6 4DS,51.983880116350800,-0.238764553882385
Marsh harrier and glass snake,SG6 4DX,51.983774319918000,-0.241914201072486
Puffleg and Jackal,SG6 4HE,51.985732197031700,-0.233347228348479
krait and agama,SG6 4HQ,51.987249317977200,-0.228991253991299
perentie and krait,SG6 4NH,51.992024603417500,-0.224258501438184
Black cockatoo and Minke whale,SG6 4PN,51.997085692545200,-0.224174776152041
Meadowlark and Siskin,SG6 4QZ,51.996248012104500,-0.227660199323060
Warbler and Kite,SG6 4RJ,51.992733158154100,-0.222351528464167
smooth snake and dugite,SG6 4SU,51.995364003435700,-0.230462701780368
Pitohui and Fish eagle,SG6 4UP,51.980859277095600,-0.243003959741393
Coati and Fish eagle,SG6 4YF,51.991367362715200,-0.236169518781030
blue tongue and flying lizard,SG6 4YL,51.985898900758400,-0.241481486727365
amphisbaena and indigo snake,SG6 4YQ,51.988443447811700,-0.236663071951572
Jay and Macaw,SG6 9AS,51.981444000000000,-0.209504000000000
Mamo and amphisbaena,SG6 9BL,51.981444000000000,-0.209504000000000
gopher snake and Magpie,SG6 9GW,51.981453000000000,-0.209477000000000
Gila monster and whip snake,SG6 9WG,51.981620000000000,-0.209234000000000
