name,postcode,lat,lon
glass snake and Gila monster,BT44 9AP,55.010317000000000,-6.408215000000000
Tahr and Grosbeak,BT44 9AS,55.006473000000000,-6.408336000000000
elapid and milk snake,BT44 9DN,55.005552000000000,-6.398369000000000
dugite and Gull,BT44 9DR,55.017500000000000,-6.371550000000000
ringhals and king snake,BT44 9FA,55.004337000000000,-6.414016000000000
Nukupuʻu and bushmaster,BT53 6AG,55.070783000000000,-6.517846000000000
Triller and Badger,BT53 6AN,55.069062000000000,-6.516437000000000
hoop snake and Pheasant,BT53 6BF,55.077052000000000,-6.510380000000000
Solitaire and Gull,BT53 6BL,55.072717000000000,-6.522425000000000
White ibis and whip snake,BT53 6BZ,55.073799000000000,-6.523528000000000
Guillemot and king cobra,BT53 6DZ,55.072034000000000,-6.517767000000000
Parrotlet and B,BT53 6FB,55.070682000000000,-6.512948000000000
iguana and Pheasant,BT53 6JT,55.068736000000000,-6.518658000000000
Tahr and elapid,BT53 6LX,55.079252000000000,-6.512726000000000
Boto and snapping turtle,BT53 6NW,55.141620000000000,-6.520771000000000
Masked owl and Dolphin,BT53 6SZ,55.079588000000000,-6.506652000000000
Grosbeak and swift,BT53 7AS,55.065270000000000,-6.500409000000000
Jay and Chickadee,BT53 7DL,55.032380000000000,-6.461237000000000
Ice seal and rat snake,BT53 7HD,55.069360000000000,-6.471559000000000
B and Piping shrike,BT53 7HG,55.072266000000000,-6.470714000000000
slowworm and harlequin snake,BT53 7JH,55.030261000000000,-6.504110000000000
Badger and sea snake,BT53 7LJ,55.073589000000000,-6.495369000000000
alligator and diamond snake,BT53 7UD,55.066992000000000,-6.509032000000000
python and Mamo,BT53 7UE,55.066654000000000,-6.508575000000000
massasauga and rattlesnake,BT53 7UH,55.066824000000000,-6.509242000000000
soft-shelled turtle and tortoise,BT53 8BB,55.123038000000000,-6.471546000000000
boomslang and Parrotbill,BT53 8BE,55.123710000000000,-6.471084000000000
Civet and River dolphin,BT53 8DA,55.126025000000000,-6.472734000000000
thorny devil and Gila monster,BT53 8DU,55.169566000000000,-6.452913000000000
Komodo dragon and leathery turtle,BT53 8EF,55.163149000000000,-6.459061000000000
Boto and perentie,BT53 8EQ,55.148761000000000,-6.446612000000000
Tit-tyrant and snapping turtle,BT53 8HR,55.102901000000000,-6.437550000000000
death adder and agamid,BT53 8JR,55.085851000000000,-6.368443000000000
Coati and goanna,BT53 8JS,55.067191000000000,-6.356320000000000
garter snake and Rabbit,BT53 8NE,55.070447000000000,-6.433350000000000
python and diamond python,BT53 8NZ,55.061284000000000,-6.353995000000000
Zebra and Black cockatoo,BT53 8PT,55.120954000000000,-6.419569000000000
Mink and Mole,BT53 8PX,55.131710000000000,-6.398479000000000
asp and rat snake,BT53 8QA,55.155692000000000,-6.407778000000000
Bronzewing pigeon and Jerboa,BT53 8QE,55.136465000000000,-6.398022000000000
bandy-bandy and New World blackbird,BT53 8SU,55.132921000000000,-6.330318000000000
caiman and American sparrow,BT53 8TN,55.118265000000000,-6.369865000000000
Rat and Polecat,BT53 8TR,55.135537000000000,-6.364674000000000
Black jay and taipan,BT53 8XU,55.097126000000000,-6.313059000000000
soft-shelled turtle and Mink,BT53 8YF,55.090851000000000,-6.306322000000000
Zebra and Songlark,BT53 9SG,55.072040000000000,-6.517768000000000
agamid and Greenbul,BT53 9SR,55.072040000000000,-6.517768000000000
box turtle and White ibis,BT54 6AN,55.204587000000000,-6.252810000000000
death adder and Fulmarine petrel,BT54 6DF,55.207277000000000,-6.243900000000000
gopher snake and Tahr,BT54 6DY,55.198914000000000,-6.259000000000000
dukite and Greenbul,BT54 6ED,55.204505000000000,-6.244823000000000
Masked owl and sidewinder,BT54 6JE,55.177748000000000,-6.299670000000000
frilled lizard and galliwasp,BT54 6QH,55.203843000000000,-6.240389000000000
Ice seal and smooth snake,BT54 6RP,55.205604000000000,-6.264489000000000
terrapin and Skunk,BT54 6SZ,55.205670000000000,-6.240623000000000
diamondback and wall lizard,BT57 8SL,55.211384000000000,-6.520007000000000
elapid and leathery turtle,BT57 8SN,55.219179000000000,-6.497812000000000
diamond snake and River dolphin,BT57 8XR,55.208911000000000,-6.445431000000000
Fulmarine petrel and Kangaroo,BT57 8YQ,55.179531000000000,-6.470925000000000
