name,id,postcode,lat,lon
jew lizard and Hawaiian honeycreeper,417143,SA12 8EN,51.614342868882500,-3.805816065369060
Darwin's finches and hognose snake,412134,SA2 0DS,51.615844402605100,-3.968550643296420
asp and grass snake,420151,SA1 3UQ,51.614842883616000,-3.952603998106200
Macaw and Boto,411653,SA2 7PF,51.624537757572900,-4.021588379449440
ringhals and Solitaire,417088,SA13 1AG,51.593523978940000,-3.774094161423290
Capuchin and amphisbaena,417596,SA12 6RA,51.594174961644500,-3.809780238771340
boa and Flameback,411900,SA2 8DY,51.605912767282600,-3.998043928239570
Black jay and thorn lizard,416784,SA13 1PQ,51.595693415259100,-3.784025428842400
perentie and mud turtle,420207,SA1 6JQ,51.623983797696000,-3.951105000000000
gecko and Maya,417292,SA12 9AA,51.611322860902300,-3.759550923910730
tiger snake and agama,416752,SA13 1LE,51.587043908032300,-3.773870523712440
glass snake and Armadillo,1474398,CF32 0BW,51.535857479463200,-3.654018953376550
Stilt and constrictor,417053,SA12 8BN,51.622665356382400,-3.817169324609630
Herring gull and Parrotbill,416908,SA13 2BA,51.575234382371600,-3.756713358585330
anole and Treepie,412223,SA2 0NB,51.620242000000000,-3.973421000000000
carpet snake and Badger,417365,SA12 7HL,51.599259291373500,-3.815945801886400
flying lizard and Cuscus,1472313,CF36 5HN,51.483342000000000,-3.689434000000000
hognose snake and Buzzard,416797,SA13 1RS,51.593205000000000,-3.786902000000000
American sparrow and Ground sloth,420178,SA1 6HB,51.621873144417200,-3.954336092524760
Siskin and Marsh harrier,420252,SA1 4EU,51.619424610542300,-3.951789512897490
Tree warbler and wall lizard,412204,SA2 0JZ,51.617968633202900,-3.974854126540750
Myna and Chickadee,419521,SA1 9SY,51.613717549168800,-3.948352473930660
bearded lizard and asp,1472573,CF36 3RS,51.497544023258400,-3.712707493018340
Cuscus and blindworm,1807989,SA1 1SE,51.617984951400000,-3.937109584600000
Buzzard and mountain devil,417405,SA12 7NW,51.600875572803000,-3.823634464778940
asp and blind snake,417698,SA12 6UD,51.595149996897800,-3.793017000000000
whip snake and Chipmunk,1472580,CF36 3SD,51.493500000000000,-3.715106000000000
Bunting and terrapin,420149,SA1 3UN,51.613538209252900,-3.958585575935820
Fox and Coati,412287,SA2 0NG,51.618702977880100,-3.970220067655310
dukite and puff adder,416949,SA12 9LR,51.616235499019700,-3.773102122089850
Cuscus and iguana,416576,SA13 2NS,51.560308662722100,-3.746976998282170
Duck and Mamo,411839,SA2 0SA,51.621683220905500,-3.975347723630780
Kangaroo and Fish eagle,1473178,CF34 9TR,51.605678000000000,-3.647306589832600
Minke whale and galliwasp,417618,SA12 6SP,51.593855752376300,-3.813564601046730
Chipmunk and Marsh harrier,411091,SA3 4AQ,51.572897652537700,-4.001934936982720
Grouse and Fox,412127,SA2 0DG,51.613909655283500,-3.973450132331310
Eagle and Songlark,417364,SA12 7HH,51.601156788635100,-3.815357290216780
Gull and Bunting,1472462,CF36 3HJ,51.496112880759100,-3.707251446323990
pit viper and Tattler,1472282,CF36 5DF,51.481111885458000,-3.696840332242650
B and rat snake,1473517,CF33 6RP,51.528057138701100,-3.688378758254750
Mamo and Duck,417431,SA12 6DW,51.595030057568100,-3.795679608872830
lizard and Mamo,410666,SA3 5NE,51.585687743413300,-4.011245030736630
flying lizard and Condor,410543,SA3 5AH,51.590618224438600,-4.001631396122920
adder and Argus,411922,SA2 8HT,51.618403161599600,-3.998058175341200
Myna and Myna,1472341,CF36 5LP,51.483106849336900,-3.695690210774230
saltwater crocodile and Maya,416905,SA13 2AX,51.574388246236100,-3.753765625559120
Diving bird and Dorcopsis,1472809,CF36 3AP,51.477486687501600,-3.703890000000000
River dolphin and rattlesnake,411740,SA2 7QQ,51.624169287326400,-4.025747323966490
Philippine hawk-owl and leathery turtle,411601,SA2 9BW,51.623297965650500,-3.991540887618550
bushmaster and Condor,411238,SA2 9LQ,51.621233690523500,-3.998182549661310
Elephant and hoop snake,417332,SA12 7DJ,51.601843000000000,-3.805912000000000
mountain devil and Grouse,411793,SA2 7UF,51.624994117792900,-4.043525957595390
habu and soft-shelled turtle,417272,SA12 8UL,51.618948680649500,-3.802777617067600
Viscacha and Jerboa,411668,SA2 9EJ,51.623237175952600,-3.990353559518640
blue racer and Old World quail,411538,SA2 8NT,51.616425245839200,-4.006464935723860
Skunk and Argus,420036,SA1 5SG,51.620803489829900,-3.948901654735460
taipan and Zebra,411573,SA2 9AF,51.617081477283600,-3.991167531946680
pit viper and Mole,420502,SA1 3HH,51.622000310993000,-3.946684825007260
leathery turtle and Stilt,417923,SA12 6DL,51.585038866609700,-3.802762710002960
Black jay and viper,411597,SA2 9BR,51.619294662521500,-3.989516485900170
blindworm and habu,419523,SA1 9TA,51.613717549168800,-3.948352473930660
Songlark and Civet,411849,SA2 0SQ,51.621262204122300,-3.980053434749120
Egret and cayman,1473718,CF33 4PH,51.523240363968500,-3.719725979912120
diamondback turtle and Goose,411715,SA2 9JA,51.620904123762600,-3.994296429802500
alligator and taipan,420075,SA1 6BQ,51.620739963298200,-3.955963157874900
frill-necked lizard and Meadowlark,419786,SA1 8HP,51.624827560366600,-3.920814763920890
tokay and alligator,1472616,CF36 3UE,51.487597827068500,-3.714596042643340
whip snake and Marmoset,412068,SA2 0BP,51.614019281265000,-3.968529426629550
chuckwalla and Pitohui,1473087,CF34 9PD,51.607815106693200,-3.661514847177030
Polecat and Chipmunk,420059,SA1 6AD,51.621289900981900,-3.951017235734990
Songlark and Myna,420070,SA1 6BG,51.620341760025400,-3.955035922347350
galliwasp and Jay,417347,SA12 7EH,51.603466714218400,-3.819492791876410
crocodile and massasauga,416729,SA13 1EZ,51.592954558698000,-3.779630259641790
tuatara and box turtle,411536,SA2 8NR,51.616396424294100,-4.001306802140950
tortoise and Boto,1473144,CF34 0HJ,51.604607918573800,-3.639563549515750
diamondback and flying lizard,417103,SA13 1BB,51.595577557545400,-3.776845223176820
amethystine python and gopher snake,416738,SA13 1HU,51.589963582613600,-3.777622198710250
Cloud rat and Parakeet,410618,SA3 5HT,51.593176263221300,-4.016094887720310
tiger snake and boa constrictor,411447,SA2 8LN,51.616179059905900,-3.992413618385970
Grackle and rat snake,420670,SA1 1WG,51.616603470992800,-3.933713383513550
tokay and boomslang,410787,SA3 4LQ,51.572876698083700,-4.000000238594820
agamid and Meadowlark,1472386,CF36 5RP,51.485251474005500,-3.683527316814020
White ibis and rattlesnake,1473709,CF33 4NU,51.523882591071800,-3.697868011334560
cobra and Quetzal,411001,SA3 3DE,51.577977223087000,-4.044244368386000
Capuchin and horned viper,416857,SA13 1UD,51.585855566884000,-3.766808887717970
king snake and sidewinder,420659,SA1 1UG,51.615942251588000,-3.936184205212430
rat snake and loggerhead,410792,SA3 4LW,51.572099952184700,-3.999143571627730
Schneider python and Black cockatoo,420193,SA1 6HX,51.622896294510200,-3.960924544042660
Coati and Chickadee,1473248,CF34 0NW,51.605563520450300,-3.645172165870500
Minke whale and Shearwater,1473397,CF34 9AD,51.607658000000000,-3.657422000000000
Black jay and pit viper,416539,SA13 2EY,51.603743050017800,-3.771460047160840
racer and python,1473200,CF34 9YY,51.608343381147200,-3.654674285407040
Rat and Goose,411109,SA3 4BX,51.576954042316300,-3.999255607907330
Puffleg and Chicken,1472349,CF36 5NB,51.484725379171400,-3.699422969214340
whip snake and grass snake,421000,SA1 1EQ,51.619574591315700,-3.941120439288570
deaf adder and pit viper,410983,SA3 3AR,51.582200000000000,-4.040912000000000
Coati and Black cockatoo,420570,SA1 1QP,51.619092747847700,-3.937083961629230
Philippine hawk-owl and Egret,417135,SA12 8EA,51.610788738238500,-3.801862070359530
Quetzal and bull snake,1474483,CF32 0NH,51.486343884889100,-3.659254923242130
smooth snake and Night heron,416975,SA12 9PL,51.620002527952200,-3.764798263119290
thorn lizard and Herring gull,412024,SA2 7EG,51.619669758096100,-4.026977034121610
Polecat and brown snake,416883,SA13 1YY,51.598128113391500,-3.777060308073980
diamond snake and bandy-bandy,420579,SA1 1RG,51.618185102637500,-3.935412967374760
Mockingbird and Dorcopsis,411838,SA2 0RZ,51.622046788606200,-3.975117923532880
skink and bearded lizard,410874,SA3 4SE,51.574736871485000,-4.021585277156230
Wader and Cuscus,411628,SA2 7LZ,51.621910371702300,-4.002271819259460
Condor and bearded dragon,1473597,CF34 0BD,51.615107000000000,-3.666109057680000
perentie and Badger,417387,SA12 7LU,51.596076850138800,-3.815891017687620
taipan and Diving bird,410717,SA3 5RN,51.582014509912400,-4.018299833131060
tuatara and king snake,420301,SA1 4NP,51.613797562879200,-3.962312000000000
Flameback and Old World vulture,1472281,CF36 5DE,51.481947663687100,-3.695835000000000
Fulmarine petrel and Old World quail,416586,SA13 2PN,51.532470041974700,-3.718257232320640
Grosbeak and Partridge,1473097,CF34 9PS,51.607073830348300,-3.670658071419920
Vulture and blind snake,417380,SA12 7LH,51.600101469348600,-3.817307837679520
king cobra and lizard,419940,SA1 5JY,51.620434462487900,-3.947296760816790
gopher snake and frilled lizard,416625,SA13 1DP,51.585140815296700,-3.768888608629550
bushmaster and Ibex,419560,SA1 9TQ,51.613717549168800,-3.948352473930660
Thrasher and whip snake,412047,SA2 0AA,51.617367296194500,-3.966753127870620
Ground sloth and rock snake,1473609,CF34 0BX,51.606445518367200,-3.645117409540570
Ibex and Jerboa,416924,SA13 2DD,51.570723437185500,-3.755298425676460
Boto and Meadowlark,410640,SA3 5JX,51.589874623567300,-4.011458881215070
Stilt and Guillemot,416431,SA13 2DN,51.570156272233600,-3.757744078609820
Hawk and Pheasant,419788,SA1 8HR,51.624118544057000,-3.918531035242660
coral snake and Black jay,411920,SA2 8HR,51.618580588675900,-3.996086913878090
turtle and Quetzal,417130,SA12 8DS,51.601433607185800,-3.793260910247510
Black jay and Elephant,410859,SA3 4RL,51.572791418430200,-4.024890264009730
Parakeet and Vole,420306,SA1 4NW,51.613591763836000,-3.963989943887620
jew lizard and habu,412194,SA2 0JE,51.616624376792500,-3.972975683382010
elapid and Thicketbird,416916,SA13 2BR,51.577760176237700,-3.760981703103840
Old World warbler and cobra de capello,410989,SA3 3AZ,51.582274784012100,-4.042748494000690
gopher snake and Kākāriki,410633,SA3 5JN,51.588657710722300,-4.003219791645350
Vulture and rattlesnake,417514,SA12 7TH,51.603552506055000,-3.829590179148770
Fulmarine petrel and Mamo,416808,SA13 1SU,51.588766793534600,-3.769347072776120
worm lizard and Treepie,417284,SA12 8YE,51.619367247230700,-3.797767159573960
frill-necked lizard and flying dragon,410621,SA3 5JE,51.589302324050700,-4.004966087590890
copperhead and Condor,1473195,CF34 9YP,51.607605822751500,-3.655108000000000
Puffleg and agama,410692,SA3 5PS,51.580965797756100,-4.008669331780880
python and rock python,1473326,CF33 6AL,51.527455522999800,-3.695175374959480
Night heron and turtle,1472405,CF36 5SU,51.489926858821900,-3.679810401726820
Masked owl and Vulture,410573,SA3 5DD,51.593626382691800,-4.001359423288980
diamondback turtle and grass snake,1473185,CF34 9UP,51.610857581138400,-3.659387361172330
Thicketbird and Solitaire,417180,SA12 8NU,51.619906150128700,-3.806008078254100
pit viper and Armadillo,1759301,CF33 4HX,51.519862306823300,-3.700284647774060
amethystine python and massasauga,419512,SA1 9SN,51.613717549168800,-3.948352473930660
River dolphin and Booted eagles,420086,SA1 6DF,51.620173861279900,-3.964014180333940
Stilt and boa,410911,SA3 4UD,51.575556548569800,-4.016281796731150
Booted eagles and krait,420279,SA1 4JY,51.618057381859500,-3.955053279872490
gaboon viper and sea snake,420921,SA1 1EF,51.619046091828300,-3.939364395408850
Dorcopsis and Condor,411817,SA2 8AG,51.605604000000000,-3.994154536620590
diamondback turtle and Viscacha,410856,SA3 4RG,51.575466033451100,-4.022584587995460
Peafowl and rat snake,411452,SA2 8LU,51.613614714476300,-3.995146770566070
Ground sloth and tortoise,1472575,CF36 3RU,51.496445927728600,-3.712162094127700
Tahr and bearded lizard,1472568,CF36 3RH,51.489196457219800,-3.713503695952870
amphisbaena and cayman,410577,SA3 5DH,51.593322508455200,-4.006514746064730
blind snake and Civet,417602,SA12 6RH,51.596696692933800,-3.807194973456040
Towhee and Pheasant,410589,SA3 5DZ,51.594337280483100,-4.014991274008240
bushmaster and Vulture,411975,SA2 7AR,51.616123081626200,-4.024059971767630
Nukupuʻu and Condor,419727,SA1 6NB,51.623322302325000,-3.966635078926730
Snipe and Tree warbler,416592,SA13 2PW,51.536016491472500,-3.730863250225880
Mink and blindworm,1472370,CF36 5PH,51.483410561567600,-3.681471981591190
Linsang and boomslang,410776,SA3 4LA,51.574701000000000,-4.029909630721430
Kite and blindworm,420264,SA1 4HX,51.618546082486800,-3.955406537645200
Logrunners and Guillemot,420315,SA1 4PT,51.618515573332500,-3.959392203787710
Elephant and Minke whale,417463,SA12 6JD,51.591814738301700,-3.806553615493570
Thicketbird and mud turtle,410814,SA3 4PJ,51.571280671884300,-4.004995330242340
blue racer and Dolphin,1473503,CF33 6NU,51.525739320329200,-3.689475083710680
water snake and Tattler,419961,SA1 5PZ,51.618761981351900,-3.958637200958700
flying lizard and turtle,1473169,CF34 9SY,51.586672350852700,-3.639292940099840
Grackle and New World blackbird,1473485,CF33 6LP,51.531200404841400,-3.692402198624470
constrictor and anole,420185,SA1 6HN,51.624317001766100,-3.951219365150100
Vulture and cycling lizard,419809,SA1 8LH,51.620906000000000,-3.915983000000000
Old World quail and leguaan,1808005,SA1 5TR,51.620970523700000,-3.950137337600000
sidewinder and amethystine python,417315,SA12 9BG,51.614986254867300,-3.764704734394730
Wader and Civet,410743,SA3 4HB,51.571392226420600,-3.995288377308250
crocodile and Songlark,417225,SA12 6YP,51.599812931146900,-3.796922394166200
giant tortoise and lizard,1472233,CF36 3YN,51.478138000000000,-3.705413000000000
American sparrow and Scimitar babbler,416552,SA13 2LA,51.581015343547600,-3.761583872056040
Snipe and Night heron,416903,SA13 2AU,51.575401629505500,-3.755752897216150
snake and crocodile,420164,SA1 3XL,51.617512500029900,-3.933665363494440
Old World warbler and python,412307,SA2 0QB,51.621012187273900,-3.973007149248090
Puffleg and king snake,411904,SA2 8ED,51.601075000000000,-3.996503000000000
Zebra and sand viper,410796,SA3 4NA,51.573220985324600,-4.005643557761490
Kestrel and bushmaster,2639347,CF34 9PZ,51.611094000000000,-3.669637000000000
Puffleg and Hawk,1473449,CF33 6EZ,51.532005820887500,-3.675765264172390
Tree warbler and Thrasher,411449,SA2 8LR,51.616844824292600,-3.993453943266740
boa constrictor and boomslang,1473034,CF34 9GG,51.594181667193700,-3.639231297326980
Cloud rat and Parrotbill,1473179,CF34 9TS,51.605244127419200,-3.647427822577530
moloch and chameleon,1473342,CF33 6BF,51.532983537285400,-3.676565329989550
Argus and Gull,417072,SA12 9YA,51.623720791704300,-3.785312679608670
Kestrel and Kite,416934,SA12 9HT,51.616170020336300,-3.765516220202250
smooth snake and snake,416834,SA12 9DH,51.616955530802900,-3.754510955470810
sea snake and Kangaroo,417288,SA12 8YL,51.622360531364700,-3.800774797237200
River dolphin and whip snake,417707,SA12 6UR,51.596416992803000,-3.796716127850750
diamondback turtle and Skunk,416636,SA13 1EF,51.592025839753500,-3.772072368072360
swift and Mole,419777,SA1 8HA,51.624717094588800,-3.925361052170190
Buzzard and Stilt,411608,SA2 9DF,51.618640236791500,-3.984085174512250
slowworm and Duck,1473028,CF34 9EY,51.598677847626800,-3.646930234836700
dugite and Marsh harrier,1473050,CF34 9HR,51.596122698034700,-3.645105232828450
massasauga and soft-shelled turtle,410574,SA3 5DE,51.594000712438400,-4.002083338711300
flying lizard and Fox,410845,SA3 4QS,51.571136152577700,-4.008712073140940
Solitaire and diamondback,420254,SA1 4EY,51.619756030566400,-3.951327021122880
bearded lizard and Polecat,1473607,CF34 0BT,51.618705110362100,-3.660843724550940
hoop snake and diamondback turtle,420912,SA1 1DP,51.619758000000000,-3.939351000000000
amethystine python and Macaw,410786,SA3 4LP,51.572631998680300,-4.004852775328590
glass snake and water snake,420152,SA1 3UR,51.613111117746300,-3.959390485273480
bearded lizard and flying lizard,420047,SA1 5TZ,51.621094879669200,-3.948683001446260
Cloud rat and Rabbit,1472239,CF36 3YY,51.478059688447100,-3.707628327800390
Myna and tokay,416425,SA13 2DE,51.570087255190000,-3.751536589079450
frilled lizard and bull snake,410771,SA3 4JU,51.566970303159700,-3.986668013299540
flying dragon and constrictor,420620,SA1 3RX,51.615736177409400,-3.947008926105440
Dorcopsis and diamondback,411996,SA2 7BX,51.621379913571700,-4.016969532999360
gavial and Grouse,1473596,CF34 0BB,51.614212498136900,-3.665041671762530
terrapin and Masked owl,410548,SA3 5AQ,51.590457207434800,-4.000527123013250
Recurvebill and indigo snake,410645,SA3 5LD,51.588222125931700,-4.009234894218070
Chipmunk and bull snake,420182,SA1 6HG,51.624883257138600,-3.950694658329520
jew lizard and Chicken,420095,SA1 6DY,51.619608741784700,-3.961779545642820
Tattler and River dolphin,420199,SA1 6JE,51.623376990898300,-3.953129384966240
Fox and Triller,420607,SA1 3QR,51.616696375006500,-3.947671166555940
blind snake and terrapin,1473787,CF33 4PU,51.507379865760600,-3.716520370187940
garter snake and cycling lizard,416543,SA13 2HL,51.583241420118200,-3.766635287585230
Puffleg and Tree warbler,1808096,SA11 2FP,51.622673000000000,-3.824292000000000
Mamo and Grackle,416608,SA13 2RT,51.623501852997100,-3.724786525254790
boomslang and Mouse,417280,SA12 8UY,51.619725268568200,-3.800222628881540
Parrotbill and carpet snake,410854,SA3 4RE,51.569859099693000,-4.021282227974450
Diving bird and Kākāriki,420138,SA1 3TU,51.614700067672800,-3.956858951574200
Old World quail and death adder,411665,SA2 9EF,51.620964360304300,-3.984908902167180
rattlesnake and Argus,411912,SA2 8EP,51.600981075491600,-3.999848987758530
Thrasher and Treepie,411565,SA2 8QH,51.613182756665700,-3.987746966728830
Lemming and Kestrel,417501,SA12 7SS,51.606653600786700,-3.823894933554470
Quetzal and Stint,419700,SA1 8BH,51.623882257581100,-3.931292402756370
Vulture and Night heron,1473675,CF33 4HR,51.520926804773500,-3.700165217324040
Triller and sidewinder,416626,SA13 1DQ,51.600220741509200,-3.776636641657150
milk snake and massasauga,417471,SA12 6JP,51.591574829729600,-3.808117698884380
Thicketbird and Chicken,420062,SA1 6AP,51.620564980361900,-3.952430754144610
Mockingbird and crocodile,1473699,CF33 4NE,51.523971465587900,-3.702282352501960
Scimitar babbler and blue tongue,421015,SA1 1JF,51.620959000000000,-3.942211620620220
Hawaiian honeycreeper and Songlark,411968,SA2 7AG,51.617829056643400,-4.012709528568740
saltwater crocodile and Recurvebill,416607,SA13 2RS,51.617888647680300,-3.713263261284820
tuatara and viper,412203,SA2 0JY,51.618160724202100,-3.976263681294550
Kākāriki and bicycle lizard,420234,SA1 4BB,51.617230095424900,-3.954512135219270
puff adder and River dolphin,416669,SA13 2UA,51.555994375063600,-3.720067080706550
Hawaiian honeycreeper and Moluccan boobook,420311,SA1 4PF,51.614352098932400,-3.957541000000000
frilled lizard and Dorcopsis,1472586,CF36 3SL,51.493223734594900,-3.706812151098900
skink and Grouse,411229,SA2 9JU,51.619177687496800,-3.999045633295070
White ibis and Fish eagle,417114,SA13 1BT,51.594644122977000,-3.780288260586860
Grosbeak and Fish eagle,1472279,CF36 5DB,51.477699194593700,-3.687814116562730
Parakeet and worm lizard,417266,SA12 7BW,51.611641762648300,-3.812453768126400
