name,postcode,lat,lon
puff adder and tortoise,CF32 0BJ,51.530853463559400,-3.646657749992520
boa and diamondback turtle,CF32 0PJ,51.463832937692300,-3.637736499967810
fer-de-lance and Masked owl,CF33 4BH,51.517890647557800,-3.705514738202130
Stint and goanna,CF33 4DJ,51.524272695265900,-3.707540739796170
Snipe and Bronzewing pigeon,CF33 4ER,51.518973998873400,-3.699025871649970
Coati and brown snake,CF33 4LY,51.521901845049800,-3.701758305802620
viper and perentie,CF33 4PD,51.525733331056700,-3.706038499350560
River dolphin and bushmaster,CF33 4PU,51.507379865760600,-3.716520370187940
jew lizard and rock snake,CF33 6AA,51.529511072567000,-3.691070849409000
Scimitar babbler and rock snake,CF33 6BL,51.524744000000000,-3.674965000000000
Chicken and Parakeet,CF33 6DG,51.529235646494300,-3.677061945553240
Asiatic leopard and Scimitar babbler,CF33 6DU,51.533122550199700,-3.671235781078750
tortoise and Marsh harrier,CF33 6FJ,51.527125000000000,-3.682190000000000
glass snake and Kākāriki,CF33 6JF,51.532097308228800,-3.696919376673760
goanna and water snake,CF33 6RL,51.531148000000000,-3.706068000000000
cerastes and Vole,CF34 0AT,51.612868798055500,-3.666581245213410
Cloud rat and boomslang,CF34 0BP,51.617407636481100,-3.661663025756330
worm lizard and Komodo dragon,CF34 0BT,51.618705110362100,-3.660843724550940
Darwin's finches and copperhead,CF34 0ET,51.619816263984500,-3.663022229542620
box turtle and Fulmarine petrel,CF34 0EW,51.620190291484400,-3.661374666757690
coral snake and tree snake,CF34 0LA,51.620120437953500,-3.660592055560220
Snipe and Quetzal,CF34 0LP,51.605602233988500,-3.643050752665310
Komodo dragon and thorn lizard,CF34 9AD,51.607658000000000,-3.657422000000000
bearded lizard and chuckwalla,CF34 9AJ,51.608647702772100,-3.654136561617250
bull snake and Songlark,CF34 9AQ,51.604463406201600,-3.654345463251630
gavial and terrapin,CF34 9DF,51.608214637831000,-3.659334290060430
Macaw and Asiatic leopard,CF34 9LW,51.602851336808100,-3.659615235875380
Parrotlet and bearded lizard,CF34 9LX,51.606893690034800,-3.650982348982930
blue tongue and Quetzal,CF34 9LY,51.599492000000000,-3.662611000000000
Rabbit and death adder,CF34 9NA,51.599452176182300,-3.664068436492460
massasauga and Mockingbird,CF34 9NF,51.601125301750400,-3.663393200051070
Jay and sidewinder,CF34 9PE,51.607227962961700,-3.665508129661010
Goose and Moluccan boobook,CF34 9RF,51.611138000000000,-3.670798429228950
rock python and krait,CF34 9SE,51.587158647060100,-3.650786316592670
Goose and puff adder,CF34 9YE,51.604089000000000,-3.661191000000000
Wallaby and Towhee,CF34 9YH,51.608993094924900,-3.653874721409150
dukite and Thicketbird,CF34 9YL,51.608597197581700,-3.653371000000000
Condor and moloch,CF34 9YW,51.608522348316900,-3.655374003071580
rock python and puff adder,CF36 3AB,51.478991944783500,-3.705978243204340
chuckwalla and bearded dragon,CF36 3BY,51.474934000000000,-3.701985000000000
alligator and bicycle lizard,CF36 3DB,51.484063036632400,-3.704165584192310
Wader and bull snake,CF36 3HQ,51.495169810440800,-3.710875342290650
rattlesnake and python,CF36 3LD,51.481974071590900,-3.715635000000000
Tit-tyrant and wall lizard,CF36 3NN,51.489600465091800,-3.708001994614720
jew lizard and agamid,CF36 3NP,51.489658846972300,-3.706462914044040
anole and leathery turtle,CF36 3PS,51.487961654489700,-3.706918066808810
loggerhead and racer,CF36 3TJ,51.492461979166300,-3.717717253709440
Parrotbill and Chicken,CF36 3UE,51.487597827068500,-3.714596042643340
Coati and thorny devil,CF36 3UN,51.487426011984800,-3.719573254868000
anole and kabaragoya,CF36 3UT,51.489764787718700,-3.715224725539090
bearded dragon and Coati,CF36 5AD,51.487489604826300,-3.667866650364770
wall lizard and Snipe,CF36 5AF,51.487036762687400,-3.667461229056560
horned viper and flying dragon,CF36 5AS,51.487150288159500,-3.676525159032470
Jackal and alligator,CF36 5BN,51.482788070698000,-3.692236271963580
Grosbeak and Zebra,CF36 5BS,51.481010384610500,-3.694646000000000
jew lizard and horned toad,CF36 5DF,51.481111885458000,-3.696840332242650
brown snake and diamond python,CF36 5DY,51.487547247717400,-3.694573061881340
frill-necked lizard and bandy-bandy,CF36 5HB,51.487057260377200,-3.691141265626070
Towhee and Flameback,CF36 5HD,51.487819418946200,-3.676895398112560
ringhals and Chickadee,CF36 5ND,51.485837294990700,-3.698398489691740
Viscacha and tokay,CF36 5RF,51.488244624811300,-3.673569314540070
sidewinder and Fox,CF36 5SG,51.485131308703100,-3.685006384642890
Gull and Parrotlet,CF36 5SS,51.491678549785800,-3.670497208810330
Fulmarine petrel and chameleon,CF36 9DX,51.478958000000000,-3.705995000000000
Condor and Capuchin,SA1 1AF,51.619766000000000,-3.939424000000000
racer and Kangaroo,SA1 1EG,51.619302706696800,-3.940704351682470
Dorcopsis and rock python,SA1 1LF,51.622696558244800,-3.942655061012530
Flameback and Coati,SA1 1RH,51.617988710663600,-3.936415784789720
amethystine python and Songlark,SA1 1RP,51.618609594093800,-3.935301023044770
turtle and Tit-tyrant,SA1 1RQ,51.618060187407100,-3.935898794354140
blue tongue and box turtle,SA1 1WG,51.616603470992800,-3.933713383513550
viper and chameleon,SA1 3BP,51.619866761580300,-3.945741176705870
Jerboa and deaf adder,SA1 3BR,51.619934690044100,-3.945440717215170
Treepie and Macaw,SA1 3JE,51.617323996398800,-3.952652741754470
massasauga and Coati,SA1 3QQ,51.618817446868500,-3.947198627500350
Pheasant and gaboon viper,SA1 4AF,51.619046171184200,-3.949129702280340
Kite and flying lizard,SA1 4BQ,51.615723272330900,-3.956975199088300
Komodo dragon and brown snake,SA1 4DE,51.617397793380600,-3.955043000000000
anole and taipan,SA1 4DN,51.616996960334100,-3.956091075340280
Tit-tyrant and rat snake,SA1 4HS,51.618747312461600,-3.956281928845830
leguaan and Tattler,SA1 4HZ,51.618554432030000,-3.955984719918850
Capuchin and Hawaiian honeycreeper,SA1 4JS,51.617382469953700,-3.958317774145620
Hawaiian honeycreeper and diamondback,SA1 4PZ,51.617927450015000,-3.961942000000000
gaboon viper and Stilt,SA1 5JN,51.619836579396100,-3.949726973887140
moloch and Wader,SA1 5RG,51.620006390629300,-3.955194856438620
blindworm and cayman,SA1 5SN,51.620388415018800,-3.951151911388130
agama and Old World quail,SA1 6BD,51.621044894158600,-3.953852657719100
Asiatic leopard and terrapin,SA1 6JQ,51.623983797696000,-3.951105000000000
iguana and Moluccan boobook,SA1 8HF,51.623336794050400,-3.923987922613370
Crow and iguana,SA1 8LA,51.622632833479800,-3.915347838426620
Chipmunk and Francolin,SA1 8LJ,51.621333090481400,-3.914541879145990
Civet and wall lizard,SA1 8NF,51.623945760549200,-3.912036944551480
skink and Guillemot,SA1 8PG,51.618099717612100,-3.930223437782890
horned viper and garter snake,SA1 8QE,51.620512666070700,-3.884112754636690
smooth snake and Pratincole,SA1 9TA,51.613717549168800,-3.948352473930660
Kite and Chicken,SA1 9TE,51.613717549168800,-3.948352473930660
viper and dugite,SA1 9TN,51.613717549168800,-3.948352473930660
blindworm and mountain devil,SA1 9TQ,51.613717549168800,-3.948352473930660
Civet and cycling lizard,SA12 6BJ,51.595197035455900,-3.799454479562440
Logrunners and Philippine hawk-owl,SA12 6BL,51.587554970033200,-3.802876770895310
alligator and slowworm,SA12 6BZ,51.594579015638000,-3.798708163536120
rattlesnake and Asiatic leopard,SA12 6EF,51.596687432746300,-3.790200677458030
king cobra and Capuchin,SA12 6EL,51.595705876857700,-3.790292013457500
Fox and Rabbit,SA12 6EN,51.596247650277000,-3.791323996699850
bushmaster and Diving bird,SA12 6HX,51.594142421421400,-3.801376292811640
agamid and Tattler,SA12 6JG,51.591230752817200,-3.808854737212730
Greenbul and Armadillo,SA12 6RB,51.594435312558500,-3.808058072791320
constrictor and Kangaroo,SA12 6RR,51.598705743297400,-3.807534651980480
garter snake and Badger,SA12 6TF,51.598188856380500,-3.814805737887340
Macaw and Moluccan boobook,SA12 6TQ,51.599235656664700,-3.809909283151100
habu and bandy-bandy,SA12 6TR,51.597616874192100,-3.808170023849940
Viscacha and gecko,SA12 6UP,51.596941546505300,-3.796520258921130
Goose and grass snake,SA12 6US,51.597338364553900,-3.795857310730640
White ibis and Mamo,SA12 6UY,51.597805903801800,-3.795861320434150
Cuscus and gaboon viper,SA12 6YX,51.600490110736300,-3.797916582654270
Cloud rat and perentie,SA12 7BQ,51.608133676716200,-3.818336324828180
agama and Capuchin,SA12 7BW,51.611641762648300,-3.812453768126400
krait and Night heron,SA12 7BZ,51.604226000000000,-3.809415000000000
sea snake and Tree warbler,SA12 7DD,51.610825748166900,-3.812305713351020
cobra de capello and Komodo dragon,SA12 7DE,51.611230065471400,-3.813491702800840
American sparrow and grass snake,SA12 7DJ,51.601843000000000,-3.805912000000000
rock python and diamondback turtle,SA12 7HU,51.603200080122400,-3.814644582138850
Tree warbler and Kite,SA12 7SP,51.605842338515200,-3.824598918636200
Minke whale and Moluccan boobook,SA12 7TH,51.603552506055000,-3.829590179148770
smooth snake and Macaw,SA12 8BH,51.618767166082500,-3.812809953214390
krait and Cloud rat,SA12 8DX,51.600653000000000,-3.791454000000000
chuckwalla and monitor,SA12 8EN,51.614342868882500,-3.805816065369060
gopher snake and glass snake,SA12 8ES,51.615862726998100,-3.806974185890590
cayman and galliwasp,SA12 8HR,51.599262540771900,-3.784670706796110
crocodile and Old World quail,SA12 8LS,51.624965467341700,-3.807393711698250
Linsang and blindworm,SA12 8PF,51.623260069895600,-3.807773774395590
Stilt and chameleon,SA12 8UD,51.619628332549100,-3.809449553856700
Viscacha and milk snake,SA12 9EX,51.618824342593400,-3.753412982623150
Kangaroo and Solitaire,SA12 9HT,51.616170020336300,-3.765516220202250
king snake and thorny devil,SA13 1AQ,51.598490701707100,-3.778056309375860
Jay and Partridge,SA13 1NT,51.596185072336500,-3.783625993367810
Lemming and grass snake,SA13 1PT,51.586336503963300,-3.773077907971160
Viscacha and moloch,SA13 1RU,51.593520000000000,-3.784503000000000
Maya and Maya,SA13 1TR,51.585660614592300,-3.767811758109830
Flameback and Vole,SA13 1TT,51.584683056989700,-3.768235708709770
death adder and flying dragon,SA13 2AH,51.570706663411700,-3.749799940970420
Ground sloth and blue tongue,SA13 2AT,51.575890895157900,-3.754905856506960
diamond snake and Dorcopsis,SA13 2EN,51.594932232224900,-3.773138407407930
Condor and Skunk,SA13 2PH,51.540232404948800,-3.743107496894430
Stint and Diving bird,SA13 2RH,51.615598177573100,-3.708771506198990
White ibis and Grouse,SA13 2RY,51.616392810228300,-3.714709137855410
Diving bird and Stint,SA13 2SU,51.562722255376100,-3.737042428541710
Cloud rat and Boto,SA13 2TU,51.591444282998900,-3.767704305128300
Vole and Polecat,SA13 2UP,51.546665000000000,-3.699495000000000
blue racer and White ibis,SA13 2YA,51.594204296340400,-3.756968932996870
Piping shrike and sea snake,SA13 9ET,51.592358000000000,-3.778988000000000
lizard and coral snake,SA2 0AE,51.615753967000200,-3.966972254968050
diamond snake and Hawk,SA2 0AT,51.611257812762400,-3.972324051689190
Lemming and frilled lizard,SA2 0AY,51.610023000000000,-3.973372000000000
Kangaroo and Rat,SA2 0DE,51.613432657142300,-3.972403913368340
Marmoset and Bunting,SA2 0HS,51.615922902655600,-3.970012000000000
Schneider python and Jerboa,SA2 0LX,51.619593629679900,-3.975011371743760
Myna and rattlesnake,SA2 0NX,51.618117000000000,-3.965023000000000
constrictor and Skunk,SA2 0PR,51.620969115752900,-3.969682613064490
Condor and rat snake,SA2 0PT,51.619103161489600,-3.968879502040070
Fox and puff adder,SA2 0QH,51.619980449449100,-3.978206308783080
tortoise and giant tortoise,SA2 0QY,51.619646034015200,-3.965999370225050
king snake and amethystine python,SA2 0SA,51.621683220905500,-3.975347723630780
whip snake and Prion,SA2 0TS,51.623129859220200,-3.979152364549940
Marsh harrier and Skunk,SA2 7AA,51.620056709108000,-4.002869166797140
bandy-bandy and Gull,SA2 7AJ,51.617934074806100,-4.018636833176490
Ibex and Quetzal,SA2 7AL,51.617559579263800,-4.020541447224660
Flameback and Meadowlark,SA2 7BE,51.618131492760600,-4.013950786739650
Nukupuʻu and amphisbaena,SA2 7BU,51.620490273872800,-4.016410004271410
boomslang and Kākāriki,SA2 7HW,51.613015285175500,-4.041499989717810
giant tortoise and Treepie,SA2 7JP,51.596383105406900,-4.041778980042080
ringhals and chuckwalla,SA2 7QA,51.624542732646700,-4.028075583494000
rattlesnake and gavial,SA2 7RB,51.622238172091100,-4.029258564571930
monitor and Old World warbler,SA2 7RN,51.621773155524900,-4.030668040003320
frilled lizard and copperhead,SA2 7SL,51.622374481811800,-4.021882263985830
Meadowlark and milk snake,SA2 8AB,51.612842360467300,-3.994029603669790
boa and B,SA2 8BB,51.609036639479300,-3.998368885028290
bull snake and Bronzewing pigeon,SA2 8HZ,51.618671663570400,-3.999716782849010
dukite and Kite,SA2 8JF,51.619476088668900,-4.001586794567550
green turtle and anaconda,SA2 8JQ,51.616852971362000,-4.000373514146710
bearded lizard and Siskin,SA2 8LT,51.614524737380700,-3.995042246056840
Rabbit and worm lizard,SA2 8PW,51.610634141440400,-3.976788815061780
New World blackbird and rock python,SA2 8QE,51.608167471400000,-3.989117074700000
Petrel and Crow,SA2 8QG,51.607536324318000,-3.988756715620410
Philippine hawk-owl and bearded dragon,SA2 8QQ,51.617957006505400,-4.008916024514460
Kākāriki and Gila monster,SA2 9AH,51.616759559539500,-3.988408872599720
B and Vulture,SA2 9BB,51.617131694185700,-3.989797436752010
worm lizard and blue tongue,SA2 9BL,51.621574889370500,-3.991335399402060
Kākāriki and galliwasp,SA2 9DA,51.617925210516600,-3.981164891887060
American sparrow and Mole,SA2 9DE,51.618269130847500,-3.984227884497930
Zebra and python,SA2 9DQ,51.619572083907600,-3.984284737309720
deaf adder and water snake,SA2 9DW,51.619769272479200,-3.986980302765360
Armadillo and Parakeet,SA2 9FD,51.622332988947300,-3.986398884405070
python and Scimitar babbler,SA2 9HY,51.617976794318900,-3.993518007934640
Maya and sand lizard,SA2 9JE,51.622100064239300,-3.993771011649320
Buzzard and dugite,SA2 9JJ,51.619848859802300,-3.997124917964280
rat snake and Zebra,SA2 9LH,51.621695864014200,-3.996917106634860
Kite and kabaragoya,SA3 3AS,51.578973441725000,-4.032453877515350
Magpie and tuatara,SA3 4BB,51.575038357600400,-4.000326067302260
agamid and Zebra,SA3 4BL,51.575333928565800,-4.002503841520070
Moluccan boobook and brown snake,SA3 4DH,51.574410514122100,-3.998119313846240
Bronzewing pigeon and Komodo dragon,SA3 4EA,51.572560976675400,-3.993189344045860
Snipe and puff adder,SA3 4EB,51.572025335183900,-3.994017328685270
Masked owl and skink,SA3 4ED,51.572435664023200,-3.993154998675810
Jackal and racer,SA3 4HN,51.569860608490700,-3.995986093965160
turtle and horned toad,SA3 4JS,51.566103351907600,-3.985822186595280
garter snake and black snake,SA3 4LD,51.568489430471300,-3.990947748310020
saltwater crocodile and Minke whale,SA3 4LF,51.573795469259600,-3.999910697420170
gopher snake and frilled lizard,SA3 4LU,51.572342000000000,-4.007178000000000
rat snake and Prion,SA3 4QJ,51.569195508837700,-4.007558681439740
Wallaby and Skunk,SA3 4QQ,51.569723798816300,-4.008216890660790
Jackal and Coati,SA3 4RN,51.573500212084000,-4.023420905886530
Quetzal and Tit-tyrant,SA3 4TN,51.579322630607700,-4.014817580255860
Meadowlark and skink,SA3 4TS,51.577329000000000,-4.021541000000000
Mouse and tree snake,SA3 4UL,51.573850800598500,-4.016639233399540
Goose and Night heron,SA3 5AE,51.592799565808400,-4.001857256193460
Mouse and hognose snake,SA3 5AJ,51.590111563699700,-4.000757356089290
Rat and snake,SA3 5BL,51.596827697786400,-3.997139690664840
Kite and rat snake,SA3 5BZ,51.597983148301600,-4.003211516291120
mud turtle and Flameback,SA3 5EJ,51.596635867920200,-4.013100495798150
iguana and blue tongue,SA3 5HH,51.591269284940600,-4.014032551954600
Dolphin and rattlesnake,SA3 5HR,51.593482929619400,-4.013423051929590
black snake and soft-shelled turtle,SA3 5JF,51.588347879247700,-4.000824204541330
horned viper and Eagle,SA3 5NE,51.585687743413300,-4.011245030736630
Egret and Parrotlet,SA3 5NF,51.584736194737900,-4.003263776173030
constrictor and diamond python,SA3 5NQ,51.584752796315500,-4.013181000000000
Ibex and Towhee,SA3 5NZ,51.587576309766300,-4.013335046830200
gavial and River dolphin,SA3 5PL,51.587881671816400,-4.015975895995660
worm lizard and Rabbit,SA3 5PQ,51.585297673024200,-4.015110851648010
asp and Mockingbird,SA3 5PS,51.580965797756100,-4.008669331780880
Guillemot and Thicketbird,SA3 5PX,51.583118247035900,-4.007955955423150
krait and Wader,SA3 5QF,51.580084447660700,-4.008673756174620
