name,postcode,lat,lon
milk snake and diamondback turtle,OX11 0GD,51.580873000000000,-1.309099000000000
worm lizard and Wallaby,OX11 0JZ,51.599584000000000,-1.315662000000000
rock snake and Quetzal,OX11 0TZ,51.570631112600000,-1.307497075200000
Egret and milk snake,OX11 0UB,51.569547673800000,-1.309793212100000
mountain devil and flying lizard,OX12 0AG,51.604067644414200,-1.426011432210200
Pratincole and slowworm,OX12 0AL,51.611570000000000,-1.421050000000000
Buzzard and hawksbill,OX12 0AT,51.612006491592900,-1.425896913149750
Diving bird and gavial,OX12 0BJ,51.608431050875800,-1.424700099408640
turtle and Hawaiian honeycreeper,OX12 0DD,51.604569329391400,-1.427477926744740
Civet and hawksbill,OX12 0DH,51.618866000000000,-1.407279000000000
horned toad and habu,OX12 0DX,51.623536503230100,-1.450987593437210
giant tortoise and Bunting,OX12 0NW,51.609580469425700,-1.428079206758030
wall lizard and Maya,OX12 2ES,51.588279000000000,-1.427392000000000
Grackle and slowworm,OX12 7AL,51.591321005545800,-1.419344176541570
whip snake and Vole,OX12 7AN,51.591241392575600,-1.415981797523970
Rabbit and Peafowl,OX12 7AP,51.590667805408800,-1.418168831987300
sand lizard and amethystine python,OX12 7BL,51.591227366760800,-1.424065666778200
gopher snake and Wader,OX12 7BS,51.593184542917000,-1.423463495483110
Greenbul and mud turtle,OX12 7DF,51.594569060322100,-1.419779175477180
brown snake and Marsh harrier,OX12 7ED,51.594837279297900,-1.412240007522870
cobra de capello and Puffleg,OX12 7EQ,51.595390784337300,-1.415047980676600
Flameback and Capuchin,OX12 7HA,51.590924815183600,-1.412001776634310
Schneider python and Schneider python,OX12 7JH,51.605749000000000,-1.422136205875920
cayman and Thrasher,OX12 7NE,51.606121301999800,-1.419429842108380
Marsh harrier and Tit-tyrant,OX12 8AB,51.588272456421000,-1.426571265398340
Tattler and garter snake,OX12 8AG,51.588500679625800,-1.427275673781140
flying dragon and turtle,OX12 8BH,51.588224486252700,-1.424118054192130
Wader and bandy-bandy,OX12 8EU,51.586989505060200,-1.416195061603520
Songlark and horned toad,OX12 8HW,51.589288786168100,-1.410290742198680
Linsang and bicycle lizard,OX12 8JZ,51.594709468357200,-1.335960292209930
worm lizard and Skunk,OX12 8LS,51.594822245487400,-1.341617697382560
tiger snake and agamid,OX12 8PS,51.593362880847200,-1.377382010858770
Triller and Stilt,OX12 8QT,51.575463000000000,-1.355938000000000
brown snake and Scimitar babbler,OX12 8QX,51.558907376345400,-1.349161173521250
horned toad and thorn lizard,OX12 8RH,51.599798783740200,-1.353716932402060
milk snake and Kangaroo,OX12 8RX,51.593334283657000,-1.352148516323410
soft-shelled turtle and terrapin,OX12 9AE,51.590780914627700,-1.430235060926190
snake and harlequin snake,OX12 9AZ,51.593372406447800,-1.428787941782820
anaconda and Civet,OX12 9EB,51.590126100234800,-1.436147083311830
thorny devil and Jerboa,OX12 9ET,51.596699000000000,-1.432114663720290
Zebra and Ground sloth,OX12 9GQ,51.591998341694900,-1.427275015814970
snake and Kangaroo,OX12 9HA,51.594970955640100,-1.428392554472980
Francolin and bull snake,OX12 9LX,51.558558000000000,-1.460930000000000
crocodile and Parrotlet,OX12 9NL,51.518506000000000,-1.438919000000000
flying dragon and Partridge,OX12 9PG,51.597620457800700,-1.486122409904830
cayman and Argus,OX12 9QJ,51.590729084478400,-1.539349624264330
anole and blindworm,OX12 9RP,51.587796032052900,-1.451057428949020
Kestrel and soft-shelled turtle,OX12 9RS,51.586782957648500,-1.451690282475330
Masked owl and tiger snake,OX12 9RX,51.588604710382700,-1.452866410637910
blindworm and sand lizard,OX12 9SQ,51.574948433800000,-1.452193000000000
Parrotbill and River dolphin,OX12 9TA,51.597205652253400,-1.455910391666570
slowworm and Jay,OX12 9UA,51.585204000000000,-1.479767000000000
Ibex and cerastes,OX12 9UD,51.584400207136700,-1.479343655039060
Old World warbler and Booted eagles,OX12 9UR,51.587793124525400,-1.480055462544300
Old World vulture and gavial,OX12 9WJ,51.599132000000000,-1.437118000000000
brown snake and Songlark,OX12 9WN,51.598490000000000,-1.435941000000000
Moluccan boobook and death adder,OX12 9YW,51.529024296129200,-1.435157564655690
Chickadee and Black cockatoo,OX13 6AG,51.608494925241900,-1.311253405436440
alligator and cobra de capello,OX13 6RY,51.622073000000000,-1.317418000000000
moloch and anole,OX13 6SQ,51.622435000000000,-1.327120000000000
gecko and Hawk,OX13 6SU,51.622969457057600,-1.321781662213250
diamond python and Cloud rat,OX14 4RP,51.624544000000000,-1.301765000000000
Grosbeak and Shearwater,RG14 1AH,51.404321289463700,-1.324933405465480
frilled lizard and Marsh harrier,RG14 1DN,51.402334489384500,-1.324072000000000
Booted eagles and Stilt,RG14 1ER,51.405018000000000,-1.319261224561150
krait and Mamo,RG14 1EY,51.405574000000000,-1.320441846726560
taipan and wall lizard,RG14 1GE,51.405489000000000,-1.327662000000000
Parrotlet and Jackal,RG14 1JW,51.405740264893000,-1.321519610127510
Kite and Maya,RG14 1LP,51.408953384494800,-1.325167155341070
jew lizard and bearded lizard,RG14 1NB,51.407079795087400,-1.329292213427630
whip snake and tiger snake,RG14 1NU,51.406846042721500,-1.326161427696810
leguaan and diamondback turtle,RG14 1SA,51.407846000000000,-1.345240000000000
Darwin's finches and Recurvebill,RG14 1SS,51.411346742233500,-1.339654211264340
alligator and smooth snake,RG14 1TU,51.409925751779200,-1.334829272539680
coral snake and Stint,RG14 2DJ,51.410052851847300,-1.314741236093110
bearded lizard and rattlesnake,RG14 2EB,51.414313725065500,-1.314533763403900
Gila monster and Bunting,RG14 2EU,51.412576183705500,-1.312632966912420
Chickadee and cobra,RG14 2FR,51.410748000000000,-1.307479000000000
gavial and diamondback,RG14 2HD,51.410116873735400,-1.313388736320900
crocodile and Thicketbird,RG14 2LX,51.411564928954600,-1.305818302286480
adder and Stilt,RG14 3BA,51.421915371872700,-1.330729072417380
Myna and Magpie,RG14 3BB,51.427305324104500,-1.334577059795350
snake and death adder,RG14 5BD,51.400873135497600,-1.322829000000000
Treepie and Recurvebill,RG14 5HP,51.401273260875500,-1.324790000000000
python and boomslang,RG14 5QG,51.400306390476100,-1.314843712031300
White ibis and Pheasant,RG14 5RL,51.401620000000000,-1.302744000000000
bearded dragon and Stint,RG14 5SR,51.400270546878800,-1.317949253577030
Siskin and Cloud rat,RG14 6WD,51.400007757712100,-1.322063000000000
Night heron and Stilt,RG14 9EZ,51.400007757712100,-1.322063000000000
Crow and Old World warbler,RG14 9GR,51.400007757712100,-1.322063000000000
blind snake and Kangaroo,RG14 9LD,51.400011203200000,-1.322063000000000
Macaw and bearded dragon,RG17 0BL,51.410393058331300,-1.516533401259070
worm lizard and taipan,RG17 0BZ,51.405689251912900,-1.516252314576580
Elephant and cobra de capello,RG17 0EY,51.419433473782800,-1.515460000000000
racer and dukite,RG17 0GW,51.447580263242700,-1.552216120091980
sand lizard and Linsang,RG17 0HD,51.419193000000000,-1.508963000000000
glass snake and White ibis,RG17 0JH,51.414760220874800,-1.518040343436140
dugite and Egret,RG17 0LL,51.411202319970200,-1.523124529923580
Linsang and Thicketbird,RG17 0PL,51.434977357916900,-1.501758794779220
Ground sloth and king cobra,RG17 0QP,51.412756931427100,-1.525107022424850
River dolphin and Marmoset,RG17 0SY,51.433501000000000,-1.527179000000000
Songlark and bearded dragon,RG17 0TY,51.431040522861000,-1.532254000000000
Pratincole and snake,RG17 0UB,51.435287009990500,-1.537864043445460
Greenbul and Hawk,RG17 0YY,51.418855819688300,-1.512575753903410
Civet and thorny devil,RG17 7AG,51.456179966148300,-1.473031001846440
Old World vulture and Fox,RG17 7AP,51.461697283874900,-1.446870746715930
adder and Egret,RG17 7AS,51.456438045378000,-1.474438503791890
Marmoset and loggerhead,RG17 7BD,51.474699262377000,-1.492658630072010
Vole and thorny devil,RG17 7BG,51.468667455514300,-1.507798533262920
White ibis and Masked owl,RG17 7ES,51.485407690178200,-1.476165148526490
hawksbill and galliwasp,RG17 7JP,51.491976908570100,-1.499655000000000
Partridge and box turtle,RG17 7JR,51.493274724179900,-1.498675164689050
Grackle and adder,RG17 7LY,51.502340939438400,-1.518659118977050
sea snake and iguana,RG17 7RS,51.492862594827100,-1.554783320570430
diamond snake and Asiatic leopard,RG17 7TQ,51.481467935010800,-1.552503000000000
perentie and rat snake,RG17 8PT,51.507831949349200,-1.529047627225780
Argus and Pheasant,RG17 8PZ,51.505387295094800,-1.527070108023040
White ibis and Rat,RG17 9RP,51.430440265095900,-1.450254423309610
Wader and Triller,RG18 9XX,51.450451000000000,-1.309575000000000
Shearwater and whip snake,RG20 7BB,51.512272000000000,-1.388173215387140
bearded lizard and mamba,RG20 7EG,51.504902152069600,-1.415399973186290
leathery turtle and Moluccan boobook,RG20 8AE,51.421284000000000,-1.352451492107110
Fish eagle and indigo snake,RG20 8AY,51.443778292129600,-1.363776977180410
harlequin snake and massasauga,RG20 8BX,51.426583615877000,-1.375004497304640
bearded dragon and blindworm,RG20 8HR,51.453820310564700,-1.411691664490170
tokay and saltwater crocodile,RG20 8HS,51.453195521505100,-1.410821804891760
diamond python and Shearwater,RG20 8HW,51.446079468902100,-1.428252508370150
worm lizard and puff adder,RG20 8JP,51.412346831720900,-1.359468167046040
Mamo and anole,RG20 8LQ,51.411337466636300,-1.375715554797240
blue racer and bearded dragon,RG20 8RX,51.480920076594700,-1.306191896797300
boa constrictor and loggerhead,RG20 8UR,51.462468058638000,-1.316720561619680
black snake and coral snake,RG20 8UU,51.464992709620800,-1.317920871617290
horned viper and anole,RG20 8UY,51.463442000000000,-1.312402000000000
wall lizard and Thicketbird,RG20 9LY,51.400007757712100,-1.322063000000000
tortoise and tree snake,SN4 0AF,51.550067709337300,-1.696123874363000
perentie and Boto,SN4 0AR,51.551498458445800,-1.710810835435840
Old World warbler and slowworm,SN4 0DL,51.546980125089300,-1.668239719509250
Schneider python and puff adder,SN4 0EW,51.546968925415600,-1.697384707679950
alligator and Wader,SN4 0FW,51.547821000000000,-1.699270000000000
grass snake and Bunting,SN4 0HQ,51.530822803348200,-1.701874115763370
Mockingbird and sand lizard,SN6 7QG,51.597801000000000,-1.698332000000000
Eagle and Boto,SN6 8DT,51.597552230365500,-1.651182441093140
Fish eagle and Kestrel,SN6 8DY,51.596315942589000,-1.652707754146840
Asiatic leopard and Myna,SN6 8ED,51.594799988173500,-1.660081760162790
boa constrictor and Triller,SN6 8EQ,51.595574208752000,-1.657318627681260
Grouse and Badger,SN6 8EW,51.596141882249600,-1.660836891320150
Ibex and River dolphin,SN6 8FH,51.599171000000000,-1.665854000000000
lizard and king cobra,SN6 8FQ,51.598919000000000,-1.665784000000000
Mamo and Tattler,SN6 8LW,51.562150399965200,-1.621259853171010
Francolin and Lemming,SN6 8NP,51.580901277677800,-1.598056532140670
gecko and Hawaiian honeycreeper,SN6 8PZ,51.551193566337400,-1.648479286255240
Mole and racer,SN6 8RH,51.613570722901800,-1.637946301707380
Schneider python and mamba,SN6 8RQ,51.615151250638700,-1.631535643431360
pit viper and loggerhead,SN6 8SF,51.613755562477900,-1.639576801052140
flying lizard and Asiatic leopard,SN7 7PS,51.605448000000000,-1.567401000000000
Parrotbill and elapid,SN7 7RU,51.600960848360500,-1.557958047362480
Towhee and Polecat,SN7 7SE,51.602636239899400,-1.556367970491590
Old World warbler and Vole,SN7 8AW,51.613493177600000,-1.490073923700000
gaboon viper and Parakeet,SN8 2AZ,51.420548076850500,-1.711622854688280
Chipmunk and amphisbaena,SN8 2EB,51.483458894613200,-1.619060215129320
Ice seal and Asiatic leopard,SN8 2EP,51.478469239529200,-1.619260147032700
boa constrictor and grass snake,SN8 2EW,51.481925551350500,-1.617589726584380
Grosbeak and elapid,SN8 2FT,51.493407000000000,-1.676697000000000
king cobra and Parrotbill,SN8 2GZ,51.445646808116900,-1.602035807368030
Solitaire and Wallaby,SN8 2HJ,51.455993041051200,-1.568109416762510
Piping shrike and Partridge,SN8 2HL,51.428685000000000,-1.600601000000000
agamid and blue tongue,SN8 2JA,51.499377540004900,-1.598571889537620
Tattler and puff adder,SN8 2LW,51.435053546277900,-1.708798322857220
Wallaby and B,SN8 2NF,51.498001238732900,-1.598396699013820
B and thorny devil,SN8 2NJ,51.449298962755400,-1.693094000000000
Polecat and Fox,SN8 2NY,51.426851346029100,-1.697401397779040
Nukupuʻu and Badger,SN8 2NZ,51.427338602329500,-1.691155812741030
Argus and Logrunners,SN8 2XB,51.449387642426300,-1.583986650714740
