name,id,postcode,lat,lon
Cuscus and tree snake,812049,ME13 7PL,51.313745393352200,0.873434154840519
Asiatic leopard and cobra,2583392,ME7 1GF,51.394099000000000,0.550744000000000
giant tortoise and Darwin's finches,800237,ME8 9DA,51.359389101892600,0.603962197242963
Chipmunk and Darwin's finches,803264,ME5 0NR,51.345316972327900,0.527899435413159
gecko and Jay,801435,ME7 4RS,51.383038806809100,0.549352257085884
amethystine python and Pheasant,803654,ME4 5RX,51.374078703394700,0.524555149110009
puff adder and pit viper,801483,ME7 5ED,51.385991411890300,0.543436428402946
Mockingbird and puff adder,814001,ME10 2SN,51.359351006035000,0.743103560060849
Thrasher and green turtle,801945,ME7 1PF,51.394526620658400,0.547561488945760
bearded lizard and Grouse,800328,ME8 8AN,51.362845698089400,0.611097267258422
Hawk and agamid,809971,ME15 6UD,51.263057433550400,0.521805314268598
Piping shrike and indigo snake,800405,ME8 9QU,51.339918154754800,0.589748280102629
chuckwalla and Fulmarine petrel,803251,ME5 0LU,51.359391811259200,0.521649985623187
elapid and Grouse,800884,ME8 6RT,51.376033000000000,0.587950000000000
slowworm and flying dragon,812238,ME13 0RU,51.289993000000000,0.846291000000000
Parrotbill and Capuchin,815411,ME1 1AE,51.385926502158900,0.505975787161766
blindworm and python,811993,ME13 8QU,51.313989483716700,0.885447500027972
Partridge and Maya,801827,ME7 2TT,51.385713148005000,0.572239660412233
tree snake and Bronzewing pigeon,812642,ME12 3TH,51.417327744303800,0.802671744523408
green turtle and Coati,808541,ME16 8FP,51.271214740186700,0.502684000000000
Mole and Tahr,810698,ME14 5DB,51.275569000000000,0.532198000000000
Komodo dragon and frilled lizard,800688,ME8 7PB,51.369483218141100,0.609880086819411
B and Solitaire,799598,ME9 9DH,51.334269286621200,0.802238655163278
hognose snake and copperhead,808270,ME17 1QN,51.283734255129100,0.661893646913611
Parrotbill and Flameback,814213,ME10 2DN,51.348410886704700,0.727602000000000
Scimitar babbler and Diving bird,803895,ME4 6JU,51.367451679716800,0.517394673129660
Eagle and green turtle,800677,ME8 7NN,51.371615920287300,0.610633648232854
skink and Jay,807932,ME17 1UJ,51.265691157952700,0.641711889607562
Bronzewing pigeon and Tit-tyrant,808981,ME16 0EW,51.279097139362900,0.506551462606976
mountain devil and Diving bird,799441,ME9 8LR,51.337853000000000,0.705018000000000
B and Kangaroo,2628173,ME2 2WJ,51.393043000000000,0.490767000000000
Maya and terrapin,800354,ME8 8DB,51.362115137148200,0.618037647516442
Armadillo and Triller,801088,ME8 0SX,51.350037502198700,0.579906350006695
goanna and viper,2591830,ME1 3FB,51.378600000000000,0.494108000000000
Condor and Jerboa,802114,ME7 2JU,51.380420675506100,0.558059715481818
tuatara and Diving bird,2584588,ME14 1FU,51.273757000000000,0.519079000000000
cobra and flying lizard,803063,ME5 8QE,51.337609742638500,0.539521870180318
perentie and rat snake,804418,ME4 3JD,51.407642280296100,0.544940030477670
Ground sloth and Puffleg,804317,ME4 4TX,51.387230000000000,0.523601881940282
cayman and frill-necked lizard,1792043,ME1 1BS,51.383190081800000,0.510727236600000
crocodile and ringhals,809625,ME15 7BG,51.259014048051500,0.545604000000000
Prion and Kestrel,804999,ME3 7RL,51.442867120785600,0.496154823859973
Peafowl and Wallaby,805683,ME2 4NX,51.407052114423000,0.505563522636422
Kākāriki and smooth snake,811116,ME14 2UG,51.280468130499700,0.526860391408631
tokay and blue tongue,814356,ME10 1HR,51.339961487228100,0.731002000000000
diamond python and soft-shelled turtle,799802,ME9 8HL,51.312083000000000,0.727582000000000
Crow and puff adder,801633,ME7 3SE,51.344306315814600,0.571011175830580
Chipmunk and Gila monster,800669,ME8 7LR,51.365518395419400,0.602542826529264
Rabbit and cobra de capello,808711,ME16 8SY,51.268246502549700,0.495810563341306
Solitaire and jew lizard,811200,ME14 3DB,51.298255267691500,0.519043247658499
turtle and Ibex,804561,ME3 9DB,51.425850180585300,0.555043792829652
Triller and alligator,812535,ME12 3NU,51.421113761966700,0.809448710831113
Solitaire and Fulmarine petrel,808625,ME16 0ND,51.293630856583000,0.510094000000000
diamondback and Skunk,813955,ME10 2PW,51.357155105340700,0.748531548467209
Civet and frilled lizard,812479,ME13 0BJ,51.271778752332600,0.800713112302305
Thicketbird and indigo snake,810660,ME14 4QQ,51.273117492343300,0.574031007370779
Nukupuʻu and Diving bird,812470,ME13 0AY,51.275546265341400,0.813876633338511
White ibis and Petrel,811514,ME14 1BU,51.274420728702100,0.528277778227319
Asiatic leopard and Minke whale,1792659,ME9 9AT,51.334189000000000,0.804143000000000
Black cockatoo and mountain devil,810489,ME14 5SF,51.271625928292500,0.537730551029492
Night heron and Parrotbill,801143,ME7 5PN,51.374883458459700,0.546786635026101
Maya and cobra,801319,ME8 0DH,51.364132183202600,0.602191243720828
Old World vulture and bushmaster,813557,ME10 4JA,51.336900832237100,0.755029945725616
blind snake and Skunk,811915,ME13 8PQ,51.312920183564100,0.890145065426502
glass snake and slowworm,805394,ME20 7ES,51.322327315615500,0.502033001842261
cayman and Hawk,809372,ME15 8UU,51.259432724029100,0.567719005778892
Fox and monitor,803072,ME5 8QR,51.340179000000000,0.539707000000000
Triller and Chicken,803031,ME5 7HN,51.369919166886100,0.555448239799208
Piping shrike and Gull,809619,ME15 8LP,51.264236542828000,0.560690078951630
giant tortoise and viper,800279,ME8 9HX,51.357936057345600,0.605402435258821
Solitaire and B,812681,ME12 4BW,51.405928533295900,0.859021669355868
caiman and hoop snake,809628,ME15 7BP,51.253961632279700,0.551404994682473
king snake and Mamo,813554,ME10 4HP,51.324471972977200,0.730427230353436
Black jay and Pitohui,814014,ME10 2TD,51.362191248421200,0.751232377899445
Hawaiian honeycreeper and Mole,805670,ME2 4NE,51.409118739088800,0.503548199654439
Wader and Civet,814792,ME1 3ES,51.381329000000000,0.502412506196845
Pitohui and Ice seal,808886,ME16 0ZA,51.277524649012500,0.510681639966212
Parrotbill and crocodile,810547,ME14 5UZ,51.279700135699600,0.552716625714590
Asiatic leopard and Parrotbill,803233,ME5 0JT,51.356748216331100,0.527049361662559
coral snake and Nukupuʻu,809980,ME15 6UQ,51.259833691807100,0.521155808436182
Minke whale and Nukupuʻu,813024,ME12 3NF,51.417425771997100,0.793673368735440
agamid and snapping turtle,808941,ME16 0BU,51.283661806150800,0.503802700687786
dukite and Crow,811578,ME14 1EQ,51.276278054159000,0.528480149873197
Viscacha and Warbler,803426,ME4 6PD,51.361771549850600,0.519726420017550
Chicken and caiman,813491,ME11 5ET,51.417747257744700,0.745075031409671
Warbler and gaboon viper,802205,ME7 1BE,51.388968252577000,0.542609720575837
chameleon and Polecat,812000,ME13 8RH,51.313221825157000,0.881194308614381
bandy-bandy and Buzzard,803433,ME4 6PU,51.379611422269300,0.521137465987346
alligator and galliwasp,810219,ME15 6HX,51.273045524616200,0.524072894569764
slowworm and death adder,1792090,ME10 3GB,51.343613197800000,0.761018916000000
Thrasher and Piping shrike,802806,ME5 9DB,51.329935974111200,0.531316849355201
Grouse and Asiatic leopard,814861,ME1 2DD,51.381618626789200,0.507235091545054
king cobra and Lemming,802027,ME7 1XE,51.386556000000000,0.549806000000000
mamba and Meadowlark,810869,ME14 3LU,51.285545000000000,0.601510967634969
galliwasp and flying lizard,814068,ME10 2UD,51.356736173977800,0.742995000000000
American sparrow and bearded dragon,812529,ME12 3NN,51.415184000000000,0.790051277748042
Grouse and Partridge,801615,ME7 5LS,51.374300155904500,0.548794763803028
pit viper and grass snake,799868,ME9 7BQ,51.371473014497200,0.645456236988692
Goose and Fox,802556,ME5 9QB,51.331597222108300,0.528939073609673
frill-necked lizard and Black jay,802827,ME5 8DD,51.338197328575900,0.535510000000000
Nukupuʻu and Moluccan boobook,813902,ME10 4AL,51.340119977928200,0.734344207927227
rat snake and Dolphin,814082,ME10 2XD,51.344835851194100,0.734984039120916
milk snake and blue racer,811859,ME13 8JN,51.310081577284000,0.887814019547563
Condor and Gila monster,814969,ME1 2LD,51.375012564637500,0.506198648084144
Armadillo and perentie,804744,ME3 8HH,51.432957065658800,0.502866047831636
Darwin's finches and harlequin snake,809327,ME15 8SL,51.262744755722500,0.579471980004643
Meadowlark and Goose,809477,ME15 8AZ,51.251788414220800,0.552904120718494
turtle and dukite,812507,ME13 0EH,51.273199763186200,0.881097613989618
constrictor and Skunk,801794,ME7 2ST,51.392846858828500,0.568470953271185
Prion and Condor,808957,ME16 0DQ,51.278345381774900,0.493748216946358
horned viper and Coati,804623,ME3 9HX,51.425002000000000,0.561893410785444
Fox and cobra de capello,803414,ME5 0XA,51.348649431162600,0.521419059403437
racer and Gila monster,809810,ME15 7QZ,51.251648183104100,0.546131893783306
bull snake and Crow,811513,ME14 1BT,51.274420728702100,0.528277778227319
puff adder and death adder,800969,ME8 0LY,51.338801842120200,0.582060834200337
chameleon and blue tongue,812974,ME12 2BF,51.432671589571200,0.797021082213904
Treepie and habu,2592439,ME17 1FZ,51.263086000000000,0.630870000000000
worm lizard and Vole,809868,ME15 6PL,51.265455429158900,0.519872272680484
Bunting and skink,801263,ME7 5XT,51.378434096094700,0.548938240992396
Schneider python and saltwater crocodile,803039,ME5 7HX,51.370442156634800,0.556210167113527
kabaragoya and fer-de-lance,814206,ME10 2BY,51.357628327412100,0.732154987404535
anole and mountain devil,2603858,ME12 2BT,51.439219000000000,0.779491000000000
anaconda and Masked owl,802100,ME7 2HX,51.375285437203200,0.560934778371335
gaboon viper and viper,800171,ME9 0NB,51.283069586258200,0.800955611422949
Vulture and moloch,808276,ME17 1QU,51.290442083224900,0.626938564820958
Boto and Darwin's finches,1792226,ME14 2FE,51.278941115400000,0.526375008400000
cayman and lizard,1792517,ME4 3SR,51.410003645000000,0.537262274500000
diamond snake and tortoise,813223,ME12 1LN,51.431165245289300,0.747030636672391
Condor and Tit-tyrant,802759,ME5 8YH,51.346503519949500,0.538735539874353
asp and mud turtle,809913,ME15 7SF,51.253702376085900,0.551333309729651
puff adder and Francolin,800409,ME8 9QZ,51.338905462426700,0.588772219187108
Cuscus and viper,810456,ME14 5QL,51.280413405866700,0.538946345277455
Jay and boa,810776,ME14 5JA,51.284586244307000,0.537713681438606
Fox and Peafowl,813996,ME10 2SF,51.363415339037900,0.744294723450544
Marsh harrier and garter snake,803527,ME4 6SS,51.378877404647100,0.518050435059650
Bunting and horned viper,808234,ME16 8UQ,51.264884216237000,0.489836832555549
rat snake and Nukupuʻu,804683,ME3 8BW,51.417030713726400,0.508281152309207
White ibis and gavial,813445,ME11 5AH,51.416857900890400,0.746949138201294
Booted eagles and mountain devil,808013,ME17 2EU,51.251843694983700,0.728184648254035
Hawaiian honeycreeper and Tahr,803862,ME4 4YJ,51.381933202763000,0.526913339599443
American sparrow and taipan,815178,ME1 1SL,51.389367450799400,0.503449000000000
Puffleg and glass snake,810201,ME15 6GJ,51.258691613708500,0.525737393652026
Jerboa and bushmaster,2655011,ME4 4GS,51.389163000000000,0.527844000000000
Grosbeak and Elephant,814031,ME10 1SW,51.328055781092700,0.719040738672384
Schneider python and Fulmarine petrel,803960,ME4 5EL,51.371361004097100,0.539191138614991
amphisbaena and Crow,808449,ME16 8DZ,51.266443833065000,0.507353680749030
Old World vulture and Coati,809721,ME15 8PB,51.264199000000000,0.566563140879503
Zebra and bicycle lizard,803619,ME5 0DG,51.359933290839300,0.534062573068596
jew lizard and Wader,803451,ME4 6QY,51.372436234043000,0.516877861593075
whip snake and wall lizard,815127,ME1 1NP,51.390838000000000,0.503470000000000
Magpie and Black jay,814626,ME1 2SJ,51.360966881938100,0.514065318851644
bandy-bandy and Komodo dragon,800714,ME8 7QZ,51.370982889348900,0.618443058392020
Linsang and wall lizard,800417,ME8 9RJ,51.345265507377800,0.595205357448968
frill-necked lizard and Peafowl,815038,ME1 1EY,51.385845567349700,0.507236216094153
Pratincole and Dorcopsis,802548,ME5 9PS,51.336585231194800,0.527433273326871
Magpie and Boto,812959,ME12 2AL,51.440270479481600,0.770185543090990
Black cockatoo and smooth snake,2655034,ME7 5FB,51.391708000000000,0.531176000000000
Duck and tokay,805010,ME3 7SD,51.448859376220400,0.503620700987034
Stint and Old World quail,804364,ME3 9ST,51.452460915617900,0.632302284202117
Petrel and White ibis,804516,ME4 3LB,51.404779182469600,0.540941738448881
Philippine hawk-owl and iguana,2655008,ME4 4GE,51.389863000000000,0.527494000000000
Crow and Recurvebill,814743,ME1 3AR,51.377222192391200,0.488614803324837
anaconda and grass snake,2643734,ME9 7FS,51.377973000000000,0.658421000000000
diamondback and snapping turtle,801073,ME8 0RU,51.359652519153300,0.581912016306590
Siskin and Hawaiian honeycreeper,800665,ME8 7LG,51.366961898973200,0.607595899407604
garter snake and Kestrel,799910,ME9 7EW,51.372135272187200,0.671747309843468
galliwasp and snapping turtle,801753,ME7 2PS,51.389847312923700,0.560468698177220
coral snake and Shearwater,802300,ME7 1JH,51.391084000000000,0.547111000000000
Logrunners and chameleon,801670,ME7 4AF,51.374075514269600,0.553739840980461
grass snake and Herring gull,799678,ME9 7TW,51.354285000000000,0.654305000000000
goanna and agamid,802912,ME5 9JZ,51.330430642670800,0.526319496813278
black snake and caiman,802280,ME7 1HG,51.389048360393800,0.543476627358965
Fulmarine petrel and chameleon,2579172,ME15 8AA,51.266637293700000,0.551677050600000
blindworm and galliwasp,814912,ME1 3LT,51.363696730865300,0.498713542498516
blue tongue and racer,799697,ME9 7WA,51.339242077185700,0.734360000000000
Towhee and Chickadee,805799,ME2 4UD,51.396509654359000,0.491746356375497
Treepie and Meadowlark,814074,ME10 2UN,51.362303296950400,0.746842931627492
blue tongue and Grosbeak,814841,ME1 2BA,51.371083790525200,0.511171139749144
smooth snake and Puffleg,812424,ME13 7HA,51.321511000000000,0.890499000000000
flying lizard and Magpie,812737,ME12 2RL,51.421035112164100,0.798079628422819
hawksbill and bearded dragon,800875,ME8 6RA,51.378666899878700,0.586316332755561
mamba and puff adder,808949,ME16 0DE,51.281081000000000,0.499231000000000
dugite and elapid,811203,ME14 3DF,51.307562547161300,0.513239560213772
Cuscus and Pheasant,805014,ME3 7SJ,51.453391710999700,0.493936512814564
Armadillo and bandy-bandy,799710,ME9 8AN,51.317629000000000,0.694728000000000
galliwasp and mountain devil,810959,ME14 4EJ,51.273444000000000,0.581713654221574
tortoise and grass snake,803195,ME5 7QU,51.356139374445100,0.541882659473706
thorny devil and terrapin,1792292,ME15 6ZW,51.263729654900000,0.517756552200000
cerastes and deaf adder,804539,ME3 9AW,51.418838946645500,0.561873326504820
cerastes and tortoise,812657,ME12 4AJ,51.397615334187300,0.895800000000000
Armadillo and Egret,804257,ME3 9NL,51.424786000000000,0.588028000000000
Perching duck and rat snake,813270,ME12 1QR,51.437715314953800,0.762605490556287
Mole and cerastes,805654,ME2 4LJ,51.408765641951400,0.509122925363901
agama and Dorcopsis,813960,ME10 2QE,51.350733312498000,0.743550933160982
sidewinder and death adder,811259,ME14 1UH,51.278266677687800,0.527184082194148
terrapin and diamond snake,804693,ME3 8DJ,51.455995684695700,0.530628358066717
asp and cerastes,799954,ME9 7JE,51.354612538745800,0.671474254750064
gavial and Herring gull,2663450,ME10 2FU,51.343478000000000,0.729333000000000
python and Tit-tyrant,802916,ME5 9LE,51.330214071364200,0.524685368790637
Kestrel and viper,802931,ME5 8FH,51.339956266361100,0.532500816484653
kabaragoya and boa constrictor,801638,ME7 3SL,51.350918775488900,0.575417305613710
Shearwater and Crow,810154,ME15 6DS,51.255952772685300,0.527206844079279
hoop snake and loggerhead,802260,ME7 1EU,51.390323407702200,0.550188525713664
Chipmunk and Pitohui,811233,ME14 1RU,51.277113264924700,0.523681000000000
tuatara and cobra de capello,808651,ME16 0PL,51.288615704399300,0.498406788917082
Tree warbler and viper,805017,ME3 7SP,51.453010140799100,0.494117232969112
Moluccan boobook and iguana,803280,ME5 7SZ,51.359218000000000,0.533923000000000
Fulmarine petrel and Booted eagles,811890,ME13 8NE,51.308067046800800,0.896994000000000
Marmoset and Jackal,809680,ME15 7HH,51.257882844001100,0.541904106445987
Rabbit and python,799779,ME9 8EU,51.310974104261700,0.695414200241608
puff adder and box turtle,804177,ME4 4NP,51.379471187971000,0.532306000000000
Parrotbill and Petrel,803697,ME5 0EU,51.361210485912000,0.532394843391294
River dolphin and sand viper,800709,ME8 7QE,51.368452451363300,0.618988321539047
Elephant and gecko,809710,ME15 8NP,51.266713624571000,0.565444067816133
mountain devil and adder,799767,ME9 8ED,51.316070658522700,0.701396406636210
rattlesnake and chameleon,815153,ME1 1QY,51.386481647650500,0.497669492623552
Coati and Zebra,2628213,ME8 1EB,51.366180000000000,0.575541000000000
Chickadee and Ice seal,801702,ME7 4DT,51.382662803737600,0.556287612049247
Ibex and Siskin,802052,ME7 2BS,51.376087479123100,0.561683702996292
constrictor and saltwater crocodile,802434,ME5 9NG,51.330244814983400,0.527845366317198
Chipmunk and Boto,801715,ME7 4EP,51.383901275398100,0.551872325309396
River dolphin and coral snake,803363,ME5 0RU,51.344743650927500,0.516939556797095
Bronzewing pigeon and carpet snake,808529,ME16 8ER,51.268281720504200,0.510980540409279
Nukupuʻu and smooth snake,809765,ME15 7NP,51.252645756178600,0.547405219535236
black snake and bearded dragon,814763,ME1 3BZ,51.378771298270400,0.503702245660741
rock python and monitor,803744,ME4 5UW,51.372405000000000,0.528429000000000
blue tongue and Dorcopsis,811113,ME14 2UD,51.280374613252700,0.527859084103219
blindworm and Mouse,803604,ME5 0BB,51.366319610013500,0.543150518833928
Shearwater and Zebra,803676,ME4 5TJ,51.371500338255000,0.528177916941931
crocodile and Pratincole,815306,ME1 1YA,51.385186734084900,0.503980619801477
Asiatic leopard and blue tongue,804014,ME4 5NB,51.373859267678900,0.533883321067217
krait and cerastes,804608,ME3 9HD,51.421097000000000,0.551168000000000
Peafowl and cerastes,803678,ME4 5TN,51.369175929406400,0.526699238339631
jew lizard and Stilt,800611,ME8 8SP,51.342297434760700,0.604931607793016
Rabbit and Darwin's finches,810523,ME14 5UD,51.273229808298000,0.553304197903515
rock python and blue racer,804754,ME3 8HW,51.431379441085400,0.499672078117373
Old World quail and Buzzard,812209,ME13 8AE,51.314771866007800,0.893103200596142
Wader and frilled lizard,800456,ME8 8HU,51.353625594091600,0.603491638115306
Rat and Zebra,813898,ME10 4AE,51.339745181911200,0.735757838711746
indigo snake and slowworm,803011,ME5 8PH,51.336307549763100,0.542335816849543
snake and Minke whale,799693,ME9 7UT,51.329812816745400,0.616684772542999
crocodile and Petrel,813656,ME10 4RR,51.327162000000000,0.735841000000000
dukite and horned viper,814737,ME1 3AF,51.376954000000000,0.494054660955916
black snake and Moluccan boobook,799865,ME9 7BL,51.371144603152600,0.646457502640631
constrictor and goanna,808959,ME16 0DS,51.276549401166500,0.491930241222142
loggerhead and saltwater crocodile,811580,ME14 1ES,51.275444167359900,0.527946831934955
goanna and Bunting,813013,ME12 2GB,51.424188000000000,0.810342000000000
anole and snapping turtle,810829,ME14 3HN,51.327237000000000,0.598723000000000
rat snake and harlequin snake,804795,ME3 8NB,51.424766592009800,0.524126175231793
krait and gopher snake,803172,ME5 7PR,51.350426716966300,0.528669061266998
Petrel and goanna,812111,ME13 7SP,51.317798915462200,0.883060061838730
puff adder and caiman,814416,ME10 1PA,51.343584999725800,0.713756346868473
constrictor and Booted eagles,801560,ME7 3PJ,51.351887957490500,0.566092743972665
boa and bandy-bandy,811414,ME14 2JN,51.290189987519700,0.531869373593967
Masked owl and Vole,814262,ME10 1DZ,51.337621999191900,0.730390422280925
Schneider python and White ibis,814829,ME1 2AH,51.366946886468200,0.515355542852415
soft-shelled turtle and Elephant,800227,ME8 9BE,51.356549898448100,0.598572506225095
krait and Kākāriki,812224,ME13 8BD,51.314272982629900,0.897494000000000
Old World warbler and Pheasant,802612,ME5 9TJ,51.352510568338800,0.514593281626091
Kangaroo and blue tongue,799557,ME9 8WH,51.374761013158400,0.732571779088039
Mockingbird and sea snake,810101,ME15 6AH,51.270728017393700,0.526440559685735
blue racer and Meadowlark,805770,ME2 4SA,51.408084200124000,0.498084688532533
hognose snake and Shearwater,799597,ME9 9DG,51.335350275892000,0.799160146775298
Peafowl and python,801499,ME7 5EY,51.387792132017100,0.542515755484209
Stilt and Schneider python,799365,ME99 2AQ,51.278324061599000,0.519099626987152
sidewinder and frilled lizard,805216,ME3 0DT,51.453075000000000,0.716951000000000
grass snake and Prion,802749,ME5 8XU,51.328141312181500,0.549779421073934
Piping shrike and Towhee,2607140,ME4 3AH,51.409181000000000,0.536268000000000
Bunting and Goose,802995,ME5 8NN,51.340948128483500,0.538748000000000
cycling lizard and Elephant,812397,ME13 7DW,51.321285025027000,0.892321839697848
Treepie and turtle,812141,ME13 0LW,51.284853844474000,0.886072000000000
Kite and Wader,803608,ME5 0BL,51.366688634197800,0.542308926438261
flying lizard and Black cockatoo,813228,ME10 5AZ,51.354124715082300,0.718070902428181
Herring gull and water snake,811988,ME13 8QL,51.311745546140500,0.886354279199284
Perching duck and Chickadee,806119,ME2 3DS,51.399670093430500,0.494951841638743
chuckwalla and Darwin's finches,812859,ME12 3FB,51.415180618513000,0.797678806466743
constrictor and Dorcopsis,801468,ME7 5DA,51.387682227970700,0.535969504530176
tree snake and Scimitar babbler,810178,ME15 6FB,51.267352676745000,0.519474312426595
bearded dragon and Scimitar babbler,808883,ME16 0YN,51.276275537591600,0.513567366181090
Vole and Pitohui,809649,ME15 7DS,51.254068871970500,0.551023962842632
Parakeet and Francolin,810265,ME14 9SB,51.273464000000000,0.526419000000000
ringhals and American sparrow,799990,ME9 7NB,51.345702289301900,0.661089751335175
tokay and Mamo,813096,ME12 2PB,51.438902107916800,0.767195797459094
turtle and Grosbeak,2654865,ME1 1FX,51.390104000000000,0.509208000000000
blue tongue and Diving bird,805785,ME2 4SX,51.399111746357100,0.496675498883647
Shearwater and indigo snake,813748,ME10 3JN,51.341240073651400,0.742596053004101
viper and Myna,800961,ME8 0LN,51.338656485929500,0.587422825158445
agama and Chicken,813309,ME12 1UB,51.438988429338500,0.763157236063056
Stilt and anole,801054,ME8 0QR,51.365936318856900,0.572639501925256
Tattler and soft-shelled turtle,810223,ME15 6JD,51.260194301667700,0.526536489895712
Tree warbler and loggerhead,2663487,ME4 6GE,51.382551000000000,0.518755000000000
Mouse and Kangaroo,805711,ME2 4QN,51.404742043571500,0.501295997109046
Gila monster and Gila monster,800436,ME8 8EP,51.365051058535900,0.618664888621610
Parrotlet and ringhals,812822,ME12 4JR,51.418492577874400,0.871184135652808
Night heron and Flameback,809361,ME15 8UE,51.262341050007600,0.569615651328212
Rat and Chipmunk,803925,ME4 5AY,51.369107000000000,0.543247000000000
Darwin's finches and Ibex,811837,ME13 8HG,51.314994675131800,0.899001601557857
Ibex and Armadillo,802642,ME5 8UL,51.336200988690900,0.548891460172398
agama and Civet,804967,ME3 7PJ,51.454078318631100,0.495902839200702
Mamo and whip snake,803140,ME5 7LX,51.351278592212500,0.536270675205179
Petrel and Masked owl,799625,ME9 7QS,51.319410000000000,0.622235000000000
boomslang and rattlesnake,814418,ME10 1PF,51.342464543576800,0.710875529092131
Booted eagles and agama,801671,ME7 4AG,51.373970469216100,0.555257182594140
Parrotbill and Rat,812718,ME12 4HP,51.413917844467700,0.836510000000000
box turtle and hognose snake,800653,ME8 7JN,51.365982388843900,0.606347749229389
Dorcopsis and Parakeet,802111,ME7 2JR,51.380847903448300,0.561305000000000
Prion and gaboon viper,802607,ME5 9TD,51.353079370652200,0.512814689163507
Diving bird and Masked owl,813080,ME12 2NE,51.430651172968800,0.801137000000000
Pheasant and diamondback,811624,ME14 1LT,51.274062526205100,0.520701771137704
Capuchin and Kestrel,808777,ME16 0ST,51.277047201462400,0.516161894730339
iguana and moloch,800838,ME8 6ND,51.376009970094100,0.584858820294788
Tree warbler and tokay,1792505,ME3 9GL,51.421029376700000,0.554659719300000
Grosbeak and Myna,810491,ME14 5SH,51.274394802240400,0.549784163168952
dukite and tuatara,802604,ME5 9SZ,51.351056473953700,0.511526260412582
Armadillo and Parrotlet,804644,ME3 7UG,51.462598520406900,0.502069200814516
Greenbul and harlequin snake,802823,ME5 9EB,51.331966128966100,0.527265312985588
king cobra and mamba,801382,ME7 4QB,51.385901799501200,0.549626406670177
diamond python and Piping shrike,801164,ME7 5QX,51.391681178190800,0.528212452245878
constrictor and Tahr,805746,ME2 3NL,51.406646000000000,0.495196225124984
Fox and Treepie,801553,ME7 3NZ,51.347598308561700,0.568538615703454
king cobra and Treepie,799751,ME9 8DB,51.341567694579000,0.687358475783003
Philippine hawk-owl and crocodile,801309,ME8 0BU,51.361927569802300,0.594136187030079
Asiatic leopard and hawksbill,802804,ME5 9BY,51.340935539372500,0.514605704252784
Moluccan boobook and caiman,802054,ME7 2BU,51.378425485411000,0.566628602852922
Philippine hawk-owl and dugite,814300,ME10 2HF,51.354763868959300,0.738117982737342
viper and Stint,811031,ME14 2PH,51.285780953279000,0.523222358465764
flying dragon and puff adder,815107,ME1 2RD,51.369364563584600,0.512916173728194
bearded lizard and Minke whale,802431,ME5 9ND,51.328061958066400,0.530223102598016
wall lizard and diamond python,800864,ME8 6QF,51.379100124025300,0.583394625728311
ringhals and Stint,803673,ME4 5TF,51.371932755254800,0.526894165483604
water snake and caiman,801975,ME7 1RG,51.392653634602200,0.555924614901914
taipan and blind snake,803230,ME5 0JQ,51.358061873069200,0.525771402866606
Gila monster and viper,802959,ME5 8JH,51.350273092421900,0.540337097209243
Vole and blindworm,813470,ME11 5DD,51.415582510577800,0.750482000000000
crocodile and Siskin,815523,ME1 1DY,51.378947834692000,0.492473657048061
sea snake and diamond snake,810867,ME14 3LS,51.291217592836700,0.618419478668951
swift and Viscacha,813016,ME12 2HB,51.422976748444300,0.813145072417242
Diving bird and Jerboa,808230,ME16 8UG,51.265074694206400,0.489761116567270
