name,id,postcode,lat,lon
skink and Chipmunk,187117,TN26 3RD,51.084621000000000,0.749104000000000
Perching duck and Partridge,188515,TN24 0RJ,51.147459731307500,0.894323000000000
Triller and leguaan,192636,TN18 4LE,51.047009000000000,0.509688433071666
elapid and Gila monster,188313,TN24 8NX,51.152223465435400,0.871321360943313
box turtle and Crow,184646,TN30 7BB,51.069712801441700,0.701053634798555
viper and Piping shrike,184710,TN30 7JE,51.027709476381800,0.727377831537762
rattlesnake and agama,193151,TN17 4BE,51.088298000000000,0.618370103835237
hoop snake and Gila monster,197535,TN12 0RU,51.168263390264300,0.561920816772931
blue racer and blindworm,184709,TN30 7JD,51.028703816993200,0.727935426852791
cerastes and racer,187127,TN26 2EQ,51.095658001046000,0.848516565354283
frilled lizard and garter snake,1763101,TN23 5FN,51.135315030551100,0.841465008770629
Nukupuʻu and diamondback terrapin,184251,TN31 6XH,50.955744672209300,0.673375817986941
tuatara and Wader,186352,TN27 9HX,51.154053118047800,0.645511118321707
Ground sloth and Tattler,189131,TN23 3NL,51.122675624076500,0.871002852785709
black snake and White ibis,187078,TN26 2BB,51.043946660507900,0.784075664642758
Ground sloth and Wader,188772,TN23 5YW,51.139855551030500,0.845232560285308
agama and cobra,184003,TN31 7PZ,50.951095287594400,0.731617254322235
Magpie and Lemming,186513,TN27 9SA,51.166871261770000,0.625660000000000
Moluccan boobook and River dolphin,188805,TN24 0EL,51.138586608739700,0.895437751014915
Ibex and Stint,192831,TN17 4LN,51.052236519365700,0.629727873022309
Shearwater and harlequin snake,2659334,TN17 9EZ,51.096115000000000,0.535078000000000
Fish eagle and bull snake,193563,TN17 2AW,51.117217695487800,0.571984721849301
Wallaby and anole,188954,TN23 5BT,51.134935117857300,0.859626246737872
Goose and Recurvebill,193069,TN17 3NB,51.098403779357100,0.529473778618577
Triller and Mole,193622,TN17 2HN,51.108444199282200,0.545894995152963
Mink and Shearwater,2659381,TN27 9EZ,51.170498000000000,0.632248000000000
death adder and thorny devil,186367,TN27 9JT,51.172426219394800,0.611982745288205
coral snake and mud turtle,189014,TN23 9BD,51.146559317068800,0.875617044109976
galliwasp and hognose snake,186612,TN27 8NE,51.149781716728700,0.692357131300409
habu and blindworm,188390,TN24 8RB,51.156382711608300,0.872995667370913
Mamo and Rabbit,188797,TN24 0EA,51.142580948617300,0.889954114394409
skink and taipan,193108,TN17 3QU,51.088154429302000,0.515133465696788
bull snake and Grosbeak,192465,TN18 5PY,51.015706000000000,0.614784000000000
rock snake and giant tortoise,192627,TN18 4JT,51.049868036461400,0.500430174506476
blind snake and black snake,192430,TN18 5LL,51.021786539919300,0.552922439373646
agamid and Greenbul,189818,TN23 1NF,51.151352189861900,0.865775612906657
gavial and carpet snake,2659362,TN23 8AR,51.136965000000000,0.824627000000000
Myna and Herring gull,189397,TN23 3BX,51.152312717852500,0.813649466928183
Cuscus and frill-necked lizard,1762009,TN12 0EH,51.162191121441500,0.544705847724881
Vole and Skunk,2590914,TN17 9EP,51.096115000000000,0.535078000000000
Grouse and boa,187218,TN26 2PJ,51.087088979211400,0.866426918246806
Black jay and Boto,184813,TN30 6DB,51.081777222150100,0.695073878818186
Bunting and krait,187246,TN25 7AG,51.111632000000000,0.880863000000000
Asiatic leopard and Boto,187224,TN26 2PS,51.064793554460200,0.895524665684604
lizard and smooth snake,189375,TN23 3AR,51.143850516320300,0.832952625958107
Crow and anaconda,193214,TN17 4JJ,51.058189547166000,0.646106764478464
Fox and diamondback,188676,TN23 9TF,51.146269786104900,0.878244464569494
Scimitar babbler and Nukupuʻu,184365,TN30 7PR,51.016602000000000,0.685873000000000
Night heron and python,193360,TN17 3AF,51.094511483306200,0.539744837865691
Flameback and tiger snake,186229,TN27 8QQ,51.144254000000000,0.675785716694066
Black cockatoo and coral snake,184699,TN30 7HJ,51.022969926178700,0.718485806145604
Black cockatoo and Viscacha,192700,TN18 4RF,51.035318040868400,0.514153597082677
cerastes and rock snake,1763311,TN24 8AE,51.154183515375700,0.872444196587897
Rabbit and Coati,193389,TN17 3BT,51.094038167722000,0.535862593966754
snake and Rabbit,192934,TN18 4AQ,51.048071525211500,0.508295142922041
Mouse and Old World warbler,187532,TN25 4QD,51.159019000000000,0.853135584302297
Herring gull and rattlesnake,184335,TN30 7LX,51.060402137976900,0.690991665811595
Cuscus and Snipe,188326,TN24 0GR,51.131257638103600,0.894650296848684
puff adder and blue tongue,187535,TN25 4QG,51.174274495156300,0.877670969591687
Piping shrike and box turtle,187014,TN26 3QN,51.082365501590200,0.770289507500005
Lemming and Tit-tyrant,193052,TN17 3JY,51.097155652573100,0.534776255916813
caiman and bushmaster,187403,TN26 1HL,51.112905289740800,0.830544365255574
Chicken and Old World vulture,187405,TN26 1HP,51.109017668877300,0.822448357375292
python and python,188802,TN24 0EG,51.139677427109600,0.894247845433593
coral snake and Mouse,188231,TN24 8BT,51.146243473427900,0.882961693108233
gaboon viper and Kākāriki,193358,TN17 3AD,51.094751874528300,0.538647000000000
perentie and Chipmunk,186496,TN27 9QU,51.169633683503700,0.622496000000000
Pheasant and boomslang,186580,TN27 8JF,51.116115978821900,0.663734258913539
sand viper and Polecat,188184,TN24 9LX,51.165347334700600,0.883337927504379
Ice seal and gopher snake,184865,TN30 6HD,51.068627982882400,0.685687503308302
Polecat and Tahr,188225,TN24 8BJ,51.145550003786900,0.885549548615329
Duck and Siskin,188428,TN24 0JX,51.138386835114000,0.899142519958363
alligator and Condor,188856,TN23 6LU,51.128542215894000,0.860274624192471
skink and chuckwalla,187383,TN26 1EH,51.169885909665100,0.817080036270967
diamond python and monitor,193179,TN17 4EB,51.066238478101900,0.585486552074436
Stilt and king snake,187211,TN26 2PA,51.065370743803300,0.889650998591938
Mamo and ringhals,1763078,TN23 3GW,51.154792148695900,0.847939459231301
terrapin and wall lizard,188152,TN24 8AY,51.146970369812700,0.881934524194185
Grosbeak and Petrel,193230,TN17 2JT,51.110285377498100,0.558369313452369
boa and galliwasp,187220,TN26 2PN,51.090509000000000,0.873727000000000
python and Masked owl,189472,TN23 3GE,51.129672236981900,0.841604533157403
Duck and Ground sloth,186016,TN29 0AX,51.020213409793900,0.884017389658888
Perching duck and carpet snake,2664648,TN23 3UB,51.127049000000000,0.838573000000000
swift and caiman,183551,TN32 5UN,51.011388530042800,0.540175607071416
rock snake and green turtle,193017,TN18 4HY,51.046521462666000,0.512206394809716
horned viper and Nukupuʻu,2659365,TN23 9WY,51.146560000000000,0.875648000000000
galliwasp and Eagle,189252,TN23 4GQ,51.142567835605500,0.839479891441679
terrapin and Recurvebill,193180,TN17 4ED,51.066043209869800,0.585775423560013
loggerhead and horned viper,2632498,TN12 9GE,51.170830000000000,0.495654000000000
water snake and copperhead,185229,TN29 9RR,51.011050346060400,0.833218273097617
Armadillo and Snipe,183906,TN32 5QA,50.972698000000000,0.535585000000000
Coati and River dolphin,193377,TN17 3BB,51.092249571842500,0.536221746163351
coral snake and leguaan,1762450,TN18 4JH,51.047947926657500,0.514067096186836
Thicketbird and grass snake,188709,TN24 0BF,51.130254257857600,0.890127584898946
jew lizard and Chickadee,188786,TN24 0DL,51.132100389488100,0.882752202817942
Hawk and amphisbaena,186857,TN26 3AY,51.127022210500800,0.749720903273155
Boto and B,2659316,TN12 9GN,51.168909000000000,0.490444000000000
cobra de capello and milk snake,189211,TN23 5SU,51.131659203584100,0.848287960199833
viper and Marmoset,186012,TN29 0AS,51.014154802553100,0.887505458887419
Jay and White ibis,197803,TN12 0EU,51.140387000000000,0.553557000000000
Petrel and Lemming,184522,TN31 6NR,50.971626375331700,0.692650213477416
Crow and swift,184675,TN30 7DW,51.071865000000000,0.726162000000000
gavial and cerastes,187079,TN26 2BD,51.045070618539100,0.782202619838953
deaf adder and Partridge,186893,TN26 3EE,51.145383000000000,0.750755000000000
grass snake and amethystine python,189253,TN23 4GT,51.141745981919000,0.840358812610153
B and soft-shelled turtle,187123,TN26 3RQ,51.077987000000000,0.781636000000000
Quetzal and Cloud rat,186862,TN26 3BE,51.120294000000000,0.772630000000000
mamba and Darwin's finches,183922,TN32 5QW,50.974774489795400,0.535170685110524
harlequin snake and Tattler,187395,TN26 1HA,51.172261797944900,0.817768583053845
moloch and Guillemot,188967,TN23 5DJ,51.137616545446500,0.849269520052383
Chickadee and black snake,188995,TN23 7XB,51.140327222927800,0.869353200839114
Masked owl and king cobra,189205,TN23 5SJ,51.133375197118300,0.850580817681817
Wallaby and whip snake,185338,TN29 9TP,50.977765019102500,0.851180174385350
River dolphin and giant tortoise,184185,TN31 6SJ,50.976990091220100,0.611260000000000
Grosbeak and amethystine python,197778,TN12 0DG,51.153110137171800,0.558978944083747
blue racer and Chickadee,186035,TN27 9TH,51.168730944983700,0.627581895635058
diamond snake and Vulture,188694,TN24 0AJ,51.144815072519500,0.898530247412291
Kangaroo and puff adder,186439,TN27 0RW,51.171001826629700,0.746462000000000
soft-shelled turtle and worm lizard,188145,TN24 8AN,51.144403759868600,0.887894566059103
Polecat and frilled lizard,184168,TN31 6RL,50.985661831794100,0.638886751700732
puff adder and White ibis,189182,TN23 3QZ,51.155211865583900,0.846958000000000
Marmoset and Rat,186570,TN27 8HF,51.120472000000000,0.625099000000000
constrictor and massasauga,193021,TN18 4JG,51.047990922331500,0.514554594462739
Wallaby and Wallaby,184236,TN31 6UT,50.971238844329000,0.686231000000000
Capuchin and Armadillo,188893,TN23 7SU,51.140762118255700,0.872153967094157
perentie and turtle,186896,TN26 3EH,51.145645019899100,0.728021019318743
Tahr and Old World quail,196776,TN12 9EU,51.172429400519400,0.499502191143761
Old World quail and whip snake,186942,TN26 3JF,51.095103000000000,0.708104000000000
Pratincole and puff adder,1763351,TN26 2QQ,51.048296000000000,0.889421919468176
Old World vulture and Viscacha,1763336,TN25 7FJ,51.113727000000000,0.883451000000000
Ground sloth and Parrotlet,184663,TN30 7DB,51.065988587502400,0.702635316094373
anole and Zebra,193073,TN17 3NH,51.099210302896200,0.533345972143077
bicycle lizard and viper,193055,TN17 3LB,51.096418029616900,0.532707671799950
king snake and Minke whale,183966,TN31 7LT,50.954048524962700,0.741843965206482
kabaragoya and blind snake,2632576,TN30 7EQ,51.064887000000000,0.686031000000000
anole and whip snake,187140,TN26 2HG,51.064781337151500,0.854727616757242
Kestrel and indigo snake,189466,TN23 3FE,51.157608924291200,0.855622131967027
flying lizard and asp,192740,TN18 5AB,51.054732656044800,0.502162132324469
Parrotbill and rock python,192678,TN18 4PX,51.049115470474800,0.496508554494412
gecko and Darwin's finches,186867,TN26 3BP,51.101244781435600,0.698791960511713
boa constrictor and sand lizard,187402,TN26 1HJ,51.115173962065600,0.833798257289848
agamid and Egret,188368,TN24 8PY,51.153013381246500,0.866622268037065
cerastes and gaboon viper,186026,TN27 9ST,51.166727013896800,0.632303153493945
box turtle and Rabbit,188793,TN24 0DW,51.130593230837400,0.883687522944131
Darwin's finches and viper,2637346,TN23 9XA,51.146560000000000,0.875648000000000
Thrasher and Buzzard,193037,TN17 3JB,51.098877361189500,0.535841766779786
gopher snake and sand lizard,184285,TN31 7BQ,50.951710367483900,0.721457983105296
Guillemot and tortoise,184592,TN30 6TG,51.097521222446700,0.668635728831322
American sparrow and Old World vulture,193384,TN17 3BL,51.094641595195200,0.535824202311029
adder and Recurvebill,187947,TN24 8XW,51.162207000000000,0.867335000000000
Boto and Quetzal,185356,TN29 9UQ,51.021898206959300,0.836532435839966
Marsh harrier and Greenbul,2659388,TN30 9BN,51.070873000000000,0.690104000000000
Bronzewing pigeon and box turtle,186975,TN26 3LY,51.103760000000000,0.709467000000000
flying lizard and Chicken,193253,TN17 2NG,51.138668255122700,0.509500885452048
Warbler and Herring gull,189097,TN23 5NT,51.136462905090500,0.859677797794833
Capuchin and leguaan,192946,TN18 4BE,51.052864340456500,0.508340128642143
cerastes and copperhead,187017,TN26 3QR,51.091166319341100,0.764788505563042
Kestrel and Macaw,188180,TN24 9LS,51.164405079335800,0.881791394530985
mamba and caiman,185332,TN29 9TF,50.992716000000000,0.805877000000000
Hawaiian honeycreeper and Cuscus,188857,TN23 6LW,51.132684000000000,0.866749000000000
python and Guillemot,192713,TN18 4WB,51.096124131437000,0.535062624744611
Kestrel and boa constrictor,187951,TN25 4GE,51.162286232182700,0.851190634123009
Chicken and sea snake,1763058,TN23 1AH,51.149008879995500,0.867257000000000
gaboon viper and habu,193417,TN17 3EG,51.096243342805700,0.533298020862166
Tree warbler and Dolphin,186722,TN27 8QF,51.144148343558200,0.685451910589032
horned toad and Marsh harrier,186849,TN26 3AP,51.126279000000000,0.753836000000000
amphisbaena and Moluccan boobook,187859,TN25 4AJ,51.168207647761700,0.874202945624704
Partridge and B,186708,TN27 8PJ,51.160546187020500,0.662574813303169
sand lizard and Wallaby,188049,TN24 9BG,51.168082694035400,0.879504000000000
carpet snake and habu,197780,TN12 0DJ,51.159072722205700,0.560639127336589
Badger and milk snake,2632564,TN25 7GR,51.117808000000000,0.890840000000000
Ground sloth and Quetzal,193605,TN17 2EJ,51.142068657609500,0.594340693322656
turtle and mud turtle,189435,TN23 3DQ,51.152327939249700,0.854938407871086
Kestrel and blue racer,184687,TN30 7ES,51.013928069579700,0.726312211806666
fer-de-lance and Hawk,192470,TN18 5QG,51.014223145522500,0.614686669613929
Mink and Fulmarine petrel,188660,TN23 9SL,51.146269786104900,0.878244464569494
Hawk and Grackle,184181,TN31 6SD,50.979240266974000,0.628905448303790
Chicken and Kangaroo,184879,TN30 6JH,51.066186695418900,0.684289996458862
Lemming and Masked owl,192948,TN18 4BG,51.053396313061400,0.508898000000000
Badger and Linsang,189319,TN23 4XG,51.144556194442300,0.853858055375015
Vulture and coral snake,197769,TN12 0BU,51.165685000000000,0.556499000000000
Gila monster and blind snake,188792,TN24 0DU,51.139372926466400,0.896373418212417
frilled lizard and agama,185353,TN29 9UH,51.024983000000000,0.831800000000000
skink and tree snake,193056,TN17 3LE,51.095085179586100,0.525461000000000
Crow and Tree warbler,196784,TN12 9HB,51.173148440909400,0.500785791520457
flying lizard and New World blackbird,192626,TN18 4JS,51.049664475275300,0.503215902145502
habu and Wallaby,192875,TN17 4PX,51.035003831481800,0.651603812500514
mud turtle and anaconda,186633,TN26 3SN,51.071310000000000,0.775354000000000
Pheasant and Old World vulture,186646,TN26 3TE,51.078034000000000,0.742359000000000
ringhals and elapid,189226,TN23 3RR,51.158201456478400,0.844230466836554
fer-de-lance and python,189234,TN23 4ER,51.145954803273000,0.844015000000000
Goose and Capuchin,1762008,TN12 0EF,51.162021000000000,0.545085099066575
New World blackbird and galliwasp,188659,TN23 9SJ,51.146269786104900,0.878244464569494
constrictor and slowworm,192444,TN18 5NS,51.019720697932900,0.549500665762752
king cobra and sea snake,184010,TN32 5RL,50.981768334258300,0.536990809381353
Tattler and Dolphin,197548,TN12 0ST,51.167323953629000,0.546461934248133
Tit-tyrant and Tit-tyrant,187143,TN26 2HL,51.067147828987000,0.857999534442366
agamid and thorn lizard,189068,TN23 5JA,51.137499952498600,0.830748007586759
kabaragoya and Jay,188226,TN24 8BL,51.144830339283600,0.884460804840185
skink and asp,1763109,TN23 5TZ,51.133570742485100,0.849935227651188
perentie and Kite,2647900,TN30 6FH,51.065418000000000,0.691871000000000
Linsang and thorny devil,188539,TN23 9FX,51.146559317068800,0.875617044109976
Komodo dragon and gaboon viper,184703,TN30 7HT,51.041835000000000,0.741139619766790
glass snake and Egret,184664,TN30 7DD,51.066120094814600,0.710254000000000
blue racer and Jay,184794,TN30 6AT,51.069126204506100,0.686315916800214
Cloud rat and B,193118,TN17 4AD,51.075970200321900,0.573784000000000
Fox and whip snake,189369,TN23 3AH,51.144588308836900,0.833684170011705
Elephant and agama,193126,TN17 2HT,51.112136000000000,0.551513000000000
Boto and Macaw,189497,TN23 3HU,51.127625656829600,0.841064340375816
hawksbill and Grouse,193150,TN17 4BD,51.089619641216300,0.617952699906712
Marsh harrier and iguana,186426,TN27 0RD,51.170181368424500,0.744534223616142
Parakeet and cayman,187015,TN26 3QP,51.090086583459500,0.775049933465899
tokay and blind snake,193324,TN17 2SP,51.081640000000000,0.502329000000000
American sparrow and puff adder,186992,TN26 3PG,51.087533814567000,0.785565119106264
Scimitar babbler and Dorcopsis,189376,TN23 3AS,51.143128976741900,0.831550071559730
water snake and cerastes,184880,TN30 6JJ,51.066442638000300,0.680193770322933
habu and Eagle,186518,TN27 9SG,51.166193081438700,0.625649468469207
bull snake and worm lizard,186973,TN26 3LW,51.105732568533700,0.714725874529805
diamondback turtle and rock snake,1763368,TN27 8FH,51.103627555473600,0.667887462295610
elapid and Stilt,189033,TN23 5EZ,51.146559317068800,0.875617044109976
Old World quail and krait,184811,TN30 6BZ,51.080857339479000,0.693621065709722
python and Condor,187151,TN26 2HW,51.064882453257000,0.858316715074008
Meadowlark and whip snake,2632563,TN25 7GP,51.117750000000000,0.890294000000000
gaboon viper and diamond python,197753,TN12 0AX,51.158286157057500,0.552600461540191
Kangaroo and smooth snake,184289,TN31 7BW,50.953252220855600,0.720522823765996
sand viper and asp,186957,TN26 3LA,51.126635400923500,0.747811220520416
Darwin's finches and horned toad,1763087,TN23 3SA,51.155911000000000,0.855284441157207
Zebra and Mamo,188890,TN23 7SR,51.139180711131300,0.869525134558564
Night heron and Black cockatoo,193286,TN17 2QF,51.102080519034300,0.497776059863333
monitor and B,192761,TN18 5DF,51.044753000000000,0.528789000000000
Warbler and Bronzewing pigeon,2579114,TN23 9UH,51.146559187800000,0.875616995200000
Buzzard and Old World vulture,196878,TN12 9LP,51.163692924905400,0.508484738625348
Gila monster and giant tortoise,188682,TN23 9TP,51.146269786104900,0.878244464569494
gavial and River dolphin,196793,TN12 9HR,51.174322000000000,0.491392000000000
Parrotlet and garter snake,192654,TN18 4NB,51.041447879403900,0.504713086980860
Partridge and leguaan,196755,TN12 9DS,51.173252484777200,0.497600959706147
saltwater crocodile and skink,197448,TN12 0NJ,51.163531000000000,0.551774000000000
bull snake and Gull,2637325,TN12 9GA,51.170972000000000,0.496191000000000
Elephant and blue tongue,184280,TN31 7BH,50.953523877422200,0.723144587775909
asp and monitor,1762443,TN17 9DW,51.096124567456400,0.535062603994395
diamondback terrapin and Skunk,187736,TN24 9QY,51.165322152178700,0.896726332594685
taipan and caiman,192647,TN18 4LT,51.042398706425000,0.507346642618463
Nukupuʻu and Warbler,188939,TN23 5AY,51.135112543031100,0.851055000000000
adder and puff adder,1763086,TN23 3RZ,51.156281412123700,0.853995401241981
Night heron and Snipe,196813,TN12 9JR,51.171524374521200,0.487535960292163
Grosbeak and Gila monster,188084,TN24 9ED,51.161746448687300,0.889292782992698
sand viper and grass snake,186622,TN27 8NW,51.153968179037300,0.681216922442791
bearded lizard and mamba,186528,TN27 8DD,51.113084926118200,0.642341084872339
Mamo and tortoise,193207,TN17 4HT,51.052963811214100,0.576912643440356
Jerboa and gaboon viper,187842,TN24 9SE,51.160553753521300,0.894238948216039
Mamo and anaconda,186523,TN27 9SQ,51.167000000000000,0.633434000000000
habu and Shearwater,185233,TN29 9RW,51.006340000000000,0.835740000000000
puff adder and grass snake,187073,TN26 2AT,51.040346148174100,0.785700124246314
tiger snake and cobra de capello,1763091,TN23 3SF,51.155064115011000,0.855593614680913
Mockingbird and Solitaire,183983,TN31 7NU,50.955931127479600,0.737127242191560
Old World quail and agamid,192808,TN18 5JG,51.024975000000000,0.568386000000000
Triller and Gila monster,187195,TN26 2NF,51.052711160396800,0.802339716223776
Parrotlet and moloch,188089,TN24 9EL,51.164646000000000,0.889946000000000
White ibis and Magpie,196760,TN12 9DY,51.172815691995100,0.496575870707052
Logrunners and thorn lizard,189082,TN23 5LB,51.138670000000000,0.840027000000000
Chipmunk and cayman,184820,TN30 6DN,51.084427535049700,0.691300974278980
Treepie and Thrasher,184552,TN30 6QW,51.071197022149800,0.688177534966299
Marsh harrier and thorn lizard,188872,TN23 7HE,51.144825782216700,0.869113000000000
Dolphin and loggerhead,187199,TN26 2NL,51.065089187562500,0.859057453991933
slowworm and smooth snake,193414,TN17 3ED,51.096726930519000,0.534638535062698
whip snake and diamond snake,184432,TN31 6DR,50.950687995119100,0.601407502359566
puff adder and Quetzal,189101,TN23 5PB,51.136064681284200,0.855364266205851
