name,id,postcode,lat,lon
Eagle and cycling lizard,1273839,DN8 5QD,53.604681535421500,-0.953760939586802
taipan and Guillemot,1283032,DN3 3JP,53.530406258244000,-1.043803431160200
frill-necked lizard and boa,1294592,DN1 2JR,53.526337768286700,-1.121598051561360
Marsh harrier and galliwasp,1288289,DN17 4NX,53.608042300130100,-0.825734438223024
White ibis and Old World quail,1294574,DN1 2EZ,53.523835000000000,-1.127095000000000
Viscacha and Asiatic leopard,1292217,DN14 5AW,53.704743567125100,-0.869476000000000
Maya and Chipmunk,1283348,DN3 2RG,53.555608447684400,-1.057123272663840
thorny devil and pit viper,1768750,DN3 1HS,53.566003814479400,-1.068820613237630
ringhals and New World blackbird,1291080,DN14 8FD,53.690436731633900,-0.832544804750438
Badger and green turtle,1278289,DN4 5JN,53.513461000000000,-1.097841000000000
Parakeet and kabaragoya,1287268,DN2 5NH,53.536232767317000,-1.100827668790070
Guillemot and Cuscus,1278078,DN4 6JP,53.514267812848500,-1.069547654108870
boomslang and rattlesnake,1274486,DN7 6JN,53.577026687780600,-1.012334293967990
Thicketbird and Crow,1290637,DN14 9PX,53.705635000000000,-1.034155000000000
Thicketbird and Shearwater,1274173,DN8 5HZ,53.611887971697700,-0.954504888551221
Grackle and Chicken,1274854,DN7 4HL,53.570606342115200,-1.014220473193730
cobra de capello and Piping shrike,1283171,DN3 3RA,53.505817422929200,-1.043225947630410
milk snake and Argus,1273704,DN9 1NS,53.549211182345900,-0.818518619023850
thorn lizard and Flameback,1276188,DN5 7XY,53.549712548146700,-1.158454979129730
sand lizard and Thicketbird,1283028,DN3 3JH,53.532683005336000,-1.047508899835190
White ibis and Meadowlark,1274245,DN8 4BD,53.614961049648900,-0.970981844081908
galliwasp and Greenbul,1278788,DN4 0BF,53.521295000000000,-1.141350463761850
Thrasher and anaconda,1277773,DN4 8JG,53.502790108135200,-1.148061778286620
Magpie and blue tongue,1283714,DN3 2JU,53.550742917900100,-1.069412050385060
perentie and Asiatic leopard,1283407,DN3 3DJ,53.536339931324000,-1.051847814891110
Black jay and Jay,1273299,DN9 3HJ,53.500863864196600,-1.018733338370370
Parakeet and snapping turtle,1274159,DN8 5GS,53.592149623647600,-0.992325485964343
deaf adder and Scimitar babbler,1273445,DN9 2BQ,53.506405000000000,-0.897407000000000
caiman and leguaan,1283757,DN3 1DJ,53.575914559255600,-1.068693394150660
Parakeet and ringhals,1276600,DN5 0PD,53.552748095568100,-1.146666464339550
Linsang and Triller,1276539,DN5 0HF,53.558167932629500,-1.147885906911300
dukite and Perching duck,1283369,DN3 3AF,53.534765010800100,-1.052743010620750
Pratincole and tortoise,1274680,DN7 5NB,53.612026271977300,-1.010973705686790
Hawk and Siskin,1275833,DN5 9RL,53.539562051654300,-1.151760266674610
flying lizard and Capuchin,1291763,DN14 5FH,53.709365131849400,-0.858685000000000
snake and Gila monster,1292012,DN14 5TG,53.697304009346000,-0.870039132084231
Parrotlet and Marsh harrier,1276696,DN5 0TX,53.551423968199900,-1.127584232533110
Bunting and Marmoset,1278232,DN4 5DF,53.513634160564900,-1.124922056709270
Grackle and cayman,1274280,DN8 4EG,53.620347449597000,-0.957727843282468
Gull and Darwin's finches,1274128,DN7 6SH,53.575592000000000,-1.003993053239930
Moluccan boobook and bull snake,1278528,DN4 0QH,53.508675998048300,-1.147823151599000
habu and Booted eagles,1278146,DN4 6ND,53.513016055187400,-1.086736456731740
Goose and massasauga,1274369,DN8 4LR,53.633051085913900,-0.948779454766682
Quetzal and boomslang,1287003,DN2 6EH,53.526511990794100,-1.100294342288980
gopher snake and black snake,1291887,DN14 5PF,53.720506347426400,-0.847670287305548
perentie and garter snake,1291184,DN14 8NN,53.685386021245700,-0.950171981166748
Diving bird and terrapin,1291549,DN14 5XS,53.708595290226900,-0.855995185868805
Polecat and Crow,1291038,DN14 8BD,53.688497043244700,-0.864535620162842
thorny devil and Old World warbler,1277946,DN4 7DN,53.505962542979400,-1.091803402278650
Nukupuʻu and anaconda,1294396,DN1 3NG,53.522450881143300,-1.129687832776900
moloch and Polecat,1278543,DN4 0RR,53.504548442612100,-1.159002742203910
Mole and Puffleg,1277664,DN4 8BP,53.508518043706400,-1.144584414074180
swift and frilled lizard,1274993,DN7 5AL,53.601142713308300,-1.028742433772170
python and Kite,1290532,DN14 9NU,53.710385983222700,-1.021668243192360
Mouse and mud turtle,1274832,DN7 4EJ,53.585982022427500,-1.024709148442090
mountain devil and Partridge,1277672,DN4 8DE,53.502960000000000,-1.127825000000000
White ibis and Black cockatoo,1292408,DN14 0HZ,53.687235000000000,-1.151688000000000
turtle and Egret,1273667,DN9 1JQ,53.524416592888000,-0.812752341205476
Grouse and Mamo,1278154,DN4 6NP,53.509367182465200,-1.072791404240230
Quetzal and Fish eagle,1291883,DN14 5PA,53.718912283495100,-0.847350154113651
iguana and Chicken,1294171,DN1 9SU,53.520010916083200,-1.132844868539990
Argus and Masked owl,1274127,DN7 6SG,53.575169074318300,-1.004025891125910
rock snake and carpet snake,1276575,DN5 0LQ,53.567099864931400,-1.155105159652380
diamond python and Logrunners,1273656,DN9 1JA,53.524938245923100,-0.782386853192706
Stilt and cerastes,1292084,DN14 0TQ,53.704337000000000,-1.152552340157370
milk snake and Vulture,1274439,DN7 6DX,53.567808587599900,-0.967068107318774
Grosbeak and chameleon,1283246,DN3 2NJ,53.554018268545100,-1.066396697874610
Triller and adder,1276540,DN5 0HG,53.557541614194300,-1.148290986047990
Thrasher and Petrel,1273935,DN8 4RP,53.621344000000000,-0.952308936730040
Chickadee and snapping turtle,1278562,DN4 0SR,53.505369385716300,-1.161986918678590
Gull and diamond python,1276562,DN5 0JT,53.557346405947900,-1.151178238256740
Pheasant and White ibis,2578092,DN7 6WA,53.577999077800000,-1.000304461400000
Dorcopsis and galliwasp,1277870,DN4 7AU,53.512344873728600,-1.091847942163980
Parakeet and Coati,1294261,DN1 2UF,53.530298466531600,-1.123598038231790
Piping shrike and ringhals,1283437,DN3 1PL,53.562173767845900,-1.064450728899080
Puffleg and fer-de-lance,1274321,DN8 4JQ,53.618107423951700,-0.981716000000000
Triller and frill-necked lizard,1275654,DN6 0PX,53.612209156068700,-1.160886201444100
Thicketbird and Pitohui,1274203,DN8 5LR,53.606060361762700,-0.958139000000000
chuckwalla and grass snake,1287004,DN2 6EJ,53.526712206118200,-1.100621973536640
rattlesnake and cobra,1274508,DN7 6LR,53.575740453561100,-0.992821346566307
gecko and Mamo,1278469,DN4 0LX,53.511742419187800,-1.148002928672210
Myna and boomslang,1288143,DN17 4DA,53.578165272068400,-0.806836795376027
Wader and thorn lizard,1292108,DN14 0UY,53.684140000000000,-1.151190000000000
Greenbul and amethystine python,2640714,DN6 0FA,53.617452000000000,-1.159697000000000
garter snake and Mouse,1273713,DN9 1PF,53.546781773920100,-0.833844953456097
Buzzard and Civet,1283706,DN3 2JJ,53.549810807994200,-1.063998870358820
Quetzal and Mink,1278173,DN4 6PN,53.508234860093900,-1.070509083357470
Ibex and Darwin's finches,1277642,DN4 8AG,53.511472773866100,-1.140468495724880
chameleon and mountain devil,1283698,DN3 2HZ,53.551567547941300,-1.064607000000000
Schneider python and whip snake,1291737,DN14 5DT,53.704440735186900,-0.865257839908783
Eagle and gopher snake,1283766,DN3 1DZ,53.577219250940700,-1.073497737884470
anole and blind snake,1291791,DN14 6NH,53.711076706394800,-0.866458074812361
Schneider python and Parrotlet,1291058,DN14 8DQ,53.691596410563500,-0.833481968180948
Quetzal and Jackal,1276059,DN5 9AD,53.527113501335900,-1.141888000000000
Grosbeak and New World blackbird,1278118,DN4 7RR,53.503582873398100,-1.096859797093650
crocodile and gopher snake,2681,YO8 8QJ,53.718904138265500,-1.092118080207870
carpet snake and king cobra,1290659,DN14 9RE,53.687582517439000,-1.032781540896530
hognose snake and Cloud rat,1274805,DN7 5TF,53.621555755896000,-1.048881200454480
Masked owl and puff adder,1274730,DN7 4AY,53.577824478274900,-1.017526391909770
milk snake and Chickadee,1291049,DN14 8DD,53.689676131116600,-0.836594072547226
Tattler and Ice seal,2633735,YO8 8SJ,53.713012000000000,-1.072355000000000
Thrasher and Gull,1287375,DN2 4BS,53.532215206639500,-1.114129049503400
Herring gull and Mamo,1283030,DN3 3JL,53.532226041400300,-1.045437122205840
viper and krait,1290887,DN14 9BY,53.685494195144900,-0.993142321778086
bandy-bandy and mud turtle,1292274,DN14 0DZ,53.666039000000000,-1.076137000000000
cerastes and Grosbeak,1288152,DN17 4DP,53.605282000000000,-0.833845715847317
Capuchin and gaboon viper,1283451,DN3 1QD,53.561115074685100,-1.062405735153420
Mouse and Mole,1278265,DN4 5FF,53.506974000000000,-1.101824000000000
thorn lizard and Night heron,1274086,DN8 5BH,53.614323174713800,-0.957513397885109
deaf adder and bull snake,1274317,DN8 4JJ,53.620644000009300,-0.980685984220065
green turtle and Parrotlet,1290884,DN14 9BS,53.641302825584800,-1.021996692588880
diamondback terrapin and sidewinder,1283157,DN3 3QF,53.508144336798400,-1.059881000000000
death adder and Songlark,1283174,DN3 3RG,53.529923926152900,-1.062355410984100
Scimitar babbler and Quetzal,1291675,DN14 6HJ,53.709757815770300,-0.870523655243910
coral snake and anole,1768377,DN14 0FA,53.662383224242900,-1.089186473484540
sea snake and Kangaroo,1292008,DN14 5SY,53.697722000000000,-0.878040000000000
Treepie and Herring gull,1291694,DN14 6JH,53.710275528216200,-0.867282614364358
Tattler and Old World quail,1290682,DN14 9TH,53.686551684695800,-1.035364208496950
sidewinder and Marsh harrier,1287283,DN2 5PD,53.537384632622200,-1.096231320528240
massasauga and bearded lizard,1290833,DN14 8SJ,53.684876329158400,-0.941281261439501
chameleon and Pitohui,1274748,DN7 4BX,53.563212067473100,-1.024508183120320
Boto and monitor,1274513,DN7 6LX,53.575297363932300,-0.987183510761513
snapping turtle and skink,1287306,DN2 5QP,53.538313114148500,-1.094204678232820
hognose snake and Grosbeak,1274206,DN8 5LU,53.606300591644400,-0.954914912595487
racer and Jerboa,1274122,DN8 5EN,53.611045534996600,-0.965136688755281
Gull and hawksbill,1283159,DN3 3QH,53.512466034132400,-1.055140000000000
Darwin's finches and kabaragoya,1283029,DN3 3JJ,53.532835117926200,-1.045166941971110
Capuchin and asp,1275728,DN5 9JG,53.544078874339100,-1.160045637298250
Logrunners and Solitaire,1275539,DN6 0HD,53.636941461974500,-1.104480669080820
sea snake and Minke whale,1768313,DN1 9PX,53.512923750490100,-1.125720996155070
American sparrow and adder,1274642,DN7 5JB,53.600407334873300,-1.031933000000000
Ibex and Mouse,1275641,DN6 0PB,53.614710938824800,-1.138524742043290
gavial and Thicketbird,1274600,DN7 6QT,53.578850477854700,-1.006794003686500
lizard and Lemming,1278199,DN4 6QU,53.507196936400100,-1.066505892572750
blind snake and Greenbul,1283332,DN3 2QG,53.554993466297700,-1.077394759662720
amphisbaena and Cuscus,1278084,DN4 6JW,53.515143793484200,-1.070071387136120
Tattler and mountain devil,1283149,DN3 3PU,53.508564149162700,-1.031583601432960
bearded dragon and Dorcopsis,1278796,DN4 0BS,53.518659484512300,-1.147411732785370
snake and Maya,1287388,DN2 4DH,53.532846662208800,-1.114432707327070
Night heron and Herring gull,1273304,DN9 3HR,53.503606941207100,-1.020011861596150
gopher snake and frill-necked lizard,1291176,DN14 8NB,53.691992143237100,-0.973981185671203
anole and Philippine hawk-owl,1291872,DN14 5NN,53.715511298581700,-0.847475000000000
Partridge and lizard,1292095,DN14 0UE,53.667743462165700,-1.073541756481310
Gull and gecko,1291632,DN14 6DH,53.708226740832100,-0.876897488589026
cycling lizard and Petrel,1274051,DN8 4TG,53.631928000000000,-0.952830000000000
Quetzal and Guillemot,1283351,DN3 2RL,53.555285031050100,-1.064013943875300
Mink and Stilt,1291685,DN14 6HX,53.709100287105300,-0.866571795116989
lizard and Shearwater,1294537,DN1 2AN,53.518134276053800,-1.124482468739620
mountain devil and hognose snake,1291794,DN14 6NN,53.711834736009200,-0.859195219763345
diamondback turtle and smooth snake,1912342,DN1 2RB,53.526592000000000,-1.127720000000000
python and Recurvebill,1273996,DN9 1DW,53.527191191847200,-0.827941493000543
Greenbul and Tit-tyrant,1277778,DN4 8JU,53.500596042556800,-1.150472655779770
tortoise and Vole,1276248,DN5 8EH,53.525027304760400,-1.160663836759720
Mole and leguaan,1283479,DN3 1SH,53.565238948050200,-1.073699120256680
Old World warbler and Songlark,2684,YO8 8QP,53.714391120385100,-1.077881218233330
thorn lizard and Philippine hawk-owl,1291804,DN14 6PB,53.711991316163800,-0.876721479850478
krait and Goose,1274108,DN8 5DT,53.610219000000000,-0.960894000000000
Linsang and massasauga,1287028,DN2 6EU,53.524536813071000,-1.104197785777760
Coati and agama,1287254,DN2 5LH,53.528709348830400,-1.106974000000000
sea snake and Armadillo,1275563,DN6 0JP,53.616966583387000,-1.147246840497150
thorny devil and slowworm,1275526,DN6 0EP,53.618094000000000,-1.152759537522140
Moluccan boobook and death adder,1273734,DN9 1PY,53.557451649533700,-0.823753996919290
bearded lizard and Chicken,1283250,DN3 2NQ,53.555056733608000,-1.066735000000000
goanna and deaf adder,1290651,DN14 9QR,53.710487378689500,-1.025286960046730
Grosbeak and death adder,1291889,DN14 5PH,53.721798182383100,-0.847407648257209
tuatara and Tahr,1276426,DN5 0EL,53.550948583933500,-1.146415876455060
Triller and Capuchin,1276532,DN5 0FB,53.553015586210800,-1.119083504598720
gavial and viper,1278067,DN4 6HX,53.516992910174600,-1.086062775451580
Polecat and Rabbit,1278342,DN4 5LR,53.512178204979300,-1.094988000000000
Thicketbird and krait,1283557,DN3 2AY,53.540825180074500,-1.065540073561850
whip snake and Kite,1768999,DN55 1RS,53.512923750490100,-1.125720996155070
Gila monster and snapping turtle,1283203,DN3 3SU,53.533557113365200,-1.043279835163450
taipan and Jackal,1290954,DN14 8AE,53.682728951948500,-0.853486279688830
whip snake and bicycle lizard,1290529,DN14 9NR,53.712156131107700,-1.017202938572580
Egret and glass snake,1287494,DN2 4PY,53.539970363885100,-1.102996879887140
gaboon viper and sea snake,1288130,DN17 4BG,53.607811000000000,-0.827730573270397
king cobra and Pitohui,1276237,DN5 8DT,53.528931770890700,-1.154763517893860
massasauga and flying lizard,1273988,DN9 1DL,53.525810081119900,-0.828266234914457
Bronzewing pigeon and slowworm,1286964,DN2 6AG,53.518845962679900,-1.113714100859060
Perching duck and Mockingbird,1283196,DN3 3SL,53.532593562607500,-1.043060151973850
Civet and Black jay,1276319,DN5 8LZ,53.531287957305900,-1.154927828039360
mud turtle and Eagle,1283401,DN3 3DB,53.532512824938200,-1.053245879825890
Argus and diamond snake,1291720,DN14 6LR,53.711747528037100,-0.866106709418402
Jerboa and Black jay,1278476,DN4 0NL,53.509363333527300,-1.157294009033940
dugite and Meadowlark,1273691,DN9 1LY,53.550431948774200,-0.796703989408308
Gila monster and Asiatic leopard,1294228,DN1 2RT,53.527506479818300,-1.131469895760670
Siskin and ringhals,1292276,DN14 0EB,53.657887414512100,-1.088163471957840
cayman and Chicken,1275531,DN6 0EU,53.633790660130700,-1.146907710179830
Minke whale and soft-shelled turtle,1287098,DN2 6NT,53.527639000000000,-1.094689000000000
king snake and terrapin,1283448,DN3 1PZ,53.561628755175800,-1.063722968729620
flying dragon and agama,1283728,DN3 1AP,53.579898717465200,-1.067820433987720
gavial and Jay,1769004,DN55 1SP,53.512923750490100,-1.125720996155070
Grosbeak and Mamo,1274745,DN7 4BT,53.562052198467400,-1.027780892024440
green turtle and dugite,2634800,DN8 4FE,53.620753000000000,-0.954412000000000
krait and diamond snake,1291315,DN14 7RS,53.705030103172200,-0.847896154238586
kabaragoya and tuatara,1276622,DN5 0QQ,53.562893394763900,-1.153860343224800
Hawaiian honeycreeper and River dolphin,1274540,DN7 5DZ,53.597303627515900,-1.024206697680560
Hawaiian honeycreeper and Treepie,1291450,DN14 6UU,53.709518458081900,-0.890120015571080
Booted eagles and perentie,1291395,DN14 7TS,53.720196331458800,-0.803199718902423
green turtle and copperhead,1288141,DN17 4BY,53.573795000000000,-0.816550000000000
leguaan and box turtle,1283415,DN3 3DU,53.537378120875300,-1.047886396347720
Ground sloth and grass snake,1291203,DN14 8PP,53.681252476695000,-0.937178000000000
flying dragon and box turtle,1291312,DN14 7RN,53.717114268287200,-0.839867986391468
Meadowlark and galliwasp,1291683,DN14 6HU,53.708827258177500,-0.866215518951992
Parakeet and hognose snake,1291167,DN14 8LQ,53.719635643202500,-0.900416313590362
taipan and thorny devil,1290739,DN14 8RN,53.700264354839700,-0.967114000000000
Fish eagle and Philippine hawk-owl,1274567,DN7 6NU,53.568571047964200,-0.973150015776407
Condor and sand lizard,1274438,DN7 6DW,53.540891326866300,-0.974046000000000
coral snake and harlequin snake,1286938,DN2 5SG,53.537931718602900,-1.099644906211310
perentie and Linsang,1276317,DN5 8LX,53.530453046317200,-1.156347480966440
Egret and caiman,1276425,DN5 0EJ,53.549524815782400,-1.145916256671210
snake and Rat,1287238,DN2 5JP,53.532614380963500,-1.102563900380640
Puffleg and frilled lizard,1292424,DN14 0JY,53.705633380090900,-1.146637287711760
River dolphin and Grackle,1290627,DN14 9PJ,53.710761239840200,-1.022492844886280
goanna and bushmaster,1287488,DN2 4PR,53.544985245384400,-1.093352962905910
Wallaby and Macaw,1288287,DN17 4NT,53.607381015244000,-0.826130637546983
hognose snake and monitor,1277979,DN4 7HE,53.500955758545600,-1.081206413637430
frilled lizard and sidewinder,1291918,DN14 5RP,53.694756000000000,-0.877120000000000
horned toad and glass snake,1292112,DN14 0WF,53.701292324084800,-1.156843581187330
sidewinder and Buzzard,1278044,DN4 6FG,53.515099516021900,-1.074792726021600
Argus and Marmoset,1288157,DN17 4DY,53.603754237766400,-0.834890920479991
Minke whale and thorny devil,1277891,DN4 8QE,53.501672000000000,-1.153783000000000
Minke whale and cobra,1283447,DN3 1PY,53.562074854417200,-1.066747771609970
rock python and harlequin snake,1273748,DN9 1QT,53.546229279707300,-0.819673220048707
Songlark and amethystine python,1291436,DN14 6TQ,53.705025301621000,-0.881542622223599
Linsang and Cuscus,1283583,DN3 2DR,53.544318480114000,-1.060528249005040
boa constrictor and horned toad,1287461,DN2 4LA,53.536863606136100,-1.111874356999200
chuckwalla and Piping shrike,1283919,DN3 1NN,53.562996837265300,-1.067406896421780
Bronzewing pigeon and Egret,1294045,DN1 9FS,53.512920908235600,-1.125720918306950
chuckwalla and thorny devil,1274997,DN7 5AS,53.601462036971200,-1.029324472484260
Tree warbler and Egret,1274344,DN7 6BP,53.564046876735900,-1.018872327467230
Pratincole and Maya,1274550,DN7 5EN,53.599281561983000,-1.020957574493580
turtle and habu,1294708,DN1 2QG,53.524933163111900,-1.126182618335840
copperhead and boa constrictor,1294426,DN1 1NH,53.523704000000000,-1.132419999610700
gavial and perentie,1273793,DN9 1TL,53.528610089354100,-0.832398009638146
copperhead and python,1294438,DN1 1QH,53.525453000000000,-1.133307000000000
alligator and Magpie,1278273,DN4 5HF,53.518055527032300,-1.113790920864070
Kangaroo and bull snake,1292018,DN14 5TS,53.692661761614600,-0.869603073508573
lizard and Bronzewing pigeon,1274286,DN8 4ET,53.621407447843800,-0.958684474767593
mountain devil and Coati,1278437,DN4 0HQ,53.514601000000000,-1.154249000000000
Tree warbler and blind snake,1277818,DN4 8PG,53.503776134032200,-1.155278944666690
Goose and Nukupuʻu,1273344,DN9 3JZ,53.501838979091400,-1.021454732791550
Flameback and Pitohui,1291002,DN14 9LF,53.689331809146700,-1.027910743235800
boa and chameleon,1277887,DN4 8PZ,53.502940935297700,-1.157933955130910
diamond snake and Tattler,1291325,DN14 6QN,53.712813289788900,-0.874275271780577
Philippine hawk-owl and green turtle,1274900,DN7 4LU,53.578977146587100,-1.015596586272700
anaconda and Civet,1287372,DN2 4BH,53.548641000000000,-1.089381000000000
Herring gull and flying dragon,1291317,DN14 7RW,53.716780164226400,-0.839710490991826
Quetzal and Chipmunk,1275865,DN5 9TP,53.531489000000000,-1.146339000000000
American sparrow and Grosbeak,1291070,DN14 8EN,53.699762366809600,-0.808338794250686
Kākāriki and blindworm,1278519,DN4 6DY,53.503027627449000,-1.078281964089510
jew lizard and turtle,1294532,DN1 2AE,53.520609000000000,-1.127112008042620
Buzzard and sand lizard,1768391,DN14 4BL,53.701649082429700,-0.895219940479740
Mink and Coati,1291108,DN14 8JL,53.717452029674800,-0.899503428297302
iguana and krait,1294564,DN1 2DZ,53.520792268843900,-1.125347745461190
Vole and python,1294599,DN1 2LF,53.527461000000000,-1.125044000000000
Chipmunk and bearded lizard,1287277,DN2 5NU,53.535836792858400,-1.098376648711820
slowworm and boomslang,1274084,DN8 5BE,53.611111000000000,-0.960117000000000
Black cockatoo and galliwasp,1292023,DN14 5TY,53.692781711948100,-0.868978924713300
flying lizard and Prion,1288203,DN17 4HZ,53.598716827370600,-0.826234818008625
American sparrow and Polecat,1278714,DN4 5BG,53.514691143324900,-1.115866856360700
hoop snake and Crow,2686,YO8 8QR,53.713415402358400,-1.076069171932110
asp and Civet,1274835,DN7 4EP,53.583847602662300,-1.017613333014360
slowworm and Gila monster,1283212,DN3 3TP,53.529489331958300,-1.043793908111180
Hawk and Bunting,1294489,DN1 3RY,53.516284017508700,-1.138289922235080
gopher snake and Old World warbler,1294617,DN1 2NE,53.528390000000000,-1.126823850174690
snapping turtle and viper,1287280,DN2 5NY,53.537031736470200,-1.095921968745330
glass snake and Tahr,1276112,DN5 9GA,53.542655726332800,-1.153252785073890
Quetzal and carpet snake,1278242,DN4 5DZ,53.516335303847200,-1.106090024764750
bushmaster and Crow,1274817,DN7 5WZ,53.594531199301900,-1.030359649379980
Cuscus and indigo snake,1292219,DN14 5BA,53.702133000000000,-0.871137000000000
Old World vulture and Guillemot,1288303,DN17 4PT,53.634632774675200,-0.785356152795055
Rat and mud turtle,2640671,DN3 1EG,53.565642000000000,-1.080127000000000
bull snake and leguaan,1273677,DN9 1LD,53.539488318350200,-0.846464478355114
Petrel and Gila monster,1278252,DN4 5EN,53.515218331283600,-1.109386116016580
Jay and whip snake,1274205,DN8 5LT,53.606987254610100,-0.955850000000000
Jackal and Prion,1286949,DN2 5SW,53.540194915139600,-1.097001428862200
mountain devil and Old World vulture,1274207,DN8 5LW,53.606496503830600,-0.957796804038104
kabaragoya and rat snake,1294251,DN1 2TT,53.530849265858200,-1.122711647166040
Bronzewing pigeon and coral snake,1283578,DN3 2DJ,53.543294160248600,-1.059434184031280
Darwin's finches and Civet,1768307,DN1 9PQ,53.512923750490100,-1.125720996155070
ringhals and king snake,1274320,DN8 4JP,53.646402016167100,-0.987704684988091
king cobra and python,1288278,DN17 4NG,53.610385563206900,-0.836492013824214
Goose and Magpie,1294605,DN1 2LQ,53.527777929199400,-1.123091896208500
lizard and gopher snake,1290943,DN14 7YH,53.701646633944000,-0.895219889863396
caiman and Pratincole,1274989,DN7 5AF,53.600188705649700,-1.029701220423530
sand viper and milk snake,1288175,DN17 4EW,53.606339000000000,-0.836256000000000
Thicketbird and dugite,1291695,DN14 6JJ,53.712066624771700,-0.863734462695589
Masked owl and Crow,1294502,DN1 3SQ,53.516042191807100,-1.137163729158810
python and Ice seal,1274155,DN8 5GD,53.605525172366900,-0.964984466084437
swift and flying lizard,1769000,DN55 1RY,53.512923750490100,-1.125720996155070
kabaragoya and Petrel,1274667,DN7 5LH,53.618230000000000,-1.020943000000000
Egret and Chipmunk,1276592,DN5 0NS,53.549708646486900,-1.141460041381450
Schneider python and mamba,1768293,DN1 3BF,53.519698772541500,-1.128944000000000
king snake and Duck,1274241,DN8 4AY,53.615162824335400,-0.968316375960935
rat snake and Gull,1278783,DN4 0AZ,53.517713324385500,-1.144565162727750
kabaragoya and asp,1768751,DN3 1ST,53.567618000000000,-1.068516694802090
Fox and green turtle,1275001,DN7 5AX,53.600654257752000,-1.027091000000000
taipan and Old World warbler,1291750,DN14 5ER,53.704327827190600,-0.866624280838280
goanna and Cloud rat,1291360,DN14 6SN,53.704597845941400,-0.879084667528159
gecko and frilled lizard,1275577,DN6 0LF,53.616188333143900,-1.145251962328220
python and krait,1283140,DN3 3PH,53.510245092794400,-1.036038944753650
Viscacha and Elephant,1275801,DN5 9QY,53.542573024064700,-1.150462651297640
hawksbill and brown snake,1294713,DN1 2QP,53.526773218438800,-1.128286845036820
Duck and Black cockatoo,1291355,DN14 6SF,53.704206524476900,-0.877610476311912
dugite and Minke whale,1292290,DN14 0EW,53.664768671185600,-1.112774865428660
snake and Condor,1287466,DN2 4LG,53.537535824326400,-1.105583276182330
Stint and Masked owl,1278372,DN4 5PU,53.508157372918800,-1.100336194569690
puff adder and taipan,1276605,DN5 0PJ,53.555313039637500,-1.143339197901840
agamid and Guillemot,1291057,DN14 8DP,53.668338011069000,-0.835774207054203
Perching duck and moloch,1283248,DN3 2NN,53.556036313363700,-1.050517000000000
horned viper and hoop snake,1274129,DN7 6SJ,53.576167000000000,-1.003888937584040
Eagle and Grosbeak,1277768,DN4 8JA,53.503831924580500,-1.149201821646970
Skunk and diamondback terrapin,1278369,DN4 5PR,53.507127123453800,-1.100795273252870
snake and Marmoset,1273453,DN9 2DA,53.523594524225500,-0.933465183024312
tortoise and glass snake,1291572,DN14 6AR,53.708137352856500,-0.880793490600785
Rabbit and Capuchin,1274605,DN7 6QZ,53.581990456240400,-1.008230907118090
tree snake and wall lizard,1291754,DN14 5EW,53.704835749859000,-0.866156161014489
Logrunners and Marsh harrier,1291045,DN14 8BQ,53.680606000000000,-0.884612000000000
Gila monster and hoop snake,1283046,DN3 3LG,53.532049135156500,-1.049182702339920
Mole and Parrotbill,1283216,DN3 3TT,53.527171983489000,-1.044012030968490
Tit-tyrant and Piping shrike,1283517,DN3 3HS,53.542424637208600,-1.046113196399540
Warbler and frill-necked lizard,1276897,DN5 0BW,53.544020396373300,-1.149121000000000
Songlark and Ice seal,1275669,DN6 0QR,53.615042272367100,-1.162417277697500
Schneider python and Peafowl,1278141,DN4 6LW,53.511613410099000,-1.074989278346790
boa constrictor and Old World vulture,1274088,DN8 5BL,53.614572921319600,-0.958476000000000
