name,id,postcode,lat,lon
saltwater crocodile and Quetzal,1290908,DN14 9EA,53.684867000000000,-1.022543049085240
bicycle lizard and thorny devil,1273956,DN9 1AQ,53.510880000000000,-0.767378000000000
pit viper and Scimitar babbler,1294504,DN1 3SS,53.517537510690500,-1.133875679266810
gecko and blue racer,1768403,DN14 5US,53.693655253109600,-0.871757468178393
tokay and bull snake,1286991,DN2 6DR,53.524064478499700,-1.105942431443090
Hawk and boa constrictor,1278454,DN4 0JZ,53.514822000000000,-1.142316000000000
turtle and Philippine hawk-owl,1291725,DN14 5BT,53.704147881734200,-0.874036000000000
Fulmarine petrel and harlequin snake,1275919,DN6 0DL,53.614183000000000,-1.087790000000000
Perching duck and horned toad,1273936,DN8 4RR,53.621538000000000,-0.951923000000000
tiger snake and Booted eagles,1277764,DN4 8HU,53.503106941157700,-1.145854228420560
whip snake and viper,1278321,DN4 6TN,53.503509593024100,-1.066255191340510
wall lizard and leathery turtle,1288221,DN17 4LA,53.605998489630400,-0.833665400099693
sand viper and Pitohui,1292034,DN14 0QZ,53.703968706138300,-1.105709569482160
Vulture and Macaw,1274319,DN8 4JN,53.622723474062800,-0.990599650177146
hawksbill and Argus,1276585,DN5 0NB,53.606570293381400,-1.124936000000000
Gull and caiman,1283394,DN3 3BT,53.533948412743700,-1.050769000000000
mamba and amethystine python,1287247,DN2 5JZ,53.532095102407500,-1.104038320940470
Darwin's finches and indigo snake,1274022,DN9 1FH,53.547512886091400,-0.823139070738273
Wader and Marmoset,1277737,DN4 8EN,53.503296849077400,-1.153599872422410
frilled lizard and boa,1276591,DN5 0NR,53.549881999940400,-1.140566026903230
cayman and gaboon viper,1287270,DN2 5NL,53.535589810817800,-1.099000514743110
Francolin and tree snake,1291710,DN14 6LD,53.710096869333400,-0.870257008483312
Mink and Philippine hawk-owl,1273655,DN9 1HY,53.522713541545800,-0.806917143881854
Ibex and Coati,1277966,DN4 7EQ,53.505254544479400,-1.093265975544370
Parrotbill and New World blackbird,1283401,DN3 3DB,53.532512824938200,-1.053245879825890
Pratincole and thorny devil,1283331,DN3 2QF,53.556057000000000,-1.077598000000000
