name,id,postcode,lat,lon
snake and Solitaire,1291805,DN14 6PD,53.712989427879700,-0.880604116709951
thorn lizard and Marsh harrier,1274079,DN8 5AX,53.613325483579000,-0.967892557444184
tree snake and gopher snake,1290861,DN14 9AL,53.637261501098100,-1.035732587593750
massasauga and bull snake,1278247,DN4 5EF,53.516136000000000,-1.108100000000000
galliwasp and alligator,1278557,DN4 0SJ,53.504292586639400,-1.160967829650760
Meadowlark and Crow,1287111,DN2 6PT,53.532324797171300,-1.095147148103540
Mamo and boa,1292252,DN14 0BU,53.691721000000000,-1.097685000000000
grass snake and Polecat,1278200,DN4 6QW,53.505456873830400,-1.070449222263890
fer-de-lance and Marsh harrier,1283553,DN3 2AT,53.540281042669500,-1.074168447036350
jew lizard and Skunk,1274881,DN7 4JU,53.584504160152700,-1.014380570735260
Macaw and Thrasher,1291631,DN14 6DG,53.706431831550600,-0.878157252395816
Duck and Boto,1273740,DN9 1QH,53.563081158709500,-0.816712937804034
terrapin and Bronzewing pigeon,1291935,DN14 0LN,53.702829906664100,-1.151829163632940
Macaw and cobra,1276429,DN5 0EQ,53.549565073042400,-1.146519175020510
swift and horned toad,1287198,DN2 5ET,53.526343463132600,-1.107795162251420
Philippine hawk-owl and Dolphin,1291528,DN14 5UE,53.691531583963000,-0.867952323069423
garter snake and diamondback,2579,YO8 8HP,53.724804049289100,-1.020636492173040
frill-necked lizard and king snake,1288209,DN17 4JG,53.596580557535300,-0.813782596448448
garter snake and Darwin's finches,1290964,DN14 9HG,53.691351416219100,-1.030893037675160
massasauga and bearded dragon,1292414,DN14 0JH,53.678231043583000,-1.158545484717020
taipan and death adder,1283463,DN3 1QX,53.558134427959700,-1.062864128980120
Mamo and iguana,1287265,DN2 5ND,53.534202473010900,-1.103375246771220
Stint and king cobra,1291664,DN14 6FD,53.715752221980800,-0.864711016639708
jew lizard and rock python,1278500,DN4 0QD,53.508502293895700,-1.151204245681400
horned viper and boomslang,2607900,DN9 1LN,53.547885000000000,-0.816718000000000
Duck and mud turtle,1283606,DN3 2FE,53.536313571720700,-1.071403236209350
Badger and Treepie,1278427,DN4 0HA,53.514954588846500,-1.153518448536850
White ibis and River dolphin,1768383,DN14 0WJ,53.702045224953300,-1.154859472278050
Eagle and Marmoset,1278067,DN4 6HX,53.516992910174600,-1.086062775451580
Recurvebill and Black jay,1290915,DN14 9EJ,53.685464389777100,-1.012237042016140
tokay and viper,1274323,DN8 4JS,53.632662263240300,-0.976524880430379
dugite and Marmoset,1768909,DN4 8DP,53.506818000000000,-1.140532000000000
leathery turtle and Komodo dragon,1274880,DN7 4JT,53.584031145297200,-1.010433889673650
iguana and dugite,1768290,DN1 2RE,53.527515577352600,-1.131092711711780
bearded lizard and Fox,1287150,DN2 5AS,53.534068253522900,-1.108266513303080
Old World quail and milk snake,1286938,DN2 5SG,53.537931718602900,-1.099644906211310
Black jay and flying dragon,1283378,DN3 3AW,53.536835849535100,-1.060120000000000
constrictor and Herring gull,1277926,DN4 7BH,53.506511363010500,-1.085971571663580
Cuscus and iguana,1274312,DN8 4JD,53.622506000000000,-0.980717000000000
viper and turtle,1278485,DN4 0PB,53.509830031631400,-1.154645914102180
mountain devil and wall lizard,1275839,DN5 9SA,53.531662000000000,-1.145461000000000
massasauga and black snake,1273709,DN9 1PA,53.546963432248500,-0.820286691541849
bearded lizard and fer-de-lance,1290826,DN14 8SA,53.706034629332900,-0.938144606371614
Myna and Petrel,1277774,DN4 8JH,53.504999236790800,-1.151560678940880
indigo snake and rock python,1274292,DN8 4HB,53.620144593958900,-0.962313783426401
Black jay and tokay,1290876,DN14 9BE,53.641803141921500,-1.057486461417420
Argus and whip snake,1276673,DN5 0SR,53.554931000000000,-1.126410000000000
Snipe and blind snake,1276099,DN5 9ED,53.548581228806700,-1.160017000000000
New World blackbird and Cloud rat,1290941,DN14 7YD,53.722636578173000,-0.779563432421679
Jerboa and Greenbul,1287066,DN2 6LD,53.528810118022600,-1.099898673720500
loggerhead and snapping turtle,1283227,DN3 2LL,53.552301895763000,-1.064155231362780
Fulmarine petrel and galliwasp,1287062,DN2 6JQ,53.528928716148400,-1.089274000000000
Dolphin and Cloud rat,1283031,DN3 3JN,53.531817929452400,-1.046110127201270
leathery turtle and gecko,1278492,DN4 0PT,53.508912000000000,-1.153096000000000
chameleon and Komodo dragon,1278329,DN4 5JY,53.515154149175500,-1.090113893433430
Kangaroo and Prion,1278915,DN4 0ES,53.514641010630800,-1.151126849868230
Hawk and amethystine python,1273735,DN9 1PZ,53.557419810473200,-0.829672688290764
Tattler and jew lizard,1291364,DN14 6SS,53.704940000000000,-0.880969000000000
Darwin's finches and soft-shelled turtle,1274573,DN7 6PD,53.570663643564800,-0.976089318592830
Black jay and Songlark,1768979,DN55 1FE,53.512923750490100,-1.125720996155070
Parrotbill and diamond python,1283376,DN3 3AT,53.534816646068400,-1.058143391410640
horned viper and Quetzal,1276915,DN5 0DT,53.546777000000000,-1.147375000000000
hoop snake and black snake,1276540,DN5 0HG,53.557541614194300,-1.148290986047990
Shearwater and Prion,1287474,DN2 4NA,53.538987988473300,-1.114712001385410
Myna and Chipmunk,1278229,DN4 5DB,53.515059835913300,-1.124440261857980
Ice seal and loggerhead,1277655,DN4 8AY,53.510816143198100,-1.142909569854870
whip snake and Solitaire,1294500,DN1 3SN,53.517630234155200,-1.136754427136770
rock snake and Nukupuʻu,1292262,DN14 0DH,53.670374156681900,-1.058181096432230
Egret and Mamo,1294379,DN1 3JH,53.519997532172100,-1.133478616003600
constrictor and Prion,1274297,DN8 4HJ,53.618875105693600,-0.960001595514842
Old World quail and Mole,1288145,DN17 4DD,53.587102492105600,-0.819758455517565
thorny devil and tortoise,1292088,DN14 0TU,53.704811898075300,-1.153743503102510
Meadowlark and Herring gull,1287157,DN2 5BE,53.527729145056500,-1.120121063982480
Marmoset and Stilt,1273676,DN9 1LB,53.537909000000000,-0.845708000000000
cobra de capello and Viscacha,1288194,DN17 4HN,53.607366336100700,-0.832902231821096
Diving bird and ringhals,1290636,DN14 9PW,53.712324227175100,-1.023471775426690
Meadowlark and Old World quail,1291171,DN14 8LW,53.717493347922900,-0.902048156206752
Old World quail and chameleon,1287374,DN2 4BP,53.532628387108900,-1.116519297791330
Linsang and thorny devil,1276073,DN5 9BN,53.536346549599500,-1.159745982978250
Tattler and dukite,1290909,DN14 9EB,53.686754283286300,-1.019354075233080
Siskin and ringhals,1278126,DN4 6LA,53.515215166488900,-1.072316908090020
gopher snake and Thicketbird,1274728,DN7 4AW,53.578377399283100,-1.021380105745520
Schneider python and king snake,1277740,DN4 8ER,53.502288245149600,-1.152067086877710
terrapin and Francolin,1283467,DN3 1RP,53.574158515892700,-1.056801333748360
horned toad and Fox,1288219,DN17 4JU,53.635792359618000,-0.786245441408626
River dolphin and Viscacha,1283610,DN3 2FJ,53.534223937507100,-1.069851000000000
glass snake and sea snake,1275556,DN6 0JE,53.617193141056000,-1.148769126263600
Stint and grass snake,1274160,DN8 5HB,53.611691583780900,-0.968128898484280
bicycle lizard and Eagle,1276920,DN5 0ED,53.550020883648700,-1.144895014770630
Treepie and Myna,1274681,DN7 5ND,53.593976148803300,-1.031747290781550
Francolin and Booted eagles,1275534,DN6 0EY,53.626557262959300,-1.123586246061300
Tit-tyrant and cerastes,1283731,DN3 1AS,53.579889090552100,-1.068893037674060
River dolphin and Mamo,1294158,DN1 9SD,53.520010916083200,-1.132844868539990
cobra and Parakeet,1276922,DN5 0EF,53.548909105292500,-1.146547462315890
Lemming and bull snake,2608320,DN4 5FP,53.516999000000000,-1.104284000000000
horned toad and taipan,1274332,DN7 6AT,53.567445499575000,-1.015698238868960
Black jay and Skunk,1278824,DN4 0ER,53.515346000000000,-1.152802000000000
green turtle and Treepie,1275536,DN6 0FB,53.637488076561700,-1.100657685843180
Fish eagle and Badger,1291210,DN14 8PY,53.680376876432000,-0.940697634439283
dugite and leguaan,1283715,DN3 2JW,53.549554288208600,-1.065679886858480
Schneider python and sand lizard,1275646,DN6 0PH,53.617310569921200,-1.152651928319230
skink and rock snake,1273734,DN9 1PY,53.557451649533700,-0.823753996919290
swift and Scimitar babbler,1273342,DN9 3JX,53.501175690184700,-1.018394463365560
Pratincole and Maya,1275636,DN6 0NU,53.618012272946700,-1.146409420414060
Scimitar babbler and galliwasp,1274150,DN8 5EZ,53.610449105815500,-0.963730444516043
Towhee and giant tortoise,1291067,DN14 8EE,53.691324599848600,-0.832338513077407
Mockingbird and Rabbit,1278523,DN4 6ED,53.505930803732100,-1.074766183858650
whip snake and glass snake,1294818,DN1 1HF,53.523504000000000,-1.132318282564390
Puffleg and Piping shrike,1274044,DN8 4SX,53.631030598632300,-0.951052679752419
Pratincole and Nukupuʻu,1291057,DN14 8DP,53.668338011069000,-0.835774207054203
Viscacha and rock snake,1277859,DN4 7AF,53.510172237463200,-1.082771410723660
frill-necked lizard and Darwin's finches,1276619,DN5 0QL,53.563047689362400,-1.152800404222630
iguana and taipan,1287223,DN2 6QU,53.530873017325500,-1.090984004091010
hawksbill and caiman,1291530,DN14 5UG,53.692692827278500,-0.868133200847856
hawksbill and amethystine python,1274107,DN8 5DR,53.610266978553100,-0.960349121711091
Logrunners and Stint,1283776,DN3 1EX,53.576833740269300,-1.073626988631230
crocodile and thorn lizard,1273438,DN9 2BD,53.500831305573600,-0.899361224468316
habu and hognose snake,1768885,DN4 0NJ,53.510590281213400,-1.144859502231120
frilled lizard and mamba,1292273,DN14 0DY,53.666026000000000,-1.070961000000000
thorny devil and horned viper,1287286,DN2 5PG,53.536363051091600,-1.096645373319340
Mole and tiger snake,1278398,DN4 6AL,53.508651386867300,-1.081371757794460
rat snake and Old World vulture,1291548,DN14 5XR,53.709452640268000,-0.853532654103469
diamondback terrapin and Macaw,1278374,DN4 5QA,53.513468000000000,-1.131624684697330
Ice seal and Grackle,1291992,DN14 5RY,53.691929756303600,-0.876831446110859
copperhead and Capuchin,1276028,DN5 8TH,53.512920908235600,-1.125720918306950
kabaragoya and blindworm,1292313,DN14 0HF,53.668875438188700,-1.072306057850100
Guillemot and Darwin's finches,1291549,DN14 5XS,53.708595290226900,-0.855995185868805
Cuscus and Tree warbler,1291467,DN14 6XF,53.702462627522600,-0.894032109047357
death adder and black snake,1277656,DN4 8BA,53.507670170034600,-1.145430789417600
Duck and jew lizard,1274481,DN7 6JF,53.576295555205100,-1.006536711137020
kabaragoya and rock snake,1283273,DN3 2PU,53.556925840236000,-1.076205440317710
Polecat and tokay,1277725,DN4 8DF,53.509305000000000,-1.140135000000000
Scimitar babbler and viper,1283265,DN3 2PJ,53.554756093260700,-1.074592224547920
python and Masked owl,1291054,DN14 8DJ,53.688500509200600,-0.830326863906329
Pratincole and blue racer,1274210,DN8 5LZ,53.606963631876700,-0.954671836956879
tokay and mamba,1283348,DN3 2RG,53.555608447684400,-1.057123272663840
gavial and Pitohui,1274507,DN7 6LQ,53.576215873997700,-1.011024134079100
carpet snake and Argus,1273861,DN8 5RF,53.605329571823500,-0.970445157189464
saltwater crocodile and swift,1294358,DN1 3DZ,53.521664888176000,-1.134093182560130
cayman and gopher snake,1286937,DN2 5SF,53.538213274882200,-1.100031254181860
Warbler and tiger snake,1291445,DN14 6UP,53.706599423574900,-0.888424305588765
Parrotlet and Parakeet,1276586,DN5 0NH,53.546343406930300,-1.146133000000000
hognose snake and Rabbit,1278809,DN4 0DJ,53.515628979812000,-1.152283438670250
rock python and flying dragon,1274544,DN7 5EE,53.598813919196500,-1.023129246986530
kabaragoya and Elephant,1275552,DN6 0HY,53.616291265794700,-1.152143238779720
Diving bird and adder,1291789,DN14 6ND,53.712165440978700,-0.870383416613506
whip snake and kabaragoya,1278507,DN4 6DH,53.503771061304500,-1.075612284576140
Diving bird and carpet snake,1277782,DN4 8LA,53.501285000000000,-1.147315950477030
boomslang and Shearwater,1274517,DN7 6NB,53.572290683156000,-0.984537074487806
Masked owl and alligator,1294437,DN1 1QG,53.523630000000000,-1.136014000000000
Kite and amethystine python,1288169,DN17 4EP,53.606358509168300,-0.835559831892670
Moluccan boobook and Tit-tyrant,1275639,DN6 0NY,53.617360621883000,-1.147270000000000
Grosbeak and tortoise,1294446,DN1 1RE,53.525470075177900,-1.138239303037080
agamid and saltwater crocodile,1274406,DN8 4PX,53.628688907656300,-0.947451293628487
Marsh harrier and Parrotbill,1292089,DN14 0TW,53.705287010244000,-1.156112347537200
Grouse and python,1275539,DN6 0HD,53.636941461974500,-1.104480669080820
hawksbill and Masked owl,1277776,DN4 8JS,53.500030034702400,-1.149142000000000
Asiatic leopard and rock snake,1294332,DN1 3AY,53.517801795288700,-1.138108314947150
chuckwalla and Recurvebill,1291074,DN14 8ET,53.698311469992400,-0.793596422690546
glass snake and Diving bird,1273304,DN9 3HR,53.503606941207100,-1.020011861596150
terrapin and slowworm,1278415,DN4 6BH,53.506890469294100,-1.079148104567910
Treepie and Rat,1278205,DN4 6RB,53.503507544897800,-1.069451548415720
dugite and Wader,1291792,DN14 6NJ,53.710714100528100,-0.866134493633319
Triller and tiger snake,1273828,DN8 5PQ,53.608255717066200,-0.950302103971598
milk snake and rock python,1294801,DN1 1DD,53.522130000000000,-1.136090000000000
monitor and Chicken,1290526,DN14 9NN,53.711495529416200,-1.018854670612480
milk snake and Guillemot,1291816,DN14 6PS,53.712421564128400,-0.885255644403306
boomslang and Parrotbill,1274031,DN8 4SE,53.626949849237400,-0.955176064703116
saltwater crocodile and Nukupuʻu,1276613,DN5 0PU,53.557728791892800,-1.140527819502300
thorn lizard and wall lizard,1294414,DN1 3QT,53.515783578995400,-1.136203783605470
Maya and gopher snake,1768282,DN1 1AF,53.525920955871900,-1.136119000000000
anaconda and leathery turtle,1287037,DN2 6HH,53.528706704130400,-1.088616642095980
Coati and Kākāriki,1294722,DN1 2QZ,53.527151895202900,-1.128445009633760
diamondback terrapin and Thicketbird,1283764,DN3 1DX,53.575335029457800,-1.070458015225140
constrictor and Mink,1277977,DN4 7HB,53.502478115283900,-1.082801773212470
Macaw and bandy-bandy,1273306,DN9 3HT,53.504097956467600,-1.023121000000000
leguaan and Chickadee,1274053,DN8 4TJ,53.630162612028600,-0.953554247142492
krait and leathery turtle,1278486,DN4 0PG,53.507176000000000,-1.155498000000000
goanna and American sparrow,1288174,DN17 4EU,53.607790000000000,-0.842166887644995
Minke whale and flying dragon,1278230,DN4 5DD,53.514972611556300,-1.124804002158890
Francolin and krait,1274120,DN8 5EJ,53.610013884962900,-0.965373518339900
chuckwalla and pit viper,1274603,DN7 6QX,53.578922803297700,-1.009012574154850
Piping shrike and milk snake,1276609,DN5 0PQ,53.555540139180200,-1.146187632121650
boa and tortoise,1294422,DN1 3RH,53.516685000000000,-1.136457000000000
Petrel and amethystine python,1274686,DN7 5NJ,53.593507467115400,-1.029370778982000
Old World quail and Grouse,1273525,DN9 1GB,53.521962503667600,-0.819095834583020
sea snake and Puffleg,1291007,DN14 9LN,53.698443000000000,-1.022960000000000
hoop snake and elapid,1291428,DN14 6TD,53.703542977337100,-0.884520755021557
Mamo and Rat,1276071,DN5 9BJ,53.533960572506900,-1.156624798587220
Snipe and amethystine python,1294228,DN1 2RT,53.527506479818300,-1.131469895760670
Flameback and Egret,1275916,DN6 0DG,53.618756000000000,-1.129734000000000
blue racer and gopher snake,1283179,DN3 3RP,53.528362378647700,-1.050140235631870
bearded dragon and Tahr,1273901,DN8 5TS,53.604024870476700,-0.964038803733610
Crow and agamid,1274734,DN7 4BD,53.578697263431900,-1.018729563935840
Nukupuʻu and Towhee,1768391,DN14 4BL,53.701649082429700,-0.895219940479740
thorn lizard and Kangaroo,1291463,DN14 6XA,53.708594235064100,-0.886417329743824
monitor and Night heron,1283576,DN3 2DG,53.542226373948800,-1.060816012485430
Mink and Rat,1275850,DN5 9SR,53.533410814838800,-1.142513849796950
bushmaster and Recurvebill,1278317,DN4 6TF,53.505227140707700,-1.059462707628240
bull snake and massasauga,1275533,DN6 0EX,53.640938000000000,-1.138248000000000
anaconda and Zebra,1277562,DN4 9EB,53.501564634605500,-1.161624724093560
mountain devil and constrictor,1278449,DN4 0JH,53.514457565811100,-1.159379000000000
Siskin and Logrunners,1273333,DN9 3JL,53.502508943779200,-1.015468953199370
mountain devil and Old World warbler,1287841,DN17 4TF,53.601473173865900,-0.826823348671808
Buzzard and Jay,1283449,DN3 1QA,53.560161008104600,-1.064540418857090
python and blue racer,1287176,DN2 5DG,53.525227905474000,-1.111288058524560
White ibis and Buzzard,1292043,DN14 0RL,53.700597000000000,-1.128653000000000
Badger and Maya,1275669,DN6 0QR,53.615042272367100,-1.162417277697500
king cobra and giant tortoise,1292271,DN14 0DW,53.668469044441600,-1.066275807921760
tiger snake and rat snake,1292005,DN14 5SQ,53.695063000000000,-0.872447000000000
mamba and bearded dragon,1287263,DN2 5LZ,53.532969088131000,-1.106720514756140
tokay and Ibex,1277758,DN4 8HJ,53.501973718795700,-1.147022800234960
worm lizard and Dolphin,1283560,DN3 2BB,53.540881619655400,-1.061268296505040
dukite and rock snake,1273999,DN9 1DZ,53.530636000000000,-0.864345703433962
king snake and Meadowlark,1278086,DN4 6JY,53.512601058812300,-1.072524788985710
terrapin and constrictor,1294240,DN1 2SU,53.532755654943200,-1.126672000000000
grass snake and amphisbaena,1273648,DN9 1HP,53.521448901040100,-0.821704506744057
bandy-bandy and blindworm,1274459,DN7 6HA,53.578934000000000,-0.929838000000000
Dolphin and bandy-bandy,1275540,DN6 0HE,53.620441384125600,-1.128006564253460
habu and taipan,1294259,DN1 2UD,53.530963486528400,-1.124806328364360
bushmaster and Jerboa,2581334,DN9 1QE,53.558864000000000,-0.840382000000000
grass snake and turtle,1274344,DN7 6BP,53.564046876735900,-1.018872327467230
Elephant and Logrunners,1294343,DN1 3BQ,53.519477600903100,-1.136158830828200
slowworm and Mink,1291909,DN14 5QU,53.702965968364300,-0.868993727641159
lizard and River dolphin,1768381,DN14 0GP,53.691593519950700,-1.152569995931020
Viscacha and Stilt,1768898,DN4 5PY,53.512704000000000,-1.099923000000000
anole and puff adder,1294394,DN1 3NE,53.522418333593300,-1.131392944574300
sand lizard and Egret,1275782,DN5 9PP,53.537726386383900,-1.160397674990620
water snake and sand lizard,1283352,DN3 2RN,53.554707611364800,-1.063739876451130
galliwasp and monitor,1287080,DN2 6LW,53.527828236788700,-1.099617775994570
water snake and agama,1294248,DN1 2TP,53.532280646155800,-1.124236041821840
blindworm and saltwater crocodile,1278044,DN4 6FG,53.515099516021900,-1.074792726021600
hoop snake and Parrotlet,1283207,DN3 3SZ,53.534616805092600,-1.044281939138440
Darwin's finches and king cobra,1283552,DN3 2AS,53.539056000000000,-1.073758000000000
Chicken and coral snake,1274836,DN7 4ER,53.585460660238900,-1.019207400851650
ringhals and Lemming,1274721,DN7 5QY,53.595538929043900,-1.028266545443360
Old World quail and chameleon,1273972,DN9 1BN,53.523523879102100,-0.823381637805291
Peafowl and chuckwalla,1291049,DN14 8DD,53.689676131116600,-0.836594072547226
racer and Night heron,1292208,DN14 5AD,53.710115000000000,-0.855015000000000
Songlark and chuckwalla,1291987,DN14 0QH,53.695504760322500,-1.115824326836360
Jackal and Pheasant,1290986,DN14 9JL,53.690906714457900,-1.028147062678350
Snipe and mountain devil,1768910,DN4 8DS,53.506992212222200,-1.146847000000000
flying dragon and Prion,1288370,DN17 3LQ,53.543214110983100,-0.753716869122074
Treepie and pit viper,1276534,DN5 0GL,53.557476798108000,-1.123142275905800
River dolphin and constrictor,1292412,DN14 0JF,53.681069000000000,-1.150429308987730
Logrunners and thorny devil,1273229,DN9 3BF,53.500145883243800,-0.984422233793253
horned viper and swift,1274170,DN8 5HW,53.609301000000000,-0.953617000000000
Petrel and Solitaire,1277447,DN4 9AE,53.501304329849700,-1.156564304229320
water snake and Kestrel,1278469,DN4 0LX,53.511742419187800,-1.148002928672210
smooth snake and thorn lizard,1273784,DN9 1SY,53.524909774483300,-0.809917673875278
lizard and Kākāriki,1276587,DN5 0NL,53.548912239279000,-1.141959131225070
River dolphin and carpet snake,1288190,DN17 4HB,53.605460458217700,-0.835644985926800
galliwasp and box turtle,1283706,DN3 2JJ,53.549810807994200,-1.063998870358820
Ibex and tokay,1273401,DN9 3QG,53.503116640622900,-1.023807459978980
Minke whale and carpet snake,1294416,DN1 3QW,53.515721000000000,-1.133611000000000
Fulmarine petrel and cerastes,1291928,DN14 0LD,53.700406326692500,-1.157391434216290
diamond snake and Jerboa,1287405,DN2 4EL,53.534333634701600,-1.113737825173160
Masked owl and soft-shelled turtle,1294457,DN1 1SL,53.512920908235600,-1.125720918306950
Asiatic leopard and bull snake,1291473,DN14 6YB,53.714890982673400,-0.861097547908025
Triller and krait,1274358,DN8 4JZ,53.660288714406600,-0.957242287090291
frill-necked lizard and box turtle,1291746,DN14 5EL,53.704727379697200,-0.867052869157627
leathery turtle and Chipmunk,1276691,DN5 0TQ,53.554348154755200,-1.125516471240970
gecko and Tattler,1276198,DN5 8AD,53.530156308329100,-1.148719705357520
Kākāriki and grass snake,1287443,DN2 4HX,53.534251892966400,-1.112411804402650
cayman and Masked owl,1290665,DN14 9RN,53.688266433014200,-1.031766437615130
hawksbill and sea snake,1283163,DN3 3QP,53.507254055769300,-1.046405280146430
worm lizard and Minke whale,1277867,DN4 7AR,53.507560209680800,-1.084561000000000
crocodile and mamba,1288301,DN17 4PR,53.634385000000000,-0.782081000000000
White ibis and bushmaster,1274523,DN7 6NJ,53.574398522080000,-0.970335748305801
Condor and tiger snake,1768991,DN55 1NP,53.512923750490100,-1.125720996155070
bicycle lizard and Grackle,1278558,DN4 0SL,53.504556071434200,-1.160088150152900
Perching duck and Triller,1287158,DN2 5BF,53.528658566225200,-1.116722000000000
Jackal and Prion,1283341,DN3 2QU,53.547805867686900,-1.075498444291550
Old World warbler and Moluccan boobook,1274483,DN7 6JH,53.574793000000000,-1.008445000000000
Masked owl and Pitohui,1291755,DN14 5EX,53.703226231315400,-0.867047738030444
diamond python and Chickadee,1291859,DN14 5LU,53.710706206747300,-0.851150135062143
green turtle and Flameback,1278116,DN4 7RP,53.504385897998000,-1.094882693866940
Minke whale and Parrotbill,1291346,DN14 6RQ,53.714012117190400,-0.884486000000000
frilled lizard and Thicketbird,1274046,DN8 4SZ,53.631433000000000,-0.951637207773679
Goose and Asiatic leopard,1278511,DN4 6DP,53.502043298362800,-1.075363409708320
bull snake and tree snake,1288149,DN17 4DH,53.580847000000000,-0.781722000000000
Gull and swift,1292095,DN14 0UE,53.667743462165700,-1.073541756481310
Snipe and rock snake,1276675,DN5 0SU,53.553165794738700,-1.129782403102520
bearded dragon and flying lizard,1292014,DN14 5TJ,53.695931955908400,-0.871332982965972
diamond snake and hawksbill,1291116,DN14 8JY,53.708469984657700,-0.924978272151889
goanna and Lemming,1278198,DN4 6QT,53.507933123758000,-1.064092235928280
crocodile and New World blackbird,1274648,DN7 5JJ,53.610940462381800,-1.013675000000000
Tattler and Hawaiian honeycreeper,1287452,DN2 4JP,53.535817628773700,-1.109014361581620
Crow and Asiatic leopard,1274798,DN7 5SX,53.605895554143600,-1.063439616656630
Puffleg and Triller,1287057,DN2 6JH,53.529579355412500,-1.089895322633630
hognose snake and Fox,1291072,DN14 8ER,53.699697212037100,-0.800009582735349
habu and Ground sloth,1283476,DN3 1SE,53.564479948505600,-1.074349841416740
Tahr and tiger snake,1287317,DN2 5RB,53.540034934920000,-1.090123842990020
dugite and black snake,1294166,DN1 9SP,53.520010916083200,-1.132844868539990
Duck and chuckwalla,1276558,DN5 0JP,53.555372609213400,-1.150432778106180
Vole and black snake,1278574,DN4 0TH,53.506997222740800,-1.151912820524800
glass snake and Mouse,1283780,DN3 1FE,53.564975800000800,-1.079200827059360
Hawk and Myna,1294174,DN1 9SY,53.520010916083200,-1.132844868539990
Kākāriki and chameleon,1276315,DN5 8LU,53.531513000000000,-1.157322000000000
Vulture and Francolin,1274849,DN7 4HE,53.569914578616200,-1.017543594657290
Rabbit and Old World warbler,1275020,DN7 5BY,53.601315461165000,-1.027877098743690
Kangaroo and Old World warbler,1274408,DN8 4PZ,53.628865924697700,-0.946116174135743
diamondback turtle and asp,1283498,DN3 3FD,53.541936000000000,-1.035515000000000
diamond python and Vulture,1290738,DN14 8RL,53.700052052924000,-0.963212428999238
Tree warbler and Nukupuʻu,1292026,DN14 0QQ,53.696165484400000,-1.118885051381080
New World blackbird and Recurvebill,1287433,DN2 4HJ,53.538301872977800,-1.113096672291390
moloch and massasauga,1274278,DN8 4EE,53.619169002579400,-0.957620803037560
taipan and Kite,1291396,DN14 7TT,53.719666450770600,-0.800547560391684
leathery turtle and Goose,1274777,DN7 5RQ,53.598619000000000,-1.032200000000000
Lemming and python,1294467,DN1 1TF,53.523222166636800,-1.135645238791720
Kite and gecko,1278458,DN4 0LE,53.513882000000000,-1.141581000000000
Quetzal and Hawk,1276529,DN5 0EX,53.555664000000000,-1.148122266583670
agamid and chuckwalla,1277665,DN4 8BQ,53.507836295924700,-1.145124000000000
Vulture and loggerhead,1287522,DN2 4RY,53.548046226744400,-1.083371626211530
death adder and wall lizard,1273443,DN9 2BN,53.517955899026400,-0.922144251744734
ringhals and anole,1274892,DN7 4LJ,53.580668377829100,-1.013578618247540
cobra de capello and habu,1273773,DN9 1SF,53.523524839141400,-0.812566091636998
Peafowl and blindworm,1291889,DN14 5PH,53.721798182383100,-0.847407648257209
Grackle and deaf adder,1294404,DN1 3PE,53.522189376994900,-1.130809370395230
Snipe and water snake,1291920,DN14 5RR,53.694798927709200,-0.874150058525673
Flameback and Boto,1291086,DN14 8HF,53.689122623769600,-0.793359343117717
habu and Macaw,1274132,DN7 6SP,53.578376425921300,-1.007076978418800
Darwin's finches and boa constrictor,1291988,DN14 0QJ,53.697616437881400,-1.116824000000000
Warbler and massasauga,1278620,DN4 5AR,53.515585261112700,-1.122544287599180
coral snake and Lemming,1291979,DN14 0PW,53.704653570590900,-1.146506000000000
Grackle and Chicken,1274514,DN7 6LY,53.573001031412500,-0.984565363685639
bushmaster and New World blackbird,1291477,DN14 6YG,53.714846539748700,-0.860204737792440
agamid and Vole,1291645,DN14 6EA,53.709570534785600,-0.877376833171292
chameleon and jew lizard,1278615,DN4 5AE,53.514115719660100,-1.126857540473200
