name,postcode,lat,lon
Minke whale and Old World quail,DN14 7XU,53.716248877927800,-0.712027723827352
Masked owl and puff adder,DN15 0AG,53.622223276613100,-0.564070819789657
goanna and green turtle,DN15 0BE,53.615441790343100,-0.634629000000000
amethystine python and skink,DN15 5FJ,53.585903000000000,-0.654589000000000
Darwin's finches and turtle,DN15 5FQ,53.585903000000000,-0.654589000000000
bearded lizard and Gull,DN15 6DB,53.596513251579600,-0.653551000000000
Puffleg and goanna,DN15 6EP,53.591270064134500,-0.648642407956806
Darwin's finches and Warbler,DN15 6HB,53.591840205938300,-0.648186055890518
Shearwater and racer,DN15 6JB,53.593103196856400,-0.652572820073419
sand viper and Kite,DN15 6LP,53.591147553226800,-0.649734148440481
fer-de-lance and Komodo dragon,DN15 6NT,53.589735082689300,-0.649628091243811
Fulmarine petrel and Condor,DN15 6NU,53.589522364123300,-0.650692446116678
rattlesnake and Wader,DN15 6QD,53.589462000000000,-0.650014000000000
brown snake and Capuchin,DN15 6QP,53.588823256132500,-0.647318000000000
Towhee and horned viper,DN15 6RA,53.591396874299500,-0.646341814215797
Gull and diamondback,DN15 6SG,53.593907146493200,-0.646548668113035
Rat and caiman,DN15 6SH,53.593972368546900,-0.645957302026342
Condor and Goose,DN15 7AB,53.586063149218200,-0.657223079298964
blue tongue and dugite,DN15 7AN,53.585475910877100,-0.661773711914248
rattlesnake and Scimitar babbler,DN15 7BP,53.588580202950700,-0.663336000000000
Polecat and Linsang,DN15 7EL,53.588728876053800,-0.685042000000000
constrictor and agamid,DN15 7HT,53.587614766680700,-0.673837454039300
kabaragoya and taipan,DN15 7PG,53.588278000000000,-0.653467000000000
Pratincole and slowworm,DN15 7QJ,53.590167249929200,-0.653678479240645
milk snake and B,DN15 7RJ,53.591411918039800,-0.662870426556845
pit viper and tuatara,DN15 7RS,53.595495022706800,-0.663058829605561
Kestrel and Peafowl,DN15 7RU,53.595653766799800,-0.661980982685571
blue tongue and Quetzal,DN15 7SA,53.595457529258400,-0.658904682792179
Civet and Chickadee,DN15 7SD,53.597884185934100,-0.659674057630806
brown snake and Stilt,DN15 7UH,53.587443247799700,-0.690914178712749
indigo snake and Fox,DN15 7UN,53.586155120720800,-0.690666950807047
Wallaby and Ice seal,DN15 8AJ,53.594824489808400,-0.678764227466886
monitor and krait,DN15 8BF,53.625634139965100,-0.684697457181373
hoop snake and Asiatic leopard,DN15 8BG,53.591773632315800,-0.688242046058420
blind snake and agamid,DN15 8BT,53.594871673958100,-0.676526467577715
Darwin's finches and Stint,DN15 8GN,53.602120178231600,-0.652663695591939
carpet snake and Shearwater,DN15 8LL,53.602319360693600,-0.667241155235125
Wallaby and rattlesnake,DN15 8LQ,53.597583512179700,-0.668869000000000
dugite and tree snake,DN15 8PL,53.604060673433800,-0.681619579110402
king cobra and Jackal,DN15 8TR,53.594658555032500,-0.723644000000000
Black jay and Masked owl,DN15 8XF,53.603422097270900,-0.649327000000000
python and sea snake,DN15 8XU,53.592302111135200,-0.684795908713660
wall lizard and Pitohui,DN15 8YL,53.601760000000000,-0.682371000000000
turtle and Skunk,DN15 9DP,53.649599847750700,-0.685494000000000
leathery turtle and bushmaster,DN15 9DX,53.649204682925100,-0.682587205014899
Shearwater and Recurvebill,DN15 9EG,53.651767368888900,-0.677771510887777
American sparrow and Badger,DN15 9JE,53.685609877499700,-0.666505000000000
green turtle and wall lizard,DN15 9LD,53.686673000000000,-0.664646000000000
worm lizard and grass snake,DN15 9LJ,53.707794415420800,-0.635245608863599
Bronzewing pigeon and Diving bird,DN15 9NF,53.685081133873200,-0.591128120662906
gopher snake and frill-necked lizard,DN15 9NH,53.687068986254700,-0.595831877839522
brown snake and Treepie,DN15 9NY,53.690843481881200,-0.599598442282332
bearded dragon and White ibis,DN15 9QG,53.655525038378200,-0.595684883657913
gavial and soft-shelled turtle,DN15 9RP,53.653392935339200,-0.596707000000000
Jay and Dolphin,DN15 9RU,53.652922734594300,-0.601445469572687
Masked owl and Marsh harrier,DN15 9SP,53.651891016283400,-0.607789062210432
ringhals and bull snake,DN15 9ST,53.653409639383900,-0.610840910112288
Warbler and ringhals,DN15 9TN,53.652851517062900,-0.609996794741250
Shearwater and rattlesnake,DN15 9UY,53.659364207678300,-0.599597861352178
bandy-bandy and Bunting,DN15 9XD,53.653728870108200,-0.611360000000000
hawksbill and Mockingbird,DN15 9XS,53.656934903870200,-0.604021371537215
Tattler and thorny devil,DN16 1AR,53.580838542996600,-0.627556149945125
Elephant and Old World quail,DN16 1AW,53.570555740462700,-0.615309480189320
Greenbul and gavial,DN16 1ER,53.583276000000000,-0.640332000000000
gavial and Linsang,DN16 1ES,53.581618688306100,-0.639373425487986
Old World warbler and giant tortoise,DN16 1HJ,53.577299235638000,-0.634225763217902
Perching duck and Grouse,DN16 1HL,53.576934634868400,-0.633784401594779
gaboon viper and Elephant,DN16 1LD,53.583755495382000,-0.650256760200333
diamond python and Fulmarine petrel,DN16 1PU,53.574473448723000,-0.637095751311264
blind snake and Vole,DN16 1QG,53.577176003234600,-0.638398387972989
Old World quail and Viscacha,DN16 1RA,53.570361434915000,-0.632017987080457
Flameback and horned toad,DN16 1RW,53.568937199425800,-0.629315586727173
kabaragoya and sidewinder,DN16 1SA,53.570183367168200,-0.625892590996794
viper and swift,DN16 2AF,53.566258803879400,-0.645921499140994
cobra de capello and Chickadee,DN16 2BA,53.570156358557800,-0.653559061477054
Grosbeak and indigo snake,DN16 2BL,53.573637900535200,-0.652210056266246
flying lizard and Jackal,DN16 2DY,53.571500424527900,-0.646010788611512
Ground sloth and Chickadee,DN16 2ER,53.574191957850400,-0.646347681364966
leguaan and Old World quail,DN16 2HL,53.572221020949500,-0.642967362904897
brown snake and Old World vulture,DN16 2HQ,53.571741693606400,-0.644296571149738
krait and Thrasher,DN16 2NJ,53.567475062140600,-0.634300681895648
asp and Bunting,DN16 2NQ,53.567971661901100,-0.635281319134570
Zebra and Meadowlark,DN16 2RH,53.568669157835100,-0.643654896908378
gaboon viper and Partridge,DN16 2RT,53.567864650471900,-0.654401973246613
diamondback turtle and Duck,DN16 2RZ,53.565233074022100,-0.651405191990509
bandy-bandy and Night heron,DN16 2TE,53.567149692721400,-0.645213533785583
Macaw and chameleon,DN16 2UJ,53.564973875561900,-0.652334502450631
Fox and box turtle,DN16 3BS,53.563040854736400,-0.636436550214892
cobra de capello and cerastes,DN16 3DL,53.565685276922200,-0.642904776161687
Kite and horned viper,DN16 3DW,53.565596600772700,-0.641427846238764
Francolin and Night heron,DN16 3GN,53.559010352235600,-0.632988082486403
Zebra and Stilt,DN16 3GT,53.558909282808400,-0.628869773190988
puff adder and Tahr,DN16 3JF,53.561194753751900,-0.652801870145339
gopher snake and Dolphin,DN16 3JT,53.558450707984700,-0.649401610594968
diamondback terrapin and racer,DN16 3LA,53.558283509586400,-0.648923829609781
tortoise and Hawk,DN16 3PL,53.554885000000000,-0.650361000000000
Black jay and coral snake,DN16 3QH,53.557770016141500,-0.647234241529658
Kākāriki and diamondback,DN16 3SB,53.557091261002400,-0.644447917048804
gavial and Cuscus,DN16 3SG,53.550532088332100,-0.651857511336294
Flameback and Perching duck,DN16 3ST,53.551241762284500,-0.647834900572554
horned viper and Kangaroo,DN17 1BP,53.583276325781300,-0.659607506650780
diamondback terrapin and Skunk,DN17 1DB,53.577186785020200,-0.660857385119642
Treepie and Tree warbler,DN17 1DP,53.575033109610900,-0.659444000000000
worm lizard and Parrotlet,DN17 1ET,53.569917037877100,-0.661872317117123
Myna and Nukupuʻu,DN17 1HG,53.568795972805200,-0.665320480818003
leathery turtle and Solitaire,DN17 1HS,53.568597770541600,-0.657247839923442
giant tortoise and perentie,DN17 1JD,53.569360541742400,-0.657933425309845
anaconda and Guillemot,DN17 1NB,53.567259523882900,-0.669415713090109
Flameback and Parrotlet,DN17 1PA,53.573237241734500,-0.675087772568215
thorny devil and gecko,DN17 1QT,53.568795530000900,-0.681493409882888
skink and diamondback,DN17 1RY,53.568692664959300,-0.678687876745910
copperhead and Partridge,DN17 1TL,53.577859370775100,-0.676060964172256
Scimitar babbler and grass snake,DN17 1UA,53.579213518820400,-0.683102650509185
Tree warbler and puff adder,DN17 1UJ,53.576406000000000,-0.682695995150883
viper and king cobra,DN17 1YL,53.578608431321000,-0.677955802042512
Booted eagles and agama,DN17 2AA,53.565140000000000,-0.689821000000000
flying dragon and grass snake,DN17 2DP,53.563923554153200,-0.663677078115647
Treepie and king snake,DN17 2EY,53.564313241668400,-0.675276058467044
Piping shrike and rock python,DN17 2GG,53.552852430351400,-0.670937000000000
cerastes and Magpie,DN17 2HH,53.561986251502200,-0.672948123716527
Buzzard and Schneider python,DN17 2HY,53.562209000000000,-0.667054040230129
Puffleg and blindworm,DN17 2JD,53.562600723082400,-0.668384226242862
rattlesnake and terrapin,DN17 2JE,53.561456323411000,-0.668133299994270
adder and Pheasant,DN17 2JF,53.562572249562200,-0.669864778495827
horned viper and ringhals,DN17 2LN,53.561286184344900,-0.656935849916583
Hawk and lizard,DN17 2LW,53.559613592956400,-0.659283647035321
copperhead and sidewinder,DN17 2PJ,53.556130704410300,-0.662126177004657
Grouse and Parrotbill,DN17 2QA,53.555551082384100,-0.664152237202926
Guillemot and Skunk,DN17 2QF,53.553419000000000,-0.665632857132913
Egret and sea snake,DN17 2QU,53.556984309572500,-0.658883678268976
Greenbul and Old World quail,DN17 2RU,53.551506340793800,-0.676310021171456
Myna and Viscacha,DN17 2SF,53.558011286555700,-0.668739694854526
Marsh harrier and Boto,DN17 2SW,53.554721777639200,-0.668782563877503
Flameback and Chicken,DN17 2UJ,53.549742882779500,-0.662536000000000
Thicketbird and Marsh harrier,DN17 2WY,53.585976661147100,-0.654585000000000
Rabbit and blue tongue,DN17 3DD,53.586400915882600,-0.738654183236091
cobra and Pratincole,DN17 3DR,53.587755352280300,-0.740940396501183
hognose snake and Black jay,DN17 3HS,53.577042565061900,-0.740276948790170
Boto and goanna,DN17 3HT,53.576431011549900,-0.742952000000000
boomslang and moloch,DN17 3JY,53.541289868242700,-0.741640348195478
Mouse and Herring gull,DN17 3JZ,53.542224745262500,-0.744208307989843
Jackal and Grackle,DN17 3PH,53.525940459316200,-0.651280780198505
perentie and Dorcopsis,DN17 3RH,53.526094616668800,-0.612250000000000
horned viper and Cuscus,DN17 3SD,53.530887859960000,-0.656373979248671
saltwater crocodile and Gull,DN17 3UU,53.526479803985600,-0.659274171418678
bearded lizard and Parrotbill,DN17 3UY,53.526479503777100,-0.657644922352089
Schneider python and agamid,DN18 5AL,53.687125747061100,-0.450953365447400
Polecat and Solitaire,DN18 5AU,53.689685878743100,-0.447345881575264
Snipe and Bunting,DN18 5BD,53.696011313623200,-0.443779000000000
coral snake and American sparrow,DN18 5DS,53.679040661435700,-0.443028684092947
Boto and amethystine python,DN18 5DZ,53.675987372017400,-0.445336513374483
Chickadee and Magpie,DN18 5ER,53.684262227449600,-0.439489584510291
Night heron and sidewinder,DN18 5EW,53.688180134115200,-0.452550205327630
wall lizard and king cobra,DN18 5EX,53.683681987713100,-0.437042839776406
Flameback and carpet snake,DN18 5GT,53.683291040748600,-0.425594759157072
frill-necked lizard and terrapin,DN18 5HP,53.685389451745100,-0.434378000000000
Hawk and Bunting,DN18 5LQ,53.682541108208600,-0.450243385836942
Quetzal and Linsang,DN18 5PA,53.684945071621500,-0.439464338249859
bearded dragon and Thrasher,DN18 5PQ,53.686090836554100,-0.441163439120680
habu and fer-de-lance,DN18 5QP,53.685890840941300,-0.439611086556495
Kite and bicycle lizard,DN18 5SA,53.690625120009800,-0.440072113144507
Towhee and Mockingbird,DN18 5TD,53.677593036998100,-0.452014733422479
cobra de capello and diamondback,DN18 5TS,53.694271799062200,-0.441921434197168
puff adder and loggerhead,DN18 6BW,53.676360385155900,-0.430516166877177
Maya and Vole,DN18 6DB,53.681687786075200,-0.417977672481052
deaf adder and Bunting,DN18 6HQ,53.675650978160800,-0.507934965084263
Kite and fer-de-lance,DN18 6HX,53.669287267736100,-0.507978156509546
Tahr and Cloud rat,DN19 7AT,53.700203000000000,-0.370778000000000
Shearwater and Mink,DN19 7BX,53.673965595387300,-0.379617379173257
diamondback terrapin and Argus,DN19 7DH,53.670877223373300,-0.384564859546973
Crow and Grackle,DN19 7DN,53.673610372253800,-0.383930436239194
perentie and blindworm,DN19 7HA,53.695333640064500,-0.403773558652193
Gila monster and sand lizard,DN19 7HG,53.674302000000000,-0.384479000000000
Recurvebill and Boto,DN19 7QA,53.695433709641500,-0.362570882771195
green turtle and boa constrictor,DN19 7QZ,53.699101048019400,-0.360580475973999
Piping shrike and Duck,DN19 7RG,53.699988000000000,-0.358940000000000
gaboon viper and chuckwalla,DN19 7RR,53.702499000000000,-0.361176000000000
New World blackbird and Triller,DN19 7RT,53.704379000000000,-0.362602000000000
Condor and anole,DN19 7RW,53.700283441338900,-0.362246296377689
cobra and mud turtle,DN19 7SJ,53.676608000000000,-0.386147000000000
python and Treepie,DN19 9AG,53.688491000000000,-0.426587000000000
hognose snake and Bronzewing pigeon,DN20 0AD,53.564980367331300,-0.549883948247931
Minke whale and Diving bird,DN20 0AS,53.569858972852200,-0.557856688983980
hawksbill and Logrunners,DN20 0DA,53.571185674823300,-0.537559969759741
monitor and green turtle,DN20 0DQ,53.566107000000000,-0.556716000000000
Mouse and Logrunners,DN20 0DR,53.567517527638800,-0.550808895337029
caiman and Boto,DN20 0DY,53.568308916369400,-0.552322123681730
Lemming and Warbler,DN20 0EU,53.573030028446800,-0.544322669194358
leathery turtle and Macaw,DN20 0EW,53.569456000000000,-0.548236000000000
leguaan and elapid,DN20 0HJ,53.571387521727300,-0.543790104510233
bearded lizard and ringhals,DN20 0HU,53.569809047850200,-0.548525754629095
Francolin and White ibis,DN20 0JR,53.565346695179000,-0.554899637841242
Polecat and brown snake,DN20 0LF,53.562424307467800,-0.556312831104367
skink and gecko,DN20 0LH,53.566305301056500,-0.546576000000000
diamond python and dukite,DN20 0LX,53.609671189850300,-0.466698445221003
Mouse and pit viper,DN20 0NN,53.609122552604100,-0.464571911830137
Egret and Tit-tyrant,DN20 0NU,53.612986712487500,-0.428468433105542
Fulmarine petrel and Ibex,DN20 0QA,53.634909000000000,-0.503217000000000
diamondback terrapin and goanna,DN20 0QE,53.636640715055900,-0.501643341719937
anole and Eagle,DN20 0QZ,53.592113000000000,-0.444186000000000
amphisbaena and Myna,DN20 8AS,53.553619738250700,-0.491867352650548
Kangaroo and Perching duck,DN20 8DJ,53.552811836876000,-0.482008576648809
River dolphin and Wallaby,DN20 8DY,53.555385000000000,-0.477871000000000
Fox and Booted eagles,DN20 8EX,53.552549121534100,-0.492509234321574
crocodile and box turtle,DN20 8HR,53.550741258431500,-0.484603493273715
Fulmarine petrel and tokay,DN20 8LS,53.550505000000000,-0.494982000000000
chuckwalla and boomslang,DN20 8NS,53.551674485782900,-0.494939000000000
Bunting and Skunk,DN20 8QB,53.561016637012800,-0.487497518672930
thorny devil and kabaragoya,DN20 8RE,53.560885169651300,-0.471497993600082
Mamo and diamondback terrapin,DN20 8RY,53.565868478432800,-0.460536837224541
Stilt and adder,DN20 8SG,53.570475943001200,-0.471439087433572
terrapin and Solitaire,DN20 8SW,53.562984000000000,-0.456384000000000
Kestrel and adder,DN20 8TB,53.569524957751700,-0.461068502462827
rattlesnake and worm lizard,DN20 9DG,53.531279630102700,-0.535842231370937
horned viper and mamba,DN20 9EW,53.535377099548100,-0.534779000000000
Triller and Grouse,DN20 9GE,53.513213574198400,-0.530900069299256
lizard and perentie,DN20 9NH,53.518103432060900,-0.559855000000000
gecko and kabaragoya,DN20 9NL,53.505130845030000,-0.529324916366388
snake and Bronzewing pigeon,DN20 9QL,53.511766641252300,-0.530196074973742
Masked owl and smooth snake,DN20 9RB,53.552238443152200,-0.504279435497201
Guillemot and Grosbeak,DN20 9RQ,53.517942120973600,-0.532380540005061
Macaw and glass snake,DN38 6AA,53.598004796261400,-0.392167107646497
Recurvebill and crocodile,DN39 6RQ,53.619553088318900,-0.364375185737763
constrictor and Polecat,DN39 6SQ,53.630888066737000,-0.357116093731841
Grackle and horned toad,DN39 6XL,53.655135000000000,-0.352012000000000
dukite and Recurvebill,HU10 6WT,53.720624322937000,-0.429262569244978
Mole and sea snake,HU10 7WG,53.720624322937000,-0.429262569244978
elapid and adder,HU10 9BB,53.720652000000000,-0.429221000000000
Elephant and Stint,HU13 0AE,53.723409070615300,-0.434496000000000
Gull and White ibis,HU13 0AP,53.722198380393600,-0.430022344547514
Argus and crocodile,HU13 0AZ,53.721639159486200,-0.433998880202345
Solitaire and moloch,HU13 0BD,53.720610427472800,-0.437825995114354
Bronzewing pigeon and blindworm,HU13 0JB,53.719416342951400,-0.460860572752557
Nukupuʻu and brown snake,HU13 0SF,53.724332572849900,-0.438567137089935
Flameback and tokay,HU13 0SP,53.724275697684500,-0.436962612895744
Stilt and habu,HU13 0SY,53.722134764706700,-0.436844976219898
Myna and milk snake,HU13 9NN,53.724823244744700,-0.419087222430848
indigo snake and ringhals,HU14 3AJ,53.718723091288900,-0.504789356619155
coral snake and goanna,HU14 3BG,53.721408486223600,-0.510377497812521
Fulmarine petrel and Duck,HU14 3BX,53.719783988511800,-0.504084901013361
gavial and frilled lizard,HU14 3DL,53.717211729289700,-0.508298120021369
Siskin and wall lizard,HU14 3LQ,53.721491157714900,-0.473379311130964
Marmoset and anaconda,HU14 9AD,53.720624322937000,-0.429262569244978
loggerhead and Minke whale,HU14 9BD,53.720652000000000,-0.429221000000000
garter snake and Bunting,LN7 6JX,53.518549000000000,-0.414955896218216
