name,id,postcode,lat,lon
Songlark and jew lizard,367317,SG8 5JB,52.080629516201100,-0.044796039678684
Warbler and Thrasher,369116,SG5 3RG,51.972329495530200,-0.332276650614696
Maya and Kākāriki,370317,SG4 7SW,51.935928803985000,-0.265532789703866
flying lizard and Meadowlark,367419,SG8 0HF,52.120860461639000,-0.070541675629389
Grosbeak and indigo snake,370796,SG4 0AW,51.959619000000000,-0.267093000000000
milk snake and bearded dragon,368187,SG6 4DE,51.981002765249100,-0.238163898450696
Condor and jew lizard,788344,MK44 3RD,52.129677000000000,-0.333204740129493
diamond snake and kabaragoya,1488854,CB23 1JL,52.148665771469800,0.053353116773739
Vulture and leathery turtle,366829,SG8 5JS,52.071174218064300,-0.033156724799760
tortoise and Crow,2664345,SG18 8YN,52.083321000000000,-0.245293000000000
elapid and White ibis,370490,SG4 0QY,51.951233904698500,-0.257084270910848
rock python and Tree warbler,1489121,CB22 7NP,52.138345329130100,0.073775705602472
Flameback and gopher snake,366745,SG8 6EU,52.086899352217600,0.029000742429033
Black jay and green turtle,372374,SG18 9JU,52.072536404407800,-0.267772674440678
Thicketbird and diamondback terrapin,365895,SG9 9NU,51.939572441881800,-0.015218749019597
