name,id,postcode,lat,lon
Guillemot and horned toad,367698,SG7 6PT,51.980994745986100,-0.183776487172670
hoop snake and fer-de-lance,368774,SG6 1NH,51.980641243355600,-0.224271863420944
sea snake and Old World warbler,367216,SG8 5BT,52.050708129884400,-0.034201509895785
frill-necked lizard and Herring gull,366267,SG8 9UA,52.041867000000000,-0.019526000000000
leguaan and Black cockatoo,367584,SG7 6HN,51.983581725725600,-0.188273596575459
Francolin and elapid,372325,SG18 9DW,52.097619016245200,-0.294642349564821
Jay and chameleon,367327,SG7 6TB,51.992024891206700,-0.172551872051850
Parrotbill and Francolin,375965,SG1 6GR,51.933919236475800,-0.173109914152595
Skunk and diamond python,1810391,SG5 4QZ,52.012556000000000,-0.229741000000000
Mouse and Towhee,373094,SG18 0BG,52.090613139400500,-0.263744481633562
Badger and sand lizard,373481,SG16 6FE,52.003978857726900,-0.300738884843320
Badger and Mole,366290,SG9 0AB,51.949597000000000,0.011446000000000
Tattler and cobra de capello,372021,SG19 2EZ,52.111488180780300,-0.170182756792503
Rat and Meadowlark,367196,SG8 5AQ,52.051493000000000,-0.026180065861501
Grosbeak and loggerhead,372118,SG19 2PW,52.127189770075500,-0.217282807045267
River dolphin and milk snake,371754,SG19 2RS,52.125573180236200,-0.207325724355868
milk snake and Wader,369546,SG5 2BE,51.945758334653700,-0.288986667563338
Old World quail and Cuscus,370611,SG4 7DJ,51.953731905324600,-0.158333925454429
Recurvebill and Komodo dragon,369719,SG5 1DX,51.950780700780100,-0.276382899041777
anaconda and Hawk,367447,SG7 6AX,51.988282000000000,-0.188011000000000
Badger and tokay,368585,SG6 2LJ,51.971823991184600,-0.213221039320835
Condor and dukite,366744,SG8 6ET,52.085694316649800,0.026917203615547
diamondback turtle and blind snake,366717,SG8 8BS,52.005597000000000,0.017395000000000
puff adder and cerastes,1489201,CB22 7SA,52.127770000000000,0.029980000000000
garter snake and Pitohui,369641,SG4 9RU,51.947522480678200,-0.268810511765275
lizard and boomslang,369784,SG5 1NB,51.950211983534300,-0.276230086777074
leguaan and alligator,366352,SG8 8EZ,51.989507000000000,0.019672000000000
sand viper and python,369718,SG5 1DW,51.947536192096100,-0.277714998457162
Magpie and Chipmunk,367512,SG8 0NT,52.050950337612500,-0.115617029995883
ringhals and habu,369880,SG4 9DN,51.940795249779300,-0.271775530631612
cobra and Badger,366776,SG8 6HY,52.083004393760300,0.021759926366378
Stint and Stint,368700,SG6 1FR,51.982066421568700,-0.216832582178528
flying dragon and tuatara,367598,SG7 6JG,51.978706199574700,-0.189314844187373
Petrel and Old World vulture,368505,SG6 3NA,51.964053291327200,-0.242480000000000
thorn lizard and Snipe,369636,SG4 9RJ,51.948157755276700,-0.266864000000000
coral snake and Eagle,367107,SG8 6BJ,52.079101508923700,0.016008623686797
milk snake and Hawk,368753,SG6 1JH,51.983295804392700,-0.210740368424722
Jay and Coati,376653,SG1 3XZ,51.931919580194000,-0.183344100684592
Mockingbird and fer-de-lance,366584,SG8 7LH,52.049985673879100,-0.009381306805814
boa and Stint,2591615,SG18 0PN,52.097843000000000,-0.251352000000000
Tahr and Boto,367983,SG6 4TN,51.988925130183900,-0.222647975301869
whip snake and slowworm,367053,SG8 5TT,52.051607849756500,-0.033155654525503
Macaw and indigo snake,372328,SG18 9EA,52.085577000000000,-0.325139000000000
Zebra and Gila monster,370453,SG4 0PB,51.956511820446200,-0.247376078660479
anole and Night heron,368904,SG5 4GS,52.012069000000000,-0.224864000000000
loggerhead and kabaragoya,373397,SG16 6DP,52.008179839385000,-0.303989207683732
death adder and blue racer,368572,SG6 2JT,51.974340323611400,-0.210762297096012
Cloud rat and garter snake,369587,SG5 2HE,51.948668858000500,-0.285703773414590
king snake and death adder,368243,SG6 2RS,51.968688090826300,-0.202733243844767
Moluccan boobook and Magpie,366219,SG9 9AH,51.948618540595100,-0.019870000000000
Cuscus and thorny devil,367629,SG6 9SA,51.976891278399400,-0.228424220728661
rock python and king snake,373189,SG17 5EL,52.039668989015200,-0.301529093105780
Jerboa and New World blackbird,1489193,CB22 7RJ,52.128851000000000,0.040286000000000
galliwasp and elapid,376440,SG1 4PL,51.926176523469300,-0.174224253797783
cayman and amphisbaena,373351,SG16 6AB,52.032855573590700,-0.286159326648636
indigo snake and Ice seal,368974,SG5 4NQ,52.014824597067300,-0.225250309458984
king cobra and Towhee,365867,SG9 9LH,51.925554000000000,-0.008231000000000
B and rock python,367793,SG7 5LG,52.044394522552000,-0.147317897711769
hognose snake and rock python,369579,SG5 2EU,51.951097021089500,-0.307731000000000
Perching duck and boomslang,366217,SG9 9AF,51.950147462733900,-0.021649477057986
terrapin and dugite,368289,SG6 4HN,51.986427351054000,-0.234732518552257
bicycle lizard and bearded dragon,372055,SG19 2JP,52.126760143048000,-0.215035539190333
glass snake and Macaw,376431,SG1 4NZ,51.926209197003000,-0.176331801995324
Bunting and blindworm,365842,SG9 9JA,51.940916944387000,-0.012831552261352
ringhals and blindworm,369609,SG5 2JQ,51.950630740693000,-0.287055018938705
mountain devil and Triller,372766,SG18 0LJ,52.086838233297800,-0.261409689613229
diamondback turtle and B,367471,SG8 0JF,52.081445094673500,-0.132794876740488
Darwin's finches and perentie,372776,SG18 0LX,52.089020201827500,-0.256945863996079
Scimitar babbler and Buzzard,367233,SG7 6RX,51.991327537769600,-0.172230703034231
diamondback turtle and grass snake,2655212,MK44 3FE,52.145928000000000,-0.326230000000000
death adder and snapping turtle,367495,SG8 0LT,52.066162059435400,-0.120535328059119
Triller and glass snake,1810520,SG8 8DF,52.005205000000000,0.017698000000000
Fish eagle and Goose,372688,SG18 9AF,52.105007000000000,-0.321302053028763
Grosbeak and cerastes,368892,SG5 4GA,51.998795637785000,-0.251318951089869
Mink and coral snake,368742,SG6 1HN,51.988992000000000,-0.202663000000000
rattlesnake and Capuchin,366570,SG8 7JP,52.054121557381300,-0.008293133933048
B and hoop snake,365843,SG9 9JB,51.941249602494100,-0.017094300339330
adder and chuckwalla,373122,SG18 0DU,52.091985242542900,-0.260450530612918
blue tongue and habu,366374,SG8 8JP,52.026133000000000,0.040447000000000
boa and Goose,365905,SG9 9PG,51.936173147322000,-0.028577904492246
loggerhead and agama,371759,SG19 2RZ,52.140935701183300,-0.298702143921126
anaconda and giant tortoise,372773,SG18 0LT,52.089565856523000,-0.257362506209610
Jackal and crocodile,369903,SG4 9ET,51.939949568704300,-0.273582914292839
cobra and hawksbill,369544,SG5 2BB,51.945007994324200,-0.288709675392517
horned toad and thorny devil,370813,SG4 0DH,51.953594761579600,-0.262289895524600
whip snake and tokay,368476,SG6 2BA,51.967106060065500,-0.205125680106641
diamondback turtle and Thicketbird,368550,SG6 2GA,51.962072000000000,-0.216906979030718
tree snake and gopher snake,367626,SG6 9EU,51.981444000000000,-0.209504000000000
Moluccan boobook and water snake,367097,SG8 6AT,52.077981281092200,0.012105418156832
Perching duck and python,366343,SG8 8EL,51.997091665801400,0.019328812192535
goanna and Logrunners,368157,SG6 4AA,51.981539743775500,-0.232594794082147
cobra de capello and python,367106,SG8 6BH,52.078144110846900,0.017308104972892
Cuscus and sea snake,372716,SG18 9BU,52.094782873898200,-0.299860000000000
Maya and Mamo,367917,SG7 5RS,52.030761933678900,-0.111013775564602
Petrel and alligator,366554,SG8 7HG,52.048080261431100,-0.016364155837273
Bronzewing pigeon and B,368745,SG6 1HR,51.990106340099100,-0.202913000000000
Crow and diamond snake,368659,SG6 1DA,51.987793293545500,-0.218556660813771
Wader and blue racer,1489120,CB22 7NN,52.137417599706400,0.074375592269746
Argus and Dorcopsis,373713,SG15 6RX,52.002807239447400,-0.264172395310863
Magpie and habu,373103,SG18 0BW,52.091646752380800,-0.263105855341416
loggerhead and frill-necked lizard,365778,SG9 9EJ,51.947335603083600,-0.025556515794447
racer and Grackle,372233,SG18 9DS,52.084867973911600,-0.301419040889653
cycling lizard and sand viper,369435,SG5 1RL,51.953875195076500,-0.267126000000000
saltwater crocodile and garter snake,367773,SG7 5HY,52.040446940086500,-0.169163184709243
Rat and taipan,375934,SG1 6BX,51.930990793607100,-0.164050628668536
Armadillo and Masked owl,365947,SG9 0EU,51.969774845194700,0.022409760307542
Bronzewing pigeon and B,370342,SG4 0HS,51.955772745312600,-0.262423987436902
Songlark and Tattler,366347,SG8 8ER,51.997271527131300,0.014602505225205
Tattler and Polecat,1810286,SG18 9PY,52.060851360200000,-0.271125000000000
Maya and Logrunners,369335,SG5 2UY,51.963726650158600,-0.287327263139390
agamid and frill-necked lizard,366777,SG8 6HZ,52.082173974116600,0.022992164059426
dugite and boa constrictor,368960,SG5 4LQ,52.014687608975400,-0.229292327487086
ringhals and mud turtle,371949,SG19 1UP,52.130443950319000,-0.285134490767741
Ibex and Puffleg,366204,SG8 9PR,52.020727868466400,-0.054711423654724
Scimitar babbler and Lemming,366762,SG8 6HE,52.084399643937000,0.024815125196994
horned toad and Myna,1488869,CB23 1LG,52.148692202356400,0.054932956141224
Solitaire and horned toad,367396,SG8 0DX,52.130227428238800,-0.084177732248335
Partridge and Philippine hawk-owl,366188,SG8 9NG,52.044236246848300,-0.011299227900452
blindworm and leathery turtle,366936,SG8 5LX,52.093228000000000,-0.043574000000000
wall lizard and Cloud rat,366997,SG8 5RD,52.143833618913900,-0.001924748882345
Hawaiian honeycreeper and Stilt,371971,SG19 2AQ,52.149615661500100,-0.297055808997782
Scimitar babbler and Fulmarine petrel,367649,SG7 5AZ,51.988738309656500,-0.195580604761515
Mockingbird and Vole,366083,SG9 0RQ,51.983592219837300,-0.065145980538010
giant tortoise and asp,372299,SG19 1QB,52.131607794684700,-0.284169334404677
gopher snake and Francolin,370592,SG4 7BA,51.955933039724000,-0.173219381352045
snake and Partridge,367709,SG7 6QN,51.990043039507700,-0.188027379962938
snake and Rabbit,366018,SG9 9RD,51.957656000000000,-0.069800000000000
slowworm and Partridge,2580244,SG17 5GT,52.034638000000000,-0.305525000000000
dukite and Logrunners,1810339,SG4 0BF,51.959801610600000,-0.261133015300000
Scimitar babbler and Recurvebill,367722,SG7 6RH,51.968318914847800,-0.155028233173735
Guillemot and Tit-tyrant,367619,SG7 6LR,51.979704331559600,-0.183479210945327
gecko and Snipe,373120,SG18 0DS,52.091973203121800,-0.257808819702000
racer and grass snake,366630,SG8 6DR,52.077638854124300,0.012148392531458
Egret and Logrunners,368818,SG6 1RG,51.978119161095100,-0.212096930413719
Cuscus and cycling lizard,369922,SG4 9HS,51.943119658415400,-0.267190472917590
Grouse and Mockingbird,371938,SG19 1TQ,52.136977777923100,-0.293607128490213
Fish eagle and lizard,366062,SG9 0QN,51.989862280106900,-0.081246532513611
sand viper and death adder,370610,SG4 7DH,51.955683948154400,-0.168761578715665
Pheasant and anole,368390,SG6 3HH,51.974176018920300,-0.234427877090247
Fish eagle and Fox,372897,SG18 8DE,52.082184647300100,-0.262904039376828
anole and Jerboa,373410,SG16 6EF,52.001037607831900,-0.318841706129756
Chicken and deaf adder,367776,SG7 5JD,52.047692992816900,-0.167381000000000
krait and Stint,366994,SG8 5QZ,52.139308687052400,-0.012444534171345
iguana and Ground sloth,368173,SG6 4BH,51.981714932700500,-0.247324458878224
Vole and horned toad,366270,SG8 9UE,52.041585093939200,-0.017789135660154
Shearwater and horned viper,366670,SG8 7TX,52.094555795428700,0.072167489593529
horned viper and adder,369110,SG5 3QY,51.972049012666200,-0.327715689458307
sand lizard and swift,368333,SG6 3AD,51.979151675017100,-0.229137000000000
thorny devil and Skunk,369710,SG5 1DG,51.949435676257700,-0.276521000000000
blindworm and soft-shelled turtle,372267,SG19 1NG,52.126721409379800,-0.295050814007977
boomslang and rat snake,372709,SG18 9BJ,52.099925705232000,-0.281355772215577
Stilt and Chipmunk,368276,SG6 2TN,51.967913240041300,-0.212080982474502
saltwater crocodile and Piping shrike,368461,SG6 2AG,51.960978199253200,-0.217435000000000
Egret and tortoise,366451,SG8 8SB,52.030128899645900,0.069041490990794
glass snake and American sparrow,368798,SG6 1PZ,51.979109686178600,-0.216935434860834
Pratincole and puff adder,370602,SG4 7BX,51.948299145831000,-0.163984077145016
agamid and Chicken,372139,SG19 1BD,52.127981000000000,-0.283228000000000
skink and viper,366663,SG8 7TP,52.091541330063800,0.073823379290502
goanna and leguaan,366902,SG8 7AZ,52.054851224496100,-0.020644241999248
Scimitar babbler and Peafowl,373376,SG16 6BJ,52.029838336445000,-0.292003596354403
puff adder and indigo snake,372037,SG19 2HG,52.105259500541600,-0.162829997817075
death adder and Wallaby,367740,SG7 5EF,52.008837936451300,-0.157441917411784
diamondback turtle and box turtle,369433,SG5 1RG,51.953631238099000,-0.270874557055913
rattlesnake and fer-de-lance,368843,SG5 4DG,52.020003597864400,-0.225832340447027
coral snake and Old World vulture,367389,SG8 0DB,52.144858000000000,-0.075906000000000
Black jay and crocodile,367076,SG8 5XP,52.078720083655300,-0.055474560103076
Asiatic leopard and leguaan,372310,SG19 1QY,52.136210984542300,-0.284343000000000
Petrel and Dorcopsis,367498,SG8 0NA,52.064505835426600,-0.115921800662584
Wader and Linsang,373355,SG16 6AG,52.042647000000000,-0.284793000000000
Guillemot and gecko,367509,SG8 0NQ,52.066810875910000,-0.124009620811503
dugite and Ibex,368792,SG6 1PS,51.979749610206900,-0.218817544806808
Hawaiian honeycreeper and Crow,366375,SG8 8JQ,52.024730969749700,0.032526264957256
swift and crocodile,370612,SG4 7DL,51.956029000000000,-0.155635000000000
Grosbeak and hognose snake,372774,SG18 0LU,52.089437306856600,-0.255966216927315
alligator and leathery turtle,372952,SG17 5RS,52.033376058391300,-0.300439000000000
Hawk and tokay,367609,SG7 6JZ,51.989759564733200,-0.187135822243076
cobra de capello and diamond snake,372251,SG19 1LH,52.134219033532400,-0.293098868367792
rattlesnake and Egret,372443,SG18 9PT,52.048061472584300,-0.268398461614853
diamondback and cobra,367329,SG7 6TH,51.992299967360800,-0.171156960455162
Cuscus and indigo snake,367737,SG7 5EA,52.011890370339400,-0.160012298432623
king snake and Skunk,365783,SG9 9ER,51.947546178385100,-0.031149464004070
python and Wallaby,369320,SG5 2UP,51.961362577705000,-0.285525202358369
tree snake and Grackle,365840,SG9 9HY,51.947693086983900,-0.018468919655353
moloch and cobra de capello,369768,SG5 1JE,51.949222126163200,-0.279251041922398
tree snake and Schneider python,365861,SG9 9LA,51.926994010061700,-0.013708441144792
Cuscus and Tree warbler,1810267,SG18 8GU,52.092170000000000,-0.243091278700000
Pratincole and harlequin snake,371772,SG19 2SW,52.132982887632500,-0.214916000000000
diamondback turtle and goanna,367145,SG8 0SG,52.083417337423100,-0.094779715395905
ringhals and Crow,366751,SG8 6FD,52.081461313047500,0.018406353606478
perentie and jew lizard,367187,SG8 5AB,52.049820476394000,-0.025212736620022
rock snake and Boto,366519,SG8 9DW,52.046277093232200,-0.020891903478556
Wallaby and Kestrel,365909,SG9 9PN,51.946587774890300,-0.019579855153370
Grouse and Parrotbill,367308,SG8 5HR,52.076651513862600,-0.053813289568519
Treepie and Buzzard,369187,SG5 3XL,51.967430353499200,-0.289122165566085
Grouse and pit viper,367103,SG8 6BD,52.079588699459400,0.016964606279009
Philippine hawk-owl and worm lizard,368910,SG6 1RR,51.984752577070700,-0.215488053571871
Vole and Jay,369294,SG5 2SZ,51.961527651069500,-0.287600295638492
thorny devil and habu,366180,SG8 9LS,52.028927619185400,-0.020652232770223
Jackal and Magpie,369171,SG5 3UR,51.968954618803900,-0.280388000000000
horned viper and Quetzal,366156,SG8 9HU,52.047188911779900,-0.015761954589120
Buzzard and iguana,366015,SG9 9QZ,51.946137000000000,-0.064314000000000
Egret and gecko,373421,SG16 6EU,52.002939277655700,-0.294134973364495
puff adder and Booted eagles,369186,SG5 3XJ,51.967845000000000,-0.288466000000000
Chipmunk and Old World warbler,365900,SG9 9PA,51.939967307846500,-0.016772582400068
Grackle and Ibex,372575,SG18 8PP,52.077362440126700,-0.244514464219354
harlequin snake and goanna,2412055,SG18 8NG,52.086919000000000,-0.245371000000000
Parrotbill and indigo snake,367691,SG7 6PH,51.982723609928700,-0.177532154335869
flying lizard and Recurvebill,370363,SG4 0LB,51.958115168382200,-0.250588233182643
turtle and Tahr,369973,SG4 9LD,51.944895593327300,-0.267021000000000
ringhals and snapping turtle,366681,SG8 7XN,52.058402673301000,-0.012610145638908
tree snake and caiman,370384,SG4 7WT,51.955002000000000,-0.170521000000000
Hawk and Komodo dragon,372002,SG19 2DU,52.127026000000000,-0.204036522243700
rock python and fer-de-lance,375823,SG11 2QY,51.926011670735200,0.050388503593752
Lemming and Crow,366849,SG8 6PX,52.108096768851300,0.018323963719030
Komodo dragon and Maya,366907,SG8 7BJ,52.048020075776200,-0.023483725489499
Shearwater and Nukupuʻu,370445,SG4 0NS,51.952317000000000,-0.247612000000000
Towhee and bicycle lizard,369595,SG5 2HR,51.949018000000000,-0.292922000000000
leathery turtle and alligator,366686,SG8 7XU,52.057836387382700,-0.010490987441167
Warbler and racer,368907,SG5 4GX,51.998668021446800,-0.249386472834385
sidewinder and Ibex,367856,SG6 4PG,51.993824980880800,-0.219628179524452
dugite and Mockingbird,372945,SG17 5RH,52.036700916050600,-0.306467425941381
iguana and anole,372146,SG19 1BS,52.134953989515800,-0.295423252864029
Argus and Asiatic leopard,366722,SG8 8BZ,52.005728654911300,0.012228551477100
River dolphin and Macaw,366867,SG8 6RA,52.102702748965500,0.039676421862073
Cloud rat and Linsang,368251,SG6 2SD,51.968001694128200,-0.205482946345551
Triller and bearded dragon,370437,SG4 0NG,51.951194593689300,-0.246564769999467
Mole and carpet snake,371944,SG19 1TY,52.133525883433500,-0.289940120778109
blindworm and Polecat,367499,SG8 0NB,52.064824783890400,-0.118870000000000
garter snake and harlequin snake,369228,SG5 2LW,51.952470493910100,-0.288047224470673
green turtle and Crow,367370,SG8 0AW,52.149761930122900,-0.063533252478905
Meadowlark and Tit-tyrant,366459,SG8 8SN,52.027809393266300,0.071062719037616
anole and Siskin,367804,SG7 5LY,52.041712869391100,-0.154632050977288
diamondback and Petrel,367316,SG8 5JA,52.080071788476500,-0.046951170054218
hoop snake and Mink,1810362,SG5 4FU,52.000767278800000,-0.249069000000000
Guillemot and Kākāriki,1488862,CB23 1JW,52.149904386757000,0.053483197883902
Shearwater and Vulture,365888,SG9 9NJ,51.926570907593300,-0.034701000000000
Magpie and Coati,373419,SG16 6ES,52.003337854804700,-0.298067946694433
constrictor and frill-necked lizard,366578,SG8 7JZ,52.052018415653400,-0.008882567369011
bandy-bandy and agama,370313,SG4 7SP,51.936301125435900,-0.267002230673583
Partridge and smooth snake,372939,SG17 5RA,52.038242807436600,-0.328177166200292
River dolphin and python,368933,SG5 4HU,52.011379175901700,-0.236519244858738
frill-necked lizard and sidewinder,371801,SG19 2UR,52.143283000000000,-0.291159000000000
Stilt and giant tortoise,373216,SG17 5HA,52.039429022383100,-0.298492000000000
Lemming and Siskin,2636935,SG16 6GF,52.030622000000000,-0.291934000000000
Dolphin and Darwin's finches,372179,SG19 1EJ,52.128721805560500,-0.289758818702998
deaf adder and king snake,372566,SG18 8NZ,52.077068072365000,-0.248903862602197
hawksbill and hoop snake,368239,SG6 2RL,51.972202255747400,-0.200860133486550
Moluccan boobook and Duck,369653,SG4 9SQ,51.951077511352800,-0.271482105592470
American sparrow and Partridge,369605,SG5 2JG,51.950894629186600,-0.286652066235937
whip snake and Magpie,1488858,CB23 1JR,52.149986170721000,0.051367452693061
milk snake and blue tongue,372754,SG18 0JL,52.086773426719200,-0.264944433097952
Ice seal and Capuchin,369323,SG5 2US,51.957862080010800,-0.285586000000000
Francolin and Old World quail,367066,SG8 5UX,52.060385226036000,-0.020880979782013
Crow and Argus,366759,SG8 6HA,52.086107748890100,0.025359534234489
Peafowl and black snake,367796,SG7 5LN,52.042158401927000,-0.147497859557414
Rat and chameleon,1810534,SG9 9FN,51.951613441900000,-0.022661893600000
rock python and Coati,370142,SG4 7HG,51.933341423716900,-0.235434807874296
slowworm and habu,369564,SG5 2DH,51.947321000000000,-0.281390000000000
skink and Vole,373025,SG16 6JU,51.999860797564500,-0.322702496078291
Armadillo and Mole,373398,SG16 6DQ,52.033264422046100,-0.286449840737168
hoop snake and death adder,369246,SG5 2NW,51.956368000000000,-0.289500000000000
worm lizard and moloch,366476,SG8 9AA,52.047360299386400,-0.023819095761445
frilled lizard and massasauga,365767,SG9 9DW,51.947234294218100,-0.029169629158141
agama and iguana,366789,SG8 6JX,52.093136617200400,0.009765389832127
Minke whale and chuckwalla,368260,SG6 2SR,51.969476638506000,-0.210228134875538
Tahr and python,369248,SG5 2NY,51.954542338571000,-0.292639797261415
Crow and sand viper,369213,SG5 4AN,52.020760843743900,-0.224767585714689
tree snake and copperhead,366969,SG8 5PS,52.081610346024000,-0.058983011280275
hoop snake and Pitohui,2580549,SG8 5GA,52.052383000000000,-0.027813000000000
Armadillo and tree snake,367152,SG8 0TP,52.110494263285000,-0.132034152338569
bicycle lizard and alligator,367975,SG6 4TA,51.993444367509300,-0.235563532617825
Mole and Grackle,369440,SG5 1RT,51.960379932110600,-0.273045542124568
dukite and slowworm,370488,SG4 0QW,51.962897964486800,-0.250533023877793
Badger and Chipmunk,370321,SG4 7TH,51.955002000000000,-0.170521000000000
Bunting and Snipe,367358,SG8 0AD,52.121324000000000,-0.055461000000000
goanna and Treepie,366170,SG8 9JT,52.046067701845400,-0.022344890052366
python and agama,367833,SG6 4LX,51.990622298314500,-0.228464927773004
Pitohui and hoop snake,372576,SG18 8PQ,52.076649693540300,-0.247373409341750
rock snake and garter snake,2646682,SG5 4SH,52.025212000000000,-0.227000000000000
Thicketbird and dugite,370477,SG4 0QG,51.961157285344200,-0.253206163621693
Crow and blind snake,366148,SG8 9HH,52.046667617428800,-0.016178000000000
Hawk and moloch,1810349,SG4 9UA,51.946174256700000,-0.274246087100000
Boto and slowworm,372779,SG18 0NB,52.090108955714500,-0.262479512703457
indigo snake and fer-de-lance,369602,SG5 2JB,51.949961990907800,-0.291154903152214
Cloud rat and Recurvebill,367472,SG8 0JG,52.083012594744000,-0.134115976026437
Dorcopsis and Argus,368518,SG6 3NW,51.963710757399200,-0.230312233571249
whip snake and mountain devil,366723,SG8 8DA,52.013487000000000,0.019671523233582
Cuscus and brown snake,369599,SG5 2HY,51.949255877835800,-0.287733108805807
turtle and pit viper,367843,SG6 4NL,51.991392044477000,-0.224050486888831
Komodo dragon and lizard,367341,SG7 6WB,51.981444000000000,-0.209504000000000
horned viper and bushmaster,366373,SG8 8JN,52.025858372631500,0.039093181876725
Recurvebill and krait,365525,SG9 9RS,51.958601413971400,-0.025483614717650
Thrasher and chameleon,372892,SG18 8BY,52.082791575001000,-0.265040484547736
Peafowl and Parakeet,371382,SG2 7AN,51.927434264988600,-0.095284192781046
perentie and Vulture,369900,SG4 9EQ,51.938471178181700,-0.269653586013332
Argus and krait,2591613,SG18 0GZ,52.096525000000000,-0.251608000000000
cayman and Booted eagles,366381,SG8 8JX,52.024080000000000,0.040630000000000
Thicketbird and Prion,370259,SG4 7NX,51.929230000000000,-0.262373000000000
milk snake and dukite,365937,SG9 0EF,51.942886246748800,0.022014774635189
mamba and Rabbit,367984,SG6 4TQ,51.994974108601800,-0.234440064089510
Hawk and Buzzard,372622,SG18 8SR,52.079011247402900,-0.246551235112100
Treepie and Wallaby,1810483,SG7 6FP,51.992319305400000,-0.183347463200000
Skunk and Black jay,366405,SG8 8PD,52.012367000000000,0.068717000000000
jew lizard and flying lizard,366925,SG8 5LG,52.079095939945200,-0.050467116085623
harlequin snake and Parrotlet,371621,SG2 7PX,51.944618682823400,-0.119378630958363
Kestrel and wall lizard,1810153,SG17 5GQ,52.041305956800000,-0.330381334000000
glass snake and Duck,367929,SG6 4QP,51.993585847488600,-0.227619670753052
Tit-tyrant and tuatara,369276,SG5 2RG,51.960937647226900,-0.294652837826528
Myna and horned viper,368213,SG6 4EX,51.982763647246400,-0.232663114529589
Schneider python and Francolin,366790,SG8 6JY,52.090675611759900,0.007903000000000
Viscacha and rock python,368981,SG5 4PB,52.012443145919200,-0.218903000000000
wall lizard and Argus,2658157,SG9 9UH,51.943066000000000,-0.011705000000000
tortoise and Tree warbler,366382,SG8 8JZ,52.026173720797700,0.041133707819099
Duck and Siskin,366808,SG8 6LZ,52.091210120672100,0.001971081978025
Parrotbill and Tree warbler,373194,SG17 5ES,52.036482958765200,-0.302568357024260
box turtle and Philippine hawk-owl,369958,SG4 9JD,51.941292100287400,-0.259724685456761
Gull and Polecat,366833,SG8 5JY,52.081836544007400,-0.043298400691601
Mouse and Elephant,372343,SG18 9EW,52.094407961804000,-0.322136762270186
Coati and boa,370006,SG4 9NY,51.943959179083800,-0.252812268996411
frill-necked lizard and skink,372746,SG18 0HY,52.096480411870000,-0.263458277070935
Marsh harrier and Rat,371376,SG2 7AE,51.932796488019400,-0.108294196043033
gecko and caiman,369992,SG4 9NB,51.945276999678100,-0.262496000000000
water snake and whip snake,368357,SG6 3DJ,51.978095906559800,-0.227808832540482
green turtle and Crow,369955,SG4 9HZ,51.939706968974300,-0.262593824671060
Polecat and ringhals,372768,SG18 0LN,52.087352000000000,-0.260259530338110
Diving bird and flying dragon,369505,SG5 1XH,51.957875580453200,-0.281946961348182
sea snake and python,372947,SG17 5RL,52.035083161186900,-0.300274148775194
Bunting and snapping turtle,367690,SG7 6PG,51.984496222447800,-0.181686000000000
mountain devil and leguaan,369569,SG5 2DU,51.946339027788300,-0.280088904077489
rock snake and green turtle,372380,SG18 9LD,52.062997054120800,-0.326946617999011
bull snake and snapping turtle,369406,SG5 3FJ,51.973754000000000,-0.331860000000000
Puffleg and constrictor,366841,SG8 6PE,52.116062000000000,0.004282000000000
caiman and chameleon,368480,SG6 2BL,51.970980272980100,-0.216879638967013
Old World warbler and Mamo,372412,SG18 9PB,52.053780533030900,-0.268425293302364
smooth snake and indigo snake,367814,SG7 5NL,52.041252000000000,-0.149825000000000
Ground sloth and rock snake,367033,SG8 0QB,52.067492666178700,-0.088443000000000
diamondback terrapin and Goose,373251,SG15 6UF,52.019087486771200,-0.264533274706025
