name,postcode,lat,lon
swift and Fulmarine petrel,EX8 2LR,50.625309568527100,-3.395402000000000
Chipmunk and black snake,EX8 2LU,50.623576966046500,-3.393866122055680
Dolphin and boa constrictor,EX8 2QF,50.624138873497600,-3.387478374981990
rock snake and boa constrictor,EX8 2QJ,50.624457400717400,-3.382624362718100
python and asp,EX8 2TS,50.627738501916400,-3.385774591530500
monitor and terrapin,EX8 2ZA,50.619384948286300,-3.411878986671120
gecko and Siskin,EX8 3AL,50.630332119735100,-3.402012348547610
Thrasher and bandy-bandy,EX8 3AT,50.629148368873700,-3.399488633343220
milk snake and River dolphin,EX8 3BW,50.636620498625400,-3.407064131427600
Asiatic leopard and dukite,EX8 3DY,50.627978431416900,-3.409252104382570
Fulmarine petrel and gopher snake,EX8 3JH,50.635102754296600,-3.408376337405820
Vole and harlequin snake,EX8 3LG,50.633584978186300,-3.402985851253850
black snake and elapid,EX8 3LH,50.632209377895700,-3.401460180706280
Scimitar babbler and Booted eagles,EX8 3ND,50.635521454838400,-3.409251000000000
Prion and python,EX8 3NF,50.634594202231300,-3.411754934707500
Macaw and Towhee,EX8 3PY,50.626480332992800,-3.396242406840460
Komodo dragon and lizard,EX8 3QA,50.627233132900000,-3.396462650418770
coral snake and snake,EX8 3QJ,50.626804667586900,-3.398443479752930
Marmoset and Mockingbird,EX8 3QW,50.628074298842800,-3.396063410488190
snapping turtle and worm lizard,EX8 4AB,50.626282367818900,-3.388729096594810
Flameback and Quetzal,EX8 4AG,50.629194214969100,-3.387386848331880
Kite and Rabbit,EX8 4BH,50.628534328373100,-3.386914973368080
king snake and Warbler,EX8 4DB,50.631680000000000,-3.393229000000000
Linsang and king snake,EX8 4EQ,50.635327050886400,-3.385927078996230
Lemming and Mouse,EX8 4FA,50.630460000000000,-3.390534000000000
Marmoset and bicycle lizard,EX8 4FF,50.632500410366000,-3.385985806806680
New World blackbird and Myna,EX8 4HA,50.634750245536500,-3.379970956662230
Parrotlet and Old World vulture,EX8 4HX,50.634185361976900,-3.394929392709900
alligator and Booted eagles,EX8 4JL,50.636463060589500,-3.393978652977220
Chickadee and thorny devil,EX8 4LS,50.638616178050400,-3.386886505630230
Mockingbird and Stint,EX8 4QA,50.632166657845200,-3.400525664093360
amethystine python and blue tongue,EX8 4QD,50.639496642375300,-3.407206608647450
box turtle and Viscacha,EX8 4QG,50.640345466837800,-3.406920829869320
Chicken and Dolphin,EX8 4QZ,50.638466603952500,-3.403131231194100
Ibex and Civet,EX8 4SA,50.629286907019700,-3.386399832594240
River dolphin and Stilt,EX8 4SE,50.629952853001600,-3.386362867660610
Gull and leguaan,EX8 4SW,50.631450857514200,-3.383240000000000
Towhee and Petrel,EX8 5AJ,50.662313217584300,-3.429324635211080
Jerboa and ringhals,EX8 5AU,50.651810749497000,-3.412964220967830
cycling lizard and Nukupuʻu,EX8 5EG,50.641944915804600,-3.376928838578340
horned toad and dukite,EX8 5EH,50.642129531446800,-3.377287811727480
tree snake and loggerhead,EX8 5ER,50.647288000000000,-3.431467835446990
sidewinder and Parakeet,EX8 5HR,50.653328672422000,-3.427142095109580
Vulture and Goose,EX8 5LR,50.647551714769500,-3.417093992972210
death adder and Francolin,EX8 5NS,50.642121143166400,-3.391614486040790
bandy-bandy and Nukupuʻu,EX8 5NU,50.641117749760400,-3.394300253644770
python and Chickadee,EX8 5NZ,50.642614284794100,-3.392491792100760
Fish eagle and Philippine hawk-owl,EX8 5QB,50.645026000000000,-3.389387943284110
Badger and Wallaby,TQ12 6RQ,50.575179359572200,-3.650763628645210
Puffleg and black snake,TQ12 6RS,50.575356786192700,-3.657266591146610
Black jay and loggerhead,TQ13 0AJ,50.583254959469400,-3.621367897351440
Ground sloth and Goose,TQ13 0DE,50.615696572172900,-3.590579727965760
Marmoset and Coati,TQ13 0DG,50.623824000000000,-3.574313000000000
constrictor and Black cockatoo,TQ13 0EN,50.586942677082700,-3.627145315732920
bearded dragon and Skunk,TQ13 0FE,50.584987000000000,-3.635210257244190
slowworm and Quetzal,TQ13 0GA,50.607481394874600,-3.594825165474930
king cobra and harlequin snake,TQ13 0HY,50.603532000000000,-3.602860000000000
saltwater crocodile and caiman,TQ13 0HZ,50.603066000000000,-3.602824528717220
Parrotbill and flying dragon,TQ13 0JA,50.603182010952800,-3.605985104601930
saltwater crocodile and Gull,TQ13 0JW,50.604539685376100,-3.604052846158390
blue racer and Pitohui,TQ13 0JX,50.606407745638400,-3.599664608503380
cobra and Ground sloth,TQ13 0NL,50.626695831560100,-3.623158915670720
Badger and milk snake,TQ13 8NN,50.660586078577300,-3.762096000000000
leguaan and goanna,TQ13 8PG,50.660610670085400,-3.765365584226420
python and wall lizard,TQ13 8SU,50.670964182352400,-3.713433357553040
puff adder and Scimitar babbler,TQ13 9DT,50.581132853815000,-3.671215000000000
Elephant and tuatara,TQ13 9DX,50.580856000000000,-3.671556000000000
chameleon and Puffleg,TQ13 9DY,50.584780907291000,-3.674322941234930
Gull and habu,TQ13 9EJ,50.595005312908900,-3.670658916278650
python and harlequin snake,TQ13 9EU,50.592274847116900,-3.663497999362780
Egret and Magpie,TQ13 9FP,50.579896197795000,-3.676904007735900
Zebra and hognose snake,TQ13 9GH,50.590832000000000,-3.656794000000000
python and death adder,TQ13 9JG,50.591405000000000,-3.679701000000000
Ice seal and adder,TQ13 9JH,50.583838736558600,-3.662875752310080
Pitohui and Condor,TQ13 9LF,50.593453000156500,-3.702249000000000
deaf adder and Night heron,TQ13 9LJ,50.597235824363800,-3.718242952535640
swift and gaboon viper,TQ13 9LL,50.588395710690000,-3.715759560933400
glass snake and diamondback turtle,TQ13 9QD,50.615819045030700,-3.654730608892720
Kite and Fulmarine petrel,TQ13 9QH,50.611227477238000,-3.648096037517990
Shearwater and Badger,TQ13 9SB,50.591151268993300,-3.677247452124300
Duck and taipan,TQ13 9SL,50.613987243318600,-3.720931233257450
Bunting and Marmoset,TQ13 9SU,50.592920593823300,-3.673665148973990
tortoise and bicycle lizard,TQ13 9SW,50.624218197884100,-3.710316000000000
Hawaiian honeycreeper and rock snake,TQ13 9TL,50.619725114651600,-3.717889252345630
Jackal and Asiatic leopard,TQ13 9UJ,50.619068242696700,-3.766608343440800
anaconda and slowworm,TQ13 9UQ,50.612684000000000,-3.760687000000000
Chipmunk and Myna,TQ13 9XP,50.581499828705200,-3.736838129725630
puff adder and blindworm,TQ13 9YR,50.590366943716700,-3.663586145203450
