name,postcode,lat,lon
New World blackbird and bushmaster,EX1 1AP,50.721261800345500,-3.527212969110750
gecko and Nukupuʻu,EX1 1SA,50.723726918835800,-3.523155635536540
python and blind snake,EX1 1TS,50.723794678747800,-3.526912304665780
Stilt and Tattler,EX1 2AA,50.726230512013200,-3.522202534601020
Chicken and saltwater crocodile,EX1 2AQ,50.723049588212100,-3.508158536439170
Armadillo and Vulture,EX1 2BN,50.726668227927100,-3.518291999527620
boomslang and Rabbit,EX1 2BU,50.726418384865100,-3.520210851389600
grass snake and diamondback,EX1 2BY,50.727040750474900,-3.519380872028110
Tit-tyrant and bushmaster,EX1 2EQ,50.726027709713900,-3.516372714158640
Old World vulture and kabaragoya,EX1 2JW,50.724432909877000,-3.522810164747120
American sparrow and thorn lizard,EX1 2JX,50.725168130116600,-3.525044249223030
Thicketbird and Siskin,EX1 2NB,50.722866439356800,-3.513961337904740
Chipmunk and Mockingbird,EX1 2NX,50.724956484422800,-3.510217482995720
Minke whale and black snake,EX1 2PZ,50.729449415556900,-3.509115069615840
king cobra and brown snake,EX1 2QH,50.722130956040900,-3.506173951694980
Kangaroo and Rabbit,EX1 2QS,50.721938900063200,-3.506707000000000
Guillemot and smooth snake,EX1 2TQ,50.723881000000000,-3.503099000000000
thorn lizard and gopher snake,EX1 3AY,50.725349888006100,-3.499249732737750
racer and thorn lizard,EX1 3EF,50.723589669689900,-3.483594889798690
Meadowlark and adder,EX1 3FJ,50.735662000000000,-3.464094000000000
Meadowlark and Diving bird,EX1 3GN,50.729375000000000,-3.480590000000000
soft-shelled turtle and taipan,EX1 3HW,50.725611948820100,-3.490034518737270
perentie and Stint,EX1 3HX,50.726031264041000,-3.489594433066380
rock python and slowworm,EX1 3JA,50.745476000000000,-3.459623000000000
Bunting and Scimitar babbler,EX1 3JE,50.732766368537000,-3.486137958899160
Armadillo and rock python,EX1 3JS,50.729580068994800,-3.492682612029890
White ibis and Masked owl,EX1 3NS,50.727711949753300,-3.484036842988030
Hawaiian honeycreeper and bicycle lizard,EX1 3PR,50.726516892355000,-3.483248141093130
Kangaroo and asp,EX1 3PT,50.729601396746000,-3.483969033958430
amethystine python and loggerhead,EX1 3QZ,50.736768762068500,-3.470505765076490
Crow and horned viper,EX1 3RH,50.734842876577000,-3.465613101172480
rattlesnake and soft-shelled turtle,EX1 3RU,50.723868575583100,-3.473062000000000
Eagle and box turtle,EX1 3SL,50.739095882376800,-3.462812214370720
Jackal and bull snake,EX1 3TA,50.740770828362900,-3.465500567871830
garter snake and loggerhead,EX1 3TJ,50.747408130193200,-3.461894806466530
wall lizard and Perching duck,EX1 3UD,50.725999123032400,-3.492809649120780
Jerboa and cobra de capello,EX1 3UJ,50.723473581340800,-3.478575869654420
Night heron and garter snake,EX1 3WL,50.749430000000000,-3.470704000000000
Kite and Triller,EX1 3WR,50.747743000000000,-3.467533000000000
Magpie and garter snake,EX1 3WS,50.733526000000000,-3.471623000000000
Logrunners and cycling lizard,EX1 3XB,50.724977000000000,-3.477745000000000
milk snake and fer-de-lance,EX1 3XG,50.736341000000000,-3.455895000000000
Piping shrike and Parrotbill,EX1 3XJ,50.736815000000000,-3.454663000000000
Grouse and diamond snake,EX1 3XL,50.737355000000000,-3.453886000000000
bearded lizard and fer-de-lance,EX1 3YF,50.735465000000000,-3.453261000000000
Night heron and Meadowlark,EX1 9DP,50.726230512013200,-3.522202534601020
Duck and hawksbill,EX1 9RU,50.726237664708000,-3.522203263408240
Grosbeak and mud turtle,EX1 9YL,50.726310000000000,-3.522262000000000
Vulture and Old World warbler,EX1 9YS,50.726310000000000,-3.522262000000000
tiger snake and leguaan,EX17 1JB,50.794296108382000,-3.648214064103300
Kestrel and saltwater crocodile,EX17 2AL,50.790843056997400,-3.658336506400660
Old World quail and coral snake,EX17 2EW,50.799023598570000,-3.699214000000000
Old World vulture and ringhals,EX17 3AH,50.790517152916400,-3.659119508204740
Herring gull and python,EX17 3DE,50.782302989933200,-3.647934090271320
Cuscus and Old World warbler,EX17 3FH,50.784785000000000,-3.642278000000000
Pitohui and Cuscus,EX17 3HA,50.786417319843300,-3.653342128863420
Prion and jew lizard,EX17 3HG,50.786995296422900,-3.654440742125500
moloch and leathery turtle,EX17 3HJ,50.787063107403100,-3.653464225287060
Kestrel and Mouse,EX17 3HQ,50.786909427818600,-3.656055036607170
jew lizard and Kākāriki,EX17 3JA,50.788796348780600,-3.658703881339060
Parrotbill and B,EX17 3LQ,50.790836400773700,-3.658804483622680
Hawaiian honeycreeper and Civet,EX17 3NN,50.791209009114300,-3.669246141922130
agamid and puff adder,EX17 3PP,50.783543478453700,-3.647339340033090
Pratincole and Thrasher,EX17 3PX,50.769926000000000,-3.631530000000000
Pitohui and Zebra,EX17 3QF,50.764188943256300,-3.684534700272550
Warbler and rat snake,EX17 3QH,50.774502207334800,-3.665275529186240
bearded dragon and Asiatic leopard,EX17 3RD,50.792092081924900,-3.674144319319310
Philippine hawk-owl and Asiatic leopard,EX17 5BZ,50.796351549483100,-3.743118109677820
elapid and Meadowlark,EX17 5HD,50.763538835532700,-3.733787120721820
python and Peafowl,EX17 5JA,50.771673656639400,-3.729833176161030
rattlesnake and cayman,EX2 4BX,50.718001104802500,-3.526369820906570
tree snake and Moluccan boobook,EX2 4DD,50.714897123443300,-3.523719244689460
Gila monster and Quetzal,EX2 4EF,50.718400491039900,-3.532941747403260
iguana and Kākāriki,EX2 4EG,50.714053373584800,-3.522218731983350
diamond python and copperhead,EX2 4HJ,50.719232465435100,-3.523675711255270
harlequin snake and Skunk,EX2 4JE,50.719733933316600,-3.527276126112040
Eagle and bushmaster,EX2 4JP,50.719656450051900,-3.527698603867760
Treepie and Grosbeak,EX2 4NT,50.720290675237900,-3.513552477811270
Petrel and Kite,EX2 4PE,50.717165666618900,-3.516653258824930
dugite and Guillemot,EX2 4PH,50.716227000000000,-3.514271000000000
python and Herring gull,EX2 4QX,50.714555714691600,-3.517489725797100
Grosbeak and saltwater crocodile,EX2 4RQ,50.712235864354800,-3.517457290093320
Gila monster and crocodile,EX2 4SJ,50.711565007292000,-3.516486627474440
Coati and diamondback,EX2 4SR,50.710675631189000,-3.515721402346930
galliwasp and king cobra,EX2 4TB,50.714042619977300,-3.511297272857410
grass snake and Snipe,EX2 4TE,50.720851649125200,-3.518132302171280
Dorcopsis and Black cockatoo,EX2 4TJ,50.719911992231100,-3.517776098746310
Linsang and Grackle,EX2 5AW,50.715813736967700,-3.490389490069610
Cuscus and Darwin's finches,EX2 5DH,50.717106484047200,-3.501777280106930
adder and Siskin,EX2 5EF,50.715538483965400,-3.499928161782070
gaboon viper and Vole,EX2 5EH,50.720987062106200,-3.505345000000000
Civet and Marmoset,EX2 5EL,50.720610598031000,-3.505516023991040
Chicken and snake,EX2 5ER,50.720601181413400,-3.504155706722840
Treepie and thorn lizard,EX2 5LN,50.716127180374400,-3.496108115971260
American sparrow and Parakeet,EX2 5NX,50.717255272872100,-3.488777826895370
Dolphin and Partridge,EX2 5QH,50.721759249962900,-3.481142822600960
Solitaire and cobra,EX2 5QW,50.716329555592000,-3.485207110041650
snake and diamondback,EX2 5QZ,50.721211837094000,-3.485290653380970
cerastes and leguaan,EX2 5RR,50.712859334678400,-3.485819795268290
brown snake and Pratincole,EX2 5RW,50.719738104094900,-3.490131509583750
crocodile and constrictor,EX2 6BH,50.709383792980400,-3.507153331767750
Cloud rat and hoop snake,EX2 6EU,50.704936126038900,-3.506146802238920
Nukupuʻu and Parrotlet,EX2 6JG,50.706239147073500,-3.494348721282200
Civet and Tahr,EX2 6LP,50.700841749515600,-3.501455799072740
Scimitar babbler and Rabbit,EX2 6NG,50.714695880712800,-3.498314775200850
Parrotlet and Greenbul,EX2 6NJ,50.705553160822200,-3.500841557245330
tree snake and Pitohui,EX2 6NQ,50.714820774134800,-3.499791926403690
Songlark and ringhals,EX2 7BG,50.699331559986400,-3.493704298865620
king snake and taipan,EX2 7DA,50.696718751054300,-3.496877988566830
frilled lizard and Treepie,EX2 7DU,50.695164851306500,-3.483363168434270
Jerboa and Chicken,EX2 7EA,50.691878971996300,-3.480795983601460
viper and dugite,EX2 7GQ,50.700379000000000,-3.482197830096380
chameleon and Dorcopsis,EX2 7GY,50.693749000000000,-3.477966000000000
Shearwater and Guillemot,EX2 7JF,50.724539000000000,-3.466283000000000
harlequin snake and Zebra,EX2 7LW,50.722020000000000,-3.471280408392490
iguana and Hawaiian honeycreeper,EX2 7QG,50.715119305155800,-3.479247817719580
hawksbill and Stint,EX2 7SL,50.701864000000000,-3.474157000000000
swift and boa,EX2 7TQ,50.710948128573500,-3.474144971536890
Coati and anaconda,EX2 8AQ,50.698598705760700,-3.534193360678650
diamond snake and bearded dragon,EX2 8EG,50.712736707453500,-3.532278000000000
Marmoset and Chipmunk,EX2 8ER,50.714876301109400,-3.533535005479280
Grackle and Fox,EX2 8GW,50.715284190814400,-3.529185420913460
Old World vulture and Piping shrike,EX2 8HU,50.711210149090600,-3.538075311138800
Ice seal and fer-de-lance,EX2 8JL,50.711919603045800,-3.534741608633880
horned viper and Black cockatoo,EX2 8LG,50.710010208968600,-3.537002083552610
diamondback terrapin and Rabbit,EX2 8LT,50.708107832047400,-3.527790498110560
tree snake and Lemming,EX2 8QH,50.707216798277900,-3.529900114943950
blindworm and American sparrow,EX2 8RJ,50.700309763622600,-3.521105000000000
New World blackbird and Elephant,EX2 8SB,50.704332636785400,-3.537212928343930
Chipmunk and Petrel,EX2 8SD,50.704557125362300,-3.535874878275490
soft-shelled turtle and horned viper,EX2 9AU,50.715400773239500,-3.541498860152860
slowworm and Macaw,EX2 9DT,50.710528000000000,-3.538696841958260
constrictor and Civet,EX2 9FB,50.703947000000000,-3.552015000000000
Tit-tyrant and whip snake,EX2 9HN,50.713220515699400,-3.547220666216370
leguaan and harlequin snake,EX2 9NG,50.709503540723500,-3.550809116783080
Cuscus and Fox,EX2 9NH,50.710142929665300,-3.552770651560590
moloch and Chipmunk,EX2 9NQ,50.708967191217100,-3.550564801019380
cycling lizard and Coati,EX2 9RE,50.702509299714500,-3.562063248555260
Philippine hawk-owl and fer-de-lance,EX2 9TF,50.705212810466000,-3.571021000000000
saltwater crocodile and Francolin,EX2 9TJ,50.700205028678800,-3.560867969803070
Pratincole and diamondback,EX2 9UN,50.672736393883300,-3.563397000000000
Goose and death adder,EX3 0BD,50.677575289619900,-3.460334000000000
smooth snake and loggerhead,EX3 0DR,50.685037377890900,-3.464244450804010
Bronzewing pigeon and Mamo,EX3 0DU,50.685425805412500,-3.467682339550360
Civet and Viscacha,EX3 0EQ,50.685423445039300,-3.462147201034820
tuatara and Meadowlark,EX3 0HG,50.684159416295000,-3.465406203381910
Grackle and Siskin,EX3 0JE,50.681270656224100,-3.464127188274260
habu and gaboon viper,EX3 0JL,50.683238453371600,-3.466410861457340
Zebra and thorn lizard,EX3 0JQ,50.680912842323800,-3.463974502237820
Parrotlet and boa constrictor,EX3 0LH,50.687953991294700,-3.470451064276240
Black cockatoo and snapping turtle,EX3 0LT,50.692225000000000,-3.478428000000000
Dorcopsis and Kite,EX3 0NP,50.690939000000000,-3.449067000000000
hoop snake and goanna,EX4 0AJ,50.761820943760900,-3.474297097366960
Greenbul and Booted eagles,EX4 0BA,50.756858407965400,-3.479840576507790
death adder and Fulmarine petrel,EX4 1AP,50.716192778552400,-3.541454021289370
leathery turtle and Shearwater,EX4 1BH,50.716910612496400,-3.542936649794380
harlequin snake and tortoise,EX4 1EJ,50.720263463254300,-3.543740958886750
iguana and Jackal,EX4 1EU,50.718858710438000,-3.547944697679520
leathery turtle and Minke whale,EX4 1HE,50.715050467341700,-3.546218543715730
gavial and Pitohui,EX4 1LW,50.712984908542200,-3.557482236538030
puff adder and coral snake,EX4 1NN,50.716998701070500,-3.557275332526530
Armadillo and sidewinder,EX4 1NW,50.716306606933100,-3.559263904768870
milk snake and bearded dragon,EX4 1NX,50.718959599285800,-3.559266972757880
skink and fer-de-lance,EX4 1NY,50.714625709810900,-3.549759999103710
Towhee and saltwater crocodile,EX4 1QX,50.719175550353100,-3.551170924540700
bull snake and dukite,EX4 1RL,50.717947123129300,-3.556966788315420
mamba and giant tortoise,EX4 2AL,50.731488317146200,-3.549749727752900
Scimitar babbler and Nukupuʻu,EX4 2BZ,50.721217044542600,-3.549141619375280
Mockingbird and pit viper,EX4 2EY,50.725295295937600,-3.562296824527650
dukite and Black jay,EX4 2HH,50.725942597143800,-3.623512351117760
Ibex and tiger snake,EX4 2HP,50.740460987689700,-3.625871159439690
turtle and Argus,EX4 2HY,50.725842000000000,-3.548373000000000
Kākāriki and racer,EX4 2JA,50.729732264340100,-3.553305026134470
Masked owl and sea snake,EX4 2JL,50.727343448463400,-3.595662020983910
sidewinder and adder,EX4 2JT,50.731710870950300,-3.606381498823660
viper and Mink,EX4 2JY,50.732503481195900,-3.609554481963520
lizard and diamond snake,EX4 2LF,50.737799000000000,-3.603869000000000
swift and moloch,EX4 2LS,50.724479160460100,-3.557424194328020
mamba and Boto,EX4 2LT,50.724949989626000,-3.559876740802500
chuckwalla and coral snake,EX4 3AD,50.721319053739900,-3.535997921554620
Nukupuʻu and goanna,EX4 3DL,50.723077132481200,-3.531564285959690
Ground sloth and Condor,EX4 3EL,50.725100655898100,-3.533502000000000
giant tortoise and Pitohui,EX4 3ET,50.724232716333100,-3.535328145093310
loggerhead and anaconda,EX4 3FF,50.720053000000000,-3.537856000000000
Linsang and wall lizard,EX4 3HH,50.723593038452700,-3.533255000000000
Grouse and New World blackbird,EX4 3PQ,50.725123630397300,-3.530497569441920
caiman and Condor,EX4 3QL,50.725977792892600,-3.528456809245830
bushmaster and cayman,EX4 3QS,50.723032339278700,-3.533602959174710
crocodile and Flameback,EX4 3SA,50.725537000000000,-3.532561936219590
jew lizard and Bronzewing pigeon,EX4 4BP,50.725114950527000,-3.540032504524060
Parakeet and puff adder,EX4 4DZ,50.724760974624100,-3.538915782618860
Prion and bearded lizard,EX4 4FD,50.727247311239800,-3.542810000000000
Tree warbler and ringhals,EX4 4FL,50.724873187297300,-3.537772338971210
puff adder and Badger,EX4 4GS,50.730995000000000,-3.542308000000000
Boto and Booted eagles,EX4 4JA,50.726529189753900,-3.536451707308450
Kestrel and agama,EX4 4JF,50.725896000000000,-3.537550000000000
gaboon viper and bushmaster,EX4 4JR,50.738381677254700,-3.539773791260800
tuatara and viper,EX4 4LS,50.729943206770700,-3.531929933869400
Tit-tyrant and River dolphin,EX4 4PX,50.735042000000000,-3.532685614984090
Black jay and Old World vulture,EX4 4XA,50.738403338455200,-3.542353350355690
Tattler and mountain devil,EX4 5AD,50.741800259927300,-3.546617749247650
perentie and Ice seal,EX4 5DF,50.741751730956000,-3.523669656506990
python and caiman,EX4 5DZ,50.742436695533400,-3.524244658041900
krait and River dolphin,EX4 5EG,50.742004026227400,-3.513969132545240
swift and gavial,EX4 5EL,50.737352530071600,-3.515505561391150
bandy-bandy and king snake,EX4 6DB,50.731658156069100,-3.525283387161440
Goose and Perching duck,EX4 6HF,50.737370951097800,-3.521685107347810
anaconda and thorn lizard,EX4 6HY,50.733762399802800,-3.522545928369980
gecko and Maya,EX4 6JA,50.732853274224800,-3.523295825462210
Diving bird and Bunting,EX4 6JW,50.735664096328100,-3.522919376293220
monitor and Grosbeak,EX4 6LH,50.730839772809500,-3.517704223871190
Elephant and galliwasp,EX4 7AQ,50.733692110127500,-3.516209302649990
Hawk and saltwater crocodile,EX4 7AU,50.732370058252400,-3.512751543138200
Skunk and Moluccan boobook,EX4 7BU,50.730811332801200,-3.514556000000000
Vole and rat snake,EX4 7DD,50.735819960023000,-3.514407398303470
Ice seal and mud turtle,EX4 7DY,50.735388686643100,-3.506046591617650
Diving bird and Fox,EX4 7EA,50.735334989192200,-3.509502660709120
bicycle lizard and Capuchin,EX4 7HB,50.736899349483400,-3.509538792992310
garter snake and American sparrow,EX4 7HJ,50.730865531798000,-3.508097840487690
kabaragoya and sand viper,EX4 7HX,50.730637816452300,-3.506234274834630
bandy-bandy and Grackle,EX4 8BD,50.732647476522300,-3.500332984151830
loggerhead and dugite,EX4 8BJ,50.733929500723000,-3.495045718512900
Ice seal and garter snake,EX4 8DN,50.735810346364300,-3.484392040656320
Polecat and Linsang,EX4 8EX,50.734231263953700,-3.483392660523640
Civet and Grosbeak,EX4 8LT,50.737024425106500,-3.499849314941260
bearded lizard and boomslang,EX4 8LZ,50.739079159700300,-3.496568000000000
Gila monster and Partridge,EX4 8PN,50.740654000000000,-3.477716708958720
mountain devil and cycling lizard,EX4 8PS,50.738962535505900,-3.476243422222200
Grackle and Pheasant,EX4 8QP,50.731209206872700,-3.498884191951240
galliwasp and Parrotbill,EX4 9AH,50.738279371662600,-3.500867292152860
fer-de-lance and Hawk,EX4 9AJ,50.738185957697800,-3.500439141439200
Wallaby and box turtle,EX4 9DP,50.741334996606600,-3.496131982423750
Triller and Parrotbill,EX4 9DS,50.740886363487600,-3.504437199991720
rock snake and glass snake,EX4 9EA,50.741586054600200,-3.496891162404390
Recurvebill and Night heron,EX4 9HN,50.744052951846400,-3.471244252801930
Guillemot and bearded dragon,EX5 1AB,50.705539883130900,-3.446415619614880
slowworm and blindworm,EX5 1AG,50.702751368994300,-3.431899372615680
Linsang and gopher snake,EX5 1AQ,50.698209000000000,-3.432743412524590
Boto and Petrel,EX5 1BE,50.709730606127800,-3.453654683739220
Jerboa and cayman,EX5 1BG,50.709572000000000,-3.454230000000000
blind snake and skink,EX5 1BH,50.709612306818200,-3.454486667504960
diamondback turtle and Meadowlark,EX5 1BR,50.709900989043300,-3.456112000000000
Condor and Old World vulture,EX5 1EB,50.679552085611100,-3.390032224191680
Eagle and moloch,EX5 1EH,50.684107525056400,-3.395645109847910
Jerboa and Mink,EX5 1EW,50.699319000000000,-3.390886000000000
horned viper and rattlesnake,EX5 1FX,50.710484000000000,-3.455901000000000
massasauga and Bronzewing pigeon,EX5 1HS,50.677101735582000,-3.403136811545710
Wader and Masked owl,EX5 1NT,50.673559148125200,-3.403073617046910
tokay and Badger,EX5 1NW,50.672233341216400,-3.398901659470570
Marmoset and Crow,EX5 1PE,50.673545855459700,-3.400768000000000
whip snake and Maya,EX5 1PG,50.692537434146800,-3.399873788467390
Ice seal and Kākāriki,EX5 1PW,50.691575880906900,-3.397565730813300
diamond python and cerastes,EX5 1RD,50.675534474333600,-3.401844592888480
Linsang and Scimitar babbler,EX5 1SB,50.710860000000000,-3.416113000000000
frill-necked lizard and adder,EX5 2BA,50.731639000000000,-3.410533000000000
Polecat and Ground sloth,EX5 2DW,50.744988834268300,-3.388922566995370
Eagle and Parakeet,EX5 2FY,50.747346000000000,-3.389019000000000
Herring gull and Jackal,EX5 2LH,50.746896133936300,-3.389786501923440
black snake and Petrel,EX5 2LQ,50.745409000000000,-3.388697245653680
dugite and Dolphin,EX5 2PD,50.764927000000000,-3.383146000000000
amphisbaena and diamondback terrapin,EX5 2PH,50.751565698092800,-3.383559778299050
Tit-tyrant and Jackal,EX5 2UB,50.766724570186900,-3.368621033712490
Badger and dukite,EX5 3AW,50.754327521355400,-3.434819806010220
boa constrictor and rock snake,EX5 3DX,50.765550042013800,-3.441459211445000
hoop snake and Tit-tyrant,EX5 3NA,50.762266609376400,-3.438621683464900
Thrasher and anaconda,EX5 4AF,50.770034999076500,-3.509187181485260
hoop snake and death adder,EX5 4ED,50.777304719612100,-3.507548944642110
agama and Buzzard,EX5 4EQ,50.763545696774900,-3.509588073847410
Maya and blindworm,EX5 5AR,50.779622310993300,-3.588362907077950
kabaragoya and milk snake,EX5 5BT,50.758759698307500,-3.613120865148060
Chicken and Black cockatoo,EX5 5DF,50.762525195737400,-3.590407014290080
blind snake and pit viper,EX5 5ED,50.759583764310800,-3.550394270330640
diamondback terrapin and agamid,EX5 5QG,50.766250167500500,-3.546828429155420
Komodo dragon and black snake,EX5 7BU,50.745948353397900,-3.411615754414870
Maya and sand lizard,EX5 7DS,50.749039949377100,-3.411042520623730
Cloud rat and diamondback turtle,EX5 7FB,50.751950872800000,-3.404339000000000
Marmoset and krait,EX5 7GE,50.755375000000000,-3.392192000000000
deaf adder and chameleon,EX6 6BZ,50.727734604617600,-3.643878704461930
amethystine python and harlequin snake,EX6 6DR,50.715120716502500,-3.685168504911970
puff adder and sidewinder,EX6 6DW,50.725651100488900,-3.688961000044430
Partridge and boa constrictor,EX6 6JG,50.721080842846900,-3.756006182685860
anole and sand lizard,EX6 6NQ,50.712306287996000,-3.772435018354300
Peafowl and whip snake,EX6 7DP,50.703661338539900,-3.698296411588550
Stilt and agama,EX6 7DQ,50.692696400299000,-3.691005020433990
Stint and loggerhead,EX6 7JG,50.665891793374400,-3.676343883897060
Herring gull and Elephant,EX6 7JP,50.676479434856800,-3.654160070258630
puff adder and Jerboa,EX6 7JR,50.687150065464900,-3.660806929150420
habu and indigo snake,EX6 7JT,50.688234000000000,-3.649180000000000
diamondback and black snake,EX6 7LU,50.654856615870000,-3.654333924111670
Fox and Fish eagle,EX6 7NR,50.642890665104200,-3.648312706817590
blue tongue and fer-de-lance,EX6 7PE,50.654169835656800,-3.654564437614020
cayman and Gull,EX6 7QL,50.645811741779100,-3.636321400005960
bull snake and soft-shelled turtle,EX6 7QY,50.663431520941500,-3.591414166271830
Macaw and puff adder,EX6 7SS,50.707426054648600,-3.579604612525230
diamond snake and sidewinder,EX6 7TH,50.668652395136600,-3.535438544623110
tortoise and Gull,EX6 7TL,50.669157189240700,-3.536714488203110
amethystine python and goanna,EX6 7UJ,50.658893951063800,-3.526588806156280
Logrunners and Moluccan boobook,EX6 7UR,50.661326692798200,-3.527615689402540
cobra de capello and kabaragoya,EX6 7WA,50.653978002147200,-3.646522221758060
cerastes and king cobra,EX6 8AF,50.681917786629600,-3.493745000000000
Tattler and Pratincole,EX6 8BH,50.682464965973600,-3.493324289570410
Wallaby and leguaan,EX6 8DF,50.679140884655200,-3.493644000000000
hognose snake and fer-de-lance,EX6 8DQ,50.678480575532700,-3.491244530460920
carpet snake and Nukupuʻu,EX6 8DY,50.675196665064700,-3.488536259943450
Pheasant and Siskin,EX6 8EE,50.665204742893200,-3.467292193989490
Meadowlark and tokay,EX6 8EN,50.625190754483600,-3.448090745933880
Fox and Perching duck,EX6 8EZ,50.635073775085200,-3.504209230656350
loggerhead and gecko,EX6 8HH,50.607465551408100,-3.488686882801520
Zebra and amphisbaena,EX6 8JG,50.637802766040200,-3.462224267943090
Thrasher and Myna,EX6 8JQ,50.642919887334800,-3.462948857948590
black snake and Minke whale,EX6 8LQ,50.638671000000000,-3.471203000000000
Gila monster and skink,EX6 8NS,50.639822048732700,-3.470418867167790
soft-shelled turtle and racer,EX6 8NX,50.639591103158700,-3.477299010544570
Old World quail and tortoise,EX6 8PE,50.630299938576500,-3.453790469001210
Ice seal and Jay,EX6 8PR,50.626566360523600,-3.447397813162030
diamondback and mamba,EX6 8PW,50.628041874794400,-3.450963719814420
rock snake and dukite,EX6 8QD,50.625562000000000,-3.450195000000000
snapping turtle and harlequin snake,EX6 8RG,50.614925283053300,-3.447690619299980
Bunting and Skunk,EX6 8SF,50.627336071345500,-3.450588521518270
boa constrictor and amphisbaena,EX7 0AU,50.590510190969300,-3.457621977104150
loggerhead and goanna,EX7 0DN,50.583274820334800,-3.468727188184280
iguana and Marsh harrier,EX7 0DT,50.584523076539300,-3.469585332811210
black snake and Piping shrike,EX7 0EN,50.589677000000000,-3.468220000000000
Parakeet and diamond python,EX7 0FA,50.590658514009300,-3.462854299708600
Dorcopsis and lizard,EX7 0FH,50.589539000000000,-3.464161000000000
Mamo and Eagle,EX7 0FQ,50.599322252489800,-3.458898000000000
mountain devil and giant tortoise,EX7 0FS,50.600109000000000,-3.460377000000000
frill-necked lizard and gavial,EX7 0GB,50.600542000000000,-3.457126000000000
River dolphin and smooth snake,EX7 0GF,50.598804000000000,-3.458740000000000
cobra de capello and Dolphin,EX7 0GH,50.599506000000000,-3.462308000000000
grass snake and rat snake,EX7 0HG,50.587757439794700,-3.464134192586070
Elephant and Diving bird,EX7 0NS,50.599288000000000,-3.464888000000000
Maya and Parrotbill,EX7 0PD,50.601622740081100,-3.451890000000000
turtle and Myna,EX7 0PE,50.601531435400900,-3.452960158579130
Magpie and diamondback,EX7 0QT,50.603389717171400,-3.484601398591170
elapid and Petrel,EX7 9AL,50.581714744035600,-3.474752419745520
perentie and Chicken,EX7 9AS,50.582550963535800,-3.477603608146450
diamondback and Egret,EX7 9BR,50.582036281345800,-3.479889897885880
Grosbeak and Chickadee,EX7 9BZ,50.582149429347100,-3.476644650859460
Partridge and galliwasp,EX7 9EP,50.576870510558800,-3.469516596315510
Badger and giant tortoise,EX7 9ES,50.577043214765700,-3.472219590287010
box turtle and slowworm,EX7 9HW,50.581648090039300,-3.467927945577870
Badger and Jerboa,EX7 9LJ,50.581650458550700,-3.473436782706910
Tree warbler and bandy-bandy,EX7 9LP,50.583258394487900,-3.471452901475260
Fulmarine petrel and Jay,EX7 9LU,50.583258605910100,-3.470012105443320
asp and Jay,EX7 9NA,50.582258734672200,-3.473695898867100
galliwasp and Magpie,EX7 9NH,50.582439254617200,-3.476484214239960
American sparrow and gopher snake,EX7 9PB,50.580307336647900,-3.469411712669090
snake and bearded dragon,EX7 9QX,50.579137342959800,-3.478005233388910
caiman and Condor,EX8 1BZ,50.621586952841300,-3.414956108301540
Jay and jew lizard,EX8 1EF,50.618756878635100,-3.422843915595090
B and diamondback turtle,EX8 1JJ,50.620469232136300,-3.409974749290810
mud turtle and garter snake,EX8 1JQ,50.620191468056500,-3.409146523616630
ringhals and tokay,EX8 1NH,50.619052566482300,-3.412589976410930
Skunk and Wader,EX8 1NW,50.618883982569800,-3.412401155226180
Perching duck and Kite,EX8 1PB,50.617967314417100,-3.413829683653330
mountain devil and Quetzal,EX8 1PU,50.622348683616200,-3.411472959025840
Kestrel and Treepie,EX8 1RR,50.621229343313000,-3.414040616822090
mamba and Stint,EX8 1SH,50.623169855752100,-3.412727503833860
blindworm and Solitaire,EX8 1XL,50.618391416888900,-3.425518722409540
horned toad and Ground sloth,EX8 2AZ,50.615534011651200,-3.412767254929870
Solitaire and cobra de capello,EX8 2DQ,50.611230555588600,-3.389981816805480
thorny devil and adder,EX8 2EE,50.618035687432400,-3.400727793056730
gopher snake and Parrotbill,EX8 2EL,50.620006000000000,-3.394821000000000
cerastes and brown snake,EX8 2EZ,50.616179503480900,-3.398778514841460
agama and Argus,EX8 2HY,50.621110726057000,-3.392535021648360
Grosbeak and viper,EX8 2JJ,50.618519345100900,-3.403880355483540
