name,postcode,lat,lon
Perching duck and racer,BN17 5RN,50.798709640000000,-0.573523008000000
sea snake and Meadowlark,PO20 0AZ,50.726476681138200,-0.788172290173707
skink and cerastes,PO20 0BP,50.733577961492200,-0.785268369437783
cayman and harlequin snake,PO20 0DJ,50.727949996808100,-0.781120776465480
Black cockatoo and Ground sloth,PO20 0DR,50.730966300336800,-0.778888729325701
Macaw and Kākāriki,PO20 0HF,50.741580798001300,-0.776571831742824
Piping shrike and taipan,PO20 0HZ,50.725161530066600,-0.788829597048130
taipan and Kestrel,PO20 0JZ,50.730458817890000,-0.792334572856896
mamba and Cloud rat,PO20 0LA,50.729220160554200,-0.792564782798577
Solitaire and agama,PO20 0LQ,50.726493544054600,-0.794136693322599
Masked owl and Fulmarine petrel,PO20 0PG,50.736926634509500,-0.775261763482963
wall lizard and bandy-bandy,PO20 0QQ,50.731708180933500,-0.793138472748515
tiger snake and giant tortoise,PO20 0SW,50.732531050563500,-0.778026185825254
Cuscus and Grackle,PO20 0TB,50.733973341294600,-0.777492694326621
Stint and soft-shelled turtle,PO20 0UQ,50.723811185691100,-0.786101751183824
skink and American sparrow,PO20 7AS,50.795505261158500,-0.827607653813152
mud turtle and Schneider python,PO20 7DD,50.795343614507100,-0.863070055651901
Crow and River dolphin,PO20 7DQ,50.773537581700000,-0.800132424700000
frilled lizard and Tattler,PO20 7ER,50.790068037969600,-0.837845099023821
Macaw and Parrotbill,PO20 7FA,50.787087000000000,-0.839135000000000
Petrel and Gila monster,PO20 7HD,50.794681278238300,-0.834226072673279
diamondback and tree snake,PO20 7HP,50.792943600983100,-0.834921954078875
swift and hognose snake,PO20 7JH,50.766656299669400,-0.845685466550119
Myna and iguana,PO20 7JU,50.771505895283200,-0.830575956467732
horned toad and chuckwalla,PO20 7NW,50.777304769906600,-0.804688154971160
Ibex and Boto,PO20 7QH,50.788435185880400,-0.807043149418914
Kākāriki and Quetzal,PO20 8AF,50.763905908918300,-0.858797000000000
Kestrel and Siskin,PO20 8BD,50.769643964624000,-0.872556283818491
Nukupuʻu and Nukupuʻu,PO20 8DD,50.766332805537400,-0.871444717028387
Jay and Ground sloth,PO20 8DE,50.766488673398100,-0.874546444555486
Komodo dragon and Wallaby,PO20 8DP,50.766100295282900,-0.866758000000000
crocodile and Badger,PO20 8FG,50.772814909000000,-0.870338000000000
Ice seal and deaf adder,PO20 8HJ,50.770123895883200,-0.882244795785096
Tit-tyrant and Ice seal,PO20 8JS,50.761159293698200,-0.859162820239862
Armadillo and hoop snake,PO20 8LA,50.760826577492500,-0.857327695997458
gecko and Philippine hawk-owl,PO20 8NE,50.772141050778700,-0.874113010315451
constrictor and Mamo,PO20 8PT,50.774940870118000,-0.862500000000000
Jackal and krait,PO20 8QT,50.770348423501000,-0.871007758668949
leathery turtle and Kestrel,PO20 8SR,50.765723718493300,-0.858754055768769
copperhead and Argus,PO20 9BN,50.753530000000000,-0.781557000000000
carpet snake and Armadillo,PO20 9DY,50.747904491370800,-0.781878490130080
tortoise and blind snake,PO20 9ER,50.735603034406300,-0.789750718988503
coral snake and Herring gull,PO20 9EU,50.735375544885800,-0.796445264555440
ringhals and crocodile,PO20 9EZ,50.735554757111000,-0.794640956241562
Pitohui and soft-shelled turtle,PO20 9HJ,50.725769193751600,-0.797144740489035
bushmaster and glass snake,PO21 1AP,50.786719000000000,-0.674571000000000
Songlark and gecko,PO21 1BY,50.786363287923100,-0.675432000000000
bearded lizard and adder,PO21 1DD,50.786661058826000,-0.674345220095649
iguana and horned viper,PO21 1EE,50.784530211286900,-0.671227824957980
Wallaby and Mouse,PO21 1EW,50.785762848468400,-0.674583000000000
bandy-bandy and B,PO21 1FD,50.782394846616000,-0.679586732024372
python and Prion,PO21 1FH,50.782320185350800,-0.677758936904533
Solitaire and taipan,PO21 1HE,50.785356438459100,-0.670339049830383
Linsang and bull snake,PO21 1LH,50.783228951362300,-0.672257692333013
Ground sloth and Recurvebill,PO21 1NX,50.783314652896100,-0.666368255638054
Armadillo and Maya,PO21 1PH,50.782902000000000,-0.678156744668753
turtle and blue racer,PO21 1PY,50.784464719577500,-0.674166164480084
Partridge and Parrotbill,PO21 1QL,50.784881567256600,-0.676821350088507
diamond snake and Philippine hawk-owl,PO21 1QR,50.783938061982300,-0.676096133989496
glass snake and water snake,PO21 1QU,50.783705152965300,-0.673010233135241
boa and Eagle,PO21 2AP,50.787086000000000,-0.678362000000000
fer-de-lance and Mamo,PO21 2AW,50.787442827521700,-0.678252858128901
cobra de capello and agamid,PO21 2AX,50.788752497792600,-0.681138492897207
flying lizard and dukite,PO21 2DQ,50.781784327769900,-0.685249589974674
Hawk and hoop snake,PO21 2ES,50.789129773501200,-0.678716034620562
Mamo and adder,PO21 2LA,50.787325158162400,-0.679774160114473
Minke whale and Solitaire,PO21 2LE,50.780458221096800,-0.682492390674519
Thrasher and Nukupuʻu,PO21 2NJ,50.781203639610400,-0.685592125472613
gecko and cycling lizard,PO21 2SD,50.784169834845700,-0.687055220505039
Night heron and Parrotlet,PO21 2SS,50.783189368078800,-0.687834509101327
dukite and Pitohui,PO21 2YE,50.783179998650400,-0.688600788494244
Francolin and sea snake,PO21 3EB,50.785326224485900,-0.721537701381324
worm lizard and soft-shelled turtle,PO21 3EQ,50.786617227269200,-0.720353387677427
alligator and Solitaire,PO21 3HY,50.780382353588000,-0.725856962444112
Tit-tyrant and king snake,PO21 3JH,50.779296530387400,-0.731021176806393
Chickadee and gopher snake,PO21 3JW,50.781187018309100,-0.730374250741056
thorn lizard and Partridge,PO21 3NG,50.781634733634100,-0.740149766145137
Gila monster and frilled lizard,PO21 3NH,50.780624581763800,-0.728275961770891
grass snake and Dorcopsis,PO21 3NQ,50.781259127500200,-0.740344261430651
bicycle lizard and mountain devil,PO21 3SP,50.781805453106600,-0.704824407244498
Mouse and White ibis,PO21 3TN,50.781946132179500,-0.699685510017015
Peafowl and diamondback,PO21 3TY,50.782637591688200,-0.699595406921453
Maya and Pitohui,PO21 4AH,50.778943099842100,-0.702165916177930
tiger snake and diamondback terrapin,PO21 4DB,50.781490820163000,-0.712961085325680
Pitohui and krait,PO21 4EF,50.774971249779200,-0.718713922211351
Shearwater and Ground sloth,PO21 4JA,50.782372878928400,-0.712213426248491
box turtle and diamond python,PO21 4JL,50.779730661545500,-0.721364024927944
Rat and rock snake,PO21 4JR,50.779976231785700,-0.723258051062341
habu and flying lizard,PO21 4LG,50.778310809483500,-0.721459475861962
thorn lizard and carpet snake,PO21 4NE,50.779665981885700,-0.710585638101049
Cuscus and asp,PO21 4PQ,50.771581020134900,-0.736037603008148
Masked owl and tree snake,PO21 4PU,50.775512176000000,-0.730116677800000
Perching duck and Mamo,PO21 4RJ,50.772150925645200,-0.738007741121459
crocodile and River dolphin,PO21 4RX,50.773515724000400,-0.735318886824169
slowworm and mamba,PO21 4UT,50.768842976586300,-0.742308524010848
dukite and Jay,PO21 4XF,50.770781149546200,-0.732769002226481
blue racer and Songlark,PO21 5AU,50.799631715168600,-0.692113744134710
krait and Pitohui,PO21 5BA,50.797389492457600,-0.690246511857472
amphisbaena and Philippine hawk-owl,PO21 5EX,50.796561067733900,-0.694966406558308
puff adder and bearded lizard,PO21 5FH,50.794073244400000,-0.692623688900000
Pratincole and Chicken,PO21 5GE,50.793448072800000,-0.691406719100000
Jackal and dukite,PO21 5HQ,50.797517985642000,-0.691278778983154
Rat and Linsang,PO21 5JP,50.793141150146600,-0.688322090418325
pit viper and bull snake,PO21 5LH,50.792557000000000,-0.693049000000000
bearded lizard and Bunting,PO21 5LJ,50.791997997258900,-0.691432915306191
taipan and Linsang,PO21 5LN,50.792309301111200,-0.689635000000000
leguaan and flying lizard,PO21 5LS,50.790197472459600,-0.686460761478613
Nukupuʻu and Fish eagle,PO21 5LW,50.791329752986300,-0.688784233522033
Moluccan boobook and fer-de-lance,PO21 5NX,50.791765254266800,-0.693936518348295
glass snake and Lemming,PO21 5QF,50.790932000000000,-0.703764000000000
sand lizard and skink,PO21 5QZ,50.786677562695900,-0.703824427217140
Rat and Chipmunk,PO21 5SA,50.787770255226900,-0.700190747452198
whip snake and boomslang,PO21 5TS,50.796843702487200,-0.697725513828381
Civet and Lemming,PO21 9HD,50.783947988600000,-0.671216054800000
Skunk and New World blackbird,PO22 6AT,50.798083735239000,-0.631636400306364
diamondback and Goose,PO22 6BE,50.796470361300000,-0.634961404400000
king cobra and Hawk,PO22 6DU,50.796105150105400,-0.618654033724489
Fish eagle and Booted eagles,PO22 6HL,50.794806263325600,-0.612264653396017
Vole and Guillemot,PO22 6HN,50.795614174624000,-0.612141403509454
gopher snake and anole,PO22 6HU,50.791428672010500,-0.605043604628287
Gila monster and Chipmunk,PO22 6JF,50.793019184508400,-0.602683526081072
Snipe and American sparrow,PO22 6JG,50.793297203330900,-0.603370481634453
Rat and slowworm,PO22 6LR,50.794962117443900,-0.609493151822609
Jay and Night heron,PO22 6QD,50.799914513460100,-0.632704000000000
tree snake and hoop snake,PO22 6RB,50.796397612823700,-0.629727474741010
Francolin and massasauga,PO22 6SJ,50.797620987402700,-0.622880525964252
rock snake and diamond python,PO22 6SP,50.796984096028500,-0.621494456508405
Hawaiian honeycreeper and Polecat,PO22 7BE,50.787392409005600,-0.657300373526694
Marsh harrier and Jay,PO22 7BF,50.789850210700000,-0.642703000000000
python and blue tongue,PO22 7DJ,50.787893414605300,-0.654732369036775
Scimitar babbler and Pitohui,PO22 7ES,50.790544933047600,-0.651492396119062
Elephant and Grouse,PO22 7HX,50.790755792169200,-0.642533799928987
soft-shelled turtle and blue tongue,PO22 7LQ,50.788529727629900,-0.643138000000000
kabaragoya and death adder,PO22 7PH,50.790654167260800,-0.653163414694971
Thicketbird and Polecat,PO22 7PJ,50.790991859812300,-0.652813201368637
Gila monster and asp,PO22 7QT,50.793701620294100,-0.630657626966566
asp and Scimitar babbler,PO22 7QW,50.792770249926000,-0.634827872677351
viper and krait,PO22 7RG,50.790417418713200,-0.628213966639673
rat snake and Tree warbler,PO22 7RS,50.791809049174700,-0.624200543826443
caiman and alligator,PO22 7RX,50.790469838857000,-0.621217854987387
tortoise and Scimitar babbler,PO22 7SS,50.794186000000000,-0.619732000000000
Piping shrike and horned viper,PO22 8AJ,50.795284972852100,-0.668780345134338
sand viper and saltwater crocodile,PO22 8EF,50.793644613056600,-0.653520000000000
blue racer and Kestrel,PO22 8EU,50.799518681989100,-0.652156536855570
bushmaster and adder,PO22 8JN,50.793742778457300,-0.648066030318552
Peafowl and Pratincole,PO22 8JQ,50.798158260053600,-0.646505444428837
Pratincole and Nukupuʻu,PO22 8LN,50.796900984368700,-0.640468562991815
blue racer and rattlesnake,PO22 8LU,50.796818845158900,-0.645777888283463
Night heron and Masked owl,PO22 8NE,50.797059950109700,-0.644082339677711
Chicken and black snake,PO22 8NF,50.796475000000000,-0.646270000000000
Philippine hawk-owl and sea snake,PO22 9BJ,50.797509621192200,-0.689732320037215
viper and Zebra,PO22 9HU,50.798858737963200,-0.678583626001195
Cloud rat and Vulture,PO22 9JT,50.798673063280100,-0.674899407939691
sand viper and horned toad,PO22 9NB,50.795444787876200,-0.684454904805245
turtle and diamond snake,PO22 9QB,50.794387984597600,-0.675304347378299
gaboon viper and Gila monster,PO22 9RR,50.794580169189500,-0.672432742899883
River dolphin and thorn lizard,PO22 9SD,50.785853000000000,-0.675957000000000
jew lizard and Vulture,PO22 9SS,50.794520139755000,-0.670320288897200
wall lizard and Scimitar babbler,PO22 9SX,50.796098215403900,-0.666756532978939
