name,postcode,lat,lon
B and Goose,AB30 1AY,56.817416470000000,-2.518470383000000
Civet and Wallaby,AB30 1FX,56.831422250000000,-2.473173080000000
box turtle and slowworm,AB30 1GP,56.832008440000000,-2.470197961000000
snapping turtle and Solitaire,AB30 1JB,56.851622090000000,-2.391382609000000
worm lizard and deaf adder,AB30 1LL,56.927889310000000,-2.308900832000000
Asiatic leopard and Wader,AB30 1NS,56.880619000000000,-2.380230818000000
Kangaroo and king cobra,AB30 1PF,56.869528000000000,-2.331876000000000
indigo snake and dukite,AB30 1UH,56.782547440000000,-2.512784780000000
Badger and Black cockatoo,AB30 1UQ,56.802804000000000,-2.486207000000000
rock snake and Vulture,AB30 1UW,56.781752800000000,-2.515948857000000
Dorcopsis and racer,AB39 2TY,56.896354770000000,-2.226382467000000
Lemming and bicycle lizard,AB39 3YP,56.944222730000000,-2.402954357000000
Black cockatoo and cobra,DD10 0BQ,56.775141523786100,-2.414655100038320
Puffleg and pit viper,DD10 0BU,56.777271090660400,-2.417214946536400
box turtle and River dolphin,DD10 0BX,56.772574198514200,-2.414054123007930
Kestrel and anole,DD10 0DN,56.793019000000000,-2.368753000000000
Night heron and rattlesnake,DD10 0EA,56.773135001253400,-2.426249795699870
garter snake and Stint,DD10 0LD,56.828613928258700,-2.282029043416010
Treepie and alligator,DD10 0PE,56.840140518283900,-2.277690249642330
Pheasant and Thrasher,DD10 0RU,56.845475975008500,-2.282024806061670
Thicketbird and Marmoset,DD10 9DR,56.728392963030800,-2.464850273323600
Tattler and blind snake,DD10 9EQ,56.738713897976600,-2.486392088527910
leathery turtle and saltwater crocodile,DD10 9FN,56.725068099659700,-2.476966857872080
frill-necked lizard and cayman,DD10 9HA,56.740824619201700,-2.477215585363140
copperhead and Pitohui,DD10 9HN,56.743100522001700,-2.483424270340170
harlequin snake and goanna,DD10 9HU,56.741902318641900,-2.484291681594560
whip snake and Chickadee,DD10 9HY,56.741025960033000,-2.487860580966210
cayman and Ibex,DD10 9JR,56.760451071103500,-2.482649563397190
Shearwater and frilled lizard,DD10 9NB,56.725288000000000,-2.478277000000000
Parrotlet and Black cockatoo,DD10 9PB,56.733454000000000,-2.466384000000000
