name,id,postcode,lat,lon
Night heron and amethystine python,498959,RG14 6AL,51.394345030635200,-1.341551832322070
slowworm and Magpie,300087,SP11 0BG,51.279364100587800,-1.454897532980680
bearded lizard and whip snake,2658631,SP11 6ZE,51.220256000000000,-1.441277000000000
krait and rat snake,498549,RG14 7QU,51.390107340039400,-1.322167545344830
viper and Parakeet,299097,SP11 9NL,51.255928058570300,-1.612172410100110
cycling lizard and Quetzal,299921,SP11 6BQ,51.255944753297800,-1.402383023871700
B and indigo snake,2631908,SP11 9GE,51.252726000000000,-1.620642000000000
Wallaby and elapid,300593,SP10 3AH,51.206549000000000,-1.491000000000000
Puffleg and Old World quail,299816,SP11 7BG,51.189450651435400,-1.531067632553600
Quetzal and indigo snake,498977,RG14 6BL,51.396429427206000,-1.338057831248600
asp and tiger snake,490299,RG28 7JW,51.226372353447100,-1.334441622176190
Puffleg and tiger snake,299884,SP11 0ST,51.219982000000000,-1.552293000000000
anaconda and Fish eagle,299197,SP11 9QR,51.257661318869700,-1.622518681959570
Crow and Skunk,495963,RG20 0HP,51.389092111049200,-1.410495371118030
hawksbill and copperhead,299182,SP11 8EB,51.216485636212300,-1.569865912422550
Buzzard and New World blackbird,499242,RG14 5NL,51.398699672778100,-1.332476509301240
tuatara and dukite,1804988,RG17 9AA,51.397429000000000,-1.476840000000000
milk snake and Warbler,490621,RG28 7BP,51.235556000000000,-1.341099000000000
Booted eagles and Parrotlet,320785,SN8 3LP,51.381009778864000,-1.605857963747790
bushmaster and slowworm,299777,SP11 0LZ,51.265225226562900,-1.425911841653800
Skunk and glass snake,320649,SN8 3DE,51.343120710064700,-1.634236369768000
rock snake and rat snake,495167,RG20 9LL,51.320768403778600,-1.338831000000000
Mink and Goose,499290,RG14 5RJ,51.399743463777000,-1.316993974247410
Stilt and water snake,494850,RG20 9UP,51.350944296100100,-1.388512143366550
Chickadee and green turtle,2584901,SP11 9FU,51.242781000000000,-1.611380000000000
box turtle and elapid,300225,SP10 4NL,51.228551338043600,-1.482794294029290
saltwater crocodile and Perching duck,293704,SP9 7EN,51.238603000000000,-1.668069000000000
Mamo and Pratincole,299794,SP11 0NX,51.270947758765300,-1.413942870925510
Ice seal and Bunting,320554,SN8 3AP,51.344658051340300,-1.667361152608020
Black jay and B,498751,RG14 6TD,51.378160745651100,-1.348149030047280
black snake and chameleon,299924,SP11 6BU,51.246176465849500,-1.391320279174100
galliwasp and Mamo,300758,SP10 2AF,51.203892726820100,-1.476142521700000
agama and Magpie,320551,SN8 3AJ,51.348788484668900,-1.665335406605500
Skunk and snake,299951,SP10 5NU,51.211954134717200,-1.451613303257800
rat snake and Hawk,293329,SP9 7JW,51.245347314913700,-1.665555992134880
New World blackbird and Maya,300158,SP10 4DB,51.225223842969100,-1.482688366878020
gecko and Polecat,299119,SP11 9PP,51.262236144089700,-1.610901162769900
Old World quail and turtle,293496,SP9 7UF,51.207558000000000,-1.669423000000000
Scimitar babbler and Diving bird,299819,SP11 7BN,51.186449789788500,-1.531684707801380
frill-necked lizard and elapid,496912,RG19 8XQ,51.382050565461600,-1.314412133456950
Cloud rat and cycling lizard,2455358,SP11 6LD,51.210215000000000,-1.436202000000000
cobra and Kite,2637116,SP10 4FA,51.221182000000000,-1.494721000000000
ringhals and Condor,300316,SP10 5JD,51.226269499872600,-1.475186944978690
king cobra and Capuchin,498782,RG14 7AU,51.388170989372000,-1.327872780857100
Siskin and puff adder,497838,RG17 9XN,51.398531064020800,-1.445016443327780
worm lizard and blindworm,490617,RG28 7BH,51.229992000000000,-1.338857000000000
harlequin snake and Grouse,498799,RG14 7BW,51.395942194688200,-1.326709668000430
whip snake and Chicken,299209,SP11 9RF,51.253921137745000,-1.625458112613210
Viscacha and Maya,2591326,SP11 6YJ,51.230818000000000,-1.471398000000000
Wallaby and Scimitar babbler,1750231,SP11 6WF,51.220215973990400,-1.444498000000000
Skunk and tree snake,498843,RG14 7EY,51.385021850104700,-1.321279842829020
chameleon and Mamo,495149,RG20 9JN,51.345261432832600,-1.332477527854400
blue racer and Grosbeak,495170,RG20 9LQ,51.326048584037600,-1.344108658400930
Badger and goanna,300159,SP10 4DD,51.225840459187800,-1.481822226325720
Mink and taipan,299527,SP11 6DR,51.262420909096700,-1.370152537851150
python and bearded dragon,498984,RG14 6BY,51.396735465962900,-1.327057374706340
Philippine hawk-owl and Old World warbler,300871,SP10 2HS,51.195272686449300,-1.482952110706260
Kākāriki and Prion,300518,SP10 3ZN,51.206327496120600,-1.481740503783150
Grackle and Macaw,299284,SP11 8LS,51.210542783755600,-1.582519095268810
king snake and River dolphin,2614413,SP10 4EW,51.218723000000000,-1.495807000000000
thorn lizard and king cobra,300277,SP10 5EA,51.221554243680300,-1.468438917997060
frilled lizard and constrictor,498616,RG17 0RG,51.386355459599000,-1.547367130040870
Pitohui and Shearwater,297332,SP4 0EF,51.191154463065400,-1.656761279614070
Snipe and gopher snake,498999,RG14 6DT,51.391335373190200,-1.342212000000000
Grackle and horned viper,293490,SP9 7TY,51.208373738881400,-1.675572186603140
Pitohui and hognose snake,300254,SP10 5BX,51.220925179450100,-1.472498438319220
Skunk and diamond python,299855,SP11 0RE,51.226467062014800,-1.530176228202170
chuckwalla and amphisbaena,498581,RG14 7TA,51.389311086558100,-1.313585093474950
Kākāriki and habu,1750168,SP11 6GT,51.226795178874800,-1.463380778634880
brown snake and snake,299852,SP11 0RA,51.222496767448600,-1.529172000000000
Chickadee and B,300820,SP10 2ER,51.196770736163400,-1.482133907001970
black snake and brown snake,298953,SP11 9DQ,51.263263776027200,-1.555986185822240
boa constrictor and worm lizard,293442,SP9 7QN,51.237375357295800,-1.660643310448140
worm lizard and horned toad,499114,RG14 6RB,51.381216227752900,-1.351080035352480
puff adder and hawksbill,300459,SP10 3TD,51.214856418076500,-1.482761542794470
bandy-bandy and viper,299052,SP11 9HP,51.239775871312100,-1.555825000000000
goanna and Jerboa,299513,SP11 7QU,51.191027139805800,-1.492930551244880
Old World quail and Old World warbler,499207,RG14 5LF,51.398545000000000,-1.325551874132740
Lemming and alligator,300855,SP10 2FN,51.205288000000000,-1.488423000000000
Black jay and deaf adder,299866,SP11 0RT,51.264904768508400,-1.522818995054190
B and Fox,300617,SP10 3BQ,51.208363839334700,-1.503447981336620
cerastes and caiman,301115,SP10 1NE,51.209479621674800,-1.478799105102740
Schneider python and Grouse,293483,SP9 7TN,51.206045979099300,-1.675989327795900
Thrasher and ringhals,300920,SP10 2NU,51.206381938515800,-1.477689000000000
gecko and bull snake,1750184,SP11 6RS,51.230365000000000,-1.461923582436470
giant tortoise and Bunting,300190,SP10 4HE,51.221940235242100,-1.500982276033430
sand lizard and Tahr,300020,SP11 6DG,51.251238581812200,-1.394720964770150
cobra and gaboon viper,298950,SP11 9DL,51.255595740153500,-1.583472778482330
goanna and Lemming,299083,SP11 9LR,51.242747926370300,-1.610062696153130
crocodile and Asiatic leopard,498214,RG17 9QB,51.380157613517200,-1.465584570493490
Skunk and Quetzal,297308,SP4 0DR,51.184831000000000,-1.668140000000000
bearded dragon and Parrotbill,299903,SP11 6AQ,51.233456466078200,-1.442620889493220
Partridge and agamid,300424,SP10 3RP,51.211942436324200,-1.486716815426090
Kākāriki and Warbler,498558,RG14 7RL,51.383074007450400,-1.337589436989760
soft-shelled turtle and galliwasp,499149,RG14 5DP,51.398818222721700,-1.324913762976790
Black jay and Gila monster,299662,SP11 6NN,51.190434998868900,-1.401785106784750
Mink and slowworm,300452,SP10 3SU,51.215816570397500,-1.488449120831600
hawksbill and Duck,299541,SP11 6EL,51.254963119144000,-1.405619907450800
Philippine hawk-owl and python,299540,SP11 6EJ,51.254765000000000,-1.406998000000000
Greenbul and Mouse,320678,SN8 3ES,51.279747000000000,-1.657649196637250
death adder and Fish eagle,299801,SP11 0PG,51.270329060235400,-1.436283701465260
Siskin and Grosbeak,300015,SP11 6DA,51.245999145615500,-1.390076184256150
sea snake and Fox,299240,SP11 8HA,51.206863018588200,-1.518723502836820
Flameback and copperhead,299522,SP11 7RF,51.177230497677200,-1.486086459136570
brown snake and green turtle,490615,RG28 7BF,51.237230225675900,-1.333654763191430
rock snake and Jerboa,300356,SP10 3NB,51.214323478855700,-1.507220855847110
Chicken and Cloud rat,298960,SP11 9DY,51.278361856316600,-1.551453674061680
deaf adder and Komodo dragon,498868,RG14 7JB,51.395365356859000,-1.317145389987450
Gila monster and adder,299212,SP11 9RJ,51.253784077576100,-1.627594267930020
Mink and adder,300368,SP10 3NS,51.204109724449200,-1.509634308730400
Thrasher and skink,2647179,SP11 6YY,51.231170000000000,-1.469733000000000
Civet and Hawk,2630553,RG28 7FU,51.221922000000000,-1.336581000000000
Guillemot and chameleon,495188,RG20 9NY,51.344472004458900,-1.375217031786260
Ibex and Booted eagles,498767,RG14 7AA,51.384943458167600,-1.309396824704950
Meadowlark and Polecat,495988,RG20 0JX,51.380828651793400,-1.377438088906390
puff adder and River dolphin,498964,RG14 6AS,51.395027622655200,-1.341298000000000
Civet and lizard,490387,RG28 7RD,51.213343556054500,-1.340914443456910
Dorcopsis and cobra,293352,SP9 7NB,51.242997303061300,-1.655172503850630
Vulture and Stilt,297337,SP4 0EN,51.180586449945600,-1.698328331751830
massasauga and blindworm,299190,SP11 9QG,51.256711294048900,-1.623486570266050
Quetzal and massasauga,299558,SP11 6FP,51.225416000000000,-1.469139000000000
gavial and garter snake,300715,SP10 3JA,51.210493541348200,-1.486446599491230
boa and harlequin snake,320482,SN8 3TZ,51.352376255800800,-1.668525899541680
amethystine python and cobra de capello,498985,RG14 6BZ,51.396027980363600,-1.327556456950600
Mole and Cuscus,300014,SP11 6BZ,51.245916982260000,-1.391567258649490
Recurvebill and gopher snake,299707,SP11 6QY,51.199995668017600,-1.403965662679660
Tree warbler and Magpie,498996,RG14 6DP,51.391605374253700,-1.340455731952560
massasauga and Goose,299261,SP11 8JJ,51.177340378694900,-1.602031052407520
gecko and River dolphin,495626,RG20 0PA,51.360538536471700,-1.398940919555260
milk snake and Jerboa,320352,SN8 3RA,51.368106300162400,-1.501794954714690
Minke whale and Black cockatoo,499154,RG14 5DY,51.398296186144800,-1.326503000000000
carpet snake and horned toad,300096,SP11 0BU,51.282134474502400,-1.460772000000000
Greenbul and Rat,320626,SN8 3AX,51.360004069392700,-1.672736477979220
Greenbul and Dolphin,299034,SP11 9FE,51.256186042488200,-1.622330136266760
pit viper and ringhals,300154,SP10 4BX,51.222814810035100,-1.482872872491650
Thrasher and Piping shrike,300862,SP10 2HF,51.198943898909700,-1.483512149106110
Egret and Elephant,293487,SP9 7TU,51.207198666984200,-1.676611091752330
perentie and Snipe,300407,SP10 3QS,51.206786508614000,-1.485915222327250
blue tongue and Stilt,2658634,SP11 6ZR,51.220866000000000,-1.456262000000000
Old World quail and Greenbul,300998,SP10 1DG,51.210743211786500,-1.479858536516160
Warbler and Marsh harrier,1805060,RG20 9AH,51.345244875800000,-1.333698339000000
Egret and Quetzal,300681,SP10 3FD,51.206169952555300,-1.482859000000000
rock python and diamondback,498896,RG14 7LS,51.396461174028300,-1.324877000000000
cycling lizard and boa,300721,SP10 3JH,51.212227065665500,-1.487472000000000
bearded dragon and dugite,498588,RG14 7TR,51.391777629519100,-1.312527760206310
Pitohui and king cobra,299503,SP11 7QG,51.190952960607500,-1.494491122651930
giant tortoise and Eagle,293685,SP9 7AQ,51.222780468917100,-1.679437506321680
Diving bird and Linsang,495958,RG20 0HG,51.380928000000000,-1.387552000000000
mamba and diamondback terrapin,320464,SN8 3TB,51.349296529391300,-1.670098863904740
Quetzal and sand lizard,495066,RG20 9DX,51.359263857426900,-1.329703268435560
krait and green turtle,2658455,SN8 3FW,51.263337000000000,-1.652687000000000
mountain devil and Komodo dragon,312917,SO21 3QD,51.177537000000000,-1.303472000000000
blind snake and Rat,299603,SP11 7RS,51.175542963153200,-1.486763236737390
Flameback and Songlark,320437,SN8 3RT,51.341456000000000,-1.672782000000000
rat snake and soft-shelled turtle,299654,SP11 6LZ,51.223470470276700,-1.412197277327520
Vulture and hoop snake,300735,SP10 1QJ,51.207600000000000,-1.480366000000000
Grackle and mud turtle,299874,SP11 0SD,51.272342540919700,-1.532102727143920
Triller and Asiatic leopard,499039,RG14 6HT,51.388572054993300,-1.336719660068770
Diving bird and king cobra,299561,SP11 6FW,51.225194000000000,-1.467638000000000
rock python and adder,300571,SP10 2SF,51.206480689891400,-1.475755314893470
whip snake and death adder,497758,RG17 9TH,51.399481642517800,-1.457927801181670
rock python and Solitaire,297303,SP4 0DH,51.178534815228000,-1.680817123009930
Zebra and American sparrow,300273,SP10 5DW,51.220378045339700,-1.468824747473990
milk snake and Herring gull,498786,RG14 7BB,51.396563234218900,-1.326815545262260
Crow and elapid,2647184,SP11 8FH,51.213772000000000,-1.535821000000000
Magpie and Crow,499068,RG14 6NE,51.382558848692500,-1.340312699690490
Mockingbird and deaf adder,498713,RG14 9SS,51.398367431280300,-1.324704779975540
rock snake and blue racer,299409,SP11 9AD,51.231156520057000,-1.563928768294720
Pitohui and whip snake,1804951,RG14 7GN,51.394660000000000,-1.310113000000000
rock snake and Hawaiian honeycreeper,300377,SP10 3PE,51.210081990382400,-1.505734329455950
python and Kite,300334,SP10 3JZ,51.214307869709100,-1.493032935439030
chameleon and puff adder,300750,SP10 1RW,51.208508701004400,-1.480871440845700
leathery turtle and goanna,320470,SN8 3TJ,51.352641990375700,-1.670290256968050
Maya and Thrasher,2630549,RG28 7FQ,51.230857000000000,-1.345604000000000
blindworm and Kākāriki,299546,SP11 6ES,51.274436721551400,-1.384166318743700
Linsang and Armadillo,498118,RG17 9DT,51.373820000000000,-1.489766000000000
pit viper and Parrotlet,490606,RG28 7AR,51.228634809857100,-1.341383000000000
Black cockatoo and garter snake,299942,SP10 5ND,51.228692345081700,-1.478095291166040
Fox and mamba,299571,SP11 6HE,51.239850642338800,-1.475920643463710
sea snake and Songlark,498960,RG14 6AN,51.394762609931800,-1.339059261357790
tiger snake and Cuscus,293477,SP9 7TD,51.206983357991200,-1.673549273755320
Minke whale and thorn lizard,300327,SP10 3JR,51.214625505429400,-1.489564724851220
dukite and soft-shelled turtle,498840,RG14 7EU,51.386064224921100,-1.321163834632360
Partridge and rattlesnake,300614,SP10 3BL,51.207804399854100,-1.505114524980300
garter snake and mamba,2592480,SP9 7WS,51.246265000000000,-1.657243000000000
Diving bird and tree snake,300198,SP10 4LJ,51.221467008619700,-1.489245676742630
Eagle and viper,293339,SP9 7LH,51.242245462018000,-1.665908000000000
Francolin and skink,320699,SN8 3HG,51.285802858699300,-1.653576112966410
rock python and alligator,300766,SP10 2AR,51.204371273009400,-1.470583313942130
puff adder and Goose,301077,SP10 1JE,51.211928982357200,-1.473560366869600
gaboon viper and Condor,299330,SP11 7DB,51.192908525633900,-1.543697162344460
Recurvebill and bearded dragon,499315,RG14 5TA,51.399329107330300,-1.309194661764250
goanna and milk snake,299422,SP11 9AW,51.244161000000000,-1.571442000000000
Vulture and racer,299945,SP10 5NJ,51.227900685722000,-1.473994065745170
Fox and python,299502,SP11 7QF,51.190669706210800,-1.493449618117500
flying dragon and Ice seal,499043,RG14 6JD,51.390519058278000,-1.331230174390690
leguaan and Hawaiian honeycreeper,299970,SP10 5RJ,51.206327496120600,-1.481740503783150
White ibis and grass snake,498785,RG14 7AY,51.387013015935800,-1.329786693190510
Hawk and Thrasher,301106,SP10 1LR,51.208788865381800,-1.479164779303610
Goose and galliwasp,320332,SN8 3QA,51.361681545319900,-1.544881298554220
giant tortoise and Grouse,499065,RG14 6NA,51.384891253475700,-1.337750024204150
Cloud rat and Mockingbird,299248,SP11 8HP,51.205366944632400,-1.526712071727480
Zebra and Stilt,300798,SP10 2DH,51.201821656776900,-1.473489455422750
Asiatic leopard and Macaw,2630550,RG28 7FR,51.230327000000000,-1.345598000000000
Treepie and Tree warbler,490344,RG28 7NN,51.236348553482000,-1.304346000000000
habu and cobra de capello,490611,RG28 7AZ,51.232569716137800,-1.344335170624140
adder and smooth snake,499151,RG14 5DS,51.398450381008300,-1.323294000000000
Francolin and Petrel,498117,RG17 9DS,51.372124419022500,-1.486925543486720
terrapin and harlequin snake,300801,SP10 2DN,51.199571387378600,-1.472985535799060
rock snake and racer,498200,RG17 9EB,51.382032000000000,-1.496715000000000
Mink and Gull,300455,SP10 3SY,51.217260091073900,-1.489549924941490
leguaan and boomslang,299724,SP11 7AR,51.186304289950300,-1.411768524930270
anole and Booted eagles,300616,SP10 3BP,51.209727489701200,-1.513411238165710
Ice seal and cycling lizard,495635,RG20 0PN,51.364620441225400,-1.400625531716630
gecko and Armadillo,2591434,SP11 9GF,51.251635000000000,-1.622757000000000
Stilt and Thicketbird,300886,SP10 2JP,51.203559479787800,-1.492349311448030
Perching duck and bushmaster,300449,SP10 3SQ,51.216177428363500,-1.514387000000000
Thicketbird and Ground sloth,293794,SP9 7GL,51.238712000000000,-1.652985791454360
death adder and giant tortoise,495930,RG20 0AQ,51.367888000000000,-1.448719000000000
Fox and anaconda,300192,SP10 4JX,51.218393000000000,-1.478997996210190
Nukupuʻu and chuckwalla,499106,RG14 6QP,51.381259492130400,-1.344311600334640
racer and dugite,490411,RG28 7SU,51.233735201869500,-1.345321226079360
Marmoset and Night heron,495317,RG20 9SQ,51.316052785214400,-1.405362069005130
Masked owl and Guillemot,299262,SP11 8JL,51.176507836643700,-1.603125409117250
swift and Grackle,300635,SP10 1PR,51.211138799370600,-1.459983514208250
flying lizard and harlequin snake,299094,SP11 9NG,51.253486103162800,-1.607922880676710
harlequin snake and jew lizard,293347,SP9 7LU,51.242167000000000,-1.663115000000000
Kangaroo and rattlesnake,320716,SN8 3JD,51.394357302174300,-1.604334799334720
Black cockatoo and B,499135,RG14 5BL,51.399700815725900,-1.329860095922100
Treepie and Goose,300461,SP10 3TG,51.215328941117400,-1.508971150618850
Lemming and Mockingbird,300271,SP10 5DT,51.220560297969600,-1.467376442695080
