name,postcode,lat,lon
cobra and whip snake,BB10 1DH,53.796291120000000,-2.242861873000000
Masked owl and White ibis,BB10 1DQ,53.798147190000000,-2.240610509000000
mamba and krait,BB10 1NH,53.799589620000000,-2.238432510000000
Mockingbird and Jerboa,BB10 3HY,53.789162400000000,-2.215316982000000
Jerboa and brown snake,BB10 3JD,53.792351110000000,-2.221359702000000
Night heron and caiman,BB10 3JF,53.790836030000000,-2.219241803000000
snake and bushmaster,BB10 3LR,53.789284000000000,-2.191819840000000
Grouse and diamond python,BB10 3LY,53.789706780000000,-2.191124740000000
Treepie and turtle,BB10 3PZ,53.799892000000000,-2.226455000000000
Warbler and python,BB10 4AX,53.788098940000000,-2.231324574000000
water snake and Fulmarine petrel,BB10 4BQ,53.793212640000000,-2.231565263000000
Marmoset and Grackle,BB10 4EG,53.786427160000000,-2.231330545000000
bushmaster and Argus,BB10 4EL,53.786288740000000,-2.228521929000000
Tit-tyrant and Prion,BB10 4HH,53.787036000000000,-2.208506000000000
loggerhead and Thrasher,BB10 4HZ,53.782875710000000,-2.202187565000000
Ice seal and Bronzewing pigeon,BB10 4JR,53.782890500000000,-2.209274995000000
mud turtle and Francolin,BB10 4PD,53.785029540000000,-2.219378444000000
adder and Mockingbird,BB10 4RN,53.770218000000000,-2.188137708000000
Cloud rat and krait,BB10 4RW,53.769785490000000,-2.182082864000000
giant tortoise and bandy-bandy,BB10 4SH,53.765537950000000,-2.207383349000000
blue racer and chuckwalla,BB10 4SP,53.758527000000000,-2.197535000000000
dugite and tuatara,BB10 4TE,53.762374080000000,-2.196779808000000
harlequin snake and Darwin's finches,BB10 4TW,53.765957460000000,-2.203850750000000
Komodo dragon and whip snake,BB10 4TY,53.767440780000000,-2.208894645000000
king cobra and turtle,BB10 4UE,53.768118750000000,-2.211810853000000
python and Prion,BB11 1ER,53.787667000000000,-2.245848000000000
snake and Myna,BB11 1HX,53.788343980000000,-2.243726623000000
Egret and king snake,BB11 1NG,53.788997830000000,-2.240406310000000
Argus and smooth snake,BB11 1NL,53.789570230000000,-2.246223058000000
boa and monitor,BB11 1PR,53.790146300000000,-2.245816602000000
Mockingbird and Grackle,BB11 2BA,53.784045900000000,-2.248983209000000
sand viper and leguaan,BB11 2BY,53.788502000000000,-2.241466000000000
wall lizard and soft-shelled turtle,BB11 2DW,53.790819000000000,-2.238125000000000
Kestrel and bearded dragon,BB11 2HY,53.779666870000000,-2.236604644000000
Kangaroo and king cobra,BB11 2JB,53.782968080000000,-2.239810278000000
skink and Marmoset,BB11 2LJ,53.781454290000000,-2.246114792000000
sand lizard and iguana,BB11 2PE,53.777474230000000,-2.249672643000000
box turtle and River dolphin,BB11 2QF,53.774678820000000,-2.254010804000000
cerastes and Kite,BB11 2SA,53.792304210000000,-2.236493676000000
Philippine hawk-owl and mountain devil,BB11 3AH,53.781235800000000,-2.234048775000000
Petrel and harlequin snake,BB11 3AJ,53.785935000000000,-2.235213000000000
brown snake and blind snake,BB11 3AR,53.785033210000000,-2.236346502000000
habu and Jerboa,BB11 3BS,53.788881260000000,-2.235745834000000
Egret and Grouse,BB11 3EX,53.781933180000000,-2.231320976000000
Polecat and mamba,BB11 3HA,53.780492790000000,-2.232511910000000
horned toad and wall lizard,BB11 3PH,53.780783000000000,-2.236535000000000
Wallaby and Condor,BB11 3QF,53.772315100000000,-2.253951002000000
perentie and River dolphin,BB11 4AF,53.789457260000000,-2.257075000000000
flying dragon and habu,BB11 4HQ,53.778633920000000,-2.253837438000000
Mamo and boomslang,BB11 4LQ,53.785322810000000,-2.257201669000000
fer-de-lance and Fulmarine petrel,BB11 4LX,53.785870420000000,-2.253289240000000
Grouse and Mink,BB11 4NY,53.784592000000000,-2.258943761000000
Scimitar babbler and Mink,BB11 4SA,53.788511610000000,-2.253897123000000
pit viper and Piping shrike,BB11 4SL,53.786829520000000,-2.250259464000000
thorn lizard and Tree warbler,BB11 5HH,53.772794930000000,-2.260705766000000
Quetzal and Vulture,BB11 5NG,53.771166160000000,-2.257328000000000
asp and bearded dragon,BB11 9HD,53.790944000000000,-2.240889000000000
gopher snake and Ibex,BB12 0AP,53.795670720000000,-2.247367037000000
wall lizard and king cobra,BB4 7BG,53.693877110000000,-2.249207509000000
viper and Wader,BB4 7DY,53.684608100000000,-2.245942831000000
harlequin snake and cobra de capello,BB4 7EA,53.679707000000000,-2.243113000000000
Buzzard and rattlesnake,BB4 7TX,53.698012780000000,-2.261318329000000
deaf adder and horned viper,BB4 9AH,53.693471730000000,-2.253914956000000
Tree warbler and blind snake,BB4 9DA,53.693723000000000,-2.245890000000000
Gila monster and Bunting,BB4 9DD,53.697094660000000,-2.249302260000000
tree snake and constrictor,BB4 9JU,53.704768120000000,-2.250453482000000
saltwater crocodile and leguaan,BB4 9LP,53.711365380000000,-2.250462402000000
Treepie and bearded dragon,BB4 9NZ,53.711675850000000,-2.252418692000000
Asiatic leopard and tortoise,BB4 9QD,53.725167750000000,-2.243375912000000
Lemming and Greenbul,BB4 9RL,53.713636390000000,-2.251884989000000
Civet and Myna,BB4 9RU,53.721720000000000,-2.241947000000000
Booted eagles and hawksbill,BD13 1JG,53.774310590000000,-1.860718121000000
Piping shrike and water snake,BD13 1LW,53.775575130000000,-1.858346845000000
Petrel and hognose snake,BD13 1LX,53.777199310000000,-1.872120000000000
diamondback turtle and Solitaire,BD13 1NA,53.778123000000000,-1.868960000000000
Old World quail and gaboon viper,BD13 2BD,53.765645020000000,-1.852251478000000
Treepie and rattlesnake,BD13 2DF,53.764712000000000,-1.852513000000000
Quetzal and Vulture,BD13 2FB,53.766247430000000,-1.859925559000000
Linsang and sand lizard,BD13 2FT,53.753273000000000,-1.857560000000000
Treepie and Tit-tyrant,BD13 2HP,53.766732330000000,-1.852050451000000
Linsang and Grackle,BD13 2JE,53.766673040000000,-1.855024076000000
terrapin and monitor,BD13 2JN,53.770645940000000,-1.855192476000000
python and Rabbit,BD13 2LU,53.760630510000000,-1.852906118000000
boa and Komodo dragon,BD13 2NP,53.758607070000000,-1.859465572000000
puff adder and Darwin's finches,BD13 3AY,53.798260000000000,-1.859503000000000
mountain devil and Grouse,BD13 3GD,53.791472460000000,-1.866354000000000
Mockingbird and Macaw,BD13 3JF,53.791126060000000,-1.852313907000000
galliwasp and Marmoset,BD13 3JY,53.790145820000000,-1.851861975000000
Egret and Old World vulture,BD13 3PF,53.793279690000000,-1.856860383000000
gopher snake and slowworm,BD13 3PR,53.791456260000000,-1.857807704000000
hawksbill and asp,BD13 3PZ,53.791588120000000,-1.863135000000000
gecko and sidewinder,BD13 3QU,53.794532420000000,-1.852241240000000
coral snake and Solitaire,BD13 3QZ,53.794191870000000,-1.860591666000000
swift and viper,BD13 3SL,53.786801800000000,-1.884141632000000
boomslang and Eagle,BD13 3SU,53.781646720000000,-1.862393574000000
Goose and anole,BD13 4EZ,53.785861000000000,-1.895967000000000
Grouse and Crow,BD13 4HB,53.783362000000000,-1.895473000000000
Old World quail and taipan,BD13 4HH,53.787937030000000,-1.886871000000000
mud turtle and bandy-bandy,BD13 4HW,53.790186440000000,-1.889627114000000
turtle and indigo snake,BD13 4NJ,53.799975340000000,-1.901109809000000
Skunk and River dolphin,BD22 9QQ,53.796661490000000,-1.978420767000000
Parrotbill and Pitohui,BL9 6TZ,53.611330850000000,-2.252831924000000
puff adder and rock snake,BL9 7JD,53.588991310000000,-2.254556565000000
Rat and Mamo,BL9 7JJ,53.587803300000000,-2.259458996000000
Komodo dragon and king cobra,BL9 7RY,53.600700640000000,-2.259855433000000
tokay and Linsang,BL9 7SR,53.600432080000000,-2.259355123000000
Crow and Myna,BL9 7TX,53.604238100000000,-2.249026569000000
Argus and horned toad,BL9 7UA,53.604627620000000,-2.243044000000000
Ground sloth and Kite,HD3 3FE,53.656206372797500,-1.876464743343060
Kite and agama,HD3 3FG,53.656644830086900,-1.874693000000000
lizard and bull snake,HD3 3FT,53.632169681498300,-1.929190300112560
cerastes and Snipe,HD3 3GF,53.663051147918500,-1.864247369092560
Snipe and lizard,HD3 3TH,53.656466959106200,-1.852526906264090
Moluccan boobook and smooth snake,HD3 3YL,53.658310774512400,-1.869089536743330
Songlark and Puffleg,HD3 3YP,53.657765373587700,-1.871754342419280
Meadowlark and frill-necked lizard,HD3 3YQ,53.659439127368300,-1.865333321689960
green turtle and Asiatic leopard,HD7 4EN,53.632587529415600,-1.854333987343790
tiger snake and Zebra,HD7 4ET,53.633525755133500,-1.857204072264390
Jerboa and Mink,HD7 4EU,53.633203579320700,-1.858491000000000
hawksbill and Buzzard,HD7 4JQ,53.636783160658800,-1.860323730054260
sand viper and B,HD7 4PH,53.640687252269100,-1.863109027813210
python and bull snake,HD7 4QB,53.643875000000000,-1.851996650531180
Cuscus and Bunting,HD7 4RN,53.644563933754700,-1.850374997519900
Rat and harlequin snake,HD7 5AF,53.624587094828300,-1.877645502322730
Pratincole and snake,HD7 5FE,53.621796000000000,-1.884593000000000
Pitohui and rock snake,HD7 5FF,53.620832000000000,-1.872849000000000
gaboon viper and Elephant,HD7 5NF,53.624379152060700,-1.860092460839070
Ibex and Rat,HD7 5NL,53.623609723928700,-1.855650000000000
flying lizard and gaboon viper,HD7 5PZ,53.612759104977500,-1.858166038823710
Duck and diamondback terrapin,HD7 5SS,53.621070000000000,-1.850276947491280
goanna and Peafowl,HD7 5TS,53.617985729903700,-1.865510377237690
Fulmarine petrel and Triller,HD7 5XB,53.611990008056700,-1.913746199049780
amphisbaena and Tree warbler,HD7 5ZA,53.621029000000000,-1.856354000000000
python and Vulture,HD7 5ZB,53.620850000000000,-1.856839000000000
Stint and Bronzewing pigeon,HD7 6BA,53.601004218740900,-1.931962456538530
Mink and viper,HD7 6DE,53.601988363038800,-1.931189970697020
tokay and Goose,HD7 6DS,53.601677600651400,-1.938232339176380
New World blackbird and Old World quail,HD7 6HR,53.596675485622500,-1.929778276465170
sand lizard and diamond python,HD7 6JG,53.598073764981800,-1.923414650611860
Coati and tortoise,HD7 6JN,53.601478913015000,-1.921247606831010
horned viper and Grackle,HD7 6JY,53.602653877011600,-1.917527962968310
Kestrel and black snake,HD7 6NG,53.606258000000000,-1.946598000000000
Polecat and Peafowl,HD9 4AA,53.591596035173000,-1.850199262636670
soft-shelled turtle and hognose snake,HD9 4AE,53.592017933982600,-1.850017000000000
Philippine hawk-owl and Vulture,HD9 4EE,53.590401522288000,-1.850943736884220
Fulmarine petrel and dugite,HD9 4ER,53.591146830857100,-1.850367031645190
worm lizard and Capuchin,HD9 5JP,53.590713652999100,-1.856290659613540
gopher snake and Partridge,HD9 5NW,53.591931000935500,-1.852131882708550
Fox and boa,HD9 5QP,53.594041964612800,-1.851097141739300
Myna and flying dragon,HD9 5RW,53.604018858187500,-1.851153000000000
Flameback and Linsang,HX1 1PS,53.721889031649900,-1.857890496460010
Stint and Old World vulture,HX1 1QP,53.720403164557000,-1.855516343919110
Coati and Greenbul,HX1 1RU,53.723417034686200,-1.857915664329500
hawksbill and Cloud rat,HX1 1SG,53.724787752885900,-1.854365000000000
bandy-bandy and Kangaroo,HX1 1TN,53.723339000000000,-1.859689000000000
mountain devil and mamba,HX1 1UP,53.724462068928700,-1.860170000000000
leathery turtle and Kestrel,HX1 1UU,53.724569837008800,-1.860170000000000
copperhead and rat snake,HX1 2AD,53.720752688709100,-1.862304122786640
Thrasher and Skunk,HX1 2AR,53.717663589914500,-1.864768954509400
diamondback terrapin and Mockingbird,HX1 2AZ,53.719109294554900,-1.863552056570670
Mockingbird and Marsh harrier,HX1 2BA,53.717897432799700,-1.864904582300870
frill-necked lizard and saltwater crocodile,HX1 2BW,53.718973263605000,-1.862491763538730
Mockingbird and snake,HX1 2LG,53.719338086622500,-1.859308350844090
horned viper and black snake,HX1 2NF,53.717236508626200,-1.860709399010040
sea snake and Flameback,HX1 2NN,53.712999927979900,-1.865799010956370
diamond python and Logrunners,HX1 2NY,53.713430454506700,-1.865131000000000
Civet and Boto,HX1 2PQ,53.713338946669000,-1.863555542342440
Stint and box turtle,HX1 2SE,53.720541000000000,-1.865139000000000
American sparrow and Gila monster,HX1 2TS,53.720412000000000,-1.870715257113930
mamba and boomslang,HX1 2XF,53.713236668210100,-1.868555788021780
Old World warbler and Civet,HX1 2XQ,53.713210217325100,-1.869025559019200
frill-necked lizard and Mamo,HX1 2YD,53.712363392715800,-1.867255523479150
soft-shelled turtle and rock python,HX1 3AJ,53.715247677326200,-1.874792147271350
Hawk and Pratincole,HX1 3AU,53.714736647004800,-1.876036108867800
Rabbit and Coati,HX1 3BG,53.714563405069800,-1.882279000000000
bearded dragon and Tattler,HX1 3EN,53.713216169994200,-1.874601200666660
Black cockatoo and indigo snake,HX1 3JY,53.717601421758200,-1.873709321243140
B and ringhals,HX1 3LG,53.716812198503100,-1.875363307465340
sidewinder and python,HX1 3QQ,53.717468167734400,-1.884180288522360
loggerhead and gaboon viper,HX1 3SA,53.715483200205700,-1.885640326788300
Quetzal and B,HX1 3SH,53.716020283465100,-1.883350882760720
turtle and horned viper,HX1 3SX,53.715377174502300,-1.887580072815720
mud turtle and gecko,HX1 3TA,53.716717000000000,-1.887499958357640
turtle and Night heron,HX1 3UB,53.717785049031500,-1.886588729472900
Jerboa and indigo snake,HX1 4GG,53.729509227231800,-1.886269490677360
mud turtle and massasauga,HX1 4HJ,53.721014904983600,-1.889959413609450
bicycle lizard and Fish eagle,HX1 4LH,53.721862299324200,-1.883107438200450
puff adder and gavial,HX1 4LN,53.721357424120300,-1.881532800910180
Gila monster and whip snake,HX1 4LQ,53.721970229672700,-1.883182911553270
python and blue tongue,HX1 4RX,53.725681969257200,-1.882839221396730
gaboon viper and Egret,HX1 5AX,53.722571643719600,-1.865496000000000
Jackal and Pratincole,HX1 5DJ,53.725953000000000,-1.865985000000000
Meadowlark and Prion,HX1 5EJ,53.720840145799500,-1.876609204929140
mamba and Fox,HX1 5EQ,53.721289905993400,-1.876956436715850
Linsang and blue racer,HX1 5JB,53.721751000000000,-1.878880000000000
rock snake and rattlesnake,HX1 5JL,53.722170000000000,-1.875681000000000
gaboon viper and cobra,HX1 5LG,53.724028371252700,-1.874159914894400
Eagle and Jerboa,HX1 5LL,53.724098243247600,-1.872235001225900
Meadowlark and water snake,HX1 5LQ,53.724064037264300,-1.873523000000000
cobra de capello and Night heron,HX1 5PR,53.726227000000000,-1.878943000000000
Perching duck and Myna,HX1 5SA,53.727932598985700,-1.877452407415750
Buzzard and Magpie,HX1 5SS,53.724206238268300,-1.864172107538710
gavial and tuatara,HX1 9SD,53.724426998141100,-1.860731148595220
Hawaiian honeycreeper and Asiatic leopard,HX1 9SE,53.724426998141100,-1.860731148595220
Ground sloth and Shearwater,HX2 0HA,53.729860579064300,-1.891512723982630
Booted eagles and blind snake,HX2 0LP,53.724701512831800,-1.902074111827810
diamondback turtle and perentie,HX2 0LQ,53.724471171135500,-1.906272661085310
Tree warbler and Black jay,HX2 0LR,53.725230513060500,-1.900496707397840
Myna and amethystine python,HX2 0NH,53.725609877381300,-1.914605770654080
Capuchin and Rabbit,HX2 0NP,53.726635040870500,-1.915346347242550
goanna and horned toad,HX2 0PL,53.730621167386800,-1.897892079733350
lizard and Capuchin,HX2 0PP,53.730639580318900,-1.898407390569360
horned toad and sand lizard,HX2 0QH,53.729836976944400,-1.895302090072040
Fish eagle and goanna,HX2 0SX,53.731935916441500,-1.912440558351830
tokay and Zebra,HX2 6AW,53.722309999229400,-1.942814980096800
White ibis and dukite,HX2 6BB,53.715369280184500,-1.938899978786120
Lemming and Hawaiian honeycreeper,HX2 6BL,53.714158679020000,-1.927719858907610
Recurvebill and lizard,HX2 6BQ,53.713609000089900,-1.925417787380970
krait and Thrasher,HX2 6DJ,53.721117000000000,-1.946620000000000
alligator and Maya,HX2 6EN,53.713744652693800,-1.943311000000000
jew lizard and Herring gull,HX2 6HN,53.730450603449700,-1.958446458997180
Tahr and Greenbul,HX2 6JT,53.714521131857700,-1.951461970101050
Black jay and tiger snake,HX2 6NG,53.726097089499400,-1.940324000000000
habu and tuatara,HX2 6NS,53.725923351343400,-1.943128372175210
Viscacha and thorny devil,HX2 6PG,53.726766523982400,-1.939626177751260
cerastes and garter snake,HX2 6ST,53.737784876513500,-1.937654807724870
bushmaster and slowworm,HX2 6TA,53.747303431926200,-1.938080518463140
Treepie and Thrasher,HX2 6TT,53.732127033031600,-1.947349131471530
hoop snake and Black cockatoo,HX2 6UF,53.733945262252000,-1.953789315604530
Vulture and Civet,HX2 7EA,53.709481932079700,-1.879293602752180
habu and wall lizard,HX2 7EH,53.710543887129600,-1.880654095745710
boomslang and garter snake,HX2 7HQ,53.713071464323600,-1.892313000000000
gopher snake and sand viper,HX2 7JN,53.716021993525600,-1.894942353645390
Chickadee and Jerboa,HX2 7JS,53.716005306850500,-1.896427315494690
Grosbeak and Darwin's finches,HX2 7LL,53.718864562863000,-1.897647724314690
Maya and Mouse,HX2 7QB,53.718041687050500,-1.891982502132960
Triller and Thrasher,HX2 7QP,53.723380379892200,-1.902213566964410
flying lizard and Mamo,HX2 7RW,53.721196492495100,-1.914266139170400
gopher snake and puff adder,HX2 7TA,53.740780739262500,-1.926749522264610
grass snake and Tahr,HX2 8AL,53.743269911188600,-1.881122588452930
Dolphin and Francolin,HX2 8DB,53.742385000000000,-1.885537000000000
dukite and rock snake,HX2 8JG,53.750545539353200,-1.895417549102870
Old World quail and Flameback,HX2 8LX,53.747059291076500,-1.896699912089250
Hawk and black snake,HX2 8NE,53.744713000000000,-1.895552830975330
Mamo and goanna,HX2 8PD,53.746425796101100,-1.902266352927890
Thicketbird and Siskin,HX2 8QD,53.749610755129300,-1.906277530319540
Herring gull and Myna,HX2 8SG,53.756594699975100,-1.906595697757370
hawksbill and elapid,HX2 8SZ,53.751849343927600,-1.919466235169790
Solitaire and king cobra,HX2 8TA,53.752038284878800,-1.919754013955270
Old World vulture and Pratincole,HX2 8UF,53.748150203047200,-1.900685325445620
Pratincole and Old World quail,HX2 8XP,53.766487000000000,-1.901325000000000
Peafowl and Mink,HX2 8XQ,53.761642174426300,-1.901836735038510
constrictor and rock snake,HX2 9AG,53.750527309848400,-1.876234287262830
rock snake and Mamo,HX2 9BD,53.751345592839600,-1.876595846427010
copperhead and Black jay,HX2 9DG,53.755866136373000,-1.895055534366270
Jackal and Stint,HX2 9DP,53.755846111582000,-1.892735096794070
boomslang and frill-necked lizard,HX2 9DQ,53.759136138889000,-1.893196935033900
boa constrictor and box turtle,HX2 9DX,53.759899916343900,-1.892967481281310
gavial and iguana,HX2 9EF,53.756870445636700,-1.892398820340320
Guillemot and galliwasp,HX2 9EZ,53.753210546188800,-1.890436618166740
frill-necked lizard and Night heron,HX2 9HZ,53.763588979907700,-1.887481979025800
Kite and Philippine hawk-owl,HX2 9JL,53.760837068624400,-1.895695413011180
gaboon viper and Duck,HX2 9LJ,53.758600519089100,-1.897399709215360
dugite and water snake,HX2 9NL,53.761312333230900,-1.894435248354760
Argus and Stint,HX2 9NT,53.776533829851400,-1.880376336483460
Fulmarine petrel and Gila monster,HX2 9NU,53.773193716256800,-1.893571008306590
indigo snake and Perching duck,HX2 9QN,53.760387117004100,-1.885230452872200
coral snake and grass snake,HX2 9RX,53.758987566240900,-1.887964448909870
Thrasher and Cloud rat,HX2 9SU,53.755648070081300,-1.882786367165080
monitor and Wallaby,HX3 0AH,53.710115256089100,-1.858414905574370
Tree warbler and thorny devil,HX3 0BG,53.709141000000000,-1.862584000000000
soft-shelled turtle and racer,HX3 0DW,53.712353850799600,-1.866755572394590
Moluccan boobook and Wallaby,HX3 0EA,53.709791409785500,-1.866006151621970
Fish eagle and flying dragon,HX3 0EL,53.711096594317000,-1.867729168448280
Pratincole and Dolphin,HX3 0EN,53.711357648199700,-1.868091965246480
Mink and Prion,HX3 0HX,53.707785866217000,-1.873178129748110
Snipe and python,HX3 0HZ,53.706520249360100,-1.874802853794550
Cuscus and python,HX3 0JJ,53.707848000000000,-1.871769000000000
water snake and Hawk,HX3 0JW,53.706385000000000,-1.865169000000000
Condor and diamond snake,HX3 0LH,53.704549887726300,-1.864704882168190
gaboon viper and Eagle,HX3 0NH,53.704821000000000,-1.857509000000000
Pheasant and Tit-tyrant,HX3 0QB,53.703115446044500,-1.852545931605430
Darwin's finches and sidewinder,HX3 0QP,53.704869638994600,-1.853781967179310
krait and Chickadee,HX3 0RN,53.701870928657000,-1.864259042347870
Logrunners and hoop snake,HX3 0SN,53.702719198722900,-1.859393976426760
Buzzard and krait,HX3 0SQ,53.701521390161700,-1.857217000000000
anaconda and horned viper,HX3 0TJ,53.701010806087500,-1.866700450269720
boa constrictor and Zebra,HX3 0UH,53.699592000000000,-1.875369000000000
blue tongue and diamond snake,HX3 0UR,53.701565765952500,-1.872863555959000
snapping turtle and Fulmarine petrel,HX3 0UY,53.699359000000000,-1.876096000000000
Dolphin and Grackle,HX3 5AS,53.727812000000000,-1.864388000000000
Jay and hognose snake,HX3 5DA,53.733312410465000,-1.873556225344950
Condor and blindworm,HX3 5DT,53.733601928820200,-1.875374387849960
king snake and Mamo,HX3 5EH,53.733039188612100,-1.878801841806810
grass snake and chameleon,HX3 5EX,53.728664168275800,-1.863597000000000
sand viper and snapping turtle,HX3 5JZ,53.735962078314400,-1.889981109029680
boa constrictor and anaconda,HX3 5RA,53.737913468567500,-1.881562153799340
rock python and Capuchin,HX3 5RJ,53.740902591112100,-1.877672499688250
diamond python and Civet,HX3 5TH,53.739783692834900,-1.887454682073030
Guillemot and terrapin,HX3 5TJ,53.742034772540200,-1.877365986545820
puff adder and python,HX3 5WG,53.727558468106800,-1.863888509482860
Darwin's finches and Logrunners,HX3 6AB,53.726602487420400,-1.853494530585460
Dorcopsis and blind snake,HX3 6BL,53.731218804893500,-1.850613700003940
Kestrel and chuckwalla,HX3 6DX,53.730424000000000,-1.861681000000000
Jerboa and boomslang,HX3 6EF,53.731298107680200,-1.864422132919330
viper and king cobra,HX3 6EP,53.729482405190300,-1.864321863417500
deaf adder and Pitohui,HX3 6EW,53.729645230963500,-1.865245926822490
amethystine python and diamondback,HX3 6HU,53.735169532895100,-1.862287419361240
Black jay and mamba,HX3 6HW,53.732434472922000,-1.859961984263930
puff adder and agama,HX3 6NH,53.734642473853900,-1.865139022393070
tuatara and Armadillo,HX3 6PD,53.737242260510100,-1.867146982056840
tree snake and Fulmarine petrel,HX3 6PW,53.734961944195800,-1.869564450208610
smooth snake and Magpie,HX3 6QR,53.743213450614200,-1.878590687242050
gaboon viper and Pratincole,HX3 6QW,53.743185000000000,-1.879563000000000
Ground sloth and kabaragoya,HX3 6SE,53.744950520410100,-1.880966228861260
Philippine hawk-owl and sand lizard,HX3 6TA,53.737024000000000,-1.871923000000000
Shearwater and Tree warbler,HX3 6UB,53.741551000000000,-1.869149393885360
Chipmunk and Shearwater,HX3 6UG,53.734616910829900,-1.858697000000000
hognose snake and Bronzewing pigeon,HX3 9AY,53.708550317536300,-1.850178779565800
chuckwalla and rock snake,HX3 9EB,53.701153592440300,-1.850568530155490
gavial and crocodile,HX3 9HU,53.717702169032500,-1.851767672917450
Bunting and death adder,HX3 9JA,53.717188573531200,-1.850739093106180
Mamo and American sparrow,HX3 9JD,53.716478442354500,-1.850680992980180
bicycle lizard and lizard,HX4 0AR,53.676434000000000,-1.922758000000000
rattlesnake and diamond python,HX4 0BA,53.685505169886200,-1.903012738005160
diamondback turtle and Scimitar babbler,HX4 0BH,53.685647908751700,-1.901695113633910
worm lizard and Skunk,HX4 0DF,53.675427164137000,-1.924894636792340
terrapin and Goose,HX4 0DG,53.676515450888600,-1.926058339209710
amethystine python and Grouse,HX4 0DP,53.675726559745700,-1.929495993459060
Boto and harlequin snake,HX4 0DS,53.670808086653600,-1.926234792871810
River dolphin and Greenbul,HX4 0EJ,53.656079506321400,-1.917076050962860
agama and crocodile,HX4 0EX,53.676715115942200,-1.915355324142310
Bunting and mud turtle,HX4 0HB,53.676474592820800,-1.918474244463960
thorny devil and rock snake,HX4 0HL,53.676408138757700,-1.913418269390170
Bunting and boa constrictor,HX4 8AY,53.689082887471600,-1.858258203823960
gecko and Booted eagles,HX4 8DE,53.684615803583000,-1.858273176537230
Civet and dukite,HX4 8JW,53.687650719533000,-1.871512318056840
galliwasp and swift,HX4 8JX,53.690833828915200,-1.872744390231100
Marsh harrier and Chipmunk,HX4 8JZ,53.689573748588600,-1.862996243222650
taipan and mamba,HX4 8LB,53.691171617071400,-1.869245263430500
Triller and carpet snake,HX4 8NG,53.685847203549500,-1.873970000000000
boomslang and Recurvebill,HX4 8NH,53.682612353405700,-1.876266000000000
Greenbul and rock python,HX4 8NR,53.679866132365200,-1.888643346165110
box turtle and mountain devil,HX4 8QS,53.681263000000000,-1.885386000000000
Schneider python and krait,HX4 9AH,53.674874788883900,-1.868024081629230
Polecat and Elephant,HX4 9AR,53.674098596332400,-1.865135295150750
American sparrow and Kangaroo,HX4 9BT,53.676710986591100,-1.854727058348360
blind snake and amphisbaena,HX4 9DB,53.672097304288200,-1.859964992460370
Mockingbird and rattlesnake,HX4 9EH,53.672870813819900,-1.876839932848980
bicycle lizard and slowworm,HX4 9EZ,53.673401686517100,-1.877398455405650
White ibis and diamond python,HX4 9FB,53.670822000000000,-1.862725000000000
rock snake and horned viper,HX4 9LJ,53.661613513450400,-1.891173117995490
Thrasher and krait,HX4 9LR,53.672440000000000,-1.876129401278220
mamba and swift,HX4 9PW,53.670980921840300,-1.893116731049510
Schneider python and Ground sloth,HX5 0QY,53.684113236567000,-1.851476639124530
Logrunners and black snake,HX6 1AE,53.705236919691000,-1.918979331157840
Egret and Elephant,HX6 1BL,53.705590586057800,-1.923765581235330
Kite and mud turtle,HX6 1BZ,53.705565541471500,-1.926855919216300
Bronzewing pigeon and Ibex,HX6 1DS,53.706919012978500,-1.920960626939360
skink and Nukupuʻu,HX6 1HJ,53.704943439824700,-1.939581541172260
Solitaire and Petrel,HX6 1JL,53.706266459440200,-1.943215352981740
Grouse and Grosbeak,HX6 1JQ,53.705690811196400,-1.942352657727170
blindworm and deaf adder,HX6 1JX,53.706560502471600,-1.938018903243820
rock snake and glass snake,HX6 1LH,53.705723401931800,-1.935717548535370
moloch and diamondback turtle,HX6 1NX,53.699717582243900,-1.951069958693040
Recurvebill and agama,HX6 2AD,53.708994880462100,-1.907610000000000
copperhead and Puffleg,HX6 2AX,53.710396082964500,-1.895668395376300
