name,postcode,lat,lon
Pratincole and death adder,OL15 9QT,53.662945829586300,-2.083316007488570
rat snake and bandy-bandy,OL15 9QW,53.662127907848800,-2.083314389321330
Triller and Solitaire,OL15 9RG,53.665291968276800,-2.082987700432280
dugite and Eagle,OL16 1DF,53.618903000000000,-2.156806000000000
Bronzewing pigeon and Siskin,OL16 1DR,53.619568977788000,-2.155009000000000
mountain devil and asp,OL16 1DY,53.619586718479200,-2.155341772550170
terrapin and crocodile,OL16 1ED,53.617353035964300,-2.159233000000000
hognose snake and Grosbeak,OL16 1NT,53.616403794147200,-2.156025000000000
Solitaire and frill-necked lizard,OL16 2AL,53.624756758400000,-2.143068848200000
Fulmarine petrel and Egret,OL16 2AX,53.613565130428500,-2.147837431582920
Linsang and Petrel,OL16 2BN,53.626005000000000,-2.139231000000000
Coati and amethystine python,OL16 2BY,53.618998504471900,-2.151439295067800
goanna and amethystine python,OL16 2DP,53.621184181194900,-2.150222551262690
Grosbeak and sand viper,OL16 2EG,53.620862252586700,-2.148906126106050
Triller and Siskin,OL16 2EL,53.620869917295600,-2.149964424696550
bicycle lizard and monitor,OL16 2HZ,53.618400000000000,-2.149427000000000
Marmoset and Nukupuʻu,OL16 2NQ,53.625591091442700,-2.140637121917160
Kākāriki and milk snake,OL16 2NT,53.629556845507900,-2.138971871683180
Fulmarine petrel and perentie,OL16 2PR,53.631152262237800,-2.135045445945520
Jackal and Jackal,OL16 2PT,53.631934746003800,-2.134594285822940
agama and boa constrictor,OL16 2TE,53.626825000000000,-2.139553000000000
saltwater crocodile and diamondback terrapin,OL16 2TR,53.624207085559700,-2.132619254010890
flying lizard and Darwin's finches,OL16 2TX,53.621988603470200,-2.131160904177470
water snake and amphisbaena,OL16 2UP,53.622813401887800,-2.140915129191840
cobra de capello and Black cockatoo,OL16 2XJ,53.622119830493200,-2.134396694071700
Towhee and smooth snake,OL16 3BJ,53.615667804961600,-2.124701728473100
racer and anole,OL16 3DJ,53.613561000000000,-2.109548000000000
leathery turtle and Chipmunk,OL16 3DS,53.611068736770700,-2.102771895650610
agamid and Viscacha,OL16 3JG,53.613271475572800,-2.112073255976990
Piping shrike and Tit-tyrant,OL16 3JR,53.612017512456000,-2.107293588955730
death adder and Fulmarine petrel,OL16 3JT,53.611449112389500,-2.109650052191460
coral snake and flying dragon,OL16 3LF,53.612148316446800,-2.111677283726890
Songlark and tiger snake,OL16 3LL,53.613724002301300,-2.118166046462970
sand lizard and gaboon viper,OL16 3NT,53.608485938499200,-2.106392904877240
krait and mud turtle,OL16 3PR,53.605522229246900,-2.103650043611860
smooth snake and Crow,OL16 3RB,53.601658992164400,-2.090493734472230
goanna and gecko,OL16 3TS,53.614309437904900,-2.085079169194220
crocodile and Myna,OL16 3UB,53.611161899992400,-2.098887647341580
Grosbeak and amethystine python,OL16 3UD,53.611728507975700,-2.098465757742660
Black cockatoo and swift,OL16 3UT,53.615140981991600,-2.112123566876750
agama and Goose,OL16 4DL,53.611900080277600,-2.117465654850010
B and Wader,OL16 4DR,53.612619479136700,-2.117120006097300
Chipmunk and Skunk,OL16 4DX,53.612036057408200,-2.116287062799530
ringhals and Francolin,OL16 4EY,53.605681530755800,-2.116118439899560
Zebra and Maya,OL16 4HG,53.610009416235400,-2.111354227131020
diamondback and Pratincole,OL16 4NE,53.598661925092000,-2.095594567122000
snake and elapid,OL16 4PE,53.595809170623700,-2.143877151349720
Mole and Darwin's finches,OL16 4PS,53.607319779700000,-2.135165984500000
saltwater crocodile and Guillemot,OL16 4QQ,53.590401498172100,-2.125004856445890
diamond snake and whip snake,OL16 4QS,53.597543462018200,-2.136600114408900
cycling lizard and Thrasher,OL16 4RY,53.587348937637200,-2.138183538947170
sand lizard and hawksbill,OL16 4TF,53.601460697349300,-2.145603959664930
krait and Vulture,OL16 4XS,53.603437055593300,-2.138946404199340
agama and fer-de-lance,OL16 5AJ,53.616864412641300,-2.131976409379320
harlequin snake and giant tortoise,OL16 5BG,53.614550054122400,-2.135884196721290
diamond python and Magpie,OL16 5DZ,53.612114801463800,-2.143101349940210
diamondback and blindworm,OL16 5LF,53.605768397248600,-2.143684367481230
Pratincole and Buzzard,OL16 5LR,53.604994000000000,-2.145510000000000
lizard and giant tortoise,OL16 5LU,53.606205072016500,-2.146768889378170
asp and cycling lizard,OL16 5ND,53.612346565020100,-2.144704337659220
rock python and dugite,OL16 5QT,53.612078698195500,-2.150537819594840
racer and lizard,OL16 5SN,53.611290989710700,-2.140483709120780
Gila monster and grass snake,OL16 9SQ,53.615690099222600,-2.158925127492100
agama and dugite,OL2 5SA,53.575562879420500,-2.132376071489260
Chickadee and adder,OL2 6ST,53.577190251905900,-2.123531056520420
Dorcopsis and Black jay,OL2 6SZ,53.576057024861600,-2.124207343888510
Darwin's finches and Tattler,OL2 6TB,53.575516671692600,-2.125217589351620
saltwater crocodile and Marmoset,OL2 6TN,53.576170724076500,-2.127197915492240
Grosbeak and krait,OL2 6XQ,53.580962002821700,-2.134915326570780
Pitohui and crocodile,OL2 6XW,53.582358707772600,-2.131762959410200
Ice seal and king snake,OL2 7DH,53.580502544563200,-2.109615073241920
chuckwalla and Asiatic leopard,OL2 7LD,53.580312871331600,-2.110611424554640
mountain devil and Boto,OL2 7LR,53.581526049166000,-2.110871369087570
blind snake and diamondback,OL2 7LY,53.582726108892500,-2.115481403010450
copperhead and bicycle lizard,OL2 7PY,53.587380339492800,-2.107684211676000
coral snake and elapid,OL2 7QR,53.585097593628200,-2.107376287384250
water snake and Asiatic leopard,OL2 7RL,53.584655800404900,-2.108885688138460
hoop snake and cayman,OL2 7SD,53.580862000000000,-2.100251939808870
rock python and Black jay,OL2 7SX,53.581970343546000,-2.096040137289560
bandy-bandy and Myna,OL2 7TD,53.580642472661400,-2.093016359412510
crocodile and Goose,OL2 7TG,53.580093275694600,-2.094178127905610
Jackal and B,OL2 7TH,53.579464263268100,-2.093965278687270
Jerboa and Snipe,OL2 7UP,53.584508015006100,-2.092269611178020
sand viper and whip snake,OL2 7XG,53.584862620836800,-2.098433349753990
skink and Ice seal,OL2 8AE,53.578305108106400,-2.093539818097620
Parrotlet and Quetzal,OL2 8AF,53.578916370013300,-2.093465655274970
Bronzewing pigeon and Songlark,OL2 8AJ,53.578493529600500,-2.093963120122080
mud turtle and thorny devil,OL2 8BE,53.582882377428500,-2.090649868860660
boa and Grackle,OL2 8DJ,53.583011853325400,-2.085726032944870
turtle and indigo snake,OL2 8DZ,53.584145173415100,-2.084610559650620
Mockingbird and cayman,OL2 8ED,53.588627298946000,-2.088773867349710
Tattler and Tit-tyrant,OL2 8EL,53.577955891173400,-2.091832423973580
Grouse and rock snake,OL2 8FN,53.585411646800000,-2.079145154800000
Dolphin and cycling lizard,OL2 8PE,53.584327064245200,-2.081559691475120
deaf adder and saltwater crocodile,OL2 8PQ,53.576421000000000,-2.090757000000000
Viscacha and Meadowlark,OL2 8QE,53.575436067370100,-2.083838020246330
Boto and slowworm,OL2 8QP,53.575393436878800,-2.092990000000000
Grosbeak and New World blackbird,OL3 5LY,53.581397770782700,-1.994252544267910
sand lizard and carpet snake,OL3 5SL,53.590874000000000,-2.040994000000000
chuckwalla and Argus,OL3 5SS,53.583212242491200,-2.048750000000000
Ibex and Minke whale,OL3 5TN,53.577245683974600,-2.045133684364610
sea snake and saltwater crocodile,OL3 5TT,53.579197733984900,-2.040725617907820
