name,postcode,lat,lon
Black cockatoo and asp,HX6 2AZ,53.710459025791600,-1.896032000000000
Siskin and krait,HX6 2DJ,53.712156043296700,-1.904421251922570
Warbler and Lemming,HX6 2EL,53.710688491614000,-1.912969358771390
Siskin and leguaan,HX6 2EW,53.712351907999900,-1.913420000000000
Black jay and coral snake,HX6 2NQ,53.712018020808700,-1.911996971038720
amethystine python and Tattler,HX6 2QH,53.709437840827000,-1.911184245275830
racer and Old World vulture,HX6 2SP,53.714024750344900,-1.903401874846950
anaconda and Elephant,HX6 2SQ,53.714778210473900,-1.901506177539840
Pitohui and Darwin's finches,HX6 3EN,53.688292653925500,-1.948584655546650
glass snake and White ibis,HX6 3EQ,53.688087000000000,-1.947919000000000
Pratincole and Chickadee,HX6 3HJ,53.688520679285500,-1.936697615266410
Vole and Egret,HX6 3LL,53.701949000000000,-1.920303000000000
Coati and Maya,HX6 3NE,53.695091000000000,-1.935612000000000
Dorcopsis and Minke whale,HX6 3PS,53.705465998107700,-1.912404461016110
Dorcopsis and mud turtle,HX6 3RG,53.700132727501900,-1.896890292246740
turtle and moloch,HX6 4BB,53.675769698684700,-1.943059392212150
Chicken and rock snake,HX6 4DZ,53.671942509007700,-1.946909181819730
python and viper,HX6 4JL,53.674218930302800,-1.933676381283890
Goose and king cobra,HX6 4JQ,53.667594710354000,-1.952832354389680
monitor and Macaw,HX6 4NS,53.689663007374400,-1.959485798728560
Fox and king cobra,HX6 4QN,53.661573514329600,-1.955108946701260
deaf adder and Night heron,HX6 4QS,53.653745479841000,-1.956917673283960
deaf adder and Flameback,HX6 4RA,53.655516731915200,-1.937715217186430
hoop snake and galliwasp,HX7 5DS,53.730015984799900,-1.981970982049230
boa and dugite,HX7 5EU,53.725738577940900,-1.989868925841140
Zebra and Tahr,HX7 5EX,53.725432976203400,-1.989778063610740
Peafowl and Kite,HX7 5HE,53.721774179466800,-1.983747510704360
Wallaby and copperhead,HX7 5JW,53.727174952067400,-1.977182802485700
soft-shelled turtle and Zebra,HX7 5JY,53.729090576681900,-1.984608680757180
Zebra and Kangaroo,HX7 5LL,53.730761955103100,-1.981712989248890
Nukupuʻu and Dorcopsis,HX7 5LR,53.732102000000000,-1.979878000000000
worm lizard and Mamo,HX7 5QY,53.733410793019900,-1.968796814115430
fer-de-lance and wall lizard,HX7 5RN,53.721432000000000,-1.976110000000000
glass snake and sand viper,HX7 5RY,53.712732808468200,-1.989568948459570
hawksbill and Eagle,HX7 5TW,53.694262694306800,-1.998902370349670
Mockingbird and blind snake,HX7 5TX,53.706657000000000,-1.979693000000000
thorny devil and Old World quail,HX7 6BS,53.742103921774900,-2.023250996996450
Marmoset and sand viper,HX7 6BX,53.743738762533400,-2.027815736909860
Tree warbler and Grackle,HX7 6DJ,53.745976864465100,-2.027468479483900
rock snake and Kestrel,HX7 6DS,53.742993484140900,-2.024509935308810
rock snake and boa,HX7 6HH,53.740541219612800,-2.015897007839520
Civet and Logrunners,HX7 6NN,53.737022986693900,-2.034345134653960
racer and jew lizard,HX7 6NT,53.739106669020200,-2.039334667381470
Grackle and Skunk,HX7 6PF,53.736851857482600,-2.035557773167610
Mink and mud turtle,HX7 6PH,53.736239794410900,-2.038376923216860
Recurvebill and Herring gull,HX7 7AY,53.758349088012700,-2.042128413581440
Diving bird and Zebra,HX7 7BS,53.742590724412400,-2.014078377721380
copperhead and Logrunners,HX7 7DH,53.744073902937100,-2.012744597054460
Triller and tortoise,HX7 7ER,53.751193000000000,-2.018494000000000
Perching duck and tree snake,HX7 7ES,53.755460558392500,-2.020983490343130
leguaan and bull snake,HX7 7EY,53.753832058491400,-2.028914408788810
bushmaster and Partridge,HX7 7HB,53.755771102670900,-2.037409020620850
Grouse and Hawk,HX7 7HN,53.753644398086100,-2.052133094682370
Herring gull and boa constrictor,HX7 7NP,53.749420587329500,-2.021086592722430
Vole and rock snake,HX7 8AB,53.740775497022600,-2.010696823310660
harlequin snake and slowworm,HX7 8AU,53.739930751228900,-2.009165358114160
dukite and Dolphin,HX7 8BA,53.739166883118300,-2.007558166647700
turtle and Egret,HX7 8DN,53.742124116896600,-2.004314125786000
sand viper and moloch,HX7 8DS,53.743022919110900,-2.004359709325560
perentie and slowworm,HX7 8EL,53.741440365744800,-2.012986000000000
Herring gull and king snake,HX7 8HW,53.747291854076900,-2.010501000000000
Asiatic leopard and Scimitar babbler,HX7 8NR,53.733212271605000,-1.998992786826420
Parrotbill and Old World warbler,HX7 8PH,53.741297039081600,-1.991760448509000
Grosbeak and frilled lizard,HX7 8RA,53.763964681744000,-2.009777521092220
water snake and swift,HX7 8RF,53.770175117031300,-2.012646461836790
Maya and Vole,HX7 8ST,53.753835538891300,-2.003845257344750
White ibis and Zebra,M24 2UD,53.576318879000600,-2.173698244191510
Chickadee and Boto,OL10 1AQ,53.591631552433100,-2.219462037940810
Marsh harrier and carpet snake,OL10 1BT,53.588122810672900,-2.216075000000000
caiman and constrictor,OL10 1DG,53.591170905112700,-2.215758291264630
Towhee and Rabbit,OL10 1HY,53.593270890782700,-2.222446883659320
ringhals and hoop snake,OL10 1JG,53.593546766291200,-2.228673007338130
Booted eagles and Stilt,OL10 1JY,53.593436484817400,-2.220393013529530
Schneider python and deaf adder,OL10 1LT,53.592965451487100,-2.217474672986060
Puffleg and Darwin's finches,OL10 1PD,53.592297148463500,-2.214253237380870
thorn lizard and Wallaby,OL10 1PT,53.591996748800000,-2.213663000000000
diamondback terrapin and cobra de capello,OL10 2AW,53.586335741250900,-2.210416374280710
Hawaiian honeycreeper and Thicketbird,OL10 2BD,53.586478241595600,-2.216187538623430
Mink and king snake,OL10 2EN,53.586024700576600,-2.208390658015920
bushmaster and blind snake,OL10 2HH,53.584395666884500,-2.209621258214190
Diving bird and ringhals,OL10 2JH,53.588924000000000,-2.210352000000000
Ice seal and lizard,OL10 2JW,53.583905608314600,-2.207156717746220
green turtle and grass snake,OL10 2LL,53.580210404024900,-2.212847815994990
agamid and Elephant,OL10 2LR,53.579988886265000,-2.211049374577710
Francolin and adder,OL10 2NT,53.582243177253100,-2.217057062164410
Francolin and tuatara,OL10 2PA,53.582744647437000,-2.218086745398380
bearded dragon and Kangaroo,OL10 3AG,53.590279233743700,-2.226464793011320
Old World vulture and Vole,OL10 3AU,53.588444311201200,-2.222376187196630
giant tortoise and jew lizard,OL10 3BG,53.589101779512100,-2.226458490638210
diamondback and amethystine python,OL10 3DB,53.591370230867000,-2.234024460339760
Moluccan boobook and frill-necked lizard,OL10 3HA,53.591801667057500,-2.229388749469540
Tit-tyrant and turtle,OL10 3HH,53.593056111713900,-2.231420057719040
terrapin and Treepie,OL10 3HQ,53.592301362000000,-2.233652181200000
terrapin and Wallaby,OL10 3HU,53.592585830993200,-2.237325000000000
king cobra and Black cockatoo,OL10 3HX,53.592709228101500,-2.238700280674320
puff adder and Wallaby,OL10 3JB,53.591454158744800,-2.237046461831670
anaconda and Night heron,OL10 3LH,53.590661797567100,-2.242223862398810
pit viper and black snake,OL10 3LZ,53.588585182013800,-2.246774187903910
carpet snake and bushmaster,OL10 3NW,53.588378429734100,-2.242392070419620
rock snake and amethystine python,OL10 3SB,53.587323033432800,-2.239802862209950
Jerboa and Pheasant,OL10 3SE,53.587298849054200,-2.238412954257430
Viscacha and Bunting,OL10 3ST,53.589505000000000,-2.240432000000000
tiger snake and Mouse,OL10 4AR,53.601018000000000,-2.222198000000000
green turtle and Magpie,OL10 4BQ,53.604980936225800,-2.232769876772870
Mamo and Peafowl,OL10 4DJ,53.596964980158500,-2.202264715373470
Masked owl and blind snake,OL10 4JX,53.595390750198000,-2.218666000000000
Warbler and Partridge,OL10 4NS,53.593107060541000,-2.213713441834180
Maya and copperhead,OL10 4SQ,53.595244258477500,-2.238533276191870
Mole and taipan,OL10 4UQ,53.601190811798000,-2.226568552440240
rat snake and galliwasp,OL10 4UY,53.599161000000000,-2.216585000000000
Snipe and Scimitar babbler,OL10 4XH,53.595450217745000,-2.234379431718850
Ice seal and chuckwalla,OL11 1EF,53.611923258233500,-2.159682000000000
Maya and Minke whale,OL11 1NZ,53.606727487714400,-2.153057759361700
Rabbit and python,OL11 1QL,53.603614984004900,-2.161826562030920
Vulture and gecko,OL11 1TJ,53.603089607981600,-2.151412000000000
Black jay and sidewinder,OL11 1TX,53.601345241326900,-2.158629410589560
Chickadee and green turtle,OL11 2DD,53.596278928179500,-2.149272800464760
blindworm and moloch,OL11 2DP,53.593804311116200,-2.151530338335610
Marmoset and Black jay,OL11 2DX,53.591720700727500,-2.150208495927380
Puffleg and Skunk,OL11 2ED,53.592155673953500,-2.147369753433120
bushmaster and Prion,OL11 2JX,53.601404376151100,-2.147553112152670
Viscacha and Mockingbird,OL11 2LP,53.597345623144200,-2.158508634489330
slowworm and cycling lizard,OL11 2LZ,53.596783482077900,-2.168629937397760
loggerhead and bicycle lizard,OL11 2ND,53.600326277033700,-2.161088652305540
Herring gull and crocodile,OL11 2NN,53.598940311540700,-2.162397970383310
blindworm and cobra de capello,OL11 2PW,53.592809918315300,-2.169157985101790
Myna and Rabbit,OL11 2SH,53.592747227327400,-2.155771933142140
bearded dragon and Mink,OL11 2SW,53.587518000800000,-2.176977233500000
Herring gull and Argus,OL11 2TW,53.587588480127200,-2.174877492007190
leguaan and Black jay,OL11 2YQ,53.582325887465000,-2.171744228473110
Partridge and Gull,OL11 3AD,53.596056000000000,-2.181406692836020
rat snake and Francolin,OL11 3BJ,53.590482291240000,-2.181189211134450
Cuscus and Flameback,OL11 3BY,53.589946000000000,-2.191520000000000
sidewinder and flying lizard,OL11 3DE,53.592923225800000,-2.186653990400000
Wader and boa,OL11 3DL,53.593572054445900,-2.182637749002370
Rat and Mamo,OL11 3ED,53.593306510807500,-2.179932210884430
copperhead and diamondback turtle,OL11 3EX,53.597910000000000,-2.173636000000000
bandy-bandy and Towhee,OL11 3HB,53.599539364809600,-2.177269055559040
boomslang and Triller,OL11 3HE,53.599282054110700,-2.181030482063230
box turtle and anole,OL11 3HL,53.598887597248100,-2.186211634173860
boa constrictor and diamondback terrapin,OL11 3HP,53.597505220115800,-2.185042089762630
Coati and Cuscus,OL11 3HU,53.597949153748100,-2.182762424128630
Shearwater and Wallaby,OL11 3JZ,53.600412223690300,-2.182576629488080
slowworm and blue racer,OL11 3LD,53.600102789358200,-2.185068568241100
Songlark and swift,OL11 3LJ,53.601287142321600,-2.186418647379830
Solitaire and Prion,OL11 3LL,53.601753868206500,-2.186843822955070
harlequin snake and puff adder,OL11 3LR,53.602243263884400,-2.189989182351290
Parrotlet and adder,OL11 3TW,53.608137074885400,-2.161088196549070
king snake and krait,OL11 4AU,53.610636717308800,-2.196919000000000
Grackle and Jay,OL11 4DW,53.610931781642800,-2.191947792267010
boomslang and Tree warbler,OL11 4EU,53.614254328214100,-2.170271696407270
death adder and hawksbill,OL11 4HJ,53.611950904551700,-2.171970408312330
Greenbul and horned toad,OL11 4HQ,53.611991147924700,-2.168962687452260
viper and worm lizard,OL11 4HS,53.611919000000000,-2.170066000000000
Grosbeak and Nukupuʻu,OL11 4HW,53.611581022459100,-2.166588016031310
adder and Goose,OL11 4NB,53.605973881403600,-2.171855412603310
Chicken and cobra,OL11 4PG,53.603934845641800,-2.177121253583590
Marsh harrier and Pheasant,OL11 4PS,53.604268950250900,-2.176079908732510
Nukupuʻu and White ibis,OL11 4PU,53.603938581717400,-2.174582432356780
tiger snake and indigo snake,OL11 4PW,53.603450175931900,-2.176650752446280
Armadillo and Chipmunk,OL11 4QD,53.606827630415000,-2.171949562800120
Perching duck and snapping turtle,OL11 4QJ,53.605366866100700,-2.175162611396840
Triller and hoop snake,OL11 4RH,53.604092000000000,-2.186975000000000
frill-necked lizard and Towhee,OL11 4YA,53.611534000000000,-2.148783000000000
Kangaroo and sea snake,OL11 5AE,53.622356915102300,-2.179693068835420
Ibex and moloch,OL11 5AJ,53.621465511133300,-2.186583261234800
adder and Parrotbill,OL11 5BW,53.616429000000000,-2.171157000000000
taipan and Mole,OL11 5DA,53.621508000000000,-2.176847000000000
Ground sloth and Marsh harrier,OL11 5DP,53.618692383652800,-2.177908748380850
Peafowl and coral snake,OL11 5EE,53.618199399542600,-2.182955823408310
Condor and cayman,OL11 5HA,53.615020300978200,-2.175127044912950
Greenbul and krait,OL11 5JD,53.610027149507000,-2.206226701468110
Tit-tyrant and Vole,OL11 5JL,53.611709318644100,-2.205433818237750
Perching duck and horned viper,OL11 5LU,53.615659687972800,-2.191893684418640
Darwin's finches and ringhals,OL11 5NP,53.623770650769000,-2.216136386706500
Parrotbill and Old World warbler,OL11 5QE,53.615220709050900,-2.201928820209430
Treepie and Jay,OL11 5RW,53.620656804022600,-2.208213691669580
Jackal and Gull,OL11 5RZ,53.623068046105500,-2.206834628742520
pit viper and boa,OL11 5SQ,53.619143368847700,-2.204986194064730
rat snake and Civet,OL11 5TZ,53.629919525290400,-2.220553055988830
Stint and copperhead,OL11 5XE,53.626639026357800,-2.210057000000000
Parakeet and cycling lizard,OL11 5XJ,53.622128744650400,-2.198907869808910
grass snake and alligator,OL12 0AU,53.635646461512600,-2.157034194185020
Stint and Argus,OL12 0EE,53.626272500541200,-2.149439286939580
Cloud rat and hoop snake,OL12 0EP,53.623611372323400,-2.149928801959930
Guillemot and B,OL12 0ES,53.628621231332600,-2.147179459192410
blindworm and gaboon viper,OL12 0JH,53.625204885636100,-2.154939085114990
cycling lizard and Siskin,OL12 0LT,53.623853576715100,-2.157292727974030
jew lizard and Hawk,OL12 0NE,53.622260487432700,-2.158934729579390
Komodo dragon and rat snake,OL12 0QA,53.624872868541500,-2.161318337206810
Warbler and turtle,OL12 0QJ,53.625108390332600,-2.159958465391170
Logrunners and leguaan,OL12 0QL,53.625145000000000,-2.160261000000000
worm lizard and sand lizard,OL12 0RF,53.626036327508100,-2.158344138526270
bandy-bandy and Rabbit,OL12 0SR,53.635116923114600,-2.163172268206810
mamba and tiger snake,OL12 0SS,53.634470517158900,-2.162625340938300
Moluccan boobook and hawksbill,OL12 0TB,53.636780695138000,-2.168956012004200
Zebra and anole,OL12 6AL,53.630850000000000,-2.174981000000000
Boto and hoop snake,OL12 6BB,53.629966990914300,-2.162940667870700
Jay and black snake,OL12 6BL,53.643587887235100,-2.196331601981910
Treepie and Eagle,OL12 6DE,53.633240574162100,-2.168079858835500
Gila monster and Boto,OL12 6DF,53.636379987046100,-2.172614347382290
death adder and Chipmunk,OL12 6DL,53.636481636511600,-2.170678922811830
snake and Old World warbler,OL12 6EH,53.631684842256800,-2.162130706918170
Parakeet and Mockingbird,OL12 6EZ,53.634537891437500,-2.165922426284070
thorn lizard and mud turtle,OL12 6NP,53.631174694853000,-2.167073593655040
harlequin snake and cerastes,OL12 6NS,53.629493843487700,-2.167112307452400
Marsh harrier and iguana,OL12 6QW,53.620535840443700,-2.164763807079220
fer-de-lance and Wader,OL12 6RG,53.619659005528500,-2.161827546494940
blue racer and Asiatic leopard,OL12 6RY,53.616727746936700,-2.162632619438630
Hawaiian honeycreeper and slowworm,OL12 6ST,53.619669022388100,-2.167602561334090
moloch and Gila monster,OL12 6UA,53.618239116951800,-2.161640700616400
garter snake and boa constrictor,OL12 6UJ,53.617785079230700,-2.165025186180610
Kestrel and boa,OL12 6XL,53.633381969655700,-2.169789280220360
python and goanna,OL12 7AB,53.620214357759600,-2.169690999953510
constrictor and flying dragon,OL12 7AZ,53.632295394900000,-2.178374613900000
Tit-tyrant and Fox,OL12 7BP,53.622621722059200,-2.176912336426360
Old World warbler and gecko,OL12 7EH,53.625387313007800,-2.178783652859990
Prion and Mockingbird,OL12 7ER,53.625774639880300,-2.178225855023050
Armadillo and Ibex,OL12 7EY,53.611534000000000,-2.148783000000000
black snake and Pitohui,OL12 7HA,53.639244672945200,-2.180430426205740
Tahr and Booted eagles,OL12 7HD,53.634619242943200,-2.178096829531000
Cuscus and thorn lizard,OL12 7HT,53.635857777432300,-2.179327059362140
dugite and smooth snake,OL12 7JQ,53.634056700368600,-2.187425277978040
frill-necked lizard and Argus,OL12 7PX,53.627423476425300,-2.193020676767080
black snake and Komodo dragon,OL12 7RN,53.628081233726100,-2.208129316397970
snake and Towhee,OL12 7SL,53.627121849373100,-2.211904693579230
viper and krait,OL12 7TP,53.630301366240200,-2.227828517615690
New World blackbird and Pheasant,OL12 8AL,53.660854242289700,-2.178904000000000
Coati and B,OL12 8EA,53.656302544600000,-2.178597137400000
Solitaire and krait,OL12 8ET,53.657740824900000,-2.178482174800000
moloch and Treepie,OL12 8JW,53.664380213254000,-2.171215543376080
agama and saltwater crocodile,OL12 8NG,53.674644091987400,-2.171635656617860
hawksbill and Perching duck,OL12 8PT,53.655701883551800,-2.174493931892200
python and Pheasant,OL12 8RQ,53.657819210190300,-2.177135550622080
Marmoset and Kākāriki,OL12 8RU,53.644852453350400,-2.180998958474570
viper and python,OL12 8SY,53.650097215786700,-2.177904954392410
blue racer and Tit-tyrant,OL12 8TJ,53.648634457831100,-2.176340594013260
Fox and Skunk,OL12 8UP,53.651309254834700,-2.184733269586620
gaboon viper and diamond snake,OL12 9AF,53.634571017556500,-2.132152756938920
Logrunners and Moluccan boobook,OL12 9BQ,53.625084300709600,-2.143538410561160
Tree warbler and tokay,OL12 9EG,53.644383317067600,-2.126450520797780
bushmaster and Mamo,OL12 9JW,53.648377211840800,-2.131863189217250
hognose snake and box turtle,OL12 9NN,53.647069162711400,-2.136109936730030
Goose and Hawaiian honeycreeper,OL12 9QD,53.637746282384700,-2.121394274003530
Shearwater and goanna,OL12 9QG,53.638392799411400,-2.122016235578830
Wader and Siskin,OL12 9QN,53.641039574246900,-2.126576627428110
tree snake and Puffleg,OL12 9QX,53.637186688599200,-2.123661263008030
New World blackbird and water snake,OL12 9QY,53.637231785941700,-2.123510155077910
massasauga and wall lizard,OL12 9RA,53.637065384041500,-2.127895613665460
jew lizard and Masked owl,OL12 9RB,53.638242640627000,-2.128080674321210
Magpie and constrictor,OL12 9RP,53.631976624436900,-2.137286158960520
Chickadee and Fish eagle,OL12 9TJ,53.640589860885600,-2.126862657291010
Old World quail and puff adder,OL12 9XB,53.631156495588900,-2.139188843533270
bearded lizard and gaboon viper,OL13 0BH,53.696005000000000,-2.203194000000000
cobra de capello and Flameback,OL13 0BJ,53.696731527891500,-2.203727741411980
bicycle lizard and Parrotbill,OL13 0DN,53.692990140690400,-2.210267009083350
boomslang and Vulture,OL13 0ET,53.692198720695500,-2.215578507562970
gaboon viper and box turtle,OL13 0NY,53.691986020794400,-2.233144054018960
mud turtle and Stint,OL13 0RD,53.693433130801500,-2.223490000000000
amethystine python and sand lizard,OL13 0UD,53.692011939674600,-2.219439184887870
Lemming and Old World vulture,OL13 8AR,53.702574814684200,-2.203134952094410
Tree warbler and Kangaroo,OL13 8HH,53.702603318315000,-2.202226242217080
Tahr and Schneider python,OL13 8HN,53.701826251861000,-2.204630913268990
Old World vulture and death adder,OL13 8JS,53.693604901110900,-2.213329210181480
garter snake and chameleon,OL13 8NH,53.695815358534400,-2.223517855076820
Pitohui and leathery turtle,OL13 8PF,53.712379369961600,-2.204000393471760
Civet and thorny devil,OL13 8RP,53.726903453301200,-2.193582698151210
Triller and gopher snake,OL13 9BD,53.703742001594300,-2.198535629635060
frill-necked lizard and boomslang,OL13 9EN,53.704966965460300,-2.191436849390090
Badger and Bunting,OL13 9ES,53.704659899913400,-2.186678922146000
Philippine hawk-owl and Asiatic leopard,OL13 9LR,53.704227194642900,-2.193145215347080
Peafowl and Elephant,OL13 9LS,53.704163886821800,-2.193387293277150
brown snake and water snake,OL13 9LY,53.703775140231000,-2.194779112965410
Rabbit and agamid,OL13 9NQ,53.703194910200000,-2.200547956200000
lizard and Recurvebill,OL13 9NT,53.697048981264300,-2.196641200775020
rattlesnake and agamid,OL13 9NW,53.701754510591500,-2.199207885027020
chuckwalla and alligator,OL13 9PW,53.694606584907000,-2.189602717321320
Ice seal and thorn lizard,OL13 9PX,53.696613218131200,-2.188157798106480
green turtle and New World blackbird,OL13 9QN,53.697754727554800,-2.199249557126220
Egret and viper,OL13 9RN,53.692224946998600,-2.195058886970590
Marsh harrier and Goose,OL13 9SH,53.691811447200000,-2.186652550500000
Crow and perentie,OL13 9SN,53.689345898131600,-2.173573225487130
Mouse and Herring gull,OL13 9SW,53.691140000000000,-2.176882000000000
tiger snake and Chicken,OL13 9TH,53.691059554875300,-2.181697095767280
tree snake and skink,OL13 9TP,53.693416878613600,-2.191656969228220
Black cockatoo and water snake,OL13 9UZ,53.707961000000000,-2.180058000000000
fer-de-lance and Fulmarine petrel,OL13 9WU,53.693678000000000,-2.180542000000000
Bronzewing pigeon and Dorcopsis,OL13 9XA,53.700352987698100,-2.187704954837240
Thrasher and Myna,OL14 5BW,53.714305426687000,-2.093493614755600
amphisbaena and hognose snake,OL14 5BX,53.714982185238000,-2.090040491072640
jew lizard and agamid,OL14 5HU,53.717995679915500,-2.098290157411030
racer and Ground sloth,OL14 5JQ,53.719379579374300,-2.098611615245630
Fulmarine petrel and hoop snake,OL14 5LB,53.719626764633300,-2.103900783938440
perentie and Wader,OL14 5NX,53.722110460473700,-2.100406244895660
Recurvebill and Polecat,OL14 5PQ,53.722590623740300,-2.106408619469610
snake and chameleon,OL14 5PX,53.713134457901000,-2.096657615278150
Civet and Fish eagle,OL14 5RW,53.717149821455900,-2.074831865836580
Meadowlark and Thicketbird,OL14 5SQ,53.716840336929800,-2.080801417566530
Asiatic leopard and sea snake,OL14 6AQ,53.714241999753000,-2.081947944637890
crocodile and Macaw,OL14 6BD,53.683540000000000,-2.093546000000000
boa and Eagle,OL14 6BU,53.716740146012800,-2.068542844943890
kabaragoya and sea snake,OL14 6LX,53.711784525141500,-2.098760464252770
leguaan and soft-shelled turtle,OL14 6NF,53.712354300389500,-2.094398332727560
Scimitar babbler and smooth snake,OL14 6SY,53.692719861245000,-2.099836369257640
Mouse and coral snake,OL14 6XD,53.683876160349200,-2.087596842117010
whip snake and Puffleg,OL14 7BJ,53.714293180172000,-2.097569376626550
Viscacha and smooth snake,OL14 7BS,53.716539488744700,-2.098438277946890
Komodo dragon and Perching duck,OL14 7DT,53.716360038856500,-2.098059048469980
Ground sloth and ringhals,OL14 7HG,53.705890217520000,-2.116621991584370
black snake and Towhee,OL14 7LD,53.712251515822600,-2.099231238747430
dugite and diamondback,OL14 7QA,53.694128527970200,-2.102581000000000
whip snake and slowworm,OL14 7TQ,53.691350433388200,-2.103634113051970
Eagle and Parakeet,OL14 7UR,53.687746922688100,-2.102792426702750
puff adder and Recurvebill,OL14 7UW,53.687436923947000,-2.107788526826190
jew lizard and asp,OL14 8DZ,53.721960769444900,-2.107179899467740
Scimitar babbler and Elephant,OL14 8EG,53.724674274099700,-2.108171915098450
lizard and Cuscus,OL14 8EJ,53.724277391149900,-2.109716726826370
snake and Armadillo,OL14 8ER,53.724220213167600,-2.113202274295110
gecko and python,OL14 8HA,53.726463340095700,-2.117239811730310
cycling lizard and Mouse,OL14 8PB,53.733798422097800,-2.155884511848690
rat snake and Lemming,OL14 8PL,53.732078675367800,-2.151239779754290
hoop snake and Chickadee,OL14 8RT,53.730908707187600,-2.062260000000000
Jackal and cobra de capello,OL14 8SD,53.742824293728600,-2.132068000000000
Philippine hawk-owl and Guillemot,OL14 8SH,53.738483000000000,-2.133283000000000
Thrasher and Pitohui,OL15 0BP,53.629156629022400,-2.108879520893120
box turtle and Boto,OL15 0BQ,53.632150411468700,-2.108100892761500
Vole and Lemming,OL15 0DQ,53.631525950970300,-2.102761238626940
Siskin and Stilt,OL15 0DR,53.633626894246400,-2.105397709538350
king snake and puff adder,OL15 0DU,53.631537404969500,-2.110080300328630
Fulmarine petrel and Wallaby,OL15 0EE,53.631461955194300,-2.113860589609760
Petrel and Triller,OL15 0HT,53.644893605265000,-2.088816700541640
White ibis and mamba,OL15 0JB,53.649347372512000,-2.082381414485560
flying lizard and Zebra,OL15 0JS,53.646523000000000,-2.087155660686400
Chickadee and Herring gull,OL15 0RA,53.631006388372200,-2.110850125788150
goanna and python,OL15 0RB,53.630747069404500,-2.109397762418920
Triller and blue racer,OL15 8BG,53.645166000000000,-2.098362000000000
Kite and Zebra,OL15 8BW,53.644481030176000,-2.099117044891740
Jay and mamba,OL15 8BZ,53.644513836397400,-2.102838268421250
Mink and Marmoset,OL15 8DB,53.640956000000000,-2.112298000000000
perentie and Pheasant,OL15 8DE,53.643495771417600,-2.094879379690910
thorn lizard and bull snake,OL15 8DN,53.642167308464800,-2.103543457142580
Mockingbird and Peafowl,OL15 8EP,53.649614371194300,-2.108221305381010
Dolphin and Marmoset,OL15 8JG,53.641709863680400,-2.102438164541130
diamondback turtle and Pitohui,OL15 8JQ,53.641989593127500,-2.101153158855660
Treepie and Piping shrike,OL15 8NA,53.641448056005600,-2.113645535550700
Black cockatoo and cerastes,OL15 8NB,53.640423317635700,-2.113733525622320
thorn lizard and monitor,OL15 8ND,53.640448992875000,-2.115079734004240
cycling lizard and fer-de-lance,OL15 8PF,53.641310000000000,-2.108472000000000
boa constrictor and chameleon,OL15 8PX,53.637696254827100,-2.117492092873290
Nukupuʻu and Kākāriki,OL15 8QN,53.633089000000000,-2.114455610036130
boomslang and Meadowlark,OL15 8RF,53.636385238005800,-2.116202927023010
monitor and glass snake,OL15 8RR,53.646188998720900,-2.109180655848720
Solitaire and frill-necked lizard,OL15 9AG,53.650662414800000,-2.096529674400000
Egret and Kangaroo,OL15 9BY,53.644735402896200,-2.095804897739990
copperhead and jew lizard,OL15 9DD,53.644807852528400,-2.095124360171640
Tit-tyrant and Treepie,OL15 9DQ,53.645061095529000,-2.093128193174420
blue racer and boomslang,OL15 9HG,53.646807956222400,-2.100332710176500
sand viper and rock snake,OL15 9JE,53.649853638771600,-2.101883068373770
Tree warbler and mountain devil,OL15 9JP,53.650636136657000,-2.101264678642640
Gull and flying lizard,OL15 9LU,53.650584722033000,-2.108632273283150
Gull and gopher snake,OL15 9NE,53.661721000000000,-2.087505000000000
Myna and New World blackbird,OL15 9NJ,53.668706025234200,-2.084508000000000
Kākāriki and Mole,OL15 9NQ,53.663796671481700,-2.087555074614720
galliwasp and wall lizard,OL15 9PP,53.657416509113700,-2.085574754103330
Night heron and Partridge,OL15 9QF,53.660506886207600,-2.087714692017830
chameleon and Recurvebill,OL15 9QL,53.660907786087400,-2.079997962889720
