name,postcode,lat,lon
Moluccan boobook and Zebra,DN21 4BB,53.479836130739100,-0.594410293533321
diamondback turtle and Philippine hawk-owl,DN21 4BL,53.479167630879900,-0.597190023167158
Black cockatoo and Recurvebill,DN21 4DE,53.475974257957400,-0.595472125980830
Badger and Rat,DN21 4DF,53.475163239945900,-0.595303026533919
pit viper and amphisbaena,DN21 4ED,53.479039633887100,-0.595476378758753
Tree warbler and Songlark,DN21 4ER,53.453568000000000,-0.594148000000000
Jerboa and deaf adder,DN21 4EU,53.453594799569400,-0.596556994657603
wall lizard and king snake,DN21 4FH,53.480269000000000,-0.590659000000000
Night heron and Booted eagles,DN21 4NQ,53.477788344819700,-0.589219039482728
turtle and Mockingbird,DN21 4NZ,53.478547482792900,-0.585758161727512
agama and Kite,DN21 4SW,53.452904986075100,-0.522199304227176
elapid and horned viper,DN21 4TL,53.478915288739100,-0.596369553740669
Parrotbill and mountain devil,DN21 4TP,53.440520871912600,-0.520280401057915
Logrunners and Marmoset,DN21 4TT,53.440110000000000,-0.516414000000000
Shearwater and Grackle,DN21 5SA,53.430619000000000,-0.601137000000000
Magpie and bushmaster,DN21 5UN,53.407110947770500,-0.604977291433443
bandy-bandy and loggerhead,LN1 2FG,53.301181053950400,-0.578419155255161
Grackle and leathery turtle,LN1 2FH,53.341020248507300,-0.585806338205143
gopher snake and Buzzard,LN1 2SE,53.302922716893900,-0.578226251084189
boa and bearded dragon,LN1 2UT,53.298265807263700,-0.552781821090149
goanna and Masked owl,LN1 2UY,53.341524788169500,-0.579090509255439
Chipmunk and Grackle,LN1 2XT,53.339969768324700,-0.580614153534525
tuatara and Wader,LN1 2ZF,53.290871000000000,-0.550061000000000
racer and Maya,LN2 2LZ,53.283277624950800,-0.540028164909719
krait and New World blackbird,LN2 2UQ,53.284760074335500,-0.450888305720590
Hawaiian honeycreeper and rock snake,LN2 2WL,53.285185000000000,-0.442682000000000
habu and tokay,LN2 3FE,53.308559335297000,-0.470679492929257
coral snake and Tahr,LN2 3HX,53.308828792975900,-0.475577875542184
Kangaroo and Asiatic leopard,LN2 3LT,53.305713331084800,-0.482937762205234
python and Vulture,LN2 3LZ,53.307291503222100,-0.475572600956261
Chipmunk and bearded lizard,LN2 3NA,53.308131108605600,-0.470934939824354
giant tortoise and Vulture,LN2 3PQ,53.328903611247000,-0.514144749547009
Myna and Viscacha,LN2 3PR,53.326991638943400,-0.539857624855553
amethystine python and Perching duck,LN2 3UD,53.302564420571300,-0.479912907637910
bull snake and chameleon,LN2 3UF,53.298106697843900,-0.466656322445006
Viscacha and Duck,LN2 3UT,53.298835920539100,-0.463944178736678
Grouse and bushmaster,LN3 5DH,53.280800384518400,-0.393737000000000
black snake and diamondback turtle,LN7 6FW,53.487779340966200,-0.296499000000000
Tahr and Rabbit,LN7 6GD,53.497574000000000,-0.339710000000000
massasauga and perentie,LN7 6GJ,53.497950000000000,-0.339834268400000
Treepie and bearded dragon,LN7 6GN,53.498084696900000,-0.339218231100000
green turtle and leathery turtle,LN7 6GY,53.498405873500000,-0.340336408900000
leathery turtle and Minke whale,LN7 6JG,53.496942382186700,-0.305341986467691
kabaragoya and horned toad,LN7 6LG,53.498243334097700,-0.446057163811700
cayman and Towhee,LN7 6LP,53.495290707062000,-0.313774672092721
Boto and python,LN7 6NN,53.486169841782600,-0.327460189862856
cycling lizard and carpet snake,LN7 6NP,53.486651716812600,-0.327848183049462
amphisbaena and Kite,LN7 6NU,53.486572969738600,-0.329931247163968
boa and galliwasp,LN7 6PJ,53.472696165279100,-0.430974303119896
New World blackbird and Armadillo,LN7 6QH,53.497408752051800,-0.320550253519921
turtle and tree snake,LN7 6QQ,53.497643587487400,-0.319244000000000
black snake and python,LN7 6QU,53.498422232459800,-0.315911881999691
Nukupuʻu and Rat,LN7 6QZ,53.497552913248000,-0.310368155497542
boomslang and Vole,LN8 2AX,53.407076238117800,-0.541870557452680
Chicken and rat snake,LN8 2BF,53.374329000000000,-0.502300000000000
habu and python,LN8 2BG,53.420241000000000,-0.521750883913440
Marsh harrier and Komodo dragon,LN8 2FB,53.400181718703600,-0.493916000000000
amphisbaena and iguana,LN8 3AN,53.384979341801700,-0.334932487930324
leguaan and Kākāriki,LN8 3DZ,53.381042988239900,-0.320893110082666
Magpie and White ibis,LN8 3FS,53.385150000000000,-0.334219000000000
Hawk and Tahr,LN8 3HE,53.387334470077700,-0.332344422145950
loggerhead and amphisbaena,LN8 3HT,53.389094276040100,-0.338530000000000
Armadillo and Hawk,LN8 3JS,53.387518537472400,-0.360561967257956
Masked owl and Kestrel,LN8 3JY,53.387366691625200,-0.371800484106800
Songlark and copperhead,LN8 3LD,53.387167673898000,-0.369732975382344
rock snake and Peafowl,LN8 3PR,53.437100000000000,-0.399874000000000
perentie and tiger snake,LN8 3RB,53.385899352023900,-0.323589048545359
Magpie and pit viper,LN8 3RE,53.384436887684400,-0.320594170056367
flying dragon and rock snake,LN8 3RF,53.383645000000000,-0.325549168853854
snapping turtle and American sparrow,LN8 3SA,53.359684677392100,-0.379513012208086
brown snake and Stilt,LN8 3TB,53.416224659169300,-0.380494079762948
Moluccan boobook and Hawk,LN8 3TW,53.387053425700000,-0.320521331600000
snake and Tree warbler,LN8 3UA,53.389598175488700,-0.360782813928166
soft-shelled turtle and pit viper,LN8 3XP,53.398564455666200,-0.273034303840503
Ice seal and copperhead,LN8 3XU,53.400533438824500,-0.261898758159038
krait and rock snake,LN8 3YZ,53.436737034170500,-0.321617000000000
coral snake and turtle,LN8 5AE,53.288124000000000,-0.314578000000000
gopher snake and Diving bird,LN8 5BB,53.283699668731800,-0.303590779746892
Ice seal and Perching duck,LN8 5LB,53.292094400586400,-0.292755596669884
rat snake and Grosbeak,LN8 5LT,53.293250000000000,-0.253879000000000
puff adder and blindworm,LN8 5PH,53.289663503377500,-0.296273172231079
Kite and jew lizard,LN8 5RR,53.286220500800600,-0.292509716832228
harlequin snake and American sparrow,LN8 5RT,53.318333905562500,-0.243096455233323
cobra and Gila monster,LN8 6LT,53.347230117294800,-0.270362427426969
Grackle and perentie,LN8 6LW,53.345768676595800,-0.227742176338505
