name,postcode,lat,lon
galliwasp and Mockingbird,BT22 1LF,54.379208000000000,-5.545483000000000
Duck and indigo snake,BT22 1LG,54.380246000000000,-5.544867000000000
galliwasp and copperhead,BT22 1LN,54.382087000000000,-5.546805000000000
Mamo and carpet snake,BT22 1NA,54.383516000000000,-5.543055000000000
Myna and Piping shrike,BT22 1PT,54.381952000000000,-5.539745000000000
Old World quail and Petrel,BT22 1QP,54.388011000000000,-5.461104000000000
Solitaire and cayman,BT22 1RG,54.338715000000000,-5.500176000000000
flying dragon and Siskin,BT22 1RH,54.379978000000000,-5.542947000000000
Kangaroo and Tit-tyrant,BT22 1RR,54.383585000000000,-5.536999000000000
Fish eagle and Marsh harrier,BT30 7LF,54.367071000000000,-5.556272000000000
Ground sloth and Treepie,BT30 7LZ,54.369442000000000,-5.557392000000000
iguana and saltwater crocodile,BT30 7NE,54.371352000000000,-5.555354000000000
