name,postcode,lat,lon
Condor and sand viper,LA10 5AB,54.323703751309000,-2.526444446101920
cycling lizard and whip snake,LA10 5BX,54.322907202851100,-2.527741112924440
Cloud rat and bearded dragon,LA10 5DF,54.324064357171300,-2.530292816197190
krait and Maya,LA10 5DR,54.322008082855100,-2.538646000000000
puff adder and Cloud rat,LA10 5DS,54.323118000000000,-2.537185626416390
thorn lizard and viper,LA10 5DU,54.322583558546400,-2.535916204012270
Gull and cobra de capello,LA10 5EE,54.324931982386900,-2.568680963917660
Myna and wall lizard,LA10 5HD,54.324716837010500,-2.535175182980140
snapping turtle and fer-de-lance,LA10 5HQ,54.317401293678100,-2.537170863302080
galliwasp and Skunk,LA10 5JJ,54.323033180041400,-2.519425032763360
swift and jew lizard,LA10 5QQ,54.285321184629000,-2.483329000000000
mountain devil and Buzzard,LA10 5SX,54.298547132318900,-2.499665000000000
Crow and Philippine hawk-owl,LA6 1HS,54.184528987386400,-2.729653000000000
python and Petrel,LA6 1LJ,54.180847224093300,-2.721116133906730
agama and cayman,LA6 1LS,54.181230897300600,-2.721582477799390
boa and White ibis,LA6 1NB,54.182855560886900,-2.720430920774760
Vole and garter snake,LA6 1RY,54.199778562611900,-2.726519751081010
lizard and Zebra,LA6 2BH,54.202452261916300,-2.596200000000000
puff adder and rat snake,LA6 2BU,54.200354190672400,-2.595434469105730
diamond snake and puff adder,LA6 2DE,54.199690450715700,-2.594904000000000
puff adder and Piping shrike,LA6 2DG,54.195565629435800,-2.595074384662190
Duck and Chipmunk,LA6 2DY,54.213715000000000,-2.601760000000000
Wallaby and loggerhead,LA6 2EH,54.209479000000000,-2.623609000000000
Hawaiian honeycreeper and cobra,LA6 2EZ,54.290603860070900,-2.584860805007900
boa and Maya,LA6 2FD,54.201690048442500,-2.596097528591010
Scimitar babbler and Vulture,LA6 2FT,54.203339986400800,-2.596690000000000
habu and Bronzewing pigeon,LA6 2GY,54.190198807751900,-2.576867341434050
diamondback and Marsh harrier,LA6 2HG,54.200966224949000,-2.600685918412150
Francolin and terrapin,LA6 2HT,54.181235794565900,-2.567932343795840
sidewinder and carpet snake,LA6 2HY,54.177879426373200,-2.555307954605260
Thrasher and anaconda,LA6 2JE,54.191823059119900,-2.536582702244090
American sparrow and harlequin snake,LA6 2LG,54.233169000000000,-2.567507454366460
Buzzard and diamondback terrapin,LA6 2LZ,54.267931899985600,-2.571074024696160
hoop snake and perentie,LA6 2NU,54.181172607741300,-2.613775040507940
viper and Herring gull,LA6 2PZ,54.236225000000000,-2.654237000000000
garter snake and puff adder,LA6 2QF,54.190744459725000,-2.615510756761960
boomslang and rock snake,LA6 2SF,54.208860000000000,-2.576376000000000
agamid and tuatara,LA7 7AJ,54.212069891765400,-2.787180750473130
Goose and chameleon,LA7 7DJ,54.229702190395600,-2.760809038109720
blind snake and Logrunners,LA7 7DY,54.231476993051300,-2.774249592681280
viper and Gila monster,LA7 7NW,54.246785538531000,-2.715867000000000
hoop snake and Meadowlark,LA7 7PN,54.226854924249900,-2.771831518303020
Parrotbill and Argus,LA7 7PP,54.227155898186900,-2.770641000000000
Quetzal and blindworm,LA7 7PQ,54.212973305152700,-2.773980021860770
Partridge and deaf adder,LA8 0AT,54.307961788978300,-2.672157777922710
diamondback and Gull,LA8 0AU,54.307027561727200,-2.659048311514170
viper and Buzzard,LA8 0HU,54.268183042495400,-2.655817000000000
Petrel and Flameback,LA8 0NA,54.283975000000000,-2.686611896165200
ringhals and coral snake,LA8 0NU,54.295277558918800,-2.662962896729030
Duck and terrapin,LA8 0NZ,54.289909797246500,-2.671494986847330
Pratincole and Peafowl,LA8 8AB,54.296834657547200,-2.755885000000000
indigo snake and flying lizard,LA8 8AJ,54.300264334260100,-2.799511821659130
diamondback turtle and bandy-bandy,LA8 8DS,54.270541228208500,-2.783304458455160
chameleon and Jackal,LA8 8HA,54.326425877393800,-2.777662323161840
Chickadee and jew lizard,LA8 8LT,54.268662909598100,-2.790178436365820
tiger snake and sand viper,LA8 8QD,54.268495688297500,-2.786889348422440
Logrunners and Parakeet,LA8 9AG,54.361211625653000,-2.749972652855330
Gila monster and anaconda,LA8 9AP,54.364232682948200,-2.726249771878860
agama and Shearwater,LA8 9DJ,54.351960813955700,-2.713386273940080
Elephant and asp,LA8 9EF,54.368536787645200,-2.672100365343580
diamondback terrapin and Capuchin,LA9 4DH,54.326830315899700,-2.746363788521600
indigo snake and B,LA9 4HF,54.325937265357400,-2.748346488793270
Schneider python and taipan,LA9 4PD,54.328853247502400,-2.752028430572140
Booted eagles and Chickadee,LA9 4SX,54.327369534641800,-2.747818945498050
boa and Coati,LA9 5DA,54.319517828384300,-2.748737265203550
Argus and Coati,LA9 5JT,54.310997155846700,-2.753162907112500
Jackal and gavial,LA9 5JX,54.310588971261100,-2.755199693815290
sand lizard and Buzzard,LA9 5PN,54.334220241547700,-2.754663943397890
terrapin and Egret,LA9 5PP,54.337405687375500,-2.752599827463630
kabaragoya and harlequin snake,LA9 5PR,54.336776760557900,-2.751127235948150
Crow and diamond python,LA9 5PU,54.338894574492100,-2.751642660174960
Songlark and flying dragon,LA9 5RJ,54.310367433838500,-2.763264974803420
garter snake and brown snake,LA9 5SB,54.351058922076300,-2.768065497108580
amphisbaena and Fish eagle,LA9 5TA,54.316134569348200,-2.756577183230960
Chicken and Stilt,LA9 6AB,54.330488101043200,-2.734666143481810
indigo snake and Civet,LA9 6DN,54.338741040580900,-2.740135067692570
cerastes and diamondback,LA9 6DZ,54.338457207160200,-2.748266320038490
Nukupuʻu and whip snake,LA9 6EQ,54.331012659116300,-2.742656000000000
Myna and viper,LA9 6HQ,54.333756946031000,-2.738030891110900
boa and Rat,LA9 6NS,54.344765000000000,-2.739920000000000
Vole and kabaragoya,LA9 6PU,54.352411046963000,-2.760336247852410
Kestrel and Philippine hawk-owl,LA9 6QN,54.352632886551300,-2.763632936635960
gopher snake and blind snake,LA9 6QR,54.353782029884700,-2.762407956301640
diamondback and pit viper,LA9 6QS,54.353932658256700,-2.762749247351080
Shearwater and Armadillo,LA9 6QT,54.354227358679000,-2.763186000000000
Kite and American sparrow,LA9 6RA,54.356496536843300,-2.766612827578320
cayman and krait,LA9 6RP,54.326393000000000,-2.728355818772380
Wader and Minke whale,LA9 6RS,54.325629469461900,-2.728152427704420
tokay and thorny devil,LA9 7AG,54.320938641080400,-2.728054181158820
hawksbill and Piping shrike,LA9 7AW,54.329824050512000,-2.738913842610420
Snipe and bandy-bandy,LA9 7AX,54.329329779171800,-2.735967930815030
anaconda and Magpie,LA9 7AY,54.326460475527400,-2.731918888734300
Badger and Ibex,LA9 7EU,54.298689552523400,-2.725940472904440
perentie and Piping shrike,LA9 7EX,54.300189369386200,-2.726120531691850
diamondback terrapin and coral snake,LA9 7JG,54.316058309153300,-2.736960759853200
turtle and Polecat,LA9 7LB,54.313935849699200,-2.734248183338190
fer-de-lance and Argus,LA9 7LD,54.313535296752600,-2.735086472423400
Tit-tyrant and king snake,LA9 7LR,54.312347000000000,-2.741446123660100
Philippine hawk-owl and Hawaiian honeycreeper,LA9 7NH,54.310704743294000,-2.727596801448780
deaf adder and brown snake,LA9 7SP,54.295218609613600,-2.738078806382430
Parrotlet and gavial,LA9 7WY,54.329712283769200,-2.746846557812760
wall lizard and diamond snake,LA9 9SB,54.327019030230300,-2.746367206547780
boa and black snake,LA9 9SX,54.327019030230300,-2.746367206547780
turtle and Badger,LA9 9TD,54.327019030230300,-2.746367206547780
Warbler and tortoise,LA9 9TY,54.327019030230300,-2.746367206547780
