name,postcode,lat,lon
Polecat and American sparrow,DL6 3BQ,54.372432575240200,-1.298120920194000
Lemming and gopher snake,DL6 3QD,54.352702117773700,-1.217188532704130
Goose and horned toad,TS9 7JS,54.360924489772000,-1.131591877153740
Moluccan boobook and flying lizard,TS9 7LW,54.367599000000000,-1.105272393996300
Peafowl and lizard,YO18 8SB,54.355656945769700,-0.889167141683937
Parakeet and Fox,YO62 4ES,54.201784010206600,-1.079804697319040
Gull and Snipe,YO62 4EW,54.201290588980000,-1.079922967031930
bearded dragon and Prion,YO62 5AS,54.248821856374300,-1.064147484480330
Maya and Cloud rat,YO62 5BD,54.244737958922600,-1.052193296111930
gaboon viper and bushmaster,YO62 5DA,54.245539410196000,-1.055827346236210
Pratincole and hawksbill,YO62 5DY,54.245349772086000,-1.058395000000000
python and Badger,YO62 5EB,54.239231213071500,-1.074522153157070
grass snake and Parrotlet,YO62 5HG,54.258161116786400,-1.052775904848300
python and diamond python,YO62 5HH,54.283497000000000,-1.056050000000000
cayman and Kite,YO62 5HT,54.249056000000000,-1.063325000000000
Boto and sand viper,YO62 5JB,54.231506365819900,-1.009495250960260
python and Mouse,YO62 5NB,54.308804064008100,-1.136316438049890
gaboon viper and bearded dragon,YO62 5UY,54.205392950073000,-0.974627452721594
tokay and bull snake,YO62 6AD,54.268823678866300,-0.933652845818560
glass snake and rattlesnake,YO62 6BT,54.270717592803200,-0.939485244727571
Jerboa and River dolphin,YO62 6BY,54.271314000000000,-0.940760000000000
Thicketbird and Masked owl,YO62 6DE,54.269195537028200,-0.930986788502035
mud turtle and Civet,YO62 6DG,54.266659805113500,-0.930852783600795
Grackle and gopher snake,YO62 6EZ,54.253059509426600,-0.936745609766398
Herring gull and Darwin's finches,YO62 6PE,54.238660024751100,-0.913440085960915
rat snake and brown snake,YO62 6PX,54.266920756167500,-0.936987797397535
box turtle and Viscacha,YO62 6TR,54.299736831375400,-0.887921000000000
B and Condor,YO62 7HA,54.297228898360500,-0.966124335530280
Wallaby and Mole,YO62 7HG,54.253141299353800,-0.957434326822738
Peafowl and brown snake,YO62 7JU,54.309983000000000,-0.946361000000000
Parrotbill and Hawaiian honeycreeper,YO62 7RD,54.253362052984600,-0.995080618866669
Mamo and American sparrow,YO62 7RX,54.245723000000000,-0.974781419165454
Tit-tyrant and tiger snake,YO62 7RZ,54.251402536721800,-0.989679506917990
jew lizard and moloch,YO62 7TG,54.289287545800400,-1.023748749039730
Coati and cerastes,YO62 7TQ,54.266735792851300,-1.022423740671770
tortoise and Herring gull,YO7 2AF,54.220696000000000,-1.297582000000000
Warbler and Tree warbler,YO7 2AP,54.214204602091200,-1.231110605640000
Logrunners and Dorcopsis,YO7 2BQ,54.183932800126200,-1.240667000000000
brown snake and Diving bird,YO7 2BZ,54.202923784186100,-1.287428829122820
Mouse and bandy-bandy,YO7 2ET,54.233965857760100,-1.227598000000000
box turtle and Skunk,YO7 2JT,54.314763031260300,-1.275691200452590
habu and blind snake,YO7 2PG,54.219703639214400,-1.286434429360450
king cobra and gopher snake,YO7 2PY,54.241924000000000,-1.241116029540760
Grouse and constrictor,YO7 2QE,54.240220000000000,-1.224735000000000
Shearwater and copperhead,YO7 3BH,54.183558000000000,-1.283716000000000
