name,id,postcode,lat,lon
gavial and saltwater crocodile,399854,SA71 4PL,51.678101056428000,-4.914151081183130
crocodile and gavial,398982,SA73 1PG,51.711356790533500,-4.921530565657050
chuckwalla and Parrotlet,399039,SA73 1RB,51.716012021660000,-4.949370040037470
black snake and Meadowlark,398779,SA73 2LF,51.712835198742100,-5.025316000000000
Puffleg and Warbler,399303,SA73 1ED,51.710782350111000,-4.955616824398520
Tahr and Peafowl,398789,SA73 2LT,51.714312879675700,-5.029514921495410
Rat and cobra,402755,SA62 3SA,51.773546608933600,-5.045545567344080
saltwater crocodile and Moluccan boobook,399412,SA72 6EU,51.698802000000000,-4.933472000000000
water snake and bearded lizard,403011,SA62 3EJ,51.760801878931700,-4.992727242783730
gecko and Partridge,399187,SA72 6UL,51.697869340173400,-4.941922400556990
Masked owl and taipan,1808451,SA73 1GL,51.722646721200000,-5.018691000000000
tree snake and blind snake,402710,SA62 3QD,51.754858027288800,-4.988797982584350
Shearwater and diamond snake,398572,SA73 3NA,51.713343000000000,-5.046535000000000
cycling lizard and dugite,398634,SA73 3PU,51.717016686249300,-5.052906791171580
glass snake and Treepie,399348,SA72 4UH,51.696235568762400,-4.889294902847620
mud turtle and Fox,399169,SA72 6TL,51.691226000000000,-4.959392000000000
Bunting and Thicketbird,399559,SA71 5EU,51.657013032838400,-4.936772127555270
Night heron and horned toad,399222,SA73 2DA,51.724808000000000,-5.033084000000000
mamba and horned toad,398625,SA73 3PG,51.715553183862000,-5.049695098399370
iguana and hoop snake,402790,SA62 3UA,51.773625386111600,-5.095510915524150
python and Asiatic leopard,398567,SA73 3LR,51.711303075769400,-5.043299288227170
Asiatic leopard and horned viper,399250,SA73 1AH,51.724793518094300,-5.020339242320240
Wader and deaf adder,403013,SA62 3EN,51.772976340709100,-5.018512519687900
Badger and Mouse,398921,SA73 3DE,51.709122874114200,-5.041010207088970
Thicketbird and Logrunners,399155,SA72 6SP,51.686106202851300,-4.951201048532100
lizard and Moluccan boobook,399919,SA71 5BE,51.689538000000000,-5.107508000000000
bicycle lizard and caiman,402752,SA62 3RR,51.692129914513000,-5.178931562388180
Tahr and habu,399312,SA73 1ER,51.711895858221500,-4.962465102911780
anaconda and racer,398941,SA73 1JY,51.749052950463000,-4.973011794045960
worm lizard and Gull,402488,SA62 4HE,51.753104396884600,-4.953599199679850
Partridge and Philippine hawk-owl,399779,SA71 4HR,51.671890419578800,-4.932759098222080
cobra and saltwater crocodile,402554,SA62 4NG,51.756088715695700,-4.921665442864910
Elephant and Ice seal,399450,SA72 6JG,51.692996500939900,-4.944430000000000
puff adder and Boto,398549,SA73 3JH,51.711885582995100,-5.034347526909910
Lemming and Coati,402762,SA62 3SJ,51.754856182731600,-5.114058000000000
chuckwalla and giant tortoise,399101,SA73 1UG,51.709172000000000,-4.953111155792040
krait and Linsang,398734,SA73 2EA,51.716899317926600,-5.034191095844060
racer and Recurvebill,402562,SA62 4NS,51.739047035101200,-4.936384416866260
Bronzewing pigeon and Kite,399094,SA73 1TX,51.708341857739600,-4.949305028571660
cycling lizard and brown snake,402765,SA62 3SP,51.748567875719300,-5.142569711585140
Coati and Tit-tyrant,399719,SA72 4RW,51.691627463642200,-4.920805000000000
Siskin and chuckwalla,402966,SA62 3AS,51.730186000000000,-5.173275000000000
mud turtle and Philippine hawk-owl,398925,SA73 1JB,51.729187963835900,-5.013129918377890
copperhead and Jay,398783,SA73 2LL,51.713108390277800,-5.026697940480240
Thicketbird and Ibex,399487,SA72 6NL,51.689523368596300,-4.947284859072950
Kangaroo and grass snake,399873,SA71 4QJ,51.679906337374500,-4.915337663476230
dugite and black snake,398760,SA73 2HY,51.714518143948400,-5.034103985522780
snake and goanna,398774,SA73 2JS,51.716899000000000,-5.033192000000000
asp and mountain devil,399470,SA72 6LL,51.689652203815500,-4.932446318033740
Philippine hawk-owl and Chipmunk,399505,SA72 6PJ,51.687777318719500,-4.937288295043180
Solitaire and tortoise,399338,SA72 4TU,51.705065208603600,-4.882070047469850
Songlark and brown snake,2398223,SA62 3QT,51.758887000000000,-4.993634000000000
Darwin's finches and gecko,402809,SA62 3XB,51.760198000000000,-5.134841000000000
Mamo and Meadowlark,403005,SA62 3DZ,51.756790082473400,-5.084851317546650
tiger snake and Prion,402975,SA62 3BE,51.732552000000000,-5.201093000000000
flying lizard and Treepie,399917,SA71 5BB,51.685020774368200,-5.096128000000000
Pratincole and Tree warbler,399253,SA73 1AN,51.727884692183100,-5.017648821591340
Scimitar babbler and blindworm,402566,SA62 4NX,51.743836000000000,-4.920758000000000
Black jay and skink,1808465,SA73 3SG,51.717731000000000,-5.061093000000000
Dolphin and hognose snake,399391,SA72 6DP,51.695162190585100,-4.938331210161480
Mamo and White ibis,399668,SA71 5QP,51.666436000000000,-4.939103000000000
Nukupuʻu and agama,399568,SA71 5HG,51.644359590024800,-5.014393856670380
Cuscus and Perching duck,399857,SA71 4PQ,51.677911085808000,-4.915281757814400
leguaan and dukite,399565,SA71 5HB,51.652366000000000,-4.983781000000000
Booted eagles and Pratincole,399050,SA73 1RR,51.711884540911900,-4.952561520664450
Parrotlet and Wallaby,399267,SA73 1BE,51.717189906651900,-5.023625860683360
Hawk and kabaragoya,402986,SA62 3BY,51.757176304294000,-5.033080880527340
Kestrel and Piping shrike,402798,SA62 3UL,51.773925637050300,-5.109000286455780
Mouse and Vulture,1808460,SA73 3SA,51.718097000000000,-5.060524000000000
Greenbul and cayman,398665,SA73 3SH,51.728705804249000,-5.084342193213120
horned toad and python,399707,SA71 5TR,51.668742051998400,-4.980258039993760
agamid and bearded dragon,399776,SA71 4HL,51.675148510004000,-4.912442481905890
mud turtle and mountain devil,399514,SA72 6QH,51.685990795975100,-4.942902496768540
gaboon viper and New World blackbird,399499,SA72 6PB,51.688190363200600,-4.943059726378220
hognose snake and bearded dragon,399066,SA73 1SL,51.707146831826900,-4.946751796938790
alligator and Gull,399176,SA72 6TU,51.694065515827100,-4.928230982779850
amethystine python and hognose snake,398894,SA73 3AJ,51.711565033944300,-5.036889000000000
Scimitar babbler and slowworm,399475,SA72 6LS,51.691167590228100,-4.929027846842590
blind snake and taipan,398750,SA73 2HH,51.712427643553300,-5.033906053480850
rock snake and Peafowl,399793,SA71 4JL,51.673702859693300,-4.932572487988240
Cloud rat and Mouse,399773,SA71 4HD,51.672737096291300,-4.921530944651590
Cloud rat and slowworm,399882,SA71 4QY,51.681224543181600,-4.915856433513840
milk snake and goanna,403017,SA62 3ET,51.754492000000000,-5.014438000000000
sea snake and Rabbit,399494,SA72 6NW,51.687285535431700,-4.947727000000000
turtle and Kite,399906,SA71 5AN,51.682300768177300,-5.085525568671870
Siskin and bearded lizard,399560,SA71 5EW,51.660537299135900,-4.931070997702380
gavial and diamondback,398864,SA73 2QS,51.711631686531300,-5.022574403754530
fer-de-lance and sand viper,398534,SA73 3HH,51.714010610736500,-5.056787212376330
