name,postcode,lat,lon
Shearwater and horned viper,HP1 3SG,51.771412592047500,-0.479846874237140
sea snake and horned viper,HP1 9NU,51.764175000000000,-0.439340000000000
Shearwater and blindworm,HP1 9ST,51.764182000000000,-0.439318000000000
gopher snake and blind snake,HP1 9SU,51.764182000000000,-0.439318000000000
Diving bird and Darwin's finches,HP10 0BA,51.593887468762200,-0.679176330776792
diamond snake and rock snake,HP10 0DU,51.599217439253500,-0.687800265877663
Civet and agamid,HP10 0EE,51.588786816019700,-0.682746000000000
fer-de-lance and Chipmunk,HP10 0EH,51.585942000000000,-0.680186000000000
Civet and Bronzewing pigeon,HP10 0NW,51.601230699236400,-0.686110633173020
Linsang and Chicken,HP10 0PS,51.579258678903300,-0.692113020150774
puff adder and diamondback terrapin,HP10 0QN,51.579828530537300,-0.693222377361471
giant tortoise and bull snake,HP10 8BB,51.640798771465100,-0.700213895931977
Skunk and pit viper,HP10 8BQ,51.643329331707600,-0.699751331126885
Chickadee and mountain devil,HP10 8EJ,51.635823763468500,-0.699171204393120
slowworm and python,HP10 8EL,51.636509290256200,-0.700177558653035
Old World warbler and perentie,HP10 8EN,51.634627114700400,-0.699104287753466
agamid and Vole,HP10 8HF,51.628934393887400,-0.699021497997038
sidewinder and Dolphin,HP10 8HP,51.637505000000000,-0.704773000000000
Vulture and coral snake,HP10 8JT,51.644261317894800,-0.715101000000000
adder and Warbler,HP10 8JW,51.640155832150300,-0.713686495250398
cobra and smooth snake,HP10 9BG,51.599170937563200,-0.707928676643825
agama and Schneider python,HP10 9BT,51.603486523470900,-0.711156214101316
thorny devil and frill-necked lizard,HP10 9BX,51.605529788598900,-0.709712091832063
Partridge and kabaragoya,HP10 9HA,51.606721010726300,-0.717490763679261
Dolphin and Wader,HP10 9NT,51.601517548965900,-0.707905401227286
king snake and agama,HP10 9NU,51.601676000000000,-0.707525000000000
adder and Puffleg,HP10 9NX,51.601772669234400,-0.707392790097720
Duck and B,HP10 9PD,51.603757161264200,-0.703885332820515
Guillemot and Vole,HP10 9QJ,51.612843807442800,-0.718257004001193
Viscacha and B,HP10 9RJ,51.610730147440200,-0.699397492591279
Kangaroo and monitor,HP10 9RS,51.604582605364000,-0.700597000000000
Minke whale and Zebra,HP10 9RW,51.610397971939400,-0.695392130582608
Stilt and tiger snake,HP10 9TN,51.606669328798700,-0.700524370844032
Mockingbird and Old World vulture,HP10 9XD,51.608813340383200,-0.700881963577435
massasauga and thorny devil,HP11 1AW,51.612492299285900,-0.711495000000000
copperhead and puff adder,HP11 1AZ,51.627758396455600,-0.748002927687814
green turtle and Tattler,HP11 1FW,51.621487778527100,-0.727388675083505
jew lizard and snapping turtle,HP11 1GJ,51.619459000000000,-0.721176000000000
krait and worm lizard,HP11 1HE,51.615733000000000,-0.710965342508729
Marmoset and garter snake,HP11 1LE,51.615347818917900,-0.707166108250019
caiman and dugite,HP11 1QU,51.623252342132900,-0.733637651317092
Macaw and Stilt,HP11 1QY,51.621895983561300,-0.732100842361866
rock snake and taipan,HP11 1WP,51.628121000000000,-0.745286000000000
Badger and tree snake,HP11 1XA,51.614600256631500,-0.714423407830876
Komodo dragon and mud turtle,HP11 9JS,51.627760870946400,-0.748002964226947
massasauga and iguana,HP11 9SW,51.627426815191300,-0.748951126192552
sea snake and jew lizard,HP11 9TA,51.627426815191300,-0.748951126192552
diamondback terrapin and skink,HP13 5HF,51.647074868848200,-0.736226228997156
black snake and Recurvebill,HP13 5PX,51.647372826234400,-0.738241347995425
cycling lizard and cobra,HP13 5QA,51.644287268425800,-0.739786706426108
thorn lizard and Mink,HP13 5QH,51.641869342506200,-0.746588296952111
Vole and harlequin snake,HP13 6AA,51.626917421171500,-0.739993482372640
monitor and Mouse,HP13 6BP,51.641840523439300,-0.733842554550344
Flameback and krait,HP13 6DW,51.630034676788400,-0.744761690240072
glass snake and rat snake,HP13 6EW,51.627240646243300,-0.735765941514045
Old World vulture and cobra de capello,HP13 6HQ,51.630849799200300,-0.736922630942989
blindworm and White ibis,HP13 6HT,51.630891000000000,-0.735592000000000
Civet and tiger snake,HP13 6JL,51.638125311172900,-0.727226000000000
Armadillo and Prion,HP13 6LF,51.630098240734000,-0.747346148730370
Ibex and goanna,HP13 6QA,51.632718143954100,-0.742606978292513
Cloud rat and Civet,HP13 6QT,51.641104000000000,-0.738806000000000
Old World vulture and viper,HP13 6RA,51.633778882595800,-0.739225414726552
thorny devil and Macaw,HP13 6TB,51.633691307316700,-0.748692108057266
viper and Myna,HP13 6TZ,51.641038579873700,-0.732853275166099
Parrotlet and hawksbill,HP13 6UF,51.639013446534700,-0.729340324241995
cycling lizard and soft-shelled turtle,HP13 6YA,51.634760766438900,-0.735210101067774
Old World quail and Ice seal,HP13 7AN,51.623959675037300,-0.727536118132084
giant tortoise and sidewinder,HP13 7BF,51.624806000000000,-0.729217000000000
American sparrow and Grosbeak,HP13 7DB,51.644584863609600,-0.730456545716696
gopher snake and gavial,HP13 7ES,51.625245621965600,-0.714339290506142
Gull and Boto,HP13 7FZ,51.626734000000000,-0.731976233784164
box turtle and Greenbul,HP13 7HA,51.628003636073200,-0.713293355541817
Polecat and Parrotlet,HP13 7LR,51.636504000000000,-0.723315801336244
cobra de capello and Grosbeak,HP13 7NN,51.624873408497500,-0.722252040374991
Marsh harrier and Hawk,HP13 7PJ,51.640609846407000,-0.725639484794484
taipan and Chicken,HP13 7PT,51.642397851551100,-0.723031352938903
hawksbill and amphisbaena,HP13 7SE,51.617207015433500,-0.712703140185937
boomslang and elapid,HP13 7SR,51.642015773496400,-0.727594442822338
Puffleg and cayman,HP13 7TU,51.625505366873900,-0.720832961216996
Meadowlark and thorn lizard,HP13 7XW,51.629746960217200,-0.718127476801407
agamid and Ground sloth,HP13 7YB,51.629732972119700,-0.712738752604639
boa constrictor and caiman,HP15 6AZ,51.675977000000000,-0.719608000000000
Solitaire and tree snake,HP15 6BH,51.663781941218500,-0.717413116305168
water snake and Shearwater,HP15 6BJ,51.664494281443700,-0.718419599696413
Hawk and Francolin,HP15 6BY,51.662563217057200,-0.720266926950167
Badger and tuatara,HP15 6EZ,51.673753000000000,-0.731304000000000
coral snake and goanna,HP15 6LY,51.672822247128800,-0.735162670679034
gavial and Diving bird,HP15 6NX,51.668814000000000,-0.719446979902731
Chipmunk and blue racer,HP15 6PA,51.662622002741000,-0.714944543865778
Quetzal and tiger snake,HP15 6TB,51.667063437421300,-0.692897640679052
Quetzal and Polecat,HP15 6TF,51.665887426774700,-0.690646869094910
Darwin's finches and Tahr,HP15 6TH,51.667183355289600,-0.689134593712495
swift and dukite,HP15 6TP,51.664867779097900,-0.689519519834785
death adder and diamondback,HP15 6UR,51.667937091969500,-0.699509739218274
Wallaby and elapid,HP15 6XA,51.667152715251500,-0.695266506816606
slowworm and indigo snake,HP15 6XB,51.668173271516700,-0.694861223090562
Hawk and adder,HP15 7AE,51.657766878365800,-0.711698931644745
brown snake and Parakeet,HP15 7BB,51.652324524638800,-0.713125275200237
box turtle and Lemming,HP15 7EB,51.648062000000000,-0.710133000000000
Warbler and mud turtle,HP15 7ET,51.659973031657300,-0.710349644211497
Armadillo and cerastes,HP15 7FP,51.644782839898200,-0.724886582602374
Partridge and Hawk,HP15 7JH,51.657275523820600,-0.697313877504205
habu and Crow,HP15 7JY,51.660156896097300,-0.704995066646082
frilled lizard and anole,HP15 7PB,51.647471972088500,-0.698707794799116
Gull and sidewinder,HP15 7PG,51.645137705326500,-0.699844135975455
bearded lizard and Hawk,HP15 7RA,51.651335846058300,-0.718805000000000
bearded lizard and Old World vulture,HP15 7TH,51.646504939509400,-0.705586384994371
Bunting and Vole,HP15 7UD,51.648560126591300,-0.709314814820642
Parakeet and Komodo dragon,HP15 7UF,51.649990000000000,-0.713336000000000
green turtle and amethystine python,HP15 7UJ,51.649768967598200,-0.712951908521505
Mamo and Dolphin,HP15 9AS,51.627760870946400,-0.748002964226947
Mink and Elephant,HP16 0AT,51.703025749425600,-0.707114536195378
elapid and Argus,HP16 0AZ,51.702129000000000,-0.703942000000000
Mamo and moloch,HP16 0DE,51.694787454965500,-0.699608485267908
flying lizard and Triller,HP16 0DL,51.685693204392000,-0.695225489798507
Marsh harrier and brown snake,HP16 0EZ,51.688689554810700,-0.701909828680991
chameleon and Shearwater,HP16 0JL,51.679238231749100,-0.749057179839079
horned viper and cerastes,HP16 0LS,51.695756532044500,-0.737344950849358
Chickadee and cerastes,HP16 0LU,51.696118134240100,-0.738362198056522
Armadillo and Puffleg,HP16 0NA,51.696103121476400,-0.739476739308309
sidewinder and python,HP16 0PL,51.698984841190400,-0.744084977269555
chuckwalla and Nukupuʻu,HP16 0PX,51.699382192244400,-0.730023424297275
Peafowl and adder,HP16 0QE,51.695435248490200,-0.728397619950894
anole and Hawaiian honeycreeper,HP16 0QZ,51.708296789799000,-0.686209878700801
bearded dragon and rock snake,HP16 0RE,51.687888626517500,-0.688088219975660
anaconda and Mockingbird,HP16 0SN,51.693076052342000,-0.733079079391191
Boto and boomslang,HP16 0ZN,51.703951000000000,-0.707739000000000
Tit-tyrant and Armadillo,HP16 6AF,51.703951000000000,-0.707739000000000
Snipe and Eagle,HP16 6BW,51.703956000000000,-0.707717000000000
Egret and viper,HP16 9BA,51.704152564244300,-0.711467359884257
constrictor and soft-shelled turtle,HP16 9BT,51.700397020276800,-0.734075703337382
krait and Grosbeak,HP16 9EJ,51.699487157717800,-0.734591000000000
bandy-bandy and Jay,HP16 9HS,51.701105036502600,-0.726371979934124
Goose and snapping turtle,HP16 9JN,51.729730826812900,-0.687630283163815
Macaw and Old World quail,HP16 9NB,51.731348963325300,-0.687597903281924
Chicken and frilled lizard,HP16 9NR,51.741356794034400,-0.701371615994986
diamond snake and Buzzard,HP16 9SD,51.703951000000000,-0.707739000000000
Kite and Goose,HP2 4BE,51.750719000000000,-0.461520000000000
Chicken and Capuchin,HP2 4DT,51.754914625164600,-0.453119362752249
moloch and bearded lizard,HP2 4DZ,51.752949274697000,-0.454664000000000
Quetzal and Dorcopsis,HP2 4EU,51.756293568839600,-0.453362022198302
Chicken and tortoise,HP2 4GZ,51.758626000000000,-0.438031000000000
rattlesnake and River dolphin,HP2 4ND,51.748435018821300,-0.424947572504732
Myna and gecko,HP2 4NL,51.749677817692100,-0.423079018103938
iguana and goanna,HP2 4NR,51.751239301111800,-0.434281199327035
crocodile and Jay,HP2 4QL,51.755608737941000,-0.441678647112449
tiger snake and Partridge,HP2 4RT,51.751531756147000,-0.442079734393995
Stilt and Jerboa,HP2 5AA,51.760703267665600,-0.470135890676414
Armadillo and Komodo dragon,HP2 5FR,51.757185852440800,-0.465183592349954
sidewinder and Tahr,HP2 5GQ,51.761046929527700,-0.465458403063881
bull snake and Komodo dragon,HP2 5JS,51.758871000000000,-0.448275000000000
Philippine hawk-owl and Jay,HP2 5JT,51.757654470684500,-0.449504860784834
Night heron and horned toad,HP2 5LX,51.757796131803000,-0.455484077408271
fer-de-lance and Ground sloth,HP2 5QL,51.763397956688800,-0.456162385012244
asp and diamondback terrapin,HP2 5SE,51.764466891913700,-0.460994000000000
Grosbeak and Solitaire,HP2 5SW,51.760237829575600,-0.462718235933124
Black jay and Boto,HP2 5UB,51.753956717734000,-0.460975628832311
Marsh harrier and Mamo,HP2 5UG,51.754103821512200,-0.460535986181286
diamondback and blue tongue,HP2 5XY,51.759686260683500,-0.465707000000000
glass snake and python,HP2 5YJ,51.764884818483300,-0.469472851028754
Flameback and Jay,HP2 5YP,51.762960338648100,-0.468074348213371
death adder and Old World quail,HP2 6DN,51.770169408649800,-0.458264773409403
ringhals and lizard,HP2 6DS,51.769612420518300,-0.459675083140062
grass snake and ringhals,HP2 6PD,51.773247174807800,-0.466711478868160
Pratincole and gaboon viper,HP2 7AJ,51.760251554804500,-0.446662791052861
Rat and blue racer,HP2 7GE,51.762476476549200,-0.430038000000000
tree snake and anole,HP2 7JH,51.774471366333500,-0.442188595304763
White ibis and Elephant,HP2 7QA,51.771062525146300,-0.442117543928070
water snake and rock snake,HP2 7TR,51.765364271235100,-0.441632593187412
skink and Duck,HP22 5FL,51.769163854175900,-0.722950407982944
Kite and hognose snake,HP22 5GU,51.768997000000000,-0.728361000000000
alligator and rattlesnake,HP22 6AE,51.772541987951400,-0.747160712307133
kabaragoya and Lemming,HP22 6AG,51.772950262617100,-0.749076000000000
River dolphin and rattlesnake,HP22 6AS,51.771970518176000,-0.748379484991570
Perching duck and Myna,HP22 6DF,51.766523194660600,-0.745994091370225
Fulmarine petrel and anole,HP22 6EB,51.762844161945400,-0.742487886690795
Eagle and racer,HP22 6HD,51.765716266190400,-0.742842834340678
Warbler and alligator,HP22 6HQ,51.765751568103500,-0.739421883107834
Civet and Duck,HP22 6NU,51.764620472333200,-0.737917333496422
ringhals and Fulmarine petrel,HP23 6HX,51.771601635981700,-0.636776475193706
amethystine python and racer,HP23 6JA,51.768700000000000,-0.616140000000000
indigo snake and Thrasher,HP23 6JE,51.762622151118000,-0.630859460564851
king snake and Tree warbler,HP23 6JQ,51.765718776011700,-0.638127487345732
Perching duck and Boto,HP23 6NG,51.753977504598200,-0.658618641756941
garter snake and Kite,HP23 6NJ,51.754166466397100,-0.668913866061897
Parrotbill and frilled lizard,HP23 6PE,51.770154848656500,-0.654805798400964
Petrel and tuatara,HP3 0BD,51.736517101253700,-0.492546039970793
Schneider python and Night heron,HP3 0BS,51.739070457274500,-0.502367587801369
Duck and Marsh harrier,HP3 0DT,51.735524781742400,-0.521311460455743
Stint and gopher snake,HP3 0FJ,51.732060000000000,-0.472660000000000
snapping turtle and asp,HP3 0HP,51.722025861815700,-0.530452959271196
Badger and Grackle,HP3 0JD,51.719246776116100,-0.534003007566346
Magpie and Night heron,HP3 0PA,51.720669425042100,-0.509142929766343
hoop snake and Grouse,HP3 0QL,51.719835810951100,-0.537255761090467
bull snake and blindworm,HP3 8BT,51.735378893492700,-0.444532399228105
cerastes and grass snake,HP3 8BY,51.737854811788200,-0.441377012709178
Treepie and Viscacha,HP3 8DA,51.734894354080300,-0.447329569259849
Chicken and Mink,HP3 8DX,51.745083234138200,-0.450282000000000
Prion and Parrotlet,HP3 8JQ,51.738690264089800,-0.447431198595846
Diving bird and viper,HP3 8QY,51.745480115924000,-0.436653115109601
B and turtle,HP3 8RS,51.728670748463600,-0.449960968348341
cycling lizard and loggerhead,HP3 8TL,51.742474992964200,-0.435163557473828
Marmoset and Booted eagles,HP3 8TY,51.743323312336400,-0.437422825476452
Egret and Siskin,HP3 9BH,51.741115033269200,-0.487888545651146
terrapin and Towhee,HP3 9DE,51.738018000000000,-0.464798000000000
Philippine hawk-owl and blue racer,HP3 9DJ,51.738832000000000,-0.472584000000000
mamba and Vulture,HP3 9DQ,51.731052800991900,-0.456048269179701
Grouse and Cuscus,HP3 9GR,51.729655220403300,-0.451505726621124
Chicken and diamond python,HP3 9HD,51.739960000000000,-0.478440000000000
ringhals and Kangaroo,HP3 9HP,51.737418010827300,-0.470256232572260
galliwasp and Mockingbird,HP3 9HS,51.742000269026100,-0.468754368923788
Old World quail and Macaw,HP3 9JP,51.745526582426100,-0.456496443347285
Bunting and Old World quail,HP3 9JT,51.743042289787500,-0.465228371098218
caiman and Marmoset,HP3 9LF,51.742454877879000,-0.468449313643413
Recurvebill and soft-shelled turtle,HP3 9PF,51.742464325845000,-0.462973912963015
Pratincole and Pitohui,HP3 9PU,51.735889412526500,-0.460083300855429
Gila monster and green turtle,HP3 9RG,51.738358037379000,-0.470094058131260
rock snake and blind snake,HP3 9SH,51.736685789621800,-0.468731246294102
bearded dragon and B,HP3 9ST,51.733946668216200,-0.464855857966649
Tahr and Hawk,HP3 9UR,51.739778141413600,-0.450145779658425
rock python and slowworm,HP3 9WQ,51.733493258863000,-0.460439888168040
Cloud rat and Elephant,HP3 9WX,51.733297063527100,-0.458506044441587
massasauga and crocodile,HP4 1DN,51.765388207472700,-0.577563102255159
loggerhead and grass snake,HP4 1DZ,51.768595597521500,-0.574375378046797
Nukupuʻu and gavial,HP4 1HJ,51.765846700413000,-0.563506266127509
loggerhead and Fish eagle,HP4 1JR,51.767912809277200,-0.575164980424115
tiger snake and sidewinder,HP4 1SA,51.771201298040000,-0.580163101589289
tuatara and Mouse,HP4 1SB,51.771990801089500,-0.580761554008618
Kangaroo and Towhee,HP4 2AF,51.761079467839200,-0.564845748772913
blind snake and hawksbill,HP4 2AZ,51.760604000000000,-0.562600000000000
water snake and bushmaster,HP4 2DZ,51.760323566526600,-0.557450878666651
blindworm and Flameback,HP4 2JF,51.759211302114600,-0.561226000000000
Vulture and Elephant,HP4 2JP,51.754888107242900,-0.557088002666565
Coati and Asiatic leopard,HP4 2NL,51.752601191924600,-0.547352874001959
Prion and Ibex,HP4 2NZ,51.757365650451900,-0.553821465435116
whip snake and Boto,HP4 2RT,51.760976998932800,-0.527478915397823
soft-shelled turtle and Old World vulture,HP4 2SX,51.736733645898600,-0.566630847351697
giant tortoise and moloch,HP4 2WF,51.759166853360600,-0.556980604683401
diamond snake and Scimitar babbler,HP4 3AT,51.760003955495900,-0.562923722768496
Francolin and Ground sloth,HP4 3AZ,51.758515133108100,-0.563970748744029
skink and Condor,HP4 3BD,51.759587000000000,-0.566226000000000
Bunting and Rat,HP4 3BH,51.757242628841300,-0.570965792672942
Siskin and Marsh harrier,HP4 3BW,51.754507527579400,-0.572312578748060
tree snake and rat snake,HP4 3BX,51.753766753705900,-0.573509448009863
Black jay and copperhead,HP4 3JD,51.759236888401600,-0.577481093554274
Greenbul and Stilt,HP4 3LN,51.756424032938800,-0.575381690990090
B and kabaragoya,HP4 3ND,51.754600086245700,-0.580698245441266
cerastes and Solitaire,HP4 3NJ,51.755888844987700,-0.584671148839279
black snake and Black jay,HP4 3QA,51.766645763188300,-0.582668205619971
blue racer and Meadowlark,HP4 3QX,51.768703581431200,-0.587792093890231
Hawk and bull snake,HP4 3RE,51.766889185935500,-0.590949993683287
diamondback terrapin and saltwater crocodile,HP4 3RU,51.771224000000000,-0.594641000000000
Egret and carpet snake,HP4 3SG,51.773071086740900,-0.598859606464792
box turtle and Magpie,HP5 1DA,51.705100845553500,-0.611582831162739
chuckwalla and cobra,HP5 1FL,51.716203869907800,-0.608694000000000
smooth snake and Siskin,HP5 1HG,51.703714186267700,-0.612942203351071
Egret and Mole,HP5 1JD,51.703086772317000,-0.616926589201124
Vole and Philippine hawk-owl,HP5 1ND,51.701406465035400,-0.612448395989972
Rat and Grosbeak,HP5 1NL,51.700793487246500,-0.610309000000000
habu and brown snake,HP5 1PE,51.701186585587500,-0.609821411189353
rock snake and Masked owl,HP5 1PN,51.699446905536000,-0.607183228751606
Parrotlet and Stilt,HP5 1PW,51.699991841374200,-0.606124618229809
giant tortoise and Stint,HP5 1QH,51.692042983975000,-0.588790123191886
blue racer and agama,HP5 1QQ,51.693887731741000,-0.595663227180680
cerastes and Bronzewing pigeon,HP5 1RT,51.700435126072200,-0.597283866061027
leguaan and Parrotbill,HP5 1RW,51.699738847371200,-0.598463034026221
rock python and Stint,HP5 1UA,51.680478440781300,-0.553220099660561
wall lizard and Lemming,HP5 1UN,51.702761000000000,-0.566417000000000
sand viper and alligator,HP5 1WR,51.716203869907800,-0.608694000000000
New World blackbird and Egret,HP5 1XY,51.710081229661400,-0.574695855250785
Ground sloth and bicycle lizard,HP5 2BU,51.717512170111700,-0.610290787040270
Civet and frill-necked lizard,HP5 2DQ,51.719854587075900,-0.613722390568672
Gila monster and Shearwater,HP5 2EW,51.720288514385000,-0.618501017404856
crocodile and Ice seal,HP5 2GL,51.711390052358600,-0.618786593132181
diamondback and Prion,HP5 2JB,51.706467744940700,-0.613118504259569
Eagle and diamondback terrapin,HP5 2LX,51.725959121708900,-0.619761587624425
Magpie and Tree warbler,HP5 2NH,51.711445213499100,-0.620420497391989
Solitaire and Vole,HP5 2PG,51.714958734010100,-0.616405261559933
Mole and cayman,HP5 2QJ,51.721538862023900,-0.631608405100184
Logrunners and Marsh harrier,HP5 2SG,51.716992710803200,-0.633468255526797
blind snake and Warbler,HP5 2TN,51.725396157584000,-0.654832000000000
flying dragon and Duck,HP5 2UN,51.748741678531500,-0.652095648340091
Cuscus and tuatara,HP5 2UW,51.746063052552900,-0.652957567785040
Grackle and terrapin,HP5 2XA,51.729910933211800,-0.639421025878219
Solitaire and rock python,HP5 2XH,51.725240080491000,-0.622085581517191
flying lizard and Solitaire,HP5 2XN,51.728954536608500,-0.624463172108197
Jerboa and Parrotlet,HP5 2XU,51.740378000000000,-0.640135000000000
Diving bird and dukite,HP5 2XW,51.735166678102100,-0.631298244681298
Mouse and Tit-tyrant,HP5 3EP,51.711944015112000,-0.608448000000000
pit viper and Buzzard,HP5 3ET,51.712183277170400,-0.608282936506511
Recurvebill and Prion,HP5 3LG,51.722136916107500,-0.582684915196768
Booted eagles and Civet,HP5 3LW,51.710263653980600,-0.596574611664688
carpet snake and Minke whale,HP5 3PS,51.739263284679700,-0.590880000000000
tokay and garter snake,HP5 3PT,51.745959000000000,-0.596309000000000
Komodo dragon and mamba,HP5 3QQ,51.727368350964600,-0.572139630558912
frill-necked lizard and B,HP5 3RP,51.732547620055900,-0.560348174609066
Buzzard and massasauga,HP5 9BE,51.716206104528100,-0.608694000000000
Chipmunk and horned viper,HP5 9DG,51.716232000000000,-0.608671000000000
Marmoset and milk snake,HP6 5LN,51.685052280623500,-0.601231087167825
Stint and Meadowlark,HP6 5ND,51.682673119468700,-0.603806850705988
galliwasp and alligator,HP6 5NX,51.685895324170300,-0.620054380698419
goanna and Nukupuʻu,HP6 5PX,51.680460111029700,-0.619698880937171
gecko and Lemming,HP6 5QU,51.682002257296400,-0.623919107853141
Myna and tuatara,HP6 5RG,51.689642390135100,-0.622906233589203
jew lizard and gaboon viper,HP6 5RP,51.694604570595100,-0.654615932681922
Egret and Petrel,HP6 5RZ,51.690597056494300,-0.655646191696066
skink and Dolphin,HP6 5XU,51.675530248182400,-0.607309542569737
grass snake and gavial,HP6 6AR,51.677086523814900,-0.597542495296226
diamondback terrapin and Mockingbird,HP6 6BT,51.684055590188800,-0.601348593243018
Tit-tyrant and snapping turtle,HP6 6BX,51.683993393599300,-0.600656167337515
viper and tokay,HP6 6DJ,51.687250264829700,-0.596288136879853
hoop snake and Stilt,HP6 6DR,51.686985764989700,-0.592969038618129
amphisbaena and rattlesnake,HP6 6EL,51.680393362428800,-0.591350860605634
Puffleg and Old World quail,HP6 6EQ,51.679962118748700,-0.598900083481646
Logrunners and Masked owl,HP6 6FR,51.672768469742900,-0.579237019392748
brown snake and frilled lizard,HP6 6LJ,51.679733242922800,-0.591790802316979
Stint and Night heron,HP6 6LQ,51.679055092119200,-0.590727044065888
glass snake and hognose snake,HP6 6NP,51.674418166532000,-0.594717964028662
diamondback turtle and Maya,HP6 6NZ,51.680001045047700,-0.593879805099021
Rat and fer-de-lance,HP6 6PX,51.668635760281500,-0.559772077369558
goanna and bearded lizard,HP6 6SR,51.668262797594400,-0.549921830620113
loggerhead and Hawaiian honeycreeper,HP6 9NG,51.675536000000000,-0.607287000000000
dugite and green turtle,HP6 9SQ,51.675422700684700,-0.603364610453156
Ice seal and Ibex,HP6 9SX,51.675422700684700,-0.603364610453156
Skunk and amethystine python,HP6 9SZ,51.675422700684700,-0.603364610453156
racer and Pheasant,HP6 9TZ,51.675422700684700,-0.603364610453156
Stint and Old World vulture,HP7 0AP,51.663943657064400,-0.620158000000000
Black cockatoo and blue tongue,HP7 0BB,51.668164592107100,-0.606436418952897
dukite and Masked owl,HP7 0DQ,51.666222240988400,-0.616198000000000
snake and Wader,HP7 0EL,51.669330868892300,-0.619298000000000
Triller and Towhee,HP7 0EP,51.667857400039600,-0.618491279983185
rat snake and Chipmunk,HP7 0ER,51.668274422477200,-0.618015861556251
pit viper and Partridge,HP7 0LS,51.641173888417400,-0.631138298868150
Kākāriki and perentie,HP7 0NQ,51.647876827834100,-0.654048233393566
rattlesnake and Elephant,HP7 0PD,51.639416492018900,-0.640859078028808
copperhead and Thrasher,HP7 0PG,51.643893300038100,-0.650899887505941
Thrasher and Macaw,HP7 0QR,51.664362250082400,-0.655135877195059
Jay and Hawaiian honeycreeper,HP7 0QT,51.663523408438600,-0.677875568009514
Petrel and Darwin's finches,HP7 0RH,51.680485860307300,-0.654470266722704
Partridge and Partridge,HP7 9BY,51.665378526947600,-0.601258627158772
horned toad and Solitaire,HP7 9HX,51.672478101149200,-0.590396073820706
chameleon and Old World quail,HP7 9JY,51.670589880017600,-0.582182867933518
Vole and Civet,HP7 9LS,51.670976267738700,-0.584397851539928
smooth snake and leathery turtle,HP7 9NQ,51.669446776755600,-0.573918019226074
black snake and glass snake,HP7 9PR,51.667895441990400,-0.560995765934029
Grackle and Komodo dragon,HP7 9PS,51.667289582293200,-0.562186237411723
leathery turtle and dugite,HP7 9QL,51.663248265927600,-0.569962917200234
green turtle and puff adder,HP8 4AE,51.650032252009800,-0.543059400388143
Kestrel and Viscacha,HP8 4DR,51.627289847219500,-0.579603280264795
adder and Mamo,HP8 4DS,51.625950534470100,-0.578157059154590
Macaw and tuatara,HP8 4EH,51.633851322528200,-0.584600171145488
Tahr and Flameback,HP8 4EY,51.632722296931900,-0.578971236375745
Armadillo and Dolphin,HP8 4HS,51.632804030541000,-0.562048654361618
dugite and Old World quail,HP8 4HU,51.631996735748500,-0.564414913220705
dugite and boa,HP8 4HX,51.631404162927400,-0.563017638630461
iguana and smooth snake,HP8 4JY,51.629200566906300,-0.580165000000000
copperhead and Civet,HP8 4PE,51.630318274806300,-0.582427279072385
Piping shrike and Wallaby,HP8 4PF,51.629841087984800,-0.583121220254052
sidewinder and adder,HP8 4PX,51.632001592991200,-0.572188300769918
bicycle lizard and Egret,HP8 4QB,51.633053332248100,-0.569207623583183
Tahr and copperhead,HP8 4QT,51.627150863560200,-0.571112543948081
tokay and cobra,HP8 4RF,51.620133000000000,-0.565468000000000
Marsh harrier and fer-de-lance,HP8 4RS,51.649756863371000,-0.578554316765032
hognose snake and Civet,HP8 4SJ,51.651382764889100,-0.557037600862861
Myna and wall lizard,HP8 4SU,51.634219527933400,-0.564561486234106
New World blackbird and Bunting,HP9 1GN,51.600125584948000,-0.671010780599024
Schneider python and pit viper,HP9 1HN,51.609946097817100,-0.657697529552424
goanna and diamondback,HP9 1HW,51.608828584024400,-0.656690699389524
wall lizard and asp,HP9 1NN,51.610785440132700,-0.646220186653681
