name,postcode,lat,lon
Chipmunk and dukite,HP9 1PJ,51.607792502075600,-0.652591106704659
Moluccan boobook and Ground sloth,HP9 1QQ,51.609915850395900,-0.644888519038283
Elephant and brown snake,HP9 1RP,51.603881052194100,-0.646338875231961
Pheasant and Old World vulture,HP9 1SW,51.600276966361200,-0.665331934125456
diamond python and Warbler,HP9 1TB,51.618646809047200,-0.655043064851961
soft-shelled turtle and monitor,HP9 1TU,51.601423013485200,-0.656230570233041
soft-shelled turtle and mud turtle,HP9 1UN,51.605228948203800,-0.641591239707680
Minke whale and horned viper,HP9 1UP,51.606526000000000,-0.642477000000000
racer and Vole,HP9 2AQ,51.622015415009900,-0.646926134121963
Marsh harrier and blue tongue,HP9 2AT,51.623567764134400,-0.649769197006854
brown snake and tortoise,HP9 2EP,51.610266446300500,-0.634017729218517
bearded dragon and deaf adder,HP9 2JB,51.601712407161100,-0.630521000000000
rat snake and Flameback,HP9 2JT,51.597963596884900,-0.630762882563101
Crow and anaconda,HP9 2RH,51.623845000000000,-0.609547784248525
tokay and horned toad,HP9 2SA,51.594480456590400,-0.617441231580591
rattlesnake and Snipe,HP9 2SP,51.614577333346500,-0.587972876398785
skink and frill-necked lizard,HP9 2ST,51.613051000000000,-0.595574000000000
Peafowl and gaboon viper,HP9 2TR,51.625362982955100,-0.654194399063747
anole and Black cockatoo,HP9 2UA,51.621691961364400,-0.653205131491879
gecko and dukite,HP9 2XF,51.616365643359400,-0.610493275333679
chuckwalla and cobra de capello,HP9 2XW,51.619421267272300,-0.610356624908947
deaf adder and Quetzal,HP9 2XY,51.618854919752700,-0.606574959314313
Eagle and monitor,HP9 2YQ,51.619350535043900,-0.604393047559212
rattlesnake and Perching duck,SL0 0PD,51.551406490813200,-0.515648818451600
Songlark and cycling lizard,SL1 8PJ,51.573354162171000,-0.642498231777062
horned toad and Wader,SL2 3FY,51.564528000000000,-0.614768000000000
Mouse and Puffleg,SL2 3HA,51.558780623108000,-0.613474960603676
Asiatic leopard and grass snake,SL2 3HJ,51.561285847578000,-0.606344233021863
flying dragon and monitor,SL2 3JA,51.561903160043700,-0.614274000000000
Jerboa and gavial,SL2 3LN,51.566828224332500,-0.616505400123287
bandy-bandy and agamid,SL2 3LQ,51.575392000000000,-0.621239000000000
amphisbaena and pit viper,SL2 3NB,51.552898701256400,-0.616423157101300
rock python and grass snake,SL2 3NG,51.553267835477400,-0.614176250299922
Jackal and blue racer,SL2 3PX,51.556853899457000,-0.615553053100113
krait and Rat,SL2 3QB,51.558500925257300,-0.617205265453959
frill-necked lizard and horned viper,SL2 3RF,51.566391000000000,-0.604618649140272
dugite and Partridge,SL2 3UE,51.561851365856200,-0.607019425965992
Linsang and gopher snake,SL2 3UY,51.576378316245600,-0.602895430767578
lizard and lizard,SL2 3XL,51.572299481667000,-0.605459134164613
bushmaster and Old World vulture,SL2 3YQ,51.572082406213300,-0.600819349010775
sand viper and blindworm,SL2 4AH,51.553801261629700,-0.592509451272571
asp and anaconda,SL2 4ET,51.553009285422300,-0.584975779603180
ringhals and Black jay,SL2 4EX,51.560393941444100,-0.584414806453031
Coati and Snipe,SL6 0GB,51.551410000000000,-0.685498000000000
Thrasher and Peafowl,SL6 9BD,51.563949330821900,-0.748544087710058
tokay and krait,SL6 9GT,51.552587995364700,-0.732196647571611
Coati and Macaw,SL6 9HY,51.556956124512800,-0.723723171317330
monitor and cobra de capello,SL6 9HZ,51.557401083783800,-0.724836000000000
Bronzewing pigeon and asp,SL6 9LQ,51.554845009509900,-0.731369420153402
Myna and Mamo,SL6 9NH,51.553159236765600,-0.725992983986738
Greenbul and horned viper,SL6 9NX,51.559696742198900,-0.741029560013243
Night heron and Ice seal,SL6 9PH,51.557110137326100,-0.748039381479396
Dolphin and anaconda,SL6 9PY,51.559421121299000,-0.742694000000000
elapid and crocodile,SL6 9RL,51.559314350911200,-0.722286726644253
loggerhead and Buzzard,SL6 9SP,51.560534110149900,-0.707220558243210
Recurvebill and Badger,SL8 5AH,51.576676796952500,-0.707426495595075
cobra and bushmaster,SL8 5BD,51.567447000000000,-0.696083000000000
krait and Fox,SL8 5DH,51.573331133961000,-0.709815778334212
Francolin and python,SL8 5DZ,51.565094681617600,-0.706557418619083
Grackle and American sparrow,SL8 5GA,51.571072703840300,-0.710500172677990
massasauga and perentie,SL8 5GQ,51.575210114066200,-0.708968893219403
Marmoset and amphisbaena,SL8 5JU,51.580588287106100,-0.712612000000000
rattlesnake and leguaan,SL8 5NJ,51.586747403886800,-0.705769497089005
Gull and Armadillo,SL8 5PW,51.585448199546300,-0.725090209359777
Guillemot and agamid,SL8 5TB,51.577786909296400,-0.714351019533423
dugite and rat snake,SL8 5TJ,51.583414996582600,-0.713456105370804
Shearwater and bearded lizard,SL8 5TX,51.586055818370900,-0.711562819267911
Jay and green turtle,SL8 5UN,51.577294089045000,-0.700626221547050
flying dragon and puff adder,SL8 5XF,51.577045759525700,-0.705005997545779
slowworm and dugite,SL9 0AG,51.608983415876500,-0.548085289772737
tree snake and mamba,SL9 0DY,51.610611471289500,-0.552495989356219
Siskin and Civet,SL9 0ED,51.620223000000000,-0.546470000000000
Maya and ringhals,SL9 0FH,51.621970000000000,-0.546437000000000
chameleon and Nukupuʻu,SL9 0GA,51.596891079285100,-0.547255000000000
leguaan and Schneider python,SL9 0JB,51.616861713162100,-0.553293811939791
Mamo and harlequin snake,SL9 0NA,51.618662433429200,-0.548383120448441
terrapin and Chickadee,SL9 0NL,51.588967732051500,-0.545215638170658
Duck and viper,SL9 0NN,51.620282474089400,-0.557258601326973
Diving bird and Night heron,SL9 0NT,51.614493508150500,-0.556676645674345
Minke whale and Kestrel,SL9 0NU,51.615013594792200,-0.556559044475631
diamond snake and perentie,SL9 0PB,51.622177017549500,-0.558498646278096
New World blackbird and diamond python,SL9 0QP,51.612692205578800,-0.541886521896420
Linsang and Francolin,SL9 1AG,51.587108600000000,-0.554022499999974
Skunk and thorn lizard,SL9 1EF,51.587109468800000,-0.554022529100000
asp and racer,SL9 7AA,51.585685706843100,-0.553952159392432
bicycle lizard and blindworm,SL9 7AF,51.580746428175100,-0.552275977530658
constrictor and Zebra,SL9 7JH,51.573668645896200,-0.554376794512938
Herring gull and king cobra,SL9 7LP,51.574063302384400,-0.565288229720878
Cuscus and Rat,SL9 7QZ,51.590867735535600,-0.562954439764778
puff adder and leguaan,SL9 7RT,51.583206235426100,-0.559991894231079
cerastes and Crow,SL9 7WQ,51.587107306499300,-0.554022507297402
Mink and Kangaroo,SL9 8AF,51.586121000000000,-0.549803993080306
Logrunners and Kestrel,SL9 8BD,51.580287276133000,-0.549317457349662
leathery turtle and Viscacha,SL9 8BE,51.579916857834900,-0.548448871498272
Jackal and cobra,SL9 8BY,51.588919754928300,-0.549636000000000
dugite and Pratincole,SL9 8BZ,51.587695077161700,-0.548460839194370
Tahr and cobra de capello,SL9 8DD,51.585868997083800,-0.546424000000000
bicycle lizard and taipan,SL9 8DH,51.585163000000000,-0.542104000000000
brown snake and sand lizard,SL9 8EB,51.588406000000000,-0.552798000000000
sidewinder and Perching duck,SL9 8HB,51.588636071162100,-0.547478126539610
Logrunners and Diving bird,SL9 8HZ,51.589694112937400,-0.550143833573951
blue racer and Chicken,SL9 8JR,51.594488888206200,-0.551766941373748
Ice seal and iguana,SL9 8NJ,51.596227262575200,-0.557847642419385
Fulmarine petrel and bushmaster,SL9 8QW,51.595914822116700,-0.561697916414257
Lemming and ringhals,SL9 8RR,51.597338622920600,-0.567096052955684
Night heron and iguana,SL9 8RW,51.595799651209000,-0.566985668622185
bull snake and boa constrictor,SL9 8SB,51.599916017077300,-0.564618102146816
anole and Kestrel,SL9 8SX,51.584619635756300,-0.589753242282765
Komodo dragon and Vole,SL9 9AQ,51.605087985071500,-0.555949614270734
Fox and Guillemot,SL9 9ET,51.605946594405700,-0.565106658856902
mud turtle and rock python,SL9 9FB,51.605035000000000,-0.558617000000000
Viscacha and Asiatic leopard,SL9 9FE,51.600989000000000,-0.566259000000000
rattlesnake and Mouse,SL9 9FF,51.605184000000000,-0.559017000000000
diamondback terrapin and king snake,SL9 9FH,51.605180000000000,-0.559464000000000
Flameback and king snake,SL9 9HW,51.604305940152300,-0.566977835055940
python and Flameback,SL9 9JD,51.605544917032400,-0.569032712152072
Komodo dragon and saltwater crocodile,SL9 9JS,51.605773338687500,-0.568592312617580
Diving bird and Armadillo,SL9 9LH,51.606692679631400,-0.572462450555223
wall lizard and Kite,SL9 9NA,51.606990140141400,-0.565145967777121
Old World warbler and puff adder,SL9 9NU,51.609344914930000,-0.563584231282888
Schneider python and Crow,SL9 9PJ,51.610064853985700,-0.562897177668528
blue racer and Peafowl,SL9 9SG,51.609033839452700,-0.559478171408725
Elephant and diamondback terrapin,SL9 9TD,51.604538677419400,-0.547866052720913
Chicken and Meadowlark,SL9 9TS,51.608133944703200,-0.550654074938198
Towhee and River dolphin,UB10 8AQ,51.567963613467800,-0.468966537721684
fer-de-lance and Stilt,UB10 8GA,51.565058000000000,-0.445338000000000
chuckwalla and gaboon viper,UB10 8HD,51.565761280182300,-0.460773209174362
monitor and leguaan,UB10 8HP,51.568807927991200,-0.457221775004635
Kestrel and iguana,UB10 8LZ,51.562745815671300,-0.449607413634778
Dolphin and grass snake,UB10 8NB,51.562450839845300,-0.447020571704904
Parrotlet and mamba,UB10 8PR,51.559995966108600,-0.440915306420699
glass snake and River dolphin,UB10 8QY,51.559961766185500,-0.444436492171230
worm lizard and bicycle lizard,UB10 8SS,51.555073862951200,-0.452205075685013
milk snake and Skunk,UB10 8TD,51.558438536364600,-0.446883144892761
hognose snake and Lemming,UB10 8TT,51.564667233657500,-0.439889878484679
Rat and Stilt,UB10 8XA,51.566083142017700,-0.436147788155891
cobra and bearded lizard,UB10 8XB,51.564372784823800,-0.442092965394754
sand viper and milk snake,UB10 9NA,51.552410533002200,-0.451965000000000
Condor and Schneider python,UB5 4AL,51.551334249745200,-0.369944303595707
boa and blindworm,UB5 4AS,51.551783121667800,-0.373779419341482
water snake and sand viper,UB5 4DT,51.554412522837100,-0.376642702688035
garter snake and Jackal,UB5 4ED,51.552000000000000,-0.362737000000000
Gull and snapping turtle,UB5 4EQ,51.552217728384600,-0.367518347193218
Komodo dragon and Hawk,UB5 4JA,51.553115588929000,-0.379746808267215
Armadillo and Coati,UB5 4JE,51.552033072864600,-0.379496790959082
Lemming and American sparrow,UB5 4JJ,51.552830242498600,-0.357284110882435
agamid and Kangaroo,UB5 4LJ,51.552721079175400,-0.355268663354655
cobra and Cloud rat,UB5 4LY,51.550163347055900,-0.362702378787193
blind snake and brown snake,UB5 4PG,51.554368248690800,-0.355382348894247
hawksbill and rat snake,UB5 4QF,51.554087965636800,-0.352709486037368
adder and Capuchin,UB5 4SL,51.550496906610600,-0.351843979790409
Masked owl and anaconda,UB6 0DY,51.552505292508700,-0.344400686664502
adder and mud turtle,UB6 0ER,51.550469502578000,-0.342238956212686
bearded lizard and sand viper,UB6 0JJ,51.551490099180100,-0.338105503852894
Asiatic leopard and Stint,UB8 9TX,51.573663338323800,-0.527189923564305
Parrotbill and Parakeet,UB8 9UA,51.573663338323800,-0.527189923564305
Stilt and goanna,UB9 4AT,51.556747897580400,-0.485398427749581
Dolphin and rattlesnake,UB9 4BD,51.552001061719200,-0.491758270228779
Meadowlark and sea snake,UB9 4EQ,51.553745517355000,-0.493157426519892
Skunk and Fish eagle,UB9 4HA,51.560809324341000,-0.500570011640049
python and Grosbeak,UB9 5BG,51.570698000000000,-0.494660000000000
agama and Old World quail,UB9 5BL,51.573058000000000,-0.500521948088840
anole and B,UB9 5DD,51.581375827149400,-0.509880847910986
Jay and amphisbaena,UB9 5DH,51.593708000000000,-0.507297000000000
Coati and River dolphin,UB9 5DQ,51.592918908539000,-0.512505995409420
blindworm and frilled lizard,UB9 5EA,51.578795519014000,-0.516300953170674
gecko and hawksbill,UB9 5FH,51.586801000000000,-0.499189000000000
thorn lizard and milk snake,UB9 5GF,51.585286000000000,-0.502669301122705
frill-necked lizard and Masked owl,UB9 5JG,51.581221377598900,-0.505512721298732
habu and Tattler,UB9 5NA,51.580431614255900,-0.497182099666790
Polecat and asp,UB9 5NW,51.584913000000000,-0.500090809347405
Argus and Snipe,UB9 5PH,51.586002000000000,-0.503018000000000
cerastes and Vole,UB9 5PL,51.586875000000000,-0.503075000000000
Fish eagle and snapping turtle,UB9 6AJ,51.594824714784900,-0.484348836129374
thorn lizard and Ice seal,UB9 6AT,51.588379482334600,-0.479640905614816
Tahr and rock snake,UB9 6AU,51.587578021897300,-0.480245057425629
Darwin's finches and Magpie,UB9 6DS,51.597742554574800,-0.483298787552462
diamond snake and Philippine hawk-owl,UB9 6DW,51.595226614503900,-0.483440339652708
anole and mud turtle,UB9 6EG,51.605231509396300,-0.479020344776806
hognose snake and Parrotbill,UB9 6ES,51.606714555065500,-0.475504932810480
Recurvebill and blindworm,UB9 6HT,51.612071625451000,-0.496253026481655
Jackal and tokay,UB9 6JA,51.611058127179800,-0.497860737847857
Komodo dragon and habu,UB9 6JT,51.605957000000000,-0.480834609057324
Ibex and Night heron,UB9 6JU,51.606643363057800,-0.480417270797607
hawksbill and agama,UB9 6LL,51.609879232423500,-0.481710111056809
water snake and Old World vulture,UB9 6PH,51.615093614014500,-0.485811469693727
gecko and Ice seal,UB9 6PS,51.605769015201500,-0.471940849609493
Chickadee and Tree warbler,UB9 6RJ,51.610192423195900,-0.496965014497496
bearded lizard and Gull,WD17 1BD,51.658945000000000,-0.402028000000000
Boto and bushmaster,WD17 1EU,51.663770001706500,-0.396595188304695
Parakeet and Puffleg,WD17 1LN,51.658411753295600,-0.399964983980345
Wader and Skunk,WD17 1QF,51.660715490351200,-0.399435633514038
Parakeet and Diving bird,WD17 2AP,51.653383568751800,-0.391150478645939
Linsang and rock snake,WD17 2DH,51.655275565077900,-0.394842129868574
Pheasant and mud turtle,WD17 2EN,51.653589327993600,-0.393181423399068
fer-de-lance and boa,WD17 2JX,51.648151883444100,-0.384860050228547
Marmoset and asp,WD17 2PB,51.658296411818400,-0.393492046519278
Goose and jew lizard,WD17 2TF,51.655055794770300,-0.392812000000000
goanna and cycling lizard,WD17 2UE,51.654715556796900,-0.393343986069562
box turtle and Tattler,WD17 3BA,51.664018411148900,-0.421572246653226
grass snake and puff adder,WD17 3BE,51.664538000000000,-0.420687000000000
Crow and Ice seal,WD17 3BL,51.665589510155600,-0.418712432379174
Partridge and Grouse,WD17 3BN,51.666584258179000,-0.421136031270500
Cuscus and gavial,WD17 3EU,51.660216616836300,-0.403082216884503
elapid and Old World warbler,WD17 3EW,51.658945122042300,-0.404138956903771
Hawaiian honeycreeper and garter snake,WD17 3EY,51.660564993869200,-0.406221879278914
Petrel and Booted eagles,WD17 3HF,51.667316314853800,-0.412072813825486
cayman and Tree warbler,WD17 3HG,51.670547755087300,-0.415647492800639
Prion and cycling lizard,WD17 4DE,51.664152578054500,-0.408857750863340
Old World warbler and caiman,WD17 4DJ,51.666517694893800,-0.404234393532106
Siskin and gaboon viper,WD17 4DZ,51.667726192841100,-0.409137447729014
dukite and Guillemot,WD17 4HS,51.676700567243400,-0.421160301227363
Tahr and hoop snake,WD17 4HW,51.677202456418900,-0.418685000000000
Old World warbler and sand viper,WD17 4JU,51.679103239319900,-0.425314744828273
thorny devil and habu,WD17 4LB,51.664796344213600,-0.407924241571249
agama and bandy-bandy,WD17 4LF,51.667030056433700,-0.410188517006321
dugite and sidewinder,WD17 4RP,51.669586692375900,-0.411067913212487
leguaan and leathery turtle,WD17 4SA,51.672458869680700,-0.412008680161247
blind snake and sand lizard,WD17 4TE,51.676620925657400,-0.415912859878370
agama and American sparrow,WD17 4UA,51.662732336179600,-0.404916821082124
amphisbaena and constrictor,WD17 4YT,51.670460618078700,-0.409200731744688
bearded dragon and Marmoset,WD18 0AU,51.649885316186900,-0.393890589498061
Black cockatoo and skink,WD18 0AZ,51.649621208434400,-0.392989269150322
Buzzard and Cuscus,WD18 0BJ,51.653239109868100,-0.395188733517291
Komodo dragon and Vole,WD18 0BP,51.653484344448700,-0.395368001039027
Night heron and adder,WD18 0ES,51.650754844039700,-0.402923258774299
Hawaiian honeycreeper and Philippine hawk-owl,WD18 0FT,51.647517979751400,-0.395767000000000
cayman and adder,WD18 0HN,51.650612478962500,-0.407669544340734
slowworm and Mockingbird,WD18 0JU,51.658525156188300,-0.403260000000000
Black cockatoo and loggerhead,WD18 0LL,51.656149014672600,-0.400203696772379
glass snake and Logrunners,WD18 0QF,51.654706187942800,-0.401223079728745
grass snake and tokay,WD18 0WU,51.653013611071200,-0.399750307898480
tortoise and Dolphin,WD18 0XZ,51.653038218816800,-0.393649045266635
Stint and wall lizard,WD18 0ZR,51.641750000000000,-0.427895000000000
Ground sloth and Ice seal,WD18 1DX,51.658969000000000,-0.403421000000000
Towhee and Petrel,WD18 1GZ,51.641751042519300,-0.427895303722714
diamondback and Stilt,WD18 1SQ,51.658962657749100,-0.403444367020938
Cuscus and Flameback,WD18 1YW,51.641750000000000,-0.427895000000000
amphisbaena and flying lizard,WD18 1YY,51.641750000000000,-0.427895000000000
boomslang and cycling lizard,WD18 6LF,51.644627570678600,-0.416737000000000
kabaragoya and python,WD18 6PB,51.647114244645900,-0.420294820616445
gecko and Pheasant,WD18 6QG,51.643063117134100,-0.419944218824406
Asiatic leopard and goanna,WD18 7AF,51.654976752736600,-0.417649000000000
Towhee and Jackal,WD18 7BG,51.652935042217300,-0.407862818160822
Solitaire and Old World quail,WD18 7BW,51.656271116238000,-0.419181337171549
White ibis and diamondback,WD18 7DD,51.652848639642600,-0.424649137680583
cayman and Myna,WD18 7GR,51.653958371967200,-0.418379973461412
blind snake and Hawaiian honeycreeper,WD18 7JQ,51.654276317462300,-0.420624084726710
massasauga and Meadowlark,WD18 7NH,51.653736000000000,-0.406461000000000
skink and gecko,WD18 7PB,51.651838792894100,-0.413235311234368
Nukupuʻu and tokay,WD18 7PE,51.654016735962200,-0.424059223317722
Badger and Nukupuʻu,WD18 7PY,51.649994091540300,-0.415800423144322
Flameback and Ibex,WD18 7RA,51.650539469934700,-0.404940087914143
terrapin and Tattler,WD18 7RX,51.655094123886500,-0.410591733038625
cycling lizard and tiger snake,WD18 8QU,51.646480136028900,-0.425303416271720
Armadillo and White ibis,WD18 8WW,51.645377000000000,-0.431499000000000
horned viper and coral snake,WD18 9ER,51.639816230252100,-0.435332472851014
Nukupuʻu and Tattler,WD19 4DR,51.644813947843600,-0.378850456999294
milk snake and New World blackbird,WD19 4DU,51.644775173973400,-0.379950291760303
skink and horned viper,WD19 4FN,51.645913000000000,-0.383429091674856
Marsh harrier and Black cockatoo,WD19 4FS,51.646119650034100,-0.383414706500262
Grackle and jew lizard,WD19 4HY,51.643833980720400,-0.401822313288931
green turtle and Bunting,WD19 4JQ,51.643695955612700,-0.398951031975603
agamid and Vulture,WD19 4JT,51.642743104296300,-0.397654950805383
loggerhead and racer,WD19 4LB,51.640678000000000,-0.393150349422731
massasauga and agama,WD19 4LN,51.636113645057700,-0.401443425768231
Old World quail and diamond python,WD19 4LS,51.632685000000000,-0.391970000000000
blindworm and Mockingbird,WD19 4RS,51.639199097968100,-0.396912774721132
massasauga and Vulture,WD19 4SD,51.641750000000000,-0.427895000000000
Vulture and Pratincole,WD19 5AF,51.633201143764300,-0.376605778152180
Coati and anaconda,WD19 5AT,51.633133772786000,-0.384107530638060
Viscacha and harlequin snake,WD19 5AX,51.633545372653300,-0.384613094149383
taipan and diamondback terrapin,WD19 5BB,51.624921901248600,-0.378085942537108
indigo snake and rock python,WD19 5DS,51.631979883032200,-0.381937800781512
Black cockatoo and agamid,WD19 5DY,51.627879057384800,-0.376044461911608
diamond python and tokay,WD19 5EY,51.628628000000000,-0.384609002480887
Darwin's finches and hoop snake,WD19 6EU,51.620284921578800,-0.387438618735811
puff adder and iguana,WD19 6FR,51.619298235216300,-0.385653496914975
New World blackbird and Black cockatoo,WD19 6LG,51.622152779472600,-0.387256837113074
amethystine python and Solitaire,WD19 6NA,51.622202045802600,-0.392816846342224
jew lizard and worm lizard,WD19 6QG,51.618888717925300,-0.391850517636727
Egret and flying dragon,WD19 6TR,51.619158758442500,-0.394498879321974
Quetzal and snapping turtle,WD19 6UU,51.617560312360900,-0.392027473758654
diamondback terrapin and glass snake,WD19 6YN,51.617333019773200,-0.390533271409886
goanna and Tattler,WD19 6YQ,51.616856429043900,-0.389221243707679
Peafowl and Kākāriki,WD19 7AJ,51.628201576398200,-0.388357122427962
sidewinder and Schneider python,WD19 7BP,51.629743719774300,-0.396567020742531
Thrasher and pit viper,WD19 7EP,51.626413000000000,-0.388658000000000
galliwasp and Badger,WD19 7FA,51.628632000000000,-0.391787000000000
constrictor and blind snake,WD19 7NZ,51.628641581115600,-0.406098311243793
slowworm and Komodo dragon,WD19 7PG,51.627036491609600,-0.406429066616934
deaf adder and Asiatic leopard,WD19 7RA,51.628551597217500,-0.401463620022711
monitor and Fish eagle,WD19 7SN,51.625462023195300,-0.392513845168544
American sparrow and cayman,WD19 7US,51.626814709454700,-0.391483601738613
gaboon viper and sand lizard,WD23 1AR,51.637259343122600,-0.349712169882339
Jackal and River dolphin,WD23 1AW,51.635132087592300,-0.352549387475912
rock python and Wader,WD23 1BW,51.636371854517700,-0.355033334367561
Snipe and Parrotlet,WD23 1DQ,51.636074617750700,-0.353714634383319
terrapin and Boto,WD23 1DY,51.644524004088800,-0.370246666444388
Marsh harrier and Mink,WD23 1EF,51.637116256555200,-0.348489034895925
Logrunners and coral snake,WD23 1FJ,51.638195000000000,-0.365054000000000
Crow and Cuscus,WD23 1FU,51.639466807168000,-0.355152574520173
horned viper and taipan,WD23 1HA,51.633449180456900,-0.344778591054715
blue tongue and rock python,WD23 1LB,51.633216392918700,-0.351881861967626
milk snake and agama,WD23 1QN,51.644247209350600,-0.364447000000000
puff adder and Guillemot,WD23 1SH,51.634509573439300,-0.342818124959641
Eagle and Argus,WD23 1SQ,51.634091903387100,-0.340622500899072
garter snake and Vole,WD23 2AU,51.668107461481400,-0.375893357079864
diamondback terrapin and box turtle,WD23 2BG,51.664368950835200,-0.368912934748714
Prion and Masked owl,WD23 2BT,51.665541828598000,-0.370490327403716
frilled lizard and Songlark,WD23 2DS,51.662660776243900,-0.378025618219262
Tahr and Tit-tyrant,WD23 2DY,51.665057049211700,-0.374440780466536
smooth snake and Greenbul,WD23 2EH,51.653639591525100,-0.379171662506945
snapping turtle and Black jay,WD23 2GS,51.651442806178400,-0.379625860822437
saltwater crocodile and Jackal,WD23 2JW,51.652898709603700,-0.382365000000000
Viscacha and Chipmunk,WD23 2LE,51.648367476190900,-0.375717172720942
sea snake and bearded lizard,WD23 2LQ,51.650530658279700,-0.373486036880703
Linsang and Zebra,WD23 2LT,51.651007241561200,-0.377386365682951
Towhee and Bronzewing pigeon,WD23 2RA,51.652273316806300,-0.369712000000000
Black cockatoo and Petrel,WD23 2RF,51.652411169814800,-0.367737612324702
Condor and slowworm,WD23 2RH,51.652731603732500,-0.368795835676459
Vulture and asp,WD23 3DX,51.646251238180400,-0.365125900819451
Snipe and kabaragoya,WD23 3EF,51.651401850533700,-0.354213000000000
black snake and goanna,WD23 3ER,51.651489647903400,-0.353127388648772
Thicketbird and Quetzal,WD23 3ET,51.651184000000000,-0.353881174448855
cycling lizard and Towhee,WD23 3HP,51.644915710127100,-0.363497346809067
Fulmarine petrel and Thicketbird,WD23 3PU,51.650456761382500,-0.352702178825375
caiman and tortoise,WD23 4HS,51.639805910199700,-0.349200624508979
Chipmunk and crocodile,WD23 4HX,51.639806812912900,-0.350544607417767
Guillemot and amethystine python,WD23 4JU,51.640403749371900,-0.341851761456661
Civet and Tattler,WD23 4PY,51.645325219921600,-0.353553032054180
Grackle and snake,WD23 4QQ,51.644270672024400,-0.348781000000000
pit viper and Logrunners,WD23 4QW,51.646226337878800,-0.347926759299629
gopher snake and hognose snake,WD23 4RN,51.641375402669400,-0.342524481040062
Marsh harrier and Diving bird,WD23 4SH,51.643661688849400,-0.342686813766713
Hawaiian honeycreeper and king snake,WD23 4UG,51.643107909060300,-0.357029761376683
chuckwalla and Peafowl,WD23 4UJ,51.643289546449000,-0.355231039025698
soft-shelled turtle and flying lizard,WD23 4UL,51.642810576500100,-0.355060484841315
Boto and jew lizard,WD23 9BR,51.640496000000000,-0.357905000000000
galliwasp and Eagle,WD23 9FT,51.640496290395300,-0.357904636568511
hoop snake and Bronzewing pigeon,WD24 4AT,51.670275200449500,-0.396886119664649
Hawk and diamond snake,WD24 4FS,51.668962492507100,-0.397554281743472
Songlark and frill-necked lizard,WD24 4GS,51.661391567278000,-0.388379916600599
Chicken and chuckwalla,WD24 4HU,51.667564893654900,-0.388074094841522
Quetzal and iguana,WD24 4WG,51.641750000000000,-0.427895000000000
racer and Condor,WD24 4WW,51.666384146340500,-0.394435097275138
harlequin snake and Kangaroo,WD24 4YH,51.669067007717000,-0.392896000000000
Moluccan boobook and Kākāriki,WD24 5DN,51.670275590687300,-0.400100000000000
White ibis and snake,WD24 5DT,51.667530334229500,-0.399513000000000
Civet and snake,WD24 5DU,51.667549810985400,-0.398804351588326
sea snake and Recurvebill,WD24 5DX,51.668600402963600,-0.400676144523822
carpet snake and pit viper,WD24 5FN,51.683201000000000,-0.406576000000000
death adder and copperhead,WD24 5GN,51.684378615975600,-0.418405106584961
Moluccan boobook and slowworm,WD24 5HL,51.672377574840800,-0.405344516061766
Viscacha and jew lizard,WD24 5JB,51.676407772059700,-0.409455187375075
Ibex and blue tongue,WD24 5JR,51.680902106350900,-0.418656418592900
Puffleg and Gila monster,WD24 5LN,51.682607351305600,-0.415747347677923
cobra and krait,WD24 5LS,51.683685276290600,-0.416331747504887
Lemming and Komodo dragon,WD24 5NG,51.682877804286100,-0.411803321282747
agama and Logrunners,WD24 5QR,51.668041844921500,-0.399278667368438
snapping turtle and tree snake,WD24 6PP,51.677161030507300,-0.397395093142957
anaconda and mountain devil,WD24 6PW,51.673427416162300,-0.395936009576534
Crow and hawksbill,WD24 6QH,51.677280741774400,-0.400240203067209
Duck and agama,WD24 6QP,51.677105964788100,-0.399291765681009
fer-de-lance and Schneider python,WD24 6RR,51.680327364441800,-0.396820444666623
chuckwalla and Fish eagle,WD24 6RT,51.680811010430000,-0.397338559942359
