name,postcode,lat,lon
krait and boa constrictor,WD24 7JW,51.679292325342100,-0.385589318142912
Kangaroo and Prion,WD24 7PF,51.671770012972300,-0.383918878902300
deaf adder and Macaw,WD24 7RJ,51.677939100307400,-0.392478845807295
death adder and viper,WD25 0BD,51.682435000000000,-0.393309000000000
sand lizard and Flameback,WD25 0ED,51.690559566681600,-0.396111743517814
Dorcopsis and crocodile,WD25 0EY,51.685665922855000,-0.409854074146482
Kākāriki and anaconda,WD25 0GJ,51.707562000000000,-0.396862000000000
Thrasher and tiger snake,WD25 0JR,51.691381788477300,-0.388515844008506
caiman and sidewinder,WD25 0JS,51.700455054073900,-0.385921580599879
copperhead and Puffleg,WD25 0LR,51.695405767121300,-0.386882569753041
Stint and smooth snake,WD25 0NE,51.691037816887900,-0.389005504763529
Darwin's finches and Piping shrike,WD25 0NP,51.691808150185100,-0.393246377200971
hawksbill and Tahr,WD25 7AB,51.685641710744300,-0.414715591485061
Black cockatoo and Old World quail,WD25 7AS,51.693462896702500,-0.407931398069581
bushmaster and Recurvebill,WD25 7BD,51.693629422610600,-0.409430000000000
pit viper and Polecat,WD25 7EP,51.697505280543400,-0.399035145990386
black snake and American sparrow,WD25 7HD,51.695254442655500,-0.402789789437084
Warbler and Recurvebill,WD25 7JD,51.701058039598800,-0.399763559988736
jew lizard and Kite,WD25 7JJ,51.700524760842500,-0.400882172022564
amethystine python and amphisbaena,WD25 7JQ,51.700872128964600,-0.400638387822199
carpet snake and Fish eagle,WD25 7PA,51.692080209573600,-0.409412277271506
viper and hoop snake,WD25 7QN,51.691429968525400,-0.405224844035093
Booted eagles and boa,WD25 7SN,51.700684385852400,-0.396101082310132
swift and glass snake,WD25 7ST,51.699427302597300,-0.394915519202831
caiman and giant tortoise,WD25 8AN,51.672614424897000,-0.355354917344749
cobra and White ibis,WD25 8AP,51.671949835655500,-0.354771584359115
Mole and tiger snake,WD25 8BQ,51.672128000000000,-0.345585698739407
American sparrow and swift,WD25 8BW,51.680602881959900,-0.354964251240926
king cobra and puff adder,WD25 8DP,51.665969658630100,-0.353455452456966
cycling lizard and rat snake,WD25 9AU,51.682888648839900,-0.377722394618294
Fulmarine petrel and Mole,WD25 9AY,51.682387000000000,-0.386977583251707
Partridge and Civet,WD25 9BH,51.682069000000000,-0.389324000000000
Fulmarine petrel and indigo snake,WD25 9DW,51.676693609741900,-0.377755744823427
Nukupuʻu and amphisbaena,WD25 9NE,51.698662173557900,-0.381094350965859
tree snake and elapid,WD25 9QP,51.687768383052600,-0.382727153339262
diamond python and amethystine python,WD25 9TA,51.682564930545000,-0.383592430109964
asp and Eagle,WD25 9UD,51.681867114779300,-0.383197790968539
caiman and Petrel,WD25 9US,51.682026827103400,-0.379127388034926
mamba and Myna,WD3 0FL,51.639480000000000,-0.474556753427907
Elephant and boa constrictor,WD3 0PD,51.639484000000000,-0.474602000000000
Crow and gaboon viper,WD3 0PR,51.639484000000000,-0.474602000000000
anaconda and Kangaroo,WD3 1AN,51.638826000000000,-0.470053312692929
Tree warbler and Grouse,WD3 1AQ,51.639280692046900,-0.471132688957884
Hawaiian honeycreeper and Grackle,WD3 1AZ,51.639251205957100,-0.465425371612849
Perching duck and black snake,WD3 1BP,51.637264807712800,-0.472385440208539
taipan and kabaragoya,WD3 1EG,51.638648806833800,-0.469564303779382
worm lizard and sea snake,WD3 1ET,51.639012184924900,-0.466401679479313
Herring gull and Parakeet,WD3 1FA,51.639480000000000,-0.474556753427907
Dolphin and Fulmarine petrel,WD3 1FE,51.640799858748000,-0.466269114212586
Parrotlet and dukite,WD3 1FT,51.641062829248700,-0.465595534795301
racer and galliwasp,WD3 1JA,51.637301003360400,-0.467572110283934
diamond python and Maya,WD3 1PJ,51.622653364123300,-0.468975700194837
Parrotlet and kabaragoya,WD3 1PR,51.621404000000000,-0.468252000000000
alligator and Partridge,WD3 3AN,51.646663093283900,-0.456283000000000
Minke whale and agama,WD3 3BS,51.643444718326000,-0.447203393582340
iguana and Mouse,WD3 3BW,51.645334847281900,-0.448020478728925
turtle and Pheasant,WD3 3DA,51.646628477412800,-0.441139659624549
Condor and python,WD3 3DX,51.646982714720600,-0.444119470190455
Solitaire and Maya,WD3 3DY,51.647003309458300,-0.441603783005030
jew lizard and cayman,WD3 3HJ,51.647293314323300,-0.454703621297998
diamond python and king cobra,WD3 3JN,51.655546000000000,-0.453117918738873
tokay and Snipe,WD3 3JP,51.655911469668400,-0.450218075609901
Tahr and caiman,WD3 3LS,51.652116581804000,-0.432709000000000
blind snake and copperhead,WD3 3NA,51.654627045703900,-0.446243022832380
Recurvebill and slowworm,WD3 3NJ,51.657635701900800,-0.445287151137912
bull snake and blindworm,WD3 3NZ,51.655383270573900,-0.437499839703610
Jay and River dolphin,WD3 3PA,51.649439294145800,-0.446290300845581
horned viper and mamba,WD3 3PH,51.651398274438000,-0.446873812690123
mud turtle and Night heron,WD3 3PU,51.652436920887900,-0.451305106034238
rattlesnake and diamondback terrapin,WD3 3QW,51.651096519409700,-0.439034939797198
moloch and Nukupuʻu,WD3 3RG,51.653687290209600,-0.433712847906025
Old World vulture and Diving bird,WD3 3TE,51.650187615603000,-0.430884659999394
Vulture and Jerboa,WD3 3TP,51.652342993397500,-0.439712000000000
Eagle and horned viper,WD3 3UF,51.651378000000000,-0.451405224875196
ringhals and Logrunners,WD3 4BU,51.645144824422300,-0.495607178772092
Komodo dragon and chameleon,WD3 4DH,51.643259412972400,-0.477690465660359
mountain devil and Thicketbird,WD3 4DX,51.648173467876000,-0.484290456406817
Maya and Parrotlet,WD3 4EP,51.649131802329800,-0.477739498454839
Marmoset and box turtle,WD3 4HQ,51.653463481330400,-0.479126000000000
Towhee and boomslang,WD3 4HR,51.653920116322800,-0.473936161430102
asp and Ice seal,WD3 4JS,51.659065000000000,-0.484332000000000
tiger snake and cerastes,WD3 4LA,51.656380440174500,-0.485476832032790
skink and box turtle,WD3 4LG,51.654818000000000,-0.491167000000000
Treepie and Lemming,WD3 4LH,51.674415353821200,-0.455559648666861
Quetzal and B,WD3 4NT,51.699897004856700,-0.508335206930217
Jerboa and copperhead,WD3 5AZ,51.654760458032200,-0.498671617520732
Badger and amethystine python,WD3 5BW,51.645745357570400,-0.526662145797084
Piping shrike and Tahr,WD3 5DA,51.642203722932600,-0.526039866962187
Mamo and Skunk,WD3 5EN,51.655715381578600,-0.503743246007041
blind snake and Gull,WD3 5JX,51.646709846151000,-0.525416771200159
hognose snake and Ice seal,WD3 5NP,51.651725886368600,-0.527451219392258
tuatara and rock python,WD3 5PF,51.654569795176000,-0.518352842657127
chuckwalla and cycling lizard,WD3 5QT,51.657586623084300,-0.522996415141953
anaconda and Magpie,WD3 5RG,51.659070557763200,-0.527314378357197
Egret and puff adder,WD3 5SL,51.662522000000000,-0.509303000000000
Viscacha and sand viper,WD3 5TH,51.656184024090400,-0.500301563239799
Capuchin and Kangaroo,WD3 5YX,51.639480000000000,-0.474556753427907
water snake and blind snake,WD3 6AB,51.667126071824300,-0.484800405955890
Marmoset and Coati,WD3 6AP,51.681011960820300,-0.488473868755361
taipan and dugite,WD3 6EE,51.672888943391400,-0.525709310600719
anole and Mouse,WD3 7AY,51.637418212503300,-0.485617233089023
Songlark and New World blackbird,WD3 7DQ,51.637288703394700,-0.479075348222243
tortoise and Coati,WD3 7EH,51.638213636558800,-0.485937564213680
Ground sloth and Triller,WD3 7EJ,51.637137376479800,-0.487548532039146
diamondback terrapin and Myna,WD3 7EY,51.640589497939900,-0.488185180731754
krait and Capuchin,WD3 7HA,51.642667054199900,-0.488032000000000
Chickadee and black snake,WD3 7HP,51.641169920827600,-0.490666073273709
Ice seal and bandy-bandy,WD3 7PQ,51.644922065832300,-0.486668030640639
amphisbaena and anole,WD3 8FJ,51.635006476373800,-0.491058519368835
garter snake and Puffleg,WD3 8HD,51.635780534150200,-0.489717856463925
Myna and sand viper,WD3 8QD,51.633932311468200,-0.497047434294740
Partridge and chameleon,WD3 8SY,51.635473458041400,-0.487517178099133
goanna and anaconda,WD3 8YJ,51.633387858894700,-0.498770470827780
grass snake and Minke whale,WD3 9SP,51.621559764669300,-0.510486278708376
Jackal and rock snake,WD3 9UF,51.621662553094200,-0.519323714408878
perentie and fer-de-lance,WD3 9UJ,51.619399818655200,-0.518155083044909
diamond python and thorn lizard,WD4 4BR,51.641750000000000,-0.427895000000000
cycling lizard and carpet snake,WD4 8AP,51.725197909805100,-0.455958152323172
hoop snake and Zebra,WD4 8BT,51.719925901923300,-0.452330239194995
Hawaiian honeycreeper and chameleon,WD4 8GW,51.712769442073100,-0.440849867845026
taipan and boomslang,WD4 8HR,51.714594000000000,-0.442727000000000
constrictor and Diving bird,WD4 8LD,51.710213832948100,-0.440706153334843
Armadillo and constrictor,WD4 8LF,51.706893939534300,-0.438533563932140
milk snake and dugite,WD4 8LL,51.706277000000000,-0.438635910288126
tree snake and Nukupuʻu,WD4 8PZ,51.695689046619900,-0.433059096285630
thorny devil and Marsh harrier,WD4 8QU,51.690383425844000,-0.433705274820808
Coati and soft-shelled turtle,WD4 8RQ,51.693620073203100,-0.434345925628078
Duck and Mink,WD4 8SS,51.712473866644000,-0.442293035946145
B and box turtle,WD4 9DB,51.701818000000000,-0.500877000000000
cayman and bicycle lizard,WD4 9HW,51.716331888806100,-0.460067308384844
tortoise and boa,WD4 9LD,51.720557581976500,-0.494727235779980
Dolphin and Kestrel,WD4 9LT,51.714993527699400,-0.508272858267945
wall lizard and Black jay,WD5 0BG,51.708730607376400,-0.419205938588026
Mole and blue racer,WD5 0BT,51.700907203624300,-0.403878691763929
diamondback and coral snake,WD5 0BY,51.701645053763200,-0.427252945892532
adder and bull snake,WD5 0DJ,51.702583107315400,-0.425454878183214
iguana and gopher snake,WD5 0DP,51.707641681141500,-0.414467710212818
Komodo dragon and Parrotbill,WD5 0JX,51.697463450663600,-0.425212939737997
galliwasp and Old World warbler,WD5 0JZ,51.696962268416000,-0.425389505042638
Boto and Zebra,WD5 0NN,51.700281541240400,-0.412120208600084
kabaragoya and Parrotbill,WD5 0NY,51.707724904704800,-0.403349283750554
Black jay and Ice seal,WD5 0PA,51.704898983034300,-0.408589000000000
Komodo dragon and horned viper,WD5 0PG,51.701452635857600,-0.416275896145522
Duck and Lemming,WD5 0QF,51.708227638552100,-0.414577485076367
coral snake and blind snake,WD5 0QL,51.711982718585200,-0.415531000000000
Maya and gavial,WD5 0RU,51.725309960190700,-0.407754043306359
cobra and leathery turtle,WD5 0TH,51.698481917551800,-0.407379034647094
tuatara and python,WD5 0TU,51.697856202050500,-0.405664579067698
diamondback turtle and Tattler,WD99 1AB,51.648776000000000,-0.422087000000000
Tahr and Lemming,WD99 1AU,51.648776000000000,-0.422087000000000
Masked owl and Jay,WD99 1AX,51.648776000000000,-0.422087000000000
