name,postcode,lat,lon
Marsh harrier and diamond snake,AL1 1NH,51.749735340000000,-0.338488552000000
Herring gull and perentie,AL1 2AT,51.745259290000000,-0.340535882000000
Rat and blue racer,AL1 2AX,51.744883660000000,-0.340680014000000
Jackal and Mouse,AL1 2DS,51.744476950000000,-0.344997016000000
thorny devil and Schneider python,AL1 2DT,51.743549150000000,-0.346798076000000
tuatara and king cobra,AL1 2EA,51.742682240000000,-0.347814672000000
Dorcopsis and dukite,AL1 3EB,51.753420000000000,-0.338266000000000
agama and Old World warbler,AL1 3JG,51.752231140000000,-0.338397000000000
bandy-bandy and Tree warbler,AL1 3YD,51.751487260000000,-0.339018249000000
Pratincole and bull snake,AL2 2AG,51.709332510000000,-0.355615685000000
Mockingbird and Komodo dragon,AL2 2AH,51.714504480000000,-0.354443768000000
sea snake and Thrasher,AL2 2DJ,51.716822040000000,-0.345948897000000
hognose snake and garter snake,AL2 2HD,51.725110840000000,-0.352219859000000
jew lizard and Rat,AL2 2HH,51.723525960000000,-0.350134666000000
chuckwalla and bearded lizard,AL2 2HJ,51.722245700000000,-0.346055019000000
Hawaiian honeycreeper and sand lizard,AL2 2PZ,51.729425420000000,-0.344431818000000
leathery turtle and smooth snake,AL2 2RR,51.718025020000000,-0.350928426000000
Scimitar babbler and Lemming,AL2 2SQ,51.717268830000000,-0.353431410000000
worm lizard and Myna,AL2 3AE,51.732427470000000,-0.361019083000000
tree snake and Kite,AL2 3AW,51.729167660000000,-0.361325234000000
horned viper and Stilt,AL2 3FD,51.704458000000000,-0.363454000000000
tokay and pit viper,AL2 3FG,51.702670000000000,-0.373952000000000
Pitohui and Ice seal,AL2 3HG,51.730849290000000,-0.357470449000000
Kangaroo and agama,AL2 3LF,51.734579270000000,-0.357349706000000
leguaan and cobra de capello,AL2 3LW,51.706256550000000,-0.360200000000000
diamondback terrapin and coral snake,AL2 3PB,51.710780460000000,-0.371774481000000
boa and Chicken,AL2 3PG,51.703992920000000,-0.358949755000000
Marmoset and crocodile,AL2 3PN,51.706543510000000,-0.352301175000000
dukite and Komodo dragon,AL2 3RT,51.710748400000000,-0.374004683000000
blind snake and asp,AL3 4AR,51.743496670000000,-0.352666360000000
Grackle and Kite,AL3 4BB,51.740170400000000,-0.355930316000000
moloch and Fulmarine petrel,AL3 4ET,51.751774890000000,-0.343469855000000
Bunting and Scimitar babbler,AL3 4GD,51.744173349653200,-0.356552793544362
Ibex and Kestrel,AL3 4HZ,51.745608560000000,-0.359198000000000
Meadowlark and Maya,AL3 4JB,51.747095630000000,-0.361183586000000
Towhee and Pratincole,AL3 4LA,51.746154280000000,-0.360739624000000
Greenbul and Armadillo,AL3 4LD,51.742834710000000,-0.349706600000000
mountain devil and Old World quail,AL3 4PW,51.753105220000000,-0.342160730000000
coral snake and Minke whale,AL3 4RY,51.753951970000000,-0.350576352000000
flying dragon and New World blackbird,AL3 4SE,51.754800000000000,-0.351917677000000
hognose snake and carpet snake,AL3 4SH,51.753714720000000,-0.354178051000000
Songlark and amphisbaena,AL3 4TG,51.754159780000000,-0.349366254000000
boa constrictor and Pheasant,AL3 4TL,51.756443600000000,-0.351919981000000
Armadillo and Chickadee,AL3 5BE,51.755497620000000,-0.338378497000000
Schneider python and Kestrel,AL3 5JS,51.756654190000000,-0.341958317000000
Parrotlet and amethystine python,AL3 5JT,51.756122710000000,-0.341253338000000
Herring gull and Puffleg,AL3 5JX,51.756524480000000,-0.341687776000000
racer and Grosbeak,AL3 5LF,51.759863060000000,-0.342507322000000
rock python and gopher snake,AL3 5NU,51.755520150000000,-0.341883942000000
Condor and box turtle,AL3 5NX,51.756150620000000,-0.338137195000000
sidewinder and Gull,AL3 5QT,51.760560770000000,-0.339699627000000
Polecat and saltwater crocodile,AL3 5RQ,51.762615550000000,-0.338117187000000
bearded lizard and Masked owl,AL3 5TE,51.761582700000000,-0.342024119000000
Hawaiian honeycreeper and anole,AL3 5UW,51.759464880000000,-0.346796448000000
ringhals and horned viper,AL3 6AN,51.753568760000000,-0.392359358000000
Snipe and Tit-tyrant,AL3 6AR,51.746337000000000,-0.395412000000000
Pratincole and turtle,AL3 6DS,51.772763090000000,-0.342904421000000
Coati and bushmaster,AL3 6DW,51.773024740000000,-0.342329558000000
Scimitar babbler and snapping turtle,AL3 6EF,51.768470000000000,-0.345177602000000
agamid and sea snake,HA1 1PQ,51.582432662725800,-0.340671896405388
massasauga and Dolphin,HA1 1RY,51.585562997517200,-0.340110389745913
bandy-bandy and chuckwalla,HA1 1UH,51.588689176816900,-0.342436064622639
Black cockatoo and blue racer,HA1 1XJ,51.592605362754500,-0.337673740698406
Fulmarine petrel and Night heron,HA1 1XN,51.592693601972200,-0.339460687136395
rock python and bicycle lizard,HA1 1XS,51.591355266337400,-0.340202436291667
dukite and bicycle lizard,HA1 3BT,51.577217390446300,-0.341958663831675
Rabbit and worm lizard,HA1 3BY,51.576033699611300,-0.341554359577759
Masked owl and Grouse,HA1 3DL,51.579082000000000,-0.342757000000000
bushmaster and python,HA1 3EF,51.571996484328800,-0.339666620489483
dugite and elapid,HA1 3EX,51.577979000000000,-0.341657000000000
gavial and hawksbill,HA1 3JR,51.565137406628700,-0.346813103947644
Philippine hawk-owl and Black jay,HA1 3JU,51.565394841983700,-0.348491862830587
hognose snake and racer,HA1 3LB,51.564229860181000,-0.346860445975149
wall lizard and harlequin snake,HA1 3NQ,51.566390080021900,-0.339365854234223
black snake and flying dragon,HA1 3NZ,51.562860000000000,-0.338893812987212
Mouse and racer,HA1 3PG,51.561074538658800,-0.338593000000000
Prion and milk snake,HA1 4BP,51.576327521898000,-0.351559218575814
diamondback and Marsh harrier,HA1 4HF,51.582819328648400,-0.354872000000000
Armadillo and Civet,HA1 4JF,51.581991542790000,-0.349564524381751
Vulture and Logrunners,HA1 4JN,51.582873684537200,-0.350268682619008
wall lizard and Chipmunk,HA1 4PD,51.587619741283600,-0.357834046111580
turtle and agama,HA1 4PJ,51.586601000000000,-0.358841376864810
Gila monster and Thrasher,HA1 4RY,51.590709217422000,-0.347949348241133
Jay and Masked owl,HA1 4SZ,51.588513474847400,-0.343366331450669
puff adder and water snake,HA1 4TB,51.587449911728700,-0.342553342041898
boa constrictor and Hawaiian honeycreeper,HA1 4UE,51.593219574189400,-0.339773557885801
galliwasp and Fish eagle,HA1 4XJ,51.590423141735900,-0.342964834034193
Peafowl and puff adder,HA2 0AB,51.572428924695500,-0.349925310245689
Thrasher and Egret,HA2 0AJ,51.572225109654400,-0.354622545557557
Wallaby and Perching duck,HA2 0AW,51.573836838242600,-0.355415768805192
rock snake and Mink,HA2 0DQ,51.571194754750700,-0.347848786710014
Vole and Boto,HA2 0DU,51.564678334199200,-0.351893959851637
bicycle lizard and moloch,HA2 0DX,51.571445261382900,-0.364232000000000
gopher snake and blue tongue,HA2 0FN,51.569564648309300,-0.360360598418961
dugite and galliwasp,HA2 0HA,51.567753688079700,-0.341682515488154
constrictor and adder,HA2 0HH,51.570370079249600,-0.360216105436433
Wallaby and bearded dragon,HA2 0HJ,51.569204046860500,-0.358497677364616
Siskin and sea snake,HA2 0HN,51.571144784777000,-0.343985000000000
pit viper and blindworm,HA2 0JP,51.569069837195800,-0.344462777114610
Hawk and Partridge,HA2 0LU,51.566668793810000,-0.348921846498349
milk snake and Rabbit,HA2 0NE,51.568901593707900,-0.342607587525294
glass snake and rat snake,HA2 0NJ,51.563297000000000,-0.348856000000000
Lemming and mud turtle,HA2 0SP,51.570299868408700,-0.360983405798711
Warbler and Goose,HA2 0TR,51.568201912549600,-0.359916000000000
sand viper and Coati,HA2 0UT,51.570233477556200,-0.362024730280909
Mole and Old World vulture,HA2 0WN,51.572197469993300,-0.364869058732971
sea snake and smooth snake,HA2 0YA,51.566943461633800,-0.347353601829542
Armadillo and horned toad,HA2 6BU,51.586634277601600,-0.360669943052955
Minke whale and Black cockatoo,HA2 6DW,51.591108000000000,-0.361534000000000
agamid and slowworm,HA2 6EG,51.590086031965300,-0.363158606294795
boa and New World blackbird,HA2 6EP,51.589702101992800,-0.364644861386795
Jackal and amethystine python,HA2 6HD,51.590092864473100,-0.361714763593176
Moluccan boobook and Dolphin,HA2 6LE,51.598745911920800,-0.352263693288813
Bunting and agamid,HA2 6PY,51.593991212691900,-0.351136402691692
Boto and python,HA2 6QD,51.594600064495300,-0.349670613179779
Ibex and water snake,HA2 7DZ,51.580104677496000,-0.365090423828337
Pheasant and anole,HA2 7HD,51.577649462518200,-0.368295842237286
Kākāriki and Moluccan boobook,HA2 7HT,51.579071886597700,-0.367768627847781
Capuchin and deaf adder,HA2 7JD,51.576685734047900,-0.367536610835803
python and Duck,HA2 7JL,51.575249010904500,-0.369622890833972
glass snake and Wallaby,HA2 7PE,51.583002388791400,-0.369128903391875
Grackle and python,HA2 7QG,51.584351227574600,-0.371072522400492
sand lizard and Tree warbler,HA2 7RD,51.584679747493200,-0.364305547067635
anole and snapping turtle,HA2 8AU,51.568418000000000,-0.356838000000000
fer-de-lance and Tahr,HA2 8AY,51.566800186572600,-0.353793956137237
leguaan and blindworm,HA2 8BJ,51.565477213697700,-0.356280099046362
green turtle and death adder,HA2 8DQ,51.565938093999000,-0.358370014457395
Philippine hawk-owl and gavial,HA2 8EL,51.564114051799700,-0.360397877924988
Old World warbler and Coati,HA2 8HE,51.557806251132100,-0.362024016663777
blindworm and tuatara,HA2 8LQ,51.563294683723200,-0.353256887257749
flying lizard and Mink,HA2 8PJ,51.559572009181500,-0.366129778899275
Jackal and mud turtle,HA2 8PL,51.558788157733800,-0.367311952724180
soft-shelled turtle and Komodo dragon,HA2 8PZ,51.562676630476300,-0.364359371633471
frilled lizard and Philippine hawk-owl,HA2 8RA,51.556738568013600,-0.375780920230728
Linsang and mamba,HA2 8SN,51.559982119616900,-0.371698105956293
rock snake and Lemming,HA2 9AN,51.560223154656700,-0.378715195759369
Tahr and Quetzal,HA2 9AY,51.562563037298000,-0.374953038145279
Myna and Pitohui,HA2 9DD,51.569864971551800,-0.369786645126084
gaboon viper and python,HA2 9EG,51.572211034400200,-0.371665240280863
hognose snake and box turtle,HA2 9JA,51.563403289937700,-0.373942015236866
Nukupuʻu and Grackle,HA2 9NE,51.571039268484000,-0.373409838064669
flying dragon and sidewinder,HA2 9NR,51.565935618459600,-0.376939334365040
flying dragon and garter snake,HA2 9PD,51.571711337973600,-0.377137682370809
Perching duck and Komodo dragon,HA2 9PL,51.567145645228900,-0.380561129085822
Gila monster and Petrel,HA2 9PQ,51.567154599074600,-0.381210101167731
Condor and worm lizard,HA2 9RQ,51.571550177381900,-0.381746612485248
cayman and Crow,HA2 9ST,51.573937320172300,-0.374244396483265
viper and rock python,HA2 9TJ,51.574405168318700,-0.369725238106914
Peafowl and crocodile,HA2 9UD,51.573349048701800,-0.366848029767904
terrapin and Fish eagle,HA3 5HQ,51.601836349523700,-0.341206523276997
Zebra and B,HA3 5LF,51.603830573656200,-0.340426272886089
Chipmunk and anole,HA3 5NZ,51.599002181404600,-0.342363824804311
Boto and Moluccan boobook,HA3 5PT,51.602406318378300,-0.347828111068751
constrictor and Bunting,HA3 5QB,51.597157696108700,-0.342286596869886
Komodo dragon and Kite,HA3 5RF,51.596766389631300,-0.338777941640029
Kākāriki and River dolphin,HA3 5RN,51.598580000000000,-0.340416000000000
Eagle and whip snake,HA3 6HJ,51.609647961615900,-0.339116531884331
Logrunners and Jerboa,HA3 6HZ,51.604866316781400,-0.343088919021310
Chickadee and bushmaster,HA3 6JH,51.606725113966000,-0.346924000000000
Minke whale and Gila monster,HA3 6LN,51.606215052517800,-0.353307449946087
Chipmunk and frilled lizard,HA3 6LS,51.605412877136600,-0.351892386380253
Warbler and cycling lizard,HA3 6NA,51.606754368026200,-0.348811141908473
Wader and rattlesnake,HA3 6PU,51.608815973953900,-0.357314850496617
cayman and grass snake,HA3 6SW,51.610234676238600,-0.352035501248597
blue racer and puff adder,HA3 6TP,51.610313630064300,-0.341041964850955
Grouse and skink,HA4 0AX,51.566646382399000,-0.413129529347276
Pheasant and monitor,HA4 0EW,51.560516560621100,-0.401412158686042
fer-de-lance and garter snake,HA4 0EY,51.558554361530300,-0.397975458766221
Perching duck and Chickadee,HA4 0HT,51.562426344963100,-0.385244486793192
Cloud rat and flying lizard,HA4 0JW,51.556496398370500,-0.382987770873062
habu and tree snake,HA4 0LU,51.561241544292700,-0.390638790405878
chuckwalla and gopher snake,HA4 0NQ,51.562578837267800,-0.389798084208322
Armadillo and Wallaby,HA4 0TJ,51.561235000000000,-0.399266000000000
constrictor and Solitaire,HA4 0TS,51.562743069922400,-0.395880584932740
Wader and Recurvebill,HA4 0UN,51.563577318782800,-0.397048712311302
snapping turtle and Tattler,HA4 0UR,51.563114746875600,-0.398074893259618
Shearwater and gavial,HA4 4HP,51.574466437800000,-0.412092459800000
carpet snake and Grouse,HA4 4HX,51.574466000000000,-0.412092000000000
Goose and leathery turtle,HA4 4JH,51.574468000000000,-0.412071000000000
mountain devil and milk snake,HA4 6AF,51.570988906948900,-0.413079337496243
Grackle and Triller,HA4 6AP,51.570142898942700,-0.411694697808982
Herring gull and worm lizard,HA4 6BA,51.568259147875900,-0.412034493638888
Thicketbird and grass snake,HA4 6BT,51.570934034140000,-0.417006157615588
diamondback turtle and soft-shelled turtle,HA4 6DT,51.566281746143100,-0.418091144205080
Schneider python and American sparrow,HA4 6EG,51.567426749964100,-0.420316711051617
Grouse and bearded lizard,HA4 6EY,51.571172095504800,-0.430042496589441
Armadillo and Mink,HA4 6LA,51.565895737900000,-0.416806001121235
blue racer and garter snake,HA4 6NR,51.556934974439500,-0.407827202820151
blue tongue and Thicketbird,HA4 6RJ,51.550400333219700,-0.402069657697332
Prion and Herring gull,HA4 6TR,51.555897891373600,-0.398357292784076
cerastes and B,HA4 7DN,51.570920000000000,-0.435318000000000
cobra and turtle,HA4 7EJ,51.570061970207500,-0.427050539093556
Komodo dragon and Triller,HA4 7EN,51.570839767553400,-0.427384438604430
Duck and indigo snake,HA4 7ER,51.569761780602600,-0.428806859514760
asp and Capuchin,HA4 7GD,51.588640360961300,-0.435849752581274
habu and Peafowl,HA4 7JE,51.575507221208000,-0.434150353764175
puff adder and Marsh harrier,HA4 7JG,51.576477587189900,-0.430725594837167
Buzzard and Vulture,HA4 7JS,51.579015250973200,-0.442342819468436
blue racer and Songlark,HA4 7LB,51.575897148790400,-0.430355938089516
bushmaster and galliwasp,HA4 7LS,51.576812748830400,-0.436299099335426
Pratincole and carpet snake,HA4 7PG,51.579640744171500,-0.436635016062160
elapid and gavial,HA4 7QL,51.578942163976500,-0.428764505787192
Shearwater and snake,HA4 7QW,51.580646847157200,-0.430495390506300
tokay and Coati,HA4 7QY,51.582257637021100,-0.442737125593068
Treepie and smooth snake,HA4 7SJ,51.588334417483000,-0.439887706138817
gopher snake and gecko,HA4 7XL,51.581213320583800,-0.427805760908046
Stilt and sea snake,HA4 8FB,51.572555031029200,-0.419186550506302
viper and green turtle,HA4 8FE,51.572327000000000,-0.411637700702442
Goose and indigo snake,HA4 8FX,51.583321000000000,-0.407295000000000
boa constrictor and Komodo dragon,HA4 8GD,51.582686383053600,-0.405888000000000
iguana and skink,HA4 8GE,51.582409000000000,-0.405686047276093
box turtle and skink,HA4 8HE,51.576242497059600,-0.420573929967882
hawksbill and Cloud rat,HA4 8LB,51.572918000000000,-0.422747116564930
racer and Shearwater,HA4 8PB,51.575664289989400,-0.405080307002394
Grackle and tree snake,HA4 8QN,51.575858806858400,-0.408986000000000
agama and gavial,HA4 8QQ,51.575630579218100,-0.412542475187960
Grackle and horned toad,HA4 8SZ,51.579280549827000,-0.401879598707025
Badger and Nukupuʻu,HA4 8TE,51.580283000000000,-0.403403000000000
blindworm and horned viper,HA4 8TY,51.574752954925700,-0.404188618398298
White ibis and snake,HA4 9AL,51.569645011534800,-0.406806047953397
Cloud rat and saltwater crocodile,HA4 9BH,51.571723988175900,-0.411581873859078
wall lizard and Minke whale,HA4 9BL,51.569857792021800,-0.402614057834916
bull snake and tokay,HA4 9HP,51.565498824626100,-0.392897982675515
Warbler and Skunk,HA4 9JH,51.568283204227800,-0.396609063788200
thorny devil and Coati,HA4 9JL,51.568764951526700,-0.397645444506272
diamondback terrapin and pit viper,HA4 9JS,51.569857318133600,-0.391387922214516
Old World quail and tiger snake,HA4 9NS,51.573287005525700,-0.394282851540458
Fox and snapping turtle,HA4 9NY,51.570684484103100,-0.390723816153358
Grackle and puff adder,HA4 9QB,51.572329969573100,-0.388097116334025
Triller and jew lizard,HA4 9QD,51.572570340825400,-0.390541777565728
king cobra and kabaragoya,HA4 9QX,51.575878062171800,-0.394379153524066
bushmaster and Logrunners,HA4 9TA,51.572592652999000,-0.402705790383816
jew lizard and cobra,HA4 9TH,51.569699454416200,-0.401551828590278
saltwater crocodile and amphisbaena,HA4 9TL,51.572298562530400,-0.402239899551000
leathery turtle and cerastes,HA5 1AN,51.590785252767500,-0.390966404857137
anaconda and Dolphin,HA5 1AY,51.590111254674000,-0.390340600824680
Vole and Tree warbler,HA5 1BH,51.591793412064300,-0.383842477243585
Eagle and brown snake,HA5 1EZ,51.585812882620300,-0.389020179011081
slowworm and Philippine hawk-owl,HA5 1HP,51.585289992717200,-0.382384409018113
puff adder and diamond snake,HA5 1JS,51.575117040327800,-0.385444207167820
Zebra and Jackal,HA5 1JU,51.586716327560000,-0.384094807205950
Parakeet and Fox,HA5 1LZ,51.580522470162100,-0.387489746665457
anole and leathery turtle,HA5 1NR,51.578291113684800,-0.385432755751603
Black jay and Elephant,HA5 1PF,51.577609640271900,-0.390811166364884
python and Night heron,HA5 1RJ,51.578656000000000,-0.400184000000000
monitor and Chipmunk,HA5 2AA,51.598458367298100,-0.393799536157673
diamond snake and saltwater crocodile,HA5 2AN,51.597699566496400,-0.397493641183210
Thicketbird and Jerboa,HA5 2BU,51.594101437858700,-0.398717496627985
Tahr and Snipe,HA5 2BX,51.593431806239300,-0.400386858603444
Tahr and giant tortoise,HA5 2ES,51.583496345849700,-0.408560000000000
horned toad and Fish eagle,HA5 2EY,51.589302521607200,-0.400907221117858
Perching duck and Jackal,HA5 2JJ,51.589059843332700,-0.412175488302659
indigo snake and hawksbill,HA5 2NG,51.591588000000000,-0.412852000000000
viper and Rabbit,HA5 2PR,51.589247597596300,-0.408112531551616
adder and bandy-bandy,HA5 2SL,51.584310165797000,-0.398801899022531
Cloud rat and Old World quail,HA5 2TH,51.584273014742700,-0.396739133099531
Tit-tyrant and terrapin,HA5 3AB,51.593532906737300,-0.378265794417822
Solitaire and Booted eagles,HA5 3AJ,51.594831363989300,-0.374624623912888
giant tortoise and boa,HA5 3DL,51.599737000000000,-0.381920315088557
cerastes and Warbler,HA5 3EP,51.600796000000000,-0.386454000000000
Egret and Parakeet,HA5 3HA,51.596920756481000,-0.381364825772312
Mink and blue tongue,HA5 3JE,51.594155285291600,-0.382314927667528
diamondback and bearded lizard,HA5 3JF,51.595210144483500,-0.383822270743135
Kite and lizard,HA5 3PX,51.603465750799700,-0.385189795858700
taipan and cobra,HA5 3RY,51.599025979539900,-0.393880582343854
box turtle and Jackal,HA5 3TU,51.599867013745900,-0.404781243988142
rock snake and boa,HA5 3XT,51.609041316592800,-0.398350764336691
Armadillo and diamondback turtle,HA5 3YY,51.599439006216100,-0.400421262946151
Skunk and Peafowl,HA5 3YZ,51.601532945640200,-0.387843038964301
Black jay and Thicketbird,HA5 4AP,51.614828986085100,-0.362268666967239
mountain devil and Old World vulture,HA5 4DB,51.612018884743800,-0.364521799468472
constrictor and diamond snake,HA5 4EQ,51.608818363280100,-0.372334350027901
Philippine hawk-owl and box turtle,HA5 4LP,51.607478617018600,-0.372988804739473
Bunting and mamba,HA5 4NN,51.606397728510600,-0.375453552174002
horned viper and Coati,HA5 4NQ,51.604746329169200,-0.371786816337892
slowworm and fer-de-lance,HA5 4QB,51.607934000000000,-0.372659359562903
diamondback turtle and goanna,HA5 4RP,51.608701000000000,-0.387809651928299
Wallaby and Thicketbird,HA5 4RT,51.609283091745800,-0.383842473383203
cerastes and gaboon viper,HA5 4SF,51.607187841607100,-0.376667308624310
Jackal and Shearwater,HA5 4SR,51.605087294791100,-0.378229616190269
Stilt and Skunk,HA5 4TW,51.604377000000000,-0.385995000000000
Mouse and Puffleg,HA5 4UR,51.613705199878800,-0.370686320161546
moloch and B,HA5 5AB,51.576577913225700,-0.374020295076941
rock snake and box turtle,HA5 5BU,51.581079966187900,-0.375750350930971
hoop snake and Logrunners,HA5 5HJ,51.591475298489300,-0.379032016240118
Ice seal and Prion,HA5 5HN,51.588700549749100,-0.376056011772800
Old World quail and Treepie,HA5 5PA,51.590304455809000,-0.380199699304753
Hawaiian honeycreeper and Cuscus,HA5 5PB,51.591601015418900,-0.381626097070557
cobra de capello and fer-de-lance,HA5 5QB,51.594120853875300,-0.379818512058454
Grosbeak and Peafowl,HA5 5TJ,51.596901729056600,-0.359071000000000
snapping turtle and wall lizard,HA5 9HU,51.595048860067800,-0.385170683550690
leathery turtle and bearded lizard,HA5 9JL,51.595048860067800,-0.385170683550690
pit viper and Fulmarine petrel,HA6 1BN,51.605893561610700,-0.416873693260432
leathery turtle and snake,HA6 1DA,51.602800136311000,-0.410873190300930
Maya and Thrasher,HA6 1DN,51.610937000000000,-0.422706000000000
Scimitar babbler and Philippine hawk-owl,HA6 1HS,51.604142990346900,-0.418421931985457
Quetzal and tortoise,HA6 1HW,51.602886426161300,-0.421266937476890
Stint and Elephant,HA6 1JE,51.597050836879700,-0.411954583997737
Argus and tiger snake,HA6 1JS,51.597974775160900,-0.414449076076891
Masked owl and Kestrel,HA6 1PQ,51.601192861682000,-0.409052172185603
mud turtle and Wader,HA6 1QJ,51.603689689470900,-0.407506447543477
hawksbill and carpet snake,HA6 1SU,51.605271180549300,-0.413400690062149
bearded dragon and Buzzard,HA6 2AG,51.614706200867300,-0.428280931159421
gaboon viper and Komodo dragon,HA6 2AY,51.622674432558300,-0.432411727315253
bicycle lizard and Black cockatoo,HA6 2DG,51.615208690205500,-0.434257764485386
Wader and copperhead,HA6 2DH,51.616208212459600,-0.433688936115509
Songlark and Fox,HA6 2FE,51.606936727713600,-0.436605000000000
saltwater crocodile and thorny devil,HA6 2FP,51.608134471415600,-0.425706214915053
Capuchin and Wader,HA6 2GG,51.611699656451500,-0.438148046836306
saltwater crocodile and giant tortoise,HA6 2HR,51.630026096873000,-0.438197819777198
Tattler and Viscacha,HA6 2NP,51.614496000000000,-0.440074000000000
Fish eagle and Petrel,HA6 2NX,51.618191678966000,-0.438806325906792
box turtle and carpet snake,HA6 2PA,51.616949535028600,-0.437361176906274
tree snake and cobra,HA6 2QT,51.609166441029500,-0.430248606439616
water snake and mud turtle,HA6 2RP,51.614868000000000,-0.437649000000000
goanna and Solitaire,HA6 2RT,51.613702624326000,-0.437978196464576
elapid and boa constrictor,HA6 2RW,51.615451663442000,-0.438322583708237
cobra and cycling lizard,HA6 2TH,51.608827352130800,-0.438535453612601
slowworm and Mink,HA6 2WA,51.613921707510500,-0.436872976580956
crocodile and Chipmunk,HA6 2YG,51.610406196750200,-0.426133112458294
Moluccan boobook and rock python,HA6 3AL,51.615154959081000,-0.422184580269368
green turtle and Prion,HA6 3AT,51.619988946945400,-0.423244789859534
amphisbaena and Zebra,HA6 3BB,51.616538694435400,-0.424115460672738
skink and anaconda,HA6 3ED,51.623099009203500,-0.422486903902442
saltwater crocodile and puff adder,HA6 3EJ,51.621031780847700,-0.420550637478947
indigo snake and habu,HA6 3FD,51.616059520073800,-0.413241188800020
bull snake and giant tortoise,HA6 3JL,51.622159133881200,-0.412797297913648
soft-shelled turtle and Duck,HA6 3LJ,51.617563529378100,-0.416077657338783
frill-necked lizard and New World blackbird,HA6 3NS,51.611906733303100,-0.414021478143733
Bunting and chuckwalla,HA6 3PW,51.615272312090500,-0.409556562989055
Dolphin and Wader,HA6 3SL,51.616953608253500,-0.413527784934021
frilled lizard and Meadowlark,HA6 9AX,51.603691400302300,-0.415607343471416
Coati and massasauga,HA7 3GD,51.626998906514600,-0.338327000000000
Pratincole and indigo snake,HP1 1AE,51.757417809446500,-0.476218000000000
iguana and Stilt,HP1 1AS,51.746016000000000,-0.474587000000000
bearded dragon and Marsh harrier,HP1 1AT,51.745981000000000,-0.474689000000000
cayman and Mamo,HP1 1EU,51.753404234028000,-0.473772683909820
elapid and Partridge,HP1 1GY,51.764175000000000,-0.439340000000000
Tit-tyrant and Diving bird,HP1 1JF,51.750985876954800,-0.477273142516165
dugite and tree snake,HP1 1RG,51.750873291623300,-0.484563894089001
gaboon viper and bicycle lizard,HP1 1RL,51.751832479760400,-0.486429629335417
Jerboa and Marmoset,HP1 1RT,51.751764048041500,-0.492299265596050
bicycle lizard and harlequin snake,HP1 1SF,51.752464621130500,-0.491537075354248
rock python and Darwin's finches,HP1 1XD,51.752624043772000,-0.485055825773277
horned toad and Eagle,HP1 1XG,51.747323554139400,-0.486116782275675
tuatara and Jerboa,HP1 2BP,51.747556669225400,-0.498682776447150
Philippine hawk-owl and Pratincole,HP1 2DD,51.747909094588900,-0.503755689112274
Dorcopsis and pit viper,HP1 2HW,51.760945841288000,-0.505063621382848
Kākāriki and boa constrictor,HP1 2JQ,51.752821787863000,-0.505418789873256
giant tortoise and viper,HP1 2QL,51.759912017197500,-0.495215670164474
Eagle and Egret,HP1 2QS,51.761572264968700,-0.498478780394640
rat snake and Guillemot,HP1 2TJ,51.758451997492600,-0.506232682262186
python and carpet snake,HP1 2WU,51.764175000000000,-0.439340000000000
Hawaiian honeycreeper and Tit-tyrant,HP1 3AA,51.758536363412100,-0.471791000000000
python and dukite,HP1 3AD,51.764364528226200,-0.490271099813152
Maya and mud turtle,HP1 3DL,51.770782685533100,-0.481897110325516
Maya and Wader,HP1 3DY,51.760417553110100,-0.487664039379574
Old World vulture and flying dragon,HP1 3EP,51.763613111924400,-0.487934033358089
puff adder and Greenbul,HP1 3HF,51.762324999044800,-0.484963006311442
Dolphin and Fulmarine petrel,HP1 3JW,51.761604556308900,-0.489768964112362
Nukupuʻu and anole,HP1 3NF,51.765166011434700,-0.491925300227971
green turtle and Triller,HP1 3NR,51.766736266651500,-0.493771435544797
amethystine python and hognose snake,HP1 3NS,51.767086642309000,-0.491643915286405
boomslang and Black jay,HP1 3NY,51.766444634399600,-0.488564029174814
Chicken and bearded lizard,HP1 3PW,51.762146479724200,-0.501198453314171
Hawaiian honeycreeper and Skunk,HP1 3QN,51.757328776778900,-0.491505404648744
