name,postcode,lat,lon
Jackal and Maya,TR1 1AR,50.268302729476000,-5.032832875169380
Herring gull and Chipmunk,TR1 1AT,50.267698389870300,-5.031517300953460
loggerhead and Grackle,TR1 1DR,50.266925943339300,-5.051733958037690
amphisbaena and milk snake,TR1 1DW,50.266235000000000,-5.053781000000000
tortoise and Cloud rat,TR1 1EP,50.265025368125800,-5.051486080070670
goanna and Meadowlark,TR1 1GR,50.265419550140100,-5.042760000000000
water snake and Fox,TR1 1GU,50.268227000000000,-5.039177000000000
flying dragon and frilled lizard,TR1 1HA,50.265669000000000,-5.050685000000000
chameleon and king cobra,TR1 1HJ,50.266177686080500,-5.049398510688040
Stint and Crow,TR1 1PN,50.265274488766000,-5.039587172814230
taipan and Parakeet,TR1 1QE,50.261838684843400,-5.045402464974990
Crow and Parrotlet,TR1 1RB,50.274322420003400,-5.041370922233450
rock snake and smooth snake,TR1 1RX,50.268759683048900,-5.041844312631210
Logrunners and ringhals,TR1 1UP,50.262488877951600,-5.043591588929390
Stint and Parrotbill,TR1 1UR,50.258990546788900,-5.044926022107490
Minke whale and amphisbaena,TR1 2BL,50.258357265363000,-5.054651846858150
Cuscus and cerastes,TR1 2BX,50.256814795466400,-5.051732784344880
cobra and worm lizard,TR1 2DS,50.258826678146700,-5.049798728457250
jew lizard and Pheasant,TR1 2EB,50.260016231775700,-5.052456724331880
Wader and Mouse,TR1 2EF,50.260028686298200,-5.050956049894110
wall lizard and Piping shrike,TR1 2GB,50.259043879254600,-5.055565792725750
mamba and mud turtle,TR1 2GH,50.259968802835700,-5.058245000000000
caiman and River dolphin,TR1 2GN,50.261381195243900,-5.055996995408170
White ibis and lizard,TR1 2LF,50.260904829944800,-5.062097910922570
Thrasher and Meadowlark,TR1 2SF,50.262591643462200,-5.054066902816310
Piping shrike and Ground sloth,TR1 2XP,50.254203395140100,-5.046009641721530
Ground sloth and Gull,TR1 3ET,50.262613484013200,-5.064845813986110
bandy-bandy and adder,TR1 3JG,50.263556466008100,-5.057398464657520
Ibex and fer-de-lance,TR1 3JL,50.263129214845900,-5.057567553449560
Recurvebill and Pitohui,TR1 3LS,50.262539982723500,-5.077148232105890
Thicketbird and American sparrow,TR1 3NH,50.265699000000000,-5.068009269727370
diamondback turtle and Quetzal,TR1 3NY,50.264184138146300,-5.077226206715000
mountain devil and cobra,TR1 3PP,50.260971753653100,-5.076920801207610
Grosbeak and Partridge,TR1 3PR,50.259914570737300,-5.078115553005520
water snake and grass snake,TR1 3PU,50.261378070047500,-5.078560786364220
whip snake and cobra de capello,TR1 3SH,50.267202447132600,-5.057295297289450
copperhead and wall lizard,TR1 3SL,50.266393090022000,-5.057285532064730
saltwater crocodile and rock python,TR1 3TN,50.266655348843500,-5.061330214862010
hawksbill and Jay,TR1 3TT,50.266173921913800,-5.062871160634060
Chicken and Viscacha,TR1 3TU,50.266833934211900,-5.062745121813280
goanna and rock snake,TR1 3TX,50.267646261327400,-5.065028794454590
Dolphin and Parakeet,TR1 3UY,50.271559639590800,-5.063315237732230
Fox and Gila monster,TR1 3YA,50.261190943879700,-5.099120903386640
Grackle and Stint,TR1 9JH,50.255270000000000,-5.046154000000000
Partridge and Zebra,TR10 8AH,50.169700142177600,-5.102806000000000
ringhals and bull snake,TR10 8DA,50.170375000000000,-5.103980000000000
Old World warbler and gavial,TR10 8DL,50.172253508178600,-5.109588000000000
slowworm and Parakeet,TR10 8GJ,50.168973879771700,-5.104197438870030
Hawk and Recurvebill,TR10 8GL,50.173787549041400,-5.111219091959010
Masked owl and wall lizard,TR10 8GZ,50.166776867470500,-5.098550950189780
Siskin and snake,TR10 8HL,50.172328479791800,-5.113631473527610
Cloud rat and water snake,TR10 8HP,50.172612070126000,-5.114468000000000
deaf adder and asp,TR10 8JU,50.165575487006600,-5.100755982387640
Egret and Ibex,TR10 8LD,50.165823587505700,-5.101234212169150
sand viper and black snake,TR10 8LE,50.164998902731300,-5.101654000000000
horned viper and alligator,TR10 8LF,50.165217000000000,-5.101791146713100
monitor and American sparrow,TR10 8NX,50.168286313247600,-5.113148000000000
Eagle and Nukupuʻu,TR10 8PB,50.166458052200100,-5.112815506421860
Cloud rat and Siskin,TR10 8PX,50.167972579696900,-5.106317374327160
wall lizard and bushmaster,TR10 8QD,50.165600309959800,-5.114608378865250
fer-de-lance and Thrasher,TR10 8QL,50.169977077544300,-5.118450705767160
B and harlequin snake,TR10 8QU,50.170451422763200,-5.115862432204990
Parrotlet and mamba,TR10 8QZ,50.170592446911400,-5.116305807918820
Parakeet and Pratincole,TR10 8RB,50.168693999230100,-5.118661243192350
slowworm and horned toad,TR10 8RJ,50.170349077010200,-5.113642782764180
death adder and Mamo,TR10 8SE,50.165201876846000,-5.113700160417850
Masked owl and Capuchin,TR10 8SH,50.165911481016000,-5.100301576119690
Civet and turtle,TR10 9AP,50.180441000000000,-5.133786000000000
worm lizard and soft-shelled turtle,TR10 9AS,50.188528000000000,-5.128809000000000
sand viper and Goose,TR10 9BT,50.140231207664700,-5.163504107907210
Capuchin and milk snake,TR10 9EJ,50.151549654992100,-5.198380000000000
Solitaire and rock python,TR10 9EL,50.160868041293700,-5.177988700329370
python and Jackal,TR10 9EP,50.166459000000000,-5.122535000000000
iguana and bearded lizard,TR10 9FG,50.164677000000000,-5.136514000000000
constrictor and harlequin snake,TR10 9JJ,50.158326838401600,-5.143038000000000
Pheasant and Viscacha,TR11 2DT,50.156036678534500,-5.079933481767330
gaboon viper and tuatara,TR11 2EE,50.151288990184700,-5.078158149423840
fer-de-lance and hoop snake,TR11 2HD,50.160865851927800,-5.090144481559240
viper and Triller,TR11 2JH,50.154349430427100,-5.085201555594270
goanna and Perching duck,TR11 2JX,50.157950629725800,-5.087799977543450
water snake and leguaan,TR11 2LG,50.155412595534500,-5.083785848981400
ringhals and Ibex,TR11 2NY,50.158463049883000,-5.079011319600990
Stilt and Jay,TR11 2PH,50.161390686046000,-5.082588421992910
leguaan and Moluccan boobook,TR11 2PX,50.159984221980700,-5.083044006416940
Shearwater and Old World warbler,TR11 2QT,50.152571166805900,-5.084414969871070
Viscacha and Bronzewing pigeon,TR11 2RZ,50.162285000000000,-5.089256000000000
horned toad and Jerboa,TR11 2SG,50.163273913494700,-5.088899477869770
rat snake and Cuscus,TR11 2SZ,50.163123716713800,-5.078302719450460
elapid and adder,TR11 2WQ,50.162072420416100,-5.086078114817900
Peafowl and Minke whale,TR11 3AF,50.155522075685500,-5.069819083917410
thorn lizard and Diving bird,TR11 3BS,50.151925658208100,-5.074502860434610
box turtle and Coati,TR11 3BW,50.152570687416900,-5.074264243113660
Pratincole and Towhee,TR11 3BY,50.151265721557100,-5.074964523921300
Dorcopsis and iguana,TR11 3EJ,50.152349042116200,-5.067683607277360
black snake and black snake,TR11 3HB,50.156630803451900,-5.071094332752000
Hawk and Diving bird,TR11 3JN,50.151204234019900,-5.066070234502590
cobra and Pitohui,TR11 3JP,50.150267924140300,-5.064736283128830
slowworm and Tree warbler,TR11 3NW,50.151962417540600,-5.069716958250400
Jay and snake,TR11 3RW,50.150586000000000,-5.074529000000000
diamond python and chuckwalla,TR11 3XE,50.154190064231400,-5.073920135603540
Mockingbird and garter snake,TR11 3XT,50.150713704558900,-5.060116677887540
flying dragon and Gila monster,TR11 4AL,50.150943938309900,-5.064345519040740
Dorcopsis and Gila monster,TR11 4AT,50.151657463912600,-5.065390000000000
Civet and Solitaire,TR11 4AX,50.148756276419000,-5.060148000000000
python and hoop snake,TR11 4DD,50.148137035348700,-5.069457837377040
Scimitar babbler and Goose,TR11 4DH,50.146899907710200,-5.065892757985390
Viscacha and Dolphin,TR11 4ED,50.144226000000000,-5.074543621982470
diamondback terrapin and Old World quail,TR11 4EH,50.145911701587000,-5.072983004300690
Egret and cycling lizard,TR11 4EL,50.144529768479400,-5.071494512940910
frill-necked lizard and Parrotbill,TR11 4EN,50.142722372865700,-5.072484503067300
king snake and Quetzal,TR11 4FT,50.150719000000000,-5.096818000000000
Coati and sand lizard,TR11 4HE,50.147273950299600,-5.087069792450630
Civet and gaboon viper,TR11 4JL,50.158124836700700,-5.101505774095640
massasauga and garter snake,TR11 4JY,50.154090512626000,-5.087495112324920
Black jay and mud turtle,TR11 4NF,50.149043811307500,-5.054186060443880
Jay and taipan,TR11 4NP,50.146219974048600,-5.063707390542490
Jay and Fish eagle,TR11 4QJ,50.148925581668900,-5.075010312392410
Goose and crocodile,TR11 4RB,50.148754000000000,-5.072731000000000
sand lizard and Kākāriki,TR11 4SZ,50.148429515289100,-5.092996160863810
iguana and galliwasp,TR11 4WJ,50.152109082988200,-5.100402193901980
coral snake and loggerhead,TR11 5AA,50.118208748514400,-5.173062131895420
Ibex and diamond python,TR11 5AE,50.119211989631700,-5.175521049538340
Towhee and Night heron,TR11 5AY,50.141156527391900,-5.090119093906090
hoop snake and habu,TR11 5BG,50.140022859125800,-5.078960127888810
black snake and swift,TR11 5BX,50.140502525923700,-5.083932041293760
adder and king cobra,TR11 5DP,50.147671818086900,-5.105196868683750
Zebra and Elephant,TR11 5EP,50.117055188096900,-5.109356005991120
ringhals and Capuchin,TR11 5ET,50.115923284480100,-5.109632381542330
anole and Guillemot,TR11 5FR,50.139158000000000,-5.087520771083070
Hawaiian honeycreeper and Buzzard,TR11 5GT,50.144722903938100,-5.085268459568180
tuatara and Mink,TR11 5HE,50.121710000000000,-5.105908000000000
constrictor and Badger,TR11 5HP,50.121466000000000,-5.092474000000000
Old World quail and loggerhead,TR11 5HR,50.120947796100400,-5.094315403265140
sidewinder and blue racer,TR11 5NF,50.185137656632600,-5.075207488374270
Fulmarine petrel and Fox,TR11 5PP,50.137658344479900,-5.120322265031240
crocodile and Towhee,TR11 5PZ,50.120646022334900,-5.185886044817910
Parrotbill and crocodile,TR11 5QD,50.129967946275400,-5.178488000000000
Diving bird and chuckwalla,TR11 5QT,50.145950659665500,-5.203247712133210
flying lizard and Marsh harrier,TR11 5RS,50.113647000000000,-5.184302000000000
anaconda and Komodo dragon,TR11 5RY,50.107016836747900,-5.143060195083510
soft-shelled turtle and Black cockatoo,TR11 9YD,50.152118913384000,-5.100403716110700
Tattler and tiger snake,TR12 6DU,50.058311000000000,-5.130540904038520
sand viper and gopher snake,TR12 6DX,50.052274268200900,-5.131779974369090
Moluccan boobook and Minke whale,TR12 6ES,50.080760000000000,-5.086474256630920
thorn lizard and puff adder,TR12 6JL,50.091699489073800,-5.121934269443020
Elephant and goanna,TR12 6LB,50.093819206073300,-5.129735315915820
Rat and Grackle,TR12 6NB,50.050212388295500,-5.087437000000000
boomslang and cerastes,TR12 7QH,50.059534945857800,-5.267689948458530
Capuchin and kabaragoya,TR13 0BT,50.111958561639400,-5.274617621465600
diamondback terrapin and Grackle,TR13 0DJ,50.110056914584200,-5.274739598358540
Tattler and lizard,TR13 0HU,50.173478938548700,-5.246929994982970
Triller and sidewinder,TR13 0NA,50.131471463673200,-5.246448631161290
Elephant and Nukupuʻu,TR13 0NG,50.106520168098700,-5.236968568096490
boomslang and Recurvebill,TR13 0NH,50.119932166383700,-5.233466456202160
amethystine python and Argus,TR13 8BY,50.095709055588500,-5.264488524267600
Schneider python and Old World vulture,TR13 8DF,50.097249674799800,-5.267921813200650
Bunting and Pratincole,TR13 8ED,50.103933000000000,-5.260334000000000
Skunk and tokay,TR13 8FR,50.101247545130000,-5.262683446469290
Ibex and Coati,TR13 8GZ,50.110794000000000,-5.268085000000000
milk snake and Scimitar babbler,TR13 8HQ,50.103308187058800,-5.281160563937820
Zebra and bull snake,TR13 8JF,50.094881870263500,-5.274682940024670
Minke whale and copperhead,TR13 8JH,50.096347802151000,-5.274699059678170
grass snake and Francolin,TR13 8NP,50.105990280219200,-5.272839409093290
Scimitar babbler and Logrunners,TR13 8NS,50.106346368237600,-5.272653883620920
Magpie and Tattler,TR13 8PG,50.101245000000000,-5.275900000000000
tokay and Pitohui,TR13 8PZ,50.103933226634900,-5.269859678529570
Puffleg and Puffleg,TR13 8RB,50.099366000000000,-5.272451832892070
Diving bird and Stilt,TR13 8RF,50.098411496160500,-5.271385446097160
Bunting and giant tortoise,TR13 8RG,50.098333668526100,-5.270317237070930
puff adder and constrictor,TR13 8TB,50.102260843122000,-5.274291386868770
boa constrictor and Grackle,TR13 8UQ,50.103749000000000,-5.268770000000000
indigo snake and caiman,TR13 8UY,50.112958263794900,-5.266921515364810
saltwater crocodile and Skunk,TR14 0EP,50.233082026804400,-5.280699553140280
water snake and caiman,TR14 7SH,50.204671611241600,-5.282632068030060
Tree warbler and Herring gull,TR14 7UR,50.212992370617200,-5.286470035091290
rock snake and soft-shelled turtle,TR14 8NN,50.222837171915700,-5.282547990839140
White ibis and Kākāriki,TR14 8NP,50.221676706471200,-5.284136843832730
thorny devil and snapping turtle,TR14 8QT,50.223197637466500,-5.279025149575400
Armadillo and Peafowl,TR14 8RA,50.217805880439300,-5.280407705531200
bearded lizard and lizard,TR14 8RU,50.218117280878800,-5.281803110617840
mud turtle and rattlesnake,TR14 9AA,50.204641951904100,-5.286540698534300
rat snake and Grouse,TR14 9AY,50.212014194192500,-5.268865156165730
agamid and boa constrictor,TR14 9BP,50.216128000000000,-5.276170000000000
Songlark and blindworm,TR14 9DP,50.201337000000000,-5.279712000000000
Zebra and mountain devil,TR14 9DT,50.199442689028100,-5.277297673445990
bushmaster and coral snake,TR14 9EU,50.195611000000000,-5.275150200896460
Moluccan boobook and sand lizard,TR14 9HB,50.196436990048700,-5.276376943210340
Pratincole and lizard,TR14 9JF,50.185415000000000,-5.256343000000000
viper and Parakeet,TR14 9JS,50.189574399248000,-5.284916742750390
diamondback terrapin and wall lizard,TR15 1AG,50.233590568752100,-5.232431821555720
Fox and sidewinder,TR15 1AP,50.232824977969300,-5.231819008874290
Towhee and lizard,TR15 1BG,50.237999770903000,-5.236264948091010
Mole and Philippine hawk-owl,TR15 1BQ,50.237932582977000,-5.233632000000000
amphisbaena and Puffleg,TR15 1DA,50.240379944541800,-5.233171988060120
indigo snake and tortoise,TR15 1DN,50.237368477061300,-5.234384727414210
Vole and Wader,TR15 1EB,50.242987920332700,-5.230333534780940
Hawk and Dolphin,TR15 1EH,50.244128634875400,-5.212566876380680
Petrel and copperhead,TR15 1HG,50.239746322103800,-5.226522408597090
boa and Dorcopsis,TR15 1LG,50.235416815870100,-5.226285978749840
Pratincole and viper,TR15 1NJ,50.235442591626700,-5.222767287440380
diamondback and saltwater crocodile,TR15 1NQ,50.234738904322800,-5.224458951118810
diamond python and alligator,TR15 1NU,50.246856280260500,-5.213436944116780
Chipmunk and Maya,TR15 1QT,50.246928733595200,-5.210818402872950
bicycle lizard and puff adder,TR15 1SR,50.238303000000000,-5.222834000000000
moloch and water snake,TR15 1SS,50.243987000000000,-5.220931000000000
green turtle and cobra de capello,TR15 2AS,50.233180343412300,-5.227453239207100
Goose and agama,TR15 2DL,50.239778861031200,-5.215948328069700
gaboon viper and Recurvebill,TR15 2DW,50.237807035317600,-5.216334499148410
Viscacha and milk snake,TR15 2EQ,50.232135144006700,-5.226218560719800
Jay and blue tongue,TR15 2HD,50.232576327729900,-5.223078000000000
Masked owl and saltwater crocodile,TR15 2HZ,50.229042673819000,-5.221606224619930
Pratincole and kabaragoya,TR15 2PB,50.226902908694100,-5.218965800693030
diamondback terrapin and Fish eagle,TR15 2RB,50.228036046420700,-5.223193099527910
water snake and Herring gull,TR15 2TN,50.228939453543000,-5.233729783890010
milk snake and Treepie,TR15 3BS,50.231454686442900,-5.235191254600820
tokay and python,TR15 3BT,50.226391016878200,-5.238016577999510
Chicken and Marsh harrier,TR15 3DF,50.227406013493300,-5.234845999743730
Marsh harrier and gopher snake,TR15 3DX,50.226818214371700,-5.268672127854720
Rabbit and Wallaby,TR15 3FD,50.225857091403000,-5.271215559393990
Prion and Cloud rat,TR15 3JT,50.229732090981900,-5.256030000000000
rock python and gaboon viper,TR15 3JW,50.231566821708800,-5.256557304709630
Buzzard and agamid,TR15 3JX,50.230475035240300,-5.255711528980810
Prion and sea snake,TR15 3ND,50.229499942306200,-5.257440130181710
rock python and Piping shrike,TR15 3PE,50.227856858315700,-5.268037000000000
Jackal and diamond python,TR15 3PL,50.226203167519000,-5.275809834184710
coral snake and gecko,TR15 3XB,50.239989023141700,-5.273122575094190
gaboon viper and rat snake,TR15 3XX,50.228007780134400,-5.252906937876110
hawksbill and Night heron,TR15 3YL,50.220197939356700,-5.267363900523580
Pitohui and Kite,TR16 4BL,50.260046060098300,-5.214676004416240
Tattler and American sparrow,TR16 4BU,50.256168180677300,-5.231224764043750
puff adder and soft-shelled turtle,TR16 4DL,50.243493527382800,-5.263038159625140
Cuscus and pit viper,TR16 4GA,50.240210963620800,-5.262042322283500
B and slowworm,TR16 4HJ,50.249312000000000,-5.242605783743780
saltwater crocodile and tiger snake,TR16 4HN,50.253093000000000,-5.241217000000000
king snake and Chickadee,TR16 4HW,50.257099735862400,-5.238472243354080
water snake and Perching duck,TR16 4SH,50.250152576430800,-5.265421000000000
Solitaire and Stilt,TR16 5AE,50.248444390271300,-5.209685766135270
Solitaire and sea snake,TR16 5AG,50.246544990026500,-5.203217011853290
puff adder and mountain devil,TR16 5AY,50.248241644615200,-5.188642166228790
Wallaby and massasauga,TR16 5BY,50.228650270390700,-5.178444165465930
cycling lizard and slowworm,TR16 5DH,50.266495453710000,-5.207545891790940
king snake and Vulture,TR16 5EP,50.234844682808800,-5.214286000000000
Kestrel and Viscacha,TR16 5ES,50.247573000000000,-5.207403000000000
copperhead and New World blackbird,TR16 5NB,50.238164000000000,-5.186081867180030
hognose snake and box turtle,TR16 5NH,50.238253936421000,-5.190359651454870
soft-shelled turtle and Buzzard,TR16 5NN,50.239174066110900,-5.192230566597260
rock snake and Solitaire,TR16 5QN,50.229862985339600,-5.181426897634770
Civet and Gila monster,TR16 5QX,50.231047053254600,-5.175966198319290
loggerhead and python,TR16 5RG,50.231646919807900,-5.180998771917820
Bronzewing pigeon and hognose snake,TR16 5RS,50.231254491479200,-5.184156150439480
Darwin's finches and crocodile,TR16 5SS,50.230461799759600,-5.216821539255640
bandy-bandy and milk snake,TR16 5SY,50.222199090437700,-5.215031268832110
Night heron and Dolphin,TR16 5TD,50.217306226233600,-5.205238387146680
Marsh harrier and Stilt,TR16 6AL,50.212318846742200,-5.195159000000000
Parrotlet and perentie,TR16 6AP,50.214239696046700,-5.200308199118070
krait and bushmaster,TR16 6DY,50.216004522743600,-5.203510754375680
skink and Diving bird,TR16 6GZ,50.212151000000000,-5.190958000000000
agama and mountain devil,TR16 6HE,50.215079723176800,-5.201163568638120
B and snapping turtle,TR16 6HQ,50.215886190056700,-5.199647370781740
Thrasher and deaf adder,TR16 6LU,50.198101001410000,-5.242112793616550
goanna and alligator,TR16 6PG,50.171442942926400,-5.217198000000000
boa constrictor and alligator,TR16 6PN,50.171917000000000,-5.231710000000000
Cloud rat and Coati,TR16 6QT,50.205059754639000,-5.233880312123550
Marsh harrier and diamondback turtle,TR16 6QW,50.204273958540600,-5.236252010798200
milk snake and horned viper,TR16 6RE,50.208526497455100,-5.224386543060870
iguana and puff adder,TR16 6TE,50.208217026894000,-5.219655747311940
swift and Prion,TR2 4HP,50.251525252328500,-4.970568671235480
bearded lizard and tree snake,TR2 4TF,50.273995113217200,-5.013235808137760
mud turtle and tortoise,TR2 5DA,50.156598007005800,-5.023359195224430
hognose snake and rock snake,TR2 5DY,50.179472000000000,-4.980396000000000
Quetzal and rock snake,TR2 5EB,50.178187184906000,-4.981311179017540
Pitohui and chuckwalla,TR2 5EU,50.164536572559900,-4.985320629407830
frilled lizard and goanna,TR2 5HG,50.179080145321100,-4.975259104969870
Nukupuʻu and flying dragon,TR2 5HZ,50.180021698942600,-5.011992681945530
Lemming and glass snake,TR2 5LZ,50.225981617366700,-4.974280612752430
Fox and king cobra,TR2 5RP,50.270389615079900,-4.910385000000000
Darwin's finches and Vole,TR2 5RX,50.267394543993900,-4.915152605495040
milk snake and Linsang,TR2 5SU,50.240895732734900,-4.897825016201690
glass snake and bandy-bandy,TR2 5TL,50.262502533271300,-4.922249046877480
anaconda and Mamo,TR2 5TP,50.267681070141500,-4.905514470549110
box turtle and Hawk,TR2 5TQ,50.248727943485200,-4.906577367473880
Crow and ringhals,TR3 6AT,50.227448000000000,-5.042733000000000
rock snake and Coati,TR3 6AU,50.225919000000000,-5.056055000000000
blind snake and White ibis,TR3 6BE,50.256383411791200,-5.121090722928970
Bunting and Quetzal,TR3 6BT,50.260368868346900,-5.117967000000000
New World blackbird and Songlark,TR3 6EZ,50.232918421474000,-5.068255231755160
Pheasant and hawksbill,TR3 6FR,50.230631000000000,-5.071123000000000
Masked owl and American sparrow,TR3 6FY,50.262968000000000,-5.114117000000000
Solitaire and Skunk,TR3 6GB,50.223105000000000,-5.088980000000000
Condor and water snake,TR3 6HP,50.221524071220400,-5.092200788441960
Dorcopsis and Thicketbird,TR3 6HQ,50.222477314810000,-5.087481152329260
puff adder and glass snake,TR3 6JF,50.223282606142100,-5.085275693855630
Siskin and B,TR3 6JU,50.223488373801000,-5.087686704657380
adder and American sparrow,TR3 6LY,50.224275064092700,-5.086181102590490
copperhead and Thicketbird,TR3 6NW,50.210617617803900,-5.067244096079620
diamondback and Civet,TR3 6PX,50.211244483355200,-5.090750721403570
Moluccan boobook and sea snake,TR3 6QW,50.217329342284200,-5.054930752548170
Perching duck and mud turtle,TR3 6RH,50.206447134613000,-5.052777598037720
agama and Parrotlet,TR3 6RS,50.208887780506000,-5.064960400817720
sand viper and River dolphin,TR3 6SE,50.208177634484800,-5.046145834313000
elapid and flying dragon,TR3 7AE,50.184192332886500,-5.178402912781400
Dolphin and Capuchin,TR3 7BX,50.179315000000000,-5.178835000000000
Crow and soft-shelled turtle,TR3 7DH,50.189867000000000,-5.178850000000000
snake and Boto,TR3 7DL,50.193073858462700,-5.173710172268080
tree snake and snapping turtle,TR3 7GD,50.189287241159000,-5.178615329341600
anole and thorny devil,TR3 7HA,50.198069702945300,-5.142784000000000
milk snake and monitor,TR3 7JB,50.200709308281700,-5.144042088754770
iguana and mud turtle,TR3 7JR,50.204389969004600,-5.117345743393580
White ibis and frilled lizard,TR3 7LA,50.209116455396300,-5.122531208740100
alligator and diamondback terrapin,TR3 7LL,50.220292626874400,-5.109338727239410
black snake and jew lizard,TR3 7LY,50.217321748958100,-5.126502232428980
Philippine hawk-owl and Chipmunk,TR3 7ND,50.218840012709100,-5.120895224882570
crocodile and Tattler,TR3 7PF,50.206108094277900,-5.126679909567790
elapid and anaconda,TR3 7QL,50.204444142184800,-5.119983442147140
tuatara and moloch,TR3 7QX,50.211429531631000,-5.117803940034390
Parrotbill and skink,TR4 8GD,50.233916923726600,-5.148219193419420
Moluccan boobook and Ibex,TR4 8LF,50.245961425513700,-5.143275752037610
Chicken and Hawaiian honeycreeper,TR4 8NR,50.259966606065500,-5.161879423887660
elapid and habu,TR4 8QU,50.251403928607700,-5.153890188256260
Kangaroo and Magpie,TR4 8RR,50.255931303100500,-5.159066000000000
Puffleg and Polecat,TR4 8SB,50.216445364348000,-5.150264589965540
lizard and viper,TR4 8SG,50.219239765322800,-5.140760529882410
Grouse and Zebra,TR4 9EA,50.267297745227500,-5.071069358402350
