name,postcode,lat,lon
taipan and caiman,PH1 0AL,56.422813000000000,-3.486139000000000
rock snake and adder,PH1 1BE,56.390477000000000,-3.452612000000000
Chickadee and garter snake,PH1 1BZ,56.389088884597400,-3.454551958790660
horned toad and constrictor,PH1 1EF,56.394672484871400,-3.476279770893960
diamond snake and rock python,PH1 1HA,56.391938000000000,-3.473485000000000
Boto and Civet,PH1 1HW,56.388718071429500,-3.465764000000000
Duck and harlequin snake,PH1 1LL,56.397342881553800,-3.464004740903860
mamba and Black jay,PH1 1LY,56.397825383350300,-3.463472386855740
chameleon and Eagle,PH1 1QY,56.398304252871600,-3.479903912441020
coral snake and mamba,PH1 1SS,56.400987338674500,-3.484707117896940
thorny devil and carpet snake,PH1 1ST,56.394453551311800,-3.486332058997520
gaboon viper and Tahr,PH1 1TA,56.396384871118000,-3.486374927364970
constrictor and Dorcopsis,PH1 2DH,56.401126589550900,-3.466207886447690
rattlesnake and Bunting,PH1 2EA,56.399322685568200,-3.473608079937850
bushmaster and Linsang,PH1 2ED,56.399793477682600,-3.471795318113860
brown snake and constrictor,PH1 2HH,56.402181905666500,-3.468144354328430
monitor and death adder,PH1 2JH,56.405255511684800,-3.476803000000000
amethystine python and Vole,PH1 2JL,56.404746367340300,-3.475405831923300
fer-de-lance and Polecat,PH1 2LA,56.406182015064600,-3.473306013912660
crocodile and coral snake,PH1 2NT,56.404786434029500,-3.457581601882050
Viscacha and asp,PH1 2PZ,56.410851480847200,-3.465204296861490
wall lizard and carpet snake,PH1 2QP,56.412935500491900,-3.464490188424910
fer-de-lance and diamondback terrapin,PH1 2QZ,56.412417008005400,-3.467306752269460
swift and flying lizard,PH1 2SZ,56.405146823505300,-3.457498148458370
sea snake and Stint,PH1 2UG,56.411927410666200,-3.471469644706890
Night heron and diamondback terrapin,PH1 3AQ,56.417341996532500,-3.464173218757380
mamba and goanna,PH1 3DB,56.417430642349700,-3.450511083719480
Polecat and Perching duck,PH1 3DX,56.418811060425000,-3.459982332672270
cerastes and Tahr,PH1 3EN,56.445919379046200,-3.478948090325680
bull snake and cayman,PH1 3ER,56.457334260452500,-3.472283000000000
worm lizard and boa,PH1 3FE,56.453152958187200,-3.462987124709600
gaboon viper and diamond python,PH1 3HF,56.448296503714600,-3.468689676130200
Grosbeak and slowworm,PH1 3HZ,56.449126000000000,-3.516242000000000
terrapin and Magpie,PH1 3JL,56.411575000000000,-3.488928000000000
Francolin and diamondback turtle,PH1 3LT,56.426614685849800,-3.519464727823100
elapid and Vole,PH1 3LY,56.429498102247100,-3.522466191206020
agamid and K훮k훮riki,PH1 3NA,56.414879404709000,-3.506985416366050
python and mud turtle,PH1 3NN,56.418522245814600,-3.518461135349950
Towhee and Armadillo,PH1 3RN,56.417980000000000,-3.458038000000000
puff adder and Gull,PH1 3RP,56.419017592191900,-3.585158998070910
snake and Snipe,PH1 3SJ,56.442272000000000,-3.741353000000000
Pheasant and blue racer,PH1 3SP,56.415332361989500,-3.511850077137690
Duck and Chickadee,PH1 3TW,56.417022000000000,-3.476027000000000
gaboon viper and Magpie,PH1 3UA,56.419485506402600,-3.511690632495380
Tit-tyrant and Kangaroo,PH1 3UH,56.416461709239300,-3.585474149719280
snapping turtle and Gull,PH1 3UZ,56.448048631882000,-3.463813010456630
sand viper and Piping shrike,PH1 3YX,56.451391509958400,-3.463779338807290
gopher snake and loggerhead,PH1 4AA,56.502716074951100,-3.518283554377700
alligator and chuckwalla,PH1 4AG,56.502383366196100,-3.515362038889620
Fulmarine petrel and diamondback,PH1 4AJ,56.504861000000000,-3.520811853310100
Petrel and Stilt,PH1 4AR,56.520641752091600,-3.535076587328140
Masked owl and K훮k훮riki,PH1 4DZ,56.497822056773500,-3.489854092866600
glass snake and Elephant,PH1 4EN,56.528527418032900,-3.466932467423480
Parrotlet and mud turtle,PH1 4HF,56.530217000000000,-3.467697000000000
diamondback turtle and hognose snake,PH1 4JE,56.542859476386400,-3.483507064453200
Polecat and Tit-tyrant,PH1 4LU,56.480989938922500,-3.448340191611020
Gull and Fox,PH1 4QF,56.486365564703300,-3.434188923133220
Songlark and Kangaroo,PH1 4QR,56.531743126276300,-3.418262415121020
Argus and Quetzal,PH1 4QY,56.484747000000000,-3.445868000000000
Stint and White ibis,PH1 5DP,56.408428571004600,-3.436522439103760
agama and Grackle,PH1 5EB,56.406475574796100,-3.442218143574920
Tree warbler and dukite,PH1 5HG,56.400909248301700,-3.433306300803110
box turtle and Piping shrike,PH1 5JR,56.397209611001800,-3.427658588429060
kabaragoya and snake,PH1 5LR,56.398422904230200,-3.430214000000000
box turtle and Greenbul,PH1 5QS,56.396801312083900,-3.438109645656600
sand viper and gavial,PH1 5SH,56.395456000000000,-3.427791391971000
grass snake and Buzzard,PH1 5SP,56.396207992352000,-3.427248457502800
sea snake and alligator,PH1 5XF,56.408307031317100,-3.451590079897800
mamba and Tattler,PH10 6QZ,56.571757110939400,-3.393278341433050
Capuchin and alligator,PH2 0AJ,56.380333000000000,-3.437942000000000
rat snake and Fulmarine petrel,PH2 0AL,56.378882000000000,-3.436786000000000
Mink and box turtle,PH2 0BH,56.383673655189800,-3.438133081912870
Flameback and Polecat,PH2 0GZ,56.394550981782600,-3.446951452934820
Quetzal and Boto,PH2 0JN,56.392086548132700,-3.443476000000000
adder and agamid,PH2 0PA,56.396820000000000,-3.444325467273760
black snake and B,PH2 0PN,56.387641824777100,-3.499834990407280
Marsh harrier and soft-shelled turtle,PH2 1TF,56.396425035057400,-3.427126967597110
horned toad and Egret,PH2 1TZ,56.396679828065300,-3.426067190334260
carpet snake and death adder,PH2 1UR,56.396679828065300,-3.426067190334260
mamba and diamondback turtle,PH2 1ZY,56.380324000000000,-3.431788000000000
Moluccan boobook and Thrasher,PH2 6AB,56.443085839736100,-3.412913838424700
thorn lizard and Prion,PH2 6BD,56.422606731705600,-3.438110823065120
Civet and wall lizard,PH2 6BN,56.473467000000000,-3.435407000000000
Old World warbler and snapping turtle,PH2 6BW,56.480012566667100,-3.414659452528740
hognose snake and Snipe,PH2 6DH,56.474145559728200,-3.407525204399270
amphisbaena and chuckwalla,PH2 6JU,56.420758000000000,-3.406711957808740
puff adder and Peafowl,PH2 6NR,56.442021889778300,-3.365087610997420
Fulmarine petrel and amphisbaena,PH2 6NU,56.423442129303100,-3.407580722768030
Condor and Mole,PH2 6PD,56.424814000000000,-3.411766000000000
Tattler and tree snake,PH2 6QD,56.425288315265700,-3.405622211820900
Treepie and flying lizard,PH2 7AB,56.394743052772500,-3.421021103412010
Meadowlark and viper,PH2 7AE,56.394406981722000,-3.418983492193290
dukite and Masked owl,PH2 7AG,56.394567354292400,-3.417531388787030
Lemming and Viscacha,PH2 7BE,56.394322592225900,-3.414573769724330
leguaan and agamid,PH2 7JA,56.405227091799500,-3.416453038840570
Recurvebill and hognose snake,PH2 7YB,56.380323735688200,-3.431788034610240
habu and Old World vulture,PH2 8AH,56.392281933759500,-3.429547719293600
hognose snake and Tit-tyrant,PH2 8DD,56.376503000000000,-3.413217000000000
Parrotbill and Booted eagles,PH2 8EE,56.395207413434000,-3.435198000000000
Elephant and Vulture,PH2 8EH,56.395737495170500,-3.440095000000000
Argus and python,PH2 8EY,56.394097913622700,-3.438785338404910
brown snake and snapping turtle,PH2 8HB,56.392928537850300,-3.437135000000000
Ground sloth and Hawk,PH2 8HH,56.394891608057200,-3.439301310027080
Mole and Rabbit,PH2 8JT,56.393221448141300,-3.431445960678190
pit viper and copperhead,PH2 8LR,56.393114223020300,-3.430615726402310
Gila monster and Fish eagle,PH2 8LS,56.392943204571600,-3.430641712000580
Macaw and frilled lizard,PH2 8NY,56.395391000000000,-3.433494445890230
Ice seal and alligator,PH2 8PF,56.395391310747700,-3.428724601669780
Minke whale and monitor,PH2 9HP,56.352358513515800,-3.471180912283230
Chickadee and Parrotlet,PH8 0AL,56.565513151025500,-3.585928179061420
carpet snake and gopher snake,PH8 0BG,56.558631813874600,-3.576642184215430
saltwater crocodile and Mouse,PH8 0BU,56.538358000000000,-3.692355000000000
bandy-bandy and Vole,PH8 0DN,56.554855000000000,-3.566967000000000
Greenbul and Marmoset,PH8 0DP,56.556939548432000,-3.575465391858390
