name,postcode,lat,lon
coral snake and amphisbaena,ML12 6HP,55.567343548334100,-3.599755838812600
Parrotlet and horned viper,ML12 6HS,55.555652911312300,-3.643815499835250
Ibex and Ground sloth,ML12 6LL,55.598721162543500,-3.593811241622530
Chipmunk and coral snake,ML12 6QH,55.585667572709700,-3.401540382596820
perentie and Chicken,ML12 6RU,55.511232000000000,-3.729904000000000
American sparrow and racer,ML12 6SH,55.497687705843100,-3.763980713357840
Solitaire and deaf adder,ML12 6SJ,55.597751034558300,-3.594470234213990
smooth snake and bandy-bandy,ML12 6TQ,55.441036060135000,-3.656467246178860
jew lizard and sea snake,ML12 6XY,55.417032629615500,-3.763132315386630
flying dragon and mud turtle,ML12 6YA,55.415571760890600,-3.762229899235190
taipan and amethystine python,ML12 6YG,55.416357135262800,-3.754174000000000
